experiment_id	timestamp	status	decision	val_fvu	exceed_alpha_0_50	objective_score	total_cost	total_cost_ratio	selection_cost	selection_cost_ratio	deployment_accesses	deployment_ratio	k	architecture	expansion_factor	wall_time_sec	peak_memory_gb	total_tokens	checkpoint	head_commit	head_branch	workspace_dirty	description	self_review	log_path
r283_1775053368	1775053368	ok	archive	0.15459926426410675	0.170913	0.270913	429056.0	0.1	265216.0	0.06	163840.0	0.04	32	shared_adaptive_active_product_key_expert_jumprelu	1				/root/sparsify-ascend/checkpoints/research_agent/round_0283/round0283_standard_1775052577_dp2_bs1_ga8_ef1_k32_20260401_220944	97340e6fcf7b24d7a112567149875869179462d3			建议以 r282 为 reference，只改 `ARCHITECTURE=shared_adaptive_active_product_key_expert_jumprelu`，做一轮完全同成本的 matched architecture probe，直接回答在更细粒度 micro-expert scaffold 上，difficulty-aware variable-active cleanup 能否继续压低 exceed_alpha_0.50。	这轮满足单变量原则：相对 r282 只改 `ARCHITECTURE`。之所以不继续把 `NUM_EXPERTS` 从 2048 往 3072/4096 线性扩，是因为 r282 已经提供了 recent 改进，当前更高信息量的问题应是“建立在该 scaffold 上的哪种结构升级能继续压低 exceed”，而不是立即把预算再次花在同 family 的容量插值上。之所以不选 `dual_shared_*` 或 `shared_stacked_*`，是因为这些升级在 r282 recipe 下都会把 cost 推到约 `0.12~0.13x`，要打赢当前 incumbent 需要 exceed 降到约 `0.15` 甚至更低，门槛明显更不现实；`shared_adaptive_active_product_key_expert_jumprelu` 则提供了一个完全同成本、归因最干净的 exceed probe。主要风险是 adaptive-active 在旧 scaffold 上给过负信号；但正因为 current best recent improvement 来自更细 micro-expert bank，这轮才有足够理由重新验证它是否与 finer-grained routing 产生正交收益。	/root/sparsify-ascend/research/history/logs/round0283_standard_1775052577.log
r284_1775054389	1775054389	ok	archive	0.1473076492547989	0.162125	0.28212499999999996	486400.0	0.12	322560.0	0.08	163840.0	0.04	32	dual_shared_product_key_expert_jumprelu	1				/root/sparsify-ascend/checkpoints/research_agent/round_0284/round0284_standard_1775053448_dp2_bs1_ga8_ef1_k32_20260401_222415	ff2ff72add86c9f1d926f332e0a1a39ea11d8c20			建议以 r282 为 reference，只改 `ARCHITECTURE=dual_shared_product_key_expert_jumprelu`，在 `NUM_EXPERTS=2048` 的 finer-grained micro-expert scaffold 上做一轮 matched architecture probe，直接测试更厚 shared coarse 主干能否把 exceed_alpha_0.50 压到足以刷新当前 best objective。	这轮满足单变量原则：相对 r282 只改 `ARCHITECTURE`。之所以不继续在 `shared_product_key_expert_jumprelu` 上把 `NUM_EXPERTS` 从 2048 线性扩到 3072/4096，是因为 r282 已经给出 recent 改进，而 r283 又说明并非所有基于该 scaffold 的轻量 follow-up 都有效；按当前阶段规则，更有价值的是回答哪个结构升级值得继续，而不是让同 family 容量插值重新主导预算。之所以不选 `residual_dual_shared_product_key_expert_jumprelu` 或 `shared_stacked_product_key_expert_jumprelu`，是因为它们最近已给出更弱或近似持平的信号；`dual_shared_product_key_expert_jumprelu` 则是当前最干净、最贴近 prompt 中‘shared/coarse 表达升级’的 matched probe。主要风险是 exact cost 升到约 0.116x 后，需要 exceed 比 r282 再降约 0.016 才能赢；如果做不到，就能更明确地结束 dual-shared 这条 coarse-thickening 支线。	/root/sparsify-ascend/research/history/logs/round0284_standard_1775053448.log
r285_1775055311	1775055311	ok	archive	0.19589456915855408	0.216635	0.296635	344104.0	0.08	180264.0	0.04	163840.0	0.04	32	shared_lowrank_product_key_expert_jumprelu	1				/root/sparsify-ascend/checkpoints/research_agent/round_0285/round0285_standard_1775054491_dp2_bs1_ga8_ef1_k32_20260401_224138	22808866464cd2ab27611cc9493c56540410eacf			建议以 r282 为 reference，只改 `ARCHITECTURE=shared_lowrank_product_key_expert_jumprelu`，在同一 2048 many-tiny scaffold 上做一轮新的 matched architecture probe，直接测试更轻的 shared low-rank bottleneck 能否把 total_cost_ratio 明显左移而不让 exceed 恶化到失去 objective 优势。	这轮满足单变量原则：相对 r282 只改 `ARCHITECTURE`。之所以不继续沿 `shared_product_key_expert_jumprelu` 做 `NUM_EXPERTS` 或 `STAGE1_RATIO` 近邻细扫，是因为当前 `consecutive_no_improve=2`，按策略应优先换结构槽位。之所以不再试 factorized expert heads 或 adaptive-active 变体，是因为它们已经在当前 hookpoint 上给出更直接的负信号；之所以不再继续 dual-shared，是因为 r284 已经说明“更厚 shared coarse”虽然能降 exceed，但交换率不足。`shared_lowrank_product_key_expert_jumprelu` 的价值在于：它是建立在 winning shared+PK scaffold 上的真正不同结构升级，且 exact 成本显著更低，因此即便 exceed 只部分恢复，也仍有机会形成更优 objective。主要风险是 r277 的旧负信号会在 2048 scaffold 上重演；但如果如此，这轮也能更干净地终结 shared-lowrank 方向。	/root/sparsify-ascend/research/history/logs/round0285_standard_1775054491.log
r286_1775056292	1775056292	ok	archive	0.17363718152046204	0.187768	0.277768	371712.0	0.09	207872.0	0.05	163840.0	0.04	32	product_key_expert_jumprelu	1				/root/sparsify-ascend/checkpoints/research_agent/round_0286/round0286_standard_1775055532_dp2_bs1_ga8_ef1_k32_20260401_225858	984c544e30d8e19f7fd6beccdcef91c365d5cdd0			以 r282 为 reference，只改 `ARCHITECTURE=product_key_expert_jumprelu`，在同一 2048 many-tiny recipe 上执行一轮 matched control probe，直接判断当前 best 的增益是否必须依赖 shared coarse 分支，还是 plain PK 在更大 expert 容量下就能以更低 cost 接近或击败 incumbent。	这轮严格满足单变量原则：相对 r282 只改 `ARCHITECTURE`。之所以不继续沿 `shared_product_key_expert_jumprelu` 做 `K/STAGE1_RATIO/LATENTS_PER_EXPERT` 近邻细扫，是因为最近 3 轮在同一 2048 scaffold 上的结构升级都未能扩展 objective，按当前策略应优先换结构槽位。之所以不选 `shared_lowrank_*`、`shared_product_key_factorized_expert_topk`、`product_key_factorized_expert_topk` 或更老的 routed/shared-routed 线，是因为它们在当前 target 已给出更强或更直接的负信号；继续投预算的信息增量低于这轮 plain-PK control。主要风险是 shared coarse 确实是当前 low-K regime 的必要组件，导致 exceed 回退到 r263 附近；但即便如此，这轮也能干净关闭“也许只靠 2048 many-tiny plain PK 就够了”这个仍未在当前 recipe 上直接回答的问题。	/root/sparsify-ascend/research/history/logs/round0286_standard_1775055532.log
r287_1775057206	1775057206	ok	archive	0.14733079075813293	0.162560	0.28256000000000003	486400.0	0.12	322560.0	0.08	163840.0	0.04	32	residual_dual_shared_product_key_expert_jumprelu	1				/root/sparsify-ascend/checkpoints/research_agent/round_0287/round0287_standard_1775056416_dp2_bs1_ga8_ef1_k32_20260401_231343	bf397cc193354724cf61fe77fba34612bb439254			以 r282 为 reference，只改 `ARCHITECTURE=residual_dual_shared_product_key_expert_jumprelu`，在同一 2048 many-tiny scaffold 上执行一轮 matched architecture probe，直接测试“串联 residual shared cleanup + PK routed cleanup”能否比当前 incumbent 更慢地恶化 hard-token exceed。	这轮严格满足单变量原则：相对 r282 只改 `ARCHITECTURE`。之所以不继续围绕 `shared_product_key_expert_jumprelu` 做 `K/STAGE1_RATIO/LATENTS_PER_EXPERT` 近邻细扫，是因为最近 4 轮都未扩展 objective，且 prompt 明确要求此时优先换结构槽位。之所以不再回到 plain PK、shared-lowrank、stacked PK、factorized expert 或更老的 routed/shared-routed 线，是因为它们已经在当前 target 给出更强或更新的负信号；r286 还额外证明了 shared coarse 在当前 2048 many-tiny regime 下不是可随意去掉的。选择 `residual_dual_shared_product_key_expert_jumprelu` 的理由是：它仍建立在 current winning shared+PK scaffold 上，但改变的是 cleanup 语义而不是宽度/分摊比例的小插值，正符合当前“优先寻找更能降低 tail-error 的结构升级”要求。主要风险是该 family 在 1024-expert 上曾接近 dual-shared 平台，说明串联 residual shared 可能只改善均值误差而不足以改善 exceed；但若如此，本轮也能更干净地关闭 dual-shared/residual-shared 这一整片邻域。	/root/sparsify-ascend/research/history/logs/round0287_standard_1775056416.log
r288_1775058392	1775058392	ok	archive	0.14545661211013794	0.162734	0.282734	489536.0	0.12	325696.0	0.08	163840.0	0.04	32	shared_product_key_expert_residual	1				/root/sparsify-ascend/checkpoints/research_agent/round_0288/round0288_standard_1775057572_dp2_bs1_ga8_ef1_k32_20260401_233259	0524ab505fd853d880b1c089b036a46c626b7a0c			已新增并接通 `shared_product_key_expert_residual`。建议以 r282 为 reference，只改 `ARCHITECTURE=shared_product_key_expert_residual`，在同一 2048 many-tiny scaffold 上做一轮新的 matched architecture probe，直接测试“shared coarse + PK routed cleanup + tiny global residual tail-cleanup”是否能在约 `0.1167x` 成本下更强地降低 exceed。	这轮符合当前策略约束。最近 5 轮都没有把 objective 拉过 r282，继续在已有 `shared+PK` 邻域做 `K/STAGE1_RATIO/LATENTS_PER_EXPERT` 近邻细扫已经明显低信息；而 plain PK、shared-lowrank、dual-shared、residual-dual-shared、shared adaptive-active 都给了更新且更直接的负信号。与其在这些已知弱槽位里继续补点，更有价值的是新开一个建立在 winning scaffold 之上的 cleanup 语义升级。代码改动限制在最小必要文件：`sparsify/config.py` whitelist、`sparsify/sparse_coder.py` dispatch+实现、`research/AutoResearch/override_registry.py` allowlist、`research/AutoResearch/prior_research_history.md` compatibility 行；没有新增 tunable env key，因此不需要改 `controller.py`、`config_resolution.py` 或 `scripts/autoresearch_test.sh`。主要风险是新加的 tiny residual bank 会抬高 encoder cost，却换不回足够多的 exceed 改善；但这正是当前单目标下最值得一次性回答的结构问题，而且 exact cost 仍稳在可接受带内。	/root/sparsify-ascend/research/history/logs/round0288_standard_1775057572.log
r289_1775059561	1775059561	ok	discard	0.20297104120254517	0.226389	0.486389	1079296.0	0.26	915456.0	0.22	163840.0	0.04	32	shared_lowrank_two_stage_residual_expert	1				/root/sparsify-ascend/checkpoints/research_agent/round_0289/round0289_standard_1775058741_dp2_bs1_ga8_ef1_k32_20260401_235227	ac18080e0d07286f86ee7db63498d5d9447ccbcd			从 r282 做单变量 architecture switch 到 shared_lowrank_two_stage_residual_expert。该 family 直接兼容 LUTurbo：最终重构仍是共享静态向量库与 expert 静态子库上的有限加权和，可导出为 shared lookup + routed expert lookup + weighted sum。按当前 target 的，基于当前成本口径复核，该配置仍位于预期成本带内并满足预算约束。	风险在于 shared low-rank coarse 分支曾给过弱信号，而该 family 还没有当前 target 的真实 objective 证据；但它和已失利的 shared_lowrank_product_key_expert_jumprelu 不同，专家阶段是显式 residual cleanup，信息增量足够，且本地成本/烟测都成立。	/root/sparsify-ascend/research/history/logs/round0289_standard_1775058741.log
r290_1775060542	1775060542	ok	keep	0.20519573986530304	0.227430	0.33743	453696.0	0.11	289856.0	0.07	163840.0	0.04	32	shared_lowrank_two_stage_residual_expert	1				/root/sparsify-ascend/checkpoints/research_agent/round_0290/round0290_standard_1775059717_dp2_bs1_ga8_ef1_k32_20260402_000848	9702866405b5f1bd17e8300b01f0d29b9de454ff			已实际修复 `shared_lowrank_two_stage_residual_expert` 的 override allowlist，使 `FACTORIZED_HIDDEN_DIM` 不再被 runtime 拦截。基于 `reference_round=289` 仅改一个 env 参数：`FACTORIZED_HIDDEN_DIM=56`。本地自检已确认解析链路只改这一项，且 smoke 通过；该配置的，基于当前成本口径复核，该配置仍位于预期成本带内并满足预算约束。	这轮不是继续细扫 recipe，而是修正 r289 的变量隔离失效：上一轮 architecture probe 继承了不匹配的 `FACTORIZED_HIDDEN_DIM=256`，导致 cost 证据失真。风险是即便 cost 回到 0.11x 左右，exceed 仍可能没有竞争力；若如此，应把该 family 在当前 hookpoint 上降级，而不是继续追加 low-rank shared 线性跟参。	/root/sparsify-ascend/research/history/logs/round0290_standard_1775059717.log
r291_1775061397	1775061397	ok	archive	0.15680032968521118	0.173906	0.283906	458752.0	0.11	294912.0	0.07	163840.0	0.04	32	dual_shared_adaptive_active_product_key_expert_jumprelu	1				/root/sparsify-ascend/checkpoints/research_agent/round_0291/round0291_standard_1775060638_dp2_bs1_ga8_ef1_k32_20260402_002418	a050309bf344f601b32fe8b9210725b5a37b3978			从 r279 做单变量 architecture switch 到 `dual_shared_adaptive_active_product_key_expert_jumprelu`。这不是回到低信息细扫，而是沿当前最相关的 shared+PK scaffold 测试“更厚 shared coarse + variable-active residual cleanup”这一结构升级。按本地烟测与 cost 估计，`NUM_EXPERTS=1024, ACTIVE_EXPERTS=2, LATENTS_PER_EXPERT=56, STAGE1_RATIO=0.375` 下 total_cost_ratio 约 `0.11x`，处于 matched-objective 带；若该 family 不能在近同成本下明显降低 exceed，就可以把这条 variable-active dual-shared 支线一并降级。	风险在于 `shared_adaptive_active_product_key_expert_jumprelu` 先前已给过负信号，而且当前 cost proxy 对 adaptive path 的计费与 dual_shared PK 基本相同，因此这轮几乎完全是在赌 exceed 改善。如果 exceed 仍停留在 `~0.16+`，这条线就不值得继续主导预算。	/root/sparsify-ascend/research/history/logs/round0291_standard_1775060638.log
r292_1775062441	1775062441	ok	archive	0.1477927267551422	0.164036	0.28403599999999996	489536.0	0.12	325696.0	0.08	163840.0	0.04	32	shared_product_key_expert_residual	1				/root/sparsify-ascend/checkpoints/research_agent/round_0292/round0292_standard_1775061620_dp2_bs1_ga8_ef1_k32_20260402_004035	5eb8f1678918584cab9ce86f63e9990f43862d2d			从 r288 做单变量 patch：`STAGE1_RATIO=0.125`。这是建立在当前最接近 winning scaffold 的 cleanup 升级之上的最小必要 knee 校准，而不是继续在 shared+PK 主线做低信息细扫。r288 已显示该 family 在近同成本下把 exceed 压到 0.1627；本轮把 split 从 `8/24` 改为 `4/28`，不改变总 K 与部署成本，只增强最后一层 residual cleanup 的预算，直接回答“更强 hard-token cleanup 能否把 objective 拉过 incumbent”。	这轮的上限取决于 residual cleanup 是否真能把 exceed 再压低约 0.01 以上；如果没有，这条扩展兼容 cleanup 线就基本可以定性为‘方向对但交换率不够’，后续应停止围绕它继续扫 split。之所以仍值得做这一轮，是因为它比继续扫 shared+PK 主线的 K 或 stage1 更直接测试 hard-token cleanup 假设，且 cost 几乎不变。	/root/sparsify-ascend/research/history/logs/round0292_standard_1775061620.log
r293_1775063569	1775063569	ok	archive	0.1473383903503418	0.164479	0.284479	489536.0	0.12	325696.0	0.08	163840.0	0.04	32	shared_adaptive_active_product_key_expert_residual	1				/root/sparsify-ascend/checkpoints/research_agent/round_0293/round0293_standard_1775062748_dp2_bs1_ga8_ef1_k32_20260402_005914	234e846f7a8fb76971dd8d179f9901aec8eb844a			已实际新增并集成 `shared_adaptive_active_product_key_expert_residual`，只在 `sparsify/` 落盘修改 whitelist 与 runtime dispatch/class implementation。该 family 复用 `shared_product_key_expert_residual` 的 shared + PK + residual scaffold，仅把 expert cleanup 改成 adaptive-active 选择。按本地 smoke 与 cost 估计，在继承 r282 的 `K=32, EF=1, NUM_EXPERTS=2048, ACTIVE_EXPERTS=2, LATENTS_PER_EXPERT=56, STAGE1_RATIO=0.25, FACTORIZED_HIDDEN_DIM=256` 配置下 total_cost_ratio 仍约 `0.12x`，与 r288/r292 同量级；这使本轮成为一个纯粹检验“variable-active cleanup 是否能显著压低 exceed”的 matched-cost architecture probe。	这是一次有信息增量的新结构 probe，而不是继续扫已平台化的 split 邻域。风险在于 cost proxy 不会奖励 adaptive-active 的轻路径，所以若 exceed 改善不够，这条线可能仍输给 incumbent；但它正面回答了当前最高价值的问题：在保留 shared+PK+residual scaffold 的同时，difficulty-aware cleanup 是否值得继续。	/root/sparsify-ascend/research/history/logs/round0293_standard_1775062748.log
r294_1775064481	1775064481	ok	archive	0.14354434609413147	0.160198	0.280198	486400.0	0.12	322560.0	0.08	163840.0	0.04	32	dual_shared_product_key_expert_jumprelu	1				/root/sparsify-ascend/checkpoints/research_agent/round_0294/round0294_standard_1775063661_dp2_bs1_ga8_ef1_k32_20260402_011427	e0549347412eaabaa153d6d78abf7bcc09dc0e55			从 r279 做单变量 patch：`NUM_EXPERTS=2048`。这不是继续扫 `K / STAGE1_RATIO / LATENTS_PER_EXPERT` 的近邻点，而是在当前最可信的 dual-shared PK scaffold 上做容量组织升级，直接对应“shared coarse + finer micro-experts”这条 DeepSeekMoE 风格假设。按，基于当前成本口径复核，该配置仍位于预期成本带内并满足预算约束。	这轮的赌点很明确：以约 `+0.01x` 的 cost 换更低 exceed。如果 exceed 不能至少明显优于 r279 的 `0.1712`，那 dual-shared PK 线的容量加深基本就可以视为交换率不足，不应继续主导预算。之所以仍值得做，是因为它比继续扫 split 更像一次结构容量升级，而且保持了 shared+PK 主 scaffold 不变，归因最清楚。	/root/sparsify-ascend/research/history/logs/round0294_standard_1775063661.log
r295_1775065637	1775065637	ok	archive	0.14155954122543335	0.159068	0.289068	546880.0	0.13	383040.0	0.09	163840.0	0.04	32	residual_dual_shared_product_key_expert_residual	1				/root/sparsify-ascend/checkpoints/research_agent/round_0295/round0295_standard_1775064696_dp2_bs1_ga8_ef1_k32_20260402_013142	232c7aa1ecf7caa3e162659bb51ed4fa8cb33c96			已实际新增并集成 `residual_dual_shared_product_key_expert_residual`，只修改 `sparsify/config.py` 与 `sparsify/sparse_coder.py`。该 family 是对 r294 `dual_shared_product_key_expert_jumprelu` 的结构升级：保留双 shared coarse + PK cleanup，只再追加一个 tiny factorized residual cleanup。按本地 exact-string smoke 与 cost 估计，在继承 r294 的 `K=32, EF=1, NUM_EXPERTS=2048, ACTIVE_EXPERTS=2, LATENTS_PER_EXPERT=56, STAGE1_RATIO=0.375, FACTORIZED_HIDDEN_DIM=256` 配置下 total_cost_ratio 约 `0.13x`，仍在当前目标带内；因此本轮是一次 matched-cost 附近、明确面向降低 exceed 的 scaffold-upgrade probe。	风险很直接：`cost≈0.13x` 已经要求 exceed 至少接近 `0.09~0.10` 才有机会逼近阶段目标，交换率门槛很高。如果这轮 exceed 只是比 r294 小幅下降几个点，仍不够支撑主线；但它是当前最贴近 winning scaffold 的高信息增量升级之一，值得用一轮回答。	/root/sparsify-ascend/research/history/logs/round0295_standard_1775064696.log
r296_1775066578	1775066578	ok	archive	0.1473289132118225	0.162317	0.282317	486400.0	0.12	322560.0	0.08	163840.0	0.04	32	dual_shared_product_key_expert_jumprelu	1				/root/sparsify-ascend/checkpoints/research_agent/round_0296/round0296_standard_1775065788_dp2_bs1_ga8_ef1_k32_20260402_014954	e1e5cf5591a2f0f24dd2f9bb60468386d781bcec			建议以 r294 为 reference，只改 `STAGE1_RATIO=0.25`，对 `dual_shared_product_key_expert_jumprelu` 做一轮必要的 knee 校准。这不是继续做广泛同 family 细扫，而是利用当前最强 recent scaffold，在近同成本下测试“少一点 coarse、多一点 PK cleanup”能否把 exceed 再压低一档，从而判断这条 dual-shared PK 线是否还有主线价值。	这轮严格满足单变量原则：相对 r294 的完整配置只改 `STAGE1_RATIO` 一个 env 参数，显式给出 `reference_round=294`，没有声明 primary_variable，也没有返回任何未落盘代码改动。选择 r294 而不是继续沿 r282 或新 family 冷启动，是因为 recent 证据里它是最接近 incumbent 的兼容 scaffold，而本轮只是一次信息密度仍然足够高的 knee 校准；如果这一步仍不能把 objective 明显拉低，就应停止继续在 dual-shared PK 上做局部比率细扫。	/root/sparsify-ascend/research/history/logs/round0296_standard_1775065788.log
	1775066881	policy_reject	policy_reject				489536.0	0.12	325696.0	0.08	163840.0	0.04											Incubation limit: 当前已经有 10 个 incubating family，达到上限 10。stale=[]		
r298_1775067900	1775067900	ok	archive	0.14650991559028625	0.162632	0.272632	449536.0	0.11	285696.0	0.07	163840.0	0.04	32	shared_product_key_expert_jumprelu	1				/root/sparsify-ascend/checkpoints/research_agent/round_0298/round0298_standard_1775066989_dp2_bs1_ga8_ef1_k32_20260402_020956	f96f4e7fcc1d7f22b94c6c6f9faab7f6a30cc88d			建议本轮以 r282 为 reference，只改 `NUM_EXPERTS=3072`。这是在不新开 family、且仅把 exact total_cost 从 `0.10229x` 提到 `0.10718x` 的前提下，对“更细粒度 micro-experts 是否能继续压低 low-K exceed”的直接 matched probe。	这轮严格遵守单变量原则：相对 r282 只改 `NUM_EXPERTS`。我没有继续返回 `edit_sae_code`，因为 round 297 的代码改动已经真实落盘且本轮没有新增改动；同时，新 family 已被 incubation limit 拦截，继续开新结构会重复撞 policy。选择 `NUM_EXPERTS=3072` 而不是 `LATENTS_PER_EXPERT` 或 `STAGE1_RATIO` 的原因是：它仍属于现有 winning scaffold 上的容量组织问题，但比常规邻域细扫更接近当前 prompt 的 high-priority hypothesis，并且 exact cost 只小幅上升。主要风险是它仍然可能只是温和改善，不足以形成 regime shift；但在当前新 family 被 policy 阻塞的前提下，这是最干净、最可解释的 exceed-oriented probe。	/root/sparsify-ascend/research/history/logs/round0298_standard_1775066989.log
r299_1775069564	1775069564	ok	archive	0.1542031466960907	0.168475	0.27847500000000003	466944.0	0.11	303104.0	0.07	163840.0	0.04	32	shared_product_key_expert_jumprelu	1				/root/sparsify-ascend/checkpoints/research_agent/round_0299/round0299_standard_1775067992_dp2_bs1_ga8_ef1_k32_20260402_022638	97999c37458fa4a2bd6e3b99110bc5a165c27084			建议本轮以 r298 为 reference，只改 `NUM_EXPERTS=4096`。这是对 r298 新正信号的一次必要 knee 校准，用来判断更细粒度 micro-experts 是否足以把 shared+PK scaffold 真正推过当前 incumbent，而不是继续把预算花在低信息近邻扫点上。	这轮严格遵守单变量原则：相对 r298 只改 `NUM_EXPERTS`。之所以允许在同一 family 上再做一次 follow-up，是因为 r298 刚给出一个接近击败 incumbent 的新正信号，且这条轴直接对应当前 prompt 最高优先级之一“更细粒度 routed micro-experts”；这不是沿着旧的 `K/STAGE1_RATIO/LATENTS_PER_EXPERT` 平台继续机械细扫。主要风险是 3072->4096 可能已经进入收益递减区间，只会抬高 cost 而不给足够的 exceed 回报；但这正是本轮要用一个最小单变量实验回答的问题。	/root/sparsify-ascend/research/history/logs/round0299_standard_1775067992.log
r300_1775070572	1775070572	ok	archive	0.1464504897594452	0.163578	0.283578	489536.0	0.12	325696.0	0.08	163840.0	0.04	32	shared_product_key_expert_jumprelu_residual	1				/root/sparsify-ascend/checkpoints/research_agent/round_0300/round0300_standard_1775069751_dp2_bs1_ga8_ef1_k32_20260402_025558	8e399a1041e08a685b178346b6a1bee525f1fb86			建议以 r282 为 reference，只改 `ARCHITECTURE=shared_product_key_expert_jumprelu_residual`。这轮不是继续做 incumbent 邻域扫参，而是在当前最强 shared+PK scaffold 上做一次 matched cleanup-semantics probe，直接判断 JumpReLU tail residual 能否在约 `0.1167x` 成本下把 exceed 明显压低。	这轮严格满足单变量原则：相对 r282 只改 `ARCHITECTURE`。它也符合当前 round 300 的策略要求：最近两轮已经是同一 family 上的局部延伸且没有实质击穿 incumbent，因此本轮应优先换结构槽位，而不是继续做 `NUM_EXPERTS/K/STAGE1_RATIO` 近邻细扫。之所以选择这个 family，而不是再新开一个未注册 family，是因为它已经真实落盘、已完成 whitelist/factory/allowlist/smoke/cost 检查，并且当前本地 policy 校验已通过；r297 的失败只是当时全局 incubation 满额，而不是此 family 自身不可运行。主要风险是 JumpReLU 过度抑制 tiny residual bank，导致 tail cleanup 容量下降，结果不如 r292 的 plain residual；但这正是本轮要用一个最小结构切换清晰回答的问题。	/root/sparsify-ascend/research/history/logs/round0300_standard_1775069751.log
r301_1775071879	1775071879	ok	keep	0.14819805324077606	0.164642	0.274642	449536.0	0.11	285696.0	0.07	163840.0	0.04	32	shared_adaptive_active_product_key_expert_jumprelu	1				/root/sparsify-ascend/checkpoints/research_agent/round_0301/round0301_standard_1775070843_dp2_bs1_ga8_ef1_k32_20260402_031410	530043d704bc4746140e8354078b4b592b9cf9a8			建议以 r283 为 reference，只改 `NUM_EXPERTS=3072`。这轮不是回到 incumbent family 的容量细扫，而是对一个仍未闭环的问题做单变量交互验证：variable-active cleanup 是否只有在 finer micro-expert bank 上才会兑现为真实的 exceed 改善。	这轮严格满足单变量原则：相对 r283 只改 `NUM_EXPERTS`。之所以允许留在同一 family 再做一轮，不是因为要继续做低信息插值，而是因为这里存在一个清晰且尚未验证完的高价值结构交互假设：r283 已证明“仅有 variable-active cleanup”不够，r298 又证明“仅扩 finer micro-expert bank”有一定正信号但不足以击穿 incumbent；本轮正是把这两条证据拼起来，判断二者是否存在非线性正交互。没有继续回到 `shared_product_key_expert_jumprelu` 本体、也没有再去扫 `STAGE1_RATIO/K`，因为那会重新落回 prompt 明确下调优先级的近邻细扫。主要风险是 r299 已提示 fixed-AE 版本的 bank 扩容 knee 接近 3072~4096，adaptive-active 语义未必足以把这条 knee 明显右移；若如此，这轮也能更干净地结束 variable-active PK 这一支线。	/root/sparsify-ascend/research/history/logs/round0301_standard_1775070843.log
r302_1775073032	1775073032	ok	archive	0.14764496684074402	0.162618	0.272618	466944.0	0.11	303104.0	0.07	163840.0	0.04	32	shared_adaptive_active_product_key_expert_jumprelu	1				/root/sparsify-ascend/checkpoints/research_agent/round_0302/round0302_standard_1775071971_dp2_bs1_ga8_ef1_k32_20260402_033257	318902d4a07e7a76aa08bb67e29e896b7d17516c			建议以 r301 为 reference，只改 `NUM_EXPERTS=4096`。这轮不是回到低信息扫参，而是对 r301 新正信号做一次必要的 knee 校准，直接判断 adaptive-active cleanup 是否真的能把 finer micro-expert bank 的收益延长到 fixed-AE 版本已经开始回撤的区域。	这轮严格满足单变量原则：相对 r301 只改 `NUM_EXPERTS`。之所以允许继续留在同一 family 再补一轮，是因为 r301 刚刚把这条线抬成了当前最低 exceed leader，而且当前仍有一个清晰、未闭环、且足以改变结论的结构假设需要回答：adaptive-active cleanup 能否把 fixed-AE family 在 `3072 -> 4096` 上出现的 knee 明显向右推移。如果直接回到全新 family，会把这个高价值交互问题悬空；如果继续扫 `K/STAGE1_RATIO/LATENTS_PER_EXPERT`，又会落回 prompt 明确下调优先级的近邻细扫。主要风险是 fixed-AE 的 r299 已显示 4096 会明显回撤，而 adaptive-active 也可能同样进入收益递减区间；但若如此，本轮就能更干净地结束 variable-active PK 这条支线，而不是继续让它占据后续预算。	/root/sparsify-ascend/research/history/logs/round0302_standard_1775071971.log
	1775073584	policy_reject	policy_reject				429056.0	0.1	265216.0	0.06	163840.0	0.04											Incubation limit: 当前已经有 10 个 incubating family，达到上限 10。stale=[]		
r305_1775077120	1775077120	ok	keep	0.1468515694141388	0.159929	0.267107	449536.000000	0.107178	285696.000000	0.068115	163840.000000	0.039062	32	shared_cascade_product_key_expert_jumprelu	1				/root/sparsify-ascend/checkpoints/research_agent/round_0305/round0305_standard_1775075813_dp2_bs1_ga8_ef1_k32_20260402_043700	40fbc55b711bcab7e40698df8272a501783c7985			建议以 r304 为 reference，只改 `NUM_EXPERTS=3072`。这是对当前新 winning scaffold 的一个高信息容量点验证：不是继续扫低信息的 `K/STAGE1_RATIO` 邻域，而是直接测试 finer routed micro-experts 是否能在 cascade cleanup 语义上继续压低 hard-token exceed。	这轮严格满足单变量原则：相对 r304 的完整配置只改 `NUM_EXPERTS`。选择这条线而不是立刻再开新 family，有两个原因：一是当前 policy/历史上新 family 仍存在 incubation 风险，二是 r304 刚把 cascade scaffold 抬成当前 objective anchor，此时最有价值的不是回到 `K/STAGE1_RATIO` 细扫，而是回答一个仍未闭环的高优先级问题：更细粒度 routed micro-experts 是否会在 ordered cascade cleanup 上兑现为更低的 tail exceed。主要风险也很清楚：2048->3072 可能只是重复 fixed-AE 线上“cost 上升但 exceed 改善有限”的模式；如果如此，这轮就应被视为给该容量轴划出 knee，而不是继续线性扩 `NUM_EXPERTS`。	/root/sparsify-ascend/research/history/logs/round0305_standard_1775075813.log
