experiment_id	timestamp	status	decision	val_fvu	exceed_alpha_0_50	objective_score	total_cost	total_cost_ratio	selection_cost	selection_cost_ratio	deployment_accesses	deployment_ratio	k	architecture	expansion_factor	wall_time_sec	peak_memory_gb	total_tokens	checkpoint	head_commit	head_branch	workspace_dirty	description	self_review	log_path
r228_1775002134	1775002134	ok	discard	0.26610833406448364	0.310449	0.600449	1212416.0	0.29	1048576.0	0.25	163840.0	0.04	32	topk	1				/root/sparsify-ascend/checkpoints/research_agent/round_0228/round0228_standard_1775001915_dp2_bs1_ga8_ef1_k32_20260401_080522	2cf66c306998180e42ef1524ce63d22a7acff10f			建议以 r212 为 reference，只改 `ARCHITECTURE=topk`。这轮的目标不是寻找高把握翻盘点，而是完成 current-target 上 single-library selector 线的最后一个 matched closure probe，明确 plain 单静态库稀疏和在当前 hookpoint 上是否还保留任何 objective 价值。	这轮严格满足单变量原则：相对 r212 只改 `ARCHITECTURE`，没有新增参数，也没有代码改动。没有再选 `whitened_topk`、`codebook_topk`、`routed`、`bucketed_topk` 等未测 family，是因为它们在当前 matched recipe 下的 exact total_cost_ratio 已抬到 `0.40x~0.54x`，对当前 objective 基本没有现实赢面；继续测试它们更像质量锚点，而不是本轮要求的 matched architecture probe。也没有回到任何已测 expert/lowrank/shared 线做局部 follow-up，因为当前要求明确是结构裁决而不是 recipe 细扫。选择 `topk` 的风险同样明确：它要赢过 r212 需要极不现实的 exceed 压缩，所以这更像 single-library closure probe，而不是高置信翻盘点；但在当前剩余槽位里，它仍是唯一同时满足“尚未 cleanly probed”和“exact cost 未明显超出可讨论窗口”的候选。	/root/sparsify-ascend/research/history/logs/round0228_standard_1775001915.log
r229_1775002879	1775002879	ok	discard	0.13452699780464172	0.160599	0.600599	1851392.0	0.44	1605632.0	0.38	245760.0	0.06	32	lowrank_expert_residual	1				/root/sparsify-ascend/checkpoints/research_agent/round_0229/round0229_standard_1775002270_dp2_bs1_ga8_ef1_k32_20260401_081117	170f4153a3d83abc0699a59822189beccc042528			建议以 r212 为 reference，只改 `ARCHITECTURE=lowrank_expert_residual`。这轮不再补低信息 selector 变体，而是用一次高风险 matched architecture probe，直接裁决当前仍最值得回答的结构问题：`low-rank trunk + routed expert + residual cleanup` 这条线在当前 hookpoint 上究竟是否还值得继续。	这轮严格满足单变量原则：相对 r212 只改 `ARCHITECTURE`，没有新增参数，也没有代码改动。没有继续选 `whitened_topk`、`codebook_topk`、`routed`、`bucketed_topk` 等 remaining 结构，是因为它们虽然未在当前 anchor recipe 上全做过干净 probe，但要么已偏离当前高优先级方向，要么在 objective 上同样没有现实赢面且信息增量更低。选择 `lowrank_expert_residual` 的理由是：在 single-library / factorized / lightweight selector 槽位都已经被 current-target 负信号裁掉后，它是剩余候选里最直接对应用户高优先级假设、且最值得得到一次 matched recipe verdict 的结构线。主要风险很明确：它在当前 total_cost 下不可能刷新 incumbent，所以这一步只能被理解为结构裁决，不是 frontier attack；但在当前阶段，这恰好是更重要的问题。	/root/sparsify-ascend/research/history/logs/round0229_standard_1775002270.log
r230_1775003563	1775003563	ok	discard	0.1469648778438568	0.171988	0.581988	1736704.0	0.41	1572864.0	0.38	163840.0	0.04	32	two_stage_residual_expert	1				/root/sparsify-ascend/checkpoints/research_agent/round_0230/round0230_standard_1775002954_dp2_bs1_ga8_ef1_k32_20260401_082240	38fdd8f0a871c92102f1939289d07276d02ddff5			建议以 r212 为 reference，只改 `ARCHITECTURE=two_stage_residual_expert`。这轮的目的不是直接冲击 incumbent，而是用一次 matched architecture probe 判断 Round 229 看到的低 exceed 到底来自 low-rank trunk，还是来自更一般的 coarse + residual-expert cleanup 分工。	这轮严格满足单变量原则：相对 r212 只改 `ARCHITECTURE`，没有新增参数，也没有代码改动。没有继续选择 `shared_lowrank_routed_expert_residual` 或 `shared_routed_factorized_expert_residual`，因为它们在当前 matched recipe 下成本更高或历史弱先验更差，信息增量反而低于 `two_stage_residual_expert`。也没有继续回到 single-library 或 factorized selector 线，因为这些槽位已经被 current-target 的新结果充分裁掉。选择 `two_stage_residual_expert` 的风险同样明确：它不可能刷新 incumbent，因此只能被理解为结构归因 probe，而不是 frontier attack；但在 Round 229 之后，这正是当前最值得回答的问题。	/root/sparsify-ascend/research/history/logs/round0230_standard_1775002954.log
r231_1775004005	1775004005	ok	discard	0.2600403428077698	0.304368	0.6943680000000001	1654784.0	0.39	1490944.0	0.36	163840.0	0.04	32	shared_routed_factorized_expert_residual	1				/root/sparsify-ascend/checkpoints/research_agent/round_0231/round0231_standard_1775003637_dp2_bs1_ga8_ef1_k32_20260401_083403	b2361554ebb61cd18261f398d9cffdab6b19741d			建议以 r212 为 reference，只改 `ARCHITECTURE=shared_routed_factorized_expert_residual`。这轮的目标不是直接赢过 incumbent，而是判断 residual-cleanup 的收益能否在更轻的 factorized shared+routed 选择链路下保留下来，从而决定这条结构线是否值得继续。	这轮严格满足单变量原则：相对 r212 只改 `ARCHITECTURE`，没有新增参数，也没有代码改动。没有继续选 `shared_lowrank_routed_expert_residual`，因为它在当前 matched recipe 下更贵；也没有回到 `whitened_topk` 或 `codebook_topk`，因为它们虽然未在当前 anchor recipe 上完整裁决，但与当前 residual-cleanup 归因问题相比信息增量更低。选择 `shared_routed_factorized_expert_residual` 的风险同样明确：它不可能刷新 incumbent，因此只能作为结构裁决，而不是 frontier attack；但在 Round 229/230 之后，这正是当前 remaining search space 里最值得回答的问题。	/root/sparsify-ascend/research/history/logs/round0231_standard_1775003637.log
r232_1775004681	1775004681	ok	discard	0.1564638614654541	0.187091	0.6470910000000001	1949696.0	0.46	1785856.0	0.43	163840.0	0.04	32	shared_lowrank_routed_expert_residual	1				/root/sparsify-ascend/checkpoints/research_agent/round_0232/round0232_standard_1775004072_dp2_bs1_ga8_ef1_k32_20260401_084118	60402deb426131c3fbe75d3c93435e9b8163745d			建议以 r212 为 reference，只改 `ARCHITECTURE=shared_lowrank_routed_expert_residual`。这轮的目的不是直接冲击 incumbent，而是判断 residual-cleanup 的收益是否需要更强的 shared low-rank 路径才能保住，从而决定这条结构线是否值得继续。	这轮严格满足单变量原则：相对 r212 只改 `ARCHITECTURE`，没有新增参数，也没有代码改动。没有再选 `whitened_topk`、`codebook_topk`、`routed`、`bucketed_topk` 等 remaining family，因为它们与当前 residual-cleanup 归因问题相比信息增量更低，而且都不具备现实 objective 赢面。也没有回到已经被 current-target 明确裁掉的 single-library selector、factorized selector 或 simple shared+routed 线。选择 `shared_lowrank_routed_expert_residual` 的风险同样明确：它不可能刷新 incumbent，因此只能作为结构裁决，而不是 frontier attack；但在 Round 229-231 之后，这正是当前 remaining search space 里最值得回答的问题。	/root/sparsify-ascend/research/history/logs/round0232_standard_1775004072.log
r233_1775006241	1775006241	ok	keep	0.19153612852096558	0.217719	0.367719	630784.0	0.15	466944.0	0.11	163840.0	0.04	32	factorized_router_expert_topk	1				/root/sparsify-ascend/checkpoints/research_agent/round_0233/round0233_standard_1775005687_dp2_bs1_ga8_ef1_k32_20260401_090813	b60fba3873dacf6ab03ef63c824fa85bb2868ea7			已新增并本地验证 `factorized_router_expert_topk`。建议以 r212 为 reference，只改 `ARCHITECTURE=factorized_router_expert_topk`，做一轮新的 matched architecture probe，直接回答“router-only 低秩化”能否在保持 short active path 优势的同时，把 objective 从当前 0.3555 再往下推。	这轮满足当前 round-233 的 matched architecture probe 约束：相对 r212 的完整配置，只改变 `ARCHITECTURE`；`K`、`EXPANSION_FACTOR`、`OPTIMIZER`、`LR` 与其余主 recipe 都保持不变。之所以不继续从现有已注册 family 中挑 probe，是因为当前 `K=32` matched lane 上的 `lowrank_expert_topk`、`shared_routed_expert_topk`、`shared_two_stage_residual_expert`、`shared_lowrank_routed_expert_topk`、`factorized_topk`、`factorized_expert_topk` 等主要结构槽位都已给出明确负信号，而剩余未闭合 family 的 exact cost 大多已远离 `0.18x~0.22x` 主战场。新 family 的工程改动被控制在 `sparsify/`，没有引入新参数接线风险；同时它正对当前高优先级的“更轻 scorer / router”问题，但比 `factorized_expert_topk` 更保守，因为只低秩化 router、保留 full expert heads。主要风险是 router 压缩仍可能破坏 expert 选择质量；但如果连这种最小侵入的 router-only 低秩化都守不住 exceed，就可以更果断地下调这条方向的优先级。	/root/sparsify-ascend/research/history/logs/round0233_standard_1775005687.log
r234_1775007963	1775007963	ok	archive	0.17585963010787964	0.203469	0.37346900000000005	712704.0	0.17	466944.0	0.11	245760.0	0.06	48	factorized_router_expert_topk	1				/root/sparsify-ascend/checkpoints/research_agent/round_0234/round0234_standard_1775007415_dp2_bs1_ga8_ef1_k48_20260401_093701	e6b856fbf7077e226d38706cb786b9ff460b45f6			建议以 r233 为 reference，只改 K=48，做一轮 factorized_router_expert_topk 的 deploy-knee probe。目标不是继续证明“router 更轻”本身，而是回答这条 family 能否把已验证的 cost 优势换成足够的 exceed 回收；如果连 K=48 仍守不住 objective，这条线就应及时降级。	这轮满足单变量原则：相对 r233 只改 K，一个 env 参数，没有代码改动，也没有新增 tunable key。之所以没有立刻再开全新结构槽位，是因为 r233 虽然输给 incumbent，但它已经给出了很干净的分解信号：selection cost 确实降下来了，失败点集中在 exceed；因此当前最高信息量的 follow-up 不是再换一个名字，而是验证“把节省的 router 成本回投到 lookup budget”后，这个 family 是否还能形成可竞争 knee。其风险也很清楚：从 r233 到 K=48，objective 想至少打平 r210 需要 exceed 大约再降 0.022 以上，想真正挑战当前 incumbent 则需要降到高 0.18x 区间；如果这一轮做不到，就可以更有把握地结束这条 router-only 低秩化分支。	/root/sparsify-ascend/research/history/logs/round0234_standard_1775007415.log
r235_1775008736	1775008736	ok	keep	0.1710990071296692	0.194491	0.354491	688128.0	0.16	524288.0	0.12	163840.0	0.04	32	expert_jumprelu	1				/root/sparsify-ascend/checkpoints/research_agent/round_0235/round0235_standard_1775008183_dp2_bs1_ga8_ef1_k32_20260401_094950	64a9407ece54ed01f74236194097a0327868674d			建议以 r212 为 reference，只改 `ARCHITECTURE=expert_jumprelu`，做一轮 matched-cost architecture probe。目标是回答在与 incumbent 完全同成本的前提下，expert 内 JumpReLU 门控能否显著改善 small-K exceed；如果不能，这条“支持规则替换”方向也可以快速降级。	这轮满足单变量原则：相对 r212 只改 `ARCHITECTURE`，没有代码改动，也没有新增 tunable key。之所以此时不继续留在 `factorized_router_expert_topk`，是因为 r233 和 r234 已经给出连续负信号：从 K=32 到 K=48，objective 反而从 0.368110 升到 0.373391，说明“router-only 低秩化”并没有形成值得继续追的 deployment knee。之所以也不选 `codebook_topk` / `residual_vq` 这类 coarse-codebook family，是因为本地 exact 成本复核显示它们在 matched K=32 recipe 下 total_cost_ratio 已分别到约 0.40 和 0.51，明显偏离当前 0.14x~0.20x 主战场。`expert_jumprelu` 则提供了一个真正新的、但仍与 incumbent 完全同成本的结构槽位；它也不等同于已失败的 plain `jumprelu`，因为 r226 测的是无 expert routing 的单库 family，cost=0.289062、objective=0.599505，而本轮测的是保留 routed expert 容量、只替换 expert 内支持形成机制的 matched probe。主要风险是 JumpReLU 门控在当前 hookpoint 上只会带来更软的稀疏支持而不会真正改善 exceed；但如果连同成本下的支持规则替换都没有收益，就可以更明确地把后续预算转去别的结构线，而不是继续在 routed-only 家族内部做低信息变体。	/root/sparsify-ascend/research/history/logs/round0235_standard_1775008183.log
r236_1775009364	1775009364	ok	keep	0.1570778787136078	0.181317	0.361317	770048.0	0.18	524288.0	0.12	245760.0	0.06	48	expert_jumprelu	1				/root/sparsify-ascend/checkpoints/research_agent/round_0236/round0236_standard_1775008811_dp2_bs1_ga8_ef1_k48_20260401_100018	c4db3553a806a02f9278e5fbf1c30c91c6be016a			建议以 r235 为 reference，只改 `K=48`，做一轮 `expert_jumprelu` 的 deployment-knee probe。目标是回答 JumpReLU 的 small-K 优势是否在 K=48 仍成立；如果它连 matched `expert_topk@K48` 都无法接近，这条支持规则替换线就不值得继续细扫。	这轮满足单变量原则：相对 r235 只改 `K`，没有代码改动，也没有新增 tunable key。之所以允许在同一 family 上再做一轮，不是因为 r235 的 0.001 级改善已经足够，而是因为它刚好打开了一个高价值未验证问题：JumpReLU 是否真的改变了 routed family 的 deployment knee，而不是只在 K=32 上偶然略赢。相比直接去调 `JUMPRELU_INIT_THRESHOLD` 这类局部旋钮，`K=48` 更能回答当前主目标相关的结构问题，即“在相同 selection cost 下，增加 deploy lookup 后，支持规则替换是否还能继续回收 exceed”。其风险也很清楚：`expert_jumprelu@K48` 若想至少打平历史 `expert_topk@K48`，需要 exceed 大致降到 0.178 附近；若仍接近或高于 0.18，则说明这条线并没有形成比 `expert_topk` 更好的 knee，只是同成本 K=32 的轻微波动，后续应停止继续消耗预算。	/root/sparsify-ascend/research/history/logs/round0236_standard_1775008811.log
r237_1775010063	1775010063	ok	archive	0.17175798118114471	0.195374	0.35537399999999997	688128.0	0.16	524288.0	0.12	163840.0	0.04	32	expert_jumprelu	1				/root/sparsify-ascend/checkpoints/research_agent/round_0237/round0237_standard_1775009515_dp2_bs1_ga8_ef1_k32_20260401_101201	ffc8be64280777cd4453ed643746e8d73b375de2			建议以 r235 为 reference，只改 `JUMPRELU_INIT_THRESHOLD=0.05`，做一轮 `expert_jumprelu` 的同成本动态参数 probe。目标是回答当前 family 的微弱优势能否通过更强阈值整形放大成可感知的 objective 改善；如果不能，就应停止继续在 JumpReLU 家族上做局部细扫。	这轮满足单变量原则：相对 r235 只改 `JUMPRELU_INIT_THRESHOLD`，没有代码改动，也没有新增 tunable key。之所以没有继续把 K 推到 64，是因为 r236 已经回答了最关键的 knee 问题：`expert_jumprelu@K48` 仅比 matched `expert_topk@K48` 略好约 0.0004 objective，但仍显著差于当前 incumbent `expert_jumprelu@K32`，这说明继续沿 K 轴细扫的信息增量已经开始下降。之所以此时仍允许留在同一 family 一轮，是因为当前 family 刚刚在两个 matched-cost 点都给出一致但很弱的正信号，而 `JUMPRELU_INIT_THRESHOLD` 正是该 family 的独特机制旋钮；默认阈值 0.0 很可能让许多弱激活在 small-K 情况下仍占用支持预算，轻度正阈值是当前最直接、最可归因、也最不混入成本因素的验证。主要风险是阈值抬高会削弱有效容量，导致 exceed 反而上升；但如果连这种不增加任何 cost 的家族内校准都无法把 objective 从 0.3545 再往下推，就可以更明确地结束 JumpReLU 线的局部优化，把预算转回新的结构槽位。	/root/sparsify-ascend/research/history/logs/round0237_standard_1775009515.log
r238_1775010831	1775010831	ok	archive	0.17309820652008057	0.196417	0.356417	688128.0	0.16	524288.0	0.12	163840.0	0.04	32	adaptive_active_expert_jumprelu	1				/root/sparsify-ascend/checkpoints/research_agent/round_0238/round0238_standard_1775010283_dp2_bs1_ga8_ef1_k32_20260401_102449	a207dc44cf250d3eb2fa77eb1334d9fa95ba71ad			已在 `sparsify/` 落盘最小新 family `adaptive_active_expert_jumprelu`。建议以 r235 为 reference，只改 `ARCHITECTURE=adaptive_active_expert_jumprelu`，做一轮新的 matched-objective architecture probe，直接回答 variable-active-path 是否值得继续。	这轮选择新结构槽位而不是继续在 `expert_jumprelu` 上补局部插值，符合当前 round-238 的运行优先级：r236 与 r237 都没有把 incumbent 再明显压低，继续在同一 family 上做 K 或阈值细扫的信息增量已经下降。新 family 的改动被严格限制在 `sparsify/`，没有新增 env key，也没有动执行层；它与现有 family 的精确差异不是重命名，而是把固定 `ACTIVE_EXPERTS=2` 的 routed path 改成“高置信 token 只走 1 expert，困难 token 仍走 2 experts”，直接对齐当前高优先级的 `variable-active-experts by difficulty` 方向。主要风险是当前 cost proxy 仍按 worst-case `ACTIVE_EXPERTS=2` 计费，因此这轮若有收益只能来自 exceed 改善而不是被 proxy 直接记到 cost 下降；但这正好让结构判断更干净。如果连这种最小侵入的 variable-active-path 原型都无法在 same-cost K=32 lane 上改善 objective，就可以更明确地下调 Expert-Choice-like 方向的优先级。	/root/sparsify-ascend/research/history/logs/round0238_standard_1775010283.log
r239_1775011671	1775011671	ok	archive	0.16139954328536987	0.187398	0.377398	802816.0	0.19	557056.0	0.13	245760.0	0.06	32	lowrank_expert_jumprelu	1				/root/sparsify-ascend/checkpoints/research_agent/round_0239/round0239_standard_1775011122_dp2_bs1_ga8_ef1_k32_20260401_103848	3cab70b56dbb88bbca2252e3334ba2e7fb0cac9a			已实际落盘最小新 family `lowrank_expert_jumprelu`，并补齐 whitelist、factory dispatch 与 override wiring。建议以 r235 为 reference，只改 `ARCHITECTURE=lowrank_expert_jumprelu`，做一轮新的 low-rank-trunk 结构 probe；本地 smoke、成本复核和 allowlist 校验均已通过。	这轮没有继续围绕 `expert_jumprelu` 做低信息细扫，而是按当前状态 `consecutive_no_improve=2` 切到新的结构槽位，符合主线策略。选择 `lowrank_expert_jumprelu` 而不是 `lowrank_expert_residual`，因为本地精确成本复核显示前者 combined_accesses=802816、total_cost_ratio=0.19140625，仍在当前优先的 0.14x-0.20x 带；后者会直接到 0.44x，信息密度太低。该 family 与现有实现的精确差异不是重命名：它把 `lowrank_expert_topk` 的 expert-local top-k 支撑换成 `expert_jumprelu` 式平滑门控，从而测试 trunk 是否能让 small-K 路线的 exceed 退化更慢。主要风险也很明确：要在 0.1914x 成本下击败当前 incumbent 0.35449，需要 exceed 压到约 0.1631 以下，这个门槛不低；如果这轮仍做不到，就应快速下调这条 lowrank+JumpReLU 结构线，而不是继续补局部插值。	/root/sparsify-ascend/research/history/logs/round0239_standard_1775011122.log
r240_1775012556	1775012556	ok	discard	0.2754603326320648	0.297997	0.437997	571392.0	0.14	407552.0	0.1	163840.0	0.04	32	hashed_expert_jumprelu	1				/root/sparsify-ascend/checkpoints/research_agent/round_0240/round0240_standard_1775012007_dp2_bs1_ga8_ef1_k32_20260401_105333	b5ec714fc48472595b0dbc50ffb922ddfc04c01b			已实际落盘最小新 family `hashed_expert_jumprelu`，并补齐 whitelist、factory dispatch 与 override wiring。建议以 r235 为 reference，只改 `ARCHITECTURE=hashed_expert_jumprelu`，做一轮 Hash-Layers-inspired 的 matched structure probe；本地 exact smoke、allowlist 校验和成本复核均已通过。	这轮没有继续在 `expert_jumprelu`、`adaptive_active_expert_jumprelu` 或 `lowrank_expert_jumprelu` 上做局部补点，而是按当前 `consecutive_no_improve=3` 切到新的高信息增量结构槽位，符合当前主线策略。之所以选择 `hashed_expert_jumprelu`，是因为它同时满足当前 prompt 的两个高优先级条件：一是直接对应 `Hash Layers` 方向，二是保留 full-dim expert heads 与 JumpReLU local support，只替换 router，因此比 `factorized_expert_topk` 那种同时压缩 scorer 和 local head 的方案更贴近“只缩短/简化 active path 成本”的问题拆解。与 r239 的 `lowrank_expert_jumprelu` 相比，它把 exact total_cost_ratio 从 0.19140625 压到 0.13623046875，释放出约 0.055176 的 objective 空间；要打赢当前 incumbent 只需 exceed 不高于约 0.21826，这个门槛明显比 lowrank 线现实。主要风险是固定哈希路由可能破坏 expert 选择质量；但如果连这种低成本、full-head、same-K 的 hash-router 变体都守不住 objective，就可以更果断地下调 Hash-Layers-like 路线优先级。	/root/sparsify-ascend/research/history/logs/round0240_standard_1775012007.log
r241_1775012910	1775012910	crash	crash				580608.0	0.14	416768.0	0.1	163840.0	0.04	32	product_key_expert_jumprelu	1				/root/sparsify-ascend/checkpoints/research_agent/round_0241/round0241_standard_1775012876_dp2_bs1_ga8_ef1_k32_20260401_110802	551dc6190ec01eb6e5c93031c767d626dc3d6513			已落盘并自检新的 `product_key_expert_jumprelu` 原型。建议以 r235 为 reference，只改 `ARCHITECTURE=product_key_expert_jumprelu`，做一轮 PKM-style matched architecture probe，直接判断 compositional coarse-to-fine expert routing 能否在 0.1384x 的更低总成本下保住足够的 exceed 表现。 [MISSING OBJECTIVE METRIC]	这轮满足单变量原则：运行动作相对 r235 只改 `ARCHITECTURE`。之所以值得做代码原型而不是继续在 `expert_jumprelu` 上微调，是因为 current-target 上现有 matched K=32 probes 已基本把 shared/coarse、factorized-router、hash-router、lowrank-trunk 等相邻结构槽位裁了一遍，而 PKM-style compositional routing 仍是 prompt 明确点名、且与已有 family 不同的新槽位。代码改动保持在最小范围，没有引入新 env key；新增 family 复用了已有 `NUM_EXPERTS/ACTIVE_EXPERTS/LATENTS_PER_EXPERT/JUMPRELU_*` 语义，并完成 whitelist、dispatch、allowlist、smoke 的闭环。主要风险是 product-key 的可分解 expert logits 仍可能像 hash/factorized router 一样伤害选择质量；但这正是当前最值得被干净回答的问题。	/root/sparsify-ascend/research/history/logs/round0241_standard_1775012876.log
r242_1775013596	1775013596	ok	keep	0.17636975646018982	0.200232	0.340232	580608.0	0.14	416768.0	0.1	163840.0	0.04	32	product_key_expert_jumprelu	1				/root/sparsify-ascend/checkpoints/research_agent/round_0242/round0242_standard_1775013042_dp2_bs1_ga8_ef1_k32_20260401_111048	54f895389fd16bcdb43be4cdd68f51fe8e07392f			建议先用已修复的 `product_key_expert_jumprelu` 重新执行同一轮 matched architecture probe。r241 的 crash 来自 DDP 设备放置 bug，不是结构结论；现在 blocker 已被最小化修复并通过了精确架构与 DDP 本地 smoke。	这轮优先修 blocker 而不是再开新 architecture slot，符合当前运行时优先级。虽然 Round 242 的模式是 matched architecture probe，但 r241 的 probe 事实上无效，因为它在 DDP 初始化阶段就崩了；若不先修复，就会把实现问题误判成结构负信号。修复范围严格限制在 `sparsify/` 单文件，没有新增 tunable，也没有改变训练语义。运行动作仍然满足 matched-probe 约束：相对 r235 只改 `ARCHITECTURE`，保持 K、EF、OPTIMIZER、LR 与主要 recipe 不变。	/root/sparsify-ascend/research/history/logs/round0242_standard_1775013042.log
r243_1775014254	1775014254	ok	keep	0.16264957189559937	0.186960	0.34696	662528.0	0.16	416768.0	0.1	245760.0	0.06	48	product_key_expert_jumprelu	1				/root/sparsify-ascend/checkpoints/research_agent/round_0243/round0243_standard_1775013701_dp2_bs1_ga8_ef1_k48_20260401_112147	9499b83fe109164bbca2b67dd608ecdcb55af153			建议以 r242 为 reference，只改 `K=48`。这是对当前新主线 `product_key_expert_jumprelu` 的单变量 deploy-knee probe，目的是判断它是否不仅能把 cost 压低，还能把省下来的成本重新投入 lookup 后进一步压低 exceed，从而继续降低 objective。	这轮继续留在同一 family 不是低信息量微调，而是对刚形成的新最优结构点做一次非常明确的 knee 测试。r242 已经证明 `product_key_expert_jumprelu` 不是一次性偶然点，因为它在更低 cost 下真实刷新了 objective；当前最需要回答的问题不再是“这个结构值不值得测”，而是“它的优势是否只来自更轻 router，还是还能把省下来的成本有效换成更低 exceed”。相对 r242 只改 `K`，归因清晰，且不会引入新的接线风险。主要风险也很清楚：`K=32->48` 需要约 0.0195 的 exceed 改善才能继续刷新当前 best objective，这个门槛不低；但如果这一步都换不回收益，就能更有把握地结束这条 family 的 deploy-side 扫描。	/root/sparsify-ascend/research/history/logs/round0243_standard_1775013701.log
r244_1775014718	1775014718	ok	keep	0.27498143911361694	0.295356	0.38535600000000003	384000.0	0.09	220160.0	0.05	163840.0	0.04	32	product_key_expert_jumprelu	1				/root/sparsify-ascend/checkpoints/research_agent/round_0244/round0244_standard_1775014346_dp2_bs1_ga8_ef1_k32_20260401_113232	b303a7f8ed3b2d498439475fde401c17d1adbf28			建议以 r242 为 reference，只改 `ACTIVE_EXPERTS=1`。这是对当前新主线 `product_key_expert_jumprelu` 的单变量 short-active-path probe，用来判断 product-key 路由是否强到足以在更低总成本下仍维持可竞争的 exceed，从而继续降低 objective。	这轮继续留在同一 family 仍然符合主线推进要求，因为这里存在一个尚未验证、且信息增量明显高于继续扫 `K` 的 family 内核心假设：`product_key_expert_jumprelu` 是否能把 active path 从 2 个 experts 压到 1 个而不丢掉太多 exceed。r243 已经基本结束了继续向右加 deploy budget 的必要性，因此此时切到 `ACTIVE_EXPERTS` 轴比再做 `K=64` 更清晰、更符合 prompt 中“very short active path”和“小 K lane”优先级。相对 r242 只改一个 env 参数，归因干净，没有新增接线风险。主要风险是单 expert path 会让 exceed 回弹明显；但由于成本下降空间很大，这一轮即使失败也能高质量裁决这条新主线到底是靠路由质量还是靠双 expert 容量在工作。	/root/sparsify-ascend/research/history/logs/round0244_standard_1775014346.log
r245_1775015632	1775015632	ok	keep	0.16149239242076874	0.182771	0.32277100000000003	589824.0	0.14	425984.0	0.1	163840.0	0.04	32	product_key_expert_jumprelu	1				/root/sparsify-ascend/checkpoints/research_agent/round_0245/round0245_standard_1775014808_dp2_bs1_ga8_ef1_k32_20260401_114015	27da1267871a382a6fec1cf10aa510fbef20dbfd			建议以 r242 为 reference，只改 `NUM_EXPERTS=256`。这是对当前 `product_key_expert_jumprelu` 主线的单变量容量 probe，目的是验证 PKM-style 路由是否真能在几乎不增加总成本的前提下，通过更大的静态 expert bank 进一步压低 exceed 并继续降低 objective。	这轮继续留在同一 family 不是低信息量细扫，而是对 `product_key_expert_jumprelu` 最关键、且尚未被回答的结构命题做一次单变量容量验证。r243 和 r244 已经把最直接的局部轴 `K` 与 `ACTIVE_EXPERTS` 裁掉了；如果此时立刻再换结构槽位，会留下一个和 PKM 本意直接相关的空白：它是否真的能用近乎常数成本扩大全局静态子库容量。相对 r242 只改 `NUM_EXPERTS`，归因清晰，且成本几乎不变，因此能比再扫别的局部轴更干净地判断这条新主线的可延展性。主要风险是更大总 bank 依然不能有效降低 exceed；但如果结果如此，就可以更果断地结束这条容量支线，而不是继续消耗预算在同 family 上。	/root/sparsify-ascend/research/history/logs/round0245_standard_1775014808.log
r246_1775016829	1775016829	ok	keep	0.1560433954000473	0.174390	0.31439	604160.0	0.14	440320.0	0.1	163840.0	0.04	32	product_key_expert_jumprelu	1				/root/sparsify-ascend/checkpoints/research_agent/round_0246/round0246_standard_1775015795_dp2_bs1_ga8_ef1_k32_20260401_115642	661f1b4d8b83b1a30d48e4e9bd4e6d8c195942a2			建议以 r245 为 reference，只改 `NUM_EXPERTS=512`。这是对当前最强兼容主线 `product_key_expert_jumprelu` 的单变量容量延展 probe，用来判断更大的静态 expert bank 能否在近乎常数成本下继续压低 exceed 并进一步降低 objective。	继续留在同一 family 这次是有明确依据的：r245 不是小数点级微调，而是一次显著正信号，且其训练曲线仍在改善，说明 PKM-style 路由的核心容量命题尚未被验证完。相对 r245 只改 `NUM_EXPERTS`，归因最干净，也比重新打开 `K` 轴更符合已有证据。主要风险是容量收益开始递减，导致 exceed 改善不足以覆盖新增的 `0.003418x` 成本；如果结果如此，就应停止继续上探 bank 大小，而不是在这条轴上继续消耗轮次。	/root/sparsify-ascend/research/history/logs/round0246_standard_1775015795.log
r247_1775017837	1775017837	ok	keep	0.1605985164642334	0.179230	0.30923	538624.0	0.13	374784.0	0.09	163840.0	0.04	32	product_key_expert_jumprelu	1				/root/sparsify-ascend/checkpoints/research_agent/round_0247/round0247_standard_1775016982_dp2_bs1_ga8_ef1_k32_20260401_121629	3aa25bde9aa91e5137df08d5a2c0b98ad558f012			建议以 r246 为 reference，只改 `LATENTS_PER_EXPERT=160`。这是对当前最强兼容主线 `product_key_expert_jumprelu` 的单变量 micro-expert width knee probe，目标是在保持 small-K 与短 active path 不变的前提下，进一步压低总成本并尽量守住 exceed。	这轮继续留在同一 family 是有充分依据的，不违背“最近 2 轮未明显改进才切结构”的策略：r245 和 r246 都是真正的 objective 刷新，而且 improvement 主要来自 prompt 明确鼓励验证的 PKM/compositional-capacity 命题。相对 r246 只改 `LATENTS_PER_EXPERT`，比继续加 `NUM_EXPERTS=1024`、重新打开 `K=48`、或把 latent 加宽到 `224` 都更像当前的高价值 knee，因为它的新增 cost 最低且容错最大。主要风险是单个 expert 过窄后 exceed 回弹过多；但由于该点的成本窗口足够大，即使 exceed 略有恶化仍可能继续降低 objective，因此它比继续右移 deploy 成本或继续堆 bank 容量更适合本轮。	/root/sparsify-ascend/research/history/logs/round0247_standard_1775016982.log
