experiment_id	timestamp	status	decision	val_fvu	exceed_alpha_0_50	objective_score	total_cost	total_cost_ratio	selection_cost	selection_cost_ratio	deployment_accesses	deployment_ratio	k	architecture	expansion_factor	wall_time_sec	peak_memory_gb	total_tokens	checkpoint	head_commit	head_branch	workspace_dirty	description	self_review	log_path
r127_1774834186	1774834186	ok	discard	0.22480779886245728	0.27077382802963257	0.5507738280296326	1179648.0	0.28	524288.0	0.12	655360.0	0.16	128	shared_routed_factorized_expert_topk	1				/root/sparsify-ascend/checkpoints/research_agent/round_0127/round0127_standard_1774833792_dp2_bs1_ga8_ef1_k128_20260330_092318	3ebb6b42987441ba9d13373ca8ce6cb5ea3684cd			已实际落盘新的 `shared_routed_factorized_expert_topk` 最小原型，并完成 instantiate/forward/backward 本地 smoke。以 r108 为 matched reference，只把 `ARCHITECTURE` 切到这个新 family，直接验证“异构 shared+routed MoE + shared low-rank basis + expert-local top-k”是否值得继续。	这轮不再把主要预算投入到现有 `lowrank_expert_*` 或 `shared_routed_expert_topk` 的局部扫参，符合当前额外提示。代码改动限制在 `sparsify/`，没有新增 env key，也没有改执行层；新 family 复用现有 `NUM_EXPERTS / ACTIVE_EXPERTS / LATENTS_PER_EXPERT / FACTORIZED_HIDDEN_DIM` 语义。为降低工程风险，我只实现最小注册链与前向/反向路径，并用 `architecture=shared_routed_factorized_expert_topk, K=128, NUM_EXPERTS=64, ACTIVE_EXPERTS=2, LATENTS_PER_EXPERT=320, FACTORIZED_HIDDEN_DIM=256` 完成了本地 instantiate/forward/backward smoke。主要风险是该 family 虽然 scorer 更轻，但 shared low-rank basis 可能削弱 shared+routed 的表达能力；不过这正是当前最需要回答的新结构问题。	/root/sparsify-ascend/research/history/logs/round0127_standard_1774833792.log
r128_1774834662	1774834662	ok	discard	0.22480779886245728	0.27077382802963257	0.5507738280296326	1179648.0	0.28	524288.0	0.12	655360.0	0.16	128	shared_routed_factorized_expert_topk	1				/root/sparsify-ascend/checkpoints/research_agent/round_0128/round0128_standard_1774834298_dp2_bs1_ga8_ef1_k128_20260330_093144	ccbcc6eb92b69bc663b8407be38c57c97e11db41			先不给新 family做局部扫参，直接做首轮 matched architecture swap。以 r108 为 reference，只把 `ARCHITECTURE` 切到刚集成并已 smoke 通过的 `shared_routed_factorized_expert_topk`，验证这条异构 MoE + shared low-rank basis 新结构是否值得继续。	满足单轮单变量约束：相对 r108 只改 `ARCHITECTURE`。这轮不再继续沿 `lowrank_expert_residual` 或 `shared_routed_expert_topk` 做局部邻域延长，符合当前运行时优先级；也不新增 env key，因此无需改 `research/AutoResearch/` 或 `scripts/`。选择 r108 而不是更近的 r121-r123，是因为 r108 提供了当前新 family 最干净的 matched shared+routed recipe，且 `LATENTS_PER_EXPERT=320, K=128, ACTIVE_EXPERTS=2` 已被证明是可行的强基线。主要风险是 `FACTORIZED_HIDDEN_DIM=256` 的 shared basis 可能损失过多表达能力；但这正是当前最需要的新结构证据。	/root/sparsify-ascend/research/history/logs/round0128_standard_1774834298.log
r129_1774836122	1774836122	ok	discard	0.1219072937965393	0.1497722566127777	0.5497722566127777	1671168.0	0.4	1015808.0	0.24	655360.0	0.16	128	shared_lowrank_routed_expert_topk	1				/root/sparsify-ascend/checkpoints/research_agent/round_0129/round0129_standard_1774835337_dp2_bs1_ga8_ef1_k128_20260330_094904	b609c5eb168a0ba6564bb95c94eb59d7f0eaae9b			已实际落盘新 family `shared_lowrank_routed_expert_topk`：shared 分支保留低秩 scorer，routed experts 改回 full-dim local heads，用来做对 r127-r128 的最小结构修正。建议本轮以 r128 为 reference，只改 `ARCHITECTURE=shared_lowrank_routed_expert_topk`，用同配方直接判断当前 shared+routed 负信号是否主要来自过度 factorize routed experts。	满足单轮单变量约束：计划运行时相对 r128 只改 `ARCHITECTURE`。这轮不是回到旧 family 的局部扫参，而是落一个最小新原型，直接隔离“shared+routed 失败是否来自把 routed heads 也 factorize”这个高信息量结构问题。按 `sae-architecture-integration` 检查，whitelist、factory dispatch、具体类实现和 exact architecture smoke 都已完成；主要风险是 routed full heads 会把行为拉回接近 `shared_routed_expert_topk` 而缺乏新的 Pareto 价值，但这本身也是清晰结论。	/root/sparsify-ascend/research/history/logs/round0129_standard_1774835337.log
r130_1774841336	1774841336	ok	discard	0.2266390025615692	0.28864893317222595	0.608648933172226	1343488.0	0.32	688128.0	0.16	655360.0	0.16	128	shared_lowrank_routed_expert_topk	1				/root/sparsify-ascend/checkpoints/research_agent/round_0130/round0130_standard_1774840821_dp2_bs1_ga8_ef1_k128_20260330_112028	bacb99fd20316ec17eebd26696583eb22ef72ff7			已落盘修复 `shared_lowrank_routed_expert_topk` 的 override 接线，使这条新异构 MoE family 可以继续做合法的单变量 param-only 探针。建议本轮以 r129 为 reference，只改 `ACTIVE_EXPERTS=1`，用一次 matched-cost 低开销实验直接检验“shared low-rank basis + 单 routed expert local top-k”是否能把该 family 推进到新的 <0.3x Pareto 段。	这轮先消除真实 blocker：r129 之后该新 family 虽已可训练，但 AutoResearch 没把它接到 expert/factorized override allowlist，导致后续单变量结构 probe 无法合法发起。真实落盘改动只在 `research/AutoResearch/override_registry.py`，不改 trainer/eval 语义；计划运行时相对 r129 仍只改 1 个 env 参数 `ACTIVE_EXPERTS=1`。风险是单 expert 路由可能让 FVU 回退到被现有 0.30x-0.34x anchor 支配；但这正是当前低开销阶段最需要回答的结构问题。	/root/sparsify-ascend/research/history/logs/round0130_standard_1774840821.log
r131_1774842100	1774842100	ok	discard	0.16397228837013245	0.20437955856323242	0.5243795585632325	1335296.0	0.32	475136.0	0.11	860160.0	0.21	128	lowrank_expert_topk	1				/root/sparsify-ascend/checkpoints/research_agent/round_0131/round0131_standard_1774841615_dp2_bs1_ga8_ef1_k128_20260330_113342	f334a5c757a0ace525441a19d1006d79f7e93e63			Round 131 不继续在 `shared_lowrank_routed_expert_topk` 上做第三个非支配失败后的局部 probe，而是做一次 matched-cost 结构切换。建议以 r130 为 reference，只改 `ARCHITECTURE=lowrank_expert_topk`，在近同样的 <0.3x 总成本下直接比较“shared low-rank + routed expert”与“low-rank trunk + single expert”谁更值得继续。	满足单轮单变量约束：相对 r130 只改 `ARCHITECTURE`。这不是回到 `lowrank_expert_*` 做局部扫参，而是基于 r129-r130 已给出的 shared-lowrank+routed 负信号，切到另一条高优先级未充分验证结构 `lowrank + expert` 做一次 matched-cost 架构对照；信息增量高于继续在 `shared_lowrank_routed_expert_topk` 上压 `FACTORIZED_HIDDEN_DIM`。主要风险是 `lowrank_expert_topk` 在当前 target 也可能继续给出负结果；但那会把“<0.3x 带里单-expert lowrank+expert 是否值得继续”这个问题回答得更清楚。	/root/sparsify-ascend/research/history/logs/round0131_standard_1774841615.log
r132_1774842807	1774842807	ok	discard	0.14350610971450806	0.1856609284877777	0.6856609284877777	2097152.0	0.5	1441792.0	0.34	655360.0	0.16	128	two_stage_residual_expert	1				/root/sparsify-ascend/checkpoints/research_agent/round_0132/round0132_standard_1774842233_dp2_bs1_ga8_ef1_k128_20260330_114359	60461afd86742f72c9d81cc458ee194f40a2004e			Round 132 建议做一次高信息量的 matched-architecture probe，而不是继续沿 `lowrank_expert_*` 微调。以 r131 为 reference，只改 `ARCHITECTURE=two_stage_residual_expert`，用同一训练配方直接测试 trunk-free staged residual 结构能否在当前低到中成本带形成新的 Pareto 段。	满足单轮单变量约束：相对 r131 只改 `ARCHITECTURE`。这轮没有继续在 `lowrank_expert_*` 上打磨内部旋钮，而是切到另一个高优先级未充分验证结构槽位 `two-stage residual expert`，更符合当前“结构扩展优先”的阶段目标。主要风险是该 matched recipe 的总成本约 0.47x，高于 r131 的 0.28x；但它仍在当前重点关注的 <0.5x 带内，而且能更直接回答 staged residual 是否值得继续。	/root/sparsify-ascend/research/history/logs/round0132_standard_1774842233.log
r133_1774843274	1774843274	ok	discard	0.2984656095504761	0.35294923186302185	0.5929492318630218	1015808.0	0.24	360448.0	0.09	655360.0	0.16	128	factorized_expert_topk	1				/root/sparsify-ascend/checkpoints/research_agent/round_0133/round0133_standard_1774842940_dp2_bs1_ga8_ef1_k128_20260330_115546	e5d1aad3714f4364d265ad0dbbf18336f38f6451			Round 133 应优先切到新的结构假设，而不是继续打磨最近两条已连续失利的 family。建议以 r132 为 reference，只改 `ARCHITECTURE=factorized_expert_topk`，在约 0.21x 的更低总成本下直接检验“expert 内部 low-rank head + local top-k”是否能形成新的低成本结构前沿。	满足单轮单变量约束：相对 r132 只改 `ARCHITECTURE`。当前 `lowrank_expert_topk` 与 `two_stage_residual_expert` 已连续给出非支配失败，继续在这两条线上调内部旋钮的信息增量不高；切到 `factorized_expert_topk` 更符合当前“结构扩展优先”和 prompt 对 expert-internal low-rank 的明确指向。主要风险是该 family 历史上有弱信号，但那是旧轮次弱先验；本轮在当前 target 上用 matched recipe 重验，结论会更干净。	/root/sparsify-ascend/research/history/logs/round0133_standard_1774842940.log
r134_1774844232	1774844232	ok	discard	0.12481768429279327	0.15314814448356628	0.5331481444835663	1581056.0	0.38	925696.0	0.22	655360.0	0.16	128	shared_lowrank_routed_expert_topk	1				/root/sparsify-ascend/checkpoints/research_agent/round_0134/round0134_standard_1774843447_dp2_bs1_ga8_ef1_k128_20260330_120414	5d384af13e20eb72142314e67ea3a062a75d0ea8			Round 134 建议回到当前最值得补信息的 hetero MoE 线，而不是继续在最近连续失败的 family 上切新架构。以 r129 为 reference，只改 `FACTORIZED_HIDDEN_DIM=192`，用一次 matched-cost 压缩直接测试 `shared_lowrank_routed_expert_topk` 是否能通过更窄 shared scorer 形成新的低成本结构锚点。	满足单轮单变量约束：相对 r129 只改 `FACTORIZED_HIDDEN_DIM`。这轮不是回到 `shared_routed_expert_topk` 或 `lowrank_expert_*` 做旧 family 局部扫参，而是沿当前最有结构信息价值的 hetero MoE 原型 `shared_lowrank_routed_expert_topk` 做一次定向低秩压缩，直接回应 prompt 对“shared low-rank basis + expert-specific head / local top-k”方向的优先级。主要风险是该 family 在 r129 已接近但未进入 frontier，192 可能仍被现有 0.32x-0.37x 点支配；但这是当前最清晰的一次单变量结构压缩对照。	/root/sparsify-ascend/research/history/logs/round0134_standard_1774843447.log
r135_1774845143	1774845143	ok	discard	0.13039079308509827	0.16057029366493225	0.5205702936649322	1490944.0	0.36	835584.0	0.2	655360.0	0.16	128	shared_lowrank_routed_expert_topk	1				/root/sparsify-ascend/checkpoints/research_agent/round_0135/round0135_standard_1774844358_dp2_bs1_ga8_ef1_k128_20260330_121925	13a8402bc68831697ff17d814aac6f0c8daafc4f			Round 135 继续沿当前最有希望的 hetero MoE 线做一次更激进但仍清晰的单变量低秩压缩。以 r134 为 reference，只改 `FACTORIZED_HIDDEN_DIM=128`，直接测试 `shared_lowrank_routed_expert_topk` 能否在约 0.32x 总成本下维持接近当前最强低成本结构点的质量。	满足单轮单变量约束：相对 r134 只改 `FACTORIZED_HIDDEN_DIM`。r134 已证明这条 `shared_lowrank_routed_expert_topk` 线在 0.35x 仍保持接近 r129 的质量，继续把 shared scorer 从 192 压到 128 是当前信息增量最高、且仍符合“进一步稀疏化 + 进一步低秩化”指引的动作。主要风险是该点会被现有 0.30x-0.35x anchor 支配；但这正是本轮要确认的压缩边界。	/root/sparsify-ascend/research/history/logs/round0135_standard_1774844358.log
r136_1774845689	1774845689	ok	discard	0.2147471308708191	0.25298047065734863	0.6929804706573486	1835008.0	0.44	1179648.0	0.28	655360.0	0.16	128	expert_topk	1				/root/sparsify-ascend/checkpoints/research_agent/round_0136/round0136_standard_1774845533_dp2_bs1_ga8_ef1_k128_20260330_123900	e6fbff358457ce299ca70692d5853a814747c4dc			相对 r25 的完整配置，本轮只改一个 env 参数：`NUM_EXPERTS=128`。保持 `ARCHITECTURE=expert_topk`、`K=128`、`EXPANSION_FACTOR=1`、`OPTIMIZER=adam`、`LR=8e-4` 与其余训练配方不变，做 routed-only 容量重验证。按当前 `expert_topk` 默认 expert layout，这会从默认 4-expert base 模式切到显式 sparse-capacity 模式，而 `ACTIVE_EXPERTS` 仍默认 1；，基于当前成本口径复核，该配置仍位于预期成本带内并满足预算约束。	这轮满足单轮单变量约束：相对 r25 只改 `NUM_EXPERTS`。它不是继续细扫旧 family 的 K 轴，而是在当前 target 上做一次更有信息量的 routed-only matched-cost 结构对照，直接比较“纯 routed 子库”与当前 shared+routed 低成本前沿点谁更值得保留。主要风险是默认 `LATENTS_PER_EXPERT` 会随显式 `NUM_EXPERTS` 切换到更宽的 sparse-capacity 模式，使 selection 成本升到约 0.28x；但这正是本轮要验证的内容，因为如果同成本下 routed-only 仍明显落后，就可以更有把握地下调这条线的优先级。	/root/sparsify-ascend/research/history/logs/round0136_standard_1774845533.log
r137_1774846552	1774846552	ok	discard	0.16879674792289734	0.2063656449317932	0.47636564493179323	1114112.0	0.27	458752.0	0.11	655360.0	0.16	128	expert_topk	1				/root/sparsify-ascend/checkpoints/research_agent/round_0137/round0137_standard_1774845948_dp2_bs1_ga8_ef1_k128_20260330_124554	ebdee5ef2bdf40116e833aa1858027ddfd3a0ef8			相对 r136 的完整配置，本轮只改一个 env 参数：`LATENTS_PER_EXPERT=320`。保持 `ARCHITECTURE=expert_topk`、`K=128`、`NUM_EXPERTS=128`、`EXPANSION_FACTOR=1`、`OPTIMIZER=adam`、`LR=8e-4` 与其余训练配方不变，直接检验 r136 的负结果是否主要由默认 per-expert width 过宽造成。按，基于当前成本口径复核，该配置仍位于预期成本带内并满足预算约束。	这轮满足单轮单变量约束：相对 r136 只改 `LATENTS_PER_EXPERT`。它不是继续扫 `K`，也不是回到 `shared_routed_expert_topk` 或 `lowrank_expert_*` 的旧主线，而是对 r136 这个 routed-only 结构做一次关键的 budget reallocation 修正：让 expert 真正变小，看看当前负信号究竟来自结构本身，还是来自过宽 expert 导致的成本/吞吐失衡。主要风险是缩小 per-expert width 后容量不足，FVU 仍可能明显差于当前 low-cost frontier；但如果连这种更符合策略约束的轻量版本也不成立，就可以更干净地把 routed-only 大容量线降级。	/root/sparsify-ascend/research/history/logs/round0137_standard_1774845948.log
r138_1774848090	1774848090	ok	keep	0.09455648809671402	0.1136159598827362	0.7436159598827362	2629632.0	0.63	1974272.0	0.47	655360.0	0.16	128	shared_lowrank_routed_expert_residual	1				/root/sparsify-ascend/checkpoints/research_agent/round_0138/round0138_standard_1774847151_dp2_bs1_ga8_ef1_k128_20260330_130557	bc1ba8ce580d03730d8656005b36ec025992cb31			已在 `sparsify/` 落盘最小新 family `shared_lowrank_routed_expert_residual`：把当前最有希望的 hetero MoE 原型 `shared_lowrank_routed_expert_topk` 接上一段全局 sparse residual cleanup。建议本轮以 r134 为 reference，只改 `ARCHITECTURE=shared_lowrank_routed_expert_residual`，先做一次干净的 matched architecture swap，直接判断“shared low-rank basis + routed experts + residual”是否值得继续。	满足运行时单变量原则：计划运行时相对 r134 只改 `ARCHITECTURE`。这轮不是回到 `shared_routed_expert_topk` 或 `lowrank_expert_*` 的旧 family 局部扫参，而是补齐当前高优先级但尚未实现的“hetero MoE + residual cleanup”最小原型。代码改动严格限制在 `sparsify/`，并已按 `sae-architecture-integration` 完成 whitelist、factory dispatch、concrete class 和 exact architecture smoke。主要风险是 residual encoder 的 1024x1024 选择成本本身就接近 0.25x，可能让该 family 的总成本落在 0.60x 左右却仍拿不到足够 FVU 改善；但这正是当前最需要的新结构证据。	/root/sparsify-ascend/research/history/logs/round0138_standard_1774847151.log
r139_1774849644	1774849644	ok	discard	0.1511169672012329	0.19896969199180603	0.7489696919918061	2301952.0	0.55	1646592.0	0.39	655360.0	0.16	128	shared_lowrank_routed_expert_residual	1				/root/sparsify-ascend/checkpoints/research_agent/round_0139/round0139_standard_1774849099_dp2_bs1_ga8_ef1_k128_20260330_133826	3d63da114f696586b0d6d830639019e890432993			已实际修复 `shared_lowrank_routed_expert_residual` 的参数接线 blocker，使该新 family 后续可以合法做单变量 param-only 探针。建议本轮以 r138 为 reference，只改 `ACTIVE_EXPERTS=1`，直接测试“shared low-rank basis + 单 routed expert + residual cleanup”能否把这条 hetero MoE 线从约 0.60x 压到约 0.52x total_cost，并保持足够接近 r138 的质量。	先修真实 blocker，再发实验：r138 已证明 `shared_lowrank_routed_expert_residual` 有结构价值，但此前它没有接入 family-specific override allowlist，后续任何合法的单变量 param-only 探针都会在训练前被判为 disallowed。当前已实际补上该 wiring，并做了本地 allowlist 自检。计划运行时相对 r138 只改 1 个 env 参数 `ACTIVE_EXPERTS`，满足单变量原则；风险是第二个 routed expert 仍对当前 target 很关键，导致 FVU 回退，但这会直接回答 residual stage 是否足以支撑更轻的 expert 激活路径。	/root/sparsify-ascend/research/history/logs/round0139_standard_1774849099.log
r140_1774850455	1774850455	ok	discard	0.10045520961284637	0.12143895030021667	0.7114389503002166	2486272.0	0.59	1830912.0	0.44	655360.0	0.16	128	shared_lowrank_routed_expert_residual	1				/root/sparsify-ascend/checkpoints/research_agent/round_0140/round0140_standard_1774849791_dp2_bs1_ga8_ef1_k128_20260330_134957	744827a2bcc04cb0b6373195e793e91de44af114			建议以 r138 为 reference，只改 `LATENTS_PER_EXPERT=256`。这是一轮针对 `shared_lowrank_routed_expert_residual` 的 matched-cost expert 缩容探针：保持双 routed expert 不变，直接回答“更小 expert 子库 + residual cleanup”能否在约 0.56x total_cost 下保住 r138 的大部分质量。	这轮满足单轮单变量约束：相对 r138 只改 `LATENTS_PER_EXPERT`。r139 已经把“减少 active experts”这条低成本方向回答得很清楚，再继续在 `ACTIVE_EXPERTS` 上打磨信息增量不高；改为缩小 per-expert 子库更符合当前阶段对“expert 更小、router 仍轻、总激活路径不膨胀”的要求，也比回到 `shared_routed_expert_topk` 或 `lowrank_expert_*` 做旧 family 局部扫参更贴合当前 hetero MoE 议程。主要风险是 expert 子库一旦缩小，质量仍可能快速回退；但这正是当前最需要确认的结构边界。	/root/sparsify-ascend/research/history/logs/round0140_standard_1774849791.log
r141_1774851150	1774851150	ok	discard	0.14034616947174072	0.17229697108268738	0.5022969710826874	1368064.0	0.33	794624.0	0.19	573440.0	0.14	112	shared_lowrank_routed_expert_topk	1				/root/sparsify-ascend/checkpoints/research_agent/round_0141/round0141_standard_1774850576_dp2_bs1_ga8_ef1_k112_20260330_140302	9367f472170fcd8fc3144c2fd2284499666a3fc7			建议以 r123 为 reference，只改 `ARCHITECTURE=shared_lowrank_routed_expert_topk`。这是一轮面向低成本前沿的 matched-cost 结构对照，用当前最相关的 low-cost anchor 直接回答“shared low-rank basis + expert-specific local top-k”是否值得继续，而不是继续在最近连续失利的 residual 变体上做局部压缩。	这轮满足单轮单变量约束：相对 r123 只改 `ARCHITECTURE`。在 `shared_lowrank_routed_expert_residual` 已连续两轮未形成新非支配点后，继续沿同一 family 做 `FACTORIZED_HIDDEN_DIM` 或 `K` 的局部扫参信息增量偏低；切回 `shared_lowrank_routed_expert_topk` 做 matched-cost architecture swap，更符合当前“结构扩展优先”和对 hetero MoE 的明确优先级。主要风险是该 family 先前在更高容量配方下已有负信号；但当前这次是更低成本、与 low-cost anchor 严格对照的重验，结论会更清晰。	/root/sparsify-ascend/research/history/logs/round0141_standard_1774850576.log
r142_1774851648	1774851648	ok	discard	0.25618457794189453	0.303800106048584	0.543800106048584	1024000.0	0.24	450560.0	0.11	573440.0	0.14	112	shared_routed_factorized_expert_topk	1				/root/sparsify-ascend/checkpoints/research_agent/round_0142/round0142_standard_1774851284_dp2_bs1_ga8_ef1_k112_20260330_141451	22c62c1f3dc7430d6808298ccaaa37bbbea1b967			建议以 r123 为 reference，只改 `ARCHITECTURE=shared_routed_factorized_expert_topk`。这是一轮低成本异构 MoE 结构重验：直接测试“shared+routed + expert 内部低秩 scorer”能否在约 0.22x total_cost 下提供比当前 low-cost frontier 更有价值的新段。	这轮满足单轮单变量约束：相对 r123 只改 `ARCHITECTURE`。在 `shared_lowrank_routed_expert_residual` 连续两轮非支配失败、`shared_lowrank_routed_expert_topk` 也已给出新的负信号后，继续沿同一 family 做局部压缩信息增量偏低；切到 `shared_routed_factorized_expert_topk` 更符合当前对异构 MoE 与 expert-internal low-rank 的优先级，也能在更低的 0.22x 成本带补一段此前仍欠清晰的结构证据。主要风险是该 family 在旧轮次已有弱负信号，但当前这次是与 r123 严格 matched-cost 的 fresh validation，结论更有解释力。	/root/sparsify-ascend/research/history/logs/round0142_standard_1774851284.log
r143_1774852422	1774852422	ok	archive	0.1273151934146881	0.15536633133888245	0.48536633133888246	1384448.0	0.33	606208.0	0.14	778240.0	0.19	112	lowrank_expert_topk	1				/root/sparsify-ascend/checkpoints/research_agent/round_0143/round0143_standard_1774851848_dp2_bs1_ga8_ef1_k112_20260330_142414	d91aaaefa6095f473c59d78be63f055e17643789			建议以 r123 为 reference，只改 `ARCHITECTURE=lowrank_expert_topk`。这是一轮低成本 matched-cost 结构对照，用当前最相关的 shared+routed anchor 直接回答“low-rank trunk + dual expert routing”是否能在约 0.29x total_cost 下形成新的 Pareto 段。	这轮满足单轮单变量约束：相对 r123 只改 `ARCHITECTURE`。在 hetero MoE 的两条无 residual 低秩变体已连续给出负信号后，继续在同一簇 family 上做局部压缩信息增量偏低；切到 `lowrank_expert_topk` 更符合当前阶段对 `lowrank + expert` 这一高优先级结构槽位的补证据需求，也避免重新把预算投入 `shared_routed_expert_topk` 或 `lowrank_expert_*` 的旧式邻域细扫。主要风险是该 family 在 r131 已有一次负结果；但本轮是更低成本、且与 low-cost anchor 严格 matched 的 fresh architecture swap，结论更有归因价值。	/root/sparsify-ascend/research/history/logs/round0143_standard_1774851848.log
r144_1774853274	1774853274	ok	discard	0.13998684287071228	0.17234140634536743	0.5023414063453675	1368064.0	0.33	794624.0	0.19	573440.0	0.14	112	shared_lowrank_two_stage_residual_expert	1				/root/sparsify-ascend/checkpoints/research_agent/round_0144/round0144_standard_1774852670_dp2_bs1_ga8_ef1_k112_20260330_143756	ae34ba31b8c98a59d84d844d74093c869ea18ae5			已实际落盘新 family `shared_lowrank_two_stage_residual_expert`：用 shared low-rank coarse stage 先做第一段重构，再让 expert residual stage 处理剩余结构。建议本轮以 r143 为 reference，只改 `ARCHITECTURE=shared_lowrank_two_stage_residual_expert`，直接测试这条新的两段式 hetero MoE 结构能否在约 0.30x total_cost 下形成新的低成本 Pareto 段。	这轮满足运行时单变量原则：计划运行时相对 r143 只改 `ARCHITECTURE`。在 `lowrank_expert_topk` 刚形成新低成本 anchor 之后，继续在其内部做局部扫参会过早收缩搜索空间；新增一个最小可运行的两段式原型 `shared_lowrank_two_stage_residual_expert`，更符合当前阶段对“shared experts + routed experts / two-stage residual expert”结构槽位的补证据需求。代码改动严格限制在 `sparsify/`，并已完成 whitelist、factory dispatch、concrete class 和 exact architecture smoke。主要风险是用 shared low-rank coarse stage 替代 full lowrank trunk 可能损失一部分全局主干表达，但这正是本轮要验证的结构问题。	/root/sparsify-ascend/research/history/logs/round0144_standard_1774852670.log
r145_1774853804	1774853804	ok	discard	0.19713568687438965	0.24028003215789795	0.520280032157898	1155072.0	0.28	376832.0	0.09	778240.0	0.19	112	lowrank_expert_topk	1				/root/sparsify-ascend/checkpoints/research_agent/round_0145/round0145_standard_1774853379_dp2_bs1_ga8_ef1_k112_20260330_144945	0b9523d8750f7daa484cb6d553d03c86ce975605			建议以 r143 为 reference，只改 `ACTIVE_EXPERTS=1`。这是一轮低成本压缩探针，直接测试 `lowrank_expert_topk` 能否把 active routed path 从双 expert 收缩到单 expert，并在约 0.24x total_cost 下维持足够接近 r143 的质量。	这轮满足单轮单变量约束：相对 r143 只改 `ACTIVE_EXPERTS`。当前阶段要补的是低到中成本带的新结构性前沿，而不是继续扫 K；在 r143 已证明 `lowrank_expert_topk` 有价值后，最直接的高信息量问题就是 low-rank trunk 是否足以支撑把 routed 路径收缩到单 expert。主要风险是单 expert 会明显损失 residual 容量，导致结果回退到当前 0.24x-0.25x anchor 附近；但这正是本轮要回答的核心结构问题。	/root/sparsify-ascend/research/history/logs/round0145_standard_1774853379.log
r146_1774854651	1774854651	ok	keep	0.0875517949461937	0.10278114676475525	0.6827811467647552	2433024.0	0.58	1654784.0	0.39	778240.0	0.19	112	lowrank_expert_residual	1				/root/sparsify-ascend/checkpoints/research_agent/round_0146/round0146_standard_1774853922_dp2_bs1_ga8_ef1_k112_20260330_145848	f227f42ddd3363aba4cc9b325bfc56e86b703cce			建议以 r143 为 reference，只改 `ARCHITECTURE=lowrank_expert_residual`。这是一轮结构扩展对照：在当前已有效的 `lowrank_expert_topk` 低成本配方上加一段全局 residual cleanup，直接测试它能否在约 0.54x total_cost 下形成新的中成本 Pareto 段。	这轮满足单轮单变量约束：相对 r143 只改 `ARCHITECTURE`。r143 提供了新的低成本可行锚点，而 r145 已清楚回答“单 expert 压缩”不可行；继续沿 `lowrank_expert_topk` 做内部扫参的信息增量开始下降。切到 `lowrank_expert_residual` 更符合当前阶段对 `lowrank + expert + residual` 这一高优先级方向的补证据需求，也避免重新把预算投入旧 family 的局部邻域。主要风险是该点落在 >0.5x 带宽，但策略已允许保留少量质量锚点，这轮的价值在于直接回答 residual cleanup 是否值得这部分额外成本。	/root/sparsify-ascend/research/history/logs/round0146_standard_1774853922.log
r147_1774855634	1774855634	ok	discard	0.10375456511974335	0.12598246335983276	0.7059824633598327	2416640.0	0.58	1843200.0	0.44	573440.0	0.14	112	shared_lowrank_routed_expert_residual	1				/root/sparsify-ascend/checkpoints/research_agent/round_0147/round0147_standard_1774855000_dp2_bs1_ga8_ef1_k112_20260330_151646	91aafa6d312cee4917fa93471262be0b931270bb			建议基于 r146 做一次 matched-cost architecture swap：仅设置 ARCHITECTURE=shared_lowrank_routed_expert_residual。它是 LUTurbo 扩展兼容 family，且在当前 K=112/EF=1 recipe 下本地估算总成本约 0.55x，正好回答当前最需要的结构问题：shared low-rank basis + routed expert + residual，是否比 trunk-based lowrank_expert_residual 更能形成新的中成本 Pareto 段。	这轮满足单变量原则：相对 r146 只改 ARCHITECTURE。当前高优先级问题是异构 MoE 的 shared+basis 版本在加入 residual 后是否还能成立；无 residual 的 shared-lowrank 线在 r141/r144 已给出较弱信号，但 shared_lowrank_routed_expert_residual 早先在更高 K/更宽 expert 配方上出现过一次 keep，因此值得在当前更压缩、且与 r146 近同成本的 recipe 上做干净复验。风险是该 family 仍可能被 r146 直接压制；但即使失败，也能更明确地终止一条当前 agenda 中仍悬而未决的 hetero-MoE residual 方向。	/root/sparsify-ascend/research/history/logs/round0147_standard_1774855000.log
