experiment_id	timestamp	status	decision	val_fvu	exceed_alpha_0_50	objective_score	total_cost	total_cost_ratio	selection_cost	selection_cost_ratio	deployment_accesses	deployment_ratio	k	architecture	expansion_factor	wall_time_sec	peak_memory_gb	total_tokens	checkpoint	head_commit	head_branch	workspace_dirty	description	self_review	log_path
r248_1775018816	1775018816	ok	keep	0.1568491905927658	0.175150	0.30515000000000003	557056.0	0.13	393216.0	0.09	163840.0	0.04	32	product_key_expert_jumprelu	1				/root/sparsify-ascend/checkpoints/research_agent/round_0248/round0248_standard_1775017929_dp2_bs1_ga8_ef1_k32_20260401_123216	fd48e4fc8df489060c91aa120842d2e10f8db485			建议以 r247 为 reference，只改 `NUM_EXPERTS=1024`。这是对当前最强兼容主线 `product_key_expert_jumprelu` 的单变量容量延展 probe，目标是在保留 `K=32` 与 `LATENTS_PER_EXPERT=160` 的低成本路径下，用更大的静态 expert bank 进一步压低 exceed，并尝试把 objective 直接推到 0.30 以下。	继续留在同一 family 这次仍有明确的高价值未验证假设，不属于被 prompt 下调优先级的低信息细扫：r245、r246、r247 三轮都是真实 objective 刷新，而且每一步都在回答 PKM/compositional-capacity 这条主线到底能走多远。r247 的 objective 已经降到 0.307648，距离 0.30 只差 0.007648；在这种情况下，最合理的单变量动作不是切到全新结构槽位重置证据，而是做当前 family 最有机会完成临门一脚的容量 probe。相对 r247 只改 `NUM_EXPERTS`，归因非常干净；相比重新打开 `K=48` 或把 `LATENTS_PER_EXPERT` 加回 192，这一步的新增成本更小、所需 exceed 改善门槛也更现实。主要风险是 bank 扩容收益开始递减，导致 exceed 改善不足以覆盖新增的 `0.0043945x` 成本；如果结果如此，就应把当前 PK family 记为接近饱和，并在下一轮优先切回新的 matched-objective architecture probe。	/root/sparsify-ascend/research/history/logs/round0248_standard_1775017929.log
r249_1775020820	1775020820	ok	keep	0.16034911572933197	0.177755	0.297755	491520.0	0.12	327680.0	0.08	163840.0	0.04	32	product_key_expert_jumprelu	1				/root/sparsify-ascend/checkpoints/research_agent/round_0249/round0249_standard_1775019904_dp2_bs1_ga8_ef1_k32_20260401_130511	eee6a771e20395d53a61ea3771427c7b7546c34c			建议以 round 248 为 reference，只改 `LATENTS_PER_EXPERT=128`。这是当前 `product_key_expert_jumprelu` 主线下信息量最高的单变量 knee probe：保持 `K=32 + NUM_EXPERTS=1024` 的大 bank 不变，直接测试更窄的 micro-expert 是否能把 total_cost 从 exact `0.1328125x` 压到 `0.1171875x`，同时把 exceed 维持在约 `0.185` 以下，从而继续刷新当前兼容 objective。	这轮继续留在同一 family 仍然有充分依据，不属于低信息细扫。原因不是沿旧 incumbent 邻域抠千分点，而是当前真正的兼容主线已经在 round 245-248 被 `product_key_expert_jumprelu` 重写，且尚未回答完一个高价值问题：当 product-key bank 已扩到 1024 时，最佳 tradeoff 是继续堆 bank，还是把单 expert width 压窄。相对 r248 只改 `LATENTS_PER_EXPERT`，归因比重新打开 `K` 轴或切新 family 更干净，也正好对应 prompt 里优先吸收的“product-key / compositional routing + tiny micro-experts”方向。主要风险是 r248 的 throughput regression 主要来自 `NUM_EXPERTS=1024` 的 expert-logit 枚举而非 local head 宽度，因此 `LATENTS_PER_EXPERT=128` 可能只能改善 objective，不能完全修复训练吞吐；但即便如此，这一轮也能明确告诉我们当前 PK 主线的真正 width knee 是否已经低于 160。	/root/sparsify-ascend/research/history/logs/round0249_standard_1775019904.log
r250_1775021740	1775021740	ok	keep	0.1657860428094864	0.184330	0.29433	473088.0	0.11	309248.0	0.07	163840.0	0.04	32	product_key_expert_jumprelu	1				/root/sparsify-ascend/checkpoints/research_agent/round_0250/round0250_standard_1775020977_dp2_bs1_ga8_ef1_k32_20260401_132303	8f116b4d8b31625cf92abc96d4f3f35ef0b1a063			建议以 round 249 为 reference，只改 `NUM_EXPERTS=512`。这不是继续在同一轴上细扫，而是对当前 `product_key_expert_jumprelu` 主线做一次 bank-size knee 复核：保持 `K=32 + LATENTS_PER_EXPERT=128` 的低成本 active path 不变，直接判断 1024-bank 是否已经过度配置，还是 512-bank 就能以更低选择成本和更轻延迟负担维持接近的 exceed，从而继续降低 objective。	这轮继续留在同一 family 仍然有充分依据，不属于 prompt 明确下调优先级的低信息细扫。原因不是围绕旧 incumbent 做保守插值，而是当前真实兼容主线已经被 `product_key_expert_jumprelu` 重写，而且 round 249 刚刚把 width knee 推到了 `LATENTS_PER_EXPERT=128`；在这种情况下，最有价值的单变量问题不再是继续沿同一 width 轴往下压，而是判断更大的 compositional bank 是否仍然必要。相对 r249 只改 `NUM_EXPERTS`，归因比重新打开 `K` 轴或直接切新 family 更干净，也更符合 LUTurbo 的真实目标，因为 bank 规模同时影响 router 维度、在线选择成本和训练/推理侧吞吐。主要风险是 `NUM_EXPERTS=1024 -> 512` 会让 exceed 回弹，抵消这次 cost 下降；但 controller 当前记分口径下该点的胜利门槛相当清晰且相对宽松，只要 exceed 不高于约 0.1878 就能继续刷新前沿，因此这一轮能非常高质量地判断当前 PK 主线的 bank-capacity 是否已经过度。	/root/sparsify-ascend/research/history/logs/round0250_standard_1775020977.log
r251_1775022654	1775022654	ok	keep	0.175105020403862	0.193524	0.293524	407552.0	0.1	243712.0	0.06	163840.0	0.04	32	product_key_expert_jumprelu	1				/root/sparsify-ascend/checkpoints/research_agent/round_0251/round0251_standard_1775021981_dp2_bs1_ga8_ef1_k32_20260401_133947	825191378b5f831d599abb72e22c06f646a9b4e2			建议以 r250 为 reference，只改 `LATENTS_PER_EXPERT=96`。这是当前 `product_key_expert_jumprelu` 主线下信息量最高、且最有机会带来 robust objective 改善的单变量 width-knee probe：保持 `K=32 + NUM_EXPERTS=512` 的已验证 bank 容量不变，直接测试更窄 micro-expert 能否把 total_cost 压到 exact `0.09717x` / controller `0.10x`，同时把 exceed 维持在约 `0.1943` 以下，从而继续降低 objective。	这轮继续留在同一 family 仍然有充分依据，不属于低信息细扫。原因不是围绕旧 prompt 里的 `expert_jumprelu` 锚点做保守插值，而是本地 runtime 已经明确把真实兼容主线重写为 `product_key_expert_jumprelu`，且 r245-r250 连续回答了一个高价值结构问题：product-key/compositional routing 是否能在 short active path 下持续把 objective 往左下推。相对 r250 只改 `LATENTS_PER_EXPERT`，归因最干净，也比重新打开 `K` 轴或切新 family 更符合当前证据。之所以优先试 `96` 而不是更保守的 `112`，是因为 r250 在 exact 口径上其实没有击败 r249，说明下一轮更应该追求“即使按 exact 成本也能更稳地变好”的点，而不仅是再赌一次 rounded-cost frontier；`96` 给出更实质的 exact cost 下移，同时仍保留 512-bank 与 active_experts=2 的容量。主要风险是 128 已经接近最小可用 local width，进一步压窄会让 exceed 快速回弹；但当前 controller 门槛与 exact objective 门槛都相对宽松，这一轮足以高质量判断当前 PK 主线的真实 width knee 是否已经低于 128。	/root/sparsify-ascend/research/history/logs/round0251_standard_1775021981.log
r252_1775023165	1775023165	ok	keep	0.18915528059005737	0.209794	0.299794	393216.0	0.09	229376.0	0.05	163840.0	0.04	32	product_key_expert_jumprelu	1				/root/sparsify-ascend/checkpoints/research_agent/round_0252/round0252_standard_1775022762_dp2_bs1_ga8_ef1_k32_20260401_135249	f383069ec06ba29f8ae18c543b65357b239ab397			建议以 r251 为 reference，只改 `NUM_EXPERTS=256`。这是一轮高信息量的 bank-size knee probe：保持已验证的 `K=32 + LATENTS_PER_EXPERT=96 + ACTIVE_EXPERTS=2` 短路径不变，直接判断 512-bank 在当前更窄 micro-expert 配方下是否仍有必要，还是 256-bank 就能以 controller `0.09x` 的更低总成本维持足够低的 exceed，从而继续降低 objective。	这轮继续留在同一 family 仍然有充分依据，不属于 prompt 明确下调优先级的低信息细扫。原因不是围绕旧文本里的 `expert_jumprelu` 锚点做温和插值，而是本地 runtime 已经明确把真实兼容主线重写为 `product_key_expert_jumprelu`，且 r250->r251 刚发生了 controller 与 exact objective 的双重改进；因此当前 family 仍存在一个高价值、未验证、且足以改变结论的主问题：在 `LATENTS_PER_EXPERT=96` 的新 width knee 下，bank 容量是否还能继续左移。相对 r251 只改 `NUM_EXPERTS`，归因比继续扫 `LATENTS_PER_EXPERT=80/112` 更干净，也比重开 `K` 轴更符合现有证据。之所以优先选 `NUM_EXPERTS=256` 而不是 `ACTIVE_EXPERTS=1`，是因为 r244 已经给过固定单 expert path 的强负信号，而当前更值得先确认的是 512-bank 是否已经过配；如果直接同时改 active path 的形态，会把“bank 不需要那么大”和“单 expert 路径是否足够”两个问题混在一起。主要风险是 `512 -> 256` 会让 exceed 回弹，抵消这次 cost 下降；但当前 controller 与 exact objective 的胜利门槛都相对宽松，这一轮足以高质量判定当前 PK 主线的 bank-capacity knee 是否已低于 512。	/root/sparsify-ascend/research/history/logs/round0252_standard_1775022762.log
r253_1775023664	1775023664	ok	archive	0.2854914665222168	0.298063	0.36806300000000003	309248.0	0.07	145408.0	0.03	163840.0	0.04	32	product_key_expert_jumprelu	1				/root/sparsify-ascend/checkpoints/research_agent/round_0253/round0253_standard_1775023295_dp2_bs1_ga8_ef1_k32_20260401_140142	3745c0eec935c6bb98be1b0b7e9ee2dba06ca8c4			建议以 r251 为 reference，只改 `ACTIVE_EXPERTS=1`。这不是继续在线性 bank 或 width 轴上补点，而是一次高信息量的 short-active-path probe：保持 `K=32 + NUM_EXPERTS=512 + LATENTS_PER_EXPERT=96` 的当前最强 PK 配方不变，直接测试更强的 compositional bank 是否能让单 expert 路径在 controller `0.07x` 的更低总成本下仍维持足够低的 exceed，从而继续降低 objective。	这轮继续留在同一 family 仍然有充分依据，但不是低信息细扫。r252 已经把“bank 还能不能继续缩”这个问题回答得很清楚：256-bank 会明显抬高 exceed，因此继续在 `NUM_EXPERTS` 轴上插值的价值开始下降。当前仍未被回答、且与 prompt 高优先级方向直接对齐的 family 内核心假设，是“更强的 product-key / compositional routing 是否已经足以把 active path 压到 1 个 expert”。相对 r251 只改 `ACTIVE_EXPERTS`，归因比再扫 `NUM_EXPERTS=384` 或 `LATENTS_PER_EXPERT=112` 更干净，也比直接切回旧的 `adaptive_active_expert_jumprelu` 更符合当前证据，因为旧的 variable-active probe 建立在明显更弱的非-PK router 上。之所以现在值得重试最短路径，不是忽略 r244 的负例，而是因为当前配置与 r244 的结构条件已实质不同：router 已换成更强的 product-key 组合容量，bank 从 128 提到 512，而 micro-expert width 已降到 96；如果在这种条件下单 expert 路径仍然守不住 objective，就能更有把握地结束 PK family 内的 active-path 收缩，并把下一轮转向新的结构槽位。主要风险是 exceed 仍可能像 r244 那样大幅回弹；但当前 controller 与 exact objective 的胜利门槛都相对宽松，这一轮能非常高质量地判定当前 PK 主线的 shortest-path 极限。	/root/sparsify-ascend/research/history/logs/round0253_standard_1775023295.log
r254_1775024537	1775024537	ok	discard	0.2883221507072449	0.302719	0.39271900000000004	378880.0	0.09	215040.0	0.05	163840.0	0.04	32	hashed_expert_jumprelu	1				/root/sparsify-ascend/checkpoints/research_agent/round_0254/round0254_standard_1775024078_dp2_bs1_ga8_ef1_k32_20260401_141445	559cd23f47fdc7654f00b72314bcde245b8519b1			建议以 r251 为 reference，只改 `ARCHITECTURE=hashed_expert_jumprelu`。这轮不是继续在 PK 家族里做低信息局部扫，而是做一次新的 matched architecture probe：在保持 `K=32 + NUM_EXPERTS=512 + LATENTS_PER_EXPERT=96 + ACTIVE_EXPERTS=2` 不变的前提下，直接检验 fixed-hash routing 能否在 exact `0.09033x` 的更低总成本下维持足够低的 exceed，从而真正挑战当前 `product_key_expert_jumprelu` frontier。	这轮严格满足单变量原则：相对 r251 只改 `ARCHITECTURE`。之所以不继续留在 `product_key_expert_jumprelu` 里补 `NUM_EXPERTS=384` 或类似中间点，是因为 r252/r253 已经把当前 PK 配方最关键的 bank-size knee 和 shortest-path knee 都回答成负信号，继续局部细扫的收益已经下降。之所以不优先切到 `shared_lowrank_routed_expert_topk`，是因为本地成本复核显示它在 r251 这套 matched recipe 下 exact cost 会抬到约 `0.1855x`，要赢 objective 必须把 exceed 压到约 `0.105` 以下，门槛明显过高；相比之下，`hashed_expert_jumprelu` 虽然有 r240 的旧负例，但那一轮建立在 `NUM_EXPERTS=128, LATENTS_PER_EXPERT=192` 的更粗 bank/更宽 local head 条件上，不能替代当前 `512-bank + width96` 碎片化 regime 下的重新验证。主要风险仍然清楚：固定哈希路由可能像 r240 一样显著抬高 exceed；但若它再次失败，就能更有把握地判定当前 frontiers 的关键收益确实来自 learned compositional routing，而不只是“很多小专家 + 很短路径”，从而结束 Hash-Layers 方向在当前 target 上的主线资格。	/root/sparsify-ascend/research/history/logs/round0254_standard_1775024078.log
r255_1775025463	1775025463	ok	discard	0.20795348286628723	0.231494	0.411494	753664.0	0.18	589824.0	0.14	163840.0	0.04	32	factorized_router_expert_topk	1				/root/sparsify-ascend/checkpoints/research_agent/round_0255/round0255_standard_1775024674_dp2_bs1_ga8_ef1_k32_20260401_142440	aedaf8c4128a819ad80d7f909cbdda023d845ca9			建议以 r251 为 reference，只改 `ARCHITECTURE=factorized_router_expert_topk`。这轮继续切新结构槽位，不回到 PK 家族做中间点插值；目标是用一个更便宜但仍是 learned 的 router，干净地区分“product-key 组合路由是否真是当前 frontier 的关键贡献”。	这轮严格满足单变量原则：相对 r251 只改 `ARCHITECTURE`。之所以不回到 `product_key_expert_jumprelu` 上补 `NUM_EXPERTS=384` 或重开 `K=48`，是因为当前 agent 状态已是 `consecutive_no_improve=2`，且 r252/r253/r254 已经把当前主线附近最有价值的 bank、active-path、hash-router 问题都裁过一遍；继续做 family 内插值不符合当前策略。之所以选 `factorized_router_expert_topk` 而不是 `shared_lowrank_routed_expert_topk`，是因为后者在 r251 同 recipe 下 exact cost 约 `0.1855x`，要赢 objective 需要把 exceed 压到约 `0.105` 以下，同时它在当前 target 上已有更强负信号；而 `factorized_router_expert_topk` 虽然也面临很高的 objective 门槛，但它更干净地隔离了“cheap learned router 是否足够”这一问题，并且历史上 r233 至少说明它不是像 hash 那样的灾难性方向。主要风险很明确：在 exact `0.1797x` 成本下，它大概率仍无法把 exceed 压到真正可赢区间；但如果连这条 cheap-router ablation 都守不住，就能更明确地结束‘更轻 scorer/router’作为当前主线解法的资格。	/root/sparsify-ascend/research/history/logs/round0255_standard_1775024674.log
r256_1775026297	1775026297	ok	discard	0.19776225090026855	0.223394	0.41339400000000004	778240.0	0.19	614400.0	0.15	163840.0	0.04	32	shared_lowrank_two_stage_residual_expert	1				/root/sparsify-ascend/checkpoints/research_agent/round_0256/round0256_standard_1775025598_dp2_bs1_ga8_ef1_k32_20260401_144005	be51a469078526bf03f434b7287f2c05da547aec			建议以 r251 为 reference，只改 `ARCHITECTURE=shared_lowrank_two_stage_residual_expert`。这轮不再继续 router-only 或 hash 方向，而是切到更贴近当前策略优先级的 shared/coarse + residual-cleanup 槽位，直接测试 explicit coarse trunk 是否能改善 small-K exceed。	这轮严格满足单变量原则：相对 r251 只改 `ARCHITECTURE`。之所以不回到 `product_key_expert_jumprelu` 上补 `NUM_EXPERTS=384` 或 `LATENTS_PER_EXPERT=112`，是因为当前 agent 状态已是 `consecutive_no_improve=3`，而 r252-r255 已经把当前主线附近最有价值的 bank、active-path、hash-router、cheap-router 问题都裁过一遍；继续在同 family 内补中间点，不符合本轮“优先更高信息增量结构改动”的要求。之所以不选 `shared_routed_expert_topk` 或 `shared_two_stage_residual_expert`，是因为它们在 r251 同 recipe 下 exact cost 约 `0.234375x`，想赢 objective 需要把 exceed 压到约 `0.056` 以下，门槛明显过高；之所以不优先选 `shared_lowrank_routed_expert_topk`，是因为它与本轮目标相比更像 shared+routed 的同层并行变体，而不是显式 residual cleanup。`shared_lowrank_two_stage_residual_expert` 虽然在旧的 128/192 recipe 上已有负信号，但那一轮并不在当前 many-tiny-experts regime 下，且没有经历 r254/r255 这两轮对“router 本身是否关键”的补充裁决。主要风险很明确：在 exact `0.1855x` 成本下，它大概率仍难以把 exceed 压到真正可赢区间；但如果连这条最贴近当前 prompt 主方向的 shared/coarse residual 槽位都守不住，后续就可以更果断地下调这一大类 family 在当前 target 上的优先级。	/root/sparsify-ascend/research/history/logs/round0256_standard_1775025598.log
r257_1775027344	1775027344	ok	archive	0.16268384456634521	0.180935	0.300935	489472.0	0.12	243712.0	0.06	245760.0	0.06	48	product_key_expert_jumprelu	1				/root/sparsify-ascend/checkpoints/research_agent/round_0257/round0257_standard_1775026645_dp2_bs1_ga8_ef1_k48_20260401_145731	8d33f69e34f2f2d2725eb6e2d1099766f1adbf2b			建议以 r251 为 reference，只改 `K=48`。这是对当前真实兼容主线 `product_key_expert_jumprelu` 的单变量 deployment-knee probe：当前 incumbent 明显 exceed-led，且 recent architecture probes 已基本证明问题不在于继续更换 router/coarse family；因此先验证在保持最强 PK recipe 不变时，适度增加 sparse lookup budget 能否把 exceed 压回到新的 objective 低点。	这轮继续留在同一 family 有充分依据，不属于低信息量细扫。最近 4 轮无改进并不意味着必须机械地继续开新 family；更关键的是 recent new-family probes 已经把当前最像样的替代槽位裁过一遍，而且它们在当前 recipe 下的 exact 成本都明显高于 PK 主线，却没有换回足够低的 exceed。相对 r251 只改 `K`，归因非常干净：selection cost 完全不变，只测试 deploy lookup capacity 是否是当前 small-K tradeoff 的主瓶颈。主要风险是 exceed 改善不足 0.0195，导致 objective 仍不如 r251；但即使如此，这一轮也能高质量地回答“当前 winning family 还剩不剩 deploy-knee 空间”，其信息价值高于继续切向又一个更贵的 architecture closure probe。	/root/sparsify-ascend/research/history/logs/round0257_standard_1775026645.log
r258_1775028385	1775028385	ok	discard	0.15895183384418488	0.182863	0.372863	777216.0	0.19	613376.0	0.15	163840.0	0.04	32	shared_product_key_expert_jumprelu	1				/root/sparsify-ascend/checkpoints/research_agent/round_0258/round0258_standard_1775027776_dp2_bs1_ga8_ef1_k32_20260401_151622	685dab7a04d0d572a9b64bc109e00dd71fb80734			已实际新增并注册 `shared_product_key_expert_jumprelu`。建议以 r235 为 reference，只改 `ARCHITECTURE=shared_product_key_expert_jumprelu`，做一轮新的 matched architecture probe，直接判断“shared coarse library + product-key routed micro-experts”这个结构槽位本身是否值得继续。	这轮满足 Round 258 的核心约束：只做 1 个 architecture probe，并且相对 reference 只改 `ARCHITECTURE`。之所以不继续回到 `product_key_expert_jumprelu` 或 `expert_jumprelu` 上补参数点，是因为 round257 已经说明 `K=48` 这种同 family deploy-knee 延伸没有把 objective 拉过 r251；而 Round 258 明确要求切回结构槽位判断。之所以不选 `shared_two_stage_residual_expert`、`shared_lowrank_*`、`factorized_expert_topk` 这些已有 family，是因为它们在当前 target 的相近 matched lane 上都已经给过较清晰负信号；继续重复它们只会得到低信息增量。新 family 的价值在于它正好补上当前实现缺失的组合：`shared coarse stage` 先吃平滑主干，第二阶段不是 flat router，而是 `product-key` compositional routing 选 very-short-path micro-experts 做 residual cleanup。这比简单重测 `shared_two_stage_residual_expert` 更能回答 prompt 里关于 `product-key / compositional dictionary + shared/residual cleanup` 的核心问题。主要风险也很清楚：exact cost `0.1853x` 高于 r235 的 `0.1641x`，所以如果它不能把 exceed 至少压到约 `0.1733` 以下，就仍然不够构成正收益；但这正是本轮 probe 要干净回答的结构性问题。	/root/sparsify-ascend/research/history/logs/round0258_standard_1775027776.log
r259_1775029031	1775029031	ok	discard	0.40711164474487305	0.416802	0.556802	579328.0	0.14	415488.0	0.1	163840.0	0.04	32	shared_product_key_factorized_expert_topk	1				/root/sparsify-ascend/checkpoints/research_agent/round_0259/round0259_standard_1775028662_dp2_bs1_ga8_ef1_k32_20260401_153109	079aaa7197c1996fc863274d75f9b5f8c40b4430			已实际新增并注册 `shared_product_key_factorized_expert_topk`。建议以 r235 为 reference，只改 `ARCHITECTURE=shared_product_key_factorized_expert_topk`，做一轮新的 matched architecture probe，直接判断“shared bottleneck + PK routing + tiny factorized experts”这个低成本结构槽位本身值不值得继续。	这轮继续遵守 Round 259 的核心约束：只做 1 个 architecture probe，并且相对 reference 只改 `ARCHITECTURE`。之所以不继续重复 `shared_product_key_expert_jumprelu` 或其他已测 shared/coarse family，是因为 round258 已给出清晰负信号：shared coarse + PK residual full heads 在 exact `0.1853x` 下仍只把 exceed 压到 `0.1829`，objective 明显不够；继续沿那条线补参数会变成 prompt 明确下调优先级的低信息细扫。之所以不回到 `shared_routed_factorized_expert_topk` 原 family，是因为它在同 lane 的旧结果很差，但旧结论并不能回答“问题到底在 shared+tiny experts，还是在 flat router”。新 family 的信息增量正好在这里：保持 shared + tiny factorized experts 不变，只把路由机制换成 product-key compositional addressing。主要风险也很清楚：如果 factorized expert heads 本身就是主要瓶颈，那么即使 PK router 降低选择难度，也可能仍然挡不住 exceed；但这正是本轮要干净回答的结构问题。	/root/sparsify-ascend/research/history/logs/round0259_standard_1775028662.log
r260_1775029565	1775029565	ok	discard	0.3683481812477112	0.381438	0.5114380000000001	530176.0	0.13	366336.0	0.09	163840.0	0.04	32	product_key_factorized_expert_topk	1				/root/sparsify-ascend/checkpoints/research_agent/round_0260/round0260_standard_1775029195_dp2_bs1_ga8_ef1_k32_20260401_154002	c5ccde7fedfac1b426f8bc426b60c4c80835e68a			已实际新增并注册 `product_key_factorized_expert_topk`。建议以 r235 为 reference，只改 `ARCHITECTURE=product_key_factorized_expert_topk`，做一轮新的 matched architecture probe，直接判断“PK routing 能不能救活 tiny factorized experts”这个结构槽位本身值不值得继续。	这轮继续满足 Round 260 的核心约束：只做 1 个 architecture probe，并且相对 reference 只改 `ARCHITECTURE`。之所以不继续围绕 round259 那条 `shared_product_key_factorized_expert_topk` 细扫，是因为它已经给出灾难性负信号：exact `0.1381x` 的低成本下 exceed 仍飙到 `0.4168`，说明 shared+tiny factorized 这条组合本身极不稳。之所以不回到 `factorized_expert_topk` 原 family，则是因为它在同一 matched lane 的旧结果同样很差，但旧结果不能回答问题到底在 tiny factorized heads，还是在 flat router。新 family 的信息增量正好在这里：保持 tiny factorized experts 不变，只把路由器换成 product-key，并且去掉刚刚证明有害的 shared 分支。主要风险也很清楚：如果 tiny factorized expert heads 本身就是主瓶颈，那么即使 product-key router 把 expert addressing 做得更好，也可能仍然无法把 exceed 拉回可竞争区间；但这正是本轮要一次性关掉或保留的结构问题。	/root/sparsify-ascend/research/history/logs/round0260_standard_1775029195.log
r261_1775031477	1775031477	ok	keep	0.1664944589138031	0.183066	0.28306600000000004	425984.0	0.1	262144.0	0.06	163840.0	0.04	32	product_key_expert_jumprelu	1				/root/sparsify-ascend/checkpoints/research_agent/round_0261/round0261_standard_1775030683_dp2_bs1_ga8_ef1_k32_20260401_160449	3eca35f4da9025400cbabe0497baa565c3b7e9f5			建议以 r251 为 reference，只改 `NUM_EXPERTS=1024`。这不是围绕过期 `expert_jumprelu` 锚点做保守插值，而是回到当前真实最强兼容主线 `product_key_expert_jumprelu`，做一次高信息量的 bank-capacity knee probe：保持 `K=32 + LATENTS_PER_EXPERT=96 + ACTIVE_EXPERTS=2` 的短路径不变，直接判断 512-bank 是否已经饱和，还是 1024-bank 还能在 controller 成本仍为 0.10x 的前提下继续压低 exceed，从而把 objective 真正往下推。	这轮继续留在同一 family 有明确依据。最新策略已从“架构探针”切回“主线推进”，而当前真实 frontier 也是 r251 而不是提示里的旧 r235；r251 不仅是 best compatible objective，而且曲线仍在改善，因此当前 family 仍有一个高价值、未验证、足以改变结论的主问题：在 `LATENTS_PER_EXPERT=96` 的新 width knee 上，bank 容量是否还能继续扩张。相对 r251 只改 `NUM_EXPERTS`，归因比继续扫 `LATENTS_PER_EXPERT=80/112` 更干净，也比重新打开 `K` 轴更符合现有证据。之所以优先选 1024 而不是再回头试 256，是因为 r252 已经把“更小 bank”这条方向在当前 width knee 上做了明确负裁决；而 r248 又表明更大 bank 至少在邻近宽度上确实能改善 exceed，所以这不是无根据的线性外推。主要风险是 512->1024 的边际收益可能不足以覆盖 exact 成本从 0.097168 到 0.1015625 的上升；但即使如此，这轮也能高质量回答当前 PK 主线的 bank-capacity knee 是否已经饱和。	/root/sparsify-ascend/research/history/logs/round0261_standard_1775030683.log
r262_1775032337	1775032337	ok	keep	0.1706826090812683	0.187586	0.277586	393216.0	0.09	229376.0	0.05	163840.0	0.04	32	product_key_expert_jumprelu	1				/root/sparsify-ascend/checkpoints/research_agent/round_0262/round0262_standard_1775031603_dp2_bs1_ga8_ef1_k32_20260401_162010	85f857f2342af87a6ae598d9cf911295d45e69c9			建议以 r261 为 reference，只改 `LATENTS_PER_EXPERT=80`。r261 已证明更大 compositional bank 值得保留；现在最有信息量的单变量问题不再是继续堆 bank，而是确认 `NUM_EXPERTS=1024` 下的真正 width knee。`80` 是第一档能把 controller 成本从 0.10x 压到 0.09x、同时又明显比 `64/72` 更稳健的宽度 probe。	这轮继续留在同一 family 有充分依据。r261 刚刚把 compatible frontier 从 r251 的约 0.2935 降到约 0.2831，属于明确改进；而且曲线仍在改善，因此当前 family 还存在一个高价值、未验证、且足以改变后续搜索方向的主问题：在 1024-bank 条件下，96 是否仍偏宽。相对 r261 只改 `LATENTS_PER_EXPERT`，归因比改 `K` 或再切结构更干净。之所以优先选 `80` 而不是 `88`，是因为 `88` 在 controller 口径下仍留在 0.10x 档，更多只是 exact-cost 微调；而 `80` 是第一档能把 rounded cost 压到 0.09x、同时门槛仍很宽的 probe。之所以不直接跳到 `64` 或 `72`，是因为当前主线虽在改善，但距离目标仍远，先用更稳健的第一档 width 压缩拿到真实 knee 信号，比更激进地下压更有信息价值。主要风险是 96 已经接近最小可用 local width，导致 exceed 回弹过大；但即使如此，这轮也会清楚回答当前 PK 主线的宽度 knee 是否已经到顶。	/root/sparsify-ascend/research/history/logs/round0262_standard_1775031603.log
r263_1775033148	1775033148	ok	keep	0.18039849400520325	0.196006	0.27600600000000003	344064.0	0.08	180224.0	0.04	163840.0	0.04	32	product_key_expert_jumprelu	1				/root/sparsify-ascend/checkpoints/research_agent/round_0263/round0263_standard_1775032505_dp2_bs1_ga8_ef1_k32_20260401_163511	6e7d907d26c6f817b62c542b614badd00c81e1ae			建议以 r262 为 reference，只改 `LATENTS_PER_EXPERT=56`。r262 已证明 `NUM_EXPERTS=1024` 值得保留；本轮最有价值的单变量问题是确认 width 是否还能把 controller cost 从 0.09x 再压到 0.08x。`56` 是第一档既能完成这个 cost band 下移、又比更激进的 `48/40` 更稳健的宽度 probe。	继续留在同一 family 仍然有充分依据，因为 r261 和 r262 连续把 compatible frontier 从约 0.2935 压到约 0.2776，主线并未停滞。当前最关键的未决问题也很清晰：在 1024-bank 条件下，local width 还能压到哪里，同时仍保住足够多的 exceed。相对 r262 只改 `LATENTS_PER_EXPERT`，归因最干净。之所以选 `56` 而不是继续小步到 `72`，是因为 `72` 仍停留在 controller 的 0.09x 成本档，只能依赖 exceed 不恶化才可能刷新 leaderboard，信息密度偏低；而 `56` 是第一档能把 controller cost 真正打到 0.08x 的点。之所以不直接跳到 `48` 或 `40`，是因为当前主线虽在改进，但 r262 的 `curve_still_improving=false` 已提示 width 压缩开始接近 knee，先做跨档但不过度激进的 `56` 更适合作为边界判定。主要风险是 80 已接近最小可用 local width，56 会让 exceed 回弹超过约 0.01；但即使如此，这轮也能高质量回答当前 PK 主线的 controller-relevant width knee 是否已经到顶。	/root/sparsify-ascend/research/history/logs/round0263_standard_1775032505.log
r264_1775033742	1775033742	ok	archive	0.19437626004219055	0.208135	0.278135	311296.0	0.07	147456.0	0.04	163840.0	0.04	32	product_key_expert_jumprelu	1				/root/sparsify-ascend/checkpoints/research_agent/round_0264/round0264_standard_1775033253_dp2_bs1_ga8_ef1_k32_20260401_164739	65035085069e56e5b151b68a655b750231ac82a2			建议以 r263 为 reference，只改 `LATENTS_PER_EXPERT=40`。r263 已证明 0.08x controller band 依然可用；本轮最有价值的单变量问题是确认当前 PK 主线能否进一步压到 0.07x。`40` 是第一档能完成这次 controller cost 下移、且仍保留足够宽 exceed 门槛的 width probe。	继续留在同一 family 仍然有充分依据，因为 r261、r262、r263 连续刷新 compatible frontier，当前并不存在“最近两轮没有明显改进”而必须切槽位的条件。当前最关键的未决问题也很清楚：在 1024-bank 条件下，local width 还能压到哪里，同时仍保住足够多的 exceed。相对 r263 只改 `LATENTS_PER_EXPERT`，归因最干净。之所以优先选 `40` 而不是 `48`，是因为 `48` 仍停留在 controller 的 0.08x 成本档，除非 exceed 意外改善，否则很难继续刷新 leaderboard；而 `40` 是第一档能把 controller cost 真正打到 0.07x 的点。之所以不选更保守的 `48`，也正是因为当前单目标排行榜由 controller 口径驱动，留在同一 cost band 的 probe 信息密度偏低。主要风险是 56 已接近最小可用 local width，40 会让 exceed 回弹超过约 0.01；但即使如此，这轮也能高质量回答当前 PK 主线的 controller-relevant width knee 是否已经到顶。	/root/sparsify-ascend/research/history/logs/round0264_standard_1775033253.log
