experiment_id	timestamp	status	decision	val_fvu	exceed_alpha_0_50	objective_score	total_cost	total_cost_ratio	selection_cost	selection_cost_ratio	deployment_accesses	deployment_ratio	k	architecture	expansion_factor	wall_time_sec	peak_memory_gb	total_tokens	checkpoint	head_commit	head_branch	workspace_dirty	description	self_review	log_path
r209_1774991934	1774991934	ok	keep	0.14861851930618286	0.172930	0.37293	851968.0	0.2	524288.0	0.12	327680.0	0.08	64	expert_topk	1				/root/sparsify-ascend/checkpoints/research_agent/round_0209/round0209_standard_1774991381_dp2_bs1_ga8_ef1_k64_20260401_050948	9d82ac8865d49535af12a75beba9bae870e3c9b2			建议以 r199 为 reference，只改 `NUM_EXPERTS=128`。这是一次固定 `K=64` 与短 active path 的 routed-only sparse-capacity probe，目标是判断当前 incumbent 的剩余 objective 缺口是否还能通过扩大总静态 expert bank 来换回更低 exceed。	这轮严格满足单变量原则：相对 r199 只改 `NUM_EXPERTS`。之所以允许继续留在 `expert_topk` 而不是立刻再切新 family，是因为这里存在一个当前 target 上仍未被干净回答的高价值假设：r199 的 short active path 已经足够便宜，但还没有验证“保持同样 active path、只扩总静态 expert bank”能否换回更低 exceed。相比继续扫 `K` 或继续在 `lowrank_expert_topk` 上做 rank/latent 插值，这个假设更直接对应 prompt 中的 MoE-like 稀疏容量问题，而且归因更干净。主要风险是 routed-only 线的 tail error 已不再主要受总 bank 容量限制，导致 exceed 改善不足以覆盖 +0.015625 的成本；但如果结果如此，也能更明确地结束这条 direct-compatible 容量扩容支线。	/root/sparsify-ascend/research/history/logs/round0209_standard_1774991381.log
r210_1774992641	1774992641	ok	keep	0.15731249749660492	0.181733	0.36173299999999997	770048.0	0.18	524288.0	0.12	245760.0	0.06	48	expert_topk	1				/root/sparsify-ascend/checkpoints/research_agent/round_0210/round0210_standard_1774992088_dp2_bs1_ga8_ef1_k48_20260401_052135	39407c00395bb01c6300196ef1b2bbfe5a858a2b			建议以 r209 为 reference，只改 `K=48`。这是一次利用 r209 新获得的 routed-only 容量增益去换更低部署成本的单变量 probe，目标是判断 `expert_topk` 在当前 `NUM_EXPERTS=128` 配方下能否进入更低 objective 的 small-K 段，而不是继续在线性扩容或低信息插值上消耗预算。	这轮严格满足单变量原则：相对 r209 只改 `K`。虽然当前阶段总体偏向新结构槽位，但 r209 刚刚给出一次实质性改进，且它打开了一个当前 target 上更高价值、仍未被回答的问题：新增静态 expert 容量究竟只是提高了质量，还是也允许把 deploy path 缩短而不显著抬高 exceed。选择 `K=48` 而不是更保守的 `K=56`，是因为它的信息增量更大，同时仍保留约 0.0195 的 objective 缓冲；若失败，也能更明确地说明当前 routed-only 主线的 tail error 仍对 active atom 数敏感，后续应转回更强结构分工而不是继续做小步 K 插值。主要风险是 exceed 回弹超过节省的成本窗口，导致 objective 不如 r209；但这同样是高价值负信号。	/root/sparsify-ascend/research/history/logs/round0210_standard_1774992088.log
r211_1774993280	1774993280	ok	discard	0.3045044541358948	0.332294	0.482294	638976.0	0.15	393216.0	0.09	245760.0	0.06	48	factorized_expert_topk	1				/root/sparsify-ascend/checkpoints/research_agent/round_0211/round0211_standard_1774992911_dp2_bs1_ga8_ef1_k48_20260401_053517	f8dc322637cf06f665d482e05791c75fbc7dc3c3			建议以 r210 为 reference，只改 `ARCHITECTURE=factorized_expert_topk`。这是一轮新的 matched-objective architecture probe，目标是在保持 `K=48` 和大静态 expert bank 的前提下，用更轻 scorer / router 直接测试“expert 内部 low-rank”能否把当前 routed-only 主线从 `objective≈0.365` 再明显推低，而不是继续围绕 incumbent 做第三轮局部 K 打磨。	这轮严格满足单变量原则：相对 r210 只改 `ARCHITECTURE`。选择 `factorized_expert_topk` 而不是继续把 `expert_topk K=48` 压到 `K=40`，是因为当前连续两轮已经在同一 routed-only family 上拿到清晰正信号；继续压 K 虽可能再拿到 0.00x 级别改进，但信息增量已明显下降，不符合本轮“优先结构槽位”的要求。相反，`factorized_expert_topk` 正好对应 operator guide 当前高优先级的“更轻 scorer / router、expert 内部 low-rank”方向，而且本地成本复核表明它仍处在当前主战场甚至更左的位置。主要风险是这条 family 在当前 target 上有明确负先验：r184 在 `K=108` 时 objective=0.506266、exceed=0.286266，r193 在 `K=96` 时 objective=0.602707、exceed=0.402707；但这些旧点的 `K`、`NUM_EXPERTS`、`LATENTS_PER_EXPERT` 与当前 `K=48, NUM_EXPERTS=128, LATENTS_PER_EXPERT=192` 的 matched recipe 差异很大，尚不足以替代这次更干净的 fresh revalidation。若本轮仍失败，就可以更果断地下调 routed-only small-head 这条线的优先级。	/root/sparsify-ascend/research/history/logs/round0211_standard_1774992911.log
r212_1774993986	1774993986	ok	keep	0.17178651690483093	0.195538	0.355538	688128.0	0.16	524288.0	0.12	163840.0	0.04	32	expert_topk	1				/root/sparsify-ascend/checkpoints/research_agent/round_0212/round0212_standard_1774993433_dp2_bs1_ga8_ef1_k32_20260401_054400	b2577f2ad8e07eaee5a815eb012e748b6375e633			建议以 r210 为 reference，只改 `K=32`。这不是继续围绕 incumbent 做低信息打磨，而是对 r209→r210 新建立的 `small-K + large bank` 主线做一次更强的信息性 deployment-knee probe，目标是确认 `expert_topk` 是否还能在不显著抬高 exceed 的前提下，把 objective 从当前约 0.365 再明显压低。	这轮严格满足单变量原则：相对 r210 只改 `K`。虽然当前总体优先级偏向结构槽位，但 r211 已经给出一个高价值且明确的负信号：`factorized_expert_topk` 在当前 matched recipe 下 cost 足够低，却因 exceed=0.332294 彻底失效，因此继续沿该方向补 `FACTORIZED_HIDDEN_DIM` 或其它局部参数的价值很低。回到 `expert_topk` 并继续压 `K` 不是盲目保守，而是在现有证据下选择更高 EV 的问题：当前最可能真正改进 objective 的，是把已验证有效的大静态 bank 继续兑换成更低 deployment 成本。选择 `K=32` 而不是更保守的 `K=40`，是因为它提供的 objective 窗口更大，且与 r209→r210 的窗口完全同量级；如果这轮仍能赢，说明当前主线的 lookup knee 还远未到头。如果失败，也能把 knee 更清晰地钉在 `K=32~48` 区间，后续再转向 shared/coarse residual 结构时归因会更干净。主要风险是 exceed 回弹超过约 0.2013 的阈值，吞掉全部成本收益；但这同样是高价值负信号。	/root/sparsify-ascend/research/history/logs/round0212_standard_1774993433.log
r213_1774994684	1774994684	ok	archive	0.2008606195449829	0.221774	0.36177400000000004	606208.0	0.14	524288.0	0.12	81920.0	0.02	16	expert_topk	1				/root/sparsify-ascend/checkpoints/research_agent/round_0213/round0213_standard_1774994136_dp2_bs1_ga8_ef1_k16_20260401_055542	20cadf28e8b937c7a3a0e9d56c6fc06b96a759aa			建议以 r212 为 reference，只改 `K=16`。这是对当前 `expert_topk + large bank` 主线的更强 deployment-knee probe，目标是判断这条直接兼容路线是否还能继续用更短 sparse support 换 objective，而不是在刚被 r211 证伪的结构槽位上继续消耗预算。	这轮严格满足单变量原则：相对 r212 只改 `K`。虽然全局策略仍强调结构性信息增量，但最近一次高信息量结构跳转 r211 已经给出明确负信号：`factorized_expert_topk` 在当前 matched recipe 下是 exceed 崩溃而非 cost 不足，因此继续在该类新 family 上补点的 EV 很低。与此同时，r210→r212 两轮连续说明当前 incumbent 明显是 cost-led，且 `K=48 -> 32` 的 objective 仍在改善；这意味着继续压 deploy budget 不是低信息重复，而是在 cleanly 定位当前主线的 deployment knee。选择 `K=16` 而不是更保守的 `K=24`，是因为两者都仍有现实赢面，但 `K=16` 的信息增量更高，并能更快回答“这条 routed-only direct-compatible 主线到底还能左移到哪里”。主要风险是 exceed 超过约 0.2151，从而吞掉本轮新增的成本收益；但如果如此，结论也会非常清楚：当前 hookpoint 下 `K=16` 已跨过 deployment knee，后续应停止继续压 K 并转向 asymmetrical cleanup 结构。	/root/sparsify-ascend/research/history/logs/round0213_standard_1774994136.log
r214_1774995410	1774995410	ok	archive	0.16169507801532745	0.187566	0.377566	802816.0	0.19	557056.0	0.13	245760.0	0.06	32	lowrank_expert_topk	1				/root/sparsify-ascend/checkpoints/research_agent/round_0214/round0214_standard_1774994861_dp2_bs1_ga8_ef1_k32_20260401_060747	fecd576930068a784e2d71eb6eb6e4b0cfaa587c			建议以 r212 为 reference，只改 `ARCHITECTURE=lowrank_expert_topk`。这是一次新的 matched-objective architecture probe，目标是在保持 `K=32` 与大静态 expert bank 的前提下，用一个便宜的 low-rank trunk 测试“适度 cost 回升能否换回足够多的 exceed 下降”，而不是继续沿 routed-only 主线做第三轮 deploy knee 细扫。	这轮严格满足单变量原则：相对 r212 只改 `ARCHITECTURE`。选择 `lowrank_expert_topk` 而不是继续把 `expert_topk` 围绕 `K=24/16` 或 `ACTIVE_EXPERTS=1` 细扫，是因为 r212 已经把 routed-only 主线压到当前最佳 objective，而 r213 又给出非常清晰的 deployment-knee 负信号：继续缩短 sparse support 会让 exceed 快速恶化。继续留在同一 family 上补一个更保守的 `K=24` 虽可能得到微小改进，但信息增量偏低，不符合本轮“优先结构槽位”的要求。相反，`lowrank_expert_topk` 正好对应当前 operator guide 高优先级的“shared low-rank trunk + routed experts”方向，而且本地成本复核表明它仍落在 `~0.19x` 主战场内。主要风险是 objective 门槛并不宽松：要赢过 r212，需要 exceed 压到约 0.1682 以下，而当前 target 上同 family 的历史最好 exceed 也只是接近这个量级；但这正是本轮的价值所在，它能直接回答‘cheap trunk 是否真能把 ultra-small-K exceed 拉回可赢区间’，而不是继续依赖猜测。	/root/sparsify-ascend/research/history/logs/round0214_standard_1774994861.log
r215_1774996127	1774996127	ok	archive	0.15621599555015564	0.180328	0.390328	884736.0	0.21	720896.0	0.17	163840.0	0.04	32	shared_two_stage_residual_expert	1				/root/sparsify-ascend/checkpoints/research_agent/round_0215/round0215_standard_1774995548_dp2_bs1_ga8_ef1_k32_20260401_061914	e144f893b5f21d119bbed65ba408aaabc4abe9ff			建议以 r212 为 reference，只改 `ARCHITECTURE=shared_two_stage_residual_expert`。这是一轮新的 matched-objective architecture probe，目标是直接回答当前 highest-value 未决问题：在 `K=32` 的 ultra-small-K 主线下，显式 coarse 主干加 residual cleanup 是否能比 routed-only 与 cheap-trunk 方案更有效地降低 exceed。	这轮严格满足单变量原则：相对 r212 只改 `ARCHITECTURE`。在连续两轮 no-improve 后，继续围绕 `expert_topk` 做 `K`、`ACTIVE_EXPERTS` 或其它局部插值的信息增量已经明显下降，不符合当前策略默认要求。选择 `shared_two_stage_residual_expert` 而不是 `shared_routed_expert_topk` 或再次回到 factorized/lowrank 家族，是因为它更直接对应当前最高优先级的“不对称 shared/coarse 吃主干、routed experts 做 residual cleanup”方向，而且 current-target 历史上它也是剩余兼容结构里最接近 incumbent 的新 family。主要风险是该 family 即使在更高 K 下历史最好 exceed 也仍在 0.17-0.19 一带，因此要在 `K=32`、cost≈0.21x 下直接打到 0.1487 以下并不容易；但如果连这条最贴合当前策略假设的 family 都做不到，后续就可以更果断地下调整个 coarse+cleanup 线在当前 hookpoint 的优先级。	/root/sparsify-ascend/research/history/logs/round0215_standard_1774995548.log
r216_1774996801	1774996801	ok	archive	0.15955373644828796	0.185566	0.395566	884736.0	0.21	720896.0	0.17	163840.0	0.04	32	shared_routed_expert_topk	1				/root/sparsify-ascend/checkpoints/research_agent/round_0216/round0216_standard_1774996252_dp2_bs1_ga8_ef1_k32_20260401_063059	6076c7ab1f3139106fef102bd35f20647dfdbf94			建议以 r212 为 reference，只改 `ARCHITECTURE=shared_routed_expert_topk`。这是一次新的 matched-objective architecture probe，目标是用当前最强 `K=32 + large bank` recipe 直接测试更简单的 shared+routed 结构是否能在不引入 staged residual 的前提下换回更低 exceed。	这轮严格满足单变量原则：相对 r212 只改 `ARCHITECTURE`。在主线连续 3 轮 no-improve 后，再继续围绕 `expert_topk` 做 `K` 或 `ACTIVE_EXPERTS` 邻域补点的信息增量已经偏低，不符合本轮策略要求。选择 `shared_routed_expert_topk` 而不是继续留在 `shared_two_stage_residual_expert` 上调 `STAGE1_RATIO`，是因为 r215 已经给出该 family 在当前 exact cost lane 下的直接负信号，继续细扫更像低信息补点；而 `shared_routed_expert_topk` 至少能回答一个尚未在当前 matched recipe 上被干净验证的问题：shared 主干本身是否有价值，还是只有更复杂的 residual cleanup 才可能有效。主要风险是 current-target 历史上该 family 的 best point r159 在 cost≈0.21x 下也只有 exceed≈0.185，仍远高于本轮需要的 0.1487 门槛；但这正说明本轮是高风险、高信息量的结构裁决，而不是保守补点。	/root/sparsify-ascend/research/history/logs/round0216_standard_1774996252.log
r217_1774997511	1774997511	ok	discard	0.39059412479400635	0.405163	0.5451630000000001	606208.0	0.14	442368.0	0.11	163840.0	0.04	32	shared_routed_factorized_expert_topk	1				/root/sparsify-ascend/checkpoints/research_agent/round_0217/round0217_standard_1774997142_dp2_bs1_ga8_ef1_k32_20260401_064548	8a74c87112ea87924dc9b7360a61eb9f37b968ae			建议以 r212 为 reference，只改 `ARCHITECTURE=shared_routed_factorized_expert_topk`。这是一轮新的 matched-objective architecture probe：用更轻的 factorized shared+routed 选择链路，把 exact total_cost_ratio 压到 0.14453125，并直接回答它能否在该低成本带把 exceed 维持在可赢区间。	这轮严格满足单变量原则：相对 r212 只改 `ARCHITECTURE`。我没有继续沿 `expert_topk` 或刚跑过的 `shared_routed_expert_topk` 做局部插值，因为当前主线已连续 4 轮没有改进，而且最近几条 cost 更高的结构线已经给出较清晰的负信号：它们能降一点 exceed，但交换率不足以支撑 0.30 目标。选择 `shared_routed_factorized_expert_topk` 的风险很明确：current-target 上 `factorized_expert_topk` 在 r211 的 exceed=0.332294 很差，说明 factorized selector 可能明显伤害 support 质量；旧的 r177 也没有给出 shared+routed factorized 的正面证据。所以这不是保守赢面最高的一步，而是一轮高信息量裁决。如果它仍在低 cost 下守不住 exceed，就可以更果断地把 factorized-expert 线整体降级；如果它能在 `~0.145x` cost 带把 exceed 拉回 `≤0.215`，则说明当前 hookpoint 上真正缺的是更轻的选择链路，而不是更重的 shared/coarse 主干。	/root/sparsify-ascend/research/history/logs/round0217_standard_1774997142.log
r218_1774998237	1774998237	ok	archive	0.1931280940771103	0.222406	0.43240599999999996	901120.0	0.21	737280.0	0.18	163840.0	0.04	32	shared_lowrank_two_stage_residual_expert	1				/root/sparsify-ascend/checkpoints/research_agent/round_0218/round0218_standard_1774997628_dp2_bs1_ga8_ef1_k32_20260401_065355	86eb98469de5072333163d3d21b4234aa07034e5			建议以 r212 为 reference，只改 `ARCHITECTURE=shared_lowrank_two_stage_residual_expert`。这是 Round 218 唯一的 matched architecture probe，用来直接裁决“shared low-rank coarse branch + routed residual cleanup”这条结构槽位在当前 `K=32` 主战场上是否值得继续。	这轮严格满足单变量原则：相对 r212 只改 `ARCHITECTURE`。我没有继续沿 `expert_topk` 做局部插值，也没有再选 `shared_routed_factorized_expert_topk` 或 `shared_lowrank_routed_expert_topk`，因为 r217 已给出 factorized shared+routed 极强负信号，而后者在当前 target 上也已有明显不稳历史。相比之下，`shared_lowrank_two_stage_residual_expert` 更直接对应当前最高优先级的“不对称 coarse 主干 + residual cleanup”假设，而且还没有在当前 matched recipe 上做过一次干净 probe。主要风险很明确：按 exact cost 计算，它要赢过 r212 需要 exceed 直接打到约 0.1407，门槛非常高；所以这不是保守赢面最大的选择，而是一轮高风险、高信息量的结构裁决。如果它仍明显落后，就可以合理判断当前 hookpoint 上 shared-lowrank-coarse 这条线短期内不值得继续占据预算。	/root/sparsify-ascend/research/history/logs/round0218_standard_1774997628.log
r219_1774998896	1774998896	ok	archive	0.19102555513381958	0.220392	0.430392	901120.0	0.21	737280.0	0.18	163840.0	0.04	32	shared_lowrank_routed_expert_topk	1				/root/sparsify-ascend/checkpoints/research_agent/round_0219/round0219_standard_1774998347_dp2_bs1_ga8_ef1_k32_20260401_070553	1af4326e833d1755b2492b8ea45cccd6a40cceaa			建议以 r212 为 reference，只改 `ARCHITECTURE=shared_lowrank_routed_expert_topk`。这是 Round 219 唯一的 matched architecture probe，用来裁决 shared low-rank trunk + routed experts 这条结构槽位在当前 `K=32` 主战场上是否值得继续。	这轮严格满足单变量原则：相对 r212 只改 `ARCHITECTURE`。我没有选择 `two_stage_residual_expert`、`lowrank_expert_residual`、`shared_lowrank_routed_expert_residual` 或 `shared_routed_factorized_expert_residual`，因为本地 exact cost 复核显示它们在当前 matched recipe 下的 total_cost_ratio 约为 `0.39x~0.46x`，从 objective 门槛看已经缺乏现实赢面，不符合“优先可能显著降低 objective”的要求。选择 `shared_lowrank_routed_expert_topk` 的风险也很明确：它与 r218 一样位于 exact `0.21484375` cost 带，历史上同 family 在更高 K 配方下并未给出强正信号，而且 r204 在较低 cost 的不稳定近邻还出现过 exceed 爆炸。所以这不是高胜率保守点，而是一个必要的剩余结构裁决。如果它仍明显落后于 r212，就可以更明确地把 shared-lowrank expert 线整体降级，而不是继续在这条线上消耗预算。	/root/sparsify-ascend/research/history/logs/round0219_standard_1774998347.log
r220_1774999239	1774999239	ok	discard	0.2918800115585327	0.327819	0.487819	688128.0	0.16	524288.0	0.12	163840.0	0.04	32	factorized_topk	1				/root/sparsify-ascend/checkpoints/research_agent/round_0220/round0220_standard_1774999021_dp2_bs1_ga8_ef1_k32_20260401_071707	6057270fa2908811de1166b7c6fa8a013c185f83			建议以 r212 为 reference，只改 `ARCHITECTURE=factorized_topk`。这是 Round 220 唯一的 matched architecture probe，用来裁决轻量 factorized scorer 这条直接兼容结构线在当前 `K=32`、与 incumbent 同成本的主战场里是否值得继续。	这轮严格满足单变量原则：相对 r212 只改 `ARCHITECTURE`。我没有选择 `factorized_expert_topk`，因为它在 current target 上已经有更接近 matched lane 的强负信号：r211 在更低 cost `0.152344x` 下 exceed 仍高达 `0.332294`，说明 factorized+expert 组合大概率已经先在 support 质量上失败。也没有选择 `topk`、`group_topk`、`jumprelu`，因为本地 exact cost 复核显示它们在当前 matched recipe 下都会抬到约 `0.289x`，明显偏离当前 `0.18x~0.22x` 主战场。选择 `factorized_topk` 的风险同样明确：它在旧轮次和旧 target 上的历史表现并不强，旧的 r173 也只给出 objective≈0.545 的弱先验负信号，所以这不是高把握度翻盘点，而是一轮必要的剩余结构裁决。但它至少具备两个其他候选不再具备的条件：一是 exact cost 不劣于 incumbent，二是 current target 上尚未做过一次干净的 matched probe。如果它仍然守不住 exceed，就可以更明确地下调整个 factorized-selector 方向的优先级。	/root/sparsify-ascend/research/history/logs/round0220_standard_1774999021.log
r221_1774999566	1774999566	ok	discard	0.2743304371833801	0.316613	0.506613	802816.0	0.19	557056.0	0.13	245760.0	0.06	32	lowrank_factorized_residual	1				/root/sparsify-ascend/checkpoints/research_agent/round_0221/round0221_standard_1774999348_dp2_bs1_ga8_ef1_k32_20260401_072235	bd3c733039b9c8bb27e51d3bc2a28b91e61a292e			建议以 r212 为 reference，只改 `ARCHITECTURE=lowrank_factorized_residual`。这是 Round 221 唯一的 matched architecture probe，用来裁决 low-rank trunk + factorized residual 这条扩展兼容结构线在当前 `K=32`、`~0.19x` 主战场里是否值得继续。	这轮严格满足单变量原则：相对 r212 只改 `ARCHITECTURE`。我没有继续沿 shared/routed 线做近邻变体，因为 r218 与 r219 已在同一 `0.214844x` 成本带给出连续负信号；也没有继续沿 factorized selector 主线扩展，因为 r220 在与 incumbent 同成本的 `0.1640625x` 带直接给出强负信号。当前剩余 still-compatible 且未做过 matched probe 的 family 中，`topk/group_topk/jumprelu/bucketed_topk/whitened_topk` 都会把 exact total_cost 抬到 `0.29x~0.54x`，已经明显偏离当前主战场；而 `lowrank_factorized_residual` 是少数仍落在 `~0.19x`、且在结构上与最近失败方向足够不同的槽位。主要风险也很明确：该 family 在旧轮次的高 K 历史点表现并不强，说明 factorized residual scorer 可能仍会伤害 support 质量；如果这轮 exceed 仍压不回 `≤0.164`，就应视为对这条方向的进一步负裁决，而不是继续补点。	/root/sparsify-ascend/research/history/logs/round0221_standard_1774999348.log
r222_1774999905	1774999905	ok	discard	0.24947819113731384	0.298591	0.618591	1327104.0	0.32	1081344.0	0.26	245760.0	0.06	32	lowrank_residual	1				/root/sparsify-ascend/checkpoints/research_agent/round_0222/round0222_standard_1774999686_dp2_bs1_ga8_ef1_k32_20260401_072813	077e416471b4c285124d6dec4e64634240407635			建议以 r212 为 reference，只改 `ARCHITECTURE=lowrank_residual`。这是 Round 222 唯一的 matched architecture probe，用来裁决 plain low-rank trunk + sparse residual 这条扩展兼容结构线在当前 target 上是否还有继续价值。	这轮严格满足单变量原则：相对 r212 只改 `ARCHITECTURE`。我没有选择 `lowrank_jumprelu_residual`、`lowrank_grouped_residual`、`whitened_lowrank_residual` 等近邻 family，因为它们在当前 matched recipe 下要么 exact cost 与 `lowrank_residual` 相同但只是在支持形成上叠加次级变体，要么 cost 更高，却没有先回答最基础的问题：plain trunk + residual 本身是否成立。选择 `lowrank_residual` 的主要价值是结构归因最干净，不会把结论混入 JumpReLU、grouping 或 whitening 的次级因素。主要风险也很明确：本地 exact total_cost_ratio 已到 `0.31640625`，从 objective 数学上看几乎不可能赢过 r212，这意味着它更像是一轮高信息量的结构排除实验，而不是现实的夺冠点。但在当前 remaining compatible 槽位里，这是最直接、最少混杂、也最能结束一整条 trunk+residual 叙事的 probe。	/root/sparsify-ascend/research/history/logs/round0222_standard_1774999686.log
r223_1775000224	1775000224	ok	discard	0.24928165972232819	0.298529	0.618529	1327104.0	0.32	1081344.0	0.26	245760.0	0.06	32	lowrank_jumprelu_residual	1				/root/sparsify-ascend/checkpoints/research_agent/round_0223/round0223_standard_1775000006_dp2_bs1_ga8_ef1_k32_20260401_073333	c7577a72593ee5e7be26c6aa1f9925cf03d781f6			建议以 r212 为 reference，只改 `ARCHITECTURE=lowrank_jumprelu_residual`。这是 Round 223 唯一的 matched architecture probe，用来裁决 residual 主线失败到底是结构问题，还是 residual 支持形成机制问题。	这轮严格满足单变量原则：相对 r212 只改 `ARCHITECTURE`。我没有选择 `lowrank_grouped_residual`，因为它与 `lowrank_jumprelu_residual` 在当前 matched recipe 下 exact total_cost 完全同档，但 JumpReLU 对支持形成方式的改变更直接、更强，信息增量更高；也没有选择 `whitened_lowrank_residual`，因为其 exact total_cost 已抬到约 `0.38x`，比 `lowrank_residual` 线更不具备现实赢面。选择 `lowrank_jumprelu_residual` 的核心不是看好它会赢，而是它能最干净地回答一个当前还没被单独验证的问题：在 trunk+residual 主线已经失利之后，问题是否主要出在 residual 支持形成方式。主要风险仍然非常大：与 r222 一样，它的 exact total_cost_ratio 约为 `0.3164x`，从 objective 数学上看几乎不可能超越 r212。因此这是一轮高信息量排除实验，而不是高胜率翻盘点。	/root/sparsify-ascend/research/history/logs/round0223_standard_1775000006.log
r224_1775000507	1775000507	ok	discard	0.2508208453655243	0.299492	0.6194919999999999	1327104.0	0.32	1081344.0	0.26	245760.0	0.06	32	lowrank_grouped_residual	1				/root/sparsify-ascend/checkpoints/research_agent/round_0224/round0224_standard_1775000288_dp2_bs1_ga8_ef1_k32_20260401_073815	6b772ce041861fa864df437205858109d5b47b04			建议以 r212 为 reference，只改 `ARCHITECTURE=lowrank_grouped_residual`。这是 Round 224 唯一的 matched architecture probe，用来裁决 grouped residual support 是否比 plain / JumpReLU residual 更值得继续。	这轮严格满足单变量原则：相对 r212 只改 `ARCHITECTURE`。我没有选择 `whitened_lowrank_residual`，因为它在当前 matched recipe 下的 exact total_cost 更高，先验上更缺乏现实赢面；也没有回到已测过的 plain residual 或 JumpReLU residual 近邻做重复实验。选择 `lowrank_grouped_residual` 的理由不是它有高胜率，而是它与 r222 / r223 保持同一成本带，只改变 residual 支持形成机制，能够给 lowrank residual 家族一个最后、最干净的结构性裁决。主要风险与前两轮相同：exact total_cost 已达 `0.31640625x`，从 objective 数学上几乎不可能超越 r212。所以这仍是一轮高信息量排除实验，而不是保守推进。	/root/sparsify-ascend/research/history/logs/round0224_standard_1775000288.log
r225_1775001130	1775001130	ok	discard	0.33179670572280884	0.349439	0.479439	557056.0	0.13	393216.0	0.09	163840.0	0.04	32	factorized_expert_topk	1				/root/sparsify-ascend/checkpoints/research_agent/round_0225/round0225_standard_1775000792_dp2_bs1_ga8_ef1_k32_20260401_074638	86449f7cda01ea27450f134bb65261382607ee5d			建议以 r212 为 reference，只改 `ARCHITECTURE=factorized_expert_topk`。这轮不再赌更重结构，而是用 当前口径下的 total_cost_ratio 已重新复核 的 ultra-low-cost matched probe，直接裁决“shared bottleneck + expert-specific head”这条剩余低成本结构槽位在当前 target 上是否还值得继续。	这轮严格满足单变量原则：相对 r212 只改 `ARCHITECTURE`，没有新增参数，也没有代码改动。没有再选更重的 `two_stage_residual_expert`、`lowrank_expert_residual`、codebook/whitened 系列，是因为本地 exact cost 复核表明它们在当前 matched recipe 下已高到几乎不可能改善 objective；也没有回到已在 `0.21x` 一带明确失败的 shared/coarse 线。选择 `factorized_expert_topk` 的风险同样明确：r211 在更高 K=48 下已经给出 `exceed=0.332294` 的强负信号，所以这一步更像 closure probe 而不是高置信 winning probe。但当前剩余候选里，只有它仍同时满足三点：一是 LUTurbo 可导出；二是 exact total_cost 低于 incumbent，仍有现实的 objective 赢面门槛；三是尚未在当前 `K=32` anchor recipe 上做过一次干净 matched architecture 裁决。	/root/sparsify-ascend/research/history/logs/round0225_standard_1775000792.log
r226_1775001560	1775001560	ok	discard	0.26630523800849915	0.310443	0.6004430000000001	1212416.0	0.29	1048576.0	0.25	163840.0	0.04	32	jumprelu	1				/root/sparsify-ascend/checkpoints/research_agent/round_0226/round0226_standard_1775001341_dp2_bs1_ga8_ef1_k32_20260401_075547	1f180b2d68e1488044d55964dee1e1d17b7ac628			建议以 r212 为 reference，只改 `ARCHITECTURE=jumprelu`。这轮不是继续赌更重结构，而是用当前剩余家族里仍保留非零 objective 赢面的最低复杂度 support-forming probe，直接裁决“问题究竟在 routed sublibrary 结构，还是在支持形成机制本身”。	这轮严格满足单变量原则：相对 r212 只改 `ARCHITECTURE`，没有新增参数，也没有代码改动。没有再选 `lowrank_expert_residual`、`two_stage_residual_expert`、`whitened_lowrank_residual`、`codebook_topk` 等未测 family，是因为本地 exact cost 复核显示它们在当前 matched recipe 下都落在 `0.38x+`，已经在 objective 上先验无法刷新 incumbent；继续测试它们更像质量锚点，不符合本轮“matched architecture probe”优先回答 objective 槽位价值的要求。相比 `topk` 与 `group_topk`，`jumprelu` 在同 exact cost 下提供了最明确的支持形成机制变化，因此信息增量更高。主要风险同样明确：它要赢过 r212 需要把 exceed 直接打到约 `0.0665`，现实门槛很高，所以这更像最后一个 direct-compatible selector closure probe，而不是高置信翻盘点。	/root/sparsify-ascend/research/history/logs/round0226_standard_1775001341.log
r227_1775001850	1775001850	ok	discard	0.2678847312927246	0.311170	0.60117	1212416.0	0.29	1048576.0	0.25	163840.0	0.04	32	group_topk	1				/root/sparsify-ascend/checkpoints/research_agent/round_0227/round0227_standard_1775001632_dp2_bs1_ga8_ef1_k32_20260401_080038	be4d500b481b51f291f92a374d17f36a7078d8ce			建议以 r212 为 reference，只改 `ARCHITECTURE=group_topk`。这轮继续做 matched architecture probe，但不再赌更重结构，而是用 single-library selector 剩余槽位里信息增量最高的一点，直接裁决“支持竞争结构本身是否还能带来足以影响 objective 的收益”。	这轮严格满足单变量原则：相对 r212 只改 `ARCHITECTURE`，没有新增参数，也没有代码改动。没有再选 `whitened_topk`、`codebook_topk`、`lowrank_expert_residual`、`two_stage_residual_expert` 等未测 family，是因为本地 exact cost 复核显示它们在当前 matched recipe 下都落在 `0.38x+` 或更高，已经在 objective 上先验无法刷新 incumbent；继续测试它们更像质量锚点，不符合本轮“matched architecture probe”优先回答 objective 槽位价值的要求。也没有直接回到 `topk`，因为在 `jumprelu` 已明确失败后，plain topk 的新增信息量低于 `group_topk`；如果连 grouped competition 都不能显著改善 exceed，那么 plain 单库线更没有继续价值。主要风险同样明确：它要赢过 r212 需要把 exceed 直接打到约 `0.0665`，现实门槛极高，所以这更像 remaining selector slot 的 closure probe，而不是高置信翻盘点。	/root/sparsify-ascend/research/history/logs/round0227_standard_1775001632.log
