experiment_id	timestamp	status	decision	val_fvu	exceed_alpha_0_50	objective_score	total_cost	total_cost_ratio	selection_cost	selection_cost_ratio	deployment_accesses	deployment_ratio	k	architecture	expansion_factor	wall_time_sec	peak_memory_gb	total_tokens	checkpoint	head_commit	head_branch	workspace_dirty	description	self_review	log_path
r189_1774889163	1774889163	ok	discard	0.16234023869037628	0.197197824716568	0.467197824716568	1138688.0	0.27	647168.0	0.15	491520.0	0.12	96	shared_lowrank_routed_expert_topk	1				/root/sparsify-ascend/checkpoints/research_agent/round_0189/round0189_standard_1774888648_dp2_bs1_ga8_ef1_k96_20260331_003735	dd655a38a4f705b6fe2c95e1aa7b8bc57d3d48c7			以 r181 为 reference，只改 `ARCHITECTURE=shared_lowrank_routed_expert_topk`，做一轮新的 `<0.25x` matched-cost architecture probe。目标是直接验证当前高优先级方向“shared bottleneck + expert-specific head”在 `K=96` small-`K` recipe 下能否比 plain top-k 更有效地稳住低成本质量。	这轮严格遵守 param_only 单变量约束：相对 r181 只改 `ARCHITECTURE`。选择 r181 而不是沿 r187 继续改 `LATENTS_PER_EXPERT` 或 `K`，是因为最近几轮已经连续在同一 family 上补局部轴且没有形成新的 frontier 扩展，按当前策略应优先回到 architecture-level probe。选择 `shared_lowrank_routed_expert_topk` 而不是 `shared_routed_factorized_expert_topk`，是因为两者都能落在 low-cost 带内，但前者更直接对应当前高优先级方向“shared bottleneck + expert-specific head”，且历史负信号相对没那么强。选择它而不是 `group_topk/jumprelu`，是因为 recent 直接兼容单库 family 已再次给出较弱证据，而当前更需要回答的是小 `K` 下 shared/coarse + routed specialists 的结构分工是否有价值。主要风险是该 family 在更高 `K`、更重 trunk recipe 下已有负信号；但当前 small-`K`、`TRUNK_RANK=16` 的 matched recipe 仍是一个新的、与当前 round 189 主问题更对齐的 fresh validation。	/root/sparsify-ascend/research/history/logs/round0189_standard_1774888648.log
r190_1774889884	1774889884	ok	keep	0.2322123944759369	0.27453529834747314	0.4845352983474731	868352.0	0.21	294912.0	0.07	573440.0	0.14	96	lowrank_expert_topk	1				/root/sparsify-ascend/checkpoints/research_agent/round_0190/round0190_standard_1774889516_dp2_bs1_ga8_ef1_k96_20260331_005202	496444955ad48feb9fed2ed30d8654a5558315ce			以 r187 为 reference，只改 `ACTIVE_EXPERTS=1`，对 `lowrank_expert_topk` 做一次 active-path compression probe。目标是在保持 current low-rank trunk recipe 不变的前提下，直接判断更短 routed path 是否能把这条最接近 anchor 的非主线 family 推到更左的低成本带。	这轮严格遵守 param_only 单变量约束：相对 r187 只改 `ACTIVE_EXPERTS`。选择这条轴而不是继续改 `K/LATENTS_PER_EXPERT`，是因为当前策略明确要求避免在同一 family 上继续做线性插值点，而 `ACTIVE_EXPERTS` 直接改变 active path 长度，属于更高信息量的结构性压缩。选择 `lowrank_expert_topk` 而不是回到 `shared_routed_expert_topk` 主线，是因为后者已被明确降为 cost anchor；选择它而不是再开一个新的 factorized/shared-lowrank architecture family，是因为 r186-r189 已连续给出这些方向的 fresh 负信号。主要风险是同 target 的旧 recipe 上，`lowrank_expert_topk` 的单 expert 版本已经出现过明显负信号；但那条证据对应的是更重的 `K=112, LATENTS_PER_EXPERT=224, TRUNK_RANK=40` 配方。当前这一轮要回答的是更轻 `K=96, LATENTS_PER_EXPERT=192, TRUNK_RANK=16` recipe 下，trunk 是否已经足以支撑更短 active path，而这在当前成本带上仍未被直接验证。	/root/sparsify-ascend/research/history/logs/round0190_standard_1774889516.log
r191_1774890715	1774890715	ok	archive	0.14542359113693237	0.17589443922042847	0.42589443922042847	1048576.0	0.25	557056.0	0.13	491520.0	0.12	96	shared_two_stage_residual_expert	1				/root/sparsify-ascend/checkpoints/research_agent/round_0191/round0191_standard_1774890201_dp2_bs1_ga8_ef1_k96_20260331_010327	5a9b5d4ac1f7b6c1ac6d9d64f2c11fe41c9a0aff			建议以 r188 为 reference，只改 `ARCHITECTURE=shared_two_stage_residual_expert`。这是一次落在 `<0.25x` 主战场内的 small-K matched architecture probe，用最低额外成本直接验证“shared coarse branch + expert residual cleanup”能否在 `K=96` 比现有 low-cost probes 更稳。	这轮严格满足单变量原则：相对 r188 只改 `ARCHITECTURE`。没有新增 tunable 参数，也没有代码落盘，因此不需要扩展到 `research/AutoResearch/` 或 `scripts/`。选择这轮而不是继续沿 `shared_routed_expert_topk`/`lowrank_expert_topk` 扫 `K` 或 `LATENTS_PER_EXPERT`，是因为当前策略已明确要求优先做 architecture-level probe，并且这条 family 正好对应“先让 cheap shared/coarse branch 吃掉平滑主干，再让 experts 只做 sparse residual cleanup”的当前高优先级结构假设。主要风险是该 family 目前不在旧兼容表显式列名里，若运行时后处理仍按旧表过滤，需要后续补记忆层兼容登记；但从导出形式看它满足 LUTurbo 静态库有限加权和硬约束。	/root/sparsify-ascend/research/history/logs/round0191_standard_1774890201.log
r192_1774891293	1774891293	ok	discard	0.22200872004032135	0.27097418904304504	0.500974189043045	950272.0	0.23	458752.0	0.11	491520.0	0.12	96	shared_two_stage_residual_expert	1				/root/sparsify-ascend/checkpoints/research_agent/round_0192/round0192_standard_1774890899_dp2_bs1_ga8_ef1_k96_20260331_011505	a65a1ec30bc5c3d3e8df081c7f7fb40bbb541935			建议以 r190 为 reference，只改 `ARCHITECTURE=shared_two_stage_residual_expert`。这是一次落在 `<0.25x` 主战场内的 matched architecture probe，用当前 `K=96` 小支撑配方直接检验“shared coarse branch + expert residual cleanup”是否能比现有 low-cost 非主线探针更慢地退化。	这轮满足单变量原则：相对 r190 只改 `ARCHITECTURE`。没有新增 tunable 参数，也没有代码改动，因此不需要触碰 `research/AutoResearch/` 或 `scripts/`。选择它而不是再试 `factorized_expert_topk`/`shared_routed_factorized_expert_topk`，是因为当前策略更强调“先用 cheap shared/coarse branch 吃掉平滑主干，再让 experts 做 sparse residual cleanup”，而 `shared_two_stage_residual_expert` 正好在 `<0.25x` 内最直接回答这个问题。主要风险是该 family 先前在更高 K 配方下已接近但未打赢当前 low-cost anchor；但本轮用更小 K、当前最新 reference 的 fresh matched probe，信息增量仍然高。	/root/sparsify-ascend/research/history/logs/round0192_standard_1774890899.log
r193_1774891764	1774891764	ok	discard	0.36423131823539734	0.40270745754241943	0.6027074575424194	819200.0	0.2	327680.0	0.08	491520.0	0.12	96	factorized_expert_topk	1				/root/sparsify-ascend/checkpoints/research_agent/round_0193/round0193_standard_1774891459_dp2_bs1_ga8_ef1_k96_20260331_012426	bc32fe76406f7a55373ce0acc235249575604280			建议以 r190 为 reference，只改 `ARCHITECTURE=factorized_expert_topk`。这是一次落在 `<0.25x` 主战场内、且比 r190 更靠左的 matched architecture probe，用当前 `K=96` 小支撑配方直接检验 expert-internal low-rank small-head 是否能形成新的低成本结构段。	这轮满足单变量原则：相对 r190 只改 `ARCHITECTURE`。没有新增 tunable 参数，也没有代码改动，因此不需要触碰 `research/AutoResearch/` 或 `scripts/`。选择 `factorized_expert_topk` 而不是继续试 `shared_lowrank_*` / `two_stage_*`，是因为这些方向已被当前策略明确下调优先级；选择它而不是 `shared_routed_factorized_expert_topk`，是因为后者在当前 target 上的低成本负信号更一致，而本轮更需要回答的是“更轻的 expert-specific small head 本身是否有效”。主要风险是该 family 的旧轮次先验偏弱；但当前这次是以 r190 exact small-K recipe 做 fresh matched probe，信息增量仍然高。	/root/sparsify-ascend/research/history/logs/round0193_standard_1774891459.log
r194_1774892432	1774892432	ok	discard	0.206455796957016	0.24948188662528992	0.4794818866252899	950272.0	0.23	458752.0	0.11	491520.0	0.12	96	shared_routed_expert_topk	1				/root/sparsify-ascend/checkpoints/research_agent/round_0194/round0194_standard_1774892007_dp2_bs1_ga8_ef1_k96_20260331_013333	8fca784f1804de524ed4bbcc4395277b4dbe3c34			建议以 r193 为 reference，只改 `ARCHITECTURE=shared_routed_expert_topk`。这是一次严格留在 `<0.25x` 主战场内的 matched architecture control，用 r193 的 exact small-K recipe 直接检验 shared branch 是否能在 very-short active path 下把质量从 factorized small-head 的失败中拉回。	这轮满足单变量原则：相对 r193 只改 `ARCHITECTURE`。没有新增 tunable 参数，也没有代码改动，因此不需要触碰 `research/AutoResearch/` 或 `scripts/`。之所以选 `shared_routed_expert_topk` 而不是继续试 `shared_routed_factorized_expert_topk`，是因为后者在当前 target 上已有更一致的低成本负信号，而当前更需要一个更强、但仍留在 `<0.25x` 内的 matched control，直接回答 r193 的失败到底来自 factorized heads，还是来自 very-short-path 本身。主要风险是 `ACTIVE_EXPERTS=1` 的 shared+routed 旧先验并不强；但当前这次是以 r193 exact recipe 做 fresh architecture swap，归因最干净。	/root/sparsify-ascend/research/history/logs/round0194_standard_1774892007.log
r195_1774892974	1774892974	ok	keep	0.24542203545570374	0.2857440710067749	0.4657440710067749	753664.0	0.18	262144.0	0.06	491520.0	0.12	96	expert_topk	1				/root/sparsify-ascend/checkpoints/research_agent/round_0195/round0195_standard_1774892606_dp2_bs1_ga8_ef1_k96_20260331_014333	6f063a49b7f80b1117f47c588bc6427584330747			建议以 r194 为 reference，只改 `ARCHITECTURE=expert_topk`。这是一次严格留在 `<0.25x` 主战场内的 matched architecture control，用与 r194 完全相同的 very-short-path recipe 直接检验 routed-only 是否能在更低总成本下形成新的左侧 Pareto 段。	这轮满足单变量原则：相对 r194 只改 `ARCHITECTURE`。没有新增 tunable 参数，也没有代码改动，因此不需要触碰 `research/AutoResearch/` 或 `scripts/`。选择 `expert_topk` 而不是继续试 `shared_routed_factorized_expert_topk`，是因为后者在当前 target 上的低成本负信号更一致；当前更有信息量的是在完全相同的 short-path recipe 下去掉 shared branch，做一个更干净的 routed-only 对照。主要风险是 routed-only 也可能明显弱于现有 `<0.25x` anchors；但即便失败，这轮也能清楚回答 single-expert 低成本方向是否还值得继续。	/root/sparsify-ascend/research/history/logs/round0195_standard_1774892606.log
r196_1774893646	1774893646	ok	keep	0.15407827496528625	0.18452420830726624	0.4145242083072662	950272.0	0.23	458752.0	0.11	491520.0	0.12	96	expert_topk	1				/root/sparsify-ascend/checkpoints/research_agent/round_0196/round0196_standard_1774893128_dp2_bs1_ga8_ef1_k96_20260331_015215	7d4b22cf4f5d67c7ed5bf0c3aae25d1bffa39c34			建议以 r195 为 reference，只改 `ACTIVE_EXPERTS=2`。这是一次仍留在 `<0.25x` 主战场内的最小容量扩展 probe，用 routed-only exact recipe 直接检验更短路径下的主要瓶颈是否是 active expert 数。	这轮满足单变量原则：相对 r195 只改 `ACTIVE_EXPERTS`。没有新增 tunable 参数，也没有代码改动，因此不需要触碰 `research/AutoResearch/` 或 `scripts/`。选择 `ACTIVE_EXPERTS=2` 而不是继续改 `K`，是因为当前更关键的问题不是 deployment lookup 是否不够，而是 routed-only 低成本线在 very-short active path 下是否容量受限；同时该点仍稳在 `<0.25x`，符合本轮主战场要求。主要风险是改善可能有限，因为更深的问题可能来自缺 shared/coarse 主干而不是 active experts 数；但这正是本轮要隔离的结构问题。	/root/sparsify-ascend/research/history/logs/round0196_standard_1774893128.log
r197_1774894339	1774894339	ok	discard	0.14519497752189636	0.17660614848136902	0.426606148481369	1064960.0	0.25	491520.0	0.12	573440.0	0.14	96	lowrank_expert_topk	1				/root/sparsify-ascend/checkpoints/research_agent/round_0197/round0197_standard_1774893825_dp2_bs1_ga8_ef1_k96_20260331_020352	86f76c95e997f071f0730501e7a971fb3ce30a92			建议以 r196 为 reference，只改 `ARCHITECTURE=lowrank_expert_topk`。这是一次严格留在 `<0.25x` 主战场内的 matched architecture probe，用与 r196 相同的 active-path recipe 直接检验 cheap trunk 是否能把 routed-only 新前沿继续往下推。	这轮满足单变量原则：相对 r196 只改 `ARCHITECTURE`。没有新增 tunable 参数，也没有代码改动，因此不需要触碰 `research/AutoResearch/` 或 `scripts/`。选择 `lowrank_expert_topk` 而不是回到 `shared_routed_expert_topk`，是因为后者在 `K=96, ACTIVE_EXPERTS=2, LATENTS_PER_EXPERT=192` 上已有更强历史正信号，继续重跑信息增量较低；当前更高信息量的问题是 routed-only 新前沿在补一个 cheap trunk 后是否还能继续改善。主要风险是 trunk 带来的额外部署/选择成本可能不足以换回足够 FVU；但这正是本轮要精确回答的结构问题。	/root/sparsify-ascend/research/history/logs/round0197_standard_1774893825.log
r198_1774977925	1774977925	ok	keep	0.15982383489608765	0.189841	0.399841	868352.0	0.21	458752.0	0.11	409600.0	0.1	80	expert_topk	1				/root/sparsify-ascend/checkpoints/research_agent/round_0198/round0198_standard_1774977402_dp2_bs1_ga8_ef1_k80_20260401_011648	19b00a4d89df70f5eb02a7c76ea147deab0a5cd6			建议以 r196 为 reference，只改 `K=80`。这不是继续围绕 FVU 做微调，而是一次针对当前 cost 略主导前沿的 deployment 压缩 probe：用最强兼容 incumbent 直接测试 active2+192 recipe 是否还能在更小 K 下保持 exceed，从而把 objective 再往下推。	这轮严格满足单变量原则：相对 r196 只改 `K`。没有新增 tunable 参数，也没有代码改动，因此不需要触碰 `sparsify/` 之外路径。之所以选 `K=80` 而不是更保守的 `88`，是因为 `88` 只省 32768 次访问，objective 增益窗口仅 0.0078，信息量偏低；而 `64` 对当前未验证的 active2 recipe 来说跨步过大。主要风险是 exceed 对 `K` 很敏感，导致 objective 反而回退；但这会直接证明当前 incumbent 已接近 small-K deployment knee。	/root/sparsify-ascend/research/history/logs/round0198_standard_1774977402.log
r199_1774978777	1774978777	ok	keep	0.16656622290611267	0.196114	0.386114	786432.0	0.19	458752.0	0.11	327680.0	0.08	64	expert_topk	1				/root/sparsify-ascend/checkpoints/research_agent/round_0199/round0199_standard_1774978103_dp2_bs1_ga8_ef1_k64_20260401_012830	97c27500dde0cc1a63cdf542f6525112616e93b1			建议以 r198 为 reference，只改 `K=64`。这是一次围绕当前最佳兼容 anchor 的高信息量 small-K probe，目标不是追 FVU，而是直接测试 routed-only 主线还能否靠更低 deployment 成本把 objective 再往下推。	这轮严格满足单变量原则：相对 r198 只改 `K`。没有新增 tunable 参数，也没有代码改动，因此不需要触碰 `sparsify/` 之外路径。虽然当前策略偏向结构性 probe，但这里继续留在同一 family 仍有明确的高价值未验证假设：r198 刚证明这条 family 在更小 K 下仍能降 objective，下一步用 `K=64` 做更大但仍可解释的 deployment 左移，可以最直接判断这条 low-cost mainline 是否还有可兑现的 objective 空间。主要风险是 `K=64` 可能跨过 knee，导致 exceed 明显反弹；但这正是本轮要测清的边界。	/root/sparsify-ascend/research/history/logs/round0199_standard_1774978103.log
r200_1774985283	1774985283	ok	archive	0.15741991996765137	0.188017	0.39801699999999995	901120.0	0.21	491520.0	0.12	409600.0	0.1	64	lowrank_expert_topk	1				/root/sparsify-ascend/checkpoints/research_agent/round_0200/round0200_standard_1774984614_dp2_bs1_ga8_ef1_k64_20260401_031700	5d8a37be6a38e6eaa795fc0853e3f193542fc9c0			建议以 r199 为 reference，只改 `ARCHITECTURE=lowrank_expert_topk`。这是一次 matched small-K architecture probe：在保持当前最佳 routed-only recipe 不变的前提下，测试一个便宜的 low-rank trunk 能否真正把 `exceed_alpha_0.50` 压低 enough，从而把 objective 往 incumbent 之下推。	这轮严格满足单变量原则：相对 r199 只改 `ARCHITECTURE`。没有新增 tunable 参数，也没有代码落盘，因此不需要触碰 `sparsify/`、`research/AutoResearch/` 或 `scripts/`。之所以选 `lowrank_expert_topk` 而不是 `shared_routed_expert_topk`/`shared_two_stage_residual_expert`，是因为在当前 `K=64` matched recipe 下，前者的本地总成本只到约 `0.21x`，而后两者会到约 `0.23x`，对 exceed 的改进要求更苛刻；同时 `lowrank_expert_topk` 已有同 `TRUNK_RANK=16`、同 `LATENTS_PER_EXPERT=192` 的较强历史质量锚点，是当前最可信的 small-K structure probe。主要风险是 `K=64` 仍可能让该 family 的 exceed 回升到无法覆盖额外成本；但这正是本轮需要用最干净 architecture swap 回答的问题。	/root/sparsify-ascend/research/history/logs/round0200_standard_1774984614.log
r201_1774986595	1774986595	ok	archive	0.15735933184623718	0.187735	0.397735	884736.0	0.21	557056.0	0.13	327680.0	0.08	64	shared_two_stage_residual_expert	1				/root/sparsify-ascend/checkpoints/research_agent/round_0201/round0201_standard_1774986077_dp2_bs1_ga8_ef1_k64_20260401_034123	e41f4da033eb7ff924f62a4537a2e718830f3a35			建议以 r191 为 reference，只改 `K=64`。这是一次结构导向的 small-K 决断实验：把 `shared_two_stage_residual_expert` 直接压回约 `0.21x` 主战场，验证“shared coarse 主干 + expert residual cleanup”是否真能比 routed-only 更慢地随 K 下降而退化，并因此逼近当前 objective incumbent。	这轮严格满足单变量原则：相对 r191 只改 K。虽然不是 brand-new family，但它也不是最近两轮正在被连续细扫的 incumbent 邻域；当前最缺的是把一条已有结构证据、但尚未进入主战场的 family 压到 K=64，直接回答 small-K objective 是否成立。之所以不继续围绕 expert_topk/lowrank_expert_topk 做局部微调，是因为 r199/r200 已经把这两条线在 0.19x-0.21x 带的基本 tradeoff 说得比较清楚，而 `shared_two_stage_residual_expert` 仍有一个高价值未验证问题：shared 主干与 residual experts 的显式分工，是否能让 K 压缩时的 exceed 退化更慢。主要风险是从 r191 的 K=96 压到 64 后 exceed 反弹过大，导致 objective 仍落在 0.39-0.41 一带；但这同样是高信息量结论，因为它会把这条结构线从 low-cost 主线里更干净地收口。	/root/sparsify-ascend/research/history/logs/round0201_standard_1774986077.log
r202_1774987295	1774987295	ok	archive	0.14924508333206177	0.178402	0.40840200000000004	983040.0	0.23	655360.0	0.16	327680.0	0.08	64	shared_two_stage_residual_expert	1				/root/sparsify-ascend/checkpoints/research_agent/round_0202/round0202_standard_1774986746_dp2_bs1_ga8_ef1_k64_20260401_035232	3da0a2e9a0315dea7afc0f49a10ebaff91b67284			建议以 r199 为 reference，只改 ARCHITECTURE=shared_two_stage_residual_expert，做一轮 matched-objective architecture probe。它不是继续扫 incumbent 邻域，而是用当前最相关的 small-K 配方，直接验证“shared coarse 主干 + residual experts”是否比 routed-only 更有机会控制 exceed_alpha_0.50。	这轮严格满足单变量原则：相对 r199 只改 ARCHITECTURE。之所以不继续在 expert_topk 或 lowrank_expert_topk 上补 K/rank 插值，是因为当前目标已明确要求优先回答新的结构槽位是否值得继续；而 shared_two_stage_residual_expert 正好对应当前高优先级的不对称 MoE-like 假设。主要风险是该 family 当前 exact cost 会从 incumbent 的 0.19x 抬到约 0.23x，因此若 exceed 不能显著低于 routed-only，则 objective 仍大概率不会进入 0.30 附近；但这正是本轮要尽快澄清的结构问题。如果它在这个 lane 也不给出明显更好的 exceed tradeoff，就应尽快下调这条结构线的优先级。	/root/sparsify-ascend/research/history/logs/round0202_standard_1774986746.log
r203_1774987818	1774987818	ok	keep	0.23898851871490479	0.277226	0.447226	720896.0	0.17	393216.0	0.09	327680.0	0.08	64	shared_routed_expert_topk	1				/root/sparsify-ascend/checkpoints/research_agent/round_0203/round0203_standard_1774987445_dp2_bs1_ga8_ef1_k64_20260401_040412	256f989e469a6d4818068a2341b9e59c20dc8148			建议以 r159 为 reference，只改 ACTIVE_EXPERTS=1。这个动作不是同 family 的低信息插值，而是一次直接改变 active path 长度的结构性 probe，用来回答 shared+routed 家族能否在更短在线路径上进入更低 cost regime。	这轮满足单变量原则：相对 r159 只改 ACTIVE_EXPERTS。虽然它不是 brand-new family，但它也不是 incumbent 邻域的线性 K 扫描；它直接改变了 active path 与容量分工关系，信息增量高于继续补 small K 或 rank。之所以优先它，而不是再切一个历史上已明显偏弱的新 family，是因为当前 0.18x-0.22x lane 里真正接近 incumbent 的兼容结构只剩 `shared_routed_expert_topk`；而把 routed path 从 2 压到 1 会把 exact total_cost 直接拉到约 0.17x，是当前最值得尽快验证的 regime-shift 假设。主要风险是旧的单路 routed 证据 r114 在更宽 per-expert 配方上出现了明显 exceed 回弹；如果这轮也重现同样模式，就应果断结束这条单路 shared+routed 线，而不是继续细扫。	/root/sparsify-ascend/research/history/logs/round0203_standard_1774987445.log
r204_1774988427	1774988427	ok	discard	0.3169121742248535	0.361829	0.551829	811008.0	0.19	483328.0	0.12	327680.0	0.08	64	shared_lowrank_routed_expert_topk	1				/root/sparsify-ascend/checkpoints/research_agent/round_0204/round0204_standard_1774987998_dp2_bs1_ga8_ef1_k64_20260401_041325	03a67bf3035263614e6e933cb3188566fad4ab54			建议以 r203 为 reference，只改 `ARCHITECTURE=shared_lowrank_routed_expert_topk`。这不是继续围绕 incumbent 做局部插值，而是用同一个 `K=64, ACTIVE_EXPERTS=1, LATENTS_PER_EXPERT=160` 的 cheap active-path recipe，直接回答当前最高优先级未决问题之一：把 shared 分支从 full-head 改成 low-rank bottleneck 后，是否能让单路 routed 结构在 `~0.19x` lane 里不再因为 exceed 失控而失败。	这轮严格满足单变量原则：相对 r203 只改 `ARCHITECTURE`。之所以不继续围绕 r199 做 `K/TRUNK_RANK/LATENTS_PER_EXPERT` 细扫，是因为 r202 与 r203 已经提供了更重要的结构证据缺口：当前真正未知的不是 incumbent 邻域还能不能抠出 0.00x，而是“单路短 active path”是否只有 plain shared+routed 失败，还是连更轻的 shared bottleneck 版本也一起失败。确实存在历史负信号：`shared_lowrank_routed_expert_topk` 在 r172/r174/r179 的更高 cost 带（约 0.25x-0.29x）表现偏弱；但当前 `K=64, ACTIVE_EXPERTS=1` 的约 0.19x matched lane 仍未被干净验证，而且它正好对应 prompt 里优先级很高的 `shared bottleneck + expert-specific head` 槽位。主要风险是该 family 也无法修复 r203 暴露出的 exceed 爆炸；但如果如此，就可以更果断地下调这条 single-active shared-bottleneck 线，而不是继续在它周围消耗预算。	/root/sparsify-ascend/research/history/logs/round0204_standard_1774987998.log
r205_1774989125	1774989125	ok	keep	0.16161774098873138	0.192283	0.402283	884736.0	0.21	557056.0	0.13	327680.0	0.08	64	shared_two_stage_residual_expert	1				/root/sparsify-ascend/checkpoints/research_agent/round_0205/round0205_standard_1774988602_dp2_bs1_ga8_ef1_k64_20260401_042329	43ae94a4cfe6f2f8d5645a113d748971601117db			建议以 r201 为 reference，只改 `STAGE1_RATIO=0.125`。这不是同 family 的低信息细扫，而是一次 exact cost-matched 的 budget-allocation probe：本地复核显示在 `shared_two_stage_residual_expert K=64 A=2 L=160` 上，`STAGE1_RATIO` 从 0.125 到 0.5 的 total_cost 都保持 `884736 accesses`、即 `0.210938x`，因此这轮能非常干净地回答当前最有价值的未决问题之一: r201 离 incumbent 仍差的那一截，究竟是不是 residual cleanup 预算分配不对。	这轮严格满足单变量原则：相对 r201 只改 `STAGE1_RATIO`。之所以这轮不再切 brand-new family，是因为最近三轮结构 probe 已经连续排除了两条高优先级短路径假设：r203 的 `shared_routed_expert_topk A1` 与 r204 的 `shared_lowrank_routed_expert_topk A1` 都出现明显 exceed 爆炸；而 r201 则是当前 target 上仍留在主战场附近、且最接近 incumbent 的新 family。选择 `STAGE1_RATIO=0.125` 而不是继续加 `LATENTS_PER_EXPERT`，是因为 r202 已经说明增加 residual 容量确实能降 exceed，但代价是 cost 从 0.210938x 抬到 0.234375x；相比之下，`STAGE1_RATIO` 在本 recipe 下是几乎完美的归因旋钮，因为 exact cost 不变。主要风险是 coarse stage 被压得过轻，导致主干表达不足、FVU/exceed 一起恶化；但如果如此，就能更明确地判定这条 family 需要更强 coarse stage 而不是更多 cleanup，从而决定是否继续或归档。	/root/sparsify-ascend/research/history/logs/round0205_standard_1774988602.log
r206_1774989707	1774989707	ok	archive	0.15560157597064972	0.186004	0.396004	884736.0	0.21	557056.0	0.13	327680.0	0.08	64	shared_two_stage_residual_expert	1				/root/sparsify-ascend/checkpoints/research_agent/round_0206/round0206_standard_1774989188_dp2_bs1_ga8_ef1_k64_20260401_043315	18c5b8ccc6f41dcbe0d733068d3bab7121c5c1a8			建议以 r201 为 reference，只改 `STAGE1_RATIO=0.375`。这轮继续留在 `shared_two_stage_residual_expert`，不是低信息细扫，而是对 r205 的反向 exact-cost 验证：既然更多 cleanup 预算在同成本下已被证伪，当前最有价值的未决问题就是更强 coarse 主干是否才是这条 family 真正缺的那一块。	这轮严格满足单变量原则：相对 r201 只改 `STAGE1_RATIO`。之所以允许继续留在同一 family，而不是立刻切到全新结构槽位，是因为这里仍有一个高价值且尚未验证完的结构假设：`shared_two_stage_residual_expert` 是当前 target 上最接近 incumbent 的新 family，且 `STAGE1_RATIO` 是极少数可以在 exact cost 不变条件下直接回答“主干 vs cleanup 谁才是瓶颈”的旋钮。r205 已经明确否定了“更多 residual cleanup 预算会更好”这一方向，因此本轮反向测 `0.375` 不是线性插值，而是对该 family 核心分工假设的闭环验证。主要风险是更重 coarse 会让 residual cleanup 不足，导致 exceed 不降反升；但如果如此，就能更明确地结束这条 family 在 `K=64` lane 的预算分工问题，不再继续消耗轮次。	/root/sparsify-ascend/research/history/logs/round0206_standard_1774989188.log
r207_1774990346	1774990346	ok	archive	0.16646146774291992	0.197653	0.39765300000000003	835584.0	0.2	425984.0	0.1	409600.0	0.1	64	lowrank_expert_topk	1				/root/sparsify-ascend/checkpoints/research_agent/round_0207/round0207_standard_1774989857_dp2_bs1_ga8_ef1_k64_20260401_044424	821f4279cf02db673a6df437b2e3bc0855e11cac			建议以 r201 为 reference，只改 `ARCHITECTURE=lowrank_expert_topk`。这是一次回到主战场的 matched-objective architecture probe：在同样的 `K=64, A=2, L=160` recipe 下，用更便宜的 low-rank trunk + expert head 去对照刚刚完成分工验证的 two-stage coarse+cleanup 结构，判断当前最该保留的是 trunk+expert 还是 coarse+cleanup。	这轮严格满足单变量原则：相对 r201 只改 `ARCHITECTURE`。之所以不继续留在 `shared_two_stage_residual_expert` 上补 `STAGE1_RATIO=0.5` 或再扫别的局部轴，是因为 r201/r205/r206 已经形成足够清楚的闭环：更多 cleanup 预算更差，更强 coarse 预算虽更好但也只把 objective 压到 0.396941，仍未进入新的 regime。相比之下，`lowrank_expert_topk K=64 A=2 L=160 TR=16` 仍是当前最值得补的一条 matched lane：它有更低 exact cost（约 0.20x），并且 family 的已有 current-target 信号没有在这个 exact recipe 上被直接验证。相比另一条可选的新槽位 `shared_lowrank_two_stage_residual_expert`，它更贴近当前 0.18x-0.22x 主战场；后者本地 exact cost 已在约 0.23x，进入这轮前就已经更贵。主要风险是 `lowrank_expert_topk` 的 exceed 也维持在 0.188 左右，从而只能做到接近但难以越过 incumbent；但即使如此，这轮也能更明确地回答当前 low-cost 主战场里“trunk+expert vs coarse+cleanup”谁更值得继续，而不是继续在同一 family 内部消耗预算。	/root/sparsify-ascend/research/history/logs/round0207_standard_1774989857.log
r208_1774990979	1774990979	ok	keep	0.1712922751903534	0.202531	0.39253099999999996	778240.0	0.19	409600.0	0.1	368640.0	0.09	64	lowrank_expert_topk	1				/root/sparsify-ascend/checkpoints/research_agent/round_0208/round0208_standard_1774990486_dp2_bs1_ga8_ef1_k64_20260401_045453	bbe5a4f490b9e96bd587b969d842ba230573e2b7			建议以 r207 为 reference，只改 `TRUNK_RANK=8`。这轮虽然留在同一 family，但不是低信息细扫，而是一个目标非常明确的 cost-dominant 压缩验证：r207 已证明 `lowrank_expert_topk` 在 `K=64 A=2 L=160` 打开了新的低成本 lane，现在最有价值的问题就是再压 trunk 是否足以把 objective 直接推过 incumbent。	这轮严格满足单变量原则：相对 r207 只改 `TRUNK_RANK`。之所以在连续两轮未越过 incumbent 后，仍允许继续留在 `lowrank_expert_topk` 而不是强行切全新 family，是因为这里存在一个非常具体、且与单目标直接对齐的未验证高价值假设：r207 的剩余差距几乎完全来自 encoder cost，而 `TRUNK_RANK` 正是这个 family 最干净的 encoder-only 压缩旋钮。相比继续去测一个本地 exact cost 已在 0.23x 左右、且历史信号更弱的新 family，先把已经打开主战场低成本 lane 的 `lowrank_expert_topk` 再压一次 trunk，更有机会得到真正可行动的 objective 结论。主要风险是 rank=8 让 trunk 过薄，导致 exceed 回弹抵消全部 cost 收益；但这轮的价值仍然很高，因为它会明确告诉我们该 family 在当前 target 上是否还有继续左移的空间。	/root/sparsify-ascend/research/history/logs/round0208_standard_1774990486.log
