experiment_id	timestamp	status	decision	val_fvu	exceed_alpha_0_50	objective_score	total_cost	total_cost_ratio	selection_cost	selection_cost_ratio	deployment_accesses	deployment_ratio	k	architecture	expansion_factor	wall_time_sec	peak_memory_gb	total_tokens	checkpoint	head_commit	head_branch	workspace_dirty	description	self_review	log_path
r306_1775091250	1775091250	ok	keep	0.16265490651130676	0.184467	0.291644	449536.000000	0.107178	285696.000000	0.068115	163840.000000	0.039062	32	shared_conditional_cascade_product_key_expert_jumprelu	1				/root/sparsify-ascend/checkpoints/research_agent/round_0306/round0306_standard_1775089824_dp2_bs1_ga8_ef1_k32_20260402_083031	e764ddc126ad8e8a1ef448b66c27ee836d3f29b6			已实际修复 `shared_conditional_cascade_product_key_expert_jumprelu` 的 sanity 阻塞，且没有改 family_name 或 env_overrides。最小补丁只落在 `sparsify/sparse_coder.py`：为 cascade 家族在未显式传参时补齐 `active_experts=2` 的 family-local 默认。修复后，失败时同一条 bare-config sanity 命令和同一 `(architecture, K=32, EF=1)` integration smoke 都已本地通过。	这次 repair 没有重新设计实验，也没有改 family 或 override；只修了导致 sanity_failed 的最小实现缺口。风险主要在于这只是实例化阻塞修复，不代表结构效果已经被验证；但当前要求正是让原始实验能跑通，而这一步已经完成。	/root/sparsify-ascend/research/history/logs/round0306_standard_1775089824.log
r307_1775092654	1775092654	ok	archive	0.14866027235984802	0.160597	0.267775	449536.000000	0.107178	285696.000000	0.068115	163840.000000	0.039062	32	shared_cascade_product_key_expert_jumprelu	1				/root/sparsify-ascend/checkpoints/research_agent/round_0307/round0307_standard_1775091354_dp2_bs1_ga8_ef1_k32_20260402_085600	21762d737b885a8b5b6cefa25a12f84add482029			建议以 r305 为 reference，只改 `STAGE1_RATIO=0.125`。这是一次同成本、单变量、明确面向降低 exceed 的 knee 校准：不再减少 cleanup 深度，而是在当前 best cascade scaffold 上把更多 K 还给 routed residual cleanup，直接检验 hard-token tail 是否因此下降。	这轮仍留在 incumbent scaffold 邻域，但不是低信息细扫。之所以允许做这一个 patch，是因为 r306 已给出非常具体的新证据：条件关闭第二专家会显著恶化 exceed，说明当前值得优先验证的不是再发散开新 family，而是把同成本预算从 coarse 端挪回 cleanup 端，看交换率是否立刻改善。主要风险是 stage1 过薄后 shared coarse 主干退化，导致 exceed 不降反升；若如此，就应把 `STAGE1_RATIO` 这条轴视为已完成 knee 裁决，而不是继续围绕它补点。	/root/sparsify-ascend/research/history/logs/round0307_standard_1775091354.log
r308_1775094326	1775094326	ok	keep	0.17800554633140564	0.195853	0.278161	345224.000000	0.082308	181384.000000	0.043245	163840.000000	0.039062	32	shared_lowrank_cascade_product_key_expert_jumprelu	1				/root/sparsify-ascend/checkpoints/research_agent/round_0308/round0308_standard_1775093170_dp2_bs1_ga8_ef1_k32_20260402_092616	3983a89f9efea3998e1d7c358f3c4fe7b1a55dfd			已实现并接通 `shared_lowrank_cascade_product_key_expert_jumprelu`。建议以 r305 为 reference，只改 `ARCHITECTURE`，做一轮低成本 architecture probe，直接裁决“low-rank shared trunk + ordered PK cascade cleanup”是否能用约 `0.0823x` 的 total_cost_ratio 换回足够低的 exceed，从而优于当前 cascade incumbent。	这轮是高信息增量的新结构槽位，不是继续围绕 incumbent 做近邻插值。主要风险很明确：虽然 low-rank shared trunk 把 cost 大幅压低，但 expert pair 是从低秩 hidden `h(x)` 上路由出来的，而不是像 full cascade 那样直接从残差空间决定；如果 hard-token 的 tail signal 在低秩 hidden 里丢失，这条线会重复 plain shared-lowrank family 的老问题，exceed 仍可能明显偏高。即便如此，这一轮仍值得做，因为当前 prompt 已明确要求在最近两轮未改进后优先换结构槽位，而这条线同时满足“shared low-rank trunk + tiny routed experts”与“真正新的 cascade tail-cleanup 语义”，且本地 smoke、allowlist、policy 校验都已通过。	/root/sparsify-ascend/research/history/logs/round0308_standard_1775093170.log
r309_1775095692	1775095692	ok	archive	0.18036961555480957	0.196375	0.278909	346176.000000	0.082535	182336.000000	0.043472	163840.000000	0.039062	32	shared_lowrank_cascade_product_key_expert_jumprelu	1				/root/sparsify-ascend/checkpoints/research_agent/round_0309/round0309_standard_1775094511_dp2_bs1_ga8_ef1_k32_20260402_094837	8353b33e76da1ee79d8b9b47f1d89d3d047bcf23			建议以 r308 为 reference，只改 `NUM_EXPERTS=4096`。这是在当前新 scaffold 上的一次高信息量、近同成本 knee 校准，直接回答“更细的 many-tiny PK expert 分片”能否在几乎不抬 cost 的前提下明显降低 tail exceed。	这轮继续留在 r308 family 内，但不是低信息量的局部细扫。之所以允许做这一个 patch，是因为 r308 刚建立了一个新的低成本 scaffold，且它的失败形状很具体：cost 已经足够左，但 exceed 仍明显偏高。此时最值得优先回答的不是再开一个不相干 family，而是判断当前 short-path PK cleanup 的瓶颈到底来自 expert 粒度，还是来自 low-rank hidden 本身。`NUM_EXPERTS=4096` 的价值在于它几乎不增加 total_cost，却能显式测试 DeepSeekMoE 式“更细 expert 分片”是否能更好地服务 hard-token cleanup。主要风险是 low-rank hidden 已经把 tail routing 信号压扁，导致再增 expert 数也几乎不改善 exceed；但如果结果如此，这轮就能较干净地终结“只靠更细 micro-experts 就能救活 lowrank+cascade”这条分支。	/root/sparsify-ascend/research/history/logs/round0309_standard_1775094511.log
