experiment_id	timestamp	status	decision	val_fvu	exceed_alpha_0_50	objective_score	total_cost	total_cost_ratio	selection_cost	selection_cost_ratio	deployment_accesses	deployment_ratio	k	architecture	expansion_factor	wall_time_sec	peak_memory_gb	total_tokens	checkpoint	head_commit	head_branch	workspace_dirty	description	self_review	log_path
r265_1775034735	1775034735	ok	archive	0.18238085508346558	0.198818	0.278818	344064.0	0.08	180224.0	0.04	163840.0	0.04	32	adaptive_active_product_key_expert_jumprelu	1				/root/sparsify-ascend/checkpoints/research_agent/round_0265/round0265_standard_1775034095_dp2_bs1_ga8_ef1_k32_20260401_170141	f627828103aa4803718e0e996043f3cddd719da9			已落盘一个新的直接兼容 family `adaptive_active_product_key_expert_jumprelu`：在现有 `product_key_expert_jumprelu` 上加入按路由置信度自适应关闭次优 expert 的 variable-active path，并补齐 config whitelist、factory dispatch 与 AutoResearch override allowlist。该 family 已按计划 recipe 做过本地 instantiate/forward/backward smoke，exact cost 与 r263 持平，因此下一轮应做相对 r263 仅改 `ARCHITECTURE` 的 matched objective probe。	这轮没有继续做 PK width 的线性插值，而是切到一个和当前 winning family 直接相邻、但机制上真正不同的结构槽位：同样的 PK compositional routing，加上按难度自适应的 1-or-2 expert path。它保持单变量归因清晰，相对 r263 只改 `ARCHITECTURE`；同时又避免回到已给过较弱证据的 flat adaptive router。主要风险是当前 cost proxy 仍按 `ACTIVE_EXPERTS=2` 的 worst-case 计费，因此若收益存在，必须主要来自 exceed 下降而不是被 proxy 直接记到 cost 左移。	/root/sparsify-ascend/research/history/logs/round0265_standard_1775034095.log
r266_1775035570	1775035570	ok	archive	0.16146668791770935	0.179298	0.27929800000000005	401408.0	0.1	237568.0	0.06	163840.0	0.04	32	shared_product_key_expert_jumprelu	1				/root/sparsify-ascend/checkpoints/research_agent/round_0266/round0266_standard_1775034900_dp2_bs1_ga8_ef1_k32_20260401_171507	60dbd3ee1034aa05c4ddc96a63d011d2c7cdefb9			相对当前真实 frontier r263，仅切到已注册可运行的直接兼容 family `shared_product_key_expert_jumprelu`，用当前 `K=32, NUM_EXPERTS=1024, ACTIVE_EXPERTS=2, LATENTS_PER_EXPERT=56` 的 many-tiny PK recipe 做一轮 matched architecture probe。目标是直接回答“shared coarse library + PK routed micro-experts”在当前 target 上能否以约 0.10x 成本换回比 plain PK 更低的 exceed，从而真正改善 objective。	这轮遵守单变量原则，相对 r263 只改 `ARCHITECTURE`，没有继续在当前 winning family 上补 `K/LATENTS` 小插值。选择 `shared_product_key_expert_jumprelu` 而不是 `shared_lowrank_routed_expert_topk` 或 `shared_lowrank_two_stage_residual_expert`，理由不是名字新，而是它在当前 many-tiny recipe 下具有明显更现实的成本档位（约 0.10x 而非 0.19x），同时结构上更贴近本轮高优先级的“shared coarse + compositional residual cleanup”假设。主要风险是 r258 的旧负信号说明 shared+PK 不一定能显著降 exceed；但 r258 建立在更宽 head、更小 bank 的不同容量组织上，本轮正是要判断它在 1024-bank/56-width regime 下是否值得重新进入主线讨论。	/root/sparsify-ascend/research/history/logs/round0266_standard_1775034900.log
r267_1775036341	1775036341	ok	keep	0.1719641089439392	0.189030	0.28903	401408.0	0.1	237568.0	0.06	163840.0	0.04	32	product_key_expert_jumprelu	1				/root/sparsify-ascend/checkpoints/research_agent/round_0267/round0267_standard_1775035666_dp2_bs1_ga8_ef1_k32_20260401_172753	44d7d475f8fcebfd91b16d10f601308c855fea2c			以真实主线 r263 `product_key_expert_jumprelu` 为 reference，只改 `ACTIVE_EXPERTS=3`，在当前最佳 `K=32, NUM_EXPERTS=1024, LATENTS_PER_EXPERT=56` recipe 上做一轮 matched active-path probe。目标是在与 round 266 近同 exact 成本的条件下，直接判断“第三个 routed PK expert”是否比“shared coarse branch”更能压低 exceed，从而真正改善 objective。	这轮虽然不是 brand-new family，但也不是被下调优先级的低信息细扫。相对 r263 只改 `ACTIVE_EXPERTS`，归因非常干净；而且这条轴在当前最佳 PK recipe 上仍有一个高价值且未验证的问题。选择 `2 -> 3` 而不是再切一个新 shared/lowrank 槽位，有两个原因：第一，用户在本轮提示里明确指出当前 layer3 q_proj 主线不应再反复回退到 `AE=1`，若要回答 active-path 形状，应优先做 `2 -> 3` 的直接对照；第二，AE=3 的 exact cost 恰好与 round 266 的 shared+PK 同档，因此这轮能非常干净地比较“第三个 routed expert”和“shared coarse branch”谁更值得这笔成本。主要风险是第三个 expert 带来的增益不足以超过 extra selection cost，导致 objective 仍不如 round 266；但即使如此，这轮也会把当前 0.10x 带的容量分配问题裁得很清楚。	/root/sparsify-ascend/research/history/logs/round0267_standard_1775035666.log
r268_1775037179	1775037179	ok	archive	0.15964436531066895	0.180281	0.280281	401408.0	0.1	237568.0	0.06	163840.0	0.04	32	shared_product_key_expert_jumprelu	1				/root/sparsify-ascend/checkpoints/research_agent/round_0268/round0268_standard_1775036509_dp2_bs1_ga8_ef1_k32_20260401_174155	67cdc88927d071b9b702a1e0d55d0e02ee028284			以 r266 为 reference，只改 `STAGE1_RATIO=0.5`，在完全同 exact cost 的条件下对 `shared_product_key_expert_jumprelu` 做一次 coarse-vs-cleanup 预算分工 probe。目标是回答：在当前 many-tiny PK recipe 下，shared coarse branch 是否值得占用更多 K 预算，从而进一步压低 exceed_alpha_0.50 并把 objective 真正往下推。	这轮遵守单变量原则，相对 r266 只改 `STAGE1_RATIO`，没有把架构切换、K 变化或 expert 容量变化混在一起。之所以选 `0.5` 而不是更小步的 `0.375`，是因为本轮目标不是做低信息细扫，而是在 exact 同成本下对当前最强 recent signal 做一次更有裁决力的分工测试：r266 已经证明“shared coarse + PK cleanup”优于同成本的第三个 routed expert，下一问就该是 shared 分支是否还应更强。主要风险是 expert cleanup 才是当前 family 的核心收益来源，若把 stage1_k 从 8 提到 16 后 exceed 回升，则可以较清晰地判定该 family 在当前 hookpoint 上只适合轻量 shared coarse，不值得继续沿 shared-budget 方向深挖。	/root/sparsify-ascend/research/history/logs/round0268_standard_1775036509.log
r269_1775037891	1775037891	ok	keep	0.16496148705482483	0.181467	0.281467	401408.0	0.1	237568.0	0.06	163840.0	0.04	32	shared_product_key_expert_jumprelu	1				/root/sparsify-ascend/checkpoints/research_agent/round_0269/round0269_standard_1775037246_dp2_bs1_ga8_ef1_k32_20260401_175413	e20b3d6d80a0395419da6e31c38d384a8006b240			以 r266 为 reference，只改 `STAGE1_RATIO=0.125`，在完全同 exact cost 下继续裁决 `shared_product_key_expert_jumprelu` 的 coarse-vs-cleanup 分工。目标是测试 shared branch 是否应缩到更轻的 coarse hint，从而进一步降低 exceed_alpha_0.50 并刷新当前 exact objective。	这轮仍遵守单变量原则，相对 r266 只改 `STAGE1_RATIO`。之所以允许在同 family 再做一轮，不是因为满足于局部细扫，而是因为 r268 已经给出一个有方向性的强信号：shared+PK 本身值得保留，但更重的 shared coarse 不值；因此当前 family 还剩下一个足以改变结论的高价值假设，即 optimum 是否在 `0.25` 左侧。选 `0.125` 而不是 `0.375`，是因为 r268 已经说明向更大 shared 侧移动大概率不是主线，当前更有信息量的是直接测试“minimal shared + maximal cleanup”能否进一步压 tail error。主要风险是 stage1_k 从 8 降到 4 后 shared coarse 过弱，导致 exceed 反弹；若如此，这条 family 的 split 结论就会基本收敛在“轻量 shared coarse，约 0.25 附近”为止，后续应切回新的结构槽位。	/root/sparsify-ascend/research/history/logs/round0269_standard_1775037246.log
r270_1775038629	1775038629	ok	discard	0.37430089712142944	0.384626	0.504626	485376.0	0.12	321536.0	0.08	163840.0	0.04	32	shared_product_key_factorized_expert_topk	1				/root/sparsify-ascend/checkpoints/research_agent/round_0270/round0270_standard_1775038080_dp2_bs1_ga8_ef1_k32_20260401_180807	b5c098d5fbf5a4859f83bb48d0a0825f428b5986			切到新的 matched architecture probe：以 r266 为 reference，只改 `ARCHITECTURE=shared_product_key_factorized_expert_topk`。目标是在保留当前最强 recent 结构分工 shared+PK 的前提下，直接测试把 full expert heads 压成 tiny factorized heads 后，objective 是否还能继续下降。	这轮遵守单变量原则，相对 r266 只改 `ARCHITECTURE`。之所以不继续留在 `shared_product_key_expert_jumprelu` 做 `LATENTS_PER_EXPERT/K` 局部补点，是因为最近两轮已经把该 family 最核心的 split 假设裁得很清楚：更重或更轻的 shared coarse 都更差，继续细扫的信息增量很低，不符合当前默认应切换结构槽位的规则。之所以选 `shared_product_key_factorized_expert_topk` 而不是 `shared_lowrank_*`、`factorized_router_expert_topk` 或再回 `hashed_expert_jumprelu`，是因为它最直接承接当前唯一 recent 正信号 `shared+PK`，同时把变化局限在 expert 内部头部表达能力这一条高价值结构轴上；而 shared-lowrank 系列在当前 target 的 small-K lane 已有多次强负信号，hash 与 plain PK-factorized 也已有更直接的坏迹象。主要风险是 factorized local head 会像 r259 那样严重伤害 exceed；但 r259 建立在 128-bank/192-width 的不同容量组织上，本轮 many-tiny 1024-bank/56-width 的 clean re-test 仍有结构信息价值。如果它仍明显失败，就可以更果断地下调“tiny factorized experts”在当前 hookpoint 上的优先级。	/root/sparsify-ascend/research/history/logs/round0270_standard_1775038080.log
r271_1775039404	1775039404	ok	archive	0.14792293310165405	0.165215	0.285215	483328.0	0.12	237568.0	0.06	245760.0	0.06	48	shared_product_key_expert_jumprelu	1				/root/sparsify-ascend/checkpoints/research_agent/round_0271/round0271_standard_1775038734_dp2_bs1_ga8_ef1_k48_20260401_181901	a4e73547ec88c41d42f6385db8b28bdd51dea0df			回到当前唯一有 recent 正信号的 `shared_product_key_expert_jumprelu`，以 r266 为 reference 只改 `K=48`，做一轮 shared+PK 在 many-tiny recipe 下的容量 knee probe。目标是判断稍高 deploy budget 是否能把 exceed 真正压到足以刷新当前 best exact objective。	这轮遵守单变量原则，相对 r266 只改 `K`。虽然最近两轮没有把 objective 再往下推，但其中一轮已经按规则切到了新结构槽位 `shared_product_key_factorized_expert_topk`，且给出了极强负信号；在这种情况下，直接继续切到另一个已多次负面的 family，信息增量并不比把当前唯一 recent 正信号做一次真正的容量 knee probe 更高。选择 `K=48` 而不是 `K=40/64` 的原因是：`K=40` 只需要约 0.0098 的 exceed 改善，过于接近小修小补；`K=64` 则需要约 0.039 的 exceed 改善，门槛偏硬。`K=48` 处在更合理的中间档，既是明确的容量测试，又仍保留现实赢面。主要风险是 exceed 下降幅度不足以覆盖额外 deployment 成本，导致 objective 仍不如 r266；但如果如此，也能更清晰地说明当前 shared+PK 线在 `K=32` 附近已经接近局部 knee，后续应回到新的结构槽位而不是继续沿 K 轴上探。	/root/sparsify-ascend/research/history/logs/round0271_standard_1775038734.log
r272_1775040260	1775040260	ok	archive	0.16397443413734436	0.180959	0.280959	401408.0	0.1	237568.0	0.06	163840.0	0.04	32	shared_adaptive_active_product_key_expert_jumprelu	1				/root/sparsify-ascend/checkpoints/research_agent/round_0272/round0272_standard_1775039621_dp2_bs1_ga8_ef1_k32_20260401_183347	51674efc767e4216fe83b1291c562198eb7f7206			已新增并本地验证 `shared_adaptive_active_product_key_expert_jumprelu`。建议以 r266 为 reference，只改 `ARCHITECTURE=shared_adaptive_active_product_key_expert_jumprelu`，做一轮新的 matched architecture probe，直接回答“shared coarse + PK cleanup + variable-active path by difficulty”是否能在同成本下压低 exceed。	这轮满足当前 round-272 的默认规则：最近两轮没有把 objective 明显拉低，因此优先切换到新的结构槽位，而不是继续沿 `shared_product_key_expert_jumprelu` 做 `K/LATENTS/STAGE1_RATIO` 细扫。之所以选这个新 family，而不是再回到 hash、PK-factorized、shared-lowrank 或旧的 adaptive-active non-shared 方向，是因为它直接承接当前唯一 recent 正信号 `shared+PK`，同时把变化局限在 prompt 明确高优先级、但尚未在这条主线上被验证过的“按难度自适应 active path”这一条结构轴上。工程改动被限制在必要文件：`sparsify/config.py`、`sparsify/sparse_coder.py`、`research/AutoResearch/override_registry.py`；没有新增 tunable env key，只是为新 architecture 接通现有 expert/STAGE1/JUMPRELU 参数集。主要风险是当前 cost proxy 仍按 worst-case `ACTIVE_EXPERTS=2` 计费，因此这轮若成功只能体现为 exceed 改善而非 cost 下降；但这恰好让结构判断更干净。如果连这个“shared+PK 的更强 Expert-Choice 变体”都无法在 same-cost lane 改善 objective，就可以更有把握地下调 variable-active 方向在当前 hookpoint 上的优先级。	/root/sparsify-ascend/research/history/logs/round0272_standard_1775039621.log
r273_1775043524	1775043524	ok	keep	0.16774076223373413	0.186414	0.296414	458752.0	0.11	212992.0	0.05	245760.0	0.06	32	lowrank_product_key_expert_jumprelu	1				/root/sparsify-ascend/checkpoints/research_agent/round_0273/round0273_standard_1775042881_dp2_bs1_ga8_ef1_k32_20260401_192807	7a79a6743ea761b7e25cd5cc5cdee73dacb76067			已集成并校验 `lowrank_product_key_expert_jumprelu`，建议以 r266 为 reference，只改 `ARCHITECTURE` 做一轮 prototype probe，裁决“low-rank trunk + PK tiny cleanup”能否在约 `0.11x` total cost 下比当前 shared+PK scaffold 更强地压低 exceed。	这轮满足单变量原则：运行配置相对 r266 只改 `ARCHITECTURE`。代码侧新增 family 已完成最小必要接线，并补了 compatibility registry 记录；没有引入新 tunable key，因此不需要改 `config_resolution`、`runner` 或 `scripts/autoresearch_test.sh`。主要风险是 dense trunk 带来的额外 deploy cost（相对 r266 多 `0.013671875x`）换不回足够的 exceed 改善；但这正是一个高信息量的 matched architecture probe，能直接回答“shared sparse coarse”是否真的是当前 scaffold 必需件。	/root/sparsify-ascend/research/history/logs/round0273_standard_1775042881.log
r274_1775044528	1775044528	ok	keep	0.16134148836135864	0.177462	0.287462	458752.0	0.11	294912.0	0.07	163840.0	0.04	32	dual_shared_product_key_expert_jumprelu	1				/root/sparsify-ascend/checkpoints/research_agent/round_0274/round0274_standard_1775043885_dp2_bs1_ga8_ef1_k32_20260401_194451	54bfe51ba6537328767f0d62bbe65e4489260e7f			已新增并接通 `dual_shared_product_key_expert_jumprelu`。建议以 r269 为 reference，只改 `ARCHITECTURE` 做一轮 matched architecture probe，直接裁决“在 shared+PK scaffold 上把 always-on shared coarse 从 1 个微专家扩到 2 个”能否在与 r273 同成本的 `0.109375x` 档位更有效地压低 exceed。	这轮满足代码与实验两层约束。代码侧新增了一个最小新 family，并完成 whitelist、factory dispatch、allowlist、compatibility registry 与 exact smoke；没有新增 tunable key，因此不需要改 `config_resolution`、`runner` 或 `scripts/autoresearch_test.sh`。实验侧相对 r269 仍只改一个 env 参数 `ARCHITECTURE`。选择这条线而不是回到 `shared_lowrank_*` / `shared_two_stage_*` 已注册家族，是因为按当前 1024-expert/56-width/K32 recipe 的本地 exact cost 复核，它们分别约在 `0.19x`、`0.33x`、`0.42x`，明显偏离当前 `0.08x~0.14x` 主战场；而本轮新 family 保持在 `0.109375x`，更符合“近同成本下争取更低 exceed”的要求。主要风险是 shared coarse 容量翻倍仍不足以把 exceed 拉到赢 incumbent 所需阈值，但即便失败，这轮也能高信息量地回答：在当前 winning scaffold 上，问题更像是 shared capacity 不足，还是 cleanup 语义本身不对。	/root/sparsify-ascend/research/history/logs/round0274_standard_1775043885.log
r275_1775045355	1775045355	ok	archive	0.15469904243946075	0.172059	0.282059	458752.0	0.11	294912.0	0.07	163840.0	0.04	32	dual_shared_product_key_expert_jumprelu	1				/root/sparsify-ascend/checkpoints/research_agent/round_0275/round0275_standard_1775044716_dp2_bs1_ga8_ef1_k32_20260401_195842	1fdde6e3f089d38a755b8824271ae1ac7a26c16d			以 r274 为 reference，只改 `STAGE1_RATIO=0.25`，在 exact 同成本 `0.109375x` 下测试 dual-shared scaffold 是否只是 shared 激活预算不足。目标是回答：把 dual-shared coarse branch 从 4 个激活位提到 8 个、同时保留 24 个 PK cleanup 位，能否继续明显压低 exceed，并把 objective 拉回 incumbent 附近。	这轮满足单变量原则：相对 r274 只改 `STAGE1_RATIO`。虽然当前阶段整体应优先新结构槽位，但 dual-shared 是刚获得一轮真实正向 exceed 信号的新 scaffold，且 `STAGE1_RATIO` 在该 family 上已本地复核为 exact 同成本轴，因此这是一轮信息密度足够高、且不混入成本变化的必要 follow-up，而不是低价值邻域细扫。选择 `0.25` 而不是 `0.1875` 或 `0.375`，是因为当前已知单-shared best split 在 0.25，而 r274 的 `0.125` 很可能只是让更大的 shared bank 处于激活不足状态；优先回到历史更强的 shared-budget 工作点更有裁决力。主要风险是 dual-shared 的改进已经主要来自“多一个 shared bank”本身，split 只会带来很小变化；但若如此，这一轮也能干净地把结论收敛到“dual-shared scaffold 需要换结构，不值得继续调 split”。	/root/sparsify-ascend/research/history/logs/round0275_standard_1775044716.log
r276_1775046246	1775046246	ok	archive	0.1581931710243225	0.174731	0.284731	458752.0	0.11	294912.0	0.07	163840.0	0.04	32	dual_shared_adaptive_active_product_key_expert_jumprelu	1				/root/sparsify-ascend/checkpoints/research_agent/round_0276/round0276_standard_1775045606_dp2_bs1_ga8_ef1_k32_20260401_201333	c17c194be2a4ff6418cfef9140bdfbdfe759e803			已新增并接通 `dual_shared_adaptive_active_product_key_expert_jumprelu`。建议以 r275 为 reference，只改 `ARCHITECTURE` 做一轮 matched architecture probe，直接裁决“更厚 shared coarse 主干 + 按难度可变 1-or-2 PK cleanup path”能否在与 dual-shared fixed-AE 完全同成本的 `0.109375x` 档位继续显著压低 exceed。	这轮符合当前阶段约束。最近两轮 r274-r275 都停留在同一 dual-shared family 内，且 objective 仍未接近 incumbent；按策略此时应优先换结构槽位，而不是继续补 `STAGE1_RATIO` 近邻点。选择 `dual_shared_adaptive_active_product_key_expert_jumprelu` 而不是继续在 dual-shared 上做 `0.125/0.375` 分裂点，是因为它直接测试当前高优先级方向“variable-active path by difficulty”，同时完全建立在已有 winning scaffold 的近同成本升级上。代码侧仅新增最小 family，并完成 whitelist、factory dispatch、override allowlist、compatibility registry 与 exact-string smoke；没有新增 tunable key，因此不需要改 `config_resolution`、`runner` 或 `scripts/autoresearch_test.sh`。主要风险是 adaptive active 在单-shared 版本上曾给过弱负信号；但 dual-shared scaffold 已把 coarse 主干抬强，当前最有价值的问题正是这是否能让 difficulty-aware cleanup 真正发挥作用。	/root/sparsify-ascend/research/history/logs/round0276_standard_1775045606.log
r277_1775047327	1775047327	ok	keep	0.20129787921905518	0.223148	0.30314800000000003	342592.0	0.08	178752.0	0.04	163840.0	0.04	32	shared_lowrank_product_key_expert_jumprelu	1				/root/sparsify-ascend/checkpoints/research_agent/round_0277/round0277_standard_1775046682_dp2_bs1_ga8_ef1_k32_20260401_203129	310011185e64ee056f246794481171374287af9f			已新增并接通 `shared_lowrank_product_key_expert_jumprelu`。建议以 r263 为 reference，只改 `ARCHITECTURE` 做一轮 matched architecture probe，直接裁决“廉价 low-rank shared coarse + full-expert PK cleanup”能否在 `0.08168x` 的低成本档位把 objective 真正压低。	这轮符合当前运行优先级。r274-r276 已经在 dual-shared scaffold 上连续给出不够强的 objective 信号，其中 r275 虽有正向 exceed 改善，但仍未接近 incumbent，而 r276 的 adaptive 变体又回退；按规则此时应优先换结构槽位，而不是继续在同一 scaffold 上做 split/active-path 邻域细扫。选择 `shared_lowrank_product_key_expert_jumprelu` 而不是继续堆 dual-shared 变体，是因为它更直接对应当前高优先级方向“shared bottleneck + expert-specific head”，同时保留当前已验证有效的 PK cleanup 语义，并且本地 exact cost 复核落在 `~0.08x`，明显优于 `shared_lowrank_*` 旧家族在当前 1024-expert recipe 下的 `~0.19x` 高成本负信号。代码侧只新增最小 family，并完成 whitelist、factory dispatch、override allowlist、compatibility registry 与 exact-string smoke；没有新增 tunable env key，因此不需要改 `config_resolution`、`runner` 或 `scripts/autoresearch_test.sh`。主要风险是低秩 shared bottleneck 可能过弱，shared coarse 只是在 cost 上更左却换不回足够的 exceed 改善；但这正是一个高信息量、近同成本的新结构 probe。	/root/sparsify-ascend/research/history/logs/round0277_standard_1775046682.log
r278_1775048226	1775048226	ok	keep	0.20013664662837982	0.221794	0.301794	345728.0	0.08	181888.0	0.04	163840.0	0.04	32	dual_shared_lowrank_product_key_expert_jumprelu	1				/root/sparsify-ascend/checkpoints/research_agent/round_0278/round0278_standard_1775047583_dp2_bs1_ga8_ef1_k32_20260401_204629	d1ede15e0f228c71c6ff713331ff80db4ae9f346			已新增并接通 `dual_shared_lowrank_product_key_expert_jumprelu`。建议以 r263 为 reference，只改 `ARCHITECTURE` 做一轮 matched architecture probe，直接裁决“更厚的 low-rank shared coarse + full-expert PK cleanup”能否在 `0.08243x` 的低成本档位修复 r277 的 exceed 崩塌。	这轮符合当前阶段优先级。r274-r277 已连续探索了 dual-shared、adaptive、single-shared-lowrank 三个不同槽位，其中只有 dual-shared 给出一定正向 exceed 信号，而最新 r277 证明“single lowrank shared coarse + PK cleanup”虽然极便宜，但 exceed 崩得太厉害。选择 `dual_shared_lowrank_product_key_expert_jumprelu` 的理由不是继续做邻域插值，而是用一个最小新结构直接回答 r277 暴露出的核心问题：失败是来自 lowrank shared 表达本身，还是来自 shared coarse 容量太薄。相对 r263 只改 `ARCHITECTURE`，满足单变量规则；代码侧只新增最小 family，并完成 whitelist、factory dispatch、override allowlist、compatibility registry 与 exact-string smoke。主要风险是即便 shared coarse 翻倍，lowrank shared 表达仍可能不够，导致 exceed 仍远高于 target；但这轮会以很低的额外成本给出一个高信息量结论。	/root/sparsify-ascend/research/history/logs/round0278_standard_1775047583.log
r279_1775049240	1775049240	ok	keep	0.15307489037513733	0.171186	0.281186	458752.0	0.11	294912.0	0.07	163840.0	0.04	32	dual_shared_product_key_expert_jumprelu	1				/root/sparsify-ascend/checkpoints/research_agent/round_0279/round0279_standard_1775048595_dp2_bs1_ga8_ef1_k32_20260401_210322	f66f96c090e00b92955deef153b0b2cea91a4886			以 r275 为 reference，只改 `STAGE1_RATIO=0.375`，继续校准 `dual_shared_product_key_expert_jumprelu` 的 coarse/cleanup 分工 knee。这个点保持同一 family、同一成本档和同一 active path，直接回答更强 dual-shared coarse allocation 是否还能继续压低 exceed，并判断 r275 的 0.25 是否已是平台。	这轮严格满足单变量原则：相对 r275 只改 `STAGE1_RATIO`。之所以没有继续推进低秩 shared 线，是因为 r277/r278 已给出一致强负信号；之所以没有再开全新 family，是因为 `dual_shared_product_key_expert_jumprelu` 刚在 r275 给出当前最强的新 scaffold 信号，而 `0.125 -> 0.25` 的同成本改善说明 split 轴仍未判死。主要风险是 0.25 已经是该 family 的 knee，继续加 shared 比例可能挤压 expert cleanup 容量、让 exceed 回升；但这正是当前最值得用一轮干净 param_only 回答的问题。	/root/sparsify-ascend/research/history/logs/round0279_standard_1775048595.log
r280_1775050206	1775050206	ok	archive	0.15337976813316345	0.171273	0.281273	458752.0	0.11	294912.0	0.07	163840.0	0.04	32	residual_dual_shared_product_key_expert_jumprelu	1				/root/sparsify-ascend/checkpoints/research_agent/round_0280/round0280_standard_1775049536_dp2_bs1_ga8_ef1_k32_20260401_211903	2724a31faf5f351d39a2b275b54dbd1bcc63baa0			已落盘并自检新的 `residual_dual_shared_product_key_expert_jumprelu`。建议以 r279 为 reference，只改 `ARCHITECTURE`，做一轮与 dual-shared scaffold 同成本的 matched architecture probe，直接裁决“串联 residual shared coarse + PK cleanup”是否比现有并行 dual-shared 更能压低 exceed。	这轮代码改动和实验设计都满足约束。代码侧我只做了最小新 family 接入：`sparsify/config.py` whitelist、`sparsify/sparse_coder.py` dispatch+实现、`research/AutoResearch/override_registry.py` allowlist、`research/AutoResearch/prior_research_history.md` compatibility 行；没有新增 tunable env key，因此不需要改 `controller.py`、`config_resolution.py`、`runner.py` 或 `scripts/autoresearch_test.sh`。实验侧相对 r279 仍只改一个 env 参数 `ARCHITECTURE`。之所以现在值得开新 family，而不是继续扫 `STAGE1_RATIO` 或回到 low-rank/variable-active 线，是因为 r279 只给出很小的同 family 改善，且 r276/r277/r278 已分别对 adaptive-active 与 low-rank shared 给出负信号。主要风险是这个新 family 虽然保持 exact 同成本，但串联 shared residual 可能只改善均值误差而不改善 exceed；如果结果如此，就可以更果断地结束 dual-shared 邻域的继续打磨。	/root/sparsify-ascend/research/history/logs/round0280_standard_1775049536.log
r281_1775051537	1775051537	ok	archive	0.16358110308647156	0.180772	0.300772	516096.0	0.12	352256.0	0.08	163840.0	0.04	32	shared_stacked_product_key_expert_jumprelu	1				/root/sparsify-ascend/checkpoints/research_agent/round_0281/round0281_standard_1775050717_dp2_bs1_ga8_ef1_k32_20260401_213844	6681cb1731695f2cb2ebe91a0adb9898def82b4b			已新增并本地验证 `shared_stacked_product_key_expert_jumprelu`。建议以 r266 为 reference，只改 `ARCHITECTURE` 做一轮 matched architecture probe，测试 shared coarse + PK routed cleanup 在复用同一 expert set 的两次 residual cleanup 后，是否能以 `当前口径下的 total_cost_ratio 已重新复核 显著压低 exceed_alpha_0.50。	这轮满足当前阶段约束。主假设只有一个：在当前 best scaffold `shared_product_key_expert_jumprelu` 上，不再扫 `K/LATENTS/STAGE1_RATIO` 邻域，而是引入一个真正不同的 cleanup 语义升级。工程改动控制在架构注册最小闭环内：config whitelist、factory dispatch、具体类实现、override allowlist、兼容性注册文档都已落盘；没有新增 tunable env key，因此未扩散到 `config_resolution/runner/scripts`。选择 r266 作为 reference 是因为它是当前 exact best scaffold；相对它只改 `ARCHITECTURE`，归因最干净。主要风险也很明确：新 family 虽把 cost 维持在现实的 0.123x 档位，但要赢过 r266 仍需把 exceed 从 0.179 附近压到约 0.152 以下，门槛不低；不过这比已有 0.19x shared-lowrank/two-stage 家族要求的 `exceed<0.09` 现实得多，也更贴近当前 prompt 的“更强 hard-token cleanup”问题。	/root/sparsify-ascend/research/history/logs/round0281_standard_1775050717.log
r282_1775052462	1775052462	ok	keep	0.1521817445755005	0.168418	0.26841800000000005	429056.0	0.1	265216.0	0.06	163840.0	0.04	32	shared_product_key_expert_jumprelu	1				/root/sparsify-ascend/checkpoints/research_agent/round_0282/round0282_standard_1775051668_dp2_bs1_ga8_ef1_k32_20260401_215434	f6437b5f384c89dc76bc32a5f3b1a53ac7736f82			建议以 r266 为 reference，只改 `NUM_EXPERTS=2048`，在保持 `shared_product_key_expert_jumprelu` 其余 recipe 不变的前提下，执行一轮 finer-grained micro-expert capacity probe，直接测试更细 expert 分片能否在近同成本下明显压低 exceed_alpha_0.50。	这轮有意在“最近两轮未显著拉低 objective”的背景下，做一个仍留在 winning scaffold 上、但信息增量高于普通局部细扫的 probe。之所以没有继续改 `K/STAGE1_RATIO/LATENTS_PER_EXPERT`，也没有继续沿 r281 的 stacked cleanup family 做 follow-up，是因为那些轴的近期证据已经说明它们更像局部校准，不像能带来新的 cost/exceed regime。选择 `NUM_EXPERTS=2048` 的原因是：它直接对应 prompt 高优先级的“更细粒度 experts / compositional routing”问题，同时保持 `ACTIVE_EXPERTS=2` 的短 active path 与 `K=32` 的 deployment 预算不变，归因很干净。主要风险是这仍属于同一 family 内的容量组织调整，而不是 brand-new family；但和被明确下调优先级的近邻细扫不同，这一改动回答的是一个当前仍未被 clean 验证的结构性问题：small-K 下的 hard-token exceed 是否主要受 routed expert bank 粒度限制。	/root/sparsify-ascend/research/history/logs/round0282_standard_1775051668.log
