experiment_id	timestamp	status	decision	val_fvu	exceed_alpha_0_50	objective_score	total_cost	total_cost_ratio	selection_cost	selection_cost_ratio	deployment_accesses	deployment_ratio	k	architecture	expansion_factor	wall_time_sec	peak_memory_gb	total_tokens	checkpoint	head_commit	head_branch	workspace_dirty	description	self_review	log_path
r148_1774856463	1774856463	ok	discard	0.11400698870420456	0.13998758792877197	0.649987587928772	2146304.0	0.51	1572864.0	0.38	573440.0	0.14	112	two_stage_residual_expert	1				/root/sparsify-ascend/checkpoints/research_agent/round_0148/round0148_standard_1774855859_dp2_bs1_ga8_ef1_k112_20260330_153105	0c74c8b93064145d67ed672cc9d4b50d98490450			建议以 r146 为 reference，仅设置 `ARCHITECTURE=two_stage_residual_expert`。这是一次低到中成本带的 matched architecture probe：在约 0.48x total_cost 下复验 trunk-free staged residual expert，直接判断“coarse library + expert residual”是否比当前已测的 shared-lowrank hetero residual 更值得继续。	这轮满足单变量原则：相对 r146 只改 `ARCHITECTURE`。在 r147 已给出 shared-lowrank hetero residual 的新负信号后，继续围绕该 family 或 `lowrank_expert_*` 做局部旋钮微调都不符合当前结构扩展优先级；切到 `two_stage_residual_expert` 能用当前最新的 matched recipe 直接测试另一条高优先级但近期未复验的 trunk-free staged 结构。风险是该 family 历史上已有偏弱信号，但当前 recipe 的 ACTIVE_EXPERTS=2、LATENTS_PER_EXPERT=224 与旧结果差异足够大，仍有必要做一次干净的低中成本复验。	/root/sparsify-ascend/research/history/logs/round0148_standard_1774855859.log
r149_1774857001	1774857001	ok	discard	0.24498677253723145	0.2860000729560852	0.5160000729560852	966656.0	0.23	393216.0	0.09	573440.0	0.14	112	factorized_expert_topk	1				/root/sparsify-ascend/checkpoints/research_agent/round_0149/round0149_standard_1774856667_dp2_bs1_ga8_ef1_k112_20260330_154433	9ffc4fcb17d3e0f26ac1263a536602f2211d471e			建议以 r148 为 reference，只改 `ARCHITECTURE=factorized_expert_topk`。这是一次面向 0.20x 低成本带的结构复验，目标不是继续打磨 `lowrank_expert_*` 或 `shared_routed_expert_topk`，而是直接回答“expert 内 low-rank local head”在当前 2-expert recipe 下是否能形成比现有低成本锚点更有价值的新段。	这轮满足单变量原则：相对 r148 只改 `ARCHITECTURE`。最近两轮 `shared_lowrank_routed_expert_residual` 与 `two_stage_residual_expert` 都没有形成新非支配点，继续在这些 family 上做局部旋钮微调信息增量很低；切到 `factorized_expert_topk` 能在当前 matched recipe 下补一条尚未被近期复验的 expert-internal low-rank 结构证据，而且总成本仅约 0.20x，正落在当前最需要补强的低成本带。主要风险是该 family 在旧 recipe 上已有负信号，但本轮正是为了验证这些负信号是否只是旧配置下的假阴性。	/root/sparsify-ascend/research/history/logs/round0149_standard_1774856667.log
r150_1774857707	1774857707	ok	discard	0.18521109223365784	0.2423945963382721	0.7323945963382721	2072576.0	0.49	1499136.0	0.36	573440.0	0.14	112	shared_routed_factorized_expert_residual	1				/root/sparsify-ascend/checkpoints/research_agent/round_0150/round0150_standard_1774857343_dp2_bs1_ga8_ef1_k112_20260330_155549	1ca5a4492b2ae37901fac12bacb50b8df2210cd0			已新增并接线 `shared_routed_factorized_expert_residual`，建议以 r146 为 reference，仅设置 `ARCHITECTURE=shared_routed_factorized_expert_residual` 启动首轮真实训练。它是一个已落盘、已 smoke、已过 allowlist 的最小新 family，目标是在当前最需要补证据的 0.3x-0.5x 带直接回答“hetero MoE 的 factorized shared+routed stage 加 residual cleanup”是否值得继续。	这轮选择 `edit_sae_code` 而不是再做现有 family 的 param-only probe，原因是当前已连续三轮 fresh 结构对照都未形成新非支配点，而提示明确要求在这种情况下优先切换到新的结构假设或新增最小可运行原型。新 family 不是无约束扩张：它直接填补了当前最缺的“shared experts + routed experts + expert-internal low-rank + residual cleanup”槽位，并且只复用现有 tunable 参数，没有新增 env key。风险在于 residual_encoder 仍然较重，可能重复 r147 的结论；但这次 factorized stage 把 stage1 selection 从约 0.44x 压到约 0.36x，足以提供新的结构信息。	/root/sparsify-ascend/research/history/logs/round0150_standard_1774857343.log
r151_1774858898	1774858898	ok	keep	0.09260296821594238	0.10952761769294739	0.6495276176929474	2260992.0	0.54	1605632.0	0.38	655360.0	0.16	112	lowrank_expert_residual	1				/root/sparsify-ascend/checkpoints/research_agent/round_0151/round0151_standard_1774858289_dp2_bs1_ga8_ef1_k112_20260330_161136	8628118d2ade5b640f7339faf31d032c809ba412			建议以 r146 为 reference，只改 `TRUNK_RANK=16`。这是对当前最强兼容 family 的一次单轴低秩压缩：在近期 r147-r150 多个新结构都给出负信号之后，优先验证 `lowrank_expert_residual` 能否以更小 trunk 在约 0.51x total_cost 保住足够好的 FVU，补齐 0.5x 左右的中低成本前沿。	这轮满足单变量原则：相对 r146 只改 `TRUNK_RANK`。之所以不继续开新 family，是因为 r147 `shared_lowrank_routed_expert_residual`、r148 `two_stage_residual_expert`、r149 `factorized_expert_topk`、r150 `shared_routed_factorized_expert_residual` 已连续给出负信号，当前更值得回答的是“最强兼容 family 还能否向左压成本”。之所以不选更保守的 `TRUNK_RANK=32`，是因为，基于当前成本口径复核，该配置仍位于预期成本带内并满足预算约束。主要风险是旧轮次里 rank<24 往往伴随质量回退，但 r146 的 expert 容量更强，值得做一次明确验证。	/root/sparsify-ascend/research/history/logs/round0151_standard_1774858289.log
r152_1774859659	1774859659	ok	keep	0.09837484359741211	0.11670511960983276	0.6367051196098328	2179072.0	0.52	1605632.0	0.38	573440.0	0.14	96	lowrank_expert_residual	1				/root/sparsify-ascend/checkpoints/research_agent/round_0152/round0152_standard_1774859050_dp2_bs1_ga8_ef1_k96_20260330_162417	004c565b79e2e9230861d93691220aeeeb4195bb			建议以 r151 为 reference，只改 `K=96`。r151 已证明 `lowrank_expert_residual` 在 `TRUNK_RANK=16` 下能以约 0.51x 成本保持 FVU=0.0926；本轮继续只压部署查表成本，直接验证它能否以更低 K 跨入 `<0.5x` 区域并保持对现有低成本前沿的优势。	这轮满足单变量原则：相对 r151 只改 `K`。之所以继续沿同一 family 再走一轮，是因为 r151 刚形成新的有效左移点，不属于“连续多轮未形成新非支配点”的无效局部扫参；当前最直接的问题是它能否再向左一步跨入 `<0.5x`。之所以选 `K=96` 而不是更保守的 `K=104`，是因为，基于当前成本口径复核，该配置仍位于预期成本带内并满足预算约束。主要风险是 K 下调会带来一定 FVU 回退，但从同 family 过往 K 轴信号看，16 个原子的压缩幅度仍属于可接受的 matched-cost probe。	/root/sparsify-ascend/research/history/logs/round0152_standard_1774859050.log
r153_1774860302	1774860302	ok	discard	0.13982398808002472	0.17686983942985535	0.6368698394298553	1949696.0	0.46	1376256.0	0.33	573440.0	0.14	96	lowrank_expert_residual	1				/root/sparsify-ascend/checkpoints/research_agent/round_0153/round0153_standard_1774859908_dp2_bs1_ga8_ef1_k96_20260330_163834	f621cfc2ac61e2f28d5c818b139ee08acbcd05b7			建议以 r152 为 reference，只改 `ACTIVE_EXPERTS=1`。这不是继续细扫 `K` 轴，而是对当前最强低成本结构做一次更有结构信息的 matched-cost probe：验证 residual 补偿是否能让 `lowrank_expert_residual` 承受单 expert 路径，把总成本从约 0.49x 压到约 0.44x。	这轮满足单变量原则：相对 r152 只改 `ACTIVE_EXPERTS`。之所以不继续顺着 `K` 做第三轮局部下压，是因为提示已明确要求不要让现有 family 的 K 轴邻域重新主导；`ACTIVE_EXPERTS=1` 比 `K=88` 更能回答一个新的结构问题：当前 lowrank+expert+residual 是否仍需要双 expert 才能工作。之所以值得做，是因为本轮不是把 `expert_topk` 上对单 expert 的负信号简单外推到这里，相反是利用 residual cleanup 做一次 matched-cost 复验；，基于当前成本口径复核，该配置仍位于预期成本带内并满足预算约束。主要风险是 quality 可能明显回退；若如此，也能更干净地确认当前 target 上这条 family 的低成本下限确实依赖双 expert 路由。	/root/sparsify-ascend/research/history/logs/round0153_standard_1774859908.log
r154_1774860921	1774860921	ok	discard	0.24223852157592773	0.29575854539871216	0.5657585453987122	1130496.0	0.27	557056.0	0.13	573440.0	0.14	96	lowrank_factorized_residual	1				/root/sparsify-ascend/checkpoints/research_agent/round_0154/round0154_standard_1774860706_dp2_bs1_ga8_ef1_k96_20260330_165153	97017dca59c43c8c585465cf07379aba9d0ae758			建议以 r152 为 reference，只改 `ARCHITECTURE=lowrank_factorized_residual`。这轮不是继续细扫 `lowrank_expert_residual` 的局部参数，而是切到一个当前 target 上尚未验证的新兼容 family，用更低的约 0.24x total_cost 直接测试“factorized residual 是否比现有低成本 MoE-like 点更有效”。	这轮满足单变量原则：相对 r152 只改 `ARCHITECTURE`。之所以不继续沿 `lowrank_expert_residual` 下压，是因为 r151-r153 已经回答了这条 family 在当前 target 上的关键问题：`TRUNK_RANK=16` 与 `K=96` 可以形成新的 <0.5x 前沿点，但把 `ACTIVE_EXPERTS` 压到 1 会明显失败；继续在同一 family 上做小步局部扫参的信息增量开始下降。切到 `lowrank_factorized_residual` 更符合当前“结构扩展优先”的要求，也能把成本带直接拉到约 0.24x，补充一个当前 target 上完全缺失的低秩 factorized residual 结构对照。主要风险是该 family 没有 expert 子库，可能在质量上明显落后于当前 low-cost best；但如果它在 0.24x 左右仍能接近或优于现有 `shared_routed_expert_topk` 点，就会给出非常有价值的新 Pareto 段。	/root/sparsify-ascend/research/history/logs/round0154_standard_1774860706.log
r155_1774861791	1774861791	ok	discard	0.14630839228630066	0.17930084466934204	0.48930084466934204	1286144.0	0.31	794624.0	0.19	491520.0	0.12	96	shared_lowrank_routed_expert_topk	1				/root/sparsify-ascend/checkpoints/research_agent/round_0155/round0155_standard_1774861187_dp2_bs1_ga8_ef1_k96_20260330_165953	923660e960d77a3fb28e6e0c5119cbffaf793928			建议本轮以 r152 为 reference，只改 `ARCHITECTURE=shared_lowrank_routed_expert_topk`。这是一次面向 0.28x 低成本带的 matched hetero-MoE 结构探针，直接验证当前最高优先级方向“shared low-rank basis + routed expert local top-k”是否能形成新的低成本 Pareto 段。	满足单轮单变量原则：相对 r152 只改 `ARCHITECTURE`。我没有返回代码改动，因为当前高优先级候选 family 已经落盘且可运行；本轮更需要的是用当前低成本 anchor recipe 做一次干净的 matched architecture swap。选择这条线而不是继续调 `lowrank_expert_*`，是因为运行时提示已明确把“shared experts + routed experts，尤其 shared low-rank basis + expert-local top-k”列为当前最值得补的结构证据。主要风险是该 family 在旧轮次已有弱负信号；但那些结果主要来自更早的 112/128 recipe，本轮用当前 `K=96, latents_per_expert=224` 的低成本配方重验，归因更直接。	/root/sparsify-ascend/research/history/logs/round0155_standard_1774861187.log
r156_1774862539	1774862539	ok	discard	0.14623424410820007	0.17861947417259216	0.48861947417259216	1286144.0	0.31	794624.0	0.19	491520.0	0.12	96	shared_lowrank_two_stage_residual_expert	1				/root/sparsify-ascend/checkpoints/research_agent/round_0156/round0156_standard_1774861935_dp2_bs1_ga8_ef1_k96_20260330_171221	b767ea0109833064a54bebd64e704b53fac3d52b			建议本轮以 r152 为 reference，只改 `ARCHITECTURE=shared_lowrank_two_stage_residual_expert`。这是一次面向 0.28x 低成本带的 matched architecture probe，用来回答 shared-lowrank 两段式 residual expert 是否比刚失败的 shared-lowrank routed top-k 更值得继续。	满足单轮单变量原则：相对 r152 只改 `ARCHITECTURE`。之所以不继续沿 r155 的 family 压 `FACTORIZED_HIDDEN_DIM` 或 `ACTIVE_EXPERTS`，是因为该 family 已在 128/112/96 三个成本配方上持续给出一致负信号；当前更高信息量的动作是切到尚未在现行 `K=96` 低成本 recipe 下复验的 `shared_lowrank_two_stage_residual_expert`。本轮没有返回代码改动，因为该 family 已经落盘且本地 smoke 通过；主要风险是它在 r144 的 K=112 recipe 下也表现偏弱，但正因为 r155 已证明 routed top-k 线不足，当前最需要回答的是两段式 residual cleanup 是否比 routed-topk 更适合这个低成本带。	/root/sparsify-ascend/research/history/logs/round0156_standard_1774861935.log
r157_1774863320	1774863320	ok	discard	0.1108003705739975	0.13447225093841553	0.6944722509384156	2334720.0	0.56	1843200.0	0.44	491520.0	0.12	96	shared_lowrank_routed_expert_residual	1				/root/sparsify-ascend/checkpoints/research_agent/round_0157/round0157_standard_1774862685_dp2_bs1_ga8_ef1_k96_20260330_172452	12b50feed5e34d4b680e20b6091751134d9bdea1			建议本轮以 r152 为 reference，只改 `ARCHITECTURE=shared_lowrank_routed_expert_residual`。这是一次针对 hetero-MoE+residual 的 matched architecture probe，用来判断 shared-lowrank 方向在加入 residual cleanup 后，是否还能形成一个值得保留的 0.5x 左右结构锚点。	满足单轮单变量原则：相对 r152 只改 `ARCHITECTURE`。我没有返回代码改动，因为该 family 已经落盘且本地 smoke 通过；本轮更重要的是利用当前 matched recipe 做一次干净的结构切换。之所以不继续沿 r155/r156 的 0.28x 线做 `FACTORIZED_HIDDEN_DIM` 或 `STAGE1_RATIO` 微调，是因为它们已经在当前 target 上给出几乎相同的失败结果；而 `shared_lowrank_routed_expert_residual` 是当前 shared-lowrank 方向里唯一还有历史正信号、且仍符合 operator hint 的 hetero-MoE+residual 候选。主要风险是 K 从 112/128 压到 96 后，该 family 可能仍被 r152 直接压制；但即使失败，也能更干净地终止一条当前仍未完全回答的结构假设。	/root/sparsify-ascend/research/history/logs/round0157_standard_1774862685.log
r158_1774863843	1774863843	ok	discard	0.13982398808002472	0.17686983942985535	0.6368698394298553	1949696.0	0.46	1376256.0	0.33	573440.0	0.14	96	lowrank_expert_residual	1				/root/sparsify-ascend/checkpoints/research_agent/round_0158/round0158_standard_1774863449_dp2_bs1_ga8_ef1_k96_20260330_173735	0f3795ebebd22330409cbe1b260251de307f95b1			建议本轮以 r152 为 reference，只改 `ACTIVE_EXPERTS=1`。这是一次针对当前最强兼容 family 的单变量低开销压缩探针，用来判断 `lowrank_expert_residual` 的低成本可用区是否仍必须依赖双 expert。	满足单轮单变量原则：相对 r152 只改 `ACTIVE_EXPERTS`。虽然当前阶段总体强调结构扩展优先，但 r155-r157 已连续给出新结构负信号，在这种情况下继续沿失败 family 做 matched architecture swap 的信息增量已经下降；而 operator hint 也明确允许在已有有效结构上探索“进一步稀疏化 + 更小激活路径”的压缩组合。选择 `ACTIVE_EXPERTS=1` 而不是继续改 `TRUNK_RANK` 或 `K`，是因为它直接回答当前最关键的部署问题：全局 residual 是否足以替代第二个 expert，从而真正压缩 encoder 选择成本。主要风险是质量可能回退到被现有低成本前沿支配；但这会给出一条很清晰的结构结论。	/root/sparsify-ascend/research/history/logs/round0158_standard_1774863449.log
r159_1774865541	1774865541	ok	keep	0.15513789653778076	0.1852344274520874	0.39523442745208737	884736.0	0.21	557056.0	0.13	327680.0	0.08	64	shared_routed_expert_topk	1				/root/sparsify-ascend/checkpoints/research_agent/round_0159/round0159_standard_1774865052_dp2_bs1_ga8_ef1_k64_20260330_180418	93c262e25595ccd2a5bd08cfdc109f2d8ddb12d7			以 r116 为 reference，保持当前最强 low-cost baseline `shared_routed_expert_topk` 的 `K=64, ACTIVE_EXPERTS=2, NUM_EXPERTS=64` 不变，只改 `LATENTS_PER_EXPERT=160`。这是一轮严格落在 `<0.25x` 主战场的 matched-cost 轻量化 probe，直接回答在约 0.20x total_cost 下，shared+routed 结构是否能通过更窄 expert 子库打败现有同成本 anchors，而不必退回到 `ACTIVE_EXPERTS=1`。	相对 r116 只改一个 env 参数 `LATENTS_PER_EXPERT`，满足单变量原则。当前策略已经明确把主战场收缩到 `<0.25x`，因此不应再让 0.5x 左右结构主导预算；沿 `shared_routed_expert_topk` 这条现有最强 low-cost baseline 做 matched light variant，比再开一个天然落到中成本区的新 family 更符合本轮目标。之所以选 `LATENTS_PER_EXPERT=160` 而不是继续降 `ACTIVE_EXPERTS` 或直接降 `K`，是因为 r114 已证明 active-path 再压会明显伤害质量，而，基于当前成本口径复核，该配置仍位于预期成本带内并满足预算约束。	/root/sparsify-ascend/research/history/logs/round0159_standard_1774865052.log
r160_1774866198	1774866198	ok	keep	0.14842143654823303	0.17819252610206604	0.408192526102066	966656.0	0.23	557056.0	0.13	409600.0	0.1	80	shared_routed_expert_topk	1				/root/sparsify-ascend/checkpoints/research_agent/round_0160/round0160_standard_1774865709_dp2_bs1_ga8_ef1_k80_20260330_181516	72deb581f74f49af1da465e2ad716684d55217a1			以 r159 为 reference，保持当前更轻的 `shared_routed_expert_topk` 配方不变，只改 `K=80`。这是一轮严格留在 `<0.25x` 主战场的 matched-cost deployment probe，直接测试 `LATENTS_PER_EXPERT=160` 这条更轻 shared+routed 子线是否主要受 lookup budget 限制，并争取在约 0.21x 处形成比现有 0.20x/0.22x anchors 更好的新段。	相对 r159 只改一个 env 参数 `K`，满足单变量原则。当前策略明确要求把预算聚焦在 `<0.25x`，因此优先回答这条已验证可行的轻量 shared+routed 子线能否在相近成本下打败现有 low-cost anchors，比回到 >0.4x 中成本结构或新开天然偏重的 family 更合适。之所以选 `K=80` 而不是继续压 `LATENTS_PER_EXPERT` 或切到 `ACTIVE_EXPERTS=1`，是因为 r159 已把 width 压到 160 且仍可行，而 r114 已证明继续压 active experts 会显著伤害质量；当前更高信息量的是判断 width=160 是否 deployment-limited。	/root/sparsify-ascend/research/history/logs/round0160_standard_1774865709.log
r161_1774866822	1774866822	ok	keep	0.14208984375	0.1715753972530365	0.4215753972530365	1048576.0	0.25	557056.0	0.13	491520.0	0.12	96	shared_routed_expert_topk	1				/root/sparsify-ascend/checkpoints/research_agent/round_0161/round0161_standard_1774866333_dp2_bs1_ga8_ef1_k96_20260330_182539	c982109d5e3a3655bfbeaf7a2303fd7389947c8c			以 r160 为 reference，保持当前更轻的 `shared_routed_expert_topk` 配方不变，只改 `K=96`。这是一轮严格留在 `<0.25x` 主战场的 matched-cost deployment probe，直接测试 `LATENTS_PER_EXPERT=160` 这条更轻 shared+routed 子线是否还能在约 0.22x 成本下继续向现有 low-cost best 靠近。	相对 r160 只改一个 env 参数 `K`，满足单变量原则。当前策略明确要求继续在 `<0.25x` 主战场内回答谁能打败现有 low-cost anchors；r160 已给出正信号，因此先完成 width=160 这条子线的 deployment knee 定位，比切回中成本结构或提前新开 family 更合适。之所以选 `K=96` 而不是继续改 `LATENTS_PER_EXPERT`，是因为 r159→r160 已显示这条子线对 lookup budget 仍有响应，而 `K=96` 仍留在 `<0.25x` 带内。	/root/sparsify-ascend/research/history/logs/round0161_standard_1774866333.log
r162_1774867452	1774867452	ok	keep	0.13694503903388977	0.1663544774055481	0.4363544774055481	1130496.0	0.27	557056.0	0.13	573440.0	0.14	112	shared_routed_expert_topk	1				/root/sparsify-ascend/checkpoints/research_agent/round_0162/round0162_standard_1774866963_dp2_bs1_ga8_ef1_k112_20260330_183610	07cca62abc27fb1168a0fbd6cd86baf81eb5cd2d			以 r161 为 reference，保持当前更轻的 `shared_routed_expert_topk` 配方不变，只改 `K=112`。这是一轮仍留在 `<0.25x` 主战场的 matched-cost deployment probe，直接测试 `LATENTS_PER_EXPERT=160` 这条更轻 shared+routed 子线能否在约 0.24x 成本处逼近或击败当前 low-cost best。	相对 r161 只改一个 env 参数 `K`，满足单变量原则。当前策略仍要求优先回答 `<0.25x` 区域谁能打败现有 low-cost anchors；r159-r161 已给出连续正信号，因此先完成 width=160 子线的 deployment knee 定位，比现在就切回 >0.25x 辅助带或新开 family 更合适。之所以选 `K=112` 而不是改 `LATENTS_PER_EXPERT`，是因为这条子线对 lookup budget 仍持续响应，而且 `K=112` 的 combined cost 仍约 0.24x，没有越出当前主战场。	/root/sparsify-ascend/research/history/logs/round0162_standard_1774866963.log
r163_1774868338	1774868338	ok	discard	0.14372655749320984	0.17537325620651245	0.43537325620651246	1081344.0	0.26	507904.0	0.12	573440.0	0.14	112	shared_routed_expert_topk	1				/root/sparsify-ascend/checkpoints/research_agent/round_0163/round0163_standard_1774867884_dp2_bs1_ga8_ef1_k112_20260330_185130	1ad55a3b100bb77e6f566e1abfc15dec79f758dc			建议以 r162 为 reference，只改 `LATENTS_PER_EXPERT=144`。这是一次严格留在 `<0.25x` 主战场内的 matched-cost 轻量化 probe，直接测试当前最强 low-cost 主线能否从约 0.24x 左移到约 0.23x，同时保住足以进入 Pareto frontier 的质量。	相对 r162 只改一个 env 参数 `LATENTS_PER_EXPERT`，满足单变量原则。选择 144 而不是继续改 `K`，是因为 r159-r162 已基本完成 width=160 子线的 deployment knee 定位；当前更有信息量的问题变成“r162 的 0.24x 点是否还能在不丢太多质量的前提下继续左移”。选择 144 而不是更激进的 128，是为了先做最小、可解释的 width compression probe，优先提高形成新 `<0.25x` 前沿点的概率。主要风险是 expert 子库一旦继续缩窄，FVU 会回退到现有 0.23x 锚点之上；但这同样能清楚界定当前 low-cost 主线的 width floor。	/root/sparsify-ascend/research/history/logs/round0163_standard_1774867884.log
r164_1774869095	1774869095	ok	keep	0.13922066986560822	0.16869935393333435	0.42869935393333436	1089536.0	0.26	557056.0	0.13	532480.0	0.13	104	shared_routed_expert_topk	1				/root/sparsify-ascend/checkpoints/research_agent/round_0164/round0164_standard_1774868606_dp2_bs1_ga8_ef1_k104_20260330_190333	67bdf31aa7e4b225a84848b1daa2a010968ee957			建议以 r162 为 reference，只改 `K=104`。这是一次严格留在 `<0.25x` 主战场内的 matched-cost deployment compression probe：r163 已排除了继续压 `LATENTS_PER_EXPERT` 的方向，现在更有信息量的问题是 r162 的 `K=112` 是否略高于真正需要的 lookup budget。	相对 r162 只改一个 env 参数 `K`，满足单变量原则。当前阶段的高优先级仍是回答 `<0.25x` 区域谁能在相近或更低成本下打败现有 low-cost anchor；在 r163 已证伪更小 `LATENTS_PER_EXPERT` 后，继续在同 family 内做一次更低 deployment 成本的 matched probe，比切去一个大概率落到 `0.26x+` 的新 family 更符合当前主战场。选择 `K=104` 而不是回到 `K=96`，是因为 r161→r162 的改进说明这条 width=160 子线对 lookup budget 仍有响应，而 104 是定位 knee 的最小中间点。主要风险是改善幅度可能不足以超越 r161 的 0.23x/0.1421；但无论正负，这一轮都会更清楚回答当前最强 low-cost recipe 是否已经在 `K=112` 吃满 deployment 预算。	/root/sparsify-ascend/research/history/logs/round0164_standard_1774868606.log
r165_1774869786	1774869786	ok	keep	0.13799256086349487	0.16729283332824707	0.4272928333282471	1110016.0	0.26	557056.0	0.13	552960.0	0.13	108	shared_routed_expert_topk	1				/root/sparsify-ascend/checkpoints/research_agent/round_0165/round0165_standard_1774869298_dp2_bs1_ga8_ef1_k108_20260330_191504	7ac92b22b459a8f8a34b6ce7625b4af5f10ddb57			建议以 r164 为 reference，只改 `K=108`。这是一次针对当前最强 low-cost 主线的 deployment knee 精细定位：r164 已证明 `K=104` 仍有很强质量，下一步最有信息量的问题是中间点 108 能否在比 `K=112` 更低的成本下逼近甚至匹配其 FVU。	相对 r164 只改一个 env 参数 `K`，满足单变量原则。当前 `<0.25x` 主战场已经明确由 `shared_routed_expert_topk` 持有，且 r164 刚形成新的 0.23x 前沿点；在这种情况下，继续细化 104-112 的 deployment knee，比跳去一个历史上已给出明显负信号的新 family 更符合当前策略。选择 `K=108` 而不是 `K=100`，是因为 r164 已经证明进一步压 lookup budget 会带来可接受但真实的质量损失，而 108 是更接近 r162 的最小中间点，更有机会在保持低成本的同时继续压低 FVU。主要风险是 108 只会插值到 104 与 112 之间、信息增量有限；但若它成功接近 r162 质量，就能直接回答当前最关键的可部署问题：最佳 low-cost recipe 的真实 lookup knee 是否低于 112。	/root/sparsify-ascend/research/history/logs/round0165_standard_1774869298.log
r166_1774870507	1774870507	ok	archive	0.13737481832504272	0.1667393147945404	0.4367393147945404	1120256.0	0.27	557056.0	0.13	563200.0	0.13	110	shared_routed_expert_topk	1				/root/sparsify-ascend/checkpoints/research_agent/round_0166/round0166_standard_1774869993_dp2_bs1_ga8_ef1_k110_20260330_192639	885069cf87990f36b47edfcc1d1bd3bdc88e52f2			建议以 r165 为 reference，只改 `K=110`。这是对当前最强 `<0.25x` 主线做最小 deployment knee 细化：`K=108` 已经很接近 `K=112`，下一步最有信息量的问题是中间点 110 能否用更低于 112 的成本拿回更多质量。	相对 r165 只改一个 env 参数 `K`，满足单变量原则。当前 `<0.25x` 主战场仍由 `shared_routed_expert_topk` 主导，且 r164-r165 连续两轮都给出正信号，说明继续细化 108-112 的 lookup knee 仍有信息增量。选择 `K=110` 而不是 109/111，是因为它是最居中的最小 probe，最适合判断当前质量曲线在接近 r162 前是否已开始饱和。主要风险是信息增量有限、只得到一个插值点；但若 `K=110` 已明显贴近 r162，则可更清楚说明 `K=112` 存在轻微 deployment overprovision。	/root/sparsify-ascend/research/history/logs/round0166_standard_1774869993.log
r167_1774871383	1774871383	ok	archive	0.13721886277198792	0.16662243008613586	0.4366224300861359	1125376.0	0.27	557056.0	0.13	568320.0	0.14	111	shared_routed_expert_topk	1				/root/sparsify-ascend/checkpoints/research_agent/round_0167/round0167_standard_1774870899_dp2_bs1_ga8_ef1_k111_20260330_194145	03ae2059749bfe02ecad8067b223fbb72695dffa			建议以 r166 为 reference，只改 `K=111`。这是对当前最强 `<0.25x` 兼容主线做最后一个最小增量的 deployment knee probe：`K=110` 已明显逼近 `K=112`，现在最有信息量的问题是 111 能否用略低于 112 的成本拿回几乎全部质量。	相对 r166 只改一个 env 参数 `K`，满足 param_only 单变量规则。`r166=archive` 但并未被标记为 invalid / crash / policy_reject，按当前 policy 仍是可用 reference_round。当前 `<0.25x` 主战场仍由 `shared_routed_expert_topk` 主导，且 r165→r166 已继续给出正向但递减的 K 轴信号；因此再补一个 `K=111` 比直接切去历史低成本负信号较强的新 family 更符合当前策略。选择 111 而不是回到 112，是因为 112 已有结果、111 是最后一个能直接回答“是否存在更便宜且几乎同质”的低风险 probe。主要风险是信息增量有限，可能只得到一个插值点；但若 111 仍明显弱于 112，就可以更有把握地宣布这条 width=160 子线的 lookup knee 基本落在 112，并停止继续细扫 K 轴。	/root/sparsify-ascend/research/history/logs/round0167_standard_1774870899.log
r168_1774872333	1774872333	ok	discard	0.1410711109638214	0.1719258725643158	0.4319258725643158	1105920.0	0.26	532480.0	0.13	573440.0	0.14	112	shared_routed_expert_topk	1				/root/sparsify-ascend/checkpoints/research_agent/round_0168/round0168_standard_1774871848_dp2_bs1_ga8_ef1_k112_20260330_195734	5cdf631c88eab062e85f48feb34ae1dd5b858a28			建议以 r162 为 reference，只改 `LATENTS_PER_EXPERT=152`。`K` 轴经过 108→110→111 已出现明显递减收益，本轮转去更高信息量的轻量 expert-width probe，更直接回答 `<0.25x` 主战场里“更小 per-expert width 是否还能保住质量”。	相对 r162 只改一个 env 参数 `LATENTS_PER_EXPERT`，满足 param_only 单变量规则。之所以不继续回到 `K=112` 做复验，是因为 r166-r167 已经把 110/111 补齐到足够说明 lookup knee 已非常接近 112；继续在线性 K 轴上补点的信息增量已经很低。之所以选 152 而不是更激进的 148/144，是因为 r163 已经给出 `144` 的明确负信号，说明 width 压缩存在 floor；152 是最小但仍有信息量的回退量级，更适合判断‘轻压 width 是否仍可行’。主要风险是它只会得到一个略便宜但仍被 r162 支配的点；但如果它能在更低成本下接近 0.137 级别，就会形成比 `K=104/108` 更强的新 matched-cost 轻量变体证据。	/root/sparsify-ascend/research/history/logs/round0168_standard_1774871848.log
r169_1774873011	1774873011	ok	discard	0.1457732915878296	0.1784442663192749	0.4484442663192749	1114112.0	0.27	540672.0	0.13	573440.0	0.14	112	shared_routed_expert_topk	1				/root/sparsify-ascend/checkpoints/research_agent/round_0169/round0169_standard_1774872526_dp2_bs1_ga8_ef1_k112_20260330_200853	89aa6c7583e5011afc5647aa354ec66b7c7ac5cb			建议以 r162 为 reference，只改 `NUM_EXPERTS=48`。`K` 轴和 width 轴最近都已给出饱和或负信号，这一轮转去更高信息量的轻 router / 轻总 expert 容量 probe，更符合当前 `<0.25x` 主战场目标。	相对 r162 只改一个 env 参数 `NUM_EXPERTS`，满足 param_only 单变量规则。选择 `NUM_EXPERTS` 而不是继续扫 `K`，是因为 r166-r167 已显示 108-112 这段 lookup 增量只有递减收益；选择 `NUM_EXPERTS` 而不是继续压 `LATENTS_PER_EXPERT`，是因为 r168 已明确给出 `152` 的负信号，说明 width floor 已经很近。选择 48 而不是一步降到 32，是因为早期高成本 shared+routed 线上 `NUM_EXPERTS=32 -> 64` 曾有明显质量提升，说明总 expert 容量确实重要；因此先做中等幅度压缩，比直接砍半更有机会在略低成本下保住质量。主要风险是质量仍会明显退化，导致该点被现有 `K=104/108/112` anchors 支配；但如果它能在约 0.238x 下维持到接近 0.138 级别，就会成为比继续细扫 K 更有价值的新 matched-cost 低成本证据。	/root/sparsify-ascend/research/history/logs/round0169_standard_1774872526.log
