{"event_id": "evt_1774160971231940185", "ts": 1774160971, "event": "research_branch_ready", "round": null, "tier": null, "run_name": null, "family_name": null, "family_stage": null, "status": "ready", "decision": null, "payload": {"branch": "autoresearch-sae", "base_branch": "autoresearch-sae", "base_commit": "04a0603ba261d372b5dc5e8d3c9746c5cebe46f2"}}
{"event_id": "evt_1774160971233703595", "ts": 1774160971, "event": "round_started", "round": 47, "session_id": "019d13dc-400c-7493-83af-bd34fffa7466", "tier": null, "run_name": null, "family_name": null, "family_stage": null, "status": "started", "decision": null, "payload": {"status": "started"}}
{"event_id": "evt_1774160971233827432", "ts": 1774160971, "event": "agent_deciding", "round": 47, "session_id": "019d13dc-400c-7493-83af-bd34fffa7466", "tier": null, "run_name": null, "family_name": null, "family_stage": null, "status": null, "decision": null, "payload": {}}
{"event_id": "evt_1774161100779354500", "ts": 1774161100, "event": "session_resumed", "round": 47, "tier": null, "run_name": null, "family_name": null, "family_stage": null, "status": "active", "decision": null, "payload": {"session_id": "019d13dc-400c-7493-83af-bd34fffa7466"}}
{"event_id": "evt_1774161100780532351", "ts": 1774161100, "event": "agent_action_received", "round": 47, "session_id": "019d13dc-400c-7493-83af-bd34fffa7466", "tier": "proxy", "run_name": null, "family_name": "lowrank_gated_residual", "family_stage": "mainline", "status": null, "decision": null, "payload": {"session_id": "019d13dc-400c-7493-83af-bd34fffa7466", "tier": "proxy", "family_name": "lowrank_gated_residual", "family_stage": "mainline", "change_type": "param_only", "expected_win": "smaller_k", "hypothesis": "`lowrank_gated_residual` still supports a coherent lower-K Pareto curve through `K=48`, with quality degrading smoothly rather than collapsing to the `K=32` endpoint. The next most informative K-first move is a proxy probe at `K=40` on the unchanged recipe, which tests whether this family can still add one more non-dominated smaller-K point before the search pivots back to architecture."}}
{"event_id": "evt_1774161100780685797", "ts": 1774161100, "event": "proxy_mode_selected", "round": 47, "session_id": "019d13dc-400c-7493-83af-bd34fffa7466", "tier": "proxy", "run_name": null, "family_name": "lowrank_gated_residual", "family_stage": "mainline", "status": null, "decision": null, "payload": {"tier": "proxy", "proxy_mode": "fast", "evaluation_basis": "terminal_only", "parameter_behavior": "structural", "proxy_max_tokens": "5000000"}}
{"event_id": "evt_1774161100780963821", "ts": 1774161100, "event": "training_started", "round": 47, "session_id": "019d13dc-400c-7493-83af-bd34fffa7466", "tier": "proxy", "run_name": "round0047_proxy_1774161100", "family_name": "lowrank_gated_residual", "family_stage": "mainline", "status": null, "decision": null, "payload": {"tier": "proxy", "run_name": "round0047_proxy_1774161100", "family_name": "lowrank_gated_residual", "family_stage": "mainline", "checkpoint_dir": "/root/sparsify-ascend/checkpoints/research_agent/round_0047_proxy", "log_path": "/root/sparsify-ascend/research/history/logs/round0047_proxy_1774161100.log", "config": {"architecture": "lowrank_gated_residual", "expansion_factor": 32, "k": 40, "optimizer": "signum", "lr": "1.6e-3", "hookpoints": "layers.[3].self_attn.o_proj", "batch_size": 1, "grad_acc_steps": 8, "micro_acc_steps": 1, "auxk_alpha": 0.0, "dead_feature_threshold": 10000000, "use_hadamard": false, "tier": "proxy", "family_name": "lowrank_gated_residual", "family_stage": "mainline"}, "baseline_tokens_per_sec": 83008.58788873068, "proxy_mode": "fast", "evaluation_basis": "terminal_only"}}
{"event_id": "evt_1774161130790113903", "ts": 1774161130, "event": "training_heartbeat", "round": 47, "session_id": "019d13dc-400c-7493-83af-bd34fffa7466", "tier": "proxy", "run_name": "round0047_proxy_1774161100", "family_name": "lowrank_gated_residual", "family_stage": "mainline", "status": null, "decision": null, "payload": {"tier": "proxy", "run_name": "round0047_proxy_1774161100", "family_name": "lowrank_gated_residual", "family_stage": "mainline", "checkpoint_dir": "/root/sparsify-ascend/checkpoints/research_agent/round_0047_proxy/round0047_proxy_1774161100_dp2_bs1_ga8_ef32_k40_20260322_143147", "metrics_path": "/root/sparsify-ascend/checkpoints/research_agent/round_0047_proxy/round0047_proxy_1774161100_dp2_bs1_ga8_ef32_k40_20260322_143147/metrics.jsonl", "latest_step": 50, "latest_tokens_per_sec": 54611.4267158702, "baseline_ratio": 0.6579009245293317, "latest_total_tokens": 1638400.0, "proxy_mode": "fast", "evaluation_basis": "terminal_only"}}
{"event_id": "evt_1774161160791423912", "ts": 1774161160, "event": "training_heartbeat", "round": 47, "session_id": "019d13dc-400c-7493-83af-bd34fffa7466", "tier": "proxy", "run_name": "round0047_proxy_1774161100", "family_name": "lowrank_gated_residual", "family_stage": "mainline", "status": null, "decision": null, "payload": {"tier": "proxy", "run_name": "round0047_proxy_1774161100", "family_name": "lowrank_gated_residual", "family_stage": "mainline", "checkpoint_dir": "/root/sparsify-ascend/checkpoints/research_agent/round_0047_proxy/round0047_proxy_1774161100_dp2_bs1_ga8_ef32_k40_20260322_143147", "metrics_path": "/root/sparsify-ascend/checkpoints/research_agent/round_0047_proxy/round0047_proxy_1774161100_dp2_bs1_ga8_ef32_k40_20260322_143147/metrics.jsonl", "latest_step": 140, "latest_tokens_per_sec": 76455.63831439528, "baseline_ratio": 0.921056968429347, "latest_total_tokens": 4587520.0, "proxy_mode": "fast", "evaluation_basis": "terminal_only"}}
{"event_id": "evt_1774161190815987157", "ts": 1774161190, "event": "training_heartbeat", "round": 47, "session_id": "019d13dc-400c-7493-83af-bd34fffa7466", "tier": "proxy", "run_name": "round0047_proxy_1774161100", "family_name": "lowrank_gated_residual", "family_stage": "mainline", "status": null, "decision": null, "payload": {"tier": "proxy", "run_name": "round0047_proxy_1774161100", "family_name": "lowrank_gated_residual", "family_stage": "mainline", "checkpoint_dir": "/root/sparsify-ascend/checkpoints/research_agent/round_0047_proxy/round0047_proxy_1774161100_dp2_bs1_ga8_ef32_k40_20260322_143147", "metrics_path": "/root/sparsify-ascend/checkpoints/research_agent/round_0047_proxy/round0047_proxy_1774161100_dp2_bs1_ga8_ef32_k40_20260322_143147/metrics.jsonl", "latest_step": 152, "latest_tokens_per_sec": 55339.1782850688, "baseline_ratio": 0.6666681085967697, "latest_total_tokens": 4980736.0, "proxy_mode": "fast", "evaluation_basis": "terminal_only"}}
{"event_id": "evt_1774161191217028062", "ts": 1774161191, "event": "training_finished", "round": 47, "session_id": "019d13dc-400c-7493-83af-bd34fffa7466", "tier": "proxy", "run_name": "round0047_proxy_1774161100", "family_name": "lowrank_gated_residual", "family_stage": "mainline", "status": "ok", "decision": "promote", "payload": {"tier": "proxy", "run_name": "round0047_proxy_1774161100", "family_name": "lowrank_gated_residual", "family_stage": "mainline", "checkpoint_dir": "/root/sparsify-ascend/checkpoints/research_agent/round_0047_proxy/round0047_proxy_1774161100_dp2_bs1_ga8_ef32_k40_20260322_143147", "metrics_path": "/root/sparsify-ascend/checkpoints/research_agent/round_0047_proxy/round0047_proxy_1774161100_dp2_bs1_ga8_ef32_k40_20260322_143147/metrics.jsonl", "run_health": "normal", "termination_reason": "completed", "tokens_per_sec": 55339.1782850688, "baseline_ratio": 0.6666681085967697, "status": "ok", "decision": "promote", "proxy_mode": "fast", "evaluation_basis": "terminal_only", "curve_start_fvu": 0.3286716341972351, "curve_mid_fvu": 0.2127993404865265, "curve_end_fvu": 0.16805875301361084, "curve_late_slope": -6.657090477435099e-09, "curve_still_improving": true}}
{"event_id": "evt_1774161191217109194", "ts": 1774161191, "event": "result_recorded", "round": 47, "session_id": "019d13dc-400c-7493-83af-bd34fffa7466", "tier": "proxy", "run_name": "round0047_proxy_1774161100", "family_name": "lowrank_gated_residual", "family_stage": "mainline", "status": "ok", "decision": "promote", "payload": {"tier": "proxy", "run_name": "round0047_proxy_1774161100", "family_name": "lowrank_gated_residual", "family_stage": "mainline", "status": "ok", "decision": "promote", "val_fvu": "0.1688084900379181", "observed_fvu": "0.168059", "k": "40", "log_path": "/root/sparsify-ascend/research/history/logs/proxy_1774161191.log", "checkpoint": null}}
{"event_id": "evt_1774161191217509293", "ts": 1774161191, "event": "training_started", "round": 47, "session_id": "019d13dc-400c-7493-83af-bd34fffa7466", "tier": "full", "run_name": "round0047_full_1774161191", "family_name": "lowrank_gated_residual", "family_stage": "mainline", "status": null, "decision": null, "payload": {"tier": "full", "run_name": "round0047_full_1774161191", "family_name": "lowrank_gated_residual", "family_stage": "mainline", "checkpoint_dir": "/root/sparsify-ascend/checkpoints/research_agent/round_0047_full", "log_path": "/root/sparsify-ascend/research/history/logs/round0047_full_1774161191.log", "config": {"architecture": "lowrank_gated_residual", "expansion_factor": 32, "k": 40, "optimizer": "signum", "lr": "1.6e-3", "hookpoints": "layers.[3].self_attn.o_proj", "batch_size": 1, "grad_acc_steps": 8, "micro_acc_steps": 1, "auxk_alpha": 0.0, "dead_feature_threshold": 10000000, "use_hadamard": false, "tier": "full", "family_name": "lowrank_gated_residual", "family_stage": "mainline"}, "baseline_tokens_per_sec": 88695.60575375632, "proxy_mode": null, "evaluation_basis": null}}
{"event_id": "evt_1774161221218793952", "ts": 1774161221, "event": "training_heartbeat", "round": 47, "session_id": "019d13dc-400c-7493-83af-bd34fffa7466", "tier": "full", "run_name": "round0047_full_1774161191", "family_name": "lowrank_gated_residual", "family_stage": "mainline", "status": null, "decision": null, "payload": {"tier": "full", "run_name": "round0047_full_1774161191", "family_name": "lowrank_gated_residual", "family_stage": "mainline", "checkpoint_dir": "/root/sparsify-ascend/checkpoints/research_agent/round_0047_full/round0047_full_1774161191_dp2_bs1_ga8_ef32_k40_20260322_143317", "metrics_path": "/root/sparsify-ascend/checkpoints/research_agent/round_0047_full/round0047_full_1774161191_dp2_bs1_ga8_ef32_k40_20260322_143317/metrics.jsonl", "latest_step": 50, "latest_tokens_per_sec": 54611.485305591974, "baseline_ratio": 0.6157180487295916, "latest_total_tokens": 1638400.0, "proxy_mode": null, "evaluation_basis": null}}
{"event_id": "evt_1774161251220127234", "ts": 1774161251, "event": "training_heartbeat", "round": 47, "session_id": "019d13dc-400c-7493-83af-bd34fffa7466", "tier": "full", "run_name": "round0047_full_1774161191", "family_name": "lowrank_gated_residual", "family_stage": "mainline", "status": null, "decision": null, "payload": {"tier": "full", "run_name": "round0047_full_1774161191", "family_name": "lowrank_gated_residual", "family_stage": "mainline", "checkpoint_dir": "/root/sparsify-ascend/checkpoints/research_agent/round_0047_full/round0047_full_1774161191_dp2_bs1_ga8_ef32_k40_20260322_143317", "metrics_path": "/root/sparsify-ascend/checkpoints/research_agent/round_0047_full/round0047_full_1774161191_dp2_bs1_ga8_ef32_k40_20260322_143317/metrics.jsonl", "latest_step": 140, "latest_tokens_per_sec": 76455.68601029934, "baseline_ratio": 0.8620008326293143, "latest_total_tokens": 4587520.0, "proxy_mode": null, "evaluation_basis": null}}
{"event_id": "evt_1774161281222029943", "ts": 1774161281, "event": "training_heartbeat", "round": 47, "session_id": "019d13dc-400c-7493-83af-bd34fffa7466", "tier": "full", "run_name": "round0047_full_1774161191", "family_name": "lowrank_gated_residual", "family_stage": "mainline", "status": null, "decision": null, "payload": {"tier": "full", "run_name": "round0047_full_1774161191", "family_name": "lowrank_gated_residual", "family_stage": "mainline", "checkpoint_dir": "/root/sparsify-ascend/checkpoints/research_agent/round_0047_full/round0047_full_1774161191_dp2_bs1_ga8_ef32_k40_20260322_143317", "metrics_path": "/root/sparsify-ascend/checkpoints/research_agent/round_0047_full/round0047_full_1774161191_dp2_bs1_ga8_ef32_k40_20260322_143317/metrics.jsonl", "latest_step": 240, "latest_tokens_per_sec": 87377.21477746291, "baseline_ratio": 0.9851357802329731, "latest_total_tokens": 7864320.0, "proxy_mode": null, "evaluation_basis": null}}
{"event_id": "evt_1774161311224471267", "ts": 1774161311, "event": "training_heartbeat", "round": 47, "session_id": "019d13dc-400c-7493-83af-bd34fffa7466", "tier": "full", "run_name": "round0047_full_1774161191", "family_name": "lowrank_gated_residual", "family_stage": "mainline", "status": null, "decision": null, "payload": {"tier": "full", "run_name": "round0047_full_1774161191", "family_name": "lowrank_gated_residual", "family_stage": "mainline", "checkpoint_dir": "/root/sparsify-ascend/checkpoints/research_agent/round_0047_full/round0047_full_1774161191_dp2_bs1_ga8_ef32_k40_20260322_143317", "metrics_path": "/root/sparsify-ascend/checkpoints/research_agent/round_0047_full/round0047_full_1774161191_dp2_bs1_ga8_ef32_k40_20260322_143317/metrics.jsonl", "latest_step": 340, "latest_tokens_per_sec": 92837.48929697856, "baseline_ratio": 1.0466977310546959, "latest_total_tokens": 11141120.0, "proxy_mode": null, "evaluation_basis": null}}
{"event_id": "evt_1774161341227511997", "ts": 1774161341, "event": "training_heartbeat", "round": 47, "session_id": "019d13dc-400c-7493-83af-bd34fffa7466", "tier": "full", "run_name": "round0047_full_1774161191", "family_name": "lowrank_gated_residual", "family_stage": "mainline", "status": null, "decision": null, "payload": {"tier": "full", "run_name": "round0047_full_1774161191", "family_name": "lowrank_gated_residual", "family_stage": "mainline", "checkpoint_dir": "/root/sparsify-ascend/checkpoints/research_agent/round_0047_full/round0047_full_1774161191_dp2_bs1_ga8_ef32_k40_20260322_143317", "metrics_path": "/root/sparsify-ascend/checkpoints/research_agent/round_0047_full/round0047_full_1774161191_dp2_bs1_ga8_ef32_k40_20260322_143317/metrics.jsonl", "latest_step": 440, "latest_tokens_per_sec": 96113.23709821321, "baseline_ratio": 1.0836302010840346, "latest_total_tokens": 14417920.0, "proxy_mode": null, "evaluation_basis": null}}
{"event_id": "evt_1774161371231053374", "ts": 1774161371, "event": "training_heartbeat", "round": 47, "session_id": "019d13dc-400c-7493-83af-bd34fffa7466", "tier": "full", "run_name": "round0047_full_1774161191", "family_name": "lowrank_gated_residual", "family_stage": "mainline", "status": null, "decision": null, "payload": {"tier": "full", "run_name": "round0047_full_1774161191", "family_name": "lowrank_gated_residual", "family_stage": "mainline", "checkpoint_dir": "/root/sparsify-ascend/checkpoints/research_agent/round_0047_full/round0047_full_1774161191_dp2_bs1_ga8_ef32_k40_20260322_143317", "metrics_path": "/root/sparsify-ascend/checkpoints/research_agent/round_0047_full/round0047_full_1774161191_dp2_bs1_ga8_ef32_k40_20260322_143317/metrics.jsonl", "latest_step": 530, "latest_tokens_per_sec": 96476.44634514449, "baseline_ratio": 1.0877252094426182, "latest_total_tokens": 17367040.0, "proxy_mode": null, "evaluation_basis": null}}
{"event_id": "evt_1774161401235277122", "ts": 1774161401, "event": "training_heartbeat", "round": 47, "session_id": "019d13dc-400c-7493-83af-bd34fffa7466", "tier": "full", "run_name": "round0047_full_1774161191", "family_name": "lowrank_gated_residual", "family_stage": "mainline", "status": null, "decision": null, "payload": {"tier": "full", "run_name": "round0047_full_1774161191", "family_name": "lowrank_gated_residual", "family_stage": "mainline", "checkpoint_dir": "/root/sparsify-ascend/checkpoints/research_agent/round_0047_full/round0047_full_1774161191_dp2_bs1_ga8_ef32_k40_20260322_143317", "metrics_path": "/root/sparsify-ascend/checkpoints/research_agent/round_0047_full/round0047_full_1774161191_dp2_bs1_ga8_ef32_k40_20260322_143317/metrics.jsonl", "latest_step": 630, "latest_tokens_per_sec": 98295.87031523304, "baseline_ratio": 1.1082383335667128, "latest_total_tokens": 20643840.0, "proxy_mode": null, "evaluation_basis": null}}
{"event_id": "evt_1774161431239970469", "ts": 1774161431, "event": "training_heartbeat", "round": 47, "session_id": "019d13dc-400c-7493-83af-bd34fffa7466", "tier": "full", "run_name": "round0047_full_1774161191", "family_name": "lowrank_gated_residual", "family_stage": "mainline", "status": null, "decision": null, "payload": {"tier": "full", "run_name": "round0047_full_1774161191", "family_name": "lowrank_gated_residual", "family_stage": "mainline", "checkpoint_dir": "/root/sparsify-ascend/checkpoints/research_agent/round_0047_full/round0047_full_1774161191_dp2_bs1_ga8_ef32_k40_20260322_143317", "metrics_path": "/root/sparsify-ascend/checkpoints/research_agent/round_0047_full/round0047_full_1774161191_dp2_bs1_ga8_ef32_k40_20260322_143317/metrics.jsonl", "latest_step": 730, "latest_tokens_per_sec": 99660.12492446169, "baseline_ratio": 1.1236196435835382, "latest_total_tokens": 23920640.0, "proxy_mode": null, "evaluation_basis": null}}
{"event_id": "evt_1774161461245166142", "ts": 1774161461, "event": "training_heartbeat", "round": 47, "session_id": "019d13dc-400c-7493-83af-bd34fffa7466", "tier": "full", "run_name": "round0047_full_1774161191", "family_name": "lowrank_gated_residual", "family_stage": "mainline", "status": null, "decision": null, "payload": {"tier": "full", "run_name": "round0047_full_1774161191", "family_name": "lowrank_gated_residual", "family_stage": "mainline", "checkpoint_dir": "/root/sparsify-ascend/checkpoints/research_agent/round_0047_full/round0047_full_1774161191_dp2_bs1_ga8_ef32_k40_20260322_143317", "metrics_path": "/root/sparsify-ascend/checkpoints/research_agent/round_0047_full/round0047_full_1774161191_dp2_bs1_ga8_ef32_k40_20260322_143317/metrics.jsonl", "latest_step": 820, "latest_tokens_per_sec": 99507.54506994165, "baseline_ratio": 1.121899379617546, "latest_total_tokens": 26869760.0, "proxy_mode": null, "evaluation_basis": null}}
{"event_id": "evt_1774161491250902901", "ts": 1774161491, "event": "training_heartbeat", "round": 47, "session_id": "019d13dc-400c-7493-83af-bd34fffa7466", "tier": "full", "run_name": "round0047_full_1774161191", "family_name": "lowrank_gated_residual", "family_stage": "mainline", "status": null, "decision": null, "payload": {"tier": "full", "run_name": "round0047_full_1774161191", "family_name": "lowrank_gated_residual", "family_stage": "mainline", "checkpoint_dir": "/root/sparsify-ascend/checkpoints/research_agent/round_0047_full/round0047_full_1774161191_dp2_bs1_ga8_ef32_k40_20260322_143317", "metrics_path": "/root/sparsify-ascend/checkpoints/research_agent/round_0047_full/round0047_full_1774161191_dp2_bs1_ga8_ef32_k40_20260322_143317/metrics.jsonl", "latest_step": 920, "latest_tokens_per_sec": 100477.4478376261, "baseline_ratio": 1.132834563603742, "latest_total_tokens": 30146560.0, "proxy_mode": null, "evaluation_basis": null}}
{"event_id": "evt_1774161521257212258", "ts": 1774161521, "event": "training_heartbeat", "round": 47, "session_id": "019d13dc-400c-7493-83af-bd34fffa7466", "tier": "full", "run_name": "round0047_full_1774161191", "family_name": "lowrank_gated_residual", "family_stage": "mainline", "status": null, "decision": null, "payload": {"tier": "full", "run_name": "round0047_full_1774161191", "family_name": "lowrank_gated_residual", "family_stage": "mainline", "checkpoint_dir": "/root/sparsify-ascend/checkpoints/research_agent/round_0047_full/round0047_full_1774161191_dp2_bs1_ga8_ef32_k40_20260322_143317", "metrics_path": "/root/sparsify-ascend/checkpoints/research_agent/round_0047_full/round0047_full_1774161191_dp2_bs1_ga8_ef32_k40_20260322_143317/metrics.jsonl", "latest_step": 990, "latest_tokens_per_sec": 98292.28917935112, "baseline_ratio": 1.1081979579939718, "latest_total_tokens": 32440320.0, "proxy_mode": null, "evaluation_basis": null}}
{"event_id": "evt_1774161551289926074", "ts": 1774161551, "event": "training_heartbeat", "round": 47, "session_id": "019d13dc-400c-7493-83af-bd34fffa7466", "tier": "full", "run_name": "round0047_full_1774161191", "family_name": "lowrank_gated_residual", "family_stage": "mainline", "status": null, "decision": null, "payload": {"tier": "full", "run_name": "round0047_full_1774161191", "family_name": "lowrank_gated_residual", "family_stage": "mainline", "checkpoint_dir": "/root/sparsify-ascend/checkpoints/research_agent/round_0047_full/round0047_full_1774161191_dp2_bs1_ga8_ef32_k40_20260322_143317", "metrics_path": "/root/sparsify-ascend/checkpoints/research_agent/round_0047_full/round0047_full_1774161191_dp2_bs1_ga8_ef32_k40_20260322_143317/metrics.jsonl", "latest_step": 1060, "latest_tokens_per_sec": 96471.24470975042, "baseline_ratio": 1.0876665635226783, "latest_total_tokens": 34734080.0, "proxy_mode": null, "evaluation_basis": null}}
{"event_id": "evt_1774161581362228774", "ts": 1774161581, "event": "training_heartbeat", "round": 47, "session_id": "019d13dc-400c-7493-83af-bd34fffa7466", "tier": "full", "run_name": "round0047_full_1774161191", "family_name": "lowrank_gated_residual", "family_stage": "mainline", "status": null, "decision": null, "payload": {"tier": "full", "run_name": "round0047_full_1774161191", "family_name": "lowrank_gated_residual", "family_stage": "mainline", "checkpoint_dir": "/root/sparsify-ascend/checkpoints/research_agent/round_0047_full/round0047_full_1774161191_dp2_bs1_ga8_ef32_k40_20260322_143317", "metrics_path": "/root/sparsify-ascend/checkpoints/research_agent/round_0047_full/round0047_full_1774161191_dp2_bs1_ga8_ef32_k40_20260322_143317/metrics.jsonl", "latest_step": 1160, "latest_tokens_per_sec": 97444.00861783003, "baseline_ratio": 1.0986340054811927, "latest_total_tokens": 38010880.0, "proxy_mode": null, "evaluation_basis": null}}
