{"event_id": "evt_1774132107916605088", "ts": 1774132107, "event": "variable_isolation_warning", "round": 7, "session_id": "019d1279-dd8d-73d2-97df-ff57e75146ab", "tier": null, "run_name": null, "family_name": "two_stage_residual", "family_stage": "prototype", "status": null, "decision": null, "payload": {"violation": "Multiple primary variables changed simultaneously: code_edit, architecture, lr"}}
{"event_id": "evt_1774132112437593803", "ts": 1774132112, "event": "behavioral_diff_identical_warning", "round": 7, "session_id": "019d1279-dd8d-73d2-97df-ff57e75146ab", "tier": null, "run_name": null, "family_name": "two_stage_residual", "family_stage": "prototype", "status": null, "decision": null, "payload": {"architecture": "two_stage_residual", "k": 128, "expansion_factor": 16, "max_diff": 0.0}}
{"event_id": "evt_1774132112437660089", "ts": 1774132112, "event": "proxy_mode_selected", "round": 7, "session_id": "019d1279-dd8d-73d2-97df-ff57e75146ab", "tier": "proxy", "run_name": null, "family_name": "two_stage_residual", "family_stage": "prototype", "status": null, "decision": null, "payload": {"tier": "proxy", "proxy_mode": "fast", "evaluation_basis": "terminal_only", "parameter_behavior": "structural", "proxy_max_tokens": "40000000"}}
{"event_id": "evt_1774132112437706258", "ts": 1774132112, "event": "sanity_started", "round": 7, "session_id": "019d1279-dd8d-73d2-97df-ff57e75146ab", "tier": "proxy", "run_name": null, "family_name": "two_stage_residual", "family_stage": "prototype", "status": null, "decision": null, "payload": {"tier": "proxy"}}
{"event_id": "evt_1774132117029794444", "ts": 1774132117, "event": "sanity_finished", "round": 7, "session_id": "019d1279-dd8d-73d2-97df-ff57e75146ab", "tier": "proxy", "run_name": null, "family_name": "two_stage_residual", "family_stage": "prototype", "status": "ok", "decision": null, "payload": {"tier": "proxy", "status": "ok"}}
{"event_id": "evt_1774132117030172870", "ts": 1774132117, "event": "training_started", "round": 7, "session_id": "019d1279-dd8d-73d2-97df-ff57e75146ab", "tier": "proxy", "run_name": "round0007_proxy_1774132117", "family_name": "two_stage_residual", "family_stage": "prototype", "status": null, "decision": null, "payload": {"tier": "proxy", "run_name": "round0007_proxy_1774132117", "family_name": "two_stage_residual", "family_stage": "prototype", "checkpoint_dir": "/root/sparsify-ascend/checkpoints/research_agent/round_0007_proxy", "log_path": "/root/sparsify-ascend/research/history/logs/round0007_proxy_1774132117.log", "config": {"architecture": "two_stage_residual", "expansion_factor": 16, "k": 128, "optimizer": "signum", "lr": "1.6e-3", "hookpoints": "layers.[3].self_attn.o_proj", "batch_size": 1, "grad_acc_steps": 8, "micro_acc_steps": 1, "auxk_alpha": 0.0, "dead_feature_threshold": 10000000, "use_hadamard": false, "tier": "proxy", "family_name": "two_stage_residual", "family_stage": "prototype"}, "baseline_tokens_per_sec": null, "proxy_mode": "fast", "evaluation_basis": "terminal_only"}}
{"event_id": "evt_1774132147031586036", "ts": 1774132147, "event": "training_heartbeat", "round": 7, "session_id": "019d1279-dd8d-73d2-97df-ff57e75146ab", "tier": "proxy", "run_name": "round0007_proxy_1774132117", "family_name": "two_stage_residual", "family_stage": "prototype", "status": null, "decision": null, "payload": {"tier": "proxy", "run_name": "round0007_proxy_1774132117", "family_name": "two_stage_residual", "family_stage": "prototype", "checkpoint_dir": "/root/sparsify-ascend/checkpoints/research_agent/round_0007_proxy/round0007_proxy_1774132117_dp2_bs1_ga8_ef16_k128_20260322_062843", "metrics_path": "/root/sparsify-ascend/checkpoints/research_agent/round_0007_proxy/round0007_proxy_1774132117_dp2_bs1_ga8_ef16_k128_20260322_062843/metrics.jsonl", "latest_step": 60, "latest_tokens_per_sec": 65533.592796755576, "baseline_ratio": null, "latest_total_tokens": 1966080.0, "proxy_mode": "fast", "evaluation_basis": "terminal_only"}}
{"event_id": "evt_1774132177033221033", "ts": 1774132177, "event": "training_heartbeat", "round": 7, "session_id": "019d1279-dd8d-73d2-97df-ff57e75146ab", "tier": "proxy", "run_name": "round0007_proxy_1774132117", "family_name": "two_stage_residual", "family_stage": "prototype", "status": null, "decision": null, "payload": {"tier": "proxy", "run_name": "round0007_proxy_1774132117", "family_name": "two_stage_residual", "family_stage": "prototype", "checkpoint_dir": "/root/sparsify-ascend/checkpoints/research_agent/round_0007_proxy/round0007_proxy_1774132117_dp2_bs1_ga8_ef16_k128_20260322_062843", "metrics_path": "/root/sparsify-ascend/checkpoints/research_agent/round_0007_proxy/round0007_proxy_1774132117_dp2_bs1_ga8_ef16_k128_20260322_062843/metrics.jsonl", "latest_step": 190, "latest_tokens_per_sec": 103760.60375290852, "baseline_ratio": null, "latest_total_tokens": 6225920.0, "proxy_mode": "fast", "evaluation_basis": "terminal_only"}}
{"event_id": "evt_1774132207035505915", "ts": 1774132207, "event": "training_heartbeat", "round": 7, "session_id": "019d1279-dd8d-73d2-97df-ff57e75146ab", "tier": "proxy", "run_name": "round0007_proxy_1774132117", "family_name": "two_stage_residual", "family_stage": "prototype", "status": null, "decision": null, "payload": {"tier": "proxy", "run_name": "round0007_proxy_1774132117", "family_name": "two_stage_residual", "family_stage": "prototype", "checkpoint_dir": "/root/sparsify-ascend/checkpoints/research_agent/round_0007_proxy/round0007_proxy_1774132117_dp2_bs1_ga8_ef16_k128_20260322_062843", "metrics_path": "/root/sparsify-ascend/checkpoints/research_agent/round_0007_proxy/round0007_proxy_1774132117_dp2_bs1_ga8_ef16_k128_20260322_062843/metrics.jsonl", "latest_step": 310, "latest_tokens_per_sec": 112861.25394945809, "baseline_ratio": null, "latest_total_tokens": 10158080.0, "proxy_mode": "fast", "evaluation_basis": "terminal_only"}}
{"event_id": "evt_1774132237038540209", "ts": 1774132237, "event": "training_heartbeat", "round": 7, "session_id": "019d1279-dd8d-73d2-97df-ff57e75146ab", "tier": "proxy", "run_name": "round0007_proxy_1774132117", "family_name": "two_stage_residual", "family_stage": "prototype", "status": null, "decision": null, "payload": {"tier": "proxy", "run_name": "round0007_proxy_1774132117", "family_name": "two_stage_residual", "family_stage": "prototype", "checkpoint_dir": "/root/sparsify-ascend/checkpoints/research_agent/round_0007_proxy/round0007_proxy_1774132117_dp2_bs1_ga8_ef16_k128_20260322_062843", "metrics_path": "/root/sparsify-ascend/checkpoints/research_agent/round_0007_proxy/round0007_proxy_1774132117_dp2_bs1_ga8_ef16_k128_20260322_062843/metrics.jsonl", "latest_step": 440, "latest_tokens_per_sec": 120141.26147981842, "baseline_ratio": null, "latest_total_tokens": 14417920.0, "proxy_mode": "fast", "evaluation_basis": "terminal_only"}}
{"event_id": "evt_1774132267042283771", "ts": 1774132267, "event": "training_heartbeat", "round": 7, "session_id": "019d1279-dd8d-73d2-97df-ff57e75146ab", "tier": "proxy", "run_name": "round0007_proxy_1774132117", "family_name": "two_stage_residual", "family_stage": "prototype", "status": null, "decision": null, "payload": {"tier": "proxy", "run_name": "round0007_proxy_1774132117", "family_name": "two_stage_residual", "family_stage": "prototype", "checkpoint_dir": "/root/sparsify-ascend/checkpoints/research_agent/round_0007_proxy/round0007_proxy_1774132117_dp2_bs1_ga8_ef16_k128_20260322_062843", "metrics_path": "/root/sparsify-ascend/checkpoints/research_agent/round_0007_proxy/round0007_proxy_1774132117_dp2_bs1_ga8_ef16_k128_20260322_062843/metrics.jsonl", "latest_step": 560, "latest_tokens_per_sec": 122324.24806188604, "baseline_ratio": null, "latest_total_tokens": 18350080.0, "proxy_mode": "fast", "evaluation_basis": "terminal_only"}}
{"event_id": "evt_1774132297046712391", "ts": 1774132297, "event": "training_heartbeat", "round": 7, "session_id": "019d1279-dd8d-73d2-97df-ff57e75146ab", "tier": "proxy", "run_name": "round0007_proxy_1774132117", "family_name": "two_stage_residual", "family_stage": "prototype", "status": null, "decision": null, "payload": {"tier": "proxy", "run_name": "round0007_proxy_1774132117", "family_name": "two_stage_residual", "family_stage": "prototype", "checkpoint_dir": "/root/sparsify-ascend/checkpoints/research_agent/round_0007_proxy/round0007_proxy_1774132117_dp2_bs1_ga8_ef16_k128_20260322_062843", "metrics_path": "/root/sparsify-ascend/checkpoints/research_agent/round_0007_proxy/round0007_proxy_1774132117_dp2_bs1_ga8_ef16_k128_20260322_062843/metrics.jsonl", "latest_step": 680, "latest_tokens_per_sec": 123779.06615787518, "baseline_ratio": null, "latest_total_tokens": 22282240.0, "proxy_mode": "fast", "evaluation_basis": "terminal_only"}}
{"event_id": "evt_1774132327051895880", "ts": 1774132327, "event": "training_heartbeat", "round": 7, "session_id": "019d1279-dd8d-73d2-97df-ff57e75146ab", "tier": "proxy", "run_name": "round0007_proxy_1774132117", "family_name": "two_stage_residual", "family_stage": "prototype", "status": null, "decision": null, "payload": {"tier": "proxy", "run_name": "round0007_proxy_1774132117", "family_name": "two_stage_residual", "family_stage": "prototype", "checkpoint_dir": "/root/sparsify-ascend/checkpoints/research_agent/round_0007_proxy/round0007_proxy_1774132117_dp2_bs1_ga8_ef16_k128_20260322_062843", "metrics_path": "/root/sparsify-ascend/checkpoints/research_agent/round_0007_proxy/round0007_proxy_1774132117_dp2_bs1_ga8_ef16_k128_20260322_062843/metrics.jsonl", "latest_step": 810, "latest_tokens_per_sec": 126377.98495267454, "baseline_ratio": null, "latest_total_tokens": 26542080.0, "proxy_mode": "fast", "evaluation_basis": "terminal_only"}}
{"event_id": "evt_1774132357057725518", "ts": 1774132357, "event": "training_heartbeat", "round": 7, "session_id": "019d1279-dd8d-73d2-97df-ff57e75146ab", "tier": "proxy", "run_name": "round0007_proxy_1774132117", "family_name": "two_stage_residual", "family_stage": "prototype", "status": null, "decision": null, "payload": {"tier": "proxy", "run_name": "round0007_proxy_1774132117", "family_name": "two_stage_residual", "family_stage": "prototype", "checkpoint_dir": "/root/sparsify-ascend/checkpoints/research_agent/round_0007_proxy/round0007_proxy_1774132117_dp2_bs1_ga8_ef16_k128_20260322_062843", "metrics_path": "/root/sparsify-ascend/checkpoints/research_agent/round_0007_proxy/round0007_proxy_1774132117_dp2_bs1_ga8_ef16_k128_20260322_062843/metrics.jsonl", "latest_step": 930, "latest_tokens_per_sec": 126961.59488392225, "baseline_ratio": null, "latest_total_tokens": 30474240.0, "proxy_mode": "fast", "evaluation_basis": "terminal_only"}}
{"event_id": "evt_1774132387253602616", "ts": 1774132387, "event": "training_heartbeat", "round": 7, "session_id": "019d1279-dd8d-73d2-97df-ff57e75146ab", "tier": "proxy", "run_name": "round0007_proxy_1774132117", "family_name": "two_stage_residual", "family_stage": "prototype", "status": null, "decision": null, "payload": {"tier": "proxy", "run_name": "round0007_proxy_1774132117", "family_name": "two_stage_residual", "family_stage": "prototype", "checkpoint_dir": "/root/sparsify-ascend/checkpoints/research_agent/round_0007_proxy/round0007_proxy_1774132117_dp2_bs1_ga8_ef16_k128_20260322_062843", "metrics_path": "/root/sparsify-ascend/checkpoints/research_agent/round_0007_proxy/round0007_proxy_1774132117_dp2_bs1_ga8_ef16_k128_20260322_062843/metrics.jsonl", "latest_step": 1020, "latest_tokens_per_sec": 123774.82870842781, "baseline_ratio": null, "latest_total_tokens": 33423360.0, "proxy_mode": "fast", "evaluation_basis": "terminal_only"}}
{"event_id": "evt_1774132417467599657", "ts": 1774132417, "event": "training_heartbeat", "round": 7, "session_id": "019d1279-dd8d-73d2-97df-ff57e75146ab", "tier": "proxy", "run_name": "round0007_proxy_1774132117", "family_name": "two_stage_residual", "family_stage": "prototype", "status": null, "decision": null, "payload": {"tier": "proxy", "run_name": "round0007_proxy_1774132117", "family_name": "two_stage_residual", "family_stage": "prototype", "checkpoint_dir": "/root/sparsify-ascend/checkpoints/research_agent/round_0007_proxy/round0007_proxy_1774132117_dp2_bs1_ga8_ef16_k128_20260322_062843", "metrics_path": "/root/sparsify-ascend/checkpoints/research_agent/round_0007_proxy/round0007_proxy_1774132117_dp2_bs1_ga8_ef16_k128_20260322_062843/metrics.jsonl", "latest_step": 1150, "latest_tokens_per_sec": 125514.36187461333, "baseline_ratio": null, "latest_total_tokens": 37683200.0, "proxy_mode": "fast", "evaluation_basis": "terminal_only"}}
{"event_id": "evt_1774132447629048436", "ts": 1774132447, "event": "training_heartbeat", "round": 7, "session_id": "019d1279-dd8d-73d2-97df-ff57e75146ab", "tier": "proxy", "run_name": "round0007_proxy_1774132117", "family_name": "two_stage_residual", "family_stage": "prototype", "status": null, "decision": null, "payload": {"tier": "proxy", "run_name": "round0007_proxy_1774132117", "family_name": "two_stage_residual", "family_stage": "prototype", "checkpoint_dir": "/root/sparsify-ascend/checkpoints/research_agent/round_0007_proxy/round0007_proxy_1774132117_dp2_bs1_ga8_ef16_k128_20260322_062843", "metrics_path": "/root/sparsify-ascend/checkpoints/research_agent/round_0007_proxy/round0007_proxy_1774132117_dp2_bs1_ga8_ef16_k128_20260322_062843/metrics.jsonl", "latest_step": 1220, "latest_tokens_per_sec": 120979.32631551822, "baseline_ratio": null, "latest_total_tokens": 39976960.0, "proxy_mode": "fast", "evaluation_basis": "terminal_only"}}
{"event_id": "evt_1774132477636547714", "ts": 1774132477, "event": "training_heartbeat", "round": 7, "session_id": "019d1279-dd8d-73d2-97df-ff57e75146ab", "tier": "proxy", "run_name": "round0007_proxy_1774132117", "family_name": "two_stage_residual", "family_stage": "prototype", "status": null, "decision": null, "payload": {"tier": "proxy", "run_name": "round0007_proxy_1774132117", "family_name": "two_stage_residual", "family_stage": "prototype", "checkpoint_dir": "/root/sparsify-ascend/checkpoints/research_agent/round_0007_proxy/round0007_proxy_1774132117_dp2_bs1_ga8_ef16_k128_20260322_062843", "metrics_path": "/root/sparsify-ascend/checkpoints/research_agent/round_0007_proxy/round0007_proxy_1774132117_dp2_bs1_ga8_ef16_k128_20260322_062843/metrics.jsonl", "latest_step": 1220, "latest_tokens_per_sec": 110860.4803471805, "baseline_ratio": null, "latest_total_tokens": 39976960.0, "proxy_mode": "fast", "evaluation_basis": "terminal_only"}}
{"event_id": "evt_1774132477712152917", "ts": 1774132477, "event": "training_finished", "round": 7, "session_id": "019d1279-dd8d-73d2-97df-ff57e75146ab", "tier": "proxy", "run_name": "round0007_proxy_1774132117", "family_name": "two_stage_residual", "family_stage": "prototype", "status": "ok", "decision": "promote", "payload": {"tier": "proxy", "run_name": "round0007_proxy_1774132117", "family_name": "two_stage_residual", "family_stage": "prototype", "checkpoint_dir": "/root/sparsify-ascend/checkpoints/research_agent/round_0007_proxy/round0007_proxy_1774132117_dp2_bs1_ga8_ef16_k128_20260322_062843", "metrics_path": "/root/sparsify-ascend/checkpoints/research_agent/round_0007_proxy/round0007_proxy_1774132117_dp2_bs1_ga8_ef16_k128_20260322_062843/metrics.jsonl", "run_health": "normal", "termination_reason": "completed", "tokens_per_sec": 110860.4803471805, "baseline_ratio": null, "status": "ok", "decision": "promote", "proxy_mode": "fast", "evaluation_basis": "terminal_only", "curve_start_fvu": 0.18473176658153534, "curve_mid_fvu": 0.1584618091583252, "curve_end_fvu": 0.13206832110881805, "curve_late_slope": -1.893409553005887e-09, "curve_still_improving": true}}
{"event_id": "evt_1774132477712208211", "ts": 1774132477, "event": "result_recorded", "round": 7, "session_id": "019d1279-dd8d-73d2-97df-ff57e75146ab", "tier": "proxy", "run_name": "round0007_proxy_1774132117", "family_name": "two_stage_residual", "family_stage": "prototype", "status": "ok", "decision": "promote", "payload": {"tier": "proxy", "run_name": "round0007_proxy_1774132117", "family_name": "two_stage_residual", "family_stage": "prototype", "status": "ok", "decision": "promote", "val_fvu": "0.13607123959809542", "observed_fvu": "0.132068", "k": "128", "log_path": "/root/sparsify-ascend/research/history/logs/proxy_1774132477.log", "checkpoint": null}}
{"event_id": "evt_1774132477712873940", "ts": 1774132477, "event": "training_started", "round": 7, "session_id": "019d1279-dd8d-73d2-97df-ff57e75146ab", "tier": "full", "run_name": "round0007_full_1774132477", "family_name": "two_stage_residual", "family_stage": "prototype", "status": null, "decision": null, "payload": {"tier": "full", "run_name": "round0007_full_1774132477", "family_name": "two_stage_residual", "family_stage": "prototype", "checkpoint_dir": "/root/sparsify-ascend/checkpoints/research_agent/round_0007_full", "log_path": "/root/sparsify-ascend/research/history/logs/round0007_full_1774132477.log", "config": {"architecture": "two_stage_residual", "expansion_factor": 16, "k": 128, "optimizer": "signum", "lr": "1.6e-3", "hookpoints": "layers.[3].self_attn.o_proj", "batch_size": 1, "grad_acc_steps": 8, "micro_acc_steps": 1, "auxk_alpha": 0.0, "dead_feature_threshold": 10000000, "use_hadamard": false, "tier": "full", "family_name": "two_stage_residual", "family_stage": "prototype"}, "baseline_tokens_per_sec": null, "proxy_mode": null, "evaluation_basis": null}}
{"event_id": "evt_1774132507714252031", "ts": 1774132507, "event": "training_heartbeat", "round": 7, "session_id": "019d1279-dd8d-73d2-97df-ff57e75146ab", "tier": "full", "run_name": "round0007_full_1774132477", "family_name": "two_stage_residual", "family_stage": "prototype", "status": null, "decision": null, "payload": {"tier": "full", "run_name": "round0007_full_1774132477", "family_name": "two_stage_residual", "family_stage": "prototype", "checkpoint_dir": "/root/sparsify-ascend/checkpoints/research_agent/round_0007_full/round0007_full_1774132477_dp2_bs1_ga8_ef16_k128_20260322_063444", "metrics_path": "/root/sparsify-ascend/checkpoints/research_agent/round_0007_full/round0007_full_1774132477_dp2_bs1_ga8_ef16_k128_20260322_063444/metrics.jsonl", "latest_step": 70, "latest_tokens_per_sec": 76455.85765528727, "baseline_ratio": null, "latest_total_tokens": 2293760.0, "proxy_mode": null, "evaluation_basis": null}}
{"event_id": "evt_1774132537715881521", "ts": 1774132537, "event": "training_heartbeat", "round": 7, "session_id": "019d1279-dd8d-73d2-97df-ff57e75146ab", "tier": "full", "run_name": "round0007_full_1774132477", "family_name": "two_stage_residual", "family_stage": "prototype", "status": null, "decision": null, "payload": {"tier": "full", "run_name": "round0007_full_1774132477", "family_name": "two_stage_residual", "family_stage": "prototype", "checkpoint_dir": "/root/sparsify-ascend/checkpoints/research_agent/round_0007_full/round0007_full_1774132477_dp2_bs1_ga8_ef16_k128_20260322_063444", "metrics_path": "/root/sparsify-ascend/checkpoints/research_agent/round_0007_full/round0007_full_1774132477_dp2_bs1_ga8_ef16_k128_20260322_063444/metrics.jsonl", "latest_step": 190, "latest_tokens_per_sec": 103760.62684108659, "baseline_ratio": null, "latest_total_tokens": 6225920.0, "proxy_mode": null, "evaluation_basis": null}}
{"event_id": "evt_1774132567718180923", "ts": 1774132567, "event": "training_heartbeat", "round": 7, "session_id": "019d1279-dd8d-73d2-97df-ff57e75146ab", "tier": "full", "run_name": "round0007_full_1774132477", "family_name": "two_stage_residual", "family_stage": "prototype", "status": null, "decision": null, "payload": {"tier": "full", "run_name": "round0007_full_1774132477", "family_name": "two_stage_residual", "family_stage": "prototype", "checkpoint_dir": "/root/sparsify-ascend/checkpoints/research_agent/round_0007_full/round0007_full_1774132477_dp2_bs1_ga8_ef16_k128_20260322_063444", "metrics_path": "/root/sparsify-ascend/checkpoints/research_agent/round_0007_full/round0007_full_1774132477_dp2_bs1_ga8_ef16_k128_20260322_063444/metrics.jsonl", "latest_step": 310, "latest_tokens_per_sec": 112861.26082561964, "baseline_ratio": null, "latest_total_tokens": 10158080.0, "proxy_mode": null, "evaluation_basis": null}}
{"event_id": "evt_1774132597721221557", "ts": 1774132597, "event": "training_heartbeat", "round": 7, "session_id": "019d1279-dd8d-73d2-97df-ff57e75146ab", "tier": "full", "run_name": "round0007_full_1774132477", "family_name": "two_stage_residual", "family_stage": "prototype", "status": null, "decision": null, "payload": {"tier": "full", "run_name": "round0007_full_1774132477", "family_name": "two_stage_residual", "family_stage": "prototype", "checkpoint_dir": "/root/sparsify-ascend/checkpoints/research_agent/round_0007_full/round0007_full_1774132477_dp2_bs1_ga8_ef16_k128_20260322_063444", "metrics_path": "/root/sparsify-ascend/checkpoints/research_agent/round_0007_full/round0007_full_1774132477_dp2_bs1_ga8_ef16_k128_20260322_063444/metrics.jsonl", "latest_step": 440, "latest_tokens_per_sec": 120141.2636279673, "baseline_ratio": null, "latest_total_tokens": 14417920.0, "proxy_mode": null, "evaluation_basis": null}}
