{"event_id": "evt_1774157109648527083", "ts": 1774157109, "event": "training_heartbeat", "round": 46, "session_id": "019d13dc-400c-7493-83af-bd34fffa7466", "tier": "full", "run_name": "round0046_full_1774157079", "family_name": "lowrank_gated_residual", "family_stage": "mainline", "status": null, "decision": null, "payload": {"tier": "full", "run_name": "round0046_full_1774157079", "family_name": "lowrank_gated_residual", "family_stage": "mainline", "checkpoint_dir": "/root/sparsify-ascend/checkpoints/research_agent/round_0046_full/round0046_full_1774157079_dp2_bs1_ga8_ef32_k48_20260322_132446", "metrics_path": "/root/sparsify-ascend/checkpoints/research_agent/round_0046_full/round0046_full_1774157079_dp2_bs1_ga8_ef32_k48_20260322_132446/metrics.jsonl", "latest_step": 50, "latest_tokens_per_sec": 54611.5139495017, "baseline_ratio": 0.6157183716758016, "latest_total_tokens": 1638400.0, "proxy_mode": null, "evaluation_basis": null}}
{"event_id": "evt_1774157139649909329", "ts": 1774157139, "event": "training_heartbeat", "round": 46, "session_id": "019d13dc-400c-7493-83af-bd34fffa7466", "tier": "full", "run_name": "round0046_full_1774157079", "family_name": "lowrank_gated_residual", "family_stage": "mainline", "status": null, "decision": null, "payload": {"tier": "full", "run_name": "round0046_full_1774157079", "family_name": "lowrank_gated_residual", "family_stage": "mainline", "checkpoint_dir": "/root/sparsify-ascend/checkpoints/research_agent/round_0046_full/round0046_full_1774157079_dp2_bs1_ga8_ef32_k48_20260322_132446", "metrics_path": "/root/sparsify-ascend/checkpoints/research_agent/round_0046_full/round0046_full_1774157079_dp2_bs1_ga8_ef32_k48_20260322_132446/metrics.jsonl", "latest_step": 140, "latest_tokens_per_sec": 76252.87941293776, "baseline_ratio": 0.859714286462364, "latest_total_tokens": 4587520.0, "proxy_mode": null, "evaluation_basis": null}}
{"event_id": "evt_1774157169651741328", "ts": 1774157169, "event": "training_heartbeat", "round": 46, "session_id": "019d13dc-400c-7493-83af-bd34fffa7466", "tier": "full", "run_name": "round0046_full_1774157079", "family_name": "lowrank_gated_residual", "family_stage": "mainline", "status": null, "decision": null, "payload": {"tier": "full", "run_name": "round0046_full_1774157079", "family_name": "lowrank_gated_residual", "family_stage": "mainline", "checkpoint_dir": "/root/sparsify-ascend/checkpoints/research_agent/round_0046_full/round0046_full_1774157079_dp2_bs1_ga8_ef32_k48_20260322_132446", "metrics_path": "/root/sparsify-ascend/checkpoints/research_agent/round_0046_full/round0046_full_1774157079_dp2_bs1_ga8_ef32_k48_20260322_132446/metrics.jsonl", "latest_step": 230, "latest_tokens_per_sec": 83588.35990795755, "baseline_ratio": 0.9424182765042735, "latest_total_tokens": 7536640.0, "proxy_mode": null, "evaluation_basis": null}}
{"event_id": "evt_1774157199654354436", "ts": 1774157199, "event": "training_heartbeat", "round": 46, "session_id": "019d13dc-400c-7493-83af-bd34fffa7466", "tier": "full", "run_name": "round0046_full_1774157079", "family_name": "lowrank_gated_residual", "family_stage": "mainline", "status": null, "decision": null, "payload": {"tier": "full", "run_name": "round0046_full_1774157079", "family_name": "lowrank_gated_residual", "family_stage": "mainline", "checkpoint_dir": "/root/sparsify-ascend/checkpoints/research_agent/round_0046_full/round0046_full_1774157079_dp2_bs1_ga8_ef32_k48_20260322_132446", "metrics_path": "/root/sparsify-ascend/checkpoints/research_agent/round_0046_full/round0046_full_1774157079_dp2_bs1_ga8_ef32_k48_20260322_132446/metrics.jsonl", "latest_step": 330, "latest_tokens_per_sec": 89987.39790608306, "baseline_ratio": 1.0145643309084909, "latest_total_tokens": 10813440.0, "proxy_mode": null, "evaluation_basis": null}}
{"event_id": "evt_1774157229657303418", "ts": 1774157229, "event": "training_heartbeat", "round": 46, "session_id": "019d13dc-400c-7493-83af-bd34fffa7466", "tier": "full", "run_name": "round0046_full_1774157079", "family_name": "lowrank_gated_residual", "family_stage": "mainline", "status": null, "decision": null, "payload": {"tier": "full", "run_name": "round0046_full_1774157079", "family_name": "lowrank_gated_residual", "family_stage": "mainline", "checkpoint_dir": "/root/sparsify-ascend/checkpoints/research_agent/round_0046_full/round0046_full_1774157079_dp2_bs1_ga8_ef32_k48_20260322_132446", "metrics_path": "/root/sparsify-ascend/checkpoints/research_agent/round_0046_full/round0046_full_1774157079_dp2_bs1_ga8_ef32_k48_20260322_132446/metrics.jsonl", "latest_step": 420, "latest_tokens_per_sec": 91646.96093594276, "baseline_ratio": 1.0332751003514224, "latest_total_tokens": 13762560.0, "proxy_mode": null, "evaluation_basis": null}}
{"event_id": "evt_1774157259660794144", "ts": 1774157259, "event": "training_heartbeat", "round": 46, "session_id": "019d13dc-400c-7493-83af-bd34fffa7466", "tier": "full", "run_name": "round0046_full_1774157079", "family_name": "lowrank_gated_residual", "family_stage": "mainline", "status": null, "decision": null, "payload": {"tier": "full", "run_name": "round0046_full_1774157079", "family_name": "lowrank_gated_residual", "family_stage": "mainline", "checkpoint_dir": "/root/sparsify-ascend/checkpoints/research_agent/round_0046_full/round0046_full_1774157079_dp2_bs1_ga8_ef32_k48_20260322_132446", "metrics_path": "/root/sparsify-ascend/checkpoints/research_agent/round_0046_full/round0046_full_1774157079_dp2_bs1_ga8_ef32_k48_20260322_132446/metrics.jsonl", "latest_step": 520, "latest_tokens_per_sec": 94572.3211480754, "baseline_ratio": 1.0662571200047326, "latest_total_tokens": 17039360.0, "proxy_mode": null, "evaluation_basis": null}}
{"event_id": "evt_1774157289664764066", "ts": 1774157289, "event": "training_heartbeat", "round": 46, "session_id": "019d13dc-400c-7493-83af-bd34fffa7466", "tier": "full", "run_name": "round0046_full_1774157079", "family_name": "lowrank_gated_residual", "family_stage": "mainline", "status": null, "decision": null, "payload": {"tier": "full", "run_name": "round0046_full_1774157079", "family_name": "lowrank_gated_residual", "family_stage": "mainline", "checkpoint_dir": "/root/sparsify-ascend/checkpoints/research_agent/round_0046_full/round0046_full_1774157079_dp2_bs1_ga8_ef32_k48_20260322_132446", "metrics_path": "/root/sparsify-ascend/checkpoints/research_agent/round_0046_full/round0046_full_1774157079_dp2_bs1_ga8_ef32_k48_20260322_132446/metrics.jsonl", "latest_step": 610, "latest_tokens_per_sec": 95103.18883337239, "baseline_ratio": 1.0722423960596796, "latest_total_tokens": 19988480.0, "proxy_mode": null, "evaluation_basis": null}}
{"event_id": "evt_1774157319669297887", "ts": 1774157319, "event": "training_heartbeat", "round": 46, "session_id": "019d13dc-400c-7493-83af-bd34fffa7466", "tier": "full", "run_name": "round0046_full_1774157079", "family_name": "lowrank_gated_residual", "family_stage": "mainline", "status": null, "decision": null, "payload": {"tier": "full", "run_name": "round0046_full_1774157079", "family_name": "lowrank_gated_residual", "family_stage": "mainline", "checkpoint_dir": "/root/sparsify-ascend/checkpoints/research_agent/round_0046_full/round0046_full_1774157079_dp2_bs1_ga8_ef32_k48_20260322_132446", "metrics_path": "/root/sparsify-ascend/checkpoints/research_agent/round_0046_full/round0046_full_1774157079_dp2_bs1_ga8_ef32_k48_20260322_132446/metrics.jsonl", "latest_step": 710, "latest_tokens_per_sec": 96865.49308155324, "baseline_ratio": 1.0921115229820832, "latest_total_tokens": 23265280.0, "proxy_mode": null, "evaluation_basis": null}}
{"event_id": "evt_1774157349674318740", "ts": 1774157349, "event": "training_heartbeat", "round": 46, "session_id": "019d13dc-400c-7493-83af-bd34fffa7466", "tier": "full", "run_name": "round0046_full_1774157079", "family_name": "lowrank_gated_residual", "family_stage": "mainline", "status": null, "decision": null, "payload": {"tier": "full", "run_name": "round0046_full_1774157079", "family_name": "lowrank_gated_residual", "family_stage": "mainline", "checkpoint_dir": "/root/sparsify-ascend/checkpoints/research_agent/round_0046_full/round0046_full_1774157079_dp2_bs1_ga8_ef32_k48_20260322_132446", "metrics_path": "/root/sparsify-ascend/checkpoints/research_agent/round_0046_full/round0046_full_1774157079_dp2_bs1_ga8_ef32_k48_20260322_132446/metrics.jsonl", "latest_step": 800, "latest_tokens_per_sec": 97023.41340598167, "baseline_ratio": 1.0938919981599275, "latest_total_tokens": 26214400.0, "proxy_mode": null, "evaluation_basis": null}}
{"event_id": "evt_1774157379679855222", "ts": 1774157379, "event": "training_heartbeat", "round": 46, "session_id": "019d13dc-400c-7493-83af-bd34fffa7466", "tier": "full", "run_name": "round0046_full_1774157079", "family_name": "lowrank_gated_residual", "family_stage": "mainline", "status": null, "decision": null, "payload": {"tier": "full", "run_name": "round0046_full_1774157079", "family_name": "lowrank_gated_residual", "family_stage": "mainline", "checkpoint_dir": "/root/sparsify-ascend/checkpoints/research_agent/round_0046_full/round0046_full_1774157079_dp2_bs1_ga8_ef32_k48_20260322_132446", "metrics_path": "/root/sparsify-ascend/checkpoints/research_agent/round_0046_full/round0046_full_1774157079_dp2_bs1_ga8_ef32_k48_20260322_132446/metrics.jsonl", "latest_step": 900, "latest_tokens_per_sec": 98241.16924630116, "baseline_ratio": 1.1076216055059818, "latest_total_tokens": 29491200.0, "proxy_mode": null, "evaluation_basis": null}}
{"event_id": "evt_1774157409685961842", "ts": 1774157409, "event": "training_heartbeat", "round": 46, "session_id": "019d13dc-400c-7493-83af-bd34fffa7466", "tier": "full", "run_name": "round0046_full_1774157079", "family_name": "lowrank_gated_residual", "family_stage": "mainline", "status": null, "decision": null, "payload": {"tier": "full", "run_name": "round0046_full_1774157079", "family_name": "lowrank_gated_residual", "family_stage": "mainline", "checkpoint_dir": "/root/sparsify-ascend/checkpoints/research_agent/round_0046_full/round0046_full_1774157079_dp2_bs1_ga8_ef32_k48_20260322_132446", "metrics_path": "/root/sparsify-ascend/checkpoints/research_agent/round_0046_full/round0046_full_1774157079_dp2_bs1_ga8_ef32_k48_20260322_132446/metrics.jsonl", "latest_step": 990, "latest_tokens_per_sec": 98245.06128153625, "baseline_ratio": 1.1076654863183626, "latest_total_tokens": 32440320.0, "proxy_mode": null, "evaluation_basis": null}}
{"event_id": "evt_1774157439941145333", "ts": 1774157439, "event": "training_heartbeat", "round": 46, "session_id": "019d13dc-400c-7493-83af-bd34fffa7466", "tier": "full", "run_name": "round0046_full_1774157079", "family_name": "lowrank_gated_residual", "family_stage": "mainline", "status": null, "decision": null, "payload": {"tier": "full", "run_name": "round0046_full_1774157079", "family_name": "lowrank_gated_residual", "family_stage": "mainline", "checkpoint_dir": "/root/sparsify-ascend/checkpoints/research_agent/round_0046_full/round0046_full_1774157079_dp2_bs1_ga8_ef32_k48_20260322_132446", "metrics_path": "/root/sparsify-ascend/checkpoints/research_agent/round_0046_full/round0046_full_1774157079_dp2_bs1_ga8_ef32_k48_20260322_132446/metrics.jsonl", "latest_step": 1030, "latest_tokens_per_sec": 93699.72021194478, "baseline_ratio": 1.0564189670464765, "latest_total_tokens": 33751040.0, "proxy_mode": null, "evaluation_basis": null}}
{"event_id": "evt_1774157470023497956", "ts": 1774157470, "event": "training_heartbeat", "round": 46, "session_id": "019d13dc-400c-7493-83af-bd34fffa7466", "tier": "full", "run_name": "round0046_full_1774157079", "family_name": "lowrank_gated_residual", "family_stage": "mainline", "status": null, "decision": null, "payload": {"tier": "full", "run_name": "round0046_full_1774157079", "family_name": "lowrank_gated_residual", "family_stage": "mainline", "checkpoint_dir": "/root/sparsify-ascend/checkpoints/research_agent/round_0046_full/round0046_full_1774157079_dp2_bs1_ga8_ef32_k48_20260322_132446", "metrics_path": "/root/sparsify-ascend/checkpoints/research_agent/round_0046_full/round0046_full_1774157079_dp2_bs1_ga8_ef32_k48_20260322_132446/metrics.jsonl", "latest_step": 1120, "latest_tokens_per_sec": 93992.09016451976, "baseline_ratio": 1.0597152966683372, "latest_total_tokens": 36700160.0, "proxy_mode": null, "evaluation_basis": null}}
{"event_id": "evt_1774157500030938674", "ts": 1774157500, "event": "training_heartbeat", "round": 46, "session_id": "019d13dc-400c-7493-83af-bd34fffa7466", "tier": "full", "run_name": "round0046_full_1774157079", "family_name": "lowrank_gated_residual", "family_stage": "mainline", "status": null, "decision": null, "payload": {"tier": "full", "run_name": "round0046_full_1774157079", "family_name": "lowrank_gated_residual", "family_stage": "mainline", "checkpoint_dir": "/root/sparsify-ascend/checkpoints/research_agent/round_0046_full/round0046_full_1774157079_dp2_bs1_ga8_ef32_k48_20260322_132446", "metrics_path": "/root/sparsify-ascend/checkpoints/research_agent/round_0046_full/round0046_full_1774157079_dp2_bs1_ga8_ef32_k48_20260322_132446/metrics.jsonl", "latest_step": 1220, "latest_tokens_per_sec": 95060.35623026984, "baseline_ratio": 1.071759479203331, "latest_total_tokens": 39976960.0, "proxy_mode": null, "evaluation_basis": null}}
{"event_id": "evt_1774157530257115518", "ts": 1774157530, "event": "training_heartbeat", "round": 46, "session_id": "019d13dc-400c-7493-83af-bd34fffa7466", "tier": "full", "run_name": "round0046_full_1774157079", "family_name": "lowrank_gated_residual", "family_stage": "mainline", "status": null, "decision": null, "payload": {"tier": "full", "run_name": "round0046_full_1774157079", "family_name": "lowrank_gated_residual", "family_stage": "mainline", "checkpoint_dir": "/root/sparsify-ascend/checkpoints/research_agent/round_0046_full/round0046_full_1774157079_dp2_bs1_ga8_ef32_k48_20260322_132446", "metrics_path": "/root/sparsify-ascend/checkpoints/research_agent/round_0046_full/round0046_full_1774157079_dp2_bs1_ga8_ef32_k48_20260322_132446/metrics.jsonl", "latest_step": 1220, "latest_tokens_per_sec": 88729.17589009239, "baseline_ratio": 1.0003784870293266, "latest_total_tokens": 39976960.0, "proxy_mode": null, "evaluation_basis": null}}
{"event_id": "evt_1774157560270270473", "ts": 1774157560, "event": "training_heartbeat", "round": 46, "session_id": "019d13dc-400c-7493-83af-bd34fffa7466", "tier": "full", "run_name": "round0046_full_1774157079", "family_name": "lowrank_gated_residual", "family_stage": "mainline", "status": null, "decision": null, "payload": {"tier": "full", "run_name": "round0046_full_1774157079", "family_name": "lowrank_gated_residual", "family_stage": "mainline", "checkpoint_dir": "/root/sparsify-ascend/checkpoints/research_agent/round_0046_full/round0046_full_1774157079_dp2_bs1_ga8_ef32_k48_20260322_132446", "metrics_path": "/root/sparsify-ascend/checkpoints/research_agent/round_0046_full/round0046_full_1774157079_dp2_bs1_ga8_ef32_k48_20260322_132446/metrics.jsonl", "latest_step": 1220, "latest_tokens_per_sec": 83149.8355061818, "baseline_ratio": 0.9374741262496011, "latest_total_tokens": 39976960.0, "proxy_mode": null, "evaluation_basis": null}}
{"event_id": "evt_1774157590277665930", "ts": 1774157590, "event": "training_heartbeat", "round": 46, "session_id": "019d13dc-400c-7493-83af-bd34fffa7466", "tier": "full", "run_name": "round0046_full_1774157079", "family_name": "lowrank_gated_residual", "family_stage": "mainline", "status": null, "decision": null, "payload": {"tier": "full", "run_name": "round0046_full_1774157079", "family_name": "lowrank_gated_residual", "family_stage": "mainline", "checkpoint_dir": "/root/sparsify-ascend/checkpoints/research_agent/round_0046_full/round0046_full_1774157079_dp2_bs1_ga8_ef32_k48_20260322_132446", "metrics_path": "/root/sparsify-ascend/checkpoints/research_agent/round_0046_full/round0046_full_1774157079_dp2_bs1_ga8_ef32_k48_20260322_132446/metrics.jsonl", "latest_step": 1220, "latest_tokens_per_sec": 78265.0150207027, "baseline_ratio": 0.8824001409719007, "latest_total_tokens": 39976960.0, "proxy_mode": null, "evaluation_basis": null}}
{"event_id": "evt_1774157620285072917", "ts": 1774157620, "event": "training_heartbeat", "round": 46, "session_id": "019d13dc-400c-7493-83af-bd34fffa7466", "tier": "full", "run_name": "round0046_full_1774157079", "family_name": "lowrank_gated_residual", "family_stage": "mainline", "status": null, "decision": null, "payload": {"tier": "full", "run_name": "round0046_full_1774157079", "family_name": "lowrank_gated_residual", "family_stage": "mainline", "checkpoint_dir": "/root/sparsify-ascend/checkpoints/research_agent/round_0046_full/round0046_full_1774157079_dp2_bs1_ga8_ef32_k48_20260322_132446", "metrics_path": "/root/sparsify-ascend/checkpoints/research_agent/round_0046_full/round0046_full_1774157079_dp2_bs1_ga8_ef32_k48_20260322_132446/metrics.jsonl", "latest_step": 1220, "latest_tokens_per_sec": 73922.29399106881, "baseline_ratio": 0.8334380645225838, "latest_total_tokens": 39976960.0, "proxy_mode": null, "evaluation_basis": null}}
{"event_id": "evt_1774157650292414672", "ts": 1774157650, "event": "training_heartbeat", "round": 46, "session_id": "019d13dc-400c-7493-83af-bd34fffa7466", "tier": "full", "run_name": "round0046_full_1774157079", "family_name": "lowrank_gated_residual", "family_stage": "mainline", "status": null, "decision": null, "payload": {"tier": "full", "run_name": "round0046_full_1774157079", "family_name": "lowrank_gated_residual", "family_stage": "mainline", "checkpoint_dir": "/root/sparsify-ascend/checkpoints/research_agent/round_0046_full/round0046_full_1774157079_dp2_bs1_ga8_ef32_k48_20260322_132446", "metrics_path": "/root/sparsify-ascend/checkpoints/research_agent/round_0046_full/round0046_full_1774157079_dp2_bs1_ga8_ef32_k48_20260322_132446/metrics.jsonl", "latest_step": 1220, "latest_tokens_per_sec": 70036.17944163423, "baseline_ratio": 0.7896240050050974, "latest_total_tokens": 39976960.0, "proxy_mode": null, "evaluation_basis": null}}
{"event_id": "evt_1774157680299879075", "ts": 1774157680, "event": "training_heartbeat", "round": 46, "session_id": "019d13dc-400c-7493-83af-bd34fffa7466", "tier": "full", "run_name": "round0046_full_1774157079", "family_name": "lowrank_gated_residual", "family_stage": "mainline", "status": null, "decision": null, "payload": {"tier": "full", "run_name": "round0046_full_1774157079", "family_name": "lowrank_gated_residual", "family_stage": "mainline", "checkpoint_dir": "/root/sparsify-ascend/checkpoints/research_agent/round_0046_full/round0046_full_1774157079_dp2_bs1_ga8_ef32_k48_20260322_132446", "metrics_path": "/root/sparsify-ascend/checkpoints/research_agent/round_0046_full/round0046_full_1774157079_dp2_bs1_ga8_ef32_k48_20260322_132446/metrics.jsonl", "latest_step": 1220, "latest_tokens_per_sec": 66538.23440687424, "baseline_ratio": 0.750186368776858, "latest_total_tokens": 39976960.0, "proxy_mode": null, "evaluation_basis": null}}
{"event_id": "evt_1774157680385506972", "ts": 1774157680, "event": "training_finished", "round": 46, "session_id": "019d13dc-400c-7493-83af-bd34fffa7466", "tier": "full", "run_name": "round0046_full_1774157079", "family_name": "lowrank_gated_residual", "family_stage": "mainline", "status": "ok", "decision": "keep", "payload": {"tier": "full", "run_name": "round0046_full_1774157079", "family_name": "lowrank_gated_residual", "family_stage": "mainline", "checkpoint_dir": "/root/sparsify-ascend/checkpoints/research_agent/round_0046_full/round0046_full_1774157079_dp2_bs1_ga8_ef32_k48_20260322_132446", "metrics_path": "/root/sparsify-ascend/checkpoints/research_agent/round_0046_full/round0046_full_1774157079_dp2_bs1_ga8_ef32_k48_20260322_132446/metrics.jsonl", "run_health": "normal", "termination_reason": "completed", "tokens_per_sec": 66538.23440687424, "baseline_ratio": 0.750186368776858, "status": "ok", "decision": "keep", "proxy_mode": null, "evaluation_basis": null, "curve_start_fvu": 0.12306579947471619, "curve_mid_fvu": 0.10566547513008118, "curve_end_fvu": 0.08537587523460388, "curve_late_slope": -1.4001363420216785e-09, "curve_still_improving": true}}
{"event_id": "evt_1774157680385562619", "ts": 1774157680, "event": "result_recorded", "round": 46, "session_id": "019d13dc-400c-7493-83af-bd34fffa7466", "tier": "full", "run_name": "round0046_full_1774157079", "family_name": "lowrank_gated_residual", "family_stage": "mainline", "status": "ok", "decision": "keep", "payload": {"tier": "full", "run_name": "round0046_full_1774157079", "family_name": "lowrank_gated_residual", "family_stage": "mainline", "status": "ok", "decision": "keep", "val_fvu": "0.08739485312253237", "observed_fvu": "0.085376", "k": "48", "log_path": "/root/sparsify-ascend/research/history/logs/full_1774157680.log", "checkpoint": null}}
{"event_id": "evt_1774157680386005881", "ts": 1774157680, "event": "round_finished", "round": 46, "session_id": "019d13dc-400c-7493-83af-bd34fffa7466", "tier": "full", "run_name": null, "family_name": "lowrank_gated_residual", "family_stage": "mainline", "status": "ok", "decision": "keep", "payload": {"tier": "full", "family_name": "lowrank_gated_residual", "family_stage": "mainline", "status": "ok", "decision": "keep", "val_fvu": "0.08739485312253237"}}
{"event_id": "evt_1774157680393838671", "ts": 1774157680, "event": "experiment_commit_prepared", "round": 46, "tier": "full", "run_name": null, "family_name": "lowrank_gated_residual", "family_stage": "mainline", "status": "ok", "decision": "keep", "payload": {"branch": "autoresearch-sae"}}
{"event_id": "evt_1774160971225731479", "ts": 1774160971, "event": "loop_started", "round": null, "tier": null, "run_name": null, "family_name": null, "family_stage": null, "status": null, "decision": null, "payload": {"rounds": 200, "budget_hours": 10.0}}
