{"event_id": "evt_1774156585613362507", "ts": 1774156585, "event": "training_heartbeat", "round": 45, "session_id": "019d13dc-400c-7493-83af-bd34fffa7466", "tier": "full", "run_name": "round0045_full_1774156345", "family_name": "lowrank_gated_residual", "family_stage": "mainline", "status": null, "decision": null, "payload": {"tier": "full", "run_name": "round0045_full_1774156345", "family_name": "lowrank_gated_residual", "family_stage": "mainline", "checkpoint_dir": "/root/sparsify-ascend/checkpoints/research_agent/round_0045_full/round0045_full_1774156345_dp2_bs1_ga8_ef32_k56_20260322_131233", "metrics_path": "/root/sparsify-ascend/checkpoints/research_agent/round_0045_full/round0045_full_1774156345_dp2_bs1_ga8_ef32_k56_20260322_131233/metrics.jsonl", "latest_step": 680, "latest_tokens_per_sec": 92834.34274397122, "baseline_ratio": 1.0466622551933993, "latest_total_tokens": 22282240.0, "proxy_mode": null, "evaluation_basis": null}}
{"event_id": "evt_1774156615618257336", "ts": 1774156615, "event": "training_heartbeat", "round": 45, "session_id": "019d13dc-400c-7493-83af-bd34fffa7466", "tier": "full", "run_name": "round0045_full_1774156345", "family_name": "lowrank_gated_residual", "family_stage": "mainline", "status": null, "decision": null, "payload": {"tier": "full", "run_name": "round0045_full_1774156345", "family_name": "lowrank_gated_residual", "family_stage": "mainline", "checkpoint_dir": "/root/sparsify-ascend/checkpoints/research_agent/round_0045_full/round0045_full_1774156345_dp2_bs1_ga8_ef32_k56_20260322_131233", "metrics_path": "/root/sparsify-ascend/checkpoints/research_agent/round_0045_full/round0045_full_1774156345_dp2_bs1_ga8_ef32_k56_20260322_131233/metrics.jsonl", "latest_step": 770, "latest_tokens_per_sec": 93440.34902142562, "baseline_ratio": 1.0534946824856468, "latest_total_tokens": 25231360.0, "proxy_mode": null, "evaluation_basis": null}}
{"event_id": "evt_1774156645623783825", "ts": 1774156645, "event": "training_heartbeat", "round": 45, "session_id": "019d13dc-400c-7493-83af-bd34fffa7466", "tier": "full", "run_name": "round0045_full_1774156345", "family_name": "lowrank_gated_residual", "family_stage": "mainline", "status": null, "decision": null, "payload": {"tier": "full", "run_name": "round0045_full_1774156345", "family_name": "lowrank_gated_residual", "family_stage": "mainline", "checkpoint_dir": "/root/sparsify-ascend/checkpoints/research_agent/round_0045_full/round0045_full_1774156345_dp2_bs1_ga8_ef32_k56_20260322_131233", "metrics_path": "/root/sparsify-ascend/checkpoints/research_agent/round_0045_full/round0045_full_1774156345_dp2_bs1_ga8_ef32_k56_20260322_131233/metrics.jsonl", "latest_step": 870, "latest_tokens_per_sec": 95017.09170556872, "baseline_ratio": 1.071271692640136, "latest_total_tokens": 28508160.0, "proxy_mode": null, "evaluation_basis": null}}
{"event_id": "evt_1774156675629775833", "ts": 1774156675, "event": "training_heartbeat", "round": 45, "session_id": "019d13dc-400c-7493-83af-bd34fffa7466", "tier": "full", "run_name": "round0045_full_1774156345", "family_name": "lowrank_gated_residual", "family_stage": "mainline", "status": null, "decision": null, "payload": {"tier": "full", "run_name": "round0045_full_1774156345", "family_name": "lowrank_gated_residual", "family_stage": "mainline", "checkpoint_dir": "/root/sparsify-ascend/checkpoints/research_agent/round_0045_full/round0045_full_1774156345_dp2_bs1_ga8_ef32_k56_20260322_131233", "metrics_path": "/root/sparsify-ascend/checkpoints/research_agent/round_0045_full/round0045_full_1774156345_dp2_bs1_ga8_ef32_k56_20260322_131233/metrics.jsonl", "latest_step": 960, "latest_tokens_per_sec": 95314.13707152591, "baseline_ratio": 1.0746207352836, "latest_total_tokens": 31457280.0, "proxy_mode": null, "evaluation_basis": null}}
{"event_id": "evt_1774156705636001602", "ts": 1774156705, "event": "training_heartbeat", "round": 45, "session_id": "019d13dc-400c-7493-83af-bd34fffa7466", "tier": "full", "run_name": "round0045_full_1774156345", "family_name": "lowrank_gated_residual", "family_stage": "mainline", "status": null, "decision": null, "payload": {"tier": "full", "run_name": "round0045_full_1774156345", "family_name": "lowrank_gated_residual", "family_stage": "mainline", "checkpoint_dir": "/root/sparsify-ascend/checkpoints/research_agent/round_0045_full/round0045_full_1774156345_dp2_bs1_ga8_ef32_k56_20260322_131233", "metrics_path": "/root/sparsify-ascend/checkpoints/research_agent/round_0045_full/round0045_full_1774156345_dp2_bs1_ga8_ef32_k56_20260322_131233/metrics.jsonl", "latest_step": 1000, "latest_tokens_per_sec": 91011.06226496461, "baseline_ratio": 1.0261056507989432, "latest_total_tokens": 32768000.0, "proxy_mode": null, "evaluation_basis": null}}
{"event_id": "evt_1774156735709009390", "ts": 1774156735, "event": "training_heartbeat", "round": 45, "session_id": "019d13dc-400c-7493-83af-bd34fffa7466", "tier": "full", "run_name": "round0045_full_1774156345", "family_name": "lowrank_gated_residual", "family_stage": "mainline", "status": null, "decision": null, "payload": {"tier": "full", "run_name": "round0045_full_1774156345", "family_name": "lowrank_gated_residual", "family_stage": "mainline", "checkpoint_dir": "/root/sparsify-ascend/checkpoints/research_agent/round_0045_full/round0045_full_1774156345_dp2_bs1_ga8_ef32_k56_20260322_131233", "metrics_path": "/root/sparsify-ascend/checkpoints/research_agent/round_0045_full/round0045_full_1774156345_dp2_bs1_ga8_ef32_k56_20260322_131233/metrics.jsonl", "latest_step": 1090, "latest_tokens_per_sec": 91570.42555355601, "baseline_ratio": 1.0324122009807453, "latest_total_tokens": 35717120.0, "proxy_mode": null, "evaluation_basis": null}}
{"event_id": "evt_1774156765787503620", "ts": 1774156765, "event": "training_heartbeat", "round": 45, "session_id": "019d13dc-400c-7493-83af-bd34fffa7466", "tier": "full", "run_name": "round0045_full_1774156345", "family_name": "lowrank_gated_residual", "family_stage": "mainline", "status": null, "decision": null, "payload": {"tier": "full", "run_name": "round0045_full_1774156345", "family_name": "lowrank_gated_residual", "family_stage": "mainline", "checkpoint_dir": "/root/sparsify-ascend/checkpoints/research_agent/round_0045_full/round0045_full_1774156345_dp2_bs1_ga8_ef32_k56_20260322_131233", "metrics_path": "/root/sparsify-ascend/checkpoints/research_agent/round_0045_full/round0045_full_1774156345_dp2_bs1_ga8_ef32_k56_20260322_131233/metrics.jsonl", "latest_step": 1180, "latest_tokens_per_sec": 92035.2353737808, "baseline_ratio": 1.0376527065985233, "latest_total_tokens": 38666240.0, "proxy_mode": null, "evaluation_basis": null}}
{"event_id": "evt_1774156795794881570", "ts": 1774156795, "event": "training_heartbeat", "round": 45, "session_id": "019d13dc-400c-7493-83af-bd34fffa7466", "tier": "full", "run_name": "round0045_full_1774156345", "family_name": "lowrank_gated_residual", "family_stage": "mainline", "status": null, "decision": null, "payload": {"tier": "full", "run_name": "round0045_full_1774156345", "family_name": "lowrank_gated_residual", "family_stage": "mainline", "checkpoint_dir": "/root/sparsify-ascend/checkpoints/research_agent/round_0045_full/round0045_full_1774156345_dp2_bs1_ga8_ef32_k56_20260322_131233", "metrics_path": "/root/sparsify-ascend/checkpoints/research_agent/round_0045_full/round0045_full_1774156345_dp2_bs1_ga8_ef32_k56_20260322_131233/metrics.jsonl", "latest_step": 1220, "latest_tokens_per_sec": 88797.62535202185, "baseline_ratio": 1.001150221562822, "latest_total_tokens": 39976960.0, "proxy_mode": null, "evaluation_basis": null}}
{"event_id": "evt_1774156825802275887", "ts": 1774156825, "event": "training_heartbeat", "round": 45, "session_id": "019d13dc-400c-7493-83af-bd34fffa7466", "tier": "full", "run_name": "round0045_full_1774156345", "family_name": "lowrank_gated_residual", "family_stage": "mainline", "status": null, "decision": null, "payload": {"tier": "full", "run_name": "round0045_full_1774156345", "family_name": "lowrank_gated_residual", "family_stage": "mainline", "checkpoint_dir": "/root/sparsify-ascend/checkpoints/research_agent/round_0045_full/round0045_full_1774156345_dp2_bs1_ga8_ef32_k56_20260322_131233", "metrics_path": "/root/sparsify-ascend/checkpoints/research_agent/round_0045_full/round0045_full_1774156345_dp2_bs1_ga8_ef32_k56_20260322_131233/metrics.jsonl", "latest_step": 1220, "latest_tokens_per_sec": 83248.83972063448, "baseline_ratio": 0.9385903508202698, "latest_total_tokens": 39976960.0, "proxy_mode": null, "evaluation_basis": null}}
{"event_id": "evt_1774156855809658015", "ts": 1774156855, "event": "training_heartbeat", "round": 45, "session_id": "019d13dc-400c-7493-83af-bd34fffa7466", "tier": "full", "run_name": "round0045_full_1774156345", "family_name": "lowrank_gated_residual", "family_stage": "mainline", "status": null, "decision": null, "payload": {"tier": "full", "run_name": "round0045_full_1774156345", "family_name": "lowrank_gated_residual", "family_stage": "mainline", "checkpoint_dir": "/root/sparsify-ascend/checkpoints/research_agent/round_0045_full/round0045_full_1774156345_dp2_bs1_ga8_ef32_k56_20260322_131233", "metrics_path": "/root/sparsify-ascend/checkpoints/research_agent/round_0045_full/round0045_full_1774156345_dp2_bs1_ga8_ef32_k56_20260322_131233/metrics.jsonl", "latest_step": 1220, "latest_tokens_per_sec": 78352.73472026756, "baseline_ratio": 0.8833891381022477, "latest_total_tokens": 39976960.0, "proxy_mode": null, "evaluation_basis": null}}
{"event_id": "evt_1774156855886883941", "ts": 1774156855, "event": "training_finished", "round": 45, "session_id": "019d13dc-400c-7493-83af-bd34fffa7466", "tier": "full", "run_name": "round0045_full_1774156345", "family_name": "lowrank_gated_residual", "family_stage": "mainline", "status": "ok", "decision": "keep", "payload": {"tier": "full", "run_name": "round0045_full_1774156345", "family_name": "lowrank_gated_residual", "family_stage": "mainline", "checkpoint_dir": "/root/sparsify-ascend/checkpoints/research_agent/round_0045_full/round0045_full_1774156345_dp2_bs1_ga8_ef32_k56_20260322_131233", "metrics_path": "/root/sparsify-ascend/checkpoints/research_agent/round_0045_full/round0045_full_1774156345_dp2_bs1_ga8_ef32_k56_20260322_131233/metrics.jsonl", "run_health": "normal", "termination_reason": "completed", "tokens_per_sec": 78352.73472026756, "baseline_ratio": 0.8833891381022477, "status": "ok", "decision": "keep", "proxy_mode": null, "evaluation_basis": null, "curve_start_fvu": 0.11936454474925995, "curve_mid_fvu": 0.10225097090005875, "curve_end_fvu": 0.08238613605499268, "curve_late_slope": -1.3372237233733225e-09, "curve_still_improving": true}}
{"event_id": "evt_1774156855886942939", "ts": 1774156855, "event": "result_recorded", "round": 45, "session_id": "019d13dc-400c-7493-83af-bd34fffa7466", "tier": "full", "run_name": "round0045_full_1774156345", "family_name": "lowrank_gated_residual", "family_stage": "mainline", "status": "ok", "decision": "keep", "payload": {"tier": "full", "run_name": "round0045_full_1774156345", "family_name": "lowrank_gated_residual", "family_stage": "mainline", "status": "ok", "decision": "keep", "val_fvu": "0.08395557384938002", "observed_fvu": "0.082386", "k": "56", "log_path": "/root/sparsify-ascend/research/history/logs/full_1774156855.log", "checkpoint": null}}
{"event_id": "evt_1774156855887365825", "ts": 1774156855, "event": "round_finished", "round": 45, "session_id": "019d13dc-400c-7493-83af-bd34fffa7466", "tier": "full", "run_name": null, "family_name": "lowrank_gated_residual", "family_stage": "mainline", "status": "ok", "decision": "keep", "payload": {"tier": "full", "family_name": "lowrank_gated_residual", "family_stage": "mainline", "status": "ok", "decision": "keep", "val_fvu": "0.08395557384938002"}}
{"event_id": "evt_1774156855894865092", "ts": 1774156855, "event": "experiment_commit_prepared", "round": 45, "tier": "full", "run_name": null, "family_name": "lowrank_gated_residual", "family_stage": "mainline", "status": "ok", "decision": "keep", "payload": {"branch": "autoresearch-sae"}}
{"event_id": "evt_1774156863540840814", "ts": 1774156863, "event": "round_started", "round": 46, "session_id": "019d13dc-400c-7493-83af-bd34fffa7466", "tier": null, "run_name": null, "family_name": null, "family_stage": null, "status": "started", "decision": null, "payload": {"status": "started"}}
{"event_id": "evt_1774156863541007597", "ts": 1774156863, "event": "agent_deciding", "round": 46, "session_id": "019d13dc-400c-7493-83af-bd34fffa7466", "tier": null, "run_name": null, "family_name": null, "family_stage": null, "status": null, "decision": null, "payload": {}}
{"event_id": "evt_1774156989410187643", "ts": 1774156989, "event": "session_resumed", "round": 46, "tier": null, "run_name": null, "family_name": null, "family_stage": null, "status": "active", "decision": null, "payload": {"session_id": "019d13dc-400c-7493-83af-bd34fffa7466"}}
{"event_id": "evt_1774156989417556323", "ts": 1774156989, "event": "agent_action_received", "round": 46, "session_id": "019d13dc-400c-7493-83af-bd34fffa7466", "tier": "proxy", "run_name": null, "family_name": "lowrank_gated_residual", "family_stage": "mainline", "status": null, "decision": null, "payload": {"session_id": "019d13dc-400c-7493-83af-bd34fffa7466", "tier": "proxy", "family_name": "lowrank_gated_residual", "family_stage": "mainline", "change_type": "param_only", "expected_win": "smaller_k", "hypothesis": "`lowrank_gated_residual` has now produced a smooth chain of valid lower-K full points through `K=56`, so the remaining high-value question is how much farther this family can extend the Pareto frontier below the old `K=64` anchor before quality bends too sharply. A proxy probe at `K=48` on the unchanged recipe is the cleanest next step to test that lower-K boundary while staying within the strongest validated family and same-EF comparison regime."}}
{"event_id": "evt_1774156989417682844", "ts": 1774156989, "event": "proxy_mode_selected", "round": 46, "session_id": "019d13dc-400c-7493-83af-bd34fffa7466", "tier": "proxy", "run_name": null, "family_name": "lowrank_gated_residual", "family_stage": "mainline", "status": null, "decision": null, "payload": {"tier": "proxy", "proxy_mode": "fast", "evaluation_basis": "terminal_only", "parameter_behavior": "structural", "proxy_max_tokens": "5000000"}}
{"event_id": "evt_1774156989417958272", "ts": 1774156989, "event": "training_started", "round": 46, "session_id": "019d13dc-400c-7493-83af-bd34fffa7466", "tier": "proxy", "run_name": "round0046_proxy_1774156989", "family_name": "lowrank_gated_residual", "family_stage": "mainline", "status": null, "decision": null, "payload": {"tier": "proxy", "run_name": "round0046_proxy_1774156989", "family_name": "lowrank_gated_residual", "family_stage": "mainline", "checkpoint_dir": "/root/sparsify-ascend/checkpoints/research_agent/round_0046_proxy", "log_path": "/root/sparsify-ascend/research/history/logs/round0046_proxy_1774156989.log", "config": {"architecture": "lowrank_gated_residual", "expansion_factor": 32, "k": 48, "optimizer": "signum", "lr": "1.6e-3", "hookpoints": "layers.[3].self_attn.o_proj", "batch_size": 1, "grad_acc_steps": 8, "micro_acc_steps": 1, "auxk_alpha": 0.0, "dead_feature_threshold": 10000000, "use_hadamard": false, "tier": "proxy", "family_name": "lowrank_gated_residual", "family_stage": "mainline"}, "baseline_tokens_per_sec": 83008.58788873068, "proxy_mode": "fast", "evaluation_basis": "terminal_only"}}
{"event_id": "evt_1774157019419214693", "ts": 1774157019, "event": "training_heartbeat", "round": 46, "session_id": "019d13dc-400c-7493-83af-bd34fffa7466", "tier": "proxy", "run_name": "round0046_proxy_1774156989", "family_name": "lowrank_gated_residual", "family_stage": "mainline", "status": null, "decision": null, "payload": {"tier": "proxy", "run_name": "round0046_proxy_1774156989", "family_name": "lowrank_gated_residual", "family_stage": "mainline", "checkpoint_dir": "/root/sparsify-ascend/checkpoints/research_agent/round_0046_proxy/round0046_proxy_1774156989_dp2_bs1_ga8_ef32_k48_20260322_132317", "metrics_path": "/root/sparsify-ascend/checkpoints/research_agent/round_0046_proxy/round0046_proxy_1774156989_dp2_bs1_ga8_ef32_k48_20260322_132317/metrics.jsonl", "latest_step": 40, "latest_tokens_per_sec": 43689.2594203279, "baseline_ratio": 0.5263221617369448, "latest_total_tokens": 1310720.0, "proxy_mode": "fast", "evaluation_basis": "terminal_only"}}
{"event_id": "evt_1774157049420488175", "ts": 1774157049, "event": "training_heartbeat", "round": 46, "session_id": "019d13dc-400c-7493-83af-bd34fffa7466", "tier": "proxy", "run_name": "round0046_proxy_1774156989", "family_name": "lowrank_gated_residual", "family_stage": "mainline", "status": null, "decision": null, "payload": {"tier": "proxy", "run_name": "round0046_proxy_1774156989", "family_name": "lowrank_gated_residual", "family_stage": "mainline", "checkpoint_dir": "/root/sparsify-ascend/checkpoints/research_agent/round_0046_proxy/round0046_proxy_1774156989_dp2_bs1_ga8_ef32_k48_20260322_132317", "metrics_path": "/root/sparsify-ascend/checkpoints/research_agent/round_0046_proxy/round0046_proxy_1774156989_dp2_bs1_ga8_ef32_k48_20260322_132317/metrics.jsonl", "latest_step": 130, "latest_tokens_per_sec": 70994.69393493154, "baseline_ratio": 0.8552692647909729, "latest_total_tokens": 4259840.0, "proxy_mode": "fast", "evaluation_basis": "terminal_only"}}
{"event_id": "evt_1774157079421911871", "ts": 1774157079, "event": "training_heartbeat", "round": 46, "session_id": "019d13dc-400c-7493-83af-bd34fffa7466", "tier": "proxy", "run_name": "round0046_proxy_1774156989", "family_name": "lowrank_gated_residual", "family_stage": "mainline", "status": null, "decision": null, "payload": {"tier": "proxy", "run_name": "round0046_proxy_1774156989", "family_name": "lowrank_gated_residual", "family_stage": "mainline", "checkpoint_dir": "/root/sparsify-ascend/checkpoints/research_agent/round_0046_proxy/round0046_proxy_1774156989_dp2_bs1_ga8_ef32_k48_20260322_132317", "metrics_path": "/root/sparsify-ascend/checkpoints/research_agent/round_0046_proxy/round0046_proxy_1774156989_dp2_bs1_ga8_ef32_k48_20260322_132317/metrics.jsonl", "latest_step": 152, "latest_tokens_per_sec": 55339.2688794308, "baseline_ratio": 0.6666691999821829, "latest_total_tokens": 4980736.0, "proxy_mode": "fast", "evaluation_basis": "terminal_only"}}
{"event_id": "evt_1774157079487272991", "ts": 1774157079, "event": "training_finished", "round": 46, "session_id": "019d13dc-400c-7493-83af-bd34fffa7466", "tier": "proxy", "run_name": "round0046_proxy_1774156989", "family_name": "lowrank_gated_residual", "family_stage": "mainline", "status": "ok", "decision": "promote", "payload": {"tier": "proxy", "run_name": "round0046_proxy_1774156989", "family_name": "lowrank_gated_residual", "family_stage": "mainline", "checkpoint_dir": "/root/sparsify-ascend/checkpoints/research_agent/round_0046_proxy/round0046_proxy_1774156989_dp2_bs1_ga8_ef32_k48_20260322_132317", "metrics_path": "/root/sparsify-ascend/checkpoints/research_agent/round_0046_proxy/round0046_proxy_1774156989_dp2_bs1_ga8_ef32_k48_20260322_132317/metrics.jsonl", "run_health": "normal", "termination_reason": "completed", "tokens_per_sec": 55339.2688794308, "baseline_ratio": 0.6666691999821829, "status": "ok", "decision": "promote", "proxy_mode": "fast", "evaluation_basis": "terminal_only", "curve_start_fvu": 0.31701913475990295, "curve_mid_fvu": 0.20570823550224304, "curve_end_fvu": 0.16214635968208313, "curve_late_slope": -6.654391331868547e-09, "curve_still_improving": true}}
{"event_id": "evt_1774157079487332604", "ts": 1774157079, "event": "result_recorded", "round": 46, "session_id": "019d13dc-400c-7493-83af-bd34fffa7466", "tier": "proxy", "run_name": "round0046_proxy_1774156989", "family_name": "lowrank_gated_residual", "family_stage": "mainline", "status": "ok", "decision": "promote", "payload": {"tier": "proxy", "run_name": "round0046_proxy_1774156989", "family_name": "lowrank_gated_residual", "family_stage": "mainline", "status": "ok", "decision": "promote", "val_fvu": "0.1631651557981968", "observed_fvu": "0.162146", "k": "48", "log_path": "/root/sparsify-ascend/research/history/logs/proxy_1774157079.log", "checkpoint": null}}
{"event_id": "evt_1774157079487703828", "ts": 1774157079, "event": "training_started", "round": 46, "session_id": "019d13dc-400c-7493-83af-bd34fffa7466", "tier": "full", "run_name": "round0046_full_1774157079", "family_name": "lowrank_gated_residual", "family_stage": "mainline", "status": null, "decision": null, "payload": {"tier": "full", "run_name": "round0046_full_1774157079", "family_name": "lowrank_gated_residual", "family_stage": "mainline", "checkpoint_dir": "/root/sparsify-ascend/checkpoints/research_agent/round_0046_full", "log_path": "/root/sparsify-ascend/research/history/logs/round0046_full_1774157079.log", "config": {"architecture": "lowrank_gated_residual", "expansion_factor": 32, "k": 48, "optimizer": "signum", "lr": "1.6e-3", "hookpoints": "layers.[3].self_attn.o_proj", "batch_size": 1, "grad_acc_steps": 8, "micro_acc_steps": 1, "auxk_alpha": 0.0, "dead_feature_threshold": 10000000, "use_hadamard": false, "tier": "full", "family_name": "lowrank_gated_residual", "family_stage": "mainline"}, "baseline_tokens_per_sec": 88695.60575375632, "proxy_mode": null, "evaluation_basis": null}}
