{"event_id": "evt_1774170423645892298", "ts": 1774170423, "event": "training_started", "round": 82, "session_id": "019d14b3-7a66-7a10-a3d2-e744f4a315a4", "tier": "proxy", "run_name": "round0082_proxy_1774170423", "family_name": "lowrank_gated_residual", "family_stage": "mainline_comparison", "status": null, "decision": null, "payload": {"tier": "proxy", "run_name": "round0082_proxy_1774170423", "family_name": "lowrank_gated_residual", "family_stage": "mainline_comparison", "checkpoint_dir": "/root/sparsify-ascend/checkpoints/research_agent/round_0082_proxy", "log_path": "/root/sparsify-ascend/research/history/logs/round0082_proxy_1774170423.log", "config": {"architecture": "lowrank_gated_residual", "expansion_factor": 12, "k": 32, "optimizer": "signum", "lr": "1.6e-3", "hookpoints": "layers.[3].self_attn.o_proj", "batch_size": 1, "grad_acc_steps": 8, "micro_acc_steps": 1, "auxk_alpha": 0.0, "dead_feature_threshold": 10000000, "use_hadamard": false, "tier": "proxy", "family_name": "lowrank_gated_residual", "family_stage": "mainline_comparison"}, "baseline_tokens_per_sec": 83008.58788873068, "proxy_mode": "fast", "evaluation_basis": "terminal_only"}}
{"event_id": "evt_1774170453655063336", "ts": 1774170453, "event": "training_heartbeat", "round": 82, "session_id": "019d14b3-7a66-7a10-a3d2-e744f4a315a4", "tier": "proxy", "run_name": "round0082_proxy_1774170423", "family_name": "lowrank_gated_residual", "family_stage": "mainline_comparison", "status": null, "decision": null, "payload": {"tier": "proxy", "run_name": "round0082_proxy_1774170423", "family_name": "lowrank_gated_residual", "family_stage": "mainline_comparison", "checkpoint_dir": "/root/sparsify-ascend/checkpoints/research_agent/round_0082_proxy/round0082_proxy_1774170423_dp2_bs1_ga8_ef12_k32_20260322_170710", "metrics_path": "/root/sparsify-ascend/checkpoints/research_agent/round_0082_proxy/round0082_proxy_1774170423_dp2_bs1_ga8_ef12_k32_20260322_170710/metrics.jsonl", "latest_step": 100, "latest_tokens_per_sec": 109221.87955009365, "baseline_ratio": 1.3157901167587711, "latest_total_tokens": 3276800.0, "proxy_mode": "fast", "evaluation_basis": "terminal_only"}}
{"event_id": "evt_1774170483656501467", "ts": 1774170483, "event": "training_heartbeat", "round": 82, "session_id": "019d14b3-7a66-7a10-a3d2-e744f4a315a4", "tier": "proxy", "run_name": "round0082_proxy_1774170423", "family_name": "lowrank_gated_residual", "family_stage": "mainline_comparison", "status": null, "decision": null, "payload": {"tier": "proxy", "run_name": "round0082_proxy_1774170423", "family_name": "lowrank_gated_residual", "family_stage": "mainline_comparison", "checkpoint_dir": "/root/sparsify-ascend/checkpoints/research_agent/round_0082_proxy/round0082_proxy_1774170423_dp2_bs1_ga8_ef12_k32_20260322_170710", "metrics_path": "/root/sparsify-ascend/checkpoints/research_agent/round_0082_proxy/round0082_proxy_1774170423_dp2_bs1_ga8_ef12_k32_20260322_170710/metrics.jsonl", "latest_step": 152, "latest_tokens_per_sec": 83008.47772503048, "baseline_ratio": 0.9999986728638205, "latest_total_tokens": 4980736.0, "proxy_mode": "fast", "evaluation_basis": "terminal_only"}}
{"event_id": "evt_1774170483722660995", "ts": 1774170483, "event": "training_finished", "round": 82, "session_id": "019d14b3-7a66-7a10-a3d2-e744f4a315a4", "tier": "proxy", "run_name": "round0082_proxy_1774170423", "family_name": "lowrank_gated_residual", "family_stage": "mainline_comparison", "status": "ok", "decision": "discard", "payload": {"tier": "proxy", "run_name": "round0082_proxy_1774170423", "family_name": "lowrank_gated_residual", "family_stage": "mainline_comparison", "checkpoint_dir": "/root/sparsify-ascend/checkpoints/research_agent/round_0082_proxy/round0082_proxy_1774170423_dp2_bs1_ga8_ef12_k32_20260322_170710", "metrics_path": "/root/sparsify-ascend/checkpoints/research_agent/round_0082_proxy/round0082_proxy_1774170423_dp2_bs1_ga8_ef12_k32_20260322_170710/metrics.jsonl", "run_health": "normal", "termination_reason": "completed", "tokens_per_sec": 83008.47772503048, "baseline_ratio": 0.9999986728638205, "status": "ok", "decision": "discard", "proxy_mode": "fast", "evaluation_basis": "terminal_only", "curve_start_fvu": 0.3535124659538269, "curve_mid_fvu": 0.22811737656593323, "curve_end_fvu": 0.18063268065452576, "curve_late_slope": -6.848788489737818e-09, "curve_still_improving": true}}
{"event_id": "evt_1774170483722717506", "ts": 1774170483, "event": "result_recorded", "round": 82, "session_id": "019d14b3-7a66-7a10-a3d2-e744f4a315a4", "tier": "proxy", "run_name": "round0082_proxy_1774170423", "family_name": "lowrank_gated_residual", "family_stage": "mainline_comparison", "status": "ok", "decision": "discard", "payload": {"tier": "proxy", "run_name": "round0082_proxy_1774170423", "family_name": "lowrank_gated_residual", "family_stage": "mainline_comparison", "status": "ok", "decision": "discard", "val_fvu": "0.18123700469732285", "observed_fvu": "0.180633", "k": "32", "log_path": "/root/sparsify-ascend/research/history/logs/proxy_1774170483.log", "checkpoint": null}}
{"event_id": "evt_1774170483722867821", "ts": 1774170483, "event": "round_finished", "round": 82, "session_id": "019d14b3-7a66-7a10-a3d2-e744f4a315a4", "tier": "proxy", "run_name": null, "family_name": "lowrank_gated_residual", "family_stage": "mainline_comparison", "status": "ok", "decision": "discard", "payload": {"tier": "proxy", "family_name": "lowrank_gated_residual", "family_stage": "mainline_comparison", "status": "ok", "decision": "discard", "val_fvu": "0.18123700469732285"}}
{"event_id": "evt_1774170483731577330", "ts": 1774170483, "event": "experiment_commit_prepared", "round": 82, "tier": "proxy", "run_name": null, "family_name": "lowrank_gated_residual", "family_stage": "mainline_comparison", "status": "ok", "decision": "discard", "payload": {"branch": "autoresearch-sae"}}
{"event_id": "evt_1774170491378499238", "ts": 1774170491, "event": "round_started", "round": 83, "session_id": "019d14b3-7a66-7a10-a3d2-e744f4a315a4", "tier": null, "run_name": null, "family_name": null, "family_stage": null, "status": "started", "decision": null, "payload": {"status": "started"}}
{"event_id": "evt_1774170491378737035", "ts": 1774170491, "event": "agent_deciding", "round": 83, "session_id": "019d14b3-7a66-7a10-a3d2-e744f4a315a4", "tier": null, "run_name": null, "family_name": null, "family_stage": null, "status": null, "decision": null, "payload": {}}
{"event_id": "evt_1774170617534519316", "ts": 1774170617, "event": "session_resumed", "round": 83, "tier": null, "run_name": null, "family_name": null, "family_stage": null, "status": "active", "decision": null, "payload": {"session_id": "019d14b3-7a66-7a10-a3d2-e744f4a315a4"}}
{"event_id": "evt_1774170617535809445", "ts": 1774170617, "event": "agent_action_received", "round": 83, "session_id": "019d14b3-7a66-7a10-a3d2-e744f4a315a4", "tier": "proxy", "run_name": null, "family_name": "batch_topk", "family_stage": "mainline_comparison", "status": null, "decision": null, "payload": {"session_id": "019d14b3-7a66-7a10-a3d2-e744f4a315a4", "tier": "proxy", "family_name": "batch_topk", "family_stage": "mainline_comparison", "change_type": "param_only", "expected_win": "smaller_k", "hypothesis": "After the low-K `lowrank_gated_residual` recovery run at `K=32, EF=12` stayed weak, the next informative move is to switch back to a fundamentally different sparse-allocation mechanism in the same mainline band rather than continue minor tweaks. Run `batch_topk` at `K=32`, `EF=12` with the stable `signum`/`lr=1.6e-3`/`auxk_alpha=0` recipe to test whether batch-level support allocation recovers a stronger low-K tradeoff than the recent per-sample and residual-style families."}}
{"event_id": "evt_1774170617535929208", "ts": 1774170617, "event": "variable_isolation_warning", "round": 83, "session_id": "019d14b3-7a66-7a10-a3d2-e744f4a315a4", "tier": null, "run_name": null, "family_name": "batch_topk", "family_stage": "mainline_comparison", "status": null, "decision": null, "payload": {"violation": "Multiple primary variables changed simultaneously: architecture, k, lr"}}
{"event_id": "evt_1774170617535982641", "ts": 1774170617, "event": "proxy_mode_selected", "round": 83, "session_id": "019d14b3-7a66-7a10-a3d2-e744f4a315a4", "tier": "proxy", "run_name": null, "family_name": "batch_topk", "family_stage": "mainline_comparison", "status": null, "decision": null, "payload": {"tier": "proxy", "proxy_mode": "fast", "evaluation_basis": "terminal_only", "parameter_behavior": "structural", "proxy_max_tokens": "5000000"}}
{"event_id": "evt_1774170617536240545", "ts": 1774170617, "event": "training_started", "round": 83, "session_id": "019d14b3-7a66-7a10-a3d2-e744f4a315a4", "tier": "proxy", "run_name": "round0083_proxy_1774170617", "family_name": "batch_topk", "family_stage": "mainline_comparison", "status": null, "decision": null, "payload": {"tier": "proxy", "run_name": "round0083_proxy_1774170617", "family_name": "batch_topk", "family_stage": "mainline_comparison", "checkpoint_dir": "/root/sparsify-ascend/checkpoints/research_agent/round_0083_proxy", "log_path": "/root/sparsify-ascend/research/history/logs/round0083_proxy_1774170617.log", "config": {"architecture": "batch_topk", "expansion_factor": 12, "k": 32, "optimizer": "signum", "lr": "1.6e-3", "hookpoints": "layers.[3].self_attn.o_proj", "batch_size": 1, "grad_acc_steps": 8, "micro_acc_steps": 1, "auxk_alpha": 0.0, "dead_feature_threshold": 10000000, "use_hadamard": false, "tier": "proxy", "family_name": "batch_topk", "family_stage": "mainline_comparison"}, "baseline_tokens_per_sec": 83008.54995808232, "proxy_mode": "fast", "evaluation_basis": "terminal_only"}}
{"event_id": "evt_1774170647538059914", "ts": 1774170647, "event": "training_heartbeat", "round": 83, "session_id": "019d14b3-7a66-7a10-a3d2-e744f4a315a4", "tier": "proxy", "run_name": "round0083_proxy_1774170617", "family_name": "batch_topk", "family_stage": "mainline_comparison", "status": null, "decision": null, "payload": {"tier": "proxy", "run_name": "round0083_proxy_1774170617", "family_name": "batch_topk", "family_stage": "mainline_comparison", "checkpoint_dir": "/root/sparsify-ascend/checkpoints/research_agent/round_0083_proxy/round0083_proxy_1774170617_dp2_bs1_ga8_ef12_k32_20260322_171024", "metrics_path": "/root/sparsify-ascend/checkpoints/research_agent/round_0083_proxy/round0083_proxy_1774170617_dp2_bs1_ga8_ef12_k32_20260322_171024/metrics.jsonl", "latest_step": 110, "latest_tokens_per_sec": 120143.71614804189, "baseline_ratio": 1.4473655570265, "latest_total_tokens": 3604480.0, "proxy_mode": "fast", "evaluation_basis": "terminal_only"}}
{"event_id": "evt_1774170677539498545", "ts": 1774170677, "event": "training_heartbeat", "round": 83, "session_id": "019d14b3-7a66-7a10-a3d2-e744f4a315a4", "tier": "proxy", "run_name": "round0083_proxy_1774170617", "family_name": "batch_topk", "family_stage": "mainline_comparison", "status": null, "decision": null, "payload": {"tier": "proxy", "run_name": "round0083_proxy_1774170617", "family_name": "batch_topk", "family_stage": "mainline_comparison", "checkpoint_dir": "/root/sparsify-ascend/checkpoints/research_agent/round_0083_proxy/round0083_proxy_1774170617_dp2_bs1_ga8_ef12_k32_20260322_171024", "metrics_path": "/root/sparsify-ascend/checkpoints/research_agent/round_0083_proxy/round0083_proxy_1774170617_dp2_bs1_ga8_ef12_k32_20260322_171024/metrics.jsonl", "latest_step": 152, "latest_tokens_per_sec": 83008.33556811293, "baseline_ratio": 0.9999974172543732, "latest_total_tokens": 4980736.0, "proxy_mode": "fast", "evaluation_basis": "terminal_only"}}
{"event_id": "evt_1774170677606033929", "ts": 1774170677, "event": "training_finished", "round": 83, "session_id": "019d14b3-7a66-7a10-a3d2-e744f4a315a4", "tier": "proxy", "run_name": "round0083_proxy_1774170617", "family_name": "batch_topk", "family_stage": "mainline_comparison", "status": "ok", "decision": "incubate", "payload": {"tier": "proxy", "run_name": "round0083_proxy_1774170617", "family_name": "batch_topk", "family_stage": "mainline_comparison", "checkpoint_dir": "/root/sparsify-ascend/checkpoints/research_agent/round_0083_proxy/round0083_proxy_1774170617_dp2_bs1_ga8_ef12_k32_20260322_171024", "metrics_path": "/root/sparsify-ascend/checkpoints/research_agent/round_0083_proxy/round0083_proxy_1774170617_dp2_bs1_ga8_ef12_k32_20260322_171024/metrics.jsonl", "run_health": "normal", "termination_reason": "completed", "tokens_per_sec": 83008.33556811293, "baseline_ratio": 0.9999974172543732, "status": "ok", "decision": "incubate", "proxy_mode": "fast", "evaluation_basis": "terminal_only", "curve_start_fvu": 0.6508341431617737, "curve_mid_fvu": 0.4956699311733246, "curve_end_fvu": 0.4237813353538513, "curve_late_slope": -1.1965077588214509e-08, "curve_still_improving": true}}
{"event_id": "evt_1774170677606088925", "ts": 1774170677, "event": "result_recorded", "round": 83, "session_id": "019d14b3-7a66-7a10-a3d2-e744f4a315a4", "tier": "proxy", "run_name": "round0083_proxy_1774170617", "family_name": "batch_topk", "family_stage": "mainline_comparison", "status": "ok", "decision": "incubate", "payload": {"tier": "proxy", "run_name": "round0083_proxy_1774170617", "family_name": "batch_topk", "family_stage": "mainline_comparison", "status": "ok", "decision": "incubate", "val_fvu": "0.42549191042780876", "observed_fvu": "0.423781", "k": "32", "log_path": "/root/sparsify-ascend/research/history/logs/proxy_1774170677.log", "checkpoint": null}}
{"event_id": "evt_1774170677606241276", "ts": 1774170677, "event": "round_finished", "round": 83, "session_id": "019d14b3-7a66-7a10-a3d2-e744f4a315a4", "tier": "proxy", "run_name": null, "family_name": "batch_topk", "family_stage": "mainline_comparison", "status": "ok", "decision": "incubate", "payload": {"tier": "proxy", "family_name": "batch_topk", "family_stage": "mainline_comparison", "status": "ok", "decision": "incubate", "val_fvu": "0.42549191042780876"}}
{"event_id": "evt_1774170677615031907", "ts": 1774170677, "event": "experiment_commit_prepared", "round": 83, "tier": "proxy", "run_name": null, "family_name": "batch_topk", "family_stage": "mainline_comparison", "status": "ok", "decision": "incubate", "payload": {"branch": "autoresearch-sae"}}
{"event_id": "evt_1774170685224791848", "ts": 1774170685, "event": "round_started", "round": 84, "session_id": "019d14b3-7a66-7a10-a3d2-e744f4a315a4", "tier": null, "run_name": null, "family_name": null, "family_stage": null, "status": "started", "decision": null, "payload": {"status": "started"}}
{"event_id": "evt_1774170685224966289", "ts": 1774170685, "event": "agent_deciding", "round": 84, "session_id": "019d14b3-7a66-7a10-a3d2-e744f4a315a4", "tier": null, "run_name": null, "family_name": null, "family_stage": null, "status": null, "decision": null, "payload": {}}
{"event_id": "evt_1774170838528266498", "ts": 1774170838, "event": "session_resumed", "round": 84, "tier": null, "run_name": null, "family_name": null, "family_stage": null, "status": "active", "decision": null, "payload": {"session_id": "019d14b3-7a66-7a10-a3d2-e744f4a315a4"}}
{"event_id": "evt_1774170838529583002", "ts": 1774170838, "event": "agent_action_received", "round": 84, "session_id": "019d14b3-7a66-7a10-a3d2-e744f4a315a4", "tier": "proxy", "run_name": null, "family_name": "residual_vq_topk", "family_stage": "prototype", "status": null, "decision": null, "payload": {"session_id": "019d14b3-7a66-7a10-a3d2-e744f4a315a4", "tier": "proxy", "family_name": "residual_vq_topk", "family_stage": "prototype", "change_type": "edit_sae_code", "expected_win": "Unblock a strategically different low-K family and obtain its first comparable proxy FVU; any clean run is more informative than another retune on families already shown weak.", "hypothesis": "`batch_topk` at `K=32, EF=12` was clearly weak, so the next informative move is to revive the still-untested discrete residual direction rather than keep sweeping known-poor low-K mechanisms. Do one narrow repair-focused pass on `residual_vq_topk` so the original `K=32, EF=12`, `signum`, `lr=1.6e-3`, `auxk_alpha=0` proxy can actually instantiate and run."}}
{"event_id": "evt_1774170968955076223", "ts": 1774170968, "event": "variable_isolation_warning", "round": 84, "session_id": "019d14b3-7a66-7a10-a3d2-e744f4a315a4", "tier": null, "run_name": null, "family_name": "residual_vq_topk", "family_stage": "prototype", "status": null, "decision": null, "payload": {"violation": "Multiple primary variables changed simultaneously: code_edit, architecture, k, lr"}}
{"event_id": "evt_1774170968955264706", "ts": 1774170968, "event": "proxy_mode_selected", "round": 84, "session_id": "019d14b3-7a66-7a10-a3d2-e744f4a315a4", "tier": "proxy", "run_name": null, "family_name": "residual_vq_topk", "family_stage": "prototype", "status": null, "decision": null, "payload": {"tier": "proxy", "proxy_mode": "fast", "evaluation_basis": "terminal_only", "parameter_behavior": "structural", "proxy_max_tokens": "40000000"}}
{"event_id": "evt_1774170968955316194", "ts": 1774170968, "event": "sanity_started", "round": 84, "session_id": "019d14b3-7a66-7a10-a3d2-e744f4a315a4", "tier": "proxy", "run_name": null, "family_name": "residual_vq_topk", "family_stage": "prototype", "status": null, "decision": null, "payload": {"tier": "proxy"}}
{"event_id": "evt_1774170973607836952", "ts": 1774170973, "event": "sanity_finished", "round": 84, "session_id": "019d14b3-7a66-7a10-a3d2-e744f4a315a4", "tier": "proxy", "run_name": null, "family_name": "residual_vq_topk", "family_stage": "prototype", "status": "ok", "decision": null, "payload": {"tier": "proxy", "status": "ok"}}
{"event_id": "evt_1774170973608238787", "ts": 1774170973, "event": "training_started", "round": 84, "session_id": "019d14b3-7a66-7a10-a3d2-e744f4a315a4", "tier": "proxy", "run_name": "round0084_proxy_1774170973", "family_name": "residual_vq_topk", "family_stage": "prototype", "status": null, "decision": null, "payload": {"tier": "proxy", "run_name": "round0084_proxy_1774170973", "family_name": "residual_vq_topk", "family_stage": "prototype", "checkpoint_dir": "/root/sparsify-ascend/checkpoints/research_agent/round_0084_proxy", "log_path": "/root/sparsify-ascend/research/history/logs/round0084_proxy_1774170973.log", "config": {"architecture": "residual_vq_topk", "expansion_factor": 12, "k": 32, "optimizer": "signum", "lr": "1.6e-3", "hookpoints": "layers.[3].self_attn.o_proj", "batch_size": 1, "grad_acc_steps": 8, "micro_acc_steps": 1, "auxk_alpha": 0.0, "dead_feature_threshold": 10000000, "use_hadamard": false, "tier": "proxy", "family_name": "residual_vq_topk", "family_stage": "prototype"}, "baseline_tokens_per_sec": null, "proxy_mode": "fast", "evaluation_basis": "terminal_only"}}
{"event_id": "evt_1774171003609031341", "ts": 1774171003, "event": "training_heartbeat", "round": 84, "session_id": "019d14b3-7a66-7a10-a3d2-e744f4a315a4", "tier": "proxy", "run_name": "round0084_proxy_1774170973", "family_name": "residual_vq_topk", "family_stage": "prototype", "status": null, "decision": null, "payload": {"tier": "proxy", "run_name": "round0084_proxy_1774170973", "family_name": "residual_vq_topk", "family_stage": "prototype", "checkpoint_dir": null, "metrics_path": null, "latest_step": null, "latest_tokens_per_sec": null, "baseline_ratio": null, "latest_total_tokens": null, "proxy_mode": "fast", "evaluation_basis": "terminal_only"}}
{"event_id": "evt_1774171003674066917", "ts": 1774171003, "event": "training_finished", "round": 84, "session_id": "019d14b3-7a66-7a10-a3d2-e744f4a315a4", "tier": "proxy", "run_name": "round0084_proxy_1774170973", "family_name": "residual_vq_topk", "family_stage": "prototype", "status": "crash", "decision": "crash", "payload": {"tier": "proxy", "run_name": "round0084_proxy_1774170973", "family_name": "residual_vq_topk", "family_stage": "prototype", "checkpoint_dir": null, "metrics_path": "", "run_health": "crash", "termination_reason": "completed", "tokens_per_sec": null, "baseline_ratio": null, "status": "crash", "decision": "crash", "proxy_mode": "fast", "evaluation_basis": "terminal_only", "curve_start_fvu": null, "curve_mid_fvu": null, "curve_end_fvu": null, "curve_late_slope": null, "curve_still_improving": null}}
{"event_id": "evt_1774171003674122462", "ts": 1774171003, "event": "result_recorded", "round": 84, "session_id": "019d14b3-7a66-7a10-a3d2-e744f4a315a4", "tier": "proxy", "run_name": "round0084_proxy_1774170973", "family_name": "residual_vq_topk", "family_stage": "prototype", "status": "crash", "decision": "crash", "payload": {"tier": "proxy", "run_name": "round0084_proxy_1774170973", "family_name": "residual_vq_topk", "family_stage": "prototype", "status": "crash", "decision": "crash", "val_fvu": "None", "observed_fvu": "", "k": "None", "log_path": "/root/sparsify-ascend/research/history/logs/proxy_1774171003.log", "checkpoint": null}}
{"event_id": "evt_1774171003674186498", "ts": 1774171003, "event": "repair_attempt_started", "round": 84, "session_id": "019d14b3-7a66-7a10-a3d2-e744f4a315a4", "tier": "proxy", "run_name": null, "family_name": "residual_vq_topk", "family_stage": "prototype", "status": null, "decision": null, "payload": {"tier": "proxy", "family_name": "residual_vq_topk", "family_stage": "prototype", "repair_attempt": 1, "failure_kind": "training_crash", "error_type": "ValueError", "error_summary": "ValueError: Unknown architecture: 'residual_vq_topk'. Must be one of ('topk', 'batch_topk', 'adaptive_budget_topk', 'bucketed_topk', 'codebook_topk', 'jumprelu', 'gated', 'routed', 'group_topk', 'factorized_topk', 'lowrank_residual', 'lowrank_gated_residual', 'lowrank_grouped_residual', 'whitened_topk', 'two_stage_residual', 'multi_branch_gated')"}}
