{"event_id": "evt_1774172636302174848", "ts": 1774172636, "event": "variable_isolation_warning", "round": 87, "session_id": "019d14ea-730e-75e1-9200-ca4cb6c1e330", "tier": null, "run_name": null, "family_name": "whitened_lowrank_gated_residual", "family_stage": "prototype", "status": null, "decision": null, "payload": {"violation": "Multiple primary variables changed simultaneously: code_edit, architecture, k, lr"}}
{"event_id": "evt_1774172640827886686", "ts": 1774172640, "event": "behavioral_diff_identical_warning", "round": 87, "session_id": "019d14ea-730e-75e1-9200-ca4cb6c1e330", "tier": null, "run_name": null, "family_name": "whitened_lowrank_gated_residual", "family_stage": "prototype", "status": null, "decision": null, "payload": {"architecture": "whitened_lowrank_gated_residual", "k": 40, "expansion_factor": 12, "max_diff": 0.0}}
{"event_id": "evt_1774172640827956927", "ts": 1774172640, "event": "proxy_mode_selected", "round": 87, "session_id": "019d14ea-730e-75e1-9200-ca4cb6c1e330", "tier": "proxy", "run_name": null, "family_name": "whitened_lowrank_gated_residual", "family_stage": "prototype", "status": null, "decision": null, "payload": {"tier": "proxy", "proxy_mode": "fast", "evaluation_basis": "terminal_only", "parameter_behavior": "structural", "proxy_max_tokens": "40000000"}}
{"event_id": "evt_1774172640828016636", "ts": 1774172640, "event": "sanity_started", "round": 87, "session_id": "019d14ea-730e-75e1-9200-ca4cb6c1e330", "tier": "proxy", "run_name": null, "family_name": "whitened_lowrank_gated_residual", "family_stage": "prototype", "status": null, "decision": null, "payload": {"tier": "proxy"}}
{"event_id": "evt_1774172645423695291", "ts": 1774172645, "event": "sanity_finished", "round": 87, "session_id": "019d14ea-730e-75e1-9200-ca4cb6c1e330", "tier": "proxy", "run_name": null, "family_name": "whitened_lowrank_gated_residual", "family_stage": "prototype", "status": "ok", "decision": null, "payload": {"tier": "proxy", "status": "ok"}}
{"event_id": "evt_1774172645424128152", "ts": 1774172645, "event": "training_started", "round": 87, "session_id": "019d14ea-730e-75e1-9200-ca4cb6c1e330", "tier": "proxy", "run_name": "round0087_proxy_1774172645", "family_name": "whitened_lowrank_gated_residual", "family_stage": "prototype", "status": null, "decision": null, "payload": {"tier": "proxy", "run_name": "round0087_proxy_1774172645", "family_name": "whitened_lowrank_gated_residual", "family_stage": "prototype", "checkpoint_dir": "/root/sparsify-ascend/checkpoints/research_agent/round_0087_proxy", "log_path": "/root/sparsify-ascend/research/history/logs/round0087_proxy_1774172645.log", "config": {"architecture": "whitened_lowrank_gated_residual", "expansion_factor": 12, "k": 40, "optimizer": "signum", "lr": "1.6e-3", "hookpoints": "layers.[3].self_attn.o_proj", "batch_size": 1, "grad_acc_steps": 8, "micro_acc_steps": 1, "auxk_alpha": 0.0, "dead_feature_threshold": 10000000, "use_hadamard": false, "tier": "proxy", "family_name": "whitened_lowrank_gated_residual", "family_stage": "prototype"}, "baseline_tokens_per_sec": null, "proxy_mode": "fast", "evaluation_basis": "terminal_only"}}
{"event_id": "evt_1774172675425837814", "ts": 1774172675, "event": "training_heartbeat", "round": 87, "session_id": "019d14ea-730e-75e1-9200-ca4cb6c1e330", "tier": "proxy", "run_name": "round0087_proxy_1774172645", "family_name": "whitened_lowrank_gated_residual", "family_stage": "prototype", "status": null, "decision": null, "payload": {"tier": "proxy", "run_name": "round0087_proxy_1774172645", "family_name": "whitened_lowrank_gated_residual", "family_stage": "prototype", "checkpoint_dir": "/root/sparsify-ascend/checkpoints/research_agent/round_0087_proxy/round0087_proxy_1774172645_dp2_bs1_ga8_ef12_k40_20260322_174411", "metrics_path": "/root/sparsify-ascend/checkpoints/research_agent/round_0087_proxy/round0087_proxy_1774172645_dp2_bs1_ga8_ef12_k40_20260322_174411/metrics.jsonl", "latest_step": 100, "latest_tokens_per_sec": 109221.64780006743, "baseline_ratio": null, "latest_total_tokens": 3276800.0, "proxy_mode": "fast", "evaluation_basis": "terminal_only"}}
{"event_id": "evt_1774172705428024366", "ts": 1774172705, "event": "training_heartbeat", "round": 87, "session_id": "019d14ea-730e-75e1-9200-ca4cb6c1e330", "tier": "proxy", "run_name": "round0087_proxy_1774172645", "family_name": "whitened_lowrank_gated_residual", "family_stage": "prototype", "status": null, "decision": null, "payload": {"tier": "proxy", "run_name": "round0087_proxy_1774172645", "family_name": "whitened_lowrank_gated_residual", "family_stage": "prototype", "checkpoint_dir": "/root/sparsify-ascend/checkpoints/research_agent/round_0087_proxy/round0087_proxy_1774172645_dp2_bs1_ga8_ef12_k40_20260322_174411", "metrics_path": "/root/sparsify-ascend/checkpoints/research_agent/round_0087_proxy/round0087_proxy_1774172645_dp2_bs1_ga8_ef12_k40_20260322_174411/metrics.jsonl", "latest_step": 290, "latest_tokens_per_sec": 158369.26991518986, "baseline_ratio": null, "latest_total_tokens": 9502720.0, "proxy_mode": "fast", "evaluation_basis": "terminal_only"}}
{"event_id": "evt_1774172735431833482", "ts": 1774172735, "event": "training_heartbeat", "round": 87, "session_id": "019d14ea-730e-75e1-9200-ca4cb6c1e330", "tier": "proxy", "run_name": "round0087_proxy_1774172645", "family_name": "whitened_lowrank_gated_residual", "family_stage": "prototype", "status": null, "decision": null, "payload": {"tier": "proxy", "run_name": "round0087_proxy_1774172645", "family_name": "whitened_lowrank_gated_residual", "family_stage": "prototype", "checkpoint_dir": "/root/sparsify-ascend/checkpoints/research_agent/round_0087_proxy/round0087_proxy_1774172645_dp2_bs1_ga8_ef12_k40_20260322_174411", "metrics_path": "/root/sparsify-ascend/checkpoints/research_agent/round_0087_proxy/round0087_proxy_1774172645_dp2_bs1_ga8_ef12_k40_20260322_174411/metrics.jsonl", "latest_step": 470, "latest_tokens_per_sec": 171107.95360530997, "baseline_ratio": null, "latest_total_tokens": 15400960.0, "proxy_mode": "fast", "evaluation_basis": "terminal_only"}}
{"event_id": "evt_1774172765436082538", "ts": 1774172765, "event": "training_heartbeat", "round": 87, "session_id": "019d14ea-730e-75e1-9200-ca4cb6c1e330", "tier": "proxy", "run_name": "round0087_proxy_1774172645", "family_name": "whitened_lowrank_gated_residual", "family_stage": "prototype", "status": null, "decision": null, "payload": {"tier": "proxy", "run_name": "round0087_proxy_1774172645", "family_name": "whitened_lowrank_gated_residual", "family_stage": "prototype", "checkpoint_dir": "/root/sparsify-ascend/checkpoints/research_agent/round_0087_proxy/round0087_proxy_1774172645_dp2_bs1_ga8_ef12_k40_20260322_174411", "metrics_path": "/root/sparsify-ascend/checkpoints/research_agent/round_0087_proxy/round0087_proxy_1774172645_dp2_bs1_ga8_ef12_k40_20260322_174411/metrics.jsonl", "latest_step": 660, "latest_tokens_per_sec": 180206.55494399252, "baseline_ratio": null, "latest_total_tokens": 21626880.0, "proxy_mode": "fast", "evaluation_basis": "terminal_only"}}
{"event_id": "evt_1774172795441440534", "ts": 1774172795, "event": "training_heartbeat", "round": 87, "session_id": "019d14ea-730e-75e1-9200-ca4cb6c1e330", "tier": "proxy", "run_name": "round0087_proxy_1774172645", "family_name": "whitened_lowrank_gated_residual", "family_stage": "prototype", "status": null, "decision": null, "payload": {"tier": "proxy", "run_name": "round0087_proxy_1774172645", "family_name": "whitened_lowrank_gated_residual", "family_stage": "prototype", "checkpoint_dir": "/root/sparsify-ascend/checkpoints/research_agent/round_0087_proxy/round0087_proxy_1774172645_dp2_bs1_ga8_ef12_k40_20260322_174411", "metrics_path": "/root/sparsify-ascend/checkpoints/research_agent/round_0087_proxy/round0087_proxy_1774172645_dp2_bs1_ga8_ef12_k40_20260322_174411/metrics.jsonl", "latest_step": 850, "latest_tokens_per_sec": 185664.3274286736, "baseline_ratio": null, "latest_total_tokens": 27852800.0, "proxy_mode": "fast", "evaluation_basis": "terminal_only"}}
{"event_id": "evt_1774172825447606348", "ts": 1774172825, "event": "training_heartbeat", "round": 87, "session_id": "019d14ea-730e-75e1-9200-ca4cb6c1e330", "tier": "proxy", "run_name": "round0087_proxy_1774172645", "family_name": "whitened_lowrank_gated_residual", "family_stage": "prototype", "status": null, "decision": null, "payload": {"tier": "proxy", "run_name": "round0087_proxy_1774172645", "family_name": "whitened_lowrank_gated_residual", "family_stage": "prototype", "checkpoint_dir": "/root/sparsify-ascend/checkpoints/research_agent/round_0087_proxy/round0087_proxy_1774172645_dp2_bs1_ga8_ef12_k40_20260322_174411", "metrics_path": "/root/sparsify-ascend/checkpoints/research_agent/round_0087_proxy/round0087_proxy_1774172645_dp2_bs1_ga8_ef12_k40_20260322_174411/metrics.jsonl", "latest_step": 1000, "latest_tokens_per_sec": 182021.04780867035, "baseline_ratio": null, "latest_total_tokens": 32768000.0, "proxy_mode": "fast", "evaluation_basis": "terminal_only"}}
{"event_id": "evt_1774172855544508723", "ts": 1774172855, "event": "training_heartbeat", "round": 87, "session_id": "019d14ea-730e-75e1-9200-ca4cb6c1e330", "tier": "proxy", "run_name": "round0087_proxy_1774172645", "family_name": "whitened_lowrank_gated_residual", "family_stage": "prototype", "status": null, "decision": null, "payload": {"tier": "proxy", "run_name": "round0087_proxy_1774172645", "family_name": "whitened_lowrank_gated_residual", "family_stage": "prototype", "checkpoint_dir": "/root/sparsify-ascend/checkpoints/research_agent/round_0087_proxy/round0087_proxy_1774172645_dp2_bs1_ga8_ef12_k40_20260322_174411", "metrics_path": "/root/sparsify-ascend/checkpoints/research_agent/round_0087_proxy/round0087_proxy_1774172645_dp2_bs1_ga8_ef12_k40_20260322_174411/metrics.jsonl", "latest_step": 1180, "latest_tokens_per_sec": 184098.30192699455, "baseline_ratio": null, "latest_total_tokens": 38666240.0, "proxy_mode": "fast", "evaluation_basis": "terminal_only"}}
{"event_id": "evt_1774172885551944804", "ts": 1774172885, "event": "training_heartbeat", "round": 87, "session_id": "019d14ea-730e-75e1-9200-ca4cb6c1e330", "tier": "proxy", "run_name": "round0087_proxy_1774172645", "family_name": "whitened_lowrank_gated_residual", "family_stage": "prototype", "status": null, "decision": null, "payload": {"tier": "proxy", "run_name": "round0087_proxy_1774172645", "family_name": "whitened_lowrank_gated_residual", "family_stage": "prototype", "checkpoint_dir": "/root/sparsify-ascend/checkpoints/research_agent/round_0087_proxy/round0087_proxy_1774172645_dp2_bs1_ga8_ef12_k40_20260322_174411", "metrics_path": "/root/sparsify-ascend/checkpoints/research_agent/round_0087_proxy/round0087_proxy_1774172645_dp2_bs1_ga8_ef12_k40_20260322_174411/metrics.jsonl", "latest_step": 1220, "latest_tokens_per_sec": 166482.24559178308, "baseline_ratio": null, "latest_total_tokens": 39976960.0, "proxy_mode": "fast", "evaluation_basis": "terminal_only"}}
{"event_id": "evt_1774172885631343660", "ts": 1774172885, "event": "training_finished", "round": 87, "session_id": "019d14ea-730e-75e1-9200-ca4cb6c1e330", "tier": "proxy", "run_name": "round0087_proxy_1774172645", "family_name": "whitened_lowrank_gated_residual", "family_stage": "prototype", "status": "ok", "decision": "incubate", "payload": {"tier": "proxy", "run_name": "round0087_proxy_1774172645", "family_name": "whitened_lowrank_gated_residual", "family_stage": "prototype", "checkpoint_dir": "/root/sparsify-ascend/checkpoints/research_agent/round_0087_proxy/round0087_proxy_1774172645_dp2_bs1_ga8_ef12_k40_20260322_174411", "metrics_path": "/root/sparsify-ascend/checkpoints/research_agent/round_0087_proxy/round0087_proxy_1774172645_dp2_bs1_ga8_ef12_k40_20260322_174411/metrics.jsonl", "run_health": "normal", "termination_reason": "completed", "tokens_per_sec": 166482.24559178308, "baseline_ratio": null, "status": "ok", "decision": "incubate", "proxy_mode": "fast", "evaluation_basis": "terminal_only", "curve_start_fvu": 0.5725676417350769, "curve_mid_fvu": 0.5776451826095581, "curve_end_fvu": 0.7995238304138184, "curve_late_slope": 2.0621696496134256e-08, "curve_still_improving": false}}
{"event_id": "evt_1774172885631397127", "ts": 1774172885, "event": "result_recorded", "round": 87, "session_id": "019d14ea-730e-75e1-9200-ca4cb6c1e330", "tier": "proxy", "run_name": "round0087_proxy_1774172645", "family_name": "whitened_lowrank_gated_residual", "family_stage": "prototype", "status": "ok", "decision": "incubate", "payload": {"tier": "proxy", "run_name": "round0087_proxy_1774172645", "family_name": "whitened_lowrank_gated_residual", "family_stage": "prototype", "status": "ok", "decision": "incubate", "val_fvu": "0.5214065499603748", "observed_fvu": "0.799524", "k": "40", "log_path": "/root/sparsify-ascend/research/history/logs/proxy_1774172885.log", "checkpoint": null}}
{"event_id": "evt_1774172885631780412", "ts": 1774172885, "event": "round_finished", "round": 87, "session_id": "019d14ea-730e-75e1-9200-ca4cb6c1e330", "tier": "proxy", "run_name": null, "family_name": "whitened_lowrank_gated_residual", "family_stage": "prototype", "status": "ok", "decision": "incubate", "payload": {"tier": "proxy", "family_name": "whitened_lowrank_gated_residual", "family_stage": "prototype", "status": "ok", "decision": "incubate", "val_fvu": "0.5214065499603748"}}
{"event_id": "evt_1774172885640176700", "ts": 1774172885, "event": "experiment_commit_prepared", "round": 87, "tier": "proxy", "run_name": null, "family_name": "whitened_lowrank_gated_residual", "family_stage": "prototype", "status": "ok", "decision": "incubate", "payload": {"branch": "autoresearch-sae"}}
{"event_id": "evt_1774172893820654184", "ts": 1774172893, "event": "round_started", "round": 88, "session_id": "019d14ea-730e-75e1-9200-ca4cb6c1e330", "tier": null, "run_name": null, "family_name": null, "family_stage": null, "status": "started", "decision": null, "payload": {"status": "started"}}
{"event_id": "evt_1774172893820822341", "ts": 1774172893, "event": "agent_deciding", "round": 88, "session_id": "019d14ea-730e-75e1-9200-ca4cb6c1e330", "tier": null, "run_name": null, "family_name": null, "family_stage": null, "status": null, "decision": null, "payload": {}}
{"event_id": "evt_1774173031221565713", "ts": 1774173031, "event": "session_resumed", "round": 88, "tier": null, "run_name": null, "family_name": null, "family_stage": null, "status": "active", "decision": null, "payload": {"session_id": "019d14ea-730e-75e1-9200-ca4cb6c1e330"}}
{"event_id": "evt_1774173031222780594", "ts": 1774173031, "event": "agent_action_received", "round": 88, "session_id": "019d14ea-730e-75e1-9200-ca4cb6c1e330", "tier": "proxy", "run_name": null, "family_name": "residual_vq", "family_stage": "prototype", "status": null, "decision": null, "payload": {"session_id": "019d14ea-730e-75e1-9200-ca4cb6c1e330", "tier": "proxy", "family_name": "residual_vq", "family_stage": "prototype", "change_type": "edit_sae_code", "expected_win": "lower_fvu", "hypothesis": "The whitening-style residual preconditioning direction is weak at the active `(K=40, EF=12)` point, so the next informative move is a genuinely different low-K mechanism: add a minimal `residual_vq` prototype that uses a hard coarse codebook assignment plus a sparse residual correction. If low-K quality is limited by continuous support selection rather than pure capacity, this discrete-first representation should be a better fit at `K=32, EF=12` than the current low-rank gated residual family."}}
{"event_id": "evt_1774173162102351157", "ts": 1774173162, "event": "variable_isolation_warning", "round": 88, "session_id": "019d14ea-730e-75e1-9200-ca4cb6c1e330", "tier": null, "run_name": null, "family_name": "residual_vq", "family_stage": "prototype", "status": null, "decision": null, "payload": {"violation": "Multiple primary variables changed simultaneously: code_edit, architecture, k, lr"}}
{"event_id": "evt_1774173162102601489", "ts": 1774173162, "event": "proxy_mode_selected", "round": 88, "session_id": "019d14ea-730e-75e1-9200-ca4cb6c1e330", "tier": "proxy", "run_name": null, "family_name": "residual_vq", "family_stage": "prototype", "status": null, "decision": null, "payload": {"tier": "proxy", "proxy_mode": "fast", "evaluation_basis": "terminal_only", "parameter_behavior": "structural", "proxy_max_tokens": "40000000"}}
{"event_id": "evt_1774173162102663791", "ts": 1774173162, "event": "sanity_started", "round": 88, "session_id": "019d14ea-730e-75e1-9200-ca4cb6c1e330", "tier": "proxy", "run_name": null, "family_name": "residual_vq", "family_stage": "prototype", "status": null, "decision": null, "payload": {"tier": "proxy"}}
{"event_id": "evt_1774173166825887979", "ts": 1774173166, "event": "sanity_finished", "round": 88, "session_id": "019d14ea-730e-75e1-9200-ca4cb6c1e330", "tier": "proxy", "run_name": null, "family_name": "residual_vq", "family_stage": "prototype", "status": "ok", "decision": null, "payload": {"tier": "proxy", "status": "ok"}}
{"event_id": "evt_1774173166826302006", "ts": 1774173166, "event": "training_started", "round": 88, "session_id": "019d14ea-730e-75e1-9200-ca4cb6c1e330", "tier": "proxy", "run_name": "round0088_proxy_1774173166", "family_name": "residual_vq", "family_stage": "prototype", "status": null, "decision": null, "payload": {"tier": "proxy", "run_name": "round0088_proxy_1774173166", "family_name": "residual_vq", "family_stage": "prototype", "checkpoint_dir": "/root/sparsify-ascend/checkpoints/research_agent/round_0088_proxy", "log_path": "/root/sparsify-ascend/research/history/logs/round0088_proxy_1774173166.log", "config": {"architecture": "residual_vq", "expansion_factor": 12, "k": 32, "optimizer": "signum", "lr": "1.6e-3", "hookpoints": "layers.[3].self_attn.o_proj", "batch_size": 1, "grad_acc_steps": 8, "micro_acc_steps": 1, "auxk_alpha": 0.0, "dead_feature_threshold": 10000000, "use_hadamard": false, "tier": "proxy", "family_name": "residual_vq", "family_stage": "prototype"}, "baseline_tokens_per_sec": null, "proxy_mode": "fast", "evaluation_basis": "terminal_only"}}
{"event_id": "evt_1774173196827097906", "ts": 1774173196, "event": "training_heartbeat", "round": 88, "session_id": "019d14ea-730e-75e1-9200-ca4cb6c1e330", "tier": "proxy", "run_name": "round0088_proxy_1774173166", "family_name": "residual_vq", "family_stage": "prototype", "status": null, "decision": null, "payload": {"tier": "proxy", "run_name": "round0088_proxy_1774173166", "family_name": "residual_vq", "family_stage": "prototype", "checkpoint_dir": null, "metrics_path": null, "latest_step": null, "latest_tokens_per_sec": null, "baseline_ratio": null, "latest_total_tokens": null, "proxy_mode": "fast", "evaluation_basis": "terminal_only"}}
{"event_id": "evt_1774173196894313483", "ts": 1774173196, "event": "training_finished", "round": 88, "session_id": "019d14ea-730e-75e1-9200-ca4cb6c1e330", "tier": "proxy", "run_name": "round0088_proxy_1774173166", "family_name": "residual_vq", "family_stage": "prototype", "status": "crash", "decision": "crash", "payload": {"tier": "proxy", "run_name": "round0088_proxy_1774173166", "family_name": "residual_vq", "family_stage": "prototype", "checkpoint_dir": null, "metrics_path": "", "run_health": "crash", "termination_reason": "completed", "tokens_per_sec": null, "baseline_ratio": null, "status": "crash", "decision": "crash", "proxy_mode": "fast", "evaluation_basis": "terminal_only", "curve_start_fvu": null, "curve_mid_fvu": null, "curve_end_fvu": null, "curve_late_slope": null, "curve_still_improving": null}}
{"event_id": "evt_1774173196894367429", "ts": 1774173196, "event": "result_recorded", "round": 88, "session_id": "019d14ea-730e-75e1-9200-ca4cb6c1e330", "tier": "proxy", "run_name": "round0088_proxy_1774173166", "family_name": "residual_vq", "family_stage": "prototype", "status": "crash", "decision": "crash", "payload": {"tier": "proxy", "run_name": "round0088_proxy_1774173166", "family_name": "residual_vq", "family_stage": "prototype", "status": "crash", "decision": "crash", "val_fvu": "None", "observed_fvu": "", "k": "None", "log_path": "/root/sparsify-ascend/research/history/logs/proxy_1774173196.log", "checkpoint": null}}
{"event_id": "evt_1774173196894438228", "ts": 1774173196, "event": "repair_attempt_started", "round": 88, "session_id": "019d14ea-730e-75e1-9200-ca4cb6c1e330", "tier": "proxy", "run_name": null, "family_name": "residual_vq", "family_stage": "prototype", "status": null, "decision": null, "payload": {"tier": "proxy", "family_name": "residual_vq", "family_stage": "prototype", "repair_attempt": 1, "failure_kind": "training_crash", "error_type": "ValueError", "error_summary": "ValueError: Unknown architecture: 'residual_vq'. Must be one of ('topk', 'batch_topk', 'adaptive_budget_topk', 'bucketed_topk', 'codebook_topk', 'jumprelu', 'gated', 'routed', 'group_topk', 'factorized_topk', 'lowrank_residual', 'lowrank_gated_residual', 'whitened_lowrank_gated_residual', 'lowrank_grouped_residual', 'whitened_topk', 'two_stage_residual', 'multi_branch_gated')"}}
{"event_id": "evt_1774173407295405792", "ts": 1774173407, "event": "variable_isolation_warning", "round": 88, "session_id": "019d14ea-730e-75e1-9200-ca4cb6c1e330", "tier": null, "run_name": null, "family_name": "residual_vq", "family_stage": "prototype", "status": null, "decision": null, "payload": {"violation": "Multiple primary variables changed simultaneously: code_edit, architecture, k, lr"}}
{"event_id": "evt_1774173411912539093", "ts": 1774173411, "event": "behavioral_diff_identical_warning", "round": 88, "session_id": "019d14ea-730e-75e1-9200-ca4cb6c1e330", "tier": null, "run_name": null, "family_name": "residual_vq", "family_stage": "prototype", "status": null, "decision": null, "payload": {"architecture": "residual_vq", "k": 32, "expansion_factor": 12, "max_diff": 0.0}}
