{"event": "compaction_snapshot_created", "ts": 1774116722, "retained_rounds": [1, 3, 7, 13, 23, 26, 29, 31, 32, 38, 41, 43, 48, 52, 54, 57, 59, 60, 64, 65, 66, 67], "dropped_round_count": 45, "strategy_summary": "Keep only rounds that introduce a family/code path, establish the winning gated lineage/frontier, capture distinct blocker classes, or preserve the latest continuity. Drop repeated sweeps, duplicate failures, and logs whose fact\n[truncated for compact history]"}
{"event": "dropped_round_digest", "ts": 1774116722, "round": 28, "family_name": "gated", "summary": "Gated non-LR tweak hurt quality materially; do not revisit without a stronger mechanism-level reason.", "reason": "Inferior gated auxiliary/other-param sweep."}
{"event": "dropped_round_digest", "ts": 1774116722, "round": 30, "family_name": "routed", "summary": "A routed code-fix attempt still failed to separate from baseline; the important lesson is that extra patching did not materially change routed behavior before evaluation.", "reason": "Secondary routed patch is not needed once round 26 lineage and round 31 quality evidence are kept."}
{"event": "dropped_round_digest", "ts": 1774116722, "round": 33, "family_name": "group_topk", "summary": "Second `group_topk` attempt confirmed the issue was still override plumbing, not stochastic noise.", "reason": "Repeat of the group-topk invalid-override failure."}
{"event": "dropped_round_digest", "ts": 1774116722, "round": 34, "family_name": "gated", "summary": "A gated non-LR tweak slightly improved k=128 full FVU to ~0.15981, but later exact frontier state and retained recent rounds are sufficient for restart.", "reason": "Historical best gated full result is superseded operationally by later exact frontier rounds 59/60/64 and the breakthrough round 23."}
{"event": "dropped_round_digest", "ts": 1774116722, "round": 35, "family_name": "gated", "summary": "Gated k=64 full run landed near ~0.20616 FVU; keep the later exact frontier refresh instead.", "reason": "Older gated k=64 frontier point superseded by exact recent repeat in round 60."}
{"event": "dropped_round_digest", "ts": 1774116722, "round": 36, "family_name": "gated", "summary": "Gated k=32 full run landed near ~0.25877 FVU; keep the later exact frontier refresh instead.", "reason": "Older gated k=32 frontier point superseded by exact recent repeat in round 64."}
{"event": "dropped_round_digest", "ts": 1774116722, "round": 37, "family_name": "gated", "summary": "A gated k=32 expansion change was much worse, so the retained frontier point is not robust to arbitrary expansion-factor changes.", "reason": "Failed gated expansion-factor sweep with no unique blocker."}
{"event": "dropped_round_digest", "ts": 1774116722, "round": 39, "family_name": "group_topk", "summary": "A performance-code intervention still failed sanity for `group_topk`; round 41 preserves the final blocker state with patch lineage.", "reason": "Intermediate group-topk perf-fix failure is superseded by round 41."}
{"event": "dropped_round_digest", "ts": 1774116722, "round": 40, "family_name": "gated", "summary": "One gated non-best variant timed out on first step; treat this as local instability in a bad setting, not a blocker for the promoted gated path.", "reason": "Single gated timeout does not alter the winning setup and is adequately summarized."}
{"event": "dropped_round_digest", "ts": 1774116722, "round": 42, "family_name": "topk", "summary": "Repeated the same topk quality conclusion as round 29 with no new lesson.", "reason": "Duplicate topk evidence."}
{"event": "dropped_round_digest", "ts": 1774116722, "round": 44, "family_name": "gated", "summary": "Another gated learning-rate setting underperformed badly; no reason to revisit this LR region.", "reason": "Bad gated LR sweep not needed after retained breakthrough and frontier continuity."}
{"event": "dropped_round_digest", "ts": 1774116722, "round": 45, "family_name": "gated", "summary": "A gated expansion-factor variant degraded quality sharply, reinforcing that the round 23 regime is the one to preserve.", "reason": "Bad gated expansion-factor sweep."}
{"event": "dropped_round_digest", "ts": 1774116722, "round": 46, "family_name": "factorized_topk", "summary": "A performance-oriented factorized-topk edit still failed sanity; later rounds show the stronger issue was architecture registration/dispatch.", "reason": "Intermediate factorized-topk sanity failure is superseded by later clearer blocker evidence."}
{"event": "dropped_round_digest", "ts": 1774116722, "round": 49, "family_name": "factorized_topk", "summary": "Second explicit unknown-architecture failure confirmed the blocker was persistent registration/dispatch, not a one-off launch issue.", "reason": "Repeat of the factorized-topk unknown-architecture failure."}
{"event": "dropped_round_digest", "ts": 1774116722, "round": 50, "family_name": "gated", "summary": "Repeated the gated k=64 frontier result without adding a new lesson; retain the later exact recent round instead.", "reason": "Older gated k=64 repeat superseded by round 60."}
{"event": "dropped_round_digest", "ts": 1774116722, "round": 51, "family_name": "gated", "summary": "Repeated the gated k=32 frontier result without adding a new lesson; retain the later exact recent round instead.", "reason": "Older gated k=32 repeat superseded by round 64."}
{"event": "dropped_round_digest", "ts": 1774116722, "round": 53, "family_name": "factorized_topk", "summary": "First successful factorized-topk metric at ~0.3276 FVU showed the family is much weaker than gated; round 54 is the better retained reference.", "reason": "Inferior factorized-topk baseline run superseded by round 54."}
{"event": "dropped_round_digest", "ts": 1774116722, "round": 55, "family_name": "factorized_topk", "summary": "A factorized-topk LR change worsened quality, so LR tuning did not close the gap.", "reason": "Inferior factorized-topk LR sweep."}
{"event": "dropped_round_digest", "ts": 1774116722, "round": 56, "family_name": "factorized_topk", "summary": "Another factorized-topk stabilize run matched round 54 quality closely without changing the conclusion.", "reason": "Near-duplicate factorized-topk stabilize run."}
{"event": "dropped_round_digest", "ts": 1774116722, "round": 58, "family_name": "residual_topk", "summary": "Second residual-topk code-fix attempt produced the same registration error; no new diagnostic beyond persistence of the blocker.", "reason": "Repeat residual-topk unknown-architecture failure."}
{"event": "dropped_round_digest", "ts": 1774116722, "round": 61, "family_name": "residual_topk", "summary": "Another residual-topk attempt hit the same unknown-architecture blocker; repeated evidence only.", "reason": "Further residual-topk duplicate failure."}
{"event": "dropped_round_digest", "ts": 1774116722, "round": 62, "family_name": "residual_topk", "summary": "Final residual-topk attempt still failed with unknown architecture, confirming the family is blocked until registration and dispatch are fixed end-to-end.", "reason": "Last residual-topk duplicate failure is still redundant once the blocker is summarized from round 57."}
{"event": "dropped_round_digest", "ts": 1774116722, "round": 63, "family_name": "gated", "summary": "A recent gated auxiliary/non-best variant regressed to ~0.2629 FVU, so recent continuity should follow the retained frontier settings instead.", "reason": "Poor gated non-best variant immediately preceding final frontier refresh."}
{"event_id": "evt_1774118403324806238", "ts": 1774118403, "event": "loop_started", "round": null, "tier": null, "run_name": null, "family_name": null, "family_stage": null, "status": null, "decision": null, "payload": {"rounds": 200, "budget_hours": 10.0}}
{"event_id": "evt_1774118403330190566", "ts": 1774118403, "event": "research_branch_ready", "round": null, "tier": null, "run_name": null, "family_name": null, "family_stage": null, "status": "ready", "decision": null, "payload": {"branch": "autoresearch-sae", "base_branch": "autoresearch-sae", "base_commit": "04a0603ba261d372b5dc5e8d3c9746c5cebe46f2"}}
{"event_id": "evt_1774118403330756825", "ts": 1774118403, "event": "round_started", "round": 1, "session_id": null, "tier": null, "run_name": null, "family_name": null, "family_stage": null, "status": "started", "decision": null, "payload": {"status": "started"}}
{"event_id": "evt_1774118403330858035", "ts": 1774118403, "event": "agent_deciding", "round": 1, "session_id": null, "tier": null, "run_name": null, "family_name": null, "family_stage": null, "status": null, "decision": null, "payload": {}}
{"event_id": "evt_1774118556047939063", "ts": 1774118556, "event": "session_started", "round": 1, "tier": null, "run_name": null, "family_name": null, "family_stage": null, "status": "active", "decision": null, "payload": {"session_id": "019d11b4-1059-72d0-bd97-56886d766be4"}}
{"event_id": "evt_1774118556048512917", "ts": 1774118556, "event": "agent_action_received", "round": 1, "session_id": "019d11b4-1059-72d0-bd97-56886d766be4", "tier": "proxy", "run_name": null, "family_name": "gated", "family_stage": "stabilize", "status": null, "decision": null, "payload": {"session_id": "019d11b4-1059-72d0-bd97-56886d766be4", "tier": "proxy", "family_name": "gated", "family_stage": "stabilize", "change_type": "param_only", "expected_win": "lower_fvu", "hypothesis": "The gated family is in exploitation mode and the lower-LR branch already showed regression, so the most informative remaining one-variable probe is the opposite direction: raise signum LR from 1.6e-3 to 3.2e-3 on the stable K=128, EF=16, aux-free anchor. A higher LR may escape the current optimization plateau and improve proxy FVU without changing architecture or cost structure."}}
{"event_id": "evt_1774118556048657466", "ts": 1774118556, "event": "proxy_mode_selected", "round": 1, "session_id": "019d11b4-1059-72d0-bd97-56886d766be4", "tier": "proxy", "run_name": null, "family_name": "gated", "family_stage": "stabilize", "status": null, "decision": null, "payload": {"tier": "proxy", "proxy_mode": "extended", "evaluation_basis": "curve_extended", "parameter_behavior": "dynamic", "proxy_max_tokens": "20000000"}}
{"event_id": "evt_1774118556048936758", "ts": 1774118556, "event": "training_started", "round": 1, "session_id": "019d11b4-1059-72d0-bd97-56886d766be4", "tier": "proxy", "run_name": "round0001_proxy_1774118556", "family_name": "gated", "family_stage": "stabilize", "status": null, "decision": null, "payload": {"tier": "proxy", "run_name": "round0001_proxy_1774118556", "family_name": "gated", "family_stage": "stabilize", "checkpoint_dir": "/root/sparsify-ascend/checkpoints/research_agent/round_0001_proxy", "log_path": "/root/sparsify-ascend/research/history/logs/round0001_proxy_1774118556.log", "config": {"architecture": "gated", "expansion_factor": 16, "k": 128, "optimizer": "signum", "lr": "3.2e-3", "hookpoints": "layers.[3].self_attn.o_proj", "batch_size": 1, "grad_acc_steps": 8, "micro_acc_steps": 1, "auxk_alpha": 0.0, "dead_feature_threshold": 10000000, "use_hadamard": false, "tier": "proxy", "family_name": "gated", "family_stage": "stabilize"}, "baseline_tokens_per_sec": 133244.6319831621, "proxy_mode": "extended", "evaluation_basis": "curve_extended"}}
{"event_id": "evt_1774118586050468470", "ts": 1774118586, "event": "training_heartbeat", "round": 1, "session_id": "019d11b4-1059-72d0-bd97-56886d766be4", "tier": "proxy", "run_name": "round0001_proxy_1774118556", "family_name": "gated", "family_stage": "stabilize", "status": null, "decision": null, "payload": {"tier": "proxy", "run_name": "round0001_proxy_1774118556", "family_name": "gated", "family_stage": "stabilize", "checkpoint_dir": "/root/sparsify-ascend/checkpoints/research_agent/round_0001_proxy/round0001_proxy_1774118556_dp2_bs1_ga8_ef16_k128_20260322_024242", "metrics_path": "/root/sparsify-ascend/checkpoints/research_agent/round_0001_proxy/round0001_proxy_1774118556_dp2_bs1_ga8_ef16_k128_20260322_024242/metrics.jsonl", "latest_step": 80, "latest_tokens_per_sec": 87377.68904088269, "baseline_ratio": 0.6557689247242955, "latest_total_tokens": 2621440.0, "proxy_mode": "extended", "evaluation_basis": "curve_extended"}}
{"event_id": "evt_1774118616052399234", "ts": 1774118616, "event": "training_heartbeat", "round": 1, "session_id": "019d11b4-1059-72d0-bd97-56886d766be4", "tier": "proxy", "run_name": "round0001_proxy_1774118556", "family_name": "gated", "family_stage": "stabilize", "status": null, "decision": null, "payload": {"tier": "proxy", "run_name": "round0001_proxy_1774118556", "family_name": "gated", "family_stage": "stabilize", "checkpoint_dir": "/root/sparsify-ascend/checkpoints/research_agent/round_0001_proxy/round0001_proxy_1774118556_dp2_bs1_ga8_ef16_k128_20260322_024242", "metrics_path": "/root/sparsify-ascend/checkpoints/research_agent/round_0001_proxy/round0001_proxy_1774118556_dp2_bs1_ga8_ef16_k128_20260322_024242/metrics.jsonl", "latest_step": 240, "latest_tokens_per_sec": 131065.0826567497, "baseline_ratio": 0.9836424980580993, "latest_total_tokens": 7864320.0, "proxy_mode": "extended", "evaluation_basis": "curve_extended"}}
{"event_id": "evt_1774118646055236565", "ts": 1774118646, "event": "training_heartbeat", "round": 1, "session_id": "019d11b4-1059-72d0-bd97-56886d766be4", "tier": "proxy", "run_name": "round0001_proxy_1774118556", "family_name": "gated", "family_stage": "stabilize", "status": null, "decision": null, "payload": {"tier": "proxy", "run_name": "round0001_proxy_1774118556", "family_name": "gated", "family_stage": "stabilize", "checkpoint_dir": "/root/sparsify-ascend/checkpoints/research_agent/round_0001_proxy/round0001_proxy_1774118556_dp2_bs1_ga8_ef16_k128_20260322_024242", "metrics_path": "/root/sparsify-ascend/checkpoints/research_agent/round_0001_proxy/round0001_proxy_1774118556_dp2_bs1_ga8_ef16_k128_20260322_024242/metrics.jsonl", "latest_step": 400, "latest_tokens_per_sec": 145625.85828463317, "baseline_ratio": 1.0929210139064789, "latest_total_tokens": 13107200.0, "proxy_mode": "extended", "evaluation_basis": "curve_extended"}}
{"event_id": "evt_1774118676058970110", "ts": 1774118676, "event": "training_heartbeat", "round": 1, "session_id": "019d11b4-1059-72d0-bd97-56886d766be4", "tier": "proxy", "run_name": "round0001_proxy_1774118556", "family_name": "gated", "family_stage": "stabilize", "status": null, "decision": null, "payload": {"tier": "proxy", "run_name": "round0001_proxy_1774118556", "family_name": "gated", "family_stage": "stabilize", "checkpoint_dir": "/root/sparsify-ascend/checkpoints/research_agent/round_0001_proxy/round0001_proxy_1774118556_dp2_bs1_ga8_ef16_k128_20260322_024242", "metrics_path": "/root/sparsify-ascend/checkpoints/research_agent/round_0001_proxy/round0001_proxy_1774118556_dp2_bs1_ga8_ef16_k128_20260322_024242/metrics.jsonl", "latest_step": 560, "latest_tokens_per_sec": 152904.93850475352, "baseline_ratio": 1.1475504583484897, "latest_total_tokens": 18350080.0, "proxy_mode": "extended", "evaluation_basis": "curve_extended"}}
{"event_id": "evt_1774118706133117140", "ts": 1774118706, "event": "training_heartbeat", "round": 1, "session_id": "019d11b4-1059-72d0-bd97-56886d766be4", "tier": "proxy", "run_name": "round0001_proxy_1774118556", "family_name": "gated", "family_stage": "stabilize", "status": null, "decision": null, "payload": {"tier": "proxy", "run_name": "round0001_proxy_1774118556", "family_name": "gated", "family_stage": "stabilize", "checkpoint_dir": "/root/sparsify-ascend/checkpoints/research_agent/round_0001_proxy/round0001_proxy_1774118556_dp2_bs1_ga8_ef16_k128_20260322_024242", "metrics_path": "/root/sparsify-ascend/checkpoints/research_agent/round_0001_proxy/round0001_proxy_1774118556_dp2_bs1_ga8_ef16_k128_20260322_024242/metrics.jsonl", "latest_step": 610, "latest_tokens_per_sec": 133242.77904134616, "baseline_ratio": 0.9999860936850635, "latest_total_tokens": 19988480.0, "proxy_mode": "extended", "evaluation_basis": "curve_extended"}}
{"event_id": "evt_1774118707172370639", "ts": 1774118707, "event": "training_finished", "round": 1, "session_id": "019d11b4-1059-72d0-bd97-56886d766be4", "tier": "proxy", "run_name": "round0001_proxy_1774118556", "family_name": "gated", "family_stage": "stabilize", "status": "ok", "decision": "discard", "payload": {"tier": "proxy", "run_name": "round0001_proxy_1774118556", "family_name": "gated", "family_stage": "stabilize", "checkpoint_dir": "/root/sparsify-ascend/checkpoints/research_agent/round_0001_proxy/round0001_proxy_1774118556_dp2_bs1_ga8_ef16_k128_20260322_024242", "metrics_path": "/root/sparsify-ascend/checkpoints/research_agent/round_0001_proxy/round0001_proxy_1774118556_dp2_bs1_ga8_ef16_k128_20260322_024242/metrics.jsonl", "run_health": "normal", "termination_reason": "completed", "tokens_per_sec": 133242.77904134616, "baseline_ratio": 0.9999860936850635, "status": "ok", "decision": "discard", "proxy_mode": "extended", "evaluation_basis": "curve_extended", "curve_start_fvu": 0.24585744738578796, "curve_mid_fvu": 0.20410890877246857, "curve_end_fvu": 0.18568097054958344, "curve_late_slope": 7.308199946848737e-10, "curve_still_improving": false}}
{"event_id": "evt_1774118707172516480", "ts": 1774118707, "event": "result_recorded", "round": 1, "session_id": "019d11b4-1059-72d0-bd97-56886d766be4", "tier": "proxy", "run_name": "round0001_proxy_1774118556", "family_name": "gated", "family_stage": "stabilize", "status": "ok", "decision": "discard", "payload": {"tier": "proxy", "run_name": "round0001_proxy_1774118556", "family_name": "gated", "family_stage": "stabilize", "status": "ok", "decision": "discard", "val_fvu": "0.17676222696900368", "observed_fvu": "0.185681", "k": "128", "log_path": "/root/sparsify-ascend/research/history/logs/proxy_1774118706.log", "checkpoint": null}}
{"event_id": "evt_1774118707172802361", "ts": 1774118707, "event": "round_finished", "round": 1, "session_id": "019d11b4-1059-72d0-bd97-56886d766be4", "tier": "proxy", "run_name": null, "family_name": "gated", "family_stage": "stabilize", "status": "ok", "decision": "discard", "payload": {"tier": "proxy", "family_name": "gated", "family_stage": "stabilize", "status": "ok", "decision": "discard", "val_fvu": "0.17676222696900368"}}
{"event_id": "evt_1774118707414520025", "ts": 1774118707, "event": "experiment_commit_prepared", "round": 1, "tier": "proxy", "run_name": null, "family_name": "gated", "family_stage": "stabilize", "status": "ok", "decision": "discard", "payload": {"branch": "autoresearch-sae"}}
{"event_id": "evt_1774118716038646659", "ts": 1774118716, "event": "round_started", "round": 2, "session_id": "019d11b4-1059-72d0-bd97-56886d766be4", "tier": null, "run_name": null, "family_name": null, "family_stage": null, "status": "started", "decision": null, "payload": {"status": "started"}}
{"event_id": "evt_1774118716038905929", "ts": 1774118716, "event": "agent_deciding", "round": 2, "session_id": "019d11b4-1059-72d0-bd97-56886d766be4", "tier": null, "run_name": null, "family_name": null, "family_stage": null, "status": null, "decision": null, "payload": {}}
{"event_id": "evt_1774118843277732554", "ts": 1774118843, "event": "session_resumed", "round": 2, "tier": null, "run_name": null, "family_name": null, "family_stage": null, "status": "active", "decision": null, "payload": {"session_id": "019d11b4-1059-72d0-bd97-56886d766be4"}}
{"event_id": "evt_1774118843278463886", "ts": 1774118843, "event": "agent_action_received", "round": 2, "session_id": "019d11b4-1059-72d0-bd97-56886d766be4", "tier": "proxy", "run_name": null, "family_name": "gated", "family_stage": "stabilize", "status": null, "decision": null, "payload": {"session_id": "019d11b4-1059-72d0-bd97-56886d766be4", "tier": "proxy", "family_name": "gated", "family_stage": "stabilize", "change_type": "param_only", "expected_win": "lower_fvu", "hypothesis": "The higher-LR gated probe regressed, so the next clean exploitation move is to keep the stable K=128 gated signum EF=16 anchor fixed and reintroduce a small auxiliary balancing term at AUXK_ALPHA=0.01. A modest auxk penalty may improve feature usage and reconstruction quality without the optimization instability seen from the aggressive LR increase."}}
{"event_id": "evt_1774118843278653206", "ts": 1774118843, "event": "proxy_mode_selected", "round": 2, "session_id": "019d11b4-1059-72d0-bd97-56886d766be4", "tier": "proxy", "run_name": null, "family_name": "gated", "family_stage": "stabilize", "status": null, "decision": null, "payload": {"tier": "proxy", "proxy_mode": "extended", "evaluation_basis": "curve_extended", "parameter_behavior": "dynamic", "proxy_max_tokens": "20000000"}}
{"event_id": "evt_1774118843278917807", "ts": 1774118843, "event": "training_started", "round": 2, "session_id": "019d11b4-1059-72d0-bd97-56886d766be4", "tier": "proxy", "run_name": "round0002_proxy_1774118843", "family_name": "gated", "family_stage": "stabilize", "status": null, "decision": null, "payload": {"tier": "proxy", "run_name": "round0002_proxy_1774118843", "family_name": "gated", "family_stage": "stabilize", "checkpoint_dir": "/root/sparsify-ascend/checkpoints/research_agent/round_0002_proxy", "log_path": "/root/sparsify-ascend/research/history/logs/round0002_proxy_1774118843.log", "config": {"architecture": "gated", "expansion_factor": 16, "k": 128, "optimizer": "signum", "lr": "1.6e-3", "hookpoints": "layers.[3].self_attn.o_proj", "batch_size": 1, "grad_acc_steps": 8, "micro_acc_steps": 1, "auxk_alpha": 0.01, "dead_feature_threshold": 10000000, "use_hadamard": false, "tier": "proxy", "family_name": "gated", "family_stage": "stabilize"}, "baseline_tokens_per_sec": 133244.6319831621, "proxy_mode": "extended", "evaluation_basis": "curve_extended"}}
