{"event_id": "evt_1774141310030554404", "ts": 1774141310, "event": "variable_isolation_warning", "round": 22, "session_id": "019d130c-782e-75a2-aa6f-506b18d29edf", "tier": null, "run_name": null, "family_name": "lowrank_gated_residual", "family_stage": "prototype", "status": null, "decision": null, "payload": {"violation": "Multiple primary variables changed simultaneously: code_edit, architecture, lr"}}
{"event_id": "evt_1774141314591760979", "ts": 1774141314, "event": "behavioral_diff_identical_warning", "round": 22, "session_id": "019d130c-782e-75a2-aa6f-506b18d29edf", "tier": null, "run_name": null, "family_name": "lowrank_gated_residual", "family_stage": "prototype", "status": null, "decision": null, "payload": {"architecture": "lowrank_gated_residual", "k": 128, "expansion_factor": 32, "max_diff": 0.0}}
{"event_id": "evt_1774141314591845100", "ts": 1774141314, "event": "proxy_mode_selected", "round": 22, "session_id": "019d130c-782e-75a2-aa6f-506b18d29edf", "tier": "proxy", "run_name": null, "family_name": "lowrank_gated_residual", "family_stage": "prototype", "status": null, "decision": null, "payload": {"tier": "proxy", "proxy_mode": "fast", "evaluation_basis": "terminal_only", "parameter_behavior": "structural", "proxy_max_tokens": "40000000"}}
{"event_id": "evt_1774141314591892320", "ts": 1774141314, "event": "sanity_started", "round": 22, "session_id": "019d130c-782e-75a2-aa6f-506b18d29edf", "tier": "proxy", "run_name": null, "family_name": "lowrank_gated_residual", "family_stage": "prototype", "status": null, "decision": null, "payload": {"tier": "proxy"}}
{"event_id": "evt_1774141319277428039", "ts": 1774141319, "event": "sanity_finished", "round": 22, "session_id": "019d130c-782e-75a2-aa6f-506b18d29edf", "tier": "proxy", "run_name": null, "family_name": "lowrank_gated_residual", "family_stage": "prototype", "status": "ok", "decision": null, "payload": {"tier": "proxy", "status": "ok"}}
{"event_id": "evt_1774141319277857622", "ts": 1774141319, "event": "training_started", "round": 22, "session_id": "019d130c-782e-75a2-aa6f-506b18d29edf", "tier": "proxy", "run_name": "round0022_proxy_1774141319", "family_name": "lowrank_gated_residual", "family_stage": "prototype", "status": null, "decision": null, "payload": {"tier": "proxy", "run_name": "round0022_proxy_1774141319", "family_name": "lowrank_gated_residual", "family_stage": "prototype", "checkpoint_dir": "/root/sparsify-ascend/checkpoints/research_agent/round_0022_proxy", "log_path": "/root/sparsify-ascend/research/history/logs/round0022_proxy_1774141319.log", "config": {"architecture": "lowrank_gated_residual", "expansion_factor": 32, "k": 128, "optimizer": "signum", "lr": "1.6e-3", "hookpoints": "layers.[3].self_attn.o_proj", "batch_size": 1, "grad_acc_steps": 8, "micro_acc_steps": 1, "auxk_alpha": 0.0, "dead_feature_threshold": 10000000, "use_hadamard": false, "tier": "proxy", "family_name": "lowrank_gated_residual", "family_stage": "prototype"}, "baseline_tokens_per_sec": null, "proxy_mode": "fast", "evaluation_basis": "terminal_only"}}
{"event_id": "evt_1774141349279088965", "ts": 1774141349, "event": "training_heartbeat", "round": 22, "session_id": "019d130c-782e-75a2-aa6f-506b18d29edf", "tier": "proxy", "run_name": "round0022_proxy_1774141319", "family_name": "lowrank_gated_residual", "family_stage": "prototype", "status": null, "decision": null, "payload": {"tier": "proxy", "run_name": "round0022_proxy_1774141319", "family_name": "lowrank_gated_residual", "family_stage": "prototype", "checkpoint_dir": "/root/sparsify-ascend/checkpoints/research_agent/round_0022_proxy/round0022_proxy_1774141319_dp2_bs1_ga8_ef32_k128_20260322_090205", "metrics_path": "/root/sparsify-ascend/checkpoints/research_agent/round_0022_proxy/round0022_proxy_1774141319_dp2_bs1_ga8_ef32_k128_20260322_090205/metrics.jsonl", "latest_step": 30, "latest_tokens_per_sec": 32766.99612450552, "baseline_ratio": null, "latest_total_tokens": 983040.0, "proxy_mode": "fast", "evaluation_basis": "terminal_only"}}
{"event_id": "evt_1774141379280254033", "ts": 1774141379, "event": "training_heartbeat", "round": 22, "session_id": "019d130c-782e-75a2-aa6f-506b18d29edf", "tier": "proxy", "run_name": "round0022_proxy_1774141319", "family_name": "lowrank_gated_residual", "family_stage": "prototype", "status": null, "decision": null, "payload": {"tier": "proxy", "run_name": "round0022_proxy_1774141319", "family_name": "lowrank_gated_residual", "family_stage": "prototype", "checkpoint_dir": "/root/sparsify-ascend/checkpoints/research_agent/round_0022_proxy/round0022_proxy_1774141319_dp2_bs1_ga8_ef32_k128_20260322_090205", "metrics_path": "/root/sparsify-ascend/checkpoints/research_agent/round_0022_proxy/round0022_proxy_1774141319_dp2_bs1_ga8_ef32_k128_20260322_090205/metrics.jsonl", "latest_step": 110, "latest_tokens_per_sec": 60072.57941280053, "baseline_ratio": null, "latest_total_tokens": 3604480.0, "proxy_mode": "fast", "evaluation_basis": "terminal_only"}}
{"event_id": "evt_1774141409281813134", "ts": 1774141409, "event": "training_heartbeat", "round": 22, "session_id": "019d130c-782e-75a2-aa6f-506b18d29edf", "tier": "proxy", "run_name": "round0022_proxy_1774141319", "family_name": "lowrank_gated_residual", "family_stage": "prototype", "status": null, "decision": null, "payload": {"tier": "proxy", "run_name": "round0022_proxy_1774141319", "family_name": "lowrank_gated_residual", "family_stage": "prototype", "checkpoint_dir": "/root/sparsify-ascend/checkpoints/research_agent/round_0022_proxy/round0022_proxy_1774141319_dp2_bs1_ga8_ef32_k128_20260322_090205", "metrics_path": "/root/sparsify-ascend/checkpoints/research_agent/round_0022_proxy/round0022_proxy_1774141319_dp2_bs1_ga8_ef32_k128_20260322_090205/metrics.jsonl", "latest_step": 180, "latest_tokens_per_sec": 65533.346114418106, "baseline_ratio": null, "latest_total_tokens": 5898240.0, "proxy_mode": "fast", "evaluation_basis": "terminal_only"}}
{"event_id": "evt_1774141439283763805", "ts": 1774141439, "event": "training_heartbeat", "round": 22, "session_id": "019d130c-782e-75a2-aa6f-506b18d29edf", "tier": "proxy", "run_name": "round0022_proxy_1774141319", "family_name": "lowrank_gated_residual", "family_stage": "prototype", "status": null, "decision": null, "payload": {"tier": "proxy", "run_name": "round0022_proxy_1774141319", "family_name": "lowrank_gated_residual", "family_stage": "prototype", "checkpoint_dir": "/root/sparsify-ascend/checkpoints/research_agent/round_0022_proxy/round0022_proxy_1774141319_dp2_bs1_ga8_ef32_k128_20260322_090205", "metrics_path": "/root/sparsify-ascend/checkpoints/research_agent/round_0022_proxy/round0022_proxy_1774141319_dp2_bs1_ga8_ef32_k128_20260322_090205/metrics.jsonl", "latest_step": 250, "latest_tokens_per_sec": 68263.48308575457, "baseline_ratio": null, "latest_total_tokens": 8192000.0, "proxy_mode": "fast", "evaluation_basis": "terminal_only"}}
{"event_id": "evt_1774141469286138180", "ts": 1774141469, "event": "training_heartbeat", "round": 22, "session_id": "019d130c-782e-75a2-aa6f-506b18d29edf", "tier": "proxy", "run_name": "round0022_proxy_1774141319", "family_name": "lowrank_gated_residual", "family_stage": "prototype", "status": null, "decision": null, "payload": {"tier": "proxy", "run_name": "round0022_proxy_1774141319", "family_name": "lowrank_gated_residual", "family_stage": "prototype", "checkpoint_dir": "/root/sparsify-ascend/checkpoints/research_agent/round_0022_proxy/round0022_proxy_1774141319_dp2_bs1_ga8_ef32_k128_20260322_090205", "metrics_path": "/root/sparsify-ascend/checkpoints/research_agent/round_0022_proxy/round0022_proxy_1774141319_dp2_bs1_ga8_ef32_k128_20260322_090205/metrics.jsonl", "latest_step": 320, "latest_tokens_per_sec": 69901.35530816282, "baseline_ratio": null, "latest_total_tokens": 10485760.0, "proxy_mode": "fast", "evaluation_basis": "terminal_only"}}
{"event_id": "evt_1774141499288953474", "ts": 1774141499, "event": "training_heartbeat", "round": 22, "session_id": "019d130c-782e-75a2-aa6f-506b18d29edf", "tier": "proxy", "run_name": "round0022_proxy_1774141319", "family_name": "lowrank_gated_residual", "family_stage": "prototype", "status": null, "decision": null, "payload": {"tier": "proxy", "run_name": "round0022_proxy_1774141319", "family_name": "lowrank_gated_residual", "family_stage": "prototype", "checkpoint_dir": "/root/sparsify-ascend/checkpoints/research_agent/round_0022_proxy/round0022_proxy_1774141319_dp2_bs1_ga8_ef32_k128_20260322_090205", "metrics_path": "/root/sparsify-ascend/checkpoints/research_agent/round_0022_proxy/round0022_proxy_1774141319_dp2_bs1_ga8_ef32_k128_20260322_090205/metrics.jsonl", "latest_step": 400, "latest_tokens_per_sec": 72813.41779579282, "baseline_ratio": null, "latest_total_tokens": 13107200.0, "proxy_mode": "fast", "evaluation_basis": "terminal_only"}}
{"event_id": "evt_1774141529292114827", "ts": 1774141529, "event": "training_heartbeat", "round": 22, "session_id": "019d130c-782e-75a2-aa6f-506b18d29edf", "tier": "proxy", "run_name": "round0022_proxy_1774141319", "family_name": "lowrank_gated_residual", "family_stage": "prototype", "status": null, "decision": null, "payload": {"tier": "proxy", "run_name": "round0022_proxy_1774141319", "family_name": "lowrank_gated_residual", "family_stage": "prototype", "checkpoint_dir": "/root/sparsify-ascend/checkpoints/research_agent/round_0022_proxy/round0022_proxy_1774141319_dp2_bs1_ga8_ef32_k128_20260322_090205", "metrics_path": "/root/sparsify-ascend/checkpoints/research_agent/round_0022_proxy/round0022_proxy_1774141319_dp2_bs1_ga8_ef32_k128_20260322_090205/metrics.jsonl", "latest_step": 470, "latest_tokens_per_sec": 73333.03381454, "baseline_ratio": null, "latest_total_tokens": 15400960.0, "proxy_mode": "fast", "evaluation_basis": "terminal_only"}}
{"event_id": "evt_1774141559295680944", "ts": 1774141559, "event": "training_heartbeat", "round": 22, "session_id": "019d130c-782e-75a2-aa6f-506b18d29edf", "tier": "proxy", "run_name": "round0022_proxy_1774141319", "family_name": "lowrank_gated_residual", "family_stage": "prototype", "status": null, "decision": null, "payload": {"tier": "proxy", "run_name": "round0022_proxy_1774141319", "family_name": "lowrank_gated_residual", "family_stage": "prototype", "checkpoint_dir": "/root/sparsify-ascend/checkpoints/research_agent/round_0022_proxy/round0022_proxy_1774141319_dp2_bs1_ga8_ef32_k128_20260322_090205", "metrics_path": "/root/sparsify-ascend/checkpoints/research_agent/round_0022_proxy/round0022_proxy_1774141319_dp2_bs1_ga8_ef32_k128_20260322_090205/metrics.jsonl", "latest_step": 540, "latest_tokens_per_sec": 73722.62397601646, "baseline_ratio": null, "latest_total_tokens": 17694720.0, "proxy_mode": "fast", "evaluation_basis": "terminal_only"}}
{"event_id": "evt_1774141589299947877", "ts": 1774141589, "event": "training_heartbeat", "round": 22, "session_id": "019d130c-782e-75a2-aa6f-506b18d29edf", "tier": "proxy", "run_name": "round0022_proxy_1774141319", "family_name": "lowrank_gated_residual", "family_stage": "prototype", "status": null, "decision": null, "payload": {"tier": "proxy", "run_name": "round0022_proxy_1774141319", "family_name": "lowrank_gated_residual", "family_stage": "prototype", "checkpoint_dir": "/root/sparsify-ascend/checkpoints/research_agent/round_0022_proxy/round0022_proxy_1774141319_dp2_bs1_ga8_ef32_k128_20260322_090205", "metrics_path": "/root/sparsify-ascend/checkpoints/research_agent/round_0022_proxy/round0022_proxy_1774141319_dp2_bs1_ga8_ef32_k128_20260322_090205/metrics.jsonl", "latest_step": 620, "latest_tokens_per_sec": 75239.0351859891, "baseline_ratio": null, "latest_total_tokens": 20316160.0, "proxy_mode": "fast", "evaluation_basis": "terminal_only"}}
{"event_id": "evt_1774141619306945416", "ts": 1774141619, "event": "training_heartbeat", "round": 22, "session_id": "019d130c-782e-75a2-aa6f-506b18d29edf", "tier": "proxy", "run_name": "round0022_proxy_1774141319", "family_name": "lowrank_gated_residual", "family_stage": "prototype", "status": null, "decision": null, "payload": {"tier": "proxy", "run_name": "round0022_proxy_1774141319", "family_name": "lowrank_gated_residual", "family_stage": "prototype", "checkpoint_dir": "/root/sparsify-ascend/checkpoints/research_agent/round_0022_proxy/round0022_proxy_1774141319_dp2_bs1_ga8_ef32_k128_20260322_090205", "metrics_path": "/root/sparsify-ascend/checkpoints/research_agent/round_0022_proxy/round0022_proxy_1774141319_dp2_bs1_ga8_ef32_k128_20260322_090205/metrics.jsonl", "latest_step": 690, "latest_tokens_per_sec": 75359.18629729722, "baseline_ratio": null, "latest_total_tokens": 22609920.0, "proxy_mode": "fast", "evaluation_basis": "terminal_only"}}
{"event_id": "evt_1774141649311796606", "ts": 1774141649, "event": "training_heartbeat", "round": 22, "session_id": "019d130c-782e-75a2-aa6f-506b18d29edf", "tier": "proxy", "run_name": "round0022_proxy_1774141319", "family_name": "lowrank_gated_residual", "family_stage": "prototype", "status": null, "decision": null, "payload": {"tier": "proxy", "run_name": "round0022_proxy_1774141319", "family_name": "lowrank_gated_residual", "family_stage": "prototype", "checkpoint_dir": "/root/sparsify-ascend/checkpoints/research_agent/round_0022_proxy/round0022_proxy_1774141319_dp2_bs1_ga8_ef32_k128_20260322_090205", "metrics_path": "/root/sparsify-ascend/checkpoints/research_agent/round_0022_proxy/round0022_proxy_1774141319_dp2_bs1_ga8_ef32_k128_20260322_090205/metrics.jsonl", "latest_step": 760, "latest_tokens_per_sec": 75458.01078923028, "baseline_ratio": null, "latest_total_tokens": 24903680.0, "proxy_mode": "fast", "evaluation_basis": "terminal_only"}}
{"event_id": "evt_1774141679317092366", "ts": 1774141679, "event": "training_heartbeat", "round": 22, "session_id": "019d130c-782e-75a2-aa6f-506b18d29edf", "tier": "proxy", "run_name": "round0022_proxy_1774141319", "family_name": "lowrank_gated_residual", "family_stage": "prototype", "status": null, "decision": null, "payload": {"tier": "proxy", "run_name": "round0022_proxy_1774141319", "family_name": "lowrank_gated_residual", "family_stage": "prototype", "checkpoint_dir": "/root/sparsify-ascend/checkpoints/research_agent/round_0022_proxy/round0022_proxy_1774141319_dp2_bs1_ga8_ef32_k128_20260322_090205", "metrics_path": "/root/sparsify-ascend/checkpoints/research_agent/round_0022_proxy/round0022_proxy_1774141319_dp2_bs1_ga8_ef32_k128_20260322_090205/metrics.jsonl", "latest_step": 840, "latest_tokens_per_sec": 76450.40513901119, "baseline_ratio": null, "latest_total_tokens": 27525120.0, "proxy_mode": "fast", "evaluation_basis": "terminal_only"}}
{"event_id": "evt_1774141709322727320", "ts": 1774141709, "event": "training_heartbeat", "round": 22, "session_id": "019d130c-782e-75a2-aa6f-506b18d29edf", "tier": "proxy", "run_name": "round0022_proxy_1774141319", "family_name": "lowrank_gated_residual", "family_stage": "prototype", "status": null, "decision": null, "payload": {"tier": "proxy", "run_name": "round0022_proxy_1774141319", "family_name": "lowrank_gated_residual", "family_stage": "prototype", "checkpoint_dir": "/root/sparsify-ascend/checkpoints/research_agent/round_0022_proxy/round0022_proxy_1774141319_dp2_bs1_ga8_ef32_k128_20260322_090205", "metrics_path": "/root/sparsify-ascend/checkpoints/research_agent/round_0022_proxy/round0022_proxy_1774141319_dp2_bs1_ga8_ef32_k128_20260322_090205/metrics.jsonl", "latest_step": 910, "latest_tokens_per_sec": 76449.93542560174, "baseline_ratio": null, "latest_total_tokens": 29818880.0, "proxy_mode": "fast", "evaluation_basis": "terminal_only"}}
{"event_id": "evt_1774141739328726306", "ts": 1774141739, "event": "training_heartbeat", "round": 22, "session_id": "019d130c-782e-75a2-aa6f-506b18d29edf", "tier": "proxy", "run_name": "round0022_proxy_1774141319", "family_name": "lowrank_gated_residual", "family_stage": "prototype", "status": null, "decision": null, "payload": {"tier": "proxy", "run_name": "round0022_proxy_1774141319", "family_name": "lowrank_gated_residual", "family_stage": "prototype", "checkpoint_dir": "/root/sparsify-ascend/checkpoints/research_agent/round_0022_proxy/round0022_proxy_1774141319_dp2_bs1_ga8_ef32_k128_20260322_090205", "metrics_path": "/root/sparsify-ascend/checkpoints/research_agent/round_0022_proxy/round0022_proxy_1774141319_dp2_bs1_ga8_ef32_k128_20260322_090205/metrics.jsonl", "latest_step": 980, "latest_tokens_per_sec": 76449.46807728318, "baseline_ratio": null, "latest_total_tokens": 32112640.0, "proxy_mode": "fast", "evaluation_basis": "terminal_only"}}
{"event_id": "evt_1774141769475169326", "ts": 1774141769, "event": "training_heartbeat", "round": 22, "session_id": "019d130c-782e-75a2-aa6f-506b18d29edf", "tier": "proxy", "run_name": "round0022_proxy_1774141319", "family_name": "lowrank_gated_residual", "family_stage": "prototype", "status": null, "decision": null, "payload": {"tier": "proxy", "run_name": "round0022_proxy_1774141319", "family_name": "lowrank_gated_residual", "family_stage": "prototype", "checkpoint_dir": "/root/sparsify-ascend/checkpoints/research_agent/round_0022_proxy/round0022_proxy_1774141319_dp2_bs1_ga8_ef32_k128_20260322_090205", "metrics_path": "/root/sparsify-ascend/checkpoints/research_agent/round_0022_proxy/round0022_proxy_1774141319_dp2_bs1_ga8_ef32_k128_20260322_090205/metrics.jsonl", "latest_step": 1020, "latest_tokens_per_sec": 74264.75854453468, "baseline_ratio": null, "latest_total_tokens": 33423360.0, "proxy_mode": "fast", "evaluation_basis": "terminal_only"}}
{"event_id": "evt_1774141799648191595", "ts": 1774141799, "event": "training_heartbeat", "round": 22, "session_id": "019d130c-782e-75a2-aa6f-506b18d29edf", "tier": "proxy", "run_name": "round0022_proxy_1774141319", "family_name": "lowrank_gated_residual", "family_stage": "prototype", "status": null, "decision": null, "payload": {"tier": "proxy", "run_name": "round0022_proxy_1774141319", "family_name": "lowrank_gated_residual", "family_stage": "prototype", "checkpoint_dir": "/root/sparsify-ascend/checkpoints/research_agent/round_0022_proxy/round0022_proxy_1774141319_dp2_bs1_ga8_ef32_k128_20260322_090205", "metrics_path": "/root/sparsify-ascend/checkpoints/research_agent/round_0022_proxy/round0022_proxy_1774141319_dp2_bs1_ga8_ef32_k128_20260322_090205/metrics.jsonl", "latest_step": 1090, "latest_tokens_per_sec": 74379.11099878392, "baseline_ratio": null, "latest_total_tokens": 35717120.0, "proxy_mode": "fast", "evaluation_basis": "terminal_only"}}
{"event_id": "evt_1774141829655352885", "ts": 1774141829, "event": "training_heartbeat", "round": 22, "session_id": "019d130c-782e-75a2-aa6f-506b18d29edf", "tier": "proxy", "run_name": "round0022_proxy_1774141319", "family_name": "lowrank_gated_residual", "family_stage": "prototype", "status": null, "decision": null, "payload": {"tier": "proxy", "run_name": "round0022_proxy_1774141319", "family_name": "lowrank_gated_residual", "family_stage": "prototype", "checkpoint_dir": "/root/sparsify-ascend/checkpoints/research_agent/round_0022_proxy/round0022_proxy_1774141319_dp2_bs1_ga8_ef32_k128_20260322_090205", "metrics_path": "/root/sparsify-ascend/checkpoints/research_agent/round_0022_proxy/round0022_proxy_1774141319_dp2_bs1_ga8_ef32_k128_20260322_090205/metrics.jsonl", "latest_step": 1160, "latest_tokens_per_sec": 74476.05917251071, "baseline_ratio": null, "latest_total_tokens": 38010880.0, "proxy_mode": "fast", "evaluation_basis": "terminal_only"}}
{"event_id": "evt_1774141859689337203", "ts": 1774141859, "event": "training_heartbeat", "round": 22, "session_id": "019d130c-782e-75a2-aa6f-506b18d29edf", "tier": "proxy", "run_name": "round0022_proxy_1774141319", "family_name": "lowrank_gated_residual", "family_stage": "prototype", "status": null, "decision": null, "payload": {"tier": "proxy", "run_name": "round0022_proxy_1774141319", "family_name": "lowrank_gated_residual", "family_stage": "prototype", "checkpoint_dir": "/root/sparsify-ascend/checkpoints/research_agent/round_0022_proxy/round0022_proxy_1774141319_dp2_bs1_ga8_ef32_k128_20260322_090205", "metrics_path": "/root/sparsify-ascend/checkpoints/research_agent/round_0022_proxy/round0022_proxy_1774141319_dp2_bs1_ga8_ef32_k128_20260322_090205/metrics.jsonl", "latest_step": 1220, "latest_tokens_per_sec": 73978.72345102721, "baseline_ratio": null, "latest_total_tokens": 39976960.0, "proxy_mode": "fast", "evaluation_basis": "terminal_only"}}
{"event_id": "evt_1774141889908220270", "ts": 1774141889, "event": "training_heartbeat", "round": 22, "session_id": "019d130c-782e-75a2-aa6f-506b18d29edf", "tier": "proxy", "run_name": "round0022_proxy_1774141319", "family_name": "lowrank_gated_residual", "family_stage": "prototype", "status": null, "decision": null, "payload": {"tier": "proxy", "run_name": "round0022_proxy_1774141319", "family_name": "lowrank_gated_residual", "family_stage": "prototype", "checkpoint_dir": "/root/sparsify-ascend/checkpoints/research_agent/round_0022_proxy/round0022_proxy_1774141319_dp2_bs1_ga8_ef32_k128_20260322_090205", "metrics_path": "/root/sparsify-ascend/checkpoints/research_agent/round_0022_proxy/round0022_proxy_1774141319_dp2_bs1_ga8_ef32_k128_20260322_090205/metrics.jsonl", "latest_step": 1220, "latest_tokens_per_sec": 70083.54977400618, "baseline_ratio": null, "latest_total_tokens": 39976960.0, "proxy_mode": "fast", "evaluation_basis": "terminal_only"}}
