{"event_id": "evt_1774145963740598959", "ts": 1774145963, "event": "training_started", "round": 29, "session_id": "019d130c-782e-75a2-aa6f-506b18d29edf", "tier": "proxy", "run_name": "round0029_proxy_1774145963", "family_name": "lowrank_gated_residual", "family_stage": "stabilize", "status": null, "decision": null, "payload": {"tier": "proxy", "run_name": "round0029_proxy_1774145963", "family_name": "lowrank_gated_residual", "family_stage": "stabilize", "checkpoint_dir": "/root/sparsify-ascend/checkpoints/research_agent/round_0029_proxy", "log_path": "/root/sparsify-ascend/research/history/logs/round0029_proxy_1774145963.log", "config": {"architecture": "lowrank_gated_residual", "expansion_factor": 32, "k": 128, "optimizer": "signum", "lr": "1.6e-3", "hookpoints": "layers.[3].self_attn.o_proj", "batch_size": 1, "grad_acc_steps": 8, "micro_acc_steps": 1, "auxk_alpha": 0.0625, "dead_feature_threshold": 10000000, "use_hadamard": false, "tier": "proxy", "family_name": "lowrank_gated_residual", "family_stage": "stabilize"}, "baseline_tokens_per_sec": 66622.61543248847, "proxy_mode": "extended", "evaluation_basis": "curve_extended"}}
{"event_id": "evt_1774145993741842623", "ts": 1774145993, "event": "training_heartbeat", "round": 29, "session_id": "019d130c-782e-75a2-aa6f-506b18d29edf", "tier": "proxy", "run_name": "round0029_proxy_1774145963", "family_name": "lowrank_gated_residual", "family_stage": "stabilize", "status": null, "decision": null, "payload": {"tier": "proxy", "run_name": "round0029_proxy_1774145963", "family_name": "lowrank_gated_residual", "family_stage": "stabilize", "checkpoint_dir": "/root/sparsify-ascend/checkpoints/research_agent/round_0029_proxy/round0029_proxy_1774145963_dp2_bs1_ga8_ef32_k128_20260322_101932", "metrics_path": "/root/sparsify-ascend/checkpoints/research_agent/round_0029_proxy/round0029_proxy_1774145963_dp2_bs1_ga8_ef32_k128_20260322_101932/metrics.jsonl", "latest_step": 30, "latest_tokens_per_sec": 32766.968522053434, "baseline_ratio": 0.4918295132867847, "latest_total_tokens": 983040.0, "proxy_mode": "extended", "evaluation_basis": "curve_extended"}}
{"event_id": "evt_1774146023742981996", "ts": 1774146023, "event": "training_heartbeat", "round": 29, "session_id": "019d130c-782e-75a2-aa6f-506b18d29edf", "tier": "proxy", "run_name": "round0029_proxy_1774145963", "family_name": "lowrank_gated_residual", "family_stage": "stabilize", "status": null, "decision": null, "payload": {"tier": "proxy", "run_name": "round0029_proxy_1774145963", "family_name": "lowrank_gated_residual", "family_stage": "stabilize", "checkpoint_dir": "/root/sparsify-ascend/checkpoints/research_agent/round_0029_proxy/round0029_proxy_1774145963_dp2_bs1_ga8_ef32_k128_20260322_101932", "metrics_path": "/root/sparsify-ascend/checkpoints/research_agent/round_0029_proxy/round0029_proxy_1774145963_dp2_bs1_ga8_ef32_k128_20260322_101932/metrics.jsonl", "latest_step": 100, "latest_tokens_per_sec": 54611.44429277353, "baseline_ratio": 0.819713305133054, "latest_total_tokens": 3276800.0, "proxy_mode": "extended", "evaluation_basis": "curve_extended"}}
{"event_id": "evt_1774146053744515077", "ts": 1774146053, "event": "training_heartbeat", "round": 29, "session_id": "019d130c-782e-75a2-aa6f-506b18d29edf", "tier": "proxy", "run_name": "round0029_proxy_1774145963", "family_name": "lowrank_gated_residual", "family_stage": "stabilize", "status": null, "decision": null, "payload": {"tier": "proxy", "run_name": "round0029_proxy_1774145963", "family_name": "lowrank_gated_residual", "family_stage": "stabilize", "checkpoint_dir": "/root/sparsify-ascend/checkpoints/research_agent/round_0029_proxy/round0029_proxy_1774145963_dp2_bs1_ga8_ef32_k128_20260322_101932", "metrics_path": "/root/sparsify-ascend/checkpoints/research_agent/round_0029_proxy/round0029_proxy_1774145963_dp2_bs1_ga8_ef32_k128_20260322_101932/metrics.jsonl", "latest_step": 170, "latest_tokens_per_sec": 61892.62909258947, "baseline_ratio": 0.929003292512704, "latest_total_tokens": 5570560.0, "proxy_mode": "extended", "evaluation_basis": "curve_extended"}}
{"event_id": "evt_1774146083746518791", "ts": 1774146083, "event": "training_heartbeat", "round": 29, "session_id": "019d130c-782e-75a2-aa6f-506b18d29edf", "tier": "proxy", "run_name": "round0029_proxy_1774145963", "family_name": "lowrank_gated_residual", "family_stage": "stabilize", "status": null, "decision": null, "payload": {"tier": "proxy", "run_name": "round0029_proxy_1774145963", "family_name": "lowrank_gated_residual", "family_stage": "stabilize", "checkpoint_dir": "/root/sparsify-ascend/checkpoints/research_agent/round_0029_proxy/round0029_proxy_1774145963_dp2_bs1_ga8_ef32_k128_20260322_101932", "metrics_path": "/root/sparsify-ascend/checkpoints/research_agent/round_0029_proxy/round0029_proxy_1774145963_dp2_bs1_ga8_ef32_k128_20260322_101932/metrics.jsonl", "latest_step": 250, "latest_tokens_per_sec": 68263.47399914674, "baseline_ratio": 1.024629152668451, "latest_total_tokens": 8192000.0, "proxy_mode": "extended", "evaluation_basis": "curve_extended"}}
{"event_id": "evt_1774146113748932922", "ts": 1774146113, "event": "training_heartbeat", "round": 29, "session_id": "019d130c-782e-75a2-aa6f-506b18d29edf", "tier": "proxy", "run_name": "round0029_proxy_1774145963", "family_name": "lowrank_gated_residual", "family_stage": "stabilize", "status": null, "decision": null, "payload": {"tier": "proxy", "run_name": "round0029_proxy_1774145963", "family_name": "lowrank_gated_residual", "family_stage": "stabilize", "checkpoint_dir": "/root/sparsify-ascend/checkpoints/research_agent/round_0029_proxy/round0029_proxy_1774145963_dp2_bs1_ga8_ef32_k128_20260322_101932", "metrics_path": "/root/sparsify-ascend/checkpoints/research_agent/round_0029_proxy/round0029_proxy_1774145963_dp2_bs1_ga8_ef32_k128_20260322_101932/metrics.jsonl", "latest_step": 320, "latest_tokens_per_sec": 69901.32086739266, "baseline_ratio": 1.0492130999904474, "latest_total_tokens": 10485760.0, "proxy_mode": "extended", "evaluation_basis": "curve_extended"}}
{"event_id": "evt_1774146143751787358", "ts": 1774146143, "event": "training_heartbeat", "round": 29, "session_id": "019d130c-782e-75a2-aa6f-506b18d29edf", "tier": "proxy", "run_name": "round0029_proxy_1774145963", "family_name": "lowrank_gated_residual", "family_stage": "stabilize", "status": null, "decision": null, "payload": {"tier": "proxy", "run_name": "round0029_proxy_1774145963", "family_name": "lowrank_gated_residual", "family_stage": "stabilize", "checkpoint_dir": "/root/sparsify-ascend/checkpoints/research_agent/round_0029_proxy/round0029_proxy_1774145963_dp2_bs1_ga8_ef32_k128_20260322_101932", "metrics_path": "/root/sparsify-ascend/checkpoints/research_agent/round_0029_proxy/round0029_proxy_1774145963_dp2_bs1_ga8_ef32_k128_20260322_101932/metrics.jsonl", "latest_step": 390, "latest_tokens_per_sec": 70993.04417551361, "baseline_ratio": 1.06559977741273, "latest_total_tokens": 12779520.0, "proxy_mode": "extended", "evaluation_basis": "curve_extended"}}
{"event_id": "evt_1774146173755045008", "ts": 1774146173, "event": "training_heartbeat", "round": 29, "session_id": "019d130c-782e-75a2-aa6f-506b18d29edf", "tier": "proxy", "run_name": "round0029_proxy_1774145963", "family_name": "lowrank_gated_residual", "family_stage": "stabilize", "status": null, "decision": null, "payload": {"tier": "proxy", "run_name": "round0029_proxy_1774145963", "family_name": "lowrank_gated_residual", "family_stage": "stabilize", "checkpoint_dir": "/root/sparsify-ascend/checkpoints/research_agent/round_0029_proxy/round0029_proxy_1774145963_dp2_bs1_ga8_ef32_k128_20260322_101932", "metrics_path": "/root/sparsify-ascend/checkpoints/research_agent/round_0029_proxy/round0029_proxy_1774145963_dp2_bs1_ga8_ef32_k128_20260322_101932/metrics.jsonl", "latest_step": 460, "latest_tokens_per_sec": 71772.6963670698, "baseline_ratio": 1.0773022929398521, "latest_total_tokens": 15073280.0, "proxy_mode": "extended", "evaluation_basis": "curve_extended"}}
{"event_id": "evt_1774146203758789438", "ts": 1774146203, "event": "training_heartbeat", "round": 29, "session_id": "019d130c-782e-75a2-aa6f-506b18d29edf", "tier": "proxy", "run_name": "round0029_proxy_1774145963", "family_name": "lowrank_gated_residual", "family_stage": "stabilize", "status": null, "decision": null, "payload": {"tier": "proxy", "run_name": "round0029_proxy_1774145963", "family_name": "lowrank_gated_residual", "family_stage": "stabilize", "checkpoint_dir": "/root/sparsify-ascend/checkpoints/research_agent/round_0029_proxy/round0029_proxy_1774145963_dp2_bs1_ga8_ef32_k128_20260322_101932", "metrics_path": "/root/sparsify-ascend/checkpoints/research_agent/round_0029_proxy/round0029_proxy_1774145963_dp2_bs1_ga8_ef32_k128_20260322_101932/metrics.jsonl", "latest_step": 540, "latest_tokens_per_sec": 73722.5106870497, "baseline_ratio": 1.1065688461563905, "latest_total_tokens": 17694720.0, "proxy_mode": "extended", "evaluation_basis": "curve_extended"}}
{"event_id": "evt_1774146233762966032", "ts": 1774146233, "event": "training_heartbeat", "round": 29, "session_id": "019d130c-782e-75a2-aa6f-506b18d29edf", "tier": "proxy", "run_name": "round0029_proxy_1774145963", "family_name": "lowrank_gated_residual", "family_stage": "stabilize", "status": null, "decision": null, "payload": {"tier": "proxy", "run_name": "round0029_proxy_1774145963", "family_name": "lowrank_gated_residual", "family_stage": "stabilize", "checkpoint_dir": "/root/sparsify-ascend/checkpoints/research_agent/round_0029_proxy/round0029_proxy_1774145963_dp2_bs1_ga8_ef32_k128_20260322_101932", "metrics_path": "/root/sparsify-ascend/checkpoints/research_agent/round_0029_proxy/round0029_proxy_1774145963_dp2_bs1_ga8_ef32_k128_20260322_101932/metrics.jsonl", "latest_step": 610, "latest_tokens_per_sec": 74025.36359787142, "baseline_ratio": 1.1111146435384913, "latest_total_tokens": 19988480.0, "proxy_mode": "extended", "evaluation_basis": "curve_extended"}}
{"event_id": "evt_1774146263887321286", "ts": 1774146263, "event": "training_heartbeat", "round": 29, "session_id": "019d130c-782e-75a2-aa6f-506b18d29edf", "tier": "proxy", "run_name": "round0029_proxy_1774145963", "family_name": "lowrank_gated_residual", "family_stage": "stabilize", "status": null, "decision": null, "payload": {"tier": "proxy", "run_name": "round0029_proxy_1774145963", "family_name": "lowrank_gated_residual", "family_stage": "stabilize", "checkpoint_dir": "/root/sparsify-ascend/checkpoints/research_agent/round_0029_proxy/round0029_proxy_1774145963_dp2_bs1_ga8_ef32_k128_20260322_101932", "metrics_path": "/root/sparsify-ascend/checkpoints/research_agent/round_0029_proxy/round0029_proxy_1774145963_dp2_bs1_ga8_ef32_k128_20260322_101932/metrics.jsonl", "latest_step": 610, "latest_tokens_per_sec": 66622.45057024142, "baseline_ratio": 0.999997525431177, "latest_total_tokens": 19988480.0, "proxy_mode": "extended", "evaluation_basis": "curve_extended"}}
{"event_id": "evt_1774146264446489625", "ts": 1774146264, "event": "training_finished", "round": 29, "session_id": "019d130c-782e-75a2-aa6f-506b18d29edf", "tier": "proxy", "run_name": "round0029_proxy_1774145963", "family_name": "lowrank_gated_residual", "family_stage": "stabilize", "status": "ok", "decision": "discard", "payload": {"tier": "proxy", "run_name": "round0029_proxy_1774145963", "family_name": "lowrank_gated_residual", "family_stage": "stabilize", "checkpoint_dir": "/root/sparsify-ascend/checkpoints/research_agent/round_0029_proxy/round0029_proxy_1774145963_dp2_bs1_ga8_ef32_k128_20260322_101932", "metrics_path": "/root/sparsify-ascend/checkpoints/research_agent/round_0029_proxy/round0029_proxy_1774145963_dp2_bs1_ga8_ef32_k128_20260322_101932/metrics.jsonl", "run_health": "normal", "termination_reason": "completed", "tokens_per_sec": 66622.45057024142, "baseline_ratio": 0.999997525431177, "status": "ok", "decision": "discard", "proxy_mode": "extended", "evaluation_basis": "curve_extended", "curve_start_fvu": 0.12963083386421204, "curve_mid_fvu": 0.09483607113361359, "curve_end_fvu": 0.08367174863815308, "curve_late_slope": -7.991625576234255e-12, "curve_still_improving": false}}
{"event_id": "evt_1774146264446564684", "ts": 1774146264, "event": "result_recorded", "round": 29, "session_id": "019d130c-782e-75a2-aa6f-506b18d29edf", "tier": "proxy", "run_name": "round0029_proxy_1774145963", "family_name": "lowrank_gated_residual", "family_stage": "stabilize", "status": "ok", "decision": "discard", "payload": {"tier": "proxy", "run_name": "round0029_proxy_1774145963", "family_name": "lowrank_gated_residual", "family_stage": "stabilize", "status": "ok", "decision": "discard", "val_fvu": "0.07915490865707397", "observed_fvu": "0.083672", "k": "128", "log_path": "/root/sparsify-ascend/research/history/logs/proxy_1774146264.log", "checkpoint": null}}
{"event_id": "evt_1774146264446930678", "ts": 1774146264, "event": "round_finished", "round": 29, "session_id": "019d130c-782e-75a2-aa6f-506b18d29edf", "tier": "proxy", "run_name": null, "family_name": "lowrank_gated_residual", "family_stage": "stabilize", "status": "ok", "decision": "discard", "payload": {"tier": "proxy", "family_name": "lowrank_gated_residual", "family_stage": "stabilize", "status": "ok", "decision": "discard", "val_fvu": "0.07915490865707397"}}
{"event_id": "evt_1774146264539085782", "ts": 1774146264, "event": "experiment_commit_prepared", "round": 29, "tier": "proxy", "run_name": null, "family_name": "lowrank_gated_residual", "family_stage": "stabilize", "status": "ok", "decision": "discard", "payload": {"branch": "autoresearch-sae"}}
{"event_id": "evt_1774146272861474491", "ts": 1774146272, "event": "round_started", "round": 30, "session_id": "019d130c-782e-75a2-aa6f-506b18d29edf", "tier": null, "run_name": null, "family_name": null, "family_stage": null, "status": "started", "decision": null, "payload": {"status": "started"}}
{"event_id": "evt_1774146272907092293", "ts": 1774146272, "event": "agent_deciding", "round": 30, "session_id": "019d130c-782e-75a2-aa6f-506b18d29edf", "tier": null, "run_name": null, "family_name": null, "family_stage": null, "status": null, "decision": null, "payload": {}}
{"event_id": "evt_1774146272909310172", "ts": 1774146272, "event": "session_rebuilt", "round": 30, "tier": null, "run_name": null, "family_name": null, "family_stage": null, "status": "recreated", "decision": null, "payload": {"previous_session_id": "019d130c-782e-75a2-aa6f-506b18d29edf", "previous_status": "active", "previous_rounds": 8, "previous_age_hours": 1.4153}}
{"event_id": "evt_1774146560535228073", "ts": 1774146560, "event": "session_started", "round": 30, "tier": null, "run_name": null, "family_name": null, "family_stage": null, "status": "active", "decision": null, "payload": {"session_id": "019d135d-4c60-7fa3-8438-b12bc57e0720"}}
{"event_id": "evt_1774146560535890222", "ts": 1774146560, "event": "agent_action_received", "round": 30, "session_id": "019d135d-4c60-7fa3-8438-b12bc57e0720", "tier": "proxy", "run_name": null, "family_name": "whitened_topk", "family_stage": "stabilize", "status": null, "decision": null, "payload": {"session_id": "019d135d-4c60-7fa3-8438-b12bc57e0720", "tier": "proxy", "family_name": "whitened_topk", "family_stage": "stabilize", "change_type": "edit_sae_code", "expected_win": "lower_fvu", "hypothesis": "Recent lowrank_gated_residual sweeps exhausted local LR/aux/EF tuning without improving the K=128 anchor, and policy blocks opening a third incubating family. The least-bad informative move is to advance the existing incubating `whitened_topk` family by strengthening its preconditioner: normalize activations first, then apply a low-rank residual mixer around identity before TopK selection. If the earlier `whitened_topk` result failed because its shallow raw linear map was too weak and poorly conditioned, this stabilized geometry change could reopen quality gains under the current strong recipe."}}
{"event_id": "evt_1774146691787626729", "ts": 1774146691, "event": "variable_isolation_warning", "round": 30, "session_id": "019d135d-4c60-7fa3-8438-b12bc57e0720", "tier": null, "run_name": null, "family_name": "whitened_topk", "family_stage": "stabilize", "status": null, "decision": null, "payload": {"violation": "Multiple primary variables changed simultaneously: code_edit, architecture, lr"}}
{"event_id": "evt_1774146696328508729", "ts": 1774146696, "event": "behavioral_diff_identical", "round": 30, "session_id": "019d135d-4c60-7fa3-8438-b12bc57e0720", "tier": null, "run_name": null, "family_name": "whitened_topk", "family_stage": "stabilize", "status": null, "decision": null, "payload": {"architecture": "whitened_topk", "k": 128, "expansion_factor": 32, "max_diff": 0.0}}
{"event_id": "evt_1774146696328632602", "ts": 1774146696, "event": "round_finished", "round": 30, "session_id": "019d135d-4c60-7fa3-8438-b12bc57e0720", "tier": "proxy", "run_name": null, "family_name": "whitened_topk", "family_stage": "stabilize", "status": "crash", "decision": "crash", "payload": {"tier": "proxy", "family_name": "whitened_topk", "family_stage": "stabilize", "status": "crash", "decision": "crash", "val_fvu": null}}
{"event_id": "evt_1774146703927629703", "ts": 1774146703, "event": "round_started", "round": 31, "session_id": "019d135d-4c60-7fa3-8438-b12bc57e0720", "tier": null, "run_name": null, "family_name": null, "family_stage": null, "status": "started", "decision": null, "payload": {"status": "started"}}
{"event_id": "evt_1774146703927787371", "ts": 1774146703, "event": "agent_deciding", "round": 31, "session_id": "019d135d-4c60-7fa3-8438-b12bc57e0720", "tier": null, "run_name": null, "family_name": null, "family_stage": null, "status": null, "decision": null, "payload": {}}
{"event_id": "evt_1774146896623492876", "ts": 1774146896, "event": "session_resumed", "round": 31, "tier": null, "run_name": null, "family_name": null, "family_stage": null, "status": "active", "decision": null, "payload": {"session_id": "019d135d-4c60-7fa3-8438-b12bc57e0720"}}
{"event_id": "evt_1774146896626696838", "ts": 1774146896, "event": "agent_action_received", "round": 31, "session_id": "019d135d-4c60-7fa3-8438-b12bc57e0720", "tier": "proxy", "run_name": null, "family_name": "whitened_topk", "family_stage": "stabilize", "status": null, "decision": null, "payload": {"session_id": "019d135d-4c60-7fa3-8438-b12bc57e0720", "tier": "proxy", "family_name": "whitened_topk", "family_stage": "stabilize", "change_type": "edit_sae_code", "expected_win": "lower_fvu", "hypothesis": "Round 30 showed that the revised `whitened_topk` path still trips the runtime's behavioral-diff gate as identical to baseline, so this round should repair that blocker instead of opening another architecture or returning to exhausted lowrank-gated sweeps. By making `whitened_topk` explicitly mean-center each sample and inject a fixed cross-channel roll mix before the learned low-rank preconditioner, the family should become observably distinct from plain top-k at step 0 while preserving the same input-geometry hypothesis."}}
{"event_id": "evt_1774147027860117303", "ts": 1774147027, "event": "variable_isolation_warning", "round": 31, "session_id": "019d135d-4c60-7fa3-8438-b12bc57e0720", "tier": null, "run_name": null, "family_name": "whitened_topk", "family_stage": "stabilize", "status": null, "decision": null, "payload": {"violation": "Multiple primary variables changed simultaneously: code_edit, architecture, lr"}}
{"event_id": "evt_1774147032432147940", "ts": 1774147032, "event": "behavioral_diff_identical", "round": 31, "session_id": "019d135d-4c60-7fa3-8438-b12bc57e0720", "tier": null, "run_name": null, "family_name": "whitened_topk", "family_stage": "stabilize", "status": null, "decision": null, "payload": {"architecture": "whitened_topk", "k": 128, "expansion_factor": 32, "max_diff": 0.0}}
{"event_id": "evt_1774147032432259933", "ts": 1774147032, "event": "round_finished", "round": 31, "session_id": "019d135d-4c60-7fa3-8438-b12bc57e0720", "tier": "proxy", "run_name": null, "family_name": "whitened_topk", "family_stage": "stabilize", "status": "crash", "decision": "crash", "payload": {"tier": "proxy", "family_name": "whitened_topk", "family_stage": "stabilize", "status": "crash", "decision": "crash", "val_fvu": null}}
{"event_id": "evt_1774147040018347079", "ts": 1774147040, "event": "round_started", "round": 32, "session_id": "019d135d-4c60-7fa3-8438-b12bc57e0720", "tier": null, "run_name": null, "family_name": null, "family_stage": null, "status": "started", "decision": null, "payload": {"status": "started"}}
{"event_id": "evt_1774147040018439605", "ts": 1774147040, "event": "agent_deciding", "round": 32, "session_id": "019d135d-4c60-7fa3-8438-b12bc57e0720", "tier": null, "run_name": null, "family_name": null, "family_stage": null, "status": null, "decision": null, "payload": {}}
{"event_id": "evt_1774147167837121301", "ts": 1774147167, "event": "session_resumed", "round": 32, "tier": null, "run_name": null, "family_name": null, "family_stage": null, "status": "active", "decision": null, "payload": {"session_id": "019d135d-4c60-7fa3-8438-b12bc57e0720"}}
