{"event_id": "evt_1774162678733310828", "ts": 1774162678, "event": "training_heartbeat", "round": 52, "session_id": "019d1451-d554-79b2-8cc5-c99f2ae19f85", "tier": "proxy", "run_name": "round0052_proxy_1774162648", "family_name": "lowrank_gated_residual", "family_stage": "stabilize", "status": null, "decision": null, "payload": {"tier": "proxy", "run_name": "round0052_proxy_1774162648", "family_name": "lowrank_gated_residual", "family_stage": "stabilize", "checkpoint_dir": "/root/sparsify-ascend/checkpoints/research_agent/round_0052_proxy/round0052_proxy_1774162648_dp2_bs1_ga8_ef12_k40_20260322_145735", "metrics_path": "/root/sparsify-ascend/checkpoints/research_agent/round_0052_proxy/round0052_proxy_1774162648_dp2_bs1_ga8_ef12_k40_20260322_145735/metrics.jsonl", "latest_step": 100, "latest_tokens_per_sec": 109221.81965954321, "baseline_ratio": 1.3157893952605266, "latest_total_tokens": 3276800.0, "proxy_mode": "fast", "evaluation_basis": "terminal_only"}}
{"event_id": "evt_1774162708734760612", "ts": 1774162708, "event": "training_heartbeat", "round": 52, "session_id": "019d1451-d554-79b2-8cc5-c99f2ae19f85", "tier": "proxy", "run_name": "round0052_proxy_1774162648", "family_name": "lowrank_gated_residual", "family_stage": "stabilize", "status": null, "decision": null, "payload": {"tier": "proxy", "run_name": "round0052_proxy_1774162648", "family_name": "lowrank_gated_residual", "family_stage": "stabilize", "checkpoint_dir": "/root/sparsify-ascend/checkpoints/research_agent/round_0052_proxy/round0052_proxy_1774162648_dp2_bs1_ga8_ef12_k40_20260322_145735", "metrics_path": "/root/sparsify-ascend/checkpoints/research_agent/round_0052_proxy/round0052_proxy_1774162648_dp2_bs1_ga8_ef12_k40_20260322_145735/metrics.jsonl", "latest_step": 152, "latest_tokens_per_sec": 83008.42792057936, "baseline_ratio": 0.9999980728722728, "latest_total_tokens": 4980736.0, "proxy_mode": "fast", "evaluation_basis": "terminal_only"}}
{"event_id": "evt_1774162708800950783", "ts": 1774162708, "event": "training_finished", "round": 52, "session_id": "019d1451-d554-79b2-8cc5-c99f2ae19f85", "tier": "proxy", "run_name": "round0052_proxy_1774162648", "family_name": "lowrank_gated_residual", "family_stage": "stabilize", "status": "ok", "decision": "discard", "payload": {"tier": "proxy", "run_name": "round0052_proxy_1774162648", "family_name": "lowrank_gated_residual", "family_stage": "stabilize", "checkpoint_dir": "/root/sparsify-ascend/checkpoints/research_agent/round_0052_proxy/round0052_proxy_1774162648_dp2_bs1_ga8_ef12_k40_20260322_145735", "metrics_path": "/root/sparsify-ascend/checkpoints/research_agent/round_0052_proxy/round0052_proxy_1774162648_dp2_bs1_ga8_ef12_k40_20260322_145735/metrics.jsonl", "run_health": "normal", "termination_reason": "completed", "tokens_per_sec": 83008.42792057936, "baseline_ratio": 0.9999980728722728, "status": "ok", "decision": "discard", "proxy_mode": "fast", "evaluation_basis": "terminal_only", "curve_start_fvu": 0.340650737285614, "curve_mid_fvu": 0.22022312879562378, "curve_end_fvu": 0.17405004799365997, "curve_late_slope": -6.931068421709501e-09, "curve_still_improving": true}}
{"event_id": "evt_1774162708801004808", "ts": 1774162708, "event": "result_recorded", "round": 52, "session_id": "019d1451-d554-79b2-8cc5-c99f2ae19f85", "tier": "proxy", "run_name": "round0052_proxy_1774162648", "family_name": "lowrank_gated_residual", "family_stage": "stabilize", "status": "ok", "decision": "discard", "payload": {"tier": "proxy", "run_name": "round0052_proxy_1774162648", "family_name": "lowrank_gated_residual", "family_stage": "stabilize", "status": "ok", "decision": "discard", "val_fvu": "0.17474958300590515", "observed_fvu": "0.174050", "k": "40", "log_path": "/root/sparsify-ascend/research/history/logs/proxy_1774162708.log", "checkpoint": null}}
{"event_id": "evt_1774162708801139303", "ts": 1774162708, "event": "round_finished", "round": 52, "session_id": "019d1451-d554-79b2-8cc5-c99f2ae19f85", "tier": "proxy", "run_name": null, "family_name": "lowrank_gated_residual", "family_stage": "stabilize", "status": "ok", "decision": "discard", "payload": {"tier": "proxy", "family_name": "lowrank_gated_residual", "family_stage": "stabilize", "status": "ok", "decision": "discard", "val_fvu": "0.17474958300590515"}}
{"event_id": "evt_1774162708809205405", "ts": 1774162708, "event": "experiment_commit_prepared", "round": 52, "tier": "proxy", "run_name": null, "family_name": "lowrank_gated_residual", "family_stage": "stabilize", "status": "ok", "decision": "discard", "payload": {"branch": "autoresearch-sae"}}
{"event_id": "evt_1774162717193939872", "ts": 1774162717, "event": "round_started", "round": 53, "session_id": "019d1451-d554-79b2-8cc5-c99f2ae19f85", "tier": null, "run_name": null, "family_name": null, "family_stage": null, "status": "started", "decision": null, "payload": {"status": "started"}}
{"event_id": "evt_1774162717280382214", "ts": 1774162717, "event": "agent_deciding", "round": 53, "session_id": "019d1451-d554-79b2-8cc5-c99f2ae19f85", "tier": null, "run_name": null, "family_name": null, "family_stage": null, "status": null, "decision": null, "payload": {}}
{"event_id": "evt_1774162844959434278", "ts": 1774162844, "event": "session_resumed", "round": 53, "tier": null, "run_name": null, "family_name": null, "family_stage": null, "status": "active", "decision": null, "payload": {"session_id": "019d1451-d554-79b2-8cc5-c99f2ae19f85"}}
{"event_id": "evt_1774162844965624250", "ts": 1774162844, "event": "agent_action_received", "round": 53, "session_id": "019d1451-d554-79b2-8cc5-c99f2ae19f85", "tier": "proxy", "run_name": null, "family_name": "batch_topk", "family_stage": "mainline_comparison", "status": null, "decision": null, "payload": {"session_id": "019d1451-d554-79b2-8cc5-c99f2ae19f85", "tier": "proxy", "family_name": "batch_topk", "family_stage": "mainline_comparison", "change_type": "param_only", "expected_win": "lower_fvu", "hypothesis": "The current `lowrank_gated_residual` small-EF track looks exhausted at the lower-K anchor, so the next informative move is a fundamentally different sparsity mechanism rather than another local tweak. `batch_topk` is the strongest existing non-residual challenger and may preserve more quality at `K=40` by allocating support globally across the batch instead of enforcing rigid per-sample selection."}}
{"event_id": "evt_1774162844965754555", "ts": 1774162844, "event": "variable_isolation_warning", "round": 53, "session_id": "019d1451-d554-79b2-8cc5-c99f2ae19f85", "tier": null, "run_name": null, "family_name": "batch_topk", "family_stage": "mainline_comparison", "status": null, "decision": null, "payload": {"violation": "Multiple primary variables changed simultaneously: architecture, k, lr"}}
{"event_id": "evt_1774162844965810787", "ts": 1774162844, "event": "proxy_mode_selected", "round": 53, "session_id": "019d1451-d554-79b2-8cc5-c99f2ae19f85", "tier": "proxy", "run_name": null, "family_name": "batch_topk", "family_stage": "mainline_comparison", "status": null, "decision": null, "payload": {"tier": "proxy", "proxy_mode": "fast", "evaluation_basis": "terminal_only", "parameter_behavior": "structural", "proxy_max_tokens": "5000000"}}
{"event_id": "evt_1774162844966074689", "ts": 1774162844, "event": "training_started", "round": 53, "session_id": "019d1451-d554-79b2-8cc5-c99f2ae19f85", "tier": "proxy", "run_name": "round0053_proxy_1774162844", "family_name": "batch_topk", "family_stage": "mainline_comparison", "status": null, "decision": null, "payload": {"tier": "proxy", "run_name": "round0053_proxy_1774162844", "family_name": "batch_topk", "family_stage": "mainline_comparison", "checkpoint_dir": "/root/sparsify-ascend/checkpoints/research_agent/round_0053_proxy", "log_path": "/root/sparsify-ascend/research/history/logs/round0053_proxy_1774162844.log", "config": {"architecture": "batch_topk", "expansion_factor": 8, "k": 40, "optimizer": "signum", "lr": "1.6e-3", "hookpoints": "layers.[3].self_attn.o_proj", "batch_size": 1, "grad_acc_steps": 8, "micro_acc_steps": 1, "auxk_alpha": 0.0, "dead_feature_threshold": 10000000, "use_hadamard": false, "tier": "proxy", "family_name": "batch_topk", "family_stage": "mainline_comparison"}, "baseline_tokens_per_sec": 66610.5627596382, "proxy_mode": "fast", "evaluation_basis": "terminal_only"}}
{"event_id": "evt_1774162874968000998", "ts": 1774162874, "event": "training_heartbeat", "round": 53, "session_id": "019d1451-d554-79b2-8cc5-c99f2ae19f85", "tier": "proxy", "run_name": "round0053_proxy_1774162844", "family_name": "batch_topk", "family_stage": "mainline_comparison", "status": null, "decision": null, "payload": {"tier": "proxy", "run_name": "round0053_proxy_1774162844", "family_name": "batch_topk", "family_stage": "mainline_comparison", "checkpoint_dir": "/root/sparsify-ascend/checkpoints/research_agent/round_0053_proxy/round0053_proxy_1774162844_dp2_bs1_ga8_ef8_k40_20260322_150051", "metrics_path": "/root/sparsify-ascend/checkpoints/research_agent/round_0053_proxy/round0053_proxy_1774162844_dp2_bs1_ga8_ef8_k40_20260322_150051/metrics.jsonl", "latest_step": 150, "latest_tokens_per_sec": 163831.22442839426, "baseline_ratio": 2.4595382119735767, "latest_total_tokens": 4915200.0, "proxy_mode": "fast", "evaluation_basis": "terminal_only"}}
{"event_id": "evt_1774162904969417652", "ts": 1774162904, "event": "training_heartbeat", "round": 53, "session_id": "019d1451-d554-79b2-8cc5-c99f2ae19f85", "tier": "proxy", "run_name": "round0053_proxy_1774162844", "family_name": "batch_topk", "family_stage": "mainline_comparison", "status": null, "decision": null, "payload": {"tier": "proxy", "run_name": "round0053_proxy_1774162844", "family_name": "batch_topk", "family_stage": "mainline_comparison", "checkpoint_dir": "/root/sparsify-ascend/checkpoints/research_agent/round_0053_proxy/round0053_proxy_1774162844_dp2_bs1_ga8_ef8_k40_20260322_150051", "metrics_path": "/root/sparsify-ascend/checkpoints/research_agent/round_0053_proxy/round0053_proxy_1774162844_dp2_bs1_ga8_ef8_k40_20260322_150051/metrics.jsonl", "latest_step": 152, "latest_tokens_per_sec": 83008.08984558696, "baseline_ratio": 1.246170072832422, "latest_total_tokens": 4980736.0, "proxy_mode": "fast", "evaluation_basis": "terminal_only"}}
{"event_id": "evt_1774162905035494064", "ts": 1774162905, "event": "training_finished", "round": 53, "session_id": "019d1451-d554-79b2-8cc5-c99f2ae19f85", "tier": "proxy", "run_name": "round0053_proxy_1774162844", "family_name": "batch_topk", "family_stage": "mainline_comparison", "status": "ok", "decision": "incubate", "payload": {"tier": "proxy", "run_name": "round0053_proxy_1774162844", "family_name": "batch_topk", "family_stage": "mainline_comparison", "checkpoint_dir": "/root/sparsify-ascend/checkpoints/research_agent/round_0053_proxy/round0053_proxy_1774162844_dp2_bs1_ga8_ef8_k40_20260322_150051", "metrics_path": "/root/sparsify-ascend/checkpoints/research_agent/round_0053_proxy/round0053_proxy_1774162844_dp2_bs1_ga8_ef8_k40_20260322_150051/metrics.jsonl", "run_health": "normal", "termination_reason": "completed", "tokens_per_sec": 83008.08984558696, "baseline_ratio": 1.246170072832422, "status": "ok", "decision": "incubate", "proxy_mode": "fast", "evaluation_basis": "terminal_only", "curve_start_fvu": 0.6180198192596436, "curve_mid_fvu": 0.4721097946166992, "curve_end_fvu": 0.4049052596092224, "curve_late_slope": -1.0623308856250538e-08, "curve_still_improving": true}}
{"event_id": "evt_1774162905035547174", "ts": 1774162905, "event": "result_recorded", "round": 53, "session_id": "019d1451-d554-79b2-8cc5-c99f2ae19f85", "tier": "proxy", "run_name": "round0053_proxy_1774162844", "family_name": "batch_topk", "family_stage": "mainline_comparison", "status": "ok", "decision": "incubate", "payload": {"tier": "proxy", "run_name": "round0053_proxy_1774162844", "family_name": "batch_topk", "family_stage": "mainline_comparison", "status": "ok", "decision": "incubate", "val_fvu": "0.405234944075346", "observed_fvu": "0.404905", "k": "40", "log_path": "/root/sparsify-ascend/research/history/logs/proxy_1774162905.log", "checkpoint": null}}
{"event_id": "evt_1774162905035695772", "ts": 1774162905, "event": "round_finished", "round": 53, "session_id": "019d1451-d554-79b2-8cc5-c99f2ae19f85", "tier": "proxy", "run_name": null, "family_name": "batch_topk", "family_stage": "mainline_comparison", "status": "ok", "decision": "incubate", "payload": {"tier": "proxy", "family_name": "batch_topk", "family_stage": "mainline_comparison", "status": "ok", "decision": "incubate", "val_fvu": "0.405234944075346"}}
{"event_id": "evt_1774162905043928737", "ts": 1774162905, "event": "experiment_commit_prepared", "round": 53, "tier": "proxy", "run_name": null, "family_name": "batch_topk", "family_stage": "mainline_comparison", "status": "ok", "decision": "incubate", "payload": {"branch": "autoresearch-sae"}}
{"event_id": "evt_1774162912897912091", "ts": 1774162912, "event": "round_started", "round": 54, "session_id": "019d1451-d554-79b2-8cc5-c99f2ae19f85", "tier": null, "run_name": null, "family_name": null, "family_stage": null, "status": "started", "decision": null, "payload": {"status": "started"}}
{"event_id": "evt_1774162912898068589", "ts": 1774162912, "event": "agent_deciding", "round": 54, "session_id": "019d1451-d554-79b2-8cc5-c99f2ae19f85", "tier": null, "run_name": null, "family_name": null, "family_stage": null, "status": null, "decision": null, "payload": {}}
{"event_id": "evt_1774163038713025222", "ts": 1774163038, "event": "session_resumed", "round": 54, "tier": null, "run_name": null, "family_name": null, "family_stage": null, "status": "active", "decision": null, "payload": {"session_id": "019d1451-d554-79b2-8cc5-c99f2ae19f85"}}
{"event_id": "evt_1774163038718415273", "ts": 1774163038, "event": "agent_action_received", "round": 54, "session_id": "019d1451-d554-79b2-8cc5-c99f2ae19f85", "tier": "proxy", "run_name": null, "family_name": "adaptive_budget_topk", "family_stage": "mainline_comparison", "status": null, "decision": null, "payload": {"session_id": "019d1451-d554-79b2-8cc5-c99f2ae19f85", "tier": "proxy", "family_name": "adaptive_budget_topk", "family_stage": "mainline_comparison", "change_type": "param_only", "expected_win": "lower_fvu", "hypothesis": "The failure of both `lowrank_gated_residual` and `batch_topk` at the current lower-K small-EF target suggests the bottleneck may be rigid support allocation rather than just encoder form. `adaptive_budget_topk` is the next fundamentally different mechanism to test at `K=40`, `EF=8`, because it relaxes fixed per-sample allocation while staying in the same fair-capacity comparison band."}}
{"event_id": "evt_1774163038718527729", "ts": 1774163038, "event": "variable_isolation_warning", "round": 54, "session_id": "019d1451-d554-79b2-8cc5-c99f2ae19f85", "tier": null, "run_name": null, "family_name": "adaptive_budget_topk", "family_stage": "mainline_comparison", "status": null, "decision": null, "payload": {"violation": "Multiple primary variables changed simultaneously: architecture, k, lr"}}
{"event_id": "evt_1774163038718585042", "ts": 1774163038, "event": "proxy_mode_selected", "round": 54, "session_id": "019d1451-d554-79b2-8cc5-c99f2ae19f85", "tier": "proxy", "run_name": null, "family_name": "adaptive_budget_topk", "family_stage": "mainline_comparison", "status": null, "decision": null, "payload": {"tier": "proxy", "proxy_mode": "fast", "evaluation_basis": "terminal_only", "parameter_behavior": "structural", "proxy_max_tokens": "5000000"}}
{"event_id": "evt_1774163038718852740", "ts": 1774163038, "event": "training_started", "round": 54, "session_id": "019d1451-d554-79b2-8cc5-c99f2ae19f85", "tier": "proxy", "run_name": "round0054_proxy_1774163038", "family_name": "adaptive_budget_topk", "family_stage": "mainline_comparison", "status": null, "decision": null, "payload": {"tier": "proxy", "run_name": "round0054_proxy_1774163038", "family_name": "adaptive_budget_topk", "family_stage": "mainline_comparison", "checkpoint_dir": "/root/sparsify-ascend/checkpoints/research_agent/round_0054_proxy", "log_path": "/root/sparsify-ascend/research/history/logs/round0054_proxy_1774163038.log", "config": {"architecture": "adaptive_budget_topk", "expansion_factor": 8, "k": 40, "optimizer": "signum", "lr": "1.6e-3", "hookpoints": "layers.[3].self_attn.o_proj", "batch_size": 1, "grad_acc_steps": 8, "micro_acc_steps": 1, "auxk_alpha": 0.0, "dead_feature_threshold": 10000000, "use_hadamard": false, "tier": "proxy", "family_name": "adaptive_budget_topk", "family_stage": "mainline_comparison"}, "baseline_tokens_per_sec": 33300.345311366844, "proxy_mode": "fast", "evaluation_basis": "terminal_only"}}
{"event_id": "evt_1774163068720135719", "ts": 1774163068, "event": "training_heartbeat", "round": 54, "session_id": "019d1451-d554-79b2-8cc5-c99f2ae19f85", "tier": "proxy", "run_name": "round0054_proxy_1774163038", "family_name": "adaptive_budget_topk", "family_stage": "mainline_comparison", "status": null, "decision": null, "payload": {"tier": "proxy", "run_name": "round0054_proxy_1774163038", "family_name": "adaptive_budget_topk", "family_stage": "mainline_comparison", "checkpoint_dir": "/root/sparsify-ascend/checkpoints/research_agent/round_0054_proxy/round0054_proxy_1774163038_dp2_bs1_ga8_ef8_k40_20260322_150405", "metrics_path": "/root/sparsify-ascend/checkpoints/research_agent/round_0054_proxy/round0054_proxy_1774163038_dp2_bs1_ga8_ef8_k40_20260322_150405/metrics.jsonl", "latest_step": 20, "latest_tokens_per_sec": 21844.7073096072, "baseline_ratio": 0.6559904140738944, "latest_total_tokens": 655360.0, "proxy_mode": "fast", "evaluation_basis": "terminal_only"}}
{"event_id": "evt_1774163098721072488", "ts": 1774163098, "event": "training_heartbeat", "round": 54, "session_id": "019d1451-d554-79b2-8cc5-c99f2ae19f85", "tier": "proxy", "run_name": "round0054_proxy_1774163038", "family_name": "adaptive_budget_topk", "family_stage": "mainline_comparison", "status": null, "decision": null, "payload": {"tier": "proxy", "run_name": "round0054_proxy_1774163038", "family_name": "adaptive_budget_topk", "family_stage": "mainline_comparison", "checkpoint_dir": "/root/sparsify-ascend/checkpoints/research_agent/round_0054_proxy/round0054_proxy_1774163038_dp2_bs1_ga8_ef8_k40_20260322_150405", "metrics_path": "/root/sparsify-ascend/checkpoints/research_agent/round_0054_proxy/round0054_proxy_1774163038_dp2_bs1_ga8_ef8_k40_20260322_150405/metrics.jsonl", "latest_step": 70, "latest_tokens_per_sec": 38228.19662668165, "baseline_ratio": 1.1479819884520153, "latest_total_tokens": 2293760.0, "proxy_mode": "fast", "evaluation_basis": "terminal_only"}}
{"event_id": "evt_1774163128722258608", "ts": 1774163128, "event": "training_heartbeat", "round": 54, "session_id": "019d1451-d554-79b2-8cc5-c99f2ae19f85", "tier": "proxy", "run_name": "round0054_proxy_1774163038", "family_name": "adaptive_budget_topk", "family_stage": "mainline_comparison", "status": null, "decision": null, "payload": {"tier": "proxy", "run_name": "round0054_proxy_1774163038", "family_name": "adaptive_budget_topk", "family_stage": "mainline_comparison", "checkpoint_dir": "/root/sparsify-ascend/checkpoints/research_agent/round_0054_proxy/round0054_proxy_1774163038_dp2_bs1_ga8_ef8_k40_20260322_150405", "metrics_path": "/root/sparsify-ascend/checkpoints/research_agent/round_0054_proxy/round0054_proxy_1774163038_dp2_bs1_ga8_ef8_k40_20260322_150405/metrics.jsonl", "latest_step": 120, "latest_tokens_per_sec": 43689.21775638503, "baseline_ratio": 1.3119749164124137, "latest_total_tokens": 3932160.0, "proxy_mode": "fast", "evaluation_basis": "terminal_only"}}
{"event_id": "evt_1774163158756816391", "ts": 1774163158, "event": "training_heartbeat", "round": 54, "session_id": "019d1451-d554-79b2-8cc5-c99f2ae19f85", "tier": "proxy", "run_name": "round0054_proxy_1774163038", "family_name": "adaptive_budget_topk", "family_stage": "mainline_comparison", "status": null, "decision": null, "payload": {"tier": "proxy", "run_name": "round0054_proxy_1774163038", "family_name": "adaptive_budget_topk", "family_stage": "mainline_comparison", "checkpoint_dir": "/root/sparsify-ascend/checkpoints/research_agent/round_0054_proxy/round0054_proxy_1774163038_dp2_bs1_ga8_ef8_k40_20260322_150405", "metrics_path": "/root/sparsify-ascend/checkpoints/research_agent/round_0054_proxy/round0054_proxy_1774163038_dp2_bs1_ga8_ef8_k40_20260322_150405/metrics.jsonl", "latest_step": 152, "latest_tokens_per_sec": 41504.621057705925, "baseline_ratio": 1.2463720922298847, "latest_total_tokens": 4980736.0, "proxy_mode": "fast", "evaluation_basis": "terminal_only"}}
{"event_id": "evt_1774163159056898518", "ts": 1774163159, "event": "training_finished", "round": 54, "session_id": "019d1451-d554-79b2-8cc5-c99f2ae19f85", "tier": "proxy", "run_name": "round0054_proxy_1774163038", "family_name": "adaptive_budget_topk", "family_stage": "mainline_comparison", "status": "ok", "decision": "incubate", "payload": {"tier": "proxy", "run_name": "round0054_proxy_1774163038", "family_name": "adaptive_budget_topk", "family_stage": "mainline_comparison", "checkpoint_dir": "/root/sparsify-ascend/checkpoints/research_agent/round_0054_proxy/round0054_proxy_1774163038_dp2_bs1_ga8_ef8_k40_20260322_150405", "metrics_path": "/root/sparsify-ascend/checkpoints/research_agent/round_0054_proxy/round0054_proxy_1774163038_dp2_bs1_ga8_ef8_k40_20260322_150405/metrics.jsonl", "run_health": "normal", "termination_reason": "completed", "tokens_per_sec": 41504.621057705925, "baseline_ratio": 1.2463720922298847, "status": "ok", "decision": "incubate", "proxy_mode": "fast", "evaluation_basis": "terminal_only", "curve_start_fvu": 0.5467408299446106, "curve_mid_fvu": 0.4480452537536621, "curve_end_fvu": 0.42320120334625244, "curve_late_slope": 4.4374539884888835e-10, "curve_still_improving": false}}
