{"event_id": "evt_1774156062770211083", "ts": 1774156062, "event": "training_heartbeat", "round": 44, "session_id": "019d13dc-400c-7493-83af-bd34fffa7466", "tier": "full", "run_name": "round0044_full_1774155612", "family_name": "lowrank_gated_residual", "family_stage": "mainline", "status": null, "decision": null, "payload": {"tier": "full", "run_name": "round0044_full_1774155612", "family_name": "lowrank_gated_residual", "family_stage": "mainline", "checkpoint_dir": "/root/sparsify-ascend/checkpoints/research_agent/round_0044_full/round0044_full_1774155612_dp2_bs1_ga8_ef32_k72_20260322_130020", "metrics_path": "/root/sparsify-ascend/checkpoints/research_agent/round_0044_full/round0044_full_1774155612_dp2_bs1_ga8_ef32_k72_20260322_130020/metrics.jsonl", "latest_step": 1210, "latest_tokens_per_sec": 88079.37155755503, "baseline_ratio": 0.9930522578772152, "latest_total_tokens": 39649280.0, "proxy_mode": null, "evaluation_basis": null}}
{"event_id": "evt_1774156092979044639", "ts": 1774156092, "event": "training_heartbeat", "round": 44, "session_id": "019d13dc-400c-7493-83af-bd34fffa7466", "tier": "full", "run_name": "round0044_full_1774155612", "family_name": "lowrank_gated_residual", "family_stage": "mainline", "status": null, "decision": null, "payload": {"tier": "full", "run_name": "round0044_full_1774155612", "family_name": "lowrank_gated_residual", "family_stage": "mainline", "checkpoint_dir": "/root/sparsify-ascend/checkpoints/research_agent/round_0044_full/round0044_full_1774155612_dp2_bs1_ga8_ef32_k72_20260322_130020", "metrics_path": "/root/sparsify-ascend/checkpoints/research_agent/round_0044_full/round0044_full_1774155612_dp2_bs1_ga8_ef32_k72_20260322_130020/metrics.jsonl", "latest_step": 1220, "latest_tokens_per_sec": 83257.33055696487, "baseline_ratio": 0.9386860808878219, "latest_total_tokens": 39976960.0, "proxy_mode": null, "evaluation_basis": null}}
{"event_id": "evt_1774156122986578084", "ts": 1774156122, "event": "training_heartbeat", "round": 44, "session_id": "019d13dc-400c-7493-83af-bd34fffa7466", "tier": "full", "run_name": "round0044_full_1774155612", "family_name": "lowrank_gated_residual", "family_stage": "mainline", "status": null, "decision": null, "payload": {"tier": "full", "run_name": "round0044_full_1774155612", "family_name": "lowrank_gated_residual", "family_stage": "mainline", "checkpoint_dir": "/root/sparsify-ascend/checkpoints/research_agent/round_0044_full/round0044_full_1774155612_dp2_bs1_ga8_ef32_k72_20260322_130020", "metrics_path": "/root/sparsify-ascend/checkpoints/research_agent/round_0044_full/round0044_full_1774155612_dp2_bs1_ga8_ef32_k72_20260322_130020/metrics.jsonl", "latest_step": 1220, "latest_tokens_per_sec": 78329.31658106676, "baseline_ratio": 0.8831251099240557, "latest_total_tokens": 39976960.0, "proxy_mode": null, "evaluation_basis": null}}
{"event_id": "evt_1774156123064016910", "ts": 1774156123, "event": "training_finished", "round": 44, "session_id": "019d13dc-400c-7493-83af-bd34fffa7466", "tier": "full", "run_name": "round0044_full_1774155612", "family_name": "lowrank_gated_residual", "family_stage": "mainline", "status": "ok", "decision": "keep", "payload": {"tier": "full", "run_name": "round0044_full_1774155612", "family_name": "lowrank_gated_residual", "family_stage": "mainline", "checkpoint_dir": "/root/sparsify-ascend/checkpoints/research_agent/round_0044_full/round0044_full_1774155612_dp2_bs1_ga8_ef32_k72_20260322_130020", "metrics_path": "/root/sparsify-ascend/checkpoints/research_agent/round_0044_full/round0044_full_1774155612_dp2_bs1_ga8_ef32_k72_20260322_130020/metrics.jsonl", "run_health": "normal", "termination_reason": "completed", "tokens_per_sec": 78329.31658106676, "baseline_ratio": 0.8831251099240557, "status": "ok", "decision": "keep", "proxy_mode": null, "evaluation_basis": null, "curve_start_fvu": 0.11351317912340164, "curve_mid_fvu": 0.09661009907722473, "curve_end_fvu": 0.07740581035614014, "curve_late_slope": -1.2716636923809735e-09, "curve_still_improving": true}}
{"event_id": "evt_1774156123064075211", "ts": 1774156123, "event": "result_recorded", "round": 44, "session_id": "019d13dc-400c-7493-83af-bd34fffa7466", "tier": "full", "run_name": "round0044_full_1774155612", "family_name": "lowrank_gated_residual", "family_stage": "mainline", "status": "ok", "decision": "keep", "payload": {"tier": "full", "run_name": "round0044_full_1774155612", "family_name": "lowrank_gated_residual", "family_stage": "mainline", "status": "ok", "decision": "keep", "val_fvu": "0.07883415557444096", "observed_fvu": "0.077406", "k": "72", "log_path": "/root/sparsify-ascend/research/history/logs/full_1774156123.log", "checkpoint": null}}
{"event_id": "evt_1774156123064471845", "ts": 1774156123, "event": "round_finished", "round": 44, "session_id": "019d13dc-400c-7493-83af-bd34fffa7466", "tier": "full", "run_name": null, "family_name": "lowrank_gated_residual", "family_stage": "mainline", "status": "ok", "decision": "keep", "payload": {"tier": "full", "family_name": "lowrank_gated_residual", "family_stage": "mainline", "status": "ok", "decision": "keep", "val_fvu": "0.07883415557444096"}}
{"event_id": "evt_1774156123071778092", "ts": 1774156123, "event": "experiment_commit_prepared", "round": 44, "tier": "full", "run_name": null, "family_name": "lowrank_gated_residual", "family_stage": "mainline", "status": "ok", "decision": "keep", "payload": {"branch": "autoresearch-sae"}}
{"event_id": "evt_1774156130722842922", "ts": 1774156130, "event": "round_started", "round": 45, "session_id": "019d13dc-400c-7493-83af-bd34fffa7466", "tier": null, "run_name": null, "family_name": null, "family_stage": null, "status": "started", "decision": null, "payload": {"status": "started"}}
{"event_id": "evt_1774156130722998997", "ts": 1774156130, "event": "agent_deciding", "round": 45, "session_id": "019d13dc-400c-7493-83af-bd34fffa7466", "tier": null, "run_name": null, "family_name": null, "family_stage": null, "status": null, "decision": null, "payload": {}}
{"event_id": "evt_1774156254621151946", "ts": 1774156254, "event": "session_resumed", "round": 45, "tier": null, "run_name": null, "family_name": null, "family_stage": null, "status": "active", "decision": null, "payload": {"session_id": "019d13dc-400c-7493-83af-bd34fffa7466"}}
{"event_id": "evt_1774156254622892852", "ts": 1774156254, "event": "agent_action_received", "round": 45, "session_id": "019d13dc-400c-7493-83af-bd34fffa7466", "tier": "proxy", "run_name": null, "family_name": "lowrank_gated_residual", "family_stage": "mainline", "status": null, "decision": null, "payload": {"session_id": "019d13dc-400c-7493-83af-bd34fffa7466", "tier": "proxy", "family_name": "lowrank_gated_residual", "family_stage": "mainline", "change_type": "param_only", "expected_win": "smaller_k", "hypothesis": "`lowrank_gated_residual` still yields valid non-dominated frontier points as K decreases, but the new `K=72` full result is now nearing the `K=64` quality regime. The most informative K-first follow-up is a lower boundary probe at `K=56` on the unchanged recipe, which tests whether the family can still produce a worthwhile smaller-K tradeoff below the current `K=64` point before switching effort back to architecture exploration."}}
{"event_id": "evt_1774156254623027771", "ts": 1774156254, "event": "proxy_mode_selected", "round": 45, "session_id": "019d13dc-400c-7493-83af-bd34fffa7466", "tier": "proxy", "run_name": null, "family_name": "lowrank_gated_residual", "family_stage": "mainline", "status": null, "decision": null, "payload": {"tier": "proxy", "proxy_mode": "fast", "evaluation_basis": "terminal_only", "parameter_behavior": "structural", "proxy_max_tokens": "5000000"}}
{"event_id": "evt_1774156254623337078", "ts": 1774156254, "event": "training_started", "round": 45, "session_id": "019d13dc-400c-7493-83af-bd34fffa7466", "tier": "proxy", "run_name": "round0045_proxy_1774156254", "family_name": "lowrank_gated_residual", "family_stage": "mainline", "status": null, "decision": null, "payload": {"tier": "proxy", "run_name": "round0045_proxy_1774156254", "family_name": "lowrank_gated_residual", "family_stage": "mainline", "checkpoint_dir": "/root/sparsify-ascend/checkpoints/research_agent/round_0045_proxy", "log_path": "/root/sparsify-ascend/research/history/logs/round0045_proxy_1774156254.log", "config": {"architecture": "lowrank_gated_residual", "expansion_factor": 32, "k": 56, "optimizer": "signum", "lr": "1.6e-3", "hookpoints": "layers.[3].self_attn.o_proj", "batch_size": 1, "grad_acc_steps": 8, "micro_acc_steps": 1, "auxk_alpha": 0.0, "dead_feature_threshold": 10000000, "use_hadamard": false, "tier": "proxy", "family_name": "lowrank_gated_residual", "family_stage": "mainline"}, "baseline_tokens_per_sec": 83008.58788873068, "proxy_mode": "fast", "evaluation_basis": "terminal_only"}}
{"event_id": "evt_1774156284624708917", "ts": 1774156284, "event": "training_heartbeat", "round": 45, "session_id": "019d13dc-400c-7493-83af-bd34fffa7466", "tier": "proxy", "run_name": "round0045_proxy_1774156254", "family_name": "lowrank_gated_residual", "family_stage": "mainline", "status": null, "decision": null, "payload": {"tier": "proxy", "run_name": "round0045_proxy_1774156254", "family_name": "lowrank_gated_residual", "family_stage": "mainline", "checkpoint_dir": "/root/sparsify-ascend/checkpoints/research_agent/round_0045_proxy/round0045_proxy_1774156254_dp2_bs1_ga8_ef32_k56_20260322_131103", "metrics_path": "/root/sparsify-ascend/checkpoints/research_agent/round_0045_proxy/round0045_proxy_1774156254_dp2_bs1_ga8_ef32_k56_20260322_131103/metrics.jsonl", "latest_step": 40, "latest_tokens_per_sec": 43689.214978791664, "baseline_ratio": 0.5263216263521446, "latest_total_tokens": 1310720.0, "proxy_mode": "fast", "evaluation_basis": "terminal_only"}}
{"event_id": "evt_1774156314625979907", "ts": 1774156314, "event": "training_heartbeat", "round": 45, "session_id": "019d13dc-400c-7493-83af-bd34fffa7466", "tier": "proxy", "run_name": "round0045_proxy_1774156254", "family_name": "lowrank_gated_residual", "family_stage": "mainline", "status": null, "decision": null, "payload": {"tier": "proxy", "run_name": "round0045_proxy_1774156254", "family_name": "lowrank_gated_residual", "family_stage": "mainline", "checkpoint_dir": "/root/sparsify-ascend/checkpoints/research_agent/round_0045_proxy/round0045_proxy_1774156254_dp2_bs1_ga8_ef32_k56_20260322_131103", "metrics_path": "/root/sparsify-ascend/checkpoints/research_agent/round_0045_proxy/round0045_proxy_1774156254_dp2_bs1_ga8_ef32_k56_20260322_131103/metrics.jsonl", "latest_step": 130, "latest_tokens_per_sec": 70994.63271991798, "baseline_ratio": 0.8552685273369923, "latest_total_tokens": 4259840.0, "proxy_mode": "fast", "evaluation_basis": "terminal_only"}}
{"event_id": "evt_1774156344662273499", "ts": 1774156344, "event": "training_heartbeat", "round": 45, "session_id": "019d13dc-400c-7493-83af-bd34fffa7466", "tier": "proxy", "run_name": "round0045_proxy_1774156254", "family_name": "lowrank_gated_residual", "family_stage": "mainline", "status": null, "decision": null, "payload": {"tier": "proxy", "run_name": "round0045_proxy_1774156254", "family_name": "lowrank_gated_residual", "family_stage": "mainline", "checkpoint_dir": "/root/sparsify-ascend/checkpoints/research_agent/round_0045_proxy/round0045_proxy_1774156254_dp2_bs1_ga8_ef32_k56_20260322_131103", "metrics_path": "/root/sparsify-ascend/checkpoints/research_agent/round_0045_proxy/round0045_proxy_1774156254_dp2_bs1_ga8_ef32_k56_20260322_131103/metrics.jsonl", "latest_step": 152, "latest_tokens_per_sec": 55339.22284924864, "baseline_ratio": 0.6666686454590507, "latest_total_tokens": 4980736.0, "proxy_mode": "fast", "evaluation_basis": "terminal_only"}}
{"event_id": "evt_1774156345590987220", "ts": 1774156345, "event": "training_finished", "round": 45, "session_id": "019d13dc-400c-7493-83af-bd34fffa7466", "tier": "proxy", "run_name": "round0045_proxy_1774156254", "family_name": "lowrank_gated_residual", "family_stage": "mainline", "status": "ok", "decision": "promote", "payload": {"tier": "proxy", "run_name": "round0045_proxy_1774156254", "family_name": "lowrank_gated_residual", "family_stage": "mainline", "checkpoint_dir": "/root/sparsify-ascend/checkpoints/research_agent/round_0045_proxy/round0045_proxy_1774156254_dp2_bs1_ga8_ef32_k56_20260322_131103", "metrics_path": "/root/sparsify-ascend/checkpoints/research_agent/round_0045_proxy/round0045_proxy_1774156254_dp2_bs1_ga8_ef32_k56_20260322_131103/metrics.jsonl", "run_health": "normal", "termination_reason": "completed", "tokens_per_sec": 55339.22284924864, "baseline_ratio": 0.6666686454590507, "status": "ok", "decision": "promote", "proxy_mode": "fast", "evaluation_basis": "terminal_only", "curve_start_fvu": 0.3067828416824341, "curve_mid_fvu": 0.19956934452056885, "curve_end_fvu": 0.15733912587165833, "curve_late_slope": -6.465216433899778e-09, "curve_still_improving": true}}
{"event_id": "evt_1774156345591097896", "ts": 1774156345, "event": "result_recorded", "round": 45, "session_id": "019d13dc-400c-7493-83af-bd34fffa7466", "tier": "proxy", "run_name": "round0045_proxy_1774156254", "family_name": "lowrank_gated_residual", "family_stage": "mainline", "status": "ok", "decision": "promote", "payload": {"tier": "proxy", "run_name": "round0045_proxy_1774156254", "family_name": "lowrank_gated_residual", "family_stage": "mainline", "status": "ok", "decision": "promote", "val_fvu": "0.15835736505687237", "observed_fvu": "0.157339", "k": "56", "log_path": "/root/sparsify-ascend/research/history/logs/proxy_1774156345.log", "checkpoint": null}}
{"event_id": "evt_1774156345591535582", "ts": 1774156345, "event": "training_started", "round": 45, "session_id": "019d13dc-400c-7493-83af-bd34fffa7466", "tier": "full", "run_name": "round0045_full_1774156345", "family_name": "lowrank_gated_residual", "family_stage": "mainline", "status": null, "decision": null, "payload": {"tier": "full", "run_name": "round0045_full_1774156345", "family_name": "lowrank_gated_residual", "family_stage": "mainline", "checkpoint_dir": "/root/sparsify-ascend/checkpoints/research_agent/round_0045_full", "log_path": "/root/sparsify-ascend/research/history/logs/round0045_full_1774156345.log", "config": {"architecture": "lowrank_gated_residual", "expansion_factor": 32, "k": 56, "optimizer": "signum", "lr": "1.6e-3", "hookpoints": "layers.[3].self_attn.o_proj", "batch_size": 1, "grad_acc_steps": 8, "micro_acc_steps": 1, "auxk_alpha": 0.0, "dead_feature_threshold": 10000000, "use_hadamard": false, "tier": "full", "family_name": "lowrank_gated_residual", "family_stage": "mainline"}, "baseline_tokens_per_sec": 88695.60575375632, "proxy_mode": null, "evaluation_basis": null}}
{"event_id": "evt_1774156375592841963", "ts": 1774156375, "event": "training_heartbeat", "round": 45, "session_id": "019d13dc-400c-7493-83af-bd34fffa7466", "tier": "full", "run_name": "round0045_full_1774156345", "family_name": "lowrank_gated_residual", "family_stage": "mainline", "status": null, "decision": null, "payload": {"tier": "full", "run_name": "round0045_full_1774156345", "family_name": "lowrank_gated_residual", "family_stage": "mainline", "checkpoint_dir": "/root/sparsify-ascend/checkpoints/research_agent/round_0045_full/round0045_full_1774156345_dp2_bs1_ga8_ef32_k56_20260322_131233", "metrics_path": "/root/sparsify-ascend/checkpoints/research_agent/round_0045_full/round0045_full_1774156345_dp2_bs1_ga8_ef32_k56_20260322_131233/metrics.jsonl", "latest_step": 40, "latest_tokens_per_sec": 43689.224005971395, "baseline_ratio": 0.492574842177242, "latest_total_tokens": 1310720.0, "proxy_mode": null, "evaluation_basis": null}}
{"event_id": "evt_1774156405594154634", "ts": 1774156405, "event": "training_heartbeat", "round": 45, "session_id": "019d13dc-400c-7493-83af-bd34fffa7466", "tier": "full", "run_name": "round0045_full_1774156345", "family_name": "lowrank_gated_residual", "family_stage": "mainline", "status": null, "decision": null, "payload": {"tier": "full", "run_name": "round0045_full_1774156345", "family_name": "lowrank_gated_residual", "family_stage": "mainline", "checkpoint_dir": "/root/sparsify-ascend/checkpoints/research_agent/round_0045_full/round0045_full_1774156345_dp2_bs1_ga8_ef32_k56_20260322_131233", "metrics_path": "/root/sparsify-ascend/checkpoints/research_agent/round_0045_full/round0045_full_1774156345_dp2_bs1_ga8_ef32_k56_20260322_131233/metrics.jsonl", "latest_step": 130, "latest_tokens_per_sec": 70994.62482121424, "baseline_ratio": 0.8004300124891764, "latest_total_tokens": 4259840.0, "proxy_mode": null, "evaluation_basis": null}}
{"event_id": "evt_1774156435595956480", "ts": 1774156435, "event": "training_heartbeat", "round": 45, "session_id": "019d13dc-400c-7493-83af-bd34fffa7466", "tier": "full", "run_name": "round0045_full_1774156345", "family_name": "lowrank_gated_residual", "family_stage": "mainline", "status": null, "decision": null, "payload": {"tier": "full", "run_name": "round0045_full_1774156345", "family_name": "lowrank_gated_residual", "family_stage": "mainline", "checkpoint_dir": "/root/sparsify-ascend/checkpoints/research_agent/round_0045_full/round0045_full_1774156345_dp2_bs1_ga8_ef32_k56_20260322_131233", "metrics_path": "/root/sparsify-ascend/checkpoints/research_agent/round_0045_full/round0045_full_1774156345_dp2_bs1_ga8_ef32_k56_20260322_131233/metrics.jsonl", "latest_step": 220, "latest_tokens_per_sec": 80095.905181798, "baseline_ratio": 0.9030425408465728, "latest_total_tokens": 7208960.0, "proxy_mode": null, "evaluation_basis": null}}
{"event_id": "evt_1774156465598526582", "ts": 1774156465, "event": "training_heartbeat", "round": 45, "session_id": "019d13dc-400c-7493-83af-bd34fffa7466", "tier": "full", "run_name": "round0045_full_1774156345", "family_name": "lowrank_gated_residual", "family_stage": "mainline", "status": null, "decision": null, "payload": {"tier": "full", "run_name": "round0045_full_1774156345", "family_name": "lowrank_gated_residual", "family_stage": "mainline", "checkpoint_dir": "/root/sparsify-ascend/checkpoints/research_agent/round_0045_full/round0045_full_1774156345_dp2_bs1_ga8_ef32_k56_20260322_131233", "metrics_path": "/root/sparsify-ascend/checkpoints/research_agent/round_0045_full/round0045_full_1774156345_dp2_bs1_ga8_ef32_k56_20260322_131233/metrics.jsonl", "latest_step": 320, "latest_tokens_per_sec": 87376.47301341106, "baseline_ratio": 0.9851274172025214, "latest_total_tokens": 10485760.0, "proxy_mode": null, "evaluation_basis": null}}
{"event_id": "evt_1774156495601414900", "ts": 1774156495, "event": "training_heartbeat", "round": 45, "session_id": "019d13dc-400c-7493-83af-bd34fffa7466", "tier": "full", "run_name": "round0045_full_1774156345", "family_name": "lowrank_gated_residual", "family_stage": "mainline", "status": null, "decision": null, "payload": {"tier": "full", "run_name": "round0045_full_1774156345", "family_name": "lowrank_gated_residual", "family_stage": "mainline", "checkpoint_dir": "/root/sparsify-ascend/checkpoints/research_agent/round_0045_full/round0045_full_1774156345_dp2_bs1_ga8_ef32_k56_20260322_131233", "metrics_path": "/root/sparsify-ascend/checkpoints/research_agent/round_0045_full/round0045_full_1774156345_dp2_bs1_ga8_ef32_k56_20260322_131233/metrics.jsonl", "latest_step": 410, "latest_tokens_per_sec": 89560.14112644792, "baseline_ratio": 1.0097472176365963, "latest_total_tokens": 13434880.0, "proxy_mode": null, "evaluation_basis": null}}
{"event_id": "evt_1774156525604788154", "ts": 1774156525, "event": "training_heartbeat", "round": 45, "session_id": "019d13dc-400c-7493-83af-bd34fffa7466", "tier": "full", "run_name": "round0045_full_1774156345", "family_name": "lowrank_gated_residual", "family_stage": "mainline", "status": null, "decision": null, "payload": {"tier": "full", "run_name": "round0045_full_1774156345", "family_name": "lowrank_gated_residual", "family_stage": "mainline", "checkpoint_dir": "/root/sparsify-ascend/checkpoints/research_agent/round_0045_full/round0045_full_1774156345_dp2_bs1_ga8_ef32_k56_20260322_131233", "metrics_path": "/root/sparsify-ascend/checkpoints/research_agent/round_0045_full/round0045_full_1774156345_dp2_bs1_ga8_ef32_k56_20260322_131233/metrics.jsonl", "latest_step": 500, "latest_tokens_per_sec": 91015.69443037508, "baseline_ratio": 1.0261578762206098, "latest_total_tokens": 16384000.0, "proxy_mode": null, "evaluation_basis": null}}
{"event_id": "evt_1774156555608959181", "ts": 1774156555, "event": "training_heartbeat", "round": 45, "session_id": "019d13dc-400c-7493-83af-bd34fffa7466", "tier": "full", "run_name": "round0045_full_1774156345", "family_name": "lowrank_gated_residual", "family_stage": "mainline", "status": null, "decision": null, "payload": {"tier": "full", "run_name": "round0045_full_1774156345", "family_name": "lowrank_gated_residual", "family_stage": "mainline", "checkpoint_dir": "/root/sparsify-ascend/checkpoints/research_agent/round_0045_full/round0045_full_1774156345_dp2_bs1_ga8_ef32_k56_20260322_131233", "metrics_path": "/root/sparsify-ascend/checkpoints/research_agent/round_0045_full/round0045_full_1774156345_dp2_bs1_ga8_ef32_k56_20260322_131233/metrics.jsonl", "latest_step": 590, "latest_tokens_per_sec": 92054.98557267193, "baseline_ratio": 1.0378753805260903, "latest_total_tokens": 19333120.0, "proxy_mode": null, "evaluation_basis": null}}
