{"event_id": "evt_1774163704736653293", "ts": 1774163704, "event": "training_heartbeat", "round": 57, "session_id": "019d1451-d554-79b2-8cc5-c99f2ae19f85", "tier": "proxy", "run_name": "round0057_proxy_1774163674", "family_name": "codebook_topk", "family_stage": "mainline_comparison", "status": null, "decision": null, "payload": {"tier": "proxy", "run_name": "round0057_proxy_1774163674", "family_name": "codebook_topk", "family_stage": "mainline_comparison", "checkpoint_dir": "/root/sparsify-ascend/checkpoints/research_agent/round_0057_proxy/round0057_proxy_1774163674_dp2_bs1_ga8_ef8_k40_20260322_151441", "metrics_path": "/root/sparsify-ascend/checkpoints/research_agent/round_0057_proxy/round0057_proxy_1774163674_dp2_bs1_ga8_ef8_k40_20260322_151441/metrics.jsonl", "latest_step": null, "latest_tokens_per_sec": null, "baseline_ratio": null, "latest_total_tokens": null, "proxy_mode": "fast", "evaluation_basis": "terminal_only"}}
{"event_id": "evt_1774163704801918702", "ts": 1774163704, "event": "training_finished", "round": 57, "session_id": "019d1451-d554-79b2-8cc5-c99f2ae19f85", "tier": "proxy", "run_name": "round0057_proxy_1774163674", "family_name": "codebook_topk", "family_stage": "mainline_comparison", "status": "crash", "decision": "crash", "payload": {"tier": "proxy", "run_name": "round0057_proxy_1774163674", "family_name": "codebook_topk", "family_stage": "mainline_comparison", "checkpoint_dir": "/root/sparsify-ascend/checkpoints/research_agent/round_0057_proxy/round0057_proxy_1774163674_dp2_bs1_ga8_ef8_k40_20260322_151441", "metrics_path": "/root/sparsify-ascend/checkpoints/research_agent/round_0057_proxy/round0057_proxy_1774163674_dp2_bs1_ga8_ef8_k40_20260322_151441/metrics.jsonl", "run_health": "crash", "termination_reason": "completed", "tokens_per_sec": null, "baseline_ratio": null, "status": "crash", "decision": "crash", "proxy_mode": "fast", "evaluation_basis": "terminal_only", "curve_start_fvu": null, "curve_mid_fvu": null, "curve_end_fvu": null, "curve_late_slope": null, "curve_still_improving": null}}
{"event_id": "evt_1774163704801969110", "ts": 1774163704, "event": "result_recorded", "round": 57, "session_id": "019d1451-d554-79b2-8cc5-c99f2ae19f85", "tier": "proxy", "run_name": "round0057_proxy_1774163674", "family_name": "codebook_topk", "family_stage": "mainline_comparison", "status": "crash", "decision": "crash", "payload": {"tier": "proxy", "run_name": "round0057_proxy_1774163674", "family_name": "codebook_topk", "family_stage": "mainline_comparison", "status": "crash", "decision": "crash", "val_fvu": "None", "observed_fvu": "", "k": "40", "log_path": "/root/sparsify-ascend/research/history/logs/proxy_1774163704.log", "checkpoint": null}}
{"event_id": "evt_1774163704802048260", "ts": 1774163704, "event": "round_finished", "round": 57, "session_id": "019d1451-d554-79b2-8cc5-c99f2ae19f85", "tier": "proxy", "run_name": null, "family_name": "codebook_topk", "family_stage": "mainline_comparison", "status": "crash", "decision": "crash", "payload": {"tier": "proxy", "family_name": "codebook_topk", "family_stage": "mainline_comparison", "status": "crash", "decision": "crash", "val_fvu": "None"}}
{"event_id": "evt_1774163704810264380", "ts": 1774163704, "event": "experiment_commit_prepared", "round": 57, "tier": "proxy", "run_name": null, "family_name": "codebook_topk", "family_stage": "mainline_comparison", "status": "crash", "decision": "crash", "payload": {"branch": "autoresearch-sae"}}
{"event_id": "evt_1774163712483755851", "ts": 1774163712, "event": "round_started", "round": 58, "session_id": "019d1451-d554-79b2-8cc5-c99f2ae19f85", "tier": null, "run_name": null, "family_name": null, "family_stage": null, "status": "started", "decision": null, "payload": {"status": "started"}}
{"event_id": "evt_1774163712483911141", "ts": 1774163712, "event": "agent_deciding", "round": 58, "session_id": "019d1451-d554-79b2-8cc5-c99f2ae19f85", "tier": null, "run_name": null, "family_name": null, "family_stage": null, "status": null, "decision": null, "payload": {}}
{"event_id": "evt_1774163835118098311", "ts": 1774163835, "event": "session_resumed", "round": 58, "tier": null, "run_name": null, "family_name": null, "family_stage": null, "status": "active", "decision": null, "payload": {"session_id": "019d1451-d554-79b2-8cc5-c99f2ae19f85"}}
{"event_id": "evt_1774163835119361694", "ts": 1774163835, "event": "agent_action_received", "round": 58, "session_id": "019d1451-d554-79b2-8cc5-c99f2ae19f85", "tier": "proxy", "run_name": null, "family_name": "codebook_topk", "family_stage": "stabilize", "status": null, "decision": null, "payload": {"session_id": "019d1451-d554-79b2-8cc5-c99f2ae19f85", "tier": "proxy", "family_name": "codebook_topk", "family_stage": "stabilize", "change_type": "edit_sae_code", "expected_win": "lower_fvu", "hypothesis": "The `K=40`, `EF=8` regime now appears broadly exhausted on quality and `codebook_topk` additionally exposed a concrete distributed-training compatibility failure, so the least-bad next move is a narrow code-fix round rather than another blind architecture swap. Repairing `codebook_topk` so all trainable paths participate in loss is the smallest informative step to determine whether the discrete-retrieval direction is actually bad or was obscured by a DDP-unused-parameter bug."}}
{"event_id": "evt_1774163964898460820", "ts": 1774163964, "event": "variable_isolation_warning", "round": 58, "session_id": "019d1451-d554-79b2-8cc5-c99f2ae19f85", "tier": null, "run_name": null, "family_name": "codebook_topk", "family_stage": "stabilize", "status": null, "decision": null, "payload": {"violation": "Multiple primary variables changed simultaneously: code_edit, architecture, k, lr"}}
{"event_id": "evt_1774163964898598769", "ts": 1774163964, "event": "proxy_mode_selected", "round": 58, "session_id": "019d1451-d554-79b2-8cc5-c99f2ae19f85", "tier": "proxy", "run_name": null, "family_name": "codebook_topk", "family_stage": "stabilize", "status": null, "decision": null, "payload": {"tier": "proxy", "proxy_mode": "fast", "evaluation_basis": "terminal_only", "parameter_behavior": "structural", "proxy_max_tokens": "40000000"}}
{"event_id": "evt_1774163964898648120", "ts": 1774163964, "event": "sanity_started", "round": 58, "session_id": "019d1451-d554-79b2-8cc5-c99f2ae19f85", "tier": "proxy", "run_name": null, "family_name": "codebook_topk", "family_stage": "stabilize", "status": null, "decision": null, "payload": {"tier": "proxy"}}
{"event_id": "evt_1774163969571939674", "ts": 1774163969, "event": "sanity_finished", "round": 58, "session_id": "019d1451-d554-79b2-8cc5-c99f2ae19f85", "tier": "proxy", "run_name": null, "family_name": "codebook_topk", "family_stage": "stabilize", "status": "ok", "decision": null, "payload": {"tier": "proxy", "status": "ok"}}
{"event_id": "evt_1774163969572343049", "ts": 1774163969, "event": "training_started", "round": 58, "session_id": "019d1451-d554-79b2-8cc5-c99f2ae19f85", "tier": "proxy", "run_name": "round0058_proxy_1774163969", "family_name": "codebook_topk", "family_stage": "stabilize", "status": null, "decision": null, "payload": {"tier": "proxy", "run_name": "round0058_proxy_1774163969", "family_name": "codebook_topk", "family_stage": "stabilize", "checkpoint_dir": "/root/sparsify-ascend/checkpoints/research_agent/round_0058_proxy", "log_path": "/root/sparsify-ascend/research/history/logs/round0058_proxy_1774163969.log", "config": {"architecture": "codebook_topk", "expansion_factor": 8, "k": 40, "optimizer": "signum", "lr": "1.6e-3", "hookpoints": "layers.[3].self_attn.o_proj", "batch_size": 1, "grad_acc_steps": 8, "micro_acc_steps": 1, "auxk_alpha": 0.0, "dead_feature_threshold": 10000000, "use_hadamard": false, "tier": "proxy", "family_name": "codebook_topk", "family_stage": "stabilize"}, "baseline_tokens_per_sec": null, "proxy_mode": "fast", "evaluation_basis": "terminal_only"}}
{"event_id": "evt_1774163989060410807", "ts": 1774163989, "event": "hint_added", "round": null, "tier": null, "run_name": null, "family_name": null, "family_stage": null, "status": "pending", "decision": null, "payload": {"id": "hint_1774163989", "message": "When a new architecture crashes with a clear implementation or DDP compatibility error, treat that as an implementation blocker rather than an\n  architecture verdict. If the direction is still strategically valuable, do one narrow repair-focused follow-up before abandoning it; do not mix crash outcomes\n  with quality conclusions.", "priority": "high", "scope": "persistent", "tag": "crash_repair_first", "status": "pending", "created_at": 1774163989, "applied_at": null}}
{"event_id": "evt_1774163999573244965", "ts": 1774163999, "event": "training_heartbeat", "round": 58, "session_id": "019d1451-d554-79b2-8cc5-c99f2ae19f85", "tier": "proxy", "run_name": "round0058_proxy_1774163969", "family_name": "codebook_topk", "family_stage": "stabilize", "status": null, "decision": null, "payload": {"tier": "proxy", "run_name": "round0058_proxy_1774163969", "family_name": "codebook_topk", "family_stage": "stabilize", "checkpoint_dir": "/root/sparsify-ascend/checkpoints/research_agent/round_0058_proxy/round0058_proxy_1774163969_dp2_bs1_ga8_ef8_k40_20260322_151935", "metrics_path": "/root/sparsify-ascend/checkpoints/research_agent/round_0058_proxy/round0058_proxy_1774163969_dp2_bs1_ga8_ef8_k40_20260322_151935/metrics.jsonl", "latest_step": null, "latest_tokens_per_sec": null, "baseline_ratio": null, "latest_total_tokens": null, "proxy_mode": "fast", "evaluation_basis": "terminal_only"}}
{"event_id": "evt_1774163999638536520", "ts": 1774163999, "event": "training_finished", "round": 58, "session_id": "019d1451-d554-79b2-8cc5-c99f2ae19f85", "tier": "proxy", "run_name": "round0058_proxy_1774163969", "family_name": "codebook_topk", "family_stage": "stabilize", "status": "crash", "decision": "crash", "payload": {"tier": "proxy", "run_name": "round0058_proxy_1774163969", "family_name": "codebook_topk", "family_stage": "stabilize", "checkpoint_dir": "/root/sparsify-ascend/checkpoints/research_agent/round_0058_proxy/round0058_proxy_1774163969_dp2_bs1_ga8_ef8_k40_20260322_151935", "metrics_path": "/root/sparsify-ascend/checkpoints/research_agent/round_0058_proxy/round0058_proxy_1774163969_dp2_bs1_ga8_ef8_k40_20260322_151935/metrics.jsonl", "run_health": "crash", "termination_reason": "completed", "tokens_per_sec": null, "baseline_ratio": null, "status": "crash", "decision": "crash", "proxy_mode": "fast", "evaluation_basis": "terminal_only", "curve_start_fvu": null, "curve_mid_fvu": null, "curve_end_fvu": null, "curve_late_slope": null, "curve_still_improving": null}}
{"event_id": "evt_1774163999638583767", "ts": 1774163999, "event": "result_recorded", "round": 58, "session_id": "019d1451-d554-79b2-8cc5-c99f2ae19f85", "tier": "proxy", "run_name": "round0058_proxy_1774163969", "family_name": "codebook_topk", "family_stage": "stabilize", "status": "crash", "decision": "crash", "payload": {"tier": "proxy", "run_name": "round0058_proxy_1774163969", "family_name": "codebook_topk", "family_stage": "stabilize", "status": "crash", "decision": "crash", "val_fvu": "None", "observed_fvu": "", "k": "40", "log_path": "/root/sparsify-ascend/research/history/logs/proxy_1774163999.log", "checkpoint": null}}
{"event_id": "evt_1774163999638659061", "ts": 1774163999, "event": "repair_attempt_started", "round": 58, "session_id": "019d1451-d554-79b2-8cc5-c99f2ae19f85", "tier": "proxy", "run_name": null, "family_name": "codebook_topk", "family_stage": "stabilize", "status": null, "decision": null, "payload": {"tier": "proxy", "family_name": "codebook_topk", "family_stage": "stabilize", "repair_attempt": 1, "failure_kind": "training_crash", "error_type": "RuntimeError", "error_summary": "RuntimeError: Expected to have finished reduction in the prior iteration before starting a new one. This error indicates that your module has parameters that were not used in producing loss. You can enable unused parameter detection by passing the keyword argument `find_unused_parameters=True` to `torch.nn.parallel.DistributedDataParallel`, and by"}}
{"event_id": "evt_1774164218505198086", "ts": 1774164218, "event": "variable_isolation_warning", "round": 58, "session_id": "019d1451-d554-79b2-8cc5-c99f2ae19f85", "tier": null, "run_name": null, "family_name": "codebook_topk", "family_stage": "stabilize", "status": null, "decision": null, "payload": {"violation": "Multiple primary variables changed simultaneously: code_edit, architecture, k, lr"}}
{"event_id": "evt_1774164223052819592", "ts": 1774164223, "event": "behavioral_diff_identical", "round": 58, "session_id": "019d1451-d554-79b2-8cc5-c99f2ae19f85", "tier": null, "run_name": null, "family_name": "codebook_topk", "family_stage": "stabilize", "status": null, "decision": null, "payload": {"architecture": "codebook_topk", "k": 40, "expansion_factor": 8, "max_diff": 0.0}}
{"event_id": "evt_1774164223052909023", "ts": 1774164223, "event": "round_finished", "round": 58, "session_id": "019d1451-d554-79b2-8cc5-c99f2ae19f85", "tier": "proxy", "run_name": null, "family_name": "codebook_topk", "family_stage": "stabilize", "status": "crash", "decision": "crash", "payload": {"tier": "proxy", "family_name": "codebook_topk", "family_stage": "stabilize", "status": "crash", "decision": "crash", "val_fvu": null}}
{"event_id": "evt_1774164230613550873", "ts": 1774164230, "event": "round_started", "round": 59, "session_id": "019d1451-d554-79b2-8cc5-c99f2ae19f85", "tier": null, "run_name": null, "family_name": null, "family_stage": null, "status": "started", "decision": null, "payload": {"status": "started"}}
{"event_id": "evt_1774164230613637006", "ts": 1774164230, "event": "agent_deciding", "round": 59, "session_id": "019d1451-d554-79b2-8cc5-c99f2ae19f85", "tier": null, "run_name": null, "family_name": null, "family_stage": null, "status": null, "decision": null, "payload": {}}
{"event_id": "evt_1774164365152937130", "ts": 1774164365, "event": "session_resumed", "round": 59, "tier": null, "run_name": null, "family_name": null, "family_stage": null, "status": "active", "decision": null, "payload": {"session_id": "019d1451-d554-79b2-8cc5-c99f2ae19f85"}}
{"event_id": "evt_1774164365154188472", "ts": 1774164365, "event": "agent_action_received", "round": 59, "session_id": "019d1451-d554-79b2-8cc5-c99f2ae19f85", "tier": "proxy", "run_name": null, "family_name": "lowrank_gated_residual", "family_stage": "stabilize", "status": null, "decision": null, "payload": {"session_id": "019d1451-d554-79b2-8cc5-c99f2ae19f85", "tier": "proxy", "family_name": "lowrank_gated_residual", "family_stage": "stabilize", "change_type": "param_only", "expected_win": "Recover a stable small-EF proxy measurement on a known working family and determine whether modestly relaxing sparsity from `K=40` to `K=64` meaningfully improves quality in the allowed `EF=8` regime.", "hypothesis": "Crash recovery mode overrides the broader architecture search for this round, so the least-risk move is to stay on the strongest working family and make one minor parameter change that improves stability while preserving lower-K pressure. Running `lowrank_gated_residual` with the same stable `signum`/`LR=1.6e-3`/`AUXK_ALPHA=0` recipe at `EF=8` and increasing only `K` from the previously weak `40` to `64` should recover a clean proxy signal in the small-EF regime without reopening code or architecture risk."}}
{"event_id": "evt_1774164365154327183", "ts": 1774164365, "event": "proxy_mode_selected", "round": 59, "session_id": "019d1451-d554-79b2-8cc5-c99f2ae19f85", "tier": "proxy", "run_name": null, "family_name": "lowrank_gated_residual", "family_stage": "stabilize", "status": null, "decision": null, "payload": {"tier": "proxy", "proxy_mode": "fast", "evaluation_basis": "terminal_only", "parameter_behavior": "structural", "proxy_max_tokens": "5000000"}}
{"event_id": "evt_1774164365154608428", "ts": 1774164365, "event": "training_started", "round": 59, "session_id": "019d1451-d554-79b2-8cc5-c99f2ae19f85", "tier": "proxy", "run_name": "round0059_proxy_1774164365", "family_name": "lowrank_gated_residual", "family_stage": "stabilize", "status": null, "decision": null, "payload": {"tier": "proxy", "run_name": "round0059_proxy_1774164365", "family_name": "lowrank_gated_residual", "family_stage": "stabilize", "checkpoint_dir": "/root/sparsify-ascend/checkpoints/research_agent/round_0059_proxy", "log_path": "/root/sparsify-ascend/research/history/logs/round0059_proxy_1774164365.log", "config": {"architecture": "lowrank_gated_residual", "expansion_factor": 8, "k": 64, "optimizer": "signum", "lr": "1.6e-3", "hookpoints": "layers.[3].self_attn.o_proj", "batch_size": 1, "grad_acc_steps": 8, "micro_acc_steps": 1, "auxk_alpha": 0.0, "dead_feature_threshold": 10000000, "use_hadamard": false, "tier": "proxy", "family_name": "lowrank_gated_residual", "family_stage": "stabilize"}, "baseline_tokens_per_sec": 83008.58788873068, "proxy_mode": "fast", "evaluation_basis": "terminal_only"}}
{"event_id": "evt_1774164395156374236", "ts": 1774164395, "event": "training_heartbeat", "round": 59, "session_id": "019d1451-d554-79b2-8cc5-c99f2ae19f85", "tier": "proxy", "run_name": "round0059_proxy_1774164365", "family_name": "lowrank_gated_residual", "family_stage": "stabilize", "status": null, "decision": null, "payload": {"tier": "proxy", "run_name": "round0059_proxy_1774164365", "family_name": "lowrank_gated_residual", "family_stage": "stabilize", "checkpoint_dir": "/root/sparsify-ascend/checkpoints/research_agent/round_0059_proxy/round0059_proxy_1774164365_dp2_bs1_ga8_ef8_k64_20260322_152611", "metrics_path": "/root/sparsify-ascend/checkpoints/research_agent/round_0059_proxy/round0059_proxy_1774164365_dp2_bs1_ga8_ef8_k64_20260322_152611/metrics.jsonl", "latest_step": 130, "latest_tokens_per_sec": 141987.6377611509, "baseline_ratio": 1.7105174461162864, "latest_total_tokens": 4259840.0, "proxy_mode": "fast", "evaluation_basis": "terminal_only"}}
{"event_id": "evt_1774164425157823713", "ts": 1774164425, "event": "training_heartbeat", "round": 59, "session_id": "019d1451-d554-79b2-8cc5-c99f2ae19f85", "tier": "proxy", "run_name": "round0059_proxy_1774164365", "family_name": "lowrank_gated_residual", "family_stage": "stabilize", "status": null, "decision": null, "payload": {"tier": "proxy", "run_name": "round0059_proxy_1774164365", "family_name": "lowrank_gated_residual", "family_stage": "stabilize", "checkpoint_dir": "/root/sparsify-ascend/checkpoints/research_agent/round_0059_proxy/round0059_proxy_1774164365_dp2_bs1_ga8_ef8_k64_20260322_152611", "metrics_path": "/root/sparsify-ascend/checkpoints/research_agent/round_0059_proxy/round0059_proxy_1774164365_dp2_bs1_ga8_ef8_k64_20260322_152611/metrics.jsonl", "latest_step": 152, "latest_tokens_per_sec": 83008.22936303058, "baseline_ratio": 0.9999956808601469, "latest_total_tokens": 4980736.0, "proxy_mode": "fast", "evaluation_basis": "terminal_only"}}
{"event_id": "evt_1774164425223917980", "ts": 1774164425, "event": "training_finished", "round": 59, "session_id": "019d1451-d554-79b2-8cc5-c99f2ae19f85", "tier": "proxy", "run_name": "round0059_proxy_1774164365", "family_name": "lowrank_gated_residual", "family_stage": "stabilize", "status": "ok", "decision": "discard", "payload": {"tier": "proxy", "run_name": "round0059_proxy_1774164365", "family_name": "lowrank_gated_residual", "family_stage": "stabilize", "checkpoint_dir": "/root/sparsify-ascend/checkpoints/research_agent/round_0059_proxy/round0059_proxy_1774164365_dp2_bs1_ga8_ef8_k64_20260322_152611", "metrics_path": "/root/sparsify-ascend/checkpoints/research_agent/round_0059_proxy/round0059_proxy_1774164365_dp2_bs1_ga8_ef8_k64_20260322_152611/metrics.jsonl", "run_health": "normal", "termination_reason": "completed", "tokens_per_sec": 83008.22936303058, "baseline_ratio": 0.9999956808601469, "status": "ok", "decision": "discard", "proxy_mode": "fast", "evaluation_basis": "terminal_only", "curve_start_fvu": 0.3188014328479767, "curve_mid_fvu": 0.20679239928722382, "curve_end_fvu": 0.1635725349187851, "curve_late_slope": -6.7075821026528794e-09, "curve_still_improving": true}}
{"event_id": "evt_1774164425223969613", "ts": 1774164425, "event": "result_recorded", "round": 59, "session_id": "019d1451-d554-79b2-8cc5-c99f2ae19f85", "tier": "proxy", "run_name": "round0059_proxy_1774164365", "family_name": "lowrank_gated_residual", "family_stage": "stabilize", "status": "ok", "decision": "discard", "payload": {"tier": "proxy", "run_name": "round0059_proxy_1774164365", "family_name": "lowrank_gated_residual", "family_stage": "stabilize", "status": "ok", "decision": "discard", "val_fvu": "0.16453043185174465", "observed_fvu": "0.163573", "k": "64", "log_path": "/root/sparsify-ascend/research/history/logs/proxy_1774164425.log", "checkpoint": null}}
{"event_id": "evt_1774164425224105130", "ts": 1774164425, "event": "round_finished", "round": 59, "session_id": "019d1451-d554-79b2-8cc5-c99f2ae19f85", "tier": "proxy", "run_name": null, "family_name": "lowrank_gated_residual", "family_stage": "stabilize", "status": "ok", "decision": "discard", "payload": {"tier": "proxy", "family_name": "lowrank_gated_residual", "family_stage": "stabilize", "status": "ok", "decision": "discard", "val_fvu": "0.16453043185174465"}}
{"event_id": "evt_1774164425232325820", "ts": 1774164425, "event": "experiment_commit_prepared", "round": 59, "tier": "proxy", "run_name": null, "family_name": "lowrank_gated_residual", "family_stage": "stabilize", "status": "ok", "decision": "discard", "payload": {"branch": "autoresearch-sae"}}
{"event_id": "evt_1774164432622814017", "ts": 1774164432, "event": "round_started", "round": 60, "session_id": "019d1451-d554-79b2-8cc5-c99f2ae19f85", "tier": null, "run_name": null, "family_name": null, "family_stage": null, "status": "started", "decision": null, "payload": {"status": "started"}}
