{"event_id": "evt_1774139904508145347", "ts": 1774139904, "event": "training_heartbeat", "round": 20, "session_id": "019d12cf-0aba-71d0-8920-5ea920811f62", "tier": "full", "run_name": "round0020_full_1774139844", "family_name": "lowrank_residual", "family_stage": "stabilize", "status": null, "decision": null, "payload": {"tier": "full", "run_name": "round0020_full_1774139844", "family_name": "lowrank_residual", "family_stage": "stabilize", "checkpoint_dir": "/root/sparsify-ascend/checkpoints/research_agent/round_0020_full/round0020_full_1774139844_dp2_bs1_ga8_ef32_k32_20260322_083730", "metrics_path": "/root/sparsify-ascend/checkpoints/research_agent/round_0020_full/round0020_full_1774139844_dp2_bs1_ga8_ef32_k32_20260322_083730/metrics.jsonl", "latest_step": 230, "latest_tokens_per_sec": 125604.29706780442, "baseline_ratio": 0.7546132658775748, "latest_total_tokens": 7536640.0, "proxy_mode": null, "evaluation_basis": null}}
{"event_id": "evt_1774139934510859598", "ts": 1774139934, "event": "training_heartbeat", "round": 20, "session_id": "019d12cf-0aba-71d0-8920-5ea920811f62", "tier": "full", "run_name": "round0020_full_1774139844", "family_name": "lowrank_residual", "family_stage": "stabilize", "status": null, "decision": null, "payload": {"tier": "full", "run_name": "round0020_full_1774139844", "family_name": "lowrank_residual", "family_stage": "stabilize", "checkpoint_dir": "/root/sparsify-ascend/checkpoints/research_agent/round_0020_full/round0020_full_1774139844_dp2_bs1_ga8_ef32_k32_20260322_083730", "metrics_path": "/root/sparsify-ascend/checkpoints/research_agent/round_0020_full/round0020_full_1774139844_dp2_bs1_ga8_ef32_k32_20260322_083730/metrics.jsonl", "latest_step": 380, "latest_tokens_per_sec": 138344.93696542736, "baseline_ratio": 0.8311572703977812, "latest_total_tokens": 12451840.0, "proxy_mode": null, "evaluation_basis": null}}
{"event_id": "evt_1774139964514387835", "ts": 1774139964, "event": "training_heartbeat", "round": 20, "session_id": "019d12cf-0aba-71d0-8920-5ea920811f62", "tier": "full", "run_name": "round0020_full_1774139844", "family_name": "lowrank_residual", "family_stage": "stabilize", "status": null, "decision": null, "payload": {"tier": "full", "run_name": "round0020_full_1774139844", "family_name": "lowrank_residual", "family_stage": "stabilize", "checkpoint_dir": "/root/sparsify-ascend/checkpoints/research_agent/round_0020_full/round0020_full_1774139844_dp2_bs1_ga8_ef32_k32_20260322_083730", "metrics_path": "/root/sparsify-ascend/checkpoints/research_agent/round_0020_full/round0020_full_1774139844_dp2_bs1_ga8_ef32_k32_20260322_083730/metrics.jsonl", "latest_step": 530, "latest_tokens_per_sec": 144714.1340969459, "baseline_ratio": 0.8694225269266939, "latest_total_tokens": 17367040.0, "proxy_mode": null, "evaluation_basis": null}}
{"event_id": "evt_1774139994519057535", "ts": 1774139994, "event": "training_heartbeat", "round": 20, "session_id": "019d12cf-0aba-71d0-8920-5ea920811f62", "tier": "full", "run_name": "round0020_full_1774139844", "family_name": "lowrank_residual", "family_stage": "stabilize", "status": null, "decision": null, "payload": {"tier": "full", "run_name": "round0020_full_1774139844", "family_name": "lowrank_residual", "family_stage": "stabilize", "checkpoint_dir": "/root/sparsify-ascend/checkpoints/research_agent/round_0020_full/round0020_full_1774139844_dp2_bs1_ga8_ef32_k32_20260322_083730", "metrics_path": "/root/sparsify-ascend/checkpoints/research_agent/round_0020_full/round0020_full_1774139844_dp2_bs1_ga8_ef32_k32_20260322_083730/metrics.jsonl", "latest_step": 690, "latest_tokens_per_sec": 150719.0118030495, "baseline_ratio": 0.9054990026745908, "latest_total_tokens": 22609920.0, "proxy_mode": null, "evaluation_basis": null}}
{"event_id": "evt_1774140024524459069", "ts": 1774140024, "event": "training_heartbeat", "round": 20, "session_id": "019d12cf-0aba-71d0-8920-5ea920811f62", "tier": "full", "run_name": "round0020_full_1774139844", "family_name": "lowrank_residual", "family_stage": "stabilize", "status": null, "decision": null, "payload": {"tier": "full", "run_name": "round0020_full_1774139844", "family_name": "lowrank_residual", "family_stage": "stabilize", "checkpoint_dir": "/root/sparsify-ascend/checkpoints/research_agent/round_0020_full/round0020_full_1774139844_dp2_bs1_ga8_ef32_k32_20260322_083730", "metrics_path": "/root/sparsify-ascend/checkpoints/research_agent/round_0020_full/round0020_full_1774139844_dp2_bs1_ga8_ef32_k32_20260322_083730/metrics.jsonl", "latest_step": 840, "latest_tokens_per_sec": 152900.90110045992, "baseline_ratio": 0.9186074921684922, "latest_total_tokens": 27525120.0, "proxy_mode": null, "evaluation_basis": null}}
{"event_id": "evt_1774140054530583174", "ts": 1774140054, "event": "training_heartbeat", "round": 20, "session_id": "019d12cf-0aba-71d0-8920-5ea920811f62", "tier": "full", "run_name": "round0020_full_1774139844", "family_name": "lowrank_residual", "family_stage": "stabilize", "status": null, "decision": null, "payload": {"tier": "full", "run_name": "round0020_full_1774139844", "family_name": "lowrank_residual", "family_stage": "stabilize", "checkpoint_dir": "/root/sparsify-ascend/checkpoints/research_agent/round_0020_full/round0020_full_1774139844_dp2_bs1_ga8_ef32_k32_20260322_083730", "metrics_path": "/root/sparsify-ascend/checkpoints/research_agent/round_0020_full/round0020_full_1774139844_dp2_bs1_ga8_ef32_k32_20260322_083730/metrics.jsonl", "latest_step": 990, "latest_tokens_per_sec": 154458.97920167903, "baseline_ratio": 0.9279682101685985, "latest_total_tokens": 32440320.0, "proxy_mode": null, "evaluation_basis": null}}
{"event_id": "evt_1774140084537259246", "ts": 1774140084, "event": "training_heartbeat", "round": 20, "session_id": "019d12cf-0aba-71d0-8920-5ea920811f62", "tier": "full", "run_name": "round0020_full_1774139844", "family_name": "lowrank_residual", "family_stage": "stabilize", "status": null, "decision": null, "payload": {"tier": "full", "run_name": "round0020_full_1774139844", "family_name": "lowrank_residual", "family_stage": "stabilize", "checkpoint_dir": "/root/sparsify-ascend/checkpoints/research_agent/round_0020_full/round0020_full_1774139844_dp2_bs1_ga8_ef32_k32_20260322_083730", "metrics_path": "/root/sparsify-ascend/checkpoints/research_agent/round_0020_full/round0020_full_1774139844_dp2_bs1_ga8_ef32_k32_20260322_083730/metrics.jsonl", "latest_step": 1090, "latest_tokens_per_sec": 148801.40323091348, "baseline_ratio": 0.8939782752705494, "latest_total_tokens": 35717120.0, "proxy_mode": null, "evaluation_basis": null}}
{"event_id": "evt_1774140114590279973", "ts": 1774140114, "event": "training_heartbeat", "round": 20, "session_id": "019d12cf-0aba-71d0-8920-5ea920811f62", "tier": "full", "run_name": "round0020_full_1774139844", "family_name": "lowrank_residual", "family_stage": "stabilize", "status": null, "decision": null, "payload": {"tier": "full", "run_name": "round0020_full_1774139844", "family_name": "lowrank_residual", "family_stage": "stabilize", "checkpoint_dir": "/root/sparsify-ascend/checkpoints/research_agent/round_0020_full/round0020_full_1774139844_dp2_bs1_ga8_ef32_k32_20260322_083730", "metrics_path": "/root/sparsify-ascend/checkpoints/research_agent/round_0020_full/round0020_full_1774139844_dp2_bs1_ga8_ef32_k32_20260322_083730/metrics.jsonl", "latest_step": 1220, "latest_tokens_per_sec": 148041.1208680743, "baseline_ratio": 0.8894106038595826, "latest_total_tokens": 39976960.0, "proxy_mode": null, "evaluation_basis": null}}
{"event_id": "evt_1774140144597753191", "ts": 1774140144, "event": "training_heartbeat", "round": 20, "session_id": "019d12cf-0aba-71d0-8920-5ea920811f62", "tier": "full", "run_name": "round0020_full_1774139844", "family_name": "lowrank_residual", "family_stage": "stabilize", "status": null, "decision": null, "payload": {"tier": "full", "run_name": "round0020_full_1774139844", "family_name": "lowrank_residual", "family_stage": "stabilize", "checkpoint_dir": "/root/sparsify-ascend/checkpoints/research_agent/round_0020_full/round0020_full_1774139844_dp2_bs1_ga8_ef32_k32_20260322_083730", "metrics_path": "/root/sparsify-ascend/checkpoints/research_agent/round_0020_full/round0020_full_1774139844_dp2_bs1_ga8_ef32_k32_20260322_083730/metrics.jsonl", "latest_step": 1220, "latest_tokens_per_sec": 133215.39010281424, "baseline_ratio": 0.8003396614398729, "latest_total_tokens": 39976960.0, "proxy_mode": null, "evaluation_basis": null}}
{"event_id": "evt_1774140174605179062", "ts": 1774140174, "event": "training_heartbeat", "round": 20, "session_id": "019d12cf-0aba-71d0-8920-5ea920811f62", "tier": "full", "run_name": "round0020_full_1774139844", "family_name": "lowrank_residual", "family_stage": "stabilize", "status": null, "decision": null, "payload": {"tier": "full", "run_name": "round0020_full_1774139844", "family_name": "lowrank_residual", "family_stage": "stabilize", "checkpoint_dir": "/root/sparsify-ascend/checkpoints/research_agent/round_0020_full/round0020_full_1774139844_dp2_bs1_ga8_ef32_k32_20260322_083730", "metrics_path": "/root/sparsify-ascend/checkpoints/research_agent/round_0020_full/round0020_full_1774139844_dp2_bs1_ga8_ef32_k32_20260322_083730/metrics.jsonl", "latest_step": 1220, "latest_tokens_per_sec": 121105.5805180144, "baseline_ratio": 0.7275855982965688, "latest_total_tokens": 39976960.0, "proxy_mode": null, "evaluation_basis": null}}
{"event_id": "evt_1774140174680430363", "ts": 1774140174, "event": "training_finished", "round": 20, "session_id": "019d12cf-0aba-71d0-8920-5ea920811f62", "tier": "full", "run_name": "round0020_full_1774139844", "family_name": "lowrank_residual", "family_stage": "stabilize", "status": "ok", "decision": "keep", "payload": {"tier": "full", "run_name": "round0020_full_1774139844", "family_name": "lowrank_residual", "family_stage": "stabilize", "checkpoint_dir": "/root/sparsify-ascend/checkpoints/research_agent/round_0020_full/round0020_full_1774139844_dp2_bs1_ga8_ef32_k32_20260322_083730", "metrics_path": "/root/sparsify-ascend/checkpoints/research_agent/round_0020_full/round0020_full_1774139844_dp2_bs1_ga8_ef32_k32_20260322_083730/metrics.jsonl", "run_health": "normal", "termination_reason": "completed", "tokens_per_sec": 121105.5805180144, "baseline_ratio": 0.7275855982965688, "status": "ok", "decision": "keep", "proxy_mode": null, "evaluation_basis": null, "curve_start_fvu": 0.13311436772346497, "curve_mid_fvu": 0.1157139390707016, "curve_end_fvu": 0.09410734474658966, "curve_late_slope": -1.4797068779742285e-09, "curve_still_improving": true}}
{"event_id": "evt_1774140174680487158", "ts": 1774140174, "event": "result_recorded", "round": 20, "session_id": "019d12cf-0aba-71d0-8920-5ea920811f62", "tier": "full", "run_name": "round0020_full_1774139844", "family_name": "lowrank_residual", "family_stage": "stabilize", "status": "ok", "decision": "keep", "payload": {"tier": "full", "run_name": "round0020_full_1774139844", "family_name": "lowrank_residual", "family_stage": "stabilize", "status": "ok", "decision": "keep", "val_fvu": "0.09628844540566206", "observed_fvu": "0.094107", "k": "32", "log_path": "/root/sparsify-ascend/research/history/logs/full_1774140174.log", "checkpoint": null}}
{"event_id": "evt_1774140174681049216", "ts": 1774140174, "event": "round_finished", "round": 20, "session_id": "019d12cf-0aba-71d0-8920-5ea920811f62", "tier": "full", "run_name": null, "family_name": "lowrank_residual", "family_stage": "stabilize", "status": "ok", "decision": "keep", "payload": {"tier": "full", "family_name": "lowrank_residual", "family_stage": "stabilize", "status": "ok", "decision": "keep", "val_fvu": "0.09628844540566206"}}
{"event_id": "evt_1774140174687182264", "ts": 1774140174, "event": "experiment_commit_prepared", "round": 20, "tier": "full", "run_name": null, "family_name": "lowrank_residual", "family_stage": "stabilize", "status": "ok", "decision": "keep", "payload": {"branch": "autoresearch-sae"}}
{"event_id": "evt_1774140182066809353", "ts": 1774140182, "event": "round_started", "round": 21, "session_id": "019d12cf-0aba-71d0-8920-5ea920811f62", "tier": null, "run_name": null, "family_name": null, "family_stage": null, "status": "started", "decision": null, "payload": {"status": "started"}}
{"event_id": "evt_1774140182066966692", "ts": 1774140182, "event": "agent_deciding", "round": 21, "session_id": "019d12cf-0aba-71d0-8920-5ea920811f62", "tier": null, "run_name": null, "family_name": null, "family_stage": null, "status": null, "decision": null, "payload": {}}
{"event_id": "evt_1774140306418111950", "ts": 1774140306, "event": "session_resumed", "round": 21, "tier": null, "run_name": null, "family_name": null, "family_stage": null, "status": "active", "decision": null, "payload": {"session_id": "019d12cf-0aba-71d0-8920-5ea920811f62"}}
{"event_id": "evt_1774140306418723856", "ts": 1774140306, "event": "agent_action_received", "round": 21, "session_id": "019d12cf-0aba-71d0-8920-5ea920811f62", "tier": "proxy", "run_name": null, "family_name": "lowrank_residual", "family_stage": "stabilize", "status": null, "decision": null, "payload": {"session_id": "019d12cf-0aba-71d0-8920-5ea920811f62", "tier": "proxy", "family_name": "lowrank_residual", "family_stage": "stabilize", "change_type": "param_only", "expected_win": "lower_fvu", "hypothesis": "`lowrank_residual` with `EXPANSION_FACTOR=32` improved both K=64 and K=32, so the next clean stabilization move is to complete this capacity sweep at the quality anchor. Increasing only `EXPANSION_FACTOR` from 16 to 32 at K=128 may further lower FVU on the best-quality point if the residual branch is still capacity-limited there."}}
{"event_id": "evt_1774140306418859265", "ts": 1774140306, "event": "proxy_mode_selected", "round": 21, "session_id": "019d12cf-0aba-71d0-8920-5ea920811f62", "tier": "proxy", "run_name": null, "family_name": "lowrank_residual", "family_stage": "stabilize", "status": null, "decision": null, "payload": {"tier": "proxy", "proxy_mode": "fast", "evaluation_basis": "terminal_only", "parameter_behavior": "structural", "proxy_max_tokens": "5000000"}}
{"event_id": "evt_1774140306419129921", "ts": 1774140306, "event": "training_started", "round": 21, "session_id": "019d12cf-0aba-71d0-8920-5ea920811f62", "tier": "proxy", "run_name": "round0021_proxy_1774140306", "family_name": "lowrank_residual", "family_stage": "stabilize", "status": null, "decision": null, "payload": {"tier": "proxy", "run_name": "round0021_proxy_1774140306", "family_name": "lowrank_residual", "family_stage": "stabilize", "checkpoint_dir": "/root/sparsify-ascend/checkpoints/research_agent/round_0021_proxy", "log_path": "/root/sparsify-ascend/research/history/logs/round0021_proxy_1774140306.log", "config": {"architecture": "lowrank_residual", "expansion_factor": 32, "k": 128, "optimizer": "signum", "lr": "1.6e-3", "hookpoints": "layers.[3].self_attn.o_proj", "batch_size": 1, "grad_acc_steps": 8, "micro_acc_steps": 1, "auxk_alpha": 0.0, "dead_feature_threshold": 10000000, "use_hadamard": false, "tier": "proxy", "family_name": "lowrank_residual", "family_stage": "stabilize"}, "baseline_tokens_per_sec": 83008.52258207071, "proxy_mode": "fast", "evaluation_basis": "terminal_only"}}
{"event_id": "evt_1774140336420404588", "ts": 1774140336, "event": "training_heartbeat", "round": 21, "session_id": "019d12cf-0aba-71d0-8920-5ea920811f62", "tier": "proxy", "run_name": "round0021_proxy_1774140306", "family_name": "lowrank_residual", "family_stage": "stabilize", "status": null, "decision": null, "payload": {"tier": "proxy", "run_name": "round0021_proxy_1774140306", "family_name": "lowrank_residual", "family_stage": "stabilize", "checkpoint_dir": "/root/sparsify-ascend/checkpoints/research_agent/round_0021_proxy/round0021_proxy_1774140306_dp2_bs1_ga8_ef32_k128_20260322_084512", "metrics_path": "/root/sparsify-ascend/checkpoints/research_agent/round_0021_proxy/round0021_proxy_1774140306_dp2_bs1_ga8_ef32_k128_20260322_084512/metrics.jsonl", "latest_step": 40, "latest_tokens_per_sec": 43689.2347691521, "baseline_ratio": 0.5263222788474093, "latest_total_tokens": 1310720.0, "proxy_mode": "fast", "evaluation_basis": "terminal_only"}}
{"event_id": "evt_1774140366421598332", "ts": 1774140366, "event": "training_heartbeat", "round": 21, "session_id": "019d12cf-0aba-71d0-8920-5ea920811f62", "tier": "proxy", "run_name": "round0021_proxy_1774140306", "family_name": "lowrank_residual", "family_stage": "stabilize", "status": null, "decision": null, "payload": {"tier": "proxy", "run_name": "round0021_proxy_1774140306", "family_name": "lowrank_residual", "family_stage": "stabilize", "checkpoint_dir": "/root/sparsify-ascend/checkpoints/research_agent/round_0021_proxy/round0021_proxy_1774140306_dp2_bs1_ga8_ef32_k128_20260322_084512", "metrics_path": "/root/sparsify-ascend/checkpoints/research_agent/round_0021_proxy/round0021_proxy_1774140306_dp2_bs1_ga8_ef32_k128_20260322_084512/metrics.jsonl", "latest_step": 110, "latest_tokens_per_sec": 60072.483694778326, "baseline_ratio": 0.7236905540076867, "latest_total_tokens": 3604480.0, "proxy_mode": "fast", "evaluation_basis": "terminal_only"}}
{"event_id": "evt_1774140396681463879", "ts": 1774140396, "event": "training_heartbeat", "round": 21, "session_id": "019d12cf-0aba-71d0-8920-5ea920811f62", "tier": "proxy", "run_name": "round0021_proxy_1774140306", "family_name": "lowrank_residual", "family_stage": "stabilize", "status": null, "decision": null, "payload": {"tier": "proxy", "run_name": "round0021_proxy_1774140306", "family_name": "lowrank_residual", "family_stage": "stabilize", "checkpoint_dir": "/root/sparsify-ascend/checkpoints/research_agent/round_0021_proxy/round0021_proxy_1774140306_dp2_bs1_ga8_ef32_k128_20260322_084512", "metrics_path": "/root/sparsify-ascend/checkpoints/research_agent/round_0021_proxy/round0021_proxy_1774140306_dp2_bs1_ga8_ef32_k128_20260322_084512/metrics.jsonl", "latest_step": 152, "latest_tokens_per_sec": 55339.27958072615, "baseline_ratio": 0.6666698533998371, "latest_total_tokens": 4980736.0, "proxy_mode": "fast", "evaluation_basis": "terminal_only"}}
{"event_id": "evt_1774140397731418851", "ts": 1774140397, "event": "training_finished", "round": 21, "session_id": "019d12cf-0aba-71d0-8920-5ea920811f62", "tier": "proxy", "run_name": "round0021_proxy_1774140306", "family_name": "lowrank_residual", "family_stage": "stabilize", "status": "ok", "decision": "promote", "payload": {"tier": "proxy", "run_name": "round0021_proxy_1774140306", "family_name": "lowrank_residual", "family_stage": "stabilize", "checkpoint_dir": "/root/sparsify-ascend/checkpoints/research_agent/round_0021_proxy/round0021_proxy_1774140306_dp2_bs1_ga8_ef32_k128_20260322_084512", "metrics_path": "/root/sparsify-ascend/checkpoints/research_agent/round_0021_proxy/round0021_proxy_1774140306_dp2_bs1_ga8_ef32_k128_20260322_084512/metrics.jsonl", "run_health": "normal", "termination_reason": "completed", "tokens_per_sec": 55339.27958072615, "baseline_ratio": 0.6666698533998371, "status": "ok", "decision": "promote", "proxy_mode": "fast", "evaluation_basis": "terminal_only", "curve_start_fvu": 0.2532416582107544, "curve_mid_fvu": 0.16731080412864685, "curve_end_fvu": 0.13289253413677216, "curve_late_slope": -5.442841704221322e-09, "curve_still_improving": true}}
{"event_id": "evt_1774140397731541440", "ts": 1774140397, "event": "result_recorded", "round": 21, "session_id": "019d12cf-0aba-71d0-8920-5ea920811f62", "tier": "proxy", "run_name": "round0021_proxy_1774140306", "family_name": "lowrank_residual", "family_stage": "stabilize", "status": "ok", "decision": "promote", "payload": {"tier": "proxy", "run_name": "round0021_proxy_1774140306", "family_name": "lowrank_residual", "family_stage": "stabilize", "status": "ok", "decision": "promote", "val_fvu": "0.13389770686626434", "observed_fvu": "0.132893", "k": "128", "log_path": "/root/sparsify-ascend/research/history/logs/proxy_1774140397.log", "checkpoint": null}}
{"event_id": "evt_1774140397732000400", "ts": 1774140397, "event": "training_started", "round": 21, "session_id": "019d12cf-0aba-71d0-8920-5ea920811f62", "tier": "full", "run_name": "round0021_full_1774140397", "family_name": "lowrank_residual", "family_stage": "stabilize", "status": null, "decision": null, "payload": {"tier": "full", "run_name": "round0021_full_1774140397", "family_name": "lowrank_residual", "family_stage": "stabilize", "checkpoint_dir": "/root/sparsify-ascend/checkpoints/research_agent/round_0021_full", "log_path": "/root/sparsify-ascend/research/history/logs/round0021_full_1774140397.log", "config": {"architecture": "lowrank_residual", "expansion_factor": 32, "k": 128, "optimizer": "signum", "lr": "1.6e-3", "hookpoints": "layers.[3].self_attn.o_proj", "batch_size": 1, "grad_acc_steps": 8, "micro_acc_steps": 1, "auxk_alpha": 0.0, "dead_feature_threshold": 10000000, "use_hadamard": false, "tier": "full", "family_name": "lowrank_residual", "family_stage": "stabilize"}, "baseline_tokens_per_sec": 166448.5674284209, "proxy_mode": null, "evaluation_basis": null}}
{"event_id": "evt_1774140427733229764", "ts": 1774140427, "event": "training_heartbeat", "round": 21, "session_id": "019d12cf-0aba-71d0-8920-5ea920811f62", "tier": "full", "run_name": "round0021_full_1774140397", "family_name": "lowrank_residual", "family_stage": "stabilize", "status": null, "decision": null, "payload": {"tier": "full", "run_name": "round0021_full_1774140397", "family_name": "lowrank_residual", "family_stage": "stabilize", "checkpoint_dir": "/root/sparsify-ascend/checkpoints/research_agent/round_0021_full/round0021_full_1774140397_dp2_bs1_ga8_ef32_k128_20260322_084644", "metrics_path": "/root/sparsify-ascend/checkpoints/research_agent/round_0021_full/round0021_full_1774140397_dp2_bs1_ga8_ef32_k128_20260322_084644/metrics.jsonl", "latest_step": 30, "latest_tokens_per_sec": 32766.984927278783, "baseline_ratio": 0.1968595190305246, "latest_total_tokens": 983040.0, "proxy_mode": null, "evaluation_basis": null}}
