{"event_id": "evt_1774147670044029030", "ts": 1774147670, "event": "training_heartbeat", "round": 34, "session_id": "019d135d-4c60-7fa3-8438-b12bc57e0720", "tier": "proxy", "run_name": "round0034_proxy_1774147610", "family_name": "two_stage_residual", "family_stage": "stabilize", "status": null, "decision": null, "payload": {"tier": "proxy", "run_name": "round0034_proxy_1774147610", "family_name": "two_stage_residual", "family_stage": "stabilize", "checkpoint_dir": "/root/sparsify-ascend/checkpoints/research_agent/round_0034_proxy/round0034_proxy_1774147610_dp2_bs1_ga8_ef32_k128_20260322_104656", "metrics_path": "/root/sparsify-ascend/checkpoints/research_agent/round_0034_proxy/round0034_proxy_1774147610_dp2_bs1_ga8_ef32_k128_20260322_104656/metrics.jsonl", "latest_step": 90, "latest_tokens_per_sec": 49150.397513184565, "baseline_ratio": 0.4426471491256455, "latest_total_tokens": 2949120.0, "proxy_mode": "fast", "evaluation_basis": "terminal_only"}}
{"event_id": "evt_1774147700045462520", "ts": 1774147700, "event": "training_heartbeat", "round": 34, "session_id": "019d135d-4c60-7fa3-8438-b12bc57e0720", "tier": "proxy", "run_name": "round0034_proxy_1774147610", "family_name": "two_stage_residual", "family_stage": "stabilize", "status": null, "decision": null, "payload": {"tier": "proxy", "run_name": "round0034_proxy_1774147610", "family_name": "two_stage_residual", "family_stage": "stabilize", "checkpoint_dir": "/root/sparsify-ascend/checkpoints/research_agent/round_0034_proxy/round0034_proxy_1774147610_dp2_bs1_ga8_ef32_k128_20260322_104656", "metrics_path": "/root/sparsify-ascend/checkpoints/research_agent/round_0034_proxy/round0034_proxy_1774147610_dp2_bs1_ga8_ef32_k128_20260322_104656/metrics.jsonl", "latest_step": 150, "latest_tokens_per_sec": 54611.28407573983, "baseline_ratio": 0.4918277456399506, "latest_total_tokens": 4915200.0, "proxy_mode": "fast", "evaluation_basis": "terminal_only"}}
{"event_id": "evt_1774147730046895138", "ts": 1774147730, "event": "training_heartbeat", "round": 34, "session_id": "019d135d-4c60-7fa3-8438-b12bc57e0720", "tier": "proxy", "run_name": "round0034_proxy_1774147610", "family_name": "two_stage_residual", "family_stage": "stabilize", "status": null, "decision": null, "payload": {"tier": "proxy", "run_name": "round0034_proxy_1774147610", "family_name": "two_stage_residual", "family_stage": "stabilize", "checkpoint_dir": "/root/sparsify-ascend/checkpoints/research_agent/round_0034_proxy/round0034_proxy_1774147610_dp2_bs1_ga8_ef32_k128_20260322_104656", "metrics_path": "/root/sparsify-ascend/checkpoints/research_agent/round_0034_proxy/round0034_proxy_1774147610_dp2_bs1_ga8_ef32_k128_20260322_104656/metrics.jsonl", "latest_step": 152, "latest_tokens_per_sec": 41504.46958058226, "baseline_ratio": 0.37378812919851934, "latest_total_tokens": 4980736.0, "proxy_mode": "fast", "evaluation_basis": "terminal_only"}}
{"event_id": "evt_1774147730227614394", "ts": 1774147730, "event": "training_finished", "round": 34, "session_id": "019d135d-4c60-7fa3-8438-b12bc57e0720", "tier": "proxy", "run_name": "round0034_proxy_1774147610", "family_name": "two_stage_residual", "family_stage": "stabilize", "status": "ok", "decision": "incubate", "payload": {"tier": "proxy", "run_name": "round0034_proxy_1774147610", "family_name": "two_stage_residual", "family_stage": "stabilize", "checkpoint_dir": "/root/sparsify-ascend/checkpoints/research_agent/round_0034_proxy/round0034_proxy_1774147610_dp2_bs1_ga8_ef32_k128_20260322_104656", "metrics_path": "/root/sparsify-ascend/checkpoints/research_agent/round_0034_proxy/round0034_proxy_1774147610_dp2_bs1_ga8_ef32_k128_20260322_104656/metrics.jsonl", "run_health": "normal", "termination_reason": "completed", "tokens_per_sec": 41504.46958058226, "baseline_ratio": 0.37378812919851934, "status": "ok", "decision": "incubate", "proxy_mode": "fast", "evaluation_basis": "terminal_only", "curve_start_fvu": 0.3658835291862488, "curve_mid_fvu": 0.26473984122276306, "curve_end_fvu": 0.2216024100780487, "curve_late_slope": -6.24243423977356e-09, "curve_still_improving": true}}
{"event_id": "evt_1774147730227680252", "ts": 1774147730, "event": "result_recorded", "round": 34, "session_id": "019d135d-4c60-7fa3-8438-b12bc57e0720", "tier": "proxy", "run_name": "round0034_proxy_1774147610", "family_name": "two_stage_residual", "family_stage": "stabilize", "status": "ok", "decision": "incubate", "payload": {"tier": "proxy", "run_name": "round0034_proxy_1774147610", "family_name": "two_stage_residual", "family_stage": "stabilize", "status": "ok", "decision": "incubate", "val_fvu": "0.22192806750535965", "observed_fvu": "0.221602", "k": "128", "log_path": "/root/sparsify-ascend/research/history/logs/proxy_1774147730.log", "checkpoint": null}}
{"event_id": "evt_1774147730227823400", "ts": 1774147730, "event": "round_finished", "round": 34, "session_id": "019d135d-4c60-7fa3-8438-b12bc57e0720", "tier": "proxy", "run_name": null, "family_name": "two_stage_residual", "family_stage": "stabilize", "status": "ok", "decision": "incubate", "payload": {"tier": "proxy", "family_name": "two_stage_residual", "family_stage": "stabilize", "status": "ok", "decision": "incubate", "val_fvu": "0.22192806750535965"}}
{"event_id": "evt_1774147730315881047", "ts": 1774147730, "event": "experiment_commit_prepared", "round": 34, "tier": "proxy", "run_name": null, "family_name": "two_stage_residual", "family_stage": "stabilize", "status": "ok", "decision": "incubate", "payload": {"branch": "autoresearch-sae"}}
{"event_id": "evt_1774147738574486595", "ts": 1774147738, "event": "round_started", "round": 35, "session_id": "019d135d-4c60-7fa3-8438-b12bc57e0720", "tier": null, "run_name": null, "family_name": null, "family_stage": null, "status": "started", "decision": null, "payload": {"status": "started"}}
{"event_id": "evt_1774147738725850117", "ts": 1774147738, "event": "agent_deciding", "round": 35, "session_id": "019d135d-4c60-7fa3-8438-b12bc57e0720", "tier": null, "run_name": null, "family_name": null, "family_stage": null, "status": null, "decision": null, "payload": {}}
{"event_id": "evt_1774147911899909298", "ts": 1774147911, "event": "session_resumed", "round": 35, "tier": null, "run_name": null, "family_name": null, "family_stage": null, "status": "active", "decision": null, "payload": {"session_id": "019d135d-4c60-7fa3-8438-b12bc57e0720"}}
{"event_id": "evt_1774147911900598576", "ts": 1774147911, "event": "agent_action_received", "round": 35, "session_id": "019d135d-4c60-7fa3-8438-b12bc57e0720", "tier": "proxy", "run_name": null, "family_name": "adaptive_budget_topk", "family_stage": "prototype", "status": null, "decision": null, "payload": {"session_id": "019d135d-4c60-7fa3-8438-b12bc57e0720", "tier": "proxy", "family_name": "adaptive_budget_topk", "family_stage": "prototype", "change_type": "edit_sae_code", "expected_win": "lower_fvu", "hypothesis": "Ten no-improve rounds indicate the current fixed-per-sample-K search direction is fundamentally flawed, and recent pivots like `jumprelu` and `two_stage_residual` still stayed far behind the frontier. The next coherent architecture move is to change the sparsity mechanism itself: add `adaptive_budget_topk`, which keeps the same overall batch budget but allocates support dynamically across samples based on encoding difficulty instead of enforcing a rigid per-sample K. If hard examples need more active features and easy examples need fewer, this dynamic-budget routing could improve the quality frontier without changing the execution layer."}}
{"event_id": "evt_1774148043445175404", "ts": 1774148043, "event": "variable_isolation_warning", "round": 35, "session_id": "019d135d-4c60-7fa3-8438-b12bc57e0720", "tier": null, "run_name": null, "family_name": "adaptive_budget_topk", "family_stage": "prototype", "status": null, "decision": null, "payload": {"violation": "Multiple primary variables changed simultaneously: code_edit, architecture, lr"}}
{"event_id": "evt_1774148047989949746", "ts": 1774148047, "event": "behavioral_diff_identical_warning", "round": 35, "session_id": "019d135d-4c60-7fa3-8438-b12bc57e0720", "tier": null, "run_name": null, "family_name": "adaptive_budget_topk", "family_stage": "prototype", "status": null, "decision": null, "payload": {"architecture": "adaptive_budget_topk", "k": 128, "expansion_factor": 32, "max_diff": 0.0}}
{"event_id": "evt_1774148047990023552", "ts": 1774148047, "event": "proxy_mode_selected", "round": 35, "session_id": "019d135d-4c60-7fa3-8438-b12bc57e0720", "tier": "proxy", "run_name": null, "family_name": "adaptive_budget_topk", "family_stage": "prototype", "status": null, "decision": null, "payload": {"tier": "proxy", "proxy_mode": "fast", "evaluation_basis": "terminal_only", "parameter_behavior": "structural", "proxy_max_tokens": "40000000"}}
{"event_id": "evt_1774148047990076056", "ts": 1774148047, "event": "sanity_started", "round": 35, "session_id": "019d135d-4c60-7fa3-8438-b12bc57e0720", "tier": "proxy", "run_name": null, "family_name": "adaptive_budget_topk", "family_stage": "prototype", "status": null, "decision": null, "payload": {"tier": "proxy"}}
{"event_id": "evt_1774148052661216545", "ts": 1774148052, "event": "sanity_finished", "round": 35, "session_id": "019d135d-4c60-7fa3-8438-b12bc57e0720", "tier": "proxy", "run_name": null, "family_name": "adaptive_budget_topk", "family_stage": "prototype", "status": "ok", "decision": null, "payload": {"tier": "proxy", "status": "ok"}}
{"event_id": "evt_1774148052661634968", "ts": 1774148052, "event": "training_started", "round": 35, "session_id": "019d135d-4c60-7fa3-8438-b12bc57e0720", "tier": "proxy", "run_name": "round0035_proxy_1774148052", "family_name": "adaptive_budget_topk", "family_stage": "prototype", "status": null, "decision": null, "payload": {"tier": "proxy", "run_name": "round0035_proxy_1774148052", "family_name": "adaptive_budget_topk", "family_stage": "prototype", "checkpoint_dir": "/root/sparsify-ascend/checkpoints/research_agent/round_0035_proxy", "log_path": "/root/sparsify-ascend/research/history/logs/round0035_proxy_1774148052.log", "config": {"architecture": "adaptive_budget_topk", "expansion_factor": 32, "k": 128, "optimizer": "signum", "lr": "1.6e-3", "hookpoints": "layers.[3].self_attn.o_proj", "batch_size": 1, "grad_acc_steps": 8, "micro_acc_steps": 1, "auxk_alpha": 0.0, "dead_feature_threshold": 10000000, "use_hadamard": false, "tier": "proxy", "family_name": "adaptive_budget_topk", "family_stage": "prototype"}, "baseline_tokens_per_sec": null, "proxy_mode": "fast", "evaluation_basis": "terminal_only"}}
{"event_id": "evt_1774148082662828606", "ts": 1774148082, "event": "training_heartbeat", "round": 35, "session_id": "019d135d-4c60-7fa3-8438-b12bc57e0720", "tier": "proxy", "run_name": "round0035_proxy_1774148052", "family_name": "adaptive_budget_topk", "family_stage": "prototype", "status": null, "decision": null, "payload": {"tier": "proxy", "run_name": "round0035_proxy_1774148052", "family_name": "adaptive_budget_topk", "family_stage": "prototype", "checkpoint_dir": "/root/sparsify-ascend/checkpoints/research_agent/round_0035_proxy/round0035_proxy_1774148052_dp2_bs1_ga8_ef32_k128_20260322_105420", "metrics_path": "/root/sparsify-ascend/checkpoints/research_agent/round_0035_proxy/round0035_proxy_1774148052_dp2_bs1_ga8_ef32_k128_20260322_105420/metrics.jsonl", "latest_step": 10, "latest_tokens_per_sec": 10922.353134000143, "baseline_ratio": null, "latest_total_tokens": 327680.0, "proxy_mode": "fast", "evaluation_basis": "terminal_only"}}
{"event_id": "evt_1774148112663661489", "ts": 1774148112, "event": "training_heartbeat", "round": 35, "session_id": "019d135d-4c60-7fa3-8438-b12bc57e0720", "tier": "proxy", "run_name": "round0035_proxy_1774148052", "family_name": "adaptive_budget_topk", "family_stage": "prototype", "status": null, "decision": null, "payload": {"tier": "proxy", "run_name": "round0035_proxy_1774148052", "family_name": "adaptive_budget_topk", "family_stage": "prototype", "checkpoint_dir": "/root/sparsify-ascend/checkpoints/research_agent/round_0035_proxy/round0035_proxy_1774148052_dp2_bs1_ga8_ef32_k128_20260322_105420", "metrics_path": "/root/sparsify-ascend/checkpoints/research_agent/round_0035_proxy/round0035_proxy_1774148052_dp2_bs1_ga8_ef32_k128_20260322_105420/metrics.jsonl", "latest_step": 50, "latest_tokens_per_sec": 27305.893685076186, "baseline_ratio": null, "latest_total_tokens": 1638400.0, "proxy_mode": "fast", "evaluation_basis": "terminal_only"}}
{"event_id": "evt_1774148142664730696", "ts": 1774148142, "event": "training_heartbeat", "round": 35, "session_id": "019d135d-4c60-7fa3-8438-b12bc57e0720", "tier": "proxy", "run_name": "round0035_proxy_1774148052", "family_name": "adaptive_budget_topk", "family_stage": "prototype", "status": null, "decision": null, "payload": {"tier": "proxy", "run_name": "round0035_proxy_1774148052", "family_name": "adaptive_budget_topk", "family_stage": "prototype", "checkpoint_dir": "/root/sparsify-ascend/checkpoints/research_agent/round_0035_proxy/round0035_proxy_1774148052_dp2_bs1_ga8_ef32_k128_20260322_105420", "metrics_path": "/root/sparsify-ascend/checkpoints/research_agent/round_0035_proxy/round0035_proxy_1774148052_dp2_bs1_ga8_ef32_k128_20260322_105420/metrics.jsonl", "latest_step": 90, "latest_tokens_per_sec": 32766.998120911092, "baseline_ratio": null, "latest_total_tokens": 2949120.0, "proxy_mode": "fast", "evaluation_basis": "terminal_only"}}
{"event_id": "evt_1774148172665977901", "ts": 1774148172, "event": "training_heartbeat", "round": 35, "session_id": "019d135d-4c60-7fa3-8438-b12bc57e0720", "tier": "proxy", "run_name": "round0035_proxy_1774148052", "family_name": "adaptive_budget_topk", "family_stage": "prototype", "status": null, "decision": null, "payload": {"tier": "proxy", "run_name": "round0035_proxy_1774148052", "family_name": "adaptive_budget_topk", "family_stage": "prototype", "checkpoint_dir": "/root/sparsify-ascend/checkpoints/research_agent/round_0035_proxy/round0035_proxy_1774148052_dp2_bs1_ga8_ef32_k128_20260322_105420", "metrics_path": "/root/sparsify-ascend/checkpoints/research_agent/round_0035_proxy/round0035_proxy_1774148052_dp2_bs1_ga8_ef32_k128_20260322_105420/metrics.jsonl", "latest_step": 120, "latest_tokens_per_sec": 32766.905114709894, "baseline_ratio": null, "latest_total_tokens": 3932160.0, "proxy_mode": "fast", "evaluation_basis": "terminal_only"}}
{"event_id": "evt_1774148202667467929", "ts": 1774148202, "event": "training_heartbeat", "round": 35, "session_id": "019d135d-4c60-7fa3-8438-b12bc57e0720", "tier": "proxy", "run_name": "round0035_proxy_1774148052", "family_name": "adaptive_budget_topk", "family_stage": "prototype", "status": null, "decision": null, "payload": {"tier": "proxy", "run_name": "round0035_proxy_1774148052", "family_name": "adaptive_budget_topk", "family_stage": "prototype", "checkpoint_dir": "/root/sparsify-ascend/checkpoints/research_agent/round_0035_proxy/round0035_proxy_1774148052_dp2_bs1_ga8_ef32_k128_20260322_105420", "metrics_path": "/root/sparsify-ascend/checkpoints/research_agent/round_0035_proxy/round0035_proxy_1774148052_dp2_bs1_ga8_ef32_k128_20260322_105420/metrics.jsonl", "latest_step": 160, "latest_tokens_per_sec": 34951.25376906703, "baseline_ratio": null, "latest_total_tokens": 5242880.0, "proxy_mode": "fast", "evaluation_basis": "terminal_only"}}
{"event_id": "evt_1774148232669161004", "ts": 1774148232, "event": "training_heartbeat", "round": 35, "session_id": "019d135d-4c60-7fa3-8438-b12bc57e0720", "tier": "proxy", "run_name": "round0035_proxy_1774148052", "family_name": "adaptive_budget_topk", "family_stage": "prototype", "status": null, "decision": null, "payload": {"tier": "proxy", "run_name": "round0035_proxy_1774148052", "family_name": "adaptive_budget_topk", "family_stage": "prototype", "checkpoint_dir": "/root/sparsify-ascend/checkpoints/research_agent/round_0035_proxy/round0035_proxy_1774148052_dp2_bs1_ga8_ef32_k128_20260322_105420", "metrics_path": "/root/sparsify-ascend/checkpoints/research_agent/round_0035_proxy/round0035_proxy_1774148052_dp2_bs1_ga8_ef32_k128_20260322_105420/metrics.jsonl", "latest_step": 200, "latest_tokens_per_sec": 36407.433555474185, "baseline_ratio": null, "latest_total_tokens": 6553600.0, "proxy_mode": "fast", "evaluation_basis": "terminal_only"}}
{"event_id": "evt_1774148262671037943", "ts": 1774148262, "event": "training_heartbeat", "round": 35, "session_id": "019d135d-4c60-7fa3-8438-b12bc57e0720", "tier": "proxy", "run_name": "round0035_proxy_1774148052", "family_name": "adaptive_budget_topk", "family_stage": "prototype", "status": null, "decision": null, "payload": {"tier": "proxy", "run_name": "round0035_proxy_1774148052", "family_name": "adaptive_budget_topk", "family_stage": "prototype", "checkpoint_dir": "/root/sparsify-ascend/checkpoints/research_agent/round_0035_proxy/round0035_proxy_1774148052_dp2_bs1_ga8_ef32_k128_20260322_105420", "metrics_path": "/root/sparsify-ascend/checkpoints/research_agent/round_0035_proxy/round0035_proxy_1774148052_dp2_bs1_ga8_ef32_k128_20260322_105420/metrics.jsonl", "latest_step": 230, "latest_tokens_per_sec": 35887.213154989826, "baseline_ratio": null, "latest_total_tokens": 7536640.0, "proxy_mode": "fast", "evaluation_basis": "terminal_only"}}
{"event_id": "evt_1774148292673127005", "ts": 1774148292, "event": "training_heartbeat", "round": 35, "session_id": "019d135d-4c60-7fa3-8438-b12bc57e0720", "tier": "proxy", "run_name": "round0035_proxy_1774148052", "family_name": "adaptive_budget_topk", "family_stage": "prototype", "status": null, "decision": null, "payload": {"tier": "proxy", "run_name": "round0035_proxy_1774148052", "family_name": "adaptive_budget_topk", "family_stage": "prototype", "checkpoint_dir": "/root/sparsify-ascend/checkpoints/research_agent/round_0035_proxy/round0035_proxy_1774148052_dp2_bs1_ga8_ef32_k128_20260322_105420", "metrics_path": "/root/sparsify-ascend/checkpoints/research_agent/round_0035_proxy/round0035_proxy_1774148052_dp2_bs1_ga8_ef32_k128_20260322_105420/metrics.jsonl", "latest_step": 270, "latest_tokens_per_sec": 36862.285699841625, "baseline_ratio": null, "latest_total_tokens": 8847360.0, "proxy_mode": "fast", "evaluation_basis": "terminal_only"}}
{"event_id": "evt_1774148322675448592", "ts": 1774148322, "event": "training_heartbeat", "round": 35, "session_id": "019d135d-4c60-7fa3-8438-b12bc57e0720", "tier": "proxy", "run_name": "round0035_proxy_1774148052", "family_name": "adaptive_budget_topk", "family_stage": "prototype", "status": null, "decision": null, "payload": {"tier": "proxy", "run_name": "round0035_proxy_1774148052", "family_name": "adaptive_budget_topk", "family_stage": "prototype", "checkpoint_dir": "/root/sparsify-ascend/checkpoints/research_agent/round_0035_proxy/round0035_proxy_1774148052_dp2_bs1_ga8_ef32_k128_20260322_105420", "metrics_path": "/root/sparsify-ascend/checkpoints/research_agent/round_0035_proxy/round0035_proxy_1774148052_dp2_bs1_ga8_ef32_k128_20260322_105420/metrics.jsonl", "latest_step": 310, "latest_tokens_per_sec": 37620.64051298788, "baseline_ratio": null, "latest_total_tokens": 10158080.0, "proxy_mode": "fast", "evaluation_basis": "terminal_only"}}
{"event_id": "evt_1774148352677920139", "ts": 1774148352, "event": "training_heartbeat", "round": 35, "session_id": "019d135d-4c60-7fa3-8438-b12bc57e0720", "tier": "proxy", "run_name": "round0035_proxy_1774148052", "family_name": "adaptive_budget_topk", "family_stage": "prototype", "status": null, "decision": null, "payload": {"tier": "proxy", "run_name": "round0035_proxy_1774148052", "family_name": "adaptive_budget_topk", "family_stage": "prototype", "checkpoint_dir": "/root/sparsify-ascend/checkpoints/research_agent/round_0035_proxy/round0035_proxy_1774148052_dp2_bs1_ga8_ef32_k128_20260322_105420", "metrics_path": "/root/sparsify-ascend/checkpoints/research_agent/round_0035_proxy/round0035_proxy_1774148052_dp2_bs1_ga8_ef32_k128_20260322_105420/metrics.jsonl", "latest_step": 340, "latest_tokens_per_sec": 37135.09226296148, "baseline_ratio": null, "latest_total_tokens": 11141120.0, "proxy_mode": "fast", "evaluation_basis": "terminal_only"}}
{"event_id": "evt_1774148382680622524", "ts": 1774148382, "event": "training_heartbeat", "round": 35, "session_id": "019d135d-4c60-7fa3-8438-b12bc57e0720", "tier": "proxy", "run_name": "round0035_proxy_1774148052", "family_name": "adaptive_budget_topk", "family_stage": "prototype", "status": null, "decision": null, "payload": {"tier": "proxy", "run_name": "round0035_proxy_1774148052", "family_name": "adaptive_budget_topk", "family_stage": "prototype", "checkpoint_dir": "/root/sparsify-ascend/checkpoints/research_agent/round_0035_proxy/round0035_proxy_1774148052_dp2_bs1_ga8_ef32_k128_20260322_105420", "metrics_path": "/root/sparsify-ascend/checkpoints/research_agent/round_0035_proxy/round0035_proxy_1774148052_dp2_bs1_ga8_ef32_k128_20260322_105420/metrics.jsonl", "latest_step": 380, "latest_tokens_per_sec": 37730.717784177774, "baseline_ratio": null, "latest_total_tokens": 12451840.0, "proxy_mode": "fast", "evaluation_basis": "terminal_only"}}
