{"event_id": "evt_1774155521539052445", "ts": 1774155521, "event": "agent_action_received", "round": 44, "session_id": "019d13dc-400c-7493-83af-bd34fffa7466", "tier": "proxy", "run_name": null, "family_name": "lowrank_gated_residual", "family_stage": "mainline", "status": null, "decision": null, "payload": {"session_id": "019d13dc-400c-7493-83af-bd34fffa7466", "tier": "proxy", "family_name": "lowrank_gated_residual", "family_stage": "mainline", "change_type": "param_only", "expected_win": "smaller_k", "hypothesis": "`lowrank_gated_residual` continues to produce smooth, non-dominated tradeoffs as K is reduced, and the new `K=80` full point now cleanly fills the gap between `K=64` and `K=96`. The next highest-value K-only probe is `K=72` on the same recipe, which directly tests whether the frontier can be pushed further downward in K while staying materially above the `K=64` quality floor."}}
{"event_id": "evt_1774155521539199949", "ts": 1774155521, "event": "proxy_mode_selected", "round": 44, "session_id": "019d13dc-400c-7493-83af-bd34fffa7466", "tier": "proxy", "run_name": null, "family_name": "lowrank_gated_residual", "family_stage": "mainline", "status": null, "decision": null, "payload": {"tier": "proxy", "proxy_mode": "fast", "evaluation_basis": "terminal_only", "parameter_behavior": "structural", "proxy_max_tokens": "5000000"}}
{"event_id": "evt_1774155521539497028", "ts": 1774155521, "event": "training_started", "round": 44, "session_id": "019d13dc-400c-7493-83af-bd34fffa7466", "tier": "proxy", "run_name": "round0044_proxy_1774155521", "family_name": "lowrank_gated_residual", "family_stage": "mainline", "status": null, "decision": null, "payload": {"tier": "proxy", "run_name": "round0044_proxy_1774155521", "family_name": "lowrank_gated_residual", "family_stage": "mainline", "checkpoint_dir": "/root/sparsify-ascend/checkpoints/research_agent/round_0044_proxy", "log_path": "/root/sparsify-ascend/research/history/logs/round0044_proxy_1774155521.log", "config": {"architecture": "lowrank_gated_residual", "expansion_factor": 32, "k": 72, "optimizer": "signum", "lr": "1.6e-3", "hookpoints": "layers.[3].self_attn.o_proj", "batch_size": 1, "grad_acc_steps": 8, "micro_acc_steps": 1, "auxk_alpha": 0.0, "dead_feature_threshold": 10000000, "use_hadamard": false, "tier": "proxy", "family_name": "lowrank_gated_residual", "family_stage": "mainline"}, "baseline_tokens_per_sec": 83008.58788873068, "proxy_mode": "fast", "evaluation_basis": "terminal_only"}}
{"event_id": "evt_1774155551540834997", "ts": 1774155551, "event": "training_heartbeat", "round": 44, "session_id": "019d13dc-400c-7493-83af-bd34fffa7466", "tier": "proxy", "run_name": "round0044_proxy_1774155521", "family_name": "lowrank_gated_residual", "family_stage": "mainline", "status": null, "decision": null, "payload": {"tier": "proxy", "run_name": "round0044_proxy_1774155521", "family_name": "lowrank_gated_residual", "family_stage": "mainline", "checkpoint_dir": "/root/sparsify-ascend/checkpoints/research_agent/round_0044_proxy/round0044_proxy_1774155521_dp2_bs1_ga8_ef32_k72_20260322_125850", "metrics_path": "/root/sparsify-ascend/checkpoints/research_agent/round_0044_proxy/round0044_proxy_1774155521_dp2_bs1_ga8_ef32_k72_20260322_125850/metrics.jsonl", "latest_step": 40, "latest_tokens_per_sec": 43689.206646013685, "baseline_ratio": 0.5263215259676158, "latest_total_tokens": 1310720.0, "proxy_mode": "fast", "evaluation_basis": "terminal_only"}}
{"event_id": "evt_1774155581542040516", "ts": 1774155581, "event": "training_heartbeat", "round": 44, "session_id": "019d13dc-400c-7493-83af-bd34fffa7466", "tier": "proxy", "run_name": "round0044_proxy_1774155521", "family_name": "lowrank_gated_residual", "family_stage": "mainline", "status": null, "decision": null, "payload": {"tier": "proxy", "run_name": "round0044_proxy_1774155521", "family_name": "lowrank_gated_residual", "family_stage": "mainline", "checkpoint_dir": "/root/sparsify-ascend/checkpoints/research_agent/round_0044_proxy/round0044_proxy_1774155521_dp2_bs1_ga8_ef32_k72_20260322_125850", "metrics_path": "/root/sparsify-ascend/checkpoints/research_agent/round_0044_proxy/round0044_proxy_1774155521_dp2_bs1_ga8_ef32_k72_20260322_125850/metrics.jsonl", "latest_step": 120, "latest_tokens_per_sec": 65533.583162048155, "baseline_ratio": 0.7894795566200091, "latest_total_tokens": 3932160.0, "proxy_mode": "fast", "evaluation_basis": "terminal_only"}}
{"event_id": "evt_1774155611756740046", "ts": 1774155611, "event": "training_heartbeat", "round": 44, "session_id": "019d13dc-400c-7493-83af-bd34fffa7466", "tier": "proxy", "run_name": "round0044_proxy_1774155521", "family_name": "lowrank_gated_residual", "family_stage": "mainline", "status": null, "decision": null, "payload": {"tier": "proxy", "run_name": "round0044_proxy_1774155521", "family_name": "lowrank_gated_residual", "family_stage": "mainline", "checkpoint_dir": "/root/sparsify-ascend/checkpoints/research_agent/round_0044_proxy/round0044_proxy_1774155521_dp2_bs1_ga8_ef32_k72_20260322_125850", "metrics_path": "/root/sparsify-ascend/checkpoints/research_agent/round_0044_proxy/round0044_proxy_1774155521_dp2_bs1_ga8_ef32_k72_20260322_125850/metrics.jsonl", "latest_step": 152, "latest_tokens_per_sec": 55339.285444451394, "baseline_ratio": 0.6666693995400964, "latest_total_tokens": 4980736.0, "proxy_mode": "fast", "evaluation_basis": "terminal_only"}}
{"event_id": "evt_1774155612603860436", "ts": 1774155612, "event": "training_finished", "round": 44, "session_id": "019d13dc-400c-7493-83af-bd34fffa7466", "tier": "proxy", "run_name": "round0044_proxy_1774155521", "family_name": "lowrank_gated_residual", "family_stage": "mainline", "status": "ok", "decision": "promote", "payload": {"tier": "proxy", "run_name": "round0044_proxy_1774155521", "family_name": "lowrank_gated_residual", "family_stage": "mainline", "checkpoint_dir": "/root/sparsify-ascend/checkpoints/research_agent/round_0044_proxy/round0044_proxy_1774155521_dp2_bs1_ga8_ef32_k72_20260322_125850", "metrics_path": "/root/sparsify-ascend/checkpoints/research_agent/round_0044_proxy/round0044_proxy_1774155521_dp2_bs1_ga8_ef32_k72_20260322_125850/metrics.jsonl", "run_health": "normal", "termination_reason": "completed", "tokens_per_sec": 55339.285444451394, "baseline_ratio": 0.6666693995400964, "status": "ok", "decision": "promote", "proxy_mode": "fast", "evaluation_basis": "terminal_only", "curve_start_fvu": 0.2897602319717407, "curve_mid_fvu": 0.18926668167114258, "curve_end_fvu": 0.14927524328231812, "curve_late_slope": -6.05833490901146e-09, "curve_still_improving": true}}
{"event_id": "evt_1774155612612851775", "ts": 1774155612, "event": "result_recorded", "round": 44, "session_id": "019d13dc-400c-7493-83af-bd34fffa7466", "tier": "proxy", "run_name": "round0044_proxy_1774155521", "family_name": "lowrank_gated_residual", "family_stage": "mainline", "status": "ok", "decision": "promote", "payload": {"tier": "proxy", "run_name": "round0044_proxy_1774155521", "family_name": "lowrank_gated_residual", "family_stage": "mainline", "status": "ok", "decision": "promote", "val_fvu": "0.15007649548351765", "observed_fvu": "0.149275", "k": "72", "log_path": "/root/sparsify-ascend/research/history/logs/proxy_1774155612.log", "checkpoint": null}}
{"event_id": "evt_1774155612613300323", "ts": 1774155612, "event": "training_started", "round": 44, "session_id": "019d13dc-400c-7493-83af-bd34fffa7466", "tier": "full", "run_name": "round0044_full_1774155612", "family_name": "lowrank_gated_residual", "family_stage": "mainline", "status": null, "decision": null, "payload": {"tier": "full", "run_name": "round0044_full_1774155612", "family_name": "lowrank_gated_residual", "family_stage": "mainline", "checkpoint_dir": "/root/sparsify-ascend/checkpoints/research_agent/round_0044_full", "log_path": "/root/sparsify-ascend/research/history/logs/round0044_full_1774155612.log", "config": {"architecture": "lowrank_gated_residual", "expansion_factor": 32, "k": 72, "optimizer": "signum", "lr": "1.6e-3", "hookpoints": "layers.[3].self_attn.o_proj", "batch_size": 1, "grad_acc_steps": 8, "micro_acc_steps": 1, "auxk_alpha": 0.0, "dead_feature_threshold": 10000000, "use_hadamard": false, "tier": "full", "family_name": "lowrank_gated_residual", "family_stage": "mainline"}, "baseline_tokens_per_sec": 88695.60575375632, "proxy_mode": null, "evaluation_basis": null}}
{"event_id": "evt_1774155642617208421", "ts": 1774155642, "event": "training_heartbeat", "round": 44, "session_id": "019d13dc-400c-7493-83af-bd34fffa7466", "tier": "full", "run_name": "round0044_full_1774155612", "family_name": "lowrank_gated_residual", "family_stage": "mainline", "status": null, "decision": null, "payload": {"tier": "full", "run_name": "round0044_full_1774155612", "family_name": "lowrank_gated_residual", "family_stage": "mainline", "checkpoint_dir": "/root/sparsify-ascend/checkpoints/research_agent/round_0044_full/round0044_full_1774155612_dp2_bs1_ga8_ef32_k72_20260322_130020", "metrics_path": "/root/sparsify-ascend/checkpoints/research_agent/round_0044_full/round0044_full_1774155612_dp2_bs1_ga8_ef32_k72_20260322_130020/metrics.jsonl", "latest_step": 40, "latest_tokens_per_sec": 43689.23268595542, "baseline_ratio": 0.49257494003985824, "latest_total_tokens": 1310720.0, "proxy_mode": null, "evaluation_basis": null}}
{"event_id": "evt_1774155672618439578", "ts": 1774155672, "event": "training_heartbeat", "round": 44, "session_id": "019d13dc-400c-7493-83af-bd34fffa7466", "tier": "full", "run_name": "round0044_full_1774155612", "family_name": "lowrank_gated_residual", "family_stage": "mainline", "status": null, "decision": null, "payload": {"tier": "full", "run_name": "round0044_full_1774155612", "family_name": "lowrank_gated_residual", "family_stage": "mainline", "checkpoint_dir": "/root/sparsify-ascend/checkpoints/research_agent/round_0044_full/round0044_full_1774155612_dp2_bs1_ga8_ef32_k72_20260322_130020", "metrics_path": "/root/sparsify-ascend/checkpoints/research_agent/round_0044_full/round0044_full_1774155612_dp2_bs1_ga8_ef32_k72_20260322_130020/metrics.jsonl", "latest_step": 120, "latest_tokens_per_sec": 65533.56467383373, "baseline_ratio": 0.7388592040937534, "latest_total_tokens": 3932160.0, "proxy_mode": null, "evaluation_basis": null}}
{"event_id": "evt_1774155702620155800", "ts": 1774155702, "event": "training_heartbeat", "round": 44, "session_id": "019d13dc-400c-7493-83af-bd34fffa7466", "tier": "full", "run_name": "round0044_full_1774155612", "family_name": "lowrank_gated_residual", "family_stage": "mainline", "status": null, "decision": null, "payload": {"tier": "full", "run_name": "round0044_full_1774155612", "family_name": "lowrank_gated_residual", "family_stage": "mainline", "checkpoint_dir": "/root/sparsify-ascend/checkpoints/research_agent/round_0044_full/round0044_full_1774155612_dp2_bs1_ga8_ef32_k72_20260322_130020", "metrics_path": "/root/sparsify-ascend/checkpoints/research_agent/round_0044_full/round0044_full_1774155612_dp2_bs1_ga8_ef32_k72_20260322_130020/metrics.jsonl", "latest_step": 210, "latest_tokens_per_sec": 76455.3193305795, "baseline_ratio": 0.8619966984930544, "latest_total_tokens": 6881280.0, "proxy_mode": null, "evaluation_basis": null}}
{"event_id": "evt_1774155732622415860", "ts": 1774155732, "event": "training_heartbeat", "round": 44, "session_id": "019d13dc-400c-7493-83af-bd34fffa7466", "tier": "full", "run_name": "round0044_full_1774155612", "family_name": "lowrank_gated_residual", "family_stage": "mainline", "status": null, "decision": null, "payload": {"tier": "full", "run_name": "round0044_full_1774155612", "family_name": "lowrank_gated_residual", "family_stage": "mainline", "checkpoint_dir": "/root/sparsify-ascend/checkpoints/research_agent/round_0044_full/round0044_full_1774155612_dp2_bs1_ga8_ef32_k72_20260322_130020", "metrics_path": "/root/sparsify-ascend/checkpoints/research_agent/round_0044_full/round0044_full_1774155612_dp2_bs1_ga8_ef32_k72_20260322_130020/metrics.jsonl", "latest_step": 300, "latest_tokens_per_sec": 81915.77674768204, "baseline_ratio": 0.9235607113964928, "latest_total_tokens": 9830400.0, "proxy_mode": null, "evaluation_basis": null}}
{"event_id": "evt_1774155762625117935", "ts": 1774155762, "event": "training_heartbeat", "round": 44, "session_id": "019d13dc-400c-7493-83af-bd34fffa7466", "tier": "full", "run_name": "round0044_full_1774155612", "family_name": "lowrank_gated_residual", "family_stage": "mainline", "status": null, "decision": null, "payload": {"tier": "full", "run_name": "round0044_full_1774155612", "family_name": "lowrank_gated_residual", "family_stage": "mainline", "checkpoint_dir": "/root/sparsify-ascend/checkpoints/research_agent/round_0044_full/round0044_full_1774155612_dp2_bs1_ga8_ef32_k72_20260322_130020", "metrics_path": "/root/sparsify-ascend/checkpoints/research_agent/round_0044_full/round0044_full_1774155612_dp2_bs1_ga8_ef32_k72_20260322_130020/metrics.jsonl", "latest_step": 380, "latest_tokens_per_sec": 83007.34041735886, "baseline_ratio": 0.9358675631328381, "latest_total_tokens": 12451840.0, "proxy_mode": null, "evaluation_basis": null}}
{"event_id": "evt_1774155792628288776", "ts": 1774155792, "event": "training_heartbeat", "round": 44, "session_id": "019d13dc-400c-7493-83af-bd34fffa7466", "tier": "full", "run_name": "round0044_full_1774155612", "family_name": "lowrank_gated_residual", "family_stage": "mainline", "status": null, "decision": null, "payload": {"tier": "full", "run_name": "round0044_full_1774155612", "family_name": "lowrank_gated_residual", "family_stage": "mainline", "checkpoint_dir": "/root/sparsify-ascend/checkpoints/research_agent/round_0044_full/round0044_full_1774155612_dp2_bs1_ga8_ef32_k72_20260322_130020", "metrics_path": "/root/sparsify-ascend/checkpoints/research_agent/round_0044_full/round0044_full_1774155612_dp2_bs1_ga8_ef32_k72_20260322_130020/metrics.jsonl", "latest_step": 470, "latest_tokens_per_sec": 85555.1511756919, "baseline_ratio": 0.9645928955400205, "latest_total_tokens": 15400960.0, "proxy_mode": null, "evaluation_basis": null}}
{"event_id": "evt_1774155822631980785", "ts": 1774155822, "event": "training_heartbeat", "round": 44, "session_id": "019d13dc-400c-7493-83af-bd34fffa7466", "tier": "full", "run_name": "round0044_full_1774155612", "family_name": "lowrank_gated_residual", "family_stage": "mainline", "status": null, "decision": null, "payload": {"tier": "full", "run_name": "round0044_full_1774155612", "family_name": "lowrank_gated_residual", "family_stage": "mainline", "checkpoint_dir": "/root/sparsify-ascend/checkpoints/research_agent/round_0044_full/round0044_full_1774155612_dp2_bs1_ga8_ef32_k72_20260322_130020", "metrics_path": "/root/sparsify-ascend/checkpoints/research_agent/round_0044_full/round0044_full_1774155612_dp2_bs1_ga8_ef32_k72_20260322_130020/metrics.jsonl", "latest_step": 560, "latest_tokens_per_sec": 87374.77489704457, "baseline_ratio": 0.9851082717628792, "latest_total_tokens": 18350080.0, "proxy_mode": null, "evaluation_basis": null}}
{"event_id": "evt_1774155852636184527", "ts": 1774155852, "event": "training_heartbeat", "round": 44, "session_id": "019d13dc-400c-7493-83af-bd34fffa7466", "tier": "full", "run_name": "round0044_full_1774155612", "family_name": "lowrank_gated_residual", "family_stage": "mainline", "status": null, "decision": null, "payload": {"tier": "full", "run_name": "round0044_full_1774155612", "family_name": "lowrank_gated_residual", "family_stage": "mainline", "checkpoint_dir": "/root/sparsify-ascend/checkpoints/research_agent/round_0044_full/round0044_full_1774155612_dp2_bs1_ga8_ef32_k72_20260322_130020", "metrics_path": "/root/sparsify-ascend/checkpoints/research_agent/round_0044_full/round0044_full_1774155612_dp2_bs1_ga8_ef32_k72_20260322_130020/metrics.jsonl", "latest_step": 640, "latest_tokens_per_sec": 87374.06848599103, "baseline_ratio": 0.9851003073203621, "latest_total_tokens": 20971520.0, "proxy_mode": null, "evaluation_basis": null}}
{"event_id": "evt_1774155882640849463", "ts": 1774155882, "event": "training_heartbeat", "round": 44, "session_id": "019d13dc-400c-7493-83af-bd34fffa7466", "tier": "full", "run_name": "round0044_full_1774155612", "family_name": "lowrank_gated_residual", "family_stage": "mainline", "status": null, "decision": null, "payload": {"tier": "full", "run_name": "round0044_full_1774155612", "family_name": "lowrank_gated_residual", "family_stage": "mainline", "checkpoint_dir": "/root/sparsify-ascend/checkpoints/research_agent/round_0044_full/round0044_full_1774155612_dp2_bs1_ga8_ef32_k72_20260322_130020", "metrics_path": "/root/sparsify-ascend/checkpoints/research_agent/round_0044_full/round0044_full_1774155612_dp2_bs1_ga8_ef32_k72_20260322_130020/metrics.jsonl", "latest_step": 730, "latest_tokens_per_sec": 88586.88341221976, "baseline_ratio": 0.9987742082529049, "latest_total_tokens": 23920640.0, "proxy_mode": null, "evaluation_basis": null}}
{"event_id": "evt_1774155912646074163", "ts": 1774155912, "event": "training_heartbeat", "round": 44, "session_id": "019d13dc-400c-7493-83af-bd34fffa7466", "tier": "full", "run_name": "round0044_full_1774155612", "family_name": "lowrank_gated_residual", "family_stage": "mainline", "status": null, "decision": null, "payload": {"tier": "full", "run_name": "round0044_full_1774155612", "family_name": "lowrank_gated_residual", "family_stage": "mainline", "checkpoint_dir": "/root/sparsify-ascend/checkpoints/research_agent/round_0044_full/round0044_full_1774155612_dp2_bs1_ga8_ef32_k72_20260322_130020", "metrics_path": "/root/sparsify-ascend/checkpoints/research_agent/round_0044_full/round0044_full_1774155612_dp2_bs1_ga8_ef32_k72_20260322_130020/metrics.jsonl", "latest_step": 820, "latest_tokens_per_sec": 89556.9571710756, "baseline_ratio": 1.0097113200817482, "latest_total_tokens": 26869760.0, "proxy_mode": null, "evaluation_basis": null}}
{"event_id": "evt_1774155942651743290", "ts": 1774155942, "event": "training_heartbeat", "round": 44, "session_id": "019d13dc-400c-7493-83af-bd34fffa7466", "tier": "full", "run_name": "round0044_full_1774155612", "family_name": "lowrank_gated_residual", "family_stage": "mainline", "status": null, "decision": null, "payload": {"tier": "full", "run_name": "round0044_full_1774155612", "family_name": "lowrank_gated_residual", "family_stage": "mainline", "checkpoint_dir": "/root/sparsify-ascend/checkpoints/research_agent/round_0044_full/round0044_full_1774155612_dp2_bs1_ga8_ef32_k72_20260322_130020", "metrics_path": "/root/sparsify-ascend/checkpoints/research_agent/round_0044_full/round0044_full_1774155612_dp2_bs1_ga8_ef32_k72_20260322_130020/metrics.jsonl", "latest_step": 910, "latest_tokens_per_sec": 90350.51981705308, "baseline_ratio": 1.0186583545964076, "latest_total_tokens": 29818880.0, "proxy_mode": null, "evaluation_basis": null}}
{"event_id": "evt_1774155972657834449", "ts": 1774155972, "event": "training_heartbeat", "round": 44, "session_id": "019d13dc-400c-7493-83af-bd34fffa7466", "tier": "full", "run_name": "round0044_full_1774155612", "family_name": "lowrank_gated_residual", "family_stage": "mainline", "status": null, "decision": null, "payload": {"tier": "full", "run_name": "round0044_full_1774155612", "family_name": "lowrank_gated_residual", "family_stage": "mainline", "checkpoint_dir": "/root/sparsify-ascend/checkpoints/research_agent/round_0044_full/round0044_full_1774155612_dp2_bs1_ga8_ef32_k72_20260322_130020", "metrics_path": "/root/sparsify-ascend/checkpoints/research_agent/round_0044_full/round0044_full_1774155612_dp2_bs1_ga8_ef32_k72_20260322_130020/metrics.jsonl", "latest_step": 990, "latest_tokens_per_sec": 90101.58730904007, "baseline_ratio": 1.0158517611254287, "latest_total_tokens": 32440320.0, "proxy_mode": null, "evaluation_basis": null}}
{"event_id": "evt_1774156002712882181", "ts": 1774156002, "event": "training_heartbeat", "round": 44, "session_id": "019d13dc-400c-7493-83af-bd34fffa7466", "tier": "full", "run_name": "round0044_full_1774155612", "family_name": "lowrank_gated_residual", "family_stage": "mainline", "status": null, "decision": null, "payload": {"tier": "full", "run_name": "round0044_full_1774155612", "family_name": "lowrank_gated_residual", "family_stage": "mainline", "checkpoint_dir": "/root/sparsify-ascend/checkpoints/research_agent/round_0044_full/round0044_full_1774155612_dp2_bs1_ga8_ef32_k72_20260322_130020", "metrics_path": "/root/sparsify-ascend/checkpoints/research_agent/round_0044_full/round0044_full_1774155612_dp2_bs1_ga8_ef32_k72_20260322_130020/metrics.jsonl", "latest_step": 1030, "latest_tokens_per_sec": 86530.48954455409, "baseline_ratio": 0.975589363297059, "latest_total_tokens": 33751040.0, "proxy_mode": null, "evaluation_basis": null}}
{"event_id": "evt_1774156032762837511", "ts": 1774156032, "event": "training_heartbeat", "round": 44, "session_id": "019d13dc-400c-7493-83af-bd34fffa7466", "tier": "full", "run_name": "round0044_full_1774155612", "family_name": "lowrank_gated_residual", "family_stage": "mainline", "status": null, "decision": null, "payload": {"tier": "full", "run_name": "round0044_full_1774155612", "family_name": "lowrank_gated_residual", "family_stage": "mainline", "checkpoint_dir": "/root/sparsify-ascend/checkpoints/research_agent/round_0044_full/round0044_full_1774155612_dp2_bs1_ga8_ef32_k72_20260322_130020", "metrics_path": "/root/sparsify-ascend/checkpoints/research_agent/round_0044_full/round0044_full_1774155612_dp2_bs1_ga8_ef32_k72_20260322_130020/metrics.jsonl", "latest_step": 1120, "latest_tokens_per_sec": 87359.79826496002, "baseline_ratio": 0.9849394174892399, "latest_total_tokens": 36700160.0, "proxy_mode": null, "evaluation_basis": null}}
