{"event_id": "evt_1774137803225545347", "ts": 1774137803, "event": "training_finished", "round": 16, "session_id": "019d12cf-0aba-71d0-8920-5ea920811f62", "tier": "proxy", "run_name": "round0016_proxy_1774137743", "family_name": "lowrank_residual", "family_stage": "stabilize", "status": "ok", "decision": "promote", "payload": {"tier": "proxy", "run_name": "round0016_proxy_1774137743", "family_name": "lowrank_residual", "family_stage": "stabilize", "checkpoint_dir": "/root/sparsify-ascend/checkpoints/research_agent/round_0016_proxy/round0016_proxy_1774137743_dp2_bs1_ga8_ef16_k128_20260322_080229", "metrics_path": "/root/sparsify-ascend/checkpoints/research_agent/round_0016_proxy/round0016_proxy_1774137743_dp2_bs1_ga8_ef16_k128_20260322_080229/metrics.jsonl", "run_health": "normal", "termination_reason": "completed", "tokens_per_sec": 83008.34876130984, "baseline_ratio": 1.000000027814188, "status": "ok", "decision": "promote", "proxy_mode": "fast", "evaluation_basis": "terminal_only", "curve_start_fvu": 0.26143357157707214, "curve_mid_fvu": 0.17164607346057892, "curve_end_fvu": 0.1358388066291809, "curve_late_slope": -5.5161440433303434e-09, "curve_still_improving": true}}
{"event_id": "evt_1774137803225601049", "ts": 1774137803, "event": "result_recorded", "round": 16, "session_id": "019d12cf-0aba-71d0-8920-5ea920811f62", "tier": "proxy", "run_name": "round0016_proxy_1774137743", "family_name": "lowrank_residual", "family_stage": "stabilize", "status": "ok", "decision": "promote", "payload": {"tier": "proxy", "run_name": "round0016_proxy_1774137743", "family_name": "lowrank_residual", "family_stage": "stabilize", "status": "ok", "decision": "promote", "val_fvu": "0.13682659436017275", "observed_fvu": "0.135839", "k": "128", "log_path": "/root/sparsify-ascend/research/history/logs/proxy_1774137803.log", "checkpoint": null}}
{"event_id": "evt_1774137803225982101", "ts": 1774137803, "event": "training_started", "round": 16, "session_id": "019d12cf-0aba-71d0-8920-5ea920811f62", "tier": "full", "run_name": "round0016_full_1774137803", "family_name": "lowrank_residual", "family_stage": "stabilize", "status": null, "decision": null, "payload": {"tier": "full", "run_name": "round0016_full_1774137803", "family_name": "lowrank_residual", "family_stage": "stabilize", "checkpoint_dir": "/root/sparsify-ascend/checkpoints/research_agent/round_0016_full", "log_path": "/root/sparsify-ascend/research/history/logs/round0016_full_1774137803.log", "config": {"architecture": "lowrank_residual", "expansion_factor": 16, "k": 128, "optimizer": "signum", "lr": "1.6e-3", "hookpoints": "layers.[3].self_attn.o_proj", "batch_size": 1, "grad_acc_steps": 8, "micro_acc_steps": 1, "auxk_alpha": 0.0, "dead_feature_threshold": 10000000, "use_hadamard": false, "tier": "full", "family_name": "lowrank_residual", "family_stage": "stabilize"}, "baseline_tokens_per_sec": null, "proxy_mode": null, "evaluation_basis": null}}
{"event_id": "evt_1774137833227568540", "ts": 1774137833, "event": "training_heartbeat", "round": 16, "session_id": "019d12cf-0aba-71d0-8920-5ea920811f62", "tier": "full", "run_name": "round0016_full_1774137803", "family_name": "lowrank_residual", "family_stage": "stabilize", "status": null, "decision": null, "payload": {"tier": "full", "run_name": "round0016_full_1774137803", "family_name": "lowrank_residual", "family_stage": "stabilize", "checkpoint_dir": "/root/sparsify-ascend/checkpoints/research_agent/round_0016_full/round0016_full_1774137803_dp2_bs1_ga8_ef16_k128_20260322_080329", "metrics_path": "/root/sparsify-ascend/checkpoints/research_agent/round_0016_full/round0016_full_1774137803_dp2_bs1_ga8_ef16_k128_20260322_080329/metrics.jsonl", "latest_step": 110, "latest_tokens_per_sec": 120144.1066509898, "baseline_ratio": null, "latest_total_tokens": 3604480.0, "proxy_mode": null, "evaluation_basis": null}}
{"event_id": "evt_1774137863229893903", "ts": 1774137863, "event": "training_heartbeat", "round": 16, "session_id": "019d12cf-0aba-71d0-8920-5ea920811f62", "tier": "full", "run_name": "round0016_full_1774137803", "family_name": "lowrank_residual", "family_stage": "stabilize", "status": null, "decision": null, "payload": {"tier": "full", "run_name": "round0016_full_1774137803", "family_name": "lowrank_residual", "family_stage": "stabilize", "checkpoint_dir": "/root/sparsify-ascend/checkpoints/research_agent/round_0016_full/round0016_full_1774137803_dp2_bs1_ga8_ef16_k128_20260322_080329", "metrics_path": "/root/sparsify-ascend/checkpoints/research_agent/round_0016_full/round0016_full_1774137803_dp2_bs1_ga8_ef16_k128_20260322_080329/metrics.jsonl", "latest_step": 310, "latest_tokens_per_sec": 169291.12776367148, "baseline_ratio": null, "latest_total_tokens": 10158080.0, "proxy_mode": null, "evaluation_basis": null}}
{"event_id": "evt_1774137893233305336", "ts": 1774137893, "event": "training_heartbeat", "round": 16, "session_id": "019d12cf-0aba-71d0-8920-5ea920811f62", "tier": "full", "run_name": "round0016_full_1774137803", "family_name": "lowrank_residual", "family_stage": "stabilize", "status": null, "decision": null, "payload": {"tier": "full", "run_name": "round0016_full_1774137803", "family_name": "lowrank_residual", "family_stage": "stabilize", "checkpoint_dir": "/root/sparsify-ascend/checkpoints/research_agent/round_0016_full/round0016_full_1774137803_dp2_bs1_ga8_ef16_k128_20260322_080329", "metrics_path": "/root/sparsify-ascend/checkpoints/research_agent/round_0016_full/round0016_full_1774137803_dp2_bs1_ga8_ef16_k128_20260322_080329/metrics.jsonl", "latest_step": 510, "latest_tokens_per_sec": 185670.81117635308, "baseline_ratio": null, "latest_total_tokens": 16711680.0, "proxy_mode": null, "evaluation_basis": null}}
{"event_id": "evt_1774137923237884218", "ts": 1774137923, "event": "training_heartbeat", "round": 16, "session_id": "019d12cf-0aba-71d0-8920-5ea920811f62", "tier": "full", "run_name": "round0016_full_1774137803", "family_name": "lowrank_residual", "family_stage": "stabilize", "status": null, "decision": null, "payload": {"tier": "full", "run_name": "round0016_full_1774137803", "family_name": "lowrank_residual", "family_stage": "stabilize", "checkpoint_dir": "/root/sparsify-ascend/checkpoints/research_agent/round_0016_full/round0016_full_1774137803_dp2_bs1_ga8_ef16_k128_20260322_080329", "metrics_path": "/root/sparsify-ascend/checkpoints/research_agent/round_0016_full/round0016_full_1774137803_dp2_bs1_ga8_ef16_k128_20260322_080329/metrics.jsonl", "latest_step": 720, "latest_tokens_per_sec": 196588.97176365572, "baseline_ratio": null, "latest_total_tokens": 23592960.0, "proxy_mode": null, "evaluation_basis": null}}
{"event_id": "evt_1774137953243826307", "ts": 1774137953, "event": "training_heartbeat", "round": 16, "session_id": "019d12cf-0aba-71d0-8920-5ea920811f62", "tier": "full", "run_name": "round0016_full_1774137803", "family_name": "lowrank_residual", "family_stage": "stabilize", "status": null, "decision": null, "payload": {"tier": "full", "run_name": "round0016_full_1774137803", "family_name": "lowrank_residual", "family_stage": "stabilize", "checkpoint_dir": "/root/sparsify-ascend/checkpoints/research_agent/round_0016_full/round0016_full_1774137803_dp2_bs1_ga8_ef16_k128_20260322_080329", "metrics_path": "/root/sparsify-ascend/checkpoints/research_agent/round_0016_full/round0016_full_1774137803_dp2_bs1_ga8_ef16_k128_20260322_080329/metrics.jsonl", "latest_step": 920, "latest_tokens_per_sec": 200953.86969161613, "baseline_ratio": null, "latest_total_tokens": 30146560.0, "proxy_mode": null, "evaluation_basis": null}}
{"event_id": "evt_1774137983430585424", "ts": 1774137983, "event": "training_heartbeat", "round": 16, "session_id": "019d12cf-0aba-71d0-8920-5ea920811f62", "tier": "full", "run_name": "round0016_full_1774137803", "family_name": "lowrank_residual", "family_stage": "stabilize", "status": null, "decision": null, "payload": {"tier": "full", "run_name": "round0016_full_1774137803", "family_name": "lowrank_residual", "family_stage": "stabilize", "checkpoint_dir": "/root/sparsify-ascend/checkpoints/research_agent/round_0016_full/round0016_full_1774137803_dp2_bs1_ga8_ef16_k128_20260322_080329", "metrics_path": "/root/sparsify-ascend/checkpoints/research_agent/round_0016_full/round0016_full_1774137803_dp2_bs1_ga8_ef16_k128_20260322_080329/metrics.jsonl", "latest_step": 1080, "latest_tokens_per_sec": 196581.5871426024, "baseline_ratio": null, "latest_total_tokens": 35389440.0, "proxy_mode": null, "evaluation_basis": null}}
{"event_id": "evt_1774138013438063865", "ts": 1774138013, "event": "training_heartbeat", "round": 16, "session_id": "019d12cf-0aba-71d0-8920-5ea920811f62", "tier": "full", "run_name": "round0016_full_1774137803", "family_name": "lowrank_residual", "family_stage": "stabilize", "status": null, "decision": null, "payload": {"tier": "full", "run_name": "round0016_full_1774137803", "family_name": "lowrank_residual", "family_stage": "stabilize", "checkpoint_dir": "/root/sparsify-ascend/checkpoints/research_agent/round_0016_full/round0016_full_1774137803_dp2_bs1_ga8_ef16_k128_20260322_080329", "metrics_path": "/root/sparsify-ascend/checkpoints/research_agent/round_0016_full/round0016_full_1774137803_dp2_bs1_ga8_ef16_k128_20260322_080329/metrics.jsonl", "latest_step": 1220, "latest_tokens_per_sec": 190174.70026421695, "baseline_ratio": null, "latest_total_tokens": 39976960.0, "proxy_mode": null, "evaluation_basis": null}}
{"event_id": "evt_1774138043445595291", "ts": 1774138043, "event": "training_heartbeat", "round": 16, "session_id": "019d12cf-0aba-71d0-8920-5ea920811f62", "tier": "full", "run_name": "round0016_full_1774137803", "family_name": "lowrank_residual", "family_stage": "stabilize", "status": null, "decision": null, "payload": {"tier": "full", "run_name": "round0016_full_1774137803", "family_name": "lowrank_residual", "family_stage": "stabilize", "checkpoint_dir": "/root/sparsify-ascend/checkpoints/research_agent/round_0016_full/round0016_full_1774137803_dp2_bs1_ga8_ef16_k128_20260322_080329", "metrics_path": "/root/sparsify-ascend/checkpoints/research_agent/round_0016_full/round0016_full_1774137803_dp2_bs1_ga8_ef16_k128_20260322_080329/metrics.jsonl", "latest_step": 1220, "latest_tokens_per_sec": 166418.64360092705, "baseline_ratio": null, "latest_total_tokens": 39976960.0, "proxy_mode": null, "evaluation_basis": null}}
{"event_id": "evt_1774138043521768562", "ts": 1774138043, "event": "training_finished", "round": 16, "session_id": "019d12cf-0aba-71d0-8920-5ea920811f62", "tier": "full", "run_name": "round0016_full_1774137803", "family_name": "lowrank_residual", "family_stage": "stabilize", "status": "ok", "decision": "keep", "payload": {"tier": "full", "run_name": "round0016_full_1774137803", "family_name": "lowrank_residual", "family_stage": "stabilize", "checkpoint_dir": "/root/sparsify-ascend/checkpoints/research_agent/round_0016_full/round0016_full_1774137803_dp2_bs1_ga8_ef16_k128_20260322_080329", "metrics_path": "/root/sparsify-ascend/checkpoints/research_agent/round_0016_full/round0016_full_1774137803_dp2_bs1_ga8_ef16_k128_20260322_080329/metrics.jsonl", "run_health": "normal", "termination_reason": "completed", "tokens_per_sec": 166418.64360092705, "baseline_ratio": null, "status": "ok", "decision": "keep", "proxy_mode": null, "evaluation_basis": null, "curve_start_fvu": 0.10369624197483063, "curve_mid_fvu": 0.08679606765508652, "curve_end_fvu": 0.06764732301235199, "curve_late_slope": -1.1728306923092144e-09, "curve_still_improving": true}}
{"event_id": "evt_1774138043521836452", "ts": 1774138043, "event": "result_recorded", "round": 16, "session_id": "019d12cf-0aba-71d0-8920-5ea920811f62", "tier": "full", "run_name": "round0016_full_1774137803", "family_name": "lowrank_residual", "family_stage": "stabilize", "status": "ok", "decision": "keep", "payload": {"tier": "full", "run_name": "round0016_full_1774137803", "family_name": "lowrank_residual", "family_stage": "stabilize", "status": "ok", "decision": "keep", "val_fvu": "0.06882281508296728", "observed_fvu": "0.067647", "k": "128", "log_path": "/root/sparsify-ascend/research/history/logs/full_1774138043.log", "checkpoint": null}}
{"event_id": "evt_1774138043522327824", "ts": 1774138043, "event": "round_finished", "round": 16, "session_id": "019d12cf-0aba-71d0-8920-5ea920811f62", "tier": "full", "run_name": null, "family_name": "lowrank_residual", "family_stage": "stabilize", "status": "ok", "decision": "keep", "payload": {"tier": "full", "family_name": "lowrank_residual", "family_stage": "stabilize", "status": "ok", "decision": "keep", "val_fvu": "0.06882281508296728"}}
{"event_id": "evt_1774138043528440123", "ts": 1774138043, "event": "experiment_commit_prepared", "round": 16, "tier": "full", "run_name": null, "family_name": "lowrank_residual", "family_stage": "stabilize", "status": "ok", "decision": "keep", "payload": {"branch": "autoresearch-sae"}}
{"event_id": "evt_1774138050930649361", "ts": 1774138050, "event": "round_started", "round": 17, "session_id": "019d12cf-0aba-71d0-8920-5ea920811f62", "tier": null, "run_name": null, "family_name": null, "family_stage": null, "status": "started", "decision": null, "payload": {"status": "started"}}
{"event_id": "evt_1774138050930805386", "ts": 1774138050, "event": "agent_deciding", "round": 17, "session_id": "019d12cf-0aba-71d0-8920-5ea920811f62", "tier": null, "run_name": null, "family_name": null, "family_stage": null, "status": null, "decision": null, "payload": {}}
{"event_id": "evt_1774138177541939051", "ts": 1774138177, "event": "session_resumed", "round": 17, "tier": null, "run_name": null, "family_name": null, "family_stage": null, "status": "active", "decision": null, "payload": {"session_id": "019d12cf-0aba-71d0-8920-5ea920811f62"}}
{"event_id": "evt_1774138177548491933", "ts": 1774138177, "event": "agent_action_received", "round": 17, "session_id": "019d12cf-0aba-71d0-8920-5ea920811f62", "tier": "proxy", "run_name": null, "family_name": "lowrank_residual", "family_stage": "stabilize", "status": null, "decision": null, "payload": {"session_id": "019d12cf-0aba-71d0-8920-5ea920811f62", "tier": "proxy", "family_name": "lowrank_residual", "family_stage": "stabilize", "change_type": "param_only", "expected_win": "pareto_improvement", "hypothesis": "`lowrank_residual` has now materially beaten the previous K=128 quality anchor, so the next clean move is to test whether that gain transfers into a better Pareto point at lower sparsity budget. Reducing only `K` from 128 to 64 on the new best architecture can show whether the dense-trunk plus sparse-residual factorization preserves enough quality to improve the low-K frontier rather than only the anchor point."}}
{"event_id": "evt_1774138177548632231", "ts": 1774138177, "event": "proxy_mode_selected", "round": 17, "session_id": "019d12cf-0aba-71d0-8920-5ea920811f62", "tier": "proxy", "run_name": null, "family_name": "lowrank_residual", "family_stage": "stabilize", "status": null, "decision": null, "payload": {"tier": "proxy", "proxy_mode": "fast", "evaluation_basis": "terminal_only", "parameter_behavior": "structural", "proxy_max_tokens": "5000000"}}
{"event_id": "evt_1774138177548925640", "ts": 1774138177, "event": "training_started", "round": 17, "session_id": "019d12cf-0aba-71d0-8920-5ea920811f62", "tier": "proxy", "run_name": "round0017_proxy_1774138177", "family_name": "lowrank_residual", "family_stage": "stabilize", "status": null, "decision": null, "payload": {"tier": "proxy", "run_name": "round0017_proxy_1774138177", "family_name": "lowrank_residual", "family_stage": "stabilize", "checkpoint_dir": "/root/sparsify-ascend/checkpoints/research_agent/round_0017_proxy", "log_path": "/root/sparsify-ascend/research/history/logs/round0017_proxy_1774138177.log", "config": {"architecture": "lowrank_residual", "expansion_factor": 16, "k": 64, "optimizer": "signum", "lr": "1.6e-3", "hookpoints": "layers.[3].self_attn.o_proj", "batch_size": 1, "grad_acc_steps": 8, "micro_acc_steps": 1, "auxk_alpha": 0.0, "dead_feature_threshold": 10000000, "use_hadamard": false, "tier": "proxy", "family_name": "lowrank_residual", "family_stage": "stabilize"}, "baseline_tokens_per_sec": 83008.34876130984, "proxy_mode": "fast", "evaluation_basis": "terminal_only"}}
{"event_id": "evt_1774138207550668836", "ts": 1774138207, "event": "training_heartbeat", "round": 17, "session_id": "019d12cf-0aba-71d0-8920-5ea920811f62", "tier": "proxy", "run_name": "round0017_proxy_1774138177", "family_name": "lowrank_residual", "family_stage": "stabilize", "status": null, "decision": null, "payload": {"tier": "proxy", "run_name": "round0017_proxy_1774138177", "family_name": "lowrank_residual", "family_stage": "stabilize", "checkpoint_dir": "/root/sparsify-ascend/checkpoints/research_agent/round_0017_proxy/round0017_proxy_1774138177_dp2_bs1_ga8_ef16_k64_20260322_080944", "metrics_path": "/root/sparsify-ascend/checkpoints/research_agent/round_0017_proxy/round0017_proxy_1774138177_dp2_bs1_ga8_ef16_k64_20260322_080944/metrics.jsonl", "latest_step": 100, "latest_tokens_per_sec": 109221.89604170604, "baseline_ratio": 1.3157941059130467, "latest_total_tokens": 3276800.0, "proxy_mode": "fast", "evaluation_basis": "terminal_only"}}
{"event_id": "evt_1774138237597474229", "ts": 1774138237, "event": "training_heartbeat", "round": 17, "session_id": "019d12cf-0aba-71d0-8920-5ea920811f62", "tier": "proxy", "run_name": "round0017_proxy_1774138177", "family_name": "lowrank_residual", "family_stage": "stabilize", "status": null, "decision": null, "payload": {"tier": "proxy", "run_name": "round0017_proxy_1774138177", "family_name": "lowrank_residual", "family_stage": "stabilize", "checkpoint_dir": "/root/sparsify-ascend/checkpoints/research_agent/round_0017_proxy/round0017_proxy_1774138177_dp2_bs1_ga8_ef16_k64_20260322_080944", "metrics_path": "/root/sparsify-ascend/checkpoints/research_agent/round_0017_proxy/round0017_proxy_1774138177_dp2_bs1_ga8_ef16_k64_20260322_080944/metrics.jsonl", "latest_step": 152, "latest_tokens_per_sec": 83008.52258207071, "baseline_ratio": 1.0000020940154029, "latest_total_tokens": 4980736.0, "proxy_mode": "fast", "evaluation_basis": "terminal_only"}}
{"event_id": "evt_1774138238325561747", "ts": 1774138238, "event": "training_finished", "round": 17, "session_id": "019d12cf-0aba-71d0-8920-5ea920811f62", "tier": "proxy", "run_name": "round0017_proxy_1774138177", "family_name": "lowrank_residual", "family_stage": "stabilize", "status": "ok", "decision": "promote", "payload": {"tier": "proxy", "run_name": "round0017_proxy_1774138177", "family_name": "lowrank_residual", "family_stage": "stabilize", "checkpoint_dir": "/root/sparsify-ascend/checkpoints/research_agent/round_0017_proxy/round0017_proxy_1774138177_dp2_bs1_ga8_ef16_k64_20260322_080944", "metrics_path": "/root/sparsify-ascend/checkpoints/research_agent/round_0017_proxy/round0017_proxy_1774138177_dp2_bs1_ga8_ef16_k64_20260322_080944/metrics.jsonl", "run_health": "normal", "termination_reason": "completed", "tokens_per_sec": 83008.52258207071, "baseline_ratio": 1.0000020940154029, "status": "ok", "decision": "promote", "proxy_mode": "fast", "evaluation_basis": "terminal_only", "curve_start_fvu": 0.30820387601852417, "curve_mid_fvu": 0.20067274570465088, "curve_end_fvu": 0.15816962718963623, "curve_late_slope": -6.4549186067926064e-09, "curve_still_improving": true}}
{"event_id": "evt_1774138238325671235", "ts": 1774138238, "event": "result_recorded", "round": 17, "session_id": "019d12cf-0aba-71d0-8920-5ea920811f62", "tier": "proxy", "run_name": "round0017_proxy_1774138177", "family_name": "lowrank_residual", "family_stage": "stabilize", "status": "ok", "decision": "promote", "payload": {"tier": "proxy", "run_name": "round0017_proxy_1774138177", "family_name": "lowrank_residual", "family_stage": "stabilize", "status": "ok", "decision": "promote", "val_fvu": "0.1590107250958681", "observed_fvu": "0.158170", "k": "64", "log_path": "/root/sparsify-ascend/research/history/logs/proxy_1774138238.log", "checkpoint": null}}
{"event_id": "evt_1774138238326121157", "ts": 1774138238, "event": "training_started", "round": 17, "session_id": "019d12cf-0aba-71d0-8920-5ea920811f62", "tier": "full", "run_name": "round0017_full_1774138238", "family_name": "lowrank_residual", "family_stage": "stabilize", "status": null, "decision": null, "payload": {"tier": "full", "run_name": "round0017_full_1774138238", "family_name": "lowrank_residual", "family_stage": "stabilize", "checkpoint_dir": "/root/sparsify-ascend/checkpoints/research_agent/round_0017_full", "log_path": "/root/sparsify-ascend/research/history/logs/round0017_full_1774138238.log", "config": {"architecture": "lowrank_residual", "expansion_factor": 16, "k": 64, "optimizer": "signum", "lr": "1.6e-3", "hookpoints": "layers.[3].self_attn.o_proj", "batch_size": 1, "grad_acc_steps": 8, "micro_acc_steps": 1, "auxk_alpha": 0.0, "dead_feature_threshold": 10000000, "use_hadamard": false, "tier": "full", "family_name": "lowrank_residual", "family_stage": "stabilize"}, "baseline_tokens_per_sec": 166418.64360092705, "proxy_mode": null, "evaluation_basis": null}}
