{"event_id": "evt_1774134520891366083", "ts": 1774134520, "event": "training_finished", "round": 10, "session_id": "019d1279-dd8d-73d2-97df-ff57e75146ab", "tier": "full", "run_name": "round0010_full_1774134040", "family_name": "two_stage_residual", "family_stage": "stabilize", "status": "ok", "decision": "keep", "payload": {"tier": "full", "run_name": "round0010_full_1774134040", "family_name": "two_stage_residual", "family_stage": "stabilize", "checkpoint_dir": "/root/sparsify-ascend/checkpoints/research_agent/round_0010_full/round0010_full_1774134040_dp2_bs1_ga8_ef16_k128_20260322_070046", "metrics_path": "/root/sparsify-ascend/checkpoints/research_agent/round_0010_full/round0010_full_1774134040_dp2_bs1_ga8_ef16_k128_20260322_070046/metrics.jsonl", "run_health": "normal", "termination_reason": "completed", "tokens_per_sec": 83221.10467517882, "baseline_ratio": 0.9999224243250845, "status": "ok", "decision": "keep", "proxy_mode": null, "evaluation_basis": null, "curve_start_fvu": 0.18473176658153534, "curve_mid_fvu": 0.1584618091583252, "curve_end_fvu": 0.13206832110881805, "curve_late_slope": -1.893409553005887e-09, "curve_still_improving": true}}
{"event_id": "evt_1774134520891418238", "ts": 1774134520, "event": "result_recorded", "round": 10, "session_id": "019d1279-dd8d-73d2-97df-ff57e75146ab", "tier": "full", "run_name": "round0010_full_1774134040", "family_name": "two_stage_residual", "family_stage": "stabilize", "status": "ok", "decision": "keep", "payload": {"tier": "full", "run_name": "round0010_full_1774134040", "family_name": "two_stage_residual", "family_stage": "stabilize", "status": "ok", "decision": "keep", "val_fvu": "0.13607123959809542", "observed_fvu": "0.132068", "k": "128", "log_path": "/root/sparsify-ascend/research/history/logs/full_1774134520.log", "checkpoint": null}}
{"event_id": "evt_1774134520891827790", "ts": 1774134520, "event": "round_finished", "round": 10, "session_id": "019d1279-dd8d-73d2-97df-ff57e75146ab", "tier": "full", "run_name": null, "family_name": "two_stage_residual", "family_stage": "stabilize", "status": "ok", "decision": "keep", "payload": {"tier": "full", "family_name": "two_stage_residual", "family_stage": "stabilize", "status": "ok", "decision": "keep", "val_fvu": "0.13607123959809542"}}
{"event_id": "evt_1774134520897636089", "ts": 1774134520, "event": "experiment_commit_prepared", "round": 10, "tier": "full", "run_name": null, "family_name": "two_stage_residual", "family_stage": "stabilize", "status": "ok", "decision": "keep", "payload": {"branch": "autoresearch-sae"}}
{"event_id": "evt_1774134528316259929", "ts": 1774134528, "event": "round_started", "round": 11, "session_id": "019d1279-dd8d-73d2-97df-ff57e75146ab", "tier": null, "run_name": null, "family_name": null, "family_stage": null, "status": "started", "decision": null, "payload": {"status": "started"}}
{"event_id": "evt_1774134528316419964", "ts": 1774134528, "event": "agent_deciding", "round": 11, "session_id": "019d1279-dd8d-73d2-97df-ff57e75146ab", "tier": null, "run_name": null, "family_name": null, "family_stage": null, "status": null, "decision": null, "payload": {}}
{"event_id": "evt_1774134662957878419", "ts": 1774134662, "event": "session_resumed", "round": 11, "tier": null, "run_name": null, "family_name": null, "family_stage": null, "status": "active", "decision": null, "payload": {"session_id": "019d1279-dd8d-73d2-97df-ff57e75146ab"}}
{"event_id": "evt_1774134662958570002", "ts": 1774134662, "event": "agent_action_received", "round": 11, "session_id": "019d1279-dd8d-73d2-97df-ff57e75146ab", "tier": "proxy", "run_name": null, "family_name": "multi_branch_gated", "family_stage": "prototype", "status": null, "decision": null, "payload": {"session_id": "019d1279-dd8d-73d2-97df-ff57e75146ab", "tier": "proxy", "family_name": "multi_branch_gated", "family_stage": "prototype", "change_type": "edit_sae_code", "expected_win": "explore_unknown", "hypothesis": "`two_stage_residual` remains a real K=128 win, but the front-loaded split change only matched the existing best point instead of extending the frontier, and its lower-K/width behavior still looks brittle. The next informative move is to pivot to a different non-gated family with a different inductive bias: a `multi_branch_gated` SAE that uses several gated encoder branches competing to explain different activation substructures before the final TopK selection, which could preserve the K=128 quality gains while avoiding the narrow tuning sensitivity of the staged-residual prototype."}}
{"event_id": "evt_1774134794099172613", "ts": 1774134794, "event": "variable_isolation_warning", "round": 11, "session_id": "019d1279-dd8d-73d2-97df-ff57e75146ab", "tier": null, "run_name": null, "family_name": "multi_branch_gated", "family_stage": "prototype", "status": null, "decision": null, "payload": {"violation": "Multiple primary variables changed simultaneously: code_edit, architecture, lr"}}
{"event_id": "evt_1774134794099298926", "ts": 1774134794, "event": "proxy_mode_selected", "round": 11, "session_id": "019d1279-dd8d-73d2-97df-ff57e75146ab", "tier": "proxy", "run_name": null, "family_name": "multi_branch_gated", "family_stage": "prototype", "status": null, "decision": null, "payload": {"tier": "proxy", "proxy_mode": "fast", "evaluation_basis": "terminal_only", "parameter_behavior": "structural", "proxy_max_tokens": "40000000"}}
{"event_id": "evt_1774134794099346283", "ts": 1774134794, "event": "sanity_started", "round": 11, "session_id": "019d1279-dd8d-73d2-97df-ff57e75146ab", "tier": "proxy", "run_name": null, "family_name": "multi_branch_gated", "family_stage": "prototype", "status": null, "decision": null, "payload": {"tier": "proxy"}}
{"event_id": "evt_1774134798726947895", "ts": 1774134798, "event": "sanity_finished", "round": 11, "session_id": "019d1279-dd8d-73d2-97df-ff57e75146ab", "tier": "proxy", "run_name": null, "family_name": "multi_branch_gated", "family_stage": "prototype", "status": "ok", "decision": null, "payload": {"tier": "proxy", "status": "ok"}}
{"event_id": "evt_1774134798727337255", "ts": 1774134798, "event": "training_started", "round": 11, "session_id": "019d1279-dd8d-73d2-97df-ff57e75146ab", "tier": "proxy", "run_name": "round0011_proxy_1774134798", "family_name": "multi_branch_gated", "family_stage": "prototype", "status": null, "decision": null, "payload": {"tier": "proxy", "run_name": "round0011_proxy_1774134798", "family_name": "multi_branch_gated", "family_stage": "prototype", "checkpoint_dir": "/root/sparsify-ascend/checkpoints/research_agent/round_0011_proxy", "log_path": "/root/sparsify-ascend/research/history/logs/round0011_proxy_1774134798.log", "config": {"architecture": "multi_branch_gated", "expansion_factor": 16, "k": 128, "optimizer": "signum", "lr": "1.6e-3", "hookpoints": "layers.[3].self_attn.o_proj", "batch_size": 1, "grad_acc_steps": 8, "micro_acc_steps": 1, "auxk_alpha": 0.0, "dead_feature_threshold": 10000000, "use_hadamard": false, "tier": "proxy", "family_name": "multi_branch_gated", "family_stage": "prototype"}, "baseline_tokens_per_sec": null, "proxy_mode": "fast", "evaluation_basis": "terminal_only"}}
{"event_id": "evt_1774134828728115793", "ts": 1774134828, "event": "training_heartbeat", "round": 11, "session_id": "019d1279-dd8d-73d2-97df-ff57e75146ab", "tier": "proxy", "run_name": "round0011_proxy_1774134798", "family_name": "multi_branch_gated", "family_stage": "prototype", "status": null, "decision": null, "payload": {"tier": "proxy", "run_name": "round0011_proxy_1774134798", "family_name": "multi_branch_gated", "family_stage": "prototype", "checkpoint_dir": null, "metrics_path": null, "latest_step": null, "latest_tokens_per_sec": null, "baseline_ratio": null, "latest_total_tokens": null, "proxy_mode": "fast", "evaluation_basis": "terminal_only"}}
{"event_id": "evt_1774134828789321686", "ts": 1774134828, "event": "training_finished", "round": 11, "session_id": "019d1279-dd8d-73d2-97df-ff57e75146ab", "tier": "proxy", "run_name": "round0011_proxy_1774134798", "family_name": "multi_branch_gated", "family_stage": "prototype", "status": "crash", "decision": "crash", "payload": {"tier": "proxy", "run_name": "round0011_proxy_1774134798", "family_name": "multi_branch_gated", "family_stage": "prototype", "checkpoint_dir": null, "metrics_path": "", "run_health": "crash", "termination_reason": "completed", "tokens_per_sec": null, "baseline_ratio": null, "status": "crash", "decision": "crash", "proxy_mode": "fast", "evaluation_basis": "terminal_only", "curve_start_fvu": null, "curve_mid_fvu": null, "curve_end_fvu": null, "curve_late_slope": null, "curve_still_improving": null}}
{"event_id": "evt_1774134828789378906", "ts": 1774134828, "event": "result_recorded", "round": 11, "session_id": "019d1279-dd8d-73d2-97df-ff57e75146ab", "tier": "proxy", "run_name": "round0011_proxy_1774134798", "family_name": "multi_branch_gated", "family_stage": "prototype", "status": "crash", "decision": "crash", "payload": {"tier": "proxy", "run_name": "round0011_proxy_1774134798", "family_name": "multi_branch_gated", "family_stage": "prototype", "status": "crash", "decision": "crash", "val_fvu": "None", "observed_fvu": "", "k": "None", "log_path": "/root/sparsify-ascend/research/history/logs/proxy_1774134828.log", "checkpoint": null}}
{"event_id": "evt_1774134828789446950", "ts": 1774134828, "event": "repair_attempt_started", "round": 11, "session_id": "019d1279-dd8d-73d2-97df-ff57e75146ab", "tier": "proxy", "run_name": null, "family_name": "multi_branch_gated", "family_stage": "prototype", "status": null, "decision": null, "payload": {"tier": "proxy", "family_name": "multi_branch_gated", "family_stage": "prototype", "repair_attempt": 1, "failure_kind": "training_crash", "error_type": "ValueError", "error_summary": "ValueError: Unknown architecture: 'multi_branch_gated'. Must be one of ('topk', 'jumprelu', 'gated', 'routed', 'group_topk', 'factorized_topk', 'lowrank_residual', 'whitened_topk', 'two_stage_residual')"}}
{"event_id": "evt_1774135007463114945", "ts": 1774135007, "event": "variable_isolation_warning", "round": 11, "session_id": "019d1279-dd8d-73d2-97df-ff57e75146ab", "tier": null, "run_name": null, "family_name": "multi_branch_gated", "family_stage": "prototype", "status": null, "decision": null, "payload": {"violation": "Multiple primary variables changed simultaneously: code_edit, architecture, lr"}}
{"event_id": "evt_1774135012003134806", "ts": 1774135012, "event": "behavioral_diff_identical_warning", "round": 11, "session_id": "019d1279-dd8d-73d2-97df-ff57e75146ab", "tier": null, "run_name": null, "family_name": "multi_branch_gated", "family_stage": "prototype", "status": null, "decision": null, "payload": {"architecture": "multi_branch_gated", "k": 128, "expansion_factor": 16, "max_diff": 0.0}}
{"event_id": "evt_1774135012003202284", "ts": 1774135012, "event": "proxy_mode_selected", "round": 11, "session_id": "019d1279-dd8d-73d2-97df-ff57e75146ab", "tier": "proxy", "run_name": null, "family_name": "multi_branch_gated", "family_stage": "prototype", "status": null, "decision": null, "payload": {"tier": "proxy", "proxy_mode": "fast", "evaluation_basis": "terminal_only", "parameter_behavior": "structural", "proxy_max_tokens": "40000000"}}
{"event_id": "evt_1774135012003246803", "ts": 1774135012, "event": "sanity_started", "round": 11, "session_id": "019d1279-dd8d-73d2-97df-ff57e75146ab", "tier": "proxy", "run_name": null, "family_name": "multi_branch_gated", "family_stage": "prototype", "status": null, "decision": null, "payload": {"tier": "proxy"}}
{"event_id": "evt_1774135016583901390", "ts": 1774135016, "event": "sanity_finished", "round": 11, "session_id": "019d1279-dd8d-73d2-97df-ff57e75146ab", "tier": "proxy", "run_name": null, "family_name": "multi_branch_gated", "family_stage": "prototype", "status": "ok", "decision": null, "payload": {"tier": "proxy", "status": "ok"}}
{"event_id": "evt_1774135016584285233", "ts": 1774135016, "event": "training_started", "round": 11, "session_id": "019d1279-dd8d-73d2-97df-ff57e75146ab", "tier": "proxy", "run_name": "round0011_proxy_1774135016", "family_name": "multi_branch_gated", "family_stage": "prototype", "status": null, "decision": null, "payload": {"tier": "proxy", "run_name": "round0011_proxy_1774135016", "family_name": "multi_branch_gated", "family_stage": "prototype", "checkpoint_dir": "/root/sparsify-ascend/checkpoints/research_agent/round_0011_proxy", "log_path": "/root/sparsify-ascend/research/history/logs/round0011_proxy_1774135016.log", "config": {"architecture": "multi_branch_gated", "expansion_factor": 16, "k": 128, "optimizer": "signum", "lr": "1.6e-3", "hookpoints": "layers.[3].self_attn.o_proj", "batch_size": 1, "grad_acc_steps": 8, "micro_acc_steps": 1, "auxk_alpha": 0.0, "dead_feature_threshold": 10000000, "use_hadamard": false, "tier": "proxy", "family_name": "multi_branch_gated", "family_stage": "prototype"}, "baseline_tokens_per_sec": null, "proxy_mode": "fast", "evaluation_basis": "terminal_only"}}
{"event_id": "evt_1774135046585561972", "ts": 1774135046, "event": "training_heartbeat", "round": 11, "session_id": "019d1279-dd8d-73d2-97df-ff57e75146ab", "tier": "proxy", "run_name": "round0011_proxy_1774135016", "family_name": "multi_branch_gated", "family_stage": "prototype", "status": null, "decision": null, "payload": {"tier": "proxy", "run_name": "round0011_proxy_1774135016", "family_name": "multi_branch_gated", "family_stage": "prototype", "checkpoint_dir": "/root/sparsify-ascend/checkpoints/research_agent/round_0011_proxy/round0011_proxy_1774135016_dp2_bs1_ga8_ef16_k128_20260322_071703", "metrics_path": "/root/sparsify-ascend/checkpoints/research_agent/round_0011_proxy/round0011_proxy_1774135016_dp2_bs1_ga8_ef16_k128_20260322_071703/metrics.jsonl", "latest_step": 30, "latest_tokens_per_sec": 32766.96044964699, "baseline_ratio": null, "latest_total_tokens": 983040.0, "proxy_mode": "fast", "evaluation_basis": "terminal_only"}}
{"event_id": "evt_1774135076586661925", "ts": 1774135076, "event": "training_heartbeat", "round": 11, "session_id": "019d1279-dd8d-73d2-97df-ff57e75146ab", "tier": "proxy", "run_name": "round0011_proxy_1774135016", "family_name": "multi_branch_gated", "family_stage": "prototype", "status": null, "decision": null, "payload": {"tier": "proxy", "run_name": "round0011_proxy_1774135016", "family_name": "multi_branch_gated", "family_stage": "prototype", "checkpoint_dir": "/root/sparsify-ascend/checkpoints/research_agent/round_0011_proxy/round0011_proxy_1774135016_dp2_bs1_ga8_ef16_k128_20260322_071703", "metrics_path": "/root/sparsify-ascend/checkpoints/research_agent/round_0011_proxy/round0011_proxy_1774135016_dp2_bs1_ga8_ef16_k128_20260322_071703/metrics.jsonl", "latest_step": 100, "latest_tokens_per_sec": 54611.45167073632, "baseline_ratio": null, "latest_total_tokens": 3276800.0, "proxy_mode": "fast", "evaluation_basis": "terminal_only"}}
{"event_id": "evt_1774135106588213538", "ts": 1774135106, "event": "training_heartbeat", "round": 11, "session_id": "019d1279-dd8d-73d2-97df-ff57e75146ab", "tier": "proxy", "run_name": "round0011_proxy_1774135016", "family_name": "multi_branch_gated", "family_stage": "prototype", "status": null, "decision": null, "payload": {"tier": "proxy", "run_name": "round0011_proxy_1774135016", "family_name": "multi_branch_gated", "family_stage": "prototype", "checkpoint_dir": "/root/sparsify-ascend/checkpoints/research_agent/round_0011_proxy/round0011_proxy_1774135016_dp2_bs1_ga8_ef16_k128_20260322_071703", "metrics_path": "/root/sparsify-ascend/checkpoints/research_agent/round_0011_proxy/round0011_proxy_1774135016_dp2_bs1_ga8_ef16_k128_20260322_071703/metrics.jsonl", "latest_step": 180, "latest_tokens_per_sec": 65533.368682042455, "baseline_ratio": null, "latest_total_tokens": 5898240.0, "proxy_mode": "fast", "evaluation_basis": "terminal_only"}}
{"event_id": "evt_1774135136590166433", "ts": 1774135136, "event": "training_heartbeat", "round": 11, "session_id": "019d1279-dd8d-73d2-97df-ff57e75146ab", "tier": "proxy", "run_name": "round0011_proxy_1774135016", "family_name": "multi_branch_gated", "family_stage": "prototype", "status": null, "decision": null, "payload": {"tier": "proxy", "run_name": "round0011_proxy_1774135016", "family_name": "multi_branch_gated", "family_stage": "prototype", "checkpoint_dir": "/root/sparsify-ascend/checkpoints/research_agent/round_0011_proxy/round0011_proxy_1774135016_dp2_bs1_ga8_ef16_k128_20260322_071703", "metrics_path": "/root/sparsify-ascend/checkpoints/research_agent/round_0011_proxy/round0011_proxy_1774135016_dp2_bs1_ga8_ef16_k128_20260322_071703/metrics.jsonl", "latest_step": 250, "latest_tokens_per_sec": 68263.49488478625, "baseline_ratio": null, "latest_total_tokens": 8192000.0, "proxy_mode": "fast", "evaluation_basis": "terminal_only"}}
{"event_id": "evt_1774135166592533987", "ts": 1774135166, "event": "training_heartbeat", "round": 11, "session_id": "019d1279-dd8d-73d2-97df-ff57e75146ab", "tier": "proxy", "run_name": "round0011_proxy_1774135016", "family_name": "multi_branch_gated", "family_stage": "prototype", "status": null, "decision": null, "payload": {"tier": "proxy", "run_name": "round0011_proxy_1774135016", "family_name": "multi_branch_gated", "family_stage": "prototype", "checkpoint_dir": "/root/sparsify-ascend/checkpoints/research_agent/round_0011_proxy/round0011_proxy_1774135016_dp2_bs1_ga8_ef16_k128_20260322_071703", "metrics_path": "/root/sparsify-ascend/checkpoints/research_agent/round_0011_proxy/round0011_proxy_1774135016_dp2_bs1_ga8_ef16_k128_20260322_071703/metrics.jsonl", "latest_step": 320, "latest_tokens_per_sec": 69901.3683067849, "baseline_ratio": null, "latest_total_tokens": 10485760.0, "proxy_mode": "fast", "evaluation_basis": "terminal_only"}}
{"event_id": "evt_1774135196595306551", "ts": 1774135196, "event": "training_heartbeat", "round": 11, "session_id": "019d1279-dd8d-73d2-97df-ff57e75146ab", "tier": "proxy", "run_name": "round0011_proxy_1774135016", "family_name": "multi_branch_gated", "family_stage": "prototype", "status": null, "decision": null, "payload": {"tier": "proxy", "run_name": "round0011_proxy_1774135016", "family_name": "multi_branch_gated", "family_stage": "prototype", "checkpoint_dir": "/root/sparsify-ascend/checkpoints/research_agent/round_0011_proxy/round0011_proxy_1774135016_dp2_bs1_ga8_ef16_k128_20260322_071703", "metrics_path": "/root/sparsify-ascend/checkpoints/research_agent/round_0011_proxy/round0011_proxy_1774135016_dp2_bs1_ga8_ef16_k128_20260322_071703/metrics.jsonl", "latest_step": 390, "latest_tokens_per_sec": 70993.11084142099, "baseline_ratio": null, "latest_total_tokens": 12779520.0, "proxy_mode": "fast", "evaluation_basis": "terminal_only"}}
{"event_id": "evt_1774135226598501851", "ts": 1774135226, "event": "training_heartbeat", "round": 11, "session_id": "019d1279-dd8d-73d2-97df-ff57e75146ab", "tier": "proxy", "run_name": "round0011_proxy_1774135016", "family_name": "multi_branch_gated", "family_stage": "prototype", "status": null, "decision": null, "payload": {"tier": "proxy", "run_name": "round0011_proxy_1774135016", "family_name": "multi_branch_gated", "family_stage": "prototype", "checkpoint_dir": "/root/sparsify-ascend/checkpoints/research_agent/round_0011_proxy/round0011_proxy_1774135016_dp2_bs1_ga8_ef16_k128_20260322_071703", "metrics_path": "/root/sparsify-ascend/checkpoints/research_agent/round_0011_proxy/round0011_proxy_1774135016_dp2_bs1_ga8_ef16_k128_20260322_071703/metrics.jsonl", "latest_step": 460, "latest_tokens_per_sec": 71772.77906933325, "baseline_ratio": null, "latest_total_tokens": 15073280.0, "proxy_mode": "fast", "evaluation_basis": "terminal_only"}}
{"event_id": "evt_1774135256602084630", "ts": 1774135256, "event": "training_heartbeat", "round": 11, "session_id": "019d1279-dd8d-73d2-97df-ff57e75146ab", "tier": "proxy", "run_name": "round0011_proxy_1774135016", "family_name": "multi_branch_gated", "family_stage": "prototype", "status": null, "decision": null, "payload": {"tier": "proxy", "run_name": "round0011_proxy_1774135016", "family_name": "multi_branch_gated", "family_stage": "prototype", "checkpoint_dir": "/root/sparsify-ascend/checkpoints/research_agent/round_0011_proxy/round0011_proxy_1774135016_dp2_bs1_ga8_ef16_k128_20260322_071703", "metrics_path": "/root/sparsify-ascend/checkpoints/research_agent/round_0011_proxy/round0011_proxy_1774135016_dp2_bs1_ga8_ef16_k128_20260322_071703/metrics.jsonl", "latest_step": 530, "latest_tokens_per_sec": 72357.40011748493, "baseline_ratio": null, "latest_total_tokens": 17367040.0, "proxy_mode": "fast", "evaluation_basis": "terminal_only"}}
{"event_id": "evt_1774135286606092332", "ts": 1774135286, "event": "training_heartbeat", "round": 11, "session_id": "019d1279-dd8d-73d2-97df-ff57e75146ab", "tier": "proxy", "run_name": "round0011_proxy_1774135016", "family_name": "multi_branch_gated", "family_stage": "prototype", "status": null, "decision": null, "payload": {"tier": "proxy", "run_name": "round0011_proxy_1774135016", "family_name": "multi_branch_gated", "family_stage": "prototype", "checkpoint_dir": "/root/sparsify-ascend/checkpoints/research_agent/round_0011_proxy/round0011_proxy_1774135016_dp2_bs1_ga8_ef16_k128_20260322_071703", "metrics_path": "/root/sparsify-ascend/checkpoints/research_agent/round_0011_proxy/round0011_proxy_1774135016_dp2_bs1_ga8_ef16_k128_20260322_071703/metrics.jsonl", "latest_step": 600, "latest_tokens_per_sec": 72811.98496446844, "baseline_ratio": null, "latest_total_tokens": 19660800.0, "proxy_mode": "fast", "evaluation_basis": "terminal_only"}}
