{"event_id": "evt_1774120793460132308", "ts": 1774120793, "event": "training_finished", "round": 4, "session_id": "019d11d4-9b96-7ed1-af50-a8e94fbadbcd", "tier": "proxy", "run_name": "round0004_proxy_1774120733", "family_name": "lowrank_residual", "family_stage": "prototype", "status": "ok", "decision": "incubate", "payload": {"tier": "proxy", "run_name": "round0004_proxy_1774120733", "family_name": "lowrank_residual", "family_stage": "prototype", "checkpoint_dir": "/root/sparsify-ascend/checkpoints/research_agent/round_0004_proxy/round0004_proxy_1774120733_dp2_bs1_ga8_ef16_k128_20260322_031900", "metrics_path": "/root/sparsify-ascend/checkpoints/research_agent/round_0004_proxy/round0004_proxy_1774120733_dp2_bs1_ga8_ef16_k128_20260322_031900/metrics.jsonl", "run_health": "normal", "termination_reason": "completed", "tokens_per_sec": 83008.34645250007, "baseline_ratio": null, "status": "ok", "decision": "incubate", "proxy_mode": "fast", "evaluation_basis": "terminal_only", "curve_start_fvu": 0.34354332089424133, "curve_mid_fvu": 0.2650063633918762, "curve_end_fvu": 0.2253667414188385, "curve_late_slope": -6.274457254837598e-09, "curve_still_improving": true}}
{"event_id": "evt_1774120793460190400", "ts": 1774120793, "event": "result_recorded", "round": 4, "session_id": "019d11d4-9b96-7ed1-af50-a8e94fbadbcd", "tier": "proxy", "run_name": "round0004_proxy_1774120733", "family_name": "lowrank_residual", "family_stage": "prototype", "status": "ok", "decision": "incubate", "payload": {"tier": "proxy", "run_name": "round0004_proxy_1774120733", "family_name": "lowrank_residual", "family_stage": "prototype", "status": "ok", "decision": "incubate", "val_fvu": "0.22577644512057304", "observed_fvu": "0.225367", "k": "128", "log_path": "/root/sparsify-ascend/research/history/logs/proxy_1774120793.log", "checkpoint": null}}
{"event_id": "evt_1774120793460314970", "ts": 1774120793, "event": "round_finished", "round": 4, "session_id": "019d11d4-9b96-7ed1-af50-a8e94fbadbcd", "tier": "proxy", "run_name": null, "family_name": "lowrank_residual", "family_stage": "prototype", "status": "ok", "decision": "incubate", "payload": {"tier": "proxy", "family_name": "lowrank_residual", "family_stage": "prototype", "status": "ok", "decision": "incubate", "val_fvu": "0.22577644512057304"}}
{"event_id": "evt_1774120793466058552", "ts": 1774120793, "event": "experiment_commit_prepared", "round": 4, "tier": "proxy", "run_name": null, "family_name": "lowrank_residual", "family_stage": "prototype", "status": "ok", "decision": "incubate", "payload": {"branch": "autoresearch-sae"}}
{"event_id": "evt_1774120801185124171", "ts": 1774120801, "event": "round_started", "round": 5, "session_id": "019d11d4-9b96-7ed1-af50-a8e94fbadbcd", "tier": null, "run_name": null, "family_name": null, "family_stage": null, "status": "started", "decision": null, "payload": {"status": "started"}}
{"event_id": "evt_1774120801185279746", "ts": 1774120801, "event": "agent_deciding", "round": 5, "session_id": "019d11d4-9b96-7ed1-af50-a8e94fbadbcd", "tier": null, "run_name": null, "family_name": null, "family_stage": null, "status": null, "decision": null, "payload": {}}
{"event_id": "evt_1774120960426291518", "ts": 1774120960, "event": "session_resumed", "round": 5, "tier": null, "run_name": null, "family_name": null, "family_stage": null, "status": "active", "decision": null, "payload": {"session_id": "019d11d4-9b96-7ed1-af50-a8e94fbadbcd"}}
{"event_id": "evt_1774120960426857536", "ts": 1774120960, "event": "agent_action_received", "round": 5, "session_id": "019d11d4-9b96-7ed1-af50-a8e94fbadbcd", "tier": "proxy", "run_name": null, "family_name": "lowrank_residual", "family_stage": "stabilize", "status": null, "decision": null, "payload": {"session_id": "019d11d4-9b96-7ed1-af50-a8e94fbadbcd", "tier": "proxy", "family_name": "lowrank_residual", "family_stage": "stabilize", "change_type": "edit_sae_code", "expected_win": "quality", "hypothesis": "`lowrank_residual` produced the strongest non-gated proxy among recent architecture pivots, so the next informative move is a narrow family-specific stabilization pass rather than abandoning it after one prototype result. The current trunk rank formula likely underpowers the dense trunk under the strong EF=16 recipe by collapsing to a near-minimal rank, so increasing the default trunk capacity should remove more shared dense structure before sparse residual coding and improve FVU at fixed K=128."}}
{"event_id": "evt_1774121094341239774", "ts": 1774121094, "event": "variable_isolation_warning", "round": 5, "session_id": "019d11d4-9b96-7ed1-af50-a8e94fbadbcd", "tier": null, "run_name": null, "family_name": "lowrank_residual", "family_stage": "stabilize", "status": null, "decision": null, "payload": {"violation": "Multiple primary variables changed simultaneously: code_edit, architecture, lr"}}
{"event_id": "evt_1774121099100771809", "ts": 1774121099, "event": "behavioral_diff_identical", "round": 5, "session_id": "019d11d4-9b96-7ed1-af50-a8e94fbadbcd", "tier": null, "run_name": null, "family_name": "lowrank_residual", "family_stage": "stabilize", "status": null, "decision": null, "payload": {"architecture": "lowrank_residual", "k": 128, "expansion_factor": 16, "max_diff": 0.0}}
{"event_id": "evt_1774121099100888933", "ts": 1774121099, "event": "round_finished", "round": 5, "session_id": "019d11d4-9b96-7ed1-af50-a8e94fbadbcd", "tier": "proxy", "run_name": null, "family_name": "lowrank_residual", "family_stage": "stabilize", "status": "crash", "decision": "crash", "payload": {"tier": "proxy", "family_name": "lowrank_residual", "family_stage": "stabilize", "status": "crash", "decision": "crash", "val_fvu": null}}
{"event_id": "evt_1774131368051059267", "ts": 1774131368, "event": "loop_started", "round": null, "tier": null, "run_name": null, "family_name": null, "family_stage": null, "status": null, "decision": null, "payload": {"rounds": 200, "budget_hours": 10.0}}
{"event_id": "evt_1774131368056461495", "ts": 1774131368, "event": "research_branch_ready", "round": null, "tier": null, "run_name": null, "family_name": null, "family_stage": null, "status": "ready", "decision": null, "payload": {"branch": "autoresearch-sae", "base_branch": "autoresearch-sae", "base_commit": "04a0603ba261d372b5dc5e8d3c9746c5cebe46f2"}}
{"event_id": "evt_1774131368057844882", "ts": 1774131368, "event": "round_started", "round": 6, "session_id": null, "tier": null, "run_name": null, "family_name": null, "family_stage": null, "status": "started", "decision": null, "payload": {"status": "started"}}
{"event_id": "evt_1774131368057960029", "ts": 1774131368, "event": "agent_deciding", "round": 6, "session_id": null, "tier": null, "run_name": null, "family_name": null, "family_stage": null, "status": null, "decision": null, "payload": {}}
{"event_id": "evt_1774131549642027135", "ts": 1774131549, "event": "session_started", "round": 6, "tier": null, "run_name": null, "family_name": null, "family_stage": null, "status": "active", "decision": null, "payload": {"session_id": "019d1279-dd8d-73d2-97df-ff57e75146ab"}}
{"event_id": "evt_1774131549642573937", "ts": 1774131549, "event": "agent_action_received", "round": 6, "session_id": "019d1279-dd8d-73d2-97df-ff57e75146ab", "tier": "proxy", "run_name": null, "family_name": "whitened_topk", "family_stage": "prototype", "status": null, "decision": null, "payload": {"session_id": "019d1279-dd8d-73d2-97df-ff57e75146ab", "tier": "proxy", "family_name": "whitened_topk", "family_stage": "prototype", "change_type": "param_only", "expected_win": "explore_unknown", "hypothesis": "After eight straight no-improve rounds and with gated already mapped at K=32/64/128, the least-bad informative move is a fundamentally different architecture that changes the input geometry rather than doing another local sweep. A `whitened_topk` proxy run at K=128 under the current strongest gated recipe can test whether a learned input preconditioner makes the activation space easier to sparsify and opens a new quality frontier without coupling in optimizer or K changes."}}
{"event_id": "evt_1774131549642687571", "ts": 1774131549, "event": "variable_isolation_warning", "round": 6, "session_id": "019d1279-dd8d-73d2-97df-ff57e75146ab", "tier": null, "run_name": null, "family_name": "whitened_topk", "family_stage": "prototype", "status": null, "decision": null, "payload": {"violation": "Multiple primary variables changed simultaneously: architecture, lr"}}
{"event_id": "evt_1774131549642736186", "ts": 1774131549, "event": "proxy_mode_selected", "round": 6, "session_id": "019d1279-dd8d-73d2-97df-ff57e75146ab", "tier": "proxy", "run_name": null, "family_name": "whitened_topk", "family_stage": "prototype", "status": null, "decision": null, "payload": {"tier": "proxy", "proxy_mode": "fast", "evaluation_basis": "terminal_only", "parameter_behavior": "structural", "proxy_max_tokens": "5000000"}}
{"event_id": "evt_1774131549643015906", "ts": 1774131549, "event": "training_started", "round": 6, "session_id": "019d1279-dd8d-73d2-97df-ff57e75146ab", "tier": "proxy", "run_name": "round0006_proxy_1774131549", "family_name": "whitened_topk", "family_stage": "prototype", "status": null, "decision": null, "payload": {"tier": "proxy", "run_name": "round0006_proxy_1774131549", "family_name": "whitened_topk", "family_stage": "prototype", "checkpoint_dir": "/root/sparsify-ascend/checkpoints/research_agent/round_0006_proxy", "log_path": "/root/sparsify-ascend/research/history/logs/round0006_proxy_1774131549.log", "config": {"architecture": "whitened_topk", "expansion_factor": 16, "k": 128, "optimizer": "signum", "lr": "1.6e-3", "hookpoints": "layers.[3].self_attn.o_proj", "batch_size": 1, "grad_acc_steps": 8, "micro_acc_steps": 1, "auxk_alpha": 0.0, "dead_feature_threshold": 10000000, "use_hadamard": false, "tier": "proxy", "family_name": "whitened_topk", "family_stage": "prototype"}, "baseline_tokens_per_sec": null, "proxy_mode": "fast", "evaluation_basis": "terminal_only"}}
{"event_id": "evt_1774131579644691521", "ts": 1774131579, "event": "training_heartbeat", "round": 6, "session_id": "019d1279-dd8d-73d2-97df-ff57e75146ab", "tier": "proxy", "run_name": "round0006_proxy_1774131549", "family_name": "whitened_topk", "family_stage": "prototype", "status": null, "decision": null, "payload": {"tier": "proxy", "run_name": "round0006_proxy_1774131549", "family_name": "whitened_topk", "family_stage": "prototype", "checkpoint_dir": "/root/sparsify-ascend/checkpoints/research_agent/round_0006_proxy/round0006_proxy_1774131549_dp2_bs1_ga8_ef16_k128_20260322_061916", "metrics_path": "/root/sparsify-ascend/checkpoints/research_agent/round_0006_proxy/round0006_proxy_1774131549_dp2_bs1_ga8_ef16_k128_20260322_061916/metrics.jsonl", "latest_step": 110, "latest_tokens_per_sec": 120143.83549463925, "baseline_ratio": null, "latest_total_tokens": 3604480.0, "proxy_mode": "fast", "evaluation_basis": "terminal_only"}}
{"event_id": "evt_1774131609646130290", "ts": 1774131609, "event": "training_heartbeat", "round": 6, "session_id": "019d1279-dd8d-73d2-97df-ff57e75146ab", "tier": "proxy", "run_name": "round0006_proxy_1774131549", "family_name": "whitened_topk", "family_stage": "prototype", "status": null, "decision": null, "payload": {"tier": "proxy", "run_name": "round0006_proxy_1774131549", "family_name": "whitened_topk", "family_stage": "prototype", "checkpoint_dir": "/root/sparsify-ascend/checkpoints/research_agent/round_0006_proxy/round0006_proxy_1774131549_dp2_bs1_ga8_ef16_k128_20260322_061916", "metrics_path": "/root/sparsify-ascend/checkpoints/research_agent/round_0006_proxy/round0006_proxy_1774131549_dp2_bs1_ga8_ef16_k128_20260322_061916/metrics.jsonl", "latest_step": 152, "latest_tokens_per_sec": 83008.36558264197, "baseline_ratio": null, "latest_total_tokens": 4980736.0, "proxy_mode": "fast", "evaluation_basis": "terminal_only"}}
{"event_id": "evt_1774131609708619480", "ts": 1774131609, "event": "training_finished", "round": 6, "session_id": "019d1279-dd8d-73d2-97df-ff57e75146ab", "tier": "proxy", "run_name": "round0006_proxy_1774131549", "family_name": "whitened_topk", "family_stage": "prototype", "status": "ok", "decision": "incubate", "payload": {"tier": "proxy", "run_name": "round0006_proxy_1774131549", "family_name": "whitened_topk", "family_stage": "prototype", "checkpoint_dir": "/root/sparsify-ascend/checkpoints/research_agent/round_0006_proxy/round0006_proxy_1774131549_dp2_bs1_ga8_ef16_k128_20260322_061916", "metrics_path": "/root/sparsify-ascend/checkpoints/research_agent/round_0006_proxy/round0006_proxy_1774131549_dp2_bs1_ga8_ef16_k128_20260322_061916/metrics.jsonl", "run_health": "normal", "termination_reason": "completed", "tokens_per_sec": 83008.36558264197, "baseline_ratio": null, "status": "ok", "decision": "incubate", "proxy_mode": "fast", "evaluation_basis": "terminal_only", "curve_start_fvu": 0.3740249276161194, "curve_mid_fvu": 0.29901009798049927, "curve_end_fvu": 0.266973614692688, "curve_late_slope": -3.607584080929237e-09, "curve_still_improving": true}}
{"event_id": "evt_1774131609708676828", "ts": 1774131609, "event": "result_recorded", "round": 6, "session_id": "019d1279-dd8d-73d2-97df-ff57e75146ab", "tier": "proxy", "run_name": "round0006_proxy_1774131549", "family_name": "whitened_topk", "family_stage": "prototype", "status": "ok", "decision": "incubate", "payload": {"tier": "proxy", "run_name": "round0006_proxy_1774131549", "family_name": "whitened_topk", "family_stage": "prototype", "status": "ok", "decision": "incubate", "val_fvu": "0.2673991918563843", "observed_fvu": "0.266974", "k": "128", "log_path": "/root/sparsify-ascend/research/history/logs/proxy_1774131609.log", "checkpoint": null}}
{"event_id": "evt_1774131609708806290", "ts": 1774131609, "event": "round_finished", "round": 6, "session_id": "019d1279-dd8d-73d2-97df-ff57e75146ab", "tier": "proxy", "run_name": null, "family_name": "whitened_topk", "family_stage": "prototype", "status": "ok", "decision": "incubate", "payload": {"tier": "proxy", "family_name": "whitened_topk", "family_stage": "prototype", "status": "ok", "decision": "incubate", "val_fvu": "0.2673991918563843"}}
{"event_id": "evt_1774131609714456177", "ts": 1774131609, "event": "experiment_commit_prepared", "round": 6, "tier": "proxy", "run_name": null, "family_name": "whitened_topk", "family_stage": "prototype", "status": "ok", "decision": "incubate", "payload": {"branch": "autoresearch-sae"}}
{"event_id": "evt_1774131617238950107", "ts": 1774131617, "event": "round_started", "round": 7, "session_id": "019d1279-dd8d-73d2-97df-ff57e75146ab", "tier": null, "run_name": null, "family_name": null, "family_stage": null, "status": "started", "decision": null, "payload": {"status": "started"}}
{"event_id": "evt_1774131617239102405", "ts": 1774131617, "event": "agent_deciding", "round": 7, "session_id": "019d1279-dd8d-73d2-97df-ff57e75146ab", "tier": null, "run_name": null, "family_name": null, "family_stage": null, "status": null, "decision": null, "payload": {}}
{"event_id": "evt_1774131752399557633", "ts": 1774131752, "event": "session_resumed", "round": 7, "tier": null, "run_name": null, "family_name": null, "family_stage": null, "status": "active", "decision": null, "payload": {"session_id": "019d1279-dd8d-73d2-97df-ff57e75146ab"}}
{"event_id": "evt_1774131752400126008", "ts": 1774131752, "event": "agent_action_received", "round": 7, "session_id": "019d1279-dd8d-73d2-97df-ff57e75146ab", "tier": "proxy", "run_name": null, "family_name": "two_stage_residual", "family_stage": "prototype", "status": null, "decision": null, "payload": {"session_id": "019d1279-dd8d-73d2-97df-ff57e75146ab", "tier": "proxy", "family_name": "two_stage_residual", "family_stage": "prototype", "change_type": "edit_sae_code", "expected_win": "explore_unknown", "hypothesis": "Recent alternative families remain well behind gated at K=128, so the next informative move is a genuinely different encoder structure rather than another local sweep. A new `two_stage_residual` SAE that allocates the same total K across a coarse sparse pass and a residual sparse pass may recover more variance at fixed sparsity by turning single-shot TopK selection into staged residual reconstruction."}}
{"event_id": "evt_1774131883043800139", "ts": 1774131883, "event": "variable_isolation_warning", "round": 7, "session_id": "019d1279-dd8d-73d2-97df-ff57e75146ab", "tier": null, "run_name": null, "family_name": "two_stage_residual", "family_stage": "prototype", "status": null, "decision": null, "payload": {"violation": "Multiple primary variables changed simultaneously: code_edit, architecture, lr"}}
{"event_id": "evt_1774131883043928203", "ts": 1774131883, "event": "proxy_mode_selected", "round": 7, "session_id": "019d1279-dd8d-73d2-97df-ff57e75146ab", "tier": "proxy", "run_name": null, "family_name": "two_stage_residual", "family_stage": "prototype", "status": null, "decision": null, "payload": {"tier": "proxy", "proxy_mode": "fast", "evaluation_basis": "terminal_only", "parameter_behavior": "structural", "proxy_max_tokens": "40000000"}}
{"event_id": "evt_1774131883043979626", "ts": 1774131883, "event": "sanity_started", "round": 7, "session_id": "019d1279-dd8d-73d2-97df-ff57e75146ab", "tier": "proxy", "run_name": null, "family_name": "two_stage_residual", "family_stage": "prototype", "status": null, "decision": null, "payload": {"tier": "proxy"}}
{"event_id": "evt_1774131887721572022", "ts": 1774131887, "event": "sanity_finished", "round": 7, "session_id": "019d1279-dd8d-73d2-97df-ff57e75146ab", "tier": "proxy", "run_name": null, "family_name": "two_stage_residual", "family_stage": "prototype", "status": "ok", "decision": null, "payload": {"tier": "proxy", "status": "ok"}}
{"event_id": "evt_1774131887721978799", "ts": 1774131887, "event": "training_started", "round": 7, "session_id": "019d1279-dd8d-73d2-97df-ff57e75146ab", "tier": "proxy", "run_name": "round0007_proxy_1774131887", "family_name": "two_stage_residual", "family_stage": "prototype", "status": null, "decision": null, "payload": {"tier": "proxy", "run_name": "round0007_proxy_1774131887", "family_name": "two_stage_residual", "family_stage": "prototype", "checkpoint_dir": "/root/sparsify-ascend/checkpoints/research_agent/round_0007_proxy", "log_path": "/root/sparsify-ascend/research/history/logs/round0007_proxy_1774131887.log", "config": {"architecture": "two_stage_residual", "expansion_factor": 16, "k": 128, "optimizer": "signum", "lr": "1.6e-3", "hookpoints": "layers.[3].self_attn.o_proj", "batch_size": 1, "grad_acc_steps": 8, "micro_acc_steps": 1, "auxk_alpha": 0.0, "dead_feature_threshold": 10000000, "use_hadamard": false, "tier": "proxy", "family_name": "two_stage_residual", "family_stage": "prototype"}, "baseline_tokens_per_sec": null, "proxy_mode": "fast", "evaluation_basis": "terminal_only"}}
{"event_id": "evt_1774131917722753220", "ts": 1774131917, "event": "training_heartbeat", "round": 7, "session_id": "019d1279-dd8d-73d2-97df-ff57e75146ab", "tier": "proxy", "run_name": "round0007_proxy_1774131887", "family_name": "two_stage_residual", "family_stage": "prototype", "status": null, "decision": null, "payload": {"tier": "proxy", "run_name": "round0007_proxy_1774131887", "family_name": "two_stage_residual", "family_stage": "prototype", "checkpoint_dir": null, "metrics_path": null, "latest_step": null, "latest_tokens_per_sec": null, "baseline_ratio": null, "latest_total_tokens": null, "proxy_mode": "fast", "evaluation_basis": "terminal_only"}}
{"event_id": "evt_1774131917784814399", "ts": 1774131917, "event": "training_finished", "round": 7, "session_id": "019d1279-dd8d-73d2-97df-ff57e75146ab", "tier": "proxy", "run_name": "round0007_proxy_1774131887", "family_name": "two_stage_residual", "family_stage": "prototype", "status": "crash", "decision": "crash", "payload": {"tier": "proxy", "run_name": "round0007_proxy_1774131887", "family_name": "two_stage_residual", "family_stage": "prototype", "checkpoint_dir": null, "metrics_path": "", "run_health": "crash", "termination_reason": "completed", "tokens_per_sec": null, "baseline_ratio": null, "status": "crash", "decision": "crash", "proxy_mode": "fast", "evaluation_basis": "terminal_only", "curve_start_fvu": null, "curve_mid_fvu": null, "curve_end_fvu": null, "curve_late_slope": null, "curve_still_improving": null}}
{"event_id": "evt_1774131917784863084", "ts": 1774131917, "event": "result_recorded", "round": 7, "session_id": "019d1279-dd8d-73d2-97df-ff57e75146ab", "tier": "proxy", "run_name": "round0007_proxy_1774131887", "family_name": "two_stage_residual", "family_stage": "prototype", "status": "crash", "decision": "crash", "payload": {"tier": "proxy", "run_name": "round0007_proxy_1774131887", "family_name": "two_stage_residual", "family_stage": "prototype", "status": "crash", "decision": "crash", "val_fvu": "None", "observed_fvu": "", "k": "None", "log_path": "/root/sparsify-ascend/research/history/logs/proxy_1774131917.log", "checkpoint": null}}
{"event_id": "evt_1774131917784932879", "ts": 1774131917, "event": "repair_attempt_started", "round": 7, "session_id": "019d1279-dd8d-73d2-97df-ff57e75146ab", "tier": "proxy", "run_name": null, "family_name": "two_stage_residual", "family_stage": "prototype", "status": null, "decision": null, "payload": {"tier": "proxy", "family_name": "two_stage_residual", "family_stage": "prototype", "repair_attempt": 1, "failure_kind": "training_crash", "error_type": "ValueError", "error_summary": "ValueError: Unknown architecture: 'two_stage_residual'. Must be one of ('topk', 'jumprelu', 'gated', 'routed', 'group_topk', 'factorized_topk', 'lowrank_residual', 'whitened_topk')"}}
