{"event_id": "evt_1774161611425028296", "ts": 1774161611, "event": "training_heartbeat", "round": 47, "session_id": "019d13dc-400c-7493-83af-bd34fffa7466", "tier": "full", "run_name": "round0047_full_1774161191", "family_name": "lowrank_gated_residual", "family_stage": "mainline", "status": null, "decision": null, "payload": {"tier": "full", "run_name": "round0047_full_1774161191", "family_name": "lowrank_gated_residual", "family_stage": "mainline", "checkpoint_dir": "/root/sparsify-ascend/checkpoints/research_agent/round_0047_full/round0047_full_1774161191_dp2_bs1_ga8_ef32_k40_20260322_143317", "metrics_path": "/root/sparsify-ascend/checkpoints/research_agent/round_0047_full/round0047_full_1774161191_dp2_bs1_ga8_ef32_k40_20260322_143317/metrics.jsonl", "latest_step": 1220, "latest_tokens_per_sec": 95148.81474797339, "baseline_ratio": 1.0727568061503856, "latest_total_tokens": 39976960.0, "proxy_mode": null, "evaluation_basis": null}}
{"event_id": "evt_1774161636686402958", "ts": 1774161636, "event": "hint_added", "round": null, "tier": null, "run_name": null, "family_name": null, "family_stage": null, "status": "pending", "decision": null, "payload": {"id": "hint_1774161636", "message": "Do not run any more experiments with EF=32. EF=32 makes the model\n  too large and those comparisons are not desirable for the current search. From\n  now on, keep EF <= 16, and prefer EF=8 by default. Only deviate from EF=8 if\n  there is strong evidence.", "priority": "high", "scope": "persistent", "tag": "ef_cap", "status": "pending", "created_at": 1774161636, "applied_at": null}}
{"event_id": "evt_1774161641502545758", "ts": 1774161641, "event": "training_heartbeat", "round": 47, "session_id": "019d13dc-400c-7493-83af-bd34fffa7466", "tier": "full", "run_name": "round0047_full_1774161191", "family_name": "lowrank_gated_residual", "family_stage": "mainline", "status": null, "decision": null, "payload": {"tier": "full", "run_name": "round0047_full_1774161191", "family_name": "lowrank_gated_residual", "family_stage": "mainline", "checkpoint_dir": "/root/sparsify-ascend/checkpoints/research_agent/round_0047_full/round0047_full_1774161191_dp2_bs1_ga8_ef32_k40_20260322_143317", "metrics_path": "/root/sparsify-ascend/checkpoints/research_agent/round_0047_full/round0047_full_1774161191_dp2_bs1_ga8_ef32_k40_20260322_143317/metrics.jsonl", "latest_step": 1220, "latest_tokens_per_sec": 88795.3301457716, "baseline_ratio": 1.0011243442239084, "latest_total_tokens": 39976960.0, "proxy_mode": null, "evaluation_basis": null}}
{"event_id": "evt_1774161671509994711", "ts": 1774161671, "event": "training_heartbeat", "round": 47, "session_id": "019d13dc-400c-7493-83af-bd34fffa7466", "tier": "full", "run_name": "round0047_full_1774161191", "family_name": "lowrank_gated_residual", "family_stage": "mainline", "status": null, "decision": null, "payload": {"tier": "full", "run_name": "round0047_full_1774161191", "family_name": "lowrank_gated_residual", "family_stage": "mainline", "checkpoint_dir": "/root/sparsify-ascend/checkpoints/research_agent/round_0047_full/round0047_full_1774161191_dp2_bs1_ga8_ef32_k40_20260322_143317", "metrics_path": "/root/sparsify-ascend/checkpoints/research_agent/round_0047_full/round0047_full_1774161191_dp2_bs1_ga8_ef32_k40_20260322_143317/metrics.jsonl", "latest_step": 1220, "latest_tokens_per_sec": 83234.66661258652, "baseline_ratio": 0.938430555891, "latest_total_tokens": 39976960.0, "proxy_mode": null, "evaluation_basis": null}}
{"event_id": "evt_1774161671590016454", "ts": 1774161671, "event": "training_finished", "round": 47, "session_id": "019d13dc-400c-7493-83af-bd34fffa7466", "tier": "full", "run_name": "round0047_full_1774161191", "family_name": "lowrank_gated_residual", "family_stage": "mainline", "status": "ok", "decision": "keep", "payload": {"tier": "full", "run_name": "round0047_full_1774161191", "family_name": "lowrank_gated_residual", "family_stage": "mainline", "checkpoint_dir": "/root/sparsify-ascend/checkpoints/research_agent/round_0047_full/round0047_full_1774161191_dp2_bs1_ga8_ef32_k40_20260322_143317", "metrics_path": "/root/sparsify-ascend/checkpoints/research_agent/round_0047_full/round0047_full_1774161191_dp2_bs1_ga8_ef32_k40_20260322_143317/metrics.jsonl", "run_health": "normal", "termination_reason": "completed", "tokens_per_sec": 83234.66661258652, "baseline_ratio": 0.938430555891, "status": "ok", "decision": "keep", "proxy_mode": null, "evaluation_basis": null, "curve_start_fvu": 0.12739238142967224, "curve_mid_fvu": 0.10995765030384064, "curve_end_fvu": 0.0889667421579361, "curve_late_slope": -1.4312278284198895e-09, "curve_still_improving": true}}
{"event_id": "evt_1774161671590070273", "ts": 1774161671, "event": "result_recorded", "round": 47, "session_id": "019d13dc-400c-7493-83af-bd34fffa7466", "tier": "full", "run_name": "round0047_full_1774161191", "family_name": "lowrank_gated_residual", "family_stage": "mainline", "status": "ok", "decision": "keep", "payload": {"tier": "full", "run_name": "round0047_full_1774161191", "family_name": "lowrank_gated_residual", "family_stage": "mainline", "status": "ok", "decision": "keep", "val_fvu": "0.09111861046403646", "observed_fvu": "0.088967", "k": "40", "log_path": "/root/sparsify-ascend/research/history/logs/full_1774161671.log", "checkpoint": null}}
{"event_id": "evt_1774161671590456673", "ts": 1774161671, "event": "round_finished", "round": 47, "session_id": "019d13dc-400c-7493-83af-bd34fffa7466", "tier": "full", "run_name": null, "family_name": "lowrank_gated_residual", "family_stage": "mainline", "status": "ok", "decision": "keep", "payload": {"tier": "full", "family_name": "lowrank_gated_residual", "family_stage": "mainline", "status": "ok", "decision": "keep", "val_fvu": "0.09111861046403646"}}
{"event_id": "evt_1774161671597934121", "ts": 1774161671, "event": "experiment_commit_prepared", "round": 47, "tier": "full", "run_name": null, "family_name": "lowrank_gated_residual", "family_stage": "mainline", "status": "ok", "decision": "keep", "payload": {"branch": "autoresearch-sae"}}
{"event_id": "evt_1774161679435157844", "ts": 1774161679, "event": "round_started", "round": 48, "session_id": "019d13dc-400c-7493-83af-bd34fffa7466", "tier": null, "run_name": null, "family_name": null, "family_stage": null, "status": "started", "decision": null, "payload": {"status": "started"}}
{"event_id": "evt_1774161679435306482", "ts": 1774161679, "event": "agent_deciding", "round": 48, "session_id": "019d13dc-400c-7493-83af-bd34fffa7466", "tier": null, "run_name": null, "family_name": null, "family_stage": null, "status": null, "decision": null, "payload": {}}
{"event_id": "evt_1774161814745265188", "ts": 1774161814, "event": "session_resumed", "round": 48, "tier": null, "run_name": null, "family_name": null, "family_stage": null, "status": "active", "decision": null, "payload": {"session_id": "019d13dc-400c-7493-83af-bd34fffa7466"}}
{"event_id": "evt_1774161814746450794", "ts": 1774161814, "event": "agent_action_received", "round": 48, "session_id": "019d13dc-400c-7493-83af-bd34fffa7466", "tier": "proxy", "run_name": null, "family_name": "lowrank_residual", "family_stage": "mainline_comparison", "status": null, "decision": null, "payload": {"session_id": "019d13dc-400c-7493-83af-bd34fffa7466", "tier": "proxy", "family_name": "lowrank_residual", "family_stage": "mainline_comparison", "change_type": "param_only", "expected_win": "smaller_k", "hypothesis": "The `lowrank_gated_residual` K sweep at `EF=32` has now mapped a clear lower-K frontier down to `K=40`, and the new operator hint explicitly rules out further `EF=32` runs. The next most informative move is a same-EF architecture comparison at lower K: run `lowrank_residual` at `K=40`, `EF=8` under the shared stable optimizer/LR recipe to test whether a simpler low-rank residual family preserves more quality at small K when capacity is reduced to the newly preferred regime."}}
{"event_id": "evt_1774161814746701936", "ts": 1774161814, "event": "variable_isolation_warning", "round": 48, "session_id": "019d13dc-400c-7493-83af-bd34fffa7466", "tier": null, "run_name": null, "family_name": "lowrank_residual", "family_stage": "mainline_comparison", "status": null, "decision": null, "payload": {"violation": "Multiple primary variables changed simultaneously: architecture, k, lr"}}
{"event_id": "evt_1774161814746783012", "ts": 1774161814, "event": "proxy_mode_selected", "round": 48, "session_id": "019d13dc-400c-7493-83af-bd34fffa7466", "tier": "proxy", "run_name": null, "family_name": "lowrank_residual", "family_stage": "mainline_comparison", "status": null, "decision": null, "payload": {"tier": "proxy", "proxy_mode": "fast", "evaluation_basis": "terminal_only", "parameter_behavior": "structural", "proxy_max_tokens": "5000000"}}
{"event_id": "evt_1774161814747066137", "ts": 1774161814, "event": "training_started", "round": 48, "session_id": "019d13dc-400c-7493-83af-bd34fffa7466", "tier": "proxy", "run_name": "round0048_proxy_1774161814", "family_name": "lowrank_residual", "family_stage": "mainline_comparison", "status": null, "decision": null, "payload": {"tier": "proxy", "run_name": "round0048_proxy_1774161814", "family_name": "lowrank_residual", "family_stage": "mainline_comparison", "checkpoint_dir": "/root/sparsify-ascend/checkpoints/research_agent/round_0048_proxy", "log_path": "/root/sparsify-ascend/research/history/logs/round0048_proxy_1774161814.log", "config": {"architecture": "lowrank_residual", "expansion_factor": 8, "k": 40, "optimizer": "signum", "lr": "1.6e-3", "hookpoints": "layers.[3].self_attn.o_proj", "batch_size": 1, "grad_acc_steps": 8, "micro_acc_steps": 1, "auxk_alpha": 0.0, "dead_feature_threshold": 10000000, "use_hadamard": false, "tier": "proxy", "family_name": "lowrank_residual", "family_stage": "mainline_comparison"}, "baseline_tokens_per_sec": 83008.52258207071, "proxy_mode": "fast", "evaluation_basis": "terminal_only"}}
{"event_id": "evt_1774161844749025996", "ts": 1774161844, "event": "training_heartbeat", "round": 48, "session_id": "019d13dc-400c-7493-83af-bd34fffa7466", "tier": "proxy", "run_name": "round0048_proxy_1774161814", "family_name": "lowrank_residual", "family_stage": "mainline_comparison", "status": null, "decision": null, "payload": {"tier": "proxy", "run_name": "round0048_proxy_1774161814", "family_name": "lowrank_residual", "family_stage": "mainline_comparison", "checkpoint_dir": "/root/sparsify-ascend/checkpoints/research_agent/round_0048_proxy/round0048_proxy_1774161814_dp2_bs1_ga8_ef8_k40_20260322_144341", "metrics_path": "/root/sparsify-ascend/checkpoints/research_agent/round_0048_proxy/round0048_proxy_1774161814_dp2_bs1_ga8_ef8_k40_20260322_144341/metrics.jsonl", "latest_step": 150, "latest_tokens_per_sec": 163830.98096525553, "baseline_ratio": 1.9736645812877283, "latest_total_tokens": 4915200.0, "proxy_mode": "fast", "evaluation_basis": "terminal_only"}}
{"event_id": "evt_1774161874750450049", "ts": 1774161874, "event": "training_heartbeat", "round": 48, "session_id": "019d13dc-400c-7493-83af-bd34fffa7466", "tier": "proxy", "run_name": "round0048_proxy_1774161814", "family_name": "lowrank_residual", "family_stage": "mainline_comparison", "status": null, "decision": null, "payload": {"tier": "proxy", "run_name": "round0048_proxy_1774161814", "family_name": "lowrank_residual", "family_stage": "mainline_comparison", "checkpoint_dir": "/root/sparsify-ascend/checkpoints/research_agent/round_0048_proxy/round0048_proxy_1774161814_dp2_bs1_ga8_ef8_k40_20260322_144341", "metrics_path": "/root/sparsify-ascend/checkpoints/research_agent/round_0048_proxy/round0048_proxy_1774161814_dp2_bs1_ga8_ef8_k40_20260322_144341/metrics.jsonl", "latest_step": 152, "latest_tokens_per_sec": 83007.99056750251, "baseline_ratio": 0.9999935908440284, "latest_total_tokens": 4980736.0, "proxy_mode": "fast", "evaluation_basis": "terminal_only"}}
{"event_id": "evt_1774161874815760159", "ts": 1774161874, "event": "training_finished", "round": 48, "session_id": "019d13dc-400c-7493-83af-bd34fffa7466", "tier": "proxy", "run_name": "round0048_proxy_1774161814", "family_name": "lowrank_residual", "family_stage": "mainline_comparison", "status": "ok", "decision": "incubate", "payload": {"tier": "proxy", "run_name": "round0048_proxy_1774161814", "family_name": "lowrank_residual", "family_stage": "mainline_comparison", "checkpoint_dir": "/root/sparsify-ascend/checkpoints/research_agent/round_0048_proxy/round0048_proxy_1774161814_dp2_bs1_ga8_ef8_k40_20260322_144341", "metrics_path": "/root/sparsify-ascend/checkpoints/research_agent/round_0048_proxy/round0048_proxy_1774161814_dp2_bs1_ga8_ef8_k40_20260322_144341/metrics.jsonl", "run_health": "normal", "termination_reason": "completed", "tokens_per_sec": 83007.99056750251, "baseline_ratio": 0.9999935908440284, "status": "ok", "decision": "incubate", "proxy_mode": "fast", "evaluation_basis": "terminal_only", "curve_start_fvu": 0.34820717573165894, "curve_mid_fvu": 0.22559601068496704, "curve_end_fvu": 0.17842891812324524, "curve_late_slope": -7.192870872395654e-09, "curve_still_improving": true}}
{"event_id": "evt_1774161874815820833", "ts": 1774161874, "event": "result_recorded", "round": 48, "session_id": "019d13dc-400c-7493-83af-bd34fffa7466", "tier": "proxy", "run_name": "round0048_proxy_1774161814", "family_name": "lowrank_residual", "family_stage": "mainline_comparison", "status": "ok", "decision": "incubate", "payload": {"tier": "proxy", "run_name": "round0048_proxy_1774161814", "family_name": "lowrank_residual", "family_stage": "mainline_comparison", "status": "ok", "decision": "incubate", "val_fvu": "0.1793901640921831", "observed_fvu": "0.178429", "k": "40", "log_path": "/root/sparsify-ascend/research/history/logs/proxy_1774161874.log", "checkpoint": null}}
{"event_id": "evt_1774161874815946175", "ts": 1774161874, "event": "round_finished", "round": 48, "session_id": "019d13dc-400c-7493-83af-bd34fffa7466", "tier": "proxy", "run_name": null, "family_name": "lowrank_residual", "family_stage": "mainline_comparison", "status": "ok", "decision": "incubate", "payload": {"tier": "proxy", "family_name": "lowrank_residual", "family_stage": "mainline_comparison", "status": "ok", "decision": "incubate", "val_fvu": "0.1793901640921831"}}
{"event_id": "evt_1774161874823840445", "ts": 1774161874, "event": "experiment_commit_prepared", "round": 48, "tier": "proxy", "run_name": null, "family_name": "lowrank_residual", "family_stage": "mainline_comparison", "status": "ok", "decision": "incubate", "payload": {"branch": "autoresearch-sae"}}
{"event_id": "evt_1774161882463030208", "ts": 1774161882, "event": "round_started", "round": 49, "session_id": "019d13dc-400c-7493-83af-bd34fffa7466", "tier": null, "run_name": null, "family_name": null, "family_stage": null, "status": "started", "decision": null, "payload": {"status": "started"}}
{"event_id": "evt_1774161882463183584", "ts": 1774161882, "event": "agent_deciding", "round": 49, "session_id": "019d13dc-400c-7493-83af-bd34fffa7466", "tier": null, "run_name": null, "family_name": null, "family_stage": null, "status": null, "decision": null, "payload": {}}
{"event_id": "evt_1774162010787922119", "ts": 1774162010, "event": "session_resumed", "round": 49, "tier": null, "run_name": null, "family_name": null, "family_stage": null, "status": "active", "decision": null, "payload": {"session_id": "019d13dc-400c-7493-83af-bd34fffa7466"}}
{"event_id": "evt_1774162010789156111", "ts": 1774162010, "event": "agent_action_received", "round": 49, "session_id": "019d13dc-400c-7493-83af-bd34fffa7466", "tier": "proxy", "run_name": null, "family_name": "lowrank_gated_residual", "family_stage": "mainline_comparison", "status": null, "decision": null, "payload": {"session_id": "019d13dc-400c-7493-83af-bd34fffa7466", "tier": "proxy", "family_name": "lowrank_gated_residual", "family_stage": "mainline_comparison", "change_type": "param_only", "expected_win": "smaller_k", "hypothesis": "`lowrank_residual` at `K=40`, `EF=8` was clearly weak in proxy, so the next fair small-capacity comparison should keep the same `K=40`, `EF=8`, optimizer, and LR while switching only architecture. Testing `lowrank_gated_residual` at `K=40`, `EF=8` is the strongest same-EF follow-up because it is the current best overall family and will show whether the low-K frontier remains viable once the operator-mandated capacity cap is enforced."}}
{"event_id": "evt_1774162010789288448", "ts": 1774162010, "event": "proxy_mode_selected", "round": 49, "session_id": "019d13dc-400c-7493-83af-bd34fffa7466", "tier": "proxy", "run_name": null, "family_name": "lowrank_gated_residual", "family_stage": "mainline_comparison", "status": null, "decision": null, "payload": {"tier": "proxy", "proxy_mode": "fast", "evaluation_basis": "terminal_only", "parameter_behavior": "structural", "proxy_max_tokens": "5000000"}}
{"event_id": "evt_1774162010789555527", "ts": 1774162010, "event": "training_started", "round": 49, "session_id": "019d13dc-400c-7493-83af-bd34fffa7466", "tier": "proxy", "run_name": "round0049_proxy_1774162010", "family_name": "lowrank_gated_residual", "family_stage": "mainline_comparison", "status": null, "decision": null, "payload": {"tier": "proxy", "run_name": "round0049_proxy_1774162010", "family_name": "lowrank_gated_residual", "family_stage": "mainline_comparison", "checkpoint_dir": "/root/sparsify-ascend/checkpoints/research_agent/round_0049_proxy", "log_path": "/root/sparsify-ascend/research/history/logs/round0049_proxy_1774162010.log", "config": {"architecture": "lowrank_gated_residual", "expansion_factor": 8, "k": 40, "optimizer": "signum", "lr": "1.6e-3", "hookpoints": "layers.[3].self_attn.o_proj", "batch_size": 1, "grad_acc_steps": 8, "micro_acc_steps": 1, "auxk_alpha": 0.0, "dead_feature_threshold": 10000000, "use_hadamard": false, "tier": "proxy", "family_name": "lowrank_gated_residual", "family_stage": "mainline_comparison"}, "baseline_tokens_per_sec": 83008.58788873068, "proxy_mode": "fast", "evaluation_basis": "terminal_only"}}
{"event_id": "evt_1774162040791299151", "ts": 1774162040, "event": "training_heartbeat", "round": 49, "session_id": "019d13dc-400c-7493-83af-bd34fffa7466", "tier": "proxy", "run_name": "round0049_proxy_1774162010", "family_name": "lowrank_gated_residual", "family_stage": "mainline_comparison", "status": null, "decision": null, "payload": {"tier": "proxy", "run_name": "round0049_proxy_1774162010", "family_name": "lowrank_gated_residual", "family_stage": "mainline_comparison", "checkpoint_dir": "/root/sparsify-ascend/checkpoints/research_agent/round_0049_proxy/round0049_proxy_1774162010_dp2_bs1_ga8_ef8_k40_20260322_144657", "metrics_path": "/root/sparsify-ascend/checkpoints/research_agent/round_0049_proxy/round0049_proxy_1774162010_dp2_bs1_ga8_ef8_k40_20260322_144657/metrics.jsonl", "latest_step": 130, "latest_tokens_per_sec": 141987.65807164286, "baseline_ratio": 1.7105176907956923, "latest_total_tokens": 4259840.0, "proxy_mode": "fast", "evaluation_basis": "terminal_only"}}
{"event_id": "evt_1774162070792734258", "ts": 1774162070, "event": "training_heartbeat", "round": 49, "session_id": "019d13dc-400c-7493-83af-bd34fffa7466", "tier": "proxy", "run_name": "round0049_proxy_1774162010", "family_name": "lowrank_gated_residual", "family_stage": "mainline_comparison", "status": null, "decision": null, "payload": {"tier": "proxy", "run_name": "round0049_proxy_1774162010", "family_name": "lowrank_gated_residual", "family_stage": "mainline_comparison", "checkpoint_dir": "/root/sparsify-ascend/checkpoints/research_agent/round_0049_proxy/round0049_proxy_1774162010_dp2_bs1_ga8_ef8_k40_20260322_144657", "metrics_path": "/root/sparsify-ascend/checkpoints/research_agent/round_0049_proxy/round0049_proxy_1774162010_dp2_bs1_ga8_ef8_k40_20260322_144657/metrics.jsonl", "latest_step": 152, "latest_tokens_per_sec": 83008.29005161578, "baseline_ratio": 0.9999964119722734, "latest_total_tokens": 4980736.0, "proxy_mode": "fast", "evaluation_basis": "terminal_only"}}
{"event_id": "evt_1774162070858342235", "ts": 1774162070, "event": "training_finished", "round": 49, "session_id": "019d13dc-400c-7493-83af-bd34fffa7466", "tier": "proxy", "run_name": "round0049_proxy_1774162010", "family_name": "lowrank_gated_residual", "family_stage": "mainline_comparison", "status": "ok", "decision": "discard", "payload": {"tier": "proxy", "run_name": "round0049_proxy_1774162010", "family_name": "lowrank_gated_residual", "family_stage": "mainline_comparison", "checkpoint_dir": "/root/sparsify-ascend/checkpoints/research_agent/round_0049_proxy/round0049_proxy_1774162010_dp2_bs1_ga8_ef8_k40_20260322_144657", "metrics_path": "/root/sparsify-ascend/checkpoints/research_agent/round_0049_proxy/round0049_proxy_1774162010_dp2_bs1_ga8_ef8_k40_20260322_144657/metrics.jsonl", "run_health": "normal", "termination_reason": "completed", "tokens_per_sec": 83008.29005161578, "baseline_ratio": 0.9999964119722734, "status": "ok", "decision": "discard", "proxy_mode": "fast", "evaluation_basis": "terminal_only", "curve_start_fvu": 0.34772181510925293, "curve_mid_fvu": 0.22488060593605042, "curve_end_fvu": 0.1780710518360138, "curve_late_slope": -7.0757220870995475e-09, "curve_still_improving": true}}
{"event_id": "evt_1774162070858399340", "ts": 1774162070, "event": "result_recorded", "round": 49, "session_id": "019d13dc-400c-7493-83af-bd34fffa7466", "tier": "proxy", "run_name": "round0049_proxy_1774162010", "family_name": "lowrank_gated_residual", "family_stage": "mainline_comparison", "status": "ok", "decision": "discard", "payload": {"tier": "proxy", "run_name": "round0049_proxy_1774162010", "family_name": "lowrank_gated_residual", "family_stage": "mainline_comparison", "status": "ok", "decision": "discard", "val_fvu": "0.17895471677184105", "observed_fvu": "0.178071", "k": "40", "log_path": "/root/sparsify-ascend/research/history/logs/proxy_1774162070.log", "checkpoint": null}}
