{"event_id": "evt_1774175532309342513", "ts": 1774175532, "event": "training_heartbeat", "round": 94, "session_id": "019d14ea-730e-75e1-9200-ca4cb6c1e330", "tier": "proxy", "run_name": "round0094_proxy_1774175472", "family_name": "batch_topk", "family_stage": "mainline_comparison", "status": null, "decision": null, "payload": {"tier": "proxy", "run_name": "round0094_proxy_1774175472", "family_name": "batch_topk", "family_stage": "mainline_comparison", "checkpoint_dir": "/root/sparsify-ascend/checkpoints/research_agent/round_0094_proxy/round0094_proxy_1774175472_dp2_bs1_ga8_ef12_k40_20260322_183118", "metrics_path": "/root/sparsify-ascend/checkpoints/research_agent/round_0094_proxy/round0094_proxy_1774175472_dp2_bs1_ga8_ef12_k40_20260322_183118/metrics.jsonl", "latest_step": 152, "latest_tokens_per_sec": 83007.59510665936, "baseline_ratio": 0.9999884969509352, "latest_total_tokens": 4980736.0, "proxy_mode": "fast", "evaluation_basis": "terminal_only"}}
{"event_id": "evt_1774175532375304968", "ts": 1774175532, "event": "training_finished", "round": 94, "session_id": "019d14ea-730e-75e1-9200-ca4cb6c1e330", "tier": "proxy", "run_name": "round0094_proxy_1774175472", "family_name": "batch_topk", "family_stage": "mainline_comparison", "status": "ok", "decision": "incubate", "payload": {"tier": "proxy", "run_name": "round0094_proxy_1774175472", "family_name": "batch_topk", "family_stage": "mainline_comparison", "checkpoint_dir": "/root/sparsify-ascend/checkpoints/research_agent/round_0094_proxy/round0094_proxy_1774175472_dp2_bs1_ga8_ef12_k40_20260322_183118", "metrics_path": "/root/sparsify-ascend/checkpoints/research_agent/round_0094_proxy/round0094_proxy_1774175472_dp2_bs1_ga8_ef12_k40_20260322_183118/metrics.jsonl", "run_health": "normal", "termination_reason": "completed", "tokens_per_sec": 83007.59510665936, "baseline_ratio": 0.9999884969509352, "status": "ok", "decision": "incubate", "proxy_mode": "fast", "evaluation_basis": "terminal_only", "curve_start_fvu": 0.6177389025688171, "curve_mid_fvu": 0.47123780846595764, "curve_end_fvu": 0.4027371406555176, "curve_late_slope": -1.0951724459206866e-08, "curve_still_improving": true}}
{"event_id": "evt_1774175532375361278", "ts": 1774175532, "event": "result_recorded", "round": 94, "session_id": "019d14ea-730e-75e1-9200-ca4cb6c1e330", "tier": "proxy", "run_name": "round0094_proxy_1774175472", "family_name": "batch_topk", "family_stage": "mainline_comparison", "status": "ok", "decision": "incubate", "payload": {"tier": "proxy", "run_name": "round0094_proxy_1774175472", "family_name": "batch_topk", "family_stage": "mainline_comparison", "status": "ok", "decision": "incubate", "val_fvu": "0.40311281383037567", "observed_fvu": "0.402737", "k": "40", "log_path": "/root/sparsify-ascend/research/history/logs/proxy_1774175532.log", "checkpoint": null}}
{"event_id": "evt_1774175532375500517", "ts": 1774175532, "event": "round_finished", "round": 94, "session_id": "019d14ea-730e-75e1-9200-ca4cb6c1e330", "tier": "proxy", "run_name": null, "family_name": "batch_topk", "family_stage": "mainline_comparison", "status": "ok", "decision": "incubate", "payload": {"tier": "proxy", "family_name": "batch_topk", "family_stage": "mainline_comparison", "status": "ok", "decision": "incubate", "val_fvu": "0.40311281383037567"}}
{"event_id": "evt_1774175532384668528", "ts": 1774175532, "event": "experiment_commit_prepared", "round": 94, "tier": "proxy", "run_name": null, "family_name": "batch_topk", "family_stage": "mainline_comparison", "status": "ok", "decision": "incubate", "payload": {"branch": "autoresearch-sae"}}
{"event_id": "evt_1774175540044442044", "ts": 1774175540, "event": "round_started", "round": 95, "session_id": "019d14ea-730e-75e1-9200-ca4cb6c1e330", "tier": null, "run_name": null, "family_name": null, "family_stage": null, "status": "started", "decision": null, "payload": {"status": "started"}}
{"event_id": "evt_1774175540045126852", "ts": 1774175540, "event": "agent_deciding", "round": 95, "session_id": "019d14ea-730e-75e1-9200-ca4cb6c1e330", "tier": null, "run_name": null, "family_name": null, "family_stage": null, "status": null, "decision": null, "payload": {}}
{"event_id": "evt_1774175672951341664", "ts": 1774175672, "event": "session_resumed", "round": 95, "tier": null, "run_name": null, "family_name": null, "family_stage": null, "status": "active", "decision": null, "payload": {"session_id": "019d14ea-730e-75e1-9200-ca4cb6c1e330"}}
{"event_id": "evt_1774175672952665524", "ts": 1774175672, "event": "agent_action_received", "round": 95, "session_id": "019d14ea-730e-75e1-9200-ca4cb6c1e330", "tier": "proxy", "run_name": null, "family_name": "jumprelu", "family_stage": "mainline_comparison", "status": null, "decision": null, "payload": {"session_id": "019d14ea-730e-75e1-9200-ca4cb6c1e330", "tier": "proxy", "family_name": "jumprelu", "family_stage": "mainline_comparison", "change_type": "param_only", "expected_win": "architecture_signal", "hypothesis": "`batch_topk` at the exact active point `K=40, EF=12` was decisively weak, so the next informative move is another fundamentally different sparsity mechanism rather than more residual-family or discrete-trunk tuning. Running `jumprelu` at `K=40, EF=12` with the unchanged `signum`/`lr=1.6e-3`/`auxk_alpha=0` recipe tests whether smoother thresholded support selection recovers low-K quality where routing, residual-VQ, two-code residual-VQ, and batch-budget allocation all failed."}}
{"event_id": "evt_1774175672952782942", "ts": 1774175672, "event": "variable_isolation_warning", "round": 95, "session_id": "019d14ea-730e-75e1-9200-ca4cb6c1e330", "tier": null, "run_name": null, "family_name": "jumprelu", "family_stage": "mainline_comparison", "status": null, "decision": null, "payload": {"violation": "Multiple primary variables changed simultaneously: architecture, k, lr"}}
{"event_id": "evt_1774175672952842261", "ts": 1774175672, "event": "proxy_mode_selected", "round": 95, "session_id": "019d14ea-730e-75e1-9200-ca4cb6c1e330", "tier": "proxy", "run_name": null, "family_name": "jumprelu", "family_stage": "mainline_comparison", "status": null, "decision": null, "payload": {"tier": "proxy", "proxy_mode": "fast", "evaluation_basis": "terminal_only", "parameter_behavior": "structural", "proxy_max_tokens": "5000000"}}
{"event_id": "evt_1774175672953119063", "ts": 1774175672, "event": "training_started", "round": 95, "session_id": "019d14ea-730e-75e1-9200-ca4cb6c1e330", "tier": "proxy", "run_name": "round0095_proxy_1774175672", "family_name": "jumprelu", "family_stage": "mainline_comparison", "status": null, "decision": null, "payload": {"tier": "proxy", "run_name": "round0095_proxy_1774175672", "family_name": "jumprelu", "family_stage": "mainline_comparison", "checkpoint_dir": "/root/sparsify-ascend/checkpoints/research_agent/round_0095_proxy", "log_path": "/root/sparsify-ascend/research/history/logs/round0095_proxy_1774175672.log", "config": {"architecture": "jumprelu", "expansion_factor": 12, "k": 40, "optimizer": "signum", "lr": "1.6e-3", "hookpoints": "layers.[3].self_attn.o_proj", "batch_size": 1, "grad_acc_steps": 8, "micro_acc_steps": 1, "auxk_alpha": 0.0, "dead_feature_threshold": 10000000, "use_hadamard": false, "tier": "proxy", "family_name": "jumprelu", "family_stage": "mainline_comparison"}, "baseline_tokens_per_sec": 83008.65550432022, "proxy_mode": "fast", "evaluation_basis": "terminal_only"}}
{"event_id": "evt_1774175702954772413", "ts": 1774175702, "event": "training_heartbeat", "round": 95, "session_id": "019d14ea-730e-75e1-9200-ca4cb6c1e330", "tier": "proxy", "run_name": "round0095_proxy_1774175672", "family_name": "jumprelu", "family_stage": "mainline_comparison", "status": null, "decision": null, "payload": {"tier": "proxy", "run_name": "round0095_proxy_1774175672", "family_name": "jumprelu", "family_stage": "mainline_comparison", "checkpoint_dir": "/root/sparsify-ascend/checkpoints/research_agent/round_0095_proxy/round0095_proxy_1774175672_dp2_bs1_ga8_ef12_k40_20260322_183439", "metrics_path": "/root/sparsify-ascend/checkpoints/research_agent/round_0095_proxy/round0095_proxy_1774175672_dp2_bs1_ga8_ef12_k40_20260322_183439/metrics.jsonl", "latest_step": 110, "latest_tokens_per_sec": 120143.85554489087, "baseline_ratio": 1.4473653959934085, "latest_total_tokens": 3604480.0, "proxy_mode": "fast", "evaluation_basis": "terminal_only"}}
{"event_id": "evt_1774175732956228144", "ts": 1774175732, "event": "training_heartbeat", "round": 95, "session_id": "019d14ea-730e-75e1-9200-ca4cb6c1e330", "tier": "proxy", "run_name": "round0095_proxy_1774175672", "family_name": "jumprelu", "family_stage": "mainline_comparison", "status": null, "decision": null, "payload": {"tier": "proxy", "run_name": "round0095_proxy_1774175672", "family_name": "jumprelu", "family_stage": "mainline_comparison", "checkpoint_dir": "/root/sparsify-ascend/checkpoints/research_agent/round_0095_proxy/round0095_proxy_1774175672_dp2_bs1_ga8_ef12_k40_20260322_183439", "metrics_path": "/root/sparsify-ascend/checkpoints/research_agent/round_0095_proxy/round0095_proxy_1774175672_dp2_bs1_ga8_ef12_k40_20260322_183439/metrics.jsonl", "latest_step": 152, "latest_tokens_per_sec": 83008.37712669739, "baseline_ratio": 0.9999966464024608, "latest_total_tokens": 4980736.0, "proxy_mode": "fast", "evaluation_basis": "terminal_only"}}
{"event_id": "evt_1774175733021543588", "ts": 1774175733, "event": "training_finished", "round": 95, "session_id": "019d14ea-730e-75e1-9200-ca4cb6c1e330", "tier": "proxy", "run_name": "round0095_proxy_1774175672", "family_name": "jumprelu", "family_stage": "mainline_comparison", "status": "ok", "decision": "incubate", "payload": {"tier": "proxy", "run_name": "round0095_proxy_1774175672", "family_name": "jumprelu", "family_stage": "mainline_comparison", "checkpoint_dir": "/root/sparsify-ascend/checkpoints/research_agent/round_0095_proxy/round0095_proxy_1774175672_dp2_bs1_ga8_ef12_k40_20260322_183439", "metrics_path": "/root/sparsify-ascend/checkpoints/research_agent/round_0095_proxy/round0095_proxy_1774175672_dp2_bs1_ga8_ef12_k40_20260322_183439/metrics.jsonl", "run_health": "normal", "termination_reason": "completed", "tokens_per_sec": 83008.37712669739, "baseline_ratio": 0.9999966464024608, "status": "ok", "decision": "incubate", "proxy_mode": "fast", "evaluation_basis": "terminal_only", "curve_start_fvu": 0.5124964118003845, "curve_mid_fvu": 0.40066027641296387, "curve_end_fvu": 0.3556212782859802, "curve_late_slope": -5.809030675839993e-09, "curve_still_improving": true}}
{"event_id": "evt_1774175733021599535", "ts": 1774175733, "event": "result_recorded", "round": 95, "session_id": "019d14ea-730e-75e1-9200-ca4cb6c1e330", "tier": "proxy", "run_name": "round0095_proxy_1774175672", "family_name": "jumprelu", "family_stage": "mainline_comparison", "status": "ok", "decision": "incubate", "payload": {"tier": "proxy", "run_name": "round0095_proxy_1774175672", "family_name": "jumprelu", "family_stage": "mainline_comparison", "status": "ok", "decision": "incubate", "val_fvu": "0.3557223603129387", "observed_fvu": "0.355621", "k": "40", "log_path": "/root/sparsify-ascend/research/history/logs/proxy_1774175733.log", "checkpoint": null}}
{"event_id": "evt_1774175733021744149", "ts": 1774175733, "event": "round_finished", "round": 95, "session_id": "019d14ea-730e-75e1-9200-ca4cb6c1e330", "tier": "proxy", "run_name": null, "family_name": "jumprelu", "family_stage": "mainline_comparison", "status": "ok", "decision": "incubate", "payload": {"tier": "proxy", "family_name": "jumprelu", "family_stage": "mainline_comparison", "status": "ok", "decision": "incubate", "val_fvu": "0.3557223603129387"}}
{"event_id": "evt_1774175733030832600", "ts": 1774175733, "event": "experiment_commit_prepared", "round": 95, "tier": "proxy", "run_name": null, "family_name": "jumprelu", "family_stage": "mainline_comparison", "status": "ok", "decision": "incubate", "payload": {"branch": "autoresearch-sae"}}
{"event_id": "evt_1774175740703488925", "ts": 1774175740, "event": "round_started", "round": 96, "session_id": "019d14ea-730e-75e1-9200-ca4cb6c1e330", "tier": null, "run_name": null, "family_name": null, "family_stage": null, "status": "started", "decision": null, "payload": {"status": "started"}}
{"event_id": "evt_1774175740703677209", "ts": 1774175740, "event": "agent_deciding", "round": 96, "session_id": "019d14ea-730e-75e1-9200-ca4cb6c1e330", "tier": null, "run_name": null, "family_name": null, "family_stage": null, "status": null, "decision": null, "payload": {}}
{"event_id": "evt_1774175740711203607", "ts": 1774175740, "event": "session_rebuilt", "round": 96, "tier": null, "run_name": null, "family_name": null, "family_stage": null, "status": "recreated", "decision": null, "payload": {"previous_session_id": "019d14ea-730e-75e1-9200-ca4cb6c1e330", "previous_status": "active", "previous_rounds": 8, "previous_age_hours": 0.8985}}
{"event_id": "evt_1774175950325813569", "ts": 1774175950, "event": "session_started", "round": 96, "tier": null, "run_name": null, "family_name": null, "family_stage": null, "status": "active", "decision": null, "payload": {"session_id": "019d151e-f057-7ab3-a1e7-776eaf5fbf59"}}
{"event_id": "evt_1774175950327110351", "ts": 1774175950, "event": "agent_action_received", "round": 96, "session_id": "019d151e-f057-7ab3-a1e7-776eaf5fbf59", "tier": "proxy", "run_name": null, "family_name": "whitened_lowrank_residual", "family_stage": "prototype", "status": null, "decision": null, "payload": {"session_id": "019d151e-f057-7ab3-a1e7-776eaf5fbf59", "tier": "proxy", "family_name": "whitened_lowrank_residual", "family_stage": "prototype", "change_type": "edit_sae_code", "expected_win": "lower_fvu", "hypothesis": "The exact active point `(K=40, EF=12)` has now rejected several alternative sparsity mechanisms, while the strongest same-`(K,EF)` signal remains `lowrank_residual`. A space-first follow-up is more justified than more threshold/routing tweaks: adding residual whitening/preconditioning to the proven low-rank trunk may make the residual easier to sparsify at low K and lower proxy FVU without relying on EF>16."}}
{"event_id": "evt_1774176081643743080", "ts": 1774176081, "event": "variable_isolation_warning", "round": 96, "session_id": "019d151e-f057-7ab3-a1e7-776eaf5fbf59", "tier": null, "run_name": null, "family_name": "whitened_lowrank_residual", "family_stage": "prototype", "status": null, "decision": null, "payload": {"violation": "Multiple primary variables changed simultaneously: code_edit, architecture, k, lr"}}
{"event_id": "evt_1774176081643854063", "ts": 1774176081, "event": "incubation_limit_blocked", "round": 96, "session_id": "019d151e-f057-7ab3-a1e7-776eaf5fbf59", "tier": null, "run_name": null, "family_name": "whitened_lowrank_residual", "family_stage": "prototype", "status": null, "decision": null, "payload": {"reason": "Cannot create new incubating family 'whitened_lowrank_residual': already 5 incubating families (limit: 5). Stale families that could be archived: []"}}
{"event_id": "evt_1774176081643897160", "ts": 1774176081, "event": "round_finished", "round": 96, "session_id": "019d151e-f057-7ab3-a1e7-776eaf5fbf59", "tier": "proxy", "run_name": null, "family_name": "whitened_lowrank_residual", "family_stage": "prototype", "status": "policy_reject", "decision": "policy_reject", "payload": {"tier": "proxy", "family_name": "whitened_lowrank_residual", "family_stage": "prototype", "status": "policy_reject", "decision": "policy_reject", "val_fvu": null}}
{"event_id": "evt_1774176089213767370", "ts": 1774176089, "event": "round_started", "round": 97, "session_id": "019d151e-f057-7ab3-a1e7-776eaf5fbf59", "tier": null, "run_name": null, "family_name": null, "family_stage": null, "status": "started", "decision": null, "payload": {"status": "started"}}
{"event_id": "evt_1774176089213932235", "ts": 1774176089, "event": "agent_deciding", "round": 97, "session_id": "019d151e-f057-7ab3-a1e7-776eaf5fbf59", "tier": null, "run_name": null, "family_name": null, "family_stage": null, "status": null, "decision": null, "payload": {}}
{"event_id": "evt_1774176218805448513", "ts": 1774176218, "event": "session_resumed", "round": 97, "tier": null, "run_name": null, "family_name": null, "family_stage": null, "status": "active", "decision": null, "payload": {"session_id": "019d151e-f057-7ab3-a1e7-776eaf5fbf59"}}
{"event_id": "evt_1774176218806722715", "ts": 1774176218, "event": "agent_action_received", "round": 97, "session_id": "019d151e-f057-7ab3-a1e7-776eaf5fbf59", "tier": "proxy", "run_name": null, "family_name": "whitened_lowrank_residual", "family_stage": "mainline_comparison", "status": null, "decision": null, "payload": {"session_id": "019d151e-f057-7ab3-a1e7-776eaf5fbf59", "tier": "proxy", "family_name": "whitened_lowrank_residual", "family_stage": "mainline_comparison", "change_type": "param_only", "expected_win": "lower_fvu", "hypothesis": "The exact active point `(K=40, EF=12)` has rejected multiple alternative sparsity mechanisms, while `lowrank_residual` remains the strongest same-neighborhood baseline. The new `whitened_lowrank_residual` family was added specifically to test whether residual preconditioning, rather than another sparsity-rule swap, can improve low-K quality at the same `(K, EF)`, so the next informative move is to execute that unchanged proxy comparison before branching further."}}
{"event_id": "evt_1774176218806834605", "ts": 1774176218, "event": "variable_isolation_warning", "round": 97, "session_id": "019d151e-f057-7ab3-a1e7-776eaf5fbf59", "tier": null, "run_name": null, "family_name": "whitened_lowrank_residual", "family_stage": "mainline_comparison", "status": null, "decision": null, "payload": {"violation": "Multiple primary variables changed simultaneously: architecture, k, lr"}}
{"event_id": "evt_1774176218806893833", "ts": 1774176218, "event": "proxy_mode_selected", "round": 97, "session_id": "019d151e-f057-7ab3-a1e7-776eaf5fbf59", "tier": "proxy", "run_name": null, "family_name": "whitened_lowrank_residual", "family_stage": "mainline_comparison", "status": null, "decision": null, "payload": {"tier": "proxy", "proxy_mode": "fast", "evaluation_basis": "terminal_only", "parameter_behavior": "structural", "proxy_max_tokens": "5000000"}}
{"event_id": "evt_1774176218807153871", "ts": 1774176218, "event": "training_started", "round": 97, "session_id": "019d151e-f057-7ab3-a1e7-776eaf5fbf59", "tier": "proxy", "run_name": "round0097_proxy_1774176218", "family_name": "whitened_lowrank_residual", "family_stage": "mainline_comparison", "status": null, "decision": null, "payload": {"tier": "proxy", "run_name": "round0097_proxy_1774176218", "family_name": "whitened_lowrank_residual", "family_stage": "mainline_comparison", "checkpoint_dir": "/root/sparsify-ascend/checkpoints/research_agent/round_0097_proxy", "log_path": "/root/sparsify-ascend/research/history/logs/round0097_proxy_1774176218.log", "config": {"architecture": "whitened_lowrank_residual", "expansion_factor": 12, "k": 40, "optimizer": "signum", "lr": "1.6e-3", "hookpoints": "layers.[3].self_attn.o_proj", "batch_size": 1, "grad_acc_steps": 8, "micro_acc_steps": 1, "auxk_alpha": 0.0, "dead_feature_threshold": 10000000, "use_hadamard": false, "tier": "proxy", "family_name": "whitened_lowrank_residual", "family_stage": "mainline_comparison"}, "baseline_tokens_per_sec": null, "proxy_mode": "fast", "evaluation_basis": "terminal_only"}}
{"event_id": "evt_1774176248808916206", "ts": 1774176248, "event": "training_heartbeat", "round": 97, "session_id": "019d151e-f057-7ab3-a1e7-776eaf5fbf59", "tier": "proxy", "run_name": "round0097_proxy_1774176218", "family_name": "whitened_lowrank_residual", "family_stage": "mainline_comparison", "status": null, "decision": null, "payload": {"tier": "proxy", "run_name": "round0097_proxy_1774176218", "family_name": "whitened_lowrank_residual", "family_stage": "mainline_comparison", "checkpoint_dir": "/root/sparsify-ascend/checkpoints/research_agent/round_0097_proxy/round0097_proxy_1774176218_dp2_bs1_ga8_ef12_k40_20260322_184345", "metrics_path": "/root/sparsify-ascend/checkpoints/research_agent/round_0097_proxy/round0097_proxy_1774176218_dp2_bs1_ga8_ef12_k40_20260322_184345/metrics.jsonl", "latest_step": 120, "latest_tokens_per_sec": 131065.57948118908, "baseline_ratio": null, "latest_total_tokens": 3932160.0, "proxy_mode": "fast", "evaluation_basis": "terminal_only"}}
{"event_id": "evt_1774176278810372160", "ts": 1774176278, "event": "training_heartbeat", "round": 97, "session_id": "019d151e-f057-7ab3-a1e7-776eaf5fbf59", "tier": "proxy", "run_name": "round0097_proxy_1774176218", "family_name": "whitened_lowrank_residual", "family_stage": "mainline_comparison", "status": null, "decision": null, "payload": {"tier": "proxy", "run_name": "round0097_proxy_1774176218", "family_name": "whitened_lowrank_residual", "family_stage": "mainline_comparison", "checkpoint_dir": "/root/sparsify-ascend/checkpoints/research_agent/round_0097_proxy/round0097_proxy_1774176218_dp2_bs1_ga8_ef12_k40_20260322_184345", "metrics_path": "/root/sparsify-ascend/checkpoints/research_agent/round_0097_proxy/round0097_proxy_1774176218_dp2_bs1_ga8_ef12_k40_20260322_184345/metrics.jsonl", "latest_step": 152, "latest_tokens_per_sec": 83008.22210679263, "baseline_ratio": null, "latest_total_tokens": 4980736.0, "proxy_mode": "fast", "evaluation_basis": "terminal_only"}}
