{"event_id": "evt_1774133949946149641", "ts": 1774133949, "event": "training_heartbeat", "round": 10, "session_id": "019d1279-dd8d-73d2-97df-ff57e75146ab", "tier": "proxy", "run_name": "round0010_proxy_1774133679", "family_name": "two_stage_residual", "family_stage": "stabilize", "status": null, "decision": null, "payload": {"tier": "proxy", "run_name": "round0010_proxy_1774133679", "family_name": "two_stage_residual", "family_stage": "stabilize", "checkpoint_dir": "/root/sparsify-ascend/checkpoints/research_agent/round_0010_proxy/round0010_proxy_1774133679_dp2_bs1_ga8_ef16_k128_20260322_065446", "metrics_path": "/root/sparsify-ascend/checkpoints/research_agent/round_0010_proxy/round0010_proxy_1774133679_dp2_bs1_ga8_ef16_k128_20260322_065446/metrics.jsonl", "latest_step": 1020, "latest_tokens_per_sec": 123773.2345010393, "baseline_ratio": 1.1164775230399515, "latest_total_tokens": 33423360.0, "proxy_mode": "fast", "evaluation_basis": "terminal_only"}}
{"event_id": "evt_1774133980108148105", "ts": 1774133980, "event": "training_heartbeat", "round": 10, "session_id": "019d1279-dd8d-73d2-97df-ff57e75146ab", "tier": "proxy", "run_name": "round0010_proxy_1774133679", "family_name": "two_stage_residual", "family_stage": "stabilize", "status": null, "decision": null, "payload": {"tier": "proxy", "run_name": "round0010_proxy_1774133679", "family_name": "two_stage_residual", "family_stage": "stabilize", "checkpoint_dir": "/root/sparsify-ascend/checkpoints/research_agent/round_0010_proxy/round0010_proxy_1774133679_dp2_bs1_ga8_ef16_k128_20260322_065446", "metrics_path": "/root/sparsify-ascend/checkpoints/research_agent/round_0010_proxy/round0010_proxy_1774133679_dp2_bs1_ga8_ef16_k128_20260322_065446/metrics.jsonl", "latest_step": 1150, "latest_tokens_per_sec": 125518.35621288947, "baseline_ratio": 1.1322191264173225, "latest_total_tokens": 37683200.0, "proxy_mode": "fast", "evaluation_basis": "terminal_only"}}
{"event_id": "evt_1774134010361716671", "ts": 1774134010, "event": "training_heartbeat", "round": 10, "session_id": "019d1279-dd8d-73d2-97df-ff57e75146ab", "tier": "proxy", "run_name": "round0010_proxy_1774133679", "family_name": "two_stage_residual", "family_stage": "stabilize", "status": null, "decision": null, "payload": {"tier": "proxy", "run_name": "round0010_proxy_1774133679", "family_name": "two_stage_residual", "family_stage": "stabilize", "checkpoint_dir": "/root/sparsify-ascend/checkpoints/research_agent/round_0010_proxy/round0010_proxy_1774133679_dp2_bs1_ga8_ef16_k128_20260322_065446", "metrics_path": "/root/sparsify-ascend/checkpoints/research_agent/round_0010_proxy/round0010_proxy_1774133679_dp2_bs1_ga8_ef16_k128_20260322_065446/metrics.jsonl", "latest_step": 1220, "latest_tokens_per_sec": 121001.84564987209, "baseline_ratio": 1.0914786339634466, "latest_total_tokens": 39976960.0, "proxy_mode": "fast", "evaluation_basis": "terminal_only"}}
{"event_id": "evt_1774134040369313354", "ts": 1774134040, "event": "training_heartbeat", "round": 10, "session_id": "019d1279-dd8d-73d2-97df-ff57e75146ab", "tier": "proxy", "run_name": "round0010_proxy_1774133679", "family_name": "two_stage_residual", "family_stage": "stabilize", "status": null, "decision": null, "payload": {"tier": "proxy", "run_name": "round0010_proxy_1774133679", "family_name": "two_stage_residual", "family_stage": "stabilize", "checkpoint_dir": "/root/sparsify-ascend/checkpoints/research_agent/round_0010_proxy/round0010_proxy_1774133679_dp2_bs1_ga8_ef16_k128_20260322_065446", "metrics_path": "/root/sparsify-ascend/checkpoints/research_agent/round_0010_proxy/round0010_proxy_1774133679_dp2_bs1_ga8_ef16_k128_20260322_065446/metrics.jsonl", "latest_step": 1220, "latest_tokens_per_sec": 110851.06487903737, "baseline_ratio": 0.9999150692102934, "latest_total_tokens": 39976960.0, "proxy_mode": "fast", "evaluation_basis": "terminal_only"}}
{"event_id": "evt_1774134040445207190", "ts": 1774134040, "event": "training_finished", "round": 10, "session_id": "019d1279-dd8d-73d2-97df-ff57e75146ab", "tier": "proxy", "run_name": "round0010_proxy_1774133679", "family_name": "two_stage_residual", "family_stage": "stabilize", "status": "ok", "decision": "promote", "payload": {"tier": "proxy", "run_name": "round0010_proxy_1774133679", "family_name": "two_stage_residual", "family_stage": "stabilize", "checkpoint_dir": "/root/sparsify-ascend/checkpoints/research_agent/round_0010_proxy/round0010_proxy_1774133679_dp2_bs1_ga8_ef16_k128_20260322_065446", "metrics_path": "/root/sparsify-ascend/checkpoints/research_agent/round_0010_proxy/round0010_proxy_1774133679_dp2_bs1_ga8_ef16_k128_20260322_065446/metrics.jsonl", "run_health": "normal", "termination_reason": "completed", "tokens_per_sec": 110851.06487903737, "baseline_ratio": 0.9999150692102934, "status": "ok", "decision": "promote", "proxy_mode": "fast", "evaluation_basis": "terminal_only", "curve_start_fvu": 0.18473176658153534, "curve_mid_fvu": 0.1584618091583252, "curve_end_fvu": 0.13206832110881805, "curve_late_slope": -1.893409553005887e-09, "curve_still_improving": true}}
{"event_id": "evt_1774134040445263102", "ts": 1774134040, "event": "result_recorded", "round": 10, "session_id": "019d1279-dd8d-73d2-97df-ff57e75146ab", "tier": "proxy", "run_name": "round0010_proxy_1774133679", "family_name": "two_stage_residual", "family_stage": "stabilize", "status": "ok", "decision": "promote", "payload": {"tier": "proxy", "run_name": "round0010_proxy_1774133679", "family_name": "two_stage_residual", "family_stage": "stabilize", "status": "ok", "decision": "promote", "val_fvu": "0.13607123959809542", "observed_fvu": "0.132068", "k": "128", "log_path": "/root/sparsify-ascend/research/history/logs/proxy_1774134040.log", "checkpoint": null}}
{"event_id": "evt_1774134040445965156", "ts": 1774134040, "event": "training_started", "round": 10, "session_id": "019d1279-dd8d-73d2-97df-ff57e75146ab", "tier": "full", "run_name": "round0010_full_1774134040", "family_name": "two_stage_residual", "family_stage": "stabilize", "status": null, "decision": null, "payload": {"tier": "full", "run_name": "round0010_full_1774134040", "family_name": "two_stage_residual", "family_stage": "stabilize", "checkpoint_dir": "/root/sparsify-ascend/checkpoints/research_agent/round_0010_full", "log_path": "/root/sparsify-ascend/research/history/logs/round0010_full_1774134040.log", "config": {"architecture": "two_stage_residual", "expansion_factor": 16, "k": 128, "optimizer": "signum", "lr": "1.6e-3", "hookpoints": "layers.[3].self_attn.o_proj", "batch_size": 1, "grad_acc_steps": 8, "micro_acc_steps": 1, "auxk_alpha": 0.0, "dead_feature_threshold": 10000000, "use_hadamard": false, "tier": "full", "family_name": "two_stage_residual", "family_stage": "stabilize"}, "baseline_tokens_per_sec": 83227.56110940345, "proxy_mode": null, "evaluation_basis": null}}
{"event_id": "evt_1774134070447306875", "ts": 1774134070, "event": "training_heartbeat", "round": 10, "session_id": "019d1279-dd8d-73d2-97df-ff57e75146ab", "tier": "full", "run_name": "round0010_full_1774134040", "family_name": "two_stage_residual", "family_stage": "stabilize", "status": null, "decision": null, "payload": {"tier": "full", "run_name": "round0010_full_1774134040", "family_name": "two_stage_residual", "family_stage": "stabilize", "checkpoint_dir": "/root/sparsify-ascend/checkpoints/research_agent/round_0010_full/round0010_full_1774134040_dp2_bs1_ga8_ef16_k128_20260322_070046", "metrics_path": "/root/sparsify-ascend/checkpoints/research_agent/round_0010_full/round0010_full_1774134040_dp2_bs1_ga8_ef16_k128_20260322_070046/metrics.jsonl", "latest_step": 60, "latest_tokens_per_sec": 65533.69278956208, "baseline_ratio": 0.7874037388097603, "latest_total_tokens": 1966080.0, "proxy_mode": null, "evaluation_basis": null}}
{"event_id": "evt_1774134100448937863", "ts": 1774134100, "event": "training_heartbeat", "round": 10, "session_id": "019d1279-dd8d-73d2-97df-ff57e75146ab", "tier": "full", "run_name": "round0010_full_1774134040", "family_name": "two_stage_residual", "family_stage": "stabilize", "status": null, "decision": null, "payload": {"tier": "full", "run_name": "round0010_full_1774134040", "family_name": "two_stage_residual", "family_stage": "stabilize", "checkpoint_dir": "/root/sparsify-ascend/checkpoints/research_agent/round_0010_full/round0010_full_1774134040_dp2_bs1_ga8_ef16_k128_20260322_070046", "metrics_path": "/root/sparsify-ascend/checkpoints/research_agent/round_0010_full/round0010_full_1774134040_dp2_bs1_ga8_ef16_k128_20260322_070046/metrics.jsonl", "latest_step": 190, "latest_tokens_per_sec": 103760.69321965578, "baseline_ratio": 1.246710727030212, "latest_total_tokens": 6225920.0, "proxy_mode": null, "evaluation_basis": null}}
{"event_id": "evt_1774134130451223683", "ts": 1774134130, "event": "training_heartbeat", "round": 10, "session_id": "019d1279-dd8d-73d2-97df-ff57e75146ab", "tier": "full", "run_name": "round0010_full_1774134040", "family_name": "two_stage_residual", "family_stage": "stabilize", "status": null, "decision": null, "payload": {"tier": "full", "run_name": "round0010_full_1774134040", "family_name": "two_stage_residual", "family_stage": "stabilize", "checkpoint_dir": "/root/sparsify-ascend/checkpoints/research_agent/round_0010_full/round0010_full_1774134040_dp2_bs1_ga8_ef16_k128_20260322_070046", "metrics_path": "/root/sparsify-ascend/checkpoints/research_agent/round_0010_full/round0010_full_1774134040_dp2_bs1_ga8_ef16_k128_20260322_070046/metrics.jsonl", "latest_step": 310, "latest_tokens_per_sec": 112861.3203194002, "baseline_ratio": 1.3560570418619244, "latest_total_tokens": 10158080.0, "proxy_mode": null, "evaluation_basis": null}}
{"event_id": "evt_1774134160454270715", "ts": 1774134160, "event": "training_heartbeat", "round": 10, "session_id": "019d1279-dd8d-73d2-97df-ff57e75146ab", "tier": "full", "run_name": "round0010_full_1774134040", "family_name": "two_stage_residual", "family_stage": "stabilize", "status": null, "decision": null, "payload": {"tier": "full", "run_name": "round0010_full_1774134040", "family_name": "two_stage_residual", "family_stage": "stabilize", "checkpoint_dir": "/root/sparsify-ascend/checkpoints/research_agent/round_0010_full/round0010_full_1774134040_dp2_bs1_ga8_ef16_k128_20260322_070046", "metrics_path": "/root/sparsify-ascend/checkpoints/research_agent/round_0010_full/round0010_full_1774134040_dp2_bs1_ga8_ef16_k128_20260322_070046/metrics.jsonl", "latest_step": 440, "latest_tokens_per_sec": 120141.30993252841, "baseline_ratio": 1.4435279411179847, "latest_total_tokens": 14417920.0, "proxy_mode": null, "evaluation_basis": null}}
{"event_id": "evt_1774134190458010618", "ts": 1774134190, "event": "training_heartbeat", "round": 10, "session_id": "019d1279-dd8d-73d2-97df-ff57e75146ab", "tier": "full", "run_name": "round0010_full_1774134040", "family_name": "two_stage_residual", "family_stage": "stabilize", "status": null, "decision": null, "payload": {"tier": "full", "run_name": "round0010_full_1774134040", "family_name": "two_stage_residual", "family_stage": "stabilize", "checkpoint_dir": "/root/sparsify-ascend/checkpoints/research_agent/round_0010_full/round0010_full_1774134040_dp2_bs1_ga8_ef16_k128_20260322_070046", "metrics_path": "/root/sparsify-ascend/checkpoints/research_agent/round_0010_full/round0010_full_1774134040_dp2_bs1_ga8_ef16_k128_20260322_070046/metrics.jsonl", "latest_step": 560, "latest_tokens_per_sec": 122324.27975135489, "baseline_ratio": 1.4697568704501434, "latest_total_tokens": 18350080.0, "proxy_mode": null, "evaluation_basis": null}}
{"event_id": "evt_1774134220462456690", "ts": 1774134220, "event": "training_heartbeat", "round": 10, "session_id": "019d1279-dd8d-73d2-97df-ff57e75146ab", "tier": "full", "run_name": "round0010_full_1774134040", "family_name": "two_stage_residual", "family_stage": "stabilize", "status": null, "decision": null, "payload": {"tier": "full", "run_name": "round0010_full_1774134040", "family_name": "two_stage_residual", "family_stage": "stabilize", "checkpoint_dir": "/root/sparsify-ascend/checkpoints/research_agent/round_0010_full/round0010_full_1774134040_dp2_bs1_ga8_ef16_k128_20260322_070046", "metrics_path": "/root/sparsify-ascend/checkpoints/research_agent/round_0010_full/round0010_full_1774134040_dp2_bs1_ga8_ef16_k128_20260322_070046/metrics.jsonl", "latest_step": 690, "latest_tokens_per_sec": 125599.36683692712, "baseline_ratio": 1.5091078623801737, "latest_total_tokens": 22609920.0, "proxy_mode": null, "evaluation_basis": null}}
{"event_id": "evt_1774134250467612852", "ts": 1774134250, "event": "training_heartbeat", "round": 10, "session_id": "019d1279-dd8d-73d2-97df-ff57e75146ab", "tier": "full", "run_name": "round0010_full_1774134040", "family_name": "two_stage_residual", "family_stage": "stabilize", "status": null, "decision": null, "payload": {"tier": "full", "run_name": "round0010_full_1774134040", "family_name": "two_stage_residual", "family_stage": "stabilize", "checkpoint_dir": "/root/sparsify-ascend/checkpoints/research_agent/round_0010_full/round0010_full_1774134040_dp2_bs1_ga8_ef16_k128_20260322_070046", "metrics_path": "/root/sparsify-ascend/checkpoints/research_agent/round_0010_full/round0010_full_1774134040_dp2_bs1_ga8_ef16_k128_20260322_070046/metrics.jsonl", "latest_step": 810, "latest_tokens_per_sec": 126378.00862451472, "baseline_ratio": 1.5184634385523994, "latest_total_tokens": 26542080.0, "proxy_mode": null, "evaluation_basis": null}}
{"event_id": "evt_1774134280473416163", "ts": 1774134280, "event": "training_heartbeat", "round": 10, "session_id": "019d1279-dd8d-73d2-97df-ff57e75146ab", "tier": "full", "run_name": "round0010_full_1774134040", "family_name": "two_stage_residual", "family_stage": "stabilize", "status": null, "decision": null, "payload": {"tier": "full", "run_name": "round0010_full_1774134040", "family_name": "two_stage_residual", "family_stage": "stabilize", "checkpoint_dir": "/root/sparsify-ascend/checkpoints/research_agent/round_0010_full/round0010_full_1774134040_dp2_bs1_ga8_ef16_k128_20260322_070046", "metrics_path": "/root/sparsify-ascend/checkpoints/research_agent/round_0010_full/round0010_full_1774134040_dp2_bs1_ga8_ef16_k128_20260322_070046/metrics.jsonl", "latest_step": 930, "latest_tokens_per_sec": 126961.63473491729, "baseline_ratio": 1.5254758525006513, "latest_total_tokens": 30474240.0, "proxy_mode": null, "evaluation_basis": null}}
{"event_id": "evt_1774134310656242137", "ts": 1774134310, "event": "training_heartbeat", "round": 10, "session_id": "019d1279-dd8d-73d2-97df-ff57e75146ab", "tier": "full", "run_name": "round0010_full_1774134040", "family_name": "two_stage_residual", "family_stage": "stabilize", "status": null, "decision": null, "payload": {"tier": "full", "run_name": "round0010_full_1774134040", "family_name": "two_stage_residual", "family_stage": "stabilize", "checkpoint_dir": "/root/sparsify-ascend/checkpoints/research_agent/round_0010_full/round0010_full_1774134040_dp2_bs1_ga8_ef16_k128_20260322_070046", "metrics_path": "/root/sparsify-ascend/checkpoints/research_agent/round_0010_full/round0010_full_1774134040_dp2_bs1_ga8_ef16_k128_20260322_070046/metrics.jsonl", "latest_step": 1020, "latest_tokens_per_sec": 123774.85843355113, "baseline_ratio": 1.487185936769766, "latest_total_tokens": 33423360.0, "proxy_mode": null, "evaluation_basis": null}}
{"event_id": "evt_1774134340768236748", "ts": 1774134340, "event": "training_heartbeat", "round": 10, "session_id": "019d1279-dd8d-73d2-97df-ff57e75146ab", "tier": "full", "run_name": "round0010_full_1774134040", "family_name": "two_stage_residual", "family_stage": "stabilize", "status": null, "decision": null, "payload": {"tier": "full", "run_name": "round0010_full_1774134040", "family_name": "two_stage_residual", "family_stage": "stabilize", "checkpoint_dir": "/root/sparsify-ascend/checkpoints/research_agent/round_0010_full/round0010_full_1774134040_dp2_bs1_ga8_ef16_k128_20260322_070046", "metrics_path": "/root/sparsify-ascend/checkpoints/research_agent/round_0010_full/round0010_full_1774134040_dp2_bs1_ga8_ef16_k128_20260322_070046/metrics.jsonl", "latest_step": 1150, "latest_tokens_per_sec": 125519.83637449562, "baseline_ratio": 1.5081522839471235, "latest_total_tokens": 37683200.0, "proxy_mode": null, "evaluation_basis": null}}
{"event_id": "evt_1774134370779366145", "ts": 1774134370, "event": "training_heartbeat", "round": 10, "session_id": "019d1279-dd8d-73d2-97df-ff57e75146ab", "tier": "full", "run_name": "round0010_full_1774134040", "family_name": "two_stage_residual", "family_stage": "stabilize", "status": null, "decision": null, "payload": {"tier": "full", "run_name": "round0010_full_1774134040", "family_name": "two_stage_residual", "family_stage": "stabilize", "checkpoint_dir": "/root/sparsify-ascend/checkpoints/research_agent/round_0010_full/round0010_full_1774134040_dp2_bs1_ga8_ef16_k128_20260322_070046", "metrics_path": "/root/sparsify-ascend/checkpoints/research_agent/round_0010_full/round0010_full_1774134040_dp2_bs1_ga8_ef16_k128_20260322_070046/metrics.jsonl", "latest_step": 1220, "latest_tokens_per_sec": 121021.46975006655, "baseline_ratio": 1.4541032818561466, "latest_total_tokens": 39976960.0, "proxy_mode": null, "evaluation_basis": null}}
{"event_id": "evt_1774134400786899707", "ts": 1774134400, "event": "training_heartbeat", "round": 10, "session_id": "019d1279-dd8d-73d2-97df-ff57e75146ab", "tier": "full", "run_name": "round0010_full_1774134040", "family_name": "two_stage_residual", "family_stage": "stabilize", "status": null, "decision": null, "payload": {"tier": "full", "run_name": "round0010_full_1774134040", "family_name": "two_stage_residual", "family_stage": "stabilize", "checkpoint_dir": "/root/sparsify-ascend/checkpoints/research_agent/round_0010_full/round0010_full_1774134040_dp2_bs1_ga8_ef16_k128_20260322_070046", "metrics_path": "/root/sparsify-ascend/checkpoints/research_agent/round_0010_full/round0010_full_1774134040_dp2_bs1_ga8_ef16_k128_20260322_070046/metrics.jsonl", "latest_step": 1220, "latest_tokens_per_sec": 110942.1383328525, "baseline_ratio": 1.3329975894285542, "latest_total_tokens": 39976960.0, "proxy_mode": null, "evaluation_basis": null}}
{"event_id": "evt_1774134430794372916", "ts": 1774134430, "event": "training_heartbeat", "round": 10, "session_id": "019d1279-dd8d-73d2-97df-ff57e75146ab", "tier": "full", "run_name": "round0010_full_1774134040", "family_name": "two_stage_residual", "family_stage": "stabilize", "status": null, "decision": null, "payload": {"tier": "full", "run_name": "round0010_full_1774134040", "family_name": "two_stage_residual", "family_stage": "stabilize", "checkpoint_dir": "/root/sparsify-ascend/checkpoints/research_agent/round_0010_full/round0010_full_1774134040_dp2_bs1_ga8_ef16_k128_20260322_070046", "metrics_path": "/root/sparsify-ascend/checkpoints/research_agent/round_0010_full/round0010_full_1774134040_dp2_bs1_ga8_ef16_k128_20260322_070046/metrics.jsonl", "latest_step": 1220, "latest_tokens_per_sec": 102413.6141880099, "baseline_ratio": 1.230525234944542, "latest_total_tokens": 39976960.0, "proxy_mode": null, "evaluation_basis": null}}
{"event_id": "evt_1774134460801809804", "ts": 1774134460, "event": "training_heartbeat", "round": 10, "session_id": "019d1279-dd8d-73d2-97df-ff57e75146ab", "tier": "full", "run_name": "round0010_full_1774134040", "family_name": "two_stage_residual", "family_stage": "stabilize", "status": null, "decision": null, "payload": {"tier": "full", "run_name": "round0010_full_1774134040", "family_name": "two_stage_residual", "family_stage": "stabilize", "checkpoint_dir": "/root/sparsify-ascend/checkpoints/research_agent/round_0010_full/round0010_full_1774134040_dp2_bs1_ga8_ef16_k128_20260322_070046", "metrics_path": "/root/sparsify-ascend/checkpoints/research_agent/round_0010_full/round0010_full_1774134040_dp2_bs1_ga8_ef16_k128_20260322_070046/metrics.jsonl", "latest_step": 1220, "latest_tokens_per_sec": 95102.72839364098, "baseline_ratio": 1.1426831103296118, "latest_total_tokens": 39976960.0, "proxy_mode": null, "evaluation_basis": null}}
{"event_id": "evt_1774134490809272348", "ts": 1774134490, "event": "training_heartbeat", "round": 10, "session_id": "019d1279-dd8d-73d2-97df-ff57e75146ab", "tier": "full", "run_name": "round0010_full_1774134040", "family_name": "two_stage_residual", "family_stage": "stabilize", "status": null, "decision": null, "payload": {"tier": "full", "run_name": "round0010_full_1774134040", "family_name": "two_stage_residual", "family_stage": "stabilize", "checkpoint_dir": "/root/sparsify-ascend/checkpoints/research_agent/round_0010_full/round0010_full_1774134040_dp2_bs1_ga8_ef16_k128_20260322_070046", "metrics_path": "/root/sparsify-ascend/checkpoints/research_agent/round_0010_full/round0010_full_1774134040_dp2_bs1_ga8_ef16_k128_20260322_070046/metrics.jsonl", "latest_step": 1220, "latest_tokens_per_sec": 88766.08496901789, "baseline_ratio": 1.0665467518906866, "latest_total_tokens": 39976960.0, "proxy_mode": null, "evaluation_basis": null}}
{"event_id": "evt_1774134520816733961", "ts": 1774134520, "event": "training_heartbeat", "round": 10, "session_id": "019d1279-dd8d-73d2-97df-ff57e75146ab", "tier": "full", "run_name": "round0010_full_1774134040", "family_name": "two_stage_residual", "family_stage": "stabilize", "status": null, "decision": null, "payload": {"tier": "full", "run_name": "round0010_full_1774134040", "family_name": "two_stage_residual", "family_stage": "stabilize", "checkpoint_dir": "/root/sparsify-ascend/checkpoints/research_agent/round_0010_full/round0010_full_1774134040_dp2_bs1_ga8_ef16_k128_20260322_070046", "metrics_path": "/root/sparsify-ascend/checkpoints/research_agent/round_0010_full/round0010_full_1774134040_dp2_bs1_ga8_ef16_k128_20260322_070046/metrics.jsonl", "latest_step": 1220, "latest_tokens_per_sec": 83221.10467517882, "baseline_ratio": 0.9999224243250845, "latest_total_tokens": 39976960.0, "proxy_mode": null, "evaluation_basis": null}}
