{"event_id": "evt_1774167230982864579", "ts": 1774167230, "event": "training_started", "round": 69, "session_id": "019d1496-cd26-7b90-a74e-d93c12b3512b", "tier": "proxy", "run_name": "round0069_proxy_1774167230", "family_name": "batch_topk", "family_stage": "mainline_comparison", "status": null, "decision": null, "payload": {"tier": "proxy", "run_name": "round0069_proxy_1774167230", "family_name": "batch_topk", "family_stage": "mainline_comparison", "checkpoint_dir": "/root/sparsify-ascend/checkpoints/research_agent/round_0069_proxy", "log_path": "/root/sparsify-ascend/research/history/logs/round0069_proxy_1774167230.log", "config": {"architecture": "batch_topk", "expansion_factor": 16, "k": 48, "optimizer": "signum", "lr": "1.6e-3", "hookpoints": "layers.[3].self_attn.o_proj", "batch_size": 1, "grad_acc_steps": 8, "micro_acc_steps": 1, "auxk_alpha": 0.0, "dead_feature_threshold": 10000000, "use_hadamard": false, "tier": "proxy", "family_name": "batch_topk", "family_stage": "mainline_comparison"}, "baseline_tokens_per_sec": 83008.08984558696, "proxy_mode": "fast", "evaluation_basis": "terminal_only"}}
{"event_id": "evt_1774167260984382554", "ts": 1774167260, "event": "training_heartbeat", "round": 69, "session_id": "019d1496-cd26-7b90-a74e-d93c12b3512b", "tier": "proxy", "run_name": "round0069_proxy_1774167230", "family_name": "batch_topk", "family_stage": "mainline_comparison", "status": null, "decision": null, "payload": {"tier": "proxy", "run_name": "round0069_proxy_1774167230", "family_name": "batch_topk", "family_stage": "mainline_comparison", "checkpoint_dir": "/root/sparsify-ascend/checkpoints/research_agent/round_0069_proxy/round0069_proxy_1774167230_dp2_bs1_ga8_ef16_k48_20260322_161357", "metrics_path": "/root/sparsify-ascend/checkpoints/research_agent/round_0069_proxy/round0069_proxy_1774167230_dp2_bs1_ga8_ef16_k48_20260322_161357/metrics.jsonl", "latest_step": 90, "latest_tokens_per_sec": 98299.90954521197, "baseline_ratio": 1.1842208359217892, "latest_total_tokens": 2949120.0, "proxy_mode": "fast", "evaluation_basis": "terminal_only"}}
{"event_id": "evt_1774167290985834283", "ts": 1774167290, "event": "training_heartbeat", "round": 69, "session_id": "019d1496-cd26-7b90-a74e-d93c12b3512b", "tier": "proxy", "run_name": "round0069_proxy_1774167230", "family_name": "batch_topk", "family_stage": "mainline_comparison", "status": null, "decision": null, "payload": {"tier": "proxy", "run_name": "round0069_proxy_1774167230", "family_name": "batch_topk", "family_stage": "mainline_comparison", "checkpoint_dir": "/root/sparsify-ascend/checkpoints/research_agent/round_0069_proxy/round0069_proxy_1774167230_dp2_bs1_ga8_ef16_k48_20260322_161357", "metrics_path": "/root/sparsify-ascend/checkpoints/research_agent/round_0069_proxy/round0069_proxy_1774167230_dp2_bs1_ga8_ef16_k48_20260322_161357/metrics.jsonl", "latest_step": 152, "latest_tokens_per_sec": 83008.54995808232, "baseline_ratio": 1.0000055429837769, "latest_total_tokens": 4980736.0, "proxy_mode": "fast", "evaluation_basis": "terminal_only"}}
{"event_id": "evt_1774167291051454704", "ts": 1774167291, "event": "training_finished", "round": 69, "session_id": "019d1496-cd26-7b90-a74e-d93c12b3512b", "tier": "proxy", "run_name": "round0069_proxy_1774167230", "family_name": "batch_topk", "family_stage": "mainline_comparison", "status": "ok", "decision": "incubate", "payload": {"tier": "proxy", "run_name": "round0069_proxy_1774167230", "family_name": "batch_topk", "family_stage": "mainline_comparison", "checkpoint_dir": "/root/sparsify-ascend/checkpoints/research_agent/round_0069_proxy/round0069_proxy_1774167230_dp2_bs1_ga8_ef16_k48_20260322_161357", "metrics_path": "/root/sparsify-ascend/checkpoints/research_agent/round_0069_proxy/round0069_proxy_1774167230_dp2_bs1_ga8_ef16_k48_20260322_161357/metrics.jsonl", "run_health": "normal", "termination_reason": "completed", "tokens_per_sec": 83008.54995808232, "baseline_ratio": 1.0000055429837769, "status": "ok", "decision": "incubate", "proxy_mode": "fast", "evaluation_basis": "terminal_only", "curve_start_fvu": 0.5915624499320984, "curve_mid_fvu": 0.45301997661590576, "curve_end_fvu": 0.3857137858867645, "curve_late_slope": -1.1451770513949376e-08, "curve_still_improving": true}}
{"event_id": "evt_1774167291051506447", "ts": 1774167291, "event": "result_recorded", "round": 69, "session_id": "019d1496-cd26-7b90-a74e-d93c12b3512b", "tier": "proxy", "run_name": "round0069_proxy_1774167230", "family_name": "batch_topk", "family_stage": "mainline_comparison", "status": "ok", "decision": "incubate", "payload": {"tier": "proxy", "run_name": "round0069_proxy_1774167230", "family_name": "batch_topk", "family_stage": "mainline_comparison", "status": "ok", "decision": "incubate", "val_fvu": "0.3849889151751995", "observed_fvu": "0.385714", "k": "48", "log_path": "/root/sparsify-ascend/research/history/logs/proxy_1774167291.log", "checkpoint": null}}
{"event_id": "evt_1774167291051635869", "ts": 1774167291, "event": "round_finished", "round": 69, "session_id": "019d1496-cd26-7b90-a74e-d93c12b3512b", "tier": "proxy", "run_name": null, "family_name": "batch_topk", "family_stage": "mainline_comparison", "status": "ok", "decision": "incubate", "payload": {"tier": "proxy", "family_name": "batch_topk", "family_stage": "mainline_comparison", "status": "ok", "decision": "incubate", "val_fvu": "0.3849889151751995"}}
{"event_id": "evt_1774167291059998587", "ts": 1774167291, "event": "experiment_commit_prepared", "round": 69, "tier": "proxy", "run_name": null, "family_name": "batch_topk", "family_stage": "mainline_comparison", "status": "ok", "decision": "incubate", "payload": {"branch": "autoresearch-sae"}}
{"event_id": "evt_1774167298696842453", "ts": 1774167298, "event": "round_started", "round": 70, "session_id": "019d1496-cd26-7b90-a74e-d93c12b3512b", "tier": null, "run_name": null, "family_name": null, "family_stage": null, "status": "started", "decision": null, "payload": {"status": "started"}}
{"event_id": "evt_1774167298696996985", "ts": 1774167298, "event": "agent_deciding", "round": 70, "session_id": "019d1496-cd26-7b90-a74e-d93c12b3512b", "tier": null, "run_name": null, "family_name": null, "family_stage": null, "status": null, "decision": null, "payload": {}}
{"event_id": "evt_1774167427551726678", "ts": 1774167427, "event": "session_resumed", "round": 70, "tier": null, "run_name": null, "family_name": null, "family_stage": null, "status": "active", "decision": null, "payload": {"session_id": "019d1496-cd26-7b90-a74e-d93c12b3512b"}}
{"event_id": "evt_1774167427552917828", "ts": 1774167427, "event": "agent_action_received", "round": 70, "session_id": "019d1496-cd26-7b90-a74e-d93c12b3512b", "tier": "proxy", "run_name": null, "family_name": "bucketed_topk", "family_stage": "mainline_comparison", "status": null, "decision": null, "payload": {"session_id": "019d1496-cd26-7b90-a74e-d93c12b3512b", "tier": "proxy", "family_name": "bucketed_topk", "family_stage": "mainline_comparison", "change_type": "param_only", "expected_win": "quality_improve", "hypothesis": "After the weak `batch_topk` result at the fixed lower-K comparison point, the next informative move is another fundamentally different sparse mechanism while holding the target constant. Run `bucketed_topk` at `K=48`, `EF=16` with the shared `signum`/`LR=1.6e-3`/`AUXK_ALPHA=0` recipe to test whether simple conditional specialization recovers low-K quality where global batch allocation failed."}}
{"event_id": "evt_1774167427553029353", "ts": 1774167427, "event": "variable_isolation_warning", "round": 70, "session_id": "019d1496-cd26-7b90-a74e-d93c12b3512b", "tier": null, "run_name": null, "family_name": "bucketed_topk", "family_stage": "mainline_comparison", "status": null, "decision": null, "payload": {"violation": "Multiple primary variables changed simultaneously: architecture, k, lr"}}
{"event_id": "evt_1774167427553086952", "ts": 1774167427, "event": "proxy_mode_selected", "round": 70, "session_id": "019d1496-cd26-7b90-a74e-d93c12b3512b", "tier": "proxy", "run_name": null, "family_name": "bucketed_topk", "family_stage": "mainline_comparison", "status": null, "decision": null, "payload": {"tier": "proxy", "proxy_mode": "fast", "evaluation_basis": "terminal_only", "parameter_behavior": "structural", "proxy_max_tokens": "5000000"}}
{"event_id": "evt_1774167427553342905", "ts": 1774167427, "event": "training_started", "round": 70, "session_id": "019d1496-cd26-7b90-a74e-d93c12b3512b", "tier": "proxy", "run_name": "round0070_proxy_1774167427", "family_name": "bucketed_topk", "family_stage": "mainline_comparison", "status": null, "decision": null, "payload": {"tier": "proxy", "run_name": "round0070_proxy_1774167427", "family_name": "bucketed_topk", "family_stage": "mainline_comparison", "checkpoint_dir": "/root/sparsify-ascend/checkpoints/research_agent/round_0070_proxy", "log_path": "/root/sparsify-ascend/research/history/logs/round0070_proxy_1774167427.log", "config": {"architecture": "bucketed_topk", "expansion_factor": 16, "k": 48, "optimizer": "signum", "lr": "1.6e-3", "hookpoints": "layers.[3].self_attn.o_proj", "batch_size": 1, "grad_acc_steps": 8, "micro_acc_steps": 1, "auxk_alpha": 0.0, "dead_feature_threshold": 10000000, "use_hadamard": false, "tier": "proxy", "family_name": "bucketed_topk", "family_stage": "mainline_comparison"}, "baseline_tokens_per_sec": 83007.71318381428, "proxy_mode": "fast", "evaluation_basis": "terminal_only"}}
{"event_id": "evt_1774167457554731252", "ts": 1774167457, "event": "training_heartbeat", "round": 70, "session_id": "019d1496-cd26-7b90-a74e-d93c12b3512b", "tier": "proxy", "run_name": "round0070_proxy_1774167427", "family_name": "bucketed_topk", "family_stage": "mainline_comparison", "status": null, "decision": null, "payload": {"tier": "proxy", "run_name": "round0070_proxy_1774167427", "family_name": "bucketed_topk", "family_stage": "mainline_comparison", "checkpoint_dir": "/root/sparsify-ascend/checkpoints/research_agent/round_0070_proxy/round0070_proxy_1774167427_dp2_bs1_ga8_ef16_k48_20260322_161714", "metrics_path": "/root/sparsify-ascend/checkpoints/research_agent/round_0070_proxy/round0070_proxy_1774167427_dp2_bs1_ga8_ef16_k48_20260322_161714/metrics.jsonl", "latest_step": 70, "latest_tokens_per_sec": 76455.7817060825, "baseline_ratio": 0.9210684016409051, "latest_total_tokens": 2293760.0, "proxy_mode": "fast", "evaluation_basis": "terminal_only"}}
{"event_id": "evt_1774167487697388341", "ts": 1774167487, "event": "training_heartbeat", "round": 70, "session_id": "019d1496-cd26-7b90-a74e-d93c12b3512b", "tier": "proxy", "run_name": "round0070_proxy_1774167427", "family_name": "bucketed_topk", "family_stage": "mainline_comparison", "status": null, "decision": null, "payload": {"tier": "proxy", "run_name": "round0070_proxy_1774167427", "family_name": "bucketed_topk", "family_stage": "mainline_comparison", "checkpoint_dir": "/root/sparsify-ascend/checkpoints/research_agent/round_0070_proxy/round0070_proxy_1774167427_dp2_bs1_ga8_ef16_k48_20260322_161714", "metrics_path": "/root/sparsify-ascend/checkpoints/research_agent/round_0070_proxy/round0070_proxy_1774167427_dp2_bs1_ga8_ef16_k48_20260322_161714/metrics.jsonl", "latest_step": 152, "latest_tokens_per_sec": 83008.79502366533, "baseline_ratio": 1.0000130330039168, "latest_total_tokens": 4980736.0, "proxy_mode": "fast", "evaluation_basis": "terminal_only"}}
{"event_id": "evt_1774167488648314402", "ts": 1774167488, "event": "training_finished", "round": 70, "session_id": "019d1496-cd26-7b90-a74e-d93c12b3512b", "tier": "proxy", "run_name": "round0070_proxy_1774167427", "family_name": "bucketed_topk", "family_stage": "mainline_comparison", "status": "ok", "decision": "incubate", "payload": {"tier": "proxy", "run_name": "round0070_proxy_1774167427", "family_name": "bucketed_topk", "family_stage": "mainline_comparison", "checkpoint_dir": "/root/sparsify-ascend/checkpoints/research_agent/round_0070_proxy/round0070_proxy_1774167427_dp2_bs1_ga8_ef16_k48_20260322_161714", "metrics_path": "/root/sparsify-ascend/checkpoints/research_agent/round_0070_proxy/round0070_proxy_1774167427_dp2_bs1_ga8_ef16_k48_20260322_161714/metrics.jsonl", "run_health": "normal", "termination_reason": "completed", "tokens_per_sec": 83008.79502366533, "baseline_ratio": 1.0000130330039168, "status": "ok", "decision": "incubate", "proxy_mode": "fast", "evaluation_basis": "terminal_only", "curve_start_fvu": 0.5020182132720947, "curve_mid_fvu": 0.3871423006057739, "curve_end_fvu": 0.339369535446167, "curve_late_slope": -6.366726959259399e-09, "curve_still_improving": true}}
{"event_id": "evt_1774167488648411454", "ts": 1774167488, "event": "result_recorded", "round": 70, "session_id": "019d1496-cd26-7b90-a74e-d93c12b3512b", "tier": "proxy", "run_name": "round0070_proxy_1774167427", "family_name": "bucketed_topk", "family_stage": "mainline_comparison", "status": "ok", "decision": "incubate", "payload": {"tier": "proxy", "run_name": "round0070_proxy_1774167427", "family_name": "bucketed_topk", "family_stage": "mainline_comparison", "status": "ok", "decision": "incubate", "val_fvu": "0.33880456909537315", "observed_fvu": "0.339370", "k": "48", "log_path": "/root/sparsify-ascend/research/history/logs/proxy_1774167488.log", "checkpoint": null}}
{"event_id": "evt_1774167488648551524", "ts": 1774167488, "event": "round_finished", "round": 70, "session_id": "019d1496-cd26-7b90-a74e-d93c12b3512b", "tier": "proxy", "run_name": null, "family_name": "bucketed_topk", "family_stage": "mainline_comparison", "status": "ok", "decision": "incubate", "payload": {"tier": "proxy", "family_name": "bucketed_topk", "family_stage": "mainline_comparison", "status": "ok", "decision": "incubate", "val_fvu": "0.33880456909537315"}}
{"event_id": "evt_1774167489099682642", "ts": 1774167489, "event": "experiment_commit_prepared", "round": 70, "tier": "proxy", "run_name": null, "family_name": "bucketed_topk", "family_stage": "mainline_comparison", "status": "ok", "decision": "incubate", "payload": {"branch": "autoresearch-sae"}}
{"event_id": "evt_1774167498146479614", "ts": 1774167498, "event": "round_started", "round": 71, "session_id": "019d1496-cd26-7b90-a74e-d93c12b3512b", "tier": null, "run_name": null, "family_name": null, "family_stage": null, "status": "started", "decision": null, "payload": {"status": "started"}}
{"event_id": "evt_1774167498240590976", "ts": 1774167498, "event": "agent_deciding", "round": 71, "session_id": "019d1496-cd26-7b90-a74e-d93c12b3512b", "tier": null, "run_name": null, "family_name": null, "family_stage": null, "status": null, "decision": null, "payload": {}}
{"event_id": "evt_1774167624551234183", "ts": 1774167624, "event": "session_resumed", "round": 71, "tier": null, "run_name": null, "family_name": null, "family_stage": null, "status": "active", "decision": null, "payload": {"session_id": "019d1496-cd26-7b90-a74e-d93c12b3512b"}}
{"event_id": "evt_1774167624558759098", "ts": 1774167624, "event": "agent_action_received", "round": 71, "session_id": "019d1496-cd26-7b90-a74e-d93c12b3512b", "tier": "proxy", "run_name": null, "family_name": "routed", "family_stage": "mainline_comparison", "status": null, "decision": null, "payload": {"session_id": "019d1496-cd26-7b90-a74e-d93c12b3512b", "tier": "proxy", "family_name": "routed", "family_stage": "mainline_comparison", "change_type": "param_only", "expected_win": "explore_unknown", "hypothesis": "The recent fixed-point `K=48`, `EF=16` mechanism probes were both clearly weak, so the next informative move is to change the search framing and test a routing-based sparse mechanism at a smaller K in the preferred mainline band. Run `routed` at `K=32`, `EF=12` with the shared `signum`/`LR=1.6e-3`/`AUXK_ALPHA=0` recipe to check whether explicit support routing recovers a viable low-K tradeoff better than magnitude-style TopK variants."}}
{"event_id": "evt_1774167624558893115", "ts": 1774167624, "event": "variable_isolation_warning", "round": 71, "session_id": "019d1496-cd26-7b90-a74e-d93c12b3512b", "tier": null, "run_name": null, "family_name": "routed", "family_stage": "mainline_comparison", "status": null, "decision": null, "payload": {"violation": "Multiple primary variables changed simultaneously: architecture, k, lr"}}
{"event_id": "evt_1774167624558954343", "ts": 1774167624, "event": "proxy_mode_selected", "round": 71, "session_id": "019d1496-cd26-7b90-a74e-d93c12b3512b", "tier": "proxy", "run_name": null, "family_name": "routed", "family_stage": "mainline_comparison", "status": null, "decision": null, "payload": {"tier": "proxy", "proxy_mode": "fast", "evaluation_basis": "terminal_only", "parameter_behavior": "structural", "proxy_max_tokens": "5000000"}}
{"event_id": "evt_1774167624559221943", "ts": 1774167624, "event": "training_started", "round": 71, "session_id": "019d1496-cd26-7b90-a74e-d93c12b3512b", "tier": "proxy", "run_name": "round0071_proxy_1774167624", "family_name": "routed", "family_stage": "mainline_comparison", "status": null, "decision": null, "payload": {"tier": "proxy", "run_name": "round0071_proxy_1774167624", "family_name": "routed", "family_stage": "mainline_comparison", "checkpoint_dir": "/root/sparsify-ascend/checkpoints/research_agent/round_0071_proxy", "log_path": "/root/sparsify-ascend/research/history/logs/round0071_proxy_1774167624.log", "config": {"architecture": "routed", "expansion_factor": 12, "k": 32, "optimizer": "signum", "lr": "1.6e-3", "hookpoints": "layers.[3].self_attn.o_proj", "batch_size": 1, "grad_acc_steps": 8, "micro_acc_steps": 1, "auxk_alpha": 0.0, "dead_feature_threshold": 10000000, "use_hadamard": false, "tier": "proxy", "family_name": "routed", "family_stage": "mainline_comparison"}, "baseline_tokens_per_sec": 83008.17593076272, "proxy_mode": "fast", "evaluation_basis": "terminal_only"}}
{"event_id": "evt_1774167654561912184", "ts": 1774167654, "event": "training_heartbeat", "round": 71, "session_id": "019d1496-cd26-7b90-a74e-d93c12b3512b", "tier": "proxy", "run_name": "round0071_proxy_1774167624", "family_name": "routed", "family_stage": "mainline_comparison", "status": null, "decision": null, "payload": {"tier": "proxy", "run_name": "round0071_proxy_1774167624", "family_name": "routed", "family_stage": "mainline_comparison", "checkpoint_dir": "/root/sparsify-ascend/checkpoints/research_agent/round_0071_proxy/round0071_proxy_1774167624_dp2_bs1_ga8_ef12_k32_20260322_162031", "metrics_path": "/root/sparsify-ascend/checkpoints/research_agent/round_0071_proxy/round0071_proxy_1774167624_dp2_bs1_ga8_ef12_k32_20260322_162031/metrics.jsonl", "latest_step": 100, "latest_tokens_per_sec": 109218.81132886786, "baseline_ratio": 1.3157596839613424, "latest_total_tokens": 3276800.0, "proxy_mode": "fast", "evaluation_basis": "terminal_only"}}
{"event_id": "evt_1774167684586239543", "ts": 1774167684, "event": "training_heartbeat", "round": 71, "session_id": "019d1496-cd26-7b90-a74e-d93c12b3512b", "tier": "proxy", "run_name": "round0071_proxy_1774167624", "family_name": "routed", "family_stage": "mainline_comparison", "status": null, "decision": null, "payload": {"tier": "proxy", "run_name": "round0071_proxy_1774167624", "family_name": "routed", "family_stage": "mainline_comparison", "checkpoint_dir": "/root/sparsify-ascend/checkpoints/research_agent/round_0071_proxy/round0071_proxy_1774167624_dp2_bs1_ga8_ef12_k32_20260322_162031", "metrics_path": "/root/sparsify-ascend/checkpoints/research_agent/round_0071_proxy/round0071_proxy_1774167624_dp2_bs1_ga8_ef12_k32_20260322_162031/metrics.jsonl", "latest_step": 152, "latest_tokens_per_sec": 83007.32893955619, "baseline_ratio": 0.9999897962917865, "latest_total_tokens": 4980736.0, "proxy_mode": "fast", "evaluation_basis": "terminal_only"}}
{"event_id": "evt_1774167685917211625", "ts": 1774167685, "event": "training_finished", "round": 71, "session_id": "019d1496-cd26-7b90-a74e-d93c12b3512b", "tier": "proxy", "run_name": "round0071_proxy_1774167624", "family_name": "routed", "family_stage": "mainline_comparison", "status": "ok", "decision": "incubate", "payload": {"tier": "proxy", "run_name": "round0071_proxy_1774167624", "family_name": "routed", "family_stage": "mainline_comparison", "checkpoint_dir": "/root/sparsify-ascend/checkpoints/research_agent/round_0071_proxy/round0071_proxy_1774167624_dp2_bs1_ga8_ef12_k32_20260322_162031", "metrics_path": "/root/sparsify-ascend/checkpoints/research_agent/round_0071_proxy/round0071_proxy_1774167624_dp2_bs1_ga8_ef12_k32_20260322_162031/metrics.jsonl", "run_health": "normal", "termination_reason": "completed", "tokens_per_sec": 83007.32893955619, "baseline_ratio": 0.9999897962917865, "status": "ok", "decision": "incubate", "proxy_mode": "fast", "evaluation_basis": "terminal_only", "curve_start_fvu": 0.5580787658691406, "curve_mid_fvu": 0.42843854427337646, "curve_end_fvu": 0.3765009343624115, "curve_late_slope": -6.439222488552332e-09, "curve_still_improving": true}}
{"event_id": "evt_1774167685917321824", "ts": 1774167685, "event": "result_recorded", "round": 71, "session_id": "019d1496-cd26-7b90-a74e-d93c12b3512b", "tier": "proxy", "run_name": "round0071_proxy_1774167624", "family_name": "routed", "family_stage": "mainline_comparison", "status": "ok", "decision": "incubate", "payload": {"tier": "proxy", "run_name": "round0071_proxy_1774167624", "family_name": "routed", "family_stage": "mainline_comparison", "status": "ok", "decision": "incubate", "val_fvu": "0.3757335729897022", "observed_fvu": "0.376501", "k": "32", "log_path": "/root/sparsify-ascend/research/history/logs/proxy_1774167685.log", "checkpoint": null}}
