{"event_id": "evt_1774139351308231736", "ts": 1774139351, "event": "training_heartbeat", "round": 19, "session_id": "019d12cf-0aba-71d0-8920-5ea920811f62", "tier": "full", "run_name": "round0019_full_1774139141", "family_name": "lowrank_residual", "family_stage": "stabilize", "status": null, "decision": null, "payload": {"tier": "full", "run_name": "round0019_full_1774139141", "family_name": "lowrank_residual", "family_stage": "stabilize", "checkpoint_dir": "/root/sparsify-ascend/checkpoints/research_agent/round_0019_full/round0019_full_1774139141_dp2_bs1_ga8_ef32_k64_20260322_082547", "metrics_path": "/root/sparsify-ascend/checkpoints/research_agent/round_0019_full/round0019_full_1774139141_dp2_bs1_ga8_ef32_k64_20260322_082547/metrics.jsonl", "latest_step": 730, "latest_tokens_per_sec": 113896.918501736, "baseline_ratio": 0.6842769527032182, "latest_total_tokens": 23920640.0, "proxy_mode": null, "evaluation_basis": null}}
{"event_id": "evt_1774139381313612652", "ts": 1774139381, "event": "training_heartbeat", "round": 19, "session_id": "019d12cf-0aba-71d0-8920-5ea920811f62", "tier": "full", "run_name": "round0019_full_1774139141", "family_name": "lowrank_residual", "family_stage": "stabilize", "status": null, "decision": null, "payload": {"tier": "full", "run_name": "round0019_full_1774139141", "family_name": "lowrank_residual", "family_stage": "stabilize", "checkpoint_dir": "/root/sparsify-ascend/checkpoints/research_agent/round_0019_full/round0019_full_1774139141_dp2_bs1_ga8_ef32_k64_20260322_082547", "metrics_path": "/root/sparsify-ascend/checkpoints/research_agent/round_0019_full/round0019_full_1774139141_dp2_bs1_ga8_ef32_k64_20260322_082547/metrics.jsonl", "latest_step": 850, "latest_tokens_per_sec": 116041.02757722749, "baseline_ratio": 0.6971584638427691, "latest_total_tokens": 27852800.0, "proxy_mode": null, "evaluation_basis": null}}
{"event_id": "evt_1774139411319553138", "ts": 1774139411, "event": "training_heartbeat", "round": 19, "session_id": "019d12cf-0aba-71d0-8920-5ea920811f62", "tier": "full", "run_name": "round0019_full_1774139141", "family_name": "lowrank_residual", "family_stage": "stabilize", "status": null, "decision": null, "payload": {"tier": "full", "run_name": "round0019_full_1774139141", "family_name": "lowrank_residual", "family_stage": "stabilize", "checkpoint_dir": "/root/sparsify-ascend/checkpoints/research_agent/round_0019_full/round0019_full_1774139141_dp2_bs1_ga8_ef32_k64_20260322_082547", "metrics_path": "/root/sparsify-ascend/checkpoints/research_agent/round_0019_full/round0019_full_1774139141_dp2_bs1_ga8_ef32_k64_20260322_082547/metrics.jsonl", "latest_step": 960, "latest_tokens_per_sec": 116494.88655731548, "baseline_ratio": 0.6998851858993177, "latest_total_tokens": 31457280.0, "proxy_mode": null, "evaluation_basis": null}}
{"event_id": "evt_1774139441430441587", "ts": 1774139441, "event": "training_heartbeat", "round": 19, "session_id": "019d12cf-0aba-71d0-8920-5ea920811f62", "tier": "full", "run_name": "round0019_full_1774139141", "family_name": "lowrank_residual", "family_stage": "stabilize", "status": null, "decision": null, "payload": {"tier": "full", "run_name": "round0019_full_1774139141", "family_name": "lowrank_residual", "family_stage": "stabilize", "checkpoint_dir": "/root/sparsify-ascend/checkpoints/research_agent/round_0019_full/round0019_full_1774139141_dp2_bs1_ga8_ef32_k64_20260322_082547", "metrics_path": "/root/sparsify-ascend/checkpoints/research_agent/round_0019_full/round0019_full_1774139141_dp2_bs1_ga8_ef32_k64_20260322_082547/metrics.jsonl", "latest_step": 1030, "latest_tokens_per_sec": 112489.30326767231, "baseline_ratio": 0.6758201948241273, "latest_total_tokens": 33751040.0, "proxy_mode": null, "evaluation_basis": null}}
{"event_id": "evt_1774139471471105165", "ts": 1774139471, "event": "training_heartbeat", "round": 19, "session_id": "019d12cf-0aba-71d0-8920-5ea920811f62", "tier": "full", "run_name": "round0019_full_1774139141", "family_name": "lowrank_residual", "family_stage": "stabilize", "status": null, "decision": null, "payload": {"tier": "full", "run_name": "round0019_full_1774139141", "family_name": "lowrank_residual", "family_stage": "stabilize", "checkpoint_dir": "/root/sparsify-ascend/checkpoints/research_agent/round_0019_full/round0019_full_1774139141_dp2_bs1_ga8_ef32_k64_20260322_082547", "metrics_path": "/root/sparsify-ascend/checkpoints/research_agent/round_0019_full/round0019_full_1774139141_dp2_bs1_ga8_ef32_k64_20260322_082547/metrics.jsonl", "latest_step": 1150, "latest_tokens_per_sec": 114139.85428716507, "baseline_ratio": 0.6857364773430655, "latest_total_tokens": 37683200.0, "proxy_mode": null, "evaluation_basis": null}}
{"event_id": "evt_1774139501591934069", "ts": 1774139501, "event": "training_heartbeat", "round": 19, "session_id": "019d12cf-0aba-71d0-8920-5ea920811f62", "tier": "full", "run_name": "round0019_full_1774139141", "family_name": "lowrank_residual", "family_stage": "stabilize", "status": null, "decision": null, "payload": {"tier": "full", "run_name": "round0019_full_1774139141", "family_name": "lowrank_residual", "family_stage": "stabilize", "checkpoint_dir": "/root/sparsify-ascend/checkpoints/research_agent/round_0019_full/round0019_full_1774139141_dp2_bs1_ga8_ef32_k64_20260322_082547", "metrics_path": "/root/sparsify-ascend/checkpoints/research_agent/round_0019_full/round0019_full_1774139141_dp2_bs1_ga8_ef32_k64_20260322_082547/metrics.jsonl", "latest_step": 1220, "latest_tokens_per_sec": 110988.41729473835, "baseline_ratio": 0.6668030792302704, "latest_total_tokens": 39976960.0, "proxy_mode": null, "evaluation_basis": null}}
{"event_id": "evt_1774139531599330686", "ts": 1774139531, "event": "training_heartbeat", "round": 19, "session_id": "019d12cf-0aba-71d0-8920-5ea920811f62", "tier": "full", "run_name": "round0019_full_1774139141", "family_name": "lowrank_residual", "family_stage": "stabilize", "status": null, "decision": null, "payload": {"tier": "full", "run_name": "round0019_full_1774139141", "family_name": "lowrank_residual", "family_stage": "stabilize", "checkpoint_dir": "/root/sparsify-ascend/checkpoints/research_agent/round_0019_full/round0019_full_1774139141_dp2_bs1_ga8_ef32_k64_20260322_082547", "metrics_path": "/root/sparsify-ascend/checkpoints/research_agent/round_0019_full/round0019_full_1774139141_dp2_bs1_ga8_ef32_k64_20260322_082547/metrics.jsonl", "latest_step": 1220, "latest_tokens_per_sec": 102423.30000570691, "baseline_ratio": 0.6153450377381755, "latest_total_tokens": 39976960.0, "proxy_mode": null, "evaluation_basis": null}}
{"event_id": "evt_1774139561606749360", "ts": 1774139561, "event": "training_heartbeat", "round": 19, "session_id": "019d12cf-0aba-71d0-8920-5ea920811f62", "tier": "full", "run_name": "round0019_full_1774139141", "family_name": "lowrank_residual", "family_stage": "stabilize", "status": null, "decision": null, "payload": {"tier": "full", "run_name": "round0019_full_1774139141", "family_name": "lowrank_residual", "family_stage": "stabilize", "checkpoint_dir": "/root/sparsify-ascend/checkpoints/research_agent/round_0019_full/round0019_full_1774139141_dp2_bs1_ga8_ef32_k64_20260322_082547", "metrics_path": "/root/sparsify-ascend/checkpoints/research_agent/round_0019_full/round0019_full_1774139141_dp2_bs1_ga8_ef32_k64_20260322_082547/metrics.jsonl", "latest_step": 1220, "latest_tokens_per_sec": 95111.0858852876, "baseline_ratio": 0.5714142654077747, "latest_total_tokens": 39976960.0, "proxy_mode": null, "evaluation_basis": null}}
{"event_id": "evt_1774139591614170338", "ts": 1774139591, "event": "training_heartbeat", "round": 19, "session_id": "019d12cf-0aba-71d0-8920-5ea920811f62", "tier": "full", "run_name": "round0019_full_1774139141", "family_name": "lowrank_residual", "family_stage": "stabilize", "status": null, "decision": null, "payload": {"tier": "full", "run_name": "round0019_full_1774139141", "family_name": "lowrank_residual", "family_stage": "stabilize", "checkpoint_dir": "/root/sparsify-ascend/checkpoints/research_agent/round_0019_full/round0019_full_1774139141_dp2_bs1_ga8_ef32_k64_20260322_082547", "metrics_path": "/root/sparsify-ascend/checkpoints/research_agent/round_0019_full/round0019_full_1774139141_dp2_bs1_ga8_ef32_k64_20260322_082547/metrics.jsonl", "latest_step": 1220, "latest_tokens_per_sec": 88773.37102765705, "baseline_ratio": 0.5333381500314378, "latest_total_tokens": 39976960.0, "proxy_mode": null, "evaluation_basis": null}}
{"event_id": "evt_1774139621621608162", "ts": 1774139621, "event": "training_heartbeat", "round": 19, "session_id": "019d12cf-0aba-71d0-8920-5ea920811f62", "tier": "full", "run_name": "round0019_full_1774139141", "family_name": "lowrank_residual", "family_stage": "stabilize", "status": null, "decision": null, "payload": {"tier": "full", "run_name": "round0019_full_1774139141", "family_name": "lowrank_residual", "family_stage": "stabilize", "checkpoint_dir": "/root/sparsify-ascend/checkpoints/research_agent/round_0019_full/round0019_full_1774139141_dp2_bs1_ga8_ef32_k64_20260322_082547", "metrics_path": "/root/sparsify-ascend/checkpoints/research_agent/round_0019_full/round0019_full_1774139141_dp2_bs1_ga8_ef32_k64_20260322_082547/metrics.jsonl", "latest_step": 1220, "latest_tokens_per_sec": 83227.51161897357, "baseline_ratio": 0.5000193928059159, "latest_total_tokens": 39976960.0, "proxy_mode": null, "evaluation_basis": null}}
{"event_id": "evt_1774139651629023413", "ts": 1774139651, "event": "training_heartbeat", "round": 19, "session_id": "019d12cf-0aba-71d0-8920-5ea920811f62", "tier": "full", "run_name": "round0019_full_1774139141", "family_name": "lowrank_residual", "family_stage": "stabilize", "status": null, "decision": null, "payload": {"tier": "full", "run_name": "round0019_full_1774139141", "family_name": "lowrank_residual", "family_stage": "stabilize", "checkpoint_dir": "/root/sparsify-ascend/checkpoints/research_agent/round_0019_full/round0019_full_1774139141_dp2_bs1_ga8_ef32_k64_20260322_082547", "metrics_path": "/root/sparsify-ascend/checkpoints/research_agent/round_0019_full/round0019_full_1774139141_dp2_bs1_ga8_ef32_k64_20260322_082547/metrics.jsonl", "latest_step": 1220, "latest_tokens_per_sec": 78333.83763606302, "baseline_ratio": 0.4706188755259158, "latest_total_tokens": 39976960.0, "proxy_mode": null, "evaluation_basis": null}}
{"event_id": "evt_1774139651704565998", "ts": 1774139651, "event": "training_finished", "round": 19, "session_id": "019d12cf-0aba-71d0-8920-5ea920811f62", "tier": "full", "run_name": "round0019_full_1774139141", "family_name": "lowrank_residual", "family_stage": "stabilize", "status": "ok", "decision": "keep", "payload": {"tier": "full", "run_name": "round0019_full_1774139141", "family_name": "lowrank_residual", "family_stage": "stabilize", "checkpoint_dir": "/root/sparsify-ascend/checkpoints/research_agent/round_0019_full/round0019_full_1774139141_dp2_bs1_ga8_ef32_k64_20260322_082547", "metrics_path": "/root/sparsify-ascend/checkpoints/research_agent/round_0019_full/round0019_full_1774139141_dp2_bs1_ga8_ef32_k64_20260322_082547/metrics.jsonl", "run_health": "normal", "termination_reason": "completed", "tokens_per_sec": 78333.83763606302, "baseline_ratio": 0.4706188755259158, "status": "ok", "decision": "keep", "proxy_mode": null, "evaluation_basis": null, "curve_start_fvu": 0.11732665449380875, "curve_mid_fvu": 0.10014893114566803, "curve_end_fvu": 0.08095023036003113, "curve_late_slope": -1.284034124928141e-09, "curve_still_improving": true}}
{"event_id": "evt_1774139651704631913", "ts": 1774139651, "event": "result_recorded", "round": 19, "session_id": "019d12cf-0aba-71d0-8920-5ea920811f62", "tier": "full", "run_name": "round0019_full_1774139141", "family_name": "lowrank_residual", "family_stage": "stabilize", "status": "ok", "decision": "keep", "payload": {"tier": "full", "run_name": "round0019_full_1774139141", "family_name": "lowrank_residual", "family_stage": "stabilize", "status": "ok", "decision": "keep", "val_fvu": "0.08263881411403418", "observed_fvu": "0.080950", "k": "64", "log_path": "/root/sparsify-ascend/research/history/logs/full_1774139651.log", "checkpoint": null}}
{"event_id": "evt_1774139651705136946", "ts": 1774139651, "event": "round_finished", "round": 19, "session_id": "019d12cf-0aba-71d0-8920-5ea920811f62", "tier": "full", "run_name": null, "family_name": "lowrank_residual", "family_stage": "stabilize", "status": "ok", "decision": "keep", "payload": {"tier": "full", "family_name": "lowrank_residual", "family_stage": "stabilize", "status": "ok", "decision": "keep", "val_fvu": "0.08263881411403418"}}
{"event_id": "evt_1774139651711314216", "ts": 1774139651, "event": "experiment_commit_prepared", "round": 19, "tier": "full", "run_name": null, "family_name": "lowrank_residual", "family_stage": "stabilize", "status": "ok", "decision": "keep", "payload": {"branch": "autoresearch-sae"}}
{"event_id": "evt_1774139659147580129", "ts": 1774139659, "event": "round_started", "round": 20, "session_id": "019d12cf-0aba-71d0-8920-5ea920811f62", "tier": null, "run_name": null, "family_name": null, "family_stage": null, "status": "started", "decision": null, "payload": {"status": "started"}}
{"event_id": "evt_1774139659147766676", "ts": 1774139659, "event": "agent_deciding", "round": 20, "session_id": "019d12cf-0aba-71d0-8920-5ea920811f62", "tier": null, "run_name": null, "family_name": null, "family_stage": null, "status": null, "decision": null, "payload": {}}
{"event_id": "evt_1774139783659479301", "ts": 1774139783, "event": "session_resumed", "round": 20, "tier": null, "run_name": null, "family_name": null, "family_stage": null, "status": "active", "decision": null, "payload": {"session_id": "019d12cf-0aba-71d0-8920-5ea920811f62"}}
{"event_id": "evt_1774139783665850972", "ts": 1774139783, "event": "agent_action_received", "round": 20, "session_id": "019d12cf-0aba-71d0-8920-5ea920811f62", "tier": "proxy", "run_name": null, "family_name": "lowrank_residual", "family_stage": "stabilize", "status": null, "decision": null, "payload": {"session_id": "019d12cf-0aba-71d0-8920-5ea920811f62", "tier": "proxy", "family_name": "lowrank_residual", "family_stage": "stabilize", "change_type": "param_only", "expected_win": "lower_fvu", "hypothesis": "`lowrank_residual` with `EXPANSION_FACTOR=32` improved the full K=64 frontier, so the next clean stabilization move is to test whether the same added residual capacity also improves the smallest-K point. Increasing only `EXPANSION_FACTOR` from 16 to 32 at K=32 may further strengthen the low-cost end of the Pareto frontier if the K=32 residual branch is currently capacity-limited."}}
{"event_id": "evt_1774139783665982248", "ts": 1774139783, "event": "proxy_mode_selected", "round": 20, "session_id": "019d12cf-0aba-71d0-8920-5ea920811f62", "tier": "proxy", "run_name": null, "family_name": "lowrank_residual", "family_stage": "stabilize", "status": null, "decision": null, "payload": {"tier": "proxy", "proxy_mode": "fast", "evaluation_basis": "terminal_only", "parameter_behavior": "structural", "proxy_max_tokens": "5000000"}}
{"event_id": "evt_1774139783666273823", "ts": 1774139783, "event": "training_started", "round": 20, "session_id": "019d12cf-0aba-71d0-8920-5ea920811f62", "tier": "proxy", "run_name": "round0020_proxy_1774139783", "family_name": "lowrank_residual", "family_stage": "stabilize", "status": null, "decision": null, "payload": {"tier": "proxy", "run_name": "round0020_proxy_1774139783", "family_name": "lowrank_residual", "family_stage": "stabilize", "checkpoint_dir": "/root/sparsify-ascend/checkpoints/research_agent/round_0020_proxy", "log_path": "/root/sparsify-ascend/research/history/logs/round0020_proxy_1774139783.log", "config": {"architecture": "lowrank_residual", "expansion_factor": 32, "k": 32, "optimizer": "signum", "lr": "1.6e-3", "hookpoints": "layers.[3].self_attn.o_proj", "batch_size": 1, "grad_acc_steps": 8, "micro_acc_steps": 1, "auxk_alpha": 0.0, "dead_feature_threshold": 10000000, "use_hadamard": false, "tier": "proxy", "family_name": "lowrank_residual", "family_stage": "stabilize"}, "baseline_tokens_per_sec": 83008.52258207071, "proxy_mode": "fast", "evaluation_basis": "terminal_only"}}
{"event_id": "evt_1774139813668300970", "ts": 1774139813, "event": "training_heartbeat", "round": 20, "session_id": "019d12cf-0aba-71d0-8920-5ea920811f62", "tier": "proxy", "run_name": "round0020_proxy_1774139783", "family_name": "lowrank_residual", "family_stage": "stabilize", "status": null, "decision": null, "payload": {"tier": "proxy", "run_name": "round0020_proxy_1774139783", "family_name": "lowrank_residual", "family_stage": "stabilize", "checkpoint_dir": "/root/sparsify-ascend/checkpoints/research_agent/round_0020_proxy/round0020_proxy_1774139783_dp2_bs1_ga8_ef32_k32_20260322_083630", "metrics_path": "/root/sparsify-ascend/checkpoints/research_agent/round_0020_proxy/round0020_proxy_1774139783_dp2_bs1_ga8_ef32_k32_20260322_083630/metrics.jsonl", "latest_step": 80, "latest_tokens_per_sec": 87376.55026182966, "baseline_ratio": 1.0526214362560213, "latest_total_tokens": 2621440.0, "proxy_mode": "fast", "evaluation_basis": "terminal_only"}}
{"event_id": "evt_1774139843703194245", "ts": 1774139843, "event": "training_heartbeat", "round": 20, "session_id": "019d12cf-0aba-71d0-8920-5ea920811f62", "tier": "proxy", "run_name": "round0020_proxy_1774139783", "family_name": "lowrank_residual", "family_stage": "stabilize", "status": null, "decision": null, "payload": {"tier": "proxy", "run_name": "round0020_proxy_1774139783", "family_name": "lowrank_residual", "family_stage": "stabilize", "checkpoint_dir": "/root/sparsify-ascend/checkpoints/research_agent/round_0020_proxy/round0020_proxy_1774139783_dp2_bs1_ga8_ef32_k32_20260322_083630", "metrics_path": "/root/sparsify-ascend/checkpoints/research_agent/round_0020_proxy/round0020_proxy_1774139783_dp2_bs1_ga8_ef32_k32_20260322_083630/metrics.jsonl", "latest_step": 152, "latest_tokens_per_sec": 83007.9034932319, "baseline_ratio": 0.9999925418641418, "latest_total_tokens": 4980736.0, "proxy_mode": "fast", "evaluation_basis": "terminal_only"}}
{"event_id": "evt_1774139844504253979", "ts": 1774139844, "event": "training_finished", "round": 20, "session_id": "019d12cf-0aba-71d0-8920-5ea920811f62", "tier": "proxy", "run_name": "round0020_proxy_1774139783", "family_name": "lowrank_residual", "family_stage": "stabilize", "status": "ok", "decision": "promote", "payload": {"tier": "proxy", "run_name": "round0020_proxy_1774139783", "family_name": "lowrank_residual", "family_stage": "stabilize", "checkpoint_dir": "/root/sparsify-ascend/checkpoints/research_agent/round_0020_proxy/round0020_proxy_1774139783_dp2_bs1_ga8_ef32_k32_20260322_083630", "metrics_path": "/root/sparsify-ascend/checkpoints/research_agent/round_0020_proxy/round0020_proxy_1774139783_dp2_bs1_ga8_ef32_k32_20260322_083630/metrics.jsonl", "run_health": "normal", "termination_reason": "completed", "tokens_per_sec": 83007.9034932319, "baseline_ratio": 0.9999925418641418, "status": "ok", "decision": "promote", "proxy_mode": "fast", "evaluation_basis": "terminal_only", "curve_start_fvu": 0.34332942962646484, "curve_mid_fvu": 0.22239521145820618, "curve_end_fvu": 0.1755329966545105, "curve_late_slope": -7.035645643144005e-09, "curve_still_improving": true}}
{"event_id": "evt_1774139844504341893", "ts": 1774139844, "event": "result_recorded", "round": 20, "session_id": "019d12cf-0aba-71d0-8920-5ea920811f62", "tier": "proxy", "run_name": "round0020_proxy_1774139783", "family_name": "lowrank_residual", "family_stage": "stabilize", "status": "ok", "decision": "promote", "payload": {"tier": "proxy", "run_name": "round0020_proxy_1774139783", "family_name": "lowrank_residual", "family_stage": "stabilize", "status": "ok", "decision": "promote", "val_fvu": "0.17638677917420864", "observed_fvu": "0.175533", "k": "32", "log_path": "/root/sparsify-ascend/research/history/logs/proxy_1774139844.log", "checkpoint": null}}
{"event_id": "evt_1774139844504803658", "ts": 1774139844, "event": "training_started", "round": 20, "session_id": "019d12cf-0aba-71d0-8920-5ea920811f62", "tier": "full", "run_name": "round0020_full_1774139844", "family_name": "lowrank_residual", "family_stage": "stabilize", "status": null, "decision": null, "payload": {"tier": "full", "run_name": "round0020_full_1774139844", "family_name": "lowrank_residual", "family_stage": "stabilize", "checkpoint_dir": "/root/sparsify-ascend/checkpoints/research_agent/round_0020_full", "log_path": "/root/sparsify-ascend/research/history/logs/round0020_full_1774139844.log", "config": {"architecture": "lowrank_residual", "expansion_factor": 32, "k": 32, "optimizer": "signum", "lr": "1.6e-3", "hookpoints": "layers.[3].self_attn.o_proj", "batch_size": 1, "grad_acc_steps": 8, "micro_acc_steps": 1, "auxk_alpha": 0.0, "dead_feature_threshold": 10000000, "use_hadamard": false, "tier": "full", "family_name": "lowrank_residual", "family_stage": "stabilize"}, "baseline_tokens_per_sec": 166448.5674284209, "proxy_mode": null, "evaluation_basis": null}}
{"event_id": "evt_1774139874506286250", "ts": 1774139874, "event": "training_heartbeat", "round": 20, "session_id": "019d12cf-0aba-71d0-8920-5ea920811f62", "tier": "full", "run_name": "round0020_full_1774139844", "family_name": "lowrank_residual", "family_stage": "stabilize", "status": null, "decision": null, "payload": {"tier": "full", "run_name": "round0020_full_1774139844", "family_name": "lowrank_residual", "family_stage": "stabilize", "checkpoint_dir": "/root/sparsify-ascend/checkpoints/research_agent/round_0020_full/round0020_full_1774139844_dp2_bs1_ga8_ef32_k32_20260322_083730", "metrics_path": "/root/sparsify-ascend/checkpoints/research_agent/round_0020_full/round0020_full_1774139844_dp2_bs1_ga8_ef32_k32_20260322_083730/metrics.jsonl", "latest_step": 80, "latest_tokens_per_sec": 87377.84250057339, "baseline_ratio": 0.5249540074182322, "latest_total_tokens": 2621440.0, "proxy_mode": null, "evaluation_basis": null}}
