{"event_id": "evt_1774151466510519226", "ts": 1774151466, "event": "incubation_limit_blocked", "round": 38, "session_id": "019d135d-4c60-7fa3-8438-b12bc57e0720", "tier": null, "run_name": null, "family_name": "codebook_topk", "family_stage": "prototype", "status": null, "decision": null, "payload": {"reason": "Cannot create new incubating family 'codebook_topk': already 5 incubating families (limit: 5). Stale families that could be archived: []"}}
{"event_id": "evt_1774151466510574542", "ts": 1774151466, "event": "round_finished", "round": 38, "session_id": "019d135d-4c60-7fa3-8438-b12bc57e0720", "tier": "proxy", "run_name": null, "family_name": "codebook_topk", "family_stage": "prototype", "status": "policy_reject", "decision": "policy_reject", "payload": {"tier": "proxy", "family_name": "codebook_topk", "family_stage": "prototype", "status": "policy_reject", "decision": "policy_reject", "val_fvu": null}}
{"event_id": "evt_1774151474040289108", "ts": 1774151474, "event": "round_started", "round": 39, "session_id": "019d135d-4c60-7fa3-8438-b12bc57e0720", "tier": null, "run_name": null, "family_name": null, "family_stage": null, "status": "started", "decision": null, "payload": {"status": "started"}}
{"event_id": "evt_1774151474040448259", "ts": 1774151474, "event": "agent_deciding", "round": 39, "session_id": "019d135d-4c60-7fa3-8438-b12bc57e0720", "tier": null, "run_name": null, "family_name": null, "family_stage": null, "status": null, "decision": null, "payload": {}}
{"event_id": "evt_1774151640871406854", "ts": 1774151640, "event": "session_resumed", "round": 39, "tier": null, "run_name": null, "family_name": null, "family_stage": null, "status": "active", "decision": null, "payload": {"session_id": "019d135d-4c60-7fa3-8438-b12bc57e0720"}}
{"event_id": "evt_1774151640872057237", "ts": 1774151640, "event": "agent_action_received", "round": 39, "session_id": "019d135d-4c60-7fa3-8438-b12bc57e0720", "tier": "proxy", "run_name": null, "family_name": "product_codebook_topk", "family_stage": "prototype", "status": null, "decision": null, "payload": {"session_id": "019d135d-4c60-7fa3-8438-b12bc57e0720", "tier": "proxy", "family_name": "product_codebook_topk", "family_stage": "prototype", "change_type": "edit_sae_code", "expected_win": "Best case: materially outperform recent alternative families like `batch_topk` and `bucketed_topk`, with proxy FVU moving toward the low-0.14s or better. Failure case: quickly falsify the discrete additive-codebook direction and archive it.", "hypothesis": "Thirteen no-improve rounds and the recent failures of adaptive-budget, batch-global, and bucketed sparse-allocation variants suggest the current continuous-support search direction is exhausted. The next clean architecture pivot is a discrete additive representation: `product_codebook_topk`, which reconstructs activations with multiple retrieved codewords before applying TopK only to the residual. If the main bottleneck is that continuous sparse atoms are wasting capacity on shared coarse structure, additive product-style codebooks should model that structure more efficiently and leave the sparse residual path to handle only fine corrections."}}
{"event_id": "evt_1774151771963207537", "ts": 1774151771, "event": "variable_isolation_warning", "round": 39, "session_id": "019d135d-4c60-7fa3-8438-b12bc57e0720", "tier": null, "run_name": null, "family_name": "product_codebook_topk", "family_stage": "prototype", "status": null, "decision": null, "payload": {"violation": "Multiple primary variables changed simultaneously: code_edit, architecture, lr"}}
{"event_id": "evt_1774151771963370011", "ts": 1774151771, "event": "incubation_limit_blocked", "round": 39, "session_id": "019d135d-4c60-7fa3-8438-b12bc57e0720", "tier": null, "run_name": null, "family_name": "product_codebook_topk", "family_stage": "prototype", "status": null, "decision": null, "payload": {"reason": "Cannot create new incubating family 'product_codebook_topk': already 6 incubating families (limit: 5). Stale families that could be archived: []"}}
{"event_id": "evt_1774151771963420280", "ts": 1774151771, "event": "round_finished", "round": 39, "session_id": "019d135d-4c60-7fa3-8438-b12bc57e0720", "tier": "proxy", "run_name": null, "family_name": "product_codebook_topk", "family_stage": "prototype", "status": "policy_reject", "decision": "policy_reject", "payload": {"tier": "proxy", "family_name": "product_codebook_topk", "family_stage": "prototype", "status": "policy_reject", "decision": "policy_reject", "val_fvu": null}}
{"event_id": "evt_1774151779513176969", "ts": 1774151779, "event": "round_started", "round": 40, "session_id": "019d135d-4c60-7fa3-8438-b12bc57e0720", "tier": null, "run_name": null, "family_name": null, "family_stage": null, "status": "started", "decision": null, "payload": {"status": "started"}}
{"event_id": "evt_1774151779513353606", "ts": 1774151779, "event": "agent_deciding", "round": 40, "session_id": "019d135d-4c60-7fa3-8438-b12bc57e0720", "tier": null, "run_name": null, "family_name": null, "family_stage": null, "status": null, "decision": null, "payload": {}}
{"event_id": "evt_1774151911881819476", "ts": 1774151911, "event": "session_resumed", "round": 40, "tier": null, "run_name": null, "family_name": null, "family_stage": null, "status": "active", "decision": null, "payload": {"session_id": "019d135d-4c60-7fa3-8438-b12bc57e0720"}}
{"event_id": "evt_1774151911909810509", "ts": 1774151911, "event": "agent_action_received", "round": 40, "session_id": "019d135d-4c60-7fa3-8438-b12bc57e0720", "tier": "proxy", "run_name": null, "family_name": "product_codebook_topk", "family_stage": "prototype", "status": null, "decision": null, "payload": {"session_id": "019d135d-4c60-7fa3-8438-b12bc57e0720", "tier": "proxy", "family_name": "product_codebook_topk", "family_stage": "prototype", "change_type": "architecture_only", "expected_win": "Best case: proxy FVU lands materially below recent alternative families like `batch_topk` and `bucketed_topk`, ideally approaching the low-0.14s or better. Failure case: discrete additive codebooks also miss badly, letting us archive this branch and pivot away from codebook-style sparse search.", "hypothesis": "The search has already covered multiple K values on the best mainline and recent continuous-support pivots have all underperformed, so the next informative step is to actually benchmark the newly added discrete additive family rather than return to more tuning. `product_codebook_topk` tests whether representing coarse structure with multiple retrieved codewords before a sparse residual correction can break the current fixed-TopK quality ceiling."}}
{"event_id": "evt_1774152042482296001", "ts": 1774152042, "event": "variable_isolation_warning", "round": 40, "session_id": "019d135d-4c60-7fa3-8438-b12bc57e0720", "tier": null, "run_name": null, "family_name": "product_codebook_topk", "family_stage": "prototype", "status": null, "decision": null, "payload": {"violation": "Multiple primary variables changed simultaneously: architecture, lr"}}
{"event_id": "evt_1774152042482438926", "ts": 1774152042, "event": "proxy_mode_selected", "round": 40, "session_id": "019d135d-4c60-7fa3-8438-b12bc57e0720", "tier": "proxy", "run_name": null, "family_name": "product_codebook_topk", "family_stage": "prototype", "status": null, "decision": null, "payload": {"tier": "proxy", "proxy_mode": "fast", "evaluation_basis": "terminal_only", "parameter_behavior": "structural", "proxy_max_tokens": "5000000"}}
{"event_id": "evt_1774152042482490655", "ts": 1774152042, "event": "sanity_started", "round": 40, "session_id": "019d135d-4c60-7fa3-8438-b12bc57e0720", "tier": "proxy", "run_name": null, "family_name": "product_codebook_topk", "family_stage": "prototype", "status": null, "decision": null, "payload": {"tier": "proxy"}}
{"event_id": "evt_1774152047163888199", "ts": 1774152047, "event": "sanity_finished", "round": 40, "session_id": "019d135d-4c60-7fa3-8438-b12bc57e0720", "tier": "proxy", "run_name": null, "family_name": "product_codebook_topk", "family_stage": "prototype", "status": "ok", "decision": null, "payload": {"tier": "proxy", "status": "ok"}}
{"event_id": "evt_1774152047164273409", "ts": 1774152047, "event": "training_started", "round": 40, "session_id": "019d135d-4c60-7fa3-8438-b12bc57e0720", "tier": "proxy", "run_name": "round0040_proxy_1774152047", "family_name": "product_codebook_topk", "family_stage": "prototype", "status": null, "decision": null, "payload": {"tier": "proxy", "run_name": "round0040_proxy_1774152047", "family_name": "product_codebook_topk", "family_stage": "prototype", "checkpoint_dir": "/root/sparsify-ascend/checkpoints/research_agent/round_0040_proxy", "log_path": "/root/sparsify-ascend/research/history/logs/round0040_proxy_1774152047.log", "config": {"architecture": "product_codebook_topk", "expansion_factor": 32, "k": 128, "optimizer": "signum", "lr": "1.6e-3", "hookpoints": "layers.[3].self_attn.o_proj", "batch_size": 1, "grad_acc_steps": 8, "micro_acc_steps": 1, "auxk_alpha": 0.0, "dead_feature_threshold": 10000000, "use_hadamard": false, "tier": "proxy", "family_name": "product_codebook_topk", "family_stage": "prototype"}, "baseline_tokens_per_sec": null, "proxy_mode": "fast", "evaluation_basis": "terminal_only"}}
{"event_id": "evt_1774152077165057969", "ts": 1774152077, "event": "training_heartbeat", "round": 40, "session_id": "019d135d-4c60-7fa3-8438-b12bc57e0720", "tier": "proxy", "run_name": "round0040_proxy_1774152047", "family_name": "product_codebook_topk", "family_stage": "prototype", "status": null, "decision": null, "payload": {"tier": "proxy", "run_name": "round0040_proxy_1774152047", "family_name": "product_codebook_topk", "family_stage": "prototype", "checkpoint_dir": null, "metrics_path": null, "latest_step": null, "latest_tokens_per_sec": null, "baseline_ratio": null, "latest_total_tokens": null, "proxy_mode": "fast", "evaluation_basis": "terminal_only"}}
{"event_id": "evt_1774152077226117297", "ts": 1774152077, "event": "training_finished", "round": 40, "session_id": "019d135d-4c60-7fa3-8438-b12bc57e0720", "tier": "proxy", "run_name": "round0040_proxy_1774152047", "family_name": "product_codebook_topk", "family_stage": "prototype", "status": "crash", "decision": "crash", "payload": {"tier": "proxy", "run_name": "round0040_proxy_1774152047", "family_name": "product_codebook_topk", "family_stage": "prototype", "checkpoint_dir": null, "metrics_path": "", "run_health": "crash", "termination_reason": "completed", "tokens_per_sec": null, "baseline_ratio": null, "status": "crash", "decision": "crash", "proxy_mode": "fast", "evaluation_basis": "terminal_only", "curve_start_fvu": null, "curve_mid_fvu": null, "curve_end_fvu": null, "curve_late_slope": null, "curve_still_improving": null}}
{"event_id": "evt_1774152077226162514", "ts": 1774152077, "event": "result_recorded", "round": 40, "session_id": "019d135d-4c60-7fa3-8438-b12bc57e0720", "tier": "proxy", "run_name": "round0040_proxy_1774152047", "family_name": "product_codebook_topk", "family_stage": "prototype", "status": "crash", "decision": "crash", "payload": {"tier": "proxy", "run_name": "round0040_proxy_1774152047", "family_name": "product_codebook_topk", "family_stage": "prototype", "status": "crash", "decision": "crash", "val_fvu": "None", "observed_fvu": "", "k": "None", "log_path": "/root/sparsify-ascend/research/history/logs/proxy_1774152077.log", "checkpoint": null}}
{"event_id": "evt_1774152077226224971", "ts": 1774152077, "event": "round_finished", "round": 40, "session_id": "019d135d-4c60-7fa3-8438-b12bc57e0720", "tier": "proxy", "run_name": null, "family_name": "product_codebook_topk", "family_stage": "prototype", "status": "crash", "decision": "crash", "payload": {"tier": "proxy", "family_name": "product_codebook_topk", "family_stage": "prototype", "status": "crash", "decision": "crash", "val_fvu": "None"}}
{"event_id": "evt_1774152077233392765", "ts": 1774152077, "event": "experiment_commit_prepared", "round": 40, "tier": "proxy", "run_name": null, "family_name": "product_codebook_topk", "family_stage": "prototype", "status": "crash", "decision": "crash", "payload": {"branch": "autoresearch-sae"}}
{"event_id": "evt_1774152084655535560", "ts": 1774152084, "event": "round_started", "round": 41, "session_id": "019d135d-4c60-7fa3-8438-b12bc57e0720", "tier": null, "run_name": null, "family_name": null, "family_stage": null, "status": "started", "decision": null, "payload": {"status": "started"}}
{"event_id": "evt_1774152084655708513", "ts": 1774152084, "event": "agent_deciding", "round": 41, "session_id": "019d135d-4c60-7fa3-8438-b12bc57e0720", "tier": null, "run_name": null, "family_name": null, "family_stage": null, "status": null, "decision": null, "payload": {}}
{"event_id": "evt_1774152209147259577", "ts": 1774152209, "event": "session_resumed", "round": 41, "tier": null, "run_name": null, "family_name": null, "family_stage": null, "status": "active", "decision": null, "payload": {"session_id": "019d135d-4c60-7fa3-8438-b12bc57e0720"}}
{"event_id": "evt_1774152209155775487", "ts": 1774152209, "event": "agent_action_received", "round": 41, "session_id": "019d135d-4c60-7fa3-8438-b12bc57e0720", "tier": "proxy", "run_name": null, "family_name": "product_codebook_topk", "family_stage": "prototype", "status": null, "decision": null, "payload": {"session_id": "019d135d-4c60-7fa3-8438-b12bc57e0720", "tier": "proxy", "family_name": "product_codebook_topk", "family_stage": "prototype", "change_type": "code_fix", "expected_win": "Best case: the family runs cleanly and yields a real proxy FVU, potentially showing whether additive product-codebooks can beat recent alternatives like `batch_topk` and `bucketed_topk`. Failure case: the repaired run is clearly uncompetitive, letting us archive the family with confidence instead of losing another round to registration issues.", "hypothesis": "`product_codebook_topk` did not fail on quality; it failed because the runtime still does not recognize the new architecture name. The next highest-value move is a narrow compatibility repair in the architecture validation/factory path so the discrete additive-codebook family can produce a real proxy signal before we decide whether to keep or archive this branch."}}
{"event_id": "evt_1774152340356892362", "ts": 1774152340, "event": "variable_isolation_warning", "round": 41, "session_id": "019d135d-4c60-7fa3-8438-b12bc57e0720", "tier": null, "run_name": null, "family_name": "product_codebook_topk", "family_stage": "prototype", "status": null, "decision": null, "payload": {"violation": "Multiple primary variables changed simultaneously: architecture, lr"}}
{"event_id": "evt_1774152340357037201", "ts": 1774152340, "event": "proxy_mode_selected", "round": 41, "session_id": "019d135d-4c60-7fa3-8438-b12bc57e0720", "tier": "proxy", "run_name": null, "family_name": "product_codebook_topk", "family_stage": "prototype", "status": null, "decision": null, "payload": {"tier": "proxy", "proxy_mode": "fast", "evaluation_basis": "terminal_only", "parameter_behavior": "structural", "proxy_max_tokens": "5000000"}}
{"event_id": "evt_1774152340357089725", "ts": 1774152340, "event": "sanity_started", "round": 41, "session_id": "019d135d-4c60-7fa3-8438-b12bc57e0720", "tier": "proxy", "run_name": null, "family_name": "product_codebook_topk", "family_stage": "prototype", "status": null, "decision": null, "payload": {"tier": "proxy"}}
{"event_id": "evt_1774152345020315373", "ts": 1774152345, "event": "sanity_finished", "round": 41, "session_id": "019d135d-4c60-7fa3-8438-b12bc57e0720", "tier": "proxy", "run_name": null, "family_name": "product_codebook_topk", "family_stage": "prototype", "status": "ok", "decision": null, "payload": {"tier": "proxy", "status": "ok"}}
{"event_id": "evt_1774152345020752201", "ts": 1774152345, "event": "training_started", "round": 41, "session_id": "019d135d-4c60-7fa3-8438-b12bc57e0720", "tier": "proxy", "run_name": "round0041_proxy_1774152345", "family_name": "product_codebook_topk", "family_stage": "prototype", "status": null, "decision": null, "payload": {"tier": "proxy", "run_name": "round0041_proxy_1774152345", "family_name": "product_codebook_topk", "family_stage": "prototype", "checkpoint_dir": "/root/sparsify-ascend/checkpoints/research_agent/round_0041_proxy", "log_path": "/root/sparsify-ascend/research/history/logs/round0041_proxy_1774152345.log", "config": {"architecture": "product_codebook_topk", "expansion_factor": 32, "k": 128, "optimizer": "signum", "lr": "1.6e-3", "hookpoints": "layers.[3].self_attn.o_proj", "batch_size": 1, "grad_acc_steps": 8, "micro_acc_steps": 1, "auxk_alpha": 0.0, "dead_feature_threshold": 10000000, "use_hadamard": false, "tier": "proxy", "family_name": "product_codebook_topk", "family_stage": "prototype"}, "baseline_tokens_per_sec": null, "proxy_mode": "fast", "evaluation_basis": "terminal_only"}}
{"event_id": "evt_1774152375021568184", "ts": 1774152375, "event": "training_heartbeat", "round": 41, "session_id": "019d135d-4c60-7fa3-8438-b12bc57e0720", "tier": "proxy", "run_name": "round0041_proxy_1774152345", "family_name": "product_codebook_topk", "family_stage": "prototype", "status": null, "decision": null, "payload": {"tier": "proxy", "run_name": "round0041_proxy_1774152345", "family_name": "product_codebook_topk", "family_stage": "prototype", "checkpoint_dir": null, "metrics_path": null, "latest_step": null, "latest_tokens_per_sec": null, "baseline_ratio": null, "latest_total_tokens": null, "proxy_mode": "fast", "evaluation_basis": "terminal_only"}}
{"event_id": "evt_1774152375083448384", "ts": 1774152375, "event": "training_finished", "round": 41, "session_id": "019d135d-4c60-7fa3-8438-b12bc57e0720", "tier": "proxy", "run_name": "round0041_proxy_1774152345", "family_name": "product_codebook_topk", "family_stage": "prototype", "status": "crash", "decision": "crash", "payload": {"tier": "proxy", "run_name": "round0041_proxy_1774152345", "family_name": "product_codebook_topk", "family_stage": "prototype", "checkpoint_dir": null, "metrics_path": "", "run_health": "crash", "termination_reason": "completed", "tokens_per_sec": null, "baseline_ratio": null, "status": "crash", "decision": "crash", "proxy_mode": "fast", "evaluation_basis": "terminal_only", "curve_start_fvu": null, "curve_mid_fvu": null, "curve_end_fvu": null, "curve_late_slope": null, "curve_still_improving": null}}
{"event_id": "evt_1774152375083497281", "ts": 1774152375, "event": "result_recorded", "round": 41, "session_id": "019d135d-4c60-7fa3-8438-b12bc57e0720", "tier": "proxy", "run_name": "round0041_proxy_1774152345", "family_name": "product_codebook_topk", "family_stage": "prototype", "status": "crash", "decision": "crash", "payload": {"tier": "proxy", "run_name": "round0041_proxy_1774152345", "family_name": "product_codebook_topk", "family_stage": "prototype", "status": "crash", "decision": "crash", "val_fvu": "None", "observed_fvu": "", "k": "None", "log_path": "/root/sparsify-ascend/research/history/logs/proxy_1774152375.log", "checkpoint": null}}
{"event_id": "evt_1774152375083562744", "ts": 1774152375, "event": "round_finished", "round": 41, "session_id": "019d135d-4c60-7fa3-8438-b12bc57e0720", "tier": "proxy", "run_name": null, "family_name": "product_codebook_topk", "family_stage": "prototype", "status": "crash", "decision": "crash", "payload": {"tier": "proxy", "family_name": "product_codebook_topk", "family_stage": "prototype", "status": "crash", "decision": "crash", "val_fvu": "None"}}
{"event_id": "evt_1774152375090731605", "ts": 1774152375, "event": "experiment_commit_prepared", "round": 41, "tier": "proxy", "run_name": null, "family_name": "product_codebook_topk", "family_stage": "prototype", "status": "crash", "decision": "crash", "payload": {"branch": "autoresearch-sae"}}
{"event_id": "evt_1774152382429507164", "ts": 1774152382, "event": "round_started", "round": 42, "session_id": "019d135d-4c60-7fa3-8438-b12bc57e0720", "tier": null, "run_name": null, "family_name": null, "family_stage": null, "status": "started", "decision": null, "payload": {"status": "started"}}
{"event_id": "evt_1774152382429596273", "ts": 1774152382, "event": "agent_deciding", "round": 42, "session_id": "019d135d-4c60-7fa3-8438-b12bc57e0720", "tier": null, "run_name": null, "family_name": null, "family_stage": null, "status": null, "decision": null, "payload": {}}
{"event_id": "evt_1774152382433846691", "ts": 1774152382, "event": "session_rebuilt", "round": 42, "tier": null, "run_name": null, "family_name": null, "family_stage": null, "status": "recreated", "decision": null, "payload": {"previous_session_id": "019d135d-4c60-7fa3-8438-b12bc57e0720", "previous_status": "active", "previous_rounds": 8, "previous_age_hours": 1.6173}}
{"event_id": "evt_1774152547504238203", "ts": 1774152547, "event": "session_started", "round": 42, "tier": null, "run_name": null, "family_name": null, "family_stage": null, "status": "active", "decision": null, "payload": {"session_id": "019d13ba-88bf-74b1-a101-245e7e501dd8"}}
