{"event_id": "evt_1774148412683536521", "ts": 1774148412, "event": "training_heartbeat", "round": 35, "session_id": "019d135d-4c60-7fa3-8438-b12bc57e0720", "tier": "proxy", "run_name": "round0035_proxy_1774148052", "family_name": "adaptive_budget_topk", "family_stage": "prototype", "status": null, "decision": null, "payload": {"tier": "proxy", "run_name": "round0035_proxy_1774148052", "family_name": "adaptive_budget_topk", "family_stage": "prototype", "checkpoint_dir": "/root/sparsify-ascend/checkpoints/research_agent/round_0035_proxy/round0035_proxy_1774148052_dp2_bs1_ga8_ef32_k128_20260322_105420", "metrics_path": "/root/sparsify-ascend/checkpoints/research_agent/round_0035_proxy/round0035_proxy_1774148052_dp2_bs1_ga8_ef32_k128_20260322_105420/metrics.jsonl", "latest_step": 420, "latest_tokens_per_sec": 38227.04320360478, "baseline_ratio": null, "latest_total_tokens": 13762560.0, "proxy_mode": "fast", "evaluation_basis": "terminal_only"}}
{"event_id": "evt_1774148442686685939", "ts": 1774148442, "event": "training_heartbeat", "round": 35, "session_id": "019d135d-4c60-7fa3-8438-b12bc57e0720", "tier": "proxy", "run_name": "round0035_proxy_1774148052", "family_name": "adaptive_budget_topk", "family_stage": "prototype", "status": null, "decision": null, "payload": {"tier": "proxy", "run_name": "round0035_proxy_1774148052", "family_name": "adaptive_budget_topk", "family_stage": "prototype", "checkpoint_dir": "/root/sparsify-ascend/checkpoints/research_agent/round_0035_proxy/round0035_proxy_1774148052_dp2_bs1_ga8_ef32_k128_20260322_105420", "metrics_path": "/root/sparsify-ascend/checkpoints/research_agent/round_0035_proxy/round0035_proxy_1774148052_dp2_bs1_ga8_ef32_k128_20260322_105420/metrics.jsonl", "latest_step": 460, "latest_tokens_per_sec": 38646.98719903673, "baseline_ratio": null, "latest_total_tokens": 15073280.0, "proxy_mode": "fast", "evaluation_basis": "terminal_only"}}
{"event_id": "evt_1774148472690059240", "ts": 1774148472, "event": "training_heartbeat", "round": 35, "session_id": "019d135d-4c60-7fa3-8438-b12bc57e0720", "tier": "proxy", "run_name": "round0035_proxy_1774148052", "family_name": "adaptive_budget_topk", "family_stage": "prototype", "status": null, "decision": null, "payload": {"tier": "proxy", "run_name": "round0035_proxy_1774148052", "family_name": "adaptive_budget_topk", "family_stage": "prototype", "checkpoint_dir": "/root/sparsify-ascend/checkpoints/research_agent/round_0035_proxy/round0035_proxy_1774148052_dp2_bs1_ga8_ef32_k128_20260322_105420", "metrics_path": "/root/sparsify-ascend/checkpoints/research_agent/round_0035_proxy/round0035_proxy_1774148052_dp2_bs1_ga8_ef32_k128_20260322_105420/metrics.jsonl", "latest_step": 490, "latest_tokens_per_sec": 38226.777449534995, "baseline_ratio": null, "latest_total_tokens": 16056320.0, "proxy_mode": "fast", "evaluation_basis": "terminal_only"}}
{"event_id": "evt_1774148502693594362", "ts": 1774148502, "event": "training_heartbeat", "round": 35, "session_id": "019d135d-4c60-7fa3-8438-b12bc57e0720", "tier": "proxy", "run_name": "round0035_proxy_1774148052", "family_name": "adaptive_budget_topk", "family_stage": "prototype", "status": null, "decision": null, "payload": {"tier": "proxy", "run_name": "round0035_proxy_1774148052", "family_name": "adaptive_budget_topk", "family_stage": "prototype", "checkpoint_dir": "/root/sparsify-ascend/checkpoints/research_agent/round_0035_proxy/round0035_proxy_1774148052_dp2_bs1_ga8_ef32_k128_20260322_105420", "metrics_path": "/root/sparsify-ascend/checkpoints/research_agent/round_0035_proxy/round0035_proxy_1774148052_dp2_bs1_ga8_ef32_k128_20260322_105420/metrics.jsonl", "latest_step": 530, "latest_tokens_per_sec": 38590.70914830116, "baseline_ratio": null, "latest_total_tokens": 17367040.0, "proxy_mode": "fast", "evaluation_basis": "terminal_only"}}
{"event_id": "evt_1774148532697322189", "ts": 1774148532, "event": "training_heartbeat", "round": 35, "session_id": "019d135d-4c60-7fa3-8438-b12bc57e0720", "tier": "proxy", "run_name": "round0035_proxy_1774148052", "family_name": "adaptive_budget_topk", "family_stage": "prototype", "status": null, "decision": null, "payload": {"tier": "proxy", "run_name": "round0035_proxy_1774148052", "family_name": "adaptive_budget_topk", "family_stage": "prototype", "checkpoint_dir": "/root/sparsify-ascend/checkpoints/research_agent/round_0035_proxy/round0035_proxy_1774148052_dp2_bs1_ga8_ef32_k128_20260322_105420", "metrics_path": "/root/sparsify-ascend/checkpoints/research_agent/round_0035_proxy/round0035_proxy_1774148052_dp2_bs1_ga8_ef32_k128_20260322_105420/metrics.jsonl", "latest_step": 570, "latest_tokens_per_sec": 38909.13432360727, "baseline_ratio": null, "latest_total_tokens": 18677760.0, "proxy_mode": "fast", "evaluation_basis": "terminal_only"}}
{"event_id": "evt_1774148562701402937", "ts": 1774148562, "event": "training_heartbeat", "round": 35, "session_id": "019d135d-4c60-7fa3-8438-b12bc57e0720", "tier": "proxy", "run_name": "round0035_proxy_1774148052", "family_name": "adaptive_budget_topk", "family_stage": "prototype", "status": null, "decision": null, "payload": {"tier": "proxy", "run_name": "round0035_proxy_1774148052", "family_name": "adaptive_budget_topk", "family_stage": "prototype", "checkpoint_dir": "/root/sparsify-ascend/checkpoints/research_agent/round_0035_proxy/round0035_proxy_1774148052_dp2_bs1_ga8_ef32_k128_20260322_105420", "metrics_path": "/root/sparsify-ascend/checkpoints/research_agent/round_0035_proxy/round0035_proxy_1774148052_dp2_bs1_ga8_ef32_k128_20260322_105420/metrics.jsonl", "latest_step": 600, "latest_tokens_per_sec": 38547.61937153393, "baseline_ratio": null, "latest_total_tokens": 19660800.0, "proxy_mode": "fast", "evaluation_basis": "terminal_only"}}
{"event_id": "evt_1774148592705617602", "ts": 1774148592, "event": "training_heartbeat", "round": 35, "session_id": "019d135d-4c60-7fa3-8438-b12bc57e0720", "tier": "proxy", "run_name": "round0035_proxy_1774148052", "family_name": "adaptive_budget_topk", "family_stage": "prototype", "status": null, "decision": null, "payload": {"tier": "proxy", "run_name": "round0035_proxy_1774148052", "family_name": "adaptive_budget_topk", "family_stage": "prototype", "checkpoint_dir": "/root/sparsify-ascend/checkpoints/research_agent/round_0035_proxy/round0035_proxy_1774148052_dp2_bs1_ga8_ef32_k128_20260322_105420", "metrics_path": "/root/sparsify-ascend/checkpoints/research_agent/round_0035_proxy/round0035_proxy_1774148052_dp2_bs1_ga8_ef32_k128_20260322_105420/metrics.jsonl", "latest_step": 640, "latest_tokens_per_sec": 38833.01026727223, "baseline_ratio": null, "latest_total_tokens": 20971520.0, "proxy_mode": "fast", "evaluation_basis": "terminal_only"}}
{"event_id": "evt_1774148622710064701", "ts": 1774148622, "event": "training_heartbeat", "round": 35, "session_id": "019d135d-4c60-7fa3-8438-b12bc57e0720", "tier": "proxy", "run_name": "round0035_proxy_1774148052", "family_name": "adaptive_budget_topk", "family_stage": "prototype", "status": null, "decision": null, "payload": {"tier": "proxy", "run_name": "round0035_proxy_1774148052", "family_name": "adaptive_budget_topk", "family_stage": "prototype", "checkpoint_dir": "/root/sparsify-ascend/checkpoints/research_agent/round_0035_proxy/round0035_proxy_1774148052_dp2_bs1_ga8_ef32_k128_20260322_105420", "metrics_path": "/root/sparsify-ascend/checkpoints/research_agent/round_0035_proxy/round0035_proxy_1774148052_dp2_bs1_ga8_ef32_k128_20260322_105420/metrics.jsonl", "latest_step": 680, "latest_tokens_per_sec": 39088.35159589534, "baseline_ratio": null, "latest_total_tokens": 22282240.0, "proxy_mode": "fast", "evaluation_basis": "terminal_only"}}
{"event_id": "evt_1774148652714695991", "ts": 1774148652, "event": "training_heartbeat", "round": 35, "session_id": "019d135d-4c60-7fa3-8438-b12bc57e0720", "tier": "proxy", "run_name": "round0035_proxy_1774148052", "family_name": "adaptive_budget_topk", "family_stage": "prototype", "status": null, "decision": null, "payload": {"tier": "proxy", "run_name": "round0035_proxy_1774148052", "family_name": "adaptive_budget_topk", "family_stage": "prototype", "checkpoint_dir": "/root/sparsify-ascend/checkpoints/research_agent/round_0035_proxy/round0035_proxy_1774148052_dp2_bs1_ga8_ef32_k128_20260322_105420", "metrics_path": "/root/sparsify-ascend/checkpoints/research_agent/round_0035_proxy/round0035_proxy_1774148052_dp2_bs1_ga8_ef32_k128_20260322_105420/metrics.jsonl", "latest_step": 720, "latest_tokens_per_sec": 39318.145834704235, "baseline_ratio": null, "latest_total_tokens": 23592960.0, "proxy_mode": "fast", "evaluation_basis": "terminal_only"}}
{"event_id": "evt_1774148682719473492", "ts": 1774148682, "event": "training_heartbeat", "round": 35, "session_id": "019d135d-4c60-7fa3-8438-b12bc57e0720", "tier": "proxy", "run_name": "round0035_proxy_1774148052", "family_name": "adaptive_budget_topk", "family_stage": "prototype", "status": null, "decision": null, "payload": {"tier": "proxy", "run_name": "round0035_proxy_1774148052", "family_name": "adaptive_budget_topk", "family_stage": "prototype", "checkpoint_dir": "/root/sparsify-ascend/checkpoints/research_agent/round_0035_proxy/round0035_proxy_1774148052_dp2_bs1_ga8_ef32_k128_20260322_105420", "metrics_path": "/root/sparsify-ascend/checkpoints/research_agent/round_0035_proxy/round0035_proxy_1774148052_dp2_bs1_ga8_ef32_k128_20260322_105420/metrics.jsonl", "latest_step": 750, "latest_tokens_per_sec": 39005.96388133083, "baseline_ratio": null, "latest_total_tokens": 24576000.0, "proxy_mode": "fast", "evaluation_basis": "terminal_only"}}
{"event_id": "evt_1774148712724448318", "ts": 1774148712, "event": "training_heartbeat", "round": 35, "session_id": "019d135d-4c60-7fa3-8438-b12bc57e0720", "tier": "proxy", "run_name": "round0035_proxy_1774148052", "family_name": "adaptive_budget_topk", "family_stage": "prototype", "status": null, "decision": null, "payload": {"tier": "proxy", "run_name": "round0035_proxy_1774148052", "family_name": "adaptive_budget_topk", "family_stage": "prototype", "checkpoint_dir": "/root/sparsify-ascend/checkpoints/research_agent/round_0035_proxy/round0035_proxy_1774148052_dp2_bs1_ga8_ef32_k128_20260322_105420", "metrics_path": "/root/sparsify-ascend/checkpoints/research_agent/round_0035_proxy/round0035_proxy_1774148052_dp2_bs1_ga8_ef32_k128_20260322_105420/metrics.jsonl", "latest_step": 790, "latest_tokens_per_sec": 39218.590607852115, "baseline_ratio": null, "latest_total_tokens": 25886720.0, "proxy_mode": "fast", "evaluation_basis": "terminal_only"}}
{"event_id": "evt_1774148742729712848", "ts": 1774148742, "event": "training_heartbeat", "round": 35, "session_id": "019d135d-4c60-7fa3-8438-b12bc57e0720", "tier": "proxy", "run_name": "round0035_proxy_1774148052", "family_name": "adaptive_budget_topk", "family_stage": "prototype", "status": null, "decision": null, "payload": {"tier": "proxy", "run_name": "round0035_proxy_1774148052", "family_name": "adaptive_budget_topk", "family_stage": "prototype", "checkpoint_dir": "/root/sparsify-ascend/checkpoints/research_agent/round_0035_proxy/round0035_proxy_1774148052_dp2_bs1_ga8_ef32_k128_20260322_105420", "metrics_path": "/root/sparsify-ascend/checkpoints/research_agent/round_0035_proxy/round0035_proxy_1774148052_dp2_bs1_ga8_ef32_k128_20260322_105420/metrics.jsonl", "latest_step": 830, "latest_tokens_per_sec": 39412.71112031247, "baseline_ratio": null, "latest_total_tokens": 27197440.0, "proxy_mode": "fast", "evaluation_basis": "terminal_only"}}
{"event_id": "evt_1774148772735148544", "ts": 1774148772, "event": "training_heartbeat", "round": 35, "session_id": "019d135d-4c60-7fa3-8438-b12bc57e0720", "tier": "proxy", "run_name": "round0035_proxy_1774148052", "family_name": "adaptive_budget_topk", "family_stage": "prototype", "status": null, "decision": null, "payload": {"tier": "proxy", "run_name": "round0035_proxy_1774148052", "family_name": "adaptive_budget_topk", "family_stage": "prototype", "checkpoint_dir": "/root/sparsify-ascend/checkpoints/research_agent/round_0035_proxy/round0035_proxy_1774148052_dp2_bs1_ga8_ef32_k128_20260322_105420", "metrics_path": "/root/sparsify-ascend/checkpoints/research_agent/round_0035_proxy/round0035_proxy_1774148052_dp2_bs1_ga8_ef32_k128_20260322_105420/metrics.jsonl", "latest_step": 870, "latest_tokens_per_sec": 39590.643467105605, "baseline_ratio": null, "latest_total_tokens": 28508160.0, "proxy_mode": "fast", "evaluation_basis": "terminal_only"}}
{"event_id": "evt_1774148802740788191", "ts": 1774148802, "event": "training_heartbeat", "round": 35, "session_id": "019d135d-4c60-7fa3-8438-b12bc57e0720", "tier": "proxy", "run_name": "round0035_proxy_1774148052", "family_name": "adaptive_budget_topk", "family_stage": "prototype", "status": null, "decision": null, "payload": {"tier": "proxy", "run_name": "round0035_proxy_1774148052", "family_name": "adaptive_budget_topk", "family_stage": "prototype", "checkpoint_dir": "/root/sparsify-ascend/checkpoints/research_agent/round_0035_proxy/round0035_proxy_1774148052_dp2_bs1_ga8_ef32_k128_20260322_105420", "metrics_path": "/root/sparsify-ascend/checkpoints/research_agent/round_0035_proxy/round0035_proxy_1774148052_dp2_bs1_ga8_ef32_k128_20260322_105420/metrics.jsonl", "latest_step": 900, "latest_tokens_per_sec": 39317.46904652531, "baseline_ratio": null, "latest_total_tokens": 29491200.0, "proxy_mode": "fast", "evaluation_basis": "terminal_only"}}
{"event_id": "evt_1774148832746618536", "ts": 1774148832, "event": "training_heartbeat", "round": 35, "session_id": "019d135d-4c60-7fa3-8438-b12bc57e0720", "tier": "proxy", "run_name": "round0035_proxy_1774148052", "family_name": "adaptive_budget_topk", "family_stage": "prototype", "status": null, "decision": null, "payload": {"tier": "proxy", "run_name": "round0035_proxy_1774148052", "family_name": "adaptive_budget_topk", "family_stage": "prototype", "checkpoint_dir": "/root/sparsify-ascend/checkpoints/research_agent/round_0035_proxy/round0035_proxy_1774148052_dp2_bs1_ga8_ef32_k128_20260322_105420", "metrics_path": "/root/sparsify-ascend/checkpoints/research_agent/round_0035_proxy/round0035_proxy_1774148052_dp2_bs1_ga8_ef32_k128_20260322_105420/metrics.jsonl", "latest_step": 940, "latest_tokens_per_sec": 39485.35613970936, "baseline_ratio": null, "latest_total_tokens": 30801920.0, "proxy_mode": "fast", "evaluation_basis": "terminal_only"}}
{"event_id": "evt_1774148862752711815", "ts": 1774148862, "event": "training_heartbeat", "round": 35, "session_id": "019d135d-4c60-7fa3-8438-b12bc57e0720", "tier": "proxy", "run_name": "round0035_proxy_1774148052", "family_name": "adaptive_budget_topk", "family_stage": "prototype", "status": null, "decision": null, "payload": {"tier": "proxy", "run_name": "round0035_proxy_1774148052", "family_name": "adaptive_budget_topk", "family_stage": "prototype", "checkpoint_dir": "/root/sparsify-ascend/checkpoints/research_agent/round_0035_proxy/round0035_proxy_1774148052_dp2_bs1_ga8_ef32_k128_20260322_105420", "metrics_path": "/root/sparsify-ascend/checkpoints/research_agent/round_0035_proxy/round0035_proxy_1774148052_dp2_bs1_ga8_ef32_k128_20260322_105420/metrics.jsonl", "latest_step": 980, "latest_tokens_per_sec": 39640.79447523587, "baseline_ratio": null, "latest_total_tokens": 32112640.0, "proxy_mode": "fast", "evaluation_basis": "terminal_only"}}
{"event_id": "evt_1774148892873456889", "ts": 1774148892, "event": "training_heartbeat", "round": 35, "session_id": "019d135d-4c60-7fa3-8438-b12bc57e0720", "tier": "proxy", "run_name": "round0035_proxy_1774148052", "family_name": "adaptive_budget_topk", "family_stage": "prototype", "status": null, "decision": null, "payload": {"tier": "proxy", "run_name": "round0035_proxy_1774148052", "family_name": "adaptive_budget_topk", "family_stage": "prototype", "checkpoint_dir": "/root/sparsify-ascend/checkpoints/research_agent/round_0035_proxy/round0035_proxy_1774148052_dp2_bs1_ga8_ef32_k128_20260322_105420", "metrics_path": "/root/sparsify-ascend/checkpoints/research_agent/round_0035_proxy/round0035_proxy_1774148052_dp2_bs1_ga8_ef32_k128_20260322_105420/metrics.jsonl", "latest_step": 1000, "latest_tokens_per_sec": 39005.024667297184, "baseline_ratio": null, "latest_total_tokens": 32768000.0, "proxy_mode": "fast", "evaluation_basis": "terminal_only"}}
{"event_id": "evt_1774148923078394990", "ts": 1774148923, "event": "training_heartbeat", "round": 35, "session_id": "019d135d-4c60-7fa3-8438-b12bc57e0720", "tier": "proxy", "run_name": "round0035_proxy_1774148052", "family_name": "adaptive_budget_topk", "family_stage": "prototype", "status": null, "decision": null, "payload": {"tier": "proxy", "run_name": "round0035_proxy_1774148052", "family_name": "adaptive_budget_topk", "family_stage": "prototype", "checkpoint_dir": "/root/sparsify-ascend/checkpoints/research_agent/round_0035_proxy/round0035_proxy_1774148052_dp2_bs1_ga8_ef32_k128_20260322_105420", "metrics_path": "/root/sparsify-ascend/checkpoints/research_agent/round_0035_proxy/round0035_proxy_1774148052_dp2_bs1_ga8_ef32_k128_20260322_105420/metrics.jsonl", "latest_step": 1040, "latest_tokens_per_sec": 39161.13196376663, "baseline_ratio": null, "latest_total_tokens": 34078720.0, "proxy_mode": "fast", "evaluation_basis": "terminal_only"}}
{"event_id": "evt_1774148953085072630", "ts": 1774148953, "event": "training_heartbeat", "round": 35, "session_id": "019d135d-4c60-7fa3-8438-b12bc57e0720", "tier": "proxy", "run_name": "round0035_proxy_1774148052", "family_name": "adaptive_budget_topk", "family_stage": "prototype", "status": null, "decision": null, "payload": {"tier": "proxy", "run_name": "round0035_proxy_1774148052", "family_name": "adaptive_budget_topk", "family_stage": "prototype", "checkpoint_dir": "/root/sparsify-ascend/checkpoints/research_agent/round_0035_proxy/round0035_proxy_1774148052_dp2_bs1_ga8_ef32_k128_20260322_105420", "metrics_path": "/root/sparsify-ascend/checkpoints/research_agent/round_0035_proxy/round0035_proxy_1774148052_dp2_bs1_ga8_ef32_k128_20260322_105420/metrics.jsonl", "latest_step": 1080, "latest_tokens_per_sec": 39303.12339428318, "baseline_ratio": null, "latest_total_tokens": 35389440.0, "proxy_mode": "fast", "evaluation_basis": "terminal_only"}}
{"event_id": "evt_1774148983091966446", "ts": 1774148983, "event": "training_heartbeat", "round": 35, "session_id": "019d135d-4c60-7fa3-8438-b12bc57e0720", "tier": "proxy", "run_name": "round0035_proxy_1774148052", "family_name": "adaptive_budget_topk", "family_stage": "prototype", "status": null, "decision": null, "payload": {"tier": "proxy", "run_name": "round0035_proxy_1774148052", "family_name": "adaptive_budget_topk", "family_stage": "prototype", "checkpoint_dir": "/root/sparsify-ascend/checkpoints/research_agent/round_0035_proxy/round0035_proxy_1774148052_dp2_bs1_ga8_ef32_k128_20260322_105420", "metrics_path": "/root/sparsify-ascend/checkpoints/research_agent/round_0035_proxy/round0035_proxy_1774148052_dp2_bs1_ga8_ef32_k128_20260322_105420/metrics.jsonl", "latest_step": 1120, "latest_tokens_per_sec": 39444.30091481918, "baseline_ratio": null, "latest_total_tokens": 36700160.0, "proxy_mode": "fast", "evaluation_basis": "terminal_only"}}
{"event_id": "evt_1774149013099036197", "ts": 1774149013, "event": "training_heartbeat", "round": 35, "session_id": "019d135d-4c60-7fa3-8438-b12bc57e0720", "tier": "proxy", "run_name": "round0035_proxy_1774148052", "family_name": "adaptive_budget_topk", "family_stage": "prototype", "status": null, "decision": null, "payload": {"tier": "proxy", "run_name": "round0035_proxy_1774148052", "family_name": "adaptive_budget_topk", "family_stage": "prototype", "checkpoint_dir": "/root/sparsify-ascend/checkpoints/research_agent/round_0035_proxy/round0035_proxy_1774148052_dp2_bs1_ga8_ef32_k128_20260322_105420", "metrics_path": "/root/sparsify-ascend/checkpoints/research_agent/round_0035_proxy/round0035_proxy_1774148052_dp2_bs1_ga8_ef32_k128_20260322_105420/metrics.jsonl", "latest_step": 1150, "latest_tokens_per_sec": 39235.47124492854, "baseline_ratio": null, "latest_total_tokens": 37683200.0, "proxy_mode": "fast", "evaluation_basis": "terminal_only"}}
{"event_id": "evt_1774149043106370400", "ts": 1774149043, "event": "training_heartbeat", "round": 35, "session_id": "019d135d-4c60-7fa3-8438-b12bc57e0720", "tier": "proxy", "run_name": "round0035_proxy_1774148052", "family_name": "adaptive_budget_topk", "family_stage": "prototype", "status": null, "decision": null, "payload": {"tier": "proxy", "run_name": "round0035_proxy_1774148052", "family_name": "adaptive_budget_topk", "family_stage": "prototype", "checkpoint_dir": "/root/sparsify-ascend/checkpoints/research_agent/round_0035_proxy/round0035_proxy_1774148052_dp2_bs1_ga8_ef32_k128_20260322_105420", "metrics_path": "/root/sparsify-ascend/checkpoints/research_agent/round_0035_proxy/round0035_proxy_1774148052_dp2_bs1_ga8_ef32_k128_20260322_105420/metrics.jsonl", "latest_step": 1190, "latest_tokens_per_sec": 39370.125297869796, "baseline_ratio": null, "latest_total_tokens": 38993920.0, "proxy_mode": "fast", "evaluation_basis": "terminal_only"}}
{"event_id": "evt_1774149073113967840", "ts": 1774149073, "event": "training_heartbeat", "round": 35, "session_id": "019d135d-4c60-7fa3-8438-b12bc57e0720", "tier": "proxy", "run_name": "round0035_proxy_1774148052", "family_name": "adaptive_budget_topk", "family_stage": "prototype", "status": null, "decision": null, "payload": {"tier": "proxy", "run_name": "round0035_proxy_1774148052", "family_name": "adaptive_budget_topk", "family_stage": "prototype", "checkpoint_dir": "/root/sparsify-ascend/checkpoints/research_agent/round_0035_proxy/round0035_proxy_1774148052_dp2_bs1_ga8_ef32_k128_20260322_105420", "metrics_path": "/root/sparsify-ascend/checkpoints/research_agent/round_0035_proxy/round0035_proxy_1774148052_dp2_bs1_ga8_ef32_k128_20260322_105420/metrics.jsonl", "latest_step": 1220, "latest_tokens_per_sec": 39175.73902223758, "baseline_ratio": null, "latest_total_tokens": 39976960.0, "proxy_mode": "fast", "evaluation_basis": "terminal_only"}}
