{"event_id": "evt_1774141919915669240", "ts": 1774141919, "event": "training_heartbeat", "round": 22, "session_id": "019d130c-782e-75a2-aa6f-506b18d29edf", "tier": "proxy", "run_name": "round0022_proxy_1774141319", "family_name": "lowrank_gated_residual", "family_stage": "prototype", "status": null, "decision": null, "payload": {"tier": "proxy", "run_name": "round0022_proxy_1774141319", "family_name": "lowrank_gated_residual", "family_stage": "prototype", "checkpoint_dir": "/root/sparsify-ascend/checkpoints/research_agent/round_0022_proxy/round0022_proxy_1774141319_dp2_bs1_ga8_ef32_k128_20260322_090205", "metrics_path": "/root/sparsify-ascend/checkpoints/research_agent/round_0022_proxy/round0022_proxy_1774141319_dp2_bs1_ga8_ef32_k128_20260322_090205/metrics.jsonl", "latest_step": 1220, "latest_tokens_per_sec": 66557.55177513757, "baseline_ratio": null, "latest_total_tokens": 39976960.0, "proxy_mode": "fast", "evaluation_basis": "terminal_only"}}
{"event_id": "evt_1774141919991193012", "ts": 1774141919, "event": "training_finished", "round": 22, "session_id": "019d130c-782e-75a2-aa6f-506b18d29edf", "tier": "proxy", "run_name": "round0022_proxy_1774141319", "family_name": "lowrank_gated_residual", "family_stage": "prototype", "status": "ok", "decision": "promote", "payload": {"tier": "proxy", "run_name": "round0022_proxy_1774141319", "family_name": "lowrank_gated_residual", "family_stage": "prototype", "checkpoint_dir": "/root/sparsify-ascend/checkpoints/research_agent/round_0022_proxy/round0022_proxy_1774141319_dp2_bs1_ga8_ef32_k128_20260322_090205", "metrics_path": "/root/sparsify-ascend/checkpoints/research_agent/round_0022_proxy/round0022_proxy_1774141319_dp2_bs1_ga8_ef32_k128_20260322_090205/metrics.jsonl", "run_health": "normal", "termination_reason": "completed", "tokens_per_sec": 66557.55177513757, "baseline_ratio": null, "status": "ok", "decision": "promote", "proxy_mode": "fast", "evaluation_basis": "terminal_only", "curve_start_fvu": 0.09979794174432755, "curve_mid_fvu": 0.08361905068159103, "curve_end_fvu": 0.06514900177717209, "curve_late_slope": -1.1304553213374705e-09, "curve_still_improving": true}}
{"event_id": "evt_1774141919991252538", "ts": 1774141919, "event": "result_recorded", "round": 22, "session_id": "019d130c-782e-75a2-aa6f-506b18d29edf", "tier": "proxy", "run_name": "round0022_proxy_1774141319", "family_name": "lowrank_gated_residual", "family_stage": "prototype", "status": "ok", "decision": "promote", "payload": {"tier": "proxy", "run_name": "round0022_proxy_1774141319", "family_name": "lowrank_gated_residual", "family_stage": "prototype", "status": "ok", "decision": "promote", "val_fvu": "0.0663293064571917", "observed_fvu": "0.065149", "k": "128", "log_path": "/root/sparsify-ascend/research/history/logs/proxy_1774141919.log", "checkpoint": null}}
{"event_id": "evt_1774141919992015323", "ts": 1774141919, "event": "training_started", "round": 22, "session_id": "019d130c-782e-75a2-aa6f-506b18d29edf", "tier": "full", "run_name": "round0022_full_1774141919", "family_name": "lowrank_gated_residual", "family_stage": "prototype", "status": null, "decision": null, "payload": {"tier": "full", "run_name": "round0022_full_1774141919", "family_name": "lowrank_gated_residual", "family_stage": "prototype", "checkpoint_dir": "/root/sparsify-ascend/checkpoints/research_agent/round_0022_full", "log_path": "/root/sparsify-ascend/research/history/logs/round0022_full_1774141919.log", "config": {"architecture": "lowrank_gated_residual", "expansion_factor": 32, "k": 128, "optimizer": "signum", "lr": "1.6e-3", "hookpoints": "layers.[3].self_attn.o_proj", "batch_size": 1, "grad_acc_steps": 8, "micro_acc_steps": 1, "auxk_alpha": 0.0, "dead_feature_threshold": 10000000, "use_hadamard": false, "tier": "full", "family_name": "lowrank_gated_residual", "family_stage": "prototype"}, "baseline_tokens_per_sec": null, "proxy_mode": null, "evaluation_basis": null}}
{"event_id": "evt_1774141949993238197", "ts": 1774141949, "event": "training_heartbeat", "round": 22, "session_id": "019d130c-782e-75a2-aa6f-506b18d29edf", "tier": "full", "run_name": "round0022_full_1774141919", "family_name": "lowrank_gated_residual", "family_stage": "prototype", "status": null, "decision": null, "payload": {"tier": "full", "run_name": "round0022_full_1774141919", "family_name": "lowrank_gated_residual", "family_stage": "prototype", "checkpoint_dir": "/root/sparsify-ascend/checkpoints/research_agent/round_0022_full/round0022_full_1774141919_dp2_bs1_ga8_ef32_k128_20260322_091206", "metrics_path": "/root/sparsify-ascend/checkpoints/research_agent/round_0022_full/round0022_full_1774141919_dp2_bs1_ga8_ef32_k128_20260322_091206/metrics.jsonl", "latest_step": 40, "latest_tokens_per_sec": 43689.30177875127, "baseline_ratio": null, "latest_total_tokens": 1310720.0, "proxy_mode": null, "evaluation_basis": null}}
{"event_id": "evt_1774141979994406816", "ts": 1774141979, "event": "training_heartbeat", "round": 22, "session_id": "019d130c-782e-75a2-aa6f-506b18d29edf", "tier": "full", "run_name": "round0022_full_1774141919", "family_name": "lowrank_gated_residual", "family_stage": "prototype", "status": null, "decision": null, "payload": {"tier": "full", "run_name": "round0022_full_1774141919", "family_name": "lowrank_gated_residual", "family_stage": "prototype", "checkpoint_dir": "/root/sparsify-ascend/checkpoints/research_agent/round_0022_full/round0022_full_1774141919_dp2_bs1_ga8_ef32_k128_20260322_091206", "metrics_path": "/root/sparsify-ascend/checkpoints/research_agent/round_0022_full/round0022_full_1774141919_dp2_bs1_ga8_ef32_k128_20260322_091206/metrics.jsonl", "latest_step": 110, "latest_tokens_per_sec": 60072.56103300702, "baseline_ratio": null, "latest_total_tokens": 3604480.0, "proxy_mode": null, "evaluation_basis": null}}
{"event_id": "evt_1774142009995965067", "ts": 1774142009, "event": "training_heartbeat", "round": 22, "session_id": "019d130c-782e-75a2-aa6f-506b18d29edf", "tier": "full", "run_name": "round0022_full_1774141919", "family_name": "lowrank_gated_residual", "family_stage": "prototype", "status": null, "decision": null, "payload": {"tier": "full", "run_name": "round0022_full_1774141919", "family_name": "lowrank_gated_residual", "family_stage": "prototype", "checkpoint_dir": "/root/sparsify-ascend/checkpoints/research_agent/round_0022_full/round0022_full_1774141919_dp2_bs1_ga8_ef32_k128_20260322_091206", "metrics_path": "/root/sparsify-ascend/checkpoints/research_agent/round_0022_full/round0022_full_1774141919_dp2_bs1_ga8_ef32_k128_20260322_091206/metrics.jsonl", "latest_step": 180, "latest_tokens_per_sec": 65533.33656658171, "baseline_ratio": null, "latest_total_tokens": 5898240.0, "proxy_mode": null, "evaluation_basis": null}}
{"event_id": "evt_1774142039997937149", "ts": 1774142039, "event": "training_heartbeat", "round": 22, "session_id": "019d130c-782e-75a2-aa6f-506b18d29edf", "tier": "full", "run_name": "round0022_full_1774141919", "family_name": "lowrank_gated_residual", "family_stage": "prototype", "status": null, "decision": null, "payload": {"tier": "full", "run_name": "round0022_full_1774141919", "family_name": "lowrank_gated_residual", "family_stage": "prototype", "checkpoint_dir": "/root/sparsify-ascend/checkpoints/research_agent/round_0022_full/round0022_full_1774141919_dp2_bs1_ga8_ef32_k128_20260322_091206", "metrics_path": "/root/sparsify-ascend/checkpoints/research_agent/round_0022_full/round0022_full_1774141919_dp2_bs1_ga8_ef32_k128_20260322_091206/metrics.jsonl", "latest_step": 250, "latest_tokens_per_sec": 68263.46613312997, "baseline_ratio": null, "latest_total_tokens": 8192000.0, "proxy_mode": null, "evaluation_basis": null}}
{"event_id": "evt_1774142070000356538", "ts": 1774142070, "event": "training_heartbeat", "round": 22, "session_id": "019d130c-782e-75a2-aa6f-506b18d29edf", "tier": "full", "run_name": "round0022_full_1774141919", "family_name": "lowrank_gated_residual", "family_stage": "prototype", "status": null, "decision": null, "payload": {"tier": "full", "run_name": "round0022_full_1774141919", "family_name": "lowrank_gated_residual", "family_stage": "prototype", "checkpoint_dir": "/root/sparsify-ascend/checkpoints/research_agent/round_0022_full/round0022_full_1774141919_dp2_bs1_ga8_ef32_k128_20260322_091206", "metrics_path": "/root/sparsify-ascend/checkpoints/research_agent/round_0022_full/round0022_full_1774141919_dp2_bs1_ga8_ef32_k128_20260322_091206/metrics.jsonl", "latest_step": 330, "latest_tokens_per_sec": 72085.73049937816, "baseline_ratio": null, "latest_total_tokens": 10813440.0, "proxy_mode": null, "evaluation_basis": null}}
{"event_id": "evt_1774142100003168752", "ts": 1774142100, "event": "training_heartbeat", "round": 22, "session_id": "019d130c-782e-75a2-aa6f-506b18d29edf", "tier": "full", "run_name": "round0022_full_1774141919", "family_name": "lowrank_gated_residual", "family_stage": "prototype", "status": null, "decision": null, "payload": {"tier": "full", "run_name": "round0022_full_1774141919", "family_name": "lowrank_gated_residual", "family_stage": "prototype", "checkpoint_dir": "/root/sparsify-ascend/checkpoints/research_agent/round_0022_full/round0022_full_1774141919_dp2_bs1_ga8_ef32_k128_20260322_091206", "metrics_path": "/root/sparsify-ascend/checkpoints/research_agent/round_0022_full/round0022_full_1774141919_dp2_bs1_ga8_ef32_k128_20260322_091206/metrics.jsonl", "latest_step": 400, "latest_tokens_per_sec": 72813.38481364664, "baseline_ratio": null, "latest_total_tokens": 13107200.0, "proxy_mode": null, "evaluation_basis": null}}
{"event_id": "evt_1774142130006417177", "ts": 1774142130, "event": "training_heartbeat", "round": 22, "session_id": "019d130c-782e-75a2-aa6f-506b18d29edf", "tier": "full", "run_name": "round0022_full_1774141919", "family_name": "lowrank_gated_residual", "family_stage": "prototype", "status": null, "decision": null, "payload": {"tier": "full", "run_name": "round0022_full_1774141919", "family_name": "lowrank_gated_residual", "family_stage": "prototype", "checkpoint_dir": "/root/sparsify-ascend/checkpoints/research_agent/round_0022_full/round0022_full_1774141919_dp2_bs1_ga8_ef32_k128_20260322_091206", "metrics_path": "/root/sparsify-ascend/checkpoints/research_agent/round_0022_full/round0022_full_1774141919_dp2_bs1_ga8_ef32_k128_20260322_091206/metrics.jsonl", "latest_step": 470, "latest_tokens_per_sec": 73332.98336421917, "baseline_ratio": null, "latest_total_tokens": 15400960.0, "proxy_mode": null, "evaluation_basis": null}}
{"event_id": "evt_1774142160010025410", "ts": 1774142160, "event": "training_heartbeat", "round": 22, "session_id": "019d130c-782e-75a2-aa6f-506b18d29edf", "tier": "full", "run_name": "round0022_full_1774141919", "family_name": "lowrank_gated_residual", "family_stage": "prototype", "status": null, "decision": null, "payload": {"tier": "full", "run_name": "round0022_full_1774141919", "family_name": "lowrank_gated_residual", "family_stage": "prototype", "checkpoint_dir": "/root/sparsify-ascend/checkpoints/research_agent/round_0022_full/round0022_full_1774141919_dp2_bs1_ga8_ef32_k128_20260322_091206", "metrics_path": "/root/sparsify-ascend/checkpoints/research_agent/round_0022_full/round0022_full_1774141919_dp2_bs1_ga8_ef32_k128_20260322_091206/metrics.jsonl", "latest_step": 540, "latest_tokens_per_sec": 73722.5598985038, "baseline_ratio": null, "latest_total_tokens": 17694720.0, "proxy_mode": null, "evaluation_basis": null}}
{"event_id": "evt_1774142190014049410", "ts": 1774142190, "event": "training_heartbeat", "round": 22, "session_id": "019d130c-782e-75a2-aa6f-506b18d29edf", "tier": "full", "run_name": "round0022_full_1774141919", "family_name": "lowrank_gated_residual", "family_stage": "prototype", "status": null, "decision": null, "payload": {"tier": "full", "run_name": "round0022_full_1774141919", "family_name": "lowrank_gated_residual", "family_stage": "prototype", "checkpoint_dir": "/root/sparsify-ascend/checkpoints/research_agent/round_0022_full/round0022_full_1774141919_dp2_bs1_ga8_ef32_k128_20260322_091206", "metrics_path": "/root/sparsify-ascend/checkpoints/research_agent/round_0022_full/round0022_full_1774141919_dp2_bs1_ga8_ef32_k128_20260322_091206/metrics.jsonl", "latest_step": 620, "latest_tokens_per_sec": 75238.98004650725, "baseline_ratio": null, "latest_total_tokens": 20316160.0, "proxy_mode": null, "evaluation_basis": null}}
{"event_id": "evt_1774142220018493153", "ts": 1774142220, "event": "training_heartbeat", "round": 22, "session_id": "019d130c-782e-75a2-aa6f-506b18d29edf", "tier": "full", "run_name": "round0022_full_1774141919", "family_name": "lowrank_gated_residual", "family_stage": "prototype", "status": null, "decision": null, "payload": {"tier": "full", "run_name": "round0022_full_1774141919", "family_name": "lowrank_gated_residual", "family_stage": "prototype", "checkpoint_dir": "/root/sparsify-ascend/checkpoints/research_agent/round_0022_full/round0022_full_1774141919_dp2_bs1_ga8_ef32_k128_20260322_091206", "metrics_path": "/root/sparsify-ascend/checkpoints/research_agent/round_0022_full/round0022_full_1774141919_dp2_bs1_ga8_ef32_k128_20260322_091206/metrics.jsonl", "latest_step": 690, "latest_tokens_per_sec": 75359.82538869246, "baseline_ratio": null, "latest_total_tokens": 22609920.0, "proxy_mode": null, "evaluation_basis": null}}
{"event_id": "evt_1774142250023291409", "ts": 1774142250, "event": "training_heartbeat", "round": 22, "session_id": "019d130c-782e-75a2-aa6f-506b18d29edf", "tier": "full", "run_name": "round0022_full_1774141919", "family_name": "lowrank_gated_residual", "family_stage": "prototype", "status": null, "decision": null, "payload": {"tier": "full", "run_name": "round0022_full_1774141919", "family_name": "lowrank_gated_residual", "family_stage": "prototype", "checkpoint_dir": "/root/sparsify-ascend/checkpoints/research_agent/round_0022_full/round0022_full_1774141919_dp2_bs1_ga8_ef32_k128_20260322_091206", "metrics_path": "/root/sparsify-ascend/checkpoints/research_agent/round_0022_full/round0022_full_1774141919_dp2_bs1_ga8_ef32_k128_20260322_091206/metrics.jsonl", "latest_step": 760, "latest_tokens_per_sec": 75458.61341748197, "baseline_ratio": null, "latest_total_tokens": 24903680.0, "proxy_mode": null, "evaluation_basis": null}}
{"event_id": "evt_1774142280028561211", "ts": 1774142280, "event": "training_heartbeat", "round": 22, "session_id": "019d130c-782e-75a2-aa6f-506b18d29edf", "tier": "full", "run_name": "round0022_full_1774141919", "family_name": "lowrank_gated_residual", "family_stage": "prototype", "status": null, "decision": null, "payload": {"tier": "full", "run_name": "round0022_full_1774141919", "family_name": "lowrank_gated_residual", "family_stage": "prototype", "checkpoint_dir": "/root/sparsify-ascend/checkpoints/research_agent/round_0022_full/round0022_full_1774141919_dp2_bs1_ga8_ef32_k128_20260322_091206", "metrics_path": "/root/sparsify-ascend/checkpoints/research_agent/round_0022_full/round0022_full_1774141919_dp2_bs1_ga8_ef32_k128_20260322_091206/metrics.jsonl", "latest_step": 840, "latest_tokens_per_sec": 76450.97240342548, "baseline_ratio": null, "latest_total_tokens": 27525120.0, "proxy_mode": null, "evaluation_basis": null}}
{"event_id": "evt_1774142310034230161", "ts": 1774142310, "event": "training_heartbeat", "round": 22, "session_id": "019d130c-782e-75a2-aa6f-506b18d29edf", "tier": "full", "run_name": "round0022_full_1774141919", "family_name": "lowrank_gated_residual", "family_stage": "prototype", "status": null, "decision": null, "payload": {"tier": "full", "run_name": "round0022_full_1774141919", "family_name": "lowrank_gated_residual", "family_stage": "prototype", "checkpoint_dir": "/root/sparsify-ascend/checkpoints/research_agent/round_0022_full/round0022_full_1774141919_dp2_bs1_ga8_ef32_k128_20260322_091206", "metrics_path": "/root/sparsify-ascend/checkpoints/research_agent/round_0022_full/round0022_full_1774141919_dp2_bs1_ga8_ef32_k128_20260322_091206/metrics.jsonl", "latest_step": 910, "latest_tokens_per_sec": 76450.45245842916, "baseline_ratio": null, "latest_total_tokens": 29818880.0, "proxy_mode": null, "evaluation_basis": null}}
{"event_id": "evt_1774142340040324434", "ts": 1774142340, "event": "training_heartbeat", "round": 22, "session_id": "019d130c-782e-75a2-aa6f-506b18d29edf", "tier": "full", "run_name": "round0022_full_1774141919", "family_name": "lowrank_gated_residual", "family_stage": "prototype", "status": null, "decision": null, "payload": {"tier": "full", "run_name": "round0022_full_1774141919", "family_name": "lowrank_gated_residual", "family_stage": "prototype", "checkpoint_dir": "/root/sparsify-ascend/checkpoints/research_agent/round_0022_full/round0022_full_1774141919_dp2_bs1_ga8_ef32_k128_20260322_091206", "metrics_path": "/root/sparsify-ascend/checkpoints/research_agent/round_0022_full/round0022_full_1774141919_dp2_bs1_ga8_ef32_k128_20260322_091206/metrics.jsonl", "latest_step": 980, "latest_tokens_per_sec": 76449.93038201593, "baseline_ratio": null, "latest_total_tokens": 32112640.0, "proxy_mode": null, "evaluation_basis": null}}
{"event_id": "evt_1774142370228741858", "ts": 1774142370, "event": "training_heartbeat", "round": 22, "session_id": "019d130c-782e-75a2-aa6f-506b18d29edf", "tier": "full", "run_name": "round0022_full_1774141919", "family_name": "lowrank_gated_residual", "family_stage": "prototype", "status": null, "decision": null, "payload": {"tier": "full", "run_name": "round0022_full_1774141919", "family_name": "lowrank_gated_residual", "family_stage": "prototype", "checkpoint_dir": "/root/sparsify-ascend/checkpoints/research_agent/round_0022_full/round0022_full_1774141919_dp2_bs1_ga8_ef32_k128_20260322_091206", "metrics_path": "/root/sparsify-ascend/checkpoints/research_agent/round_0022_full/round0022_full_1774141919_dp2_bs1_ga8_ef32_k128_20260322_091206/metrics.jsonl", "latest_step": 1020, "latest_tokens_per_sec": 74265.17820715178, "baseline_ratio": null, "latest_total_tokens": 33423360.0, "proxy_mode": null, "evaluation_basis": null}}
{"event_id": "evt_1774142400276539550", "ts": 1774142400, "event": "training_heartbeat", "round": 22, "session_id": "019d130c-782e-75a2-aa6f-506b18d29edf", "tier": "full", "run_name": "round0022_full_1774141919", "family_name": "lowrank_gated_residual", "family_stage": "prototype", "status": null, "decision": null, "payload": {"tier": "full", "run_name": "round0022_full_1774141919", "family_name": "lowrank_gated_residual", "family_stage": "prototype", "checkpoint_dir": "/root/sparsify-ascend/checkpoints/research_agent/round_0022_full/round0022_full_1774141919_dp2_bs1_ga8_ef32_k128_20260322_091206", "metrics_path": "/root/sparsify-ascend/checkpoints/research_agent/round_0022_full/round0022_full_1774141919_dp2_bs1_ga8_ef32_k128_20260322_091206/metrics.jsonl", "latest_step": 1090, "latest_tokens_per_sec": 74373.0006645885, "baseline_ratio": null, "latest_total_tokens": 35717120.0, "proxy_mode": null, "evaluation_basis": null}}
{"event_id": "evt_1774142430283682823", "ts": 1774142430, "event": "training_heartbeat", "round": 22, "session_id": "019d130c-782e-75a2-aa6f-506b18d29edf", "tier": "full", "run_name": "round0022_full_1774141919", "family_name": "lowrank_gated_residual", "family_stage": "prototype", "status": null, "decision": null, "payload": {"tier": "full", "run_name": "round0022_full_1774141919", "family_name": "lowrank_gated_residual", "family_stage": "prototype", "checkpoint_dir": "/root/sparsify-ascend/checkpoints/research_agent/round_0022_full/round0022_full_1774141919_dp2_bs1_ga8_ef32_k128_20260322_091206", "metrics_path": "/root/sparsify-ascend/checkpoints/research_agent/round_0022_full/round0022_full_1774141919_dp2_bs1_ga8_ef32_k128_20260322_091206/metrics.jsonl", "latest_step": 1170, "latest_tokens_per_sec": 75130.7238575982, "baseline_ratio": null, "latest_total_tokens": 38338560.0, "proxy_mode": null, "evaluation_basis": null}}
{"event_id": "evt_1774142460430992507", "ts": 1774142460, "event": "training_heartbeat", "round": 22, "session_id": "019d130c-782e-75a2-aa6f-506b18d29edf", "tier": "full", "run_name": "round0022_full_1774141919", "family_name": "lowrank_gated_residual", "family_stage": "prototype", "status": null, "decision": null, "payload": {"tier": "full", "run_name": "round0022_full_1774141919", "family_name": "lowrank_gated_residual", "family_stage": "prototype", "checkpoint_dir": "/root/sparsify-ascend/checkpoints/research_agent/round_0022_full/round0022_full_1774141919_dp2_bs1_ga8_ef32_k128_20260322_091206", "metrics_path": "/root/sparsify-ascend/checkpoints/research_agent/round_0022_full/round0022_full_1774141919_dp2_bs1_ga8_ef32_k128_20260322_091206/metrics.jsonl", "latest_step": 1220, "latest_tokens_per_sec": 73990.46696420816, "baseline_ratio": null, "latest_total_tokens": 39976960.0, "proxy_mode": null, "evaluation_basis": null}}
{"event_id": "evt_1774142490674842830", "ts": 1774142490, "event": "training_heartbeat", "round": 22, "session_id": "019d130c-782e-75a2-aa6f-506b18d29edf", "tier": "full", "run_name": "round0022_full_1774141919", "family_name": "lowrank_gated_residual", "family_stage": "prototype", "status": null, "decision": null, "payload": {"tier": "full", "run_name": "round0022_full_1774141919", "family_name": "lowrank_gated_residual", "family_stage": "prototype", "checkpoint_dir": "/root/sparsify-ascend/checkpoints/research_agent/round_0022_full/round0022_full_1774141919_dp2_bs1_ga8_ef32_k128_20260322_091206", "metrics_path": "/root/sparsify-ascend/checkpoints/research_agent/round_0022_full/round0022_full_1774141919_dp2_bs1_ga8_ef32_k128_20260322_091206/metrics.jsonl", "latest_step": 1220, "latest_tokens_per_sec": 70080.17630128724, "baseline_ratio": null, "latest_total_tokens": 39976960.0, "proxy_mode": null, "evaluation_basis": null}}
