{"event_id": "evt_1774166263707411579", "ts": 1774166263, "event": "result_recorded", "round": 66, "session_id": "019d1472-65bf-7983-8005-f5d3834169bf", "tier": "proxy", "run_name": "round0066_proxy_1774166203", "family_name": "lowrank_gated_residual", "family_stage": "stabilize", "status": "ok", "decision": "discard", "payload": {"tier": "proxy", "run_name": "round0066_proxy_1774166203", "family_name": "lowrank_gated_residual", "family_stage": "stabilize", "status": "ok", "decision": "discard", "val_fvu": "0.1688940990716219", "observed_fvu": "0.167951", "k": "56", "log_path": "/root/sparsify-ascend/research/history/logs/proxy_1774166263.log", "checkpoint": null}}
{"event_id": "evt_1774166263707551015", "ts": 1774166263, "event": "round_finished", "round": 66, "session_id": "019d1472-65bf-7983-8005-f5d3834169bf", "tier": "proxy", "run_name": null, "family_name": "lowrank_gated_residual", "family_stage": "stabilize", "status": "ok", "decision": "discard", "payload": {"tier": "proxy", "family_name": "lowrank_gated_residual", "family_stage": "stabilize", "status": "ok", "decision": "discard", "val_fvu": "0.1688940990716219"}}
{"event_id": "evt_1774166263715926245", "ts": 1774166263, "event": "experiment_commit_prepared", "round": 66, "tier": "proxy", "run_name": null, "family_name": "lowrank_gated_residual", "family_stage": "stabilize", "status": "ok", "decision": "discard", "payload": {"branch": "autoresearch-sae"}}
{"event_id": "evt_1774166271307876870", "ts": 1774166271, "event": "round_started", "round": 67, "session_id": "019d1472-65bf-7983-8005-f5d3834169bf", "tier": null, "run_name": null, "family_name": null, "family_stage": null, "status": "started", "decision": null, "payload": {"status": "started"}}
{"event_id": "evt_1774166271308030918", "ts": 1774166271, "event": "agent_deciding", "round": 67, "session_id": "019d1472-65bf-7983-8005-f5d3834169bf", "tier": null, "run_name": null, "family_name": null, "family_stage": null, "status": null, "decision": null, "payload": {}}
{"event_id": "evt_1774166394307669233", "ts": 1774166394, "event": "session_resumed", "round": 67, "tier": null, "run_name": null, "family_name": null, "family_stage": null, "status": "active", "decision": null, "payload": {"session_id": "019d1472-65bf-7983-8005-f5d3834169bf"}}
{"event_id": "evt_1774166394316596280", "ts": 1774166394, "event": "agent_action_received", "round": 67, "session_id": "019d1472-65bf-7983-8005-f5d3834169bf", "tier": "proxy", "run_name": null, "family_name": "lowrank_gated_residual", "family_stage": "stabilize", "status": null, "decision": null, "payload": {"session_id": "019d1472-65bf-7983-8005-f5d3834169bf", "tier": "proxy", "family_name": "lowrank_gated_residual", "family_stage": "stabilize", "change_type": "param_only", "expected_win": "smaller_k", "hypothesis": "The stable small-EF recovery path should continue by lowering K one step further on the known working `lowrank_gated_residual` recipe, so `K=48`, `EF=8` is the next conservative point to test whether lower-K exploration can proceed without reintroducing instability."}}
{"event_id": "evt_1774166394316740939", "ts": 1774166394, "event": "proxy_mode_selected", "round": 67, "session_id": "019d1472-65bf-7983-8005-f5d3834169bf", "tier": "proxy", "run_name": null, "family_name": "lowrank_gated_residual", "family_stage": "stabilize", "status": null, "decision": null, "payload": {"tier": "proxy", "proxy_mode": "fast", "evaluation_basis": "terminal_only", "parameter_behavior": "structural", "proxy_max_tokens": "5000000"}}
{"event_id": "evt_1774166394317021280", "ts": 1774166394, "event": "training_started", "round": 67, "session_id": "019d1472-65bf-7983-8005-f5d3834169bf", "tier": "proxy", "run_name": "round0067_proxy_1774166394", "family_name": "lowrank_gated_residual", "family_stage": "stabilize", "status": null, "decision": null, "payload": {"tier": "proxy", "run_name": "round0067_proxy_1774166394", "family_name": "lowrank_gated_residual", "family_stage": "stabilize", "checkpoint_dir": "/root/sparsify-ascend/checkpoints/research_agent/round_0067_proxy", "log_path": "/root/sparsify-ascend/research/history/logs/round0067_proxy_1774166394.log", "config": {"architecture": "lowrank_gated_residual", "expansion_factor": 8, "k": 48, "optimizer": "signum", "lr": "1.6e-3", "hookpoints": "layers.[3].self_attn.o_proj", "batch_size": 1, "grad_acc_steps": 8, "micro_acc_steps": 1, "auxk_alpha": 0.0, "dead_feature_threshold": 10000000, "use_hadamard": false, "tier": "proxy", "family_name": "lowrank_gated_residual", "family_stage": "stabilize"}, "baseline_tokens_per_sec": 83008.58788873068, "proxy_mode": "fast", "evaluation_basis": "terminal_only"}}
{"event_id": "evt_1774166424318869330", "ts": 1774166424, "event": "training_heartbeat", "round": 67, "session_id": "019d1472-65bf-7983-8005-f5d3834169bf", "tier": "proxy", "run_name": "round0067_proxy_1774166394", "family_name": "lowrank_gated_residual", "family_stage": "stabilize", "status": null, "decision": null, "payload": {"tier": "proxy", "run_name": "round0067_proxy_1774166394", "family_name": "lowrank_gated_residual", "family_stage": "stabilize", "checkpoint_dir": "/root/sparsify-ascend/checkpoints/research_agent/round_0067_proxy/round0067_proxy_1774166394_dp2_bs1_ga8_ef8_k48_20260322_160000", "metrics_path": "/root/sparsify-ascend/checkpoints/research_agent/round_0067_proxy/round0067_proxy_1774166394_dp2_bs1_ga8_ef8_k48_20260322_160000/metrics.jsonl", "latest_step": 130, "latest_tokens_per_sec": 141987.4955878698, "baseline_ratio": 1.710515733362405, "latest_total_tokens": 4259840.0, "proxy_mode": "fast", "evaluation_basis": "terminal_only"}}
{"event_id": "evt_1774166454320321795", "ts": 1774166454, "event": "training_heartbeat", "round": 67, "session_id": "019d1472-65bf-7983-8005-f5d3834169bf", "tier": "proxy", "run_name": "round0067_proxy_1774166394", "family_name": "lowrank_gated_residual", "family_stage": "stabilize", "status": null, "decision": null, "payload": {"tier": "proxy", "run_name": "round0067_proxy_1774166394", "family_name": "lowrank_gated_residual", "family_stage": "stabilize", "checkpoint_dir": "/root/sparsify-ascend/checkpoints/research_agent/round_0067_proxy/round0067_proxy_1774166394_dp2_bs1_ga8_ef8_k48_20260322_160000", "metrics_path": "/root/sparsify-ascend/checkpoints/research_agent/round_0067_proxy/round0067_proxy_1774166394_dp2_bs1_ga8_ef8_k48_20260322_160000/metrics.jsonl", "latest_step": 152, "latest_tokens_per_sec": 83008.16801487702, "baseline_ratio": 0.999994941802236, "latest_total_tokens": 4980736.0, "proxy_mode": "fast", "evaluation_basis": "terminal_only"}}
{"event_id": "evt_1774166454385811184", "ts": 1774166454, "event": "training_finished", "round": 67, "session_id": "019d1472-65bf-7983-8005-f5d3834169bf", "tier": "proxy", "run_name": "round0067_proxy_1774166394", "family_name": "lowrank_gated_residual", "family_stage": "stabilize", "status": "ok", "decision": "discard", "payload": {"tier": "proxy", "run_name": "round0067_proxy_1774166394", "family_name": "lowrank_gated_residual", "family_stage": "stabilize", "checkpoint_dir": "/root/sparsify-ascend/checkpoints/research_agent/round_0067_proxy/round0067_proxy_1774166394_dp2_bs1_ga8_ef8_k48_20260322_160000", "metrics_path": "/root/sparsify-ascend/checkpoints/research_agent/round_0067_proxy/round0067_proxy_1774166394_dp2_bs1_ga8_ef8_k48_20260322_160000/metrics.jsonl", "run_health": "normal", "termination_reason": "completed", "tokens_per_sec": 83008.16801487702, "baseline_ratio": 0.999994941802236, "status": "ok", "decision": "discard", "proxy_mode": "fast", "evaluation_basis": "terminal_only", "curve_start_fvu": 0.3369583487510681, "curve_mid_fvu": 0.21818852424621582, "curve_end_fvu": 0.1726493090391159, "curve_late_slope": -6.891138670447793e-09, "curve_still_improving": true}}
{"event_id": "evt_1774166454385875238", "ts": 1774166454, "event": "result_recorded", "round": 67, "session_id": "019d1472-65bf-7983-8005-f5d3834169bf", "tier": "proxy", "run_name": "round0067_proxy_1774166394", "family_name": "lowrank_gated_residual", "family_stage": "stabilize", "status": "ok", "decision": "discard", "payload": {"tier": "proxy", "run_name": "round0067_proxy_1774166394", "family_name": "lowrank_gated_residual", "family_stage": "stabilize", "status": "ok", "decision": "discard", "val_fvu": "0.17363375425338745", "observed_fvu": "0.172649", "k": "48", "log_path": "/root/sparsify-ascend/research/history/logs/proxy_1774166454.log", "checkpoint": null}}
{"event_id": "evt_1774166454386010250", "ts": 1774166454, "event": "round_finished", "round": 67, "session_id": "019d1472-65bf-7983-8005-f5d3834169bf", "tier": "proxy", "run_name": null, "family_name": "lowrank_gated_residual", "family_stage": "stabilize", "status": "ok", "decision": "discard", "payload": {"tier": "proxy", "family_name": "lowrank_gated_residual", "family_stage": "stabilize", "status": "ok", "decision": "discard", "val_fvu": "0.17363375425338745"}}
{"event_id": "evt_1774166454394562880", "ts": 1774166454, "event": "experiment_commit_prepared", "round": 67, "tier": "proxy", "run_name": null, "family_name": "lowrank_gated_residual", "family_stage": "stabilize", "status": "ok", "decision": "discard", "payload": {"branch": "autoresearch-sae"}}
{"event_id": "evt_1774166708234504191", "ts": 1774166708, "event": "hint_added", "round": null, "tier": null, "run_name": null, "family_name": null, "family_stage": null, "status": "pending", "decision": null, "payload": {"id": "hint_1774166708", "message": "Current evidence suggests EF=8 is mainly a lower-bound check and is usually too capacity-constrained for the main frontier targets. Keep EF<=16, but\n  spend most meaningful EF exploration on EF=12 or EF=16. Use EF=8 only sparingly to confirm capacity limits, not as the default mainline comparison band.", "priority": "high", "scope": "persistent", "tag": "ef_mainline_12_16", "status": "pending", "created_at": 1774166708, "applied_at": null}}
{"event_id": "evt_1774166819300482062", "ts": 1774166819, "event": "loop_started", "round": null, "tier": null, "run_name": null, "family_name": null, "family_stage": null, "status": null, "decision": null, "payload": {"rounds": 200, "budget_hours": 10.0}}
{"event_id": "evt_1774166819306759435", "ts": 1774166819, "event": "research_branch_ready", "round": null, "tier": null, "run_name": null, "family_name": null, "family_stage": null, "status": "ready", "decision": null, "payload": {"branch": "autoresearch-sae", "base_branch": "autoresearch-sae", "base_commit": "04a0603ba261d372b5dc5e8d3c9746c5cebe46f2"}}
{"event_id": "evt_1774166819308608050", "ts": 1774166819, "event": "round_started", "round": 68, "session_id": null, "tier": null, "run_name": null, "family_name": null, "family_stage": null, "status": "started", "decision": null, "payload": {"status": "started"}}
{"event_id": "evt_1774166819308735313", "ts": 1774166819, "event": "agent_deciding", "round": 68, "session_id": null, "tier": null, "run_name": null, "family_name": null, "family_stage": null, "status": null, "decision": null, "payload": {}}
{"event_id": "evt_1774167009212028483", "ts": 1774167009, "event": "session_started", "round": 68, "tier": null, "run_name": null, "family_name": null, "family_stage": null, "status": "active", "decision": null, "payload": {"session_id": "019d1496-cd26-7b90-a74e-d93c12b3512b"}}
{"event_id": "evt_1774167009213315598", "ts": 1774167009, "event": "agent_action_received", "round": 68, "session_id": "019d1496-cd26-7b90-a74e-d93c12b3512b", "tier": "proxy", "run_name": null, "family_name": "lowrank_residual", "family_stage": "mainline", "status": null, "decision": null, "payload": {"session_id": "019d1496-cd26-7b90-a74e-d93c12b3512b", "tier": "proxy", "family_name": "lowrank_residual", "family_stage": "mainline", "change_type": "param_only", "expected_win": "explore_unknown", "hypothesis": "Eighteen straight no-improve rounds mean the recent EF=8 recovery ladder is no longer the right mainline. The least-risk stagnation break is a same-band architecture comparison in the preferred EF=16 regime: run `lowrank_residual` at `K=48` with the shared `signum`/`LR=1.6e-3`/`AUXK_ALPHA=0` recipe to test whether the simpler ungated low-rank residual encoder gives a better lower-K quality/cost tradeoff than the recent gated-recovery path."}}
{"event_id": "evt_1774167009213440729", "ts": 1774167009, "event": "variable_isolation_warning", "round": 68, "session_id": "019d1496-cd26-7b90-a74e-d93c12b3512b", "tier": null, "run_name": null, "family_name": "lowrank_residual", "family_stage": "mainline", "status": null, "decision": null, "payload": {"violation": "Multiple primary variables changed simultaneously: architecture, k, lr"}}
{"event_id": "evt_1774167009213506316", "ts": 1774167009, "event": "proxy_mode_selected", "round": 68, "session_id": "019d1496-cd26-7b90-a74e-d93c12b3512b", "tier": "proxy", "run_name": null, "family_name": "lowrank_residual", "family_stage": "mainline", "status": null, "decision": null, "payload": {"tier": "proxy", "proxy_mode": "fast", "evaluation_basis": "terminal_only", "parameter_behavior": "structural", "proxy_max_tokens": "5000000"}}
{"event_id": "evt_1774167009213791566", "ts": 1774167009, "event": "training_started", "round": 68, "session_id": "019d1496-cd26-7b90-a74e-d93c12b3512b", "tier": "proxy", "run_name": "round0068_proxy_1774167009", "family_name": "lowrank_residual", "family_stage": "mainline", "status": null, "decision": null, "payload": {"tier": "proxy", "run_name": "round0068_proxy_1774167009", "family_name": "lowrank_residual", "family_stage": "mainline", "checkpoint_dir": "/root/sparsify-ascend/checkpoints/research_agent/round_0068_proxy", "log_path": "/root/sparsify-ascend/research/history/logs/round0068_proxy_1774167009.log", "config": {"architecture": "lowrank_residual", "expansion_factor": 16, "k": 48, "optimizer": "signum", "lr": "1.6e-3", "hookpoints": "layers.[3].self_attn.o_proj", "batch_size": 1, "grad_acc_steps": 8, "micro_acc_steps": 1, "auxk_alpha": 0.0, "dead_feature_threshold": 10000000, "use_hadamard": false, "tier": "proxy", "family_name": "lowrank_residual", "family_stage": "mainline"}, "baseline_tokens_per_sec": 83008.52258207071, "proxy_mode": "fast", "evaluation_basis": "terminal_only"}}
{"event_id": "evt_1774167039215495235", "ts": 1774167039, "event": "training_heartbeat", "round": 68, "session_id": "019d1496-cd26-7b90-a74e-d93c12b3512b", "tier": "proxy", "run_name": "round0068_proxy_1774167009", "family_name": "lowrank_residual", "family_stage": "mainline", "status": null, "decision": null, "payload": {"tier": "proxy", "run_name": "round0068_proxy_1774167009", "family_name": "lowrank_residual", "family_stage": "mainline", "checkpoint_dir": "/root/sparsify-ascend/checkpoints/research_agent/round_0068_proxy/round0068_proxy_1774167009_dp2_bs1_ga8_ef16_k48_20260322_161015", "metrics_path": "/root/sparsify-ascend/checkpoints/research_agent/round_0068_proxy/round0068_proxy_1774167009_dp2_bs1_ga8_ef16_k48_20260322_161015/metrics.jsonl", "latest_step": 110, "latest_tokens_per_sec": 120143.5719776685, "baseline_ratio": 1.4473642975500771, "latest_total_tokens": 3604480.0, "proxy_mode": "fast", "evaluation_basis": "terminal_only"}}
{"event_id": "evt_1774167069216929361", "ts": 1774167069, "event": "training_heartbeat", "round": 68, "session_id": "019d1496-cd26-7b90-a74e-d93c12b3512b", "tier": "proxy", "run_name": "round0068_proxy_1774167009", "family_name": "lowrank_residual", "family_stage": "mainline", "status": null, "decision": null, "payload": {"tier": "proxy", "run_name": "round0068_proxy_1774167009", "family_name": "lowrank_residual", "family_stage": "mainline", "checkpoint_dir": "/root/sparsify-ascend/checkpoints/research_agent/round_0068_proxy/round0068_proxy_1774167009_dp2_bs1_ga8_ef16_k48_20260322_161015", "metrics_path": "/root/sparsify-ascend/checkpoints/research_agent/round_0068_proxy/round0068_proxy_1774167009_dp2_bs1_ga8_ef16_k48_20260322_161015/metrics.jsonl", "latest_step": 152, "latest_tokens_per_sec": 83008.30984139102, "baseline_ratio": 0.9999974371224415, "latest_total_tokens": 4980736.0, "proxy_mode": "fast", "evaluation_basis": "terminal_only"}}
{"event_id": "evt_1774167069282211795", "ts": 1774167069, "event": "training_finished", "round": 68, "session_id": "019d1496-cd26-7b90-a74e-d93c12b3512b", "tier": "proxy", "run_name": "round0068_proxy_1774167009", "family_name": "lowrank_residual", "family_stage": "mainline", "status": "ok", "decision": "incubate", "payload": {"tier": "proxy", "run_name": "round0068_proxy_1774167009", "family_name": "lowrank_residual", "family_stage": "mainline", "checkpoint_dir": "/root/sparsify-ascend/checkpoints/research_agent/round_0068_proxy/round0068_proxy_1774167009_dp2_bs1_ga8_ef16_k48_20260322_161015", "metrics_path": "/root/sparsify-ascend/checkpoints/research_agent/round_0068_proxy/round0068_proxy_1774167009_dp2_bs1_ga8_ef16_k48_20260322_161015/metrics.jsonl", "run_health": "normal", "termination_reason": "completed", "tokens_per_sec": 83008.30984139102, "baseline_ratio": 0.9999974371224415, "status": "ok", "decision": "incubate", "proxy_mode": "fast", "evaluation_basis": "terminal_only", "curve_start_fvu": 0.32637012004852295, "curve_mid_fvu": 0.21189990639686584, "curve_end_fvu": 0.1670444756746292, "curve_late_slope": -6.604207761307818e-09, "curve_still_improving": true}}
{"event_id": "evt_1774167069282262504", "ts": 1774167069, "event": "result_recorded", "round": 68, "session_id": "019d1496-cd26-7b90-a74e-d93c12b3512b", "tier": "proxy", "run_name": "round0068_proxy_1774167009", "family_name": "lowrank_residual", "family_stage": "mainline", "status": "ok", "decision": "incubate", "payload": {"tier": "proxy", "run_name": "round0068_proxy_1774167009", "family_name": "lowrank_residual", "family_stage": "mainline", "status": "ok", "decision": "incubate", "val_fvu": "0.16771421395242214", "observed_fvu": "0.167044", "k": "48", "log_path": "/root/sparsify-ascend/research/history/logs/proxy_1774167069.log", "checkpoint": null}}
{"event_id": "evt_1774167069282376638", "ts": 1774167069, "event": "round_finished", "round": 68, "session_id": "019d1496-cd26-7b90-a74e-d93c12b3512b", "tier": "proxy", "run_name": null, "family_name": "lowrank_residual", "family_stage": "mainline", "status": "ok", "decision": "incubate", "payload": {"tier": "proxy", "family_name": "lowrank_residual", "family_stage": "mainline", "status": "ok", "decision": "incubate", "val_fvu": "0.16771421395242214"}}
{"event_id": "evt_1774167069290386463", "ts": 1774167069, "event": "experiment_commit_prepared", "round": 68, "tier": "proxy", "run_name": null, "family_name": "lowrank_residual", "family_stage": "mainline", "status": "ok", "decision": "incubate", "payload": {"branch": "autoresearch-sae"}}
{"event_id": "evt_1774167076902951981", "ts": 1774167076, "event": "round_started", "round": 69, "session_id": "019d1496-cd26-7b90-a74e-d93c12b3512b", "tier": null, "run_name": null, "family_name": null, "family_stage": null, "status": "started", "decision": null, "payload": {"status": "started"}}
{"event_id": "evt_1774167076903091440", "ts": 1774167076, "event": "agent_deciding", "round": 69, "session_id": "019d1496-cd26-7b90-a74e-d93c12b3512b", "tier": null, "run_name": null, "family_name": null, "family_stage": null, "status": null, "decision": null, "payload": {}}
{"event_id": "evt_1774167230981159254", "ts": 1774167230, "event": "session_resumed", "round": 69, "tier": null, "run_name": null, "family_name": null, "family_stage": null, "status": "active", "decision": null, "payload": {"session_id": "019d1496-cd26-7b90-a74e-d93c12b3512b"}}
{"event_id": "evt_1774167230982346350", "ts": 1774167230, "event": "agent_action_received", "round": 69, "session_id": "019d1496-cd26-7b90-a74e-d93c12b3512b", "tier": "proxy", "run_name": null, "family_name": "batch_topk", "family_stage": "mainline_comparison", "status": null, "decision": null, "payload": {"session_id": "019d1496-cd26-7b90-a74e-d93c12b3512b", "tier": "proxy", "family_name": "batch_topk", "family_stage": "mainline_comparison", "change_type": "param_only", "expected_win": "quality_improve", "hypothesis": "After 19 no-improve rounds, continue the stagnation break with a genuinely different sparse mechanism while keeping the comparison target fixed. Run `batch_topk` at `K=48`, `EF=16` with the shared `signum`/`LR=1.6e-3`/`AUXK_ALPHA=0` recipe to test whether batch-level support allocation preserves more quality than the recent low-rank residual variants at the same lower-K operating point."}}
{"event_id": "evt_1774167230982533069", "ts": 1774167230, "event": "variable_isolation_warning", "round": 69, "session_id": "019d1496-cd26-7b90-a74e-d93c12b3512b", "tier": null, "run_name": null, "family_name": "batch_topk", "family_stage": "mainline_comparison", "status": null, "decision": null, "payload": {"violation": "Multiple primary variables changed simultaneously: architecture, k, lr"}}
{"event_id": "evt_1774167230982597133", "ts": 1774167230, "event": "proxy_mode_selected", "round": 69, "session_id": "019d1496-cd26-7b90-a74e-d93c12b3512b", "tier": "proxy", "run_name": null, "family_name": "batch_topk", "family_stage": "mainline_comparison", "status": null, "decision": null, "payload": {"tier": "proxy", "proxy_mode": "fast", "evaluation_basis": "terminal_only", "parameter_behavior": "structural", "proxy_max_tokens": "5000000"}}
