{"event_id": "evt_1774153087796020214", "ts": 1774153087, "event": "training_heartbeat", "round": 42, "session_id": "019d13ba-88bf-74b1-a101-245e7e501dd8", "tier": "full", "run_name": "round0042_full_1774152637", "family_name": "lowrank_gated_residual", "family_stage": "stabilize", "status": null, "decision": null, "payload": {"tier": "full", "run_name": "round0042_full_1774152637", "family_name": "lowrank_gated_residual", "family_stage": "stabilize", "checkpoint_dir": "/root/sparsify-ascend/checkpoints/research_agent/round_0042_full/round0042_full_1774152637_dp2_bs1_ga8_ef32_k96_20260322_121045", "metrics_path": "/root/sparsify-ascend/checkpoints/research_agent/round_0042_full/round0042_full_1774152637_dp2_bs1_ga8_ef32_k96_20260322_121045/metrics.jsonl", "latest_step": 1110, "latest_tokens_per_sec": 80792.49767850424, "baseline_ratio": 0.9108962838903958, "latest_total_tokens": 36372480.0, "proxy_mode": null, "evaluation_basis": null}}
{"event_id": "evt_1774153117803355364", "ts": 1774153117, "event": "training_heartbeat", "round": 42, "session_id": "019d13ba-88bf-74b1-a101-245e7e501dd8", "tier": "full", "run_name": "round0042_full_1774152637", "family_name": "lowrank_gated_residual", "family_stage": "stabilize", "status": null, "decision": null, "payload": {"tier": "full", "run_name": "round0042_full_1774152637", "family_name": "lowrank_gated_residual", "family_stage": "stabilize", "checkpoint_dir": "/root/sparsify-ascend/checkpoints/research_agent/round_0042_full/round0042_full_1774152637_dp2_bs1_ga8_ef32_k96_20260322_121045", "metrics_path": "/root/sparsify-ascend/checkpoints/research_agent/round_0042_full/round0042_full_1774152637_dp2_bs1_ga8_ef32_k96_20260322_121045/metrics.jsonl", "latest_step": 1190, "latest_tokens_per_sec": 81198.34964140272, "baseline_ratio": 0.9154720682198386, "latest_total_tokens": 38993920.0, "proxy_mode": null, "evaluation_basis": null}}
{"event_id": "evt_1774153148006524711", "ts": 1774153148, "event": "training_heartbeat", "round": 42, "session_id": "019d13ba-88bf-74b1-a101-245e7e501dd8", "tier": "full", "run_name": "round0042_full_1774152637", "family_name": "lowrank_gated_residual", "family_stage": "stabilize", "status": null, "decision": null, "payload": {"tier": "full", "run_name": "round0042_full_1774152637", "family_name": "lowrank_gated_residual", "family_stage": "stabilize", "checkpoint_dir": "/root/sparsify-ascend/checkpoints/research_agent/round_0042_full/round0042_full_1774152637_dp2_bs1_ga8_ef32_k96_20260322_121045", "metrics_path": "/root/sparsify-ascend/checkpoints/research_agent/round_0042_full/round0042_full_1774152637_dp2_bs1_ga8_ef32_k96_20260322_121045/metrics.jsonl", "latest_step": 1220, "latest_tokens_per_sec": 78349.65002634276, "baseline_ratio": 0.8833543596721487, "latest_total_tokens": 39976960.0, "proxy_mode": null, "evaluation_basis": null}}
{"event_id": "evt_1774153178014089229", "ts": 1774153178, "event": "training_heartbeat", "round": 42, "session_id": "019d13ba-88bf-74b1-a101-245e7e501dd8", "tier": "full", "run_name": "round0042_full_1774152637", "family_name": "lowrank_gated_residual", "family_stage": "stabilize", "status": null, "decision": null, "payload": {"tier": "full", "run_name": "round0042_full_1774152637", "family_name": "lowrank_gated_residual", "family_stage": "stabilize", "checkpoint_dir": "/root/sparsify-ascend/checkpoints/research_agent/round_0042_full/round0042_full_1774152637_dp2_bs1_ga8_ef32_k96_20260322_121045", "metrics_path": "/root/sparsify-ascend/checkpoints/research_agent/round_0042_full/round0042_full_1774152637_dp2_bs1_ga8_ef32_k96_20260322_121045/metrics.jsonl", "latest_step": 1220, "latest_tokens_per_sec": 73970.97364575315, "baseline_ratio": 0.833986904053817, "latest_total_tokens": 39976960.0, "proxy_mode": null, "evaluation_basis": null}}
{"event_id": "evt_1774153208021489347", "ts": 1774153208, "event": "training_heartbeat", "round": 42, "session_id": "019d13ba-88bf-74b1-a101-245e7e501dd8", "tier": "full", "run_name": "round0042_full_1774152637", "family_name": "lowrank_gated_residual", "family_stage": "stabilize", "status": null, "decision": null, "payload": {"tier": "full", "run_name": "round0042_full_1774152637", "family_name": "lowrank_gated_residual", "family_stage": "stabilize", "checkpoint_dir": "/root/sparsify-ascend/checkpoints/research_agent/round_0042_full/round0042_full_1774152637_dp2_bs1_ga8_ef32_k96_20260322_121045", "metrics_path": "/root/sparsify-ascend/checkpoints/research_agent/round_0042_full/round0042_full_1774152637_dp2_bs1_ga8_ef32_k96_20260322_121045/metrics.jsonl", "latest_step": 1220, "latest_tokens_per_sec": 70079.86562268346, "baseline_ratio": 0.7901165455394111, "latest_total_tokens": 39976960.0, "proxy_mode": null, "evaluation_basis": null}}
{"event_id": "evt_1774153238028923884", "ts": 1774153238, "event": "training_heartbeat", "round": 42, "session_id": "019d13ba-88bf-74b1-a101-245e7e501dd8", "tier": "full", "run_name": "round0042_full_1774152637", "family_name": "lowrank_gated_residual", "family_stage": "stabilize", "status": null, "decision": null, "payload": {"tier": "full", "run_name": "round0042_full_1774152637", "family_name": "lowrank_gated_residual", "family_stage": "stabilize", "checkpoint_dir": "/root/sparsify-ascend/checkpoints/research_agent/round_0042_full/round0042_full_1774152637_dp2_bs1_ga8_ef32_k96_20260322_121045", "metrics_path": "/root/sparsify-ascend/checkpoints/research_agent/round_0042_full/round0042_full_1774152637_dp2_bs1_ga8_ef32_k96_20260322_121045/metrics.jsonl", "latest_step": 1220, "latest_tokens_per_sec": 66577.66614893328, "baseline_ratio": 0.7506309425719624, "latest_total_tokens": 39976960.0, "proxy_mode": null, "evaluation_basis": null}}
{"event_id": "evt_1774153268036333951", "ts": 1774153268, "event": "training_heartbeat", "round": 42, "session_id": "019d13ba-88bf-74b1-a101-245e7e501dd8", "tier": "full", "run_name": "round0042_full_1774152637", "family_name": "lowrank_gated_residual", "family_stage": "stabilize", "status": null, "decision": null, "payload": {"tier": "full", "run_name": "round0042_full_1774152637", "family_name": "lowrank_gated_residual", "family_stage": "stabilize", "checkpoint_dir": "/root/sparsify-ascend/checkpoints/research_agent/round_0042_full/round0042_full_1774152637_dp2_bs1_ga8_ef32_k96_20260322_121045", "metrics_path": "/root/sparsify-ascend/checkpoints/research_agent/round_0042_full/round0042_full_1774152637_dp2_bs1_ga8_ef32_k96_20260322_121045/metrics.jsonl", "latest_step": 1220, "latest_tokens_per_sec": 63408.84911193889, "baseline_ratio": 0.7149040651233557, "latest_total_tokens": 39976960.0, "proxy_mode": null, "evaluation_basis": null}}
{"event_id": "evt_1774153298043763011", "ts": 1774153298, "event": "training_heartbeat", "round": 42, "session_id": "019d13ba-88bf-74b1-a101-245e7e501dd8", "tier": "full", "run_name": "round0042_full_1774152637", "family_name": "lowrank_gated_residual", "family_stage": "stabilize", "status": null, "decision": null, "payload": {"tier": "full", "run_name": "round0042_full_1774152637", "family_name": "lowrank_gated_residual", "family_stage": "stabilize", "checkpoint_dir": "/root/sparsify-ascend/checkpoints/research_agent/round_0042_full/round0042_full_1774152637_dp2_bs1_ga8_ef32_k96_20260322_121045", "metrics_path": "/root/sparsify-ascend/checkpoints/research_agent/round_0042_full/round0042_full_1774152637_dp2_bs1_ga8_ef32_k96_20260322_121045/metrics.jsonl", "latest_step": 1220, "latest_tokens_per_sec": 60527.96948143349, "baseline_ratio": 0.6824235424861517, "latest_total_tokens": 39976960.0, "proxy_mode": null, "evaluation_basis": null}}
{"event_id": "evt_1774153328051253615", "ts": 1774153328, "event": "training_heartbeat", "round": 42, "session_id": "019d13ba-88bf-74b1-a101-245e7e501dd8", "tier": "full", "run_name": "round0042_full_1774152637", "family_name": "lowrank_gated_residual", "family_stage": "stabilize", "status": null, "decision": null, "payload": {"tier": "full", "run_name": "round0042_full_1774152637", "family_name": "lowrank_gated_residual", "family_stage": "stabilize", "checkpoint_dir": "/root/sparsify-ascend/checkpoints/research_agent/round_0042_full/round0042_full_1774152637_dp2_bs1_ga8_ef32_k96_20260322_121045", "metrics_path": "/root/sparsify-ascend/checkpoints/research_agent/round_0042_full/round0042_full_1774152637_dp2_bs1_ga8_ef32_k96_20260322_121045/metrics.jsonl", "latest_step": 1220, "latest_tokens_per_sec": 57897.48519386111, "baseline_ratio": 0.6527661060752056, "latest_total_tokens": 39976960.0, "proxy_mode": null, "evaluation_basis": null}}
{"event_id": "evt_1774153328128244889", "ts": 1774153328, "event": "training_finished", "round": 42, "session_id": "019d13ba-88bf-74b1-a101-245e7e501dd8", "tier": "full", "run_name": "round0042_full_1774152637", "family_name": "lowrank_gated_residual", "family_stage": "stabilize", "status": "ok", "decision": "keep", "payload": {"tier": "full", "run_name": "round0042_full_1774152637", "family_name": "lowrank_gated_residual", "family_stage": "stabilize", "checkpoint_dir": "/root/sparsify-ascend/checkpoints/research_agent/round_0042_full/round0042_full_1774152637_dp2_bs1_ga8_ef32_k96_20260322_121045", "metrics_path": "/root/sparsify-ascend/checkpoints/research_agent/round_0042_full/round0042_full_1774152637_dp2_bs1_ga8_ef32_k96_20260322_121045/metrics.jsonl", "run_health": "normal", "termination_reason": "completed", "tokens_per_sec": 57897.48519386111, "baseline_ratio": 0.6527661060752056, "status": "ok", "decision": "keep", "proxy_mode": null, "evaluation_basis": null, "curve_start_fvu": 0.10673820227384567, "curve_mid_fvu": 0.09034253656864166, "curve_end_fvu": 0.07144095748662949, "curve_late_slope": -1.2051084356288975e-09, "curve_still_improving": true}}
{"event_id": "evt_1774153328128300103", "ts": 1774153328, "event": "result_recorded", "round": 42, "session_id": "019d13ba-88bf-74b1-a101-245e7e501dd8", "tier": "full", "run_name": "round0042_full_1774152637", "family_name": "lowrank_gated_residual", "family_stage": "stabilize", "status": "ok", "decision": "keep", "payload": {"tier": "full", "run_name": "round0042_full_1774152637", "family_name": "lowrank_gated_residual", "family_stage": "stabilize", "status": "ok", "decision": "keep", "val_fvu": "0.07289826218038797", "observed_fvu": "0.071441", "k": "96", "log_path": "/root/sparsify-ascend/research/history/logs/full_1774153328.log", "checkpoint": null}}
{"event_id": "evt_1774153328128884882", "ts": 1774153328, "event": "round_finished", "round": 42, "session_id": "019d13ba-88bf-74b1-a101-245e7e501dd8", "tier": "full", "run_name": null, "family_name": "lowrank_gated_residual", "family_stage": "stabilize", "status": "ok", "decision": "keep", "payload": {"tier": "full", "family_name": "lowrank_gated_residual", "family_stage": "stabilize", "status": "ok", "decision": "keep", "val_fvu": "0.07289826218038797"}}
{"event_id": "evt_1774153328136071988", "ts": 1774153328, "event": "experiment_commit_prepared", "round": 42, "tier": "full", "run_name": null, "family_name": "lowrank_gated_residual", "family_stage": "stabilize", "status": "ok", "decision": "keep", "payload": {"branch": "autoresearch-sae"}}
{"event_id": "evt_1774154343355745103", "ts": 1774154343, "event": "hint_added", "round": null, "tier": null, "run_name": null, "family_name": null, "family_stage": null, "status": "pending", "decision": null, "payload": {"id": "hint_1774154343", "message": "K reduction is the top priority. Do not trade away lower-K exploration for easier large-EF wins.", "priority": "high", "scope": "persistent", "tag": "k_priority", "status": "pending", "created_at": 1774154343, "applied_at": null}}
{"event_id": "evt_1774154343456446323", "ts": 1774154343, "event": "hint_added", "round": null, "tier": null, "run_name": null, "family_name": null, "family_stage": null, "status": "pending", "decision": null, "payload": {"id": "hint_1774154343", "message": "Treat expansion_factor as a capacity axis, not a neutral hyperparameter. Do not claim an architecture win from cross-EF comparisons alone; prefer same-EF architecture comparisons first.", "priority": "high", "scope": "persistent", "tag": "ef_fairness", "status": "pending", "created_at": 1774154343, "applied_at": null}}
{"event_id": "evt_1774154343557312394", "ts": 1774154343, "event": "hint_added", "round": null, "tier": null, "run_name": null, "family_name": null, "family_stage": null, "status": "pending", "decision": null, "payload": {"id": "hint_1774154343", "message": "Use EF=8 as the default starting point for a new family or refreshed architecture comparison. Aim for the lowest practical FVU with the smallest feasible EF, and prefer EF {4,8,12} before moving upward unless evidence strongly justifies it.", "priority": "high", "scope": "persistent", "tag": "ef_small_first", "status": "pending", "created_at": 1774154343, "applied_at": null}}
{"event_id": "evt_1774154590527285079", "ts": 1774154590, "event": "loop_started", "round": null, "tier": null, "run_name": null, "family_name": null, "family_stage": null, "status": null, "decision": null, "payload": {"rounds": 200, "budget_hours": 10.0}}
{"event_id": "evt_1774154590532453053", "ts": 1774154590, "event": "research_branch_ready", "round": null, "tier": null, "run_name": null, "family_name": null, "family_stage": null, "status": "ready", "decision": null, "payload": {"branch": "autoresearch-sae", "base_branch": "autoresearch-sae", "base_commit": "04a0603ba261d372b5dc5e8d3c9746c5cebe46f2"}}
{"event_id": "evt_1774154590533323759", "ts": 1774154590, "event": "round_started", "round": 43, "session_id": null, "tier": null, "run_name": null, "family_name": null, "family_stage": null, "status": "started", "decision": null, "payload": {"status": "started"}}
{"event_id": "evt_1774154590534076709", "ts": 1774154590, "event": "agent_deciding", "round": 43, "session_id": null, "tier": null, "run_name": null, "family_name": null, "family_stage": null, "status": null, "decision": null, "payload": {}}
{"event_id": "evt_1774154757288914308", "ts": 1774154757, "event": "session_started", "round": 43, "tier": null, "run_name": null, "family_name": null, "family_stage": null, "status": "active", "decision": null, "payload": {"session_id": "019d13dc-400c-7493-83af-bd34fffa7466"}}
{"event_id": "evt_1774154757289578013", "ts": 1774154757, "event": "agent_action_received", "round": 43, "session_id": "019d13dc-400c-7493-83af-bd34fffa7466", "tier": "proxy", "run_name": null, "family_name": "lowrank_gated_residual", "family_stage": "mainline", "status": null, "decision": null, "payload": {"session_id": "019d13dc-400c-7493-83af-bd34fffa7466", "tier": "proxy", "family_name": "lowrank_gated_residual", "family_stage": "mainline", "change_type": "param_only", "expected_win": "smaller_k", "hypothesis": "`lowrank_gated_residual` has already shown that quality degrades smoothly between `K=128` and `K=64`, with the new `K=96` point landing much closer to the anchor than to the lower-K regime. A proxy run at `K=80` on the same proven recipe is the cleanest next Pareto probe: it prioritizes lower-K exploration, keeps expansion factor fixed for a fair within-family comparison, and can reveal a new non-dominated tradeoff between the existing `K=64` and `K=96` frontier points."}}
{"event_id": "evt_1774154757289728555", "ts": 1774154757, "event": "proxy_mode_selected", "round": 43, "session_id": "019d13dc-400c-7493-83af-bd34fffa7466", "tier": "proxy", "run_name": null, "family_name": "lowrank_gated_residual", "family_stage": "mainline", "status": null, "decision": null, "payload": {"tier": "proxy", "proxy_mode": "fast", "evaluation_basis": "terminal_only", "parameter_behavior": "structural", "proxy_max_tokens": "5000000"}}
{"event_id": "evt_1774154757290007035", "ts": 1774154757, "event": "training_started", "round": 43, "session_id": "019d13dc-400c-7493-83af-bd34fffa7466", "tier": "proxy", "run_name": "round0043_proxy_1774154757", "family_name": "lowrank_gated_residual", "family_stage": "mainline", "status": null, "decision": null, "payload": {"tier": "proxy", "run_name": "round0043_proxy_1774154757", "family_name": "lowrank_gated_residual", "family_stage": "mainline", "checkpoint_dir": "/root/sparsify-ascend/checkpoints/research_agent/round_0043_proxy", "log_path": "/root/sparsify-ascend/research/history/logs/round0043_proxy_1774154757.log", "config": {"architecture": "lowrank_gated_residual", "expansion_factor": 32, "k": 80, "optimizer": "signum", "lr": "1.6e-3", "hookpoints": "layers.[3].self_attn.o_proj", "batch_size": 1, "grad_acc_steps": 8, "micro_acc_steps": 1, "auxk_alpha": 0.0, "dead_feature_threshold": 10000000, "use_hadamard": false, "tier": "proxy", "family_name": "lowrank_gated_residual", "family_stage": "mainline"}, "baseline_tokens_per_sec": 83008.58788873068, "proxy_mode": "fast", "evaluation_basis": "terminal_only"}}
{"event_id": "evt_1774154787291208164", "ts": 1774154787, "event": "training_heartbeat", "round": 43, "session_id": "019d13dc-400c-7493-83af-bd34fffa7466", "tier": "proxy", "run_name": "round0043_proxy_1774154757", "family_name": "lowrank_gated_residual", "family_stage": "mainline", "status": null, "decision": null, "payload": {"tier": "proxy", "run_name": "round0043_proxy_1774154757", "family_name": "lowrank_gated_residual", "family_stage": "mainline", "checkpoint_dir": "/root/sparsify-ascend/checkpoints/research_agent/round_0043_proxy/round0043_proxy_1774154757_dp2_bs1_ga8_ef32_k80_20260322_124607", "metrics_path": "/root/sparsify-ascend/checkpoints/research_agent/round_0043_proxy/round0043_proxy_1774154757_dp2_bs1_ga8_ef32_k80_20260322_124607/metrics.jsonl", "latest_step": 30, "latest_tokens_per_sec": 32766.991697694037, "baseline_ratio": 0.39474218910477954, "latest_total_tokens": 983040.0, "proxy_mode": "fast", "evaluation_basis": "terminal_only"}}
{"event_id": "evt_1774154817292366013", "ts": 1774154817, "event": "training_heartbeat", "round": 43, "session_id": "019d13dc-400c-7493-83af-bd34fffa7466", "tier": "proxy", "run_name": "round0043_proxy_1774154757", "family_name": "lowrank_gated_residual", "family_stage": "mainline", "status": null, "decision": null, "payload": {"tier": "proxy", "run_name": "round0043_proxy_1774154757", "family_name": "lowrank_gated_residual", "family_stage": "mainline", "checkpoint_dir": "/root/sparsify-ascend/checkpoints/research_agent/round_0043_proxy/round0043_proxy_1774154757_dp2_bs1_ga8_ef32_k80_20260322_124607", "metrics_path": "/root/sparsify-ascend/checkpoints/research_agent/round_0043_proxy/round0043_proxy_1774154757_dp2_bs1_ga8_ef32_k80_20260322_124607/metrics.jsonl", "latest_step": 110, "latest_tokens_per_sec": 60072.58132239011, "baseline_ratio": 0.7236911607617604, "latest_total_tokens": 3604480.0, "proxy_mode": "fast", "evaluation_basis": "terminal_only"}}
{"event_id": "evt_1774154847422892867", "ts": 1774154847, "event": "training_heartbeat", "round": 43, "session_id": "019d13dc-400c-7493-83af-bd34fffa7466", "tier": "proxy", "run_name": "round0043_proxy_1774154757", "family_name": "lowrank_gated_residual", "family_stage": "mainline", "status": null, "decision": null, "payload": {"tier": "proxy", "run_name": "round0043_proxy_1774154757", "family_name": "lowrank_gated_residual", "family_stage": "mainline", "checkpoint_dir": "/root/sparsify-ascend/checkpoints/research_agent/round_0043_proxy/round0043_proxy_1774154757_dp2_bs1_ga8_ef32_k80_20260322_124607", "metrics_path": "/root/sparsify-ascend/checkpoints/research_agent/round_0043_proxy/round0043_proxy_1774154757_dp2_bs1_ga8_ef32_k80_20260322_124607/metrics.jsonl", "latest_step": 152, "latest_tokens_per_sec": 55339.33704528707, "baseline_ratio": 0.6666700211725923, "latest_total_tokens": 4980736.0, "proxy_mode": "fast", "evaluation_basis": "terminal_only"}}
{"event_id": "evt_1774154848372640690", "ts": 1774154848, "event": "training_finished", "round": 43, "session_id": "019d13dc-400c-7493-83af-bd34fffa7466", "tier": "proxy", "run_name": "round0043_proxy_1774154757", "family_name": "lowrank_gated_residual", "family_stage": "mainline", "status": "ok", "decision": "promote", "payload": {"tier": "proxy", "run_name": "round0043_proxy_1774154757", "family_name": "lowrank_gated_residual", "family_stage": "mainline", "checkpoint_dir": "/root/sparsify-ascend/checkpoints/research_agent/round_0043_proxy/round0043_proxy_1774154757_dp2_bs1_ga8_ef32_k80_20260322_124607", "metrics_path": "/root/sparsify-ascend/checkpoints/research_agent/round_0043_proxy/round0043_proxy_1774154757_dp2_bs1_ga8_ef32_k80_20260322_124607/metrics.jsonl", "run_health": "normal", "termination_reason": "completed", "tokens_per_sec": 55339.33704528707, "baseline_ratio": 0.6666700211725923, "status": "ok", "decision": "promote", "proxy_mode": "fast", "evaluation_basis": "terminal_only", "curve_start_fvu": 0.2824327349662781, "curve_mid_fvu": 0.1847665011882782, "curve_end_fvu": 0.14575672149658203, "curve_late_slope": -5.984739184514769e-09, "curve_still_improving": true}}
{"event_id": "evt_1774154848372764054", "ts": 1774154848, "event": "result_recorded", "round": 43, "session_id": "019d13dc-400c-7493-83af-bd34fffa7466", "tier": "proxy", "run_name": "round0043_proxy_1774154757", "family_name": "lowrank_gated_residual", "family_stage": "mainline", "status": "ok", "decision": "promote", "payload": {"tier": "proxy", "run_name": "round0043_proxy_1774154757", "family_name": "lowrank_gated_residual", "family_stage": "mainline", "status": "ok", "decision": "promote", "val_fvu": "0.14660699106752872", "observed_fvu": "0.145757", "k": "80", "log_path": "/root/sparsify-ascend/research/history/logs/proxy_1774154847.log", "checkpoint": null}}
