{"event_id": "evt_1774136642193021453", "ts": 1774136642, "event": "training_heartbeat", "round": 13, "session_id": "019d1279-dd8d-73d2-97df-ff57e75146ab", "tier": "proxy", "run_name": "round0013_proxy_1774136191", "family_name": "multi_branch_gated", "family_stage": "stabilize", "status": null, "decision": null, "payload": {"tier": "proxy", "run_name": "round0013_proxy_1774136191", "family_name": "multi_branch_gated", "family_stage": "stabilize", "checkpoint_dir": "/root/sparsify-ascend/checkpoints/research_agent/round_0013_proxy/round0013_proxy_1774136191_dp2_bs1_ga8_ef16_k128_20260322_073638", "metrics_path": "/root/sparsify-ascend/checkpoints/research_agent/round_0013_proxy/round0013_proxy_1774136191_dp2_bs1_ga8_ef16_k128_20260322_073638/metrics.jsonl", "latest_step": 990, "latest_tokens_per_sec": 72080.57998291324, "baseline_ratio": 1.082762574426553, "latest_total_tokens": 32440320.0, "proxy_mode": "fast", "evaluation_basis": "terminal_only"}}
{"event_id": "evt_1774136672276777692", "ts": 1774136672, "event": "training_heartbeat", "round": 13, "session_id": "019d1279-dd8d-73d2-97df-ff57e75146ab", "tier": "proxy", "run_name": "round0013_proxy_1774136191", "family_name": "multi_branch_gated", "family_stage": "stabilize", "status": null, "decision": null, "payload": {"tier": "proxy", "run_name": "round0013_proxy_1774136191", "family_name": "multi_branch_gated", "family_stage": "stabilize", "checkpoint_dir": "/root/sparsify-ascend/checkpoints/research_agent/round_0013_proxy/round0013_proxy_1774136191_dp2_bs1_ga8_ef16_k128_20260322_073638", "metrics_path": "/root/sparsify-ascend/checkpoints/research_agent/round_0013_proxy/round0013_proxy_1774136191_dp2_bs1_ga8_ef16_k128_20260322_073638/metrics.jsonl", "latest_step": 1050, "latest_tokens_per_sec": 71644.78702132111, "baseline_ratio": 1.0762162854105335, "latest_total_tokens": 34406400.0, "proxy_mode": "fast", "evaluation_basis": "terminal_only"}}
{"event_id": "evt_1774136702422598388", "ts": 1774136702, "event": "training_heartbeat", "round": 13, "session_id": "019d1279-dd8d-73d2-97df-ff57e75146ab", "tier": "proxy", "run_name": "round0013_proxy_1774136191", "family_name": "multi_branch_gated", "family_stage": "stabilize", "status": null, "decision": null, "payload": {"tier": "proxy", "run_name": "round0013_proxy_1774136191", "family_name": "multi_branch_gated", "family_stage": "stabilize", "checkpoint_dir": "/root/sparsify-ascend/checkpoints/research_agent/round_0013_proxy/round0013_proxy_1774136191_dp2_bs1_ga8_ef16_k128_20260322_073638", "metrics_path": "/root/sparsify-ascend/checkpoints/research_agent/round_0013_proxy/round0013_proxy_1774136191_dp2_bs1_ga8_ef16_k128_20260322_073638/metrics.jsonl", "latest_step": 1120, "latest_tokens_per_sec": 71915.96512759641, "baseline_ratio": 1.080289802917584, "latest_total_tokens": 36700160.0, "proxy_mode": "fast", "evaluation_basis": "terminal_only"}}
{"event_id": "evt_1774136732429910756", "ts": 1774136732, "event": "training_heartbeat", "round": 13, "session_id": "019d1279-dd8d-73d2-97df-ff57e75146ab", "tier": "proxy", "run_name": "round0013_proxy_1774136191", "family_name": "multi_branch_gated", "family_stage": "stabilize", "status": null, "decision": null, "payload": {"tier": "proxy", "run_name": "round0013_proxy_1774136191", "family_name": "multi_branch_gated", "family_stage": "stabilize", "checkpoint_dir": "/root/sparsify-ascend/checkpoints/research_agent/round_0013_proxy/round0013_proxy_1774136191_dp2_bs1_ga8_ef16_k128_20260322_073638", "metrics_path": "/root/sparsify-ascend/checkpoints/research_agent/round_0013_proxy/round0013_proxy_1774136191_dp2_bs1_ga8_ef16_k128_20260322_073638/metrics.jsonl", "latest_step": 1190, "latest_tokens_per_sec": 72148.65750083378, "baseline_ratio": 1.083785204774168, "latest_total_tokens": 38993920.0, "proxy_mode": "fast", "evaluation_basis": "terminal_only"}}
{"event_id": "evt_1774136762614129943", "ts": 1774136762, "event": "training_heartbeat", "round": 13, "session_id": "019d1279-dd8d-73d2-97df-ff57e75146ab", "tier": "proxy", "run_name": "round0013_proxy_1774136191", "family_name": "multi_branch_gated", "family_stage": "stabilize", "status": null, "decision": null, "payload": {"tier": "proxy", "run_name": "round0013_proxy_1774136191", "family_name": "multi_branch_gated", "family_stage": "stabilize", "checkpoint_dir": "/root/sparsify-ascend/checkpoints/research_agent/round_0013_proxy/round0013_proxy_1774136191_dp2_bs1_ga8_ef16_k128_20260322_073638", "metrics_path": "/root/sparsify-ascend/checkpoints/research_agent/round_0013_proxy/round0013_proxy_1774136191_dp2_bs1_ga8_ef16_k128_20260322_073638/metrics.jsonl", "latest_step": 1220, "latest_tokens_per_sec": 70076.77152307954, "baseline_ratio": 1.0526622504954533, "latest_total_tokens": 39976960.0, "proxy_mode": "fast", "evaluation_basis": "terminal_only"}}
{"event_id": "evt_1774136792621681454", "ts": 1774136792, "event": "training_heartbeat", "round": 13, "session_id": "019d1279-dd8d-73d2-97df-ff57e75146ab", "tier": "proxy", "run_name": "round0013_proxy_1774136191", "family_name": "multi_branch_gated", "family_stage": "stabilize", "status": null, "decision": null, "payload": {"tier": "proxy", "run_name": "round0013_proxy_1774136191", "family_name": "multi_branch_gated", "family_stage": "stabilize", "checkpoint_dir": "/root/sparsify-ascend/checkpoints/research_agent/round_0013_proxy/round0013_proxy_1774136191_dp2_bs1_ga8_ef16_k128_20260322_073638", "metrics_path": "/root/sparsify-ascend/checkpoints/research_agent/round_0013_proxy/round0013_proxy_1774136191_dp2_bs1_ga8_ef16_k128_20260322_073638/metrics.jsonl", "latest_step": 1220, "latest_tokens_per_sec": 66555.2695234623, "baseline_ratio": 0.9997638058400732, "latest_total_tokens": 39976960.0, "proxy_mode": "fast", "evaluation_basis": "terminal_only"}}
{"event_id": "evt_1774136822629247432", "ts": 1774136822, "event": "training_heartbeat", "round": 13, "session_id": "019d1279-dd8d-73d2-97df-ff57e75146ab", "tier": "proxy", "run_name": "round0013_proxy_1774136191", "family_name": "multi_branch_gated", "family_stage": "stabilize", "status": null, "decision": null, "payload": {"tier": "proxy", "run_name": "round0013_proxy_1774136191", "family_name": "multi_branch_gated", "family_stage": "stabilize", "checkpoint_dir": "/root/sparsify-ascend/checkpoints/research_agent/round_0013_proxy/round0013_proxy_1774136191_dp2_bs1_ga8_ef16_k128_20260322_073638", "metrics_path": "/root/sparsify-ascend/checkpoints/research_agent/round_0013_proxy/round0013_proxy_1774136191_dp2_bs1_ga8_ef16_k128_20260322_073638/metrics.jsonl", "latest_step": 1220, "latest_tokens_per_sec": 63388.51755529847, "baseline_ratio": 0.9521942591683868, "latest_total_tokens": 39976960.0, "proxy_mode": "fast", "evaluation_basis": "terminal_only"}}
{"event_id": "evt_1774136852636710042", "ts": 1774136852, "event": "training_heartbeat", "round": 13, "session_id": "019d1279-dd8d-73d2-97df-ff57e75146ab", "tier": "proxy", "run_name": "round0013_proxy_1774136191", "family_name": "multi_branch_gated", "family_stage": "stabilize", "status": null, "decision": null, "payload": {"tier": "proxy", "run_name": "round0013_proxy_1774136191", "family_name": "multi_branch_gated", "family_stage": "stabilize", "checkpoint_dir": "/root/sparsify-ascend/checkpoints/research_agent/round_0013_proxy/round0013_proxy_1774136191_dp2_bs1_ga8_ef16_k128_20260322_073638", "metrics_path": "/root/sparsify-ascend/checkpoints/research_agent/round_0013_proxy/round0013_proxy_1774136191_dp2_bs1_ga8_ef16_k128_20260322_073638/metrics.jsonl", "latest_step": 1220, "latest_tokens_per_sec": 60509.44046428655, "baseline_ratio": 0.9089460371954843, "latest_total_tokens": 39976960.0, "proxy_mode": "fast", "evaluation_basis": "terminal_only"}}
{"event_id": "evt_1774136882644142351", "ts": 1774136882, "event": "training_heartbeat", "round": 13, "session_id": "019d1279-dd8d-73d2-97df-ff57e75146ab", "tier": "proxy", "run_name": "round0013_proxy_1774136191", "family_name": "multi_branch_gated", "family_stage": "stabilize", "status": null, "decision": null, "payload": {"tier": "proxy", "run_name": "round0013_proxy_1774136191", "family_name": "multi_branch_gated", "family_stage": "stabilize", "checkpoint_dir": "/root/sparsify-ascend/checkpoints/research_agent/round_0013_proxy/round0013_proxy_1774136191_dp2_bs1_ga8_ef16_k128_20260322_073638", "metrics_path": "/root/sparsify-ascend/checkpoints/research_agent/round_0013_proxy/round0013_proxy_1774136191_dp2_bs1_ga8_ef16_k128_20260322_073638/metrics.jsonl", "latest_step": 1220, "latest_tokens_per_sec": 57880.53513669337, "baseline_ratio": 0.8694557847432534, "latest_total_tokens": 39976960.0, "proxy_mode": "fast", "evaluation_basis": "terminal_only"}}
{"event_id": "evt_1774136912651606709", "ts": 1774136912, "event": "training_heartbeat", "round": 13, "session_id": "019d1279-dd8d-73d2-97df-ff57e75146ab", "tier": "proxy", "run_name": "round0013_proxy_1774136191", "family_name": "multi_branch_gated", "family_stage": "stabilize", "status": null, "decision": null, "payload": {"tier": "proxy", "run_name": "round0013_proxy_1774136191", "family_name": "multi_branch_gated", "family_stage": "stabilize", "checkpoint_dir": "/root/sparsify-ascend/checkpoints/research_agent/round_0013_proxy/round0013_proxy_1774136191_dp2_bs1_ga8_ef16_k128_20260322_073638", "metrics_path": "/root/sparsify-ascend/checkpoints/research_agent/round_0013_proxy/round0013_proxy_1774136191_dp2_bs1_ga8_ef16_k128_20260322_073638/metrics.jsonl", "latest_step": 1220, "latest_tokens_per_sec": 55470.548897710905, "baseline_ratio": 0.8332540379610855, "latest_total_tokens": 39976960.0, "proxy_mode": "fast", "evaluation_basis": "terminal_only"}}
{"event_id": "evt_1774136942659123220", "ts": 1774136942, "event": "training_heartbeat", "round": 13, "session_id": "019d1279-dd8d-73d2-97df-ff57e75146ab", "tier": "proxy", "run_name": "round0013_proxy_1774136191", "family_name": "multi_branch_gated", "family_stage": "stabilize", "status": null, "decision": null, "payload": {"tier": "proxy", "run_name": "round0013_proxy_1774136191", "family_name": "multi_branch_gated", "family_stage": "stabilize", "checkpoint_dir": "/root/sparsify-ascend/checkpoints/research_agent/round_0013_proxy/round0013_proxy_1774136191_dp2_bs1_ga8_ef16_k128_20260322_073638", "metrics_path": "/root/sparsify-ascend/checkpoints/research_agent/round_0013_proxy/round0013_proxy_1774136191_dp2_bs1_ga8_ef16_k128_20260322_073638/metrics.jsonl", "latest_step": 1220, "latest_tokens_per_sec": 53253.22781593582, "baseline_ratio": 0.7999464219096861, "latest_total_tokens": 39976960.0, "proxy_mode": "fast", "evaluation_basis": "terminal_only"}}
{"event_id": "evt_1774136942735563745", "ts": 1774136942, "event": "training_finished", "round": 13, "session_id": "019d1279-dd8d-73d2-97df-ff57e75146ab", "tier": "proxy", "run_name": "round0013_proxy_1774136191", "family_name": "multi_branch_gated", "family_stage": "stabilize", "status": "ok", "decision": "incubate", "payload": {"tier": "proxy", "run_name": "round0013_proxy_1774136191", "family_name": "multi_branch_gated", "family_stage": "stabilize", "checkpoint_dir": "/root/sparsify-ascend/checkpoints/research_agent/round_0013_proxy/round0013_proxy_1774136191_dp2_bs1_ga8_ef16_k128_20260322_073638", "metrics_path": "/root/sparsify-ascend/checkpoints/research_agent/round_0013_proxy/round0013_proxy_1774136191_dp2_bs1_ga8_ef16_k128_20260322_073638/metrics.jsonl", "run_health": "normal", "termination_reason": "completed", "tokens_per_sec": 53253.22781593582, "baseline_ratio": 0.7999464219096861, "status": "ok", "decision": "incubate", "proxy_mode": "fast", "evaluation_basis": "terminal_only", "curve_start_fvu": 0.21543386578559875, "curve_mid_fvu": 0.18599863350391388, "curve_end_fvu": 0.1534861922264099, "curve_late_slope": -2.1941037839049567e-09, "curve_still_improving": true}}
{"event_id": "evt_1774136942735618785", "ts": 1774136942, "event": "result_recorded", "round": 13, "session_id": "019d1279-dd8d-73d2-97df-ff57e75146ab", "tier": "proxy", "run_name": "round0013_proxy_1774136191", "family_name": "multi_branch_gated", "family_stage": "stabilize", "status": "ok", "decision": "incubate", "payload": {"tier": "proxy", "run_name": "round0013_proxy_1774136191", "family_name": "multi_branch_gated", "family_stage": "stabilize", "status": "ok", "decision": "incubate", "val_fvu": "0.15793968923389912", "observed_fvu": "0.153486", "k": "128", "log_path": "/root/sparsify-ascend/research/history/logs/proxy_1774136942.log", "checkpoint": null}}
{"event_id": "evt_1774136942736121690", "ts": 1774136942, "event": "round_finished", "round": 13, "session_id": "019d1279-dd8d-73d2-97df-ff57e75146ab", "tier": "proxy", "run_name": null, "family_name": "multi_branch_gated", "family_stage": "stabilize", "status": "ok", "decision": "incubate", "payload": {"tier": "proxy", "family_name": "multi_branch_gated", "family_stage": "stabilize", "status": "ok", "decision": "incubate", "val_fvu": "0.15793968923389912"}}
{"event_id": "evt_1774136942742199005", "ts": 1774136942, "event": "experiment_commit_prepared", "round": 13, "tier": "proxy", "run_name": null, "family_name": "multi_branch_gated", "family_stage": "stabilize", "status": "ok", "decision": "incubate", "payload": {"branch": "autoresearch-sae"}}
{"event_id": "evt_1774136950116647095", "ts": 1774136950, "event": "round_started", "round": 14, "session_id": "019d1279-dd8d-73d2-97df-ff57e75146ab", "tier": null, "run_name": null, "family_name": null, "family_stage": null, "status": "started", "decision": null, "payload": {"status": "started"}}
{"event_id": "evt_1774136950116802638", "ts": 1774136950, "event": "agent_deciding", "round": 14, "session_id": "019d1279-dd8d-73d2-97df-ff57e75146ab", "tier": null, "run_name": null, "family_name": null, "family_stage": null, "status": null, "decision": null, "payload": {}}
{"event_id": "evt_1774136950121214092", "ts": 1774136950, "event": "session_rebuilt", "round": 14, "tier": null, "run_name": null, "family_name": null, "family_stage": null, "status": "recreated", "decision": null, "payload": {"previous_session_id": "019d1279-dd8d-73d2-97df-ff57e75146ab", "previous_status": "active", "previous_rounds": 8, "previous_age_hours": 1.5003}}
{"event_id": "evt_1774137101261803932", "ts": 1774137101, "event": "session_started", "round": 14, "tier": null, "run_name": null, "family_name": null, "family_stage": null, "status": "active", "decision": null, "payload": {"session_id": "019d12cf-0aba-71d0-8920-5ea920811f62"}}
{"event_id": "evt_1774137101262426224", "ts": 1774137101, "event": "agent_action_received", "round": 14, "session_id": "019d12cf-0aba-71d0-8920-5ea920811f62", "tier": "proxy", "run_name": null, "family_name": "two_stage_residual", "family_stage": "stabilize", "status": null, "decision": null, "payload": {"session_id": "019d12cf-0aba-71d0-8920-5ea920811f62", "tier": "proxy", "family_name": "two_stage_residual", "family_stage": "stabilize", "change_type": "param_only", "expected_win": "lower_fvu", "hypothesis": "Stagnation and the runtime policy both point to exploitation on the current best family rather than another architecture change. The strongest clean next move is to keep the winning `two_stage_residual` K=128 / EF=16 / signum / aux-free recipe fixed and lower only the learning rate to `4e-4`, testing whether the current plateau is partly an optimization-step-size issue after the family-specific stage allocation stabilized."}}
{"event_id": "evt_1774137101262591436", "ts": 1774137101, "event": "proxy_mode_selected", "round": 14, "session_id": "019d12cf-0aba-71d0-8920-5ea920811f62", "tier": "proxy", "run_name": null, "family_name": "two_stage_residual", "family_stage": "stabilize", "status": null, "decision": null, "payload": {"tier": "proxy", "proxy_mode": "extended", "evaluation_basis": "curve_extended", "parameter_behavior": "dynamic", "proxy_max_tokens": "20000000"}}
{"event_id": "evt_1774137101262913872", "ts": 1774137101, "event": "training_started", "round": 14, "session_id": "019d12cf-0aba-71d0-8920-5ea920811f62", "tier": "proxy", "run_name": "round0014_proxy_1774137101", "family_name": "two_stage_residual", "family_stage": "stabilize", "status": null, "decision": null, "payload": {"tier": "proxy", "run_name": "round0014_proxy_1774137101", "family_name": "two_stage_residual", "family_stage": "stabilize", "checkpoint_dir": "/root/sparsify-ascend/checkpoints/research_agent/round_0014_proxy", "log_path": "/root/sparsify-ascend/research/history/logs/round0014_proxy_1774137101.log", "config": {"architecture": "two_stage_residual", "expansion_factor": 16, "k": 128, "optimizer": "signum", "lr": "4e-4", "hookpoints": "layers.[3].self_attn.o_proj", "batch_size": 1, "grad_acc_steps": 8, "micro_acc_steps": 1, "auxk_alpha": 0.0, "dead_feature_threshold": 10000000, "use_hadamard": false, "tier": "proxy", "family_name": "two_stage_residual", "family_stage": "stabilize"}, "baseline_tokens_per_sec": 110860.4803471805, "proxy_mode": "extended", "evaluation_basis": "curve_extended"}}
{"event_id": "evt_1774137131264283045", "ts": 1774137131, "event": "training_heartbeat", "round": 14, "session_id": "019d12cf-0aba-71d0-8920-5ea920811f62", "tier": "proxy", "run_name": "round0014_proxy_1774137101", "family_name": "two_stage_residual", "family_stage": "stabilize", "status": null, "decision": null, "payload": {"tier": "proxy", "run_name": "round0014_proxy_1774137101", "family_name": "two_stage_residual", "family_stage": "stabilize", "checkpoint_dir": "/root/sparsify-ascend/checkpoints/research_agent/round_0014_proxy/round0014_proxy_1774137101_dp2_bs1_ga8_ef16_k128_20260322_075147", "metrics_path": "/root/sparsify-ascend/checkpoints/research_agent/round_0014_proxy/round0014_proxy_1774137101_dp2_bs1_ga8_ef16_k128_20260322_075147/metrics.jsonl", "latest_step": 60, "latest_tokens_per_sec": 65533.65008426364, "baseline_ratio": 0.5911362631573727, "latest_total_tokens": 1966080.0, "proxy_mode": "extended", "evaluation_basis": "curve_extended"}}
{"event_id": "evt_1774137161265889464", "ts": 1774137161, "event": "training_heartbeat", "round": 14, "session_id": "019d12cf-0aba-71d0-8920-5ea920811f62", "tier": "proxy", "run_name": "round0014_proxy_1774137101", "family_name": "two_stage_residual", "family_stage": "stabilize", "status": null, "decision": null, "payload": {"tier": "proxy", "run_name": "round0014_proxy_1774137101", "family_name": "two_stage_residual", "family_stage": "stabilize", "checkpoint_dir": "/root/sparsify-ascend/checkpoints/research_agent/round_0014_proxy/round0014_proxy_1774137101_dp2_bs1_ga8_ef16_k128_20260322_075147", "metrics_path": "/root/sparsify-ascend/checkpoints/research_agent/round_0014_proxy/round0014_proxy_1774137101_dp2_bs1_ga8_ef16_k128_20260322_075147/metrics.jsonl", "latest_step": 190, "latest_tokens_per_sec": 103760.70352689463, "baseline_ratio": 0.9359575495428887, "latest_total_tokens": 6225920.0, "proxy_mode": "extended", "evaluation_basis": "curve_extended"}}
{"event_id": "evt_1774137191269678430", "ts": 1774137191, "event": "training_heartbeat", "round": 14, "session_id": "019d12cf-0aba-71d0-8920-5ea920811f62", "tier": "proxy", "run_name": "round0014_proxy_1774137101", "family_name": "two_stage_residual", "family_stage": "stabilize", "status": null, "decision": null, "payload": {"tier": "proxy", "run_name": "round0014_proxy_1774137101", "family_name": "two_stage_residual", "family_stage": "stabilize", "checkpoint_dir": "/root/sparsify-ascend/checkpoints/research_agent/round_0014_proxy/round0014_proxy_1774137101_dp2_bs1_ga8_ef16_k128_20260322_075147", "metrics_path": "/root/sparsify-ascend/checkpoints/research_agent/round_0014_proxy/round0014_proxy_1774137101_dp2_bs1_ga8_ef16_k128_20260322_075147/metrics.jsonl", "latest_step": 310, "latest_tokens_per_sec": 112859.53971862953, "baseline_ratio": 1.0180322091803011, "latest_total_tokens": 10158080.0, "proxy_mode": "extended", "evaluation_basis": "curve_extended"}}
{"event_id": "evt_1774137221272705110", "ts": 1774137221, "event": "training_heartbeat", "round": 14, "session_id": "019d12cf-0aba-71d0-8920-5ea920811f62", "tier": "proxy", "run_name": "round0014_proxy_1774137101", "family_name": "two_stage_residual", "family_stage": "stabilize", "status": null, "decision": null, "payload": {"tier": "proxy", "run_name": "round0014_proxy_1774137101", "family_name": "two_stage_residual", "family_stage": "stabilize", "checkpoint_dir": "/root/sparsify-ascend/checkpoints/research_agent/round_0014_proxy/round0014_proxy_1774137101_dp2_bs1_ga8_ef16_k128_20260322_075147", "metrics_path": "/root/sparsify-ascend/checkpoints/research_agent/round_0014_proxy/round0014_proxy_1774137101_dp2_bs1_ga8_ef16_k128_20260322_075147/metrics.jsonl", "latest_step": 440, "latest_tokens_per_sec": 120139.84634376976, "baseline_ratio": 1.0837031011188945, "latest_total_tokens": 14417920.0, "proxy_mode": "extended", "evaluation_basis": "curve_extended"}}
{"event_id": "evt_1774137251276358183", "ts": 1774137251, "event": "training_heartbeat", "round": 14, "session_id": "019d12cf-0aba-71d0-8920-5ea920811f62", "tier": "proxy", "run_name": "round0014_proxy_1774137101", "family_name": "two_stage_residual", "family_stage": "stabilize", "status": null, "decision": null, "payload": {"tier": "proxy", "run_name": "round0014_proxy_1774137101", "family_name": "two_stage_residual", "family_stage": "stabilize", "checkpoint_dir": "/root/sparsify-ascend/checkpoints/research_agent/round_0014_proxy/round0014_proxy_1774137101_dp2_bs1_ga8_ef16_k128_20260322_075147", "metrics_path": "/root/sparsify-ascend/checkpoints/research_agent/round_0014_proxy/round0014_proxy_1774137101_dp2_bs1_ga8_ef16_k128_20260322_075147/metrics.jsonl", "latest_step": 560, "latest_tokens_per_sec": 122323.1488557487, "baseline_ratio": 1.1033972473569544, "latest_total_tokens": 18350080.0, "proxy_mode": "extended", "evaluation_basis": "curve_extended"}}
