{"event_id": "evt_1774177752858611373", "ts": 1774177752, "event": "training_heartbeat", "round": 101, "session_id": "019d151e-f057-7ab3-a1e7-776eaf5fbf59", "tier": "full", "run_name": "round0101_full_1774177722", "family_name": "bucketed_lowrank_residual", "family_stage": "prototype", "status": null, "decision": null, "payload": {"tier": "full", "run_name": "round0101_full_1774177722", "family_name": "bucketed_lowrank_residual", "family_stage": "prototype", "checkpoint_dir": "/root/sparsify-ascend/checkpoints/research_agent/round_0101_full/round0101_full_1774177722_dp2_bs1_ga8_ef12_k32_20260322_190849", "metrics_path": "/root/sparsify-ascend/checkpoints/research_agent/round_0101_full/round0101_full_1774177722_dp2_bs1_ga8_ef12_k32_20260322_190849/metrics.jsonl", "latest_step": 90, "latest_tokens_per_sec": 98300.01031817838, "baseline_ratio": null, "latest_total_tokens": 2949120.0, "proxy_mode": null, "evaluation_basis": null}}
{"event_id": "evt_1774177782860601593", "ts": 1774177782, "event": "training_heartbeat", "round": 101, "session_id": "019d151e-f057-7ab3-a1e7-776eaf5fbf59", "tier": "full", "run_name": "round0101_full_1774177722", "family_name": "bucketed_lowrank_residual", "family_stage": "prototype", "status": null, "decision": null, "payload": {"tier": "full", "run_name": "round0101_full_1774177722", "family_name": "bucketed_lowrank_residual", "family_stage": "prototype", "checkpoint_dir": "/root/sparsify-ascend/checkpoints/research_agent/round_0101_full/round0101_full_1774177722_dp2_bs1_ga8_ef12_k32_20260322_190849", "metrics_path": "/root/sparsify-ascend/checkpoints/research_agent/round_0101_full/round0101_full_1774177722_dp2_bs1_ga8_ef12_k32_20260322_190849/metrics.jsonl", "latest_step": 260, "latest_tokens_per_sec": 141987.1051769909, "baseline_ratio": null, "latest_total_tokens": 8519680.0, "proxy_mode": null, "evaluation_basis": null}}
{"event_id": "evt_1774177812863570799", "ts": 1774177812, "event": "training_heartbeat", "round": 101, "session_id": "019d151e-f057-7ab3-a1e7-776eaf5fbf59", "tier": "full", "run_name": "round0101_full_1774177722", "family_name": "bucketed_lowrank_residual", "family_stage": "prototype", "status": null, "decision": null, "payload": {"tier": "full", "run_name": "round0101_full_1774177722", "family_name": "bucketed_lowrank_residual", "family_stage": "prototype", "checkpoint_dir": "/root/sparsify-ascend/checkpoints/research_agent/round_0101_full/round0101_full_1774177722_dp2_bs1_ga8_ef12_k32_20260322_190849", "metrics_path": "/root/sparsify-ascend/checkpoints/research_agent/round_0101_full/round0101_full_1774177722_dp2_bs1_ga8_ef12_k32_20260322_190849/metrics.jsonl", "latest_step": 430, "latest_tokens_per_sec": 156547.49369435344, "baseline_ratio": null, "latest_total_tokens": 14090240.0, "proxy_mode": null, "evaluation_basis": null}}
{"event_id": "evt_1774177842867460688", "ts": 1774177842, "event": "training_heartbeat", "round": 101, "session_id": "019d151e-f057-7ab3-a1e7-776eaf5fbf59", "tier": "full", "run_name": "round0101_full_1774177722", "family_name": "bucketed_lowrank_residual", "family_stage": "prototype", "status": null, "decision": null, "payload": {"tier": "full", "run_name": "round0101_full_1774177722", "family_name": "bucketed_lowrank_residual", "family_stage": "prototype", "checkpoint_dir": "/root/sparsify-ascend/checkpoints/research_agent/round_0101_full/round0101_full_1774177722_dp2_bs1_ga8_ef12_k32_20260322_190849", "metrics_path": "/root/sparsify-ascend/checkpoints/research_agent/round_0101_full/round0101_full_1774177722_dp2_bs1_ga8_ef12_k32_20260322_190849/metrics.jsonl", "latest_step": 600, "latest_tokens_per_sec": 163826.27816754836, "baseline_ratio": null, "latest_total_tokens": 19660800.0, "proxy_mode": null, "evaluation_basis": null}}
{"event_id": "evt_1774177872872384764", "ts": 1774177872, "event": "training_heartbeat", "round": 101, "session_id": "019d151e-f057-7ab3-a1e7-776eaf5fbf59", "tier": "full", "run_name": "round0101_full_1774177722", "family_name": "bucketed_lowrank_residual", "family_stage": "prototype", "status": null, "decision": null, "payload": {"tier": "full", "run_name": "round0101_full_1774177722", "family_name": "bucketed_lowrank_residual", "family_stage": "prototype", "checkpoint_dir": "/root/sparsify-ascend/checkpoints/research_agent/round_0101_full/round0101_full_1774177722_dp2_bs1_ga8_ef12_k32_20260322_190849", "metrics_path": "/root/sparsify-ascend/checkpoints/research_agent/round_0101_full/round0101_full_1774177722_dp2_bs1_ga8_ef12_k32_20260322_190849/metrics.jsonl", "latest_step": 780, "latest_tokens_per_sec": 170376.58903176527, "baseline_ratio": null, "latest_total_tokens": 25559040.0, "proxy_mode": null, "evaluation_basis": null}}
{"event_id": "evt_1774177902878240321", "ts": 1774177902, "event": "training_heartbeat", "round": 101, "session_id": "019d151e-f057-7ab3-a1e7-776eaf5fbf59", "tier": "full", "run_name": "round0101_full_1774177722", "family_name": "bucketed_lowrank_residual", "family_stage": "prototype", "status": null, "decision": null, "payload": {"tier": "full", "run_name": "round0101_full_1774177722", "family_name": "bucketed_lowrank_residual", "family_stage": "prototype", "checkpoint_dir": "/root/sparsify-ascend/checkpoints/research_agent/round_0101_full/round0101_full_1774177722_dp2_bs1_ga8_ef12_k32_20260322_190849", "metrics_path": "/root/sparsify-ascend/checkpoints/research_agent/round_0101_full/round0101_full_1774177722_dp2_bs1_ga8_ef12_k32_20260322_190849/metrics.jsonl", "latest_step": 950, "latest_tokens_per_sec": 172922.22258219265, "baseline_ratio": null, "latest_total_tokens": 31129600.0, "proxy_mode": null, "evaluation_basis": null}}
{"event_id": "evt_1774177932954875993", "ts": 1774177932, "event": "training_heartbeat", "round": 101, "session_id": "019d151e-f057-7ab3-a1e7-776eaf5fbf59", "tier": "full", "run_name": "round0101_full_1774177722", "family_name": "bucketed_lowrank_residual", "family_stage": "prototype", "status": null, "decision": null, "payload": {"tier": "full", "run_name": "round0101_full_1774177722", "family_name": "bucketed_lowrank_residual", "family_stage": "prototype", "checkpoint_dir": "/root/sparsify-ascend/checkpoints/research_agent/round_0101_full/round0101_full_1774177722_dp2_bs1_ga8_ef12_k32_20260322_190849", "metrics_path": "/root/sparsify-ascend/checkpoints/research_agent/round_0101_full/round0101_full_1774177722_dp2_bs1_ga8_ef12_k32_20260322_190849/metrics.jsonl", "latest_step": 1080, "latest_tokens_per_sec": 168499.14203079723, "baseline_ratio": null, "latest_total_tokens": 35389440.0, "proxy_mode": null, "evaluation_basis": null}}
{"event_id": "evt_1774177962962344756", "ts": 1774177962, "event": "training_heartbeat", "round": 101, "session_id": "019d151e-f057-7ab3-a1e7-776eaf5fbf59", "tier": "full", "run_name": "round0101_full_1774177722", "family_name": "bucketed_lowrank_residual", "family_stage": "prototype", "status": null, "decision": null, "payload": {"tier": "full", "run_name": "round0101_full_1774177722", "family_name": "bucketed_lowrank_residual", "family_stage": "prototype", "checkpoint_dir": "/root/sparsify-ascend/checkpoints/research_agent/round_0101_full/round0101_full_1774177722_dp2_bs1_ga8_ef12_k32_20260322_190849", "metrics_path": "/root/sparsify-ascend/checkpoints/research_agent/round_0101_full/round0101_full_1774177722_dp2_bs1_ga8_ef12_k32_20260322_190849/metrics.jsonl", "latest_step": 1220, "latest_tokens_per_sec": 166497.9007332376, "baseline_ratio": null, "latest_total_tokens": 39976960.0, "proxy_mode": null, "evaluation_basis": null}}
{"event_id": "evt_1774177992969849082", "ts": 1774177992, "event": "training_heartbeat", "round": 101, "session_id": "019d151e-f057-7ab3-a1e7-776eaf5fbf59", "tier": "full", "run_name": "round0101_full_1774177722", "family_name": "bucketed_lowrank_residual", "family_stage": "prototype", "status": null, "decision": null, "payload": {"tier": "full", "run_name": "round0101_full_1774177722", "family_name": "bucketed_lowrank_residual", "family_stage": "prototype", "checkpoint_dir": "/root/sparsify-ascend/checkpoints/research_agent/round_0101_full/round0101_full_1774177722_dp2_bs1_ga8_ef12_k32_20260322_190849", "metrics_path": "/root/sparsify-ascend/checkpoints/research_agent/round_0101_full/round0101_full_1774177722_dp2_bs1_ga8_ef12_k32_20260322_190849/metrics.jsonl", "latest_step": 1220, "latest_tokens_per_sec": 148001.2110542196, "baseline_ratio": null, "latest_total_tokens": 39976960.0, "proxy_mode": null, "evaluation_basis": null}}
{"event_id": "evt_1774178022977366103", "ts": 1774178022, "event": "training_heartbeat", "round": 101, "session_id": "019d151e-f057-7ab3-a1e7-776eaf5fbf59", "tier": "full", "run_name": "round0101_full_1774177722", "family_name": "bucketed_lowrank_residual", "family_stage": "prototype", "status": null, "decision": null, "payload": {"tier": "full", "run_name": "round0101_full_1774177722", "family_name": "bucketed_lowrank_residual", "family_stage": "prototype", "checkpoint_dir": "/root/sparsify-ascend/checkpoints/research_agent/round_0101_full/round0101_full_1774177722_dp2_bs1_ga8_ef12_k32_20260322_190849", "metrics_path": "/root/sparsify-ascend/checkpoints/research_agent/round_0101_full/round0101_full_1774177722_dp2_bs1_ga8_ef12_k32_20260322_190849/metrics.jsonl", "latest_step": 1220, "latest_tokens_per_sec": 133203.28234729834, "baseline_ratio": null, "latest_total_tokens": 39976960.0, "proxy_mode": null, "evaluation_basis": null}}
{"event_id": "evt_1774178052984830816", "ts": 1774178052, "event": "training_heartbeat", "round": 101, "session_id": "019d151e-f057-7ab3-a1e7-776eaf5fbf59", "tier": "full", "run_name": "round0101_full_1774177722", "family_name": "bucketed_lowrank_residual", "family_stage": "prototype", "status": null, "decision": null, "payload": {"tier": "full", "run_name": "round0101_full_1774177722", "family_name": "bucketed_lowrank_residual", "family_stage": "prototype", "checkpoint_dir": "/root/sparsify-ascend/checkpoints/research_agent/round_0101_full/round0101_full_1774177722_dp2_bs1_ga8_ef12_k32_20260322_190849", "metrics_path": "/root/sparsify-ascend/checkpoints/research_agent/round_0101_full/round0101_full_1774177722_dp2_bs1_ga8_ef12_k32_20260322_190849/metrics.jsonl", "latest_step": 1220, "latest_tokens_per_sec": 121095.56560511244, "baseline_ratio": null, "latest_total_tokens": 39976960.0, "proxy_mode": null, "evaluation_basis": null}}
{"event_id": "evt_1774178053062861323", "ts": 1774178053, "event": "training_finished", "round": 101, "session_id": "019d151e-f057-7ab3-a1e7-776eaf5fbf59", "tier": "full", "run_name": "round0101_full_1774177722", "family_name": "bucketed_lowrank_residual", "family_stage": "prototype", "status": "ok", "decision": "discard", "payload": {"tier": "full", "run_name": "round0101_full_1774177722", "family_name": "bucketed_lowrank_residual", "family_stage": "prototype", "checkpoint_dir": "/root/sparsify-ascend/checkpoints/research_agent/round_0101_full/round0101_full_1774177722_dp2_bs1_ga8_ef12_k32_20260322_190849", "metrics_path": "/root/sparsify-ascend/checkpoints/research_agent/round_0101_full/round0101_full_1774177722_dp2_bs1_ga8_ef12_k32_20260322_190849/metrics.jsonl", "run_health": "normal", "termination_reason": "completed", "tokens_per_sec": 121095.56560511244, "baseline_ratio": null, "status": "ok", "decision": "discard", "proxy_mode": null, "evaluation_basis": null, "curve_start_fvu": 0.13791623711585999, "curve_mid_fvu": 0.12027817219495773, "curve_end_fvu": 0.09853360056877136, "curve_late_slope": -1.5129257992127544e-09, "curve_still_improving": true}}
{"event_id": "evt_1774178053062940480", "ts": 1774178053, "event": "result_recorded", "round": 101, "session_id": "019d151e-f057-7ab3-a1e7-776eaf5fbf59", "tier": "full", "run_name": "round0101_full_1774177722", "family_name": "bucketed_lowrank_residual", "family_stage": "prototype", "status": "ok", "decision": "discard", "payload": {"tier": "full", "run_name": "round0101_full_1774177722", "family_name": "bucketed_lowrank_residual", "family_stage": "prototype", "status": "ok", "decision": "discard", "val_fvu": "0.10123475920408964", "observed_fvu": "0.098534", "k": "32", "log_path": "/root/sparsify-ascend/research/history/logs/full_1774178053.log", "checkpoint": null}}
{"event_id": "evt_1774178053063433519", "ts": 1774178053, "event": "round_finished", "round": 101, "session_id": "019d151e-f057-7ab3-a1e7-776eaf5fbf59", "tier": "full", "run_name": null, "family_name": "bucketed_lowrank_residual", "family_stage": "prototype", "status": "ok", "decision": "discard", "payload": {"tier": "full", "family_name": "bucketed_lowrank_residual", "family_stage": "prototype", "status": "ok", "decision": "discard", "val_fvu": "0.10123475920408964"}}
{"event_id": "evt_1774178053072836384", "ts": 1774178053, "event": "experiment_commit_prepared", "round": 101, "tier": "full", "run_name": null, "family_name": "bucketed_lowrank_residual", "family_stage": "prototype", "status": "ok", "decision": "discard", "payload": {"branch": "autoresearch-sae"}}
{"event_id": "evt_1774178060777795241", "ts": 1774178060, "event": "round_started", "round": 102, "session_id": "019d151e-f057-7ab3-a1e7-776eaf5fbf59", "tier": null, "run_name": null, "family_name": null, "family_stage": null, "status": "started", "decision": null, "payload": {"status": "started"}}
{"event_id": "evt_1774178060777977331", "ts": 1774178060, "event": "agent_deciding", "round": 102, "session_id": "019d151e-f057-7ab3-a1e7-776eaf5fbf59", "tier": null, "run_name": null, "family_name": null, "family_stage": null, "status": null, "decision": null, "payload": {}}
{"event_id": "evt_1774178195418837888", "ts": 1774178195, "event": "session_resumed", "round": 102, "tier": null, "run_name": null, "family_name": null, "family_stage": null, "status": "active", "decision": null, "payload": {"session_id": "019d151e-f057-7ab3-a1e7-776eaf5fbf59"}}
{"event_id": "evt_1774178195448039745", "ts": 1774178195, "event": "agent_action_received", "round": 102, "session_id": "019d151e-f057-7ab3-a1e7-776eaf5fbf59", "tier": "proxy", "run_name": null, "family_name": "bucketed_lowrank_residual", "family_stage": "mainline_comparison", "status": null, "decision": null, "payload": {"session_id": "019d151e-f057-7ab3-a1e7-776eaf5fbf59", "tier": "proxy", "family_name": "bucketed_lowrank_residual", "family_stage": "mainline_comparison", "change_type": "param_only", "expected_win": "explore_unknown", "hypothesis": "`bucketed_lowrank_residual` produced the strongest exact-neighborhood result seen so far at `K=32, EF=12`, so the next informative move is to keep the family fixed and map it to the adjacent low-K point `K=40` before any EF work. This preserves same-EF fairness, prioritizes K-lane coverage, and tests whether the conditional residual-dictionary reformulation remains competitive beyond a single low-K point."}}
{"event_id": "evt_1774178195448191220", "ts": 1774178195, "event": "proxy_mode_selected", "round": 102, "session_id": "019d151e-f057-7ab3-a1e7-776eaf5fbf59", "tier": "proxy", "run_name": null, "family_name": "bucketed_lowrank_residual", "family_stage": "mainline_comparison", "status": null, "decision": null, "payload": {"tier": "proxy", "proxy_mode": "fast", "evaluation_basis": "terminal_only", "parameter_behavior": "structural", "proxy_max_tokens": "5000000"}}
{"event_id": "evt_1774178195448469478", "ts": 1774178195, "event": "training_started", "round": 102, "session_id": "019d151e-f057-7ab3-a1e7-776eaf5fbf59", "tier": "proxy", "run_name": "round0102_proxy_1774178195", "family_name": "bucketed_lowrank_residual", "family_stage": "mainline_comparison", "status": null, "decision": null, "payload": {"tier": "proxy", "run_name": "round0102_proxy_1774178195", "family_name": "bucketed_lowrank_residual", "family_stage": "mainline_comparison", "checkpoint_dir": "/root/sparsify-ascend/checkpoints/research_agent/round_0102_proxy", "log_path": "/root/sparsify-ascend/research/history/logs/round0102_proxy_1774178195.log", "config": {"architecture": "bucketed_lowrank_residual", "expansion_factor": 12, "k": 40, "optimizer": "signum", "lr": "1.6e-3", "hookpoints": "layers.[3].self_attn.o_proj", "batch_size": 1, "grad_acc_steps": 8, "micro_acc_steps": 1, "auxk_alpha": 0.0, "dead_feature_threshold": 10000000, "use_hadamard": false, "tier": "proxy", "family_name": "bucketed_lowrank_residual", "family_stage": "mainline_comparison"}, "baseline_tokens_per_sec": 148039.37635751817, "proxy_mode": "fast", "evaluation_basis": "terminal_only"}}
{"event_id": "evt_1774178225450052409", "ts": 1774178225, "event": "training_heartbeat", "round": 102, "session_id": "019d151e-f057-7ab3-a1e7-776eaf5fbf59", "tier": "proxy", "run_name": "round0102_proxy_1774178195", "family_name": "bucketed_lowrank_residual", "family_stage": "mainline_comparison", "status": null, "decision": null, "payload": {"tier": "proxy", "run_name": "round0102_proxy_1774178195", "family_name": "bucketed_lowrank_residual", "family_stage": "mainline_comparison", "checkpoint_dir": "/root/sparsify-ascend/checkpoints/research_agent/round_0102_proxy/round0102_proxy_1774178195_dp2_bs1_ga8_ef12_k40_20260322_191641", "metrics_path": "/root/sparsify-ascend/checkpoints/research_agent/round_0102_proxy/round0102_proxy_1774178195_dp2_bs1_ga8_ef12_k40_20260322_191641/metrics.jsonl", "latest_step": 90, "latest_tokens_per_sec": 98299.86736124086, "baseline_ratio": 0.6640116283916561, "latest_total_tokens": 2949120.0, "proxy_mode": "fast", "evaluation_basis": "terminal_only"}}
{"event_id": "evt_1774178255599754701", "ts": 1774178255, "event": "training_heartbeat", "round": 102, "session_id": "019d151e-f057-7ab3-a1e7-776eaf5fbf59", "tier": "proxy", "run_name": "round0102_proxy_1774178195", "family_name": "bucketed_lowrank_residual", "family_stage": "mainline_comparison", "status": null, "decision": null, "payload": {"tier": "proxy", "run_name": "round0102_proxy_1774178195", "family_name": "bucketed_lowrank_residual", "family_stage": "mainline_comparison", "checkpoint_dir": "/root/sparsify-ascend/checkpoints/research_agent/round_0102_proxy/round0102_proxy_1774178195_dp2_bs1_ga8_ef12_k40_20260322_191641", "metrics_path": "/root/sparsify-ascend/checkpoints/research_agent/round_0102_proxy/round0102_proxy_1774178195_dp2_bs1_ga8_ef12_k40_20260322_191641/metrics.jsonl", "latest_step": 152, "latest_tokens_per_sec": 83008.54303161985, "baseline_ratio": 0.5607193509864058, "latest_total_tokens": 4980736.0, "proxy_mode": "fast", "evaluation_basis": "terminal_only"}}
{"event_id": "evt_1774178256538513599", "ts": 1774178256, "event": "training_finished", "round": 102, "session_id": "019d151e-f057-7ab3-a1e7-776eaf5fbf59", "tier": "proxy", "run_name": "round0102_proxy_1774178195", "family_name": "bucketed_lowrank_residual", "family_stage": "mainline_comparison", "status": "ok", "decision": "discard", "payload": {"tier": "proxy", "run_name": "round0102_proxy_1774178195", "family_name": "bucketed_lowrank_residual", "family_stage": "mainline_comparison", "checkpoint_dir": "/root/sparsify-ascend/checkpoints/research_agent/round_0102_proxy/round0102_proxy_1774178195_dp2_bs1_ga8_ef12_k40_20260322_191641", "metrics_path": "/root/sparsify-ascend/checkpoints/research_agent/round_0102_proxy/round0102_proxy_1774178195_dp2_bs1_ga8_ef12_k40_20260322_191641/metrics.jsonl", "run_health": "normal", "termination_reason": "completed", "tokens_per_sec": 83008.54303161985, "baseline_ratio": 0.5607193509864058, "status": "ok", "decision": "discard", "proxy_mode": "fast", "evaluation_basis": "terminal_only", "curve_start_fvu": 0.3497501015663147, "curve_mid_fvu": 0.22278538346290588, "curve_end_fvu": 0.17477644979953766, "curve_late_slope": -7.234868990640426e-09, "curve_still_improving": true}}
{"event_id": "evt_1774178256538597997", "ts": 1774178256, "event": "result_recorded", "round": 102, "session_id": "019d151e-f057-7ab3-a1e7-776eaf5fbf59", "tier": "proxy", "run_name": "round0102_proxy_1774178195", "family_name": "bucketed_lowrank_residual", "family_stage": "mainline_comparison", "status": "ok", "decision": "discard", "payload": {"tier": "proxy", "run_name": "round0102_proxy_1774178195", "family_name": "bucketed_lowrank_residual", "family_stage": "mainline_comparison", "status": "ok", "decision": "discard", "val_fvu": "0.17556130327284336", "observed_fvu": "0.174776", "k": "40", "log_path": "/root/sparsify-ascend/research/history/logs/proxy_1774178256.log", "checkpoint": null}}
{"event_id": "evt_1774178256538753119", "ts": 1774178256, "event": "round_finished", "round": 102, "session_id": "019d151e-f057-7ab3-a1e7-776eaf5fbf59", "tier": "proxy", "run_name": null, "family_name": "bucketed_lowrank_residual", "family_stage": "mainline_comparison", "status": "ok", "decision": "discard", "payload": {"tier": "proxy", "family_name": "bucketed_lowrank_residual", "family_stage": "mainline_comparison", "status": "ok", "decision": "discard", "val_fvu": "0.17556130327284336"}}
{"event_id": "evt_1774178256999954306", "ts": 1774178256, "event": "experiment_commit_prepared", "round": 102, "tier": "proxy", "run_name": null, "family_name": "bucketed_lowrank_residual", "family_stage": "mainline_comparison", "status": "ok", "decision": "discard", "payload": {"branch": "autoresearch-sae"}}
{"event_id": "evt_1774178266052525571", "ts": 1774178266, "event": "round_started", "round": 103, "session_id": "019d151e-f057-7ab3-a1e7-776eaf5fbf59", "tier": null, "run_name": null, "family_name": null, "family_stage": null, "status": "started", "decision": null, "payload": {"status": "started"}}
{"event_id": "evt_1774178266052706678", "ts": 1774178266, "event": "agent_deciding", "round": 103, "session_id": "019d151e-f057-7ab3-a1e7-776eaf5fbf59", "tier": null, "run_name": null, "family_name": null, "family_stage": null, "status": null, "decision": null, "payload": {}}
