{"event_id": "evt_1774168242809203117", "ts": 1774168242, "event": "training_heartbeat", "round": 74, "session_id": "019d1496-cd26-7b90-a74e-d93c12b3512b", "tier": "proxy", "run_name": "round0074_proxy_1774168212", "family_name": "lowrank_residual", "family_stage": "mainline_comparison", "status": null, "decision": null, "payload": {"tier": "proxy", "run_name": "round0074_proxy_1774168212", "family_name": "lowrank_residual", "family_stage": "mainline_comparison", "checkpoint_dir": "/root/sparsify-ascend/checkpoints/research_agent/round_0074_proxy/round0074_proxy_1774168212_dp2_bs1_ga8_ef12_k32_20260322_163019", "metrics_path": "/root/sparsify-ascend/checkpoints/research_agent/round_0074_proxy/round0074_proxy_1774168212_dp2_bs1_ga8_ef12_k32_20260322_163019/metrics.jsonl", "latest_step": 130, "latest_tokens_per_sec": 141987.63324770902, "baseline_ratio": 1.7105187374865698, "latest_total_tokens": 4259840.0, "proxy_mode": "fast", "evaluation_basis": "terminal_only"}}
{"event_id": "evt_1774168272810608076", "ts": 1774168272, "event": "training_heartbeat", "round": 74, "session_id": "019d1496-cd26-7b90-a74e-d93c12b3512b", "tier": "proxy", "run_name": "round0074_proxy_1774168212", "family_name": "lowrank_residual", "family_stage": "mainline_comparison", "status": null, "decision": null, "payload": {"tier": "proxy", "run_name": "round0074_proxy_1774168212", "family_name": "lowrank_residual", "family_stage": "mainline_comparison", "checkpoint_dir": "/root/sparsify-ascend/checkpoints/research_agent/round_0074_proxy/round0074_proxy_1774168212_dp2_bs1_ga8_ef12_k32_20260322_163019", "metrics_path": "/root/sparsify-ascend/checkpoints/research_agent/round_0074_proxy/round0074_proxy_1774168212_dp2_bs1_ga8_ef12_k32_20260322_163019/metrics.jsonl", "latest_step": 152, "latest_tokens_per_sec": 83008.27949707286, "baseline_ratio": 0.9999970715657828, "latest_total_tokens": 4980736.0, "proxy_mode": "fast", "evaluation_basis": "terminal_only"}}
{"event_id": "evt_1774168272876326516", "ts": 1774168272, "event": "training_finished", "round": 74, "session_id": "019d1496-cd26-7b90-a74e-d93c12b3512b", "tier": "proxy", "run_name": "round0074_proxy_1774168212", "family_name": "lowrank_residual", "family_stage": "mainline_comparison", "status": "ok", "decision": "incubate", "payload": {"tier": "proxy", "run_name": "round0074_proxy_1774168212", "family_name": "lowrank_residual", "family_stage": "mainline_comparison", "checkpoint_dir": "/root/sparsify-ascend/checkpoints/research_agent/round_0074_proxy/round0074_proxy_1774168212_dp2_bs1_ga8_ef12_k32_20260322_163019", "metrics_path": "/root/sparsify-ascend/checkpoints/research_agent/round_0074_proxy/round0074_proxy_1774168212_dp2_bs1_ga8_ef12_k32_20260322_163019/metrics.jsonl", "run_health": "normal", "termination_reason": "completed", "tokens_per_sec": 83008.27949707286, "baseline_ratio": 0.9999970715657828, "status": "ok", "decision": "incubate", "proxy_mode": "fast", "evaluation_basis": "terminal_only", "curve_start_fvu": 0.3540574908256531, "curve_mid_fvu": 0.22892272472381592, "curve_end_fvu": 0.1810237169265747, "curve_late_slope": -7.058383010688328e-09, "curve_still_improving": true}}
{"event_id": "evt_1774168272876378924", "ts": 1774168272, "event": "result_recorded", "round": 74, "session_id": "019d1496-cd26-7b90-a74e-d93c12b3512b", "tier": "proxy", "run_name": "round0074_proxy_1774168212", "family_name": "lowrank_residual", "family_stage": "mainline_comparison", "status": "ok", "decision": "incubate", "payload": {"tier": "proxy", "run_name": "round0074_proxy_1774168212", "family_name": "lowrank_residual", "family_stage": "mainline_comparison", "status": "ok", "decision": "incubate", "val_fvu": "0.18159605003893375", "observed_fvu": "0.181024", "k": "32", "log_path": "/root/sparsify-ascend/research/history/logs/proxy_1774168272.log", "checkpoint": null}}
{"event_id": "evt_1774168272876520896", "ts": 1774168272, "event": "round_finished", "round": 74, "session_id": "019d1496-cd26-7b90-a74e-d93c12b3512b", "tier": "proxy", "run_name": null, "family_name": "lowrank_residual", "family_stage": "mainline_comparison", "status": "ok", "decision": "incubate", "payload": {"tier": "proxy", "family_name": "lowrank_residual", "family_stage": "mainline_comparison", "status": "ok", "decision": "incubate", "val_fvu": "0.18159605003893375"}}
{"event_id": "evt_1774168272884828758", "ts": 1774168272, "event": "experiment_commit_prepared", "round": 74, "tier": "proxy", "run_name": null, "family_name": "lowrank_residual", "family_stage": "mainline_comparison", "status": "ok", "decision": "incubate", "payload": {"branch": "autoresearch-sae"}}
{"event_id": "evt_1774168280547283933", "ts": 1774168280, "event": "round_started", "round": 75, "session_id": "019d1496-cd26-7b90-a74e-d93c12b3512b", "tier": null, "run_name": null, "family_name": null, "family_stage": null, "status": "started", "decision": null, "payload": {"status": "started"}}
{"event_id": "evt_1774168280547427448", "ts": 1774168280, "event": "agent_deciding", "round": 75, "session_id": "019d1496-cd26-7b90-a74e-d93c12b3512b", "tier": null, "run_name": null, "family_name": null, "family_stage": null, "status": null, "decision": null, "payload": {}}
{"event_id": "evt_1774168435128623449", "ts": 1774168435, "event": "session_resumed", "round": 75, "tier": null, "run_name": null, "family_name": null, "family_stage": null, "status": "active", "decision": null, "payload": {"session_id": "019d1496-cd26-7b90-a74e-d93c12b3512b"}}
{"event_id": "evt_1774168435129864374", "ts": 1774168435, "event": "agent_action_received", "round": 75, "session_id": "019d1496-cd26-7b90-a74e-d93c12b3512b", "tier": "proxy", "run_name": null, "family_name": "adaptive_budget_topk", "family_stage": "mainline_comparison", "status": null, "decision": null, "payload": {"session_id": "019d1496-cd26-7b90-a74e-d93c12b3512b", "tier": "proxy", "family_name": "adaptive_budget_topk", "family_stage": "mainline_comparison", "change_type": "param_only", "expected_win": "medium", "hypothesis": "`lowrank_residual` at the refreshed low-K target (`K=32`, `EF=12`) was effectively tied with the archived `lowrank_grouped_residual` result and still far from competitive, so the next informative move is to keep the same `K=32`, `EF=12` mainline target fixed and switch to a fundamentally different sparse mechanism. Run `adaptive_budget_topk` at `K=32`, `EF=12` with the shared `signum`/`LR=1.6e-3`/`AUXK_ALPHA=0` recipe to test whether flexible per-sample support allocation recovers useful low-K quality where the recent residual/routing families did not."}}
{"event_id": "evt_1774168435129966857", "ts": 1774168435, "event": "env_overrides_rejected", "round": 75, "session_id": "019d1496-cd26-7b90-a74e-d93c12b3512b", "tier": null, "run_name": null, "family_name": "adaptive_budget_topk", "family_stage": "mainline_comparison", "status": null, "decision": null, "payload": {"rejected_keys": ["FAMILY_NAME", "FAMILY_STAGE"], "error": "env_overrides contain disallowed keys: FAMILY_NAME, FAMILY_STAGE"}}
{"event_id": "evt_1774168435130003386", "ts": 1774168435, "event": "round_finished", "round": 75, "session_id": "019d1496-cd26-7b90-a74e-d93c12b3512b", "tier": "proxy", "run_name": null, "family_name": "adaptive_budget_topk", "family_stage": "mainline_comparison", "status": "crash", "decision": "crash", "payload": {"tier": "proxy", "family_name": "adaptive_budget_topk", "family_stage": "mainline_comparison", "status": "crash", "decision": "crash", "val_fvu": null}}
{"event_id": "evt_1774168442779183936", "ts": 1774168442, "event": "round_started", "round": 76, "session_id": "019d1496-cd26-7b90-a74e-d93c12b3512b", "tier": null, "run_name": null, "family_name": null, "family_stage": null, "status": "started", "decision": null, "payload": {"status": "started"}}
{"event_id": "evt_1774168442779350478", "ts": 1774168442, "event": "agent_deciding", "round": 76, "session_id": "019d1496-cd26-7b90-a74e-d93c12b3512b", "tier": null, "run_name": null, "family_name": null, "family_stage": null, "status": null, "decision": null, "payload": {}}
{"event_id": "evt_1774168569526418375", "ts": 1774168569, "event": "session_resumed", "round": 76, "tier": null, "run_name": null, "family_name": null, "family_stage": null, "status": "active", "decision": null, "payload": {"session_id": "019d1496-cd26-7b90-a74e-d93c12b3512b"}}
{"event_id": "evt_1774168569527804315", "ts": 1774168569, "event": "agent_action_received", "round": 76, "session_id": "019d1496-cd26-7b90-a74e-d93c12b3512b", "tier": "proxy", "run_name": null, "family_name": "adaptive_budget_topk", "family_stage": "mainline_comparison", "status": null, "decision": null, "payload": {"session_id": "019d1496-cd26-7b90-a74e-d93c12b3512b", "tier": "proxy", "family_name": "adaptive_budget_topk", "family_stage": "mainline_comparison", "change_type": "param_only", "expected_win": "medium", "hypothesis": "Round 75 did not produce a model result because the `adaptive_budget_topk` launch failed at the config layer with `invalid_env_overrides`, so the next informative move is to rerun the same low-K mainline architecture pivot with a minimal valid override set. Run `adaptive_budget_topk` at `K=32`, `EF=12` with the shared `signum`/`LR=1.6e-3`/`AUXK_ALPHA=0` recipe to test whether flexible per-sample support allocation improves the weak `K=32`, `EF=12` cluster once the launcher issue is removed."}}
{"event_id": "evt_1774168569527910745", "ts": 1774168569, "event": "variable_isolation_warning", "round": 76, "session_id": "019d1496-cd26-7b90-a74e-d93c12b3512b", "tier": null, "run_name": null, "family_name": "adaptive_budget_topk", "family_stage": "mainline_comparison", "status": null, "decision": null, "payload": {"violation": "Multiple primary variables changed simultaneously: architecture, k, lr"}}
{"event_id": "evt_1774168569527961414", "ts": 1774168569, "event": "proxy_mode_selected", "round": 76, "session_id": "019d1496-cd26-7b90-a74e-d93c12b3512b", "tier": "proxy", "run_name": null, "family_name": "adaptive_budget_topk", "family_stage": "mainline_comparison", "status": null, "decision": null, "payload": {"tier": "proxy", "proxy_mode": "fast", "evaluation_basis": "terminal_only", "parameter_behavior": "structural", "proxy_max_tokens": "5000000"}}
{"event_id": "evt_1774168569528217176", "ts": 1774168569, "event": "training_started", "round": 76, "session_id": "019d1496-cd26-7b90-a74e-d93c12b3512b", "tier": "proxy", "run_name": "round0076_proxy_1774168569", "family_name": "adaptive_budget_topk", "family_stage": "mainline_comparison", "status": null, "decision": null, "payload": {"tier": "proxy", "run_name": "round0076_proxy_1774168569", "family_name": "adaptive_budget_topk", "family_stage": "mainline_comparison", "checkpoint_dir": "/root/sparsify-ascend/checkpoints/research_agent/round_0076_proxy", "log_path": "/root/sparsify-ascend/research/history/logs/round0076_proxy_1774168569.log", "config": {"architecture": "adaptive_budget_topk", "expansion_factor": 12, "k": 32, "optimizer": "signum", "lr": "1.6e-3", "hookpoints": "layers.[3].self_attn.o_proj", "batch_size": 1, "grad_acc_steps": 8, "micro_acc_steps": 1, "auxk_alpha": 0.0, "dead_feature_threshold": 10000000, "use_hadamard": false, "tier": "proxy", "family_name": "adaptive_budget_topk", "family_stage": "mainline_comparison"}, "baseline_tokens_per_sec": 41504.621057705925, "proxy_mode": "fast", "evaluation_basis": "terminal_only"}}
{"event_id": "evt_1774168599529418213", "ts": 1774168599, "event": "training_heartbeat", "round": 76, "session_id": "019d1496-cd26-7b90-a74e-d93c12b3512b", "tier": "proxy", "run_name": "round0076_proxy_1774168569", "family_name": "adaptive_budget_topk", "family_stage": "mainline_comparison", "status": null, "decision": null, "payload": {"tier": "proxy", "run_name": "round0076_proxy_1774168569", "family_name": "adaptive_budget_topk", "family_stage": "mainline_comparison", "checkpoint_dir": "/root/sparsify-ascend/checkpoints/research_agent/round_0076_proxy/round0076_proxy_1774168569_dp2_bs1_ga8_ef12_k32_20260322_163616", "metrics_path": "/root/sparsify-ascend/checkpoints/research_agent/round_0076_proxy/round0076_proxy_1774168569_dp2_bs1_ga8_ef12_k32_20260322_163616/metrics.jsonl", "latest_step": 20, "latest_tokens_per_sec": 21844.702622376863, "baseline_ratio": 0.5263197703216009, "latest_total_tokens": 655360.0, "proxy_mode": "fast", "evaluation_basis": "terminal_only"}}
{"event_id": "evt_1774168629530350911", "ts": 1774168629, "event": "training_heartbeat", "round": 76, "session_id": "019d1496-cd26-7b90-a74e-d93c12b3512b", "tier": "proxy", "run_name": "round0076_proxy_1774168569", "family_name": "adaptive_budget_topk", "family_stage": "mainline_comparison", "status": null, "decision": null, "payload": {"tier": "proxy", "run_name": "round0076_proxy_1774168569", "family_name": "adaptive_budget_topk", "family_stage": "mainline_comparison", "checkpoint_dir": "/root/sparsify-ascend/checkpoints/research_agent/round_0076_proxy/round0076_proxy_1774168569_dp2_bs1_ga8_ef12_k32_20260322_163616", "metrics_path": "/root/sparsify-ascend/checkpoints/research_agent/round_0076_proxy/round0076_proxy_1774168569_dp2_bs1_ga8_ef12_k32_20260322_163616/metrics.jsonl", "latest_step": 70, "latest_tokens_per_sec": 38228.18280372399, "baseline_ratio": 0.921058470828428, "latest_total_tokens": 2293760.0, "proxy_mode": "fast", "evaluation_basis": "terminal_only"}}
{"event_id": "evt_1774168659531505561", "ts": 1774168659, "event": "training_heartbeat", "round": 76, "session_id": "019d1496-cd26-7b90-a74e-d93c12b3512b", "tier": "proxy", "run_name": "round0076_proxy_1774168569", "family_name": "adaptive_budget_topk", "family_stage": "mainline_comparison", "status": null, "decision": null, "payload": {"tier": "proxy", "run_name": "round0076_proxy_1774168569", "family_name": "adaptive_budget_topk", "family_stage": "mainline_comparison", "checkpoint_dir": "/root/sparsify-ascend/checkpoints/research_agent/round_0076_proxy/round0076_proxy_1774168569_dp2_bs1_ga8_ef12_k32_20260322_163616", "metrics_path": "/root/sparsify-ascend/checkpoints/research_agent/round_0076_proxy/round0076_proxy_1774168569_dp2_bs1_ga8_ef12_k32_20260322_163616/metrics.jsonl", "latest_step": 110, "latest_tokens_per_sec": 40048.457566669356, "baseline_ratio": 0.9649156297798264, "latest_total_tokens": 3604480.0, "proxy_mode": "fast", "evaluation_basis": "terminal_only"}}
{"event_id": "evt_1774168689532931343", "ts": 1774168689, "event": "training_heartbeat", "round": 76, "session_id": "019d1496-cd26-7b90-a74e-d93c12b3512b", "tier": "proxy", "run_name": "round0076_proxy_1774168569", "family_name": "adaptive_budget_topk", "family_stage": "mainline_comparison", "status": null, "decision": null, "payload": {"tier": "proxy", "run_name": "round0076_proxy_1774168569", "family_name": "adaptive_budget_topk", "family_stage": "mainline_comparison", "checkpoint_dir": "/root/sparsify-ascend/checkpoints/research_agent/round_0076_proxy/round0076_proxy_1774168569_dp2_bs1_ga8_ef12_k32_20260322_163616", "metrics_path": "/root/sparsify-ascend/checkpoints/research_agent/round_0076_proxy/round0076_proxy_1774168569_dp2_bs1_ga8_ef12_k32_20260322_163616/metrics.jsonl", "latest_step": 152, "latest_tokens_per_sec": 41504.61751195767, "baseline_ratio": 0.9999999145697958, "latest_total_tokens": 4980736.0, "proxy_mode": "fast", "evaluation_basis": "terminal_only"}}
{"event_id": "evt_1774168689598359766", "ts": 1774168689, "event": "training_finished", "round": 76, "session_id": "019d1496-cd26-7b90-a74e-d93c12b3512b", "tier": "proxy", "run_name": "round0076_proxy_1774168569", "family_name": "adaptive_budget_topk", "family_stage": "mainline_comparison", "status": "ok", "decision": "incubate", "payload": {"tier": "proxy", "run_name": "round0076_proxy_1774168569", "family_name": "adaptive_budget_topk", "family_stage": "mainline_comparison", "checkpoint_dir": "/root/sparsify-ascend/checkpoints/research_agent/round_0076_proxy/round0076_proxy_1774168569_dp2_bs1_ga8_ef12_k32_20260322_163616", "metrics_path": "/root/sparsify-ascend/checkpoints/research_agent/round_0076_proxy/round0076_proxy_1774168569_dp2_bs1_ga8_ef12_k32_20260322_163616/metrics.jsonl", "run_health": "normal", "termination_reason": "completed", "tokens_per_sec": 41504.61751195767, "baseline_ratio": 0.9999999145697958, "status": "ok", "decision": "incubate", "proxy_mode": "fast", "evaluation_basis": "terminal_only", "curve_start_fvu": 0.5629972219467163, "curve_mid_fvu": 0.45672035217285156, "curve_end_fvu": 0.4318459630012512, "curve_late_slope": 2.261825307692972e-09, "curve_still_improving": false}}
{"event_id": "evt_1774168689598420213", "ts": 1774168689, "event": "result_recorded", "round": 76, "session_id": "019d1496-cd26-7b90-a74e-d93c12b3512b", "tier": "proxy", "run_name": "round0076_proxy_1774168569", "family_name": "adaptive_budget_topk", "family_stage": "mainline_comparison", "status": "ok", "decision": "incubate", "payload": {"tier": "proxy", "run_name": "round0076_proxy_1774168569", "family_name": "adaptive_budget_topk", "family_stage": "mainline_comparison", "status": "ok", "decision": "incubate", "val_fvu": "0.43356696516275406", "observed_fvu": "0.431846", "k": "32", "log_path": "/root/sparsify-ascend/research/history/logs/proxy_1774168689.log", "checkpoint": null}}
{"event_id": "evt_1774168689598555954", "ts": 1774168689, "event": "round_finished", "round": 76, "session_id": "019d1496-cd26-7b90-a74e-d93c12b3512b", "tier": "proxy", "run_name": null, "family_name": "adaptive_budget_topk", "family_stage": "mainline_comparison", "status": "ok", "decision": "incubate", "payload": {"tier": "proxy", "family_name": "adaptive_budget_topk", "family_stage": "mainline_comparison", "status": "ok", "decision": "incubate", "val_fvu": "0.43356696516275406"}}
{"event_id": "evt_1774168689606933693", "ts": 1774168689, "event": "experiment_commit_prepared", "round": 76, "tier": "proxy", "run_name": null, "family_name": "adaptive_budget_topk", "family_stage": "mainline_comparison", "status": "ok", "decision": "incubate", "payload": {"branch": "autoresearch-sae"}}
{"event_id": "evt_1774168698082568849", "ts": 1774168698, "event": "round_started", "round": 77, "session_id": "019d1496-cd26-7b90-a74e-d93c12b3512b", "tier": null, "run_name": null, "family_name": null, "family_stage": null, "status": "started", "decision": null, "payload": {"status": "started"}}
{"event_id": "evt_1774168698156373494", "ts": 1774168698, "event": "agent_deciding", "round": 77, "session_id": "019d1496-cd26-7b90-a74e-d93c12b3512b", "tier": null, "run_name": null, "family_name": null, "family_stage": null, "status": null, "decision": null, "payload": {}}
{"event_id": "evt_1774168698395329417", "ts": 1774168698, "event": "session_rebuilt", "round": 77, "tier": null, "run_name": null, "family_name": null, "family_stage": null, "status": "recreated", "decision": null, "payload": {"previous_session_id": "019d1496-cd26-7b90-a74e-d93c12b3512b", "previous_status": "active", "previous_rounds": 8, "previous_age_hours": 0.4693}}
{"event_id": "evt_1774168865295300343", "ts": 1774168865, "event": "session_started", "round": 77, "tier": null, "run_name": null, "family_name": null, "family_stage": null, "status": "active", "decision": null, "payload": {"session_id": "019d14b3-7a66-7a10-a3d2-e744f4a315a4"}}
{"event_id": "evt_1774168865296556995", "ts": 1774168865, "event": "agent_action_received", "round": 77, "session_id": "019d14b3-7a66-7a10-a3d2-e744f4a315a4", "tier": "proxy", "run_name": null, "family_name": "multi_branch_gated", "family_stage": "stabilize", "status": null, "decision": null, "payload": {"session_id": "019d14b3-7a66-7a10-a3d2-e744f4a315a4", "tier": "proxy", "family_name": "multi_branch_gated", "family_stage": "stabilize", "change_type": "param_only", "expected_win": "smaller_k", "hypothesis": "After 27 no-improve rounds and 13 rounds without a new family, the least-bad informative move is a real low-K architecture pivot: run `multi_branch_gated` at `K=32`, `EF=16` with the stable `signum`/`lr=1.6e-3`/`auxk_alpha=0` recipe to test whether branch-specialized gated routing preserves more quality than the current low-K residual families under the required `EF<=16` regime."}}
{"event_id": "evt_1774168865296679710", "ts": 1774168865, "event": "variable_isolation_warning", "round": 77, "session_id": "019d14b3-7a66-7a10-a3d2-e744f4a315a4", "tier": null, "run_name": null, "family_name": "multi_branch_gated", "family_stage": "stabilize", "status": null, "decision": null, "payload": {"violation": "Multiple primary variables changed simultaneously: architecture, k, lr"}}
{"event_id": "evt_1774168865296737440", "ts": 1774168865, "event": "proxy_mode_selected", "round": 77, "session_id": "019d14b3-7a66-7a10-a3d2-e744f4a315a4", "tier": "proxy", "run_name": null, "family_name": "multi_branch_gated", "family_stage": "stabilize", "status": null, "decision": null, "payload": {"tier": "proxy", "proxy_mode": "fast", "evaluation_basis": "terminal_only", "parameter_behavior": "structural", "proxy_max_tokens": "5000000"}}
