{"event_id": "evt_1774140457734397277", "ts": 1774140457, "event": "training_heartbeat", "round": 21, "session_id": "019d12cf-0aba-71d0-8920-5ea920811f62", "tier": "full", "run_name": "round0021_full_1774140397", "family_name": "lowrank_residual", "family_stage": "stabilize", "status": null, "decision": null, "payload": {"tier": "full", "run_name": "round0021_full_1774140397", "family_name": "lowrank_residual", "family_stage": "stabilize", "checkpoint_dir": "/root/sparsify-ascend/checkpoints/research_agent/round_0021_full/round0021_full_1774140397_dp2_bs1_ga8_ef32_k128_20260322_084644", "metrics_path": "/root/sparsify-ascend/checkpoints/research_agent/round_0021_full/round0021_full_1774140397_dp2_bs1_ga8_ef32_k128_20260322_084644/metrics.jsonl", "latest_step": 110, "latest_tokens_per_sec": 60072.562703896874, "baseline_ratio": 0.3609076583355415, "latest_total_tokens": 3604480.0, "proxy_mode": null, "evaluation_basis": null}}
{"event_id": "evt_1774140487735946683", "ts": 1774140487, "event": "training_heartbeat", "round": 21, "session_id": "019d12cf-0aba-71d0-8920-5ea920811f62", "tier": "full", "run_name": "round0021_full_1774140397", "family_name": "lowrank_residual", "family_stage": "stabilize", "status": null, "decision": null, "payload": {"tier": "full", "run_name": "round0021_full_1774140397", "family_name": "lowrank_residual", "family_stage": "stabilize", "checkpoint_dir": "/root/sparsify-ascend/checkpoints/research_agent/round_0021_full/round0021_full_1774140397_dp2_bs1_ga8_ef32_k128_20260322_084644", "metrics_path": "/root/sparsify-ascend/checkpoints/research_agent/round_0021_full/round0021_full_1774140397_dp2_bs1_ga8_ef32_k128_20260322_084644/metrics.jsonl", "latest_step": 180, "latest_tokens_per_sec": 65533.33847614877, "baseline_ratio": 0.3937152448267874, "latest_total_tokens": 5898240.0, "proxy_mode": null, "evaluation_basis": null}}
{"event_id": "evt_1774140517738113822", "ts": 1774140517, "event": "training_heartbeat", "round": 21, "session_id": "019d12cf-0aba-71d0-8920-5ea920811f62", "tier": "full", "run_name": "round0021_full_1774140397", "family_name": "lowrank_residual", "family_stage": "stabilize", "status": null, "decision": null, "payload": {"tier": "full", "run_name": "round0021_full_1774140397", "family_name": "lowrank_residual", "family_stage": "stabilize", "checkpoint_dir": "/root/sparsify-ascend/checkpoints/research_agent/round_0021_full/round0021_full_1774140397_dp2_bs1_ga8_ef32_k128_20260322_084644", "metrics_path": "/root/sparsify-ascend/checkpoints/research_agent/round_0021_full/round0021_full_1774140397_dp2_bs1_ga8_ef32_k128_20260322_084644/metrics.jsonl", "latest_step": 250, "latest_tokens_per_sec": 68263.47494849372, "baseline_ratio": 0.4101175276131443, "latest_total_tokens": 8192000.0, "proxy_mode": null, "evaluation_basis": null}}
{"event_id": "evt_1774140547740536772", "ts": 1774140547, "event": "training_heartbeat", "round": 21, "session_id": "019d12cf-0aba-71d0-8920-5ea920811f62", "tier": "full", "run_name": "round0021_full_1774140397", "family_name": "lowrank_residual", "family_stage": "stabilize", "status": null, "decision": null, "payload": {"tier": "full", "run_name": "round0021_full_1774140397", "family_name": "lowrank_residual", "family_stage": "stabilize", "checkpoint_dir": "/root/sparsify-ascend/checkpoints/research_agent/round_0021_full/round0021_full_1774140397_dp2_bs1_ga8_ef32_k128_20260322_084644", "metrics_path": "/root/sparsify-ascend/checkpoints/research_agent/round_0021_full/round0021_full_1774140397_dp2_bs1_ga8_ef32_k128_20260322_084644/metrics.jsonl", "latest_step": 330, "latest_tokens_per_sec": 72085.64079037108, "baseline_ratio": 0.433080571999339, "latest_total_tokens": 10813440.0, "proxy_mode": null, "evaluation_basis": null}}
{"event_id": "evt_1774140577743375142", "ts": 1774140577, "event": "training_heartbeat", "round": 21, "session_id": "019d12cf-0aba-71d0-8920-5ea920811f62", "tier": "full", "run_name": "round0021_full_1774140397", "family_name": "lowrank_residual", "family_stage": "stabilize", "status": null, "decision": null, "payload": {"tier": "full", "run_name": "round0021_full_1774140397", "family_name": "lowrank_residual", "family_stage": "stabilize", "checkpoint_dir": "/root/sparsify-ascend/checkpoints/research_agent/round_0021_full/round0021_full_1774140397_dp2_bs1_ga8_ef32_k128_20260322_084644", "metrics_path": "/root/sparsify-ascend/checkpoints/research_agent/round_0021_full/round0021_full_1774140397_dp2_bs1_ga8_ef32_k128_20260322_084644/metrics.jsonl", "latest_step": 400, "latest_tokens_per_sec": 72813.2962827704, "baseline_ratio": 0.43745222567976044, "latest_total_tokens": 13107200.0, "proxy_mode": null, "evaluation_basis": null}}
{"event_id": "evt_1774140607746636953", "ts": 1774140607, "event": "training_heartbeat", "round": 21, "session_id": "019d12cf-0aba-71d0-8920-5ea920811f62", "tier": "full", "run_name": "round0021_full_1774140397", "family_name": "lowrank_residual", "family_stage": "stabilize", "status": null, "decision": null, "payload": {"tier": "full", "run_name": "round0021_full_1774140397", "family_name": "lowrank_residual", "family_stage": "stabilize", "checkpoint_dir": "/root/sparsify-ascend/checkpoints/research_agent/round_0021_full/round0021_full_1774140397_dp2_bs1_ga8_ef32_k128_20260322_084644", "metrics_path": "/root/sparsify-ascend/checkpoints/research_agent/round_0021_full/round0021_full_1774140397_dp2_bs1_ga8_ef32_k128_20260322_084644/metrics.jsonl", "latest_step": 480, "latest_tokens_per_sec": 74893.17356323726, "baseline_ratio": 0.44994784106774677, "latest_total_tokens": 15728640.0, "proxy_mode": null, "evaluation_basis": null}}
{"event_id": "evt_1774140637750302861", "ts": 1774140637, "event": "training_heartbeat", "round": 21, "session_id": "019d12cf-0aba-71d0-8920-5ea920811f62", "tier": "full", "run_name": "round0021_full_1774140397", "family_name": "lowrank_residual", "family_stage": "stabilize", "status": null, "decision": null, "payload": {"tier": "full", "run_name": "round0021_full_1774140397", "family_name": "lowrank_residual", "family_stage": "stabilize", "checkpoint_dir": "/root/sparsify-ascend/checkpoints/research_agent/round_0021_full/round0021_full_1774140397_dp2_bs1_ga8_ef32_k128_20260322_084644", "metrics_path": "/root/sparsify-ascend/checkpoints/research_agent/round_0021_full/round0021_full_1774140397_dp2_bs1_ga8_ef32_k128_20260322_084644/metrics.jsonl", "latest_step": 550, "latest_tokens_per_sec": 75087.7016417322, "baseline_ratio": 0.4511165388913468, "latest_total_tokens": 18022400.0, "proxy_mode": null, "evaluation_basis": null}}
{"event_id": "evt_1774140667754333867", "ts": 1774140667, "event": "training_heartbeat", "round": 21, "session_id": "019d12cf-0aba-71d0-8920-5ea920811f62", "tier": "full", "run_name": "round0021_full_1774140397", "family_name": "lowrank_residual", "family_stage": "stabilize", "status": null, "decision": null, "payload": {"tier": "full", "run_name": "round0021_full_1774140397", "family_name": "lowrank_residual", "family_stage": "stabilize", "checkpoint_dir": "/root/sparsify-ascend/checkpoints/research_agent/round_0021_full/round0021_full_1774140397_dp2_bs1_ga8_ef32_k128_20260322_084644", "metrics_path": "/root/sparsify-ascend/checkpoints/research_agent/round_0021_full/round0021_full_1774140397_dp2_bs1_ga8_ef32_k128_20260322_084644/metrics.jsonl", "latest_step": 620, "latest_tokens_per_sec": 75238.89946328939, "baseline_ratio": 0.45202491451688176, "latest_total_tokens": 20316160.0, "proxy_mode": null, "evaluation_basis": null}}
{"event_id": "evt_1774140697758880803", "ts": 1774140697, "event": "training_heartbeat", "round": 21, "session_id": "019d12cf-0aba-71d0-8920-5ea920811f62", "tier": "full", "run_name": "round0021_full_1774140397", "family_name": "lowrank_residual", "family_stage": "stabilize", "status": null, "decision": null, "payload": {"tier": "full", "run_name": "round0021_full_1774140397", "family_name": "lowrank_residual", "family_stage": "stabilize", "checkpoint_dir": "/root/sparsify-ascend/checkpoints/research_agent/round_0021_full/round0021_full_1774140397_dp2_bs1_ga8_ef32_k128_20260322_084644", "metrics_path": "/root/sparsify-ascend/checkpoints/research_agent/round_0021_full/round0021_full_1774140397_dp2_bs1_ga8_ef32_k128_20260322_084644/metrics.jsonl", "latest_step": 700, "latest_tokens_per_sec": 76451.89507026873, "baseline_ratio": 0.4593124245610939, "latest_total_tokens": 22937600.0, "proxy_mode": null, "evaluation_basis": null}}
{"event_id": "evt_1774140727763732672", "ts": 1774140727, "event": "training_heartbeat", "round": 21, "session_id": "019d12cf-0aba-71d0-8920-5ea920811f62", "tier": "full", "run_name": "round0021_full_1774140397", "family_name": "lowrank_residual", "family_stage": "stabilize", "status": null, "decision": null, "payload": {"tier": "full", "run_name": "round0021_full_1774140397", "family_name": "lowrank_residual", "family_stage": "stabilize", "checkpoint_dir": "/root/sparsify-ascend/checkpoints/research_agent/round_0021_full/round0021_full_1774140397_dp2_bs1_ga8_ef32_k128_20260322_084644", "metrics_path": "/root/sparsify-ascend/checkpoints/research_agent/round_0021_full/round0021_full_1774140397_dp2_bs1_ga8_ef32_k128_20260322_084644/metrics.jsonl", "latest_step": 770, "latest_tokens_per_sec": 76451.3861336725, "baseline_ratio": 0.4593093669403279, "latest_total_tokens": 25231360.0, "proxy_mode": null, "evaluation_basis": null}}
{"event_id": "evt_1774140757769059218", "ts": 1774140757, "event": "training_heartbeat", "round": 21, "session_id": "019d12cf-0aba-71d0-8920-5ea920811f62", "tier": "full", "run_name": "round0021_full_1774140397", "family_name": "lowrank_residual", "family_stage": "stabilize", "status": null, "decision": null, "payload": {"tier": "full", "run_name": "round0021_full_1774140397", "family_name": "lowrank_residual", "family_stage": "stabilize", "checkpoint_dir": "/root/sparsify-ascend/checkpoints/research_agent/round_0021_full/round0021_full_1774140397_dp2_bs1_ga8_ef32_k128_20260322_084644", "metrics_path": "/root/sparsify-ascend/checkpoints/research_agent/round_0021_full/round0021_full_1774140397_dp2_bs1_ga8_ef32_k128_20260322_084644/metrics.jsonl", "latest_step": 850, "latest_tokens_per_sec": 77360.99078452827, "baseline_ratio": 0.46477414603040296, "latest_total_tokens": 27852800.0, "proxy_mode": null, "evaluation_basis": null}}
{"event_id": "evt_1774140787774745567", "ts": 1774140787, "event": "training_heartbeat", "round": 21, "session_id": "019d12cf-0aba-71d0-8920-5ea920811f62", "tier": "full", "run_name": "round0021_full_1774140397", "family_name": "lowrank_residual", "family_stage": "stabilize", "status": null, "decision": null, "payload": {"tier": "full", "run_name": "round0021_full_1774140397", "family_name": "lowrank_residual", "family_stage": "stabilize", "checkpoint_dir": "/root/sparsify-ascend/checkpoints/research_agent/round_0021_full/round0021_full_1774140397_dp2_bs1_ga8_ef32_k128_20260322_084644", "metrics_path": "/root/sparsify-ascend/checkpoints/research_agent/round_0021_full/round0021_full_1774140397_dp2_bs1_ga8_ef32_k128_20260322_084644/metrics.jsonl", "latest_step": 920, "latest_tokens_per_sec": 77290.46073616677, "baseline_ratio": 0.4643504112428276, "latest_total_tokens": 30146560.0, "proxy_mode": null, "evaluation_basis": null}}
{"event_id": "evt_1774140817780909276", "ts": 1774140817, "event": "training_heartbeat", "round": 21, "session_id": "019d12cf-0aba-71d0-8920-5ea920811f62", "tier": "full", "run_name": "round0021_full_1774140397", "family_name": "lowrank_residual", "family_stage": "stabilize", "status": null, "decision": null, "payload": {"tier": "full", "run_name": "round0021_full_1774140397", "family_name": "lowrank_residual", "family_stage": "stabilize", "checkpoint_dir": "/root/sparsify-ascend/checkpoints/research_agent/round_0021_full/round0021_full_1774140397_dp2_bs1_ga8_ef32_k128_20260322_084644", "metrics_path": "/root/sparsify-ascend/checkpoints/research_agent/round_0021_full/round0021_full_1774140397_dp2_bs1_ga8_ef32_k128_20260322_084644/metrics.jsonl", "latest_step": 990, "latest_tokens_per_sec": 77229.9247536212, "baseline_ratio": 0.4639867194220999, "latest_total_tokens": 32440320.0, "proxy_mode": null, "evaluation_basis": null}}
{"event_id": "evt_1774140847787413629", "ts": 1774140847, "event": "training_heartbeat", "round": 21, "session_id": "019d12cf-0aba-71d0-8920-5ea920811f62", "tier": "full", "run_name": "round0021_full_1774140397", "family_name": "lowrank_residual", "family_stage": "stabilize", "status": null, "decision": null, "payload": {"tier": "full", "run_name": "round0021_full_1774140397", "family_name": "lowrank_residual", "family_stage": "stabilize", "checkpoint_dir": "/root/sparsify-ascend/checkpoints/research_agent/round_0021_full/round0021_full_1774140397_dp2_bs1_ga8_ef32_k128_20260322_084644", "metrics_path": "/root/sparsify-ascend/checkpoints/research_agent/round_0021_full/round0021_full_1774140397_dp2_bs1_ga8_ef32_k128_20260322_084644/metrics.jsonl", "latest_step": 1050, "latest_tokens_per_sec": 76449.30903892059, "baseline_ratio": 0.45929688804198715, "latest_total_tokens": 34406400.0, "proxy_mode": null, "evaluation_basis": null}}
{"event_id": "evt_1774140877794271851", "ts": 1774140877, "event": "training_heartbeat", "round": 21, "session_id": "019d12cf-0aba-71d0-8920-5ea920811f62", "tier": "full", "run_name": "round0021_full_1774140397", "family_name": "lowrank_residual", "family_stage": "stabilize", "status": null, "decision": null, "payload": {"tier": "full", "run_name": "round0021_full_1774140397", "family_name": "lowrank_residual", "family_stage": "stabilize", "checkpoint_dir": "/root/sparsify-ascend/checkpoints/research_agent/round_0021_full/round0021_full_1774140397_dp2_bs1_ga8_ef32_k128_20260322_084644", "metrics_path": "/root/sparsify-ascend/checkpoints/research_agent/round_0021_full/round0021_full_1774140397_dp2_bs1_ga8_ef32_k128_20260322_084644/metrics.jsonl", "latest_step": 1120, "latest_tokens_per_sec": 76448.79999845962, "baseline_ratio": 0.4592938297972162, "latest_total_tokens": 36700160.0, "proxy_mode": null, "evaluation_basis": null}}
{"event_id": "evt_1774140907801627300", "ts": 1774140907, "event": "training_heartbeat", "round": 21, "session_id": "019d12cf-0aba-71d0-8920-5ea920811f62", "tier": "full", "run_name": "round0021_full_1774140397", "family_name": "lowrank_residual", "family_stage": "stabilize", "status": null, "decision": null, "payload": {"tier": "full", "run_name": "round0021_full_1774140397", "family_name": "lowrank_residual", "family_stage": "stabilize", "checkpoint_dir": "/root/sparsify-ascend/checkpoints/research_agent/round_0021_full/round0021_full_1774140397_dp2_bs1_ga8_ef32_k128_20260322_084644", "metrics_path": "/root/sparsify-ascend/checkpoints/research_agent/round_0021_full/round0021_full_1774140397_dp2_bs1_ga8_ef32_k128_20260322_084644/metrics.jsonl", "latest_step": 1200, "latest_tokens_per_sec": 77090.70247553823, "baseline_ratio": 0.46315029120746326, "latest_total_tokens": 39321600.0, "proxy_mode": null, "evaluation_basis": null}}
{"event_id": "evt_1774140937863221997", "ts": 1774140937, "event": "training_heartbeat", "round": 21, "session_id": "019d12cf-0aba-71d0-8920-5ea920811f62", "tier": "full", "run_name": "round0021_full_1774140397", "family_name": "lowrank_residual", "family_stage": "stabilize", "status": null, "decision": null, "payload": {"tier": "full", "run_name": "round0021_full_1774140397", "family_name": "lowrank_residual", "family_stage": "stabilize", "checkpoint_dir": "/root/sparsify-ascend/checkpoints/research_agent/round_0021_full/round0021_full_1774140397_dp2_bs1_ga8_ef32_k128_20260322_084644", "metrics_path": "/root/sparsify-ascend/checkpoints/research_agent/round_0021_full/round0021_full_1774140397_dp2_bs1_ga8_ef32_k128_20260322_084644/metrics.jsonl", "latest_step": 1220, "latest_tokens_per_sec": 74020.89324532959, "baseline_ratio": 0.4447073014140619, "latest_total_tokens": 39976960.0, "proxy_mode": null, "evaluation_basis": null}}
{"event_id": "evt_1774140967870731483", "ts": 1774140967, "event": "training_heartbeat", "round": 21, "session_id": "019d12cf-0aba-71d0-8920-5ea920811f62", "tier": "full", "run_name": "round0021_full_1774140397", "family_name": "lowrank_residual", "family_stage": "stabilize", "status": null, "decision": null, "payload": {"tier": "full", "run_name": "round0021_full_1774140397", "family_name": "lowrank_residual", "family_stage": "stabilize", "checkpoint_dir": "/root/sparsify-ascend/checkpoints/research_agent/round_0021_full/round0021_full_1774140397_dp2_bs1_ga8_ef32_k128_20260322_084644", "metrics_path": "/root/sparsify-ascend/checkpoints/research_agent/round_0021_full/round0021_full_1774140397_dp2_bs1_ga8_ef32_k128_20260322_084644/metrics.jsonl", "latest_step": 1220, "latest_tokens_per_sec": 70117.99347858068, "baseline_ratio": 0.4212592187597772, "latest_total_tokens": 39976960.0, "proxy_mode": null, "evaluation_basis": null}}
{"event_id": "evt_1774140967946366596", "ts": 1774140967, "event": "training_finished", "round": 21, "session_id": "019d12cf-0aba-71d0-8920-5ea920811f62", "tier": "full", "run_name": "round0021_full_1774140397", "family_name": "lowrank_residual", "family_stage": "stabilize", "status": "ok", "decision": "keep", "payload": {"tier": "full", "run_name": "round0021_full_1774140397", "family_name": "lowrank_residual", "family_stage": "stabilize", "checkpoint_dir": "/root/sparsify-ascend/checkpoints/research_agent/round_0021_full/round0021_full_1774140397_dp2_bs1_ga8_ef32_k128_20260322_084644", "metrics_path": "/root/sparsify-ascend/checkpoints/research_agent/round_0021_full/round0021_full_1774140397_dp2_bs1_ga8_ef32_k128_20260322_084644/metrics.jsonl", "run_health": "normal", "termination_reason": "completed", "tokens_per_sec": 70117.99347858068, "baseline_ratio": 0.4212592187597772, "status": "ok", "decision": "keep", "proxy_mode": null, "evaluation_basis": null, "curve_start_fvu": 0.10155387222766876, "curve_mid_fvu": 0.08509042859077454, "curve_end_fvu": 0.06640064716339111, "curve_late_slope": -1.1430428771075e-09, "curve_still_improving": true}}
{"event_id": "evt_1774140967946448137", "ts": 1774140967, "event": "result_recorded", "round": 21, "session_id": "019d12cf-0aba-71d0-8920-5ea920811f62", "tier": "full", "run_name": "round0021_full_1774140397", "family_name": "lowrank_residual", "family_stage": "stabilize", "status": "ok", "decision": "keep", "payload": {"tier": "full", "run_name": "round0021_full_1774140397", "family_name": "lowrank_residual", "family_stage": "stabilize", "status": "ok", "decision": "keep", "val_fvu": "0.06766715925186872", "observed_fvu": "0.066401", "k": "128", "log_path": "/root/sparsify-ascend/research/history/logs/full_1774140967.log", "checkpoint": null}}
{"event_id": "evt_1774140967946968867", "ts": 1774140967, "event": "round_finished", "round": 21, "session_id": "019d12cf-0aba-71d0-8920-5ea920811f62", "tier": "full", "run_name": null, "family_name": "lowrank_residual", "family_stage": "stabilize", "status": "ok", "decision": "keep", "payload": {"tier": "full", "family_name": "lowrank_residual", "family_stage": "stabilize", "status": "ok", "decision": "keep", "val_fvu": "0.06766715925186872"}}
{"event_id": "evt_1774140967953273783", "ts": 1774140967, "event": "experiment_commit_prepared", "round": 21, "tier": "full", "run_name": null, "family_name": "lowrank_residual", "family_stage": "stabilize", "status": "ok", "decision": "keep", "payload": {"branch": "autoresearch-sae"}}
{"event_id": "evt_1774140975441827022", "ts": 1774140975, "event": "round_started", "round": 22, "session_id": "019d12cf-0aba-71d0-8920-5ea920811f62", "tier": null, "run_name": null, "family_name": null, "family_stage": null, "status": "started", "decision": null, "payload": {"status": "started"}}
{"event_id": "evt_1774140975442120116", "ts": 1774140975, "event": "agent_deciding", "round": 22, "session_id": "019d12cf-0aba-71d0-8920-5ea920811f62", "tier": null, "run_name": null, "family_name": null, "family_stage": null, "status": null, "decision": null, "payload": {}}
{"event_id": "evt_1774140975444007546", "ts": 1774140975, "event": "session_rebuilt", "round": 22, "tier": null, "run_name": null, "family_name": null, "family_stage": null, "status": "recreated", "decision": null, "payload": {"previous_session_id": "019d12cf-0aba-71d0-8920-5ea920811f62", "previous_status": "active", "previous_rounds": 8, "previous_age_hours": 1.0762}}
{"event_id": "evt_1774141178998152663", "ts": 1774141178, "event": "session_started", "round": 22, "tier": null, "run_name": null, "family_name": null, "family_stage": null, "status": "active", "decision": null, "payload": {"session_id": "019d130c-782e-75a2-aa6f-506b18d29edf"}}
{"event_id": "evt_1774141178998776430", "ts": 1774141178, "event": "agent_action_received", "round": 22, "session_id": "019d130c-782e-75a2-aa6f-506b18d29edf", "tier": "proxy", "run_name": null, "family_name": "lowrank_gated_residual", "family_stage": "prototype", "status": null, "decision": null, "payload": {"session_id": "019d130c-782e-75a2-aa6f-506b18d29edf", "tier": "proxy", "family_name": "lowrank_gated_residual", "family_stage": "prototype", "change_type": "edit_sae_code", "expected_win": "lower_fvu", "hypothesis": "The current `lowrank_residual` family has finished a clean EF=32 stabilization sweep across K={32,64,128}, and the search has gone many rounds without a new family. A narrow next bet is to keep the winning low-rank trunk intact and change only the sparse residual selector: add a gated residual branch so support selection can focus sparse capacity on the hardest residual directions at the K=128 quality anchor. If low-rank decomposition is already the right backbone, this should be a higher-signal architecture probe than another local sweep on the existing family."}}
