{"event_id": "evt_1774167685917471907", "ts": 1774167685, "event": "round_finished", "round": 71, "session_id": "019d1496-cd26-7b90-a74e-d93c12b3512b", "tier": "proxy", "run_name": null, "family_name": "routed", "family_stage": "mainline_comparison", "status": "ok", "decision": "incubate", "payload": {"tier": "proxy", "family_name": "routed", "family_stage": "mainline_comparison", "status": "ok", "decision": "incubate", "val_fvu": "0.3757335729897022"}}
{"event_id": "evt_1774167686427832999", "ts": 1774167686, "event": "experiment_commit_prepared", "round": 71, "tier": "proxy", "run_name": null, "family_name": "routed", "family_stage": "mainline_comparison", "status": "ok", "decision": "incubate", "payload": {"branch": "autoresearch-sae"}}
{"event_id": "evt_1774167694730882928", "ts": 1774167694, "event": "round_started", "round": 72, "session_id": "019d1496-cd26-7b90-a74e-d93c12b3512b", "tier": null, "run_name": null, "family_name": null, "family_stage": null, "status": "started", "decision": null, "payload": {"status": "started"}}
{"event_id": "evt_1774167694731036119", "ts": 1774167694, "event": "agent_deciding", "round": 72, "session_id": "019d1496-cd26-7b90-a74e-d93c12b3512b", "tier": null, "run_name": null, "family_name": null, "family_stage": null, "status": null, "decision": null, "payload": {}}
{"event_id": "evt_1774167822092659086", "ts": 1774167822, "event": "session_resumed", "round": 72, "tier": null, "run_name": null, "family_name": null, "family_stage": null, "status": "active", "decision": null, "payload": {"session_id": "019d1496-cd26-7b90-a74e-d93c12b3512b"}}
{"event_id": "evt_1774167822093883561", "ts": 1774167822, "event": "agent_action_received", "round": 72, "session_id": "019d1496-cd26-7b90-a74e-d93c12b3512b", "tier": "proxy", "run_name": null, "family_name": "two_stage_residual", "family_stage": "mainline_comparison", "status": null, "decision": null, "payload": {"session_id": "019d1496-cd26-7b90-a74e-d93c12b3512b", "tier": "proxy", "family_name": "two_stage_residual", "family_stage": "mainline_comparison", "change_type": "param_only", "expected_win": "explore_unknown", "hypothesis": "`routed` at the refreshed low-K mainline target (`K=32`, `EF=12`) remained weak, so the next informative move is to keep that target fixed and test a different non-TopK architecture family with real prior signal. Run `two_stage_residual` at `K=32`, `EF=12` with the shared `signum`/`LR=1.6e-3`/`AUXK_ALPHA=0` recipe to see whether coarse-to-fine residual allocation recovers useful low-K quality where explicit routing did not."}}
{"event_id": "evt_1774167822093999876", "ts": 1774167822, "event": "variable_isolation_warning", "round": 72, "session_id": "019d1496-cd26-7b90-a74e-d93c12b3512b", "tier": null, "run_name": null, "family_name": "two_stage_residual", "family_stage": "mainline_comparison", "status": null, "decision": null, "payload": {"violation": "Multiple primary variables changed simultaneously: architecture, k, lr"}}
{"event_id": "evt_1774167822094058058", "ts": 1774167822, "event": "proxy_mode_selected", "round": 72, "session_id": "019d1496-cd26-7b90-a74e-d93c12b3512b", "tier": "proxy", "run_name": null, "family_name": "two_stage_residual", "family_stage": "mainline_comparison", "status": null, "decision": null, "payload": {"tier": "proxy", "proxy_mode": "fast", "evaluation_basis": "terminal_only", "parameter_behavior": "structural", "proxy_max_tokens": "5000000"}}
{"event_id": "evt_1774167822094353357", "ts": 1774167822, "event": "training_started", "round": 72, "session_id": "019d1496-cd26-7b90-a74e-d93c12b3512b", "tier": "proxy", "run_name": "round0072_proxy_1774167822", "family_name": "two_stage_residual", "family_stage": "mainline_comparison", "status": null, "decision": null, "payload": {"tier": "proxy", "run_name": "round0072_proxy_1774167822", "family_name": "two_stage_residual", "family_stage": "mainline_comparison", "checkpoint_dir": "/root/sparsify-ascend/checkpoints/research_agent/round_0072_proxy", "log_path": "/root/sparsify-ascend/research/history/logs/round0072_proxy_1774167822.log", "config": {"architecture": "two_stage_residual", "expansion_factor": 12, "k": 32, "optimizer": "signum", "lr": "1.6e-3", "hookpoints": "layers.[3].self_attn.o_proj", "batch_size": 1, "grad_acc_steps": 8, "micro_acc_steps": 1, "auxk_alpha": 0.0, "dead_feature_threshold": 10000000, "use_hadamard": false, "tier": "proxy", "family_name": "two_stage_residual", "family_stage": "mainline_comparison"}, "baseline_tokens_per_sec": 111037.42023476404, "proxy_mode": "fast", "evaluation_basis": "terminal_only"}}
{"event_id": "evt_1774167852095824308", "ts": 1774167852, "event": "training_heartbeat", "round": 72, "session_id": "019d1496-cd26-7b90-a74e-d93c12b3512b", "tier": "proxy", "run_name": "round0072_proxy_1774167822", "family_name": "two_stage_residual", "family_stage": "mainline_comparison", "status": null, "decision": null, "payload": {"tier": "proxy", "run_name": "round0072_proxy_1774167822", "family_name": "two_stage_residual", "family_stage": "mainline_comparison", "checkpoint_dir": "/root/sparsify-ascend/checkpoints/research_agent/round_0072_proxy/round0072_proxy_1774167822_dp2_bs1_ga8_ef12_k32_20260322_162348", "metrics_path": "/root/sparsify-ascend/checkpoints/research_agent/round_0072_proxy/round0072_proxy_1774167822_dp2_bs1_ga8_ef12_k32_20260322_162348/metrics.jsonl", "latest_step": 80, "latest_tokens_per_sec": 87377.8883302688, "baseline_ratio": 0.7869228963130412, "latest_total_tokens": 2621440.0, "proxy_mode": "fast", "evaluation_basis": "terminal_only"}}
{"event_id": "evt_1774167882232220008", "ts": 1774167882, "event": "training_heartbeat", "round": 72, "session_id": "019d1496-cd26-7b90-a74e-d93c12b3512b", "tier": "proxy", "run_name": "round0072_proxy_1774167822", "family_name": "two_stage_residual", "family_stage": "mainline_comparison", "status": null, "decision": null, "payload": {"tier": "proxy", "run_name": "round0072_proxy_1774167822", "family_name": "two_stage_residual", "family_stage": "mainline_comparison", "checkpoint_dir": "/root/sparsify-ascend/checkpoints/research_agent/round_0072_proxy/round0072_proxy_1774167822_dp2_bs1_ga8_ef12_k32_20260322_162348", "metrics_path": "/root/sparsify-ascend/checkpoints/research_agent/round_0072_proxy/round0072_proxy_1774167822_dp2_bs1_ga8_ef12_k32_20260322_162348/metrics.jsonl", "latest_step": 152, "latest_tokens_per_sec": 83008.60998747221, "baseline_ratio": 0.7475732938676789, "latest_total_tokens": 4980736.0, "proxy_mode": "fast", "evaluation_basis": "terminal_only"}}
{"event_id": "evt_1774167883171164965", "ts": 1774167883, "event": "training_finished", "round": 72, "session_id": "019d1496-cd26-7b90-a74e-d93c12b3512b", "tier": "proxy", "run_name": "round0072_proxy_1774167822", "family_name": "two_stage_residual", "family_stage": "mainline_comparison", "status": "ok", "decision": "incubate", "payload": {"tier": "proxy", "run_name": "round0072_proxy_1774167822", "family_name": "two_stage_residual", "family_stage": "mainline_comparison", "checkpoint_dir": "/root/sparsify-ascend/checkpoints/research_agent/round_0072_proxy/round0072_proxy_1774167822_dp2_bs1_ga8_ef12_k32_20260322_162348", "metrics_path": "/root/sparsify-ascend/checkpoints/research_agent/round_0072_proxy/round0072_proxy_1774167822_dp2_bs1_ga8_ef12_k32_20260322_162348/metrics.jsonl", "run_health": "normal", "termination_reason": "completed", "tokens_per_sec": 83008.60998747221, "baseline_ratio": 0.7475732938676789, "status": "ok", "decision": "incubate", "proxy_mode": "fast", "evaluation_basis": "terminal_only", "curve_start_fvu": 0.5552037954330444, "curve_mid_fvu": 0.4139292538166046, "curve_end_fvu": 0.3560715317726135, "curve_late_slope": -8.199593491641985e-09, "curve_still_improving": true}}
{"event_id": "evt_1774167883171256306", "ts": 1774167883, "event": "result_recorded", "round": 72, "session_id": "019d1496-cd26-7b90-a74e-d93c12b3512b", "tier": "proxy", "run_name": "round0072_proxy_1774167822", "family_name": "two_stage_residual", "family_stage": "mainline_comparison", "status": "ok", "decision": "incubate", "payload": {"tier": "proxy", "run_name": "round0072_proxy_1774167822", "family_name": "two_stage_residual", "family_stage": "mainline_comparison", "status": "ok", "decision": "incubate", "val_fvu": "0.3559596575796604", "observed_fvu": "0.356072", "k": "32", "log_path": "/root/sparsify-ascend/research/history/logs/proxy_1774167882.log", "checkpoint": null}}
{"event_id": "evt_1774167883171419622", "ts": 1774167883, "event": "round_finished", "round": 72, "session_id": "019d1496-cd26-7b90-a74e-d93c12b3512b", "tier": "proxy", "run_name": null, "family_name": "two_stage_residual", "family_stage": "mainline_comparison", "status": "ok", "decision": "incubate", "payload": {"tier": "proxy", "family_name": "two_stage_residual", "family_stage": "mainline_comparison", "status": "ok", "decision": "incubate", "val_fvu": "0.3559596575796604"}}
{"event_id": "evt_1774167883642454599", "ts": 1774167883, "event": "experiment_commit_prepared", "round": 72, "tier": "proxy", "run_name": null, "family_name": "two_stage_residual", "family_stage": "mainline_comparison", "status": "ok", "decision": "incubate", "payload": {"branch": "autoresearch-sae"}}
{"event_id": "evt_1774167892076635704", "ts": 1774167892, "event": "round_started", "round": 73, "session_id": "019d1496-cd26-7b90-a74e-d93c12b3512b", "tier": null, "run_name": null, "family_name": null, "family_stage": null, "status": "started", "decision": null, "payload": {"status": "started"}}
{"event_id": "evt_1774167892076782853", "ts": 1774167892, "event": "agent_deciding", "round": 73, "session_id": "019d1496-cd26-7b90-a74e-d93c12b3512b", "tier": null, "run_name": null, "family_name": null, "family_stage": null, "status": null, "decision": null, "payload": {}}
{"event_id": "evt_1774168019024746313", "ts": 1774168019, "event": "session_resumed", "round": 73, "tier": null, "run_name": null, "family_name": null, "family_stage": null, "status": "active", "decision": null, "payload": {"session_id": "019d1496-cd26-7b90-a74e-d93c12b3512b"}}
{"event_id": "evt_1774168019028766537", "ts": 1774168019, "event": "agent_action_received", "round": 73, "session_id": "019d1496-cd26-7b90-a74e-d93c12b3512b", "tier": "proxy", "run_name": null, "family_name": "lowrank_grouped_residual", "family_stage": "mainline_comparison", "status": null, "decision": null, "payload": {"session_id": "019d1496-cd26-7b90-a74e-d93c12b3512b", "tier": "proxy", "family_name": "lowrank_grouped_residual", "family_stage": "mainline_comparison", "change_type": "param_only", "expected_win": "explore_unknown", "hypothesis": "`two_stage_residual` at the refreshed low-K mainline target (`K=32`, `EF=12`) remained weak, so the next informative move is to keep that lower-K target fixed and test a different architecture that changes the access pattern itself. Run `lowrank_grouped_residual` at `K=32`, `EF=12` with the shared `signum`/`LR=1.6e-3`/`AUXK_ALPHA=0` recipe to check whether grouped residual competition yields a better low-K quality/deployment tradeoff than the recent routed and two-stage variants."}}
{"event_id": "evt_1774168019028876559", "ts": 1774168019, "event": "variable_isolation_warning", "round": 73, "session_id": "019d1496-cd26-7b90-a74e-d93c12b3512b", "tier": null, "run_name": null, "family_name": "lowrank_grouped_residual", "family_stage": "mainline_comparison", "status": null, "decision": null, "payload": {"violation": "Multiple primary variables changed simultaneously: architecture, k, lr"}}
{"event_id": "evt_1774168019028932120", "ts": 1774168019, "event": "proxy_mode_selected", "round": 73, "session_id": "019d1496-cd26-7b90-a74e-d93c12b3512b", "tier": "proxy", "run_name": null, "family_name": "lowrank_grouped_residual", "family_stage": "mainline_comparison", "status": null, "decision": null, "payload": {"tier": "proxy", "proxy_mode": "fast", "evaluation_basis": "terminal_only", "parameter_behavior": "structural", "proxy_max_tokens": "5000000"}}
{"event_id": "evt_1774168019029182022", "ts": 1774168019, "event": "training_started", "round": 73, "session_id": "019d1496-cd26-7b90-a74e-d93c12b3512b", "tier": "proxy", "run_name": "round0073_proxy_1774168019", "family_name": "lowrank_grouped_residual", "family_stage": "mainline_comparison", "status": null, "decision": null, "payload": {"tier": "proxy", "run_name": "round0073_proxy_1774168019", "family_name": "lowrank_grouped_residual", "family_stage": "mainline_comparison", "checkpoint_dir": "/root/sparsify-ascend/checkpoints/research_agent/round_0073_proxy", "log_path": "/root/sparsify-ascend/research/history/logs/round0073_proxy_1774168019.log", "config": {"architecture": "lowrank_grouped_residual", "expansion_factor": 12, "k": 32, "optimizer": "signum", "lr": "1.6e-3", "hookpoints": "layers.[3].self_attn.o_proj", "batch_size": 1, "grad_acc_steps": 8, "micro_acc_steps": 1, "auxk_alpha": 0.0, "dead_feature_threshold": 10000000, "use_hadamard": false, "tier": "proxy", "family_name": "lowrank_grouped_residual", "family_stage": "mainline_comparison"}, "baseline_tokens_per_sec": 83007.91206872014, "proxy_mode": "fast", "evaluation_basis": "terminal_only"}}
{"event_id": "evt_1774168049031709982", "ts": 1774168049, "event": "training_heartbeat", "round": 73, "session_id": "019d1496-cd26-7b90-a74e-d93c12b3512b", "tier": "proxy", "run_name": "round0073_proxy_1774168019", "family_name": "lowrank_grouped_residual", "family_stage": "mainline_comparison", "status": null, "decision": null, "payload": {"tier": "proxy", "run_name": "round0073_proxy_1774168019", "family_name": "lowrank_grouped_residual", "family_stage": "mainline_comparison", "checkpoint_dir": "/root/sparsify-ascend/checkpoints/research_agent/round_0073_proxy/round0073_proxy_1774168019_dp2_bs1_ga8_ef12_k32_20260322_162705", "metrics_path": "/root/sparsify-ascend/checkpoints/research_agent/round_0073_proxy/round0073_proxy_1774168019_dp2_bs1_ga8_ef12_k32_20260322_162705/metrics.jsonl", "latest_step": 130, "latest_tokens_per_sec": 141984.5359658885, "baseline_ratio": 1.7104940050575315, "latest_total_tokens": 4259840.0, "proxy_mode": "fast", "evaluation_basis": "terminal_only"}}
{"event_id": "evt_1774168079033168641", "ts": 1774168079, "event": "training_heartbeat", "round": 73, "session_id": "019d1496-cd26-7b90-a74e-d93c12b3512b", "tier": "proxy", "run_name": "round0073_proxy_1774168019", "family_name": "lowrank_grouped_residual", "family_stage": "mainline_comparison", "status": null, "decision": null, "payload": {"tier": "proxy", "run_name": "round0073_proxy_1774168019", "family_name": "lowrank_grouped_residual", "family_stage": "mainline_comparison", "checkpoint_dir": "/root/sparsify-ascend/checkpoints/research_agent/round_0073_proxy/round0073_proxy_1774168019_dp2_bs1_ga8_ef12_k32_20260322_162705", "metrics_path": "/root/sparsify-ascend/checkpoints/research_agent/round_0073_proxy/round0073_proxy_1774168019_dp2_bs1_ga8_ef12_k32_20260322_162705/metrics.jsonl", "latest_step": 152, "latest_tokens_per_sec": 83007.19997940506, "baseline_ratio": 0.9999914214284238, "latest_total_tokens": 4980736.0, "proxy_mode": "fast", "evaluation_basis": "terminal_only"}}
{"event_id": "evt_1774168079099216193", "ts": 1774168079, "event": "training_finished", "round": 73, "session_id": "019d1496-cd26-7b90-a74e-d93c12b3512b", "tier": "proxy", "run_name": "round0073_proxy_1774168019", "family_name": "lowrank_grouped_residual", "family_stage": "mainline_comparison", "status": "ok", "decision": "incubate", "payload": {"tier": "proxy", "run_name": "round0073_proxy_1774168019", "family_name": "lowrank_grouped_residual", "family_stage": "mainline_comparison", "checkpoint_dir": "/root/sparsify-ascend/checkpoints/research_agent/round_0073_proxy/round0073_proxy_1774168019_dp2_bs1_ga8_ef12_k32_20260322_162705", "metrics_path": "/root/sparsify-ascend/checkpoints/research_agent/round_0073_proxy/round0073_proxy_1774168019_dp2_bs1_ga8_ef12_k32_20260322_162705/metrics.jsonl", "run_health": "normal", "termination_reason": "completed", "tokens_per_sec": 83007.19997940506, "baseline_ratio": 0.9999914214284238, "status": "ok", "decision": "incubate", "proxy_mode": "fast", "evaluation_basis": "terminal_only", "curve_start_fvu": 0.3541298508644104, "curve_mid_fvu": 0.22890111804008484, "curve_end_fvu": 0.18099144101142883, "curve_late_slope": -7.109901484762949e-09, "curve_still_improving": true}}
{"event_id": "evt_1774168079099269567", "ts": 1774168079, "event": "result_recorded", "round": 73, "session_id": "019d1496-cd26-7b90-a74e-d93c12b3512b", "tier": "proxy", "run_name": "round0073_proxy_1774168019", "family_name": "lowrank_grouped_residual", "family_stage": "mainline_comparison", "status": "ok", "decision": "incubate", "payload": {"tier": "proxy", "run_name": "round0073_proxy_1774168019", "family_name": "lowrank_grouped_residual", "family_stage": "mainline_comparison", "status": "ok", "decision": "incubate", "val_fvu": "0.18161508068442345", "observed_fvu": "0.180991", "k": "32", "log_path": "/root/sparsify-ascend/research/history/logs/proxy_1774168079.log", "checkpoint": null}}
{"event_id": "evt_1774168079099405543", "ts": 1774168079, "event": "round_finished", "round": 73, "session_id": "019d1496-cd26-7b90-a74e-d93c12b3512b", "tier": "proxy", "run_name": null, "family_name": "lowrank_grouped_residual", "family_stage": "mainline_comparison", "status": "ok", "decision": "incubate", "payload": {"tier": "proxy", "family_name": "lowrank_grouped_residual", "family_stage": "mainline_comparison", "status": "ok", "decision": "incubate", "val_fvu": "0.18161508068442345"}}
{"event_id": "evt_1774168079107768434", "ts": 1774168079, "event": "experiment_commit_prepared", "round": 73, "tier": "proxy", "run_name": null, "family_name": "lowrank_grouped_residual", "family_stage": "mainline_comparison", "status": "ok", "decision": "incubate", "payload": {"branch": "autoresearch-sae"}}
{"event_id": "evt_1774168086745024432", "ts": 1774168086, "event": "round_started", "round": 74, "session_id": "019d1496-cd26-7b90-a74e-d93c12b3512b", "tier": null, "run_name": null, "family_name": null, "family_stage": null, "status": "started", "decision": null, "payload": {"status": "started"}}
{"event_id": "evt_1774168086745173027", "ts": 1774168086, "event": "agent_deciding", "round": 74, "session_id": "019d1496-cd26-7b90-a74e-d93c12b3512b", "tier": null, "run_name": null, "family_name": null, "family_stage": null, "status": null, "decision": null, "payload": {}}
{"event_id": "evt_1774168212805813078", "ts": 1774168212, "event": "session_resumed", "round": 74, "tier": null, "run_name": null, "family_name": null, "family_stage": null, "status": "active", "decision": null, "payload": {"session_id": "019d1496-cd26-7b90-a74e-d93c12b3512b"}}
{"event_id": "evt_1774168212807038084", "ts": 1774168212, "event": "agent_action_received", "round": 74, "session_id": "019d1496-cd26-7b90-a74e-d93c12b3512b", "tier": "proxy", "run_name": null, "family_name": "lowrank_residual", "family_stage": "mainline_comparison", "status": null, "decision": null, "payload": {"session_id": "019d1496-cd26-7b90-a74e-d93c12b3512b", "tier": "proxy", "family_name": "lowrank_residual", "family_stage": "mainline_comparison", "change_type": "param_only", "expected_win": "quality_improve", "hypothesis": "`lowrank_grouped_residual` at the refreshed low-K target (`K=32`, `EF=12`) improved over the recent weak non-TopK probes but remained far from competitive, so the next informative move is a same-target comparison against the strongest simpler non-gated baseline family. Run `lowrank_residual` at `K=32`, `EF=12` with the shared `signum`/`LR=1.6e-3`/`AUXK_ALPHA=0` recipe to test whether the grouped routing machinery is hurting low-K quality relative to a cleaner low-rank residual path in the preferred mainline band."}}
{"event_id": "evt_1774168212807142269", "ts": 1774168212, "event": "variable_isolation_warning", "round": 74, "session_id": "019d1496-cd26-7b90-a74e-d93c12b3512b", "tier": null, "run_name": null, "family_name": "lowrank_residual", "family_stage": "mainline_comparison", "status": null, "decision": null, "payload": {"violation": "Multiple primary variables changed simultaneously: architecture, k, lr"}}
{"event_id": "evt_1774168212807196709", "ts": 1774168212, "event": "proxy_mode_selected", "round": 74, "session_id": "019d1496-cd26-7b90-a74e-d93c12b3512b", "tier": "proxy", "run_name": null, "family_name": "lowrank_residual", "family_stage": "mainline_comparison", "status": null, "decision": null, "payload": {"tier": "proxy", "proxy_mode": "fast", "evaluation_basis": "terminal_only", "parameter_behavior": "structural", "proxy_max_tokens": "5000000"}}
{"event_id": "evt_1774168212807447963", "ts": 1774168212, "event": "training_started", "round": 74, "session_id": "019d1496-cd26-7b90-a74e-d93c12b3512b", "tier": "proxy", "run_name": "round0074_proxy_1774168212", "family_name": "lowrank_residual", "family_stage": "mainline_comparison", "status": null, "decision": null, "payload": {"tier": "proxy", "run_name": "round0074_proxy_1774168212", "family_name": "lowrank_residual", "family_stage": "mainline_comparison", "checkpoint_dir": "/root/sparsify-ascend/checkpoints/research_agent/round_0074_proxy", "log_path": "/root/sparsify-ascend/research/history/logs/round0074_proxy_1774168212.log", "config": {"architecture": "lowrank_residual", "expansion_factor": 12, "k": 32, "optimizer": "signum", "lr": "1.6e-3", "hookpoints": "layers.[3].self_attn.o_proj", "batch_size": 1, "grad_acc_steps": 8, "micro_acc_steps": 1, "auxk_alpha": 0.0, "dead_feature_threshold": 10000000, "use_hadamard": false, "tier": "proxy", "family_name": "lowrank_residual", "family_stage": "mainline_comparison"}, "baseline_tokens_per_sec": 83008.52258207071, "proxy_mode": "fast", "evaluation_basis": "terminal_only"}}
