{"event_id": "evt_1774168865297005388", "ts": 1774168865, "event": "training_started", "round": 77, "session_id": "019d14b3-7a66-7a10-a3d2-e744f4a315a4", "tier": "proxy", "run_name": "round0077_proxy_1774168865", "family_name": "multi_branch_gated", "family_stage": "stabilize", "status": null, "decision": null, "payload": {"tier": "proxy", "run_name": "round0077_proxy_1774168865", "family_name": "multi_branch_gated", "family_stage": "stabilize", "checkpoint_dir": "/root/sparsify-ascend/checkpoints/research_agent/round_0077_proxy", "log_path": "/root/sparsify-ascend/research/history/logs/round0077_proxy_1774168865.log", "config": {"architecture": "multi_branch_gated", "expansion_factor": 16, "k": 32, "optimizer": "signum", "lr": "1.6e-3", "hookpoints": "layers.[3].self_attn.o_proj", "batch_size": 1, "grad_acc_steps": 8, "micro_acc_steps": 1, "auxk_alpha": 0.0, "dead_feature_threshold": 10000000, "use_hadamard": false, "tier": "proxy", "family_name": "multi_branch_gated", "family_stage": "stabilize"}, "baseline_tokens_per_sec": 66570.99320327744, "proxy_mode": "fast", "evaluation_basis": "terminal_only"}}
{"event_id": "evt_1774168895298180863", "ts": 1774168895, "event": "training_heartbeat", "round": 77, "session_id": "019d14b3-7a66-7a10-a3d2-e744f4a315a4", "tier": "proxy", "run_name": "round0077_proxy_1774168865", "family_name": "multi_branch_gated", "family_stage": "stabilize", "status": null, "decision": null, "payload": {"tier": "proxy", "run_name": "round0077_proxy_1774168865", "family_name": "multi_branch_gated", "family_stage": "stabilize", "checkpoint_dir": "/root/sparsify-ascend/checkpoints/research_agent/round_0077_proxy/round0077_proxy_1774168865_dp2_bs1_ga8_ef16_k32_20260322_164111", "metrics_path": "/root/sparsify-ascend/checkpoints/research_agent/round_0077_proxy/round0077_proxy_1774168865_dp2_bs1_ga8_ef16_k32_20260322_164111/metrics.jsonl", "latest_step": 30, "latest_tokens_per_sec": 32767.014352565413, "baseline_ratio": 0.4922115891002242, "latest_total_tokens": 983040.0, "proxy_mode": "fast", "evaluation_basis": "terminal_only"}}
{"event_id": "evt_1774168925299273693", "ts": 1774168925, "event": "training_heartbeat", "round": 77, "session_id": "019d14b3-7a66-7a10-a3d2-e744f4a315a4", "tier": "proxy", "run_name": "round0077_proxy_1774168865", "family_name": "multi_branch_gated", "family_stage": "stabilize", "status": null, "decision": null, "payload": {"tier": "proxy", "run_name": "round0077_proxy_1774168865", "family_name": "multi_branch_gated", "family_stage": "stabilize", "checkpoint_dir": "/root/sparsify-ascend/checkpoints/research_agent/round_0077_proxy/round0077_proxy_1774168865_dp2_bs1_ga8_ef16_k32_20260322_164111", "metrics_path": "/root/sparsify-ascend/checkpoints/research_agent/round_0077_proxy/round0077_proxy_1774168865_dp2_bs1_ga8_ef16_k32_20260322_164111/metrics.jsonl", "latest_step": 100, "latest_tokens_per_sec": 54611.50765651896, "baseline_ratio": 0.820349900590492, "latest_total_tokens": 3276800.0, "proxy_mode": "fast", "evaluation_basis": "terminal_only"}}
{"event_id": "evt_1774168955393037199", "ts": 1774168955, "event": "training_heartbeat", "round": 77, "session_id": "019d14b3-7a66-7a10-a3d2-e744f4a315a4", "tier": "proxy", "run_name": "round0077_proxy_1774168865", "family_name": "multi_branch_gated", "family_stage": "stabilize", "status": null, "decision": null, "payload": {"tier": "proxy", "run_name": "round0077_proxy_1774168865", "family_name": "multi_branch_gated", "family_stage": "stabilize", "checkpoint_dir": "/root/sparsify-ascend/checkpoints/research_agent/round_0077_proxy/round0077_proxy_1774168865_dp2_bs1_ga8_ef16_k32_20260322_164111", "metrics_path": "/root/sparsify-ascend/checkpoints/research_agent/round_0077_proxy/round0077_proxy_1774168865_dp2_bs1_ga8_ef16_k32_20260322_164111/metrics.jsonl", "latest_step": 152, "latest_tokens_per_sec": 55339.43570283454, "baseline_ratio": 0.8312845135696437, "latest_total_tokens": 4980736.0, "proxy_mode": "fast", "evaluation_basis": "terminal_only"}}
{"event_id": "evt_1774168985429138906", "ts": 1774168985, "event": "training_heartbeat", "round": 77, "session_id": "019d14b3-7a66-7a10-a3d2-e744f4a315a4", "tier": "proxy", "run_name": "round0077_proxy_1774168865", "family_name": "multi_branch_gated", "family_stage": "stabilize", "status": null, "decision": null, "payload": {"tier": "proxy", "run_name": "round0077_proxy_1774168865", "family_name": "multi_branch_gated", "family_stage": "stabilize", "checkpoint_dir": "/root/sparsify-ascend/checkpoints/research_agent/round_0077_proxy/round0077_proxy_1774168865_dp2_bs1_ga8_ef16_k32_20260322_164111", "metrics_path": "/root/sparsify-ascend/checkpoints/research_agent/round_0077_proxy/round0077_proxy_1774168865_dp2_bs1_ga8_ef16_k32_20260322_164111/metrics.jsonl", "latest_step": 152, "latest_tokens_per_sec": 41472.546367414594, "baseline_ratio": 0.6229822385370811, "latest_total_tokens": 4980736.0, "proxy_mode": "fast", "evaluation_basis": "terminal_only"}}
{"event_id": "evt_1774168986497832723", "ts": 1774168986, "event": "training_finished", "round": 77, "session_id": "019d14b3-7a66-7a10-a3d2-e744f4a315a4", "tier": "proxy", "run_name": "round0077_proxy_1774168865", "family_name": "multi_branch_gated", "family_stage": "stabilize", "status": "ok", "decision": "incubate", "payload": {"tier": "proxy", "run_name": "round0077_proxy_1774168865", "family_name": "multi_branch_gated", "family_stage": "stabilize", "checkpoint_dir": "/root/sparsify-ascend/checkpoints/research_agent/round_0077_proxy/round0077_proxy_1774168865_dp2_bs1_ga8_ef16_k32_20260322_164111", "metrics_path": "/root/sparsify-ascend/checkpoints/research_agent/round_0077_proxy/round0077_proxy_1774168865_dp2_bs1_ga8_ef16_k32_20260322_164111/metrics.jsonl", "run_health": "normal", "termination_reason": "completed", "tokens_per_sec": 41472.546367414594, "baseline_ratio": 0.6229822385370811, "status": "ok", "decision": "incubate", "proxy_mode": "fast", "evaluation_basis": "terminal_only", "curve_start_fvu": 0.544644832611084, "curve_mid_fvu": 0.41862839460372925, "curve_end_fvu": 0.3671836853027344, "curve_late_slope": -6.741057375385877e-09, "curve_still_improving": true}}
{"event_id": "evt_1774168986497925365", "ts": 1774168986, "event": "result_recorded", "round": 77, "session_id": "019d14b3-7a66-7a10-a3d2-e744f4a315a4", "tier": "proxy", "run_name": "round0077_proxy_1774168865", "family_name": "multi_branch_gated", "family_stage": "stabilize", "status": "ok", "decision": "incubate", "payload": {"tier": "proxy", "run_name": "round0077_proxy_1774168865", "family_name": "multi_branch_gated", "family_stage": "stabilize", "status": "ok", "decision": "incubate", "val_fvu": "0.36755063384771347", "observed_fvu": "0.367184", "k": "32", "log_path": "/root/sparsify-ascend/research/history/logs/proxy_1774168985.log", "checkpoint": null}}
{"event_id": "evt_1774168986498077901", "ts": 1774168986, "event": "round_finished", "round": 77, "session_id": "019d14b3-7a66-7a10-a3d2-e744f4a315a4", "tier": "proxy", "run_name": null, "family_name": "multi_branch_gated", "family_stage": "stabilize", "status": "ok", "decision": "incubate", "payload": {"tier": "proxy", "family_name": "multi_branch_gated", "family_stage": "stabilize", "status": "ok", "decision": "incubate", "val_fvu": "0.36755063384771347"}}
{"event_id": "evt_1774168987029193224", "ts": 1774168987, "event": "experiment_commit_prepared", "round": 77, "tier": "proxy", "run_name": null, "family_name": "multi_branch_gated", "family_stage": "stabilize", "status": "ok", "decision": "incubate", "payload": {"branch": "autoresearch-sae"}}
{"event_id": "evt_1774168996616589920", "ts": 1774168996, "event": "round_started", "round": 78, "session_id": "019d14b3-7a66-7a10-a3d2-e744f4a315a4", "tier": null, "run_name": null, "family_name": null, "family_stage": null, "status": "started", "decision": null, "payload": {"status": "started"}}
{"event_id": "evt_1774168996648215538", "ts": 1774168996, "event": "agent_deciding", "round": 78, "session_id": "019d14b3-7a66-7a10-a3d2-e744f4a315a4", "tier": null, "run_name": null, "family_name": null, "family_stage": null, "status": null, "decision": null, "payload": {}}
{"event_id": "evt_1774169127416388418", "ts": 1774169127, "event": "session_resumed", "round": 78, "tier": null, "run_name": null, "family_name": null, "family_stage": null, "status": "active", "decision": null, "payload": {"session_id": "019d14b3-7a66-7a10-a3d2-e744f4a315a4"}}
{"event_id": "evt_1774169127417650338", "ts": 1774169127, "event": "agent_action_received", "round": 78, "session_id": "019d14b3-7a66-7a10-a3d2-e744f4a315a4", "tier": "proxy", "run_name": null, "family_name": "whitened_topk", "family_stage": "mainline_comparison", "status": null, "decision": null, "payload": {"session_id": "019d14b3-7a66-7a10-a3d2-e744f4a315a4", "tier": "proxy", "family_name": "whitened_topk", "family_stage": "mainline_comparison", "change_type": "param_only", "expected_win": "smaller_k", "hypothesis": "After `adaptive_budget_topk` and `multi_branch_gated` both stayed clearly weak at the low-K target, the next informative move is a different problem framing rather than another routing tweak: run `whitened_topk` at `K=32`, `EF=12` with the stable `signum`/`lr=1.6e-3`/`auxk_alpha=0` recipe to test whether input-space preconditioning makes the activation geometry easier to sparsify in the preferred low-K mainline band."}}
{"event_id": "evt_1774169127417759809", "ts": 1774169127, "event": "variable_isolation_warning", "round": 78, "session_id": "019d14b3-7a66-7a10-a3d2-e744f4a315a4", "tier": null, "run_name": null, "family_name": "whitened_topk", "family_stage": "mainline_comparison", "status": null, "decision": null, "payload": {"violation": "Multiple primary variables changed simultaneously: architecture, k, lr"}}
{"event_id": "evt_1774169127417822033", "ts": 1774169127, "event": "proxy_mode_selected", "round": 78, "session_id": "019d14b3-7a66-7a10-a3d2-e744f4a315a4", "tier": "proxy", "run_name": null, "family_name": "whitened_topk", "family_stage": "mainline_comparison", "status": null, "decision": null, "payload": {"tier": "proxy", "proxy_mode": "fast", "evaluation_basis": "terminal_only", "parameter_behavior": "structural", "proxy_max_tokens": "5000000"}}
{"event_id": "evt_1774169127418081298", "ts": 1774169127, "event": "training_started", "round": 78, "session_id": "019d14b3-7a66-7a10-a3d2-e744f4a315a4", "tier": "proxy", "run_name": "round0078_proxy_1774169127", "family_name": "whitened_topk", "family_stage": "mainline_comparison", "status": null, "decision": null, "payload": {"tier": "proxy", "run_name": "round0078_proxy_1774169127", "family_name": "whitened_topk", "family_stage": "mainline_comparison", "checkpoint_dir": "/root/sparsify-ascend/checkpoints/research_agent/round_0078_proxy", "log_path": "/root/sparsify-ascend/research/history/logs/round0078_proxy_1774169127.log", "config": {"architecture": "whitened_topk", "expansion_factor": 12, "k": 32, "optimizer": "signum", "lr": "1.6e-3", "hookpoints": "layers.[3].self_attn.o_proj", "batch_size": 1, "grad_acc_steps": 8, "micro_acc_steps": 1, "auxk_alpha": 0.0, "dead_feature_threshold": 10000000, "use_hadamard": false, "tier": "proxy", "family_name": "whitened_topk", "family_stage": "mainline_comparison"}, "baseline_tokens_per_sec": 83008.36558264197, "proxy_mode": "fast", "evaluation_basis": "terminal_only"}}
{"event_id": "evt_1774169157419813662", "ts": 1774169157, "event": "training_heartbeat", "round": 78, "session_id": "019d14b3-7a66-7a10-a3d2-e744f4a315a4", "tier": "proxy", "run_name": "round0078_proxy_1774169127", "family_name": "whitened_topk", "family_stage": "mainline_comparison", "status": null, "decision": null, "payload": {"tier": "proxy", "run_name": "round0078_proxy_1774169127", "family_name": "whitened_topk", "family_stage": "mainline_comparison", "checkpoint_dir": "/root/sparsify-ascend/checkpoints/research_agent/round_0078_proxy/round0078_proxy_1774169127_dp2_bs1_ga8_ef12_k32_20260322_164533", "metrics_path": "/root/sparsify-ascend/checkpoints/research_agent/round_0078_proxy/round0078_proxy_1774169127_dp2_bs1_ga8_ef12_k32_20260322_164533/metrics.jsonl", "latest_step": 130, "latest_tokens_per_sec": 141987.7494689286, "baseline_ratio": 1.710523372822798, "latest_total_tokens": 4259840.0, "proxy_mode": "fast", "evaluation_basis": "terminal_only"}}
{"event_id": "evt_1774169187421239848", "ts": 1774169187, "event": "training_heartbeat", "round": 78, "session_id": "019d14b3-7a66-7a10-a3d2-e744f4a315a4", "tier": "proxy", "run_name": "round0078_proxy_1774169127", "family_name": "whitened_topk", "family_stage": "mainline_comparison", "status": null, "decision": null, "payload": {"tier": "proxy", "run_name": "round0078_proxy_1774169127", "family_name": "whitened_topk", "family_stage": "mainline_comparison", "checkpoint_dir": "/root/sparsify-ascend/checkpoints/research_agent/round_0078_proxy/round0078_proxy_1774169127_dp2_bs1_ga8_ef12_k32_20260322_164533", "metrics_path": "/root/sparsify-ascend/checkpoints/research_agent/round_0078_proxy/round0078_proxy_1774169127_dp2_bs1_ga8_ef12_k32_20260322_164533/metrics.jsonl", "latest_step": 152, "latest_tokens_per_sec": 83008.3006061614, "baseline_ratio": 0.9999992172297321, "latest_total_tokens": 4980736.0, "proxy_mode": "fast", "evaluation_basis": "terminal_only"}}
{"event_id": "evt_1774169187487533723", "ts": 1774169187, "event": "training_finished", "round": 78, "session_id": "019d14b3-7a66-7a10-a3d2-e744f4a315a4", "tier": "proxy", "run_name": "round0078_proxy_1774169127", "family_name": "whitened_topk", "family_stage": "mainline_comparison", "status": "ok", "decision": "incubate", "payload": {"tier": "proxy", "run_name": "round0078_proxy_1774169127", "family_name": "whitened_topk", "family_stage": "mainline_comparison", "checkpoint_dir": "/root/sparsify-ascend/checkpoints/research_agent/round_0078_proxy/round0078_proxy_1774169127_dp2_bs1_ga8_ef12_k32_20260322_164533", "metrics_path": "/root/sparsify-ascend/checkpoints/research_agent/round_0078_proxy/round0078_proxy_1774169127_dp2_bs1_ga8_ef12_k32_20260322_164533/metrics.jsonl", "run_health": "normal", "termination_reason": "completed", "tokens_per_sec": 83008.3006061614, "baseline_ratio": 0.9999992172297321, "status": "ok", "decision": "incubate", "proxy_mode": "fast", "evaluation_basis": "terminal_only", "curve_start_fvu": 1.2152273654937744, "curve_mid_fvu": 6.1534423828125, "curve_end_fvu": 26.93124771118164, "curve_late_slope": 1.5206131783704603e-05, "curve_still_improving": false}}
{"event_id": "evt_1774169187487589005", "ts": 1774169187, "event": "result_recorded", "round": 78, "session_id": "019d14b3-7a66-7a10-a3d2-e744f4a315a4", "tier": "proxy", "run_name": "round0078_proxy_1774169127", "family_name": "whitened_topk", "family_stage": "mainline_comparison", "status": "ok", "decision": "incubate", "payload": {"tier": "proxy", "run_name": "round0078_proxy_1774169127", "family_name": "whitened_topk", "family_stage": "mainline_comparison", "status": "ok", "decision": "incubate", "val_fvu": "10.304026067256927", "observed_fvu": "26.931248", "k": "32", "log_path": "/root/sparsify-ascend/research/history/logs/proxy_1774169187.log", "checkpoint": null}}
{"event_id": "evt_1774169187487726294", "ts": 1774169187, "event": "round_finished", "round": 78, "session_id": "019d14b3-7a66-7a10-a3d2-e744f4a315a4", "tier": "proxy", "run_name": null, "family_name": "whitened_topk", "family_stage": "mainline_comparison", "status": "ok", "decision": "incubate", "payload": {"tier": "proxy", "family_name": "whitened_topk", "family_stage": "mainline_comparison", "status": "ok", "decision": "incubate", "val_fvu": "10.304026067256927"}}
{"event_id": "evt_1774169187496296368", "ts": 1774169187, "event": "experiment_commit_prepared", "round": 78, "tier": "proxy", "run_name": null, "family_name": "whitened_topk", "family_stage": "mainline_comparison", "status": "ok", "decision": "incubate", "payload": {"branch": "autoresearch-sae"}}
{"event_id": "evt_1774169195142465797", "ts": 1774169195, "event": "round_started", "round": 79, "session_id": "019d14b3-7a66-7a10-a3d2-e744f4a315a4", "tier": null, "run_name": null, "family_name": null, "family_stage": null, "status": "started", "decision": null, "payload": {"status": "started"}}
{"event_id": "evt_1774169195142617952", "ts": 1774169195, "event": "agent_deciding", "round": 79, "session_id": "019d14b3-7a66-7a10-a3d2-e744f4a315a4", "tier": null, "run_name": null, "family_name": null, "family_stage": null, "status": null, "decision": null, "payload": {}}
{"event_id": "evt_1774169325375281164", "ts": 1774169325, "event": "session_resumed", "round": 79, "tier": null, "run_name": null, "family_name": null, "family_stage": null, "status": "active", "decision": null, "payload": {"session_id": "019d14b3-7a66-7a10-a3d2-e744f4a315a4"}}
{"event_id": "evt_1774169325377862517", "ts": 1774169325, "event": "agent_action_received", "round": 79, "session_id": "019d14b3-7a66-7a10-a3d2-e744f4a315a4", "tier": "proxy", "run_name": null, "family_name": "jumprelu", "family_stage": "mainline_comparison", "status": null, "decision": null, "payload": {"session_id": "019d14b3-7a66-7a10-a3d2-e744f4a315a4", "tier": "proxy", "family_name": "jumprelu", "family_stage": "mainline_comparison", "change_type": "param_only", "expected_win": "smaller_k", "hypothesis": "After low-K routing, branch-specialized gating, adaptive-budget, and input-preconditioning pivots all stayed clearly weak, the next informative move is to change the sparsity mechanism itself and refresh a previously promising non-TopK baseline in the preferred mainline band: run `jumprelu` at `K=32`, `EF=12` with the stable `signum`/`lr=1.6e-3`/`auxk_alpha=0` recipe to test whether thresholded sparse activation recovers a viable low-K tradeoff where recent low-K family pivots failed."}}
{"event_id": "evt_1774169325377983930", "ts": 1774169325, "event": "variable_isolation_warning", "round": 79, "session_id": "019d14b3-7a66-7a10-a3d2-e744f4a315a4", "tier": null, "run_name": null, "family_name": "jumprelu", "family_stage": "mainline_comparison", "status": null, "decision": null, "payload": {"violation": "Multiple primary variables changed simultaneously: architecture, k, lr"}}
{"event_id": "evt_1774169325378039734", "ts": 1774169325, "event": "proxy_mode_selected", "round": 79, "session_id": "019d14b3-7a66-7a10-a3d2-e744f4a315a4", "tier": "proxy", "run_name": null, "family_name": "jumprelu", "family_stage": "mainline_comparison", "status": null, "decision": null, "payload": {"tier": "proxy", "proxy_mode": "fast", "evaluation_basis": "terminal_only", "parameter_behavior": "structural", "proxy_max_tokens": "5000000"}}
{"event_id": "evt_1774169325378291677", "ts": 1774169325, "event": "training_started", "round": 79, "session_id": "019d14b3-7a66-7a10-a3d2-e744f4a315a4", "tier": "proxy", "run_name": "round0079_proxy_1774169325", "family_name": "jumprelu", "family_stage": "mainline_comparison", "status": null, "decision": null, "payload": {"tier": "proxy", "run_name": "round0079_proxy_1774169325", "family_name": "jumprelu", "family_stage": "mainline_comparison", "checkpoint_dir": "/root/sparsify-ascend/checkpoints/research_agent/round_0079_proxy", "log_path": "/root/sparsify-ascend/research/history/logs/round0079_proxy_1774169325.log", "config": {"architecture": "jumprelu", "expansion_factor": 12, "k": 32, "optimizer": "signum", "lr": "1.6e-3", "hookpoints": "layers.[3].self_attn.o_proj", "batch_size": 1, "grad_acc_steps": 8, "micro_acc_steps": 1, "auxk_alpha": 0.0, "dead_feature_threshold": 10000000, "use_hadamard": false, "tier": "proxy", "family_name": "jumprelu", "family_stage": "mainline_comparison"}, "baseline_tokens_per_sec": 83008.65550432022, "proxy_mode": "fast", "evaluation_basis": "terminal_only"}}
{"event_id": "evt_1774169355380100639", "ts": 1774169355, "event": "training_heartbeat", "round": 79, "session_id": "019d14b3-7a66-7a10-a3d2-e744f4a315a4", "tier": "proxy", "run_name": "round0079_proxy_1774169325", "family_name": "jumprelu", "family_stage": "mainline_comparison", "status": null, "decision": null, "payload": {"tier": "proxy", "run_name": "round0079_proxy_1774169325", "family_name": "jumprelu", "family_stage": "mainline_comparison", "checkpoint_dir": "/root/sparsify-ascend/checkpoints/research_agent/round_0079_proxy/round0079_proxy_1774169325_dp2_bs1_ga8_ef12_k32_20260322_164851", "metrics_path": "/root/sparsify-ascend/checkpoints/research_agent/round_0079_proxy/round0079_proxy_1774169325_dp2_bs1_ga8_ef12_k32_20260322_164851/metrics.jsonl", "latest_step": 110, "latest_tokens_per_sec": 120143.9137861359, "baseline_ratio": 1.4473660976219878, "latest_total_tokens": 3604480.0, "proxy_mode": "fast", "evaluation_basis": "terminal_only"}}
{"event_id": "evt_1774169385381554022", "ts": 1774169385, "event": "training_heartbeat", "round": 79, "session_id": "019d14b3-7a66-7a10-a3d2-e744f4a315a4", "tier": "proxy", "run_name": "round0079_proxy_1774169325", "family_name": "jumprelu", "family_stage": "mainline_comparison", "status": null, "decision": null, "payload": {"tier": "proxy", "run_name": "round0079_proxy_1774169325", "family_name": "jumprelu", "family_stage": "mainline_comparison", "checkpoint_dir": "/root/sparsify-ascend/checkpoints/research_agent/round_0079_proxy/round0079_proxy_1774169325_dp2_bs1_ga8_ef12_k32_20260322_164851", "metrics_path": "/root/sparsify-ascend/checkpoints/research_agent/round_0079_proxy/round0079_proxy_1774169325_dp2_bs1_ga8_ef12_k32_20260322_164851/metrics.jsonl", "latest_step": 152, "latest_tokens_per_sec": 83008.4021938002, "baseline_ratio": 0.999996948384256, "latest_total_tokens": 4980736.0, "proxy_mode": "fast", "evaluation_basis": "terminal_only"}}
