{"event_id": "evt_1774147167837780749", "ts": 1774147167, "event": "agent_action_received", "round": 32, "session_id": "019d135d-4c60-7fa3-8438-b12bc57e0720", "tier": "proxy", "run_name": null, "family_name": "lowrank_gated_residual", "family_stage": "stabilize", "status": null, "decision": null, "payload": {"session_id": "019d135d-4c60-7fa3-8438-b12bc57e0720", "tier": "proxy", "family_name": "lowrank_gated_residual", "family_stage": "stabilize", "change_type": "param_only", "expected_win": "lower_fvu", "hypothesis": "Crash recovery mode requires returning to the best known working family and making only a small stable parameter change. The recent lowrank_gated_residual sweeps showed that higher LR, added aux pressure, and larger EF all regress at K=128, so the clean remaining stability-oriented probe is to reduce only `EXPANSION_FACTOR` from 32 to 16 on the same winning signum recipe and test whether the family is over-parameterized at the anchor."}}
{"event_id": "evt_1774147167837911505", "ts": 1774147167, "event": "proxy_mode_selected", "round": 32, "session_id": "019d135d-4c60-7fa3-8438-b12bc57e0720", "tier": "proxy", "run_name": null, "family_name": "lowrank_gated_residual", "family_stage": "stabilize", "status": null, "decision": null, "payload": {"tier": "proxy", "proxy_mode": "fast", "evaluation_basis": "terminal_only", "parameter_behavior": "structural", "proxy_max_tokens": "5000000"}}
{"event_id": "evt_1774147167838203776", "ts": 1774147167, "event": "training_started", "round": 32, "session_id": "019d135d-4c60-7fa3-8438-b12bc57e0720", "tier": "proxy", "run_name": "round0032_proxy_1774147167", "family_name": "lowrank_gated_residual", "family_stage": "stabilize", "status": null, "decision": null, "payload": {"tier": "proxy", "run_name": "round0032_proxy_1774147167", "family_name": "lowrank_gated_residual", "family_stage": "stabilize", "checkpoint_dir": "/root/sparsify-ascend/checkpoints/research_agent/round_0032_proxy", "log_path": "/root/sparsify-ascend/research/history/logs/round0032_proxy_1774147167.log", "config": {"architecture": "lowrank_gated_residual", "expansion_factor": 16, "k": 128, "optimizer": "signum", "lr": "1.6e-3", "hookpoints": "layers.[3].self_attn.o_proj", "batch_size": 1, "grad_acc_steps": 8, "micro_acc_steps": 1, "auxk_alpha": 0.0, "dead_feature_threshold": 10000000, "use_hadamard": false, "tier": "proxy", "family_name": "lowrank_gated_residual", "family_stage": "stabilize"}, "baseline_tokens_per_sec": 66622.61543248847, "proxy_mode": "fast", "evaluation_basis": "terminal_only"}}
{"event_id": "evt_1774147197839676579", "ts": 1774147197, "event": "training_heartbeat", "round": 32, "session_id": "019d135d-4c60-7fa3-8438-b12bc57e0720", "tier": "proxy", "run_name": "round0032_proxy_1774147167", "family_name": "lowrank_gated_residual", "family_stage": "stabilize", "status": null, "decision": null, "payload": {"tier": "proxy", "run_name": "round0032_proxy_1774147167", "family_name": "lowrank_gated_residual", "family_stage": "stabilize", "checkpoint_dir": "/root/sparsify-ascend/checkpoints/research_agent/round_0032_proxy/round0032_proxy_1774147167_dp2_bs1_ga8_ef16_k128_20260322_103936", "metrics_path": "/root/sparsify-ascend/checkpoints/research_agent/round_0032_proxy/round0032_proxy_1774147167_dp2_bs1_ga8_ef16_k128_20260322_103936/metrics.jsonl", "latest_step": 70, "latest_tokens_per_sec": 76455.64195993998, "baseline_ratio": 1.1475929226677648, "latest_total_tokens": 2293760.0, "proxy_mode": "fast", "evaluation_basis": "terminal_only"}}
{"event_id": "evt_1774147227841156362", "ts": 1774147227, "event": "training_heartbeat", "round": 32, "session_id": "019d135d-4c60-7fa3-8438-b12bc57e0720", "tier": "proxy", "run_name": "round0032_proxy_1774147167", "family_name": "lowrank_gated_residual", "family_stage": "stabilize", "status": null, "decision": null, "payload": {"tier": "proxy", "run_name": "round0032_proxy_1774147167", "family_name": "lowrank_gated_residual", "family_stage": "stabilize", "checkpoint_dir": "/root/sparsify-ascend/checkpoints/research_agent/round_0032_proxy/round0032_proxy_1774147167_dp2_bs1_ga8_ef16_k128_20260322_103936", "metrics_path": "/root/sparsify-ascend/checkpoints/research_agent/round_0032_proxy/round0032_proxy_1774147167_dp2_bs1_ga8_ef16_k128_20260322_103936/metrics.jsonl", "latest_step": 152, "latest_tokens_per_sec": 83008.58788873068, "baseline_ratio": 1.245952104249747, "latest_total_tokens": 4980736.0, "proxy_mode": "fast", "evaluation_basis": "terminal_only"}}
{"event_id": "evt_1774147227903941187", "ts": 1774147227, "event": "training_finished", "round": 32, "session_id": "019d135d-4c60-7fa3-8438-b12bc57e0720", "tier": "proxy", "run_name": "round0032_proxy_1774147167", "family_name": "lowrank_gated_residual", "family_stage": "stabilize", "status": "ok", "decision": "discard", "payload": {"tier": "proxy", "run_name": "round0032_proxy_1774147167", "family_name": "lowrank_gated_residual", "family_stage": "stabilize", "checkpoint_dir": "/root/sparsify-ascend/checkpoints/research_agent/round_0032_proxy/round0032_proxy_1774147167_dp2_bs1_ga8_ef16_k128_20260322_103936", "metrics_path": "/root/sparsify-ascend/checkpoints/research_agent/round_0032_proxy/round0032_proxy_1774147167_dp2_bs1_ga8_ef16_k128_20260322_103936/metrics.jsonl", "run_health": "normal", "termination_reason": "completed", "tokens_per_sec": 83008.58788873068, "baseline_ratio": 1.245952104249747, "status": "ok", "decision": "discard", "proxy_mode": "fast", "evaluation_basis": "terminal_only", "curve_start_fvu": 0.25864672660827637, "curve_mid_fvu": 0.16962212324142456, "curve_end_fvu": 0.1341528594493866, "curve_late_slope": -5.442768357874405e-09, "curve_still_improving": true}}
{"event_id": "evt_1774147227904000780", "ts": 1774147227, "event": "result_recorded", "round": 32, "session_id": "019d135d-4c60-7fa3-8438-b12bc57e0720", "tier": "proxy", "run_name": "round0032_proxy_1774147167", "family_name": "lowrank_gated_residual", "family_stage": "stabilize", "status": "ok", "decision": "discard", "payload": {"tier": "proxy", "run_name": "round0032_proxy_1774147167", "family_name": "lowrank_gated_residual", "family_stage": "stabilize", "status": "ok", "decision": "discard", "val_fvu": "0.13520684465765953", "observed_fvu": "0.134153", "k": "128", "log_path": "/root/sparsify-ascend/research/history/logs/proxy_1774147227.log", "checkpoint": null}}
{"event_id": "evt_1774147227904142261", "ts": 1774147227, "event": "round_finished", "round": 32, "session_id": "019d135d-4c60-7fa3-8438-b12bc57e0720", "tier": "proxy", "run_name": null, "family_name": "lowrank_gated_residual", "family_stage": "stabilize", "status": "ok", "decision": "discard", "payload": {"tier": "proxy", "family_name": "lowrank_gated_residual", "family_stage": "stabilize", "status": "ok", "decision": "discard", "val_fvu": "0.13520684465765953"}}
{"event_id": "evt_1774147227910992825", "ts": 1774147227, "event": "experiment_commit_prepared", "round": 32, "tier": "proxy", "run_name": null, "family_name": "lowrank_gated_residual", "family_stage": "stabilize", "status": "ok", "decision": "discard", "payload": {"branch": "autoresearch-sae"}}
{"event_id": "evt_1774147235491517501", "ts": 1774147235, "event": "round_started", "round": 33, "session_id": "019d135d-4c60-7fa3-8438-b12bc57e0720", "tier": null, "run_name": null, "family_name": null, "family_stage": null, "status": "started", "decision": null, "payload": {"status": "started"}}
{"event_id": "evt_1774147235491673568", "ts": 1774147235, "event": "agent_deciding", "round": 33, "session_id": "019d135d-4c60-7fa3-8438-b12bc57e0720", "tier": null, "run_name": null, "family_name": null, "family_stage": null, "status": null, "decision": null, "payload": {}}
{"event_id": "evt_1774147365374553156", "ts": 1774147365, "event": "session_resumed", "round": 33, "tier": null, "run_name": null, "family_name": null, "family_stage": null, "status": "active", "decision": null, "payload": {"session_id": "019d135d-4c60-7fa3-8438-b12bc57e0720"}}
{"event_id": "evt_1774147365375229601", "ts": 1774147365, "event": "agent_action_received", "round": 33, "session_id": "019d135d-4c60-7fa3-8438-b12bc57e0720", "tier": "proxy", "run_name": null, "family_name": "jumprelu", "family_stage": "stabilize", "status": null, "decision": null, "payload": {"session_id": "019d135d-4c60-7fa3-8438-b12bc57e0720", "tier": "proxy", "family_name": "jumprelu", "family_stage": "stabilize", "change_type": "param_only", "expected_win": "lower_fvu", "hypothesis": "Eight no-improve rounds indicate the current lowrank_gated_residual tuning track is exhausted, and the frontier already covers K={32,64,128}, so the next informative move must switch the single primary variable back to architecture. The cleanest fundamentally different probe is to re-benchmark `jumprelu` at K=128 under the current strongest shared recipe (`EXPANSION_FACTOR=32`, signum, `LR=1.6e-3`, `AUXK_ALPHA=0`) to test whether a different sparse activation mechanism benefits from the stronger mainline training regime that earlier non-gated families did not fully share."}}
{"event_id": "evt_1774147365375351657", "ts": 1774147365, "event": "variable_isolation_warning", "round": 33, "session_id": "019d135d-4c60-7fa3-8438-b12bc57e0720", "tier": null, "run_name": null, "family_name": "jumprelu", "family_stage": "stabilize", "status": null, "decision": null, "payload": {"violation": "Multiple primary variables changed simultaneously: architecture, lr"}}
{"event_id": "evt_1774147365375396422", "ts": 1774147365, "event": "proxy_mode_selected", "round": 33, "session_id": "019d135d-4c60-7fa3-8438-b12bc57e0720", "tier": "proxy", "run_name": null, "family_name": "jumprelu", "family_stage": "stabilize", "status": null, "decision": null, "payload": {"tier": "proxy", "proxy_mode": "fast", "evaluation_basis": "terminal_only", "parameter_behavior": "structural", "proxy_max_tokens": "5000000"}}
{"event_id": "evt_1774147365375667324", "ts": 1774147365, "event": "training_started", "round": 33, "session_id": "019d135d-4c60-7fa3-8438-b12bc57e0720", "tier": "proxy", "run_name": "round0033_proxy_1774147365", "family_name": "jumprelu", "family_stage": "stabilize", "status": null, "decision": null, "payload": {"tier": "proxy", "run_name": "round0033_proxy_1774147365", "family_name": "jumprelu", "family_stage": "stabilize", "checkpoint_dir": "/root/sparsify-ascend/checkpoints/research_agent/round_0033_proxy", "log_path": "/root/sparsify-ascend/research/history/logs/round0033_proxy_1774147365.log", "config": {"architecture": "jumprelu", "expansion_factor": 32, "k": 128, "optimizer": "signum", "lr": "1.6e-3", "hookpoints": "layers.[3].self_attn.o_proj", "batch_size": 1, "grad_acc_steps": 8, "micro_acc_steps": 1, "auxk_alpha": 0.0, "dead_feature_threshold": 10000000, "use_hadamard": false, "tier": "proxy", "family_name": "jumprelu", "family_stage": "stabilize"}, "baseline_tokens_per_sec": 83008.65550432022, "proxy_mode": "fast", "evaluation_basis": "terminal_only"}}
{"event_id": "evt_1774147395377180072", "ts": 1774147395, "event": "training_heartbeat", "round": 33, "session_id": "019d135d-4c60-7fa3-8438-b12bc57e0720", "tier": "proxy", "run_name": "round0033_proxy_1774147365", "family_name": "jumprelu", "family_stage": "stabilize", "status": null, "decision": null, "payload": {"tier": "proxy", "run_name": "round0033_proxy_1774147365", "family_name": "jumprelu", "family_stage": "stabilize", "checkpoint_dir": "/root/sparsify-ascend/checkpoints/research_agent/round_0033_proxy/round0033_proxy_1774147365_dp2_bs1_ga8_ef32_k128_20260322_104252", "metrics_path": "/root/sparsify-ascend/checkpoints/research_agent/round_0033_proxy/round0033_proxy_1774147365_dp2_bs1_ga8_ef32_k128_20260322_104252/metrics.jsonl", "latest_step": 30, "latest_tokens_per_sec": 32766.75473482496, "baseline_ratio": 0.3947390128866694, "latest_total_tokens": 983040.0, "proxy_mode": "fast", "evaluation_basis": "terminal_only"}}
{"event_id": "evt_1774147425378356022", "ts": 1774147425, "event": "training_heartbeat", "round": 33, "session_id": "019d135d-4c60-7fa3-8438-b12bc57e0720", "tier": "proxy", "run_name": "round0033_proxy_1774147365", "family_name": "jumprelu", "family_stage": "stabilize", "status": null, "decision": null, "payload": {"tier": "proxy", "run_name": "round0033_proxy_1774147365", "family_name": "jumprelu", "family_stage": "stabilize", "checkpoint_dir": "/root/sparsify-ascend/checkpoints/research_agent/round_0033_proxy/round0033_proxy_1774147365_dp2_bs1_ga8_ef32_k128_20260322_104252", "metrics_path": "/root/sparsify-ascend/checkpoints/research_agent/round_0033_proxy/round0033_proxy_1774147365_dp2_bs1_ga8_ef32_k128_20260322_104252/metrics.jsonl", "latest_step": 110, "latest_tokens_per_sec": 60072.27316394244, "baseline_ratio": 0.7236868589061287, "latest_total_tokens": 3604480.0, "proxy_mode": "fast", "evaluation_basis": "terminal_only"}}
{"event_id": "evt_1774147455407119439", "ts": 1774147455, "event": "training_heartbeat", "round": 33, "session_id": "019d135d-4c60-7fa3-8438-b12bc57e0720", "tier": "proxy", "run_name": "round0033_proxy_1774147365", "family_name": "jumprelu", "family_stage": "stabilize", "status": null, "decision": null, "payload": {"tier": "proxy", "run_name": "round0033_proxy_1774147365", "family_name": "jumprelu", "family_stage": "stabilize", "checkpoint_dir": "/root/sparsify-ascend/checkpoints/research_agent/round_0033_proxy/round0033_proxy_1774147365_dp2_bs1_ga8_ef32_k128_20260322_104252", "metrics_path": "/root/sparsify-ascend/checkpoints/research_agent/round_0033_proxy/round0033_proxy_1774147365_dp2_bs1_ga8_ef32_k128_20260322_104252/metrics.jsonl", "latest_step": 152, "latest_tokens_per_sec": 55339.1674372201, "baseline_ratio": 0.666667434871776, "latest_total_tokens": 4980736.0, "proxy_mode": "fast", "evaluation_basis": "terminal_only"}}
{"event_id": "evt_1774147455908568865", "ts": 1774147455, "event": "training_finished", "round": 33, "session_id": "019d135d-4c60-7fa3-8438-b12bc57e0720", "tier": "proxy", "run_name": "round0033_proxy_1774147365", "family_name": "jumprelu", "family_stage": "stabilize", "status": "ok", "decision": "incubate", "payload": {"tier": "proxy", "run_name": "round0033_proxy_1774147365", "family_name": "jumprelu", "family_stage": "stabilize", "checkpoint_dir": "/root/sparsify-ascend/checkpoints/research_agent/round_0033_proxy/round0033_proxy_1774147365_dp2_bs1_ga8_ef32_k128_20260322_104252", "metrics_path": "/root/sparsify-ascend/checkpoints/research_agent/round_0033_proxy/round0033_proxy_1774147365_dp2_bs1_ga8_ef32_k128_20260322_104252/metrics.jsonl", "run_health": "normal", "termination_reason": "completed", "tokens_per_sec": 55339.1674372201, "baseline_ratio": 0.666667434871776, "status": "ok", "decision": "incubate", "proxy_mode": "fast", "evaluation_basis": "terminal_only", "curve_start_fvu": 0.35512983798980713, "curve_mid_fvu": 0.2891584038734436, "curve_end_fvu": 0.2595789432525635, "curve_late_slope": -3.1489053658480127e-09, "curve_still_improving": true}}
{"event_id": "evt_1774147455908670267", "ts": 1774147455, "event": "result_recorded", "round": 33, "session_id": "019d135d-4c60-7fa3-8438-b12bc57e0720", "tier": "proxy", "run_name": "round0033_proxy_1774147365", "family_name": "jumprelu", "family_stage": "stabilize", "status": "ok", "decision": "incubate", "payload": {"tier": "proxy", "run_name": "round0033_proxy_1774147365", "family_name": "jumprelu", "family_stage": "stabilize", "status": "ok", "decision": "incubate", "val_fvu": "0.2602509167045355", "observed_fvu": "0.259579", "k": "128", "log_path": "/root/sparsify-ascend/research/history/logs/proxy_1774147455.log", "checkpoint": null}}
{"event_id": "evt_1774147455908831075", "ts": 1774147455, "event": "round_finished", "round": 33, "session_id": "019d135d-4c60-7fa3-8438-b12bc57e0720", "tier": "proxy", "run_name": null, "family_name": "jumprelu", "family_stage": "stabilize", "status": "ok", "decision": "incubate", "payload": {"tier": "proxy", "family_name": "jumprelu", "family_stage": "stabilize", "status": "ok", "decision": "incubate", "val_fvu": "0.2602509167045355"}}
{"event_id": "evt_1774147456152561414", "ts": 1774147456, "event": "experiment_commit_prepared", "round": 33, "tier": "proxy", "run_name": null, "family_name": "jumprelu", "family_stage": "stabilize", "status": "ok", "decision": "incubate", "payload": {"branch": "autoresearch-sae"}}
{"event_id": "evt_1774147465097855179", "ts": 1774147465, "event": "round_started", "round": 34, "session_id": "019d135d-4c60-7fa3-8438-b12bc57e0720", "tier": null, "run_name": null, "family_name": null, "family_stage": null, "status": "started", "decision": null, "payload": {"status": "started"}}
{"event_id": "evt_1774147465181903226", "ts": 1774147465, "event": "agent_deciding", "round": 34, "session_id": "019d135d-4c60-7fa3-8438-b12bc57e0720", "tier": null, "run_name": null, "family_name": null, "family_stage": null, "status": null, "decision": null, "payload": {}}
{"event_id": "evt_1774147610040713441", "ts": 1774147610, "event": "session_resumed", "round": 34, "tier": null, "run_name": null, "family_name": null, "family_stage": null, "status": "active", "decision": null, "payload": {"session_id": "019d135d-4c60-7fa3-8438-b12bc57e0720"}}
{"event_id": "evt_1774147610041358105", "ts": 1774147610, "event": "agent_action_received", "round": 34, "session_id": "019d135d-4c60-7fa3-8438-b12bc57e0720", "tier": "proxy", "run_name": null, "family_name": "two_stage_residual", "family_stage": "stabilize", "status": null, "decision": null, "payload": {"session_id": "019d135d-4c60-7fa3-8438-b12bc57e0720", "tier": "proxy", "family_name": "two_stage_residual", "family_stage": "stabilize", "change_type": "param_only", "expected_win": "lower_fvu", "hypothesis": "Nine no-improve rounds indicate the current search direction around lowrank_gated_residual is exhausted, and the latest architecture pivot to `jumprelu` remained clearly uncompetitive even under the strongest shared recipe. The least-bad next informative move is to switch the single primary variable to a different existing architecture mechanism with real prior signal: rerun `two_stage_residual` at K=128 under the current strongest stable recipe (`EXPANSION_FACTOR=32`, signum, `LR=1.6e-3`, `AUXK_ALPHA=0`) to test whether hierarchical residual allocation benefits from the stronger modern training regime."}}
{"event_id": "evt_1774147610041472347", "ts": 1774147610, "event": "variable_isolation_warning", "round": 34, "session_id": "019d135d-4c60-7fa3-8438-b12bc57e0720", "tier": null, "run_name": null, "family_name": "two_stage_residual", "family_stage": "stabilize", "status": null, "decision": null, "payload": {"violation": "Multiple primary variables changed simultaneously: architecture, lr"}}
{"event_id": "evt_1774147610041513884", "ts": 1774147610, "event": "proxy_mode_selected", "round": 34, "session_id": "019d135d-4c60-7fa3-8438-b12bc57e0720", "tier": "proxy", "run_name": null, "family_name": "two_stage_residual", "family_stage": "stabilize", "status": null, "decision": null, "payload": {"tier": "proxy", "proxy_mode": "fast", "evaluation_basis": "terminal_only", "parameter_behavior": "structural", "proxy_max_tokens": "5000000"}}
{"event_id": "evt_1774147610041789468", "ts": 1774147610, "event": "training_started", "round": 34, "session_id": "019d135d-4c60-7fa3-8438-b12bc57e0720", "tier": "proxy", "run_name": "round0034_proxy_1774147610", "family_name": "two_stage_residual", "family_stage": "stabilize", "status": null, "decision": null, "payload": {"tier": "proxy", "run_name": "round0034_proxy_1774147610", "family_name": "two_stage_residual", "family_stage": "stabilize", "checkpoint_dir": "/root/sparsify-ascend/checkpoints/research_agent/round_0034_proxy", "log_path": "/root/sparsify-ascend/research/history/logs/round0034_proxy_1774147610.log", "config": {"architecture": "two_stage_residual", "expansion_factor": 32, "k": 128, "optimizer": "signum", "lr": "1.6e-3", "hookpoints": "layers.[3].self_attn.o_proj", "batch_size": 1, "grad_acc_steps": 8, "micro_acc_steps": 1, "auxk_alpha": 0.0, "dead_feature_threshold": 10000000, "use_hadamard": false, "tier": "proxy", "family_name": "two_stage_residual", "family_stage": "stabilize"}, "baseline_tokens_per_sec": 111037.42023476404, "proxy_mode": "fast", "evaluation_basis": "terminal_only"}}
{"event_id": "evt_1774147640042987542", "ts": 1774147640, "event": "training_heartbeat", "round": 34, "session_id": "019d135d-4c60-7fa3-8438-b12bc57e0720", "tier": "proxy", "run_name": "round0034_proxy_1774147610", "family_name": "two_stage_residual", "family_stage": "stabilize", "status": null, "decision": null, "payload": {"tier": "proxy", "run_name": "round0034_proxy_1774147610", "family_name": "two_stage_residual", "family_stage": "stabilize", "checkpoint_dir": "/root/sparsify-ascend/checkpoints/research_agent/round_0034_proxy/round0034_proxy_1774147610_dp2_bs1_ga8_ef32_k128_20260322_104656", "metrics_path": "/root/sparsify-ascend/checkpoints/research_agent/round_0034_proxy/round0034_proxy_1774147610_dp2_bs1_ga8_ef32_k128_20260322_104656/metrics.jsonl", "latest_step": 30, "latest_tokens_per_sec": 32767.00159292136, "baseline_ratio": 0.29509872909189344, "latest_total_tokens": 983040.0, "proxy_mode": "fast", "evaluation_basis": "terminal_only"}}
