{"event_id": "evt_1774149103121531868", "ts": 1774149103, "event": "training_heartbeat", "round": 35, "session_id": "019d135d-4c60-7fa3-8438-b12bc57e0720", "tier": "proxy", "run_name": "round0035_proxy_1774148052", "family_name": "adaptive_budget_topk", "family_stage": "prototype", "status": null, "decision": null, "payload": {"tier": "proxy", "run_name": "round0035_proxy_1774148052", "family_name": "adaptive_budget_topk", "family_stage": "prototype", "checkpoint_dir": "/root/sparsify-ascend/checkpoints/research_agent/round_0035_proxy/round0035_proxy_1774148052_dp2_bs1_ga8_ef32_k128_20260322_105420", "metrics_path": "/root/sparsify-ascend/checkpoints/research_agent/round_0035_proxy/round0035_proxy_1774148052_dp2_bs1_ga8_ef32_k128_20260322_105420/metrics.jsonl", "latest_step": 1220, "latest_tokens_per_sec": 38056.639447418966, "baseline_ratio": null, "latest_total_tokens": 39976960.0, "proxy_mode": "fast", "evaluation_basis": "terminal_only"}}
{"event_id": "evt_1774149133129015450", "ts": 1774149133, "event": "training_heartbeat", "round": 35, "session_id": "019d135d-4c60-7fa3-8438-b12bc57e0720", "tier": "proxy", "run_name": "round0035_proxy_1774148052", "family_name": "adaptive_budget_topk", "family_stage": "prototype", "status": null, "decision": null, "payload": {"tier": "proxy", "run_name": "round0035_proxy_1774148052", "family_name": "adaptive_budget_topk", "family_stage": "prototype", "checkpoint_dir": "/root/sparsify-ascend/checkpoints/research_agent/round_0035_proxy/round0035_proxy_1774148052_dp2_bs1_ga8_ef32_k128_20260322_105420", "metrics_path": "/root/sparsify-ascend/checkpoints/research_agent/round_0035_proxy/round0035_proxy_1774148052_dp2_bs1_ga8_ef32_k128_20260322_105420/metrics.jsonl", "latest_step": 1220, "latest_tokens_per_sec": 36999.70398957537, "baseline_ratio": null, "latest_total_tokens": 39976960.0, "proxy_mode": "fast", "evaluation_basis": "terminal_only"}}
{"event_id": "evt_1774149163136450509", "ts": 1774149163, "event": "training_heartbeat", "round": 35, "session_id": "019d135d-4c60-7fa3-8438-b12bc57e0720", "tier": "proxy", "run_name": "round0035_proxy_1774148052", "family_name": "adaptive_budget_topk", "family_stage": "prototype", "status": null, "decision": null, "payload": {"tier": "proxy", "run_name": "round0035_proxy_1774148052", "family_name": "adaptive_budget_topk", "family_stage": "prototype", "checkpoint_dir": "/root/sparsify-ascend/checkpoints/research_agent/round_0035_proxy/round0035_proxy_1774148052_dp2_bs1_ga8_ef32_k128_20260322_105420", "metrics_path": "/root/sparsify-ascend/checkpoints/research_agent/round_0035_proxy/round0035_proxy_1774148052_dp2_bs1_ga8_ef32_k128_20260322_105420/metrics.jsonl", "latest_step": 1220, "latest_tokens_per_sec": 35999.8918007418, "baseline_ratio": null, "latest_total_tokens": 39976960.0, "proxy_mode": "fast", "evaluation_basis": "terminal_only"}}
{"event_id": "evt_1774149193143891588", "ts": 1774149193, "event": "training_heartbeat", "round": 35, "session_id": "019d135d-4c60-7fa3-8438-b12bc57e0720", "tier": "proxy", "run_name": "round0035_proxy_1774148052", "family_name": "adaptive_budget_topk", "family_stage": "prototype", "status": null, "decision": null, "payload": {"tier": "proxy", "run_name": "round0035_proxy_1774148052", "family_name": "adaptive_budget_topk", "family_stage": "prototype", "checkpoint_dir": "/root/sparsify-ascend/checkpoints/research_agent/round_0035_proxy/round0035_proxy_1774148052_dp2_bs1_ga8_ef32_k128_20260322_105420", "metrics_path": "/root/sparsify-ascend/checkpoints/research_agent/round_0035_proxy/round0035_proxy_1774148052_dp2_bs1_ga8_ef32_k128_20260322_105420/metrics.jsonl", "latest_step": 1220, "latest_tokens_per_sec": 35052.69133089519, "baseline_ratio": null, "latest_total_tokens": 39976960.0, "proxy_mode": "fast", "evaluation_basis": "terminal_only"}}
{"event_id": "evt_1774149223151386509", "ts": 1774149223, "event": "training_heartbeat", "round": 35, "session_id": "019d135d-4c60-7fa3-8438-b12bc57e0720", "tier": "proxy", "run_name": "round0035_proxy_1774148052", "family_name": "adaptive_budget_topk", "family_stage": "prototype", "status": null, "decision": null, "payload": {"tier": "proxy", "run_name": "round0035_proxy_1774148052", "family_name": "adaptive_budget_topk", "family_stage": "prototype", "checkpoint_dir": "/root/sparsify-ascend/checkpoints/research_agent/round_0035_proxy/round0035_proxy_1774148052_dp2_bs1_ga8_ef32_k128_20260322_105420", "metrics_path": "/root/sparsify-ascend/checkpoints/research_agent/round_0035_proxy/round0035_proxy_1774148052_dp2_bs1_ga8_ef32_k128_20260322_105420/metrics.jsonl", "latest_step": 1220, "latest_tokens_per_sec": 34154.05556959144, "baseline_ratio": null, "latest_total_tokens": 39976960.0, "proxy_mode": "fast", "evaluation_basis": "terminal_only"}}
{"event_id": "evt_1774149253158861213", "ts": 1774149253, "event": "training_heartbeat", "round": 35, "session_id": "019d135d-4c60-7fa3-8438-b12bc57e0720", "tier": "proxy", "run_name": "round0035_proxy_1774148052", "family_name": "adaptive_budget_topk", "family_stage": "prototype", "status": null, "decision": null, "payload": {"tier": "proxy", "run_name": "round0035_proxy_1774148052", "family_name": "adaptive_budget_topk", "family_stage": "prototype", "checkpoint_dir": "/root/sparsify-ascend/checkpoints/research_agent/round_0035_proxy/round0035_proxy_1774148052_dp2_bs1_ga8_ef32_k128_20260322_105420", "metrics_path": "/root/sparsify-ascend/checkpoints/research_agent/round_0035_proxy/round0035_proxy_1774148052_dp2_bs1_ga8_ef32_k128_20260322_105420/metrics.jsonl", "latest_step": 1220, "latest_tokens_per_sec": 33300.345311366844, "baseline_ratio": null, "latest_total_tokens": 39976960.0, "proxy_mode": "fast", "evaluation_basis": "terminal_only"}}
{"event_id": "evt_1774149253236440559", "ts": 1774149253, "event": "training_finished", "round": 35, "session_id": "019d135d-4c60-7fa3-8438-b12bc57e0720", "tier": "proxy", "run_name": "round0035_proxy_1774148052", "family_name": "adaptive_budget_topk", "family_stage": "prototype", "status": "ok", "decision": "incubate", "payload": {"tier": "proxy", "run_name": "round0035_proxy_1774148052", "family_name": "adaptive_budget_topk", "family_stage": "prototype", "checkpoint_dir": "/root/sparsify-ascend/checkpoints/research_agent/round_0035_proxy/round0035_proxy_1774148052_dp2_bs1_ga8_ef32_k128_20260322_105420", "metrics_path": "/root/sparsify-ascend/checkpoints/research_agent/round_0035_proxy/round0035_proxy_1774148052_dp2_bs1_ga8_ef32_k128_20260322_105420/metrics.jsonl", "run_health": "normal", "termination_reason": "completed", "tokens_per_sec": 33300.345311366844, "baseline_ratio": null, "status": "ok", "decision": "incubate", "proxy_mode": "fast", "evaluation_basis": "terminal_only", "curve_start_fvu": 0.27889367938041687, "curve_mid_fvu": 0.2493455410003662, "curve_end_fvu": 0.2208566665649414, "curve_late_slope": -2.3833215474027026e-09, "curve_still_improving": true}}
{"event_id": "evt_1774149253236499786", "ts": 1774149253, "event": "result_recorded", "round": 35, "session_id": "019d135d-4c60-7fa3-8438-b12bc57e0720", "tier": "proxy", "run_name": "round0035_proxy_1774148052", "family_name": "adaptive_budget_topk", "family_stage": "prototype", "status": "ok", "decision": "incubate", "payload": {"tier": "proxy", "run_name": "round0035_proxy_1774148052", "family_name": "adaptive_budget_topk", "family_stage": "prototype", "status": "ok", "decision": "incubate", "val_fvu": "0.22683675587177277", "observed_fvu": "0.220857", "k": "128", "log_path": "/root/sparsify-ascend/research/history/logs/proxy_1774149253.log", "checkpoint": null}}
{"event_id": "evt_1774149253237053220", "ts": 1774149253, "event": "round_finished", "round": 35, "session_id": "019d135d-4c60-7fa3-8438-b12bc57e0720", "tier": "proxy", "run_name": null, "family_name": "adaptive_budget_topk", "family_stage": "prototype", "status": "ok", "decision": "incubate", "payload": {"tier": "proxy", "family_name": "adaptive_budget_topk", "family_stage": "prototype", "status": "ok", "decision": "incubate", "val_fvu": "0.22683675587177277"}}
{"event_id": "evt_1774149253243677178", "ts": 1774149253, "event": "experiment_commit_prepared", "round": 35, "tier": "proxy", "run_name": null, "family_name": "adaptive_budget_topk", "family_stage": "prototype", "status": "ok", "decision": "incubate", "payload": {"branch": "autoresearch-sae"}}
{"event_id": "evt_1774149260716444064", "ts": 1774149260, "event": "round_started", "round": 36, "session_id": "019d135d-4c60-7fa3-8438-b12bc57e0720", "tier": null, "run_name": null, "family_name": null, "family_stage": null, "status": "started", "decision": null, "payload": {"status": "started"}}
{"event_id": "evt_1774149260716622919", "ts": 1774149260, "event": "agent_deciding", "round": 36, "session_id": "019d135d-4c60-7fa3-8438-b12bc57e0720", "tier": null, "run_name": null, "family_name": null, "family_stage": null, "status": null, "decision": null, "payload": {}}
{"event_id": "evt_1774149427269020240", "ts": 1774149427, "event": "session_resumed", "round": 36, "tier": null, "run_name": null, "family_name": null, "family_stage": null, "status": "active", "decision": null, "payload": {"session_id": "019d135d-4c60-7fa3-8438-b12bc57e0720"}}
{"event_id": "evt_1774149427269636147", "ts": 1774149427, "event": "agent_action_received", "round": 36, "session_id": "019d135d-4c60-7fa3-8438-b12bc57e0720", "tier": "proxy", "run_name": null, "family_name": "batch_topk", "family_stage": "prototype", "status": null, "decision": null, "payload": {"session_id": "019d135d-4c60-7fa3-8438-b12bc57e0720", "tier": "proxy", "family_name": "batch_topk", "family_stage": "prototype", "change_type": "edit_sae_code", "expected_win": "lower_fvu", "hypothesis": "Eleven no-improve rounds indicate the fixed-per-sample sparse allocation direction is fundamentally flawed, and recent alternatives like `jumprelu`, `two_stage_residual`, and `adaptive_budget_topk` still stayed far behind the frontier. The next coherent architecture move is to test a cleaner batch-level sparsity mechanism: add `batch_topk`, which enforces the same total activation budget across the batch but selects features globally rather than distributing them per sample or via a heuristic quota. If the main failure mode is rigid per-sample support allocation, true batch-level competition could improve reconstruction quality at fixed average sparsity."}}
{"event_id": "evt_1774149558480784115", "ts": 1774149558, "event": "variable_isolation_warning", "round": 36, "session_id": "019d135d-4c60-7fa3-8438-b12bc57e0720", "tier": null, "run_name": null, "family_name": "batch_topk", "family_stage": "prototype", "status": null, "decision": null, "payload": {"violation": "Multiple primary variables changed simultaneously: code_edit, architecture, lr"}}
{"event_id": "evt_1774149562988066456", "ts": 1774149562, "event": "behavioral_diff_identical_warning", "round": 36, "session_id": "019d135d-4c60-7fa3-8438-b12bc57e0720", "tier": null, "run_name": null, "family_name": "batch_topk", "family_stage": "prototype", "status": null, "decision": null, "payload": {"architecture": "batch_topk", "k": 128, "expansion_factor": 32, "max_diff": 0.0}}
{"event_id": "evt_1774149562988131453", "ts": 1774149562, "event": "proxy_mode_selected", "round": 36, "session_id": "019d135d-4c60-7fa3-8438-b12bc57e0720", "tier": "proxy", "run_name": null, "family_name": "batch_topk", "family_stage": "prototype", "status": null, "decision": null, "payload": {"tier": "proxy", "proxy_mode": "fast", "evaluation_basis": "terminal_only", "parameter_behavior": "structural", "proxy_max_tokens": "40000000"}}
{"event_id": "evt_1774149562988176949", "ts": 1774149562, "event": "sanity_started", "round": 36, "session_id": "019d135d-4c60-7fa3-8438-b12bc57e0720", "tier": "proxy", "run_name": null, "family_name": "batch_topk", "family_stage": "prototype", "status": null, "decision": null, "payload": {"tier": "proxy"}}
{"event_id": "evt_1774149567597823345", "ts": 1774149567, "event": "sanity_finished", "round": 36, "session_id": "019d135d-4c60-7fa3-8438-b12bc57e0720", "tier": "proxy", "run_name": null, "family_name": "batch_topk", "family_stage": "prototype", "status": "ok", "decision": null, "payload": {"tier": "proxy", "status": "ok"}}
{"event_id": "evt_1774149567598256948", "ts": 1774149567, "event": "training_started", "round": 36, "session_id": "019d135d-4c60-7fa3-8438-b12bc57e0720", "tier": "proxy", "run_name": "round0036_proxy_1774149567", "family_name": "batch_topk", "family_stage": "prototype", "status": null, "decision": null, "payload": {"tier": "proxy", "run_name": "round0036_proxy_1774149567", "family_name": "batch_topk", "family_stage": "prototype", "checkpoint_dir": "/root/sparsify-ascend/checkpoints/research_agent/round_0036_proxy", "log_path": "/root/sparsify-ascend/research/history/logs/round0036_proxy_1774149567.log", "config": {"architecture": "batch_topk", "expansion_factor": 32, "k": 128, "optimizer": "signum", "lr": "1.6e-3", "hookpoints": "layers.[3].self_attn.o_proj", "batch_size": 1, "grad_acc_steps": 8, "micro_acc_steps": 1, "auxk_alpha": 0.0, "dead_feature_threshold": 10000000, "use_hadamard": false, "tier": "proxy", "family_name": "batch_topk", "family_stage": "prototype"}, "baseline_tokens_per_sec": null, "proxy_mode": "fast", "evaluation_basis": "terminal_only"}}
{"event_id": "evt_1774149597599531630", "ts": 1774149597, "event": "training_heartbeat", "round": 36, "session_id": "019d135d-4c60-7fa3-8438-b12bc57e0720", "tier": "proxy", "run_name": "round0036_proxy_1774149567", "family_name": "batch_topk", "family_stage": "prototype", "status": null, "decision": null, "payload": {"tier": "proxy", "run_name": "round0036_proxy_1774149567", "family_name": "batch_topk", "family_stage": "prototype", "checkpoint_dir": "/root/sparsify-ascend/checkpoints/research_agent/round_0036_proxy/round0036_proxy_1774149567_dp2_bs1_ga8_ef32_k128_20260322_111936", "metrics_path": "/root/sparsify-ascend/checkpoints/research_agent/round_0036_proxy/round0036_proxy_1774149567_dp2_bs1_ga8_ef32_k128_20260322_111936/metrics.jsonl", "latest_step": 30, "latest_tokens_per_sec": 32766.96018924685, "baseline_ratio": null, "latest_total_tokens": 983040.0, "proxy_mode": "fast", "evaluation_basis": "terminal_only"}}
{"event_id": "evt_1774149627600648663", "ts": 1774149627, "event": "training_heartbeat", "round": 36, "session_id": "019d135d-4c60-7fa3-8438-b12bc57e0720", "tier": "proxy", "run_name": "round0036_proxy_1774149567", "family_name": "batch_topk", "family_stage": "prototype", "status": null, "decision": null, "payload": {"tier": "proxy", "run_name": "round0036_proxy_1774149567", "family_name": "batch_topk", "family_stage": "prototype", "checkpoint_dir": "/root/sparsify-ascend/checkpoints/research_agent/round_0036_proxy/round0036_proxy_1774149567_dp2_bs1_ga8_ef32_k128_20260322_111936", "metrics_path": "/root/sparsify-ascend/checkpoints/research_agent/round_0036_proxy/round0036_proxy_1774149567_dp2_bs1_ga8_ef32_k128_20260322_111936/metrics.jsonl", "latest_step": 100, "latest_tokens_per_sec": 54611.46903065665, "baseline_ratio": null, "latest_total_tokens": 3276800.0, "proxy_mode": "fast", "evaluation_basis": "terminal_only"}}
{"event_id": "evt_1774149657602107609", "ts": 1774149657, "event": "training_heartbeat", "round": 36, "session_id": "019d135d-4c60-7fa3-8438-b12bc57e0720", "tier": "proxy", "run_name": "round0036_proxy_1774149567", "family_name": "batch_topk", "family_stage": "prototype", "status": null, "decision": null, "payload": {"tier": "proxy", "run_name": "round0036_proxy_1774149567", "family_name": "batch_topk", "family_stage": "prototype", "checkpoint_dir": "/root/sparsify-ascend/checkpoints/research_agent/round_0036_proxy/round0036_proxy_1774149567_dp2_bs1_ga8_ef32_k128_20260322_111936", "metrics_path": "/root/sparsify-ascend/checkpoints/research_agent/round_0036_proxy/round0036_proxy_1774149567_dp2_bs1_ga8_ef32_k128_20260322_111936/metrics.jsonl", "latest_step": 160, "latest_tokens_per_sec": 58251.94515073924, "baseline_ratio": null, "latest_total_tokens": 5242880.0, "proxy_mode": "fast", "evaluation_basis": "terminal_only"}}
{"event_id": "evt_1774149687603942642", "ts": 1774149687, "event": "training_heartbeat", "round": 36, "session_id": "019d135d-4c60-7fa3-8438-b12bc57e0720", "tier": "proxy", "run_name": "round0036_proxy_1774149567", "family_name": "batch_topk", "family_stage": "prototype", "status": null, "decision": null, "payload": {"tier": "proxy", "run_name": "round0036_proxy_1774149567", "family_name": "batch_topk", "family_stage": "prototype", "checkpoint_dir": "/root/sparsify-ascend/checkpoints/research_agent/round_0036_proxy/round0036_proxy_1774149567_dp2_bs1_ga8_ef32_k128_20260322_111936", "metrics_path": "/root/sparsify-ascend/checkpoints/research_agent/round_0036_proxy/round0036_proxy_1774149567_dp2_bs1_ga8_ef32_k128_20260322_111936/metrics.jsonl", "latest_step": 230, "latest_tokens_per_sec": 62802.52883617456, "baseline_ratio": null, "latest_total_tokens": 7536640.0, "proxy_mode": "fast", "evaluation_basis": "terminal_only"}}
{"event_id": "evt_1774149717606271176", "ts": 1774149717, "event": "training_heartbeat", "round": 36, "session_id": "019d135d-4c60-7fa3-8438-b12bc57e0720", "tier": "proxy", "run_name": "round0036_proxy_1774149567", "family_name": "batch_topk", "family_stage": "prototype", "status": null, "decision": null, "payload": {"tier": "proxy", "run_name": "round0036_proxy_1774149567", "family_name": "batch_topk", "family_stage": "prototype", "checkpoint_dir": "/root/sparsify-ascend/checkpoints/research_agent/round_0036_proxy/round0036_proxy_1774149567_dp2_bs1_ga8_ef32_k128_20260322_111936", "metrics_path": "/root/sparsify-ascend/checkpoints/research_agent/round_0036_proxy/round0036_proxy_1774149567_dp2_bs1_ga8_ef32_k128_20260322_111936/metrics.jsonl", "latest_step": 300, "latest_tokens_per_sec": 65532.64819226872, "baseline_ratio": null, "latest_total_tokens": 9830400.0, "proxy_mode": "fast", "evaluation_basis": "terminal_only"}}
{"event_id": "evt_1774149747608940935", "ts": 1774149747, "event": "training_heartbeat", "round": 36, "session_id": "019d135d-4c60-7fa3-8438-b12bc57e0720", "tier": "proxy", "run_name": "round0036_proxy_1774149567", "family_name": "batch_topk", "family_stage": "prototype", "status": null, "decision": null, "payload": {"tier": "proxy", "run_name": "round0036_proxy_1774149567", "family_name": "batch_topk", "family_stage": "prototype", "checkpoint_dir": "/root/sparsify-ascend/checkpoints/research_agent/round_0036_proxy/round0036_proxy_1774149567_dp2_bs1_ga8_ef32_k128_20260322_111936", "metrics_path": "/root/sparsify-ascend/checkpoints/research_agent/round_0036_proxy/round0036_proxy_1774149567_dp2_bs1_ga8_ef32_k128_20260322_111936/metrics.jsonl", "latest_step": 370, "latest_tokens_per_sec": 67352.57087285347, "baseline_ratio": null, "latest_total_tokens": 12124160.0, "proxy_mode": "fast", "evaluation_basis": "terminal_only"}}
{"event_id": "evt_1774149777611951612", "ts": 1774149777, "event": "training_heartbeat", "round": 36, "session_id": "019d135d-4c60-7fa3-8438-b12bc57e0720", "tier": "proxy", "run_name": "round0036_proxy_1774149567", "family_name": "batch_topk", "family_stage": "prototype", "status": null, "decision": null, "payload": {"tier": "proxy", "run_name": "round0036_proxy_1774149567", "family_name": "batch_topk", "family_stage": "prototype", "checkpoint_dir": "/root/sparsify-ascend/checkpoints/research_agent/round_0036_proxy/round0036_proxy_1774149567_dp2_bs1_ga8_ef32_k128_20260322_111936", "metrics_path": "/root/sparsify-ascend/checkpoints/research_agent/round_0036_proxy/round0036_proxy_1774149567_dp2_bs1_ga8_ef32_k128_20260322_111936/metrics.jsonl", "latest_step": 440, "latest_tokens_per_sec": 68652.39164724843, "baseline_ratio": null, "latest_total_tokens": 14417920.0, "proxy_mode": "fast", "evaluation_basis": "terminal_only"}}
{"event_id": "evt_1774149807615397374", "ts": 1774149807, "event": "training_heartbeat", "round": 36, "session_id": "019d135d-4c60-7fa3-8438-b12bc57e0720", "tier": "proxy", "run_name": "round0036_proxy_1774149567", "family_name": "batch_topk", "family_stage": "prototype", "status": null, "decision": null, "payload": {"tier": "proxy", "run_name": "round0036_proxy_1774149567", "family_name": "batch_topk", "family_stage": "prototype", "checkpoint_dir": "/root/sparsify-ascend/checkpoints/research_agent/round_0036_proxy/round0036_proxy_1774149567_dp2_bs1_ga8_ef32_k128_20260322_111936", "metrics_path": "/root/sparsify-ascend/checkpoints/research_agent/round_0036_proxy/round0036_proxy_1774149567_dp2_bs1_ga8_ef32_k128_20260322_111936/metrics.jsonl", "latest_step": 510, "latest_tokens_per_sec": 69627.12480831359, "baseline_ratio": null, "latest_total_tokens": 16711680.0, "proxy_mode": "fast", "evaluation_basis": "terminal_only"}}
{"event_id": "evt_1774149837619192270", "ts": 1774149837, "event": "training_heartbeat", "round": 36, "session_id": "019d135d-4c60-7fa3-8438-b12bc57e0720", "tier": "proxy", "run_name": "round0036_proxy_1774149567", "family_name": "batch_topk", "family_stage": "prototype", "status": null, "decision": null, "payload": {"tier": "proxy", "run_name": "round0036_proxy_1774149567", "family_name": "batch_topk", "family_stage": "prototype", "checkpoint_dir": "/root/sparsify-ascend/checkpoints/research_agent/round_0036_proxy/round0036_proxy_1774149567_dp2_bs1_ga8_ef32_k128_20260322_111936", "metrics_path": "/root/sparsify-ascend/checkpoints/research_agent/round_0036_proxy/round0036_proxy_1774149567_dp2_bs1_ga8_ef32_k128_20260322_111936/metrics.jsonl", "latest_step": 570, "latest_tokens_per_sec": 69171.60949823259, "baseline_ratio": null, "latest_total_tokens": 18677760.0, "proxy_mode": "fast", "evaluation_basis": "terminal_only"}}
