{"event_id": "evt_1774150647927579110", "ts": 1774150647, "event": "training_heartbeat", "round": 37, "session_id": "019d135d-4c60-7fa3-8438-b12bc57e0720", "tier": "proxy", "run_name": "round0037_proxy_1774150497", "family_name": "bucketed_topk", "family_stage": "prototype", "status": null, "decision": null, "payload": {"tier": "proxy", "run_name": "round0037_proxy_1774150497", "family_name": "bucketed_topk", "family_stage": "prototype", "checkpoint_dir": "/root/sparsify-ascend/checkpoints/research_agent/round_0037_proxy/round0037_proxy_1774150497_dp2_bs1_ga8_ef32_k128_20260322_113506", "metrics_path": "/root/sparsify-ascend/checkpoints/research_agent/round_0037_proxy/round0037_proxy_1774150497_dp2_bs1_ga8_ef32_k128_20260322_113506/metrics.jsonl", "latest_step": 290, "latest_tokens_per_sec": 63348.359992632526, "baseline_ratio": null, "latest_total_tokens": 9502720.0, "proxy_mode": "fast", "evaluation_basis": "terminal_only"}}
{"event_id": "evt_1774150677930128511", "ts": 1774150677, "event": "training_heartbeat", "round": 37, "session_id": "019d135d-4c60-7fa3-8438-b12bc57e0720", "tier": "proxy", "run_name": "round0037_proxy_1774150497", "family_name": "bucketed_topk", "family_stage": "prototype", "status": null, "decision": null, "payload": {"tier": "proxy", "run_name": "round0037_proxy_1774150497", "family_name": "bucketed_topk", "family_stage": "prototype", "checkpoint_dir": "/root/sparsify-ascend/checkpoints/research_agent/round_0037_proxy/round0037_proxy_1774150497_dp2_bs1_ga8_ef32_k128_20260322_113506", "metrics_path": "/root/sparsify-ascend/checkpoints/research_agent/round_0037_proxy/round0037_proxy_1774150497_dp2_bs1_ga8_ef32_k128_20260322_113506/metrics.jsonl", "latest_step": 350, "latest_tokens_per_sec": 63712.05304748524, "baseline_ratio": null, "latest_total_tokens": 11468800.0, "proxy_mode": "fast", "evaluation_basis": "terminal_only"}}
{"event_id": "evt_1774150707933109086", "ts": 1774150707, "event": "training_heartbeat", "round": 37, "session_id": "019d135d-4c60-7fa3-8438-b12bc57e0720", "tier": "proxy", "run_name": "round0037_proxy_1774150497", "family_name": "bucketed_topk", "family_stage": "prototype", "status": null, "decision": null, "payload": {"tier": "proxy", "run_name": "round0037_proxy_1774150497", "family_name": "bucketed_topk", "family_stage": "prototype", "checkpoint_dir": "/root/sparsify-ascend/checkpoints/research_agent/round_0037_proxy/round0037_proxy_1774150497_dp2_bs1_ga8_ef32_k128_20260322_113506", "metrics_path": "/root/sparsify-ascend/checkpoints/research_agent/round_0037_proxy/round0037_proxy_1774150497_dp2_bs1_ga8_ef32_k128_20260322_113506/metrics.jsonl", "latest_step": 420, "latest_tokens_per_sec": 65531.98454664098, "baseline_ratio": null, "latest_total_tokens": 13762560.0, "proxy_mode": "fast", "evaluation_basis": "terminal_only"}}
{"event_id": "evt_1774150737936364781", "ts": 1774150737, "event": "training_heartbeat", "round": 37, "session_id": "019d135d-4c60-7fa3-8438-b12bc57e0720", "tier": "proxy", "run_name": "round0037_proxy_1774150497", "family_name": "bucketed_topk", "family_stage": "prototype", "status": null, "decision": null, "payload": {"tier": "proxy", "run_name": "round0037_proxy_1774150497", "family_name": "bucketed_topk", "family_stage": "prototype", "checkpoint_dir": "/root/sparsify-ascend/checkpoints/research_agent/round_0037_proxy/round0037_proxy_1774150497_dp2_bs1_ga8_ef32_k128_20260322_113506", "metrics_path": "/root/sparsify-ascend/checkpoints/research_agent/round_0037_proxy/round0037_proxy_1774150497_dp2_bs1_ga8_ef32_k128_20260322_113506/metrics.jsonl", "latest_step": 480, "latest_tokens_per_sec": 65531.595283042945, "baseline_ratio": null, "latest_total_tokens": 15728640.0, "proxy_mode": "fast", "evaluation_basis": "terminal_only"}}
{"event_id": "evt_1774150767940009092", "ts": 1774150767, "event": "training_heartbeat", "round": 37, "session_id": "019d135d-4c60-7fa3-8438-b12bc57e0720", "tier": "proxy", "run_name": "round0037_proxy_1774150497", "family_name": "bucketed_topk", "family_stage": "prototype", "status": null, "decision": null, "payload": {"tier": "proxy", "run_name": "round0037_proxy_1774150497", "family_name": "bucketed_topk", "family_stage": "prototype", "checkpoint_dir": "/root/sparsify-ascend/checkpoints/research_agent/round_0037_proxy/round0037_proxy_1774150497_dp2_bs1_ga8_ef32_k128_20260322_113506", "metrics_path": "/root/sparsify-ascend/checkpoints/research_agent/round_0037_proxy/round0037_proxy_1774150497_dp2_bs1_ga8_ef32_k128_20260322_113506/metrics.jsonl", "latest_step": 550, "latest_tokens_per_sec": 66744.74180598836, "baseline_ratio": null, "latest_total_tokens": 18022400.0, "proxy_mode": "fast", "evaluation_basis": "terminal_only"}}
{"event_id": "evt_1774150797943962546", "ts": 1774150797, "event": "training_heartbeat", "round": 37, "session_id": "019d135d-4c60-7fa3-8438-b12bc57e0720", "tier": "proxy", "run_name": "round0037_proxy_1774150497", "family_name": "bucketed_topk", "family_stage": "prototype", "status": null, "decision": null, "payload": {"tier": "proxy", "run_name": "round0037_proxy_1774150497", "family_name": "bucketed_topk", "family_stage": "prototype", "checkpoint_dir": "/root/sparsify-ascend/checkpoints/research_agent/round_0037_proxy/round0037_proxy_1774150497_dp2_bs1_ga8_ef32_k128_20260322_113506", "metrics_path": "/root/sparsify-ascend/checkpoints/research_agent/round_0037_proxy/round0037_proxy_1774150497_dp2_bs1_ga8_ef32_k128_20260322_113506/metrics.jsonl", "latest_step": 610, "latest_tokens_per_sec": 66622.99519053764, "baseline_ratio": null, "latest_total_tokens": 19988480.0, "proxy_mode": "fast", "evaluation_basis": "terminal_only"}}
{"event_id": "evt_1774150827948425868", "ts": 1774150827, "event": "training_heartbeat", "round": 37, "session_id": "019d135d-4c60-7fa3-8438-b12bc57e0720", "tier": "proxy", "run_name": "round0037_proxy_1774150497", "family_name": "bucketed_topk", "family_stage": "prototype", "status": null, "decision": null, "payload": {"tier": "proxy", "run_name": "round0037_proxy_1774150497", "family_name": "bucketed_topk", "family_stage": "prototype", "checkpoint_dir": "/root/sparsify-ascend/checkpoints/research_agent/round_0037_proxy/round0037_proxy_1774150497_dp2_bs1_ga8_ef32_k128_20260322_113506", "metrics_path": "/root/sparsify-ascend/checkpoints/research_agent/round_0037_proxy/round0037_proxy_1774150497_dp2_bs1_ga8_ef32_k128_20260322_113506/metrics.jsonl", "latest_step": 680, "latest_tokens_per_sec": 67516.17131176757, "baseline_ratio": null, "latest_total_tokens": 22282240.0, "proxy_mode": "fast", "evaluation_basis": "terminal_only"}}
{"event_id": "evt_1774150857953195923", "ts": 1774150857, "event": "training_heartbeat", "round": 37, "session_id": "019d135d-4c60-7fa3-8438-b12bc57e0720", "tier": "proxy", "run_name": "round0037_proxy_1774150497", "family_name": "bucketed_topk", "family_stage": "prototype", "status": null, "decision": null, "payload": {"tier": "proxy", "run_name": "round0037_proxy_1774150497", "family_name": "bucketed_topk", "family_stage": "prototype", "checkpoint_dir": "/root/sparsify-ascend/checkpoints/research_agent/round_0037_proxy/round0037_proxy_1774150497_dp2_bs1_ga8_ef32_k128_20260322_113506", "metrics_path": "/root/sparsify-ascend/checkpoints/research_agent/round_0037_proxy/round0037_proxy_1774150497_dp2_bs1_ga8_ef32_k128_20260322_113506/metrics.jsonl", "latest_step": 750, "latest_tokens_per_sec": 68260.41660597759, "baseline_ratio": null, "latest_total_tokens": 24576000.0, "proxy_mode": "fast", "evaluation_basis": "terminal_only"}}
{"event_id": "evt_1774150887958276064", "ts": 1774150887, "event": "training_heartbeat", "round": 37, "session_id": "019d135d-4c60-7fa3-8438-b12bc57e0720", "tier": "proxy", "run_name": "round0037_proxy_1774150497", "family_name": "bucketed_topk", "family_stage": "prototype", "status": null, "decision": null, "payload": {"tier": "proxy", "run_name": "round0037_proxy_1774150497", "family_name": "bucketed_topk", "family_stage": "prototype", "checkpoint_dir": "/root/sparsify-ascend/checkpoints/research_agent/round_0037_proxy/round0037_proxy_1774150497_dp2_bs1_ga8_ef32_k128_20260322_113506", "metrics_path": "/root/sparsify-ascend/checkpoints/research_agent/round_0037_proxy/round0037_proxy_1774150497_dp2_bs1_ga8_ef32_k128_20260322_113506/metrics.jsonl", "latest_step": 810, "latest_tokens_per_sec": 68049.97657684665, "baseline_ratio": null, "latest_total_tokens": 26542080.0, "proxy_mode": "fast", "evaluation_basis": "terminal_only"}}
{"event_id": "evt_1774150917963758338", "ts": 1774150917, "event": "training_heartbeat", "round": 37, "session_id": "019d135d-4c60-7fa3-8438-b12bc57e0720", "tier": "proxy", "run_name": "round0037_proxy_1774150497", "family_name": "bucketed_topk", "family_stage": "prototype", "status": null, "decision": null, "payload": {"tier": "proxy", "run_name": "round0037_proxy_1774150497", "family_name": "bucketed_topk", "family_stage": "prototype", "checkpoint_dir": "/root/sparsify-ascend/checkpoints/research_agent/round_0037_proxy/round0037_proxy_1774150497_dp2_bs1_ga8_ef32_k128_20260322_113506", "metrics_path": "/root/sparsify-ascend/checkpoints/research_agent/round_0037_proxy/round0037_proxy_1774150497_dp2_bs1_ga8_ef32_k128_20260322_113506/metrics.jsonl", "latest_step": 880, "latest_tokens_per_sec": 68649.64697818697, "baseline_ratio": null, "latest_total_tokens": 28835840.0, "proxy_mode": "fast", "evaluation_basis": "terminal_only"}}
{"event_id": "evt_1774150947969594469", "ts": 1774150947, "event": "training_heartbeat", "round": 37, "session_id": "019d135d-4c60-7fa3-8438-b12bc57e0720", "tier": "proxy", "run_name": "round0037_proxy_1774150497", "family_name": "bucketed_topk", "family_stage": "prototype", "status": null, "decision": null, "payload": {"tier": "proxy", "run_name": "round0037_proxy_1774150497", "family_name": "bucketed_topk", "family_stage": "prototype", "checkpoint_dir": "/root/sparsify-ascend/checkpoints/research_agent/round_0037_proxy/round0037_proxy_1774150497_dp2_bs1_ga8_ef32_k128_20260322_113506", "metrics_path": "/root/sparsify-ascend/checkpoints/research_agent/round_0037_proxy/round0037_proxy_1774150497_dp2_bs1_ga8_ef32_k128_20260322_113506/metrics.jsonl", "latest_step": 940, "latest_tokens_per_sec": 68441.20379338531, "baseline_ratio": null, "latest_total_tokens": 30801920.0, "proxy_mode": "fast", "evaluation_basis": "terminal_only"}}
{"event_id": "evt_1774150977975891807", "ts": 1774150977, "event": "training_heartbeat", "round": 37, "session_id": "019d135d-4c60-7fa3-8438-b12bc57e0720", "tier": "proxy", "run_name": "round0037_proxy_1774150497", "family_name": "bucketed_topk", "family_stage": "prototype", "status": null, "decision": null, "payload": {"tier": "proxy", "run_name": "round0037_proxy_1774150497", "family_name": "bucketed_topk", "family_stage": "prototype", "checkpoint_dir": "/root/sparsify-ascend/checkpoints/research_agent/round_0037_proxy/round0037_proxy_1774150497_dp2_bs1_ga8_ef32_k128_20260322_113506", "metrics_path": "/root/sparsify-ascend/checkpoints/research_agent/round_0037_proxy/round0037_proxy_1774150497_dp2_bs1_ga8_ef32_k128_20260322_113506/metrics.jsonl", "latest_step": 990, "latest_tokens_per_sec": 67576.16582521617, "baseline_ratio": null, "latest_total_tokens": 32440320.0, "proxy_mode": "fast", "evaluation_basis": "terminal_only"}}
{"event_id": "evt_1774151008211295291", "ts": 1774151008, "event": "training_heartbeat", "round": 37, "session_id": "019d135d-4c60-7fa3-8438-b12bc57e0720", "tier": "proxy", "run_name": "round0037_proxy_1774150497", "family_name": "bucketed_topk", "family_stage": "prototype", "status": null, "decision": null, "payload": {"tier": "proxy", "run_name": "round0037_proxy_1774150497", "family_name": "bucketed_topk", "family_stage": "prototype", "checkpoint_dir": "/root/sparsify-ascend/checkpoints/research_agent/round_0037_proxy/round0037_proxy_1774150497_dp2_bs1_ga8_ef32_k128_20260322_113506", "metrics_path": "/root/sparsify-ascend/checkpoints/research_agent/round_0037_proxy/round0037_proxy_1774150497_dp2_bs1_ga8_ef32_k128_20260322_113506/metrics.jsonl", "latest_step": 1040, "latest_tokens_per_sec": 66812.87679498046, "baseline_ratio": null, "latest_total_tokens": 34078720.0, "proxy_mode": "fast", "evaluation_basis": "terminal_only"}}
{"event_id": "evt_1774151038269967887", "ts": 1774151038, "event": "training_heartbeat", "round": 37, "session_id": "019d135d-4c60-7fa3-8438-b12bc57e0720", "tier": "proxy", "run_name": "round0037_proxy_1774150497", "family_name": "bucketed_topk", "family_stage": "prototype", "status": null, "decision": null, "payload": {"tier": "proxy", "run_name": "round0037_proxy_1774150497", "family_name": "bucketed_topk", "family_stage": "prototype", "checkpoint_dir": "/root/sparsify-ascend/checkpoints/research_agent/round_0037_proxy/round0037_proxy_1774150497_dp2_bs1_ga8_ef32_k128_20260322_113506", "metrics_path": "/root/sparsify-ascend/checkpoints/research_agent/round_0037_proxy/round0037_proxy_1774150497_dp2_bs1_ga8_ef32_k128_20260322_113506/metrics.jsonl", "latest_step": 1100, "latest_tokens_per_sec": 66712.82795207229, "baseline_ratio": null, "latest_total_tokens": 36044800.0, "proxy_mode": "fast", "evaluation_basis": "terminal_only"}}
{"event_id": "evt_1774151068277301156", "ts": 1774151068, "event": "training_heartbeat", "round": 37, "session_id": "019d135d-4c60-7fa3-8438-b12bc57e0720", "tier": "proxy", "run_name": "round0037_proxy_1774150497", "family_name": "bucketed_topk", "family_stage": "prototype", "status": null, "decision": null, "payload": {"tier": "proxy", "run_name": "round0037_proxy_1774150497", "family_name": "bucketed_topk", "family_stage": "prototype", "checkpoint_dir": "/root/sparsify-ascend/checkpoints/research_agent/round_0037_proxy/round0037_proxy_1774150497_dp2_bs1_ga8_ef32_k128_20260322_113506", "metrics_path": "/root/sparsify-ascend/checkpoints/research_agent/round_0037_proxy/round0037_proxy_1774150497_dp2_bs1_ga8_ef32_k128_20260322_113506/metrics.jsonl", "latest_step": 1170, "latest_tokens_per_sec": 67218.52442912238, "baseline_ratio": null, "latest_total_tokens": 38338560.0, "proxy_mode": "fast", "evaluation_basis": "terminal_only"}}
{"event_id": "evt_1774151098382630765", "ts": 1774151098, "event": "training_heartbeat", "round": 37, "session_id": "019d135d-4c60-7fa3-8438-b12bc57e0720", "tier": "proxy", "run_name": "round0037_proxy_1774150497", "family_name": "bucketed_topk", "family_stage": "prototype", "status": null, "decision": null, "payload": {"tier": "proxy", "run_name": "round0037_proxy_1774150497", "family_name": "bucketed_topk", "family_stage": "prototype", "checkpoint_dir": "/root/sparsify-ascend/checkpoints/research_agent/round_0037_proxy/round0037_proxy_1774150497_dp2_bs1_ga8_ef32_k128_20260322_113506", "metrics_path": "/root/sparsify-ascend/checkpoints/research_agent/round_0037_proxy/round0037_proxy_1774150497_dp2_bs1_ga8_ef32_k128_20260322_113506/metrics.jsonl", "latest_step": 1220, "latest_tokens_per_sec": 66587.80811201167, "baseline_ratio": null, "latest_total_tokens": 39976960.0, "proxy_mode": "fast", "evaluation_basis": "terminal_only"}}
{"event_id": "evt_1774151128441442438", "ts": 1774151128, "event": "training_heartbeat", "round": 37, "session_id": "019d135d-4c60-7fa3-8438-b12bc57e0720", "tier": "proxy", "run_name": "round0037_proxy_1774150497", "family_name": "bucketed_topk", "family_stage": "prototype", "status": null, "decision": null, "payload": {"tier": "proxy", "run_name": "round0037_proxy_1774150497", "family_name": "bucketed_topk", "family_stage": "prototype", "checkpoint_dir": "/root/sparsify-ascend/checkpoints/research_agent/round_0037_proxy/round0037_proxy_1774150497_dp2_bs1_ga8_ef32_k128_20260322_113506", "metrics_path": "/root/sparsify-ascend/checkpoints/research_agent/round_0037_proxy/round0037_proxy_1774150497_dp2_bs1_ga8_ef32_k128_20260322_113506/metrics.jsonl", "latest_step": 1220, "latest_tokens_per_sec": 63408.186508676416, "baseline_ratio": null, "latest_total_tokens": 39976960.0, "proxy_mode": "fast", "evaluation_basis": "terminal_only"}}
{"event_id": "evt_1774151158448993890", "ts": 1774151158, "event": "training_heartbeat", "round": 37, "session_id": "019d135d-4c60-7fa3-8438-b12bc57e0720", "tier": "proxy", "run_name": "round0037_proxy_1774150497", "family_name": "bucketed_topk", "family_stage": "prototype", "status": null, "decision": null, "payload": {"tier": "proxy", "run_name": "round0037_proxy_1774150497", "family_name": "bucketed_topk", "family_stage": "prototype", "checkpoint_dir": "/root/sparsify-ascend/checkpoints/research_agent/round_0037_proxy/round0037_proxy_1774150497_dp2_bs1_ga8_ef32_k128_20260322_113506", "metrics_path": "/root/sparsify-ascend/checkpoints/research_agent/round_0037_proxy/round0037_proxy_1774150497_dp2_bs1_ga8_ef32_k128_20260322_113506/metrics.jsonl", "latest_step": 1220, "latest_tokens_per_sec": 60522.66487510176, "baseline_ratio": null, "latest_total_tokens": 39976960.0, "proxy_mode": "fast", "evaluation_basis": "terminal_only"}}
{"event_id": "evt_1774151158525765458", "ts": 1774151158, "event": "training_finished", "round": 37, "session_id": "019d135d-4c60-7fa3-8438-b12bc57e0720", "tier": "proxy", "run_name": "round0037_proxy_1774150497", "family_name": "bucketed_topk", "family_stage": "prototype", "status": "ok", "decision": "incubate", "payload": {"tier": "proxy", "run_name": "round0037_proxy_1774150497", "family_name": "bucketed_topk", "family_stage": "prototype", "checkpoint_dir": "/root/sparsify-ascend/checkpoints/research_agent/round_0037_proxy/round0037_proxy_1774150497_dp2_bs1_ga8_ef32_k128_20260322_113506", "metrics_path": "/root/sparsify-ascend/checkpoints/research_agent/round_0037_proxy/round0037_proxy_1774150497_dp2_bs1_ga8_ef32_k128_20260322_113506/metrics.jsonl", "run_health": "normal", "termination_reason": "completed", "tokens_per_sec": 60522.66487510176, "baseline_ratio": null, "status": "ok", "decision": "incubate", "proxy_mode": "fast", "evaluation_basis": "terminal_only", "curve_start_fvu": 0.21493175625801086, "curve_mid_fvu": 0.1895866096019745, "curve_end_fvu": 0.15545465052127838, "curve_late_slope": -2.301366383435976e-09, "curve_still_improving": true}}
{"event_id": "evt_1774151158525828585", "ts": 1774151158, "event": "result_recorded", "round": 37, "session_id": "019d135d-4c60-7fa3-8438-b12bc57e0720", "tier": "proxy", "run_name": "round0037_proxy_1774150497", "family_name": "bucketed_topk", "family_stage": "prototype", "status": "ok", "decision": "incubate", "payload": {"tier": "proxy", "run_name": "round0037_proxy_1774150497", "family_name": "bucketed_topk", "family_stage": "prototype", "status": "ok", "decision": "incubate", "val_fvu": "0.1606419887393713", "observed_fvu": "0.155455", "k": "128", "log_path": "/root/sparsify-ascend/research/history/logs/proxy_1774151158.log", "checkpoint": null}}
{"event_id": "evt_1774151158526392234", "ts": 1774151158, "event": "round_finished", "round": 37, "session_id": "019d135d-4c60-7fa3-8438-b12bc57e0720", "tier": "proxy", "run_name": null, "family_name": "bucketed_topk", "family_stage": "prototype", "status": "ok", "decision": "incubate", "payload": {"tier": "proxy", "family_name": "bucketed_topk", "family_stage": "prototype", "status": "ok", "decision": "incubate", "val_fvu": "0.1606419887393713"}}
{"event_id": "evt_1774151158533136662", "ts": 1774151158, "event": "experiment_commit_prepared", "round": 37, "tier": "proxy", "run_name": null, "family_name": "bucketed_topk", "family_stage": "prototype", "status": "ok", "decision": "incubate", "payload": {"branch": "autoresearch-sae"}}
{"event_id": "evt_1774151165824708217", "ts": 1774151165, "event": "round_started", "round": 38, "session_id": "019d135d-4c60-7fa3-8438-b12bc57e0720", "tier": null, "run_name": null, "family_name": null, "family_stage": null, "status": "started", "decision": null, "payload": {"status": "started"}}
{"event_id": "evt_1774151165824880423", "ts": 1774151165, "event": "agent_deciding", "round": 38, "session_id": "019d135d-4c60-7fa3-8438-b12bc57e0720", "tier": null, "run_name": null, "family_name": null, "family_stage": null, "status": null, "decision": null, "payload": {}}
{"event_id": "evt_1774151335162976546", "ts": 1774151335, "event": "session_resumed", "round": 38, "tier": null, "run_name": null, "family_name": null, "family_stage": null, "status": "active", "decision": null, "payload": {"session_id": "019d135d-4c60-7fa3-8438-b12bc57e0720"}}
{"event_id": "evt_1774151335163657429", "ts": 1774151335, "event": "agent_action_received", "round": 38, "session_id": "019d135d-4c60-7fa3-8438-b12bc57e0720", "tier": "proxy", "run_name": null, "family_name": "codebook_topk", "family_stage": "prototype", "status": null, "decision": null, "payload": {"session_id": "019d135d-4c60-7fa3-8438-b12bc57e0720", "tier": "proxy", "family_name": "codebook_topk", "family_stage": "prototype", "change_type": "edit_sae_code", "expected_win": "lower_fvu", "hypothesis": "Thirteen no-improve rounds indicate the current search direction around continuous sparse-support variants is fundamentally flawed, and the latest routing-based families still remained far behind the frontier. The next coherent architecture move is to test a discrete-codebook path: add `codebook_topk`, which reconstructs a coarse learned prototype first and then uses TopK only on the residual. If much of the activation mass is better modeled as codebook retrieval plus sparse correction than as pure sparse linear combination, this could lower FVU without changing the execution layer."}}
{"event_id": "evt_1774151466510417962", "ts": 1774151466, "event": "variable_isolation_warning", "round": 38, "session_id": "019d135d-4c60-7fa3-8438-b12bc57e0720", "tier": null, "run_name": null, "family_name": "codebook_topk", "family_stage": "prototype", "status": null, "decision": null, "payload": {"violation": "Multiple primary variables changed simultaneously: code_edit, architecture, lr"}}
