{"event_id": "evt_1774133158590743260", "ts": 1774133158, "event": "agent_deciding", "round": 9, "session_id": "019d1279-dd8d-73d2-97df-ff57e75146ab", "tier": null, "run_name": null, "family_name": null, "family_stage": null, "status": null, "decision": null, "payload": {}}
{"event_id": "evt_1774133283709693401", "ts": 1774133283, "event": "session_resumed", "round": 9, "tier": null, "run_name": null, "family_name": null, "family_stage": null, "status": "active", "decision": null, "payload": {"session_id": "019d1279-dd8d-73d2-97df-ff57e75146ab"}}
{"event_id": "evt_1774133283718189365", "ts": 1774133283, "event": "agent_action_received", "round": 9, "session_id": "019d1279-dd8d-73d2-97df-ff57e75146ab", "tier": "proxy", "run_name": null, "family_name": "two_stage_residual", "family_stage": "stabilize", "status": null, "decision": null, "payload": {"session_id": "019d1279-dd8d-73d2-97df-ff57e75146ab", "tier": "proxy", "family_name": "two_stage_residual", "family_stage": "stabilize", "change_type": "param_only", "expected_win": "quality_improve", "hypothesis": "`two_stage_residual` has established a new K=128 full frontier point, but the sharp K=64 regression suggests the current prototype may be capacity-limited or too brittle outside its initial setting rather than broadly Pareto-dominant yet. The next informative move is a family-specific stabilization pass at the winning K=128 anchor by increasing expansion factor to 32, testing whether more latent capacity lets the staged residual design convert its structural advantage into another quality gain without changing architecture or optimization."}}
{"event_id": "evt_1774133283718339443", "ts": 1774133283, "event": "proxy_mode_selected", "round": 9, "session_id": "019d1279-dd8d-73d2-97df-ff57e75146ab", "tier": "proxy", "run_name": null, "family_name": "two_stage_residual", "family_stage": "stabilize", "status": null, "decision": null, "payload": {"tier": "proxy", "proxy_mode": "fast", "evaluation_basis": "terminal_only", "parameter_behavior": "structural", "proxy_max_tokens": "5000000"}}
{"event_id": "evt_1774133283718651171", "ts": 1774133283, "event": "training_started", "round": 9, "session_id": "019d1279-dd8d-73d2-97df-ff57e75146ab", "tier": "proxy", "run_name": "round0009_proxy_1774133283", "family_name": "two_stage_residual", "family_stage": "stabilize", "status": null, "decision": null, "payload": {"tier": "proxy", "run_name": "round0009_proxy_1774133283", "family_name": "two_stage_residual", "family_stage": "stabilize", "checkpoint_dir": "/root/sparsify-ascend/checkpoints/research_agent/round_0009_proxy", "log_path": "/root/sparsify-ascend/research/history/logs/round0009_proxy_1774133283.log", "config": {"architecture": "two_stage_residual", "expansion_factor": 32, "k": 128, "optimizer": "signum", "lr": "1.6e-3", "hookpoints": "layers.[3].self_attn.o_proj", "batch_size": 1, "grad_acc_steps": 8, "micro_acc_steps": 1, "auxk_alpha": 0.0, "dead_feature_threshold": 10000000, "use_hadamard": false, "tier": "proxy", "family_name": "two_stage_residual", "family_stage": "stabilize"}, "baseline_tokens_per_sec": 110860.4803471805, "proxy_mode": "fast", "evaluation_basis": "terminal_only"}}
{"event_id": "evt_1774133313719868472", "ts": 1774133313, "event": "training_heartbeat", "round": 9, "session_id": "019d1279-dd8d-73d2-97df-ff57e75146ab", "tier": "proxy", "run_name": "round0009_proxy_1774133283", "family_name": "two_stage_residual", "family_stage": "stabilize", "status": null, "decision": null, "payload": {"tier": "proxy", "run_name": "round0009_proxy_1774133283", "family_name": "two_stage_residual", "family_stage": "stabilize", "checkpoint_dir": "/root/sparsify-ascend/checkpoints/research_agent/round_0009_proxy/round0009_proxy_1774133283_dp2_bs1_ga8_ef32_k128_20260322_064810", "metrics_path": "/root/sparsify-ascend/checkpoints/research_agent/round_0009_proxy/round0009_proxy_1774133283_dp2_bs1_ga8_ef32_k128_20260322_064810/metrics.jsonl", "latest_step": 30, "latest_tokens_per_sec": 32767.000811718983, "baseline_ratio": 0.2955697170813525, "latest_total_tokens": 983040.0, "proxy_mode": "fast", "evaluation_basis": "terminal_only"}}
{"event_id": "evt_1774133343720914833", "ts": 1774133343, "event": "training_heartbeat", "round": 9, "session_id": "019d1279-dd8d-73d2-97df-ff57e75146ab", "tier": "proxy", "run_name": "round0009_proxy_1774133283", "family_name": "two_stage_residual", "family_stage": "stabilize", "status": null, "decision": null, "payload": {"tier": "proxy", "run_name": "round0009_proxy_1774133283", "family_name": "two_stage_residual", "family_stage": "stabilize", "checkpoint_dir": "/root/sparsify-ascend/checkpoints/research_agent/round_0009_proxy/round0009_proxy_1774133283_dp2_bs1_ga8_ef32_k128_20260322_064810", "metrics_path": "/root/sparsify-ascend/checkpoints/research_agent/round_0009_proxy/round0009_proxy_1774133283_dp2_bs1_ga8_ef32_k128_20260322_064810/metrics.jsonl", "latest_step": 90, "latest_tokens_per_sec": 49150.38149860907, "baseline_ratio": 0.44335349571538374, "latest_total_tokens": 2949120.0, "proxy_mode": "fast", "evaluation_basis": "terminal_only"}}
{"event_id": "evt_1774133373722317330", "ts": 1774133373, "event": "training_heartbeat", "round": 9, "session_id": "019d1279-dd8d-73d2-97df-ff57e75146ab", "tier": "proxy", "run_name": "round0009_proxy_1774133283", "family_name": "two_stage_residual", "family_stage": "stabilize", "status": null, "decision": null, "payload": {"tier": "proxy", "run_name": "round0009_proxy_1774133283", "family_name": "two_stage_residual", "family_stage": "stabilize", "checkpoint_dir": "/root/sparsify-ascend/checkpoints/research_agent/round_0009_proxy/round0009_proxy_1774133283_dp2_bs1_ga8_ef32_k128_20260322_064810", "metrics_path": "/root/sparsify-ascend/checkpoints/research_agent/round_0009_proxy/round0009_proxy_1774133283_dp2_bs1_ga8_ef32_k128_20260322_064810/metrics.jsonl", "latest_step": 150, "latest_tokens_per_sec": 54611.28653504611, "baseline_ratio": 0.49261275401315746, "latest_total_tokens": 4915200.0, "proxy_mode": "fast", "evaluation_basis": "terminal_only"}}
{"event_id": "evt_1774133403945290897", "ts": 1774133403, "event": "training_heartbeat", "round": 9, "session_id": "019d1279-dd8d-73d2-97df-ff57e75146ab", "tier": "proxy", "run_name": "round0009_proxy_1774133283", "family_name": "two_stage_residual", "family_stage": "stabilize", "status": null, "decision": null, "payload": {"tier": "proxy", "run_name": "round0009_proxy_1774133283", "family_name": "two_stage_residual", "family_stage": "stabilize", "checkpoint_dir": "/root/sparsify-ascend/checkpoints/research_agent/round_0009_proxy/round0009_proxy_1774133283_dp2_bs1_ga8_ef32_k128_20260322_064810", "metrics_path": "/root/sparsify-ascend/checkpoints/research_agent/round_0009_proxy/round0009_proxy_1774133283_dp2_bs1_ga8_ef32_k128_20260322_064810/metrics.jsonl", "latest_step": 152, "latest_tokens_per_sec": 41504.47683694621, "baseline_ratio": 0.374384782629185, "latest_total_tokens": 4980736.0, "proxy_mode": "fast", "evaluation_basis": "terminal_only"}}
{"event_id": "evt_1774133404685186573", "ts": 1774133404, "event": "training_finished", "round": 9, "session_id": "019d1279-dd8d-73d2-97df-ff57e75146ab", "tier": "proxy", "run_name": "round0009_proxy_1774133283", "family_name": "two_stage_residual", "family_stage": "stabilize", "status": "ok", "decision": "discard", "payload": {"tier": "proxy", "run_name": "round0009_proxy_1774133283", "family_name": "two_stage_residual", "family_stage": "stabilize", "checkpoint_dir": "/root/sparsify-ascend/checkpoints/research_agent/round_0009_proxy/round0009_proxy_1774133283_dp2_bs1_ga8_ef32_k128_20260322_064810", "metrics_path": "/root/sparsify-ascend/checkpoints/research_agent/round_0009_proxy/round0009_proxy_1774133283_dp2_bs1_ga8_ef32_k128_20260322_064810/metrics.jsonl", "run_health": "normal", "termination_reason": "completed", "tokens_per_sec": 41504.47683694621, "baseline_ratio": 0.374384782629185, "status": "ok", "decision": "discard", "proxy_mode": "fast", "evaluation_basis": "terminal_only", "curve_start_fvu": 0.3658484220504761, "curve_mid_fvu": 0.26473262906074524, "curve_end_fvu": 0.2215581238269806, "curve_late_slope": -6.297942755120476e-09, "curve_still_improving": true}}
{"event_id": "evt_1774133404685305298", "ts": 1774133404, "event": "result_recorded", "round": 9, "session_id": "019d1279-dd8d-73d2-97df-ff57e75146ab", "tier": "proxy", "run_name": "round0009_proxy_1774133283", "family_name": "two_stage_residual", "family_stage": "stabilize", "status": "ok", "decision": "discard", "payload": {"tier": "proxy", "run_name": "round0009_proxy_1774133283", "family_name": "two_stage_residual", "family_stage": "stabilize", "status": "ok", "decision": "discard", "val_fvu": "0.22183789871633053", "observed_fvu": "0.221558", "k": "128", "log_path": "/root/sparsify-ascend/research/history/logs/proxy_1774133404.log", "checkpoint": null}}
{"event_id": "evt_1774133404685457746", "ts": 1774133404, "event": "round_finished", "round": 9, "session_id": "019d1279-dd8d-73d2-97df-ff57e75146ab", "tier": "proxy", "run_name": null, "family_name": "two_stage_residual", "family_stage": "stabilize", "status": "ok", "decision": "discard", "payload": {"tier": "proxy", "family_name": "two_stage_residual", "family_stage": "stabilize", "status": "ok", "decision": "discard", "val_fvu": "0.22183789871633053"}}
{"event_id": "evt_1774133404928698156", "ts": 1774133404, "event": "experiment_commit_prepared", "round": 9, "tier": "proxy", "run_name": null, "family_name": "two_stage_residual", "family_stage": "stabilize", "status": "ok", "decision": "discard", "payload": {"branch": "autoresearch-sae"}}
{"event_id": "evt_1774133413963304786", "ts": 1774133413, "event": "round_started", "round": 10, "session_id": "019d1279-dd8d-73d2-97df-ff57e75146ab", "tier": null, "run_name": null, "family_name": null, "family_stage": null, "status": "started", "decision": null, "payload": {"status": "started"}}
{"event_id": "evt_1774133414175550933", "ts": 1774133414, "event": "agent_deciding", "round": 10, "session_id": "019d1279-dd8d-73d2-97df-ff57e75146ab", "tier": null, "run_name": null, "family_name": null, "family_stage": null, "status": null, "decision": null, "payload": {}}
{"event_id": "evt_1774133544113861025", "ts": 1774133544, "event": "session_resumed", "round": 10, "tier": null, "run_name": null, "family_name": null, "family_stage": null, "status": "active", "decision": null, "payload": {"session_id": "019d1279-dd8d-73d2-97df-ff57e75146ab"}}
{"event_id": "evt_1774133544114460472", "ts": 1774133544, "event": "agent_action_received", "round": 10, "session_id": "019d1279-dd8d-73d2-97df-ff57e75146ab", "tier": "proxy", "run_name": null, "family_name": "two_stage_residual", "family_stage": "stabilize", "status": null, "decision": null, "payload": {"session_id": "019d1279-dd8d-73d2-97df-ff57e75146ab", "tier": "proxy", "family_name": "two_stage_residual", "family_stage": "stabilize", "change_type": "edit_sae_code", "expected_win": "quality_improve", "hypothesis": "`two_stage_residual` remains the best K=128 full architecture, but both the K=64 drop and the EF=32 regression suggest the current 50/50 split of the total K across coarse and residual stages is likely misallocated rather than the family being exhausted. A family-specific stabilization pass that shifts more of the fixed K=128 budget into the first stage should test whether the architecture needs a stronger coarse pass before residual refinement to preserve its K=128 advantage."}}
{"event_id": "evt_1774133675105002777", "ts": 1774133675, "event": "proxy_mode_selected", "round": 10, "session_id": "019d1279-dd8d-73d2-97df-ff57e75146ab", "tier": "proxy", "run_name": null, "family_name": "two_stage_residual", "family_stage": "stabilize", "status": null, "decision": null, "payload": {"tier": "proxy", "proxy_mode": "fast", "evaluation_basis": "terminal_only", "parameter_behavior": "default", "proxy_max_tokens": "40000000"}}
{"event_id": "evt_1774133675105119818", "ts": 1774133675, "event": "sanity_started", "round": 10, "session_id": "019d1279-dd8d-73d2-97df-ff57e75146ab", "tier": "proxy", "run_name": null, "family_name": "two_stage_residual", "family_stage": "stabilize", "status": null, "decision": null, "payload": {"tier": "proxy"}}
{"event_id": "evt_1774133679731883907", "ts": 1774133679, "event": "sanity_finished", "round": 10, "session_id": "019d1279-dd8d-73d2-97df-ff57e75146ab", "tier": "proxy", "run_name": null, "family_name": "two_stage_residual", "family_stage": "stabilize", "status": "ok", "decision": null, "payload": {"tier": "proxy", "status": "ok"}}
{"event_id": "evt_1774133679732283878", "ts": 1774133679, "event": "training_started", "round": 10, "session_id": "019d1279-dd8d-73d2-97df-ff57e75146ab", "tier": "proxy", "run_name": "round0010_proxy_1774133679", "family_name": "two_stage_residual", "family_stage": "stabilize", "status": null, "decision": null, "payload": {"tier": "proxy", "run_name": "round0010_proxy_1774133679", "family_name": "two_stage_residual", "family_stage": "stabilize", "checkpoint_dir": "/root/sparsify-ascend/checkpoints/research_agent/round_0010_proxy", "log_path": "/root/sparsify-ascend/research/history/logs/round0010_proxy_1774133679.log", "config": {"architecture": "two_stage_residual", "expansion_factor": 16, "k": 128, "optimizer": "signum", "lr": "1.6e-3", "hookpoints": "layers.[3].self_attn.o_proj", "batch_size": 1, "grad_acc_steps": 8, "micro_acc_steps": 1, "auxk_alpha": 0.0, "dead_feature_threshold": 10000000, "use_hadamard": false, "tier": "proxy", "family_name": "two_stage_residual", "family_stage": "stabilize"}, "baseline_tokens_per_sec": 110860.4803471805, "proxy_mode": "fast", "evaluation_basis": "terminal_only"}}
{"event_id": "evt_1774133709733713399", "ts": 1774133709, "event": "training_heartbeat", "round": 10, "session_id": "019d1279-dd8d-73d2-97df-ff57e75146ab", "tier": "proxy", "run_name": "round0010_proxy_1774133679", "family_name": "two_stage_residual", "family_stage": "stabilize", "status": null, "decision": null, "payload": {"tier": "proxy", "run_name": "round0010_proxy_1774133679", "family_name": "two_stage_residual", "family_stage": "stabilize", "checkpoint_dir": "/root/sparsify-ascend/checkpoints/research_agent/round_0010_proxy/round0010_proxy_1774133679_dp2_bs1_ga8_ef16_k128_20260322_065446", "metrics_path": "/root/sparsify-ascend/checkpoints/research_agent/round_0010_proxy/round0010_proxy_1774133679_dp2_bs1_ga8_ef16_k128_20260322_065446/metrics.jsonl", "latest_step": 60, "latest_tokens_per_sec": 65533.57665211231, "baseline_ratio": 0.5911356007738876, "latest_total_tokens": 1966080.0, "proxy_mode": "fast", "evaluation_basis": "terminal_only"}}
{"event_id": "evt_1774133739735327648", "ts": 1774133739, "event": "training_heartbeat", "round": 10, "session_id": "019d1279-dd8d-73d2-97df-ff57e75146ab", "tier": "proxy", "run_name": "round0010_proxy_1774133679", "family_name": "two_stage_residual", "family_stage": "stabilize", "status": null, "decision": null, "payload": {"tier": "proxy", "run_name": "round0010_proxy_1774133679", "family_name": "two_stage_residual", "family_stage": "stabilize", "checkpoint_dir": "/root/sparsify-ascend/checkpoints/research_agent/round_0010_proxy/round0010_proxy_1774133679_dp2_bs1_ga8_ef16_k128_20260322_065446", "metrics_path": "/root/sparsify-ascend/checkpoints/research_agent/round_0010_proxy/round0010_proxy_1774133679_dp2_bs1_ga8_ef16_k128_20260322_065446/metrics.jsonl", "latest_step": 190, "latest_tokens_per_sec": 103760.64003433581, "baseline_ratio": 0.935956976817977, "latest_total_tokens": 6225920.0, "proxy_mode": "fast", "evaluation_basis": "terminal_only"}}
{"event_id": "evt_1774133769737649775", "ts": 1774133769, "event": "training_heartbeat", "round": 10, "session_id": "019d1279-dd8d-73d2-97df-ff57e75146ab", "tier": "proxy", "run_name": "round0010_proxy_1774133679", "family_name": "two_stage_residual", "family_stage": "stabilize", "status": null, "decision": null, "payload": {"tier": "proxy", "run_name": "round0010_proxy_1774133679", "family_name": "two_stage_residual", "family_stage": "stabilize", "checkpoint_dir": "/root/sparsify-ascend/checkpoints/research_agent/round_0010_proxy/round0010_proxy_1774133679_dp2_bs1_ga8_ef16_k128_20260322_065446", "metrics_path": "/root/sparsify-ascend/checkpoints/research_agent/round_0010_proxy/round0010_proxy_1774133679_dp2_bs1_ga8_ef16_k128_20260322_065446/metrics.jsonl", "latest_step": 310, "latest_tokens_per_sec": 112861.24318677213, "baseline_ratio": 1.0180475750540305, "latest_total_tokens": 10158080.0, "proxy_mode": "fast", "evaluation_basis": "terminal_only"}}
{"event_id": "evt_1774133799740733426", "ts": 1774133799, "event": "training_heartbeat", "round": 10, "session_id": "019d1279-dd8d-73d2-97df-ff57e75146ab", "tier": "proxy", "run_name": "round0010_proxy_1774133679", "family_name": "two_stage_residual", "family_stage": "stabilize", "status": null, "decision": null, "payload": {"tier": "proxy", "run_name": "round0010_proxy_1774133679", "family_name": "two_stage_residual", "family_stage": "stabilize", "checkpoint_dir": "/root/sparsify-ascend/checkpoints/research_agent/round_0010_proxy/round0010_proxy_1774133679_dp2_bs1_ga8_ef16_k128_20260322_065446", "metrics_path": "/root/sparsify-ascend/checkpoints/research_agent/round_0010_proxy/round0010_proxy_1774133679_dp2_bs1_ga8_ef16_k128_20260322_065446/metrics.jsonl", "latest_step": 440, "latest_tokens_per_sec": 120141.25527405544, "baseline_ratio": 1.0837158101589532, "latest_total_tokens": 14417920.0, "proxy_mode": "fast", "evaluation_basis": "terminal_only"}}
{"event_id": "evt_1774133829744452254", "ts": 1774133829, "event": "training_heartbeat", "round": 10, "session_id": "019d1279-dd8d-73d2-97df-ff57e75146ab", "tier": "proxy", "run_name": "round0010_proxy_1774133679", "family_name": "two_stage_residual", "family_stage": "stabilize", "status": null, "decision": null, "payload": {"tier": "proxy", "run_name": "round0010_proxy_1774133679", "family_name": "two_stage_residual", "family_stage": "stabilize", "checkpoint_dir": "/root/sparsify-ascend/checkpoints/research_agent/round_0010_proxy/round0010_proxy_1774133679_dp2_bs1_ga8_ef16_k128_20260322_065446", "metrics_path": "/root/sparsify-ascend/checkpoints/research_agent/round_0010_proxy/round0010_proxy_1774133679_dp2_bs1_ga8_ef16_k128_20260322_065446/metrics.jsonl", "latest_step": 560, "latest_tokens_per_sec": 122324.21578919231, "baseline_ratio": 1.1034068714668288, "latest_total_tokens": 18350080.0, "proxy_mode": "fast", "evaluation_basis": "terminal_only"}}
{"event_id": "evt_1774133859752182006", "ts": 1774133859, "event": "training_heartbeat", "round": 10, "session_id": "019d1279-dd8d-73d2-97df-ff57e75146ab", "tier": "proxy", "run_name": "round0010_proxy_1774133679", "family_name": "two_stage_residual", "family_stage": "stabilize", "status": null, "decision": null, "payload": {"tier": "proxy", "run_name": "round0010_proxy_1774133679", "family_name": "two_stage_residual", "family_stage": "stabilize", "checkpoint_dir": "/root/sparsify-ascend/checkpoints/research_agent/round_0010_proxy/round0010_proxy_1774133679_dp2_bs1_ga8_ef16_k128_20260322_065446", "metrics_path": "/root/sparsify-ascend/checkpoints/research_agent/round_0010_proxy/round0010_proxy_1774133679_dp2_bs1_ga8_ef16_k128_20260322_065446/metrics.jsonl", "latest_step": 690, "latest_tokens_per_sec": 125597.05880941749, "baseline_ratio": 1.1329290511468704, "latest_total_tokens": 22609920.0, "proxy_mode": "fast", "evaluation_basis": "terminal_only"}}
{"event_id": "evt_1774133889757511846", "ts": 1774133889, "event": "training_heartbeat", "round": 10, "session_id": "019d1279-dd8d-73d2-97df-ff57e75146ab", "tier": "proxy", "run_name": "round0010_proxy_1774133679", "family_name": "two_stage_residual", "family_stage": "stabilize", "status": null, "decision": null, "payload": {"tier": "proxy", "run_name": "round0010_proxy_1774133679", "family_name": "two_stage_residual", "family_stage": "stabilize", "checkpoint_dir": "/root/sparsify-ascend/checkpoints/research_agent/round_0010_proxy/round0010_proxy_1774133679_dp2_bs1_ga8_ef16_k128_20260322_065446", "metrics_path": "/root/sparsify-ascend/checkpoints/research_agent/round_0010_proxy/round0010_proxy_1774133679_dp2_bs1_ga8_ef16_k128_20260322_065446/metrics.jsonl", "latest_step": 810, "latest_tokens_per_sec": 126375.87919864053, "baseline_ratio": 1.1399542812990764, "latest_total_tokens": 26542080.0, "proxy_mode": "fast", "evaluation_basis": "terminal_only"}}
{"event_id": "evt_1774133919763352733", "ts": 1774133919, "event": "training_heartbeat", "round": 10, "session_id": "019d1279-dd8d-73d2-97df-ff57e75146ab", "tier": "proxy", "run_name": "round0010_proxy_1774133679", "family_name": "two_stage_residual", "family_stage": "stabilize", "status": null, "decision": null, "payload": {"tier": "proxy", "run_name": "round0010_proxy_1774133679", "family_name": "two_stage_residual", "family_stage": "stabilize", "checkpoint_dir": "/root/sparsify-ascend/checkpoints/research_agent/round_0010_proxy/round0010_proxy_1774133679_dp2_bs1_ga8_ef16_k128_20260322_065446", "metrics_path": "/root/sparsify-ascend/checkpoints/research_agent/round_0010_proxy/round0010_proxy_1774133679_dp2_bs1_ga8_ef16_k128_20260322_065446/metrics.jsonl", "latest_step": 930, "latest_tokens_per_sec": 126959.74310135192, "baseline_ratio": 1.1452209362953645, "latest_total_tokens": 30474240.0, "proxy_mode": "fast", "evaluation_basis": "terminal_only"}}
