{"event_id": "evt_1774144175402650183", "ts": 1774144175, "event": "training_started", "round": 25, "session_id": "019d130c-782e-75a2-aa6f-506b18d29edf", "tier": "proxy", "run_name": "round0025_proxy_1774144175", "family_name": "lowrank_gated_residual", "family_stage": "stabilize", "status": null, "decision": null, "payload": {"tier": "proxy", "run_name": "round0025_proxy_1774144175", "family_name": "lowrank_gated_residual", "family_stage": "stabilize", "checkpoint_dir": "/root/sparsify-ascend/checkpoints/research_agent/round_0025_proxy", "log_path": "/root/sparsify-ascend/research/history/logs/round0025_proxy_1774144175.log", "config": {"architecture": "lowrank_gated_residual", "expansion_factor": 32, "k": 128, "optimizer": "signum", "lr": "1.6e-3", "hookpoints": "layers.[3].self_attn.o_proj", "batch_size": 1, "grad_acc_steps": 8, "micro_acc_steps": 1, "auxk_alpha": 0.01, "dead_feature_threshold": 10000000, "use_hadamard": false, "tier": "proxy", "family_name": "lowrank_gated_residual", "family_stage": "stabilize"}, "baseline_tokens_per_sec": 66557.55177513757, "proxy_mode": "extended", "evaluation_basis": "curve_extended"}}
{"event_id": "evt_1774144205403843956", "ts": 1774144205, "event": "training_heartbeat", "round": 25, "session_id": "019d130c-782e-75a2-aa6f-506b18d29edf", "tier": "proxy", "run_name": "round0025_proxy_1774144175", "family_name": "lowrank_gated_residual", "family_stage": "stabilize", "status": null, "decision": null, "payload": {"tier": "proxy", "run_name": "round0025_proxy_1774144175", "family_name": "lowrank_gated_residual", "family_stage": "stabilize", "checkpoint_dir": "/root/sparsify-ascend/checkpoints/research_agent/round_0025_proxy/round0025_proxy_1774144175_dp2_bs1_ga8_ef32_k128_20260322_094947", "metrics_path": "/root/sparsify-ascend/checkpoints/research_agent/round_0025_proxy/round0025_proxy_1774144175_dp2_bs1_ga8_ef32_k128_20260322_094947/metrics.jsonl", "latest_step": 20, "latest_tokens_per_sec": 21844.68751909279, "baseline_ratio": 0.32820749766899965, "latest_total_tokens": 655360.0, "proxy_mode": "extended", "evaluation_basis": "curve_extended"}}
{"event_id": "evt_1774144235404970607", "ts": 1774144235, "event": "training_heartbeat", "round": 25, "session_id": "019d130c-782e-75a2-aa6f-506b18d29edf", "tier": "proxy", "run_name": "round0025_proxy_1774144175", "family_name": "lowrank_gated_residual", "family_stage": "stabilize", "status": null, "decision": null, "payload": {"tier": "proxy", "run_name": "round0025_proxy_1774144175", "family_name": "lowrank_gated_residual", "family_stage": "stabilize", "checkpoint_dir": "/root/sparsify-ascend/checkpoints/research_agent/round_0025_proxy/round0025_proxy_1774144175_dp2_bs1_ga8_ef32_k128_20260322_094947", "metrics_path": "/root/sparsify-ascend/checkpoints/research_agent/round_0025_proxy/round0025_proxy_1774144175_dp2_bs1_ga8_ef32_k128_20260322_094947/metrics.jsonl", "latest_step": 90, "latest_tokens_per_sec": 49150.346930597545, "baseline_ratio": 0.7384638650269217, "latest_total_tokens": 2949120.0, "proxy_mode": "extended", "evaluation_basis": "curve_extended"}}
{"event_id": "evt_1774144265406538535", "ts": 1774144265, "event": "training_heartbeat", "round": 25, "session_id": "019d130c-782e-75a2-aa6f-506b18d29edf", "tier": "proxy", "run_name": "round0025_proxy_1774144175", "family_name": "lowrank_gated_residual", "family_stage": "stabilize", "status": null, "decision": null, "payload": {"tier": "proxy", "run_name": "round0025_proxy_1774144175", "family_name": "lowrank_gated_residual", "family_stage": "stabilize", "checkpoint_dir": "/root/sparsify-ascend/checkpoints/research_agent/round_0025_proxy/round0025_proxy_1774144175_dp2_bs1_ga8_ef32_k128_20260322_094947", "metrics_path": "/root/sparsify-ascend/checkpoints/research_agent/round_0025_proxy/round0025_proxy_1774144175_dp2_bs1_ga8_ef32_k128_20260322_094947/metrics.jsonl", "latest_step": 170, "latest_tokens_per_sec": 61892.6386018591, "baseline_ratio": 0.9299115870571873, "latest_total_tokens": 5570560.0, "proxy_mode": "extended", "evaluation_basis": "curve_extended"}}
{"event_id": "evt_1774144295408496197", "ts": 1774144295, "event": "training_heartbeat", "round": 25, "session_id": "019d130c-782e-75a2-aa6f-506b18d29edf", "tier": "proxy", "run_name": "round0025_proxy_1774144175", "family_name": "lowrank_gated_residual", "family_stage": "stabilize", "status": null, "decision": null, "payload": {"tier": "proxy", "run_name": "round0025_proxy_1774144175", "family_name": "lowrank_gated_residual", "family_stage": "stabilize", "checkpoint_dir": "/root/sparsify-ascend/checkpoints/research_agent/round_0025_proxy/round0025_proxy_1774144175_dp2_bs1_ga8_ef32_k128_20260322_094947", "metrics_path": "/root/sparsify-ascend/checkpoints/research_agent/round_0025_proxy/round0025_proxy_1774144175_dp2_bs1_ga8_ef32_k128_20260322_094947/metrics.jsonl", "latest_step": 240, "latest_tokens_per_sec": 65532.971884713326, "baseline_ratio": 0.9846061060976858, "latest_total_tokens": 7864320.0, "proxy_mode": "extended", "evaluation_basis": "curve_extended"}}
{"event_id": "evt_1774144325410894961", "ts": 1774144325, "event": "training_heartbeat", "round": 25, "session_id": "019d130c-782e-75a2-aa6f-506b18d29edf", "tier": "proxy", "run_name": "round0025_proxy_1774144175", "family_name": "lowrank_gated_residual", "family_stage": "stabilize", "status": null, "decision": null, "payload": {"tier": "proxy", "run_name": "round0025_proxy_1774144175", "family_name": "lowrank_gated_residual", "family_stage": "stabilize", "checkpoint_dir": "/root/sparsify-ascend/checkpoints/research_agent/round_0025_proxy/round0025_proxy_1774144175_dp2_bs1_ga8_ef32_k128_20260322_094947", "metrics_path": "/root/sparsify-ascend/checkpoints/research_agent/round_0025_proxy/round0025_proxy_1774144175_dp2_bs1_ga8_ef32_k128_20260322_094947/metrics.jsonl", "latest_step": 310, "latest_tokens_per_sec": 67716.94516582332, "baseline_ratio": 1.0174194116184248, "latest_total_tokens": 10158080.0, "proxy_mode": "extended", "evaluation_basis": "curve_extended"}}
{"event_id": "evt_1774144355413756457", "ts": 1774144355, "event": "training_heartbeat", "round": 25, "session_id": "019d130c-782e-75a2-aa6f-506b18d29edf", "tier": "proxy", "run_name": "round0025_proxy_1774144175", "family_name": "lowrank_gated_residual", "family_stage": "stabilize", "status": null, "decision": null, "payload": {"tier": "proxy", "run_name": "round0025_proxy_1774144175", "family_name": "lowrank_gated_residual", "family_stage": "stabilize", "checkpoint_dir": "/root/sparsify-ascend/checkpoints/research_agent/round_0025_proxy/round0025_proxy_1774144175_dp2_bs1_ga8_ef32_k128_20260322_094947", "metrics_path": "/root/sparsify-ascend/checkpoints/research_agent/round_0025_proxy/round0025_proxy_1774144175_dp2_bs1_ga8_ef32_k128_20260322_094947/metrics.jsonl", "latest_step": 380, "latest_tokens_per_sec": 69172.73884369807, "baseline_ratio": 1.0392921163536155, "latest_total_tokens": 12451840.0, "proxy_mode": "extended", "evaluation_basis": "curve_extended"}}
{"event_id": "evt_1774144385417048671", "ts": 1774144385, "event": "training_heartbeat", "round": 25, "session_id": "019d130c-782e-75a2-aa6f-506b18d29edf", "tier": "proxy", "run_name": "round0025_proxy_1774144175", "family_name": "lowrank_gated_residual", "family_stage": "stabilize", "status": null, "decision": null, "payload": {"tier": "proxy", "run_name": "round0025_proxy_1774144175", "family_name": "lowrank_gated_residual", "family_stage": "stabilize", "checkpoint_dir": "/root/sparsify-ascend/checkpoints/research_agent/round_0025_proxy/round0025_proxy_1774144175_dp2_bs1_ga8_ef32_k128_20260322_094947", "metrics_path": "/root/sparsify-ascend/checkpoints/research_agent/round_0025_proxy/round0025_proxy_1774144175_dp2_bs1_ga8_ef32_k128_20260322_094947/metrics.jsonl", "latest_step": 460, "latest_tokens_per_sec": 71772.70842610717, "baseline_ratio": 1.0783555962002453, "latest_total_tokens": 15073280.0, "proxy_mode": "extended", "evaluation_basis": "curve_extended"}}
{"event_id": "evt_1774144415420728729", "ts": 1774144415, "event": "training_heartbeat", "round": 25, "session_id": "019d130c-782e-75a2-aa6f-506b18d29edf", "tier": "proxy", "run_name": "round0025_proxy_1774144175", "family_name": "lowrank_gated_residual", "family_stage": "stabilize", "status": null, "decision": null, "payload": {"tier": "proxy", "run_name": "round0025_proxy_1774144175", "family_name": "lowrank_gated_residual", "family_stage": "stabilize", "checkpoint_dir": "/root/sparsify-ascend/checkpoints/research_agent/round_0025_proxy/round0025_proxy_1774144175_dp2_bs1_ga8_ef32_k128_20260322_094947", "metrics_path": "/root/sparsify-ascend/checkpoints/research_agent/round_0025_proxy/round0025_proxy_1774144175_dp2_bs1_ga8_ef32_k128_20260322_094947/metrics.jsonl", "latest_step": 530, "latest_tokens_per_sec": 72357.30775773003, "baseline_ratio": 1.0871389621148737, "latest_total_tokens": 17367040.0, "proxy_mode": "extended", "evaluation_basis": "curve_extended"}}
{"event_id": "evt_1774144445424854421", "ts": 1774144445, "event": "training_heartbeat", "round": 25, "session_id": "019d130c-782e-75a2-aa6f-506b18d29edf", "tier": "proxy", "run_name": "round0025_proxy_1774144175", "family_name": "lowrank_gated_residual", "family_stage": "stabilize", "status": null, "decision": null, "payload": {"tier": "proxy", "run_name": "round0025_proxy_1774144175", "family_name": "lowrank_gated_residual", "family_stage": "stabilize", "checkpoint_dir": "/root/sparsify-ascend/checkpoints/research_agent/round_0025_proxy/round0025_proxy_1774144175_dp2_bs1_ga8_ef32_k128_20260322_094947", "metrics_path": "/root/sparsify-ascend/checkpoints/research_agent/round_0025_proxy/round0025_proxy_1774144175_dp2_bs1_ga8_ef32_k128_20260322_094947/metrics.jsonl", "latest_step": 600, "latest_tokens_per_sec": 72811.87091386519, "baseline_ratio": 1.0939685876646668, "latest_total_tokens": 19660800.0, "proxy_mode": "extended", "evaluation_basis": "curve_extended"}}
{"event_id": "evt_1774144475475949495", "ts": 1774144475, "event": "training_heartbeat", "round": 25, "session_id": "019d130c-782e-75a2-aa6f-506b18d29edf", "tier": "proxy", "run_name": "round0025_proxy_1774144175", "family_name": "lowrank_gated_residual", "family_stage": "stabilize", "status": null, "decision": null, "payload": {"tier": "proxy", "run_name": "round0025_proxy_1774144175", "family_name": "lowrank_gated_residual", "family_stage": "stabilize", "checkpoint_dir": "/root/sparsify-ascend/checkpoints/research_agent/round_0025_proxy/round0025_proxy_1774144175_dp2_bs1_ga8_ef32_k128_20260322_094947", "metrics_path": "/root/sparsify-ascend/checkpoints/research_agent/round_0025_proxy/round0025_proxy_1774144175_dp2_bs1_ga8_ef32_k128_20260322_094947/metrics.jsonl", "latest_step": 610, "latest_tokens_per_sec": 66622.4730177184, "baseline_ratio": 1.0009754151234431, "latest_total_tokens": 19988480.0, "proxy_mode": "extended", "evaluation_basis": "curve_extended"}}
{"event_id": "evt_1774144505480373511", "ts": 1774144505, "event": "training_heartbeat", "round": 25, "session_id": "019d130c-782e-75a2-aa6f-506b18d29edf", "tier": "proxy", "run_name": "round0025_proxy_1774144175", "family_name": "lowrank_gated_residual", "family_stage": "stabilize", "status": null, "decision": null, "payload": {"tier": "proxy", "run_name": "round0025_proxy_1774144175", "family_name": "lowrank_gated_residual", "family_stage": "stabilize", "checkpoint_dir": "/root/sparsify-ascend/checkpoints/research_agent/round_0025_proxy/round0025_proxy_1774144175_dp2_bs1_ga8_ef32_k128_20260322_094947", "metrics_path": "/root/sparsify-ascend/checkpoints/research_agent/round_0025_proxy/round0025_proxy_1774144175_dp2_bs1_ga8_ef32_k128_20260322_094947/metrics.jsonl", "latest_step": 610, "latest_tokens_per_sec": 60556.98302545191, "baseline_ratio": 0.9098439081720076, "latest_total_tokens": 19988480.0, "proxy_mode": "extended", "evaluation_basis": "curve_extended"}}
{"event_id": "evt_1774144535484597628", "ts": 1774144535, "event": "training_heartbeat", "round": 25, "session_id": "019d130c-782e-75a2-aa6f-506b18d29edf", "tier": "proxy", "run_name": "round0025_proxy_1774144175", "family_name": "lowrank_gated_residual", "family_stage": "stabilize", "status": null, "decision": null, "payload": {"tier": "proxy", "run_name": "round0025_proxy_1774144175", "family_name": "lowrank_gated_residual", "family_stage": "stabilize", "checkpoint_dir": "/root/sparsify-ascend/checkpoints/research_agent/round_0025_proxy/round0025_proxy_1774144175_dp2_bs1_ga8_ef32_k128_20260322_094947", "metrics_path": "/root/sparsify-ascend/checkpoints/research_agent/round_0025_proxy/round0025_proxy_1774144175_dp2_bs1_ga8_ef32_k128_20260322_094947/metrics.jsonl", "latest_step": 610, "latest_tokens_per_sec": 55510.96690105123, "baseline_ratio": 0.8340295792218011, "latest_total_tokens": 19988480.0, "proxy_mode": "extended", "evaluation_basis": "curve_extended"}}
{"event_id": "evt_1774144565488852808", "ts": 1774144565, "event": "training_heartbeat", "round": 25, "session_id": "019d130c-782e-75a2-aa6f-506b18d29edf", "tier": "proxy", "run_name": "round0025_proxy_1774144175", "family_name": "lowrank_gated_residual", "family_stage": "stabilize", "status": null, "decision": null, "payload": {"tier": "proxy", "run_name": "round0025_proxy_1774144175", "family_name": "lowrank_gated_residual", "family_stage": "stabilize", "checkpoint_dir": "/root/sparsify-ascend/checkpoints/research_agent/round_0025_proxy/round0025_proxy_1774144175_dp2_bs1_ga8_ef32_k128_20260322_094947", "metrics_path": "/root/sparsify-ascend/checkpoints/research_agent/round_0025_proxy/round0025_proxy_1774144175_dp2_bs1_ga8_ef32_k128_20260322_094947/metrics.jsonl", "latest_step": 610, "latest_tokens_per_sec": 51241.22841937897, "baseline_ratio": 0.7698785044332117, "latest_total_tokens": 19988480.0, "proxy_mode": "extended", "evaluation_basis": "curve_extended"}}
{"event_id": "evt_1774144595493095604", "ts": 1774144595, "event": "training_heartbeat", "round": 25, "session_id": "019d130c-782e-75a2-aa6f-506b18d29edf", "tier": "proxy", "run_name": "round0025_proxy_1774144175", "family_name": "lowrank_gated_residual", "family_stage": "stabilize", "status": null, "decision": null, "payload": {"tier": "proxy", "run_name": "round0025_proxy_1774144175", "family_name": "lowrank_gated_residual", "family_stage": "stabilize", "checkpoint_dir": "/root/sparsify-ascend/checkpoints/research_agent/round_0025_proxy/round0025_proxy_1774144175_dp2_bs1_ga8_ef32_k128_20260322_094947", "metrics_path": "/root/sparsify-ascend/checkpoints/research_agent/round_0025_proxy/round0025_proxy_1774144175_dp2_bs1_ga8_ef32_k128_20260322_094947/metrics.jsonl", "latest_step": 610, "latest_tokens_per_sec": 47581.40764559435, "baseline_ratio": 0.7148911938099304, "latest_total_tokens": 19988480.0, "proxy_mode": "extended", "evaluation_basis": "curve_extended"}}
{"event_id": "evt_1774144595561900890", "ts": 1774144595, "event": "training_finished", "round": 25, "session_id": "019d130c-782e-75a2-aa6f-506b18d29edf", "tier": "proxy", "run_name": "round0025_proxy_1774144175", "family_name": "lowrank_gated_residual", "family_stage": "stabilize", "status": "ok", "decision": "discard", "payload": {"tier": "proxy", "run_name": "round0025_proxy_1774144175", "family_name": "lowrank_gated_residual", "family_stage": "stabilize", "checkpoint_dir": "/root/sparsify-ascend/checkpoints/research_agent/round_0025_proxy/round0025_proxy_1774144175_dp2_bs1_ga8_ef32_k128_20260322_094947", "metrics_path": "/root/sparsify-ascend/checkpoints/research_agent/round_0025_proxy/round0025_proxy_1774144175_dp2_bs1_ga8_ef32_k128_20260322_094947/metrics.jsonl", "run_health": "normal", "termination_reason": "completed", "tokens_per_sec": 47581.40764559435, "baseline_ratio": 0.7148911938099304, "status": "ok", "decision": "discard", "proxy_mode": "extended", "evaluation_basis": "curve_extended", "curve_start_fvu": 0.1295512616634369, "curve_mid_fvu": 0.09478600323200226, "curve_end_fvu": 0.08365611732006073, "curve_late_slope": -2.418920437358778e-11, "curve_still_improving": false}}
{"event_id": "evt_1774144595561961498", "ts": 1774144595, "event": "result_recorded", "round": 25, "session_id": "019d130c-782e-75a2-aa6f-506b18d29edf", "tier": "proxy", "run_name": "round0025_proxy_1774144175", "family_name": "lowrank_gated_residual", "family_stage": "stabilize", "status": "ok", "decision": "discard", "payload": {"tier": "proxy", "run_name": "round0025_proxy_1774144175", "family_name": "lowrank_gated_residual", "family_stage": "stabilize", "status": "ok", "decision": "discard", "val_fvu": "0.07924031186848879", "observed_fvu": "0.083656", "k": "128", "log_path": "/root/sparsify-ascend/research/history/logs/proxy_1774144595.log", "checkpoint": null}}
{"event_id": "evt_1774144595562285926", "ts": 1774144595, "event": "round_finished", "round": 25, "session_id": "019d130c-782e-75a2-aa6f-506b18d29edf", "tier": "proxy", "run_name": null, "family_name": "lowrank_gated_residual", "family_stage": "stabilize", "status": "ok", "decision": "discard", "payload": {"tier": "proxy", "family_name": "lowrank_gated_residual", "family_stage": "stabilize", "status": "ok", "decision": "discard", "val_fvu": "0.07924031186848879"}}
{"event_id": "evt_1774144595568626265", "ts": 1774144595, "event": "experiment_commit_prepared", "round": 25, "tier": "proxy", "run_name": null, "family_name": "lowrank_gated_residual", "family_stage": "stabilize", "status": "ok", "decision": "discard", "payload": {"branch": "autoresearch-sae"}}
{"event_id": "evt_1774144603078516479", "ts": 1774144603, "event": "round_started", "round": 26, "session_id": "019d130c-782e-75a2-aa6f-506b18d29edf", "tier": null, "run_name": null, "family_name": null, "family_stage": null, "status": "started", "decision": null, "payload": {"status": "started"}}
{"event_id": "evt_1774144603078682285", "ts": 1774144603, "event": "agent_deciding", "round": 26, "session_id": "019d130c-782e-75a2-aa6f-506b18d29edf", "tier": null, "run_name": null, "family_name": null, "family_stage": null, "status": null, "decision": null, "payload": {}}
{"event_id": "evt_1774144725568176219", "ts": 1774144725, "event": "session_resumed", "round": 26, "tier": null, "run_name": null, "family_name": null, "family_stage": null, "status": "active", "decision": null, "payload": {"session_id": "019d130c-782e-75a2-aa6f-506b18d29edf"}}
{"event_id": "evt_1774144725569002340", "ts": 1774144725, "event": "agent_action_received", "round": 26, "session_id": "019d130c-782e-75a2-aa6f-506b18d29edf", "tier": "proxy", "run_name": null, "family_name": "lowrank_gated_residual", "family_stage": "stabilize", "status": null, "decision": null, "payload": {"session_id": "019d130c-782e-75a2-aa6f-506b18d29edf", "tier": "proxy", "family_name": "lowrank_gated_residual", "family_stage": "stabilize", "change_type": "param_only", "expected_win": "lower_fvu", "hypothesis": "`AUXK_ALPHA=0.01` clearly regressed proxy quality for `lowrank_gated_residual` at the K=128 anchor, so the family default should stay at `AUXK_ALPHA=0`. The next clean single-variable stabilization move is to lower LR slightly from `1.6e-3` to `1.2e-3` at K=128, testing whether the gated residual mainline is overshooting near convergence and can realize a modest quality gain through a narrower optimization step without changing architecture, K, or aux behavior."}}
{"event_id": "evt_1774144725569132530", "ts": 1774144725, "event": "proxy_mode_selected", "round": 26, "session_id": "019d130c-782e-75a2-aa6f-506b18d29edf", "tier": "proxy", "run_name": null, "family_name": "lowrank_gated_residual", "family_stage": "stabilize", "status": null, "decision": null, "payload": {"tier": "proxy", "proxy_mode": "extended", "evaluation_basis": "curve_extended", "parameter_behavior": "dynamic", "proxy_max_tokens": "20000000"}}
{"event_id": "evt_1774144725569404143", "ts": 1774144725, "event": "training_started", "round": 26, "session_id": "019d130c-782e-75a2-aa6f-506b18d29edf", "tier": "proxy", "run_name": "round0026_proxy_1774144725", "family_name": "lowrank_gated_residual", "family_stage": "stabilize", "status": null, "decision": null, "payload": {"tier": "proxy", "run_name": "round0026_proxy_1774144725", "family_name": "lowrank_gated_residual", "family_stage": "stabilize", "checkpoint_dir": "/root/sparsify-ascend/checkpoints/research_agent/round_0026_proxy", "log_path": "/root/sparsify-ascend/research/history/logs/round0026_proxy_1774144725.log", "config": {"architecture": "lowrank_gated_residual", "expansion_factor": 32, "k": 128, "optimizer": "signum", "lr": "1.2e-3", "hookpoints": "layers.[3].self_attn.o_proj", "batch_size": 1, "grad_acc_steps": 8, "micro_acc_steps": 1, "auxk_alpha": 0.0, "dead_feature_threshold": 10000000, "use_hadamard": false, "tier": "proxy", "family_name": "lowrank_gated_residual", "family_stage": "stabilize"}, "baseline_tokens_per_sec": 66557.55177513757, "proxy_mode": "extended", "evaluation_basis": "curve_extended"}}
{"event_id": "evt_1774144755570649560", "ts": 1774144755, "event": "training_heartbeat", "round": 26, "session_id": "019d130c-782e-75a2-aa6f-506b18d29edf", "tier": "proxy", "run_name": "round0026_proxy_1774144725", "family_name": "lowrank_gated_residual", "family_stage": "stabilize", "status": null, "decision": null, "payload": {"tier": "proxy", "run_name": "round0026_proxy_1774144725", "family_name": "lowrank_gated_residual", "family_stage": "stabilize", "checkpoint_dir": "/root/sparsify-ascend/checkpoints/research_agent/round_0026_proxy/round0026_proxy_1774144725_dp2_bs1_ga8_ef32_k128_20260322_095854", "metrics_path": "/root/sparsify-ascend/checkpoints/research_agent/round_0026_proxy/round0026_proxy_1774144725_dp2_bs1_ga8_ef32_k128_20260322_095854/metrics.jsonl", "latest_step": 30, "latest_tokens_per_sec": 32766.967740852637, "baseline_ratio": 0.49231029187423725, "latest_total_tokens": 983040.0, "proxy_mode": "extended", "evaluation_basis": "curve_extended"}}
