{"event_id": "evt_1774154848373203930", "ts": 1774154848, "event": "training_started", "round": 43, "session_id": "019d13dc-400c-7493-83af-bd34fffa7466", "tier": "full", "run_name": "round0043_full_1774154848", "family_name": "lowrank_gated_residual", "family_stage": "mainline", "status": null, "decision": null, "payload": {"tier": "full", "run_name": "round0043_full_1774154848", "family_name": "lowrank_gated_residual", "family_stage": "mainline", "checkpoint_dir": "/root/sparsify-ascend/checkpoints/research_agent/round_0043_full", "log_path": "/root/sparsify-ascend/research/history/logs/round0043_full_1774154848.log", "config": {"architecture": "lowrank_gated_residual", "expansion_factor": 32, "k": 80, "optimizer": "signum", "lr": "1.6e-3", "hookpoints": "layers.[3].self_attn.o_proj", "batch_size": 1, "grad_acc_steps": 8, "micro_acc_steps": 1, "auxk_alpha": 0.0, "dead_feature_threshold": 10000000, "use_hadamard": false, "tier": "full", "family_name": "lowrank_gated_residual", "family_stage": "mainline"}, "baseline_tokens_per_sec": 88695.60575375632, "proxy_mode": null, "evaluation_basis": null}}
{"event_id": "evt_1774154878602786964", "ts": 1774154878, "event": "training_heartbeat", "round": 43, "session_id": "019d13dc-400c-7493-83af-bd34fffa7466", "tier": "full", "run_name": "round0043_full_1774154848", "family_name": "lowrank_gated_residual", "family_stage": "mainline", "status": null, "decision": null, "payload": {"tier": "full", "run_name": "round0043_full_1774154848", "family_name": "lowrank_gated_residual", "family_stage": "mainline", "checkpoint_dir": "/root/sparsify-ascend/checkpoints/research_agent/round_0043_full/round0043_full_1774154848_dp2_bs1_ga8_ef32_k80_20260322_124736", "metrics_path": "/root/sparsify-ascend/checkpoints/research_agent/round_0043_full/round0043_full_1774154848_dp2_bs1_ga8_ef32_k80_20260322_124736/metrics.jsonl", "latest_step": 40, "latest_tokens_per_sec": 43689.084432301854, "baseline_ratio": 0.4925732685517128, "latest_total_tokens": 1310720.0, "proxy_mode": null, "evaluation_basis": null}}
{"event_id": "evt_1774154908604004405", "ts": 1774154908, "event": "training_heartbeat", "round": 43, "session_id": "019d13dc-400c-7493-83af-bd34fffa7466", "tier": "full", "run_name": "round0043_full_1774154848", "family_name": "lowrank_gated_residual", "family_stage": "mainline", "status": null, "decision": null, "payload": {"tier": "full", "run_name": "round0043_full_1774154848", "family_name": "lowrank_gated_residual", "family_stage": "mainline", "checkpoint_dir": "/root/sparsify-ascend/checkpoints/research_agent/round_0043_full/round0043_full_1774154848_dp2_bs1_ga8_ef32_k80_20260322_124736", "metrics_path": "/root/sparsify-ascend/checkpoints/research_agent/round_0043_full/round0043_full_1774154848_dp2_bs1_ga8_ef32_k80_20260322_124736/metrics.jsonl", "latest_step": 120, "latest_tokens_per_sec": 65533.49801218946, "baseline_ratio": 0.7388584525159982, "latest_total_tokens": 3932160.0, "proxy_mode": null, "evaluation_basis": null}}
{"event_id": "evt_1774154938605674488", "ts": 1774154938, "event": "training_heartbeat", "round": 43, "session_id": "019d13dc-400c-7493-83af-bd34fffa7466", "tier": "full", "run_name": "round0043_full_1774154848", "family_name": "lowrank_gated_residual", "family_stage": "mainline", "status": null, "decision": null, "payload": {"tier": "full", "run_name": "round0043_full_1774154848", "family_name": "lowrank_gated_residual", "family_stage": "mainline", "checkpoint_dir": "/root/sparsify-ascend/checkpoints/research_agent/round_0043_full/round0043_full_1774154848_dp2_bs1_ga8_ef32_k80_20260322_124736", "metrics_path": "/root/sparsify-ascend/checkpoints/research_agent/round_0043_full/round0043_full_1774154848_dp2_bs1_ga8_ef32_k80_20260322_124736/metrics.jsonl", "latest_step": 200, "latest_tokens_per_sec": 72814.57633674552, "baseline_ratio": 0.8209490844326499, "latest_total_tokens": 6553600.0, "proxy_mode": null, "evaluation_basis": null}}
{"event_id": "evt_1774154968607833868", "ts": 1774154968, "event": "training_heartbeat", "round": 43, "session_id": "019d13dc-400c-7493-83af-bd34fffa7466", "tier": "full", "run_name": "round0043_full_1774154848", "family_name": "lowrank_gated_residual", "family_stage": "mainline", "status": null, "decision": null, "payload": {"tier": "full", "run_name": "round0043_full_1774154848", "family_name": "lowrank_gated_residual", "family_stage": "mainline", "checkpoint_dir": "/root/sparsify-ascend/checkpoints/research_agent/round_0043_full/round0043_full_1774154848_dp2_bs1_ga8_ef32_k80_20260322_124736", "metrics_path": "/root/sparsify-ascend/checkpoints/research_agent/round_0043_full/round0043_full_1774154848_dp2_bs1_ga8_ef32_k80_20260322_124736/metrics.jsonl", "latest_step": 290, "latest_tokens_per_sec": 79185.29238829018, "baseline_ratio": 0.8927758226053565, "latest_total_tokens": 9502720.0, "proxy_mode": null, "evaluation_basis": null}}
{"event_id": "evt_1774154998610478361", "ts": 1774154998, "event": "training_heartbeat", "round": 43, "session_id": "019d13dc-400c-7493-83af-bd34fffa7466", "tier": "full", "run_name": "round0043_full_1774154848", "family_name": "lowrank_gated_residual", "family_stage": "mainline", "status": null, "decision": null, "payload": {"tier": "full", "run_name": "round0043_full_1774154848", "family_name": "lowrank_gated_residual", "family_stage": "mainline", "checkpoint_dir": "/root/sparsify-ascend/checkpoints/research_agent/round_0043_full/round0043_full_1774154848_dp2_bs1_ga8_ef32_k80_20260322_124736", "metrics_path": "/root/sparsify-ascend/checkpoints/research_agent/round_0043_full/round0043_full_1774154848_dp2_bs1_ga8_ef32_k80_20260322_124736/metrics.jsonl", "latest_step": 370, "latest_tokens_per_sec": 80823.01186956526, "baseline_ratio": 0.9112403166167266, "latest_total_tokens": 12124160.0, "proxy_mode": null, "evaluation_basis": null}}
{"event_id": "evt_1774155028613625960", "ts": 1774155028, "event": "training_heartbeat", "round": 43, "session_id": "019d13dc-400c-7493-83af-bd34fffa7466", "tier": "full", "run_name": "round0043_full_1774154848", "family_name": "lowrank_gated_residual", "family_stage": "mainline", "status": null, "decision": null, "payload": {"tier": "full", "run_name": "round0043_full_1774154848", "family_name": "lowrank_gated_residual", "family_stage": "mainline", "checkpoint_dir": "/root/sparsify-ascend/checkpoints/research_agent/round_0043_full/round0043_full_1774154848_dp2_bs1_ga8_ef32_k80_20260322_124736", "metrics_path": "/root/sparsify-ascend/checkpoints/research_agent/round_0043_full/round0043_full_1774154848_dp2_bs1_ga8_ef32_k80_20260322_124736/metrics.jsonl", "latest_step": 460, "latest_tokens_per_sec": 83734.90688627161, "baseline_ratio": 0.9440705227127374, "latest_total_tokens": 15073280.0, "proxy_mode": null, "evaluation_basis": null}}
{"event_id": "evt_1774155058617249507", "ts": 1774155058, "event": "training_heartbeat", "round": 43, "session_id": "019d13dc-400c-7493-83af-bd34fffa7466", "tier": "full", "run_name": "round0043_full_1774154848", "family_name": "lowrank_gated_residual", "family_stage": "mainline", "status": null, "decision": null, "payload": {"tier": "full", "run_name": "round0043_full_1774154848", "family_name": "lowrank_gated_residual", "family_stage": "mainline", "checkpoint_dir": "/root/sparsify-ascend/checkpoints/research_agent/round_0043_full/round0043_full_1774154848_dp2_bs1_ga8_ef32_k80_20260322_124736", "metrics_path": "/root/sparsify-ascend/checkpoints/research_agent/round_0043_full/round0043_full_1774154848_dp2_bs1_ga8_ef32_k80_20260322_124736/metrics.jsonl", "latest_step": 540, "latest_tokens_per_sec": 84254.34354070833, "baseline_ratio": 0.9499269194307307, "latest_total_tokens": 17694720.0, "proxy_mode": null, "evaluation_basis": null}}
{"event_id": "evt_1774155088621357925", "ts": 1774155088, "event": "training_heartbeat", "round": 43, "session_id": "019d13dc-400c-7493-83af-bd34fffa7466", "tier": "full", "run_name": "round0043_full_1774154848", "family_name": "lowrank_gated_residual", "family_stage": "mainline", "status": null, "decision": null, "payload": {"tier": "full", "run_name": "round0043_full_1774154848", "family_name": "lowrank_gated_residual", "family_stage": "mainline", "checkpoint_dir": "/root/sparsify-ascend/checkpoints/research_agent/round_0043_full/round0043_full_1774154848_dp2_bs1_ga8_ef32_k80_20260322_124736", "metrics_path": "/root/sparsify-ascend/checkpoints/research_agent/round_0043_full/round0043_full_1774154848_dp2_bs1_ga8_ef32_k80_20260322_124736/metrics.jsonl", "latest_step": 630, "latest_tokens_per_sec": 86008.96178200062, "baseline_ratio": 0.9697093903477635, "latest_total_tokens": 20643840.0, "proxy_mode": null, "evaluation_basis": null}}
{"event_id": "evt_1774155118625913979", "ts": 1774155118, "event": "training_heartbeat", "round": 43, "session_id": "019d13dc-400c-7493-83af-bd34fffa7466", "tier": "full", "run_name": "round0043_full_1774154848", "family_name": "lowrank_gated_residual", "family_stage": "mainline", "status": null, "decision": null, "payload": {"tier": "full", "run_name": "round0043_full_1774154848", "family_name": "lowrank_gated_residual", "family_stage": "mainline", "checkpoint_dir": "/root/sparsify-ascend/checkpoints/research_agent/round_0043_full/round0043_full_1774154848_dp2_bs1_ga8_ef32_k80_20260322_124736", "metrics_path": "/root/sparsify-ascend/checkpoints/research_agent/round_0043_full/round0043_full_1774154848_dp2_bs1_ga8_ef32_k80_20260322_124736/metrics.jsonl", "latest_step": 710, "latest_tokens_per_sec": 86159.98221740435, "baseline_ratio": 0.9714120726184388, "latest_total_tokens": 23265280.0, "proxy_mode": null, "evaluation_basis": null}}
{"event_id": "evt_1774155148630891570", "ts": 1774155148, "event": "training_heartbeat", "round": 43, "session_id": "019d13dc-400c-7493-83af-bd34fffa7466", "tier": "full", "run_name": "round0043_full_1774154848", "family_name": "lowrank_gated_residual", "family_stage": "mainline", "status": null, "decision": null, "payload": {"tier": "full", "run_name": "round0043_full_1774154848", "family_name": "lowrank_gated_residual", "family_stage": "mainline", "checkpoint_dir": "/root/sparsify-ascend/checkpoints/research_agent/round_0043_full/round0043_full_1774154848_dp2_bs1_ga8_ef32_k80_20260322_124736", "metrics_path": "/root/sparsify-ascend/checkpoints/research_agent/round_0043_full/round0043_full_1774154848_dp2_bs1_ga8_ef32_k80_20260322_124736/metrics.jsonl", "latest_step": 790, "latest_tokens_per_sec": 86280.67668129866, "baseline_ratio": 0.9727728442470739, "latest_total_tokens": 25886720.0, "proxy_mode": null, "evaluation_basis": null}}
{"event_id": "evt_1774155178636381417", "ts": 1774155178, "event": "training_heartbeat", "round": 43, "session_id": "019d13dc-400c-7493-83af-bd34fffa7466", "tier": "full", "run_name": "round0043_full_1774154848", "family_name": "lowrank_gated_residual", "family_stage": "mainline", "status": null, "decision": null, "payload": {"tier": "full", "run_name": "round0043_full_1774154848", "family_name": "lowrank_gated_residual", "family_stage": "mainline", "checkpoint_dir": "/root/sparsify-ascend/checkpoints/research_agent/round_0043_full/round0043_full_1774154848_dp2_bs1_ga8_ef32_k80_20260322_124736", "metrics_path": "/root/sparsify-ascend/checkpoints/research_agent/round_0043_full/round0043_full_1774154848_dp2_bs1_ga8_ef32_k80_20260322_124736/metrics.jsonl", "latest_step": 880, "latest_tokens_per_sec": 87372.15620381827, "baseline_ratio": 0.9850787472649738, "latest_total_tokens": 28835840.0, "proxy_mode": null, "evaluation_basis": null}}
{"event_id": "evt_1774155208642330306", "ts": 1774155208, "event": "training_heartbeat", "round": 43, "session_id": "019d13dc-400c-7493-83af-bd34fffa7466", "tier": "full", "run_name": "round0043_full_1774154848", "family_name": "lowrank_gated_residual", "family_stage": "mainline", "status": null, "decision": null, "payload": {"tier": "full", "run_name": "round0043_full_1774154848", "family_name": "lowrank_gated_residual", "family_stage": "mainline", "checkpoint_dir": "/root/sparsify-ascend/checkpoints/research_agent/round_0043_full/round0043_full_1774154848_dp2_bs1_ga8_ef32_k80_20260322_124736", "metrics_path": "/root/sparsify-ascend/checkpoints/research_agent/round_0043_full/round0043_full_1774154848_dp2_bs1_ga8_ef32_k80_20260322_124736/metrics.jsonl", "latest_step": 960, "latest_tokens_per_sec": 87371.47906281162, "baseline_ratio": 0.98507111282806, "latest_total_tokens": 31457280.0, "proxy_mode": null, "evaluation_basis": null}}
{"event_id": "evt_1774155238806102846", "ts": 1774155238, "event": "training_heartbeat", "round": 43, "session_id": "019d13dc-400c-7493-83af-bd34fffa7466", "tier": "full", "run_name": "round0043_full_1774154848", "family_name": "lowrank_gated_residual", "family_stage": "mainline", "status": null, "decision": null, "payload": {"tier": "full", "run_name": "round0043_full_1774154848", "family_name": "lowrank_gated_residual", "family_stage": "mainline", "checkpoint_dir": "/root/sparsify-ascend/checkpoints/research_agent/round_0043_full/round0043_full_1774154848_dp2_bs1_ga8_ef32_k80_20260322_124736", "metrics_path": "/root/sparsify-ascend/checkpoints/research_agent/round_0043_full/round0043_full_1774154848_dp2_bs1_ga8_ef32_k80_20260322_124736/metrics.jsonl", "latest_step": 1000, "latest_tokens_per_sec": 84010.43518529588, "baseline_ratio": 0.9471769708471491, "latest_total_tokens": 32768000.0, "proxy_mode": null, "evaluation_basis": null}}
{"event_id": "evt_1774155268920381388", "ts": 1774155268, "event": "training_heartbeat", "round": 43, "session_id": "019d13dc-400c-7493-83af-bd34fffa7466", "tier": "full", "run_name": "round0043_full_1774154848", "family_name": "lowrank_gated_residual", "family_stage": "mainline", "status": null, "decision": null, "payload": {"tier": "full", "run_name": "round0043_full_1774154848", "family_name": "lowrank_gated_residual", "family_stage": "mainline", "checkpoint_dir": "/root/sparsify-ascend/checkpoints/research_agent/round_0043_full/round0043_full_1774154848_dp2_bs1_ga8_ef32_k80_20260322_124736", "metrics_path": "/root/sparsify-ascend/checkpoints/research_agent/round_0043_full/round0043_full_1774154848_dp2_bs1_ga8_ef32_k80_20260322_124736/metrics.jsonl", "latest_step": 1090, "latest_tokens_per_sec": 84998.03639210455, "baseline_ratio": 0.9583116961631983, "latest_total_tokens": 35717120.0, "proxy_mode": null, "evaluation_basis": null}}
{"event_id": "evt_1774155299010860812", "ts": 1774155299, "event": "training_heartbeat", "round": 43, "session_id": "019d13dc-400c-7493-83af-bd34fffa7466", "tier": "full", "run_name": "round0043_full_1774154848", "family_name": "lowrank_gated_residual", "family_stage": "mainline", "status": null, "decision": null, "payload": {"tier": "full", "run_name": "round0043_full_1774154848", "family_name": "lowrank_gated_residual", "family_stage": "mainline", "checkpoint_dir": "/root/sparsify-ascend/checkpoints/research_agent/round_0043_full/round0043_full_1774154848_dp2_bs1_ga8_ef32_k80_20260322_124736", "metrics_path": "/root/sparsify-ascend/checkpoints/research_agent/round_0043_full/round0043_full_1774154848_dp2_bs1_ga8_ef32_k80_20260322_124736/metrics.jsonl", "latest_step": 1170, "latest_tokens_per_sec": 85135.16634541554, "baseline_ratio": 0.9598577699753745, "latest_total_tokens": 38338560.0, "proxy_mode": null, "evaluation_basis": null}}
{"event_id": "evt_1774155329067263454", "ts": 1774155329, "event": "training_heartbeat", "round": 43, "session_id": "019d13dc-400c-7493-83af-bd34fffa7466", "tier": "full", "run_name": "round0043_full_1774154848", "family_name": "lowrank_gated_residual", "family_stage": "mainline", "status": null, "decision": null, "payload": {"tier": "full", "run_name": "round0043_full_1774154848", "family_name": "lowrank_gated_residual", "family_stage": "mainline", "checkpoint_dir": "/root/sparsify-ascend/checkpoints/research_agent/round_0043_full/round0043_full_1774154848_dp2_bs1_ga8_ef32_k80_20260322_124736", "metrics_path": "/root/sparsify-ascend/checkpoints/research_agent/round_0043_full/round0043_full_1774154848_dp2_bs1_ga8_ef32_k80_20260322_124736/metrics.jsonl", "latest_step": 1220, "latest_tokens_per_sec": 83204.63966729633, "baseline_ratio": 0.9380920166247645, "latest_total_tokens": 39976960.0, "proxy_mode": null, "evaluation_basis": null}}
{"event_id": "evt_1774155359074693751", "ts": 1774155359, "event": "training_heartbeat", "round": 43, "session_id": "019d13dc-400c-7493-83af-bd34fffa7466", "tier": "full", "run_name": "round0043_full_1774154848", "family_name": "lowrank_gated_residual", "family_stage": "mainline", "status": null, "decision": null, "payload": {"tier": "full", "run_name": "round0043_full_1774154848", "family_name": "lowrank_gated_residual", "family_stage": "mainline", "checkpoint_dir": "/root/sparsify-ascend/checkpoints/research_agent/round_0043_full/round0043_full_1774154848_dp2_bs1_ga8_ef32_k80_20260322_124736", "metrics_path": "/root/sparsify-ascend/checkpoints/research_agent/round_0043_full/round0043_full_1774154848_dp2_bs1_ga8_ef32_k80_20260322_124736/metrics.jsonl", "latest_step": 1220, "latest_tokens_per_sec": 78313.57091887342, "baseline_ratio": 0.8829475852083776, "latest_total_tokens": 39976960.0, "proxy_mode": null, "evaluation_basis": null}}
{"event_id": "evt_1774155389082145398", "ts": 1774155389, "event": "training_heartbeat", "round": 43, "session_id": "019d13dc-400c-7493-83af-bd34fffa7466", "tier": "full", "run_name": "round0043_full_1774154848", "family_name": "lowrank_gated_residual", "family_stage": "mainline", "status": null, "decision": null, "payload": {"tier": "full", "run_name": "round0043_full_1774154848", "family_name": "lowrank_gated_residual", "family_stage": "mainline", "checkpoint_dir": "/root/sparsify-ascend/checkpoints/research_agent/round_0043_full/round0043_full_1774154848_dp2_bs1_ga8_ef32_k80_20260322_124736", "metrics_path": "/root/sparsify-ascend/checkpoints/research_agent/round_0043_full/round0043_full_1774154848_dp2_bs1_ga8_ef32_k80_20260322_124736/metrics.jsonl", "latest_step": 1220, "latest_tokens_per_sec": 73965.60380279426, "baseline_ratio": 0.8339263616750457, "latest_total_tokens": 39976960.0, "proxy_mode": null, "evaluation_basis": null}}
{"event_id": "evt_1774155389163728217", "ts": 1774155389, "event": "training_finished", "round": 43, "session_id": "019d13dc-400c-7493-83af-bd34fffa7466", "tier": "full", "run_name": "round0043_full_1774154848", "family_name": "lowrank_gated_residual", "family_stage": "mainline", "status": "ok", "decision": "keep", "payload": {"tier": "full", "run_name": "round0043_full_1774154848", "family_name": "lowrank_gated_residual", "family_stage": "mainline", "checkpoint_dir": "/root/sparsify-ascend/checkpoints/research_agent/round_0043_full/round0043_full_1774154848_dp2_bs1_ga8_ef32_k80_20260322_124736", "metrics_path": "/root/sparsify-ascend/checkpoints/research_agent/round_0043_full/round0043_full_1774154848_dp2_bs1_ga8_ef32_k80_20260322_124736/metrics.jsonl", "run_health": "normal", "termination_reason": "completed", "tokens_per_sec": 73965.60380279426, "baseline_ratio": 0.8339263616750457, "status": "ok", "decision": "keep", "proxy_mode": null, "evaluation_basis": null, "curve_start_fvu": 0.11110006272792816, "curve_mid_fvu": 0.09450381994247437, "curve_end_fvu": 0.07535674422979355, "curve_late_slope": -1.2483979605990423e-09, "curve_still_improving": true}}
{"event_id": "evt_1774155389163785328", "ts": 1774155389, "event": "result_recorded", "round": 43, "session_id": "019d13dc-400c-7493-83af-bd34fffa7466", "tier": "full", "run_name": "round0043_full_1774154848", "family_name": "lowrank_gated_residual", "family_stage": "mainline", "status": "ok", "decision": "keep", "payload": {"tier": "full", "run_name": "round0043_full_1774154848", "family_name": "lowrank_gated_residual", "family_stage": "mainline", "status": "ok", "decision": "keep", "val_fvu": "0.07682335376739502", "observed_fvu": "0.075357", "k": "80", "log_path": "/root/sparsify-ascend/research/history/logs/full_1774155389.log", "checkpoint": null}}
{"event_id": "evt_1774155389164167126", "ts": 1774155389, "event": "round_finished", "round": 43, "session_id": "019d13dc-400c-7493-83af-bd34fffa7466", "tier": "full", "run_name": null, "family_name": "lowrank_gated_residual", "family_stage": "mainline", "status": "ok", "decision": "keep", "payload": {"tier": "full", "family_name": "lowrank_gated_residual", "family_stage": "mainline", "status": "ok", "decision": "keep", "val_fvu": "0.07682335376739502"}}
{"event_id": "evt_1774155389171287108", "ts": 1774155389, "event": "experiment_commit_prepared", "round": 43, "tier": "full", "run_name": null, "family_name": "lowrank_gated_residual", "family_stage": "mainline", "status": "ok", "decision": "keep", "payload": {"branch": "autoresearch-sae"}}
{"event_id": "evt_1774155396794635513", "ts": 1774155396, "event": "round_started", "round": 44, "session_id": "019d13dc-400c-7493-83af-bd34fffa7466", "tier": null, "run_name": null, "family_name": null, "family_stage": null, "status": "started", "decision": null, "payload": {"status": "started"}}
{"event_id": "evt_1774155396794821835", "ts": 1774155396, "event": "agent_deciding", "round": 44, "session_id": "019d13dc-400c-7493-83af-bd34fffa7466", "tier": null, "run_name": null, "family_name": null, "family_stage": null, "status": null, "decision": null, "payload": {}}
{"event_id": "evt_1774155521533658095", "ts": 1774155521, "event": "session_resumed", "round": 44, "tier": null, "run_name": null, "family_name": null, "family_stage": null, "status": "active", "decision": null, "payload": {"session_id": "019d13dc-400c-7493-83af-bd34fffa7466"}}
