{"event_id": "evt_1774174101072353363", "ts": 1774174101, "event": "result_recorded", "round": 90, "session_id": "019d14ea-730e-75e1-9200-ca4cb6c1e330", "tier": "proxy", "run_name": "round0090_proxy_1774174041", "family_name": "lowrank_residual", "family_stage": "mainline_comparison", "status": "ok", "decision": "incubate", "payload": {"tier": "proxy", "run_name": "round0090_proxy_1774174041", "family_name": "lowrank_residual", "family_stage": "mainline_comparison", "status": "ok", "decision": "incubate", "val_fvu": "0.18159605003893375", "observed_fvu": "0.181024", "k": "32", "log_path": "/root/sparsify-ascend/research/history/logs/proxy_1774174101.log", "checkpoint": null}}
{"event_id": "evt_1774174101072500064", "ts": 1774174101, "event": "round_finished", "round": 90, "session_id": "019d14ea-730e-75e1-9200-ca4cb6c1e330", "tier": "proxy", "run_name": null, "family_name": "lowrank_residual", "family_stage": "mainline_comparison", "status": "ok", "decision": "incubate", "payload": {"tier": "proxy", "family_name": "lowrank_residual", "family_stage": "mainline_comparison", "status": "ok", "decision": "incubate", "val_fvu": "0.18159605003893375"}}
{"event_id": "evt_1774174101081483754", "ts": 1774174101, "event": "experiment_commit_prepared", "round": 90, "tier": "proxy", "run_name": null, "family_name": "lowrank_residual", "family_stage": "mainline_comparison", "status": "ok", "decision": "incubate", "payload": {"branch": "autoresearch-sae"}}
{"event_id": "evt_1774174108623577873", "ts": 1774174108, "event": "round_started", "round": 91, "session_id": "019d14ea-730e-75e1-9200-ca4cb6c1e330", "tier": null, "run_name": null, "family_name": null, "family_stage": null, "status": "started", "decision": null, "payload": {"status": "started"}}
{"event_id": "evt_1774174108623741822", "ts": 1774174108, "event": "agent_deciding", "round": 91, "session_id": "019d14ea-730e-75e1-9200-ca4cb6c1e330", "tier": null, "run_name": null, "family_name": null, "family_stage": null, "status": null, "decision": null, "payload": {}}
{"event_id": "evt_1774174236885880868", "ts": 1774174236, "event": "session_resumed", "round": 91, "tier": null, "run_name": null, "family_name": null, "family_stage": null, "status": "active", "decision": null, "payload": {"session_id": "019d14ea-730e-75e1-9200-ca4cb6c1e330"}}
{"event_id": "evt_1774174236892721070", "ts": 1774174236, "event": "agent_action_received", "round": 91, "session_id": "019d14ea-730e-75e1-9200-ca4cb6c1e330", "tier": "proxy", "run_name": null, "family_name": "lowrank_residual", "family_stage": "mainline_comparison", "status": null, "decision": null, "payload": {"session_id": "019d14ea-730e-75e1-9200-ca4cb6c1e330", "tier": "proxy", "family_name": "lowrank_residual", "family_stage": "mainline_comparison", "change_type": "param_only", "expected_win": "lower_fvu", "hypothesis": "`lowrank_residual` at `K=32, EF=12` is now effectively tied with the best exact-neighborhood result, so the next informative move is to map this same non-gated family at the adjacent low-K point `K=40` before touching EF. If the family scales more favorably than `lowrank_gated_residual` across low K, `K=40, EF=12` is the cleanest same-family, same-EF check."}}
{"event_id": "evt_1774174236892845397", "ts": 1774174236, "event": "variable_isolation_warning", "round": 91, "session_id": "019d14ea-730e-75e1-9200-ca4cb6c1e330", "tier": null, "run_name": null, "family_name": "lowrank_residual", "family_stage": "mainline_comparison", "status": null, "decision": null, "payload": {"violation": "Multiple primary variables changed simultaneously: architecture, k, lr"}}
{"event_id": "evt_1774174236892911424", "ts": 1774174236, "event": "proxy_mode_selected", "round": 91, "session_id": "019d14ea-730e-75e1-9200-ca4cb6c1e330", "tier": "proxy", "run_name": null, "family_name": "lowrank_residual", "family_stage": "mainline_comparison", "status": null, "decision": null, "payload": {"tier": "proxy", "proxy_mode": "fast", "evaluation_basis": "terminal_only", "parameter_behavior": "structural", "proxy_max_tokens": "5000000"}}
{"event_id": "evt_1774174236893175289", "ts": 1774174236, "event": "training_started", "round": 91, "session_id": "019d14ea-730e-75e1-9200-ca4cb6c1e330", "tier": "proxy", "run_name": "round0091_proxy_1774174236", "family_name": "lowrank_residual", "family_stage": "mainline_comparison", "status": null, "decision": null, "payload": {"tier": "proxy", "run_name": "round0091_proxy_1774174236", "family_name": "lowrank_residual", "family_stage": "mainline_comparison", "checkpoint_dir": "/root/sparsify-ascend/checkpoints/research_agent/round_0091_proxy", "log_path": "/root/sparsify-ascend/research/history/logs/round0091_proxy_1774174236.log", "config": {"architecture": "lowrank_residual", "expansion_factor": 12, "k": 40, "optimizer": "signum", "lr": "1.6e-3", "hookpoints": "layers.[3].self_attn.o_proj", "batch_size": 1, "grad_acc_steps": 8, "micro_acc_steps": 1, "auxk_alpha": 0.0, "dead_feature_threshold": 10000000, "use_hadamard": false, "tier": "proxy", "family_name": "lowrank_residual", "family_stage": "mainline_comparison"}, "baseline_tokens_per_sec": 83008.52258207071, "proxy_mode": "fast", "evaluation_basis": "terminal_only"}}
{"event_id": "evt_1774174266895096461", "ts": 1774174266, "event": "training_heartbeat", "round": 91, "session_id": "019d14ea-730e-75e1-9200-ca4cb6c1e330", "tier": "proxy", "run_name": "round0091_proxy_1774174236", "family_name": "lowrank_residual", "family_stage": "mainline_comparison", "status": null, "decision": null, "payload": {"tier": "proxy", "run_name": "round0091_proxy_1774174236", "family_name": "lowrank_residual", "family_stage": "mainline_comparison", "checkpoint_dir": "/root/sparsify-ascend/checkpoints/research_agent/round_0091_proxy/round0091_proxy_1774174236_dp2_bs1_ga8_ef12_k40_20260322_181043", "metrics_path": "/root/sparsify-ascend/checkpoints/research_agent/round_0091_proxy/round0091_proxy_1774174236_dp2_bs1_ga8_ef12_k40_20260322_181043/metrics.jsonl", "latest_step": 130, "latest_tokens_per_sec": 141987.59939690412, "baseline_ratio": 1.7105183296874205, "latest_total_tokens": 4259840.0, "proxy_mode": "fast", "evaluation_basis": "terminal_only"}}
{"event_id": "evt_1774174296896530761", "ts": 1774174296, "event": "training_heartbeat", "round": 91, "session_id": "019d14ea-730e-75e1-9200-ca4cb6c1e330", "tier": "proxy", "run_name": "round0091_proxy_1774174236", "family_name": "lowrank_residual", "family_stage": "mainline_comparison", "status": null, "decision": null, "payload": {"tier": "proxy", "run_name": "round0091_proxy_1774174236", "family_name": "lowrank_residual", "family_stage": "mainline_comparison", "checkpoint_dir": "/root/sparsify-ascend/checkpoints/research_agent/round_0091_proxy/round0091_proxy_1774174236_dp2_bs1_ga8_ef12_k40_20260322_181043", "metrics_path": "/root/sparsify-ascend/checkpoints/research_agent/round_0091_proxy/round0091_proxy_1774174236_dp2_bs1_ga8_ef12_k40_20260322_181043/metrics.jsonl", "latest_step": 152, "latest_tokens_per_sec": 83008.2171593584, "baseline_ratio": 0.999996320586094, "latest_total_tokens": 4980736.0, "proxy_mode": "fast", "evaluation_basis": "terminal_only"}}
{"event_id": "evt_1774174296961676750", "ts": 1774174296, "event": "training_finished", "round": 91, "session_id": "019d14ea-730e-75e1-9200-ca4cb6c1e330", "tier": "proxy", "run_name": "round0091_proxy_1774174236", "family_name": "lowrank_residual", "family_stage": "mainline_comparison", "status": "ok", "decision": "incubate", "payload": {"tier": "proxy", "run_name": "round0091_proxy_1774174236", "family_name": "lowrank_residual", "family_stage": "mainline_comparison", "checkpoint_dir": "/root/sparsify-ascend/checkpoints/research_agent/round_0091_proxy/round0091_proxy_1774174236_dp2_bs1_ga8_ef12_k40_20260322_181043", "metrics_path": "/root/sparsify-ascend/checkpoints/research_agent/round_0091_proxy/round0091_proxy_1774174236_dp2_bs1_ga8_ef12_k40_20260322_181043/metrics.jsonl", "run_health": "normal", "termination_reason": "completed", "tokens_per_sec": 83008.2171593584, "baseline_ratio": 0.999996320586094, "status": "ok", "decision": "incubate", "proxy_mode": "fast", "evaluation_basis": "terminal_only", "curve_start_fvu": 0.3414577841758728, "curve_mid_fvu": 0.2212115377187729, "curve_end_fvu": 0.17460772395133972, "curve_late_slope": -7.077746446274461e-09, "curve_still_improving": true}}
{"event_id": "evt_1774174296961729537", "ts": 1774174296, "event": "result_recorded", "round": 91, "session_id": "019d14ea-730e-75e1-9200-ca4cb6c1e330", "tier": "proxy", "run_name": "round0091_proxy_1774174236", "family_name": "lowrank_residual", "family_stage": "mainline_comparison", "status": "ok", "decision": "incubate", "payload": {"tier": "proxy", "run_name": "round0091_proxy_1774174236", "family_name": "lowrank_residual", "family_stage": "mainline_comparison", "status": "ok", "decision": "incubate", "val_fvu": "0.17533555254340172", "observed_fvu": "0.174608", "k": "40", "log_path": "/root/sparsify-ascend/research/history/logs/proxy_1774174296.log", "checkpoint": null}}
{"event_id": "evt_1774174296961868005", "ts": 1774174296, "event": "round_finished", "round": 91, "session_id": "019d14ea-730e-75e1-9200-ca4cb6c1e330", "tier": "proxy", "run_name": null, "family_name": "lowrank_residual", "family_stage": "mainline_comparison", "status": "ok", "decision": "incubate", "payload": {"tier": "proxy", "family_name": "lowrank_residual", "family_stage": "mainline_comparison", "status": "ok", "decision": "incubate", "val_fvu": "0.17533555254340172"}}
{"event_id": "evt_1774174296970737232", "ts": 1774174296, "event": "experiment_commit_prepared", "round": 91, "tier": "proxy", "run_name": null, "family_name": "lowrank_residual", "family_stage": "mainline_comparison", "status": "ok", "decision": "incubate", "payload": {"branch": "autoresearch-sae"}}
{"event_id": "evt_1774174304705516895", "ts": 1774174304, "event": "round_started", "round": 92, "session_id": "019d14ea-730e-75e1-9200-ca4cb6c1e330", "tier": null, "run_name": null, "family_name": null, "family_stage": null, "status": "started", "decision": null, "payload": {"status": "started"}}
{"event_id": "evt_1774174304705717222", "ts": 1774174304, "event": "agent_deciding", "round": 92, "session_id": "019d14ea-730e-75e1-9200-ca4cb6c1e330", "tier": null, "run_name": null, "family_name": null, "family_stage": null, "status": null, "decision": null, "payload": {}}
{"event_id": "evt_1774174434589912750", "ts": 1774174434, "event": "session_resumed", "round": 92, "tier": null, "run_name": null, "family_name": null, "family_stage": null, "status": "active", "decision": null, "payload": {"session_id": "019d14ea-730e-75e1-9200-ca4cb6c1e330"}}
{"event_id": "evt_1774174434591178451", "ts": 1774174434, "event": "agent_action_received", "round": 92, "session_id": "019d14ea-730e-75e1-9200-ca4cb6c1e330", "tier": "proxy", "run_name": null, "family_name": "routed", "family_stage": "mainline_comparison", "status": null, "decision": null, "payload": {"session_id": "019d14ea-730e-75e1-9200-ca4cb6c1e330", "tier": "proxy", "family_name": "routed", "family_stage": "mainline_comparison", "change_type": "param_only", "expected_win": "lower_fvu", "hypothesis": "Low-rank residual variants at `K=32` and `K=40` have now converged to near-parity with the local best without producing a real win, so the next informative move is to switch to a fundamentally different sparse-support mechanism at the same low-K comparison point. Running `routed` at `K=40, EF=12` tests whether explicit routing can improve the low-K tradeoff where both gated and non-gated residual magnitude families have stalled."}}
{"event_id": "evt_1774174434591288984", "ts": 1774174434, "event": "variable_isolation_warning", "round": 92, "session_id": "019d14ea-730e-75e1-9200-ca4cb6c1e330", "tier": null, "run_name": null, "family_name": "routed", "family_stage": "mainline_comparison", "status": null, "decision": null, "payload": {"violation": "Multiple primary variables changed simultaneously: architecture, k, lr"}}
{"event_id": "evt_1774174434591346740", "ts": 1774174434, "event": "proxy_mode_selected", "round": 92, "session_id": "019d14ea-730e-75e1-9200-ca4cb6c1e330", "tier": "proxy", "run_name": null, "family_name": "routed", "family_stage": "mainline_comparison", "status": null, "decision": null, "payload": {"tier": "proxy", "proxy_mode": "fast", "evaluation_basis": "terminal_only", "parameter_behavior": "structural", "proxy_max_tokens": "5000000"}}
{"event_id": "evt_1774174434591605237", "ts": 1774174434, "event": "training_started", "round": 92, "session_id": "019d14ea-730e-75e1-9200-ca4cb6c1e330", "tier": "proxy", "run_name": "round0092_proxy_1774174434", "family_name": "routed", "family_stage": "mainline_comparison", "status": null, "decision": null, "payload": {"tier": "proxy", "run_name": "round0092_proxy_1774174434", "family_name": "routed", "family_stage": "mainline_comparison", "checkpoint_dir": "/root/sparsify-ascend/checkpoints/research_agent/round_0092_proxy", "log_path": "/root/sparsify-ascend/research/history/logs/round0092_proxy_1774174434.log", "config": {"architecture": "routed", "expansion_factor": 12, "k": 40, "optimizer": "signum", "lr": "1.6e-3", "hookpoints": "layers.[3].self_attn.o_proj", "batch_size": 1, "grad_acc_steps": 8, "micro_acc_steps": 1, "auxk_alpha": 0.0, "dead_feature_threshold": 10000000, "use_hadamard": false, "tier": "proxy", "family_name": "routed", "family_stage": "mainline_comparison"}, "baseline_tokens_per_sec": 83008.17593076272, "proxy_mode": "fast", "evaluation_basis": "terminal_only"}}
{"event_id": "evt_1774174464593235989", "ts": 1774174464, "event": "training_heartbeat", "round": 92, "session_id": "019d14ea-730e-75e1-9200-ca4cb6c1e330", "tier": "proxy", "run_name": "round0092_proxy_1774174434", "family_name": "routed", "family_stage": "mainline_comparison", "status": null, "decision": null, "payload": {"tier": "proxy", "run_name": "round0092_proxy_1774174434", "family_name": "routed", "family_stage": "mainline_comparison", "checkpoint_dir": "/root/sparsify-ascend/checkpoints/research_agent/round_0092_proxy/round0092_proxy_1774174434_dp2_bs1_ga8_ef12_k40_20260322_181401", "metrics_path": "/root/sparsify-ascend/checkpoints/research_agent/round_0092_proxy/round0092_proxy_1774174434_dp2_bs1_ga8_ef12_k40_20260322_181401/metrics.jsonl", "latest_step": 100, "latest_tokens_per_sec": 109221.78841232556, "baseline_ratio": 1.3157955489038533, "latest_total_tokens": 3276800.0, "proxy_mode": "fast", "evaluation_basis": "terminal_only"}}
{"event_id": "evt_1774174494594667086", "ts": 1774174494, "event": "training_heartbeat", "round": 92, "session_id": "019d14ea-730e-75e1-9200-ca4cb6c1e330", "tier": "proxy", "run_name": "round0092_proxy_1774174434", "family_name": "routed", "family_stage": "mainline_comparison", "status": null, "decision": null, "payload": {"tier": "proxy", "run_name": "round0092_proxy_1774174434", "family_name": "routed", "family_stage": "mainline_comparison", "checkpoint_dir": "/root/sparsify-ascend/checkpoints/research_agent/round_0092_proxy/round0092_proxy_1774174434_dp2_bs1_ga8_ef12_k40_20260322_181401", "metrics_path": "/root/sparsify-ascend/checkpoints/research_agent/round_0092_proxy/round0092_proxy_1774174434_dp2_bs1_ga8_ef12_k40_20260322_181401/metrics.jsonl", "latest_step": 152, "latest_tokens_per_sec": 83008.44078397492, "baseline_ratio": 1.0000031906882572, "latest_total_tokens": 4980736.0, "proxy_mode": "fast", "evaluation_basis": "terminal_only"}}
{"event_id": "evt_1774174494660173463", "ts": 1774174494, "event": "training_finished", "round": 92, "session_id": "019d14ea-730e-75e1-9200-ca4cb6c1e330", "tier": "proxy", "run_name": "round0092_proxy_1774174434", "family_name": "routed", "family_stage": "mainline_comparison", "status": "ok", "decision": "incubate", "payload": {"tier": "proxy", "run_name": "round0092_proxy_1774174434", "family_name": "routed", "family_stage": "mainline_comparison", "checkpoint_dir": "/root/sparsify-ascend/checkpoints/research_agent/round_0092_proxy/round0092_proxy_1774174434_dp2_bs1_ga8_ef12_k40_20260322_181401", "metrics_path": "/root/sparsify-ascend/checkpoints/research_agent/round_0092_proxy/round0092_proxy_1774174434_dp2_bs1_ga8_ef12_k40_20260322_181401/metrics.jsonl", "run_health": "normal", "termination_reason": "completed", "tokens_per_sec": 83008.44078397492, "baseline_ratio": 1.0000031906882572, "status": "ok", "decision": "incubate", "proxy_mode": "fast", "evaluation_basis": "terminal_only", "curve_start_fvu": 0.5306911468505859, "curve_mid_fvu": 0.40779173374176025, "curve_end_fvu": 0.3585151135921478, "curve_late_slope": -6.170862874451784e-09, "curve_still_improving": true}}
{"event_id": "evt_1774174494660234107", "ts": 1774174494, "event": "result_recorded", "round": 92, "session_id": "019d14ea-730e-75e1-9200-ca4cb6c1e330", "tier": "proxy", "run_name": "round0092_proxy_1774174434", "family_name": "routed", "family_stage": "mainline_comparison", "status": "ok", "decision": "incubate", "payload": {"tier": "proxy", "run_name": "round0092_proxy_1774174434", "family_name": "routed", "family_stage": "mainline_comparison", "status": "ok", "decision": "incubate", "val_fvu": "0.3580229729413986", "observed_fvu": "0.358515", "k": "40", "log_path": "/root/sparsify-ascend/research/history/logs/proxy_1774174494.log", "checkpoint": null}}
{"event_id": "evt_1774174494660396725", "ts": 1774174494, "event": "round_finished", "round": 92, "session_id": "019d14ea-730e-75e1-9200-ca4cb6c1e330", "tier": "proxy", "run_name": null, "family_name": "routed", "family_stage": "mainline_comparison", "status": "ok", "decision": "incubate", "payload": {"tier": "proxy", "family_name": "routed", "family_stage": "mainline_comparison", "status": "ok", "decision": "incubate", "val_fvu": "0.3580229729413986"}}
{"event_id": "evt_1774174494669387768", "ts": 1774174494, "event": "experiment_commit_prepared", "round": 92, "tier": "proxy", "run_name": null, "family_name": "routed", "family_stage": "mainline_comparison", "status": "ok", "decision": "incubate", "payload": {"branch": "autoresearch-sae"}}
{"event_id": "evt_1774174502264152084", "ts": 1774174502, "event": "round_started", "round": 93, "session_id": "019d14ea-730e-75e1-9200-ca4cb6c1e330", "tier": null, "run_name": null, "family_name": null, "family_stage": null, "status": "started", "decision": null, "payload": {"status": "started"}}
{"event_id": "evt_1774174502264315335", "ts": 1774174502, "event": "agent_deciding", "round": 93, "session_id": "019d14ea-730e-75e1-9200-ca4cb6c1e330", "tier": null, "run_name": null, "family_name": null, "family_stage": null, "status": null, "decision": null, "payload": {}}
{"event_id": "evt_1774174634329805006", "ts": 1774174634, "event": "session_resumed", "round": 93, "tier": null, "run_name": null, "family_name": null, "family_stage": null, "status": "active", "decision": null, "payload": {"session_id": "019d14ea-730e-75e1-9200-ca4cb6c1e330"}}
{"event_id": "evt_1774174634331071929", "ts": 1774174634, "event": "agent_action_received", "round": 93, "session_id": "019d14ea-730e-75e1-9200-ca4cb6c1e330", "tier": "proxy", "run_name": null, "family_name": "two_code_residual_vq", "family_stage": "prototype", "status": null, "decision": null, "payload": {"session_id": "019d14ea-730e-75e1-9200-ca4cb6c1e330", "tier": "proxy", "family_name": "two_code_residual_vq", "family_stage": "prototype", "change_type": "edit_sae_code", "expected_win": "lower_fvu", "hypothesis": "Single-code `residual_vq` was clearly too coarse at low K, and both routed and residual-magnitude alternatives have now failed to improve the `K=40, EF=12` local frontier. A real `two_code_residual_vq` prototype that composes two hard codebook selections before the sparse residual stage is the next informative architecture move because it strengthens the discrete trunk without raising K or EF."}}
{"event_id": "evt_1774174765025931927", "ts": 1774174765, "event": "variable_isolation_warning", "round": 93, "session_id": "019d14ea-730e-75e1-9200-ca4cb6c1e330", "tier": null, "run_name": null, "family_name": "two_code_residual_vq", "family_stage": "prototype", "status": null, "decision": null, "payload": {"violation": "Multiple primary variables changed simultaneously: code_edit, architecture, k, lr"}}
{"event_id": "evt_1774174765026070867", "ts": 1774174765, "event": "proxy_mode_selected", "round": 93, "session_id": "019d14ea-730e-75e1-9200-ca4cb6c1e330", "tier": "proxy", "run_name": null, "family_name": "two_code_residual_vq", "family_stage": "prototype", "status": null, "decision": null, "payload": {"tier": "proxy", "proxy_mode": "fast", "evaluation_basis": "terminal_only", "parameter_behavior": "structural", "proxy_max_tokens": "40000000"}}
{"event_id": "evt_1774174765026117216", "ts": 1774174765, "event": "sanity_started", "round": 93, "session_id": "019d14ea-730e-75e1-9200-ca4cb6c1e330", "tier": "proxy", "run_name": null, "family_name": "two_code_residual_vq", "family_stage": "prototype", "status": null, "decision": null, "payload": {"tier": "proxy"}}
{"event_id": "evt_1774174769711689762", "ts": 1774174769, "event": "sanity_finished", "round": 93, "session_id": "019d14ea-730e-75e1-9200-ca4cb6c1e330", "tier": "proxy", "run_name": null, "family_name": "two_code_residual_vq", "family_stage": "prototype", "status": "ok", "decision": null, "payload": {"tier": "proxy", "status": "ok"}}
