{"event_id": "evt_1774174769712108680", "ts": 1774174769, "event": "training_started", "round": 93, "session_id": "019d14ea-730e-75e1-9200-ca4cb6c1e330", "tier": "proxy", "run_name": "round0093_proxy_1774174769", "family_name": "two_code_residual_vq", "family_stage": "prototype", "status": null, "decision": null, "payload": {"tier": "proxy", "run_name": "round0093_proxy_1774174769", "family_name": "two_code_residual_vq", "family_stage": "prototype", "checkpoint_dir": "/root/sparsify-ascend/checkpoints/research_agent/round_0093_proxy", "log_path": "/root/sparsify-ascend/research/history/logs/round0093_proxy_1774174769.log", "config": {"architecture": "two_code_residual_vq", "expansion_factor": 12, "k": 40, "optimizer": "signum", "lr": "1.6e-3", "hookpoints": "layers.[3].self_attn.o_proj", "batch_size": 1, "grad_acc_steps": 8, "micro_acc_steps": 1, "auxk_alpha": 0.0, "dead_feature_threshold": 10000000, "use_hadamard": false, "tier": "proxy", "family_name": "two_code_residual_vq", "family_stage": "prototype"}, "baseline_tokens_per_sec": null, "proxy_mode": "fast", "evaluation_basis": "terminal_only"}}
{"event_id": "evt_1774174799712886266", "ts": 1774174799, "event": "training_heartbeat", "round": 93, "session_id": "019d14ea-730e-75e1-9200-ca4cb6c1e330", "tier": "proxy", "run_name": "round0093_proxy_1774174769", "family_name": "two_code_residual_vq", "family_stage": "prototype", "status": null, "decision": null, "payload": {"tier": "proxy", "run_name": "round0093_proxy_1774174769", "family_name": "two_code_residual_vq", "family_stage": "prototype", "checkpoint_dir": null, "metrics_path": null, "latest_step": null, "latest_tokens_per_sec": null, "baseline_ratio": null, "latest_total_tokens": null, "proxy_mode": "fast", "evaluation_basis": "terminal_only"}}
{"event_id": "evt_1774174799777903192", "ts": 1774174799, "event": "training_finished", "round": 93, "session_id": "019d14ea-730e-75e1-9200-ca4cb6c1e330", "tier": "proxy", "run_name": "round0093_proxy_1774174769", "family_name": "two_code_residual_vq", "family_stage": "prototype", "status": "crash", "decision": "crash", "payload": {"tier": "proxy", "run_name": "round0093_proxy_1774174769", "family_name": "two_code_residual_vq", "family_stage": "prototype", "checkpoint_dir": null, "metrics_path": "", "run_health": "crash", "termination_reason": "completed", "tokens_per_sec": null, "baseline_ratio": null, "status": "crash", "decision": "crash", "proxy_mode": "fast", "evaluation_basis": "terminal_only", "curve_start_fvu": null, "curve_mid_fvu": null, "curve_end_fvu": null, "curve_late_slope": null, "curve_still_improving": null}}
{"event_id": "evt_1774174799777949993", "ts": 1774174799, "event": "result_recorded", "round": 93, "session_id": "019d14ea-730e-75e1-9200-ca4cb6c1e330", "tier": "proxy", "run_name": "round0093_proxy_1774174769", "family_name": "two_code_residual_vq", "family_stage": "prototype", "status": "crash", "decision": "crash", "payload": {"tier": "proxy", "run_name": "round0093_proxy_1774174769", "family_name": "two_code_residual_vq", "family_stage": "prototype", "status": "crash", "decision": "crash", "val_fvu": "None", "observed_fvu": "", "k": "None", "log_path": "/root/sparsify-ascend/research/history/logs/proxy_1774174799.log", "checkpoint": null}}
{"event_id": "evt_1774174799778018697", "ts": 1774174799, "event": "repair_attempt_started", "round": 93, "session_id": "019d14ea-730e-75e1-9200-ca4cb6c1e330", "tier": "proxy", "run_name": null, "family_name": "two_code_residual_vq", "family_stage": "prototype", "status": null, "decision": null, "payload": {"tier": "proxy", "family_name": "two_code_residual_vq", "family_stage": "prototype", "repair_attempt": 1, "failure_kind": "training_crash", "error_type": "ValueError", "error_summary": "ValueError: Unknown architecture: 'two_code_residual_vq'. Must be one of ('topk', 'batch_topk', 'adaptive_budget_topk', 'bucketed_topk', 'codebook_topk', 'residual_vq', 'jumprelu', 'gated', 'routed', 'group_topk', 'factorized_topk', 'lowrank_residual', 'lowrank_gated_residual', 'whitened_lowrank_gated_residual', 'lowrank_grouped_residual', 'whitened_topk', 'two_stage_residual', 'multi_branch_gated')"}}
{"event_id": "evt_1774175102570360320", "ts": 1774175102, "event": "variable_isolation_warning", "round": 93, "session_id": "019d14ea-730e-75e1-9200-ca4cb6c1e330", "tier": null, "run_name": null, "family_name": "two_code_residual_vq", "family_stage": "prototype", "status": null, "decision": null, "payload": {"violation": "Multiple primary variables changed simultaneously: code_edit, architecture, k, lr"}}
{"event_id": "evt_1774175107102255901", "ts": 1774175107, "event": "behavioral_diff_identical_warning", "round": 93, "session_id": "019d14ea-730e-75e1-9200-ca4cb6c1e330", "tier": null, "run_name": null, "family_name": "two_code_residual_vq", "family_stage": "prototype", "status": null, "decision": null, "payload": {"architecture": "two_code_residual_vq", "k": 40, "expansion_factor": 12, "max_diff": 0.0}}
{"event_id": "evt_1774175107102325121", "ts": 1774175107, "event": "proxy_mode_selected", "round": 93, "session_id": "019d14ea-730e-75e1-9200-ca4cb6c1e330", "tier": "proxy", "run_name": null, "family_name": "two_code_residual_vq", "family_stage": "prototype", "status": null, "decision": null, "payload": {"tier": "proxy", "proxy_mode": "fast", "evaluation_basis": "terminal_only", "parameter_behavior": "structural", "proxy_max_tokens": "40000000"}}
{"event_id": "evt_1774175107102367603", "ts": 1774175107, "event": "sanity_started", "round": 93, "session_id": "019d14ea-730e-75e1-9200-ca4cb6c1e330", "tier": "proxy", "run_name": null, "family_name": "two_code_residual_vq", "family_stage": "prototype", "status": null, "decision": null, "payload": {"tier": "proxy"}}
{"event_id": "evt_1774175111727560698", "ts": 1774175111, "event": "sanity_finished", "round": 93, "session_id": "019d14ea-730e-75e1-9200-ca4cb6c1e330", "tier": "proxy", "run_name": null, "family_name": "two_code_residual_vq", "family_stage": "prototype", "status": "ok", "decision": null, "payload": {"tier": "proxy", "status": "ok"}}
{"event_id": "evt_1774175111727937486", "ts": 1774175111, "event": "training_started", "round": 93, "session_id": "019d14ea-730e-75e1-9200-ca4cb6c1e330", "tier": "proxy", "run_name": "round0093_proxy_1774175111", "family_name": "two_code_residual_vq", "family_stage": "prototype", "status": null, "decision": null, "payload": {"tier": "proxy", "run_name": "round0093_proxy_1774175111", "family_name": "two_code_residual_vq", "family_stage": "prototype", "checkpoint_dir": "/root/sparsify-ascend/checkpoints/research_agent/round_0093_proxy", "log_path": "/root/sparsify-ascend/research/history/logs/round0093_proxy_1774175111.log", "config": {"architecture": "two_code_residual_vq", "expansion_factor": 12, "k": 40, "optimizer": "signum", "lr": "1.6e-3", "hookpoints": "layers.[3].self_attn.o_proj", "batch_size": 1, "grad_acc_steps": 8, "micro_acc_steps": 1, "auxk_alpha": 0.0, "dead_feature_threshold": 10000000, "use_hadamard": false, "tier": "proxy", "family_name": "two_code_residual_vq", "family_stage": "prototype"}, "baseline_tokens_per_sec": null, "proxy_mode": "fast", "evaluation_basis": "terminal_only"}}
{"event_id": "evt_1774175141729689230", "ts": 1774175141, "event": "training_heartbeat", "round": 93, "session_id": "019d14ea-730e-75e1-9200-ca4cb6c1e330", "tier": "proxy", "run_name": "round0093_proxy_1774175111", "family_name": "two_code_residual_vq", "family_stage": "prototype", "status": null, "decision": null, "payload": {"tier": "proxy", "run_name": "round0093_proxy_1774175111", "family_name": "two_code_residual_vq", "family_stage": "prototype", "checkpoint_dir": "/root/sparsify-ascend/checkpoints/research_agent/round_0093_proxy/round0093_proxy_1774175111_dp2_bs1_ga8_ef12_k40_20260322_182518", "metrics_path": "/root/sparsify-ascend/checkpoints/research_agent/round_0093_proxy/round0093_proxy_1774175111_dp2_bs1_ga8_ef12_k40_20260322_182518/metrics.jsonl", "latest_step": 120, "latest_tokens_per_sec": 131065.7409239037, "baseline_ratio": null, "latest_total_tokens": 3932160.0, "proxy_mode": "fast", "evaluation_basis": "terminal_only"}}
{"event_id": "evt_1774175171732217053", "ts": 1774175171, "event": "training_heartbeat", "round": 93, "session_id": "019d14ea-730e-75e1-9200-ca4cb6c1e330", "tier": "proxy", "run_name": "round0093_proxy_1774175111", "family_name": "two_code_residual_vq", "family_stage": "prototype", "status": null, "decision": null, "payload": {"tier": "proxy", "run_name": "round0093_proxy_1774175111", "family_name": "two_code_residual_vq", "family_stage": "prototype", "checkpoint_dir": "/root/sparsify-ascend/checkpoints/research_agent/round_0093_proxy/round0093_proxy_1774175111_dp2_bs1_ga8_ef12_k40_20260322_182518", "metrics_path": "/root/sparsify-ascend/checkpoints/research_agent/round_0093_proxy/round0093_proxy_1774175111_dp2_bs1_ga8_ef12_k40_20260322_182518/metrics.jsonl", "latest_step": 360, "latest_tokens_per_sec": 196595.00632754865, "baseline_ratio": null, "latest_total_tokens": 11796480.0, "proxy_mode": "fast", "evaluation_basis": "terminal_only"}}
{"event_id": "evt_1774175201736097965", "ts": 1774175201, "event": "training_heartbeat", "round": 93, "session_id": "019d14ea-730e-75e1-9200-ca4cb6c1e330", "tier": "proxy", "run_name": "round0093_proxy_1774175111", "family_name": "two_code_residual_vq", "family_stage": "prototype", "status": null, "decision": null, "payload": {"tier": "proxy", "run_name": "round0093_proxy_1774175111", "family_name": "two_code_residual_vq", "family_stage": "prototype", "checkpoint_dir": "/root/sparsify-ascend/checkpoints/research_agent/round_0093_proxy/round0093_proxy_1774175111_dp2_bs1_ga8_ef12_k40_20260322_182518", "metrics_path": "/root/sparsify-ascend/checkpoints/research_agent/round_0093_proxy/round0093_proxy_1774175111_dp2_bs1_ga8_ef12_k40_20260322_182518/metrics.jsonl", "latest_step": 600, "latest_tokens_per_sec": 218434.30374115618, "baseline_ratio": null, "latest_total_tokens": 19660800.0, "proxy_mode": "fast", "evaluation_basis": "terminal_only"}}
{"event_id": "evt_1774175231741280283", "ts": 1774175231, "event": "training_heartbeat", "round": 93, "session_id": "019d14ea-730e-75e1-9200-ca4cb6c1e330", "tier": "proxy", "run_name": "round0093_proxy_1774175111", "family_name": "two_code_residual_vq", "family_stage": "prototype", "status": null, "decision": null, "payload": {"tier": "proxy", "run_name": "round0093_proxy_1774175111", "family_name": "two_code_residual_vq", "family_stage": "prototype", "checkpoint_dir": "/root/sparsify-ascend/checkpoints/research_agent/round_0093_proxy/round0093_proxy_1774175111_dp2_bs1_ga8_ef12_k40_20260322_182518", "metrics_path": "/root/sparsify-ascend/checkpoints/research_agent/round_0093_proxy/round0093_proxy_1774175111_dp2_bs1_ga8_ef12_k40_20260322_182518/metrics.jsonl", "latest_step": 840, "latest_tokens_per_sec": 229351.1094070094, "baseline_ratio": null, "latest_total_tokens": 27525120.0, "proxy_mode": "fast", "evaluation_basis": "terminal_only"}}
{"event_id": "evt_1774175261966552719", "ts": 1774175261, "event": "training_heartbeat", "round": 93, "session_id": "019d14ea-730e-75e1-9200-ca4cb6c1e330", "tier": "proxy", "run_name": "round0093_proxy_1774175111", "family_name": "two_code_residual_vq", "family_stage": "prototype", "status": null, "decision": null, "payload": {"tier": "proxy", "run_name": "round0093_proxy_1774175111", "family_name": "two_code_residual_vq", "family_stage": "prototype", "checkpoint_dir": "/root/sparsify-ascend/checkpoints/research_agent/round_0093_proxy/round0093_proxy_1774175111_dp2_bs1_ga8_ef12_k40_20260322_182518", "metrics_path": "/root/sparsify-ascend/checkpoints/research_agent/round_0093_proxy/round0093_proxy_1774175111_dp2_bs1_ga8_ef12_k40_20260322_182518/metrics.jsonl", "latest_step": 1040, "latest_tokens_per_sec": 227162.17494372607, "baseline_ratio": null, "latest_total_tokens": 34078720.0, "proxy_mode": "fast", "evaluation_basis": "terminal_only"}}
{"event_id": "evt_1774175292128015450", "ts": 1774175292, "event": "training_heartbeat", "round": 93, "session_id": "019d14ea-730e-75e1-9200-ca4cb6c1e330", "tier": "proxy", "run_name": "round0093_proxy_1774175111", "family_name": "two_code_residual_vq", "family_stage": "prototype", "status": null, "decision": null, "payload": {"tier": "proxy", "run_name": "round0093_proxy_1774175111", "family_name": "two_code_residual_vq", "family_stage": "prototype", "checkpoint_dir": "/root/sparsify-ascend/checkpoints/research_agent/round_0093_proxy/round0093_proxy_1774175111_dp2_bs1_ga8_ef12_k40_20260322_182518", "metrics_path": "/root/sparsify-ascend/checkpoints/research_agent/round_0093_proxy/round0093_proxy_1774175111_dp2_bs1_ga8_ef12_k40_20260322_182518/metrics.jsonl", "latest_step": 1220, "latest_tokens_per_sec": 221791.38722880778, "baseline_ratio": null, "latest_total_tokens": 39976960.0, "proxy_mode": "fast", "evaluation_basis": "terminal_only"}}
{"event_id": "evt_1774175322135463891", "ts": 1774175322, "event": "training_heartbeat", "round": 93, "session_id": "019d14ea-730e-75e1-9200-ca4cb6c1e330", "tier": "proxy", "run_name": "round0093_proxy_1774175111", "family_name": "two_code_residual_vq", "family_stage": "prototype", "status": null, "decision": null, "payload": {"tier": "proxy", "run_name": "round0093_proxy_1774175111", "family_name": "two_code_residual_vq", "family_stage": "prototype", "checkpoint_dir": "/root/sparsify-ascend/checkpoints/research_agent/round_0093_proxy/round0093_proxy_1774175111_dp2_bs1_ga8_ef12_k40_20260322_182518", "metrics_path": "/root/sparsify-ascend/checkpoints/research_agent/round_0093_proxy/round0093_proxy_1774175111_dp2_bs1_ga8_ef12_k40_20260322_182518/metrics.jsonl", "latest_step": 1220, "latest_tokens_per_sec": 189998.0761000911, "baseline_ratio": null, "latest_total_tokens": 39976960.0, "proxy_mode": "fast", "evaluation_basis": "terminal_only"}}
{"event_id": "evt_1774175322213620342", "ts": 1774175322, "event": "training_finished", "round": 93, "session_id": "019d14ea-730e-75e1-9200-ca4cb6c1e330", "tier": "proxy", "run_name": "round0093_proxy_1774175111", "family_name": "two_code_residual_vq", "family_stage": "prototype", "status": "ok", "decision": "incubate", "payload": {"tier": "proxy", "run_name": "round0093_proxy_1774175111", "family_name": "two_code_residual_vq", "family_stage": "prototype", "checkpoint_dir": "/root/sparsify-ascend/checkpoints/research_agent/round_0093_proxy/round0093_proxy_1774175111_dp2_bs1_ga8_ef12_k40_20260322_182518", "metrics_path": "/root/sparsify-ascend/checkpoints/research_agent/round_0093_proxy/round0093_proxy_1774175111_dp2_bs1_ga8_ef12_k40_20260322_182518/metrics.jsonl", "run_health": "normal", "termination_reason": "completed", "tokens_per_sec": 189998.0761000911, "baseline_ratio": null, "status": "ok", "decision": "incubate", "proxy_mode": "fast", "evaluation_basis": "terminal_only", "curve_start_fvu": 0.29579347372055054, "curve_mid_fvu": 0.2670770287513733, "curve_end_fvu": 0.2335253655910492, "curve_late_slope": -2.8560146451813216e-09, "curve_still_improving": true}}
{"event_id": "evt_1774175322213680689", "ts": 1774175322, "event": "result_recorded", "round": 93, "session_id": "019d14ea-730e-75e1-9200-ca4cb6c1e330", "tier": "proxy", "run_name": "round0093_proxy_1774175111", "family_name": "two_code_residual_vq", "family_stage": "prototype", "status": "ok", "decision": "incubate", "payload": {"tier": "proxy", "run_name": "round0093_proxy_1774175111", "family_name": "two_code_residual_vq", "family_stage": "prototype", "status": "ok", "decision": "incubate", "val_fvu": "0.24070418253540993", "observed_fvu": "0.233525", "k": "40", "log_path": "/root/sparsify-ascend/research/history/logs/proxy_1774175322.log", "checkpoint": null}}
{"event_id": "evt_1774175322214113527", "ts": 1774175322, "event": "round_finished", "round": 93, "session_id": "019d14ea-730e-75e1-9200-ca4cb6c1e330", "tier": "proxy", "run_name": null, "family_name": "two_code_residual_vq", "family_stage": "prototype", "status": "ok", "decision": "incubate", "payload": {"tier": "proxy", "family_name": "two_code_residual_vq", "family_stage": "prototype", "status": "ok", "decision": "incubate", "val_fvu": "0.24070418253540993"}}
{"event_id": "evt_1774175322222843023", "ts": 1774175322, "event": "experiment_commit_prepared", "round": 93, "tier": "proxy", "run_name": null, "family_name": "two_code_residual_vq", "family_stage": "prototype", "status": "ok", "decision": "incubate", "payload": {"branch": "autoresearch-sae"}}
{"event_id": "evt_1774175329618246066", "ts": 1774175329, "event": "round_started", "round": 94, "session_id": "019d14ea-730e-75e1-9200-ca4cb6c1e330", "tier": null, "run_name": null, "family_name": null, "family_stage": null, "status": "started", "decision": null, "payload": {"status": "started"}}
{"event_id": "evt_1774175329618402492", "ts": 1774175329, "event": "agent_deciding", "round": 94, "session_id": "019d14ea-730e-75e1-9200-ca4cb6c1e330", "tier": null, "run_name": null, "family_name": null, "family_stage": null, "status": null, "decision": null, "payload": {}}
{"event_id": "evt_1774175472303940502", "ts": 1774175472, "event": "session_resumed", "round": 94, "tier": null, "run_name": null, "family_name": null, "family_stage": null, "status": "active", "decision": null, "payload": {"session_id": "019d14ea-730e-75e1-9200-ca4cb6c1e330"}}
{"event_id": "evt_1774175472305207508", "ts": 1774175472, "event": "agent_action_received", "round": 94, "session_id": "019d14ea-730e-75e1-9200-ca4cb6c1e330", "tier": "proxy", "run_name": null, "family_name": "batch_topk", "family_stage": "mainline_comparison", "status": null, "decision": null, "payload": {"session_id": "019d14ea-730e-75e1-9200-ca4cb6c1e330", "tier": "proxy", "family_name": "batch_topk", "family_stage": "mainline_comparison", "change_type": "param_only", "expected_win": "architecture_signal", "hypothesis": "The current low-K stall suggests the main failure mode may be fixed per-sample top-k allocation rather than trunk capacity alone. Running `batch_topk` at the exact active comparison point `K=40, EF=12` with the unchanged `signum`/`lr=1.6e-3`/`auxk_alpha=0` recipe is the cleanest fundamentally different architecture test because it changes the sparsity mechanism itself while keeping the same low-K lane and same EF band."}}
{"event_id": "evt_1774175472305326187", "ts": 1774175472, "event": "variable_isolation_warning", "round": 94, "session_id": "019d14ea-730e-75e1-9200-ca4cb6c1e330", "tier": null, "run_name": null, "family_name": "batch_topk", "family_stage": "mainline_comparison", "status": null, "decision": null, "payload": {"violation": "Multiple primary variables changed simultaneously: architecture, k, lr"}}
{"event_id": "evt_1774175472305387720", "ts": 1774175472, "event": "proxy_mode_selected", "round": 94, "session_id": "019d14ea-730e-75e1-9200-ca4cb6c1e330", "tier": "proxy", "run_name": null, "family_name": "batch_topk", "family_stage": "mainline_comparison", "status": null, "decision": null, "payload": {"tier": "proxy", "proxy_mode": "fast", "evaluation_basis": "terminal_only", "parameter_behavior": "structural", "proxy_max_tokens": "5000000"}}
{"event_id": "evt_1774175472305662730", "ts": 1774175472, "event": "training_started", "round": 94, "session_id": "019d14ea-730e-75e1-9200-ca4cb6c1e330", "tier": "proxy", "run_name": "round0094_proxy_1774175472", "family_name": "batch_topk", "family_stage": "mainline_comparison", "status": null, "decision": null, "payload": {"tier": "proxy", "run_name": "round0094_proxy_1774175472", "family_name": "batch_topk", "family_stage": "mainline_comparison", "checkpoint_dir": "/root/sparsify-ascend/checkpoints/research_agent/round_0094_proxy", "log_path": "/root/sparsify-ascend/research/history/logs/round0094_proxy_1774175472.log", "config": {"architecture": "batch_topk", "expansion_factor": 12, "k": 40, "optimizer": "signum", "lr": "1.6e-3", "hookpoints": "layers.[3].self_attn.o_proj", "batch_size": 1, "grad_acc_steps": 8, "micro_acc_steps": 1, "auxk_alpha": 0.0, "dead_feature_threshold": 10000000, "use_hadamard": false, "tier": "proxy", "family_name": "batch_topk", "family_stage": "mainline_comparison"}, "baseline_tokens_per_sec": 83008.54995808232, "proxy_mode": "fast", "evaluation_basis": "terminal_only"}}
{"event_id": "evt_1774175502307844147", "ts": 1774175502, "event": "training_heartbeat", "round": 94, "session_id": "019d14ea-730e-75e1-9200-ca4cb6c1e330", "tier": "proxy", "run_name": "round0094_proxy_1774175472", "family_name": "batch_topk", "family_stage": "mainline_comparison", "status": null, "decision": null, "payload": {"tier": "proxy", "run_name": "round0094_proxy_1774175472", "family_name": "batch_topk", "family_stage": "mainline_comparison", "checkpoint_dir": "/root/sparsify-ascend/checkpoints/research_agent/round_0094_proxy/round0094_proxy_1774175472_dp2_bs1_ga8_ef12_k40_20260322_183118", "metrics_path": "/root/sparsify-ascend/checkpoints/research_agent/round_0094_proxy/round0094_proxy_1774175472_dp2_bs1_ga8_ef12_k40_20260322_183118/metrics.jsonl", "latest_step": 110, "latest_tokens_per_sec": 120142.16561860006, "baseline_ratio": 1.4473468778730563, "latest_total_tokens": 3604480.0, "proxy_mode": "fast", "evaluation_basis": "terminal_only"}}
