{"event_id": "evt_1774177085918546555", "ts": 1774177085, "event": "session_resumed", "round": 101, "tier": null, "run_name": null, "family_name": null, "family_stage": null, "status": "active", "decision": null, "payload": {"session_id": "019d151e-f057-7ab3-a1e7-776eaf5fbf59"}}
{"event_id": "evt_1774177085919871002", "ts": 1774177085, "event": "agent_action_received", "round": 101, "session_id": "019d151e-f057-7ab3-a1e7-776eaf5fbf59", "tier": "proxy", "run_name": null, "family_name": "bucketed_lowrank_residual", "family_stage": "prototype", "status": null, "decision": null, "payload": {"session_id": "019d151e-f057-7ab3-a1e7-776eaf5fbf59", "tier": "proxy", "family_name": "bucketed_lowrank_residual", "family_stage": "prototype", "change_type": "edit_sae_code", "expected_win": "run_stability", "hypothesis": "`bucketed_lowrank_residual` did not fail on quality; it failed on a narrow implementation blocker because the architecture string was not registered in config validation and/or factory dispatch. The correct next move is a repair-only follow-up that wires the existing family into the `sparsify/` registration path and reruns the exact same `K=32, EF=12` proxy target unchanged."}}
{"event_id": "evt_1774177217484313166", "ts": 1774177217, "event": "variable_isolation_warning", "round": 101, "session_id": "019d151e-f057-7ab3-a1e7-776eaf5fbf59", "tier": null, "run_name": null, "family_name": "bucketed_lowrank_residual", "family_stage": "prototype", "status": null, "decision": null, "payload": {"violation": "Multiple primary variables changed simultaneously: code_edit, architecture, k, lr"}}
{"event_id": "evt_1774177217484456157", "ts": 1774177217, "event": "proxy_mode_selected", "round": 101, "session_id": "019d151e-f057-7ab3-a1e7-776eaf5fbf59", "tier": "proxy", "run_name": null, "family_name": "bucketed_lowrank_residual", "family_stage": "prototype", "status": null, "decision": null, "payload": {"tier": "proxy", "proxy_mode": "fast", "evaluation_basis": "terminal_only", "parameter_behavior": "structural", "proxy_max_tokens": "40000000"}}
{"event_id": "evt_1774177217484502228", "ts": 1774177217, "event": "sanity_started", "round": 101, "session_id": "019d151e-f057-7ab3-a1e7-776eaf5fbf59", "tier": "proxy", "run_name": null, "family_name": "bucketed_lowrank_residual", "family_stage": "prototype", "status": null, "decision": null, "payload": {"tier": "proxy"}}
{"event_id": "evt_1774177222226520870", "ts": 1774177222, "event": "sanity_finished", "round": 101, "session_id": "019d151e-f057-7ab3-a1e7-776eaf5fbf59", "tier": "proxy", "run_name": null, "family_name": "bucketed_lowrank_residual", "family_stage": "prototype", "status": "ok", "decision": null, "payload": {"tier": "proxy", "status": "ok"}}
{"event_id": "evt_1774177222226915245", "ts": 1774177222, "event": "training_started", "round": 101, "session_id": "019d151e-f057-7ab3-a1e7-776eaf5fbf59", "tier": "proxy", "run_name": "round0101_proxy_1774177222", "family_name": "bucketed_lowrank_residual", "family_stage": "prototype", "status": null, "decision": null, "payload": {"tier": "proxy", "run_name": "round0101_proxy_1774177222", "family_name": "bucketed_lowrank_residual", "family_stage": "prototype", "checkpoint_dir": "/root/sparsify-ascend/checkpoints/research_agent/round_0101_proxy", "log_path": "/root/sparsify-ascend/research/history/logs/round0101_proxy_1774177222.log", "config": {"architecture": "bucketed_lowrank_residual", "expansion_factor": 12, "k": 32, "optimizer": "signum", "lr": "1.6e-3", "hookpoints": "layers.[3].self_attn.o_proj", "batch_size": 1, "grad_acc_steps": 8, "micro_acc_steps": 1, "auxk_alpha": 0.0, "dead_feature_threshold": 10000000, "use_hadamard": false, "tier": "proxy", "family_name": "bucketed_lowrank_residual", "family_stage": "prototype"}, "baseline_tokens_per_sec": null, "proxy_mode": "fast", "evaluation_basis": "terminal_only"}}
{"event_id": "evt_1774177252227699139", "ts": 1774177252, "event": "training_heartbeat", "round": 101, "session_id": "019d151e-f057-7ab3-a1e7-776eaf5fbf59", "tier": "proxy", "run_name": "round0101_proxy_1774177222", "family_name": "bucketed_lowrank_residual", "family_stage": "prototype", "status": null, "decision": null, "payload": {"tier": "proxy", "run_name": "round0101_proxy_1774177222", "family_name": "bucketed_lowrank_residual", "family_stage": "prototype", "checkpoint_dir": null, "metrics_path": null, "latest_step": null, "latest_tokens_per_sec": null, "baseline_ratio": null, "latest_total_tokens": null, "proxy_mode": "fast", "evaluation_basis": "terminal_only"}}
{"event_id": "evt_1774177252293733355", "ts": 1774177252, "event": "training_finished", "round": 101, "session_id": "019d151e-f057-7ab3-a1e7-776eaf5fbf59", "tier": "proxy", "run_name": "round0101_proxy_1774177222", "family_name": "bucketed_lowrank_residual", "family_stage": "prototype", "status": "crash", "decision": "crash", "payload": {"tier": "proxy", "run_name": "round0101_proxy_1774177222", "family_name": "bucketed_lowrank_residual", "family_stage": "prototype", "checkpoint_dir": null, "metrics_path": "", "run_health": "crash", "termination_reason": "completed", "tokens_per_sec": null, "baseline_ratio": null, "status": "crash", "decision": "crash", "proxy_mode": "fast", "evaluation_basis": "terminal_only", "curve_start_fvu": null, "curve_mid_fvu": null, "curve_end_fvu": null, "curve_late_slope": null, "curve_still_improving": null}}
{"event_id": "evt_1774177252293787099", "ts": 1774177252, "event": "result_recorded", "round": 101, "session_id": "019d151e-f057-7ab3-a1e7-776eaf5fbf59", "tier": "proxy", "run_name": "round0101_proxy_1774177222", "family_name": "bucketed_lowrank_residual", "family_stage": "prototype", "status": "crash", "decision": "crash", "payload": {"tier": "proxy", "run_name": "round0101_proxy_1774177222", "family_name": "bucketed_lowrank_residual", "family_stage": "prototype", "status": "crash", "decision": "crash", "val_fvu": "None", "observed_fvu": "", "k": "None", "log_path": "/root/sparsify-ascend/research/history/logs/proxy_1774177252.log", "checkpoint": null}}
{"event_id": "evt_1774177252293851575", "ts": 1774177252, "event": "repair_attempt_started", "round": 101, "session_id": "019d151e-f057-7ab3-a1e7-776eaf5fbf59", "tier": "proxy", "run_name": null, "family_name": "bucketed_lowrank_residual", "family_stage": "prototype", "status": null, "decision": null, "payload": {"tier": "proxy", "family_name": "bucketed_lowrank_residual", "family_stage": "prototype", "repair_attempt": 1, "failure_kind": "training_crash", "error_type": "ValueError", "error_summary": "ValueError: Unknown architecture: 'bucketed_lowrank_residual'. Must be one of ('topk', 'batch_topk', 'adaptive_budget_topk', 'bucketed_topk', 'codebook_topk', 'residual_vq', 'two_code_residual_vq', 'jumprelu', 'gated', 'routed', 'group_topk', 'factorized_topk', 'lowrank_residual', 'whitened_lowrank_residual', 'lowrank_gated_residual', 'whitened_lowrank_gated_residual', 'lowrank_grouped_residual', 'whitened_topk', 'two_stage_residual', 'multi_branch_gated')"}}
{"event_id": "evt_1774177443625268421", "ts": 1774177443, "event": "variable_isolation_warning", "round": 101, "session_id": "019d151e-f057-7ab3-a1e7-776eaf5fbf59", "tier": null, "run_name": null, "family_name": "bucketed_lowrank_residual", "family_stage": "prototype", "status": null, "decision": null, "payload": {"violation": "Multiple primary variables changed simultaneously: code_edit, architecture, k, lr"}}
{"event_id": "evt_1774177448144296840", "ts": 1774177448, "event": "behavioral_diff_identical_warning", "round": 101, "session_id": "019d151e-f057-7ab3-a1e7-776eaf5fbf59", "tier": null, "run_name": null, "family_name": "bucketed_lowrank_residual", "family_stage": "prototype", "status": null, "decision": null, "payload": {"architecture": "bucketed_lowrank_residual", "k": 32, "expansion_factor": 12, "max_diff": 0.0}}
{"event_id": "evt_1774177448144366631", "ts": 1774177448, "event": "proxy_mode_selected", "round": 101, "session_id": "019d151e-f057-7ab3-a1e7-776eaf5fbf59", "tier": "proxy", "run_name": null, "family_name": "bucketed_lowrank_residual", "family_stage": "prototype", "status": null, "decision": null, "payload": {"tier": "proxy", "proxy_mode": "fast", "evaluation_basis": "terminal_only", "parameter_behavior": "structural", "proxy_max_tokens": "40000000"}}
{"event_id": "evt_1774177448144421291", "ts": 1774177448, "event": "sanity_started", "round": 101, "session_id": "019d151e-f057-7ab3-a1e7-776eaf5fbf59", "tier": "proxy", "run_name": null, "family_name": "bucketed_lowrank_residual", "family_stage": "prototype", "status": null, "decision": null, "payload": {"tier": "proxy"}}
{"event_id": "evt_1774177452732450983", "ts": 1774177452, "event": "sanity_finished", "round": 101, "session_id": "019d151e-f057-7ab3-a1e7-776eaf5fbf59", "tier": "proxy", "run_name": null, "family_name": "bucketed_lowrank_residual", "family_stage": "prototype", "status": "ok", "decision": null, "payload": {"tier": "proxy", "status": "ok"}}
{"event_id": "evt_1774177452732858331", "ts": 1774177452, "event": "training_started", "round": 101, "session_id": "019d151e-f057-7ab3-a1e7-776eaf5fbf59", "tier": "proxy", "run_name": "round0101_proxy_1774177452", "family_name": "bucketed_lowrank_residual", "family_stage": "prototype", "status": null, "decision": null, "payload": {"tier": "proxy", "run_name": "round0101_proxy_1774177452", "family_name": "bucketed_lowrank_residual", "family_stage": "prototype", "checkpoint_dir": "/root/sparsify-ascend/checkpoints/research_agent/round_0101_proxy", "log_path": "/root/sparsify-ascend/research/history/logs/round0101_proxy_1774177452.log", "config": {"architecture": "bucketed_lowrank_residual", "expansion_factor": 12, "k": 32, "optimizer": "signum", "lr": "1.6e-3", "hookpoints": "layers.[3].self_attn.o_proj", "batch_size": 1, "grad_acc_steps": 8, "micro_acc_steps": 1, "auxk_alpha": 0.0, "dead_feature_threshold": 10000000, "use_hadamard": false, "tier": "proxy", "family_name": "bucketed_lowrank_residual", "family_stage": "prototype"}, "baseline_tokens_per_sec": null, "proxy_mode": "fast", "evaluation_basis": "terminal_only"}}
{"event_id": "evt_1774177482734468211", "ts": 1774177482, "event": "training_heartbeat", "round": 101, "session_id": "019d151e-f057-7ab3-a1e7-776eaf5fbf59", "tier": "proxy", "run_name": "round0101_proxy_1774177452", "family_name": "bucketed_lowrank_residual", "family_stage": "prototype", "status": null, "decision": null, "payload": {"tier": "proxy", "run_name": "round0101_proxy_1774177452", "family_name": "bucketed_lowrank_residual", "family_stage": "prototype", "checkpoint_dir": "/root/sparsify-ascend/checkpoints/research_agent/round_0101_proxy/round0101_proxy_1774177452_dp2_bs1_ga8_ef12_k32_20260322_190419", "metrics_path": "/root/sparsify-ascend/checkpoints/research_agent/round_0101_proxy/round0101_proxy_1774177452_dp2_bs1_ga8_ef12_k32_20260322_190419/metrics.jsonl", "latest_step": 90, "latest_tokens_per_sec": 98299.75877674103, "baseline_ratio": null, "latest_total_tokens": 2949120.0, "proxy_mode": "fast", "evaluation_basis": "terminal_only"}}
{"event_id": "evt_1774177512736488242", "ts": 1774177512, "event": "training_heartbeat", "round": 101, "session_id": "019d151e-f057-7ab3-a1e7-776eaf5fbf59", "tier": "proxy", "run_name": "round0101_proxy_1774177452", "family_name": "bucketed_lowrank_residual", "family_stage": "prototype", "status": null, "decision": null, "payload": {"tier": "proxy", "run_name": "round0101_proxy_1774177452", "family_name": "bucketed_lowrank_residual", "family_stage": "prototype", "checkpoint_dir": "/root/sparsify-ascend/checkpoints/research_agent/round_0101_proxy/round0101_proxy_1774177452_dp2_bs1_ga8_ef12_k32_20260322_190419", "metrics_path": "/root/sparsify-ascend/checkpoints/research_agent/round_0101_proxy/round0101_proxy_1774177452_dp2_bs1_ga8_ef12_k32_20260322_190419/metrics.jsonl", "latest_step": 260, "latest_tokens_per_sec": 141986.8236537154, "baseline_ratio": null, "latest_total_tokens": 8519680.0, "proxy_mode": "fast", "evaluation_basis": "terminal_only"}}
{"event_id": "evt_1774177542739491680", "ts": 1774177542, "event": "training_heartbeat", "round": 101, "session_id": "019d151e-f057-7ab3-a1e7-776eaf5fbf59", "tier": "proxy", "run_name": "round0101_proxy_1774177452", "family_name": "bucketed_lowrank_residual", "family_stage": "prototype", "status": null, "decision": null, "payload": {"tier": "proxy", "run_name": "round0101_proxy_1774177452", "family_name": "bucketed_lowrank_residual", "family_stage": "prototype", "checkpoint_dir": "/root/sparsify-ascend/checkpoints/research_agent/round_0101_proxy/round0101_proxy_1774177452_dp2_bs1_ga8_ef12_k32_20260322_190419", "metrics_path": "/root/sparsify-ascend/checkpoints/research_agent/round_0101_proxy/round0101_proxy_1774177452_dp2_bs1_ga8_ef12_k32_20260322_190419/metrics.jsonl", "latest_step": 430, "latest_tokens_per_sec": 156547.24861837574, "baseline_ratio": null, "latest_total_tokens": 14090240.0, "proxy_mode": "fast", "evaluation_basis": "terminal_only"}}
{"event_id": "evt_1774177572743422834", "ts": 1774177572, "event": "training_heartbeat", "round": 101, "session_id": "019d151e-f057-7ab3-a1e7-776eaf5fbf59", "tier": "proxy", "run_name": "round0101_proxy_1774177452", "family_name": "bucketed_lowrank_residual", "family_stage": "prototype", "status": null, "decision": null, "payload": {"tier": "proxy", "run_name": "round0101_proxy_1774177452", "family_name": "bucketed_lowrank_residual", "family_stage": "prototype", "checkpoint_dir": "/root/sparsify-ascend/checkpoints/research_agent/round_0101_proxy/round0101_proxy_1774177452_dp2_bs1_ga8_ef12_k32_20260322_190419", "metrics_path": "/root/sparsify-ascend/checkpoints/research_agent/round_0101_proxy/round0101_proxy_1774177452_dp2_bs1_ga8_ef12_k32_20260322_190419/metrics.jsonl", "latest_step": 600, "latest_tokens_per_sec": 163826.013889331, "baseline_ratio": null, "latest_total_tokens": 19660800.0, "proxy_mode": "fast", "evaluation_basis": "terminal_only"}}
{"event_id": "evt_1774177602748453304", "ts": 1774177602, "event": "training_heartbeat", "round": 101, "session_id": "019d151e-f057-7ab3-a1e7-776eaf5fbf59", "tier": "proxy", "run_name": "round0101_proxy_1774177452", "family_name": "bucketed_lowrank_residual", "family_stage": "prototype", "status": null, "decision": null, "payload": {"tier": "proxy", "run_name": "round0101_proxy_1774177452", "family_name": "bucketed_lowrank_residual", "family_stage": "prototype", "checkpoint_dir": "/root/sparsify-ascend/checkpoints/research_agent/round_0101_proxy/round0101_proxy_1774177452_dp2_bs1_ga8_ef12_k32_20260322_190419", "metrics_path": "/root/sparsify-ascend/checkpoints/research_agent/round_0101_proxy/round0101_proxy_1774177452_dp2_bs1_ga8_ef12_k32_20260322_190419/metrics.jsonl", "latest_step": 770, "latest_tokens_per_sec": 168191.94900950268, "baseline_ratio": null, "latest_total_tokens": 25231360.0, "proxy_mode": "fast", "evaluation_basis": "terminal_only"}}
{"event_id": "evt_1774177632754277109", "ts": 1774177632, "event": "training_heartbeat", "round": 101, "session_id": "019d151e-f057-7ab3-a1e7-776eaf5fbf59", "tier": "proxy", "run_name": "round0101_proxy_1774177452", "family_name": "bucketed_lowrank_residual", "family_stage": "prototype", "status": null, "decision": null, "payload": {"tier": "proxy", "run_name": "round0101_proxy_1774177452", "family_name": "bucketed_lowrank_residual", "family_stage": "prototype", "checkpoint_dir": "/root/sparsify-ascend/checkpoints/research_agent/round_0101_proxy/round0101_proxy_1774177452_dp2_bs1_ga8_ef12_k32_20260322_190419", "metrics_path": "/root/sparsify-ascend/checkpoints/research_agent/round_0101_proxy/round0101_proxy_1774177452_dp2_bs1_ga8_ef12_k32_20260322_190419/metrics.jsonl", "latest_step": 940, "latest_tokens_per_sec": 171101.73191546116, "baseline_ratio": null, "latest_total_tokens": 30801920.0, "proxy_mode": "fast", "evaluation_basis": "terminal_only"}}
{"event_id": "evt_1774177662760927491", "ts": 1774177662, "event": "training_heartbeat", "round": 101, "session_id": "019d151e-f057-7ab3-a1e7-776eaf5fbf59", "tier": "proxy", "run_name": "round0101_proxy_1774177452", "family_name": "bucketed_lowrank_residual", "family_stage": "prototype", "status": null, "decision": null, "payload": {"tier": "proxy", "run_name": "round0101_proxy_1774177452", "family_name": "bucketed_lowrank_residual", "family_stage": "prototype", "checkpoint_dir": "/root/sparsify-ascend/checkpoints/research_agent/round_0101_proxy/round0101_proxy_1774177452_dp2_bs1_ga8_ef12_k32_20260322_190419", "metrics_path": "/root/sparsify-ascend/checkpoints/research_agent/round_0101_proxy/round0101_proxy_1774177452_dp2_bs1_ga8_ef12_k32_20260322_190419/metrics.jsonl", "latest_step": 1080, "latest_tokens_per_sec": 168498.89566692547, "baseline_ratio": null, "latest_total_tokens": 35389440.0, "proxy_mode": "fast", "evaluation_basis": "terminal_only"}}
{"event_id": "evt_1774177692768415376", "ts": 1774177692, "event": "training_heartbeat", "round": 101, "session_id": "019d151e-f057-7ab3-a1e7-776eaf5fbf59", "tier": "proxy", "run_name": "round0101_proxy_1774177452", "family_name": "bucketed_lowrank_residual", "family_stage": "prototype", "status": null, "decision": null, "payload": {"tier": "proxy", "run_name": "round0101_proxy_1774177452", "family_name": "bucketed_lowrank_residual", "family_stage": "prototype", "checkpoint_dir": "/root/sparsify-ascend/checkpoints/research_agent/round_0101_proxy/round0101_proxy_1774177452_dp2_bs1_ga8_ef12_k32_20260322_190419", "metrics_path": "/root/sparsify-ascend/checkpoints/research_agent/round_0101_proxy/round0101_proxy_1774177452_dp2_bs1_ga8_ef12_k32_20260322_190419/metrics.jsonl", "latest_step": 1220, "latest_tokens_per_sec": 166546.23417780202, "baseline_ratio": null, "latest_total_tokens": 39976960.0, "proxy_mode": "fast", "evaluation_basis": "terminal_only"}}
{"event_id": "evt_1774177722775948650", "ts": 1774177722, "event": "training_heartbeat", "round": 101, "session_id": "019d151e-f057-7ab3-a1e7-776eaf5fbf59", "tier": "proxy", "run_name": "round0101_proxy_1774177452", "family_name": "bucketed_lowrank_residual", "family_stage": "prototype", "status": null, "decision": null, "payload": {"tier": "proxy", "run_name": "round0101_proxy_1774177452", "family_name": "bucketed_lowrank_residual", "family_stage": "prototype", "checkpoint_dir": "/root/sparsify-ascend/checkpoints/research_agent/round_0101_proxy/round0101_proxy_1774177452_dp2_bs1_ga8_ef12_k32_20260322_190419", "metrics_path": "/root/sparsify-ascend/checkpoints/research_agent/round_0101_proxy/round0101_proxy_1774177452_dp2_bs1_ga8_ef12_k32_20260322_190419/metrics.jsonl", "latest_step": 1220, "latest_tokens_per_sec": 148039.37635751817, "baseline_ratio": null, "latest_total_tokens": 39976960.0, "proxy_mode": "fast", "evaluation_basis": "terminal_only"}}
{"event_id": "evt_1774177722856300229", "ts": 1774177722, "event": "training_finished", "round": 101, "session_id": "019d151e-f057-7ab3-a1e7-776eaf5fbf59", "tier": "proxy", "run_name": "round0101_proxy_1774177452", "family_name": "bucketed_lowrank_residual", "family_stage": "prototype", "status": "ok", "decision": "promote", "payload": {"tier": "proxy", "run_name": "round0101_proxy_1774177452", "family_name": "bucketed_lowrank_residual", "family_stage": "prototype", "checkpoint_dir": "/root/sparsify-ascend/checkpoints/research_agent/round_0101_proxy/round0101_proxy_1774177452_dp2_bs1_ga8_ef12_k32_20260322_190419", "metrics_path": "/root/sparsify-ascend/checkpoints/research_agent/round_0101_proxy/round0101_proxy_1774177452_dp2_bs1_ga8_ef12_k32_20260322_190419/metrics.jsonl", "run_health": "normal", "termination_reason": "completed", "tokens_per_sec": 148039.37635751817, "baseline_ratio": null, "status": "ok", "decision": "promote", "proxy_mode": "fast", "evaluation_basis": "terminal_only", "curve_start_fvu": 0.13791623711585999, "curve_mid_fvu": 0.12027817219495773, "curve_end_fvu": 0.09853360056877136, "curve_late_slope": -1.5129257992127544e-09, "curve_still_improving": true}}
{"event_id": "evt_1774177722856361643", "ts": 1774177722, "event": "result_recorded", "round": 101, "session_id": "019d151e-f057-7ab3-a1e7-776eaf5fbf59", "tier": "proxy", "run_name": "round0101_proxy_1774177452", "family_name": "bucketed_lowrank_residual", "family_stage": "prototype", "status": "ok", "decision": "promote", "payload": {"tier": "proxy", "run_name": "round0101_proxy_1774177452", "family_name": "bucketed_lowrank_residual", "family_stage": "prototype", "status": "ok", "decision": "promote", "val_fvu": "0.10123475920408964", "observed_fvu": "0.098534", "k": "32", "log_path": "/root/sparsify-ascend/research/history/logs/proxy_1774177722.log", "checkpoint": null}}
{"event_id": "evt_1774177722857100826", "ts": 1774177722, "event": "training_started", "round": 101, "session_id": "019d151e-f057-7ab3-a1e7-776eaf5fbf59", "tier": "full", "run_name": "round0101_full_1774177722", "family_name": "bucketed_lowrank_residual", "family_stage": "prototype", "status": null, "decision": null, "payload": {"tier": "full", "run_name": "round0101_full_1774177722", "family_name": "bucketed_lowrank_residual", "family_stage": "prototype", "checkpoint_dir": "/root/sparsify-ascend/checkpoints/research_agent/round_0101_full", "log_path": "/root/sparsify-ascend/research/history/logs/round0101_full_1774177722.log", "config": {"architecture": "bucketed_lowrank_residual", "expansion_factor": 12, "k": 32, "optimizer": "signum", "lr": "1.6e-3", "hookpoints": "layers.[3].self_attn.o_proj", "batch_size": 1, "grad_acc_steps": 8, "micro_acc_steps": 1, "auxk_alpha": 0.0, "dead_feature_threshold": 10000000, "use_hadamard": false, "tier": "full", "family_name": "bucketed_lowrank_residual", "family_stage": "prototype"}, "baseline_tokens_per_sec": null, "proxy_mode": null, "evaluation_basis": null}}
