{"event_id": "evt_1774145398344085417", "ts": 1774145398, "event": "training_heartbeat", "round": 27, "session_id": "019d130c-782e-75a2-aa6f-506b18d29edf", "tier": "proxy", "run_name": "round0027_proxy_1774145278", "family_name": "lowrank_gated_residual", "family_stage": "stabilize", "status": null, "decision": null, "payload": {"tier": "proxy", "run_name": "round0027_proxy_1774145278", "family_name": "lowrank_gated_residual", "family_stage": "stabilize", "checkpoint_dir": "/root/sparsify-ascend/checkpoints/research_agent/round_0027_proxy/round0027_proxy_1774145278_dp2_bs1_ga8_ef48_k128_20260322_100806", "metrics_path": "/root/sparsify-ascend/checkpoints/research_agent/round_0027_proxy/round0027_proxy_1774145278_dp2_bs1_ga8_ef48_k128_20260322_100806/metrics.jsonl", "latest_step": 152, "latest_tokens_per_sec": 41504.48227922083, "baseline_ratio": 0.6235878750384676, "latest_total_tokens": 4980736.0, "proxy_mode": "fast", "evaluation_basis": "terminal_only"}}
{"event_id": "evt_1774145398406340058", "ts": 1774145398, "event": "training_finished", "round": 27, "session_id": "019d130c-782e-75a2-aa6f-506b18d29edf", "tier": "proxy", "run_name": "round0027_proxy_1774145278", "family_name": "lowrank_gated_residual", "family_stage": "stabilize", "status": "ok", "decision": "discard", "payload": {"tier": "proxy", "run_name": "round0027_proxy_1774145278", "family_name": "lowrank_gated_residual", "family_stage": "stabilize", "checkpoint_dir": "/root/sparsify-ascend/checkpoints/research_agent/round_0027_proxy/round0027_proxy_1774145278_dp2_bs1_ga8_ef48_k128_20260322_100806", "metrics_path": "/root/sparsify-ascend/checkpoints/research_agent/round_0027_proxy/round0027_proxy_1774145278_dp2_bs1_ga8_ef48_k128_20260322_100806/metrics.jsonl", "run_health": "normal", "termination_reason": "completed", "tokens_per_sec": 41504.48227922083, "baseline_ratio": 0.6235878750384676, "status": "ok", "decision": "discard", "proxy_mode": "fast", "evaluation_basis": "terminal_only", "curve_start_fvu": 0.24592754244804382, "curve_mid_fvu": 0.16307125985622406, "curve_end_fvu": 0.12961462140083313, "curve_late_slope": -5.19752751232215e-09, "curve_still_improving": true}}
{"event_id": "evt_1774145398406396402", "ts": 1774145398, "event": "result_recorded", "round": 27, "session_id": "019d130c-782e-75a2-aa6f-506b18d29edf", "tier": "proxy", "run_name": "round0027_proxy_1774145278", "family_name": "lowrank_gated_residual", "family_stage": "stabilize", "status": "ok", "decision": "discard", "payload": {"tier": "proxy", "run_name": "round0027_proxy_1774145278", "family_name": "lowrank_gated_residual", "family_stage": "stabilize", "status": "ok", "decision": "discard", "val_fvu": "0.13058725278824568", "observed_fvu": "0.129615", "k": "128", "log_path": "/root/sparsify-ascend/research/history/logs/proxy_1774145398.log", "checkpoint": null}}
{"event_id": "evt_1774145398406530933", "ts": 1774145398, "event": "round_finished", "round": 27, "session_id": "019d130c-782e-75a2-aa6f-506b18d29edf", "tier": "proxy", "run_name": null, "family_name": "lowrank_gated_residual", "family_stage": "stabilize", "status": "ok", "decision": "discard", "payload": {"tier": "proxy", "family_name": "lowrank_gated_residual", "family_stage": "stabilize", "status": "ok", "decision": "discard", "val_fvu": "0.13058725278824568"}}
{"event_id": "evt_1774145398413089640", "ts": 1774145398, "event": "experiment_commit_prepared", "round": 27, "tier": "proxy", "run_name": null, "family_name": "lowrank_gated_residual", "family_stage": "stabilize", "status": "ok", "decision": "discard", "payload": {"branch": "autoresearch-sae"}}
{"event_id": "evt_1774145405989754325", "ts": 1774145405, "event": "round_started", "round": 28, "session_id": "019d130c-782e-75a2-aa6f-506b18d29edf", "tier": null, "run_name": null, "family_name": null, "family_stage": null, "status": "started", "decision": null, "payload": {"status": "started"}}
{"event_id": "evt_1774145405989906883", "ts": 1774145405, "event": "agent_deciding", "round": 28, "session_id": "019d130c-782e-75a2-aa6f-506b18d29edf", "tier": null, "run_name": null, "family_name": null, "family_stage": null, "status": null, "decision": null, "payload": {}}
{"event_id": "evt_1774145531889581601", "ts": 1774145531, "event": "session_resumed", "round": 28, "tier": null, "run_name": null, "family_name": null, "family_stage": null, "status": "active", "decision": null, "payload": {"session_id": "019d130c-782e-75a2-aa6f-506b18d29edf"}}
{"event_id": "evt_1774145531890296797", "ts": 1774145531, "event": "agent_action_received", "round": 28, "session_id": "019d130c-782e-75a2-aa6f-506b18d29edf", "tier": "proxy", "run_name": null, "family_name": "lowrank_gated_residual", "family_stage": "stabilize", "status": null, "decision": null, "payload": {"session_id": "019d130c-782e-75a2-aa6f-506b18d29edf", "tier": "proxy", "family_name": "lowrank_gated_residual", "family_stage": "stabilize", "change_type": "param_only", "expected_win": "lower_fvu", "hypothesis": "`lowrank_gated_residual` remains the best full-signal family, and the recent exploitation probes show that adding aux pressure, lowering LR, or increasing EF all hurt the K=128 proxy anchor. The next clean single-variable sweep point is the untested high-LR side: raising `LR` from `1.6e-3` to `3.2e-3` at K=128 while keeping `AUXK_ALPHA=0` and `EXPANSION_FACTOR=32` fixed tests whether the current mainline family benefits from a more aggressive signum step rather than the smaller-step regime already shown to regress."}}
{"event_id": "evt_1774145531890451905", "ts": 1774145531, "event": "proxy_mode_selected", "round": 28, "session_id": "019d130c-782e-75a2-aa6f-506b18d29edf", "tier": "proxy", "run_name": null, "family_name": "lowrank_gated_residual", "family_stage": "stabilize", "status": null, "decision": null, "payload": {"tier": "proxy", "proxy_mode": "extended", "evaluation_basis": "curve_extended", "parameter_behavior": "dynamic", "proxy_max_tokens": "20000000"}}
{"event_id": "evt_1774145531890807948", "ts": 1774145531, "event": "training_started", "round": 28, "session_id": "019d130c-782e-75a2-aa6f-506b18d29edf", "tier": "proxy", "run_name": "round0028_proxy_1774145531", "family_name": "lowrank_gated_residual", "family_stage": "stabilize", "status": null, "decision": null, "payload": {"tier": "proxy", "run_name": "round0028_proxy_1774145531", "family_name": "lowrank_gated_residual", "family_stage": "stabilize", "checkpoint_dir": "/root/sparsify-ascend/checkpoints/research_agent/round_0028_proxy", "log_path": "/root/sparsify-ascend/research/history/logs/round0028_proxy_1774145531.log", "config": {"architecture": "lowrank_gated_residual", "expansion_factor": 32, "k": 128, "optimizer": "signum", "lr": "3.2e-3", "hookpoints": "layers.[3].self_attn.o_proj", "batch_size": 1, "grad_acc_steps": 8, "micro_acc_steps": 1, "auxk_alpha": 0.0, "dead_feature_threshold": 10000000, "use_hadamard": false, "tier": "proxy", "family_name": "lowrank_gated_residual", "family_stage": "stabilize"}, "baseline_tokens_per_sec": 66557.55177513757, "proxy_mode": "extended", "evaluation_basis": "curve_extended"}}
{"event_id": "evt_1774145561892048234", "ts": 1774145561, "event": "training_heartbeat", "round": 28, "session_id": "019d130c-782e-75a2-aa6f-506b18d29edf", "tier": "proxy", "run_name": "round0028_proxy_1774145531", "family_name": "lowrank_gated_residual", "family_stage": "stabilize", "status": null, "decision": null, "payload": {"tier": "proxy", "run_name": "round0028_proxy_1774145531", "family_name": "lowrank_gated_residual", "family_stage": "stabilize", "checkpoint_dir": "/root/sparsify-ascend/checkpoints/research_agent/round_0028_proxy/round0028_proxy_1774145531_dp2_bs1_ga8_ef32_k128_20260322_101222", "metrics_path": "/root/sparsify-ascend/checkpoints/research_agent/round_0028_proxy/round0028_proxy_1774145531_dp2_bs1_ga8_ef32_k128_20260322_101222/metrics.jsonl", "latest_step": 20, "latest_tokens_per_sec": 21844.66842301639, "baseline_ratio": 0.32820721075826015, "latest_total_tokens": 655360.0, "proxy_mode": "extended", "evaluation_basis": "curve_extended"}}
{"event_id": "evt_1774145591893193317", "ts": 1774145591, "event": "training_heartbeat", "round": 28, "session_id": "019d130c-782e-75a2-aa6f-506b18d29edf", "tier": "proxy", "run_name": "round0028_proxy_1774145531", "family_name": "lowrank_gated_residual", "family_stage": "stabilize", "status": null, "decision": null, "payload": {"tier": "proxy", "run_name": "round0028_proxy_1774145531", "family_name": "lowrank_gated_residual", "family_stage": "stabilize", "checkpoint_dir": "/root/sparsify-ascend/checkpoints/research_agent/round_0028_proxy/round0028_proxy_1774145531_dp2_bs1_ga8_ef32_k128_20260322_101222", "metrics_path": "/root/sparsify-ascend/checkpoints/research_agent/round_0028_proxy/round0028_proxy_1774145531_dp2_bs1_ga8_ef32_k128_20260322_101222/metrics.jsonl", "latest_step": 100, "latest_tokens_per_sec": 54611.472285642936, "baseline_ratio": 0.8205150404291603, "latest_total_tokens": 3276800.0, "proxy_mode": "extended", "evaluation_basis": "curve_extended"}}
{"event_id": "evt_1774145621894707743", "ts": 1774145621, "event": "training_heartbeat", "round": 28, "session_id": "019d130c-782e-75a2-aa6f-506b18d29edf", "tier": "proxy", "run_name": "round0028_proxy_1774145531", "family_name": "lowrank_gated_residual", "family_stage": "stabilize", "status": null, "decision": null, "payload": {"tier": "proxy", "run_name": "round0028_proxy_1774145531", "family_name": "lowrank_gated_residual", "family_stage": "stabilize", "checkpoint_dir": "/root/sparsify-ascend/checkpoints/research_agent/round_0028_proxy/round0028_proxy_1774145531_dp2_bs1_ga8_ef32_k128_20260322_101222", "metrics_path": "/root/sparsify-ascend/checkpoints/research_agent/round_0028_proxy/round0028_proxy_1774145531_dp2_bs1_ga8_ef32_k128_20260322_101222/metrics.jsonl", "latest_step": 170, "latest_tokens_per_sec": 61892.66106342138, "baseline_ratio": 0.9299119245329761, "latest_total_tokens": 5570560.0, "proxy_mode": "extended", "evaluation_basis": "curve_extended"}}
{"event_id": "evt_1774145651896635753", "ts": 1774145651, "event": "training_heartbeat", "round": 28, "session_id": "019d130c-782e-75a2-aa6f-506b18d29edf", "tier": "proxy", "run_name": "round0028_proxy_1774145531", "family_name": "lowrank_gated_residual", "family_stage": "stabilize", "status": null, "decision": null, "payload": {"tier": "proxy", "run_name": "round0028_proxy_1774145531", "family_name": "lowrank_gated_residual", "family_stage": "stabilize", "checkpoint_dir": "/root/sparsify-ascend/checkpoints/research_agent/round_0028_proxy/round0028_proxy_1774145531_dp2_bs1_ga8_ef32_k128_20260322_101222", "metrics_path": "/root/sparsify-ascend/checkpoints/research_agent/round_0028_proxy/round0028_proxy_1774145531_dp2_bs1_ga8_ef32_k128_20260322_101222/metrics.jsonl", "latest_step": 240, "latest_tokens_per_sec": 65533.005475376194, "baseline_ratio": 0.9846066107836602, "latest_total_tokens": 7864320.0, "proxy_mode": "extended", "evaluation_basis": "curve_extended"}}
{"event_id": "evt_1774145681899048717", "ts": 1774145681, "event": "training_heartbeat", "round": 28, "session_id": "019d130c-782e-75a2-aa6f-506b18d29edf", "tier": "proxy", "run_name": "round0028_proxy_1774145531", "family_name": "lowrank_gated_residual", "family_stage": "stabilize", "status": null, "decision": null, "payload": {"tier": "proxy", "run_name": "round0028_proxy_1774145531", "family_name": "lowrank_gated_residual", "family_stage": "stabilize", "checkpoint_dir": "/root/sparsify-ascend/checkpoints/research_agent/round_0028_proxy/round0028_proxy_1774145531_dp2_bs1_ga8_ef32_k128_20260322_101222", "metrics_path": "/root/sparsify-ascend/checkpoints/research_agent/round_0028_proxy/round0028_proxy_1774145531_dp2_bs1_ga8_ef32_k128_20260322_101222/metrics.jsonl", "latest_step": 320, "latest_tokens_per_sec": 69901.39697043016, "baseline_ratio": 1.0502399067590353, "latest_total_tokens": 10485760.0, "proxy_mode": "extended", "evaluation_basis": "curve_extended"}}
{"event_id": "evt_1774145711901851155", "ts": 1774145711, "event": "training_heartbeat", "round": 28, "session_id": "019d130c-782e-75a2-aa6f-506b18d29edf", "tier": "proxy", "run_name": "round0028_proxy_1774145531", "family_name": "lowrank_gated_residual", "family_stage": "stabilize", "status": null, "decision": null, "payload": {"tier": "proxy", "run_name": "round0028_proxy_1774145531", "family_name": "lowrank_gated_residual", "family_stage": "stabilize", "checkpoint_dir": "/root/sparsify-ascend/checkpoints/research_agent/round_0028_proxy/round0028_proxy_1774145531_dp2_bs1_ga8_ef32_k128_20260322_101222", "metrics_path": "/root/sparsify-ascend/checkpoints/research_agent/round_0028_proxy/round0028_proxy_1774145531_dp2_bs1_ga8_ef32_k128_20260322_101222/metrics.jsonl", "latest_step": 390, "latest_tokens_per_sec": 70993.12033826706, "baseline_ratio": 1.066642603954468, "latest_total_tokens": 12779520.0, "proxy_mode": "extended", "evaluation_basis": "curve_extended"}}
{"event_id": "evt_1774145741905016167", "ts": 1774145741, "event": "training_heartbeat", "round": 28, "session_id": "019d130c-782e-75a2-aa6f-506b18d29edf", "tier": "proxy", "run_name": "round0028_proxy_1774145531", "family_name": "lowrank_gated_residual", "family_stage": "stabilize", "status": null, "decision": null, "payload": {"tier": "proxy", "run_name": "round0028_proxy_1774145531", "family_name": "lowrank_gated_residual", "family_stage": "stabilize", "checkpoint_dir": "/root/sparsify-ascend/checkpoints/research_agent/round_0028_proxy/round0028_proxy_1774145531_dp2_bs1_ga8_ef32_k128_20260322_101222", "metrics_path": "/root/sparsify-ascend/checkpoints/research_agent/round_0028_proxy/round0028_proxy_1774145531_dp2_bs1_ga8_ef32_k128_20260322_101222/metrics.jsonl", "latest_step": 460, "latest_tokens_per_sec": 71772.78933583443, "baseline_ratio": 1.0783568118358133, "latest_total_tokens": 15073280.0, "proxy_mode": "extended", "evaluation_basis": "curve_extended"}}
{"event_id": "evt_1774145771908603070", "ts": 1774145771, "event": "training_heartbeat", "round": 28, "session_id": "019d130c-782e-75a2-aa6f-506b18d29edf", "tier": "proxy", "run_name": "round0028_proxy_1774145531", "family_name": "lowrank_gated_residual", "family_stage": "stabilize", "status": null, "decision": null, "payload": {"tier": "proxy", "run_name": "round0028_proxy_1774145531", "family_name": "lowrank_gated_residual", "family_stage": "stabilize", "checkpoint_dir": "/root/sparsify-ascend/checkpoints/research_agent/round_0028_proxy/round0028_proxy_1774145531_dp2_bs1_ga8_ef32_k128_20260322_101222", "metrics_path": "/root/sparsify-ascend/checkpoints/research_agent/round_0028_proxy/round0028_proxy_1774145531_dp2_bs1_ga8_ef32_k128_20260322_101222/metrics.jsonl", "latest_step": 540, "latest_tokens_per_sec": 73722.63481428105, "baseline_ratio": 1.107652442856529, "latest_total_tokens": 17694720.0, "proxy_mode": "extended", "evaluation_basis": "curve_extended"}}
{"event_id": "evt_1774145801912581714", "ts": 1774145801, "event": "training_heartbeat", "round": 28, "session_id": "019d130c-782e-75a2-aa6f-506b18d29edf", "tier": "proxy", "run_name": "round0028_proxy_1774145531", "family_name": "lowrank_gated_residual", "family_stage": "stabilize", "status": null, "decision": null, "payload": {"tier": "proxy", "run_name": "round0028_proxy_1774145531", "family_name": "lowrank_gated_residual", "family_stage": "stabilize", "checkpoint_dir": "/root/sparsify-ascend/checkpoints/research_agent/round_0028_proxy/round0028_proxy_1774145531_dp2_bs1_ga8_ef32_k128_20260322_101222", "metrics_path": "/root/sparsify-ascend/checkpoints/research_agent/round_0028_proxy/round0028_proxy_1774145531_dp2_bs1_ga8_ef32_k128_20260322_101222/metrics.jsonl", "latest_step": 610, "latest_tokens_per_sec": 74025.53059665512, "baseline_ratio": 1.1122033281324388, "latest_total_tokens": 19988480.0, "proxy_mode": "extended", "evaluation_basis": "curve_extended"}}
{"event_id": "evt_1774145831916645663", "ts": 1774145831, "event": "training_heartbeat", "round": 28, "session_id": "019d130c-782e-75a2-aa6f-506b18d29edf", "tier": "proxy", "run_name": "round0028_proxy_1774145531", "family_name": "lowrank_gated_residual", "family_stage": "stabilize", "status": null, "decision": null, "payload": {"tier": "proxy", "run_name": "round0028_proxy_1774145531", "family_name": "lowrank_gated_residual", "family_stage": "stabilize", "checkpoint_dir": "/root/sparsify-ascend/checkpoints/research_agent/round_0028_proxy/round0028_proxy_1774145531_dp2_bs1_ga8_ef32_k128_20260322_101222", "metrics_path": "/root/sparsify-ascend/checkpoints/research_agent/round_0028_proxy/round0028_proxy_1774145531_dp2_bs1_ga8_ef32_k128_20260322_101222/metrics.jsonl", "latest_step": 610, "latest_tokens_per_sec": 66622.61543248847, "baseline_ratio": 1.00097755484713, "latest_total_tokens": 19988480.0, "proxy_mode": "extended", "evaluation_basis": "curve_extended"}}
{"event_id": "evt_1774145831985898653", "ts": 1774145831, "event": "training_finished", "round": 28, "session_id": "019d130c-782e-75a2-aa6f-506b18d29edf", "tier": "proxy", "run_name": "round0028_proxy_1774145531", "family_name": "lowrank_gated_residual", "family_stage": "stabilize", "status": "ok", "decision": "discard", "payload": {"tier": "proxy", "run_name": "round0028_proxy_1774145531", "family_name": "lowrank_gated_residual", "family_stage": "stabilize", "checkpoint_dir": "/root/sparsify-ascend/checkpoints/research_agent/round_0028_proxy/round0028_proxy_1774145531_dp2_bs1_ga8_ef32_k128_20260322_101222", "metrics_path": "/root/sparsify-ascend/checkpoints/research_agent/round_0028_proxy/round0028_proxy_1774145531_dp2_bs1_ga8_ef32_k128_20260322_101222/metrics.jsonl", "run_health": "normal", "termination_reason": "completed", "tokens_per_sec": 66622.61543248847, "baseline_ratio": 1.00097755484713, "status": "ok", "decision": "discard", "proxy_mode": "extended", "evaluation_basis": "curve_extended", "curve_start_fvu": 0.12026208639144897, "curve_mid_fvu": 0.09098601341247559, "curve_end_fvu": 0.08091910928487778, "curve_late_slope": -3.080726930390677e-12, "curve_still_improving": false}}
{"event_id": "evt_1774145831985977228", "ts": 1774145831, "event": "result_recorded", "round": 28, "session_id": "019d130c-782e-75a2-aa6f-506b18d29edf", "tier": "proxy", "run_name": "round0028_proxy_1774145531", "family_name": "lowrank_gated_residual", "family_stage": "stabilize", "status": "ok", "decision": "discard", "payload": {"tier": "proxy", "run_name": "round0028_proxy_1774145531", "family_name": "lowrank_gated_residual", "family_stage": "stabilize", "status": "ok", "decision": "discard", "val_fvu": "0.0762509610503912", "observed_fvu": "0.080919", "k": "128", "log_path": "/root/sparsify-ascend/research/history/logs/proxy_1774145831.log", "checkpoint": null}}
{"event_id": "evt_1774145831986335186", "ts": 1774145831, "event": "round_finished", "round": 28, "session_id": "019d130c-782e-75a2-aa6f-506b18d29edf", "tier": "proxy", "run_name": null, "family_name": "lowrank_gated_residual", "family_stage": "stabilize", "status": "ok", "decision": "discard", "payload": {"tier": "proxy", "family_name": "lowrank_gated_residual", "family_stage": "stabilize", "status": "ok", "decision": "discard", "val_fvu": "0.0762509610503912"}}
{"event_id": "evt_1774145831992912861", "ts": 1774145831, "event": "experiment_commit_prepared", "round": 28, "tier": "proxy", "run_name": null, "family_name": "lowrank_gated_residual", "family_stage": "stabilize", "status": "ok", "decision": "discard", "payload": {"branch": "autoresearch-sae"}}
{"event_id": "evt_1774145840166780180", "ts": 1774145840, "event": "round_started", "round": 29, "session_id": "019d130c-782e-75a2-aa6f-506b18d29edf", "tier": null, "run_name": null, "family_name": null, "family_stage": null, "status": "started", "decision": null, "payload": {"status": "started"}}
{"event_id": "evt_1774145840246463769", "ts": 1774145840, "event": "agent_deciding", "round": 29, "session_id": "019d130c-782e-75a2-aa6f-506b18d29edf", "tier": null, "run_name": null, "family_name": null, "family_stage": null, "status": null, "decision": null, "payload": {}}
{"event_id": "evt_1774145963739548385", "ts": 1774145963, "event": "session_resumed", "round": 29, "tier": null, "run_name": null, "family_name": null, "family_stage": null, "status": "active", "decision": null, "payload": {"session_id": "019d130c-782e-75a2-aa6f-506b18d29edf"}}
{"event_id": "evt_1774145963740175314", "ts": 1774145963, "event": "agent_action_received", "round": 29, "session_id": "019d130c-782e-75a2-aa6f-506b18d29edf", "tier": "proxy", "run_name": null, "family_name": "lowrank_gated_residual", "family_stage": "stabilize", "status": null, "decision": null, "payload": {"session_id": "019d130c-782e-75a2-aa6f-506b18d29edf", "tier": "proxy", "family_name": "lowrank_gated_residual", "family_stage": "stabilize", "change_type": "param_only", "expected_win": "lower_fvu", "hypothesis": "`lowrank_gated_residual` remains the best full-signal family, and the exploitation sweep has now shown that moving LR to `1.2e-3` or `3.2e-3`, adding small aux pressure, or increasing EF to 48 all regress the K=128 anchor. The next clean single-variable sweep point is the remaining untested family-specific routing regularization axis from the runtime guidance: increase `AUXK_ALPHA` from `0` to `0.0625` at K=128 while keeping the winning `LR=1.6e-3`, `EXPANSION_FACTOR=32`, and signum recipe fixed, to test whether only a stronger utilization pressure helps where the weak aux setting failed."}}
{"event_id": "evt_1774145963740319522", "ts": 1774145963, "event": "proxy_mode_selected", "round": 29, "session_id": "019d130c-782e-75a2-aa6f-506b18d29edf", "tier": "proxy", "run_name": null, "family_name": "lowrank_gated_residual", "family_stage": "stabilize", "status": null, "decision": null, "payload": {"tier": "proxy", "proxy_mode": "extended", "evaluation_basis": "curve_extended", "parameter_behavior": "dynamic", "proxy_max_tokens": "20000000"}}
