{"event_id": "evt_1774173411912632458", "ts": 1774173411, "event": "proxy_mode_selected", "round": 88, "session_id": "019d14ea-730e-75e1-9200-ca4cb6c1e330", "tier": "proxy", "run_name": null, "family_name": "residual_vq", "family_stage": "prototype", "status": null, "decision": null, "payload": {"tier": "proxy", "proxy_mode": "fast", "evaluation_basis": "terminal_only", "parameter_behavior": "structural", "proxy_max_tokens": "40000000"}}
{"event_id": "evt_1774173411912680905", "ts": 1774173411, "event": "sanity_started", "round": 88, "session_id": "019d14ea-730e-75e1-9200-ca4cb6c1e330", "tier": "proxy", "run_name": null, "family_name": "residual_vq", "family_stage": "prototype", "status": null, "decision": null, "payload": {"tier": "proxy"}}
{"event_id": "evt_1774173416537188878", "ts": 1774173416, "event": "sanity_finished", "round": 88, "session_id": "019d14ea-730e-75e1-9200-ca4cb6c1e330", "tier": "proxy", "run_name": null, "family_name": "residual_vq", "family_stage": "prototype", "status": "ok", "decision": null, "payload": {"tier": "proxy", "status": "ok"}}
{"event_id": "evt_1774173416537575812", "ts": 1774173416, "event": "training_started", "round": 88, "session_id": "019d14ea-730e-75e1-9200-ca4cb6c1e330", "tier": "proxy", "run_name": "round0088_proxy_1774173416", "family_name": "residual_vq", "family_stage": "prototype", "status": null, "decision": null, "payload": {"tier": "proxy", "run_name": "round0088_proxy_1774173416", "family_name": "residual_vq", "family_stage": "prototype", "checkpoint_dir": "/root/sparsify-ascend/checkpoints/research_agent/round_0088_proxy", "log_path": "/root/sparsify-ascend/research/history/logs/round0088_proxy_1774173416.log", "config": {"architecture": "residual_vq", "expansion_factor": 12, "k": 32, "optimizer": "signum", "lr": "1.6e-3", "hookpoints": "layers.[3].self_attn.o_proj", "batch_size": 1, "grad_acc_steps": 8, "micro_acc_steps": 1, "auxk_alpha": 0.0, "dead_feature_threshold": 10000000, "use_hadamard": false, "tier": "proxy", "family_name": "residual_vq", "family_stage": "prototype"}, "baseline_tokens_per_sec": null, "proxy_mode": "fast", "evaluation_basis": "terminal_only"}}
{"event_id": "evt_1774173446539398137", "ts": 1774173446, "event": "training_heartbeat", "round": 88, "session_id": "019d14ea-730e-75e1-9200-ca4cb6c1e330", "tier": "proxy", "run_name": "round0088_proxy_1774173416", "family_name": "residual_vq", "family_stage": "prototype", "status": null, "decision": null, "payload": {"tier": "proxy", "run_name": "round0088_proxy_1774173416", "family_name": "residual_vq", "family_stage": "prototype", "checkpoint_dir": "/root/sparsify-ascend/checkpoints/research_agent/round_0088_proxy/round0088_proxy_1774173416_dp2_bs1_ga8_ef12_k32_20260322_175703", "metrics_path": "/root/sparsify-ascend/checkpoints/research_agent/round_0088_proxy/round0088_proxy_1774173416_dp2_bs1_ga8_ef12_k32_20260322_175703/metrics.jsonl", "latest_step": 130, "latest_tokens_per_sec": 141987.5655461154, "baseline_ratio": null, "latest_total_tokens": 4259840.0, "proxy_mode": "fast", "evaluation_basis": "terminal_only"}}
{"event_id": "evt_1774173476542015791", "ts": 1774173476, "event": "training_heartbeat", "round": 88, "session_id": "019d14ea-730e-75e1-9200-ca4cb6c1e330", "tier": "proxy", "run_name": "round0088_proxy_1774173416", "family_name": "residual_vq", "family_stage": "prototype", "status": null, "decision": null, "payload": {"tier": "proxy", "run_name": "round0088_proxy_1774173416", "family_name": "residual_vq", "family_stage": "prototype", "checkpoint_dir": "/root/sparsify-ascend/checkpoints/research_agent/round_0088_proxy/round0088_proxy_1774173416_dp2_bs1_ga8_ef12_k32_20260322_175703", "metrics_path": "/root/sparsify-ascend/checkpoints/research_agent/round_0088_proxy/round0088_proxy_1774173416_dp2_bs1_ga8_ef12_k32_20260322_175703/metrics.jsonl", "latest_step": 370, "latest_tokens_per_sec": 202055.476948495, "baseline_ratio": null, "latest_total_tokens": 12124160.0, "proxy_mode": "fast", "evaluation_basis": "terminal_only"}}
{"event_id": "evt_1774173506546007602", "ts": 1774173506, "event": "training_heartbeat", "round": 88, "session_id": "019d14ea-730e-75e1-9200-ca4cb6c1e330", "tier": "proxy", "run_name": "round0088_proxy_1774173416", "family_name": "residual_vq", "family_stage": "prototype", "status": null, "decision": null, "payload": {"tier": "proxy", "run_name": "round0088_proxy_1774173416", "family_name": "residual_vq", "family_stage": "prototype", "checkpoint_dir": "/root/sparsify-ascend/checkpoints/research_agent/round_0088_proxy/round0088_proxy_1774173416_dp2_bs1_ga8_ef12_k32_20260322_175703", "metrics_path": "/root/sparsify-ascend/checkpoints/research_agent/round_0088_proxy/round0088_proxy_1774173416_dp2_bs1_ga8_ef12_k32_20260322_175703/metrics.jsonl", "latest_step": 620, "latest_tokens_per_sec": 225714.78294575002, "baseline_ratio": null, "latest_total_tokens": 20316160.0, "proxy_mode": "fast", "evaluation_basis": "terminal_only"}}
{"event_id": "evt_1774173536551362647", "ts": 1774173536, "event": "training_heartbeat", "round": 88, "session_id": "019d14ea-730e-75e1-9200-ca4cb6c1e330", "tier": "proxy", "run_name": "round0088_proxy_1774173416", "family_name": "residual_vq", "family_stage": "prototype", "status": null, "decision": null, "payload": {"tier": "proxy", "run_name": "round0088_proxy_1774173416", "family_name": "residual_vq", "family_stage": "prototype", "checkpoint_dir": "/root/sparsify-ascend/checkpoints/research_agent/round_0088_proxy/round0088_proxy_1774173416_dp2_bs1_ga8_ef12_k32_20260322_175703", "metrics_path": "/root/sparsify-ascend/checkpoints/research_agent/round_0088_proxy/round0088_proxy_1774173416_dp2_bs1_ga8_ef12_k32_20260322_175703/metrics.jsonl", "latest_step": 860, "latest_tokens_per_sec": 234811.00345156033, "baseline_ratio": null, "latest_total_tokens": 28180480.0, "proxy_mode": "fast", "evaluation_basis": "terminal_only"}}
{"event_id": "evt_1774173566657827494", "ts": 1774173566, "event": "training_heartbeat", "round": 88, "session_id": "019d14ea-730e-75e1-9200-ca4cb6c1e330", "tier": "proxy", "run_name": "round0088_proxy_1774173416", "family_name": "residual_vq", "family_stage": "prototype", "status": null, "decision": null, "payload": {"tier": "proxy", "run_name": "round0088_proxy_1774173416", "family_name": "residual_vq", "family_stage": "prototype", "checkpoint_dir": "/root/sparsify-ascend/checkpoints/research_agent/round_0088_proxy/round0088_proxy_1774173416_dp2_bs1_ga8_ef12_k32_20260322_175703", "metrics_path": "/root/sparsify-ascend/checkpoints/research_agent/round_0088_proxy/round0088_proxy_1774173416_dp2_bs1_ga8_ef12_k32_20260322_175703/metrics.jsonl", "latest_step": 1070, "latest_tokens_per_sec": 233713.88738525723, "baseline_ratio": null, "latest_total_tokens": 35061760.0, "proxy_mode": "fast", "evaluation_basis": "terminal_only"}}
{"event_id": "evt_1774173596665308812", "ts": 1774173596, "event": "training_heartbeat", "round": 88, "session_id": "019d14ea-730e-75e1-9200-ca4cb6c1e330", "tier": "proxy", "run_name": "round0088_proxy_1774173416", "family_name": "residual_vq", "family_stage": "prototype", "status": null, "decision": null, "payload": {"tier": "proxy", "run_name": "round0088_proxy_1774173416", "family_name": "residual_vq", "family_stage": "prototype", "checkpoint_dir": "/root/sparsify-ascend/checkpoints/research_agent/round_0088_proxy/round0088_proxy_1774173416_dp2_bs1_ga8_ef12_k32_20260322_175703", "metrics_path": "/root/sparsify-ascend/checkpoints/research_agent/round_0088_proxy/round0088_proxy_1774173416_dp2_bs1_ga8_ef12_k32_20260322_175703/metrics.jsonl", "latest_step": 1220, "latest_tokens_per_sec": 221937.1592375545, "baseline_ratio": null, "latest_total_tokens": 39976960.0, "proxy_mode": "fast", "evaluation_basis": "terminal_only"}}
{"event_id": "evt_1774173626672781321", "ts": 1774173626, "event": "training_heartbeat", "round": 88, "session_id": "019d14ea-730e-75e1-9200-ca4cb6c1e330", "tier": "proxy", "run_name": "round0088_proxy_1774173416", "family_name": "residual_vq", "family_stage": "prototype", "status": null, "decision": null, "payload": {"tier": "proxy", "run_name": "round0088_proxy_1774173416", "family_name": "residual_vq", "family_stage": "prototype", "checkpoint_dir": "/root/sparsify-ascend/checkpoints/research_agent/round_0088_proxy/round0088_proxy_1774173416_dp2_bs1_ga8_ef12_k32_20260322_175703", "metrics_path": "/root/sparsify-ascend/checkpoints/research_agent/round_0088_proxy/round0088_proxy_1774173416_dp2_bs1_ga8_ef12_k32_20260322_175703/metrics.jsonl", "latest_step": 1220, "latest_tokens_per_sec": 190244.30480258656, "baseline_ratio": null, "latest_total_tokens": 39976960.0, "proxy_mode": "fast", "evaluation_basis": "terminal_only"}}
{"event_id": "evt_1774173626751622315", "ts": 1774173626, "event": "training_finished", "round": 88, "session_id": "019d14ea-730e-75e1-9200-ca4cb6c1e330", "tier": "proxy", "run_name": "round0088_proxy_1774173416", "family_name": "residual_vq", "family_stage": "prototype", "status": "ok", "decision": "incubate", "payload": {"tier": "proxy", "run_name": "round0088_proxy_1774173416", "family_name": "residual_vq", "family_stage": "prototype", "checkpoint_dir": "/root/sparsify-ascend/checkpoints/research_agent/round_0088_proxy/round0088_proxy_1774173416_dp2_bs1_ga8_ef12_k32_20260322_175703", "metrics_path": "/root/sparsify-ascend/checkpoints/research_agent/round_0088_proxy/round0088_proxy_1774173416_dp2_bs1_ga8_ef12_k32_20260322_175703/metrics.jsonl", "run_health": "normal", "termination_reason": "completed", "tokens_per_sec": 190244.30480258656, "baseline_ratio": null, "status": "ok", "decision": "incubate", "proxy_mode": "fast", "evaluation_basis": "terminal_only", "curve_start_fvu": 0.31422287225723267, "curve_mid_fvu": 0.28599703311920166, "curve_end_fvu": 0.25217628479003906, "curve_late_slope": -2.9443959110572965e-09, "curve_still_improving": true}}
{"event_id": "evt_1774173626751682311", "ts": 1774173626, "event": "result_recorded", "round": 88, "session_id": "019d14ea-730e-75e1-9200-ca4cb6c1e330", "tier": "proxy", "run_name": "round0088_proxy_1774173416", "family_name": "residual_vq", "family_stage": "prototype", "status": "ok", "decision": "incubate", "payload": {"tier": "proxy", "run_name": "round0088_proxy_1774173416", "family_name": "residual_vq", "family_stage": "prototype", "status": "ok", "decision": "incubate", "val_fvu": "0.26075503416359425", "observed_fvu": "0.252176", "k": "32", "log_path": "/root/sparsify-ascend/research/history/logs/proxy_1774173626.log", "checkpoint": null}}
{"event_id": "evt_1774173626752135355", "ts": 1774173626, "event": "round_finished", "round": 88, "session_id": "019d14ea-730e-75e1-9200-ca4cb6c1e330", "tier": "proxy", "run_name": null, "family_name": "residual_vq", "family_stage": "prototype", "status": "ok", "decision": "incubate", "payload": {"tier": "proxy", "family_name": "residual_vq", "family_stage": "prototype", "status": "ok", "decision": "incubate", "val_fvu": "0.26075503416359425"}}
{"event_id": "evt_1774173626760822534", "ts": 1774173626, "event": "experiment_commit_prepared", "round": 88, "tier": "proxy", "run_name": null, "family_name": "residual_vq", "family_stage": "prototype", "status": "ok", "decision": "incubate", "payload": {"branch": "autoresearch-sae"}}
{"event_id": "evt_1774173634237871267", "ts": 1774173634, "event": "round_started", "round": 89, "session_id": "019d14ea-730e-75e1-9200-ca4cb6c1e330", "tier": null, "run_name": null, "family_name": null, "family_stage": null, "status": "started", "decision": null, "payload": {"status": "started"}}
{"event_id": "evt_1774173634238039082", "ts": 1774173634, "event": "agent_deciding", "round": 89, "session_id": "019d14ea-730e-75e1-9200-ca4cb6c1e330", "tier": null, "run_name": null, "family_name": null, "family_stage": null, "status": null, "decision": null, "payload": {}}
{"event_id": "evt_1774173763637100896", "ts": 1774173763, "event": "session_resumed", "round": 89, "tier": null, "run_name": null, "family_name": null, "family_stage": null, "status": "active", "decision": null, "payload": {"session_id": "019d14ea-730e-75e1-9200-ca4cb6c1e330"}}
{"event_id": "evt_1774173763638305730", "ts": 1774173763, "event": "agent_action_received", "round": 89, "session_id": "019d14ea-730e-75e1-9200-ca4cb6c1e330", "tier": "proxy", "run_name": null, "family_name": "two_code_residual_vq", "family_stage": "prototype", "status": null, "decision": null, "payload": {"session_id": "019d14ea-730e-75e1-9200-ca4cb6c1e330", "tier": "proxy", "family_name": "two_code_residual_vq", "family_stage": "prototype", "change_type": "edit_sae_code", "expected_win": "lower_fvu", "hypothesis": "Single-code `residual_vq` is likely too coarse at `K=32, EF=12`, leaving too much residual burden for the sparse correction. A new `two_code_residual_vq` family that composes two hard codebook selections before the same sparse residual stage may recover a better low-K tradeoff by moving more structure into the discrete trunk without raising K or EF."}}
{"event_id": "evt_1774173894879324973", "ts": 1774173894, "event": "variable_isolation_warning", "round": 89, "session_id": "019d14ea-730e-75e1-9200-ca4cb6c1e330", "tier": null, "run_name": null, "family_name": "two_code_residual_vq", "family_stage": "prototype", "status": null, "decision": null, "payload": {"violation": "Multiple primary variables changed simultaneously: code_edit, architecture, k, lr"}}
{"event_id": "evt_1774173894879490894", "ts": 1774173894, "event": "incubation_limit_blocked", "round": 89, "session_id": "019d14ea-730e-75e1-9200-ca4cb6c1e330", "tier": null, "run_name": null, "family_name": "two_code_residual_vq", "family_stage": "prototype", "status": null, "decision": null, "payload": {"reason": "Cannot create new incubating family 'two_code_residual_vq': already 5 incubating families (limit: 5). Stale families that could be archived: []"}}
{"event_id": "evt_1774173894879542504", "ts": 1774173894, "event": "round_finished", "round": 89, "session_id": "019d14ea-730e-75e1-9200-ca4cb6c1e330", "tier": "proxy", "run_name": null, "family_name": "two_code_residual_vq", "family_stage": "prototype", "status": "policy_reject", "decision": "policy_reject", "payload": {"tier": "proxy", "family_name": "two_code_residual_vq", "family_stage": "prototype", "status": "policy_reject", "decision": "policy_reject", "val_fvu": null}}
{"event_id": "evt_1774173902343562311", "ts": 1774173902, "event": "round_started", "round": 90, "session_id": "019d14ea-730e-75e1-9200-ca4cb6c1e330", "tier": null, "run_name": null, "family_name": null, "family_stage": null, "status": "started", "decision": null, "payload": {"status": "started"}}
{"event_id": "evt_1774173902343733257", "ts": 1774173902, "event": "agent_deciding", "round": 90, "session_id": "019d14ea-730e-75e1-9200-ca4cb6c1e330", "tier": null, "run_name": null, "family_name": null, "family_stage": null, "status": null, "decision": null, "payload": {}}
{"event_id": "evt_1774174040999883741", "ts": 1774174040, "event": "session_resumed", "round": 90, "tier": null, "run_name": null, "family_name": null, "family_stage": null, "status": "active", "decision": null, "payload": {"session_id": "019d14ea-730e-75e1-9200-ca4cb6c1e330"}}
{"event_id": "evt_1774174041001172148", "ts": 1774174041, "event": "agent_action_received", "round": 90, "session_id": "019d14ea-730e-75e1-9200-ca4cb6c1e330", "tier": "proxy", "run_name": null, "family_name": "lowrank_residual", "family_stage": "mainline_comparison", "status": null, "decision": null, "payload": {"session_id": "019d14ea-730e-75e1-9200-ca4cb6c1e330", "tier": "proxy", "family_name": "lowrank_residual", "family_stage": "mainline_comparison", "change_type": "param_only", "expected_win": "lower_fvu", "hypothesis": "With incubation slots saturated and recent fresh-family probes weak or blocked, the least-bad informative move is to return to the strongest existing alternative architecture at the active low-K target. `lowrank_residual` is the closest non-gated same-`(K=32, EF=12)` competitor seen so far, so rerunning that exact architecture point is the best available architecture-level comparison against the weak discrete branch and the slightly better gated local baseline."}}
{"event_id": "evt_1774174041001284335", "ts": 1774174041, "event": "variable_isolation_warning", "round": 90, "session_id": "019d14ea-730e-75e1-9200-ca4cb6c1e330", "tier": null, "run_name": null, "family_name": "lowrank_residual", "family_stage": "mainline_comparison", "status": null, "decision": null, "payload": {"violation": "Multiple primary variables changed simultaneously: architecture, k, lr"}}
{"event_id": "evt_1774174041001345533", "ts": 1774174041, "event": "proxy_mode_selected", "round": 90, "session_id": "019d14ea-730e-75e1-9200-ca4cb6c1e330", "tier": "proxy", "run_name": null, "family_name": "lowrank_residual", "family_stage": "mainline_comparison", "status": null, "decision": null, "payload": {"tier": "proxy", "proxy_mode": "fast", "evaluation_basis": "terminal_only", "parameter_behavior": "structural", "proxy_max_tokens": "5000000"}}
{"event_id": "evt_1774174041001642169", "ts": 1774174041, "event": "training_started", "round": 90, "session_id": "019d14ea-730e-75e1-9200-ca4cb6c1e330", "tier": "proxy", "run_name": "round0090_proxy_1774174041", "family_name": "lowrank_residual", "family_stage": "mainline_comparison", "status": null, "decision": null, "payload": {"tier": "proxy", "run_name": "round0090_proxy_1774174041", "family_name": "lowrank_residual", "family_stage": "mainline_comparison", "checkpoint_dir": "/root/sparsify-ascend/checkpoints/research_agent/round_0090_proxy", "log_path": "/root/sparsify-ascend/research/history/logs/round0090_proxy_1774174041.log", "config": {"architecture": "lowrank_residual", "expansion_factor": 12, "k": 32, "optimizer": "signum", "lr": "1.6e-3", "hookpoints": "layers.[3].self_attn.o_proj", "batch_size": 1, "grad_acc_steps": 8, "micro_acc_steps": 1, "auxk_alpha": 0.0, "dead_feature_threshold": 10000000, "use_hadamard": false, "tier": "proxy", "family_name": "lowrank_residual", "family_stage": "mainline_comparison"}, "baseline_tokens_per_sec": 83008.52258207071, "proxy_mode": "fast", "evaluation_basis": "terminal_only"}}
{"event_id": "evt_1774174071003413024", "ts": 1774174071, "event": "training_heartbeat", "round": 90, "session_id": "019d14ea-730e-75e1-9200-ca4cb6c1e330", "tier": "proxy", "run_name": "round0090_proxy_1774174041", "family_name": "lowrank_residual", "family_stage": "mainline_comparison", "status": null, "decision": null, "payload": {"tier": "proxy", "run_name": "round0090_proxy_1774174041", "family_name": "lowrank_residual", "family_stage": "mainline_comparison", "checkpoint_dir": "/root/sparsify-ascend/checkpoints/research_agent/round_0090_proxy/round0090_proxy_1774174041_dp2_bs1_ga8_ef12_k32_20260322_180727", "metrics_path": "/root/sparsify-ascend/checkpoints/research_agent/round_0090_proxy/round0090_proxy_1774174041_dp2_bs1_ga8_ef12_k32_20260322_180727/metrics.jsonl", "latest_step": 130, "latest_tokens_per_sec": 141987.6388895114, "baseline_ratio": 1.7105188054531137, "latest_total_tokens": 4259840.0, "proxy_mode": "fast", "evaluation_basis": "terminal_only"}}
{"event_id": "evt_1774174101004894405", "ts": 1774174101, "event": "training_heartbeat", "round": 90, "session_id": "019d14ea-730e-75e1-9200-ca4cb6c1e330", "tier": "proxy", "run_name": "round0090_proxy_1774174041", "family_name": "lowrank_residual", "family_stage": "mainline_comparison", "status": null, "decision": null, "payload": {"tier": "proxy", "run_name": "round0090_proxy_1774174041", "family_name": "lowrank_residual", "family_stage": "mainline_comparison", "checkpoint_dir": "/root/sparsify-ascend/checkpoints/research_agent/round_0090_proxy/round0090_proxy_1774174041_dp2_bs1_ga8_ef12_k32_20260322_180727", "metrics_path": "/root/sparsify-ascend/checkpoints/research_agent/round_0090_proxy/round0090_proxy_1774174041_dp2_bs1_ga8_ef12_k32_20260322_180727/metrics.jsonl", "latest_step": 152, "latest_tokens_per_sec": 83008.19835911368, "baseline_ratio": 0.9999960941003774, "latest_total_tokens": 4980736.0, "proxy_mode": "fast", "evaluation_basis": "terminal_only"}}
{"event_id": "evt_1774174101072295273", "ts": 1774174101, "event": "training_finished", "round": 90, "session_id": "019d14ea-730e-75e1-9200-ca4cb6c1e330", "tier": "proxy", "run_name": "round0090_proxy_1774174041", "family_name": "lowrank_residual", "family_stage": "mainline_comparison", "status": "ok", "decision": "incubate", "payload": {"tier": "proxy", "run_name": "round0090_proxy_1774174041", "family_name": "lowrank_residual", "family_stage": "mainline_comparison", "checkpoint_dir": "/root/sparsify-ascend/checkpoints/research_agent/round_0090_proxy/round0090_proxy_1774174041_dp2_bs1_ga8_ef12_k32_20260322_180727", "metrics_path": "/root/sparsify-ascend/checkpoints/research_agent/round_0090_proxy/round0090_proxy_1774174041_dp2_bs1_ga8_ef12_k32_20260322_180727/metrics.jsonl", "run_health": "normal", "termination_reason": "completed", "tokens_per_sec": 83008.19835911368, "baseline_ratio": 0.9999960941003774, "status": "ok", "decision": "incubate", "proxy_mode": "fast", "evaluation_basis": "terminal_only", "curve_start_fvu": 0.3540574908256531, "curve_mid_fvu": 0.22892272472381592, "curve_end_fvu": 0.1810237169265747, "curve_late_slope": -7.058383010688328e-09, "curve_still_improving": true}}
