{"event_id": "evt_1774164432821386239", "ts": 1774164432, "event": "agent_deciding", "round": 60, "session_id": "019d1451-d554-79b2-8cc5-c99f2ae19f85", "tier": null, "run_name": null, "family_name": null, "family_stage": null, "status": null, "decision": null, "payload": {}}
{"event_id": "evt_1774164432824046002", "ts": 1774164432, "event": "session_rebuilt", "round": 60, "tier": null, "run_name": null, "family_name": null, "family_stage": null, "status": "recreated", "decision": null, "payload": {"previous_session_id": "019d1451-d554-79b2-8cc5-c99f2ae19f85", "previous_status": "active", "previous_rounds": 8, "previous_age_hours": 0.5461}}
{"event_id": "evt_1774164641731755695", "ts": 1774164641, "event": "session_started", "round": 60, "tier": null, "run_name": null, "family_name": null, "family_stage": null, "status": "active", "decision": null, "payload": {"session_id": "019d1472-65bf-7983-8005-f5d3834169bf"}}
{"event_id": "evt_1774164641733015481", "ts": 1774164641, "event": "agent_action_received", "round": 60, "session_id": "019d1472-65bf-7983-8005-f5d3834169bf", "tier": "proxy", "run_name": null, "family_name": "lowrank_grouped_residual", "family_stage": "prototype", "status": null, "decision": null, "payload": {"session_id": "019d1472-65bf-7983-8005-f5d3834169bf", "tier": "proxy", "family_name": "lowrank_grouped_residual", "family_stage": "prototype", "change_type": "edit_sae_code", "expected_win": "smaller_k", "hypothesis": "A low-rank trunk plus group-local winner-take-all residual routing can improve support diversity and regularity at low K, making `K=32` more competitive at the mandated small-capacity setting `EF=8` than the existing low-rank gated residual path."}}
{"event_id": "evt_1774164772831220004", "ts": 1774164772, "event": "variable_isolation_warning", "round": 60, "session_id": "019d1472-65bf-7983-8005-f5d3834169bf", "tier": null, "run_name": null, "family_name": "lowrank_grouped_residual", "family_stage": "prototype", "status": null, "decision": null, "payload": {"violation": "Multiple primary variables changed simultaneously: code_edit, architecture, k, lr"}}
{"event_id": "evt_1774164772831328370", "ts": 1774164772, "event": "incubation_limit_blocked", "round": 60, "session_id": "019d1472-65bf-7983-8005-f5d3834169bf", "tier": null, "run_name": null, "family_name": "lowrank_grouped_residual", "family_stage": "prototype", "status": null, "decision": null, "payload": {"reason": "Cannot create new incubating family 'lowrank_grouped_residual': already 5 incubating families (limit: 5). Stale families that could be archived: []"}}
{"event_id": "evt_1774164772831364873", "ts": 1774164772, "event": "round_finished", "round": 60, "session_id": "019d1472-65bf-7983-8005-f5d3834169bf", "tier": "proxy", "run_name": null, "family_name": "lowrank_grouped_residual", "family_stage": "prototype", "status": "policy_reject", "decision": "policy_reject", "payload": {"tier": "proxy", "family_name": "lowrank_grouped_residual", "family_stage": "prototype", "status": "policy_reject", "decision": "policy_reject", "val_fvu": null}}
{"event_id": "evt_1774164780341085090", "ts": 1774164780, "event": "round_started", "round": 61, "session_id": "019d1472-65bf-7983-8005-f5d3834169bf", "tier": null, "run_name": null, "family_name": null, "family_stage": null, "status": "started", "decision": null, "payload": {"status": "started"}}
{"event_id": "evt_1774164780341247071", "ts": 1774164780, "event": "agent_deciding", "round": 61, "session_id": "019d1472-65bf-7983-8005-f5d3834169bf", "tier": null, "run_name": null, "family_name": null, "family_stage": null, "status": null, "decision": null, "payload": {}}
{"event_id": "evt_1774164919952954118", "ts": 1774164919, "event": "session_resumed", "round": 61, "tier": null, "run_name": null, "family_name": null, "family_stage": null, "status": "active", "decision": null, "payload": {"session_id": "019d1472-65bf-7983-8005-f5d3834169bf"}}
{"event_id": "evt_1774164919954188201", "ts": 1774164919, "event": "agent_action_received", "round": 61, "session_id": "019d1472-65bf-7983-8005-f5d3834169bf", "tier": "proxy", "run_name": null, "family_name": "lowrank_grouped_residual", "family_stage": "stabilize", "status": null, "decision": null, "payload": {"session_id": "019d1472-65bf-7983-8005-f5d3834169bf", "tier": "proxy", "family_name": "lowrank_grouped_residual", "family_stage": "stabilize", "change_type": "param_only", "expected_win": "smaller_k", "hypothesis": "`lowrank_grouped_residual` may need a slightly less aggressive low-K budget than `K=32` for its grouped residual routing to show useful quality at the required small-capacity setting, so the next informative move is a same-family probe at `K=40`, `EF=8` before changing EF or abandoning the grouped residual direction."}}
{"event_id": "evt_1774164919954309668", "ts": 1774164919, "event": "variable_isolation_warning", "round": 61, "session_id": "019d1472-65bf-7983-8005-f5d3834169bf", "tier": null, "run_name": null, "family_name": "lowrank_grouped_residual", "family_stage": "stabilize", "status": null, "decision": null, "payload": {"violation": "Multiple primary variables changed simultaneously: architecture, k, lr"}}
{"event_id": "evt_1774164919954391645", "ts": 1774164919, "event": "proxy_mode_selected", "round": 61, "session_id": "019d1472-65bf-7983-8005-f5d3834169bf", "tier": "proxy", "run_name": null, "family_name": "lowrank_grouped_residual", "family_stage": "stabilize", "status": null, "decision": null, "payload": {"tier": "proxy", "proxy_mode": "fast", "evaluation_basis": "terminal_only", "parameter_behavior": "structural", "proxy_max_tokens": "5000000"}}
{"event_id": "evt_1774164919954673566", "ts": 1774164919, "event": "training_started", "round": 61, "session_id": "019d1472-65bf-7983-8005-f5d3834169bf", "tier": "proxy", "run_name": "round0061_proxy_1774164919", "family_name": "lowrank_grouped_residual", "family_stage": "stabilize", "status": null, "decision": null, "payload": {"tier": "proxy", "run_name": "round0061_proxy_1774164919", "family_name": "lowrank_grouped_residual", "family_stage": "stabilize", "checkpoint_dir": "/root/sparsify-ascend/checkpoints/research_agent/round_0061_proxy", "log_path": "/root/sparsify-ascend/research/history/logs/round0061_proxy_1774164919.log", "config": {"architecture": "lowrank_grouped_residual", "expansion_factor": 8, "k": 40, "optimizer": "signum", "lr": "1.6e-3", "hookpoints": "layers.[3].self_attn.o_proj", "batch_size": 1, "grad_acc_steps": 8, "micro_acc_steps": 1, "auxk_alpha": 0.03125, "dead_feature_threshold": 10000000, "use_hadamard": false, "tier": "proxy", "family_name": "lowrank_grouped_residual", "family_stage": "stabilize"}, "baseline_tokens_per_sec": null, "proxy_mode": "fast", "evaluation_basis": "terminal_only"}}
{"event_id": "evt_1774164949956656416", "ts": 1774164949, "event": "training_heartbeat", "round": 61, "session_id": "019d1472-65bf-7983-8005-f5d3834169bf", "tier": "proxy", "run_name": "round0061_proxy_1774164919", "family_name": "lowrank_grouped_residual", "family_stage": "stabilize", "status": null, "decision": null, "payload": {"tier": "proxy", "run_name": "round0061_proxy_1774164919", "family_name": "lowrank_grouped_residual", "family_stage": "stabilize", "checkpoint_dir": "/root/sparsify-ascend/checkpoints/research_agent/round_0061_proxy/round0061_proxy_1774164919_dp2_bs1_ga8_ef8_k40_20260322_153526", "metrics_path": "/root/sparsify-ascend/checkpoints/research_agent/round_0061_proxy/round0061_proxy_1774164919_dp2_bs1_ga8_ef8_k40_20260322_153526/metrics.jsonl", "latest_step": 152, "latest_tokens_per_sec": 166015.30301319854, "baseline_ratio": null, "latest_total_tokens": 4980736.0, "proxy_mode": "fast", "evaluation_basis": "terminal_only"}}
{"event_id": "evt_1774164979958138875", "ts": 1774164979, "event": "training_heartbeat", "round": 61, "session_id": "019d1472-65bf-7983-8005-f5d3834169bf", "tier": "proxy", "run_name": "round0061_proxy_1774164919", "family_name": "lowrank_grouped_residual", "family_stage": "stabilize", "status": null, "decision": null, "payload": {"tier": "proxy", "run_name": "round0061_proxy_1774164919", "family_name": "lowrank_grouped_residual", "family_stage": "stabilize", "checkpoint_dir": "/root/sparsify-ascend/checkpoints/research_agent/round_0061_proxy/round0061_proxy_1774164919_dp2_bs1_ga8_ef8_k40_20260322_153526", "metrics_path": "/root/sparsify-ascend/checkpoints/research_agent/round_0061_proxy/round0061_proxy_1774164919_dp2_bs1_ga8_ef8_k40_20260322_153526/metrics.jsonl", "latest_step": 152, "latest_tokens_per_sec": 83007.91206872014, "baseline_ratio": null, "latest_total_tokens": 4980736.0, "proxy_mode": "fast", "evaluation_basis": "terminal_only"}}
{"event_id": "evt_1774164980025093005", "ts": 1774164980, "event": "training_finished", "round": 61, "session_id": "019d1472-65bf-7983-8005-f5d3834169bf", "tier": "proxy", "run_name": "round0061_proxy_1774164919", "family_name": "lowrank_grouped_residual", "family_stage": "stabilize", "status": "ok", "decision": "incubate", "payload": {"tier": "proxy", "run_name": "round0061_proxy_1774164919", "family_name": "lowrank_grouped_residual", "family_stage": "stabilize", "checkpoint_dir": "/root/sparsify-ascend/checkpoints/research_agent/round_0061_proxy/round0061_proxy_1774164919_dp2_bs1_ga8_ef8_k40_20260322_153526", "metrics_path": "/root/sparsify-ascend/checkpoints/research_agent/round_0061_proxy/round0061_proxy_1774164919_dp2_bs1_ga8_ef8_k40_20260322_153526/metrics.jsonl", "run_health": "normal", "termination_reason": "completed", "tokens_per_sec": 83007.91206872014, "baseline_ratio": null, "status": "ok", "decision": "incubate", "proxy_mode": "fast", "evaluation_basis": "terminal_only", "curve_start_fvu": 0.3482514023780823, "curve_mid_fvu": 0.22571757435798645, "curve_end_fvu": 0.17857781052589417, "curve_late_slope": -7.055859896354377e-09, "curve_still_improving": true}}
{"event_id": "evt_1774164980025152264", "ts": 1774164980, "event": "result_recorded", "round": 61, "session_id": "019d1472-65bf-7983-8005-f5d3834169bf", "tier": "proxy", "run_name": "round0061_proxy_1774164919", "family_name": "lowrank_grouped_residual", "family_stage": "stabilize", "status": "ok", "decision": "incubate", "payload": {"tier": "proxy", "run_name": "round0061_proxy_1774164919", "family_name": "lowrank_grouped_residual", "family_stage": "stabilize", "status": "ok", "decision": "incubate", "val_fvu": "0.1794072687625885", "observed_fvu": "0.178578", "k": "40", "log_path": "/root/sparsify-ascend/research/history/logs/proxy_1774164980.log", "checkpoint": null}}
{"event_id": "evt_1774164980025292761", "ts": 1774164980, "event": "round_finished", "round": 61, "session_id": "019d1472-65bf-7983-8005-f5d3834169bf", "tier": "proxy", "run_name": null, "family_name": "lowrank_grouped_residual", "family_stage": "stabilize", "status": "ok", "decision": "incubate", "payload": {"tier": "proxy", "family_name": "lowrank_grouped_residual", "family_stage": "stabilize", "status": "ok", "decision": "incubate", "val_fvu": "0.1794072687625885"}}
{"event_id": "evt_1774164980033778106", "ts": 1774164980, "event": "experiment_commit_prepared", "round": 61, "tier": "proxy", "run_name": null, "family_name": "lowrank_grouped_residual", "family_stage": "stabilize", "status": "ok", "decision": "incubate", "payload": {"branch": "autoresearch-sae"}}
{"event_id": "evt_1774164987686919128", "ts": 1774164987, "event": "round_started", "round": 62, "session_id": "019d1472-65bf-7983-8005-f5d3834169bf", "tier": null, "run_name": null, "family_name": null, "family_stage": null, "status": "started", "decision": null, "payload": {"status": "started"}}
{"event_id": "evt_1774164987687064305", "ts": 1774164987, "event": "agent_deciding", "round": 62, "session_id": "019d1472-65bf-7983-8005-f5d3834169bf", "tier": null, "run_name": null, "family_name": null, "family_stage": null, "status": null, "decision": null, "payload": {}}
{"event_id": "evt_1774165125233736365", "ts": 1774165125, "event": "session_resumed", "round": 62, "tier": null, "run_name": null, "family_name": null, "family_stage": null, "status": "active", "decision": null, "payload": {"session_id": "019d1472-65bf-7983-8005-f5d3834169bf"}}
{"event_id": "evt_1774165125234949931", "ts": 1774165125, "event": "agent_action_received", "round": 62, "session_id": "019d1472-65bf-7983-8005-f5d3834169bf", "tier": "proxy", "run_name": null, "family_name": "routed", "family_stage": "prototype", "status": null, "decision": null, "payload": {"session_id": "019d1472-65bf-7983-8005-f5d3834169bf", "tier": "proxy", "family_name": "routed", "family_stage": "prototype", "change_type": "param_only", "expected_win": "smaller_k", "hypothesis": "A separate support router may preserve more useful structure than pure magnitude TopK at very low sparsity, so a `routed` SAE at `K=32`, `EF=8` is the next clean architecture pivot to test whether low-K quality improves through different support selection rather than more residual-branch variants."}}
{"event_id": "evt_1774165125235054871", "ts": 1774165125, "event": "variable_isolation_warning", "round": 62, "session_id": "019d1472-65bf-7983-8005-f5d3834169bf", "tier": null, "run_name": null, "family_name": "routed", "family_stage": "prototype", "status": null, "decision": null, "payload": {"violation": "Multiple primary variables changed simultaneously: architecture, k, lr"}}
{"event_id": "evt_1774165125235112662", "ts": 1774165125, "event": "proxy_mode_selected", "round": 62, "session_id": "019d1472-65bf-7983-8005-f5d3834169bf", "tier": "proxy", "run_name": null, "family_name": "routed", "family_stage": "prototype", "status": null, "decision": null, "payload": {"tier": "proxy", "proxy_mode": "fast", "evaluation_basis": "terminal_only", "parameter_behavior": "structural", "proxy_max_tokens": "5000000"}}
{"event_id": "evt_1774165125235366417", "ts": 1774165125, "event": "training_started", "round": 62, "session_id": "019d1472-65bf-7983-8005-f5d3834169bf", "tier": "proxy", "run_name": "round0062_proxy_1774165125", "family_name": "routed", "family_stage": "prototype", "status": null, "decision": null, "payload": {"tier": "proxy", "run_name": "round0062_proxy_1774165125", "family_name": "routed", "family_stage": "prototype", "checkpoint_dir": "/root/sparsify-ascend/checkpoints/research_agent/round_0062_proxy", "log_path": "/root/sparsify-ascend/research/history/logs/round0062_proxy_1774165125.log", "config": {"architecture": "routed", "expansion_factor": 8, "k": 32, "optimizer": "signum", "lr": "1.6e-3", "hookpoints": "layers.[3].self_attn.o_proj", "batch_size": 1, "grad_acc_steps": 8, "micro_acc_steps": 1, "auxk_alpha": 0.03125, "dead_feature_threshold": 10000000, "use_hadamard": false, "tier": "proxy", "family_name": "routed", "family_stage": "prototype"}, "baseline_tokens_per_sec": 55338.76650957904, "proxy_mode": "fast", "evaluation_basis": "terminal_only"}}
{"event_id": "evt_1774165155237169497", "ts": 1774165155, "event": "training_heartbeat", "round": 62, "session_id": "019d1472-65bf-7983-8005-f5d3834169bf", "tier": "proxy", "run_name": "round0062_proxy_1774165125", "family_name": "routed", "family_stage": "prototype", "status": null, "decision": null, "payload": {"tier": "proxy", "run_name": "round0062_proxy_1774165125", "family_name": "routed", "family_stage": "prototype", "checkpoint_dir": "/root/sparsify-ascend/checkpoints/research_agent/round_0062_proxy/round0062_proxy_1774165125_dp2_bs1_ga8_ef8_k32_20260322_153851", "metrics_path": "/root/sparsify-ascend/checkpoints/research_agent/round_0062_proxy/round0062_proxy_1774165125_dp2_bs1_ga8_ef8_k32_20260322_153851/metrics.jsonl", "latest_step": 130, "latest_tokens_per_sec": 141987.5373371371, "baseline_ratio": 2.5657878968545367, "latest_total_tokens": 4259840.0, "proxy_mode": "fast", "evaluation_basis": "terminal_only"}}
{"event_id": "evt_1774165185238607864", "ts": 1774165185, "event": "training_heartbeat", "round": 62, "session_id": "019d1472-65bf-7983-8005-f5d3834169bf", "tier": "proxy", "run_name": "round0062_proxy_1774165125", "family_name": "routed", "family_stage": "prototype", "status": null, "decision": null, "payload": {"tier": "proxy", "run_name": "round0062_proxy_1774165125", "family_name": "routed", "family_stage": "prototype", "checkpoint_dir": "/root/sparsify-ascend/checkpoints/research_agent/round_0062_proxy/round0062_proxy_1774165125_dp2_bs1_ga8_ef8_k32_20260322_153851", "metrics_path": "/root/sparsify-ascend/checkpoints/research_agent/round_0062_proxy/round0062_proxy_1774165125_dp2_bs1_ga8_ef8_k32_20260322_153851/metrics.jsonl", "latest_step": 152, "latest_tokens_per_sec": 83008.17593076272, "baseline_ratio": 1.5000004728402132, "latest_total_tokens": 4980736.0, "proxy_mode": "fast", "evaluation_basis": "terminal_only"}}
{"event_id": "evt_1774165185305046450", "ts": 1774165185, "event": "training_finished", "round": 62, "session_id": "019d1472-65bf-7983-8005-f5d3834169bf", "tier": "proxy", "run_name": "round0062_proxy_1774165125", "family_name": "routed", "family_stage": "prototype", "status": "ok", "decision": "incubate", "payload": {"tier": "proxy", "run_name": "round0062_proxy_1774165125", "family_name": "routed", "family_stage": "prototype", "checkpoint_dir": "/root/sparsify-ascend/checkpoints/research_agent/round_0062_proxy/round0062_proxy_1774165125_dp2_bs1_ga8_ef8_k32_20260322_153851", "metrics_path": "/root/sparsify-ascend/checkpoints/research_agent/round_0062_proxy/round0062_proxy_1774165125_dp2_bs1_ga8_ef8_k32_20260322_153851/metrics.jsonl", "run_health": "normal", "termination_reason": "completed", "tokens_per_sec": 83008.17593076272, "baseline_ratio": 1.5000004728402132, "status": "ok", "decision": "incubate", "proxy_mode": "fast", "evaluation_basis": "terminal_only", "curve_start_fvu": 0.5667749643325806, "curve_mid_fvu": 0.4357052445411682, "curve_end_fvu": 0.3836003541946411, "curve_late_slope": -6.867653170164915e-09, "curve_still_improving": true}}
{"event_id": "evt_1774165185305107266", "ts": 1774165185, "event": "result_recorded", "round": 62, "session_id": "019d1472-65bf-7983-8005-f5d3834169bf", "tier": "proxy", "run_name": "round0062_proxy_1774165125", "family_name": "routed", "family_stage": "prototype", "status": "ok", "decision": "incubate", "payload": {"tier": "proxy", "run_name": "round0062_proxy_1774165125", "family_name": "routed", "family_stage": "prototype", "status": "ok", "decision": "incubate", "val_fvu": "0.3838951364159584", "observed_fvu": "0.383600", "k": "32", "log_path": "/root/sparsify-ascend/research/history/logs/proxy_1774165185.log", "checkpoint": null}}
{"event_id": "evt_1774165185305244492", "ts": 1774165185, "event": "round_finished", "round": 62, "session_id": "019d1472-65bf-7983-8005-f5d3834169bf", "tier": "proxy", "run_name": null, "family_name": "routed", "family_stage": "prototype", "status": "ok", "decision": "incubate", "payload": {"tier": "proxy", "family_name": "routed", "family_stage": "prototype", "status": "ok", "decision": "incubate", "val_fvu": "0.3838951364159584"}}
{"event_id": "evt_1774165185313425104", "ts": 1774165185, "event": "experiment_commit_prepared", "round": 62, "tier": "proxy", "run_name": null, "family_name": "routed", "family_stage": "prototype", "status": "ok", "decision": "incubate", "payload": {"branch": "autoresearch-sae"}}
{"event_id": "evt_1774165192920424618", "ts": 1774165192, "event": "round_started", "round": 63, "session_id": "019d1472-65bf-7983-8005-f5d3834169bf", "tier": null, "run_name": null, "family_name": null, "family_stage": null, "status": "started", "decision": null, "payload": {"status": "started"}}
{"event_id": "evt_1774165192920584106", "ts": 1774165192, "event": "agent_deciding", "round": 63, "session_id": "019d1472-65bf-7983-8005-f5d3834169bf", "tier": null, "run_name": null, "family_name": null, "family_stage": null, "status": null, "decision": null, "payload": {}}
{"event_id": "evt_1774165324737089368", "ts": 1774165324, "event": "session_resumed", "round": 63, "tier": null, "run_name": null, "family_name": null, "family_stage": null, "status": "active", "decision": null, "payload": {"session_id": "019d1472-65bf-7983-8005-f5d3834169bf"}}
{"event_id": "evt_1774165324738358377", "ts": 1774165324, "event": "agent_action_received", "round": 63, "session_id": "019d1472-65bf-7983-8005-f5d3834169bf", "tier": "proxy", "run_name": null, "family_name": "preconditioned_topk", "family_stage": "prototype", "status": null, "decision": null, "payload": {"session_id": "019d1472-65bf-7983-8005-f5d3834169bf", "tier": "proxy", "family_name": "preconditioned_topk", "family_stage": "prototype", "change_type": "edit_sae_code", "expected_win": "smaller_k", "hypothesis": "The small-EF low-K failures may reflect an input-space mismatch more than a routing deficiency, so a new preprocessing-oriented family that normalizes and lightly rotates activations before TopK selection could make `K=32`, `EF=8` more viable than the current direct-support variants."}}
{"event_id": "evt_1774165455207507337", "ts": 1774165455, "event": "variable_isolation_warning", "round": 63, "session_id": "019d1472-65bf-7983-8005-f5d3834169bf", "tier": null, "run_name": null, "family_name": "preconditioned_topk", "family_stage": "prototype", "status": null, "decision": null, "payload": {"violation": "Multiple primary variables changed simultaneously: code_edit, architecture, k, lr"}}
{"event_id": "evt_1774165455207669849", "ts": 1774165455, "event": "incubation_limit_blocked", "round": 63, "session_id": "019d1472-65bf-7983-8005-f5d3834169bf", "tier": null, "run_name": null, "family_name": "preconditioned_topk", "family_stage": "prototype", "status": null, "decision": null, "payload": {"reason": "Cannot create new incubating family 'preconditioned_topk': already 7 incubating families (limit: 5). Stale families that could be archived: []"}}
