{"event_id": "evt_1774138268558101690", "ts": 1774138268, "event": "training_heartbeat", "round": 17, "session_id": "019d12cf-0aba-71d0-8920-5ea920811f62", "tier": "full", "run_name": "round0017_full_1774138238", "family_name": "lowrank_residual", "family_stage": "stabilize", "status": null, "decision": null, "payload": {"tier": "full", "run_name": "round0017_full_1774138238", "family_name": "lowrank_residual", "family_stage": "stabilize", "checkpoint_dir": "/root/sparsify-ascend/checkpoints/research_agent/round_0017_full/round0017_full_1774138238_dp2_bs1_ga8_ef16_k64_20260322_081045", "metrics_path": "/root/sparsify-ascend/checkpoints/research_agent/round_0017_full/round0017_full_1774138238_dp2_bs1_ga8_ef16_k64_20260322_081045/metrics.jsonl", "latest_step": 110, "latest_tokens_per_sec": 120143.4774555585, "baseline_ratio": 0.7219352042290604, "latest_total_tokens": 3604480.0, "proxy_mode": null, "evaluation_basis": null}}
{"event_id": "evt_1774138298560408802", "ts": 1774138298, "event": "training_heartbeat", "round": 17, "session_id": "019d12cf-0aba-71d0-8920-5ea920811f62", "tier": "full", "run_name": "round0017_full_1774138238", "family_name": "lowrank_residual", "family_stage": "stabilize", "status": null, "decision": null, "payload": {"tier": "full", "run_name": "round0017_full_1774138238", "family_name": "lowrank_residual", "family_stage": "stabilize", "checkpoint_dir": "/root/sparsify-ascend/checkpoints/research_agent/round_0017_full/round0017_full_1774138238_dp2_bs1_ga8_ef16_k64_20260322_081045", "metrics_path": "/root/sparsify-ascend/checkpoints/research_agent/round_0017_full/round0017_full_1774138238_dp2_bs1_ga8_ef16_k64_20260322_081045/metrics.jsonl", "latest_step": 310, "latest_tokens_per_sec": 169290.75645508867, "baseline_ratio": 1.017258359953041, "latest_total_tokens": 10158080.0, "proxy_mode": null, "evaluation_basis": null}}
{"event_id": "evt_1774138328563860071", "ts": 1774138328, "event": "training_heartbeat", "round": 17, "session_id": "019d12cf-0aba-71d0-8920-5ea920811f62", "tier": "full", "run_name": "round0017_full_1774138238", "family_name": "lowrank_residual", "family_stage": "stabilize", "status": null, "decision": null, "payload": {"tier": "full", "run_name": "round0017_full_1774138238", "family_name": "lowrank_residual", "family_stage": "stabilize", "checkpoint_dir": "/root/sparsify-ascend/checkpoints/research_agent/round_0017_full/round0017_full_1774138238_dp2_bs1_ga8_ef16_k64_20260322_081045", "metrics_path": "/root/sparsify-ascend/checkpoints/research_agent/round_0017_full/round0017_full_1774138238_dp2_bs1_ga8_ef16_k64_20260322_081045/metrics.jsonl", "latest_step": 520, "latest_tokens_per_sec": 189311.0662982342, "baseline_ratio": 1.1375592433754196, "latest_total_tokens": 17039360.0, "proxy_mode": null, "evaluation_basis": null}}
{"event_id": "evt_1774138358568442199", "ts": 1774138358, "event": "training_heartbeat", "round": 17, "session_id": "019d12cf-0aba-71d0-8920-5ea920811f62", "tier": "full", "run_name": "round0017_full_1774138238", "family_name": "lowrank_residual", "family_stage": "stabilize", "status": null, "decision": null, "payload": {"tier": "full", "run_name": "round0017_full_1774138238", "family_name": "lowrank_residual", "family_stage": "stabilize", "checkpoint_dir": "/root/sparsify-ascend/checkpoints/research_agent/round_0017_full/round0017_full_1774138238_dp2_bs1_ga8_ef16_k64_20260322_081045", "metrics_path": "/root/sparsify-ascend/checkpoints/research_agent/round_0017_full/round0017_full_1774138238_dp2_bs1_ga8_ef16_k64_20260322_081045/metrics.jsonl", "latest_step": 720, "latest_tokens_per_sec": 196588.7065809761, "baseline_ratio": 1.1812901627319896, "latest_total_tokens": 23592960.0, "proxy_mode": null, "evaluation_basis": null}}
{"event_id": "evt_1774138388574375586", "ts": 1774138388, "event": "training_heartbeat", "round": 17, "session_id": "019d12cf-0aba-71d0-8920-5ea920811f62", "tier": "full", "run_name": "round0017_full_1774138238", "family_name": "lowrank_residual", "family_stage": "stabilize", "status": null, "decision": null, "payload": {"tier": "full", "run_name": "round0017_full_1774138238", "family_name": "lowrank_residual", "family_stage": "stabilize", "checkpoint_dir": "/root/sparsify-ascend/checkpoints/research_agent/round_0017_full/round0017_full_1774138238_dp2_bs1_ga8_ef16_k64_20260322_081045", "metrics_path": "/root/sparsify-ascend/checkpoints/research_agent/round_0017_full/round0017_full_1774138238_dp2_bs1_ga8_ef16_k64_20260322_081045/metrics.jsonl", "latest_step": 920, "latest_tokens_per_sec": 200953.65667158004, "baseline_ratio": 1.2075188952595248, "latest_total_tokens": 30146560.0, "proxy_mode": null, "evaluation_basis": null}}
{"event_id": "evt_1774138418581092042", "ts": 1774138418, "event": "training_heartbeat", "round": 17, "session_id": "019d12cf-0aba-71d0-8920-5ea920811f62", "tier": "full", "run_name": "round0017_full_1774138238", "family_name": "lowrank_residual", "family_stage": "stabilize", "status": null, "decision": null, "payload": {"tier": "full", "run_name": "round0017_full_1774138238", "family_name": "lowrank_residual", "family_stage": "stabilize", "checkpoint_dir": "/root/sparsify-ascend/checkpoints/research_agent/round_0017_full/round0017_full_1774138238_dp2_bs1_ga8_ef16_k64_20260322_081045", "metrics_path": "/root/sparsify-ascend/checkpoints/research_agent/round_0017_full/round0017_full_1774138238_dp2_bs1_ga8_ef16_k64_20260322_081045/metrics.jsonl", "latest_step": 1090, "latest_tokens_per_sec": 198401.52610587797, "baseline_ratio": 1.1921832903628637, "latest_total_tokens": 35717120.0, "proxy_mode": null, "evaluation_basis": null}}
{"event_id": "evt_1774138448725280743", "ts": 1774138448, "event": "training_heartbeat", "round": 17, "session_id": "019d12cf-0aba-71d0-8920-5ea920811f62", "tier": "full", "run_name": "round0017_full_1774138238", "family_name": "lowrank_residual", "family_stage": "stabilize", "status": null, "decision": null, "payload": {"tier": "full", "run_name": "round0017_full_1774138238", "family_name": "lowrank_residual", "family_stage": "stabilize", "checkpoint_dir": "/root/sparsify-ascend/checkpoints/research_agent/round_0017_full/round0017_full_1774138238_dp2_bs1_ga8_ef16_k64_20260322_081045", "metrics_path": "/root/sparsify-ascend/checkpoints/research_agent/round_0017_full/round0017_full_1774138238_dp2_bs1_ga8_ef16_k64_20260322_081045/metrics.jsonl", "latest_step": 1220, "latest_tokens_per_sec": 190337.6298359131, "baseline_ratio": 1.1437278042738044, "latest_total_tokens": 39976960.0, "proxy_mode": null, "evaluation_basis": null}}
{"event_id": "evt_1774138478732725564", "ts": 1774138478, "event": "training_heartbeat", "round": 17, "session_id": "019d12cf-0aba-71d0-8920-5ea920811f62", "tier": "full", "run_name": "round0017_full_1774138238", "family_name": "lowrank_residual", "family_stage": "stabilize", "status": null, "decision": null, "payload": {"tier": "full", "run_name": "round0017_full_1774138238", "family_name": "lowrank_residual", "family_stage": "stabilize", "checkpoint_dir": "/root/sparsify-ascend/checkpoints/research_agent/round_0017_full/round0017_full_1774138238_dp2_bs1_ga8_ef16_k64_20260322_081045", "metrics_path": "/root/sparsify-ascend/checkpoints/research_agent/round_0017_full/round0017_full_1774138238_dp2_bs1_ga8_ef16_k64_20260322_081045/metrics.jsonl", "latest_step": 1220, "latest_tokens_per_sec": 166448.5674284209, "baseline_ratio": 1.0001798105479431, "latest_total_tokens": 39976960.0, "proxy_mode": null, "evaluation_basis": null}}
{"event_id": "evt_1774138478808122177", "ts": 1774138478, "event": "training_finished", "round": 17, "session_id": "019d12cf-0aba-71d0-8920-5ea920811f62", "tier": "full", "run_name": "round0017_full_1774138238", "family_name": "lowrank_residual", "family_stage": "stabilize", "status": "ok", "decision": "keep", "payload": {"tier": "full", "run_name": "round0017_full_1774138238", "family_name": "lowrank_residual", "family_stage": "stabilize", "checkpoint_dir": "/root/sparsify-ascend/checkpoints/research_agent/round_0017_full/round0017_full_1774138238_dp2_bs1_ga8_ef16_k64_20260322_081045", "metrics_path": "/root/sparsify-ascend/checkpoints/research_agent/round_0017_full/round0017_full_1774138238_dp2_bs1_ga8_ef16_k64_20260322_081045/metrics.jsonl", "run_health": "normal", "termination_reason": "completed", "tokens_per_sec": 166448.5674284209, "baseline_ratio": 1.0001798105479431, "status": "ok", "decision": "keep", "proxy_mode": null, "evaluation_basis": null, "curve_start_fvu": 0.12048269808292389, "curve_mid_fvu": 0.10342255234718323, "curve_end_fvu": 0.08389362692832947, "curve_late_slope": -1.2906549854364369e-09, "curve_still_improving": true}}
{"event_id": "evt_1774138478808177836", "ts": 1774138478, "event": "result_recorded", "round": 17, "session_id": "019d12cf-0aba-71d0-8920-5ea920811f62", "tier": "full", "run_name": "round0017_full_1774138238", "family_name": "lowrank_residual", "family_stage": "stabilize", "status": "ok", "decision": "keep", "payload": {"tier": "full", "run_name": "round0017_full_1774138238", "family_name": "lowrank_residual", "family_stage": "stabilize", "status": "ok", "decision": "keep", "val_fvu": "0.08546286541968584", "observed_fvu": "0.083894", "k": "64", "log_path": "/root/sparsify-ascend/research/history/logs/full_1774138478.log", "checkpoint": null}}
{"event_id": "evt_1774138478808710529", "ts": 1774138478, "event": "round_finished", "round": 17, "session_id": "019d12cf-0aba-71d0-8920-5ea920811f62", "tier": "full", "run_name": null, "family_name": "lowrank_residual", "family_stage": "stabilize", "status": "ok", "decision": "keep", "payload": {"tier": "full", "family_name": "lowrank_residual", "family_stage": "stabilize", "status": "ok", "decision": "keep", "val_fvu": "0.08546286541968584"}}
{"event_id": "evt_1774138478814811599", "ts": 1774138478, "event": "experiment_commit_prepared", "round": 17, "tier": "full", "run_name": null, "family_name": "lowrank_residual", "family_stage": "stabilize", "status": "ok", "decision": "keep", "payload": {"branch": "autoresearch-sae"}}
{"event_id": "evt_1774138486346825500", "ts": 1774138486, "event": "round_started", "round": 18, "session_id": "019d12cf-0aba-71d0-8920-5ea920811f62", "tier": null, "run_name": null, "family_name": null, "family_stage": null, "status": "started", "decision": null, "payload": {"status": "started"}}
{"event_id": "evt_1774138486347002153", "ts": 1774138486, "event": "agent_deciding", "round": 18, "session_id": "019d12cf-0aba-71d0-8920-5ea920811f62", "tier": null, "run_name": null, "family_name": null, "family_stage": null, "status": null, "decision": null, "payload": {}}
{"event_id": "evt_1774138613190288097", "ts": 1774138613, "event": "session_resumed", "round": 18, "tier": null, "run_name": null, "family_name": null, "family_stage": null, "status": "active", "decision": null, "payload": {"session_id": "019d12cf-0aba-71d0-8920-5ea920811f62"}}
{"event_id": "evt_1774138613191859756", "ts": 1774138613, "event": "agent_action_received", "round": 18, "session_id": "019d12cf-0aba-71d0-8920-5ea920811f62", "tier": "proxy", "run_name": null, "family_name": "lowrank_residual", "family_stage": "stabilize", "status": null, "decision": null, "payload": {"session_id": "019d12cf-0aba-71d0-8920-5ea920811f62", "tier": "proxy", "family_name": "lowrank_residual", "family_stage": "stabilize", "change_type": "param_only", "expected_win": "pareto_improvement", "hypothesis": "`lowrank_residual` at K=64 established a strong new Pareto point, so the next clean step is to continue the same axis and test whether the family remains non-dominated at K=32. Changing only K from 64 to 32 will determine whether the low-rank trunk continues to preserve enough reconstruction quality to replace the current gated K=32 frontier point."}}
{"event_id": "evt_1774138613192000358", "ts": 1774138613, "event": "proxy_mode_selected", "round": 18, "session_id": "019d12cf-0aba-71d0-8920-5ea920811f62", "tier": "proxy", "run_name": null, "family_name": "lowrank_residual", "family_stage": "stabilize", "status": null, "decision": null, "payload": {"tier": "proxy", "proxy_mode": "fast", "evaluation_basis": "terminal_only", "parameter_behavior": "structural", "proxy_max_tokens": "5000000"}}
{"event_id": "evt_1774138613192282738", "ts": 1774138613, "event": "training_started", "round": 18, "session_id": "019d12cf-0aba-71d0-8920-5ea920811f62", "tier": "proxy", "run_name": "round0018_proxy_1774138613", "family_name": "lowrank_residual", "family_stage": "stabilize", "status": null, "decision": null, "payload": {"tier": "proxy", "run_name": "round0018_proxy_1774138613", "family_name": "lowrank_residual", "family_stage": "stabilize", "checkpoint_dir": "/root/sparsify-ascend/checkpoints/research_agent/round_0018_proxy", "log_path": "/root/sparsify-ascend/research/history/logs/round0018_proxy_1774138613.log", "config": {"architecture": "lowrank_residual", "expansion_factor": 16, "k": 32, "optimizer": "signum", "lr": "1.6e-3", "hookpoints": "layers.[3].self_attn.o_proj", "batch_size": 1, "grad_acc_steps": 8, "micro_acc_steps": 1, "auxk_alpha": 0.0, "dead_feature_threshold": 10000000, "use_hadamard": false, "tier": "proxy", "family_name": "lowrank_residual", "family_stage": "stabilize"}, "baseline_tokens_per_sec": 83008.52258207071, "proxy_mode": "fast", "evaluation_basis": "terminal_only"}}
{"event_id": "evt_1774138643194451564", "ts": 1774138643, "event": "training_heartbeat", "round": 18, "session_id": "019d12cf-0aba-71d0-8920-5ea920811f62", "tier": "proxy", "run_name": "round0018_proxy_1774138613", "family_name": "lowrank_residual", "family_stage": "stabilize", "status": null, "decision": null, "payload": {"tier": "proxy", "run_name": "round0018_proxy_1774138613", "family_name": "lowrank_residual", "family_stage": "stabilize", "checkpoint_dir": "/root/sparsify-ascend/checkpoints/research_agent/round_0018_proxy/round0018_proxy_1774138613_dp2_bs1_ga8_ef16_k32_20260322_081659", "metrics_path": "/root/sparsify-ascend/checkpoints/research_agent/round_0018_proxy/round0018_proxy_1774138613_dp2_bs1_ga8_ef16_k32_20260322_081659/metrics.jsonl", "latest_step": 110, "latest_tokens_per_sec": 120142.16466385288, "baseline_ratio": 1.4473473437027873, "latest_total_tokens": 3604480.0, "proxy_mode": "fast", "evaluation_basis": "terminal_only"}}
{"event_id": "evt_1774138673217716009", "ts": 1774138673, "event": "training_heartbeat", "round": 18, "session_id": "019d12cf-0aba-71d0-8920-5ea920811f62", "tier": "proxy", "run_name": "round0018_proxy_1774138613", "family_name": "lowrank_residual", "family_stage": "stabilize", "status": null, "decision": null, "payload": {"tier": "proxy", "run_name": "round0018_proxy_1774138613", "family_name": "lowrank_residual", "family_stage": "stabilize", "checkpoint_dir": "/root/sparsify-ascend/checkpoints/research_agent/round_0018_proxy/round0018_proxy_1774138613_dp2_bs1_ga8_ef16_k32_20260322_081659", "metrics_path": "/root/sparsify-ascend/checkpoints/research_agent/round_0018_proxy/round0018_proxy_1774138613_dp2_bs1_ga8_ef16_k32_20260322_081659/metrics.jsonl", "latest_step": 152, "latest_tokens_per_sec": 83007.75705055239, "baseline_ratio": 0.9999907776756589, "latest_total_tokens": 4980736.0, "proxy_mode": "fast", "evaluation_basis": "terminal_only"}}
{"event_id": "evt_1774138673937265666", "ts": 1774138673, "event": "training_finished", "round": 18, "session_id": "019d12cf-0aba-71d0-8920-5ea920811f62", "tier": "proxy", "run_name": "round0018_proxy_1774138613", "family_name": "lowrank_residual", "family_stage": "stabilize", "status": "ok", "decision": "promote", "payload": {"tier": "proxy", "run_name": "round0018_proxy_1774138613", "family_name": "lowrank_residual", "family_stage": "stabilize", "checkpoint_dir": "/root/sparsify-ascend/checkpoints/research_agent/round_0018_proxy/round0018_proxy_1774138613_dp2_bs1_ga8_ef16_k32_20260322_081659", "metrics_path": "/root/sparsify-ascend/checkpoints/research_agent/round_0018_proxy/round0018_proxy_1774138613_dp2_bs1_ga8_ef16_k32_20260322_081659/metrics.jsonl", "run_health": "normal", "termination_reason": "completed", "tokens_per_sec": 83007.75705055239, "baseline_ratio": 0.9999907776756589, "status": "ok", "decision": "promote", "proxy_mode": "fast", "evaluation_basis": "terminal_only", "curve_start_fvu": 0.3504185676574707, "curve_mid_fvu": 0.22648370265960693, "curve_end_fvu": 0.17901036143302917, "curve_late_slope": -6.934662392708443e-09, "curve_still_improving": true}}
{"event_id": "evt_1774138673937379385", "ts": 1774138673, "event": "result_recorded", "round": 18, "session_id": "019d12cf-0aba-71d0-8920-5ea920811f62", "tier": "proxy", "run_name": "round0018_proxy_1774138613", "family_name": "lowrank_residual", "family_stage": "stabilize", "status": "ok", "decision": "promote", "payload": {"tier": "proxy", "run_name": "round0018_proxy_1774138613", "family_name": "lowrank_residual", "family_stage": "stabilize", "status": "ok", "decision": "promote", "val_fvu": "0.17962167970836163", "observed_fvu": "0.179010", "k": "32", "log_path": "/root/sparsify-ascend/research/history/logs/proxy_1774138673.log", "checkpoint": null}}
{"event_id": "evt_1774138673937853937", "ts": 1774138673, "event": "training_started", "round": 18, "session_id": "019d12cf-0aba-71d0-8920-5ea920811f62", "tier": "full", "run_name": "round0018_full_1774138673", "family_name": "lowrank_residual", "family_stage": "stabilize", "status": null, "decision": null, "payload": {"tier": "full", "run_name": "round0018_full_1774138673", "family_name": "lowrank_residual", "family_stage": "stabilize", "checkpoint_dir": "/root/sparsify-ascend/checkpoints/research_agent/round_0018_full", "log_path": "/root/sparsify-ascend/research/history/logs/round0018_full_1774138673.log", "config": {"architecture": "lowrank_residual", "expansion_factor": 16, "k": 32, "optimizer": "signum", "lr": "1.6e-3", "hookpoints": "layers.[3].self_attn.o_proj", "batch_size": 1, "grad_acc_steps": 8, "micro_acc_steps": 1, "auxk_alpha": 0.0, "dead_feature_threshold": 10000000, "use_hadamard": false, "tier": "full", "family_name": "lowrank_residual", "family_stage": "stabilize"}, "baseline_tokens_per_sec": 166448.5674284209, "proxy_mode": null, "evaluation_basis": null}}
{"event_id": "evt_1774138703939546194", "ts": 1774138703, "event": "training_heartbeat", "round": 18, "session_id": "019d12cf-0aba-71d0-8920-5ea920811f62", "tier": "full", "run_name": "round0018_full_1774138673", "family_name": "lowrank_residual", "family_stage": "stabilize", "status": null, "decision": null, "payload": {"tier": "full", "run_name": "round0018_full_1774138673", "family_name": "lowrank_residual", "family_stage": "stabilize", "checkpoint_dir": "/root/sparsify-ascend/checkpoints/research_agent/round_0018_full/round0018_full_1774138673_dp2_bs1_ga8_ef16_k32_20260322_081800", "metrics_path": "/root/sparsify-ascend/checkpoints/research_agent/round_0018_full/round0018_full_1774138673_dp2_bs1_ga8_ef16_k32_20260322_081800/metrics.jsonl", "latest_step": 110, "latest_tokens_per_sec": 120143.76388665238, "baseline_ratio": 0.7218071368401454, "latest_total_tokens": 3604480.0, "proxy_mode": null, "evaluation_basis": null}}
{"event_id": "evt_1774138733941876174", "ts": 1774138733, "event": "training_heartbeat", "round": 18, "session_id": "019d12cf-0aba-71d0-8920-5ea920811f62", "tier": "full", "run_name": "round0018_full_1774138673", "family_name": "lowrank_residual", "family_stage": "stabilize", "status": null, "decision": null, "payload": {"tier": "full", "run_name": "round0018_full_1774138673", "family_name": "lowrank_residual", "family_stage": "stabilize", "checkpoint_dir": "/root/sparsify-ascend/checkpoints/research_agent/round_0018_full/round0018_full_1774138673_dp2_bs1_ga8_ef16_k32_20260322_081800", "metrics_path": "/root/sparsify-ascend/checkpoints/research_agent/round_0018_full/round0018_full_1774138673_dp2_bs1_ga8_ef16_k32_20260322_081800/metrics.jsonl", "latest_step": 310, "latest_tokens_per_sec": 169290.85937197835, "baseline_ratio": 1.017076097364309, "latest_total_tokens": 10158080.0, "proxy_mode": null, "evaluation_basis": null}}
{"event_id": "evt_1774138763945353120", "ts": 1774138763, "event": "training_heartbeat", "round": 18, "session_id": "019d12cf-0aba-71d0-8920-5ea920811f62", "tier": "full", "run_name": "round0018_full_1774138673", "family_name": "lowrank_residual", "family_stage": "stabilize", "status": null, "decision": null, "payload": {"tier": "full", "run_name": "round0018_full_1774138673", "family_name": "lowrank_residual", "family_stage": "stabilize", "checkpoint_dir": "/root/sparsify-ascend/checkpoints/research_agent/round_0018_full/round0018_full_1774138673_dp2_bs1_ga8_ef16_k32_20260322_081800", "metrics_path": "/root/sparsify-ascend/checkpoints/research_agent/round_0018_full/round0018_full_1774138673_dp2_bs1_ga8_ef16_k32_20260322_081800/metrics.jsonl", "latest_step": 520, "latest_tokens_per_sec": 189311.11243283353, "baseline_ratio": 1.1373550121676137, "latest_total_tokens": 17039360.0, "proxy_mode": null, "evaluation_basis": null}}
{"event_id": "evt_1774138793949971515", "ts": 1774138793, "event": "training_heartbeat", "round": 18, "session_id": "019d12cf-0aba-71d0-8920-5ea920811f62", "tier": "full", "run_name": "round0018_full_1774138673", "family_name": "lowrank_residual", "family_stage": "stabilize", "status": null, "decision": null, "payload": {"tier": "full", "run_name": "round0018_full_1774138673", "family_name": "lowrank_residual", "family_stage": "stabilize", "checkpoint_dir": "/root/sparsify-ascend/checkpoints/research_agent/round_0018_full/round0018_full_1774138673_dp2_bs1_ga8_ef16_k32_20260322_081800", "metrics_path": "/root/sparsify-ascend/checkpoints/research_agent/round_0018_full/round0018_full_1774138673_dp2_bs1_ga8_ef16_k32_20260322_081800/metrics.jsonl", "latest_step": 720, "latest_tokens_per_sec": 196588.66518286092, "baseline_ratio": 1.1810775437728016, "latest_total_tokens": 23592960.0, "proxy_mode": null, "evaluation_basis": null}}
