{"event_id": "evt_1774135932463014527", "ts": 1774135932, "event": "training_heartbeat", "round": 12, "session_id": "019d1279-dd8d-73d2-97df-ff57e75146ab", "tier": "proxy", "run_name": "round0012_proxy_1774135752", "family_name": "multi_branch_gated", "family_stage": "stabilize", "status": null, "decision": null, "payload": {"tier": "proxy", "run_name": "round0012_proxy_1774135752", "family_name": "multi_branch_gated", "family_stage": "stabilize", "checkpoint_dir": "/root/sparsify-ascend/checkpoints/research_agent/round_0012_proxy/round0012_proxy_1774135752_dp2_bs1_ga8_ef32_k128_20260322_072918", "metrics_path": "/root/sparsify-ascend/checkpoints/research_agent/round_0012_proxy/round0012_proxy_1774135752_dp2_bs1_ga8_ef32_k128_20260322_072918/metrics.jsonl", "latest_step": 152, "latest_tokens_per_sec": 27669.728222942595, "baseline_ratio": 0.41564241258128554, "latest_total_tokens": 4980736.0, "proxy_mode": "fast", "evaluation_basis": "terminal_only"}}
{"event_id": "evt_1774135934182000352", "ts": 1774135934, "event": "training_finished", "round": 12, "session_id": "019d1279-dd8d-73d2-97df-ff57e75146ab", "tier": "proxy", "run_name": "round0012_proxy_1774135752", "family_name": "multi_branch_gated", "family_stage": "stabilize", "status": "ok", "decision": "incubate", "payload": {"tier": "proxy", "run_name": "round0012_proxy_1774135752", "family_name": "multi_branch_gated", "family_stage": "stabilize", "checkpoint_dir": "/root/sparsify-ascend/checkpoints/research_agent/round_0012_proxy/round0012_proxy_1774135752_dp2_bs1_ga8_ef32_k128_20260322_072918", "metrics_path": "/root/sparsify-ascend/checkpoints/research_agent/round_0012_proxy/round0012_proxy_1774135752_dp2_bs1_ga8_ef32_k128_20260322_072918/metrics.jsonl", "run_health": "normal", "termination_reason": "completed", "tokens_per_sec": 27669.728222942595, "baseline_ratio": 0.41564241258128554, "status": "ok", "decision": "incubate", "proxy_mode": "fast", "evaluation_basis": "terminal_only", "curve_start_fvu": 0.36065807938575745, "curve_mid_fvu": 0.28406333923339844, "curve_end_fvu": 0.2509804964065552, "curve_late_slope": -3.816855877953311e-09, "curve_still_improving": true}}
{"event_id": "evt_1774135934182122190", "ts": 1774135934, "event": "result_recorded", "round": 12, "session_id": "019d1279-dd8d-73d2-97df-ff57e75146ab", "tier": "proxy", "run_name": "round0012_proxy_1774135752", "family_name": "multi_branch_gated", "family_stage": "stabilize", "status": "ok", "decision": "incubate", "payload": {"tier": "proxy", "run_name": "round0012_proxy_1774135752", "family_name": "multi_branch_gated", "family_stage": "stabilize", "status": "ok", "decision": "incubate", "val_fvu": "0.25158748403191566", "observed_fvu": "0.250980", "k": "128", "log_path": "/root/sparsify-ascend/research/history/logs/proxy_1774135933.log", "checkpoint": null}}
{"event_id": "evt_1774135934182265784", "ts": 1774135934, "event": "round_finished", "round": 12, "session_id": "019d1279-dd8d-73d2-97df-ff57e75146ab", "tier": "proxy", "run_name": null, "family_name": "multi_branch_gated", "family_stage": "stabilize", "status": "ok", "decision": "incubate", "payload": {"tier": "proxy", "family_name": "multi_branch_gated", "family_stage": "stabilize", "status": "ok", "decision": "incubate", "val_fvu": "0.25158748403191566"}}
{"event_id": "evt_1774135934426615894", "ts": 1774135934, "event": "experiment_commit_prepared", "round": 12, "tier": "proxy", "run_name": null, "family_name": "multi_branch_gated", "family_stage": "stabilize", "status": "ok", "decision": "incubate", "payload": {"branch": "autoresearch-sae"}}
{"event_id": "evt_1774135943283897447", "ts": 1774135943, "event": "round_started", "round": 13, "session_id": "019d1279-dd8d-73d2-97df-ff57e75146ab", "tier": null, "run_name": null, "family_name": null, "family_stage": null, "status": "started", "decision": null, "payload": {"status": "started"}}
{"event_id": "evt_1774135943291310355", "ts": 1774135943, "event": "agent_deciding", "round": 13, "session_id": "019d1279-dd8d-73d2-97df-ff57e75146ab", "tier": null, "run_name": null, "family_name": null, "family_stage": null, "status": null, "decision": null, "payload": {}}
{"event_id": "evt_1774136056162593595", "ts": 1774136056, "event": "session_resumed", "round": 13, "tier": null, "run_name": null, "family_name": null, "family_stage": null, "status": "active", "decision": null, "payload": {"session_id": "019d1279-dd8d-73d2-97df-ff57e75146ab"}}
{"event_id": "evt_1774136056163226526", "ts": 1774136056, "event": "agent_action_received", "round": 13, "session_id": "019d1279-dd8d-73d2-97df-ff57e75146ab", "tier": "proxy", "run_name": null, "family_name": "multi_branch_gated", "family_stage": "stabilize", "status": null, "decision": null, "payload": {"session_id": "019d1279-dd8d-73d2-97df-ff57e75146ab", "tier": "proxy", "family_name": "multi_branch_gated", "family_stage": "stabilize", "change_type": "edit_sae_code", "expected_win": "quality_improve", "hypothesis": "`multi_branch_gated` showed a competitive prototype signal at K=128, but the strong regression at EF=32 suggests the family is not generically width-limited and instead needs a family-specific routing adjustment. Reducing the number of active branches from the current default to a simpler two-branch mixture should test whether the prototype is over-fragmenting capacity across too many competing branches and can recover better K=128 quality under the same training recipe."}}
{"event_id": "evt_1774136187282171632", "ts": 1774136187, "event": "variable_isolation_warning", "round": 13, "session_id": "019d1279-dd8d-73d2-97df-ff57e75146ab", "tier": null, "run_name": null, "family_name": "multi_branch_gated", "family_stage": "stabilize", "status": null, "decision": null, "payload": {"violation": "Multiple primary variables changed simultaneously: code_edit, architecture, lr"}}
{"event_id": "evt_1774136187282312714", "ts": 1774136187, "event": "proxy_mode_selected", "round": 13, "session_id": "019d1279-dd8d-73d2-97df-ff57e75146ab", "tier": "proxy", "run_name": null, "family_name": "multi_branch_gated", "family_stage": "stabilize", "status": null, "decision": null, "payload": {"tier": "proxy", "proxy_mode": "fast", "evaluation_basis": "terminal_only", "parameter_behavior": "structural", "proxy_max_tokens": "40000000"}}
{"event_id": "evt_1774136187282360821", "ts": 1774136187, "event": "sanity_started", "round": 13, "session_id": "019d1279-dd8d-73d2-97df-ff57e75146ab", "tier": "proxy", "run_name": null, "family_name": "multi_branch_gated", "family_stage": "stabilize", "status": null, "decision": null, "payload": {"tier": "proxy"}}
{"event_id": "evt_1774136191962844283", "ts": 1774136191, "event": "sanity_finished", "round": 13, "session_id": "019d1279-dd8d-73d2-97df-ff57e75146ab", "tier": "proxy", "run_name": null, "family_name": "multi_branch_gated", "family_stage": "stabilize", "status": "ok", "decision": null, "payload": {"tier": "proxy", "status": "ok"}}
{"event_id": "evt_1774136191963239847", "ts": 1774136191, "event": "training_started", "round": 13, "session_id": "019d1279-dd8d-73d2-97df-ff57e75146ab", "tier": "proxy", "run_name": "round0013_proxy_1774136191", "family_name": "multi_branch_gated", "family_stage": "stabilize", "status": null, "decision": null, "payload": {"tier": "proxy", "run_name": "round0013_proxy_1774136191", "family_name": "multi_branch_gated", "family_stage": "stabilize", "checkpoint_dir": "/root/sparsify-ascend/checkpoints/research_agent/round_0013_proxy", "log_path": "/root/sparsify-ascend/research/history/logs/round0013_proxy_1774136191.log", "config": {"architecture": "multi_branch_gated", "expansion_factor": 16, "k": 128, "optimizer": "signum", "lr": "1.6e-3", "hookpoints": "layers.[3].self_attn.o_proj", "batch_size": 1, "grad_acc_steps": 8, "micro_acc_steps": 1, "auxk_alpha": 0.0, "dead_feature_threshold": 10000000, "use_hadamard": false, "tier": "proxy", "family_name": "multi_branch_gated", "family_stage": "stabilize"}, "baseline_tokens_per_sec": 66570.99320327744, "proxy_mode": "fast", "evaluation_basis": "terminal_only"}}
{"event_id": "evt_1774136221964484661", "ts": 1774136221, "event": "training_heartbeat", "round": 13, "session_id": "019d1279-dd8d-73d2-97df-ff57e75146ab", "tier": "proxy", "run_name": "round0013_proxy_1774136191", "family_name": "multi_branch_gated", "family_stage": "stabilize", "status": null, "decision": null, "payload": {"tier": "proxy", "run_name": "round0013_proxy_1774136191", "family_name": "multi_branch_gated", "family_stage": "stabilize", "checkpoint_dir": "/root/sparsify-ascend/checkpoints/research_agent/round_0013_proxy/round0013_proxy_1774136191_dp2_bs1_ga8_ef16_k128_20260322_073638", "metrics_path": "/root/sparsify-ascend/checkpoints/research_agent/round_0013_proxy/round0013_proxy_1774136191_dp2_bs1_ga8_ef16_k128_20260322_073638/metrics.jsonl", "latest_step": 30, "latest_tokens_per_sec": 32766.990135290267, "baseline_ratio": 0.49221122531903394, "latest_total_tokens": 983040.0, "proxy_mode": "fast", "evaluation_basis": "terminal_only"}}
{"event_id": "evt_1774136251965614933", "ts": 1774136251, "event": "training_heartbeat", "round": 13, "session_id": "019d1279-dd8d-73d2-97df-ff57e75146ab", "tier": "proxy", "run_name": "round0013_proxy_1774136191", "family_name": "multi_branch_gated", "family_stage": "stabilize", "status": null, "decision": null, "payload": {"tier": "proxy", "run_name": "round0013_proxy_1774136191", "family_name": "multi_branch_gated", "family_stage": "stabilize", "checkpoint_dir": "/root/sparsify-ascend/checkpoints/research_agent/round_0013_proxy/round0013_proxy_1774136191_dp2_bs1_ga8_ef16_k128_20260322_073638", "metrics_path": "/root/sparsify-ascend/checkpoints/research_agent/round_0013_proxy/round0013_proxy_1774136191_dp2_bs1_ga8_ef16_k128_20260322_073638/metrics.jsonl", "latest_step": 100, "latest_tokens_per_sec": 54611.47510663137, "baseline_ratio": 0.8203494116404849, "latest_total_tokens": 3276800.0, "proxy_mode": "fast", "evaluation_basis": "terminal_only"}}
{"event_id": "evt_1774136281967178632", "ts": 1774136281, "event": "training_heartbeat", "round": 13, "session_id": "019d1279-dd8d-73d2-97df-ff57e75146ab", "tier": "proxy", "run_name": "round0013_proxy_1774136191", "family_name": "multi_branch_gated", "family_stage": "stabilize", "status": null, "decision": null, "payload": {"tier": "proxy", "run_name": "round0013_proxy_1774136191", "family_name": "multi_branch_gated", "family_stage": "stabilize", "checkpoint_dir": "/root/sparsify-ascend/checkpoints/research_agent/round_0013_proxy/round0013_proxy_1774136191_dp2_bs1_ga8_ef16_k128_20260322_073638", "metrics_path": "/root/sparsify-ascend/checkpoints/research_agent/round_0013_proxy/round0013_proxy_1774136191_dp2_bs1_ga8_ef16_k128_20260322_073638/metrics.jsonl", "latest_step": 180, "latest_tokens_per_sec": 65533.37059161138, "baseline_ratio": 0.9844132923103966, "latest_total_tokens": 5898240.0, "proxy_mode": "fast", "evaluation_basis": "terminal_only"}}
{"event_id": "evt_1774136311969134065", "ts": 1774136311, "event": "training_heartbeat", "round": 13, "session_id": "019d1279-dd8d-73d2-97df-ff57e75146ab", "tier": "proxy", "run_name": "round0013_proxy_1774136191", "family_name": "multi_branch_gated", "family_stage": "stabilize", "status": null, "decision": null, "payload": {"tier": "proxy", "run_name": "round0013_proxy_1774136191", "family_name": "multi_branch_gated", "family_stage": "stabilize", "checkpoint_dir": "/root/sparsify-ascend/checkpoints/research_agent/round_0013_proxy/round0013_proxy_1774136191_dp2_bs1_ga8_ef16_k128_20260322_073638", "metrics_path": "/root/sparsify-ascend/checkpoints/research_agent/round_0013_proxy/round0013_proxy_1774136191_dp2_bs1_ga8_ef16_k128_20260322_073638/metrics.jsonl", "latest_step": 250, "latest_tokens_per_sec": 68263.50681944315, "baseline_ratio": 1.0254241905479395, "latest_total_tokens": 8192000.0, "proxy_mode": "fast", "evaluation_basis": "terminal_only"}}
{"event_id": "evt_1774136341971467552", "ts": 1774136341, "event": "training_heartbeat", "round": 13, "session_id": "019d1279-dd8d-73d2-97df-ff57e75146ab", "tier": "proxy", "run_name": "round0013_proxy_1774136191", "family_name": "multi_branch_gated", "family_stage": "stabilize", "status": null, "decision": null, "payload": {"tier": "proxy", "run_name": "round0013_proxy_1774136191", "family_name": "multi_branch_gated", "family_stage": "stabilize", "checkpoint_dir": "/root/sparsify-ascend/checkpoints/research_agent/round_0013_proxy/round0013_proxy_1774136191_dp2_bs1_ga8_ef16_k128_20260322_073638", "metrics_path": "/root/sparsify-ascend/checkpoints/research_agent/round_0013_proxy/round0013_proxy_1774136191_dp2_bs1_ga8_ef16_k128_20260322_073638/metrics.jsonl", "latest_step": 320, "latest_tokens_per_sec": 69901.38441619504, "baseline_ratio": 1.0500276629905176, "latest_total_tokens": 10485760.0, "proxy_mode": "fast", "evaluation_basis": "terminal_only"}}
{"event_id": "evt_1774136371974208212", "ts": 1774136371, "event": "training_heartbeat", "round": 13, "session_id": "019d1279-dd8d-73d2-97df-ff57e75146ab", "tier": "proxy", "run_name": "round0013_proxy_1774136191", "family_name": "multi_branch_gated", "family_stage": "stabilize", "status": null, "decision": null, "payload": {"tier": "proxy", "run_name": "round0013_proxy_1774136191", "family_name": "multi_branch_gated", "family_stage": "stabilize", "checkpoint_dir": "/root/sparsify-ascend/checkpoints/research_agent/round_0013_proxy/round0013_proxy_1774136191_dp2_bs1_ga8_ef16_k128_20260322_073638", "metrics_path": "/root/sparsify-ascend/checkpoints/research_agent/round_0013_proxy/round0013_proxy_1774136191_dp2_bs1_ga8_ef16_k128_20260322_073638/metrics.jsonl", "latest_step": 390, "latest_tokens_per_sec": 70993.13839168444, "baseline_ratio": 1.0664275080725292, "latest_total_tokens": 12779520.0, "proxy_mode": "fast", "evaluation_basis": "terminal_only"}}
{"event_id": "evt_1774136401977356362", "ts": 1774136401, "event": "training_heartbeat", "round": 13, "session_id": "019d1279-dd8d-73d2-97df-ff57e75146ab", "tier": "proxy", "run_name": "round0013_proxy_1774136191", "family_name": "multi_branch_gated", "family_stage": "stabilize", "status": null, "decision": null, "payload": {"tier": "proxy", "run_name": "round0013_proxy_1774136191", "family_name": "multi_branch_gated", "family_stage": "stabilize", "checkpoint_dir": "/root/sparsify-ascend/checkpoints/research_agent/round_0013_proxy/round0013_proxy_1774136191_dp2_bs1_ga8_ef16_k128_20260322_073638", "metrics_path": "/root/sparsify-ascend/checkpoints/research_agent/round_0013_proxy/round0013_proxy_1774136191_dp2_bs1_ga8_ef16_k128_20260322_073638/metrics.jsonl", "latest_step": 460, "latest_tokens_per_sec": 71772.81288361408, "baseline_ratio": 1.0781394332581558, "latest_total_tokens": 15073280.0, "proxy_mode": "fast", "evaluation_basis": "terminal_only"}}
{"event_id": "evt_1774136431980879639", "ts": 1774136431, "event": "training_heartbeat", "round": 13, "session_id": "019d1279-dd8d-73d2-97df-ff57e75146ab", "tier": "proxy", "run_name": "round0013_proxy_1774136191", "family_name": "multi_branch_gated", "family_stage": "stabilize", "status": null, "decision": null, "payload": {"tier": "proxy", "run_name": "round0013_proxy_1774136191", "family_name": "multi_branch_gated", "family_stage": "stabilize", "checkpoint_dir": "/root/sparsify-ascend/checkpoints/research_agent/round_0013_proxy/round0013_proxy_1774136191_dp2_bs1_ga8_ef16_k128_20260322_073638", "metrics_path": "/root/sparsify-ascend/checkpoints/research_agent/round_0013_proxy/round0013_proxy_1774136191_dp2_bs1_ga8_ef16_k128_20260322_073638/metrics.jsonl", "latest_step": 530, "latest_tokens_per_sec": 72357.4502865401, "baseline_ratio": 1.0869215976032303, "latest_total_tokens": 17367040.0, "proxy_mode": "fast", "evaluation_basis": "terminal_only"}}
{"event_id": "evt_1774136461984816625", "ts": 1774136461, "event": "training_heartbeat", "round": 13, "session_id": "019d1279-dd8d-73d2-97df-ff57e75146ab", "tier": "proxy", "run_name": "round0013_proxy_1774136191", "family_name": "multi_branch_gated", "family_stage": "stabilize", "status": null, "decision": null, "payload": {"tier": "proxy", "run_name": "round0013_proxy_1774136191", "family_name": "multi_branch_gated", "family_stage": "stabilize", "checkpoint_dir": "/root/sparsify-ascend/checkpoints/research_agent/round_0013_proxy/round0013_proxy_1774136191_dp2_bs1_ga8_ef16_k128_20260322_073638", "metrics_path": "/root/sparsify-ascend/checkpoints/research_agent/round_0013_proxy/round0013_proxy_1774136191_dp2_bs1_ga8_ef16_k128_20260322_073638/metrics.jsonl", "latest_step": 600, "latest_tokens_per_sec": 72812.04867609401, "baseline_ratio": 1.0937503734360585, "latest_total_tokens": 19660800.0, "proxy_mode": "fast", "evaluation_basis": "terminal_only"}}
{"event_id": "evt_1774136491989089257", "ts": 1774136491, "event": "training_heartbeat", "round": 13, "session_id": "019d1279-dd8d-73d2-97df-ff57e75146ab", "tier": "proxy", "run_name": "round0013_proxy_1774136191", "family_name": "multi_branch_gated", "family_stage": "stabilize", "status": null, "decision": null, "payload": {"tier": "proxy", "run_name": "round0013_proxy_1774136191", "family_name": "multi_branch_gated", "family_stage": "stabilize", "checkpoint_dir": "/root/sparsify-ascend/checkpoints/research_agent/round_0013_proxy/round0013_proxy_1774136191_dp2_bs1_ga8_ef16_k128_20260322_073638", "metrics_path": "/root/sparsify-ascend/checkpoints/research_agent/round_0013_proxy/round0013_proxy_1774136191_dp2_bs1_ga8_ef16_k128_20260322_073638/metrics.jsonl", "latest_step": 670, "latest_tokens_per_sec": 73175.64451257918, "baseline_ratio": 1.0992121491883733, "latest_total_tokens": 21954560.0, "proxy_mode": "fast", "evaluation_basis": "terminal_only"}}
{"event_id": "evt_1774136521994036126", "ts": 1774136521, "event": "training_heartbeat", "round": 13, "session_id": "019d1279-dd8d-73d2-97df-ff57e75146ab", "tier": "proxy", "run_name": "round0013_proxy_1774136191", "family_name": "multi_branch_gated", "family_stage": "stabilize", "status": null, "decision": null, "payload": {"tier": "proxy", "run_name": "round0013_proxy_1774136191", "family_name": "multi_branch_gated", "family_stage": "stabilize", "checkpoint_dir": "/root/sparsify-ascend/checkpoints/research_agent/round_0013_proxy/round0013_proxy_1774136191_dp2_bs1_ga8_ef16_k128_20260322_073638", "metrics_path": "/root/sparsify-ascend/checkpoints/research_agent/round_0013_proxy/round0013_proxy_1774136191_dp2_bs1_ga8_ef16_k128_20260322_073638/metrics.jsonl", "latest_step": 740, "latest_tokens_per_sec": 73472.97709784607, "baseline_ratio": 1.1036785477046005, "latest_total_tokens": 24248320.0, "proxy_mode": "fast", "evaluation_basis": "terminal_only"}}
{"event_id": "evt_1774136551999227085", "ts": 1774136551, "event": "training_heartbeat", "round": 13, "session_id": "019d1279-dd8d-73d2-97df-ff57e75146ab", "tier": "proxy", "run_name": "round0013_proxy_1774136191", "family_name": "multi_branch_gated", "family_stage": "stabilize", "status": null, "decision": null, "payload": {"tier": "proxy", "run_name": "round0013_proxy_1774136191", "family_name": "multi_branch_gated", "family_stage": "stabilize", "checkpoint_dir": "/root/sparsify-ascend/checkpoints/research_agent/round_0013_proxy/round0013_proxy_1774136191_dp2_bs1_ga8_ef16_k128_20260322_073638", "metrics_path": "/root/sparsify-ascend/checkpoints/research_agent/round_0013_proxy/round0013_proxy_1774136191_dp2_bs1_ga8_ef16_k128_20260322_073638/metrics.jsonl", "latest_step": 810, "latest_tokens_per_sec": 73720.69979516965, "baseline_ratio": 1.1073997284381845, "latest_total_tokens": 26542080.0, "proxy_mode": "fast", "evaluation_basis": "terminal_only"}}
{"event_id": "evt_1774136582004839972", "ts": 1774136582, "event": "training_heartbeat", "round": 13, "session_id": "019d1279-dd8d-73d2-97df-ff57e75146ab", "tier": "proxy", "run_name": "round0013_proxy_1774136191", "family_name": "multi_branch_gated", "family_stage": "stabilize", "status": null, "decision": null, "payload": {"tier": "proxy", "run_name": "round0013_proxy_1774136191", "family_name": "multi_branch_gated", "family_stage": "stabilize", "checkpoint_dir": "/root/sparsify-ascend/checkpoints/research_agent/round_0013_proxy/round0013_proxy_1774136191_dp2_bs1_ga8_ef16_k128_20260322_073638", "metrics_path": "/root/sparsify-ascend/checkpoints/research_agent/round_0013_proxy/round0013_proxy_1774136191_dp2_bs1_ga8_ef16_k128_20260322_073638/metrics.jsonl", "latest_step": 880, "latest_tokens_per_sec": 73930.23070072517, "baseline_ratio": 1.1105472089769786, "latest_total_tokens": 28835840.0, "proxy_mode": "fast", "evaluation_basis": "terminal_only"}}
{"event_id": "evt_1774136612013708813", "ts": 1774136612, "event": "training_heartbeat", "round": 13, "session_id": "019d1279-dd8d-73d2-97df-ff57e75146ab", "tier": "proxy", "run_name": "round0013_proxy_1774136191", "family_name": "multi_branch_gated", "family_stage": "stabilize", "status": null, "decision": null, "payload": {"tier": "proxy", "run_name": "round0013_proxy_1774136191", "family_name": "multi_branch_gated", "family_stage": "stabilize", "checkpoint_dir": "/root/sparsify-ascend/checkpoints/research_agent/round_0013_proxy/round0013_proxy_1774136191_dp2_bs1_ga8_ef16_k128_20260322_073638", "metrics_path": "/root/sparsify-ascend/checkpoints/research_agent/round_0013_proxy/round0013_proxy_1774136191_dp2_bs1_ga8_ef16_k128_20260322_073638/metrics.jsonl", "latest_step": 950, "latest_tokens_per_sec": 74109.25370107232, "baseline_ratio": 1.113236413264505, "latest_total_tokens": 31129600.0, "proxy_mode": "fast", "evaluation_basis": "terminal_only"}}
