{"event_id": "evt_1774165455207721520", "ts": 1774165455, "event": "round_finished", "round": 63, "session_id": "019d1472-65bf-7983-8005-f5d3834169bf", "tier": "proxy", "run_name": null, "family_name": "preconditioned_topk", "family_stage": "prototype", "status": "policy_reject", "decision": "policy_reject", "payload": {"tier": "proxy", "family_name": "preconditioned_topk", "family_stage": "prototype", "status": "policy_reject", "decision": "policy_reject", "val_fvu": null}}
{"event_id": "evt_1774165462614953278", "ts": 1774165462, "event": "round_started", "round": 64, "session_id": "019d1472-65bf-7983-8005-f5d3834169bf", "tier": null, "run_name": null, "family_name": null, "family_stage": null, "status": "started", "decision": null, "payload": {"status": "started"}}
{"event_id": "evt_1774165462615120909", "ts": 1774165462, "event": "agent_deciding", "round": 64, "session_id": "019d1472-65bf-7983-8005-f5d3834169bf", "tier": null, "run_name": null, "family_name": null, "family_stage": null, "status": null, "decision": null, "payload": {}}
{"event_id": "evt_1774165588376198513", "ts": 1774165588, "event": "session_resumed", "round": 64, "tier": null, "run_name": null, "family_name": null, "family_stage": null, "status": "active", "decision": null, "payload": {"session_id": "019d1472-65bf-7983-8005-f5d3834169bf"}}
{"event_id": "evt_1774165588381966819", "ts": 1774165588, "event": "agent_action_received", "round": 64, "session_id": "019d1472-65bf-7983-8005-f5d3834169bf", "tier": "proxy", "run_name": null, "family_name": "preconditioned_topk", "family_stage": "prototype", "status": null, "decision": null, "payload": {"session_id": "019d1472-65bf-7983-8005-f5d3834169bf", "tier": "proxy", "family_name": "preconditioned_topk", "family_stage": "prototype", "change_type": "param_only", "expected_win": "smaller_k", "hypothesis": "A lightweight normalization-plus-mixing front end may make the activation space more compatible with very low-K sparse coding, so `preconditioned_topk` at `K=32`, `EF=8` is the next clean same-EF architecture probe to test whether input conditioning improves the low-K frontier where routing-based variants failed."}}
{"event_id": "evt_1774165588382075233", "ts": 1774165588, "event": "variable_isolation_warning", "round": 64, "session_id": "019d1472-65bf-7983-8005-f5d3834169bf", "tier": null, "run_name": null, "family_name": "preconditioned_topk", "family_stage": "prototype", "status": null, "decision": null, "payload": {"violation": "Multiple primary variables changed simultaneously: architecture, k, lr"}}
{"event_id": "evt_1774165588382135313", "ts": 1774165588, "event": "proxy_mode_selected", "round": 64, "session_id": "019d1472-65bf-7983-8005-f5d3834169bf", "tier": "proxy", "run_name": null, "family_name": "preconditioned_topk", "family_stage": "prototype", "status": null, "decision": null, "payload": {"tier": "proxy", "proxy_mode": "fast", "evaluation_basis": "terminal_only", "parameter_behavior": "structural", "proxy_max_tokens": "5000000"}}
{"event_id": "evt_1774165588382392690", "ts": 1774165588, "event": "training_started", "round": 64, "session_id": "019d1472-65bf-7983-8005-f5d3834169bf", "tier": "proxy", "run_name": "round0064_proxy_1774165588", "family_name": "preconditioned_topk", "family_stage": "prototype", "status": null, "decision": null, "payload": {"tier": "proxy", "run_name": "round0064_proxy_1774165588", "family_name": "preconditioned_topk", "family_stage": "prototype", "checkpoint_dir": "/root/sparsify-ascend/checkpoints/research_agent/round_0064_proxy", "log_path": "/root/sparsify-ascend/research/history/logs/round0064_proxy_1774165588.log", "config": {"architecture": "preconditioned_topk", "expansion_factor": 8, "k": 32, "optimizer": "signum", "lr": "1.6e-3", "hookpoints": "layers.[3].self_attn.o_proj", "batch_size": 1, "grad_acc_steps": 8, "micro_acc_steps": 1, "auxk_alpha": 0.03125, "dead_feature_threshold": 10000000, "use_hadamard": false, "tier": "proxy", "family_name": "preconditioned_topk", "family_stage": "prototype"}, "baseline_tokens_per_sec": null, "proxy_mode": "fast", "evaluation_basis": "terminal_only"}}
{"event_id": "evt_1774165618383311679", "ts": 1774165618, "event": "training_heartbeat", "round": 64, "session_id": "019d1472-65bf-7983-8005-f5d3834169bf", "tier": "proxy", "run_name": "round0064_proxy_1774165588", "family_name": "preconditioned_topk", "family_stage": "prototype", "status": null, "decision": null, "payload": {"tier": "proxy", "run_name": "round0064_proxy_1774165588", "family_name": "preconditioned_topk", "family_stage": "prototype", "checkpoint_dir": null, "metrics_path": null, "latest_step": null, "latest_tokens_per_sec": null, "baseline_ratio": null, "latest_total_tokens": null, "proxy_mode": "fast", "evaluation_basis": "terminal_only"}}
{"event_id": "evt_1774165618448293832", "ts": 1774165618, "event": "training_finished", "round": 64, "session_id": "019d1472-65bf-7983-8005-f5d3834169bf", "tier": "proxy", "run_name": "round0064_proxy_1774165588", "family_name": "preconditioned_topk", "family_stage": "prototype", "status": "crash", "decision": "crash", "payload": {"tier": "proxy", "run_name": "round0064_proxy_1774165588", "family_name": "preconditioned_topk", "family_stage": "prototype", "checkpoint_dir": null, "metrics_path": "", "run_health": "crash", "termination_reason": "completed", "tokens_per_sec": null, "baseline_ratio": null, "status": "crash", "decision": "crash", "proxy_mode": "fast", "evaluation_basis": "terminal_only", "curve_start_fvu": null, "curve_mid_fvu": null, "curve_end_fvu": null, "curve_late_slope": null, "curve_still_improving": null}}
{"event_id": "evt_1774165618448336022", "ts": 1774165618, "event": "result_recorded", "round": 64, "session_id": "019d1472-65bf-7983-8005-f5d3834169bf", "tier": "proxy", "run_name": "round0064_proxy_1774165588", "family_name": "preconditioned_topk", "family_stage": "prototype", "status": "crash", "decision": "crash", "payload": {"tier": "proxy", "run_name": "round0064_proxy_1774165588", "family_name": "preconditioned_topk", "family_stage": "prototype", "status": "crash", "decision": "crash", "val_fvu": "None", "observed_fvu": "", "k": "None", "log_path": "/root/sparsify-ascend/research/history/logs/proxy_1774165618.log", "checkpoint": null}}
{"event_id": "evt_1774165618448399442", "ts": 1774165618, "event": "round_finished", "round": 64, "session_id": "019d1472-65bf-7983-8005-f5d3834169bf", "tier": "proxy", "run_name": null, "family_name": "preconditioned_topk", "family_stage": "prototype", "status": "crash", "decision": "crash", "payload": {"tier": "proxy", "family_name": "preconditioned_topk", "family_stage": "prototype", "status": "crash", "decision": "crash", "val_fvu": "None"}}
{"event_id": "evt_1774165618456922077", "ts": 1774165618, "event": "experiment_commit_prepared", "round": 64, "tier": "proxy", "run_name": null, "family_name": "preconditioned_topk", "family_stage": "prototype", "status": "crash", "decision": "crash", "payload": {"branch": "autoresearch-sae"}}
{"event_id": "evt_1774165626290392023", "ts": 1774165626, "event": "round_started", "round": 65, "session_id": "019d1472-65bf-7983-8005-f5d3834169bf", "tier": null, "run_name": null, "family_name": null, "family_stage": null, "status": "started", "decision": null, "payload": {"status": "started"}}
{"event_id": "evt_1774165626290548013", "ts": 1774165626, "event": "agent_deciding", "round": 65, "session_id": "019d1472-65bf-7983-8005-f5d3834169bf", "tier": null, "run_name": null, "family_name": null, "family_stage": null, "status": null, "decision": null, "payload": {}}
{"event_id": "evt_1774165752585077956", "ts": 1774165752, "event": "session_resumed", "round": 65, "tier": null, "run_name": null, "family_name": null, "family_stage": null, "status": "active", "decision": null, "payload": {"session_id": "019d1472-65bf-7983-8005-f5d3834169bf"}}
{"event_id": "evt_1774165752586460521", "ts": 1774165752, "event": "agent_action_received", "round": 65, "session_id": "019d1472-65bf-7983-8005-f5d3834169bf", "tier": "proxy", "run_name": null, "family_name": "preconditioned_topk", "family_stage": "prototype", "status": null, "decision": null, "payload": {"session_id": "019d1472-65bf-7983-8005-f5d3834169bf", "tier": "proxy", "family_name": "preconditioned_topk", "family_stage": "prototype", "change_type": "edit_sae_code", "expected_win": "smaller_k", "hypothesis": "`preconditioned_topk` did not fail on quality but on architecture registration, so the next informative move is a narrow code-path repair that makes the new family selectable by the existing config/runtime path and then reruns the same `K=32`, `EF=8` probe unchanged."}}
{"event_id": "evt_1774165882727050613", "ts": 1774165882, "event": "variable_isolation_warning", "round": 65, "session_id": "019d1472-65bf-7983-8005-f5d3834169bf", "tier": null, "run_name": null, "family_name": "preconditioned_topk", "family_stage": "prototype", "status": null, "decision": null, "payload": {"violation": "Multiple primary variables changed simultaneously: code_edit, architecture, k, lr"}}
{"event_id": "evt_1774165882727198038", "ts": 1774165882, "event": "proxy_mode_selected", "round": 65, "session_id": "019d1472-65bf-7983-8005-f5d3834169bf", "tier": "proxy", "run_name": null, "family_name": "preconditioned_topk", "family_stage": "prototype", "status": null, "decision": null, "payload": {"tier": "proxy", "proxy_mode": "fast", "evaluation_basis": "terminal_only", "parameter_behavior": "structural", "proxy_max_tokens": "40000000"}}
{"event_id": "evt_1774165882727243686", "ts": 1774165882, "event": "sanity_started", "round": 65, "session_id": "019d1472-65bf-7983-8005-f5d3834169bf", "tier": "proxy", "run_name": null, "family_name": "preconditioned_topk", "family_stage": "prototype", "status": null, "decision": null, "payload": {"tier": "proxy"}}
{"event_id": "evt_1774165887413628224", "ts": 1774165887, "event": "sanity_finished", "round": 65, "session_id": "019d1472-65bf-7983-8005-f5d3834169bf", "tier": "proxy", "run_name": null, "family_name": "preconditioned_topk", "family_stage": "prototype", "status": "ok", "decision": null, "payload": {"tier": "proxy", "status": "ok"}}
{"event_id": "evt_1774165887414013777", "ts": 1774165887, "event": "training_started", "round": 65, "session_id": "019d1472-65bf-7983-8005-f5d3834169bf", "tier": "proxy", "run_name": "round0065_proxy_1774165887", "family_name": "preconditioned_topk", "family_stage": "prototype", "status": null, "decision": null, "payload": {"tier": "proxy", "run_name": "round0065_proxy_1774165887", "family_name": "preconditioned_topk", "family_stage": "prototype", "checkpoint_dir": "/root/sparsify-ascend/checkpoints/research_agent/round_0065_proxy", "log_path": "/root/sparsify-ascend/research/history/logs/round0065_proxy_1774165887.log", "config": {"architecture": "preconditioned_topk", "expansion_factor": 8, "k": 32, "optimizer": "signum", "lr": "1.6e-3", "hookpoints": "layers.[3].self_attn.o_proj", "batch_size": 1, "grad_acc_steps": 8, "micro_acc_steps": 1, "auxk_alpha": 0.03125, "dead_feature_threshold": 10000000, "use_hadamard": false, "tier": "proxy", "family_name": "preconditioned_topk", "family_stage": "prototype"}, "baseline_tokens_per_sec": null, "proxy_mode": "fast", "evaluation_basis": "terminal_only"}}
{"event_id": "evt_1774165917414784634", "ts": 1774165917, "event": "training_heartbeat", "round": 65, "session_id": "019d1472-65bf-7983-8005-f5d3834169bf", "tier": "proxy", "run_name": "round0065_proxy_1774165887", "family_name": "preconditioned_topk", "family_stage": "prototype", "status": null, "decision": null, "payload": {"tier": "proxy", "run_name": "round0065_proxy_1774165887", "family_name": "preconditioned_topk", "family_stage": "prototype", "checkpoint_dir": null, "metrics_path": null, "latest_step": null, "latest_tokens_per_sec": null, "baseline_ratio": null, "latest_total_tokens": null, "proxy_mode": "fast", "evaluation_basis": "terminal_only"}}
{"event_id": "evt_1774165917479429554", "ts": 1774165917, "event": "training_finished", "round": 65, "session_id": "019d1472-65bf-7983-8005-f5d3834169bf", "tier": "proxy", "run_name": "round0065_proxy_1774165887", "family_name": "preconditioned_topk", "family_stage": "prototype", "status": "crash", "decision": "crash", "payload": {"tier": "proxy", "run_name": "round0065_proxy_1774165887", "family_name": "preconditioned_topk", "family_stage": "prototype", "checkpoint_dir": null, "metrics_path": "", "run_health": "crash", "termination_reason": "completed", "tokens_per_sec": null, "baseline_ratio": null, "status": "crash", "decision": "crash", "proxy_mode": "fast", "evaluation_basis": "terminal_only", "curve_start_fvu": null, "curve_mid_fvu": null, "curve_end_fvu": null, "curve_late_slope": null, "curve_still_improving": null}}
{"event_id": "evt_1774165917479477215", "ts": 1774165917, "event": "result_recorded", "round": 65, "session_id": "019d1472-65bf-7983-8005-f5d3834169bf", "tier": "proxy", "run_name": "round0065_proxy_1774165887", "family_name": "preconditioned_topk", "family_stage": "prototype", "status": "crash", "decision": "crash", "payload": {"tier": "proxy", "run_name": "round0065_proxy_1774165887", "family_name": "preconditioned_topk", "family_stage": "prototype", "status": "crash", "decision": "crash", "val_fvu": "None", "observed_fvu": "", "k": "None", "log_path": "/root/sparsify-ascend/research/history/logs/proxy_1774165917.log", "checkpoint": null}}
{"event_id": "evt_1774165917479541282", "ts": 1774165917, "event": "repair_attempt_started", "round": 65, "session_id": "019d1472-65bf-7983-8005-f5d3834169bf", "tier": "proxy", "run_name": null, "family_name": "preconditioned_topk", "family_stage": "prototype", "status": null, "decision": null, "payload": {"tier": "proxy", "family_name": "preconditioned_topk", "family_stage": "prototype", "repair_attempt": 1, "failure_kind": "training_crash", "error_type": "ValueError", "error_summary": "ValueError: Unknown architecture: 'preconditioned_topk'. Must be one of ('topk', 'batch_topk', 'adaptive_budget_topk', 'bucketed_topk', 'codebook_topk', 'jumprelu', 'gated', 'routed', 'group_topk', 'factorized_topk', 'lowrank_residual', 'lowrank_gated_residual', 'lowrank_grouped_residual', 'whitened_topk', 'two_stage_residual', 'multi_branch_gated')"}}
{"event_id": "evt_1774166070412195496", "ts": 1774166070, "event": "repair_loop_blocked", "round": 65, "session_id": "019d1472-65bf-7983-8005-f5d3834169bf", "tier": null, "run_name": null, "family_name": "preconditioned_topk", "family_stage": "prototype", "status": null, "decision": null, "payload": {"repair_attempt": 1, "failure_kind": "post_repair_validation", "reason": "no_code_changes"}}
{"event_id": "evt_1774166070412262005", "ts": 1774166070, "event": "round_finished", "round": 65, "session_id": "019d1472-65bf-7983-8005-f5d3834169bf", "tier": "proxy", "run_name": null, "family_name": "preconditioned_topk", "family_stage": "prototype", "status": "crash", "decision": "crash", "payload": {"tier": "proxy", "family_name": "preconditioned_topk", "family_stage": "prototype", "status": "crash", "decision": "crash", "val_fvu": null}}
{"event_id": "evt_1774166077915951127", "ts": 1774166077, "event": "round_started", "round": 66, "session_id": "019d1472-65bf-7983-8005-f5d3834169bf", "tier": null, "run_name": null, "family_name": null, "family_stage": null, "status": "started", "decision": null, "payload": {"status": "started"}}
{"event_id": "evt_1774166077916048136", "ts": 1774166077, "event": "agent_deciding", "round": 66, "session_id": "019d1472-65bf-7983-8005-f5d3834169bf", "tier": null, "run_name": null, "family_name": null, "family_stage": null, "status": null, "decision": null, "payload": {}}
{"event_id": "evt_1774166203628086227", "ts": 1774166203, "event": "session_resumed", "round": 66, "tier": null, "run_name": null, "family_name": null, "family_stage": null, "status": "active", "decision": null, "payload": {"session_id": "019d1472-65bf-7983-8005-f5d3834169bf"}}
{"event_id": "evt_1774166203637071866", "ts": 1774166203, "event": "agent_action_received", "round": 66, "session_id": "019d1472-65bf-7983-8005-f5d3834169bf", "tier": "proxy", "run_name": null, "family_name": "lowrank_gated_residual", "family_stage": "stabilize", "status": null, "decision": null, "payload": {"session_id": "019d1472-65bf-7983-8005-f5d3834169bf", "tier": "proxy", "family_name": "lowrank_gated_residual", "family_stage": "stabilize", "change_type": "param_only", "expected_win": "smaller_k", "hypothesis": "In crash-recovery mode, the safest informative move is to stay on the known working `lowrank_gated_residual` small-EF recipe and step K down from the last stable `K=64` probe to `K=56`, testing whether a lower-K point can still run cleanly while improving the low-K map."}}
{"event_id": "evt_1774166203637206903", "ts": 1774166203, "event": "proxy_mode_selected", "round": 66, "session_id": "019d1472-65bf-7983-8005-f5d3834169bf", "tier": "proxy", "run_name": null, "family_name": "lowrank_gated_residual", "family_stage": "stabilize", "status": null, "decision": null, "payload": {"tier": "proxy", "proxy_mode": "fast", "evaluation_basis": "terminal_only", "parameter_behavior": "structural", "proxy_max_tokens": "5000000"}}
{"event_id": "evt_1774166203637488405", "ts": 1774166203, "event": "training_started", "round": 66, "session_id": "019d1472-65bf-7983-8005-f5d3834169bf", "tier": "proxy", "run_name": "round0066_proxy_1774166203", "family_name": "lowrank_gated_residual", "family_stage": "stabilize", "status": null, "decision": null, "payload": {"tier": "proxy", "run_name": "round0066_proxy_1774166203", "family_name": "lowrank_gated_residual", "family_stage": "stabilize", "checkpoint_dir": "/root/sparsify-ascend/checkpoints/research_agent/round_0066_proxy", "log_path": "/root/sparsify-ascend/research/history/logs/round0066_proxy_1774166203.log", "config": {"architecture": "lowrank_gated_residual", "expansion_factor": 8, "k": 56, "optimizer": "signum", "lr": "1.6e-3", "hookpoints": "layers.[3].self_attn.o_proj", "batch_size": 1, "grad_acc_steps": 8, "micro_acc_steps": 1, "auxk_alpha": 0.0, "dead_feature_threshold": 10000000, "use_hadamard": false, "tier": "proxy", "family_name": "lowrank_gated_residual", "family_stage": "stabilize"}, "baseline_tokens_per_sec": 83008.58788873068, "proxy_mode": "fast", "evaluation_basis": "terminal_only"}}
{"event_id": "evt_1774166233639387263", "ts": 1774166233, "event": "training_heartbeat", "round": 66, "session_id": "019d1472-65bf-7983-8005-f5d3834169bf", "tier": "proxy", "run_name": "round0066_proxy_1774166203", "family_name": "lowrank_gated_residual", "family_stage": "stabilize", "status": null, "decision": null, "payload": {"tier": "proxy", "run_name": "round0066_proxy_1774166203", "family_name": "lowrank_gated_residual", "family_stage": "stabilize", "checkpoint_dir": "/root/sparsify-ascend/checkpoints/research_agent/round_0066_proxy/round0066_proxy_1774166203_dp2_bs1_ga8_ef8_k56_20260322_155650", "metrics_path": "/root/sparsify-ascend/checkpoints/research_agent/round_0066_proxy/round0066_proxy_1774166203_dp2_bs1_ga8_ef8_k56_20260322_155650/metrics.jsonl", "latest_step": 130, "latest_tokens_per_sec": 141987.6772537795, "baseline_ratio": 1.710517921881862, "latest_total_tokens": 4259840.0, "proxy_mode": "fast", "evaluation_basis": "terminal_only"}}
{"event_id": "evt_1774166263640844737", "ts": 1774166263, "event": "training_heartbeat", "round": 66, "session_id": "019d1472-65bf-7983-8005-f5d3834169bf", "tier": "proxy", "run_name": "round0066_proxy_1774166203", "family_name": "lowrank_gated_residual", "family_stage": "stabilize", "status": null, "decision": null, "payload": {"tier": "proxy", "run_name": "round0066_proxy_1774166203", "family_name": "lowrank_gated_residual", "family_stage": "stabilize", "checkpoint_dir": "/root/sparsify-ascend/checkpoints/research_agent/round_0066_proxy/round0066_proxy_1774166203_dp2_bs1_ga8_ef8_k56_20260322_155650", "metrics_path": "/root/sparsify-ascend/checkpoints/research_agent/round_0066_proxy/round0066_proxy_1774166203_dp2_bs1_ga8_ef8_k56_20260322_155650/metrics.jsonl", "latest_step": 152, "latest_tokens_per_sec": 83008.21946816097, "baseline_ratio": 0.9999955616571842, "latest_total_tokens": 4980736.0, "proxy_mode": "fast", "evaluation_basis": "terminal_only"}}
{"event_id": "evt_1774166263707358759", "ts": 1774166263, "event": "training_finished", "round": 66, "session_id": "019d1472-65bf-7983-8005-f5d3834169bf", "tier": "proxy", "run_name": "round0066_proxy_1774166203", "family_name": "lowrank_gated_residual", "family_stage": "stabilize", "status": "ok", "decision": "discard", "payload": {"tier": "proxy", "run_name": "round0066_proxy_1774166203", "family_name": "lowrank_gated_residual", "family_stage": "stabilize", "checkpoint_dir": "/root/sparsify-ascend/checkpoints/research_agent/round_0066_proxy/round0066_proxy_1774166203_dp2_bs1_ga8_ef8_k56_20260322_155650", "metrics_path": "/root/sparsify-ascend/checkpoints/research_agent/round_0066_proxy/round0066_proxy_1774166203_dp2_bs1_ga8_ef8_k56_20260322_155650/metrics.jsonl", "run_health": "normal", "termination_reason": "completed", "tokens_per_sec": 83008.21946816097, "baseline_ratio": 0.9999955616571842, "status": "ok", "decision": "discard", "proxy_mode": "fast", "evaluation_basis": "terminal_only", "curve_start_fvu": 0.3274161219596863, "curve_mid_fvu": 0.21220847964286804, "curve_end_fvu": 0.16795103251934052, "curve_late_slope": -6.732417175719034e-09, "curve_still_improving": true}}
