{"event_id": "evt_1774132627724938498", "ts": 1774132627, "event": "training_heartbeat", "round": 7, "session_id": "019d1279-dd8d-73d2-97df-ff57e75146ab", "tier": "full", "run_name": "round0007_full_1774132477", "family_name": "two_stage_residual", "family_stage": "prototype", "status": null, "decision": null, "payload": {"tier": "full", "run_name": "round0007_full_1774132477", "family_name": "two_stage_residual", "family_stage": "prototype", "checkpoint_dir": "/root/sparsify-ascend/checkpoints/research_agent/round_0007_full/round0007_full_1774132477_dp2_bs1_ga8_ef16_k128_20260322_063444", "metrics_path": "/root/sparsify-ascend/checkpoints/research_agent/round_0007_full/round0007_full_1774132477_dp2_bs1_ga8_ef16_k128_20260322_063444/metrics.jsonl", "latest_step": 560, "latest_tokens_per_sec": 122324.25739375246, "baseline_ratio": null, "latest_total_tokens": 18350080.0, "proxy_mode": null, "evaluation_basis": null}}
{"event_id": "evt_1774132657729401869", "ts": 1774132657, "event": "training_heartbeat", "round": 7, "session_id": "019d1279-dd8d-73d2-97df-ff57e75146ab", "tier": "full", "run_name": "round0007_full_1774132477", "family_name": "two_stage_residual", "family_stage": "prototype", "status": null, "decision": null, "payload": {"tier": "full", "run_name": "round0007_full_1774132477", "family_name": "two_stage_residual", "family_stage": "prototype", "checkpoint_dir": "/root/sparsify-ascend/checkpoints/research_agent/round_0007_full/round0007_full_1774132477_dp2_bs1_ga8_ef16_k128_20260322_063444", "metrics_path": "/root/sparsify-ascend/checkpoints/research_agent/round_0007_full/round0007_full_1774132477_dp2_bs1_ga8_ef16_k128_20260322_063444/metrics.jsonl", "latest_step": 690, "latest_tokens_per_sec": 125599.33390015415, "baseline_ratio": null, "latest_total_tokens": 22609920.0, "proxy_mode": null, "evaluation_basis": null}}
{"event_id": "evt_1774132687734520394", "ts": 1774132687, "event": "training_heartbeat", "round": 7, "session_id": "019d1279-dd8d-73d2-97df-ff57e75146ab", "tier": "full", "run_name": "round0007_full_1774132477", "family_name": "two_stage_residual", "family_stage": "prototype", "status": null, "decision": null, "payload": {"tier": "full", "run_name": "round0007_full_1774132477", "family_name": "two_stage_residual", "family_stage": "prototype", "checkpoint_dir": "/root/sparsify-ascend/checkpoints/research_agent/round_0007_full/round0007_full_1774132477_dp2_bs1_ga8_ef16_k128_20260322_063444", "metrics_path": "/root/sparsify-ascend/checkpoints/research_agent/round_0007_full/round0007_full_1774132477_dp2_bs1_ga8_ef16_k128_20260322_063444/metrics.jsonl", "latest_step": 810, "latest_tokens_per_sec": 126378.00202509172, "baseline_ratio": null, "latest_total_tokens": 26542080.0, "proxy_mode": null, "evaluation_basis": null}}
{"event_id": "evt_1774132717740430140", "ts": 1774132717, "event": "training_heartbeat", "round": 7, "session_id": "019d1279-dd8d-73d2-97df-ff57e75146ab", "tier": "full", "run_name": "round0007_full_1774132477", "family_name": "two_stage_residual", "family_stage": "prototype", "status": null, "decision": null, "payload": {"tier": "full", "run_name": "round0007_full_1774132477", "family_name": "two_stage_residual", "family_stage": "prototype", "checkpoint_dir": "/root/sparsify-ascend/checkpoints/research_agent/round_0007_full/round0007_full_1774132477_dp2_bs1_ga8_ef16_k128_20260322_063444", "metrics_path": "/root/sparsify-ascend/checkpoints/research_agent/round_0007_full/round0007_full_1774132477_dp2_bs1_ga8_ef16_k128_20260322_063444/metrics.jsonl", "latest_step": 940, "latest_tokens_per_sec": 128326.75305632695, "baseline_ratio": null, "latest_total_tokens": 30801920.0, "proxy_mode": null, "evaluation_basis": null}}
{"event_id": "evt_1774132747845047858", "ts": 1774132747, "event": "training_heartbeat", "round": 7, "session_id": "019d1279-dd8d-73d2-97df-ff57e75146ab", "tier": "full", "run_name": "round0007_full_1774132477", "family_name": "two_stage_residual", "family_stage": "prototype", "status": null, "decision": null, "payload": {"tier": "full", "run_name": "round0007_full_1774132477", "family_name": "two_stage_residual", "family_stage": "prototype", "checkpoint_dir": "/root/sparsify-ascend/checkpoints/research_agent/round_0007_full/round0007_full_1774132477_dp2_bs1_ga8_ef16_k128_20260322_063444", "metrics_path": "/root/sparsify-ascend/checkpoints/research_agent/round_0007_full/round0007_full_1774132477_dp2_bs1_ga8_ef16_k128_20260322_063444/metrics.jsonl", "latest_step": 1030, "latest_tokens_per_sec": 124988.24440862663, "baseline_ratio": null, "latest_total_tokens": 33751040.0, "proxy_mode": null, "evaluation_basis": null}}
{"event_id": "evt_1774132777981843317", "ts": 1774132777, "event": "training_heartbeat", "round": 7, "session_id": "019d1279-dd8d-73d2-97df-ff57e75146ab", "tier": "full", "run_name": "round0007_full_1774132477", "family_name": "two_stage_residual", "family_stage": "prototype", "status": null, "decision": null, "payload": {"tier": "full", "run_name": "round0007_full_1774132477", "family_name": "two_stage_residual", "family_stage": "prototype", "checkpoint_dir": "/root/sparsify-ascend/checkpoints/research_agent/round_0007_full/round0007_full_1774132477_dp2_bs1_ga8_ef16_k128_20260322_063444", "metrics_path": "/root/sparsify-ascend/checkpoints/research_agent/round_0007_full/round0007_full_1774132477_dp2_bs1_ga8_ef16_k128_20260322_063444/metrics.jsonl", "latest_step": 1150, "latest_tokens_per_sec": 125552.50440897146, "baseline_ratio": null, "latest_total_tokens": 37683200.0, "proxy_mode": null, "evaluation_basis": null}}
{"event_id": "evt_1774132808008691682", "ts": 1774132808, "event": "training_heartbeat", "round": 7, "session_id": "019d1279-dd8d-73d2-97df-ff57e75146ab", "tier": "full", "run_name": "round0007_full_1774132477", "family_name": "two_stage_residual", "family_stage": "prototype", "status": null, "decision": null, "payload": {"tier": "full", "run_name": "round0007_full_1774132477", "family_name": "two_stage_residual", "family_stage": "prototype", "checkpoint_dir": "/root/sparsify-ascend/checkpoints/research_agent/round_0007_full/round0007_full_1774132477_dp2_bs1_ga8_ef16_k128_20260322_063444", "metrics_path": "/root/sparsify-ascend/checkpoints/research_agent/round_0007_full/round0007_full_1774132477_dp2_bs1_ga8_ef16_k128_20260322_063444/metrics.jsonl", "latest_step": 1220, "latest_tokens_per_sec": 121040.98496670532, "baseline_ratio": null, "latest_total_tokens": 39976960.0, "proxy_mode": null, "evaluation_basis": null}}
{"event_id": "evt_1774132838016211532", "ts": 1774132838, "event": "training_heartbeat", "round": 7, "session_id": "019d1279-dd8d-73d2-97df-ff57e75146ab", "tier": "full", "run_name": "round0007_full_1774132477", "family_name": "two_stage_residual", "family_stage": "prototype", "status": null, "decision": null, "payload": {"tier": "full", "run_name": "round0007_full_1774132477", "family_name": "two_stage_residual", "family_stage": "prototype", "checkpoint_dir": "/root/sparsify-ascend/checkpoints/research_agent/round_0007_full/round0007_full_1774132477_dp2_bs1_ga8_ef16_k128_20260322_063444", "metrics_path": "/root/sparsify-ascend/checkpoints/research_agent/round_0007_full/round0007_full_1774132477_dp2_bs1_ga8_ef16_k128_20260322_063444/metrics.jsonl", "latest_step": 1220, "latest_tokens_per_sec": 110953.71655069539, "baseline_ratio": null, "latest_total_tokens": 39976960.0, "proxy_mode": null, "evaluation_basis": null}}
{"event_id": "evt_1774132868023735613", "ts": 1774132868, "event": "training_heartbeat", "round": 7, "session_id": "019d1279-dd8d-73d2-97df-ff57e75146ab", "tier": "full", "run_name": "round0007_full_1774132477", "family_name": "two_stage_residual", "family_stage": "prototype", "status": null, "decision": null, "payload": {"tier": "full", "run_name": "round0007_full_1774132477", "family_name": "two_stage_residual", "family_stage": "prototype", "checkpoint_dir": "/root/sparsify-ascend/checkpoints/research_agent/round_0007_full/round0007_full_1774132477_dp2_bs1_ga8_ef16_k128_20260322_063444", "metrics_path": "/root/sparsify-ascend/checkpoints/research_agent/round_0007_full/round0007_full_1774132477_dp2_bs1_ga8_ef16_k128_20260322_063444/metrics.jsonl", "latest_step": 1220, "latest_tokens_per_sec": 102423.4694306065, "baseline_ratio": null, "latest_total_tokens": 39976960.0, "proxy_mode": null, "evaluation_basis": null}}
{"event_id": "evt_1774132898031295714", "ts": 1774132898, "event": "training_heartbeat", "round": 7, "session_id": "019d1279-dd8d-73d2-97df-ff57e75146ab", "tier": "full", "run_name": "round0007_full_1774132477", "family_name": "two_stage_residual", "family_stage": "prototype", "status": null, "decision": null, "payload": {"tier": "full", "run_name": "round0007_full_1774132477", "family_name": "two_stage_residual", "family_stage": "prototype", "checkpoint_dir": "/root/sparsify-ascend/checkpoints/research_agent/round_0007_full/round0007_full_1774132477_dp2_bs1_ga8_ef16_k128_20260322_063444", "metrics_path": "/root/sparsify-ascend/checkpoints/research_agent/round_0007_full/round0007_full_1774132477_dp2_bs1_ga8_ef16_k128_20260322_063444/metrics.jsonl", "latest_step": 1220, "latest_tokens_per_sec": 95111.20004392976, "baseline_ratio": null, "latest_total_tokens": 39976960.0, "proxy_mode": null, "evaluation_basis": null}}
{"event_id": "evt_1774132928038844581", "ts": 1774132928, "event": "training_heartbeat", "round": 7, "session_id": "019d1279-dd8d-73d2-97df-ff57e75146ab", "tier": "full", "run_name": "round0007_full_1774132477", "family_name": "two_stage_residual", "family_stage": "prototype", "status": null, "decision": null, "payload": {"tier": "full", "run_name": "round0007_full_1774132477", "family_name": "two_stage_residual", "family_stage": "prototype", "checkpoint_dir": "/root/sparsify-ascend/checkpoints/research_agent/round_0007_full/round0007_full_1774132477_dp2_bs1_ga8_ef16_k128_20260322_063444", "metrics_path": "/root/sparsify-ascend/checkpoints/research_agent/round_0007_full/round0007_full_1774132477_dp2_bs1_ga8_ef16_k128_20260322_063444/metrics.jsonl", "latest_step": 1220, "latest_tokens_per_sec": 88773.44599235708, "baseline_ratio": null, "latest_total_tokens": 39976960.0, "proxy_mode": null, "evaluation_basis": null}}
{"event_id": "evt_1774132958046376510", "ts": 1774132958, "event": "training_heartbeat", "round": 7, "session_id": "019d1279-dd8d-73d2-97df-ff57e75146ab", "tier": "full", "run_name": "round0007_full_1774132477", "family_name": "two_stage_residual", "family_stage": "prototype", "status": null, "decision": null, "payload": {"tier": "full", "run_name": "round0007_full_1774132477", "family_name": "two_stage_residual", "family_stage": "prototype", "checkpoint_dir": "/root/sparsify-ascend/checkpoints/research_agent/round_0007_full/round0007_full_1774132477_dp2_bs1_ga8_ef16_k128_20260322_063444", "metrics_path": "/root/sparsify-ascend/checkpoints/research_agent/round_0007_full/round0007_full_1774132477_dp2_bs1_ga8_ef16_k128_20260322_063444/metrics.jsonl", "latest_step": 1220, "latest_tokens_per_sec": 83227.56110940345, "baseline_ratio": null, "latest_total_tokens": 39976960.0, "proxy_mode": null, "evaluation_basis": null}}
{"event_id": "evt_1774132958121781042", "ts": 1774132958, "event": "training_finished", "round": 7, "session_id": "019d1279-dd8d-73d2-97df-ff57e75146ab", "tier": "full", "run_name": "round0007_full_1774132477", "family_name": "two_stage_residual", "family_stage": "prototype", "status": "ok", "decision": "keep", "payload": {"tier": "full", "run_name": "round0007_full_1774132477", "family_name": "two_stage_residual", "family_stage": "prototype", "checkpoint_dir": "/root/sparsify-ascend/checkpoints/research_agent/round_0007_full/round0007_full_1774132477_dp2_bs1_ga8_ef16_k128_20260322_063444", "metrics_path": "/root/sparsify-ascend/checkpoints/research_agent/round_0007_full/round0007_full_1774132477_dp2_bs1_ga8_ef16_k128_20260322_063444/metrics.jsonl", "run_health": "normal", "termination_reason": "completed", "tokens_per_sec": 83227.56110940345, "baseline_ratio": null, "status": "ok", "decision": "keep", "proxy_mode": null, "evaluation_basis": null, "curve_start_fvu": 0.18473176658153534, "curve_mid_fvu": 0.1584618091583252, "curve_end_fvu": 0.13206832110881805, "curve_late_slope": -1.893409553005887e-09, "curve_still_improving": true}}
{"event_id": "evt_1774132958121839516", "ts": 1774132958, "event": "result_recorded", "round": 7, "session_id": "019d1279-dd8d-73d2-97df-ff57e75146ab", "tier": "full", "run_name": "round0007_full_1774132477", "family_name": "two_stage_residual", "family_stage": "prototype", "status": "ok", "decision": "keep", "payload": {"tier": "full", "run_name": "round0007_full_1774132477", "family_name": "two_stage_residual", "family_stage": "prototype", "status": "ok", "decision": "keep", "val_fvu": "0.13607123959809542", "observed_fvu": "0.132068", "k": "128", "log_path": "/root/sparsify-ascend/research/history/logs/full_1774132958.log", "checkpoint": null}}
{"event_id": "evt_1774132958122248433", "ts": 1774132958, "event": "round_finished", "round": 7, "session_id": "019d1279-dd8d-73d2-97df-ff57e75146ab", "tier": "full", "run_name": null, "family_name": "two_stage_residual", "family_stage": "prototype", "status": "ok", "decision": "keep", "payload": {"tier": "full", "family_name": "two_stage_residual", "family_stage": "prototype", "status": "ok", "decision": "keep", "val_fvu": "0.13607123959809542"}}
{"event_id": "evt_1774132958128050456", "ts": 1774132958, "event": "experiment_commit_prepared", "round": 7, "tier": "full", "run_name": null, "family_name": "two_stage_residual", "family_stage": "prototype", "status": "ok", "decision": "keep", "payload": {"branch": "autoresearch-sae"}}
{"event_id": "evt_1774132965528073100", "ts": 1774132965, "event": "round_started", "round": 8, "session_id": "019d1279-dd8d-73d2-97df-ff57e75146ab", "tier": null, "run_name": null, "family_name": null, "family_stage": null, "status": "started", "decision": null, "payload": {"status": "started"}}
{"event_id": "evt_1774132965528236111", "ts": 1774132965, "event": "agent_deciding", "round": 8, "session_id": "019d1279-dd8d-73d2-97df-ff57e75146ab", "tier": null, "run_name": null, "family_name": null, "family_stage": null, "status": null, "decision": null, "payload": {}}
{"event_id": "evt_1774133090297113451", "ts": 1774133090, "event": "session_resumed", "round": 8, "tier": null, "run_name": null, "family_name": null, "family_stage": null, "status": "active", "decision": null, "payload": {"session_id": "019d1279-dd8d-73d2-97df-ff57e75146ab"}}
{"event_id": "evt_1774133090302267842", "ts": 1774133090, "event": "agent_action_received", "round": 8, "session_id": "019d1279-dd8d-73d2-97df-ff57e75146ab", "tier": "proxy", "run_name": null, "family_name": "two_stage_residual", "family_stage": "stabilize", "status": null, "decision": null, "payload": {"session_id": "019d1279-dd8d-73d2-97df-ff57e75146ab", "tier": "proxy", "family_name": "two_stage_residual", "family_stage": "stabilize", "change_type": "param_only", "expected_win": "pareto_improve", "hypothesis": "`two_stage_residual` has now produced a real full-fidelity gain at K=128, so the next informative move is to map whether that architectural win also strengthens the lower-K Pareto frontier rather than assuming the gain is confined to the anchor point. Running the same strong recipe at K=64 isolates whether staged residual allocation preserves enough of the new quality advantage to create a better non-dominated tradeoff than the current gated K=64 point."}}
{"event_id": "evt_1774133090302394967", "ts": 1774133090, "event": "proxy_mode_selected", "round": 8, "session_id": "019d1279-dd8d-73d2-97df-ff57e75146ab", "tier": "proxy", "run_name": null, "family_name": "two_stage_residual", "family_stage": "stabilize", "status": null, "decision": null, "payload": {"tier": "proxy", "proxy_mode": "fast", "evaluation_basis": "terminal_only", "parameter_behavior": "structural", "proxy_max_tokens": "5000000"}}
{"event_id": "evt_1774133090302673174", "ts": 1774133090, "event": "training_started", "round": 8, "session_id": "019d1279-dd8d-73d2-97df-ff57e75146ab", "tier": "proxy", "run_name": "round0008_proxy_1774133090", "family_name": "two_stage_residual", "family_stage": "stabilize", "status": null, "decision": null, "payload": {"tier": "proxy", "run_name": "round0008_proxy_1774133090", "family_name": "two_stage_residual", "family_stage": "stabilize", "checkpoint_dir": "/root/sparsify-ascend/checkpoints/research_agent/round_0008_proxy", "log_path": "/root/sparsify-ascend/research/history/logs/round0008_proxy_1774133090.log", "config": {"architecture": "two_stage_residual", "expansion_factor": 16, "k": 64, "optimizer": "signum", "lr": "1.6e-3", "hookpoints": "layers.[3].self_attn.o_proj", "batch_size": 1, "grad_acc_steps": 8, "micro_acc_steps": 1, "auxk_alpha": 0.0, "dead_feature_threshold": 10000000, "use_hadamard": false, "tier": "proxy", "family_name": "two_stage_residual", "family_stage": "stabilize"}, "baseline_tokens_per_sec": 110860.4803471805, "proxy_mode": "fast", "evaluation_basis": "terminal_only"}}
{"event_id": "evt_1774133120304954188", "ts": 1774133120, "event": "training_heartbeat", "round": 8, "session_id": "019d1279-dd8d-73d2-97df-ff57e75146ab", "tier": "proxy", "run_name": "round0008_proxy_1774133090", "family_name": "two_stage_residual", "family_stage": "stabilize", "status": null, "decision": null, "payload": {"tier": "proxy", "run_name": "round0008_proxy_1774133090", "family_name": "two_stage_residual", "family_stage": "stabilize", "checkpoint_dir": "/root/sparsify-ascend/checkpoints/research_agent/round_0008_proxy/round0008_proxy_1774133090_dp2_bs1_ga8_ef16_k64_20260322_064456", "metrics_path": "/root/sparsify-ascend/checkpoints/research_agent/round_0008_proxy/round0008_proxy_1774133090_dp2_bs1_ga8_ef16_k64_20260322_064456/metrics.jsonl", "latest_step": 60, "latest_tokens_per_sec": 65533.58186006088, "baseline_ratio": 0.5911356477513908, "latest_total_tokens": 1966080.0, "proxy_mode": "fast", "evaluation_basis": "terminal_only"}}
{"event_id": "evt_1774133150311815969", "ts": 1774133150, "event": "training_heartbeat", "round": 8, "session_id": "019d1279-dd8d-73d2-97df-ff57e75146ab", "tier": "proxy", "run_name": "round0008_proxy_1774133090", "family_name": "two_stage_residual", "family_stage": "stabilize", "status": null, "decision": null, "payload": {"tier": "proxy", "run_name": "round0008_proxy_1774133090", "family_name": "two_stage_residual", "family_stage": "stabilize", "checkpoint_dir": "/root/sparsify-ascend/checkpoints/research_agent/round_0008_proxy/round0008_proxy_1774133090_dp2_bs1_ga8_ef16_k64_20260322_064456", "metrics_path": "/root/sparsify-ascend/checkpoints/research_agent/round_0008_proxy/round0008_proxy_1774133090_dp2_bs1_ga8_ef16_k64_20260322_064456/metrics.jsonl", "latest_step": 152, "latest_tokens_per_sec": 83008.79238499724, "baseline_ratio": 0.7487681103765702, "latest_total_tokens": 4980736.0, "proxy_mode": "fast", "evaluation_basis": "terminal_only"}}
{"event_id": "evt_1774133150491968574", "ts": 1774133150, "event": "training_finished", "round": 8, "session_id": "019d1279-dd8d-73d2-97df-ff57e75146ab", "tier": "proxy", "run_name": "round0008_proxy_1774133090", "family_name": "two_stage_residual", "family_stage": "stabilize", "status": "ok", "decision": "discard", "payload": {"tier": "proxy", "run_name": "round0008_proxy_1774133090", "family_name": "two_stage_residual", "family_stage": "stabilize", "checkpoint_dir": "/root/sparsify-ascend/checkpoints/research_agent/round_0008_proxy/round0008_proxy_1774133090_dp2_bs1_ga8_ef16_k64_20260322_064456", "metrics_path": "/root/sparsify-ascend/checkpoints/research_agent/round_0008_proxy/round0008_proxy_1774133090_dp2_bs1_ga8_ef16_k64_20260322_064456/metrics.jsonl", "run_health": "normal", "termination_reason": "completed", "tokens_per_sec": 83008.79238499724, "baseline_ratio": 0.7487681103765702, "status": "ok", "decision": "discard", "proxy_mode": "fast", "evaluation_basis": "terminal_only", "curve_start_fvu": 0.4629829525947571, "curve_mid_fvu": 0.34127378463745117, "curve_end_fvu": 0.29066747426986694, "curve_late_slope": -6.9882052259579785e-09, "curve_still_improving": true}}
{"event_id": "evt_1774133150492041616", "ts": 1774133150, "event": "result_recorded", "round": 8, "session_id": "019d1279-dd8d-73d2-97df-ff57e75146ab", "tier": "proxy", "run_name": "round0008_proxy_1774133090", "family_name": "two_stage_residual", "family_stage": "stabilize", "status": "ok", "decision": "discard", "payload": {"tier": "proxy", "run_name": "round0008_proxy_1774133090", "family_name": "two_stage_residual", "family_stage": "stabilize", "status": "ok", "decision": "discard", "val_fvu": "0.2899633552879095", "observed_fvu": "0.290667", "k": "64", "log_path": "/root/sparsify-ascend/research/history/logs/proxy_1774133150.log", "checkpoint": null}}
{"event_id": "evt_1774133150492178924", "ts": 1774133150, "event": "round_finished", "round": 8, "session_id": "019d1279-dd8d-73d2-97df-ff57e75146ab", "tier": "proxy", "run_name": null, "family_name": "two_stage_residual", "family_stage": "stabilize", "status": "ok", "decision": "discard", "payload": {"tier": "proxy", "family_name": "two_stage_residual", "family_stage": "stabilize", "status": "ok", "decision": "discard", "val_fvu": "0.2899633552879095"}}
{"event_id": "evt_1774133150542749064", "ts": 1774133150, "event": "experiment_commit_prepared", "round": 8, "tier": "proxy", "run_name": null, "family_name": "two_stage_residual", "family_stage": "stabilize", "status": "ok", "decision": "discard", "payload": {"branch": "autoresearch-sae"}}
{"event_id": "evt_1774133158462991651", "ts": 1774133158, "event": "round_started", "round": 9, "session_id": "019d1279-dd8d-73d2-97df-ff57e75146ab", "tier": null, "run_name": null, "family_name": null, "family_stage": null, "status": "started", "decision": null, "payload": {"status": "started"}}
