{"event_id": "evt_1774143591380114724", "ts": 1774143591, "event": "result_recorded", "round": 24, "session_id": "019d130c-782e-75a2-aa6f-506b18d29edf", "tier": "proxy", "run_name": "round0024_proxy_1774143500", "family_name": "lowrank_gated_residual", "family_stage": "stabilize", "status": "ok", "decision": "promote", "payload": {"tier": "proxy", "run_name": "round0024_proxy_1774143500", "family_name": "lowrank_gated_residual", "family_stage": "stabilize", "status": "ok", "decision": "promote", "val_fvu": "0.1756359562277794", "observed_fvu": "0.174893", "k": "32", "log_path": "/root/sparsify-ascend/research/history/logs/proxy_1774143591.log", "checkpoint": null}}
{"event_id": "evt_1774143591380566615", "ts": 1774143591, "event": "training_started", "round": 24, "session_id": "019d130c-782e-75a2-aa6f-506b18d29edf", "tier": "full", "run_name": "round0024_full_1774143591", "family_name": "lowrank_gated_residual", "family_stage": "stabilize", "status": null, "decision": null, "payload": {"tier": "full", "run_name": "round0024_full_1774143591", "family_name": "lowrank_gated_residual", "family_stage": "stabilize", "checkpoint_dir": "/root/sparsify-ascend/checkpoints/research_agent/round_0024_full", "log_path": "/root/sparsify-ascend/research/history/logs/round0024_full_1774143591.log", "config": {"architecture": "lowrank_gated_residual", "expansion_factor": 32, "k": 32, "optimizer": "signum", "lr": "1.6e-3", "hookpoints": "layers.[3].self_attn.o_proj", "batch_size": 1, "grad_acc_steps": 8, "micro_acc_steps": 1, "auxk_alpha": 0.0, "dead_feature_threshold": 10000000, "use_hadamard": false, "tier": "full", "family_name": "lowrank_gated_residual", "family_stage": "stabilize"}, "baseline_tokens_per_sec": 78283.77131027532, "proxy_mode": null, "evaluation_basis": null}}
{"event_id": "evt_1774143621381841587", "ts": 1774143621, "event": "training_heartbeat", "round": 24, "session_id": "019d130c-782e-75a2-aa6f-506b18d29edf", "tier": "full", "run_name": "round0024_full_1774143591", "family_name": "lowrank_gated_residual", "family_stage": "stabilize", "status": null, "decision": null, "payload": {"tier": "full", "run_name": "round0024_full_1774143591", "family_name": "lowrank_gated_residual", "family_stage": "stabilize", "checkpoint_dir": "/root/sparsify-ascend/checkpoints/research_agent/round_0024_full/round0024_full_1774143591_dp2_bs1_ga8_ef32_k32_20260322_094000", "metrics_path": "/root/sparsify-ascend/checkpoints/research_agent/round_0024_full/round0024_full_1774143591_dp2_bs1_ga8_ef32_k32_20260322_094000/metrics.jsonl", "latest_step": 40, "latest_tokens_per_sec": 43689.250045933826, "baseline_ratio": 0.5580882131083443, "latest_total_tokens": 1310720.0, "proxy_mode": null, "evaluation_basis": null}}
{"event_id": "evt_1774143651383183497", "ts": 1774143651, "event": "training_heartbeat", "round": 24, "session_id": "019d130c-782e-75a2-aa6f-506b18d29edf", "tier": "full", "run_name": "round0024_full_1774143591", "family_name": "lowrank_gated_residual", "family_stage": "stabilize", "status": null, "decision": null, "payload": {"tier": "full", "run_name": "round0024_full_1774143591", "family_name": "lowrank_gated_residual", "family_stage": "stabilize", "checkpoint_dir": "/root/sparsify-ascend/checkpoints/research_agent/round_0024_full/round0024_full_1774143591_dp2_bs1_ga8_ef32_k32_20260322_094000", "metrics_path": "/root/sparsify-ascend/checkpoints/research_agent/round_0024_full/round0024_full_1774143591_dp2_bs1_ga8_ef32_k32_20260322_094000/metrics.jsonl", "latest_step": 140, "latest_tokens_per_sec": 76455.72094682734, "baseline_ratio": 0.9766484121440373, "latest_total_tokens": 4587520.0, "proxy_mode": null, "evaluation_basis": null}}
{"event_id": "evt_1774143681385109514", "ts": 1774143681, "event": "training_heartbeat", "round": 24, "session_id": "019d130c-782e-75a2-aa6f-506b18d29edf", "tier": "full", "run_name": "round0024_full_1774143591", "family_name": "lowrank_gated_residual", "family_stage": "stabilize", "status": null, "decision": null, "payload": {"tier": "full", "run_name": "round0024_full_1774143591", "family_name": "lowrank_gated_residual", "family_stage": "stabilize", "checkpoint_dir": "/root/sparsify-ascend/checkpoints/research_agent/round_0024_full/round0024_full_1774143591_dp2_bs1_ga8_ef32_k32_20260322_094000", "metrics_path": "/root/sparsify-ascend/checkpoints/research_agent/round_0024_full/round0024_full_1774143591_dp2_bs1_ga8_ef32_k32_20260322_094000/metrics.jsonl", "latest_step": 240, "latest_tokens_per_sec": 87377.2279706656, "baseline_ratio": 1.1161601760899924, "latest_total_tokens": 7864320.0, "proxy_mode": null, "evaluation_basis": null}}
{"event_id": "evt_1774143711387807839", "ts": 1774143711, "event": "training_heartbeat", "round": 24, "session_id": "019d130c-782e-75a2-aa6f-506b18d29edf", "tier": "full", "run_name": "round0024_full_1774143591", "family_name": "lowrank_gated_residual", "family_stage": "stabilize", "status": null, "decision": null, "payload": {"tier": "full", "run_name": "round0024_full_1774143591", "family_name": "lowrank_gated_residual", "family_stage": "stabilize", "checkpoint_dir": "/root/sparsify-ascend/checkpoints/research_agent/round_0024_full/round0024_full_1774143591_dp2_bs1_ga8_ef32_k32_20260322_094000", "metrics_path": "/root/sparsify-ascend/checkpoints/research_agent/round_0024_full/round0024_full_1774143591_dp2_bs1_ga8_ef32_k32_20260322_094000/metrics.jsonl", "latest_step": 340, "latest_tokens_per_sec": 92837.46365965424, "baseline_ratio": 1.1859094433723154, "latest_total_tokens": 11141120.0, "proxy_mode": null, "evaluation_basis": null}}
{"event_id": "evt_1774143741390898970", "ts": 1774143741, "event": "training_heartbeat", "round": 24, "session_id": "019d130c-782e-75a2-aa6f-506b18d29edf", "tier": "full", "run_name": "round0024_full_1774143591", "family_name": "lowrank_gated_residual", "family_stage": "stabilize", "status": null, "decision": null, "payload": {"tier": "full", "run_name": "round0024_full_1774143591", "family_name": "lowrank_gated_residual", "family_stage": "stabilize", "checkpoint_dir": "/root/sparsify-ascend/checkpoints/research_agent/round_0024_full/round0024_full_1774143591_dp2_bs1_ga8_ef32_k32_20260322_094000", "metrics_path": "/root/sparsify-ascend/checkpoints/research_agent/round_0024_full/round0024_full_1774143591_dp2_bs1_ga8_ef32_k32_20260322_094000/metrics.jsonl", "latest_step": 440, "latest_tokens_per_sec": 96113.0467621531, "baseline_ratio": 1.2277518718561986, "latest_total_tokens": 14417920.0, "proxy_mode": null, "evaluation_basis": null}}
{"event_id": "evt_1774143771394568374", "ts": 1774143771, "event": "training_heartbeat", "round": 24, "session_id": "019d130c-782e-75a2-aa6f-506b18d29edf", "tier": "full", "run_name": "round0024_full_1774143591", "family_name": "lowrank_gated_residual", "family_stage": "stabilize", "status": null, "decision": null, "payload": {"tier": "full", "run_name": "round0024_full_1774143591", "family_name": "lowrank_gated_residual", "family_stage": "stabilize", "checkpoint_dir": "/root/sparsify-ascend/checkpoints/research_agent/round_0024_full/round0024_full_1774143591_dp2_bs1_ga8_ef32_k32_20260322_094000", "metrics_path": "/root/sparsify-ascend/checkpoints/research_agent/round_0024_full/round0024_full_1774143591_dp2_bs1_ga8_ef32_k32_20260322_094000/metrics.jsonl", "latest_step": 540, "latest_tokens_per_sec": 98296.52400609065, "baseline_ratio": 1.255643696782254, "latest_total_tokens": 17694720.0, "proxy_mode": null, "evaluation_basis": null}}
{"event_id": "evt_1774143801398783367", "ts": 1774143801, "event": "training_heartbeat", "round": 24, "session_id": "019d130c-782e-75a2-aa6f-506b18d29edf", "tier": "full", "run_name": "round0024_full_1774143591", "family_name": "lowrank_gated_residual", "family_stage": "stabilize", "status": null, "decision": null, "payload": {"tier": "full", "run_name": "round0024_full_1774143591", "family_name": "lowrank_gated_residual", "family_stage": "stabilize", "checkpoint_dir": "/root/sparsify-ascend/checkpoints/research_agent/round_0024_full/round0024_full_1774143591_dp2_bs1_ga8_ef32_k32_20260322_094000", "metrics_path": "/root/sparsify-ascend/checkpoints/research_agent/round_0024_full/round0024_full_1774143591_dp2_bs1_ga8_ef32_k32_20260322_094000/metrics.jsonl", "latest_step": 640, "latest_tokens_per_sec": 99855.86988642573, "baseline_ratio": 1.275562842912231, "latest_total_tokens": 20971520.0, "proxy_mode": null, "evaluation_basis": null}}
{"event_id": "evt_1774143831403557298", "ts": 1774143831, "event": "training_heartbeat", "round": 24, "session_id": "019d130c-782e-75a2-aa6f-506b18d29edf", "tier": "full", "run_name": "round0024_full_1774143591", "family_name": "lowrank_gated_residual", "family_stage": "stabilize", "status": null, "decision": null, "payload": {"tier": "full", "run_name": "round0024_full_1774143591", "family_name": "lowrank_gated_residual", "family_stage": "stabilize", "checkpoint_dir": "/root/sparsify-ascend/checkpoints/research_agent/round_0024_full/round0024_full_1774143591_dp2_bs1_ga8_ef32_k32_20260322_094000", "metrics_path": "/root/sparsify-ascend/checkpoints/research_agent/round_0024_full/round0024_full_1774143591_dp2_bs1_ga8_ef32_k32_20260322_094000/metrics.jsonl", "latest_step": 740, "latest_tokens_per_sec": 101025.13081274983, "baseline_ratio": 1.290499028366171, "latest_total_tokens": 24248320.0, "proxy_mode": null, "evaluation_basis": null}}
{"event_id": "evt_1774143861408920278", "ts": 1774143861, "event": "training_heartbeat", "round": 24, "session_id": "019d130c-782e-75a2-aa6f-506b18d29edf", "tier": "full", "run_name": "round0024_full_1774143591", "family_name": "lowrank_gated_residual", "family_stage": "stabilize", "status": null, "decision": null, "payload": {"tier": "full", "run_name": "round0024_full_1774143591", "family_name": "lowrank_gated_residual", "family_stage": "stabilize", "checkpoint_dir": "/root/sparsify-ascend/checkpoints/research_agent/round_0024_full/round0024_full_1774143591_dp2_bs1_ga8_ef32_k32_20260322_094000", "metrics_path": "/root/sparsify-ascend/checkpoints/research_agent/round_0024_full/round0024_full_1774143591_dp2_bs1_ga8_ef32_k32_20260322_094000/metrics.jsonl", "latest_step": 840, "latest_tokens_per_sec": 101934.30923848244, "baseline_ratio": 1.3021129096408621, "latest_total_tokens": 27525120.0, "proxy_mode": null, "evaluation_basis": null}}
{"event_id": "evt_1774143891414804757", "ts": 1774143891, "event": "training_heartbeat", "round": 24, "session_id": "019d130c-782e-75a2-aa6f-506b18d29edf", "tier": "full", "run_name": "round0024_full_1774143591", "family_name": "lowrank_gated_residual", "family_stage": "stabilize", "status": null, "decision": null, "payload": {"tier": "full", "run_name": "round0024_full_1774143591", "family_name": "lowrank_gated_residual", "family_stage": "stabilize", "checkpoint_dir": "/root/sparsify-ascend/checkpoints/research_agent/round_0024_full/round0024_full_1774143591_dp2_bs1_ga8_ef32_k32_20260322_094000", "metrics_path": "/root/sparsify-ascend/checkpoints/research_agent/round_0024_full/round0024_full_1774143591_dp2_bs1_ga8_ef32_k32_20260322_094000/metrics.jsonl", "latest_step": 940, "latest_tokens_per_sec": 102661.45897912035, "baseline_ratio": 1.3114015492716213, "latest_total_tokens": 30801920.0, "proxy_mode": null, "evaluation_basis": null}}
{"event_id": "evt_1774143921656931040", "ts": 1774143921, "event": "training_heartbeat", "round": 24, "session_id": "019d130c-782e-75a2-aa6f-506b18d29edf", "tier": "full", "run_name": "round0024_full_1774143591", "family_name": "lowrank_gated_residual", "family_stage": "stabilize", "status": null, "decision": null, "payload": {"tier": "full", "run_name": "round0024_full_1774143591", "family_name": "lowrank_gated_residual", "family_stage": "stabilize", "checkpoint_dir": "/root/sparsify-ascend/checkpoints/research_agent/round_0024_full/round0024_full_1774143591_dp2_bs1_ga8_ef32_k32_20260322_094000", "metrics_path": "/root/sparsify-ascend/checkpoints/research_agent/round_0024_full/round0024_full_1774143591_dp2_bs1_ga8_ef32_k32_20260322_094000/metrics.jsonl", "latest_step": 990, "latest_tokens_per_sec": 98292.05003237634, "baseline_ratio": 1.255586546064558, "latest_total_tokens": 32440320.0, "proxy_mode": null, "evaluation_basis": null}}
{"event_id": "evt_1774143951757749215", "ts": 1774143951, "event": "training_heartbeat", "round": 24, "session_id": "019d130c-782e-75a2-aa6f-506b18d29edf", "tier": "full", "run_name": "round0024_full_1774143591", "family_name": "lowrank_gated_residual", "family_stage": "stabilize", "status": null, "decision": null, "payload": {"tier": "full", "run_name": "round0024_full_1774143591", "family_name": "lowrank_gated_residual", "family_stage": "stabilize", "checkpoint_dir": "/root/sparsify-ascend/checkpoints/research_agent/round_0024_full/round0024_full_1774143591_dp2_bs1_ga8_ef32_k32_20260322_094000", "metrics_path": "/root/sparsify-ascend/checkpoints/research_agent/round_0024_full/round0024_full_1774143591_dp2_bs1_ga8_ef32_k32_20260322_094000/metrics.jsonl", "latest_step": 1090, "latest_tokens_per_sec": 99136.35299925582, "baseline_ratio": 1.2663717056544443, "latest_total_tokens": 35717120.0, "proxy_mode": null, "evaluation_basis": null}}
{"event_id": "evt_1774143981970630209", "ts": 1774143981, "event": "training_heartbeat", "round": 24, "session_id": "019d130c-782e-75a2-aa6f-506b18d29edf", "tier": "full", "run_name": "round0024_full_1774143591", "family_name": "lowrank_gated_residual", "family_stage": "stabilize", "status": null, "decision": null, "payload": {"tier": "full", "run_name": "round0024_full_1774143591", "family_name": "lowrank_gated_residual", "family_stage": "stabilize", "checkpoint_dir": "/root/sparsify-ascend/checkpoints/research_agent/round_0024_full/round0024_full_1774143591_dp2_bs1_ga8_ef32_k32_20260322_094000", "metrics_path": "/root/sparsify-ascend/checkpoints/research_agent/round_0024_full/round0024_full_1774143591_dp2_bs1_ga8_ef32_k32_20260322_094000/metrics.jsonl", "latest_step": 1190, "latest_tokens_per_sec": 99886.0178197547, "baseline_ratio": 1.2759479538084535, "latest_total_tokens": 38993920.0, "proxy_mode": null, "evaluation_basis": null}}
{"event_id": "evt_1774144012094221077", "ts": 1774144012, "event": "training_heartbeat", "round": 24, "session_id": "019d130c-782e-75a2-aa6f-506b18d29edf", "tier": "full", "run_name": "round0024_full_1774143591", "family_name": "lowrank_gated_residual", "family_stage": "stabilize", "status": null, "decision": null, "payload": {"tier": "full", "run_name": "round0024_full_1774143591", "family_name": "lowrank_gated_residual", "family_stage": "stabilize", "checkpoint_dir": "/root/sparsify-ascend/checkpoints/research_agent/round_0024_full/round0024_full_1774143591_dp2_bs1_ga8_ef32_k32_20260322_094000", "metrics_path": "/root/sparsify-ascend/checkpoints/research_agent/round_0024_full/round0024_full_1774143591_dp2_bs1_ga8_ef32_k32_20260322_094000/metrics.jsonl", "latest_step": 1220, "latest_tokens_per_sec": 95048.08576679869, "baseline_ratio": 1.214148017857731, "latest_total_tokens": 39976960.0, "proxy_mode": null, "evaluation_basis": null}}
{"event_id": "evt_1774144042101772730", "ts": 1774144042, "event": "training_heartbeat", "round": 24, "session_id": "019d130c-782e-75a2-aa6f-506b18d29edf", "tier": "full", "run_name": "round0024_full_1774143591", "family_name": "lowrank_gated_residual", "family_stage": "stabilize", "status": null, "decision": null, "payload": {"tier": "full", "run_name": "round0024_full_1774143591", "family_name": "lowrank_gated_residual", "family_stage": "stabilize", "checkpoint_dir": "/root/sparsify-ascend/checkpoints/research_agent/round_0024_full/round0024_full_1774143591_dp2_bs1_ga8_ef32_k32_20260322_094000", "metrics_path": "/root/sparsify-ascend/checkpoints/research_agent/round_0024_full/round0024_full_1774143591_dp2_bs1_ga8_ef32_k32_20260322_094000/metrics.jsonl", "latest_step": 1220, "latest_tokens_per_sec": 88695.60575375632, "baseline_ratio": 1.133001186187288, "latest_total_tokens": 39976960.0, "proxy_mode": null, "evaluation_basis": null}}
{"event_id": "evt_1774144042181909187", "ts": 1774144042, "event": "training_finished", "round": 24, "session_id": "019d130c-782e-75a2-aa6f-506b18d29edf", "tier": "full", "run_name": "round0024_full_1774143591", "family_name": "lowrank_gated_residual", "family_stage": "stabilize", "status": "ok", "decision": "keep", "payload": {"tier": "full", "run_name": "round0024_full_1774143591", "family_name": "lowrank_gated_residual", "family_stage": "stabilize", "checkpoint_dir": "/root/sparsify-ascend/checkpoints/research_agent/round_0024_full/round0024_full_1774143591_dp2_bs1_ga8_ef32_k32_20260322_094000", "metrics_path": "/root/sparsify-ascend/checkpoints/research_agent/round_0024_full/round0024_full_1774143591_dp2_bs1_ga8_ef32_k32_20260322_094000/metrics.jsonl", "run_health": "normal", "termination_reason": "completed", "tokens_per_sec": 88695.60575375632, "baseline_ratio": 1.133001186187288, "status": "ok", "decision": "keep", "proxy_mode": null, "evaluation_basis": null, "curve_start_fvu": 0.13273076713085175, "curve_mid_fvu": 0.11536510288715363, "curve_end_fvu": 0.09365683794021606, "curve_late_slope": -1.4684444261651837e-09, "curve_still_improving": true}}
{"event_id": "evt_1774144042181971764", "ts": 1774144042, "event": "result_recorded", "round": 24, "session_id": "019d130c-782e-75a2-aa6f-506b18d29edf", "tier": "full", "run_name": "round0024_full_1774143591", "family_name": "lowrank_gated_residual", "family_stage": "stabilize", "status": "ok", "decision": "keep", "payload": {"tier": "full", "run_name": "round0024_full_1774143591", "family_name": "lowrank_gated_residual", "family_stage": "stabilize", "status": "ok", "decision": "keep", "val_fvu": "0.09578194748610258", "observed_fvu": "0.093657", "k": "32", "log_path": "/root/sparsify-ascend/research/history/logs/full_1774144042.log", "checkpoint": null}}
{"event_id": "evt_1774144042182520321", "ts": 1774144042, "event": "round_finished", "round": 24, "session_id": "019d130c-782e-75a2-aa6f-506b18d29edf", "tier": "full", "run_name": null, "family_name": "lowrank_gated_residual", "family_stage": "stabilize", "status": "ok", "decision": "keep", "payload": {"tier": "full", "family_name": "lowrank_gated_residual", "family_stage": "stabilize", "status": "ok", "decision": "keep", "val_fvu": "0.09578194748610258"}}
{"event_id": "evt_1774144042188963884", "ts": 1774144042, "event": "experiment_commit_prepared", "round": 24, "tier": "full", "run_name": null, "family_name": "lowrank_gated_residual", "family_stage": "stabilize", "status": "ok", "decision": "keep", "payload": {"branch": "autoresearch-sae"}}
{"event_id": "evt_1774144049778505597", "ts": 1774144049, "event": "round_started", "round": 25, "session_id": "019d130c-782e-75a2-aa6f-506b18d29edf", "tier": null, "run_name": null, "family_name": null, "family_stage": null, "status": "started", "decision": null, "payload": {"status": "started"}}
{"event_id": "evt_1774144049778677889", "ts": 1774144049, "event": "agent_deciding", "round": 25, "session_id": "019d130c-782e-75a2-aa6f-506b18d29edf", "tier": null, "run_name": null, "family_name": null, "family_stage": null, "status": null, "decision": null, "payload": {}}
{"event_id": "evt_1774144175400817745", "ts": 1774144175, "event": "session_resumed", "round": 25, "tier": null, "run_name": null, "family_name": null, "family_stage": null, "status": "active", "decision": null, "payload": {"session_id": "019d130c-782e-75a2-aa6f-506b18d29edf"}}
{"event_id": "evt_1774144175401547846", "ts": 1774144175, "event": "agent_action_received", "round": 25, "session_id": "019d130c-782e-75a2-aa6f-506b18d29edf", "tier": "proxy", "run_name": null, "family_name": "lowrank_gated_residual", "family_stage": "stabilize", "status": null, "decision": null, "payload": {"session_id": "019d130c-782e-75a2-aa6f-506b18d29edf", "tier": "proxy", "family_name": "lowrank_gated_residual", "family_stage": "stabilize", "change_type": "param_only", "expected_win": "lower_fvu", "hypothesis": "`lowrank_gated_residual` now owns the full frontier at K={32,64,128} under the shared EF=32 signum recipe, so the next clean move is a family-internal stabilization step rather than another K sweep. Changing only `AUXK_ALPHA` from 0.0 to a small positive value at the K=128 anchor may improve feature utilization and reduce residual support collapse inside the gated selector, potentially lowering FVU further without changing architecture, K, or optimizer."}}
{"event_id": "evt_1774144175401677931", "ts": 1774144175, "event": "proxy_mode_selected", "round": 25, "session_id": "019d130c-782e-75a2-aa6f-506b18d29edf", "tier": "proxy", "run_name": null, "family_name": "lowrank_gated_residual", "family_stage": "stabilize", "status": null, "decision": null, "payload": {"tier": "proxy", "proxy_mode": "extended", "evaluation_basis": "curve_extended", "parameter_behavior": "dynamic", "proxy_max_tokens": "20000000"}}
