{"event_id": "evt_1774171155875374418", "ts": 1774171155, "event": "repair_loop_blocked", "round": 84, "session_id": "019d14b3-7a66-7a10-a3d2-e744f4a315a4", "tier": null, "run_name": null, "family_name": "residual_vq_topk", "family_stage": "prototype", "status": null, "decision": null, "payload": {"repair_attempt": 1, "failure_kind": "post_repair_validation", "reason": "no_code_changes"}}
{"event_id": "evt_1774171155875441141", "ts": 1774171155, "event": "round_finished", "round": 84, "session_id": "019d14b3-7a66-7a10-a3d2-e744f4a315a4", "tier": "proxy", "run_name": null, "family_name": "residual_vq_topk", "family_stage": "prototype", "status": "crash", "decision": "crash", "payload": {"tier": "proxy", "family_name": "residual_vq_topk", "family_stage": "prototype", "status": "crash", "decision": "crash", "val_fvu": null}}
{"event_id": "evt_1774171163384072688", "ts": 1774171163, "event": "round_started", "round": 85, "session_id": "019d14b3-7a66-7a10-a3d2-e744f4a315a4", "tier": null, "run_name": null, "family_name": null, "family_stage": null, "status": "started", "decision": null, "payload": {"status": "started"}}
{"event_id": "evt_1774171163384633200", "ts": 1774171163, "event": "agent_deciding", "round": 85, "session_id": "019d14b3-7a66-7a10-a3d2-e744f4a315a4", "tier": null, "run_name": null, "family_name": null, "family_stage": null, "status": null, "decision": null, "payload": {}}
{"event_id": "evt_1774171297503407446", "ts": 1774171297, "event": "session_resumed", "round": 85, "tier": null, "run_name": null, "family_name": null, "family_stage": null, "status": "active", "decision": null, "payload": {"session_id": "019d14b3-7a66-7a10-a3d2-e744f4a315a4"}}
{"event_id": "evt_1774171297506102994", "ts": 1774171297, "event": "agent_action_received", "round": 85, "session_id": "019d14b3-7a66-7a10-a3d2-e744f4a315a4", "tier": "proxy", "run_name": null, "family_name": "residual_vq", "family_stage": "prototype", "status": null, "decision": null, "payload": {"session_id": "019d14b3-7a66-7a10-a3d2-e744f4a315a4", "tier": "proxy", "family_name": "residual_vq", "family_stage": "prototype", "change_type": "edit_sae_code", "expected_win": "Obtain a first clean low-K signal from a non-TopK discrete residual family that may outperform the recent weak routing and batch-allocation pivots.", "hypothesis": "After repeated weak low-K results from `batch_topk`, `routed`, `two_stage_residual`, and `lowrank_residual`, the next informative move is a simpler discrete residual architecture that drops the failed `residual_vq_topk` registration path and tests whether coarse codebook reconstruction plus residual correction is a better low-K framing. Implement a new `residual_vq` family and run it at `K=32, EF=12` with the shared stable recipe."}}
{"event_id": "evt_1774171427798237342", "ts": 1774171427, "event": "variable_isolation_warning", "round": 85, "session_id": "019d14b3-7a66-7a10-a3d2-e744f4a315a4", "tier": null, "run_name": null, "family_name": "residual_vq", "family_stage": "prototype", "status": null, "decision": null, "payload": {"violation": "Multiple primary variables changed simultaneously: code_edit, architecture, k, lr"}}
{"event_id": "evt_1774171427798371707", "ts": 1774171427, "event": "proxy_mode_selected", "round": 85, "session_id": "019d14b3-7a66-7a10-a3d2-e744f4a315a4", "tier": "proxy", "run_name": null, "family_name": "residual_vq", "family_stage": "prototype", "status": null, "decision": null, "payload": {"tier": "proxy", "proxy_mode": "fast", "evaluation_basis": "terminal_only", "parameter_behavior": "structural", "proxy_max_tokens": "40000000"}}
{"event_id": "evt_1774171427798415791", "ts": 1774171427, "event": "sanity_started", "round": 85, "session_id": "019d14b3-7a66-7a10-a3d2-e744f4a315a4", "tier": "proxy", "run_name": null, "family_name": "residual_vq", "family_stage": "prototype", "status": null, "decision": null, "payload": {"tier": "proxy"}}
{"event_id": "evt_1774171432450004954", "ts": 1774171432, "event": "sanity_finished", "round": 85, "session_id": "019d14b3-7a66-7a10-a3d2-e744f4a315a4", "tier": "proxy", "run_name": null, "family_name": "residual_vq", "family_stage": "prototype", "status": "ok", "decision": null, "payload": {"tier": "proxy", "status": "ok"}}
{"event_id": "evt_1774171432450368915", "ts": 1774171432, "event": "training_started", "round": 85, "session_id": "019d14b3-7a66-7a10-a3d2-e744f4a315a4", "tier": "proxy", "run_name": "round0085_proxy_1774171432", "family_name": "residual_vq", "family_stage": "prototype", "status": null, "decision": null, "payload": {"tier": "proxy", "run_name": "round0085_proxy_1774171432", "family_name": "residual_vq", "family_stage": "prototype", "checkpoint_dir": "/root/sparsify-ascend/checkpoints/research_agent/round_0085_proxy", "log_path": "/root/sparsify-ascend/research/history/logs/round0085_proxy_1774171432.log", "config": {"architecture": "residual_vq", "expansion_factor": 12, "k": 32, "optimizer": "signum", "lr": "1.6e-3", "hookpoints": "layers.[3].self_attn.o_proj", "batch_size": 1, "grad_acc_steps": 8, "micro_acc_steps": 1, "auxk_alpha": 0.0, "dead_feature_threshold": 10000000, "use_hadamard": false, "tier": "proxy", "family_name": "residual_vq", "family_stage": "prototype"}, "baseline_tokens_per_sec": null, "proxy_mode": "fast", "evaluation_basis": "terminal_only"}}
{"event_id": "evt_1774171462451128952", "ts": 1774171462, "event": "training_heartbeat", "round": 85, "session_id": "019d14b3-7a66-7a10-a3d2-e744f4a315a4", "tier": "proxy", "run_name": "round0085_proxy_1774171432", "family_name": "residual_vq", "family_stage": "prototype", "status": null, "decision": null, "payload": {"tier": "proxy", "run_name": "round0085_proxy_1774171432", "family_name": "residual_vq", "family_stage": "prototype", "checkpoint_dir": null, "metrics_path": null, "latest_step": null, "latest_tokens_per_sec": null, "baseline_ratio": null, "latest_total_tokens": null, "proxy_mode": "fast", "evaluation_basis": "terminal_only"}}
{"event_id": "evt_1774171462515589507", "ts": 1774171462, "event": "training_finished", "round": 85, "session_id": "019d14b3-7a66-7a10-a3d2-e744f4a315a4", "tier": "proxy", "run_name": "round0085_proxy_1774171432", "family_name": "residual_vq", "family_stage": "prototype", "status": "crash", "decision": "crash", "payload": {"tier": "proxy", "run_name": "round0085_proxy_1774171432", "family_name": "residual_vq", "family_stage": "prototype", "checkpoint_dir": null, "metrics_path": "", "run_health": "crash", "termination_reason": "completed", "tokens_per_sec": null, "baseline_ratio": null, "status": "crash", "decision": "crash", "proxy_mode": "fast", "evaluation_basis": "terminal_only", "curve_start_fvu": null, "curve_mid_fvu": null, "curve_end_fvu": null, "curve_late_slope": null, "curve_still_improving": null}}
{"event_id": "evt_1774171462515644768", "ts": 1774171462, "event": "result_recorded", "round": 85, "session_id": "019d14b3-7a66-7a10-a3d2-e744f4a315a4", "tier": "proxy", "run_name": "round0085_proxy_1774171432", "family_name": "residual_vq", "family_stage": "prototype", "status": "crash", "decision": "crash", "payload": {"tier": "proxy", "run_name": "round0085_proxy_1774171432", "family_name": "residual_vq", "family_stage": "prototype", "status": "crash", "decision": "crash", "val_fvu": "None", "observed_fvu": "", "k": "None", "log_path": "/root/sparsify-ascend/research/history/logs/proxy_1774171462.log", "checkpoint": null}}
{"event_id": "evt_1774171462515705580", "ts": 1774171462, "event": "repair_attempt_started", "round": 85, "session_id": "019d14b3-7a66-7a10-a3d2-e744f4a315a4", "tier": "proxy", "run_name": null, "family_name": "residual_vq", "family_stage": "prototype", "status": null, "decision": null, "payload": {"tier": "proxy", "family_name": "residual_vq", "family_stage": "prototype", "repair_attempt": 1, "failure_kind": "training_crash", "error_type": "ValueError", "error_summary": "ValueError: Unknown architecture: 'residual_vq'. Must be one of ('topk', 'batch_topk', 'adaptive_budget_topk', 'bucketed_topk', 'codebook_topk', 'jumprelu', 'gated', 'routed', 'group_topk', 'factorized_topk', 'lowrank_residual', 'lowrank_gated_residual', 'lowrank_grouped_residual', 'whitened_topk', 'two_stage_residual', 'multi_branch_gated')"}}
{"event_id": "evt_1774171614660502957", "ts": 1774171614, "event": "repair_loop_blocked", "round": 85, "session_id": "019d14b3-7a66-7a10-a3d2-e744f4a315a4", "tier": null, "run_name": null, "family_name": "residual_vq", "family_stage": "prototype", "status": null, "decision": null, "payload": {"repair_attempt": 1, "failure_kind": "post_repair_validation", "reason": "no_code_changes"}}
{"event_id": "evt_1774171614660573405", "ts": 1774171614, "event": "round_finished", "round": 85, "session_id": "019d14b3-7a66-7a10-a3d2-e744f4a315a4", "tier": "proxy", "run_name": null, "family_name": "residual_vq", "family_stage": "prototype", "status": "crash", "decision": "crash", "payload": {"tier": "proxy", "family_name": "residual_vq", "family_stage": "prototype", "status": "crash", "decision": "crash", "val_fvu": null}}
{"event_id": "evt_1774171622320785282", "ts": 1774171622, "event": "round_started", "round": 86, "session_id": "019d14b3-7a66-7a10-a3d2-e744f4a315a4", "tier": null, "run_name": null, "family_name": null, "family_stage": null, "status": "started", "decision": null, "payload": {"status": "started"}}
{"event_id": "evt_1774171622320877081", "ts": 1774171622, "event": "agent_deciding", "round": 86, "session_id": "019d14b3-7a66-7a10-a3d2-e744f4a315a4", "tier": null, "run_name": null, "family_name": null, "family_stage": null, "status": null, "decision": null, "payload": {}}
{"event_id": "evt_1774171745446572247", "ts": 1774171745, "event": "session_resumed", "round": 86, "tier": null, "run_name": null, "family_name": null, "family_stage": null, "status": "active", "decision": null, "payload": {"session_id": "019d14b3-7a66-7a10-a3d2-e744f4a315a4"}}
{"event_id": "evt_1774171745448841228", "ts": 1774171745, "event": "agent_action_received", "round": 86, "session_id": "019d14b3-7a66-7a10-a3d2-e744f4a315a4", "tier": "proxy", "run_name": null, "family_name": "lowrank_gated_residual", "family_stage": "stabilize", "status": null, "decision": null, "payload": {"session_id": "019d14b3-7a66-7a10-a3d2-e744f4a315a4", "tier": "proxy", "family_name": "lowrank_gated_residual", "family_stage": "stabilize", "change_type": "param_only", "expected_win": "Recover a clean, more informative low-K baseline in the preferred EF band with lower crash risk than another new-family attempt.", "hypothesis": "Crash recovery mode rules out further architecture/code changes, so the next stability-first move is to stay on the best working family and make one conservative parameter-only adjustment that remains low-K focused: raise `lowrank_gated_residual` from `K=32` to `K=40` at `EF=12` with the same stable `signum`/`lr=1.6e-3`/`auxk_alpha=0` recipe to see whether a small K increase restores a usable signal without abandoning the low-K regime."}}
{"event_id": "evt_1774171745448986481", "ts": 1774171745, "event": "proxy_mode_selected", "round": 86, "session_id": "019d14b3-7a66-7a10-a3d2-e744f4a315a4", "tier": "proxy", "run_name": null, "family_name": "lowrank_gated_residual", "family_stage": "stabilize", "status": null, "decision": null, "payload": {"tier": "proxy", "proxy_mode": "fast", "evaluation_basis": "terminal_only", "parameter_behavior": "structural", "proxy_max_tokens": "5000000"}}
{"event_id": "evt_1774171745449269373", "ts": 1774171745, "event": "training_started", "round": 86, "session_id": "019d14b3-7a66-7a10-a3d2-e744f4a315a4", "tier": "proxy", "run_name": "round0086_proxy_1774171745", "family_name": "lowrank_gated_residual", "family_stage": "stabilize", "status": null, "decision": null, "payload": {"tier": "proxy", "run_name": "round0086_proxy_1774171745", "family_name": "lowrank_gated_residual", "family_stage": "stabilize", "checkpoint_dir": "/root/sparsify-ascend/checkpoints/research_agent/round_0086_proxy", "log_path": "/root/sparsify-ascend/research/history/logs/round0086_proxy_1774171745.log", "config": {"architecture": "lowrank_gated_residual", "expansion_factor": 12, "k": 40, "optimizer": "signum", "lr": "1.6e-3", "hookpoints": "layers.[3].self_attn.o_proj", "batch_size": 1, "grad_acc_steps": 8, "micro_acc_steps": 1, "auxk_alpha": 0.0, "dead_feature_threshold": 10000000, "use_hadamard": false, "tier": "proxy", "family_name": "lowrank_gated_residual", "family_stage": "stabilize"}, "baseline_tokens_per_sec": 83008.58788873068, "proxy_mode": "fast", "evaluation_basis": "terminal_only"}}
{"event_id": "evt_1774171775450881371", "ts": 1774171775, "event": "training_heartbeat", "round": 86, "session_id": "019d14b3-7a66-7a10-a3d2-e744f4a315a4", "tier": "proxy", "run_name": "round0086_proxy_1774171745", "family_name": "lowrank_gated_residual", "family_stage": "stabilize", "status": null, "decision": null, "payload": {"tier": "proxy", "run_name": "round0086_proxy_1774171745", "family_name": "lowrank_gated_residual", "family_stage": "stabilize", "checkpoint_dir": "/root/sparsify-ascend/checkpoints/research_agent/round_0086_proxy/round0086_proxy_1774171745_dp2_bs1_ga8_ef12_k40_20260322_172911", "metrics_path": "/root/sparsify-ascend/checkpoints/research_agent/round_0086_proxy/round0086_proxy_1774171745_dp2_bs1_ga8_ef12_k40_20260322_172911/metrics.jsonl", "latest_step": 100, "latest_tokens_per_sec": 109221.83094326509, "baseline_ratio": 1.315789531194918, "latest_total_tokens": 3276800.0, "proxy_mode": "fast", "evaluation_basis": "terminal_only"}}
{"event_id": "evt_1774171805665243307", "ts": 1774171805, "event": "training_heartbeat", "round": 86, "session_id": "019d14b3-7a66-7a10-a3d2-e744f4a315a4", "tier": "proxy", "run_name": "round0086_proxy_1774171745", "family_name": "lowrank_gated_residual", "family_stage": "stabilize", "status": null, "decision": null, "payload": {"tier": "proxy", "run_name": "round0086_proxy_1774171745", "family_name": "lowrank_gated_residual", "family_stage": "stabilize", "checkpoint_dir": "/root/sparsify-ascend/checkpoints/research_agent/round_0086_proxy/round0086_proxy_1774171745_dp2_bs1_ga8_ef12_k40_20260322_172911", "metrics_path": "/root/sparsify-ascend/checkpoints/research_agent/round_0086_proxy/round0086_proxy_1774171745_dp2_bs1_ga8_ef12_k40_20260322_172911/metrics.jsonl", "latest_step": 152, "latest_tokens_per_sec": 83008.45925449858, "baseline_ratio": 0.9999984503503148, "latest_total_tokens": 4980736.0, "proxy_mode": "fast", "evaluation_basis": "terminal_only"}}
{"event_id": "evt_1774171806644190428", "ts": 1774171806, "event": "training_finished", "round": 86, "session_id": "019d14b3-7a66-7a10-a3d2-e744f4a315a4", "tier": "proxy", "run_name": "round0086_proxy_1774171745", "family_name": "lowrank_gated_residual", "family_stage": "stabilize", "status": "ok", "decision": "discard", "payload": {"tier": "proxy", "run_name": "round0086_proxy_1774171745", "family_name": "lowrank_gated_residual", "family_stage": "stabilize", "checkpoint_dir": "/root/sparsify-ascend/checkpoints/research_agent/round_0086_proxy/round0086_proxy_1774171745_dp2_bs1_ga8_ef12_k40_20260322_172911", "metrics_path": "/root/sparsify-ascend/checkpoints/research_agent/round_0086_proxy/round0086_proxy_1774171745_dp2_bs1_ga8_ef12_k40_20260322_172911/metrics.jsonl", "run_health": "normal", "termination_reason": "completed", "tokens_per_sec": 83008.45925449858, "baseline_ratio": 0.9999984503503148, "status": "ok", "decision": "discard", "proxy_mode": "fast", "evaluation_basis": "terminal_only", "curve_start_fvu": 0.340650737285614, "curve_mid_fvu": 0.22022312879562378, "curve_end_fvu": 0.17405004799365997, "curve_late_slope": -6.931068421709501e-09, "curve_still_improving": true}}
{"event_id": "evt_1774171806644278514", "ts": 1774171806, "event": "result_recorded", "round": 86, "session_id": "019d14b3-7a66-7a10-a3d2-e744f4a315a4", "tier": "proxy", "run_name": "round0086_proxy_1774171745", "family_name": "lowrank_gated_residual", "family_stage": "stabilize", "status": "ok", "decision": "discard", "payload": {"tier": "proxy", "run_name": "round0086_proxy_1774171745", "family_name": "lowrank_gated_residual", "family_stage": "stabilize", "status": "ok", "decision": "discard", "val_fvu": "0.17474958300590515", "observed_fvu": "0.174050", "k": "40", "log_path": "/root/sparsify-ascend/research/history/logs/proxy_1774171806.log", "checkpoint": null}}
{"event_id": "evt_1774171806644439894", "ts": 1774171806, "event": "round_finished", "round": 86, "session_id": "019d14b3-7a66-7a10-a3d2-e744f4a315a4", "tier": "proxy", "run_name": null, "family_name": "lowrank_gated_residual", "family_stage": "stabilize", "status": "ok", "decision": "discard", "payload": {"tier": "proxy", "family_name": "lowrank_gated_residual", "family_stage": "stabilize", "status": "ok", "decision": "discard", "val_fvu": "0.17474958300590515"}}
{"event_id": "evt_1774171807105547625", "ts": 1774171807, "event": "experiment_commit_prepared", "round": 86, "tier": "proxy", "run_name": null, "family_name": "lowrank_gated_residual", "family_stage": "stabilize", "status": "ok", "decision": "discard", "payload": {"branch": "autoresearch-sae"}}
{"event_id": "evt_1774171815416498649", "ts": 1774171815, "event": "round_started", "round": 87, "session_id": "019d14b3-7a66-7a10-a3d2-e744f4a315a4", "tier": null, "run_name": null, "family_name": null, "family_stage": null, "status": "started", "decision": null, "payload": {"status": "started"}}
{"event_id": "evt_1774171815416674778", "ts": 1774171815, "event": "agent_deciding", "round": 87, "session_id": "019d14b3-7a66-7a10-a3d2-e744f4a315a4", "tier": null, "run_name": null, "family_name": null, "family_stage": null, "status": null, "decision": null, "payload": {}}
{"event_id": "evt_1774171945139681726", "ts": 1774171945, "event": "session_resumed", "round": 87, "tier": null, "run_name": null, "family_name": null, "family_stage": null, "status": "active", "decision": null, "payload": {"session_id": "019d14b3-7a66-7a10-a3d2-e744f4a315a4"}}
{"event_id": "evt_1774171945140999442", "ts": 1774171945, "event": "agent_action_received", "round": 87, "session_id": "019d14b3-7a66-7a10-a3d2-e744f4a315a4", "tier": "proxy", "run_name": null, "family_name": "whitened_lowrank_residual", "family_stage": "prototype", "status": null, "decision": null, "payload": {"session_id": "019d14b3-7a66-7a10-a3d2-e744f4a315a4", "tier": "proxy", "family_name": "whitened_lowrank_residual", "family_stage": "prototype", "change_type": "edit_sae_code", "expected_win": "Get a first clean low-K signal from an input-space-changed residual family that could outperform the recent weak routing, batch allocation, and plain residual pivots.", "hypothesis": "After repeated weak low-K results from sparse-allocation variants and repeated registration failures on fresh discrete families, the next informative move is to change the input-space framing rather than keep retuning support selection. Implement a `whitened_lowrank_residual` family and run it at `K=32, EF=12` with the stable `signum`/`lr=1.6e-3`/`auxk_alpha=0` recipe to test whether a better coordinate system plus residual decomposition recovers a materially stronger low-K tradeoff."}}
{"event_id": "evt_1774172301069313055", "ts": 1774172301, "event": "loop_started", "round": null, "tier": null, "run_name": null, "family_name": null, "family_stage": null, "status": null, "decision": null, "payload": {"rounds": 200, "budget_hours": 10.0}}
{"event_id": "evt_1774172301076201556", "ts": 1774172301, "event": "research_branch_ready", "round": null, "tier": null, "run_name": null, "family_name": null, "family_stage": null, "status": "ready", "decision": null, "payload": {"branch": "autoresearch-sae", "base_branch": "autoresearch-sae", "base_commit": "04a0603ba261d372b5dc5e8d3c9746c5cebe46f2"}}
{"event_id": "evt_1774172301077304145", "ts": 1774172301, "event": "round_started", "round": 87, "session_id": null, "tier": null, "run_name": null, "family_name": null, "family_stage": null, "status": "started", "decision": null, "payload": {"status": "started"}}
{"event_id": "evt_1774172301077410627", "ts": 1774172301, "event": "agent_deciding", "round": 87, "session_id": null, "tier": null, "run_name": null, "family_name": null, "family_stage": null, "status": null, "decision": null, "payload": {}}
{"event_id": "evt_1774172506647194657", "ts": 1774172506, "event": "session_started", "round": 87, "tier": null, "run_name": null, "family_name": null, "family_stage": null, "status": "active", "decision": null, "payload": {"session_id": "019d14ea-730e-75e1-9200-ca4cb6c1e330"}}
{"event_id": "evt_1774172506648322321", "ts": 1774172506, "event": "agent_action_received", "round": 87, "session_id": "019d14ea-730e-75e1-9200-ca4cb6c1e330", "tier": "proxy", "run_name": null, "family_name": "whitened_lowrank_gated_residual", "family_stage": "prototype", "status": null, "decision": null, "payload": {"session_id": "019d14ea-730e-75e1-9200-ca4cb6c1e330", "tier": "proxy", "family_name": "whitened_lowrank_gated_residual", "family_stage": "prototype", "change_type": "edit_sae_code", "expected_win": "lower_fvu", "hypothesis": "At low K, the residual after the low-rank trunk is likely still poorly conditioned at `EF=12`, so support selection is wasting budget on scale/correlation artifacts. A new `whitened_lowrank_gated_residual` family that RMS-centers and lightly mixes the residual before gated top-k selection may improve same-`(K=40, EF=12)` FVU over the discarded `lowrank_gated_residual` local baseline without increasing K or EF."}}
