{"event_id": "evt_1774176278876401585", "ts": 1774176278, "event": "training_finished", "round": 97, "session_id": "019d151e-f057-7ab3-a1e7-776eaf5fbf59", "tier": "proxy", "run_name": "round0097_proxy_1774176218", "family_name": "whitened_lowrank_residual", "family_stage": "mainline_comparison", "status": "ok", "decision": "incubate", "payload": {"tier": "proxy", "run_name": "round0097_proxy_1774176218", "family_name": "whitened_lowrank_residual", "family_stage": "mainline_comparison", "checkpoint_dir": "/root/sparsify-ascend/checkpoints/research_agent/round_0097_proxy/round0097_proxy_1774176218_dp2_bs1_ga8_ef12_k40_20260322_184345", "metrics_path": "/root/sparsify-ascend/checkpoints/research_agent/round_0097_proxy/round0097_proxy_1774176218_dp2_bs1_ga8_ef12_k40_20260322_184345/metrics.jsonl", "run_health": "normal", "termination_reason": "completed", "tokens_per_sec": 83008.22210679263, "baseline_ratio": null, "status": "ok", "decision": "incubate", "proxy_mode": "fast", "evaluation_basis": "terminal_only", "curve_start_fvu": 19.879592895507812, "curve_mid_fvu": 38.39845275878906, "curve_end_fvu": 1.9568136930465698, "curve_late_slope": -3.1760025576072473e-06, "curve_still_improving": true}}
{"event_id": "evt_1774176278876464028", "ts": 1774176278, "event": "result_recorded", "round": 97, "session_id": "019d151e-f057-7ab3-a1e7-776eaf5fbf59", "tier": "proxy", "run_name": "round0097_proxy_1774176218", "family_name": "whitened_lowrank_residual", "family_stage": "mainline_comparison", "status": "ok", "decision": "incubate", "payload": {"tier": "proxy", "run_name": "round0097_proxy_1774176218", "family_name": "whitened_lowrank_residual", "family_stage": "mainline_comparison", "status": "ok", "decision": "incubate", "val_fvu": "3.8012688159942627", "observed_fvu": "1.956814", "k": "40", "log_path": "/root/sparsify-ascend/research/history/logs/proxy_1774176278.log", "checkpoint": null}}
{"event_id": "evt_1774176278876628692", "ts": 1774176278, "event": "round_finished", "round": 97, "session_id": "019d151e-f057-7ab3-a1e7-776eaf5fbf59", "tier": "proxy", "run_name": null, "family_name": "whitened_lowrank_residual", "family_stage": "mainline_comparison", "status": "ok", "decision": "incubate", "payload": {"tier": "proxy", "family_name": "whitened_lowrank_residual", "family_stage": "mainline_comparison", "status": "ok", "decision": "incubate", "val_fvu": "3.8012688159942627"}}
{"event_id": "evt_1774176278885805994", "ts": 1774176278, "event": "experiment_commit_prepared", "round": 97, "tier": "proxy", "run_name": null, "family_name": "whitened_lowrank_residual", "family_stage": "mainline_comparison", "status": "ok", "decision": "incubate", "payload": {"branch": "autoresearch-sae"}}
{"event_id": "evt_1774176286477434226", "ts": 1774176286, "event": "round_started", "round": 98, "session_id": "019d151e-f057-7ab3-a1e7-776eaf5fbf59", "tier": null, "run_name": null, "family_name": null, "family_stage": null, "status": "started", "decision": null, "payload": {"status": "started"}}
{"event_id": "evt_1774176286477597821", "ts": 1774176286, "event": "agent_deciding", "round": 98, "session_id": "019d151e-f057-7ab3-a1e7-776eaf5fbf59", "tier": null, "run_name": null, "family_name": null, "family_stage": null, "status": null, "decision": null, "payload": {}}
{"event_id": "evt_1774176439799883569", "ts": 1774176439, "event": "session_resumed", "round": 98, "tier": null, "run_name": null, "family_name": null, "family_stage": null, "status": "active", "decision": null, "payload": {"session_id": "019d151e-f057-7ab3-a1e7-776eaf5fbf59"}}
{"event_id": "evt_1774176439801197587", "ts": 1774176439, "event": "agent_action_received", "round": 98, "session_id": "019d151e-f057-7ab3-a1e7-776eaf5fbf59", "tier": "proxy", "run_name": null, "family_name": "two_code_residual_vq", "family_stage": "mainline_comparison", "status": null, "decision": null, "payload": {"session_id": "019d151e-f057-7ab3-a1e7-776eaf5fbf59", "tier": "proxy", "family_name": "two_code_residual_vq", "family_stage": "mainline_comparison", "change_type": "param_only", "expected_win": "explore_unknown", "hypothesis": "The exact active point `(K=40, EF=12)` has now rejected several fundamentally different mechanisms, and the one non-TopK family with the best remaining same-EF low-K signal is `two_code_residual_vq`. Since lower K is the top priority and `K=32, EF=12` is still sparsely explored outside the residual baseline, the next informative move is to map this discrete coarse-plus-residual family down to `K=32` before spending another round on EF or another new local tweak."}}
{"event_id": "evt_1774176439801315859", "ts": 1774176439, "event": "variable_isolation_warning", "round": 98, "session_id": "019d151e-f057-7ab3-a1e7-776eaf5fbf59", "tier": null, "run_name": null, "family_name": "two_code_residual_vq", "family_stage": "mainline_comparison", "status": null, "decision": null, "payload": {"violation": "Multiple primary variables changed simultaneously: architecture, k, lr"}}
{"event_id": "evt_1774176439801380170", "ts": 1774176439, "event": "proxy_mode_selected", "round": 98, "session_id": "019d151e-f057-7ab3-a1e7-776eaf5fbf59", "tier": "proxy", "run_name": null, "family_name": "two_code_residual_vq", "family_stage": "mainline_comparison", "status": null, "decision": null, "payload": {"tier": "proxy", "proxy_mode": "fast", "evaluation_basis": "terminal_only", "parameter_behavior": "structural", "proxy_max_tokens": "5000000"}}
{"event_id": "evt_1774176439801673951", "ts": 1774176439, "event": "training_started", "round": 98, "session_id": "019d151e-f057-7ab3-a1e7-776eaf5fbf59", "tier": "proxy", "run_name": "round0098_proxy_1774176439", "family_name": "two_code_residual_vq", "family_stage": "mainline_comparison", "status": null, "decision": null, "payload": {"tier": "proxy", "run_name": "round0098_proxy_1774176439", "family_name": "two_code_residual_vq", "family_stage": "mainline_comparison", "checkpoint_dir": "/root/sparsify-ascend/checkpoints/research_agent/round_0098_proxy", "log_path": "/root/sparsify-ascend/research/history/logs/round0098_proxy_1774176439.log", "config": {"architecture": "two_code_residual_vq", "expansion_factor": 12, "k": 32, "optimizer": "signum", "lr": "1.6e-3", "hookpoints": "layers.[3].self_attn.o_proj", "batch_size": 1, "grad_acc_steps": 8, "micro_acc_steps": 1, "auxk_alpha": 0.0, "dead_feature_threshold": 10000000, "use_hadamard": false, "tier": "proxy", "family_name": "two_code_residual_vq", "family_stage": "mainline_comparison"}, "baseline_tokens_per_sec": 189998.0761000911, "proxy_mode": "fast", "evaluation_basis": "terminal_only"}}
{"event_id": "evt_1774176469803460467", "ts": 1774176469, "event": "training_heartbeat", "round": 98, "session_id": "019d151e-f057-7ab3-a1e7-776eaf5fbf59", "tier": "proxy", "run_name": "round0098_proxy_1774176439", "family_name": "two_code_residual_vq", "family_stage": "mainline_comparison", "status": null, "decision": null, "payload": {"tier": "proxy", "run_name": "round0098_proxy_1774176439", "family_name": "two_code_residual_vq", "family_stage": "mainline_comparison", "checkpoint_dir": "/root/sparsify-ascend/checkpoints/research_agent/round_0098_proxy/round0098_proxy_1774176439_dp2_bs1_ga8_ef12_k32_20260322_184726", "metrics_path": "/root/sparsify-ascend/checkpoints/research_agent/round_0098_proxy/round0098_proxy_1774176439_dp2_bs1_ga8_ef12_k32_20260322_184726/metrics.jsonl", "latest_step": 130, "latest_tokens_per_sec": 141987.61180886405, "baseline_ratio": 0.7473107871579967, "latest_total_tokens": 4259840.0, "proxy_mode": "fast", "evaluation_basis": "terminal_only"}}
{"event_id": "evt_1774176499804945894", "ts": 1774176499, "event": "training_heartbeat", "round": 98, "session_id": "019d151e-f057-7ab3-a1e7-776eaf5fbf59", "tier": "proxy", "run_name": "round0098_proxy_1774176439", "family_name": "two_code_residual_vq", "family_stage": "mainline_comparison", "status": null, "decision": null, "payload": {"tier": "proxy", "run_name": "round0098_proxy_1774176439", "family_name": "two_code_residual_vq", "family_stage": "mainline_comparison", "checkpoint_dir": "/root/sparsify-ascend/checkpoints/research_agent/round_0098_proxy/round0098_proxy_1774176439_dp2_bs1_ga8_ef12_k32_20260322_184726", "metrics_path": "/root/sparsify-ascend/checkpoints/research_agent/round_0098_proxy/round0098_proxy_1774176439_dp2_bs1_ga8_ef12_k32_20260322_184726/metrics.jsonl", "latest_step": 152, "latest_tokens_per_sec": 83008.17527110552, "baseline_ratio": 0.43688955685728503, "latest_total_tokens": 4980736.0, "proxy_mode": "fast", "evaluation_basis": "terminal_only"}}
{"event_id": "evt_1774176499873918299", "ts": 1774176499, "event": "training_finished", "round": 98, "session_id": "019d151e-f057-7ab3-a1e7-776eaf5fbf59", "tier": "proxy", "run_name": "round0098_proxy_1774176439", "family_name": "two_code_residual_vq", "family_stage": "mainline_comparison", "status": "ok", "decision": "incubate", "payload": {"tier": "proxy", "run_name": "round0098_proxy_1774176439", "family_name": "two_code_residual_vq", "family_stage": "mainline_comparison", "checkpoint_dir": "/root/sparsify-ascend/checkpoints/research_agent/round_0098_proxy/round0098_proxy_1774176439_dp2_bs1_ga8_ef12_k32_20260322_184726", "metrics_path": "/root/sparsify-ascend/checkpoints/research_agent/round_0098_proxy/round0098_proxy_1774176439_dp2_bs1_ga8_ef12_k32_20260322_184726/metrics.jsonl", "run_health": "normal", "termination_reason": "completed", "tokens_per_sec": 83008.17527110552, "baseline_ratio": 0.43688955685728503, "status": "ok", "decision": "incubate", "proxy_mode": "fast", "evaluation_basis": "terminal_only", "curve_start_fvu": 0.5412015318870544, "curve_mid_fvu": 0.4160017967224121, "curve_end_fvu": 0.3665587306022644, "curve_late_slope": -6.5341620000019186e-09, "curve_still_improving": true}}
{"event_id": "evt_1774176499874009901", "ts": 1774176499, "event": "result_recorded", "round": 98, "session_id": "019d151e-f057-7ab3-a1e7-776eaf5fbf59", "tier": "proxy", "run_name": "round0098_proxy_1774176439", "family_name": "two_code_residual_vq", "family_stage": "mainline_comparison", "status": "ok", "decision": "incubate", "payload": {"tier": "proxy", "run_name": "round0098_proxy_1774176439", "family_name": "two_code_residual_vq", "family_stage": "mainline_comparison", "status": "ok", "decision": "incubate", "val_fvu": "0.3666718266904354", "observed_fvu": "0.366559", "k": "32", "log_path": "/root/sparsify-ascend/research/history/logs/proxy_1774176499.log", "checkpoint": null}}
{"event_id": "evt_1774176499874438076", "ts": 1774176499, "event": "round_finished", "round": 98, "session_id": "019d151e-f057-7ab3-a1e7-776eaf5fbf59", "tier": "proxy", "run_name": null, "family_name": "two_code_residual_vq", "family_stage": "mainline_comparison", "status": "ok", "decision": "incubate", "payload": {"tier": "proxy", "family_name": "two_code_residual_vq", "family_stage": "mainline_comparison", "status": "ok", "decision": "incubate", "val_fvu": "0.3666718266904354"}}
{"event_id": "evt_1774176499884450552", "ts": 1774176499, "event": "experiment_commit_prepared", "round": 98, "tier": "proxy", "run_name": null, "family_name": "two_code_residual_vq", "family_stage": "mainline_comparison", "status": "ok", "decision": "incubate", "payload": {"branch": "autoresearch-sae"}}
{"event_id": "evt_1774176507885887149", "ts": 1774176507, "event": "round_started", "round": 99, "session_id": "019d151e-f057-7ab3-a1e7-776eaf5fbf59", "tier": null, "run_name": null, "family_name": null, "family_stage": null, "status": "started", "decision": null, "payload": {"status": "started"}}
{"event_id": "evt_1774176507886048761", "ts": 1774176507, "event": "agent_deciding", "round": 99, "session_id": "019d151e-f057-7ab3-a1e7-776eaf5fbf59", "tier": null, "run_name": null, "family_name": null, "family_stage": null, "status": null, "decision": null, "payload": {}}
{"event_id": "evt_1774176644292329360", "ts": 1774176644, "event": "session_resumed", "round": 99, "tier": null, "run_name": null, "family_name": null, "family_stage": null, "status": "active", "decision": null, "payload": {"session_id": "019d151e-f057-7ab3-a1e7-776eaf5fbf59"}}
{"event_id": "evt_1774176644293639694", "ts": 1774176644, "event": "agent_action_received", "round": 99, "session_id": "019d151e-f057-7ab3-a1e7-776eaf5fbf59", "tier": "proxy", "run_name": null, "family_name": "bucketed_lowrank_residual", "family_stage": "prototype", "status": null, "decision": null, "payload": {"session_id": "019d151e-f057-7ab3-a1e7-776eaf5fbf59", "tier": "proxy", "family_name": "bucketed_lowrank_residual", "family_stage": "prototype", "change_type": "edit_sae_code", "expected_win": "explore_unknown", "hypothesis": "The low-K lane has now rejected several support-selection tweaks and discrete residual variants, which suggests the failure mode may be a single global dictionary trying to cover heterogeneous samples rather than the exact sparse mechanism alone. A new `bucketed_lowrank_residual` family that keeps the proven low-rank trunk but routes samples between two residual dictionaries by activation norm can test a stronger problem reformulation at the active target `K=32, EF=12` without increasing K or EF."}}
{"event_id": "evt_1774176776039316926", "ts": 1774176776, "event": "variable_isolation_warning", "round": 99, "session_id": "019d151e-f057-7ab3-a1e7-776eaf5fbf59", "tier": null, "run_name": null, "family_name": "bucketed_lowrank_residual", "family_stage": "prototype", "status": null, "decision": null, "payload": {"violation": "Multiple primary variables changed simultaneously: code_edit, architecture, k, lr"}}
{"event_id": "evt_1774176776039496679", "ts": 1774176776, "event": "incubation_limit_blocked", "round": 99, "session_id": "019d151e-f057-7ab3-a1e7-776eaf5fbf59", "tier": null, "run_name": null, "family_name": "bucketed_lowrank_residual", "family_stage": "prototype", "status": null, "decision": null, "payload": {"reason": "Cannot create new incubating family 'bucketed_lowrank_residual': already 5 incubating families (limit: 5). Stale families that could be archived: []"}}
{"event_id": "evt_1774176776039540911", "ts": 1774176776, "event": "round_finished", "round": 99, "session_id": "019d151e-f057-7ab3-a1e7-776eaf5fbf59", "tier": "proxy", "run_name": null, "family_name": "bucketed_lowrank_residual", "family_stage": "prototype", "status": "policy_reject", "decision": "policy_reject", "payload": {"tier": "proxy", "family_name": "bucketed_lowrank_residual", "family_stage": "prototype", "status": "policy_reject", "decision": "policy_reject", "val_fvu": null}}
{"event_id": "evt_1774176783676916354", "ts": 1774176783, "event": "round_started", "round": 100, "session_id": "019d151e-f057-7ab3-a1e7-776eaf5fbf59", "tier": null, "run_name": null, "family_name": null, "family_stage": null, "status": "started", "decision": null, "payload": {"status": "started"}}
{"event_id": "evt_1774176783677096573", "ts": 1774176783, "event": "agent_deciding", "round": 100, "session_id": "019d151e-f057-7ab3-a1e7-776eaf5fbf59", "tier": null, "run_name": null, "family_name": null, "family_stage": null, "status": null, "decision": null, "payload": {}}
{"event_id": "evt_1774176915764752592", "ts": 1774176915, "event": "session_resumed", "round": 100, "tier": null, "run_name": null, "family_name": null, "family_stage": null, "status": "active", "decision": null, "payload": {"session_id": "019d151e-f057-7ab3-a1e7-776eaf5fbf59"}}
{"event_id": "evt_1774176915766062047", "ts": 1774176915, "event": "agent_action_received", "round": 100, "session_id": "019d151e-f057-7ab3-a1e7-776eaf5fbf59", "tier": "proxy", "run_name": null, "family_name": "bucketed_lowrank_residual", "family_stage": "prototype", "status": null, "decision": null, "payload": {"session_id": "019d151e-f057-7ab3-a1e7-776eaf5fbf59", "tier": "proxy", "family_name": "bucketed_lowrank_residual", "family_stage": "prototype", "change_type": "param_only", "expected_win": "explore_unknown", "hypothesis": "The low-K lane has repeatedly rejected support-selection tweaks, whitening variants, and discrete residual families, so the strongest pending informative move is to execute the newly added `bucketed_lowrank_residual` reformulation at the exact active target. Conditioning the residual dictionary on coarse sample regime may recover useful low-K capacity where single-dictionary residual models and other mechanism swaps have stalled, without changing K or EF."}}
{"event_id": "evt_1774176915766170439", "ts": 1774176915, "event": "variable_isolation_warning", "round": 100, "session_id": "019d151e-f057-7ab3-a1e7-776eaf5fbf59", "tier": null, "run_name": null, "family_name": "bucketed_lowrank_residual", "family_stage": "prototype", "status": null, "decision": null, "payload": {"violation": "Multiple primary variables changed simultaneously: architecture, k, lr"}}
{"event_id": "evt_1774176915766244628", "ts": 1774176915, "event": "proxy_mode_selected", "round": 100, "session_id": "019d151e-f057-7ab3-a1e7-776eaf5fbf59", "tier": "proxy", "run_name": null, "family_name": "bucketed_lowrank_residual", "family_stage": "prototype", "status": null, "decision": null, "payload": {"tier": "proxy", "proxy_mode": "fast", "evaluation_basis": "terminal_only", "parameter_behavior": "structural", "proxy_max_tokens": "5000000"}}
{"event_id": "evt_1774176915766503093", "ts": 1774176915, "event": "training_started", "round": 100, "session_id": "019d151e-f057-7ab3-a1e7-776eaf5fbf59", "tier": "proxy", "run_name": "round0100_proxy_1774176915", "family_name": "bucketed_lowrank_residual", "family_stage": "prototype", "status": null, "decision": null, "payload": {"tier": "proxy", "run_name": "round0100_proxy_1774176915", "family_name": "bucketed_lowrank_residual", "family_stage": "prototype", "checkpoint_dir": "/root/sparsify-ascend/checkpoints/research_agent/round_0100_proxy", "log_path": "/root/sparsify-ascend/research/history/logs/round0100_proxy_1774176915.log", "config": {"architecture": "bucketed_lowrank_residual", "expansion_factor": 12, "k": 32, "optimizer": "signum", "lr": "1.6e-3", "hookpoints": "layers.[3].self_attn.o_proj", "batch_size": 1, "grad_acc_steps": 8, "micro_acc_steps": 1, "auxk_alpha": 0.0, "dead_feature_threshold": 10000000, "use_hadamard": false, "tier": "proxy", "family_name": "bucketed_lowrank_residual", "family_stage": "prototype"}, "baseline_tokens_per_sec": null, "proxy_mode": "fast", "evaluation_basis": "terminal_only"}}
{"event_id": "evt_1774176945767241031", "ts": 1774176945, "event": "training_heartbeat", "round": 100, "session_id": "019d151e-f057-7ab3-a1e7-776eaf5fbf59", "tier": "proxy", "run_name": "round0100_proxy_1774176915", "family_name": "bucketed_lowrank_residual", "family_stage": "prototype", "status": null, "decision": null, "payload": {"tier": "proxy", "run_name": "round0100_proxy_1774176915", "family_name": "bucketed_lowrank_residual", "family_stage": "prototype", "checkpoint_dir": null, "metrics_path": null, "latest_step": null, "latest_tokens_per_sec": null, "baseline_ratio": null, "latest_total_tokens": null, "proxy_mode": "fast", "evaluation_basis": "terminal_only"}}
{"event_id": "evt_1774176945832723614", "ts": 1774176945, "event": "training_finished", "round": 100, "session_id": "019d151e-f057-7ab3-a1e7-776eaf5fbf59", "tier": "proxy", "run_name": "round0100_proxy_1774176915", "family_name": "bucketed_lowrank_residual", "family_stage": "prototype", "status": "crash", "decision": "crash", "payload": {"tier": "proxy", "run_name": "round0100_proxy_1774176915", "family_name": "bucketed_lowrank_residual", "family_stage": "prototype", "checkpoint_dir": null, "metrics_path": "", "run_health": "crash", "termination_reason": "completed", "tokens_per_sec": null, "baseline_ratio": null, "status": "crash", "decision": "crash", "proxy_mode": "fast", "evaluation_basis": "terminal_only", "curve_start_fvu": null, "curve_mid_fvu": null, "curve_end_fvu": null, "curve_late_slope": null, "curve_still_improving": null}}
{"event_id": "evt_1774176945832771063", "ts": 1774176945, "event": "result_recorded", "round": 100, "session_id": "019d151e-f057-7ab3-a1e7-776eaf5fbf59", "tier": "proxy", "run_name": "round0100_proxy_1774176915", "family_name": "bucketed_lowrank_residual", "family_stage": "prototype", "status": "crash", "decision": "crash", "payload": {"tier": "proxy", "run_name": "round0100_proxy_1774176915", "family_name": "bucketed_lowrank_residual", "family_stage": "prototype", "status": "crash", "decision": "crash", "val_fvu": "None", "observed_fvu": "", "k": "None", "log_path": "/root/sparsify-ascend/research/history/logs/proxy_1774176945.log", "checkpoint": null}}
{"event_id": "evt_1774176945832846007", "ts": 1774176945, "event": "round_finished", "round": 100, "session_id": "019d151e-f057-7ab3-a1e7-776eaf5fbf59", "tier": "proxy", "run_name": null, "family_name": "bucketed_lowrank_residual", "family_stage": "prototype", "status": "crash", "decision": "crash", "payload": {"tier": "proxy", "family_name": "bucketed_lowrank_residual", "family_stage": "prototype", "status": "crash", "decision": "crash", "val_fvu": "None"}}
{"event_id": "evt_1774176945842166989", "ts": 1774176945, "event": "experiment_commit_prepared", "round": 100, "tier": "proxy", "run_name": null, "family_name": "bucketed_lowrank_residual", "family_stage": "prototype", "status": "crash", "decision": "crash", "payload": {"branch": "autoresearch-sae"}}
{"event_id": "evt_1774176953535782298", "ts": 1774176953, "event": "round_started", "round": 101, "session_id": "019d151e-f057-7ab3-a1e7-776eaf5fbf59", "tier": null, "run_name": null, "family_name": null, "family_stage": null, "status": "started", "decision": null, "payload": {"status": "started"}}
{"event_id": "evt_1774176953535941860", "ts": 1774176953, "event": "agent_deciding", "round": 101, "session_id": "019d151e-f057-7ab3-a1e7-776eaf5fbf59", "tier": null, "run_name": null, "family_name": null, "family_stage": null, "status": null, "decision": null, "payload": {}}
