{"event_id": "evt_1774137281464507215", "ts": 1774137281, "event": "training_heartbeat", "round": 14, "session_id": "019d12cf-0aba-71d0-8920-5ea920811f62", "tier": "proxy", "run_name": "round0014_proxy_1774137101", "family_name": "two_stage_residual", "family_stage": "stabilize", "status": null, "decision": null, "payload": {"tier": "proxy", "run_name": "round0014_proxy_1774137101", "family_name": "two_stage_residual", "family_stage": "stabilize", "checkpoint_dir": "/root/sparsify-ascend/checkpoints/research_agent/round_0014_proxy/round0014_proxy_1774137101_dp2_bs1_ga8_ef16_k128_20260322_075147", "metrics_path": "/root/sparsify-ascend/checkpoints/research_agent/round_0014_proxy/round0014_proxy_1774137101_dp2_bs1_ga8_ef16_k128_20260322_075147/metrics.jsonl", "latest_step": 610, "latest_tokens_per_sec": 111036.54934327074, "baseline_ratio": 1.001588203438582, "latest_total_tokens": 19988480.0, "proxy_mode": "extended", "evaluation_basis": "curve_extended"}}
{"event_id": "evt_1774137282393576302", "ts": 1774137282, "event": "training_finished", "round": 14, "session_id": "019d12cf-0aba-71d0-8920-5ea920811f62", "tier": "proxy", "run_name": "round0014_proxy_1774137101", "family_name": "two_stage_residual", "family_stage": "stabilize", "status": "ok", "decision": "discard", "payload": {"tier": "proxy", "run_name": "round0014_proxy_1774137101", "family_name": "two_stage_residual", "family_stage": "stabilize", "checkpoint_dir": "/root/sparsify-ascend/checkpoints/research_agent/round_0014_proxy/round0014_proxy_1774137101_dp2_bs1_ga8_ef16_k128_20260322_075147", "metrics_path": "/root/sparsify-ascend/checkpoints/research_agent/round_0014_proxy/round0014_proxy_1774137101_dp2_bs1_ga8_ef16_k128_20260322_075147/metrics.jsonl", "run_health": "normal", "termination_reason": "completed", "tokens_per_sec": 111036.54934327074, "baseline_ratio": 1.001588203438582, "status": "ok", "decision": "discard", "proxy_mode": "extended", "evaluation_basis": "curve_extended", "curve_start_fvu": 0.3477558493614197, "curve_mid_fvu": 0.24485990405082703, "curve_end_fvu": 0.20853522419929504, "curve_late_slope": -1.5931439773965871e-10, "curve_still_improving": true}}
{"event_id": "evt_1774137282393680270", "ts": 1774137282, "event": "result_recorded", "round": 14, "session_id": "019d12cf-0aba-71d0-8920-5ea920811f62", "tier": "proxy", "run_name": "round0014_proxy_1774137101", "family_name": "two_stage_residual", "family_stage": "stabilize", "status": "ok", "decision": "discard", "payload": {"tier": "proxy", "run_name": "round0014_proxy_1774137101", "family_name": "two_stage_residual", "family_stage": "stabilize", "status": "ok", "decision": "discard", "val_fvu": "0.19914506003260612", "observed_fvu": "0.208535", "k": "128", "log_path": "/root/sparsify-ascend/research/history/logs/proxy_1774137281.log", "checkpoint": null}}
{"event_id": "evt_1774137282393997437", "ts": 1774137282, "event": "round_finished", "round": 14, "session_id": "019d12cf-0aba-71d0-8920-5ea920811f62", "tier": "proxy", "run_name": null, "family_name": "two_stage_residual", "family_stage": "stabilize", "status": "ok", "decision": "discard", "payload": {"tier": "proxy", "family_name": "two_stage_residual", "family_stage": "stabilize", "status": "ok", "decision": "discard", "val_fvu": "0.19914506003260612"}}
{"event_id": "evt_1774137282626078795", "ts": 1774137282, "event": "experiment_commit_prepared", "round": 14, "tier": "proxy", "run_name": null, "family_name": "two_stage_residual", "family_stage": "stabilize", "status": "ok", "decision": "discard", "payload": {"branch": "autoresearch-sae"}}
{"event_id": "evt_1774137290885607537", "ts": 1774137290, "event": "round_started", "round": 15, "session_id": "019d12cf-0aba-71d0-8920-5ea920811f62", "tier": null, "run_name": null, "family_name": null, "family_stage": null, "status": "started", "decision": null, "payload": {"status": "started"}}
{"event_id": "evt_1774137290885765839", "ts": 1774137290, "event": "agent_deciding", "round": 15, "session_id": "019d12cf-0aba-71d0-8920-5ea920811f62", "tier": null, "run_name": null, "family_name": null, "family_stage": null, "status": null, "decision": null, "payload": {}}
{"event_id": "evt_1774137416235755395", "ts": 1774137416, "event": "session_resumed", "round": 15, "tier": null, "run_name": null, "family_name": null, "family_stage": null, "status": "active", "decision": null, "payload": {"session_id": "019d12cf-0aba-71d0-8920-5ea920811f62"}}
{"event_id": "evt_1774137416236358039", "ts": 1774137416, "event": "agent_action_received", "round": 15, "session_id": "019d12cf-0aba-71d0-8920-5ea920811f62", "tier": "proxy", "run_name": null, "family_name": "two_stage_residual", "family_stage": "stabilize", "status": null, "decision": null, "payload": {"session_id": "019d12cf-0aba-71d0-8920-5ea920811f62", "tier": "proxy", "family_name": "two_stage_residual", "family_stage": "stabilize", "change_type": "param_only", "expected_win": "lower_fvu", "hypothesis": "The downward LR sweep regressed at `4e-4`, so the next clean exploitation move is to test the opposite remaining LR extreme on the current best `two_stage_residual` recipe. Increasing only the learning rate to `3.2e-3` may recover or improve optimization efficiency at K=128 if the family is currently slightly under-stepping around the `1.6e-3` anchor."}}
{"event_id": "evt_1774137416236531017", "ts": 1774137416, "event": "proxy_mode_selected", "round": 15, "session_id": "019d12cf-0aba-71d0-8920-5ea920811f62", "tier": "proxy", "run_name": null, "family_name": "two_stage_residual", "family_stage": "stabilize", "status": null, "decision": null, "payload": {"tier": "proxy", "proxy_mode": "extended", "evaluation_basis": "curve_extended", "parameter_behavior": "dynamic", "proxy_max_tokens": "20000000"}}
{"event_id": "evt_1774137416236891089", "ts": 1774137416, "event": "training_started", "round": 15, "session_id": "019d12cf-0aba-71d0-8920-5ea920811f62", "tier": "proxy", "run_name": "round0015_proxy_1774137416", "family_name": "two_stage_residual", "family_stage": "stabilize", "status": null, "decision": null, "payload": {"tier": "proxy", "run_name": "round0015_proxy_1774137416", "family_name": "two_stage_residual", "family_stage": "stabilize", "checkpoint_dir": "/root/sparsify-ascend/checkpoints/research_agent/round_0015_proxy", "log_path": "/root/sparsify-ascend/research/history/logs/round0015_proxy_1774137416.log", "config": {"architecture": "two_stage_residual", "expansion_factor": 16, "k": 128, "optimizer": "signum", "lr": "3.2e-3", "hookpoints": "layers.[3].self_attn.o_proj", "batch_size": 1, "grad_acc_steps": 8, "micro_acc_steps": 1, "auxk_alpha": 0.0, "dead_feature_threshold": 10000000, "use_hadamard": false, "tier": "proxy", "family_name": "two_stage_residual", "family_stage": "stabilize"}, "baseline_tokens_per_sec": 111036.54934327074, "proxy_mode": "extended", "evaluation_basis": "curve_extended"}}
{"event_id": "evt_1774137446238293335", "ts": 1774137446, "event": "training_heartbeat", "round": 15, "session_id": "019d12cf-0aba-71d0-8920-5ea920811f62", "tier": "proxy", "run_name": "round0015_proxy_1774137416", "family_name": "two_stage_residual", "family_stage": "stabilize", "status": null, "decision": null, "payload": {"tier": "proxy", "run_name": "round0015_proxy_1774137416", "family_name": "two_stage_residual", "family_stage": "stabilize", "checkpoint_dir": "/root/sparsify-ascend/checkpoints/research_agent/round_0015_proxy/round0015_proxy_1774137416_dp2_bs1_ga8_ef16_k128_20260322_075702", "metrics_path": "/root/sparsify-ascend/checkpoints/research_agent/round_0015_proxy/round0015_proxy_1774137416_dp2_bs1_ga8_ef16_k128_20260322_075702/metrics.jsonl", "latest_step": 60, "latest_tokens_per_sec": 65533.677165665955, "baseline_ratio": 0.590199151119762, "latest_total_tokens": 1966080.0, "proxy_mode": "extended", "evaluation_basis": "curve_extended"}}
{"event_id": "evt_1774137476239905368", "ts": 1774137476, "event": "training_heartbeat", "round": 15, "session_id": "019d12cf-0aba-71d0-8920-5ea920811f62", "tier": "proxy", "run_name": "round0015_proxy_1774137416", "family_name": "two_stage_residual", "family_stage": "stabilize", "status": null, "decision": null, "payload": {"tier": "proxy", "run_name": "round0015_proxy_1774137416", "family_name": "two_stage_residual", "family_stage": "stabilize", "checkpoint_dir": "/root/sparsify-ascend/checkpoints/research_agent/round_0015_proxy/round0015_proxy_1774137416_dp2_bs1_ga8_ef16_k128_20260322_075702", "metrics_path": "/root/sparsify-ascend/checkpoints/research_agent/round_0015_proxy/round0015_proxy_1774137416_dp2_bs1_ga8_ef16_k128_20260322_075702/metrics.jsonl", "latest_step": 190, "latest_tokens_per_sec": 103760.71713245306, "baseline_ratio": 0.9344735381831404, "latest_total_tokens": 6225920.0, "proxy_mode": "extended", "evaluation_basis": "curve_extended"}}
{"event_id": "evt_1774137506242205518", "ts": 1774137506, "event": "training_heartbeat", "round": 15, "session_id": "019d12cf-0aba-71d0-8920-5ea920811f62", "tier": "proxy", "run_name": "round0015_proxy_1774137416", "family_name": "two_stage_residual", "family_stage": "stabilize", "status": null, "decision": null, "payload": {"tier": "proxy", "run_name": "round0015_proxy_1774137416", "family_name": "two_stage_residual", "family_stage": "stabilize", "checkpoint_dir": "/root/sparsify-ascend/checkpoints/research_agent/round_0015_proxy/round0015_proxy_1774137416_dp2_bs1_ga8_ef16_k128_20260322_075702", "metrics_path": "/root/sparsify-ascend/checkpoints/research_agent/round_0015_proxy/round0015_proxy_1774137416_dp2_bs1_ga8_ef16_k128_20260322_075702/metrics.jsonl", "latest_step": 310, "latest_tokens_per_sec": 112861.32480385856, "baseline_ratio": 1.0164340072830118, "latest_total_tokens": 10158080.0, "proxy_mode": "extended", "evaluation_basis": "curve_extended"}}
{"event_id": "evt_1774137536245241539", "ts": 1774137536, "event": "training_heartbeat", "round": 15, "session_id": "019d12cf-0aba-71d0-8920-5ea920811f62", "tier": "proxy", "run_name": "round0015_proxy_1774137416", "family_name": "two_stage_residual", "family_stage": "stabilize", "status": null, "decision": null, "payload": {"tier": "proxy", "run_name": "round0015_proxy_1774137416", "family_name": "two_stage_residual", "family_stage": "stabilize", "checkpoint_dir": "/root/sparsify-ascend/checkpoints/research_agent/round_0015_proxy/round0015_proxy_1774137416_dp2_bs1_ga8_ef16_k128_20260322_075702", "metrics_path": "/root/sparsify-ascend/checkpoints/research_agent/round_0015_proxy/round0015_proxy_1774137416_dp2_bs1_ga8_ef16_k128_20260322_075702/metrics.jsonl", "latest_step": 440, "latest_tokens_per_sec": 120141.3273564189, "baseline_ratio": 1.0819980273792609, "latest_total_tokens": 14417920.0, "proxy_mode": "extended", "evaluation_basis": "curve_extended"}}
{"event_id": "evt_1774137566248948487", "ts": 1774137566, "event": "training_heartbeat", "round": 15, "session_id": "019d12cf-0aba-71d0-8920-5ea920811f62", "tier": "proxy", "run_name": "round0015_proxy_1774137416", "family_name": "two_stage_residual", "family_stage": "stabilize", "status": null, "decision": null, "payload": {"tier": "proxy", "run_name": "round0015_proxy_1774137416", "family_name": "two_stage_residual", "family_stage": "stabilize", "checkpoint_dir": "/root/sparsify-ascend/checkpoints/research_agent/round_0015_proxy/round0015_proxy_1774137416_dp2_bs1_ga8_ef16_k128_20260322_075702", "metrics_path": "/root/sparsify-ascend/checkpoints/research_agent/round_0015_proxy/round0015_proxy_1774137416_dp2_bs1_ga8_ef16_k128_20260322_075702/metrics.jsonl", "latest_step": 560, "latest_tokens_per_sec": 122324.31941181756, "baseline_ratio": 1.1016581489186101, "latest_total_tokens": 18350080.0, "proxy_mode": "extended", "evaluation_basis": "curve_extended"}}
{"event_id": "evt_1774137596277150338", "ts": 1774137596, "event": "training_heartbeat", "round": 15, "session_id": "019d12cf-0aba-71d0-8920-5ea920811f62", "tier": "proxy", "run_name": "round0015_proxy_1774137416", "family_name": "two_stage_residual", "family_stage": "stabilize", "status": null, "decision": null, "payload": {"tier": "proxy", "run_name": "round0015_proxy_1774137416", "family_name": "two_stage_residual", "family_stage": "stabilize", "checkpoint_dir": "/root/sparsify-ascend/checkpoints/research_agent/round_0015_proxy/round0015_proxy_1774137416_dp2_bs1_ga8_ef16_k128_20260322_075702", "metrics_path": "/root/sparsify-ascend/checkpoints/research_agent/round_0015_proxy/round0015_proxy_1774137416_dp2_bs1_ga8_ef16_k128_20260322_075702/metrics.jsonl", "latest_step": 610, "latest_tokens_per_sec": 111037.42023476404, "baseline_ratio": 1.0000078432867237, "latest_total_tokens": 19988480.0, "proxy_mode": "extended", "evaluation_basis": "curve_extended"}}
{"event_id": "evt_1774137597245889778", "ts": 1774137597, "event": "training_finished", "round": 15, "session_id": "019d12cf-0aba-71d0-8920-5ea920811f62", "tier": "proxy", "run_name": "round0015_proxy_1774137416", "family_name": "two_stage_residual", "family_stage": "stabilize", "status": "ok", "decision": "discard", "payload": {"tier": "proxy", "run_name": "round0015_proxy_1774137416", "family_name": "two_stage_residual", "family_stage": "stabilize", "checkpoint_dir": "/root/sparsify-ascend/checkpoints/research_agent/round_0015_proxy/round0015_proxy_1774137416_dp2_bs1_ga8_ef16_k128_20260322_075702", "metrics_path": "/root/sparsify-ascend/checkpoints/research_agent/round_0015_proxy/round0015_proxy_1774137416_dp2_bs1_ga8_ef16_k128_20260322_075702/metrics.jsonl", "run_health": "normal", "termination_reason": "completed", "tokens_per_sec": 111037.42023476404, "baseline_ratio": 1.0000078432867237, "status": "ok", "decision": "discard", "proxy_mode": "extended", "evaluation_basis": "curve_extended", "curve_start_fvu": 0.20579174160957336, "curve_mid_fvu": 0.16833248734474182, "curve_end_fvu": 0.15519578754901886, "curve_late_slope": 6.604236137927281e-10, "curve_still_improving": false}}
{"event_id": "evt_1774137597245993588", "ts": 1774137597, "event": "result_recorded", "round": 15, "session_id": "019d12cf-0aba-71d0-8920-5ea920811f62", "tier": "proxy", "run_name": "round0015_proxy_1774137416", "family_name": "two_stage_residual", "family_stage": "stabilize", "status": "ok", "decision": "discard", "payload": {"tier": "proxy", "run_name": "round0015_proxy_1774137416", "family_name": "two_stage_residual", "family_stage": "stabilize", "status": "ok", "decision": "discard", "val_fvu": "0.14798009023070335", "observed_fvu": "0.155196", "k": "128", "log_path": "/root/sparsify-ascend/research/history/logs/proxy_1774137596.log", "checkpoint": null}}
{"event_id": "evt_1774137597246321164", "ts": 1774137597, "event": "round_finished", "round": 15, "session_id": "019d12cf-0aba-71d0-8920-5ea920811f62", "tier": "proxy", "run_name": null, "family_name": "two_stage_residual", "family_stage": "stabilize", "status": "ok", "decision": "discard", "payload": {"tier": "proxy", "family_name": "two_stage_residual", "family_stage": "stabilize", "status": "ok", "decision": "discard", "val_fvu": "0.14798009023070335"}}
{"event_id": "evt_1774137597490606515", "ts": 1774137597, "event": "experiment_commit_prepared", "round": 15, "tier": "proxy", "run_name": null, "family_name": "two_stage_residual", "family_stage": "stabilize", "status": "ok", "decision": "discard", "payload": {"branch": "autoresearch-sae"}}
{"event_id": "evt_1774137605824255751", "ts": 1774137605, "event": "round_started", "round": 16, "session_id": "019d12cf-0aba-71d0-8920-5ea920811f62", "tier": null, "run_name": null, "family_name": null, "family_stage": null, "status": "started", "decision": null, "payload": {"status": "started"}}
{"event_id": "evt_1774137605824466909", "ts": 1774137605, "event": "agent_deciding", "round": 16, "session_id": "019d12cf-0aba-71d0-8920-5ea920811f62", "tier": null, "run_name": null, "family_name": null, "family_stage": null, "status": null, "decision": null, "payload": {}}
{"event_id": "evt_1774137743159836253", "ts": 1774137743, "event": "session_resumed", "round": 16, "tier": null, "run_name": null, "family_name": null, "family_stage": null, "status": "active", "decision": null, "payload": {"session_id": "019d12cf-0aba-71d0-8920-5ea920811f62"}}
{"event_id": "evt_1774137743160458200", "ts": 1774137743, "event": "agent_action_received", "round": 16, "session_id": "019d12cf-0aba-71d0-8920-5ea920811f62", "tier": "proxy", "run_name": null, "family_name": "lowrank_residual", "family_stage": "stabilize", "status": null, "decision": null, "payload": {"session_id": "019d12cf-0aba-71d0-8920-5ea920811f62", "tier": "proxy", "family_name": "lowrank_residual", "family_stage": "stabilize", "change_type": "param_only", "expected_win": "lower_fvu", "hypothesis": "Five no-improve rounds suggest the current `two_stage_residual` direction is locally exhausted, so this round should switch the single primary variable back to architecture. The strongest informative alternative is `lowrank_residual`, which attacks the plateau by modeling shared dense structure with a low-rank trunk before sparse residual coding, and should be re-tested at K=128 under the current strongest shared recipe for a clean apples-to-apples comparison."}}
{"event_id": "evt_1774137743160573291", "ts": 1774137743, "event": "variable_isolation_warning", "round": 16, "session_id": "019d12cf-0aba-71d0-8920-5ea920811f62", "tier": null, "run_name": null, "family_name": "lowrank_residual", "family_stage": "stabilize", "status": null, "decision": null, "payload": {"violation": "Multiple primary variables changed simultaneously: architecture, lr"}}
{"event_id": "evt_1774137743160640431", "ts": 1774137743, "event": "proxy_mode_selected", "round": 16, "session_id": "019d12cf-0aba-71d0-8920-5ea920811f62", "tier": "proxy", "run_name": null, "family_name": "lowrank_residual", "family_stage": "stabilize", "status": null, "decision": null, "payload": {"tier": "proxy", "proxy_mode": "fast", "evaluation_basis": "terminal_only", "parameter_behavior": "structural", "proxy_max_tokens": "5000000"}}
{"event_id": "evt_1774137743160911496", "ts": 1774137743, "event": "training_started", "round": 16, "session_id": "019d12cf-0aba-71d0-8920-5ea920811f62", "tier": "proxy", "run_name": "round0016_proxy_1774137743", "family_name": "lowrank_residual", "family_stage": "stabilize", "status": null, "decision": null, "payload": {"tier": "proxy", "run_name": "round0016_proxy_1774137743", "family_name": "lowrank_residual", "family_stage": "stabilize", "checkpoint_dir": "/root/sparsify-ascend/checkpoints/research_agent/round_0016_proxy", "log_path": "/root/sparsify-ascend/research/history/logs/round0016_proxy_1774137743.log", "config": {"architecture": "lowrank_residual", "expansion_factor": 16, "k": 128, "optimizer": "signum", "lr": "1.6e-3", "hookpoints": "layers.[3].self_attn.o_proj", "batch_size": 1, "grad_acc_steps": 8, "micro_acc_steps": 1, "auxk_alpha": 0.0, "dead_feature_threshold": 10000000, "use_hadamard": false, "tier": "proxy", "family_name": "lowrank_residual", "family_stage": "stabilize"}, "baseline_tokens_per_sec": 83008.34645250007, "proxy_mode": "fast", "evaluation_basis": "terminal_only"}}
{"event_id": "evt_1774137773162571098", "ts": 1774137773, "event": "training_heartbeat", "round": 16, "session_id": "019d12cf-0aba-71d0-8920-5ea920811f62", "tier": "proxy", "run_name": "round0016_proxy_1774137743", "family_name": "lowrank_residual", "family_stage": "stabilize", "status": null, "decision": null, "payload": {"tier": "proxy", "run_name": "round0016_proxy_1774137743", "family_name": "lowrank_residual", "family_stage": "stabilize", "checkpoint_dir": "/root/sparsify-ascend/checkpoints/research_agent/round_0016_proxy/round0016_proxy_1774137743_dp2_bs1_ga8_ef16_k128_20260322_080229", "metrics_path": "/root/sparsify-ascend/checkpoints/research_agent/round_0016_proxy/round0016_proxy_1774137743_dp2_bs1_ga8_ef16_k128_20260322_080229/metrics.jsonl", "latest_step": 110, "latest_tokens_per_sec": 120143.805896661, "baseline_ratio": 1.4473701866282924, "latest_total_tokens": 3604480.0, "proxy_mode": "fast", "evaluation_basis": "terminal_only"}}
{"event_id": "evt_1774137803164038396", "ts": 1774137803, "event": "training_heartbeat", "round": 16, "session_id": "019d12cf-0aba-71d0-8920-5ea920811f62", "tier": "proxy", "run_name": "round0016_proxy_1774137743", "family_name": "lowrank_residual", "family_stage": "stabilize", "status": null, "decision": null, "payload": {"tier": "proxy", "run_name": "round0016_proxy_1774137743", "family_name": "lowrank_residual", "family_stage": "stabilize", "checkpoint_dir": "/root/sparsify-ascend/checkpoints/research_agent/round_0016_proxy/round0016_proxy_1774137743_dp2_bs1_ga8_ef16_k128_20260322_080229", "metrics_path": "/root/sparsify-ascend/checkpoints/research_agent/round_0016_proxy/round0016_proxy_1774137743_dp2_bs1_ga8_ef16_k128_20260322_080229/metrics.jsonl", "latest_step": 152, "latest_tokens_per_sec": 83008.34876130984, "baseline_ratio": 1.000000027814188, "latest_total_tokens": 4980736.0, "proxy_mode": "fast", "evaluation_basis": "terminal_only"}}
