{"event_id": "evt_1774149867623343177", "ts": 1774149867, "event": "training_heartbeat", "round": 36, "session_id": "019d135d-4c60-7fa3-8438-b12bc57e0720", "tier": "proxy", "run_name": "round0036_proxy_1774149567", "family_name": "batch_topk", "family_stage": "prototype", "status": null, "decision": null, "payload": {"tier": "proxy", "run_name": "round0036_proxy_1774149567", "family_name": "batch_topk", "family_stage": "prototype", "checkpoint_dir": "/root/sparsify-ascend/checkpoints/research_agent/round_0036_proxy/round0036_proxy_1774149567_dp2_bs1_ga8_ef32_k128_20260322_111936", "metrics_path": "/root/sparsify-ascend/checkpoints/research_agent/round_0036_proxy/round0036_proxy_1774149567_dp2_bs1_ga8_ef32_k128_20260322_111936/metrics.jsonl", "latest_step": 640, "latest_tokens_per_sec": 69899.2999202055, "baseline_ratio": null, "latest_total_tokens": 20971520.0, "proxy_mode": "fast", "evaluation_basis": "terminal_only"}}
{"event_id": "evt_1774149897627912613", "ts": 1774149897, "event": "training_heartbeat", "round": 36, "session_id": "019d135d-4c60-7fa3-8438-b12bc57e0720", "tier": "proxy", "run_name": "round0036_proxy_1774149567", "family_name": "batch_topk", "family_stage": "prototype", "status": null, "decision": null, "payload": {"tier": "proxy", "run_name": "round0036_proxy_1774149567", "family_name": "batch_topk", "family_stage": "prototype", "checkpoint_dir": "/root/sparsify-ascend/checkpoints/research_agent/round_0036_proxy/round0036_proxy_1774149567_dp2_bs1_ga8_ef32_k128_20260322_111936", "metrics_path": "/root/sparsify-ascend/checkpoints/research_agent/round_0036_proxy/round0036_proxy_1774149567_dp2_bs1_ga8_ef32_k128_20260322_111936/metrics.jsonl", "latest_step": 710, "latest_tokens_per_sec": 70494.58361963264, "baseline_ratio": null, "latest_total_tokens": 23265280.0, "proxy_mode": "fast", "evaluation_basis": "terminal_only"}}
{"event_id": "evt_1774149927632903336", "ts": 1774149927, "event": "training_heartbeat", "round": 36, "session_id": "019d135d-4c60-7fa3-8438-b12bc57e0720", "tier": "proxy", "run_name": "round0036_proxy_1774149567", "family_name": "batch_topk", "family_stage": "prototype", "status": null, "decision": null, "payload": {"tier": "proxy", "run_name": "round0036_proxy_1774149567", "family_name": "batch_topk", "family_stage": "prototype", "checkpoint_dir": "/root/sparsify-ascend/checkpoints/research_agent/round_0036_proxy/round0036_proxy_1774149567_dp2_bs1_ga8_ef32_k128_20260322_111936", "metrics_path": "/root/sparsify-ascend/checkpoints/research_agent/round_0036_proxy/round0036_proxy_1774149567_dp2_bs1_ga8_ef32_k128_20260322_111936/metrics.jsonl", "latest_step": 780, "latest_tokens_per_sec": 70990.56836384449, "baseline_ratio": null, "latest_total_tokens": 25559040.0, "proxy_mode": "fast", "evaluation_basis": "terminal_only"}}
{"event_id": "evt_1774149957638267018", "ts": 1774149957, "event": "training_heartbeat", "round": 36, "session_id": "019d135d-4c60-7fa3-8438-b12bc57e0720", "tier": "proxy", "run_name": "round0036_proxy_1774149567", "family_name": "batch_topk", "family_stage": "prototype", "status": null, "decision": null, "payload": {"tier": "proxy", "run_name": "round0036_proxy_1774149567", "family_name": "batch_topk", "family_stage": "prototype", "checkpoint_dir": "/root/sparsify-ascend/checkpoints/research_agent/round_0036_proxy/round0036_proxy_1774149567_dp2_bs1_ga8_ef32_k128_20260322_111936", "metrics_path": "/root/sparsify-ascend/checkpoints/research_agent/round_0036_proxy/round0036_proxy_1774149567_dp2_bs1_ga8_ef32_k128_20260322_111936/metrics.jsonl", "latest_step": 850, "latest_tokens_per_sec": 71410.17198468046, "baseline_ratio": null, "latest_total_tokens": 27852800.0, "proxy_mode": "fast", "evaluation_basis": "terminal_only"}}
{"event_id": "evt_1774149987644017903", "ts": 1774149987, "event": "training_heartbeat", "round": 36, "session_id": "019d135d-4c60-7fa3-8438-b12bc57e0720", "tier": "proxy", "run_name": "round0036_proxy_1774149567", "family_name": "batch_topk", "family_stage": "prototype", "status": null, "decision": null, "payload": {"tier": "proxy", "run_name": "round0036_proxy_1774149567", "family_name": "batch_topk", "family_stage": "prototype", "checkpoint_dir": "/root/sparsify-ascend/checkpoints/research_agent/round_0036_proxy/round0036_proxy_1774149567_dp2_bs1_ga8_ef32_k128_20260322_111936", "metrics_path": "/root/sparsify-ascend/checkpoints/research_agent/round_0036_proxy/round0036_proxy_1774149567_dp2_bs1_ga8_ef32_k128_20260322_111936/metrics.jsonl", "latest_step": 920, "latest_tokens_per_sec": 71769.76239334146, "baseline_ratio": null, "latest_total_tokens": 30146560.0, "proxy_mode": "fast", "evaluation_basis": "terminal_only"}}
{"event_id": "evt_1774150017650187499", "ts": 1774150017, "event": "training_heartbeat", "round": 36, "session_id": "019d135d-4c60-7fa3-8438-b12bc57e0720", "tier": "proxy", "run_name": "round0036_proxy_1774149567", "family_name": "batch_topk", "family_stage": "prototype", "status": null, "decision": null, "payload": {"tier": "proxy", "run_name": "round0036_proxy_1774149567", "family_name": "batch_topk", "family_stage": "prototype", "checkpoint_dir": "/root/sparsify-ascend/checkpoints/research_agent/round_0036_proxy/round0036_proxy_1774149567_dp2_bs1_ga8_ef32_k128_20260322_111936", "metrics_path": "/root/sparsify-ascend/checkpoints/research_agent/round_0036_proxy/round0036_proxy_1774149567_dp2_bs1_ga8_ef32_k128_20260322_111936/metrics.jsonl", "latest_step": 990, "latest_tokens_per_sec": 72081.33624253652, "baseline_ratio": null, "latest_total_tokens": 32440320.0, "proxy_mode": "fast", "evaluation_basis": "terminal_only"}}
{"event_id": "evt_1774150047707141635", "ts": 1774150047, "event": "training_heartbeat", "round": 36, "session_id": "019d135d-4c60-7fa3-8438-b12bc57e0720", "tier": "proxy", "run_name": "round0036_proxy_1774149567", "family_name": "batch_topk", "family_stage": "prototype", "status": null, "decision": null, "payload": {"tier": "proxy", "run_name": "round0036_proxy_1774149567", "family_name": "batch_topk", "family_stage": "prototype", "checkpoint_dir": "/root/sparsify-ascend/checkpoints/research_agent/round_0036_proxy/round0036_proxy_1774149567_dp2_bs1_ga8_ef32_k128_20260322_111936", "metrics_path": "/root/sparsify-ascend/checkpoints/research_agent/round_0036_proxy/round0036_proxy_1774149567_dp2_bs1_ga8_ef32_k128_20260322_111936/metrics.jsonl", "latest_step": 1030, "latest_tokens_per_sec": 70306.17520059367, "baseline_ratio": null, "latest_total_tokens": 33751040.0, "proxy_mode": "fast", "evaluation_basis": "terminal_only"}}
{"event_id": "evt_1774150077735888543", "ts": 1774150077, "event": "training_heartbeat", "round": 36, "session_id": "019d135d-4c60-7fa3-8438-b12bc57e0720", "tier": "proxy", "run_name": "round0036_proxy_1774149567", "family_name": "batch_topk", "family_stage": "prototype", "status": null, "decision": null, "payload": {"tier": "proxy", "run_name": "round0036_proxy_1774149567", "family_name": "batch_topk", "family_stage": "prototype", "checkpoint_dir": "/root/sparsify-ascend/checkpoints/research_agent/round_0036_proxy/round0036_proxy_1774149567_dp2_bs1_ga8_ef32_k128_20260322_111936", "metrics_path": "/root/sparsify-ascend/checkpoints/research_agent/round_0036_proxy/round0036_proxy_1774149567_dp2_bs1_ga8_ef32_k128_20260322_111936/metrics.jsonl", "latest_step": 1100, "latest_tokens_per_sec": 70660.09189122716, "baseline_ratio": null, "latest_total_tokens": 36044800.0, "proxy_mode": "fast", "evaluation_basis": "terminal_only"}}
{"event_id": "evt_1774150107743109248", "ts": 1774150107, "event": "training_heartbeat", "round": 36, "session_id": "019d135d-4c60-7fa3-8438-b12bc57e0720", "tier": "proxy", "run_name": "round0036_proxy_1774149567", "family_name": "batch_topk", "family_stage": "prototype", "status": null, "decision": null, "payload": {"tier": "proxy", "run_name": "round0036_proxy_1774149567", "family_name": "batch_topk", "family_stage": "prototype", "checkpoint_dir": "/root/sparsify-ascend/checkpoints/research_agent/round_0036_proxy/round0036_proxy_1774149567_dp2_bs1_ga8_ef32_k128_20260322_111936", "metrics_path": "/root/sparsify-ascend/checkpoints/research_agent/round_0036_proxy/round0036_proxy_1774149567_dp2_bs1_ga8_ef32_k128_20260322_111936/metrics.jsonl", "latest_step": 1170, "latest_tokens_per_sec": 70978.33879985705, "baseline_ratio": null, "latest_total_tokens": 38338560.0, "proxy_mode": "fast", "evaluation_basis": "terminal_only"}}
{"event_id": "evt_1774150137750614866", "ts": 1774150137, "event": "training_heartbeat", "round": 36, "session_id": "019d135d-4c60-7fa3-8438-b12bc57e0720", "tier": "proxy", "run_name": "round0036_proxy_1774149567", "family_name": "batch_topk", "family_stage": "prototype", "status": null, "decision": null, "payload": {"tier": "proxy", "run_name": "round0036_proxy_1774149567", "family_name": "batch_topk", "family_stage": "prototype", "checkpoint_dir": "/root/sparsify-ascend/checkpoints/research_agent/round_0036_proxy/round0036_proxy_1774149567_dp2_bs1_ga8_ef32_k128_20260322_111936", "metrics_path": "/root/sparsify-ascend/checkpoints/research_agent/round_0036_proxy/round0036_proxy_1774149567_dp2_bs1_ga8_ef32_k128_20260322_111936/metrics.jsonl", "latest_step": 1220, "latest_tokens_per_sec": 70116.31986466266, "baseline_ratio": null, "latest_total_tokens": 39976960.0, "proxy_mode": "fast", "evaluation_basis": "terminal_only"}}
{"event_id": "evt_1774150167758259170", "ts": 1774150167, "event": "training_heartbeat", "round": 36, "session_id": "019d135d-4c60-7fa3-8438-b12bc57e0720", "tier": "proxy", "run_name": "round0036_proxy_1774149567", "family_name": "batch_topk", "family_stage": "prototype", "status": null, "decision": null, "payload": {"tier": "proxy", "run_name": "round0036_proxy_1774149567", "family_name": "batch_topk", "family_stage": "prototype", "checkpoint_dir": "/root/sparsify-ascend/checkpoints/research_agent/round_0036_proxy/round0036_proxy_1774149567_dp2_bs1_ga8_ef32_k128_20260322_111936", "metrics_path": "/root/sparsify-ascend/checkpoints/research_agent/round_0036_proxy/round0036_proxy_1774149567_dp2_bs1_ga8_ef32_k128_20260322_111936/metrics.jsonl", "latest_step": 1220, "latest_tokens_per_sec": 66610.5627596382, "baseline_ratio": null, "latest_total_tokens": 39976960.0, "proxy_mode": "fast", "evaluation_basis": "terminal_only"}}
{"event_id": "evt_1774150167835370609", "ts": 1774150167, "event": "training_finished", "round": 36, "session_id": "019d135d-4c60-7fa3-8438-b12bc57e0720", "tier": "proxy", "run_name": "round0036_proxy_1774149567", "family_name": "batch_topk", "family_stage": "prototype", "status": "ok", "decision": "incubate", "payload": {"tier": "proxy", "run_name": "round0036_proxy_1774149567", "family_name": "batch_topk", "family_stage": "prototype", "checkpoint_dir": "/root/sparsify-ascend/checkpoints/research_agent/round_0036_proxy/round0036_proxy_1774149567_dp2_bs1_ga8_ef32_k128_20260322_111936", "metrics_path": "/root/sparsify-ascend/checkpoints/research_agent/round_0036_proxy/round0036_proxy_1774149567_dp2_bs1_ga8_ef32_k128_20260322_111936/metrics.jsonl", "run_health": "normal", "termination_reason": "completed", "tokens_per_sec": 66610.5627596382, "baseline_ratio": null, "status": "ok", "decision": "incubate", "proxy_mode": "fast", "evaluation_basis": "terminal_only", "curve_start_fvu": 0.23101022839546204, "curve_mid_fvu": 0.19254368543624878, "curve_end_fvu": 0.16008245944976807, "curve_late_slope": -2.253265668767825e-09, "curve_still_improving": true}}
{"event_id": "evt_1774150167835430325", "ts": 1774150167, "event": "result_recorded", "round": 36, "session_id": "019d135d-4c60-7fa3-8438-b12bc57e0720", "tier": "proxy", "run_name": "round0036_proxy_1774149567", "family_name": "batch_topk", "family_stage": "prototype", "status": "ok", "decision": "incubate", "payload": {"tier": "proxy", "run_name": "round0036_proxy_1774149567", "family_name": "batch_topk", "family_stage": "prototype", "status": "ok", "decision": "incubate", "val_fvu": "0.1644012425094843", "observed_fvu": "0.160082", "k": "128", "log_path": "/root/sparsify-ascend/research/history/logs/proxy_1774150167.log", "checkpoint": null}}
{"event_id": "evt_1774150167835979126", "ts": 1774150167, "event": "round_finished", "round": 36, "session_id": "019d135d-4c60-7fa3-8438-b12bc57e0720", "tier": "proxy", "run_name": null, "family_name": "batch_topk", "family_stage": "prototype", "status": "ok", "decision": "incubate", "payload": {"tier": "proxy", "family_name": "batch_topk", "family_stage": "prototype", "status": "ok", "decision": "incubate", "val_fvu": "0.1644012425094843"}}
{"event_id": "evt_1774150167842708077", "ts": 1774150167, "event": "experiment_commit_prepared", "round": 36, "tier": "proxy", "run_name": null, "family_name": "batch_topk", "family_stage": "prototype", "status": "ok", "decision": "incubate", "payload": {"branch": "autoresearch-sae"}}
{"event_id": "evt_1774150175235641528", "ts": 1774150175, "event": "round_started", "round": 37, "session_id": "019d135d-4c60-7fa3-8438-b12bc57e0720", "tier": null, "run_name": null, "family_name": null, "family_stage": null, "status": "started", "decision": null, "payload": {"status": "started"}}
{"event_id": "evt_1774150175235822029", "ts": 1774150175, "event": "agent_deciding", "round": 37, "session_id": "019d135d-4c60-7fa3-8438-b12bc57e0720", "tier": null, "run_name": null, "family_name": null, "family_stage": null, "status": null, "decision": null, "payload": {}}
{"event_id": "evt_1774150357566292663", "ts": 1774150357, "event": "session_resumed", "round": 37, "tier": null, "run_name": null, "family_name": null, "family_stage": null, "status": "active", "decision": null, "payload": {"session_id": "019d135d-4c60-7fa3-8438-b12bc57e0720"}}
{"event_id": "evt_1774150357566929491", "ts": 1774150357, "event": "agent_action_received", "round": 37, "session_id": "019d135d-4c60-7fa3-8438-b12bc57e0720", "tier": "proxy", "run_name": null, "family_name": "bucketed_topk", "family_stage": "prototype", "status": null, "decision": null, "payload": {"session_id": "019d135d-4c60-7fa3-8438-b12bc57e0720", "tier": "proxy", "family_name": "bucketed_topk", "family_stage": "prototype", "change_type": "edit_sae_code", "expected_win": "lower_fvu", "hypothesis": "Twelve no-improve rounds indicate that the current search direction is fundamentally flawed, and the latest alternative sparse-allocation families still sit far behind the frontier. The next coherent architecture move is to test conditionalized dictionaries rather than another global-allocation variant: add `bucketed_topk`, which routes samples between separate low-norm and high-norm dictionaries before TopK selection. If the activation distribution is multi-regime rather than unimodal, specializing dictionaries by sample norm could improve reconstruction quality without changing the fixed execution layer."}}
{"event_id": "evt_1774150488743682103", "ts": 1774150488, "event": "variable_isolation_warning", "round": 37, "session_id": "019d135d-4c60-7fa3-8438-b12bc57e0720", "tier": null, "run_name": null, "family_name": "bucketed_topk", "family_stage": "prototype", "status": null, "decision": null, "payload": {"violation": "Multiple primary variables changed simultaneously: code_edit, architecture, lr"}}
{"event_id": "evt_1774150493291481926", "ts": 1774150493, "event": "behavioral_diff_identical_warning", "round": 37, "session_id": "019d135d-4c60-7fa3-8438-b12bc57e0720", "tier": null, "run_name": null, "family_name": "bucketed_topk", "family_stage": "prototype", "status": null, "decision": null, "payload": {"architecture": "bucketed_topk", "k": 128, "expansion_factor": 32, "max_diff": 0.0}}
{"event_id": "evt_1774150493291544009", "ts": 1774150493, "event": "proxy_mode_selected", "round": 37, "session_id": "019d135d-4c60-7fa3-8438-b12bc57e0720", "tier": "proxy", "run_name": null, "family_name": "bucketed_topk", "family_stage": "prototype", "status": null, "decision": null, "payload": {"tier": "proxy", "proxy_mode": "fast", "evaluation_basis": "terminal_only", "parameter_behavior": "structural", "proxy_max_tokens": "40000000"}}
{"event_id": "evt_1774150493291589021", "ts": 1774150493, "event": "sanity_started", "round": 37, "session_id": "019d135d-4c60-7fa3-8438-b12bc57e0720", "tier": "proxy", "run_name": null, "family_name": "bucketed_topk", "family_stage": "prototype", "status": null, "decision": null, "payload": {"tier": "proxy"}}
{"event_id": "evt_1774150497919516936", "ts": 1774150497, "event": "sanity_finished", "round": 37, "session_id": "019d135d-4c60-7fa3-8438-b12bc57e0720", "tier": "proxy", "run_name": null, "family_name": "bucketed_topk", "family_stage": "prototype", "status": "ok", "decision": null, "payload": {"tier": "proxy", "status": "ok"}}
{"event_id": "evt_1774150497919915250", "ts": 1774150497, "event": "training_started", "round": 37, "session_id": "019d135d-4c60-7fa3-8438-b12bc57e0720", "tier": "proxy", "run_name": "round0037_proxy_1774150497", "family_name": "bucketed_topk", "family_stage": "prototype", "status": null, "decision": null, "payload": {"tier": "proxy", "run_name": "round0037_proxy_1774150497", "family_name": "bucketed_topk", "family_stage": "prototype", "checkpoint_dir": "/root/sparsify-ascend/checkpoints/research_agent/round_0037_proxy", "log_path": "/root/sparsify-ascend/research/history/logs/round0037_proxy_1774150497.log", "config": {"architecture": "bucketed_topk", "expansion_factor": 32, "k": 128, "optimizer": "signum", "lr": "1.6e-3", "hookpoints": "layers.[3].self_attn.o_proj", "batch_size": 1, "grad_acc_steps": 8, "micro_acc_steps": 1, "auxk_alpha": 0.0, "dead_feature_threshold": 10000000, "use_hadamard": false, "tier": "proxy", "family_name": "bucketed_topk", "family_stage": "prototype"}, "baseline_tokens_per_sec": null, "proxy_mode": "fast", "evaluation_basis": "terminal_only"}}
{"event_id": "evt_1774150527921135691", "ts": 1774150527, "event": "training_heartbeat", "round": 37, "session_id": "019d135d-4c60-7fa3-8438-b12bc57e0720", "tier": "proxy", "run_name": "round0037_proxy_1774150497", "family_name": "bucketed_topk", "family_stage": "prototype", "status": null, "decision": null, "payload": {"tier": "proxy", "run_name": "round0037_proxy_1774150497", "family_name": "bucketed_topk", "family_stage": "prototype", "checkpoint_dir": "/root/sparsify-ascend/checkpoints/research_agent/round_0037_proxy/round0037_proxy_1774150497_dp2_bs1_ga8_ef32_k128_20260322_113506", "metrics_path": "/root/sparsify-ascend/checkpoints/research_agent/round_0037_proxy/round0037_proxy_1774150497_dp2_bs1_ga8_ef32_k128_20260322_113506/metrics.jsonl", "latest_step": 30, "latest_tokens_per_sec": 32766.987531284318, "baseline_ratio": null, "latest_total_tokens": 983040.0, "proxy_mode": "fast", "evaluation_basis": "terminal_only"}}
{"event_id": "evt_1774150557922190515", "ts": 1774150557, "event": "training_heartbeat", "round": 37, "session_id": "019d135d-4c60-7fa3-8438-b12bc57e0720", "tier": "proxy", "run_name": "round0037_proxy_1774150497", "family_name": "bucketed_topk", "family_stage": "prototype", "status": null, "decision": null, "payload": {"tier": "proxy", "run_name": "round0037_proxy_1774150497", "family_name": "bucketed_topk", "family_stage": "prototype", "checkpoint_dir": "/root/sparsify-ascend/checkpoints/research_agent/round_0037_proxy/round0037_proxy_1774150497_dp2_bs1_ga8_ef32_k128_20260322_113506", "metrics_path": "/root/sparsify-ascend/checkpoints/research_agent/round_0037_proxy/round0037_proxy_1774150497_dp2_bs1_ga8_ef32_k128_20260322_113506/metrics.jsonl", "latest_step": 90, "latest_tokens_per_sec": 49150.40044268121, "baseline_ratio": null, "latest_total_tokens": 2949120.0, "proxy_mode": "fast", "evaluation_basis": "terminal_only"}}
{"event_id": "evt_1774150587923620821", "ts": 1774150587, "event": "training_heartbeat", "round": 37, "session_id": "019d135d-4c60-7fa3-8438-b12bc57e0720", "tier": "proxy", "run_name": "round0037_proxy_1774150497", "family_name": "bucketed_topk", "family_stage": "prototype", "status": null, "decision": null, "payload": {"tier": "proxy", "run_name": "round0037_proxy_1774150497", "family_name": "bucketed_topk", "family_stage": "prototype", "checkpoint_dir": "/root/sparsify-ascend/checkpoints/research_agent/round_0037_proxy/round0037_proxy_1774150497_dp2_bs1_ga8_ef32_k128_20260322_113506", "metrics_path": "/root/sparsify-ascend/checkpoints/research_agent/round_0037_proxy/round0037_proxy_1774150497_dp2_bs1_ga8_ef32_k128_20260322_113506/metrics.jsonl", "latest_step": 160, "latest_tokens_per_sec": 58252.019373426025, "baseline_ratio": null, "latest_total_tokens": 5242880.0, "proxy_mode": "fast", "evaluation_basis": "terminal_only"}}
{"event_id": "evt_1774150617925427239", "ts": 1774150617, "event": "training_heartbeat", "round": 37, "session_id": "019d135d-4c60-7fa3-8438-b12bc57e0720", "tier": "proxy", "run_name": "round0037_proxy_1774150497", "family_name": "bucketed_topk", "family_stage": "prototype", "status": null, "decision": null, "payload": {"tier": "proxy", "run_name": "round0037_proxy_1774150497", "family_name": "bucketed_topk", "family_stage": "prototype", "checkpoint_dir": "/root/sparsify-ascend/checkpoints/research_agent/round_0037_proxy/round0037_proxy_1774150497_dp2_bs1_ga8_ef32_k128_20260322_113506", "metrics_path": "/root/sparsify-ascend/checkpoints/research_agent/round_0037_proxy/round0037_proxy_1774150497_dp2_bs1_ga8_ef32_k128_20260322_113506/metrics.jsonl", "latest_step": 220, "latest_tokens_per_sec": 60072.0668117377, "baseline_ratio": null, "latest_total_tokens": 7208960.0, "proxy_mode": "fast", "evaluation_basis": "terminal_only"}}
