{"event_id": "evt_1774138823955977272", "ts": 1774138823, "event": "training_heartbeat", "round": 18, "session_id": "019d12cf-0aba-71d0-8920-5ea920811f62", "tier": "full", "run_name": "round0018_full_1774138673", "family_name": "lowrank_residual", "family_stage": "stabilize", "status": null, "decision": null, "payload": {"tier": "full", "run_name": "round0018_full_1774138673", "family_name": "lowrank_residual", "family_stage": "stabilize", "checkpoint_dir": "/root/sparsify-ascend/checkpoints/research_agent/round_0018_full/round0018_full_1774138673_dp2_bs1_ga8_ef16_k32_20260322_081800", "metrics_path": "/root/sparsify-ascend/checkpoints/research_agent/round_0018_full/round0018_full_1774138673_dp2_bs1_ga8_ef16_k32_20260322_081800/metrics.jsonl", "latest_step": 930, "latest_tokens_per_sec": 203137.7880100124, "baseline_ratio": 1.2204237690262443, "latest_total_tokens": 30474240.0, "proxy_mode": null, "evaluation_basis": null}}
{"event_id": "evt_1774138854186408259", "ts": 1774138854, "event": "training_heartbeat", "round": 18, "session_id": "019d12cf-0aba-71d0-8920-5ea920811f62", "tier": "full", "run_name": "round0018_full_1774138673", "family_name": "lowrank_residual", "family_stage": "stabilize", "status": null, "decision": null, "payload": {"tier": "full", "run_name": "round0018_full_1774138673", "family_name": "lowrank_residual", "family_stage": "stabilize", "checkpoint_dir": "/root/sparsify-ascend/checkpoints/research_agent/round_0018_full/round0018_full_1774138673_dp2_bs1_ga8_ef16_k32_20260322_081800", "metrics_path": "/root/sparsify-ascend/checkpoints/research_agent/round_0018_full/round0018_full_1774138673_dp2_bs1_ga8_ef16_k32_20260322_081800/metrics.jsonl", "latest_step": 1090, "latest_tokens_per_sec": 198401.43808244675, "baseline_ratio": 1.1919684329381013, "latest_total_tokens": 35717120.0, "proxy_mode": null, "evaluation_basis": null}}
{"event_id": "evt_1774138884255726124", "ts": 1774138884, "event": "training_heartbeat", "round": 18, "session_id": "019d12cf-0aba-71d0-8920-5ea920811f62", "tier": "full", "run_name": "round0018_full_1774138673", "family_name": "lowrank_residual", "family_stage": "stabilize", "status": null, "decision": null, "payload": {"tier": "full", "run_name": "round0018_full_1774138673", "family_name": "lowrank_residual", "family_stage": "stabilize", "checkpoint_dir": "/root/sparsify-ascend/checkpoints/research_agent/round_0018_full/round0018_full_1774138673_dp2_bs1_ga8_ef16_k32_20260322_081800", "metrics_path": "/root/sparsify-ascend/checkpoints/research_agent/round_0018_full/round0018_full_1774138673_dp2_bs1_ga8_ef16_k32_20260322_081800/metrics.jsonl", "latest_step": 1220, "latest_tokens_per_sec": 190134.8628024336, "baseline_ratio": 1.1423039905957657, "latest_total_tokens": 39976960.0, "proxy_mode": null, "evaluation_basis": null}}
{"event_id": "evt_1774138914263245520", "ts": 1774138914, "event": "training_heartbeat", "round": 18, "session_id": "019d12cf-0aba-71d0-8920-5ea920811f62", "tier": "full", "run_name": "round0018_full_1774138673", "family_name": "lowrank_residual", "family_stage": "stabilize", "status": null, "decision": null, "payload": {"tier": "full", "run_name": "round0018_full_1774138673", "family_name": "lowrank_residual", "family_stage": "stabilize", "checkpoint_dir": "/root/sparsify-ascend/checkpoints/research_agent/round_0018_full/round0018_full_1774138673_dp2_bs1_ga8_ef16_k32_20260322_081800", "metrics_path": "/root/sparsify-ascend/checkpoints/research_agent/round_0018_full/round0018_full_1774138673_dp2_bs1_ga8_ef16_k32_20260322_081800/metrics.jsonl", "latest_step": 1220, "latest_tokens_per_sec": 166345.36778682852, "baseline_ratio": 0.9993799908092524, "latest_total_tokens": 39976960.0, "proxy_mode": null, "evaluation_basis": null}}
{"event_id": "evt_1774138914338394736", "ts": 1774138914, "event": "training_finished", "round": 18, "session_id": "019d12cf-0aba-71d0-8920-5ea920811f62", "tier": "full", "run_name": "round0018_full_1774138673", "family_name": "lowrank_residual", "family_stage": "stabilize", "status": "ok", "decision": "keep", "payload": {"tier": "full", "run_name": "round0018_full_1774138673", "family_name": "lowrank_residual", "family_stage": "stabilize", "checkpoint_dir": "/root/sparsify-ascend/checkpoints/research_agent/round_0018_full/round0018_full_1774138673_dp2_bs1_ga8_ef16_k32_20260322_081800", "metrics_path": "/root/sparsify-ascend/checkpoints/research_agent/round_0018_full/round0018_full_1774138673_dp2_bs1_ga8_ef16_k32_20260322_081800/metrics.jsonl", "run_health": "normal", "termination_reason": "completed", "tokens_per_sec": 166345.36778682852, "baseline_ratio": 0.9993799908092524, "status": "ok", "decision": "keep", "proxy_mode": null, "evaluation_basis": null, "curve_start_fvu": 0.13616612553596497, "curve_mid_fvu": 0.11913134157657623, "curve_end_fvu": 0.09775596857070923, "curve_late_slope": -1.4734131000892136e-09, "curve_still_improving": true}}
{"event_id": "evt_1774138914338456337", "ts": 1774138914, "event": "result_recorded", "round": 18, "session_id": "019d12cf-0aba-71d0-8920-5ea920811f62", "tier": "full", "run_name": "round0018_full_1774138673", "family_name": "lowrank_residual", "family_stage": "stabilize", "status": "ok", "decision": "keep", "payload": {"tier": "full", "run_name": "round0018_full_1774138673", "family_name": "lowrank_residual", "family_stage": "stabilize", "status": "ok", "decision": "keep", "val_fvu": "0.10000576265156269", "observed_fvu": "0.097756", "k": "32", "log_path": "/root/sparsify-ascend/research/history/logs/full_1774138914.log", "checkpoint": null}}
{"event_id": "evt_1774138914339000217", "ts": 1774138914, "event": "round_finished", "round": 18, "session_id": "019d12cf-0aba-71d0-8920-5ea920811f62", "tier": "full", "run_name": null, "family_name": "lowrank_residual", "family_stage": "stabilize", "status": "ok", "decision": "keep", "payload": {"tier": "full", "family_name": "lowrank_residual", "family_stage": "stabilize", "status": "ok", "decision": "keep", "val_fvu": "0.10000576265156269"}}
{"event_id": "evt_1774138914345119003", "ts": 1774138914, "event": "experiment_commit_prepared", "round": 18, "tier": "full", "run_name": null, "family_name": "lowrank_residual", "family_stage": "stabilize", "status": "ok", "decision": "keep", "payload": {"branch": "autoresearch-sae"}}
{"event_id": "evt_1774138921826077958", "ts": 1774138921, "event": "round_started", "round": 19, "session_id": "019d12cf-0aba-71d0-8920-5ea920811f62", "tier": null, "run_name": null, "family_name": null, "family_stage": null, "status": "started", "decision": null, "payload": {"status": "started"}}
{"event_id": "evt_1774138921826237090", "ts": 1774138921, "event": "agent_deciding", "round": 19, "session_id": "019d12cf-0aba-71d0-8920-5ea920811f62", "tier": null, "run_name": null, "family_name": null, "family_stage": null, "status": null, "decision": null, "payload": {}}
{"event_id": "evt_1774139050555293032", "ts": 1774139050, "event": "session_resumed", "round": 19, "tier": null, "run_name": null, "family_name": null, "family_stage": null, "status": "active", "decision": null, "payload": {"session_id": "019d12cf-0aba-71d0-8920-5ea920811f62"}}
{"event_id": "evt_1774139050556360327", "ts": 1774139050, "event": "agent_action_received", "round": 19, "session_id": "019d12cf-0aba-71d0-8920-5ea920811f62", "tier": "proxy", "run_name": null, "family_name": "lowrank_residual", "family_stage": "stabilize", "status": null, "decision": null, "payload": {"session_id": "019d12cf-0aba-71d0-8920-5ea920811f62", "tier": "proxy", "family_name": "lowrank_residual", "family_stage": "stabilize", "change_type": "param_only", "expected_win": "lower_fvu", "hypothesis": "`lowrank_residual` now owns the full frontier at K=32, 64, and 128 under the shared EF=16 recipe, so the next clean stabilization move is to test whether a larger sparse residual budget improves quality within this winning family. Increasing only `EXPANSION_FACTOR` from 16 to 32 at K=64 may strengthen the middle Pareto point by giving the residual branch more capacity while keeping the low-rank trunk and optimization recipe fixed."}}
{"event_id": "evt_1774139050556489002", "ts": 1774139050, "event": "proxy_mode_selected", "round": 19, "session_id": "019d12cf-0aba-71d0-8920-5ea920811f62", "tier": "proxy", "run_name": null, "family_name": "lowrank_residual", "family_stage": "stabilize", "status": null, "decision": null, "payload": {"tier": "proxy", "proxy_mode": "fast", "evaluation_basis": "terminal_only", "parameter_behavior": "structural", "proxy_max_tokens": "5000000"}}
{"event_id": "evt_1774139050556782484", "ts": 1774139050, "event": "training_started", "round": 19, "session_id": "019d12cf-0aba-71d0-8920-5ea920811f62", "tier": "proxy", "run_name": "round0019_proxy_1774139050", "family_name": "lowrank_residual", "family_stage": "stabilize", "status": null, "decision": null, "payload": {"tier": "proxy", "run_name": "round0019_proxy_1774139050", "family_name": "lowrank_residual", "family_stage": "stabilize", "checkpoint_dir": "/root/sparsify-ascend/checkpoints/research_agent/round_0019_proxy", "log_path": "/root/sparsify-ascend/research/history/logs/round0019_proxy_1774139050.log", "config": {"architecture": "lowrank_residual", "expansion_factor": 32, "k": 64, "optimizer": "signum", "lr": "1.6e-3", "hookpoints": "layers.[3].self_attn.o_proj", "batch_size": 1, "grad_acc_steps": 8, "micro_acc_steps": 1, "auxk_alpha": 0.0, "dead_feature_threshold": 10000000, "use_hadamard": false, "tier": "proxy", "family_name": "lowrank_residual", "family_stage": "stabilize"}, "baseline_tokens_per_sec": 83008.52258207071, "proxy_mode": "fast", "evaluation_basis": "terminal_only"}}
{"event_id": "evt_1774139080558248852", "ts": 1774139080, "event": "training_heartbeat", "round": 19, "session_id": "019d12cf-0aba-71d0-8920-5ea920811f62", "tier": "proxy", "run_name": "round0019_proxy_1774139050", "family_name": "lowrank_residual", "family_stage": "stabilize", "status": null, "decision": null, "payload": {"tier": "proxy", "run_name": "round0019_proxy_1774139050", "family_name": "lowrank_residual", "family_stage": "stabilize", "checkpoint_dir": "/root/sparsify-ascend/checkpoints/research_agent/round_0019_proxy/round0019_proxy_1774139050_dp2_bs1_ga8_ef32_k64_20260322_082417", "metrics_path": "/root/sparsify-ascend/checkpoints/research_agent/round_0019_proxy/round0019_proxy_1774139050_dp2_bs1_ga8_ef32_k64_20260322_082417/metrics.jsonl", "latest_step": 60, "latest_tokens_per_sec": 65533.60633743026, "baseline_ratio": 0.7894804569330461, "latest_total_tokens": 1966080.0, "proxy_mode": "fast", "evaluation_basis": "terminal_only"}}
{"event_id": "evt_1774139110559678427", "ts": 1774139110, "event": "training_heartbeat", "round": 19, "session_id": "019d12cf-0aba-71d0-8920-5ea920811f62", "tier": "proxy", "run_name": "round0019_proxy_1774139050", "family_name": "lowrank_residual", "family_stage": "stabilize", "status": null, "decision": null, "payload": {"tier": "proxy", "run_name": "round0019_proxy_1774139050", "family_name": "lowrank_residual", "family_stage": "stabilize", "checkpoint_dir": "/root/sparsify-ascend/checkpoints/research_agent/round_0019_proxy/round0019_proxy_1774139050_dp2_bs1_ga8_ef32_k64_20260322_082417", "metrics_path": "/root/sparsify-ascend/checkpoints/research_agent/round_0019_proxy/round0019_proxy_1774139050_dp2_bs1_ga8_ef32_k64_20260322_082417/metrics.jsonl", "latest_step": 150, "latest_tokens_per_sec": 81916.56980509518, "baseline_ratio": 0.9868452931938896, "latest_total_tokens": 4915200.0, "proxy_mode": "fast", "evaluation_basis": "terminal_only"}}
{"event_id": "evt_1774139140561109564", "ts": 1774139140, "event": "training_heartbeat", "round": 19, "session_id": "019d12cf-0aba-71d0-8920-5ea920811f62", "tier": "proxy", "run_name": "round0019_proxy_1774139050", "family_name": "lowrank_residual", "family_stage": "stabilize", "status": null, "decision": null, "payload": {"tier": "proxy", "run_name": "round0019_proxy_1774139050", "family_name": "lowrank_residual", "family_stage": "stabilize", "checkpoint_dir": "/root/sparsify-ascend/checkpoints/research_agent/round_0019_proxy/round0019_proxy_1774139050_dp2_bs1_ga8_ef32_k64_20260322_082417", "metrics_path": "/root/sparsify-ascend/checkpoints/research_agent/round_0019_proxy/round0019_proxy_1774139050_dp2_bs1_ga8_ef32_k64_20260322_082417/metrics.jsonl", "latest_step": 152, "latest_tokens_per_sec": 55339.07948184711, "baseline_ratio": 0.6666674428174919, "latest_total_tokens": 4980736.0, "proxy_mode": "fast", "evaluation_basis": "terminal_only"}}
{"event_id": "evt_1774139141286677121", "ts": 1774139141, "event": "training_finished", "round": 19, "session_id": "019d12cf-0aba-71d0-8920-5ea920811f62", "tier": "proxy", "run_name": "round0019_proxy_1774139050", "family_name": "lowrank_residual", "family_stage": "stabilize", "status": "ok", "decision": "promote", "payload": {"tier": "proxy", "run_name": "round0019_proxy_1774139050", "family_name": "lowrank_residual", "family_stage": "stabilize", "checkpoint_dir": "/root/sparsify-ascend/checkpoints/research_agent/round_0019_proxy/round0019_proxy_1774139050_dp2_bs1_ga8_ef32_k64_20260322_082417", "metrics_path": "/root/sparsify-ascend/checkpoints/research_agent/round_0019_proxy/round0019_proxy_1774139050_dp2_bs1_ga8_ef32_k64_20260322_082417/metrics.jsonl", "run_health": "normal", "termination_reason": "completed", "tokens_per_sec": 55339.07948184711, "baseline_ratio": 0.6666674428174919, "status": "ok", "decision": "promote", "proxy_mode": "fast", "evaluation_basis": "terminal_only", "curve_start_fvu": 0.299995094537735, "curve_mid_fvu": 0.19612708687782288, "curve_end_fvu": 0.15438900887966156, "curve_late_slope": -6.356238431650244e-09, "curve_still_improving": true}}
{"event_id": "evt_1774139141286807513", "ts": 1774139141, "event": "result_recorded", "round": 19, "session_id": "019d12cf-0aba-71d0-8920-5ea920811f62", "tier": "proxy", "run_name": "round0019_proxy_1774139050", "family_name": "lowrank_residual", "family_stage": "stabilize", "status": "ok", "decision": "promote", "payload": {"tier": "proxy", "run_name": "round0019_proxy_1774139050", "family_name": "lowrank_residual", "family_stage": "stabilize", "status": "ok", "decision": "promote", "val_fvu": "0.1552824880927801", "observed_fvu": "0.154389", "k": "64", "log_path": "/root/sparsify-ascend/research/history/logs/proxy_1774139141.log", "checkpoint": null}}
{"event_id": "evt_1774139141287814586", "ts": 1774139141, "event": "training_started", "round": 19, "session_id": "019d12cf-0aba-71d0-8920-5ea920811f62", "tier": "full", "run_name": "round0019_full_1774139141", "family_name": "lowrank_residual", "family_stage": "stabilize", "status": null, "decision": null, "payload": {"tier": "full", "run_name": "round0019_full_1774139141", "family_name": "lowrank_residual", "family_stage": "stabilize", "checkpoint_dir": "/root/sparsify-ascend/checkpoints/research_agent/round_0019_full", "log_path": "/root/sparsify-ascend/research/history/logs/round0019_full_1774139141.log", "config": {"architecture": "lowrank_residual", "expansion_factor": 32, "k": 64, "optimizer": "signum", "lr": "1.6e-3", "hookpoints": "layers.[3].self_attn.o_proj", "batch_size": 1, "grad_acc_steps": 8, "micro_acc_steps": 1, "auxk_alpha": 0.0, "dead_feature_threshold": 10000000, "use_hadamard": false, "tier": "full", "family_name": "lowrank_residual", "family_stage": "stabilize"}, "baseline_tokens_per_sec": 166448.5674284209, "proxy_mode": null, "evaluation_basis": null}}
{"event_id": "evt_1774139171289222228", "ts": 1774139171, "event": "training_heartbeat", "round": 19, "session_id": "019d12cf-0aba-71d0-8920-5ea920811f62", "tier": "full", "run_name": "round0019_full_1774139141", "family_name": "lowrank_residual", "family_stage": "stabilize", "status": null, "decision": null, "payload": {"tier": "full", "run_name": "round0019_full_1774139141", "family_name": "lowrank_residual", "family_stage": "stabilize", "checkpoint_dir": "/root/sparsify-ascend/checkpoints/research_agent/round_0019_full/round0019_full_1774139141_dp2_bs1_ga8_ef32_k64_20260322_082547", "metrics_path": "/root/sparsify-ascend/checkpoints/research_agent/round_0019_full/round0019_full_1774139141_dp2_bs1_ga8_ef32_k64_20260322_082547/metrics.jsonl", "latest_step": 60, "latest_tokens_per_sec": 65533.56415303911, "baseline_ratio": 0.3937166006623697, "latest_total_tokens": 1966080.0, "proxy_mode": null, "evaluation_basis": null}}
{"event_id": "evt_1774139201290742205", "ts": 1774139201, "event": "training_heartbeat", "round": 19, "session_id": "019d12cf-0aba-71d0-8920-5ea920811f62", "tier": "full", "run_name": "round0019_full_1774139141", "family_name": "lowrank_residual", "family_stage": "stabilize", "status": null, "decision": null, "payload": {"tier": "full", "run_name": "round0019_full_1774139141", "family_name": "lowrank_residual", "family_stage": "stabilize", "checkpoint_dir": "/root/sparsify-ascend/checkpoints/research_agent/round_0019_full/round0019_full_1774139141_dp2_bs1_ga8_ef32_k64_20260322_082547", "metrics_path": "/root/sparsify-ascend/checkpoints/research_agent/round_0019_full/round0019_full_1774139141_dp2_bs1_ga8_ef32_k64_20260322_082547/metrics.jsonl", "latest_step": 170, "latest_tokens_per_sec": 92838.61569325555, "baseline_ratio": 0.5577615784117794, "latest_total_tokens": 5570560.0, "proxy_mode": null, "evaluation_basis": null}}
{"event_id": "evt_1774139231292917598", "ts": 1774139231, "event": "training_heartbeat", "round": 19, "session_id": "019d12cf-0aba-71d0-8920-5ea920811f62", "tier": "full", "run_name": "round0019_full_1774139141", "family_name": "lowrank_residual", "family_stage": "stabilize", "status": null, "decision": null, "payload": {"tier": "full", "run_name": "round0019_full_1774139141", "family_name": "lowrank_residual", "family_stage": "stabilize", "checkpoint_dir": "/root/sparsify-ascend/checkpoints/research_agent/round_0019_full/round0019_full_1774139141_dp2_bs1_ga8_ef32_k64_20260322_082547", "metrics_path": "/root/sparsify-ascend/checkpoints/research_agent/round_0019_full/round0019_full_1774139141_dp2_bs1_ga8_ef32_k64_20260322_082547/metrics.jsonl", "latest_step": 280, "latest_tokens_per_sec": 101939.49226100354, "baseline_ratio": 0.612438387640923, "latest_total_tokens": 9175040.0, "proxy_mode": null, "evaluation_basis": null}}
{"event_id": "evt_1774139261295910027", "ts": 1774139261, "event": "training_heartbeat", "round": 19, "session_id": "019d12cf-0aba-71d0-8920-5ea920811f62", "tier": "full", "run_name": "round0019_full_1774139141", "family_name": "lowrank_residual", "family_stage": "stabilize", "status": null, "decision": null, "payload": {"tier": "full", "run_name": "round0019_full_1774139141", "family_name": "lowrank_residual", "family_stage": "stabilize", "checkpoint_dir": "/root/sparsify-ascend/checkpoints/research_agent/round_0019_full/round0019_full_1774139141_dp2_bs1_ga8_ef32_k64_20260322_082547", "metrics_path": "/root/sparsify-ascend/checkpoints/research_agent/round_0019_full/round0019_full_1774139141_dp2_bs1_ga8_ef32_k64_20260322_082547/metrics.jsonl", "latest_step": 390, "latest_tokens_per_sec": 106489.29581595158, "baseline_ratio": 0.6397729788917886, "latest_total_tokens": 12779520.0, "proxy_mode": null, "evaluation_basis": null}}
{"event_id": "evt_1774139291299423633", "ts": 1774139291, "event": "training_heartbeat", "round": 19, "session_id": "019d12cf-0aba-71d0-8920-5ea920811f62", "tier": "full", "run_name": "round0019_full_1774139141", "family_name": "lowrank_residual", "family_stage": "stabilize", "status": null, "decision": null, "payload": {"tier": "full", "run_name": "round0019_full_1774139141", "family_name": "lowrank_residual", "family_stage": "stabilize", "checkpoint_dir": "/root/sparsify-ascend/checkpoints/research_agent/round_0019_full/round0019_full_1774139141_dp2_bs1_ga8_ef32_k64_20260322_082547", "metrics_path": "/root/sparsify-ascend/checkpoints/research_agent/round_0019_full/round0019_full_1774139141_dp2_bs1_ga8_ef32_k64_20260322_082547/metrics.jsonl", "latest_step": 510, "latest_tokens_per_sec": 111402.82848325565, "baseline_ratio": 0.6692928044043577, "latest_total_tokens": 16711680.0, "proxy_mode": null, "evaluation_basis": null}}
{"event_id": "evt_1774139321303519833", "ts": 1774139321, "event": "training_heartbeat", "round": 19, "session_id": "019d12cf-0aba-71d0-8920-5ea920811f62", "tier": "full", "run_name": "round0019_full_1774139141", "family_name": "lowrank_residual", "family_stage": "stabilize", "status": null, "decision": null, "payload": {"tier": "full", "run_name": "round0019_full_1774139141", "family_name": "lowrank_residual", "family_stage": "stabilize", "checkpoint_dir": "/root/sparsify-ascend/checkpoints/research_agent/round_0019_full/round0019_full_1774139141_dp2_bs1_ga8_ef32_k64_20260322_082547", "metrics_path": "/root/sparsify-ascend/checkpoints/research_agent/round_0019_full/round0019_full_1774139141_dp2_bs1_ga8_ef32_k64_20260322_082547/metrics.jsonl", "latest_step": 620, "latest_tokens_per_sec": 112857.91925932406, "baseline_ratio": 0.6780347887815686, "latest_total_tokens": 20316160.0, "proxy_mode": null, "evaluation_basis": null}}
