{"event_id": "evt_1774118873288300132", "ts": 1774118873, "event": "training_heartbeat", "round": 2, "session_id": "019d11b4-1059-72d0-bd97-56886d766be4", "tier": "proxy", "run_name": "round0002_proxy_1774118843", "family_name": "gated", "family_stage": "stabilize", "status": null, "decision": null, "payload": {"tier": "proxy", "run_name": "round0002_proxy_1774118843", "family_name": "gated", "family_stage": "stabilize", "checkpoint_dir": "/root/sparsify-ascend/checkpoints/research_agent/round_0002_proxy/round0002_proxy_1774118843_dp2_bs1_ga8_ef16_k128_20260322_024729", "metrics_path": "/root/sparsify-ascend/checkpoints/research_agent/round_0002_proxy/round0002_proxy_1774118843_dp2_bs1_ga8_ef16_k128_20260322_024729/metrics.jsonl", "latest_step": 80, "latest_tokens_per_sec": 87377.57377287225, "baseline_ratio": 0.6557680596387102, "latest_total_tokens": 2621440.0, "proxy_mode": "extended", "evaluation_basis": "curve_extended"}}
{"event_id": "evt_1774118903290310435", "ts": 1774118903, "event": "training_heartbeat", "round": 2, "session_id": "019d11b4-1059-72d0-bd97-56886d766be4", "tier": "proxy", "run_name": "round0002_proxy_1774118843", "family_name": "gated", "family_stage": "stabilize", "status": null, "decision": null, "payload": {"tier": "proxy", "run_name": "round0002_proxy_1774118843", "family_name": "gated", "family_stage": "stabilize", "checkpoint_dir": "/root/sparsify-ascend/checkpoints/research_agent/round_0002_proxy/round0002_proxy_1774118843_dp2_bs1_ga8_ef16_k128_20260322_024729", "metrics_path": "/root/sparsify-ascend/checkpoints/research_agent/round_0002_proxy/round0002_proxy_1774118843_dp2_bs1_ga8_ef16_k128_20260322_024729/metrics.jsonl", "latest_step": 240, "latest_tokens_per_sec": 131064.81810187647, "baseline_ratio": 0.9836405125756879, "latest_total_tokens": 7864320.0, "proxy_mode": "extended", "evaluation_basis": "curve_extended"}}
{"event_id": "evt_1774118933293208301", "ts": 1774118933, "event": "training_heartbeat", "round": 2, "session_id": "019d11b4-1059-72d0-bd97-56886d766be4", "tier": "proxy", "run_name": "round0002_proxy_1774118843", "family_name": "gated", "family_stage": "stabilize", "status": null, "decision": null, "payload": {"tier": "proxy", "run_name": "round0002_proxy_1774118843", "family_name": "gated", "family_stage": "stabilize", "checkpoint_dir": "/root/sparsify-ascend/checkpoints/research_agent/round_0002_proxy/round0002_proxy_1774118843_dp2_bs1_ga8_ef16_k128_20260322_024729", "metrics_path": "/root/sparsify-ascend/checkpoints/research_agent/round_0002_proxy/round0002_proxy_1774118843_dp2_bs1_ga8_ef16_k128_20260322_024729/metrics.jsonl", "latest_step": 390, "latest_tokens_per_sec": 141984.90530071693, "baseline_ratio": 1.0655956880773951, "latest_total_tokens": 12779520.0, "proxy_mode": "extended", "evaluation_basis": "curve_extended"}}
{"event_id": "evt_1774118963297224636", "ts": 1774118963, "event": "training_heartbeat", "round": 2, "session_id": "019d11b4-1059-72d0-bd97-56886d766be4", "tier": "proxy", "run_name": "round0002_proxy_1774118843", "family_name": "gated", "family_stage": "stabilize", "status": null, "decision": null, "payload": {"tier": "proxy", "run_name": "round0002_proxy_1774118843", "family_name": "gated", "family_stage": "stabilize", "checkpoint_dir": "/root/sparsify-ascend/checkpoints/research_agent/round_0002_proxy/round0002_proxy_1774118843_dp2_bs1_ga8_ef16_k128_20260322_024729", "metrics_path": "/root/sparsify-ascend/checkpoints/research_agent/round_0002_proxy/round0002_proxy_1774118843_dp2_bs1_ga8_ef16_k128_20260322_024729/metrics.jsonl", "latest_step": 550, "latest_tokens_per_sec": 150174.15634274227, "baseline_ratio": 1.1270559579594885, "latest_total_tokens": 18022400.0, "proxy_mode": "extended", "evaluation_basis": "curve_extended"}}
{"event_id": "evt_1774118993301486690", "ts": 1774118993, "event": "training_heartbeat", "round": 2, "session_id": "019d11b4-1059-72d0-bd97-56886d766be4", "tier": "proxy", "run_name": "round0002_proxy_1774118843", "family_name": "gated", "family_stage": "stabilize", "status": null, "decision": null, "payload": {"tier": "proxy", "run_name": "round0002_proxy_1774118843", "family_name": "gated", "family_stage": "stabilize", "checkpoint_dir": "/root/sparsify-ascend/checkpoints/research_agent/round_0002_proxy/round0002_proxy_1774118843_dp2_bs1_ga8_ef16_k128_20260322_024729", "metrics_path": "/root/sparsify-ascend/checkpoints/research_agent/round_0002_proxy/round0002_proxy_1774118843_dp2_bs1_ga8_ef16_k128_20260322_024729/metrics.jsonl", "latest_step": 610, "latest_tokens_per_sec": 133243.691741103, "baseline_ratio": 0.999992943490142, "latest_total_tokens": 19988480.0, "proxy_mode": "extended", "evaluation_basis": "curve_extended"}}
{"event_id": "evt_1774118993369256181", "ts": 1774118993, "event": "training_finished", "round": 2, "session_id": "019d11b4-1059-72d0-bd97-56886d766be4", "tier": "proxy", "run_name": "round0002_proxy_1774118843", "family_name": "gated", "family_stage": "stabilize", "status": "ok", "decision": "discard", "payload": {"tier": "proxy", "run_name": "round0002_proxy_1774118843", "family_name": "gated", "family_stage": "stabilize", "checkpoint_dir": "/root/sparsify-ascend/checkpoints/research_agent/round_0002_proxy/round0002_proxy_1774118843_dp2_bs1_ga8_ef16_k128_20260322_024729", "metrics_path": "/root/sparsify-ascend/checkpoints/research_agent/round_0002_proxy/round0002_proxy_1774118843_dp2_bs1_ga8_ef16_k128_20260322_024729/metrics.jsonl", "run_health": "normal", "termination_reason": "completed", "tokens_per_sec": 133243.691741103, "baseline_ratio": 0.999992943490142, "status": "ok", "decision": "discard", "proxy_mode": "extended", "evaluation_basis": "curve_extended", "curve_start_fvu": 0.25444483757019043, "curve_mid_fvu": 0.21166247129440308, "curve_end_fvu": 0.18827927112579346, "curve_late_slope": 3.357973716939326e-10, "curve_still_improving": false}}
{"event_id": "evt_1774118993369311765", "ts": 1774118993, "event": "result_recorded", "round": 2, "session_id": "019d11b4-1059-72d0-bd97-56886d766be4", "tier": "proxy", "run_name": "round0002_proxy_1774118843", "family_name": "gated", "family_stage": "stabilize", "status": "ok", "decision": "discard", "payload": {"tier": "proxy", "run_name": "round0002_proxy_1774118843", "family_name": "gated", "family_stage": "stabilize", "status": "ok", "decision": "discard", "val_fvu": "0.17990098893642426", "observed_fvu": "0.188279", "k": "128", "log_path": "/root/sparsify-ascend/research/history/logs/proxy_1774118993.log", "checkpoint": null}}
{"event_id": "evt_1774118993369582940", "ts": 1774118993, "event": "round_finished", "round": 2, "session_id": "019d11b4-1059-72d0-bd97-56886d766be4", "tier": "proxy", "run_name": null, "family_name": "gated", "family_stage": "stabilize", "status": "ok", "decision": "discard", "payload": {"tier": "proxy", "family_name": "gated", "family_stage": "stabilize", "status": "ok", "decision": "discard", "val_fvu": "0.17990098893642426"}}
{"event_id": "evt_1774118993375219498", "ts": 1774118993, "event": "experiment_commit_prepared", "round": 2, "tier": "proxy", "run_name": null, "family_name": "gated", "family_stage": "stabilize", "status": "ok", "decision": "discard", "payload": {"branch": "autoresearch-sae"}}
{"event_id": "evt_1774119001016343187", "ts": 1774119001, "event": "round_started", "round": 3, "session_id": "019d11b4-1059-72d0-bd97-56886d766be4", "tier": null, "run_name": null, "family_name": null, "family_stage": null, "status": "started", "decision": null, "payload": {"status": "started"}}
{"event_id": "evt_1774119001017163909", "ts": 1774119001, "event": "agent_deciding", "round": 3, "session_id": "019d11b4-1059-72d0-bd97-56886d766be4", "tier": null, "run_name": null, "family_name": null, "family_stage": null, "status": null, "decision": null, "payload": {}}
{"event_id": "evt_1774119126929445314", "ts": 1774119126, "event": "session_resumed", "round": 3, "tier": null, "run_name": null, "family_name": null, "family_stage": null, "status": "active", "decision": null, "payload": {"session_id": "019d11b4-1059-72d0-bd97-56886d766be4"}}
{"event_id": "evt_1774119126934749870", "ts": 1774119126, "event": "agent_action_received", "round": 3, "session_id": "019d11b4-1059-72d0-bd97-56886d766be4", "tier": "proxy", "run_name": null, "family_name": "jumprelu", "family_stage": "stabilize", "status": null, "decision": null, "payload": {"session_id": "019d11b4-1059-72d0-bd97-56886d766be4", "tier": "proxy", "family_name": "jumprelu", "family_stage": "stabilize", "change_type": "param_only", "expected_win": "lower_fvu", "hypothesis": "Five rounds of gated-local tuning have failed to move the frontier, so the current search direction is likely locally exhausted. The least-disruptive fundamentally different probe is to switch the single primary variable back to architecture and run `jumprelu` at K=128 under the strongest shared signum recipe to test whether a different sparse activation mechanism can reopen quality gains without introducing new code risk."}}
{"event_id": "evt_1774119126934865516", "ts": 1774119126, "event": "variable_isolation_warning", "round": 3, "session_id": "019d11b4-1059-72d0-bd97-56886d766be4", "tier": null, "run_name": null, "family_name": "jumprelu", "family_stage": "stabilize", "status": null, "decision": null, "payload": {"violation": "Multiple primary variables changed simultaneously: architecture, lr"}}
{"event_id": "evt_1774119126934910993", "ts": 1774119126, "event": "proxy_mode_selected", "round": 3, "session_id": "019d11b4-1059-72d0-bd97-56886d766be4", "tier": "proxy", "run_name": null, "family_name": "jumprelu", "family_stage": "stabilize", "status": null, "decision": null, "payload": {"tier": "proxy", "proxy_mode": "fast", "evaluation_basis": "terminal_only", "parameter_behavior": "structural", "proxy_max_tokens": "5000000"}}
{"event_id": "evt_1774119126935156126", "ts": 1774119126, "event": "training_started", "round": 3, "session_id": "019d11b4-1059-72d0-bd97-56886d766be4", "tier": "proxy", "run_name": "round0003_proxy_1774119126", "family_name": "jumprelu", "family_stage": "stabilize", "status": null, "decision": null, "payload": {"tier": "proxy", "run_name": "round0003_proxy_1774119126", "family_name": "jumprelu", "family_stage": "stabilize", "checkpoint_dir": "/root/sparsify-ascend/checkpoints/research_agent/round_0003_proxy", "log_path": "/root/sparsify-ascend/research/history/logs/round0003_proxy_1774119126.log", "config": {"architecture": "jumprelu", "expansion_factor": 16, "k": 128, "optimizer": "signum", "lr": "1.6e-3", "hookpoints": "layers.[3].self_attn.o_proj", "batch_size": 1, "grad_acc_steps": 8, "micro_acc_steps": 1, "auxk_alpha": 0.0, "dead_feature_threshold": 10000000, "use_hadamard": false, "tier": "proxy", "family_name": "jumprelu", "family_stage": "stabilize"}, "baseline_tokens_per_sec": 83008.65550432022, "proxy_mode": "fast", "evaluation_basis": "terminal_only"}}
{"event_id": "evt_1774119156936674839", "ts": 1774119156, "event": "training_heartbeat", "round": 3, "session_id": "019d11b4-1059-72d0-bd97-56886d766be4", "tier": "proxy", "run_name": "round0003_proxy_1774119126", "family_name": "jumprelu", "family_stage": "stabilize", "status": null, "decision": null, "payload": {"tier": "proxy", "run_name": "round0003_proxy_1774119126", "family_name": "jumprelu", "family_stage": "stabilize", "checkpoint_dir": "/root/sparsify-ascend/checkpoints/research_agent/round_0003_proxy/round0003_proxy_1774119126_dp2_bs1_ga8_ef16_k128_20260322_025213", "metrics_path": "/root/sparsify-ascend/checkpoints/research_agent/round_0003_proxy/round0003_proxy_1774119126_dp2_bs1_ga8_ef16_k128_20260322_025213/metrics.jsonl", "latest_step": 80, "latest_tokens_per_sec": 87377.78903265618, "baseline_ratio": 1.052634674080567, "latest_total_tokens": 2621440.0, "proxy_mode": "fast", "evaluation_basis": "terminal_only"}}
{"event_id": "evt_1774119187169401049", "ts": 1774119187, "event": "training_heartbeat", "round": 3, "session_id": "019d11b4-1059-72d0-bd97-56886d766be4", "tier": "proxy", "run_name": "round0003_proxy_1774119126", "family_name": "jumprelu", "family_stage": "stabilize", "status": null, "decision": null, "payload": {"tier": "proxy", "run_name": "round0003_proxy_1774119126", "family_name": "jumprelu", "family_stage": "stabilize", "checkpoint_dir": "/root/sparsify-ascend/checkpoints/research_agent/round_0003_proxy/round0003_proxy_1774119126_dp2_bs1_ga8_ef16_k128_20260322_025213", "metrics_path": "/root/sparsify-ascend/checkpoints/research_agent/round_0003_proxy/round0003_proxy_1774119126_dp2_bs1_ga8_ef16_k128_20260322_025213/metrics.jsonl", "latest_step": 152, "latest_tokens_per_sec": 83008.57337613069, "baseline_ratio": 0.9999990106069176, "latest_total_tokens": 4980736.0, "proxy_mode": "fast", "evaluation_basis": "terminal_only"}}
{"event_id": "evt_1774119187958246698", "ts": 1774119187, "event": "training_finished", "round": 3, "session_id": "019d11b4-1059-72d0-bd97-56886d766be4", "tier": "proxy", "run_name": "round0003_proxy_1774119126", "family_name": "jumprelu", "family_stage": "stabilize", "status": "ok", "decision": "incubate", "payload": {"tier": "proxy", "run_name": "round0003_proxy_1774119126", "family_name": "jumprelu", "family_stage": "stabilize", "checkpoint_dir": "/root/sparsify-ascend/checkpoints/research_agent/round_0003_proxy/round0003_proxy_1774119126_dp2_bs1_ga8_ef16_k128_20260322_025213", "metrics_path": "/root/sparsify-ascend/checkpoints/research_agent/round_0003_proxy/round0003_proxy_1774119126_dp2_bs1_ga8_ef16_k128_20260322_025213/metrics.jsonl", "run_health": "normal", "termination_reason": "completed", "tokens_per_sec": 83008.57337613069, "baseline_ratio": 0.9999990106069176, "status": "ok", "decision": "incubate", "proxy_mode": "fast", "evaluation_basis": "terminal_only", "curve_start_fvu": 0.365617573261261, "curve_mid_fvu": 0.29550817608833313, "curve_end_fvu": 0.2646826505661011, "curve_late_slope": -3.6648529086021646e-09, "curve_still_improving": true}}
{"event_id": "evt_1774119187958392963", "ts": 1774119187, "event": "result_recorded", "round": 3, "session_id": "019d11b4-1059-72d0-bd97-56886d766be4", "tier": "proxy", "run_name": "round0003_proxy_1774119126", "family_name": "jumprelu", "family_stage": "stabilize", "status": "ok", "decision": "incubate", "payload": {"tier": "proxy", "run_name": "round0003_proxy_1774119126", "family_name": "jumprelu", "family_stage": "stabilize", "status": "ok", "decision": "incubate", "val_fvu": "0.2653468679636717", "observed_fvu": "0.264683", "k": "128", "log_path": "/root/sparsify-ascend/research/history/logs/proxy_1774119187.log", "checkpoint": null}}
{"event_id": "evt_1774119187958537697", "ts": 1774119187, "event": "round_finished", "round": 3, "session_id": "019d11b4-1059-72d0-bd97-56886d766be4", "tier": "proxy", "run_name": null, "family_name": "jumprelu", "family_stage": "stabilize", "status": "ok", "decision": "incubate", "payload": {"tier": "proxy", "family_name": "jumprelu", "family_stage": "stabilize", "status": "ok", "decision": "incubate", "val_fvu": "0.2653468679636717"}}
{"event_id": "evt_1774119188221411106", "ts": 1774119188, "event": "experiment_commit_prepared", "round": 3, "tier": "proxy", "run_name": null, "family_name": "jumprelu", "family_stage": "stabilize", "status": "ok", "decision": "incubate", "payload": {"branch": "autoresearch-sae"}}
{"event_id": "evt_1774120534204212040", "ts": 1774120534, "event": "loop_started", "round": null, "tier": null, "run_name": null, "family_name": null, "family_stage": null, "status": null, "decision": null, "payload": {"rounds": 200, "budget_hours": 10.0}}
{"event_id": "evt_1774120534209771054", "ts": 1774120534, "event": "research_branch_ready", "round": null, "tier": null, "run_name": null, "family_name": null, "family_stage": null, "status": "ready", "decision": null, "payload": {"branch": "autoresearch-sae", "base_branch": "autoresearch-sae", "base_commit": "04a0603ba261d372b5dc5e8d3c9746c5cebe46f2"}}
{"event_id": "evt_1774120534211173389", "ts": 1774120534, "event": "round_started", "round": 4, "session_id": null, "tier": null, "run_name": null, "family_name": null, "family_stage": null, "status": "started", "decision": null, "payload": {"status": "started"}}
{"event_id": "evt_1774120534211293264", "ts": 1774120534, "event": "agent_deciding", "round": 4, "session_id": null, "tier": null, "run_name": null, "family_name": null, "family_stage": null, "status": null, "decision": null, "payload": {}}
{"event_id": "evt_1774120733389984213", "ts": 1774120733, "event": "session_started", "round": 4, "tier": null, "run_name": null, "family_name": null, "family_stage": null, "status": "active", "decision": null, "payload": {"session_id": "019d11d4-9b96-7ed1-af50-a8e94fbadbcd"}}
{"event_id": "evt_1774120733390564947", "ts": 1774120733, "event": "agent_action_received", "round": 4, "session_id": "019d11d4-9b96-7ed1-af50-a8e94fbadbcd", "tier": "proxy", "run_name": null, "family_name": "lowrank_residual", "family_stage": "prototype", "status": null, "decision": null, "payload": {"session_id": "019d11d4-9b96-7ed1-af50-a8e94fbadbcd", "tier": "proxy", "family_name": "lowrank_residual", "family_stage": "prototype", "change_type": "no_change", "expected_win": "explore_unknown", "hypothesis": "Severe stagnation and the policy guidance both point away from more gated-local tuning. The current workspace already contains a `lowrank_residual` implementation that now passes a local forward/backward smoke test, so the least-bad informative move is a clean proxy retry of that fundamentally different family at K=128 under the strongest shared gated recipe. If separating a learned low-rank trunk before TopK makes the residual easier to sparsify, it can lower FVU at fixed K without changing the execution layer."}}
{"event_id": "evt_1774120733390681383", "ts": 1774120733, "event": "variable_isolation_warning", "round": 4, "session_id": "019d11d4-9b96-7ed1-af50-a8e94fbadbcd", "tier": null, "run_name": null, "family_name": "lowrank_residual", "family_stage": "prototype", "status": null, "decision": null, "payload": {"violation": "Multiple primary variables changed simultaneously: architecture, lr"}}
{"event_id": "evt_1774120733390731709", "ts": 1774120733, "event": "proxy_mode_selected", "round": 4, "session_id": "019d11d4-9b96-7ed1-af50-a8e94fbadbcd", "tier": "proxy", "run_name": null, "family_name": "lowrank_residual", "family_stage": "prototype", "status": null, "decision": null, "payload": {"tier": "proxy", "proxy_mode": "fast", "evaluation_basis": "terminal_only", "parameter_behavior": "structural", "proxy_max_tokens": "5000000"}}
{"event_id": "evt_1774120733390993054", "ts": 1774120733, "event": "training_started", "round": 4, "session_id": "019d11d4-9b96-7ed1-af50-a8e94fbadbcd", "tier": "proxy", "run_name": "round0004_proxy_1774120733", "family_name": "lowrank_residual", "family_stage": "prototype", "status": null, "decision": null, "payload": {"tier": "proxy", "run_name": "round0004_proxy_1774120733", "family_name": "lowrank_residual", "family_stage": "prototype", "checkpoint_dir": "/root/sparsify-ascend/checkpoints/research_agent/round_0004_proxy", "log_path": "/root/sparsify-ascend/research/history/logs/round0004_proxy_1774120733.log", "config": {"architecture": "lowrank_residual", "expansion_factor": 16, "k": 128, "optimizer": "signum", "lr": "1.6e-3", "hookpoints": "layers.[3].self_attn.o_proj", "batch_size": 1, "grad_acc_steps": 8, "micro_acc_steps": 1, "auxk_alpha": 0.0, "dead_feature_threshold": 10000000, "use_hadamard": false, "tier": "proxy", "family_name": "lowrank_residual", "family_stage": "prototype"}, "baseline_tokens_per_sec": null, "proxy_mode": "fast", "evaluation_basis": "terminal_only"}}
{"event_id": "evt_1774120763392650772", "ts": 1774120763, "event": "training_heartbeat", "round": 4, "session_id": "019d11d4-9b96-7ed1-af50-a8e94fbadbcd", "tier": "proxy", "run_name": "round0004_proxy_1774120733", "family_name": "lowrank_residual", "family_stage": "prototype", "status": null, "decision": null, "payload": {"tier": "proxy", "run_name": "round0004_proxy_1774120733", "family_name": "lowrank_residual", "family_stage": "prototype", "checkpoint_dir": "/root/sparsify-ascend/checkpoints/research_agent/round_0004_proxy/round0004_proxy_1774120733_dp2_bs1_ga8_ef16_k128_20260322_031900", "metrics_path": "/root/sparsify-ascend/checkpoints/research_agent/round_0004_proxy/round0004_proxy_1774120733_dp2_bs1_ga8_ef16_k128_20260322_031900/metrics.jsonl", "latest_step": 100, "latest_tokens_per_sec": 109221.760637036, "baseline_ratio": null, "latest_total_tokens": 3276800.0, "proxy_mode": "fast", "evaluation_basis": "terminal_only"}}
{"event_id": "evt_1774120793394138860", "ts": 1774120793, "event": "training_heartbeat", "round": 4, "session_id": "019d11d4-9b96-7ed1-af50-a8e94fbadbcd", "tier": "proxy", "run_name": "round0004_proxy_1774120733", "family_name": "lowrank_residual", "family_stage": "prototype", "status": null, "decision": null, "payload": {"tier": "proxy", "run_name": "round0004_proxy_1774120733", "family_name": "lowrank_residual", "family_stage": "prototype", "checkpoint_dir": "/root/sparsify-ascend/checkpoints/research_agent/round_0004_proxy/round0004_proxy_1774120733_dp2_bs1_ga8_ef16_k128_20260322_031900", "metrics_path": "/root/sparsify-ascend/checkpoints/research_agent/round_0004_proxy/round0004_proxy_1774120733_dp2_bs1_ga8_ef16_k128_20260322_031900/metrics.jsonl", "latest_step": 152, "latest_tokens_per_sec": 83008.34645250007, "baseline_ratio": null, "latest_total_tokens": 4980736.0, "proxy_mode": "fast", "evaluation_basis": "terminal_only"}}
