{"event_id": "evt_1774152547504950411", "ts": 1774152547, "event": "agent_action_received", "round": 42, "session_id": "019d13ba-88bf-74b1-a101-245e7e501dd8", "tier": "proxy", "run_name": null, "family_name": "lowrank_gated_residual", "family_stage": "stabilize", "status": null, "decision": null, "payload": {"session_id": "019d13ba-88bf-74b1-a101-245e7e501dd8", "tier": "proxy", "family_name": "lowrank_gated_residual", "family_stage": "stabilize", "change_type": "param_only", "expected_win": "smaller_k", "hypothesis": "Crash-recovery policy forces a param-only round on the best proven working family. Rather than retrying already-regressed LR/aux/EF sweeps at the K=128 anchor, the cleanest stable move is to hold the winning `lowrank_gated_residual` recipe fixed and lower only `K` to 96 in proxy. This maps a missing mid-Pareto point between 64 and 128 and could yield a non-dominated tradeoff if quality stays close to the K=128 anchor while reducing active feature count."}}
{"event_id": "evt_1774152547505091982", "ts": 1774152547, "event": "proxy_mode_selected", "round": 42, "session_id": "019d13ba-88bf-74b1-a101-245e7e501dd8", "tier": "proxy", "run_name": null, "family_name": "lowrank_gated_residual", "family_stage": "stabilize", "status": null, "decision": null, "payload": {"tier": "proxy", "proxy_mode": "fast", "evaluation_basis": "terminal_only", "parameter_behavior": "structural", "proxy_max_tokens": "5000000"}}
{"event_id": "evt_1774152547505387490", "ts": 1774152547, "event": "training_started", "round": 42, "session_id": "019d13ba-88bf-74b1-a101-245e7e501dd8", "tier": "proxy", "run_name": "round0042_proxy_1774152547", "family_name": "lowrank_gated_residual", "family_stage": "stabilize", "status": null, "decision": null, "payload": {"tier": "proxy", "run_name": "round0042_proxy_1774152547", "family_name": "lowrank_gated_residual", "family_stage": "stabilize", "checkpoint_dir": "/root/sparsify-ascend/checkpoints/research_agent/round_0042_proxy", "log_path": "/root/sparsify-ascend/research/history/logs/round0042_proxy_1774152547.log", "config": {"architecture": "lowrank_gated_residual", "expansion_factor": 32, "k": 96, "optimizer": "signum", "lr": "1.6e-3", "hookpoints": "layers.[3].self_attn.o_proj", "batch_size": 1, "grad_acc_steps": 8, "micro_acc_steps": 1, "auxk_alpha": 0.0, "dead_feature_threshold": 10000000, "use_hadamard": false, "tier": "proxy", "family_name": "lowrank_gated_residual", "family_stage": "stabilize"}, "baseline_tokens_per_sec": 83008.58788873068, "proxy_mode": "fast", "evaluation_basis": "terminal_only"}}
{"event_id": "evt_1774152577506626437", "ts": 1774152577, "event": "training_heartbeat", "round": 42, "session_id": "019d13ba-88bf-74b1-a101-245e7e501dd8", "tier": "proxy", "run_name": "round0042_proxy_1774152547", "family_name": "lowrank_gated_residual", "family_stage": "stabilize", "status": null, "decision": null, "payload": {"tier": "proxy", "run_name": "round0042_proxy_1774152547", "family_name": "lowrank_gated_residual", "family_stage": "stabilize", "checkpoint_dir": "/root/sparsify-ascend/checkpoints/research_agent/round_0042_proxy/round0042_proxy_1774152547_dp2_bs1_ga8_ef32_k96_20260322_120917", "metrics_path": "/root/sparsify-ascend/checkpoints/research_agent/round_0042_proxy/round0042_proxy_1774152547_dp2_bs1_ga8_ef32_k96_20260322_120917/metrics.jsonl", "latest_step": 30, "latest_tokens_per_sec": 32766.9588872462, "baseline_ratio": 0.39474179383907665, "latest_total_tokens": 983040.0, "proxy_mode": "fast", "evaluation_basis": "terminal_only"}}
{"event_id": "evt_1774152607507819967", "ts": 1774152607, "event": "training_heartbeat", "round": 42, "session_id": "019d13ba-88bf-74b1-a101-245e7e501dd8", "tier": "proxy", "run_name": "round0042_proxy_1774152547", "family_name": "lowrank_gated_residual", "family_stage": "stabilize", "status": null, "decision": null, "payload": {"tier": "proxy", "run_name": "round0042_proxy_1774152547", "family_name": "lowrank_gated_residual", "family_stage": "stabilize", "checkpoint_dir": "/root/sparsify-ascend/checkpoints/research_agent/round_0042_proxy/round0042_proxy_1774152547_dp2_bs1_ga8_ef32_k96_20260322_120917", "metrics_path": "/root/sparsify-ascend/checkpoints/research_agent/round_0042_proxy/round0042_proxy_1774152547_dp2_bs1_ga8_ef32_k96_20260322_120917/metrics.jsonl", "latest_step": 110, "latest_tokens_per_sec": 60072.52284126426, "baseline_ratio": 0.7236904562427783, "latest_total_tokens": 3604480.0, "proxy_mode": "fast", "evaluation_basis": "terminal_only"}}
{"event_id": "evt_1774152637509328188", "ts": 1774152637, "event": "training_heartbeat", "round": 42, "session_id": "019d13ba-88bf-74b1-a101-245e7e501dd8", "tier": "proxy", "run_name": "round0042_proxy_1774152547", "family_name": "lowrank_gated_residual", "family_stage": "stabilize", "status": null, "decision": null, "payload": {"tier": "proxy", "run_name": "round0042_proxy_1774152547", "family_name": "lowrank_gated_residual", "family_stage": "stabilize", "checkpoint_dir": "/root/sparsify-ascend/checkpoints/research_agent/round_0042_proxy/round0042_proxy_1774152547_dp2_bs1_ga8_ef32_k96_20260322_120917", "metrics_path": "/root/sparsify-ascend/checkpoints/research_agent/round_0042_proxy/round0042_proxy_1774152547_dp2_bs1_ga8_ef32_k96_20260322_120917/metrics.jsonl", "latest_step": 152, "latest_tokens_per_sec": 55339.274743153765, "baseline_ratio": 0.6666692706221385, "latest_total_tokens": 4980736.0, "proxy_mode": "fast", "evaluation_basis": "terminal_only"}}
{"event_id": "evt_1774152637572074049", "ts": 1774152637, "event": "training_finished", "round": 42, "session_id": "019d13ba-88bf-74b1-a101-245e7e501dd8", "tier": "proxy", "run_name": "round0042_proxy_1774152547", "family_name": "lowrank_gated_residual", "family_stage": "stabilize", "status": "ok", "decision": "promote", "payload": {"tier": "proxy", "run_name": "round0042_proxy_1774152547", "family_name": "lowrank_gated_residual", "family_stage": "stabilize", "checkpoint_dir": "/root/sparsify-ascend/checkpoints/research_agent/round_0042_proxy/round0042_proxy_1774152547_dp2_bs1_ga8_ef32_k96_20260322_120917", "metrics_path": "/root/sparsify-ascend/checkpoints/research_agent/round_0042_proxy/round0042_proxy_1774152547_dp2_bs1_ga8_ef32_k96_20260322_120917/metrics.jsonl", "run_health": "normal", "termination_reason": "completed", "tokens_per_sec": 55339.274743153765, "baseline_ratio": 0.6666692706221385, "status": "ok", "decision": "promote", "proxy_mode": "fast", "evaluation_basis": "terminal_only", "curve_start_fvu": 0.2699083089828491, "curve_mid_fvu": 0.17727284133434296, "curve_end_fvu": 0.14003506302833557, "curve_late_slope": -5.577725636202001e-09, "curve_still_improving": true}}
{"event_id": "evt_1774152637572134822", "ts": 1774152637, "event": "result_recorded", "round": 42, "session_id": "019d13ba-88bf-74b1-a101-245e7e501dd8", "tier": "proxy", "run_name": "round0042_proxy_1774152547", "family_name": "lowrank_gated_residual", "family_stage": "stabilize", "status": "ok", "decision": "promote", "payload": {"tier": "proxy", "run_name": "round0042_proxy_1774152547", "family_name": "lowrank_gated_residual", "family_stage": "stabilize", "status": "ok", "decision": "promote", "val_fvu": "0.1410280941054225", "observed_fvu": "0.140035", "k": "96", "log_path": "/root/sparsify-ascend/research/history/logs/proxy_1774152637.log", "checkpoint": null}}
{"event_id": "evt_1774152637572572574", "ts": 1774152637, "event": "training_started", "round": 42, "session_id": "019d13ba-88bf-74b1-a101-245e7e501dd8", "tier": "full", "run_name": "round0042_full_1774152637", "family_name": "lowrank_gated_residual", "family_stage": "stabilize", "status": null, "decision": null, "payload": {"tier": "full", "run_name": "round0042_full_1774152637", "family_name": "lowrank_gated_residual", "family_stage": "stabilize", "checkpoint_dir": "/root/sparsify-ascend/checkpoints/research_agent/round_0042_full", "log_path": "/root/sparsify-ascend/research/history/logs/round0042_full_1774152637.log", "config": {"architecture": "lowrank_gated_residual", "expansion_factor": 32, "k": 96, "optimizer": "signum", "lr": "1.6e-3", "hookpoints": "layers.[3].self_attn.o_proj", "batch_size": 1, "grad_acc_steps": 8, "micro_acc_steps": 1, "auxk_alpha": 0.0, "dead_feature_threshold": 10000000, "use_hadamard": false, "tier": "full", "family_name": "lowrank_gated_residual", "family_stage": "stabilize"}, "baseline_tokens_per_sec": 88695.60575375632, "proxy_mode": null, "evaluation_basis": null}}
{"event_id": "evt_1774152667711009985", "ts": 1774152667, "event": "training_heartbeat", "round": 42, "session_id": "019d13ba-88bf-74b1-a101-245e7e501dd8", "tier": "full", "run_name": "round0042_full_1774152637", "family_name": "lowrank_gated_residual", "family_stage": "stabilize", "status": null, "decision": null, "payload": {"tier": "full", "run_name": "round0042_full_1774152637", "family_name": "lowrank_gated_residual", "family_stage": "stabilize", "checkpoint_dir": "/root/sparsify-ascend/checkpoints/research_agent/round_0042_full/round0042_full_1774152637_dp2_bs1_ga8_ef32_k96_20260322_121045", "metrics_path": "/root/sparsify-ascend/checkpoints/research_agent/round_0042_full/round0042_full_1774152637_dp2_bs1_ga8_ef32_k96_20260322_121045/metrics.jsonl", "latest_step": 40, "latest_tokens_per_sec": 43689.224005971395, "baseline_ratio": 0.492574842177242, "latest_total_tokens": 1310720.0, "proxy_mode": null, "evaluation_basis": null}}
{"event_id": "evt_1774152697712288013", "ts": 1774152697, "event": "training_heartbeat", "round": 42, "session_id": "019d13ba-88bf-74b1-a101-245e7e501dd8", "tier": "full", "run_name": "round0042_full_1774152637", "family_name": "lowrank_gated_residual", "family_stage": "stabilize", "status": null, "decision": null, "payload": {"tier": "full", "run_name": "round0042_full_1774152637", "family_name": "lowrank_gated_residual", "family_stage": "stabilize", "checkpoint_dir": "/root/sparsify-ascend/checkpoints/research_agent/round_0042_full/round0042_full_1774152637_dp2_bs1_ga8_ef32_k96_20260322_121045", "metrics_path": "/root/sparsify-ascend/checkpoints/research_agent/round_0042_full/round0042_full_1774152637_dp2_bs1_ga8_ef32_k96_20260322_121045/metrics.jsonl", "latest_step": 110, "latest_tokens_per_sec": 59935.41290808446, "baseline_ratio": 0.6757427540940624, "latest_total_tokens": 3604480.0, "proxy_mode": null, "evaluation_basis": null}}
{"event_id": "evt_1774152727713962752", "ts": 1774152727, "event": "training_heartbeat", "round": 42, "session_id": "019d13ba-88bf-74b1-a101-245e7e501dd8", "tier": "full", "run_name": "round0042_full_1774152637", "family_name": "lowrank_gated_residual", "family_stage": "stabilize", "status": null, "decision": null, "payload": {"tier": "full", "run_name": "round0042_full_1774152637", "family_name": "lowrank_gated_residual", "family_stage": "stabilize", "checkpoint_dir": "/root/sparsify-ascend/checkpoints/research_agent/round_0042_full/round0042_full_1774152637_dp2_bs1_ga8_ef32_k96_20260322_121045", "metrics_path": "/root/sparsify-ascend/checkpoints/research_agent/round_0042_full/round0042_full_1774152637_dp2_bs1_ga8_ef32_k96_20260322_121045/metrics.jsonl", "latest_step": 190, "latest_tokens_per_sec": 69068.63047743443, "baseline_ratio": 0.7787153590132545, "latest_total_tokens": 6225920.0, "proxy_mode": null, "evaluation_basis": null}}
{"event_id": "evt_1774152757716067549", "ts": 1774152757, "event": "training_heartbeat", "round": 42, "session_id": "019d13ba-88bf-74b1-a101-245e7e501dd8", "tier": "full", "run_name": "round0042_full_1774152637", "family_name": "lowrank_gated_residual", "family_stage": "stabilize", "status": null, "decision": null, "payload": {"tier": "full", "run_name": "round0042_full_1774152637", "family_name": "lowrank_gated_residual", "family_stage": "stabilize", "checkpoint_dir": "/root/sparsify-ascend/checkpoints/research_agent/round_0042_full/round0042_full_1774152637_dp2_bs1_ga8_ef32_k96_20260322_121045", "metrics_path": "/root/sparsify-ascend/checkpoints/research_agent/round_0042_full/round0042_full_1774152637_dp2_bs1_ga8_ef32_k96_20260322_121045/metrics.jsonl", "latest_step": 270, "latest_tokens_per_sec": 73640.14183304728, "baseline_ratio": 0.8302569355858824, "latest_total_tokens": 8847360.0, "proxy_mode": null, "evaluation_basis": null}}
{"event_id": "evt_1774152787718677915", "ts": 1774152787, "event": "training_heartbeat", "round": 42, "session_id": "019d13ba-88bf-74b1-a101-245e7e501dd8", "tier": "full", "run_name": "round0042_full_1774152637", "family_name": "lowrank_gated_residual", "family_stage": "stabilize", "status": null, "decision": null, "payload": {"tier": "full", "run_name": "round0042_full_1774152637", "family_name": "lowrank_gated_residual", "family_stage": "stabilize", "checkpoint_dir": "/root/sparsify-ascend/checkpoints/research_agent/round_0042_full/round0042_full_1774152637_dp2_bs1_ga8_ef32_k96_20260322_121045", "metrics_path": "/root/sparsify-ascend/checkpoints/research_agent/round_0042_full/round0042_full_1774152637_dp2_bs1_ga8_ef32_k96_20260322_121045/metrics.jsonl", "latest_step": 350, "latest_tokens_per_sec": 76384.43417242981, "baseline_ratio": 0.8611975026642724, "latest_total_tokens": 11468800.0, "proxy_mode": null, "evaluation_basis": null}}
{"event_id": "evt_1774152817721688932", "ts": 1774152817, "event": "training_heartbeat", "round": 42, "session_id": "019d13ba-88bf-74b1-a101-245e7e501dd8", "tier": "full", "run_name": "round0042_full_1774152637", "family_name": "lowrank_gated_residual", "family_stage": "stabilize", "status": null, "decision": null, "payload": {"tier": "full", "run_name": "round0042_full_1774152637", "family_name": "lowrank_gated_residual", "family_stage": "stabilize", "checkpoint_dir": "/root/sparsify-ascend/checkpoints/research_agent/round_0042_full/round0042_full_1774152637_dp2_bs1_ga8_ef32_k96_20260322_121045", "metrics_path": "/root/sparsify-ascend/checkpoints/research_agent/round_0042_full/round0042_full_1774152637_dp2_bs1_ga8_ef32_k96_20260322_121045/metrics.jsonl", "latest_step": 430, "latest_tokens_per_sec": 78214.4553235127, "baseline_ratio": 0.881830104871912, "latest_total_tokens": 14090240.0, "proxy_mode": null, "evaluation_basis": null}}
{"event_id": "evt_1774152847725197648", "ts": 1774152847, "event": "training_heartbeat", "round": 42, "session_id": "019d13ba-88bf-74b1-a101-245e7e501dd8", "tier": "full", "run_name": "round0042_full_1774152637", "family_name": "lowrank_gated_residual", "family_stage": "stabilize", "status": null, "decision": null, "payload": {"tier": "full", "run_name": "round0042_full_1774152637", "family_name": "lowrank_gated_residual", "family_stage": "stabilize", "checkpoint_dir": "/root/sparsify-ascend/checkpoints/research_agent/round_0042_full/round0042_full_1774152637_dp2_bs1_ga8_ef32_k96_20260322_121045", "metrics_path": "/root/sparsify-ascend/checkpoints/research_agent/round_0042_full/round0042_full_1774152637_dp2_bs1_ga8_ef32_k96_20260322_121045/metrics.jsonl", "latest_step": 520, "latest_tokens_per_sec": 81081.00386740868, "baseline_ratio": 0.9141490514480741, "latest_total_tokens": 17039360.0, "proxy_mode": null, "evaluation_basis": null}}
{"event_id": "evt_1774152877729137301", "ts": 1774152877, "event": "training_heartbeat", "round": 42, "session_id": "019d13ba-88bf-74b1-a101-245e7e501dd8", "tier": "full", "run_name": "round0042_full_1774152637", "family_name": "lowrank_gated_residual", "family_stage": "stabilize", "status": null, "decision": null, "payload": {"tier": "full", "run_name": "round0042_full_1774152637", "family_name": "lowrank_gated_residual", "family_stage": "stabilize", "checkpoint_dir": "/root/sparsify-ascend/checkpoints/research_agent/round_0042_full/round0042_full_1774152637_dp2_bs1_ga8_ef32_k96_20260322_121045", "metrics_path": "/root/sparsify-ascend/checkpoints/research_agent/round_0042_full/round0042_full_1774152637_dp2_bs1_ga8_ef32_k96_20260322_121045/metrics.jsonl", "latest_step": 600, "latest_tokens_per_sec": 81866.70282923627, "baseline_ratio": 0.9230074267322894, "latest_total_tokens": 19660800.0, "proxy_mode": null, "evaluation_basis": null}}
{"event_id": "evt_1774152907733540440", "ts": 1774152907, "event": "training_heartbeat", "round": 42, "session_id": "019d13ba-88bf-74b1-a101-245e7e501dd8", "tier": "full", "run_name": "round0042_full_1774152637", "family_name": "lowrank_gated_residual", "family_stage": "stabilize", "status": null, "decision": null, "payload": {"tier": "full", "run_name": "round0042_full_1774152637", "family_name": "lowrank_gated_residual", "family_stage": "stabilize", "checkpoint_dir": "/root/sparsify-ascend/checkpoints/research_agent/round_0042_full/round0042_full_1774152637_dp2_bs1_ga8_ef32_k96_20260322_121045", "metrics_path": "/root/sparsify-ascend/checkpoints/research_agent/round_0042_full/round0042_full_1774152637_dp2_bs1_ga8_ef32_k96_20260322_121045/metrics.jsonl", "latest_step": 680, "latest_tokens_per_sec": 82477.74419399821, "baseline_ratio": 0.92989662219546, "latest_total_tokens": 22282240.0, "proxy_mode": null, "evaluation_basis": null}}
{"event_id": "evt_1774152937738390167", "ts": 1774152937, "event": "training_heartbeat", "round": 42, "session_id": "019d13ba-88bf-74b1-a101-245e7e501dd8", "tier": "full", "run_name": "round0042_full_1774152637", "family_name": "lowrank_gated_residual", "family_stage": "stabilize", "status": null, "decision": null, "payload": {"tier": "full", "run_name": "round0042_full_1774152637", "family_name": "lowrank_gated_residual", "family_stage": "stabilize", "checkpoint_dir": "/root/sparsify-ascend/checkpoints/research_agent/round_0042_full/round0042_full_1774152637_dp2_bs1_ga8_ef32_k96_20260322_121045", "metrics_path": "/root/sparsify-ascend/checkpoints/research_agent/round_0042_full/round0042_full_1774152637_dp2_bs1_ga8_ef32_k96_20260322_121045/metrics.jsonl", "latest_step": 760, "latest_tokens_per_sec": 82966.49630928792, "baseline_ratio": 0.9354070655949518, "latest_total_tokens": 24903680.0, "proxy_mode": null, "evaluation_basis": null}}
{"event_id": "evt_1774152967743789974", "ts": 1774152967, "event": "training_heartbeat", "round": 42, "session_id": "019d13ba-88bf-74b1-a101-245e7e501dd8", "tier": "full", "run_name": "round0042_full_1774152637", "family_name": "lowrank_gated_residual", "family_stage": "stabilize", "status": null, "decision": null, "payload": {"tier": "full", "run_name": "round0042_full_1774152637", "family_name": "lowrank_gated_residual", "family_stage": "stabilize", "checkpoint_dir": "/root/sparsify-ascend/checkpoints/research_agent/round_0042_full/round0042_full_1774152637_dp2_bs1_ga8_ef32_k96_20260322_121045", "metrics_path": "/root/sparsify-ascend/checkpoints/research_agent/round_0042_full/round0042_full_1774152637_dp2_bs1_ga8_ef32_k96_20260322_121045/metrics.jsonl", "latest_step": 840, "latest_tokens_per_sec": 83366.31845447535, "baseline_ratio": 0.9399148666499155, "latest_total_tokens": 27525120.0, "proxy_mode": null, "evaluation_basis": null}}
{"event_id": "evt_1774152997749621306", "ts": 1774152997, "event": "training_heartbeat", "round": 42, "session_id": "019d13ba-88bf-74b1-a101-245e7e501dd8", "tier": "full", "run_name": "round0042_full_1774152637", "family_name": "lowrank_gated_residual", "family_stage": "stabilize", "status": null, "decision": null, "payload": {"tier": "full", "run_name": "round0042_full_1774152637", "family_name": "lowrank_gated_residual", "family_stage": "stabilize", "checkpoint_dir": "/root/sparsify-ascend/checkpoints/research_agent/round_0042_full/round0042_full_1774152637_dp2_bs1_ga8_ef32_k96_20260322_121045", "metrics_path": "/root/sparsify-ascend/checkpoints/research_agent/round_0042_full/round0042_full_1774152637_dp2_bs1_ga8_ef32_k96_20260322_121045/metrics.jsonl", "latest_step": 920, "latest_tokens_per_sec": 83699.35782546834, "baseline_ratio": 0.9436697242684271, "latest_total_tokens": 30146560.0, "proxy_mode": null, "evaluation_basis": null}}
{"event_id": "evt_1774153027755791846", "ts": 1774153027, "event": "training_heartbeat", "round": 42, "session_id": "019d13ba-88bf-74b1-a101-245e7e501dd8", "tier": "full", "run_name": "round0042_full_1774152637", "family_name": "lowrank_gated_residual", "family_stage": "stabilize", "status": null, "decision": null, "payload": {"tier": "full", "run_name": "round0042_full_1774152637", "family_name": "lowrank_gated_residual", "family_stage": "stabilize", "checkpoint_dir": "/root/sparsify-ascend/checkpoints/research_agent/round_0042_full/round0042_full_1774152637_dp2_bs1_ga8_ef32_k96_20260322_121045", "metrics_path": "/root/sparsify-ascend/checkpoints/research_agent/round_0042_full/round0042_full_1774152637_dp2_bs1_ga8_ef32_k96_20260322_121045/metrics.jsonl", "latest_step": 990, "latest_tokens_per_sec": 83141.32209443754, "baseline_ratio": 0.9373781416551907, "latest_total_tokens": 32440320.0, "proxy_mode": null, "evaluation_basis": null}}
{"event_id": "evt_1774153057762202783", "ts": 1774153057, "event": "training_heartbeat", "round": 42, "session_id": "019d13ba-88bf-74b1-a101-245e7e501dd8", "tier": "full", "run_name": "round0042_full_1774152637", "family_name": "lowrank_gated_residual", "family_stage": "stabilize", "status": null, "decision": null, "payload": {"tier": "full", "run_name": "round0042_full_1774152637", "family_name": "lowrank_gated_residual", "family_stage": "stabilize", "checkpoint_dir": "/root/sparsify-ascend/checkpoints/research_agent/round_0042_full/round0042_full_1774152637_dp2_bs1_ga8_ef32_k96_20260322_121045", "metrics_path": "/root/sparsify-ascend/checkpoints/research_agent/round_0042_full/round0042_full_1774152637_dp2_bs1_ga8_ef32_k96_20260322_121045/metrics.jsonl", "latest_step": 1030, "latest_tokens_per_sec": 80323.41425634676, "baseline_ratio": 0.9056075954805124, "latest_total_tokens": 33751040.0, "proxy_mode": null, "evaluation_basis": null}}
