{"event_id": "evt_1774135316610429042", "ts": 1774135316, "event": "training_heartbeat", "round": 11, "session_id": "019d1279-dd8d-73d2-97df-ff57e75146ab", "tier": "proxy", "run_name": "round0011_proxy_1774135016", "family_name": "multi_branch_gated", "family_stage": "prototype", "status": null, "decision": null, "payload": {"tier": "proxy", "run_name": "round0011_proxy_1774135016", "family_name": "multi_branch_gated", "family_stage": "prototype", "checkpoint_dir": "/root/sparsify-ascend/checkpoints/research_agent/round_0011_proxy/round0011_proxy_1774135016_dp2_bs1_ga8_ef16_k128_20260322_071703", "metrics_path": "/root/sparsify-ascend/checkpoints/research_agent/round_0011_proxy/round0011_proxy_1774135016_dp2_bs1_ga8_ef16_k128_20260322_071703/metrics.jsonl", "latest_step": 670, "latest_tokens_per_sec": 73175.56944122205, "baseline_ratio": null, "latest_total_tokens": 21954560.0, "proxy_mode": "fast", "evaluation_basis": "terminal_only"}}
{"event_id": "evt_1774135346615179018", "ts": 1774135346, "event": "training_heartbeat", "round": 11, "session_id": "019d1279-dd8d-73d2-97df-ff57e75146ab", "tier": "proxy", "run_name": "round0011_proxy_1774135016", "family_name": "multi_branch_gated", "family_stage": "prototype", "status": null, "decision": null, "payload": {"tier": "proxy", "run_name": "round0011_proxy_1774135016", "family_name": "multi_branch_gated", "family_stage": "prototype", "checkpoint_dir": "/root/sparsify-ascend/checkpoints/research_agent/round_0011_proxy/round0011_proxy_1774135016_dp2_bs1_ga8_ef16_k128_20260322_071703", "metrics_path": "/root/sparsify-ascend/checkpoints/research_agent/round_0011_proxy/round0011_proxy_1774135016_dp2_bs1_ga8_ef16_k128_20260322_071703/metrics.jsonl", "latest_step": 740, "latest_tokens_per_sec": 73472.95284125468, "baseline_ratio": null, "latest_total_tokens": 24248320.0, "proxy_mode": "fast", "evaluation_basis": "terminal_only"}}
{"event_id": "evt_1774135376620315571", "ts": 1774135376, "event": "training_heartbeat", "round": 11, "session_id": "019d1279-dd8d-73d2-97df-ff57e75146ab", "tier": "proxy", "run_name": "round0011_proxy_1774135016", "family_name": "multi_branch_gated", "family_stage": "prototype", "status": null, "decision": null, "payload": {"tier": "proxy", "run_name": "round0011_proxy_1774135016", "family_name": "multi_branch_gated", "family_stage": "prototype", "checkpoint_dir": "/root/sparsify-ascend/checkpoints/research_agent/round_0011_proxy/round0011_proxy_1774135016_dp2_bs1_ga8_ef16_k128_20260322_071703", "metrics_path": "/root/sparsify-ascend/checkpoints/research_agent/round_0011_proxy/round0011_proxy_1774135016_dp2_bs1_ga8_ef16_k128_20260322_071703/metrics.jsonl", "latest_step": 810, "latest_tokens_per_sec": 73720.68827401583, "baseline_ratio": null, "latest_total_tokens": 26542080.0, "proxy_mode": "fast", "evaluation_basis": "terminal_only"}}
{"event_id": "evt_1774135406625893429", "ts": 1774135406, "event": "training_heartbeat", "round": 11, "session_id": "019d1279-dd8d-73d2-97df-ff57e75146ab", "tier": "proxy", "run_name": "round0011_proxy_1774135016", "family_name": "multi_branch_gated", "family_stage": "prototype", "status": null, "decision": null, "payload": {"tier": "proxy", "run_name": "round0011_proxy_1774135016", "family_name": "multi_branch_gated", "family_stage": "prototype", "checkpoint_dir": "/root/sparsify-ascend/checkpoints/research_agent/round_0011_proxy/round0011_proxy_1774135016_dp2_bs1_ga8_ef16_k128_20260322_071703", "metrics_path": "/root/sparsify-ascend/checkpoints/research_agent/round_0011_proxy/round0011_proxy_1774135016_dp2_bs1_ga8_ef16_k128_20260322_071703/metrics.jsonl", "latest_step": 880, "latest_tokens_per_sec": 73930.2274017849, "baseline_ratio": null, "latest_total_tokens": 28835840.0, "proxy_mode": "fast", "evaluation_basis": "terminal_only"}}
{"event_id": "evt_1774135436631833725", "ts": 1774135436, "event": "training_heartbeat", "round": 11, "session_id": "019d1279-dd8d-73d2-97df-ff57e75146ab", "tier": "proxy", "run_name": "round0011_proxy_1774135016", "family_name": "multi_branch_gated", "family_stage": "prototype", "status": null, "decision": null, "payload": {"tier": "proxy", "run_name": "round0011_proxy_1774135016", "family_name": "multi_branch_gated", "family_stage": "prototype", "checkpoint_dir": "/root/sparsify-ascend/checkpoints/research_agent/round_0011_proxy/round0011_proxy_1774135016_dp2_bs1_ga8_ef16_k128_20260322_071703", "metrics_path": "/root/sparsify-ascend/checkpoints/research_agent/round_0011_proxy/round0011_proxy_1774135016_dp2_bs1_ga8_ef16_k128_20260322_071703/metrics.jsonl", "latest_step": 950, "latest_tokens_per_sec": 74109.7626799829, "baseline_ratio": null, "latest_total_tokens": 31129600.0, "proxy_mode": "fast", "evaluation_basis": "terminal_only"}}
{"event_id": "evt_1774135466651104086", "ts": 1774135466, "event": "training_heartbeat", "round": 11, "session_id": "019d1279-dd8d-73d2-97df-ff57e75146ab", "tier": "proxy", "run_name": "round0011_proxy_1774135016", "family_name": "multi_branch_gated", "family_stage": "prototype", "status": null, "decision": null, "payload": {"tier": "proxy", "run_name": "round0011_proxy_1774135016", "family_name": "multi_branch_gated", "family_stage": "prototype", "checkpoint_dir": "/root/sparsify-ascend/checkpoints/research_agent/round_0011_proxy/round0011_proxy_1774135016_dp2_bs1_ga8_ef16_k128_20260322_071703", "metrics_path": "/root/sparsify-ascend/checkpoints/research_agent/round_0011_proxy/round0011_proxy_1774135016_dp2_bs1_ga8_ef16_k128_20260322_071703/metrics.jsonl", "latest_step": 990, "latest_tokens_per_sec": 72081.04839996716, "baseline_ratio": null, "latest_total_tokens": 32440320.0, "proxy_mode": "fast", "evaluation_basis": "terminal_only"}}
{"event_id": "evt_1774135496674798576", "ts": 1774135496, "event": "training_heartbeat", "round": 11, "session_id": "019d1279-dd8d-73d2-97df-ff57e75146ab", "tier": "proxy", "run_name": "round0011_proxy_1774135016", "family_name": "multi_branch_gated", "family_stage": "prototype", "status": null, "decision": null, "payload": {"tier": "proxy", "run_name": "round0011_proxy_1774135016", "family_name": "multi_branch_gated", "family_stage": "prototype", "checkpoint_dir": "/root/sparsify-ascend/checkpoints/research_agent/round_0011_proxy/round0011_proxy_1774135016_dp2_bs1_ga8_ef16_k128_20260322_071703", "metrics_path": "/root/sparsify-ascend/checkpoints/research_agent/round_0011_proxy/round0011_proxy_1774135016_dp2_bs1_ga8_ef16_k128_20260322_071703/metrics.jsonl", "latest_step": 1050, "latest_tokens_per_sec": 71669.10118539189, "baseline_ratio": null, "latest_total_tokens": 34406400.0, "proxy_mode": "fast", "evaluation_basis": "terminal_only"}}
{"event_id": "evt_1774135526900928786", "ts": 1774135526, "event": "training_heartbeat", "round": 11, "session_id": "019d1279-dd8d-73d2-97df-ff57e75146ab", "tier": "proxy", "run_name": "round0011_proxy_1774135016", "family_name": "multi_branch_gated", "family_stage": "prototype", "status": null, "decision": null, "payload": {"tier": "proxy", "run_name": "round0011_proxy_1774135016", "family_name": "multi_branch_gated", "family_stage": "prototype", "checkpoint_dir": "/root/sparsify-ascend/checkpoints/research_agent/round_0011_proxy/round0011_proxy_1774135016_dp2_bs1_ga8_ef16_k128_20260322_071703", "metrics_path": "/root/sparsify-ascend/checkpoints/research_agent/round_0011_proxy/round0011_proxy_1774135016_dp2_bs1_ga8_ef16_k128_20260322_071703/metrics.jsonl", "latest_step": 1120, "latest_tokens_per_sec": 71947.39887425269, "baseline_ratio": null, "latest_total_tokens": 36700160.0, "proxy_mode": "fast", "evaluation_basis": "terminal_only"}}
{"event_id": "evt_1774135556908249871", "ts": 1774135556, "event": "training_heartbeat", "round": 11, "session_id": "019d1279-dd8d-73d2-97df-ff57e75146ab", "tier": "proxy", "run_name": "round0011_proxy_1774135016", "family_name": "multi_branch_gated", "family_stage": "prototype", "status": null, "decision": null, "payload": {"tier": "proxy", "run_name": "round0011_proxy_1774135016", "family_name": "multi_branch_gated", "family_stage": "prototype", "checkpoint_dir": "/root/sparsify-ascend/checkpoints/research_agent/round_0011_proxy/round0011_proxy_1774135016_dp2_bs1_ga8_ef16_k128_20260322_071703", "metrics_path": "/root/sparsify-ascend/checkpoints/research_agent/round_0011_proxy/round0011_proxy_1774135016_dp2_bs1_ga8_ef16_k128_20260322_071703/metrics.jsonl", "latest_step": 1190, "latest_tokens_per_sec": 72167.71043406143, "baseline_ratio": null, "latest_total_tokens": 38993920.0, "proxy_mode": "fast", "evaluation_basis": "terminal_only"}}
{"event_id": "evt_1774135587093269513", "ts": 1774135587, "event": "training_heartbeat", "round": 11, "session_id": "019d1279-dd8d-73d2-97df-ff57e75146ab", "tier": "proxy", "run_name": "round0011_proxy_1774135016", "family_name": "multi_branch_gated", "family_stage": "prototype", "status": null, "decision": null, "payload": {"tier": "proxy", "run_name": "round0011_proxy_1774135016", "family_name": "multi_branch_gated", "family_stage": "prototype", "checkpoint_dir": "/root/sparsify-ascend/checkpoints/research_agent/round_0011_proxy/round0011_proxy_1774135016_dp2_bs1_ga8_ef16_k128_20260322_071703", "metrics_path": "/root/sparsify-ascend/checkpoints/research_agent/round_0011_proxy/round0011_proxy_1774135016_dp2_bs1_ga8_ef16_k128_20260322_071703/metrics.jsonl", "latest_step": 1220, "latest_tokens_per_sec": 70094.30277092509, "baseline_ratio": null, "latest_total_tokens": 39976960.0, "proxy_mode": "fast", "evaluation_basis": "terminal_only"}}
{"event_id": "evt_1774135617100945653", "ts": 1774135617, "event": "training_heartbeat", "round": 11, "session_id": "019d1279-dd8d-73d2-97df-ff57e75146ab", "tier": "proxy", "run_name": "round0011_proxy_1774135016", "family_name": "multi_branch_gated", "family_stage": "prototype", "status": null, "decision": null, "payload": {"tier": "proxy", "run_name": "round0011_proxy_1774135016", "family_name": "multi_branch_gated", "family_stage": "prototype", "checkpoint_dir": "/root/sparsify-ascend/checkpoints/research_agent/round_0011_proxy/round0011_proxy_1774135016_dp2_bs1_ga8_ef16_k128_20260322_071703", "metrics_path": "/root/sparsify-ascend/checkpoints/research_agent/round_0011_proxy/round0011_proxy_1774135016_dp2_bs1_ga8_ef16_k128_20260322_071703/metrics.jsonl", "latest_step": 1220, "latest_tokens_per_sec": 66570.99320327744, "baseline_ratio": null, "latest_total_tokens": 39976960.0, "proxy_mode": "fast", "evaluation_basis": "terminal_only"}}
{"event_id": "evt_1774135617176855834", "ts": 1774135617, "event": "training_finished", "round": 11, "session_id": "019d1279-dd8d-73d2-97df-ff57e75146ab", "tier": "proxy", "run_name": "round0011_proxy_1774135016", "family_name": "multi_branch_gated", "family_stage": "prototype", "status": "ok", "decision": "incubate", "payload": {"tier": "proxy", "run_name": "round0011_proxy_1774135016", "family_name": "multi_branch_gated", "family_stage": "prototype", "checkpoint_dir": "/root/sparsify-ascend/checkpoints/research_agent/round_0011_proxy/round0011_proxy_1774135016_dp2_bs1_ga8_ef16_k128_20260322_071703", "metrics_path": "/root/sparsify-ascend/checkpoints/research_agent/round_0011_proxy/round0011_proxy_1774135016_dp2_bs1_ga8_ef16_k128_20260322_071703/metrics.jsonl", "run_health": "normal", "termination_reason": "completed", "tokens_per_sec": 66570.99320327744, "baseline_ratio": null, "status": "ok", "decision": "incubate", "proxy_mode": "fast", "evaluation_basis": "terminal_only", "curve_start_fvu": 0.21543386578559875, "curve_mid_fvu": 0.18599863350391388, "curve_end_fvu": 0.1534861922264099, "curve_late_slope": -2.1941037839049567e-09, "curve_still_improving": true}}
{"event_id": "evt_1774135617176914043", "ts": 1774135617, "event": "result_recorded", "round": 11, "session_id": "019d1279-dd8d-73d2-97df-ff57e75146ab", "tier": "proxy", "run_name": "round0011_proxy_1774135016", "family_name": "multi_branch_gated", "family_stage": "prototype", "status": "ok", "decision": "incubate", "payload": {"tier": "proxy", "run_name": "round0011_proxy_1774135016", "family_name": "multi_branch_gated", "family_stage": "prototype", "status": "ok", "decision": "incubate", "val_fvu": "0.15793968923389912", "observed_fvu": "0.153486", "k": "128", "log_path": "/root/sparsify-ascend/research/history/logs/proxy_1774135617.log", "checkpoint": null}}
{"event_id": "evt_1774135617177387222", "ts": 1774135617, "event": "round_finished", "round": 11, "session_id": "019d1279-dd8d-73d2-97df-ff57e75146ab", "tier": "proxy", "run_name": null, "family_name": "multi_branch_gated", "family_stage": "prototype", "status": "ok", "decision": "incubate", "payload": {"tier": "proxy", "family_name": "multi_branch_gated", "family_stage": "prototype", "status": "ok", "decision": "incubate", "val_fvu": "0.15793968923389912"}}
{"event_id": "evt_1774135617183328101", "ts": 1774135617, "event": "experiment_commit_prepared", "round": 11, "tier": "proxy", "run_name": null, "family_name": "multi_branch_gated", "family_stage": "prototype", "status": "ok", "decision": "incubate", "payload": {"branch": "autoresearch-sae"}}
{"event_id": "evt_1774135624522127642", "ts": 1774135624, "event": "round_started", "round": 12, "session_id": "019d1279-dd8d-73d2-97df-ff57e75146ab", "tier": null, "run_name": null, "family_name": null, "family_stage": null, "status": "started", "decision": null, "payload": {"status": "started"}}
{"event_id": "evt_1774135624522284470", "ts": 1774135624, "event": "agent_deciding", "round": 12, "session_id": "019d1279-dd8d-73d2-97df-ff57e75146ab", "tier": null, "run_name": null, "family_name": null, "family_stage": null, "status": null, "decision": null, "payload": {}}
{"event_id": "evt_1774135752316481142", "ts": 1774135752, "event": "session_resumed", "round": 12, "tier": null, "run_name": null, "family_name": null, "family_stage": null, "status": "active", "decision": null, "payload": {"session_id": "019d1279-dd8d-73d2-97df-ff57e75146ab"}}
{"event_id": "evt_1774135752321610550", "ts": 1774135752, "event": "agent_action_received", "round": 12, "session_id": "019d1279-dd8d-73d2-97df-ff57e75146ab", "tier": "proxy", "run_name": null, "family_name": "multi_branch_gated", "family_stage": "stabilize", "status": null, "decision": null, "payload": {"session_id": "019d1279-dd8d-73d2-97df-ff57e75146ab", "tier": "proxy", "family_name": "multi_branch_gated", "family_stage": "stabilize", "change_type": "param_only", "expected_win": "quality_improve", "hypothesis": "`multi_branch_gated` produced the strongest new non-winning proxy signal since `two_stage_residual`, so the next informative move is a family-specific stabilization pass rather than pivoting away immediately. Increasing `EXPANSION_FACTOR` from 16 to 32 at K=128 tests whether the multi-branch gated encoder is capacity-limited under the current strong signum recipe and can close more of the remaining quality gap without changing architecture or optimization."}}
{"event_id": "evt_1774135752321722465", "ts": 1774135752, "event": "variable_isolation_warning", "round": 12, "session_id": "019d1279-dd8d-73d2-97df-ff57e75146ab", "tier": null, "run_name": null, "family_name": "multi_branch_gated", "family_stage": "stabilize", "status": null, "decision": null, "payload": {"violation": "Multiple primary variables changed simultaneously: architecture, lr"}}
{"event_id": "evt_1774135752321775492", "ts": 1774135752, "event": "proxy_mode_selected", "round": 12, "session_id": "019d1279-dd8d-73d2-97df-ff57e75146ab", "tier": "proxy", "run_name": null, "family_name": "multi_branch_gated", "family_stage": "stabilize", "status": null, "decision": null, "payload": {"tier": "proxy", "proxy_mode": "fast", "evaluation_basis": "terminal_only", "parameter_behavior": "structural", "proxy_max_tokens": "5000000"}}
{"event_id": "evt_1774135752322067713", "ts": 1774135752, "event": "training_started", "round": 12, "session_id": "019d1279-dd8d-73d2-97df-ff57e75146ab", "tier": "proxy", "run_name": "round0012_proxy_1774135752", "family_name": "multi_branch_gated", "family_stage": "stabilize", "status": null, "decision": null, "payload": {"tier": "proxy", "run_name": "round0012_proxy_1774135752", "family_name": "multi_branch_gated", "family_stage": "stabilize", "checkpoint_dir": "/root/sparsify-ascend/checkpoints/research_agent/round_0012_proxy", "log_path": "/root/sparsify-ascend/research/history/logs/round0012_proxy_1774135752.log", "config": {"architecture": "multi_branch_gated", "expansion_factor": 32, "k": 128, "optimizer": "signum", "lr": "1.6e-3", "hookpoints": "layers.[3].self_attn.o_proj", "batch_size": 1, "grad_acc_steps": 8, "micro_acc_steps": 1, "auxk_alpha": 0.0, "dead_feature_threshold": 10000000, "use_hadamard": false, "tier": "proxy", "family_name": "multi_branch_gated", "family_stage": "stabilize"}, "baseline_tokens_per_sec": 66570.99320327744, "proxy_mode": "fast", "evaluation_basis": "terminal_only"}}
{"event_id": "evt_1774135782323189007", "ts": 1774135782, "event": "training_heartbeat", "round": 12, "session_id": "019d1279-dd8d-73d2-97df-ff57e75146ab", "tier": "proxy", "run_name": "round0012_proxy_1774135752", "family_name": "multi_branch_gated", "family_stage": "stabilize", "status": null, "decision": null, "payload": {"tier": "proxy", "run_name": "round0012_proxy_1774135752", "family_name": "multi_branch_gated", "family_stage": "stabilize", "checkpoint_dir": "/root/sparsify-ascend/checkpoints/research_agent/round_0012_proxy/round0012_proxy_1774135752_dp2_bs1_ga8_ef32_k128_20260322_072918", "metrics_path": "/root/sparsify-ascend/checkpoints/research_agent/round_0012_proxy/round0012_proxy_1774135752_dp2_bs1_ga8_ef32_k128_20260322_072918/metrics.jsonl", "latest_step": 10, "latest_tokens_per_sec": 10922.377177811559, "baseline_ratio": 0.16407111644646194, "latest_total_tokens": 327680.0, "proxy_mode": "fast", "evaluation_basis": "terminal_only"}}
{"event_id": "evt_1774135812323999603", "ts": 1774135812, "event": "training_heartbeat", "round": 12, "session_id": "019d1279-dd8d-73d2-97df-ff57e75146ab", "tier": "proxy", "run_name": "round0012_proxy_1774135752", "family_name": "multi_branch_gated", "family_stage": "stabilize", "status": null, "decision": null, "payload": {"tier": "proxy", "run_name": "round0012_proxy_1774135752", "family_name": "multi_branch_gated", "family_stage": "stabilize", "checkpoint_dir": "/root/sparsify-ascend/checkpoints/research_agent/round_0012_proxy/round0012_proxy_1774135752_dp2_bs1_ga8_ef32_k128_20260322_072918", "metrics_path": "/root/sparsify-ascend/checkpoints/research_agent/round_0012_proxy/round0012_proxy_1774135752_dp2_bs1_ga8_ef32_k128_20260322_072918/metrics.jsonl", "latest_step": 50, "latest_tokens_per_sec": 27305.93600045432, "baseline_ratio": 0.41017768680533956, "latest_total_tokens": 1638400.0, "proxy_mode": "fast", "evaluation_basis": "terminal_only"}}
{"event_id": "evt_1774135842325018202", "ts": 1774135842, "event": "training_heartbeat", "round": 12, "session_id": "019d1279-dd8d-73d2-97df-ff57e75146ab", "tier": "proxy", "run_name": "round0012_proxy_1774135752", "family_name": "multi_branch_gated", "family_stage": "stabilize", "status": null, "decision": null, "payload": {"tier": "proxy", "run_name": "round0012_proxy_1774135752", "family_name": "multi_branch_gated", "family_stage": "stabilize", "checkpoint_dir": "/root/sparsify-ascend/checkpoints/research_agent/round_0012_proxy/round0012_proxy_1774135752_dp2_bs1_ga8_ef32_k128_20260322_072918", "metrics_path": "/root/sparsify-ascend/checkpoints/research_agent/round_0012_proxy/round0012_proxy_1774135752_dp2_bs1_ga8_ef32_k128_20260322_072918/metrics.jsonl", "latest_step": 80, "latest_tokens_per_sec": 29126.268079956262, "baseline_ratio": 0.4375219097455543, "latest_total_tokens": 2621440.0, "proxy_mode": "fast", "evaluation_basis": "terminal_only"}}
{"event_id": "evt_1774135872326244365", "ts": 1774135872, "event": "training_heartbeat", "round": 12, "session_id": "019d1279-dd8d-73d2-97df-ff57e75146ab", "tier": "proxy", "run_name": "round0012_proxy_1774135752", "family_name": "multi_branch_gated", "family_stage": "stabilize", "status": null, "decision": null, "payload": {"tier": "proxy", "run_name": "round0012_proxy_1774135752", "family_name": "multi_branch_gated", "family_stage": "stabilize", "checkpoint_dir": "/root/sparsify-ascend/checkpoints/research_agent/round_0012_proxy/round0012_proxy_1774135752_dp2_bs1_ga8_ef32_k128_20260322_072918", "metrics_path": "/root/sparsify-ascend/checkpoints/research_agent/round_0012_proxy/round0012_proxy_1774135752_dp2_bs1_ga8_ef32_k128_20260322_072918/metrics.jsonl", "latest_step": 120, "latest_tokens_per_sec": 32766.9510752445, "baseline_ratio": 0.49221063857631175, "latest_total_tokens": 3932160.0, "proxy_mode": "fast", "evaluation_basis": "terminal_only"}}
{"event_id": "evt_1774135902327641513", "ts": 1774135902, "event": "training_heartbeat", "round": 12, "session_id": "019d1279-dd8d-73d2-97df-ff57e75146ab", "tier": "proxy", "run_name": "round0012_proxy_1774135752", "family_name": "multi_branch_gated", "family_stage": "stabilize", "status": null, "decision": null, "payload": {"tier": "proxy", "run_name": "round0012_proxy_1774135752", "family_name": "multi_branch_gated", "family_stage": "stabilize", "checkpoint_dir": "/root/sparsify-ascend/checkpoints/research_agent/round_0012_proxy/round0012_proxy_1774135752_dp2_bs1_ga8_ef32_k128_20260322_072918", "metrics_path": "/root/sparsify-ascend/checkpoints/research_agent/round_0012_proxy/round0012_proxy_1774135752_dp2_bs1_ga8_ef32_k128_20260322_072918/metrics.jsonl", "latest_step": 150, "latest_tokens_per_sec": 32766.854779609443, "baseline_ratio": 0.49220919206589603, "latest_total_tokens": 4915200.0, "proxy_mode": "fast", "evaluation_basis": "terminal_only"}}
