{"event_id": "evt_1774144785571765075", "ts": 1774144785, "event": "training_heartbeat", "round": 26, "session_id": "019d130c-782e-75a2-aa6f-506b18d29edf", "tier": "proxy", "run_name": "round0026_proxy_1774144725", "family_name": "lowrank_gated_residual", "family_stage": "stabilize", "status": null, "decision": null, "payload": {"tier": "proxy", "run_name": "round0026_proxy_1774144725", "family_name": "lowrank_gated_residual", "family_stage": "stabilize", "checkpoint_dir": "/root/sparsify-ascend/checkpoints/research_agent/round_0026_proxy/round0026_proxy_1774144725_dp2_bs1_ga8_ef32_k128_20260322_095854", "metrics_path": "/root/sparsify-ascend/checkpoints/research_agent/round_0026_proxy/round0026_proxy_1774144725_dp2_bs1_ga8_ef32_k128_20260322_095854/metrics.jsonl", "latest_step": 100, "latest_tokens_per_sec": 54611.44733075797, "baseline_ratio": 0.8205146654922177, "latest_total_tokens": 3276800.0, "proxy_mode": "extended", "evaluation_basis": "curve_extended"}}
{"event_id": "evt_1774144815573280033", "ts": 1774144815, "event": "training_heartbeat", "round": 26, "session_id": "019d130c-782e-75a2-aa6f-506b18d29edf", "tier": "proxy", "run_name": "round0026_proxy_1774144725", "family_name": "lowrank_gated_residual", "family_stage": "stabilize", "status": null, "decision": null, "payload": {"tier": "proxy", "run_name": "round0026_proxy_1774144725", "family_name": "lowrank_gated_residual", "family_stage": "stabilize", "checkpoint_dir": "/root/sparsify-ascend/checkpoints/research_agent/round_0026_proxy/round0026_proxy_1774144725_dp2_bs1_ga8_ef32_k128_20260322_095854", "metrics_path": "/root/sparsify-ascend/checkpoints/research_agent/round_0026_proxy/round0026_proxy_1774144725_dp2_bs1_ga8_ef32_k128_20260322_095854/metrics.jsonl", "latest_step": 170, "latest_tokens_per_sec": 61892.64647160169, "baseline_ratio": 0.9299117052968519, "latest_total_tokens": 5570560.0, "proxy_mode": "extended", "evaluation_basis": "curve_extended"}}
{"event_id": "evt_1774144845575261652", "ts": 1774144845, "event": "training_heartbeat", "round": 26, "session_id": "019d130c-782e-75a2-aa6f-506b18d29edf", "tier": "proxy", "run_name": "round0026_proxy_1774144725", "family_name": "lowrank_gated_residual", "family_stage": "stabilize", "status": null, "decision": null, "payload": {"tier": "proxy", "run_name": "round0026_proxy_1774144725", "family_name": "lowrank_gated_residual", "family_stage": "stabilize", "checkpoint_dir": "/root/sparsify-ascend/checkpoints/research_agent/round_0026_proxy/round0026_proxy_1774144725_dp2_bs1_ga8_ef32_k128_20260322_095854", "metrics_path": "/root/sparsify-ascend/checkpoints/research_agent/round_0026_proxy/round0026_proxy_1774144725_dp2_bs1_ga8_ef32_k128_20260322_095854/metrics.jsonl", "latest_step": 250, "latest_tokens_per_sec": 68263.5070906854, "baseline_ratio": 1.0256312810499901, "latest_total_tokens": 8192000.0, "proxy_mode": "extended", "evaluation_basis": "curve_extended"}}
{"event_id": "evt_1774144875579139547", "ts": 1774144875, "event": "training_heartbeat", "round": 26, "session_id": "019d130c-782e-75a2-aa6f-506b18d29edf", "tier": "proxy", "run_name": "round0026_proxy_1774144725", "family_name": "lowrank_gated_residual", "family_stage": "stabilize", "status": null, "decision": null, "payload": {"tier": "proxy", "run_name": "round0026_proxy_1774144725", "family_name": "lowrank_gated_residual", "family_stage": "stabilize", "checkpoint_dir": "/root/sparsify-ascend/checkpoints/research_agent/round_0026_proxy/round0026_proxy_1774144725_dp2_bs1_ga8_ef32_k128_20260322_095854", "metrics_path": "/root/sparsify-ascend/checkpoints/research_agent/round_0026_proxy/round0026_proxy_1774144725_dp2_bs1_ga8_ef32_k128_20260322_095854/metrics.jsonl", "latest_step": 320, "latest_tokens_per_sec": 69900.68927412556, "baseline_ratio": 1.0502292739114363, "latest_total_tokens": 10485760.0, "proxy_mode": "extended", "evaluation_basis": "curve_extended"}}
{"event_id": "evt_1774144905583456346", "ts": 1774144905, "event": "training_heartbeat", "round": 26, "session_id": "019d130c-782e-75a2-aa6f-506b18d29edf", "tier": "proxy", "run_name": "round0026_proxy_1774144725", "family_name": "lowrank_gated_residual", "family_stage": "stabilize", "status": null, "decision": null, "payload": {"tier": "proxy", "run_name": "round0026_proxy_1774144725", "family_name": "lowrank_gated_residual", "family_stage": "stabilize", "checkpoint_dir": "/root/sparsify-ascend/checkpoints/research_agent/round_0026_proxy/round0026_proxy_1774144725_dp2_bs1_ga8_ef32_k128_20260322_095854", "metrics_path": "/root/sparsify-ascend/checkpoints/research_agent/round_0026_proxy/round0026_proxy_1774144725_dp2_bs1_ga8_ef32_k128_20260322_095854/metrics.jsonl", "latest_step": 390, "latest_tokens_per_sec": 70991.92667044574, "baseline_ratio": 1.066624669583544, "latest_total_tokens": 12779520.0, "proxy_mode": "extended", "evaluation_basis": "curve_extended"}}
{"event_id": "evt_1774144935588657651", "ts": 1774144935, "event": "training_heartbeat", "round": 26, "session_id": "019d130c-782e-75a2-aa6f-506b18d29edf", "tier": "proxy", "run_name": "round0026_proxy_1774144725", "family_name": "lowrank_gated_residual", "family_stage": "stabilize", "status": null, "decision": null, "payload": {"tier": "proxy", "run_name": "round0026_proxy_1774144725", "family_name": "lowrank_gated_residual", "family_stage": "stabilize", "checkpoint_dir": "/root/sparsify-ascend/checkpoints/research_agent/round_0026_proxy/round0026_proxy_1774144725_dp2_bs1_ga8_ef32_k128_20260322_095854", "metrics_path": "/root/sparsify-ascend/checkpoints/research_agent/round_0026_proxy/round0026_proxy_1774144725_dp2_bs1_ga8_ef32_k128_20260322_095854/metrics.jsonl", "latest_step": 460, "latest_tokens_per_sec": 71771.16237648699, "baseline_ratio": 1.0783323674368825, "latest_total_tokens": 15073280.0, "proxy_mode": "extended", "evaluation_basis": "curve_extended"}}
{"event_id": "evt_1774144965592342906", "ts": 1774144965, "event": "training_heartbeat", "round": 26, "session_id": "019d130c-782e-75a2-aa6f-506b18d29edf", "tier": "proxy", "run_name": "round0026_proxy_1774144725", "family_name": "lowrank_gated_residual", "family_stage": "stabilize", "status": null, "decision": null, "payload": {"tier": "proxy", "run_name": "round0026_proxy_1774144725", "family_name": "lowrank_gated_residual", "family_stage": "stabilize", "checkpoint_dir": "/root/sparsify-ascend/checkpoints/research_agent/round_0026_proxy/round0026_proxy_1774144725_dp2_bs1_ga8_ef32_k128_20260322_095854", "metrics_path": "/root/sparsify-ascend/checkpoints/research_agent/round_0026_proxy/round0026_proxy_1774144725_dp2_bs1_ga8_ef32_k128_20260322_095854/metrics.jsonl", "latest_step": 540, "latest_tokens_per_sec": 73721.04821413688, "baseline_ratio": 1.1076286048381248, "latest_total_tokens": 17694720.0, "proxy_mode": "extended", "evaluation_basis": "curve_extended"}}
{"event_id": "evt_1774144995596396139", "ts": 1774144995, "event": "training_heartbeat", "round": 26, "session_id": "019d130c-782e-75a2-aa6f-506b18d29edf", "tier": "proxy", "run_name": "round0026_proxy_1774144725", "family_name": "lowrank_gated_residual", "family_stage": "stabilize", "status": null, "decision": null, "payload": {"tier": "proxy", "run_name": "round0026_proxy_1774144725", "family_name": "lowrank_gated_residual", "family_stage": "stabilize", "checkpoint_dir": "/root/sparsify-ascend/checkpoints/research_agent/round_0026_proxy/round0026_proxy_1774144725_dp2_bs1_ga8_ef32_k128_20260322_095854", "metrics_path": "/root/sparsify-ascend/checkpoints/research_agent/round_0026_proxy/round0026_proxy_1774144725_dp2_bs1_ga8_ef32_k128_20260322_095854/metrics.jsonl", "latest_step": 610, "latest_tokens_per_sec": 74024.09240560442, "baseline_ratio": 1.112181719899979, "latest_total_tokens": 19988480.0, "proxy_mode": "extended", "evaluation_basis": "curve_extended"}}
{"event_id": "evt_1774145025745532616", "ts": 1774145025, "event": "training_heartbeat", "round": 26, "session_id": "019d130c-782e-75a2-aa6f-506b18d29edf", "tier": "proxy", "run_name": "round0026_proxy_1774144725", "family_name": "lowrank_gated_residual", "family_stage": "stabilize", "status": null, "decision": null, "payload": {"tier": "proxy", "run_name": "round0026_proxy_1774144725", "family_name": "lowrank_gated_residual", "family_stage": "stabilize", "checkpoint_dir": "/root/sparsify-ascend/checkpoints/research_agent/round_0026_proxy/round0026_proxy_1774144725_dp2_bs1_ga8_ef32_k128_20260322_095854", "metrics_path": "/root/sparsify-ascend/checkpoints/research_agent/round_0026_proxy/round0026_proxy_1774144725_dp2_bs1_ga8_ef32_k128_20260322_095854/metrics.jsonl", "latest_step": 610, "latest_tokens_per_sec": 66621.44733170395, "baseline_ratio": 1.0009600046104798, "latest_total_tokens": 19988480.0, "proxy_mode": "extended", "evaluation_basis": "curve_extended"}}
{"event_id": "evt_1774145055749577962", "ts": 1774145055, "event": "training_heartbeat", "round": 26, "session_id": "019d130c-782e-75a2-aa6f-506b18d29edf", "tier": "proxy", "run_name": "round0026_proxy_1774144725", "family_name": "lowrank_gated_residual", "family_stage": "stabilize", "status": null, "decision": null, "payload": {"tier": "proxy", "run_name": "round0026_proxy_1774144725", "family_name": "lowrank_gated_residual", "family_stage": "stabilize", "checkpoint_dir": "/root/sparsify-ascend/checkpoints/research_agent/round_0026_proxy/round0026_proxy_1774144725_dp2_bs1_ga8_ef32_k128_20260322_095854", "metrics_path": "/root/sparsify-ascend/checkpoints/research_agent/round_0026_proxy/round0026_proxy_1774144725_dp2_bs1_ga8_ef32_k128_20260322_095854/metrics.jsonl", "latest_step": 610, "latest_tokens_per_sec": 60538.155970913, "baseline_ratio": 0.909561039375954, "latest_total_tokens": 19988480.0, "proxy_mode": "extended", "evaluation_basis": "curve_extended"}}
{"event_id": "evt_1774145085753621450", "ts": 1774145085, "event": "training_heartbeat", "round": 26, "session_id": "019d130c-782e-75a2-aa6f-506b18d29edf", "tier": "proxy", "run_name": "round0026_proxy_1774144725", "family_name": "lowrank_gated_residual", "family_stage": "stabilize", "status": null, "decision": null, "payload": {"tier": "proxy", "run_name": "round0026_proxy_1774144725", "family_name": "lowrank_gated_residual", "family_stage": "stabilize", "checkpoint_dir": "/root/sparsify-ascend/checkpoints/research_agent/round_0026_proxy/round0026_proxy_1774144725_dp2_bs1_ga8_ef32_k128_20260322_095854", "metrics_path": "/root/sparsify-ascend/checkpoints/research_agent/round_0026_proxy/round0026_proxy_1774144725_dp2_bs1_ga8_ef32_k128_20260322_095854/metrics.jsonl", "latest_step": 610, "latest_tokens_per_sec": 55495.20651553837, "baseline_ratio": 0.833792785873901, "latest_total_tokens": 19988480.0, "proxy_mode": "extended", "evaluation_basis": "curve_extended"}}
{"event_id": "evt_1774145115758178707", "ts": 1774145115, "event": "training_heartbeat", "round": 26, "session_id": "019d130c-782e-75a2-aa6f-506b18d29edf", "tier": "proxy", "run_name": "round0026_proxy_1774144725", "family_name": "lowrank_gated_residual", "family_stage": "stabilize", "status": null, "decision": null, "payload": {"tier": "proxy", "run_name": "round0026_proxy_1774144725", "family_name": "lowrank_gated_residual", "family_stage": "stabilize", "checkpoint_dir": "/root/sparsify-ascend/checkpoints/research_agent/round_0026_proxy/round0026_proxy_1774144725_dp2_bs1_ga8_ef32_k128_20260322_095854", "metrics_path": "/root/sparsify-ascend/checkpoints/research_agent/round_0026_proxy/round0026_proxy_1774144725_dp2_bs1_ga8_ef32_k128_20260322_095854/metrics.jsonl", "latest_step": 610, "latest_tokens_per_sec": 51227.82762383238, "baseline_ratio": 0.7696771629597172, "latest_total_tokens": 19988480.0, "proxy_mode": "extended", "evaluation_basis": "curve_extended"}}
{"event_id": "evt_1774145145762261494", "ts": 1774145145, "event": "training_heartbeat", "round": 26, "session_id": "019d130c-782e-75a2-aa6f-506b18d29edf", "tier": "proxy", "run_name": "round0026_proxy_1774144725", "family_name": "lowrank_gated_residual", "family_stage": "stabilize", "status": null, "decision": null, "payload": {"tier": "proxy", "run_name": "round0026_proxy_1774144725", "family_name": "lowrank_gated_residual", "family_stage": "stabilize", "checkpoint_dir": "/root/sparsify-ascend/checkpoints/research_agent/round_0026_proxy/round0026_proxy_1774144725_dp2_bs1_ga8_ef32_k128_20260322_095854", "metrics_path": "/root/sparsify-ascend/checkpoints/research_agent/round_0026_proxy/round0026_proxy_1774144725_dp2_bs1_ga8_ef32_k128_20260322_095854/metrics.jsonl", "latest_step": 610, "latest_tokens_per_sec": 47569.81131681244, "baseline_ratio": 0.7147169637117278, "latest_total_tokens": 19988480.0, "proxy_mode": "extended", "evaluation_basis": "curve_extended"}}
{"event_id": "evt_1774145145830470023", "ts": 1774145145, "event": "training_finished", "round": 26, "session_id": "019d130c-782e-75a2-aa6f-506b18d29edf", "tier": "proxy", "run_name": "round0026_proxy_1774144725", "family_name": "lowrank_gated_residual", "family_stage": "stabilize", "status": "ok", "decision": "discard", "payload": {"tier": "proxy", "run_name": "round0026_proxy_1774144725", "family_name": "lowrank_gated_residual", "family_stage": "stabilize", "checkpoint_dir": "/root/sparsify-ascend/checkpoints/research_agent/round_0026_proxy/round0026_proxy_1774144725_dp2_bs1_ga8_ef32_k128_20260322_095854", "metrics_path": "/root/sparsify-ascend/checkpoints/research_agent/round_0026_proxy/round0026_proxy_1774144725_dp2_bs1_ga8_ef32_k128_20260322_095854/metrics.jsonl", "run_health": "normal", "termination_reason": "completed", "tokens_per_sec": 47569.81131681244, "baseline_ratio": 0.7147169637117278, "status": "ok", "decision": "discard", "proxy_mode": "extended", "evaluation_basis": "curve_extended", "curve_start_fvu": 0.14049625396728516, "curve_mid_fvu": 0.09981915354728699, "curve_end_fvu": 0.08688434958457947, "curve_late_slope": -9.405815288745111e-11, "curve_still_improving": true}}
{"event_id": "evt_1774145145830525284", "ts": 1774145145, "event": "result_recorded", "round": 26, "session_id": "019d130c-782e-75a2-aa6f-506b18d29edf", "tier": "proxy", "run_name": "round0026_proxy_1774144725", "family_name": "lowrank_gated_residual", "family_stage": "stabilize", "status": "ok", "decision": "discard", "payload": {"tier": "proxy", "run_name": "round0026_proxy_1774144725", "family_name": "lowrank_gated_residual", "family_stage": "stabilize", "status": "ok", "decision": "discard", "val_fvu": "0.08242063876241446", "observed_fvu": "0.086884", "k": "128", "log_path": "/root/sparsify-ascend/research/history/logs/proxy_1774145145.log", "checkpoint": null}}
{"event_id": "evt_1774145145830861941", "ts": 1774145145, "event": "round_finished", "round": 26, "session_id": "019d130c-782e-75a2-aa6f-506b18d29edf", "tier": "proxy", "run_name": null, "family_name": "lowrank_gated_residual", "family_stage": "stabilize", "status": "ok", "decision": "discard", "payload": {"tier": "proxy", "family_name": "lowrank_gated_residual", "family_stage": "stabilize", "status": "ok", "decision": "discard", "val_fvu": "0.08242063876241446"}}
{"event_id": "evt_1774145145837182530", "ts": 1774145145, "event": "experiment_commit_prepared", "round": 26, "tier": "proxy", "run_name": null, "family_name": "lowrank_gated_residual", "family_stage": "stabilize", "status": "ok", "decision": "discard", "payload": {"branch": "autoresearch-sae"}}
{"event_id": "evt_1774145153316596595", "ts": 1774145153, "event": "round_started", "round": 27, "session_id": "019d130c-782e-75a2-aa6f-506b18d29edf", "tier": null, "run_name": null, "family_name": null, "family_stage": null, "status": "started", "decision": null, "payload": {"status": "started"}}
{"event_id": "evt_1774145153317795787", "ts": 1774145153, "event": "agent_deciding", "round": 27, "session_id": "019d130c-782e-75a2-aa6f-506b18d29edf", "tier": null, "run_name": null, "family_name": null, "family_stage": null, "status": null, "decision": null, "payload": {}}
{"event_id": "evt_1774145278332448764", "ts": 1774145278, "event": "session_resumed", "round": 27, "tier": null, "run_name": null, "family_name": null, "family_stage": null, "status": "active", "decision": null, "payload": {"session_id": "019d130c-782e-75a2-aa6f-506b18d29edf"}}
{"event_id": "evt_1774145278338480155", "ts": 1774145278, "event": "agent_action_received", "round": 27, "session_id": "019d130c-782e-75a2-aa6f-506b18d29edf", "tier": "proxy", "run_name": null, "family_name": "lowrank_gated_residual", "family_stage": "stabilize", "status": null, "decision": null, "payload": {"session_id": "019d130c-782e-75a2-aa6f-506b18d29edf", "tier": "proxy", "family_name": "lowrank_gated_residual", "family_stage": "stabilize", "change_type": "param_only", "expected_win": "lower_fvu", "hypothesis": "`lowrank_gated_residual` remains the best full-signal family, but the recent `AUXK_ALPHA=0.01` and `LR=1.2e-3` probes both regressed at the K=128 anchor, so the optimization-side local moves look weak. The next clean single-variable stabilization move is to increase `EXPANSION_FACTOR` from 32 to 48 at K=128 while keeping the winning signum/LR/aux recipe fixed, testing whether the gated residual selector is now capacity-limited rather than optimization-limited."}}
{"event_id": "evt_1774145278338624644", "ts": 1774145278, "event": "proxy_mode_selected", "round": 27, "session_id": "019d130c-782e-75a2-aa6f-506b18d29edf", "tier": "proxy", "run_name": null, "family_name": "lowrank_gated_residual", "family_stage": "stabilize", "status": null, "decision": null, "payload": {"tier": "proxy", "proxy_mode": "fast", "evaluation_basis": "terminal_only", "parameter_behavior": "structural", "proxy_max_tokens": "5000000"}}
{"event_id": "evt_1774145278338935147", "ts": 1774145278, "event": "training_started", "round": 27, "session_id": "019d130c-782e-75a2-aa6f-506b18d29edf", "tier": "proxy", "run_name": "round0027_proxy_1774145278", "family_name": "lowrank_gated_residual", "family_stage": "stabilize", "status": null, "decision": null, "payload": {"tier": "proxy", "run_name": "round0027_proxy_1774145278", "family_name": "lowrank_gated_residual", "family_stage": "stabilize", "checkpoint_dir": "/root/sparsify-ascend/checkpoints/research_agent/round_0027_proxy", "log_path": "/root/sparsify-ascend/research/history/logs/round0027_proxy_1774145278.log", "config": {"architecture": "lowrank_gated_residual", "expansion_factor": 48, "k": 128, "optimizer": "signum", "lr": "1.6e-3", "hookpoints": "layers.[3].self_attn.o_proj", "batch_size": 1, "grad_acc_steps": 8, "micro_acc_steps": 1, "auxk_alpha": 0.0, "dead_feature_threshold": 10000000, "use_hadamard": false, "tier": "proxy", "family_name": "lowrank_gated_residual", "family_stage": "stabilize"}, "baseline_tokens_per_sec": 66557.55177513757, "proxy_mode": "fast", "evaluation_basis": "terminal_only"}}
{"event_id": "evt_1774145308340203332", "ts": 1774145308, "event": "training_heartbeat", "round": 27, "session_id": "019d130c-782e-75a2-aa6f-506b18d29edf", "tier": "proxy", "run_name": "round0027_proxy_1774145278", "family_name": "lowrank_gated_residual", "family_stage": "stabilize", "status": null, "decision": null, "payload": {"tier": "proxy", "run_name": "round0027_proxy_1774145278", "family_name": "lowrank_gated_residual", "family_stage": "stabilize", "checkpoint_dir": "/root/sparsify-ascend/checkpoints/research_agent/round_0027_proxy/round0027_proxy_1774145278_dp2_bs1_ga8_ef48_k128_20260322_100806", "metrics_path": "/root/sparsify-ascend/checkpoints/research_agent/round_0027_proxy/round0027_proxy_1774145278_dp2_bs1_ga8_ef48_k128_20260322_100806/metrics.jsonl", "latest_step": 20, "latest_tokens_per_sec": 21844.676235043607, "baseline_ratio": 0.32820732813077474, "latest_total_tokens": 655360.0, "proxy_mode": "fast", "evaluation_basis": "terminal_only"}}
{"event_id": "evt_1774145338341243075", "ts": 1774145338, "event": "training_heartbeat", "round": 27, "session_id": "019d130c-782e-75a2-aa6f-506b18d29edf", "tier": "proxy", "run_name": "round0027_proxy_1774145278", "family_name": "lowrank_gated_residual", "family_stage": "stabilize", "status": null, "decision": null, "payload": {"tier": "proxy", "run_name": "round0027_proxy_1774145278", "family_name": "lowrank_gated_residual", "family_stage": "stabilize", "checkpoint_dir": "/root/sparsify-ascend/checkpoints/research_agent/round_0027_proxy/round0027_proxy_1774145278_dp2_bs1_ga8_ef48_k128_20260322_100806", "metrics_path": "/root/sparsify-ascend/checkpoints/research_agent/round_0027_proxy/round0027_proxy_1774145278_dp2_bs1_ga8_ef48_k128_20260322_100806/metrics.jsonl", "latest_step": 80, "latest_tokens_per_sec": 43689.26410752644, "baseline_ratio": 0.6564133286502054, "latest_total_tokens": 2621440.0, "proxy_mode": "fast", "evaluation_basis": "terminal_only"}}
{"event_id": "evt_1774145368342616031", "ts": 1774145368, "event": "training_heartbeat", "round": 27, "session_id": "019d130c-782e-75a2-aa6f-506b18d29edf", "tier": "proxy", "run_name": "round0027_proxy_1774145278", "family_name": "lowrank_gated_residual", "family_stage": "stabilize", "status": null, "decision": null, "payload": {"tier": "proxy", "run_name": "round0027_proxy_1774145278", "family_name": "lowrank_gated_residual", "family_stage": "stabilize", "checkpoint_dir": "/root/sparsify-ascend/checkpoints/research_agent/round_0027_proxy/round0027_proxy_1774145278_dp2_bs1_ga8_ef48_k128_20260322_100806", "metrics_path": "/root/sparsify-ascend/checkpoints/research_agent/round_0027_proxy/round0027_proxy_1774145278_dp2_bs1_ga8_ef48_k128_20260322_100806/metrics.jsonl", "latest_step": 140, "latest_tokens_per_sec": 50970.56744952171, "baseline_ratio": 0.7658119340345336, "latest_total_tokens": 4587520.0, "proxy_mode": "fast", "evaluation_basis": "terminal_only"}}
