{"event_id": "evt_1774142520682287664", "ts": 1774142520, "event": "training_heartbeat", "round": 22, "session_id": "019d130c-782e-75a2-aa6f-506b18d29edf", "tier": "full", "run_name": "round0022_full_1774141919", "family_name": "lowrank_gated_residual", "family_stage": "prototype", "status": null, "decision": null, "payload": {"tier": "full", "run_name": "round0022_full_1774141919", "family_name": "lowrank_gated_residual", "family_stage": "prototype", "checkpoint_dir": "/root/sparsify-ascend/checkpoints/research_agent/round_0022_full/round0022_full_1774141919_dp2_bs1_ga8_ef32_k128_20260322_091206", "metrics_path": "/root/sparsify-ascend/checkpoints/research_agent/round_0022_full/round0022_full_1774141919_dp2_bs1_ga8_ef32_k128_20260322_091206/metrics.jsonl", "latest_step": 1220, "latest_tokens_per_sec": 66551.73636829642, "baseline_ratio": null, "latest_total_tokens": 39976960.0, "proxy_mode": null, "evaluation_basis": null}}
{"event_id": "evt_1774142550689816015", "ts": 1774142550, "event": "training_heartbeat", "round": 22, "session_id": "019d130c-782e-75a2-aa6f-506b18d29edf", "tier": "full", "run_name": "round0022_full_1774141919", "family_name": "lowrank_gated_residual", "family_stage": "prototype", "status": null, "decision": null, "payload": {"tier": "full", "run_name": "round0022_full_1774141919", "family_name": "lowrank_gated_residual", "family_stage": "prototype", "checkpoint_dir": "/root/sparsify-ascend/checkpoints/research_agent/round_0022_full/round0022_full_1774141919_dp2_bs1_ga8_ef32_k128_20260322_091206", "metrics_path": "/root/sparsify-ascend/checkpoints/research_agent/round_0022_full/round0022_full_1774141919_dp2_bs1_ga8_ef32_k128_20260322_091206/metrics.jsonl", "latest_step": 1220, "latest_tokens_per_sec": 63385.33125558775, "baseline_ratio": null, "latest_total_tokens": 39976960.0, "proxy_mode": null, "evaluation_basis": null}}
{"event_id": "evt_1774142580697281593", "ts": 1774142580, "event": "training_heartbeat", "round": 22, "session_id": "019d130c-782e-75a2-aa6f-506b18d29edf", "tier": "full", "run_name": "round0022_full_1774141919", "family_name": "lowrank_gated_residual", "family_stage": "prototype", "status": null, "decision": null, "payload": {"tier": "full", "run_name": "round0022_full_1774141919", "family_name": "lowrank_gated_residual", "family_stage": "prototype", "checkpoint_dir": "/root/sparsify-ascend/checkpoints/research_agent/round_0022_full/round0022_full_1774141919_dp2_bs1_ga8_ef32_k128_20260322_091206", "metrics_path": "/root/sparsify-ascend/checkpoints/research_agent/round_0022_full/round0022_full_1774141919_dp2_bs1_ga8_ef32_k128_20260322_091206/metrics.jsonl", "latest_step": 1220, "latest_tokens_per_sec": 60506.52392488656, "baseline_ratio": null, "latest_total_tokens": 39976960.0, "proxy_mode": null, "evaluation_basis": null}}
{"event_id": "evt_1774142610704669087", "ts": 1774142610, "event": "training_heartbeat", "round": 22, "session_id": "019d130c-782e-75a2-aa6f-506b18d29edf", "tier": "full", "run_name": "round0022_full_1774141919", "family_name": "lowrank_gated_residual", "family_stage": "prototype", "status": null, "decision": null, "payload": {"tier": "full", "run_name": "round0022_full_1774141919", "family_name": "lowrank_gated_residual", "family_stage": "prototype", "checkpoint_dir": "/root/sparsify-ascend/checkpoints/research_agent/round_0022_full/round0022_full_1774141919_dp2_bs1_ga8_ef32_k128_20260322_091206", "metrics_path": "/root/sparsify-ascend/checkpoints/research_agent/round_0022_full/round0022_full_1774141919_dp2_bs1_ga8_ef32_k128_20260322_091206/metrics.jsonl", "latest_step": 1220, "latest_tokens_per_sec": 57877.872285328245, "baseline_ratio": null, "latest_total_tokens": 39976960.0, "proxy_mode": null, "evaluation_basis": null}}
{"event_id": "evt_1774142640712049647", "ts": 1774142640, "event": "training_heartbeat", "round": 22, "session_id": "019d130c-782e-75a2-aa6f-506b18d29edf", "tier": "full", "run_name": "round0022_full_1774141919", "family_name": "lowrank_gated_residual", "family_stage": "prototype", "status": null, "decision": null, "payload": {"tier": "full", "run_name": "round0022_full_1774141919", "family_name": "lowrank_gated_residual", "family_stage": "prototype", "checkpoint_dir": "/root/sparsify-ascend/checkpoints/research_agent/round_0022_full/round0022_full_1774141919_dp2_bs1_ga8_ef32_k128_20260322_091206", "metrics_path": "/root/sparsify-ascend/checkpoints/research_agent/round_0022_full/round0022_full_1774141919_dp2_bs1_ga8_ef32_k128_20260322_091206/metrics.jsonl", "latest_step": 1220, "latest_tokens_per_sec": 55468.1082371676, "baseline_ratio": null, "latest_total_tokens": 39976960.0, "proxy_mode": null, "evaluation_basis": null}}
{"event_id": "evt_1774142640788042152", "ts": 1774142640, "event": "training_finished", "round": 22, "session_id": "019d130c-782e-75a2-aa6f-506b18d29edf", "tier": "full", "run_name": "round0022_full_1774141919", "family_name": "lowrank_gated_residual", "family_stage": "prototype", "status": "ok", "decision": "keep", "payload": {"tier": "full", "run_name": "round0022_full_1774141919", "family_name": "lowrank_gated_residual", "family_stage": "prototype", "checkpoint_dir": "/root/sparsify-ascend/checkpoints/research_agent/round_0022_full/round0022_full_1774141919_dp2_bs1_ga8_ef32_k128_20260322_091206", "metrics_path": "/root/sparsify-ascend/checkpoints/research_agent/round_0022_full/round0022_full_1774141919_dp2_bs1_ga8_ef32_k128_20260322_091206/metrics.jsonl", "run_health": "normal", "termination_reason": "completed", "tokens_per_sec": 55468.1082371676, "baseline_ratio": null, "status": "ok", "decision": "keep", "proxy_mode": null, "evaluation_basis": null, "curve_start_fvu": 0.09982532262802124, "curve_mid_fvu": 0.08375698328018188, "curve_end_fvu": 0.06517943739891052, "curve_late_slope": -1.1147395138114455e-09, "curve_still_improving": true}}
{"event_id": "evt_1774142640788101775", "ts": 1774142640, "event": "result_recorded", "round": 22, "session_id": "019d130c-782e-75a2-aa6f-506b18d29edf", "tier": "full", "run_name": "round0022_full_1774141919", "family_name": "lowrank_gated_residual", "family_stage": "prototype", "status": "ok", "decision": "keep", "payload": {"tier": "full", "run_name": "round0022_full_1774141919", "family_name": "lowrank_gated_residual", "family_stage": "prototype", "status": "ok", "decision": "keep", "val_fvu": "0.06634617038071156", "observed_fvu": "0.065179", "k": "128", "log_path": "/root/sparsify-ascend/research/history/logs/full_1774142640.log", "checkpoint": null}}
{"event_id": "evt_1774142640788606113", "ts": 1774142640, "event": "round_finished", "round": 22, "session_id": "019d130c-782e-75a2-aa6f-506b18d29edf", "tier": "full", "run_name": null, "family_name": "lowrank_gated_residual", "family_stage": "prototype", "status": "ok", "decision": "keep", "payload": {"tier": "full", "family_name": "lowrank_gated_residual", "family_stage": "prototype", "status": "ok", "decision": "keep", "val_fvu": "0.06634617038071156"}}
{"event_id": "evt_1774142640794884742", "ts": 1774142640, "event": "experiment_commit_prepared", "round": 22, "tier": "full", "run_name": null, "family_name": "lowrank_gated_residual", "family_stage": "prototype", "status": "ok", "decision": "keep", "payload": {"branch": "autoresearch-sae"}}
{"event_id": "evt_1774142648209414747", "ts": 1774142648, "event": "round_started", "round": 23, "session_id": "019d130c-782e-75a2-aa6f-506b18d29edf", "tier": null, "run_name": null, "family_name": null, "family_stage": null, "status": "started", "decision": null, "payload": {"status": "started"}}
{"event_id": "evt_1774142648209580090", "ts": 1774142648, "event": "agent_deciding", "round": 23, "session_id": "019d130c-782e-75a2-aa6f-506b18d29edf", "tier": null, "run_name": null, "family_name": null, "family_stage": null, "status": null, "decision": null, "payload": {}}
{"event_id": "evt_1774142773970432563", "ts": 1774142773, "event": "session_resumed", "round": 23, "tier": null, "run_name": null, "family_name": null, "family_stage": null, "status": "active", "decision": null, "payload": {"session_id": "019d130c-782e-75a2-aa6f-506b18d29edf"}}
{"event_id": "evt_1774142773971131787", "ts": 1774142773, "event": "agent_action_received", "round": 23, "session_id": "019d130c-782e-75a2-aa6f-506b18d29edf", "tier": "proxy", "run_name": null, "family_name": "lowrank_gated_residual", "family_stage": "stabilize", "status": null, "decision": null, "payload": {"session_id": "019d130c-782e-75a2-aa6f-506b18d29edf", "tier": "proxy", "family_name": "lowrank_gated_residual", "family_stage": "stabilize", "change_type": "param_only", "expected_win": "lower_fvu", "hypothesis": "`lowrank_gated_residual` has now earned real full-signal evidence by improving the K=128 frontier over `lowrank_residual`, so the next clean move is to change only K and test whether the same gated residual support mechanism also improves the middle Pareto point. A proxy run at K=64 under the same winning EF=32 signum recipe will show whether this family can expand the frontier beyond the anchor rather than being only a K=128-specific gain."}}
{"event_id": "evt_1774142773971259389", "ts": 1774142773, "event": "proxy_mode_selected", "round": 23, "session_id": "019d130c-782e-75a2-aa6f-506b18d29edf", "tier": "proxy", "run_name": null, "family_name": "lowrank_gated_residual", "family_stage": "stabilize", "status": null, "decision": null, "payload": {"tier": "proxy", "proxy_mode": "fast", "evaluation_basis": "terminal_only", "parameter_behavior": "structural", "proxy_max_tokens": "5000000"}}
{"event_id": "evt_1774142773972073231", "ts": 1774142773, "event": "training_started", "round": 23, "session_id": "019d130c-782e-75a2-aa6f-506b18d29edf", "tier": "proxy", "run_name": "round0023_proxy_1774142773", "family_name": "lowrank_gated_residual", "family_stage": "stabilize", "status": null, "decision": null, "payload": {"tier": "proxy", "run_name": "round0023_proxy_1774142773", "family_name": "lowrank_gated_residual", "family_stage": "stabilize", "checkpoint_dir": "/root/sparsify-ascend/checkpoints/research_agent/round_0023_proxy", "log_path": "/root/sparsify-ascend/research/history/logs/round0023_proxy_1774142773.log", "config": {"architecture": "lowrank_gated_residual", "expansion_factor": 32, "k": 64, "optimizer": "signum", "lr": "1.6e-3", "hookpoints": "layers.[3].self_attn.o_proj", "batch_size": 1, "grad_acc_steps": 8, "micro_acc_steps": 1, "auxk_alpha": 0.0, "dead_feature_threshold": 10000000, "use_hadamard": false, "tier": "proxy", "family_name": "lowrank_gated_residual", "family_stage": "stabilize"}, "baseline_tokens_per_sec": 66557.55177513757, "proxy_mode": "fast", "evaluation_basis": "terminal_only"}}
{"event_id": "evt_1774142803973429908", "ts": 1774142803, "event": "training_heartbeat", "round": 23, "session_id": "019d130c-782e-75a2-aa6f-506b18d29edf", "tier": "proxy", "run_name": "round0023_proxy_1774142773", "family_name": "lowrank_gated_residual", "family_stage": "stabilize", "status": null, "decision": null, "payload": {"tier": "proxy", "run_name": "round0023_proxy_1774142773", "family_name": "lowrank_gated_residual", "family_stage": "stabilize", "checkpoint_dir": "/root/sparsify-ascend/checkpoints/research_agent/round_0023_proxy/round0023_proxy_1774142773_dp2_bs1_ga8_ef32_k64_20260322_092620", "metrics_path": "/root/sparsify-ascend/checkpoints/research_agent/round_0023_proxy/round0023_proxy_1774142773_dp2_bs1_ga8_ef32_k64_20260322_092620/metrics.jsonl", "latest_step": 40, "latest_tokens_per_sec": 43689.21220119865, "baseline_ratio": 0.6564125487788549, "latest_total_tokens": 1310720.0, "proxy_mode": "fast", "evaluation_basis": "terminal_only"}}
{"event_id": "evt_1774142833975293882", "ts": 1774142833, "event": "training_heartbeat", "round": 23, "session_id": "019d130c-782e-75a2-aa6f-506b18d29edf", "tier": "proxy", "run_name": "round0023_proxy_1774142773", "family_name": "lowrank_gated_residual", "family_stage": "stabilize", "status": null, "decision": null, "payload": {"tier": "proxy", "run_name": "round0023_proxy_1774142773", "family_name": "lowrank_gated_residual", "family_stage": "stabilize", "checkpoint_dir": "/root/sparsify-ascend/checkpoints/research_agent/round_0023_proxy/round0023_proxy_1774142773_dp2_bs1_ga8_ef32_k64_20260322_092620", "metrics_path": "/root/sparsify-ascend/checkpoints/research_agent/round_0023_proxy/round0023_proxy_1774142773_dp2_bs1_ga8_ef32_k64_20260322_092620/metrics.jsonl", "latest_step": 130, "latest_tokens_per_sec": 70993.99010969485, "baseline_ratio": 1.0666556719145204, "latest_total_tokens": 4259840.0, "proxy_mode": "fast", "evaluation_basis": "terminal_only"}}
{"event_id": "evt_1774142864093766298", "ts": 1774142864, "event": "training_heartbeat", "round": 23, "session_id": "019d130c-782e-75a2-aa6f-506b18d29edf", "tier": "proxy", "run_name": "round0023_proxy_1774142773", "family_name": "lowrank_gated_residual", "family_stage": "stabilize", "status": null, "decision": null, "payload": {"tier": "proxy", "run_name": "round0023_proxy_1774142773", "family_name": "lowrank_gated_residual", "family_stage": "stabilize", "checkpoint_dir": "/root/sparsify-ascend/checkpoints/research_agent/round_0023_proxy/round0023_proxy_1774142773_dp2_bs1_ga8_ef32_k64_20260322_092620", "metrics_path": "/root/sparsify-ascend/checkpoints/research_agent/round_0023_proxy/round0023_proxy_1774142773_dp2_bs1_ga8_ef32_k64_20260322_092620/metrics.jsonl", "latest_step": 152, "latest_tokens_per_sec": 55338.8466946425, "baseline_ratio": 0.8314435435005619, "latest_total_tokens": 4980736.0, "proxy_mode": "fast", "evaluation_basis": "terminal_only"}}
{"event_id": "evt_1774142864913654954", "ts": 1774142864, "event": "training_finished", "round": 23, "session_id": "019d130c-782e-75a2-aa6f-506b18d29edf", "tier": "proxy", "run_name": "round0023_proxy_1774142773", "family_name": "lowrank_gated_residual", "family_stage": "stabilize", "status": "ok", "decision": "promote", "payload": {"tier": "proxy", "run_name": "round0023_proxy_1774142773", "family_name": "lowrank_gated_residual", "family_stage": "stabilize", "checkpoint_dir": "/root/sparsify-ascend/checkpoints/research_agent/round_0023_proxy/round0023_proxy_1774142773_dp2_bs1_ga8_ef32_k64_20260322_092620", "metrics_path": "/root/sparsify-ascend/checkpoints/research_agent/round_0023_proxy/round0023_proxy_1774142773_dp2_bs1_ga8_ef32_k64_20260322_092620/metrics.jsonl", "run_health": "normal", "termination_reason": "completed", "tokens_per_sec": 55338.8466946425, "baseline_ratio": 0.8314435435005619, "status": "ok", "decision": "promote", "proxy_mode": "fast", "evaluation_basis": "terminal_only", "curve_start_fvu": 0.2978094220161438, "curve_mid_fvu": 0.1940852701663971, "curve_end_fvu": 0.1530117690563202, "curve_late_slope": -6.33964748797758e-09, "curve_still_improving": true}}
{"event_id": "evt_1774142864913766429", "ts": 1774142864, "event": "result_recorded", "round": 23, "session_id": "019d130c-782e-75a2-aa6f-506b18d29edf", "tier": "proxy", "run_name": "round0023_proxy_1774142773", "family_name": "lowrank_gated_residual", "family_stage": "stabilize", "status": "ok", "decision": "promote", "payload": {"tier": "proxy", "run_name": "round0023_proxy_1774142773", "family_name": "lowrank_gated_residual", "family_stage": "stabilize", "status": "ok", "decision": "promote", "val_fvu": "0.1538811568170786", "observed_fvu": "0.153012", "k": "64", "log_path": "/root/sparsify-ascend/research/history/logs/proxy_1774142864.log", "checkpoint": null}}
{"event_id": "evt_1774142864914194745", "ts": 1774142864, "event": "training_started", "round": 23, "session_id": "019d130c-782e-75a2-aa6f-506b18d29edf", "tier": "full", "run_name": "round0023_full_1774142864", "family_name": "lowrank_gated_residual", "family_stage": "stabilize", "status": null, "decision": null, "payload": {"tier": "full", "run_name": "round0023_full_1774142864", "family_name": "lowrank_gated_residual", "family_stage": "stabilize", "checkpoint_dir": "/root/sparsify-ascend/checkpoints/research_agent/round_0023_full", "log_path": "/root/sparsify-ascend/research/history/logs/round0023_full_1774142864.log", "config": {"architecture": "lowrank_gated_residual", "expansion_factor": 32, "k": 64, "optimizer": "signum", "lr": "1.6e-3", "hookpoints": "layers.[3].self_attn.o_proj", "batch_size": 1, "grad_acc_steps": 8, "micro_acc_steps": 1, "auxk_alpha": 0.0, "dead_feature_threshold": 10000000, "use_hadamard": false, "tier": "full", "family_name": "lowrank_gated_residual", "family_stage": "stabilize"}, "baseline_tokens_per_sec": 55468.1082371676, "proxy_mode": null, "evaluation_basis": null}}
{"event_id": "evt_1774142894915486394", "ts": 1774142894, "event": "training_heartbeat", "round": 23, "session_id": "019d130c-782e-75a2-aa6f-506b18d29edf", "tier": "full", "run_name": "round0023_full_1774142864", "family_name": "lowrank_gated_residual", "family_stage": "stabilize", "status": null, "decision": null, "payload": {"tier": "full", "run_name": "round0023_full_1774142864", "family_name": "lowrank_gated_residual", "family_stage": "stabilize", "checkpoint_dir": "/root/sparsify-ascend/checkpoints/research_agent/round_0023_full/round0023_full_1774142864_dp2_bs1_ga8_ef32_k64_20260322_092751", "metrics_path": "/root/sparsify-ascend/checkpoints/research_agent/round_0023_full/round0023_full_1774142864_dp2_bs1_ga8_ef32_k64_20260322_092751/metrics.jsonl", "latest_step": 40, "latest_tokens_per_sec": 43689.199702034464, "baseline_ratio": 0.7876453892249308, "latest_total_tokens": 1310720.0, "proxy_mode": null, "evaluation_basis": null}}
{"event_id": "evt_1774142924916768010", "ts": 1774142924, "event": "training_heartbeat", "round": 23, "session_id": "019d130c-782e-75a2-aa6f-506b18d29edf", "tier": "full", "run_name": "round0023_full_1774142864", "family_name": "lowrank_gated_residual", "family_stage": "stabilize", "status": null, "decision": null, "payload": {"tier": "full", "run_name": "round0023_full_1774142864", "family_name": "lowrank_gated_residual", "family_stage": "stabilize", "checkpoint_dir": "/root/sparsify-ascend/checkpoints/research_agent/round_0023_full/round0023_full_1774142864_dp2_bs1_ga8_ef32_k64_20260322_092751", "metrics_path": "/root/sparsify-ascend/checkpoints/research_agent/round_0023_full/round0023_full_1774142864_dp2_bs1_ga8_ef32_k64_20260322_092751/metrics.jsonl", "latest_step": 130, "latest_tokens_per_sec": 70994.64569636364, "baseline_ratio": 1.2799182801188838, "latest_total_tokens": 4259840.0, "proxy_mode": null, "evaluation_basis": null}}
{"event_id": "evt_1774142954918546703", "ts": 1774142954, "event": "training_heartbeat", "round": 23, "session_id": "019d130c-782e-75a2-aa6f-506b18d29edf", "tier": "full", "run_name": "round0023_full_1774142864", "family_name": "lowrank_gated_residual", "family_stage": "stabilize", "status": null, "decision": null, "payload": {"tier": "full", "run_name": "round0023_full_1774142864", "family_name": "lowrank_gated_residual", "family_stage": "stabilize", "checkpoint_dir": "/root/sparsify-ascend/checkpoints/research_agent/round_0023_full/round0023_full_1774142864_dp2_bs1_ga8_ef32_k64_20260322_092751", "metrics_path": "/root/sparsify-ascend/checkpoints/research_agent/round_0023_full/round0023_full_1774142864_dp2_bs1_ga8_ef32_k64_20260322_092751/metrics.jsonl", "latest_step": 220, "latest_tokens_per_sec": 80095.94209974617, "baseline_ratio": 1.4439998883191794, "latest_total_tokens": 7208960.0, "proxy_mode": null, "evaluation_basis": null}}
{"event_id": "evt_1774142984921072422", "ts": 1774142984, "event": "training_heartbeat", "round": 23, "session_id": "019d130c-782e-75a2-aa6f-506b18d29edf", "tier": "full", "run_name": "round0023_full_1774142864", "family_name": "lowrank_gated_residual", "family_stage": "stabilize", "status": null, "decision": null, "payload": {"tier": "full", "run_name": "round0023_full_1774142864", "family_name": "lowrank_gated_residual", "family_stage": "stabilize", "checkpoint_dir": "/root/sparsify-ascend/checkpoints/research_agent/round_0023_full/round0023_full_1774142864_dp2_bs1_ga8_ef32_k64_20260322_092751", "metrics_path": "/root/sparsify-ascend/checkpoints/research_agent/round_0023_full/round0023_full_1774142864_dp2_bs1_ga8_ef32_k64_20260322_092751/metrics.jsonl", "latest_step": 310, "latest_tokens_per_sec": 84646.17113176877, "baseline_ratio": 1.5260331354702625, "latest_total_tokens": 10158080.0, "proxy_mode": null, "evaluation_basis": null}}
{"event_id": "evt_1774143014923904620", "ts": 1774143014, "event": "training_heartbeat", "round": 23, "session_id": "019d130c-782e-75a2-aa6f-506b18d29edf", "tier": "full", "run_name": "round0023_full_1774142864", "family_name": "lowrank_gated_residual", "family_stage": "stabilize", "status": null, "decision": null, "payload": {"tier": "full", "run_name": "round0023_full_1774142864", "family_name": "lowrank_gated_residual", "family_stage": "stabilize", "checkpoint_dir": "/root/sparsify-ascend/checkpoints/research_agent/round_0023_full/round0023_full_1774142864_dp2_bs1_ga8_ef32_k64_20260322_092751", "metrics_path": "/root/sparsify-ascend/checkpoints/research_agent/round_0023_full/round0023_full_1774142864_dp2_bs1_ga8_ef32_k64_20260322_092751/metrics.jsonl", "latest_step": 400, "latest_tokens_per_sec": 87375.85145503897, "baseline_ratio": 1.5752448430626464, "latest_total_tokens": 13107200.0, "proxy_mode": null, "evaluation_basis": null}}
