{"event_id": "evt_1774162070858528693", "ts": 1774162070, "event": "round_finished", "round": 49, "session_id": "019d13dc-400c-7493-83af-bd34fffa7466", "tier": "proxy", "run_name": null, "family_name": "lowrank_gated_residual", "family_stage": "mainline_comparison", "status": "ok", "decision": "discard", "payload": {"tier": "proxy", "family_name": "lowrank_gated_residual", "family_stage": "mainline_comparison", "status": "ok", "decision": "discard", "val_fvu": "0.17895471677184105"}}
{"event_id": "evt_1774162070866416802", "ts": 1774162070, "event": "experiment_commit_prepared", "round": 49, "tier": "proxy", "run_name": null, "family_name": "lowrank_gated_residual", "family_stage": "mainline_comparison", "status": "ok", "decision": "discard", "payload": {"branch": "autoresearch-sae"}}
{"event_id": "evt_1774162078492686445", "ts": 1774162078, "event": "round_started", "round": 50, "session_id": "019d13dc-400c-7493-83af-bd34fffa7466", "tier": null, "run_name": null, "family_name": null, "family_stage": null, "status": "started", "decision": null, "payload": {"status": "started"}}
{"event_id": "evt_1774162078492837129", "ts": 1774162078, "event": "agent_deciding", "round": 50, "session_id": "019d13dc-400c-7493-83af-bd34fffa7466", "tier": null, "run_name": null, "family_name": null, "family_stage": null, "status": null, "decision": null, "payload": {}}
{"event_id": "evt_1774162230542534878", "ts": 1774162230, "event": "session_resumed", "round": 50, "tier": null, "run_name": null, "family_name": null, "family_stage": null, "status": "active", "decision": null, "payload": {"session_id": "019d13dc-400c-7493-83af-bd34fffa7466"}}
{"event_id": "evt_1774162230543743254", "ts": 1774162230, "event": "agent_action_received", "round": 50, "session_id": "019d13dc-400c-7493-83af-bd34fffa7466", "tier": "proxy", "run_name": null, "family_name": "two_stage_residual", "family_stage": "mainline_comparison", "status": null, "decision": null, "payload": {"session_id": "019d13dc-400c-7493-83af-bd34fffa7466", "tier": "proxy", "family_name": "two_stage_residual", "family_stage": "mainline_comparison", "change_type": "param_only", "expected_win": "medium", "hypothesis": "`lowrank_gated_residual` at `K=40`, `EF=8` also regressed badly in proxy, so the current question is no longer whether the leading family survives small capacity but whether any other architecture does better at the same lower-K, same-EF target. The next cleanest move is to hold `K=40`, `EF=8`, optimizer, LR, and aux fixed and switch only the architecture to `two_stage_residual`, which has prior nontrivial full-signal evidence and is the strongest remaining fair challenger in this small-EF comparison band."}}
{"event_id": "evt_1774162230543858668", "ts": 1774162230, "event": "variable_isolation_warning", "round": 50, "session_id": "019d13dc-400c-7493-83af-bd34fffa7466", "tier": null, "run_name": null, "family_name": "two_stage_residual", "family_stage": "mainline_comparison", "status": null, "decision": null, "payload": {"violation": "Multiple primary variables changed simultaneously: architecture, k, lr"}}
{"event_id": "evt_1774162230543930886", "ts": 1774162230, "event": "proxy_mode_selected", "round": 50, "session_id": "019d13dc-400c-7493-83af-bd34fffa7466", "tier": "proxy", "run_name": null, "family_name": "two_stage_residual", "family_stage": "mainline_comparison", "status": null, "decision": null, "payload": {"tier": "proxy", "proxy_mode": "fast", "evaluation_basis": "terminal_only", "parameter_behavior": "structural", "proxy_max_tokens": "5000000"}}
{"event_id": "evt_1774162230544187694", "ts": 1774162230, "event": "training_started", "round": 50, "session_id": "019d13dc-400c-7493-83af-bd34fffa7466", "tier": "proxy", "run_name": "round0050_proxy_1774162230", "family_name": "two_stage_residual", "family_stage": "mainline_comparison", "status": null, "decision": null, "payload": {"tier": "proxy", "run_name": "round0050_proxy_1774162230", "family_name": "two_stage_residual", "family_stage": "mainline_comparison", "checkpoint_dir": "/root/sparsify-ascend/checkpoints/research_agent/round_0050_proxy", "log_path": "/root/sparsify-ascend/research/history/logs/round0050_proxy_1774162230.log", "config": {"architecture": "two_stage_residual", "expansion_factor": 8, "k": 40, "optimizer": "signum", "lr": "1.6e-3", "hookpoints": "layers.[3].self_attn.o_proj", "batch_size": 1, "grad_acc_steps": 8, "micro_acc_steps": 1, "auxk_alpha": 0.0, "dead_feature_threshold": 10000000, "use_hadamard": false, "tier": "proxy", "family_name": "two_stage_residual", "family_stage": "mainline_comparison"}, "baseline_tokens_per_sec": 111037.42023476404, "proxy_mode": "fast", "evaluation_basis": "terminal_only"}}
{"event_id": "evt_1774162260546423033", "ts": 1774162260, "event": "training_heartbeat", "round": 50, "session_id": "019d13dc-400c-7493-83af-bd34fffa7466", "tier": "proxy", "run_name": "round0050_proxy_1774162230", "family_name": "two_stage_residual", "family_stage": "mainline_comparison", "status": null, "decision": null, "payload": {"tier": "proxy", "run_name": "round0050_proxy_1774162230", "family_name": "two_stage_residual", "family_stage": "mainline_comparison", "checkpoint_dir": "/root/sparsify-ascend/checkpoints/research_agent/round_0050_proxy/round0050_proxy_1774162230_dp2_bs1_ga8_ef8_k40_20260322_145037", "metrics_path": "/root/sparsify-ascend/checkpoints/research_agent/round_0050_proxy/round0050_proxy_1774162230_dp2_bs1_ga8_ef8_k40_20260322_145037/metrics.jsonl", "latest_step": 110, "latest_tokens_per_sec": 120141.69302060167, "baseline_ratio": 1.0819928341867873, "latest_total_tokens": 3604480.0, "proxy_mode": "fast", "evaluation_basis": "terminal_only"}}
{"event_id": "evt_1774162290547846611", "ts": 1774162290, "event": "training_heartbeat", "round": 50, "session_id": "019d13dc-400c-7493-83af-bd34fffa7466", "tier": "proxy", "run_name": "round0050_proxy_1774162230", "family_name": "two_stage_residual", "family_stage": "mainline_comparison", "status": null, "decision": null, "payload": {"tier": "proxy", "run_name": "round0050_proxy_1774162230", "family_name": "two_stage_residual", "family_stage": "mainline_comparison", "checkpoint_dir": "/root/sparsify-ascend/checkpoints/research_agent/round_0050_proxy/round0050_proxy_1774162230_dp2_bs1_ga8_ef8_k40_20260322_145037", "metrics_path": "/root/sparsify-ascend/checkpoints/research_agent/round_0050_proxy/round0050_proxy_1774162230_dp2_bs1_ga8_ef8_k40_20260322_145037/metrics.jsonl", "latest_step": 152, "latest_tokens_per_sec": 83007.58785053229, "baseline_ratio": 0.747564088530075, "latest_total_tokens": 4980736.0, "proxy_mode": "fast", "evaluation_basis": "terminal_only"}}
{"event_id": "evt_1774162290613442068", "ts": 1774162290, "event": "training_finished", "round": 50, "session_id": "019d13dc-400c-7493-83af-bd34fffa7466", "tier": "proxy", "run_name": "round0050_proxy_1774162230", "family_name": "two_stage_residual", "family_stage": "mainline_comparison", "status": "ok", "decision": "incubate", "payload": {"tier": "proxy", "run_name": "round0050_proxy_1774162230", "family_name": "two_stage_residual", "family_stage": "mainline_comparison", "checkpoint_dir": "/root/sparsify-ascend/checkpoints/research_agent/round_0050_proxy/round0050_proxy_1774162230_dp2_bs1_ga8_ef8_k40_20260322_145037", "metrics_path": "/root/sparsify-ascend/checkpoints/research_agent/round_0050_proxy/round0050_proxy_1774162230_dp2_bs1_ga8_ef8_k40_20260322_145037/metrics.jsonl", "run_health": "normal", "termination_reason": "completed", "tokens_per_sec": 83007.58785053229, "baseline_ratio": 0.747564088530075, "status": "ok", "decision": "incubate", "proxy_mode": "fast", "evaluation_basis": "terminal_only", "curve_start_fvu": 0.5355927348136902, "curve_mid_fvu": 0.39932742714881897, "curve_end_fvu": 0.3435419201850891, "curve_late_slope": -8.078542680689884e-09, "curve_still_improving": true}}
{"event_id": "evt_1774162290613492387", "ts": 1774162290, "event": "result_recorded", "round": 50, "session_id": "019d13dc-400c-7493-83af-bd34fffa7466", "tier": "proxy", "run_name": "round0050_proxy_1774162230", "family_name": "two_stage_residual", "family_stage": "mainline_comparison", "status": "ok", "decision": "incubate", "payload": {"tier": "proxy", "run_name": "round0050_proxy_1774162230", "family_name": "two_stage_residual", "family_stage": "mainline_comparison", "status": "ok", "decision": "incubate", "val_fvu": "0.3432897999882698", "observed_fvu": "0.343542", "k": "40", "log_path": "/root/sparsify-ascend/research/history/logs/proxy_1774162290.log", "checkpoint": null}}
{"event_id": "evt_1774162290613627190", "ts": 1774162290, "event": "round_finished", "round": 50, "session_id": "019d13dc-400c-7493-83af-bd34fffa7466", "tier": "proxy", "run_name": null, "family_name": "two_stage_residual", "family_stage": "mainline_comparison", "status": "ok", "decision": "incubate", "payload": {"tier": "proxy", "family_name": "two_stage_residual", "family_stage": "mainline_comparison", "status": "ok", "decision": "incubate", "val_fvu": "0.3432897999882698"}}
{"event_id": "evt_1774162290621574901", "ts": 1774162290, "event": "experiment_commit_prepared", "round": 50, "tier": "proxy", "run_name": null, "family_name": "two_stage_residual", "family_stage": "mainline_comparison", "status": "ok", "decision": "incubate", "payload": {"branch": "autoresearch-sae"}}
{"event_id": "evt_1774162298620443644", "ts": 1774162298, "event": "round_started", "round": 51, "session_id": "019d13dc-400c-7493-83af-bd34fffa7466", "tier": null, "run_name": null, "family_name": null, "family_stage": null, "status": "started", "decision": null, "payload": {"status": "started"}}
{"event_id": "evt_1774162298846032321", "ts": 1774162298, "event": "agent_deciding", "round": 51, "session_id": "019d13dc-400c-7493-83af-bd34fffa7466", "tier": null, "run_name": null, "family_name": null, "family_stage": null, "status": null, "decision": null, "payload": {}}
{"event_id": "evt_1774162298851256194", "ts": 1774162298, "event": "session_rebuilt", "round": 51, "tier": null, "run_name": null, "family_name": null, "family_stage": null, "status": "recreated", "decision": null, "payload": {"previous_session_id": "019d13dc-400c-7493-83af-bd34fffa7466", "previous_status": "active", "previous_rounds": 8, "previous_age_hours": 2.095}}
{"event_id": "evt_1774162467167755718", "ts": 1774162467, "event": "session_started", "round": 51, "tier": null, "run_name": null, "family_name": null, "family_stage": null, "status": "active", "decision": null, "payload": {"session_id": "019d1451-d554-79b2-8cc5-c99f2ae19f85"}}
{"event_id": "evt_1774162467168984472", "ts": 1774162467, "event": "agent_action_received", "round": 51, "session_id": "019d1451-d554-79b2-8cc5-c99f2ae19f85", "tier": "proxy", "run_name": null, "family_name": "lowrank_gated_residual", "family_stage": "stabilize", "status": null, "decision": null, "payload": {"session_id": "019d1451-d554-79b2-8cc5-c99f2ae19f85", "tier": "proxy", "family_name": "lowrank_gated_residual", "family_stage": "stabilize", "change_type": "param_only", "expected_win": "lower_fvu", "hypothesis": "At the current lower-K anchor (`K=40`) and fair small-capacity setting (`EF=8`), `lowrank_gated_residual` may be undertrained rather than fundamentally weak; dropping the learning rate from `1.6e-3` to `4e-4` while keeping the rest of the recipe fixed is the narrowest exploitation-mode check for whether this family can recover a competitive small-EF proxy point without reopening architecture or EF."}}
{"event_id": "evt_1774162467169113980", "ts": 1774162467, "event": "proxy_mode_selected", "round": 51, "session_id": "019d1451-d554-79b2-8cc5-c99f2ae19f85", "tier": "proxy", "run_name": null, "family_name": "lowrank_gated_residual", "family_stage": "stabilize", "status": null, "decision": null, "payload": {"tier": "proxy", "proxy_mode": "fast", "evaluation_basis": "terminal_only", "parameter_behavior": "structural", "proxy_max_tokens": "5000000"}}
{"event_id": "evt_1774162467169391108", "ts": 1774162467, "event": "training_started", "round": 51, "session_id": "019d1451-d554-79b2-8cc5-c99f2ae19f85", "tier": "proxy", "run_name": "round0051_proxy_1774162467", "family_name": "lowrank_gated_residual", "family_stage": "stabilize", "status": null, "decision": null, "payload": {"tier": "proxy", "run_name": "round0051_proxy_1774162467", "family_name": "lowrank_gated_residual", "family_stage": "stabilize", "checkpoint_dir": "/root/sparsify-ascend/checkpoints/research_agent/round_0051_proxy", "log_path": "/root/sparsify-ascend/research/history/logs/round0051_proxy_1774162467.log", "config": {"architecture": "lowrank_gated_residual", "expansion_factor": 8, "k": 40, "optimizer": "signum", "lr": "4e-4", "hookpoints": "layers.[3].self_attn.o_proj", "batch_size": 1, "grad_acc_steps": 8, "micro_acc_steps": 1, "auxk_alpha": 0.0, "dead_feature_threshold": 10000000, "use_hadamard": false, "tier": "proxy", "family_name": "lowrank_gated_residual", "family_stage": "stabilize"}, "baseline_tokens_per_sec": 83008.58788873068, "proxy_mode": "fast", "evaluation_basis": "terminal_only"}}
{"event_id": "evt_1774162497171809912", "ts": 1774162497, "event": "training_heartbeat", "round": 51, "session_id": "019d1451-d554-79b2-8cc5-c99f2ae19f85", "tier": "proxy", "run_name": "round0051_proxy_1774162467", "family_name": "lowrank_gated_residual", "family_stage": "stabilize", "status": null, "decision": null, "payload": {"tier": "proxy", "run_name": "round0051_proxy_1774162467", "family_name": "lowrank_gated_residual", "family_stage": "stabilize", "checkpoint_dir": "/root/sparsify-ascend/checkpoints/research_agent/round_0051_proxy/round0051_proxy_1774162467_dp2_bs1_ga8_ef8_k40_20260322_145433", "metrics_path": "/root/sparsify-ascend/checkpoints/research_agent/round_0051_proxy/round0051_proxy_1774162467_dp2_bs1_ga8_ef8_k40_20260322_145433/metrics.jsonl", "latest_step": 140, "latest_tokens_per_sec": 152906.6007533244, "baseline_ratio": 1.842057606838089, "latest_total_tokens": 4587520.0, "proxy_mode": "fast", "evaluation_basis": "terminal_only"}}
{"event_id": "evt_1774162527173244881", "ts": 1774162527, "event": "training_heartbeat", "round": 51, "session_id": "019d1451-d554-79b2-8cc5-c99f2ae19f85", "tier": "proxy", "run_name": "round0051_proxy_1774162467", "family_name": "lowrank_gated_residual", "family_stage": "stabilize", "status": null, "decision": null, "payload": {"tier": "proxy", "run_name": "round0051_proxy_1774162467", "family_name": "lowrank_gated_residual", "family_stage": "stabilize", "checkpoint_dir": "/root/sparsify-ascend/checkpoints/research_agent/round_0051_proxy/round0051_proxy_1774162467_dp2_bs1_ga8_ef8_k40_20260322_145433", "metrics_path": "/root/sparsify-ascend/checkpoints/research_agent/round_0051_proxy/round0051_proxy_1774162467_dp2_bs1_ga8_ef8_k40_20260322_145433/metrics.jsonl", "latest_step": 152, "latest_tokens_per_sec": 83007.33058866557, "baseline_ratio": 0.9999848533736438, "latest_total_tokens": 4980736.0, "proxy_mode": "fast", "evaluation_basis": "terminal_only"}}
{"event_id": "evt_1774162527238352242", "ts": 1774162527, "event": "training_finished", "round": 51, "session_id": "019d1451-d554-79b2-8cc5-c99f2ae19f85", "tier": "proxy", "run_name": "round0051_proxy_1774162467", "family_name": "lowrank_gated_residual", "family_stage": "stabilize", "status": "ok", "decision": "discard", "payload": {"tier": "proxy", "run_name": "round0051_proxy_1774162467", "family_name": "lowrank_gated_residual", "family_stage": "stabilize", "checkpoint_dir": "/root/sparsify-ascend/checkpoints/research_agent/round_0051_proxy/round0051_proxy_1774162467_dp2_bs1_ga8_ef8_k40_20260322_145433", "metrics_path": "/root/sparsify-ascend/checkpoints/research_agent/round_0051_proxy/round0051_proxy_1774162467_dp2_bs1_ga8_ef8_k40_20260322_145433/metrics.jsonl", "run_health": "normal", "termination_reason": "completed", "tokens_per_sec": 83007.33058866557, "baseline_ratio": 0.9999848533736438, "status": "ok", "decision": "discard", "proxy_mode": "fast", "evaluation_basis": "terminal_only", "curve_start_fvu": 0.6206907033920288, "curve_mid_fvu": 0.42751312255859375, "curve_end_fvu": 0.30881261825561523, "curve_late_slope": -2.8609886818054702e-08, "curve_still_improving": true}}
{"event_id": "evt_1774162527238404204", "ts": 1774162527, "event": "result_recorded", "round": 51, "session_id": "019d1451-d554-79b2-8cc5-c99f2ae19f85", "tier": "proxy", "run_name": "round0051_proxy_1774162467", "family_name": "lowrank_gated_residual", "family_stage": "stabilize", "status": "ok", "decision": "discard", "payload": {"tier": "proxy", "run_name": "round0051_proxy_1774162467", "family_name": "lowrank_gated_residual", "family_stage": "stabilize", "status": "ok", "decision": "discard", "val_fvu": "0.3102319724857807", "observed_fvu": "0.308813", "k": "40", "log_path": "/root/sparsify-ascend/research/history/logs/proxy_1774162527.log", "checkpoint": null}}
{"event_id": "evt_1774162527238534750", "ts": 1774162527, "event": "round_finished", "round": 51, "session_id": "019d1451-d554-79b2-8cc5-c99f2ae19f85", "tier": "proxy", "run_name": null, "family_name": "lowrank_gated_residual", "family_stage": "stabilize", "status": "ok", "decision": "discard", "payload": {"tier": "proxy", "family_name": "lowrank_gated_residual", "family_stage": "stabilize", "status": "ok", "decision": "discard", "val_fvu": "0.3102319724857807"}}
{"event_id": "evt_1774162527246491877", "ts": 1774162527, "event": "experiment_commit_prepared", "round": 51, "tier": "proxy", "run_name": null, "family_name": "lowrank_gated_residual", "family_stage": "stabilize", "status": "ok", "decision": "discard", "payload": {"branch": "autoresearch-sae"}}
{"event_id": "evt_1774162534707529515", "ts": 1774162534, "event": "round_started", "round": 52, "session_id": "019d1451-d554-79b2-8cc5-c99f2ae19f85", "tier": null, "run_name": null, "family_name": null, "family_stage": null, "status": "started", "decision": null, "payload": {"status": "started"}}
{"event_id": "evt_1774162534707683588", "ts": 1774162534, "event": "agent_deciding", "round": 52, "session_id": "019d1451-d554-79b2-8cc5-c99f2ae19f85", "tier": null, "run_name": null, "family_name": null, "family_stage": null, "status": null, "decision": null, "payload": {}}
{"event_id": "evt_1774162648730034460", "ts": 1774162648, "event": "session_resumed", "round": 52, "tier": null, "run_name": null, "family_name": null, "family_stage": null, "status": "active", "decision": null, "payload": {"session_id": "019d1451-d554-79b2-8cc5-c99f2ae19f85"}}
{"event_id": "evt_1774162648731297335", "ts": 1774162648, "event": "agent_action_received", "round": 52, "session_id": "019d1451-d554-79b2-8cc5-c99f2ae19f85", "tier": "proxy", "run_name": null, "family_name": "lowrank_gated_residual", "family_stage": "stabilize", "status": null, "decision": null, "payload": {"session_id": "019d1451-d554-79b2-8cc5-c99f2ae19f85", "tier": "proxy", "family_name": "lowrank_gated_residual", "family_stage": "stabilize", "change_type": "param_only", "expected_win": "lower_fvu", "hypothesis": "At the current lower-K anchor (`K=40`), `lowrank_gated_residual` may need slightly more capacity to recover a useful Pareto point even though `EF=8` underperformed; increasing only `EXPANSION_FACTOR` from 8 to 12 while holding the stabilized small-EF recipe fixed is the narrowest next check for whether this family can regain competitive quality without reverting to oversized settings."}}
{"event_id": "evt_1774162648731423919", "ts": 1774162648, "event": "proxy_mode_selected", "round": 52, "session_id": "019d1451-d554-79b2-8cc5-c99f2ae19f85", "tier": "proxy", "run_name": null, "family_name": "lowrank_gated_residual", "family_stage": "stabilize", "status": null, "decision": null, "payload": {"tier": "proxy", "proxy_mode": "fast", "evaluation_basis": "terminal_only", "parameter_behavior": "structural", "proxy_max_tokens": "5000000"}}
{"event_id": "evt_1774162648731694093", "ts": 1774162648, "event": "training_started", "round": 52, "session_id": "019d1451-d554-79b2-8cc5-c99f2ae19f85", "tier": "proxy", "run_name": "round0052_proxy_1774162648", "family_name": "lowrank_gated_residual", "family_stage": "stabilize", "status": null, "decision": null, "payload": {"tier": "proxy", "run_name": "round0052_proxy_1774162648", "family_name": "lowrank_gated_residual", "family_stage": "stabilize", "checkpoint_dir": "/root/sparsify-ascend/checkpoints/research_agent/round_0052_proxy", "log_path": "/root/sparsify-ascend/research/history/logs/round0052_proxy_1774162648.log", "config": {"architecture": "lowrank_gated_residual", "expansion_factor": 12, "k": 40, "optimizer": "signum", "lr": "1.6e-3", "hookpoints": "layers.[3].self_attn.o_proj", "batch_size": 1, "grad_acc_steps": 8, "micro_acc_steps": 1, "auxk_alpha": 0.0, "dead_feature_threshold": 10000000, "use_hadamard": false, "tier": "proxy", "family_name": "lowrank_gated_residual", "family_stage": "stabilize"}, "baseline_tokens_per_sec": 83008.58788873068, "proxy_mode": "fast", "evaluation_basis": "terminal_only"}}
