{"event_id": "evt_1774143044927227000", "ts": 1774143044, "event": "training_heartbeat", "round": 23, "session_id": "019d130c-782e-75a2-aa6f-506b18d29edf", "tier": "full", "run_name": "round0023_full_1774142864", "family_name": "lowrank_gated_residual", "family_stage": "stabilize", "status": null, "decision": null, "payload": {"tier": "full", "run_name": "round0023_full_1774142864", "family_name": "lowrank_gated_residual", "family_stage": "stabilize", "checkpoint_dir": "/root/sparsify-ascend/checkpoints/research_agent/round_0023_full/round0023_full_1774142864_dp2_bs1_ga8_ef32_k64_20260322_092751", "metrics_path": "/root/sparsify-ascend/checkpoints/research_agent/round_0023_full/round0023_full_1774142864_dp2_bs1_ga8_ef32_k64_20260322_092751/metrics.jsonl", "latest_step": 490, "latest_tokens_per_sec": 89195.46843433875, "baseline_ratio": 1.6080495850509537, "latest_total_tokens": 16056320.0, "proxy_mode": null, "evaluation_basis": null}}
{"event_id": "evt_1774143074931025132", "ts": 1774143074, "event": "training_heartbeat", "round": 23, "session_id": "019d130c-782e-75a2-aa6f-506b18d29edf", "tier": "full", "run_name": "round0023_full_1774142864", "family_name": "lowrank_gated_residual", "family_stage": "stabilize", "status": null, "decision": null, "payload": {"tier": "full", "run_name": "round0023_full_1774142864", "family_name": "lowrank_gated_residual", "family_stage": "stabilize", "checkpoint_dir": "/root/sparsify-ascend/checkpoints/research_agent/round_0023_full/round0023_full_1774142864_dp2_bs1_ga8_ef32_k64_20260322_092751", "metrics_path": "/root/sparsify-ascend/checkpoints/research_agent/round_0023_full/round0023_full_1774142864_dp2_bs1_ga8_ef32_k64_20260322_092751/metrics.jsonl", "latest_step": 580, "latest_tokens_per_sec": 90494.97238603594, "baseline_ratio": 1.6314775329834996, "latest_total_tokens": 19005440.0, "proxy_mode": null, "evaluation_basis": null}}
{"event_id": "evt_1774143104935323060", "ts": 1774143104, "event": "training_heartbeat", "round": 23, "session_id": "019d130c-782e-75a2-aa6f-506b18d29edf", "tier": "full", "run_name": "round0023_full_1774142864", "family_name": "lowrank_gated_residual", "family_stage": "stabilize", "status": null, "decision": null, "payload": {"tier": "full", "run_name": "round0023_full_1774142864", "family_name": "lowrank_gated_residual", "family_stage": "stabilize", "checkpoint_dir": "/root/sparsify-ascend/checkpoints/research_agent/round_0023_full/round0023_full_1774142864_dp2_bs1_ga8_ef32_k64_20260322_092751", "metrics_path": "/root/sparsify-ascend/checkpoints/research_agent/round_0023_full/round0023_full_1774142864_dp2_bs1_ga8_ef32_k64_20260322_092751/metrics.jsonl", "latest_step": 670, "latest_tokens_per_sec": 91469.3950384365, "baseline_ratio": 1.6490447925019636, "latest_total_tokens": 21954560.0, "proxy_mode": null, "evaluation_basis": null}}
{"event_id": "evt_1774143134940128633", "ts": 1774143134, "event": "training_heartbeat", "round": 23, "session_id": "019d130c-782e-75a2-aa6f-506b18d29edf", "tier": "full", "run_name": "round0023_full_1774142864", "family_name": "lowrank_gated_residual", "family_stage": "stabilize", "status": null, "decision": null, "payload": {"tier": "full", "run_name": "round0023_full_1774142864", "family_name": "lowrank_gated_residual", "family_stage": "stabilize", "checkpoint_dir": "/root/sparsify-ascend/checkpoints/research_agent/round_0023_full/round0023_full_1774142864_dp2_bs1_ga8_ef32_k64_20260322_092751", "metrics_path": "/root/sparsify-ascend/checkpoints/research_agent/round_0023_full/round0023_full_1774142864_dp2_bs1_ga8_ef32_k64_20260322_092751/metrics.jsonl", "latest_step": 760, "latest_tokens_per_sec": 92227.09678447447, "baseline_ratio": 1.6627049256869322, "latest_total_tokens": 24903680.0, "proxy_mode": null, "evaluation_basis": null}}
{"event_id": "evt_1774143164945438178", "ts": 1774143164, "event": "training_heartbeat", "round": 23, "session_id": "019d130c-782e-75a2-aa6f-506b18d29edf", "tier": "full", "run_name": "round0023_full_1774142864", "family_name": "lowrank_gated_residual", "family_stage": "stabilize", "status": null, "decision": null, "payload": {"tier": "full", "run_name": "round0023_full_1774142864", "family_name": "lowrank_gated_residual", "family_stage": "stabilize", "checkpoint_dir": "/root/sparsify-ascend/checkpoints/research_agent/round_0023_full/round0023_full_1774142864_dp2_bs1_ga8_ef32_k64_20260322_092751", "metrics_path": "/root/sparsify-ascend/checkpoints/research_agent/round_0023_full/round0023_full_1774142864_dp2_bs1_ga8_ef32_k64_20260322_092751/metrics.jsonl", "latest_step": 850, "latest_tokens_per_sec": 92833.09474997048, "baseline_ratio": 1.6736300858330997, "latest_total_tokens": 27852800.0, "proxy_mode": null, "evaluation_basis": null}}
{"event_id": "evt_1774143194951197151", "ts": 1774143194, "event": "training_heartbeat", "round": 23, "session_id": "019d130c-782e-75a2-aa6f-506b18d29edf", "tier": "full", "run_name": "round0023_full_1774142864", "family_name": "lowrank_gated_residual", "family_stage": "stabilize", "status": null, "decision": null, "payload": {"tier": "full", "run_name": "round0023_full_1774142864", "family_name": "lowrank_gated_residual", "family_stage": "stabilize", "checkpoint_dir": "/root/sparsify-ascend/checkpoints/research_agent/round_0023_full/round0023_full_1774142864_dp2_bs1_ga8_ef32_k64_20260322_092751", "metrics_path": "/root/sparsify-ascend/checkpoints/research_agent/round_0023_full/round0023_full_1774142864_dp2_bs1_ga8_ef32_k64_20260322_092751/metrics.jsonl", "latest_step": 940, "latest_tokens_per_sec": 93328.77269345481, "baseline_ratio": 1.6825663549657144, "latest_total_tokens": 30801920.0, "proxy_mode": null, "evaluation_basis": null}}
{"event_id": "evt_1774143224989209281", "ts": 1774143224, "event": "training_heartbeat", "round": 23, "session_id": "019d130c-782e-75a2-aa6f-506b18d29edf", "tier": "full", "run_name": "round0023_full_1774142864", "family_name": "lowrank_gated_residual", "family_stage": "stabilize", "status": null, "decision": null, "payload": {"tier": "full", "run_name": "round0023_full_1774142864", "family_name": "lowrank_gated_residual", "family_stage": "stabilize", "checkpoint_dir": "/root/sparsify-ascend/checkpoints/research_agent/round_0023_full/round0023_full_1774142864_dp2_bs1_ga8_ef32_k64_20260322_092751", "metrics_path": "/root/sparsify-ascend/checkpoints/research_agent/round_0023_full/round0023_full_1774142864_dp2_bs1_ga8_ef32_k64_20260322_092751/metrics.jsonl", "latest_step": 990, "latest_tokens_per_sec": 90101.28940253957, "baseline_ratio": 1.6243800675027393, "latest_total_tokens": 32440320.0, "proxy_mode": null, "evaluation_basis": null}}
{"event_id": "evt_1774143255228947934", "ts": 1774143255, "event": "training_heartbeat", "round": 23, "session_id": "019d130c-782e-75a2-aa6f-506b18d29edf", "tier": "full", "run_name": "round0023_full_1774142864", "family_name": "lowrank_gated_residual", "family_stage": "stabilize", "status": null, "decision": null, "payload": {"tier": "full", "run_name": "round0023_full_1774142864", "family_name": "lowrank_gated_residual", "family_stage": "stabilize", "checkpoint_dir": "/root/sparsify-ascend/checkpoints/research_agent/round_0023_full/round0023_full_1774142864_dp2_bs1_ga8_ef32_k64_20260322_092751", "metrics_path": "/root/sparsify-ascend/checkpoints/research_agent/round_0023_full/round0023_full_1774142864_dp2_bs1_ga8_ef32_k64_20260322_092751/metrics.jsonl", "latest_step": 1060, "latest_tokens_per_sec": 89043.19489467844, "baseline_ratio": 1.6053043401796265, "latest_total_tokens": 34734080.0, "proxy_mode": null, "evaluation_basis": null}}
{"event_id": "evt_1774143285389761970", "ts": 1774143285, "event": "training_heartbeat", "round": 23, "session_id": "019d130c-782e-75a2-aa6f-506b18d29edf", "tier": "full", "run_name": "round0023_full_1774142864", "family_name": "lowrank_gated_residual", "family_stage": "stabilize", "status": null, "decision": null, "payload": {"tier": "full", "run_name": "round0023_full_1774142864", "family_name": "lowrank_gated_residual", "family_stage": "stabilize", "checkpoint_dir": "/root/sparsify-ascend/checkpoints/research_agent/round_0023_full/round0023_full_1774142864_dp2_bs1_ga8_ef32_k64_20260322_092751", "metrics_path": "/root/sparsify-ascend/checkpoints/research_agent/round_0023_full/round0023_full_1774142864_dp2_bs1_ga8_ef32_k64_20260322_092751/metrics.jsonl", "latest_step": 1150, "latest_tokens_per_sec": 89653.1360781119, "baseline_ratio": 1.6163005901477254, "latest_total_tokens": 37683200.0, "proxy_mode": null, "evaluation_basis": null}}
{"event_id": "evt_1774143315484459398", "ts": 1774143315, "event": "training_heartbeat", "round": 23, "session_id": "019d130c-782e-75a2-aa6f-506b18d29edf", "tier": "full", "run_name": "round0023_full_1774142864", "family_name": "lowrank_gated_residual", "family_stage": "stabilize", "status": null, "decision": null, "payload": {"tier": "full", "run_name": "round0023_full_1774142864", "family_name": "lowrank_gated_residual", "family_stage": "stabilize", "checkpoint_dir": "/root/sparsify-ascend/checkpoints/research_agent/round_0023_full/round0023_full_1774142864_dp2_bs1_ga8_ef32_k64_20260322_092751", "metrics_path": "/root/sparsify-ascend/checkpoints/research_agent/round_0023_full/round0023_full_1774142864_dp2_bs1_ga8_ef32_k64_20260322_092751/metrics.jsonl", "latest_step": 1220, "latest_tokens_per_sec": 88742.49384977933, "baseline_ratio": 1.5998831881977815, "latest_total_tokens": 39976960.0, "proxy_mode": null, "evaluation_basis": null}}
{"event_id": "evt_1774143345574377726", "ts": 1774143345, "event": "training_heartbeat", "round": 23, "session_id": "019d130c-782e-75a2-aa6f-506b18d29edf", "tier": "full", "run_name": "round0023_full_1774142864", "family_name": "lowrank_gated_residual", "family_stage": "stabilize", "status": null, "decision": null, "payload": {"tier": "full", "run_name": "round0023_full_1774142864", "family_name": "lowrank_gated_residual", "family_stage": "stabilize", "checkpoint_dir": "/root/sparsify-ascend/checkpoints/research_agent/round_0023_full/round0023_full_1774142864_dp2_bs1_ga8_ef32_k64_20260322_092751", "metrics_path": "/root/sparsify-ascend/checkpoints/research_agent/round_0023_full/round0023_full_1774142864_dp2_bs1_ga8_ef32_k64_20260322_092751/metrics.jsonl", "latest_step": 1220, "latest_tokens_per_sec": 83185.27251981011, "baseline_ratio": 1.4996955036600659, "latest_total_tokens": 39976960.0, "proxy_mode": null, "evaluation_basis": null}}
{"event_id": "evt_1774143375581779543", "ts": 1774143375, "event": "training_heartbeat", "round": 23, "session_id": "019d130c-782e-75a2-aa6f-506b18d29edf", "tier": "full", "run_name": "round0023_full_1774142864", "family_name": "lowrank_gated_residual", "family_stage": "stabilize", "status": null, "decision": null, "payload": {"tier": "full", "run_name": "round0023_full_1774142864", "family_name": "lowrank_gated_residual", "family_stage": "stabilize", "checkpoint_dir": "/root/sparsify-ascend/checkpoints/research_agent/round_0023_full/round0023_full_1774142864_dp2_bs1_ga8_ef32_k64_20260322_092751", "metrics_path": "/root/sparsify-ascend/checkpoints/research_agent/round_0023_full/round0023_full_1774142864_dp2_bs1_ga8_ef32_k64_20260322_092751/metrics.jsonl", "latest_step": 1220, "latest_tokens_per_sec": 78283.77131027532, "baseline_ratio": 1.4113293890527816, "latest_total_tokens": 39976960.0, "proxy_mode": null, "evaluation_basis": null}}
{"event_id": "evt_1774143375746789310", "ts": 1774143375, "event": "training_finished", "round": 23, "session_id": "019d130c-782e-75a2-aa6f-506b18d29edf", "tier": "full", "run_name": "round0023_full_1774142864", "family_name": "lowrank_gated_residual", "family_stage": "stabilize", "status": "ok", "decision": "keep", "payload": {"tier": "full", "run_name": "round0023_full_1774142864", "family_name": "lowrank_gated_residual", "family_stage": "stabilize", "checkpoint_dir": "/root/sparsify-ascend/checkpoints/research_agent/round_0023_full/round0023_full_1774142864_dp2_bs1_ga8_ef32_k64_20260322_092751", "metrics_path": "/root/sparsify-ascend/checkpoints/research_agent/round_0023_full/round0023_full_1774142864_dp2_bs1_ga8_ef32_k64_20260322_092751/metrics.jsonl", "run_health": "normal", "termination_reason": "completed", "tokens_per_sec": 78283.77131027532, "baseline_ratio": 1.4113293890527816, "status": "ok", "decision": "keep", "proxy_mode": null, "evaluation_basis": null, "curve_start_fvu": 0.11625978350639343, "curve_mid_fvu": 0.09934917837381363, "curve_end_fvu": 0.07978237420320511, "curve_late_slope": -1.3003155710647974e-09, "curve_still_improving": true}}
{"event_id": "evt_1774143375746858434", "ts": 1774143375, "event": "result_recorded", "round": 23, "session_id": "019d130c-782e-75a2-aa6f-506b18d29edf", "tier": "full", "run_name": "round0023_full_1774142864", "family_name": "lowrank_gated_residual", "family_stage": "stabilize", "status": "ok", "decision": "keep", "payload": {"tier": "full", "run_name": "round0023_full_1774142864", "family_name": "lowrank_gated_residual", "family_stage": "stabilize", "status": "ok", "decision": "keep", "val_fvu": "0.08140197116881609", "observed_fvu": "0.079782", "k": "64", "log_path": "/root/sparsify-ascend/research/history/logs/full_1774143375.log", "checkpoint": null}}
{"event_id": "evt_1774143375747407692", "ts": 1774143375, "event": "round_finished", "round": 23, "session_id": "019d130c-782e-75a2-aa6f-506b18d29edf", "tier": "full", "run_name": null, "family_name": "lowrank_gated_residual", "family_stage": "stabilize", "status": "ok", "decision": "keep", "payload": {"tier": "full", "family_name": "lowrank_gated_residual", "family_stage": "stabilize", "status": "ok", "decision": "keep", "val_fvu": "0.08140197116881609"}}
{"event_id": "evt_1774143375756836788", "ts": 1774143375, "event": "experiment_commit_prepared", "round": 23, "tier": "full", "run_name": null, "family_name": "lowrank_gated_residual", "family_stage": "stabilize", "status": "ok", "decision": "keep", "payload": {"branch": "autoresearch-sae"}}
{"event_id": "evt_1774143383187345671", "ts": 1774143383, "event": "round_started", "round": 24, "session_id": "019d130c-782e-75a2-aa6f-506b18d29edf", "tier": null, "run_name": null, "family_name": null, "family_stage": null, "status": "started", "decision": null, "payload": {"status": "started"}}
{"event_id": "evt_1774143383187514585", "ts": 1774143383, "event": "agent_deciding", "round": 24, "session_id": "019d130c-782e-75a2-aa6f-506b18d29edf", "tier": null, "run_name": null, "family_name": null, "family_stage": null, "status": null, "decision": null, "payload": {}}
{"event_id": "evt_1774143500600624138", "ts": 1774143500, "event": "session_resumed", "round": 24, "tier": null, "run_name": null, "family_name": null, "family_stage": null, "status": "active", "decision": null, "payload": {"session_id": "019d130c-782e-75a2-aa6f-506b18d29edf"}}
{"event_id": "evt_1774143500635802868", "ts": 1774143500, "event": "agent_action_received", "round": 24, "session_id": "019d130c-782e-75a2-aa6f-506b18d29edf", "tier": "proxy", "run_name": null, "family_name": "lowrank_gated_residual", "family_stage": "stabilize", "status": null, "decision": null, "payload": {"session_id": "019d130c-782e-75a2-aa6f-506b18d29edf", "tier": "proxy", "family_name": "lowrank_gated_residual", "family_stage": "stabilize", "change_type": "param_only", "expected_win": "lower_fvu", "hypothesis": "`lowrank_gated_residual` has now improved the full frontier at both K=128 and K=64, so the next clean move is to change only K again and test whether the family also strengthens the smallest currently active Pareto point. A proxy K=32 run under the same EF=32 signum recipe will show whether the gated residual selector is a general frontier improvement rather than only a medium/high-K gain."}}
{"event_id": "evt_1774143500635933921", "ts": 1774143500, "event": "proxy_mode_selected", "round": 24, "session_id": "019d130c-782e-75a2-aa6f-506b18d29edf", "tier": "proxy", "run_name": null, "family_name": "lowrank_gated_residual", "family_stage": "stabilize", "status": null, "decision": null, "payload": {"tier": "proxy", "proxy_mode": "fast", "evaluation_basis": "terminal_only", "parameter_behavior": "structural", "proxy_max_tokens": "5000000"}}
{"event_id": "evt_1774143500636254157", "ts": 1774143500, "event": "training_started", "round": 24, "session_id": "019d130c-782e-75a2-aa6f-506b18d29edf", "tier": "proxy", "run_name": "round0024_proxy_1774143500", "family_name": "lowrank_gated_residual", "family_stage": "stabilize", "status": null, "decision": null, "payload": {"tier": "proxy", "run_name": "round0024_proxy_1774143500", "family_name": "lowrank_gated_residual", "family_stage": "stabilize", "checkpoint_dir": "/root/sparsify-ascend/checkpoints/research_agent/round_0024_proxy", "log_path": "/root/sparsify-ascend/research/history/logs/round0024_proxy_1774143500.log", "config": {"architecture": "lowrank_gated_residual", "expansion_factor": 32, "k": 32, "optimizer": "signum", "lr": "1.6e-3", "hookpoints": "layers.[3].self_attn.o_proj", "batch_size": 1, "grad_acc_steps": 8, "micro_acc_steps": 1, "auxk_alpha": 0.0, "dead_feature_threshold": 10000000, "use_hadamard": false, "tier": "proxy", "family_name": "lowrank_gated_residual", "family_stage": "stabilize"}, "baseline_tokens_per_sec": 66557.55177513757, "proxy_mode": "fast", "evaluation_basis": "terminal_only"}}
{"event_id": "evt_1774143530637603825", "ts": 1774143530, "event": "training_heartbeat", "round": 24, "session_id": "019d130c-782e-75a2-aa6f-506b18d29edf", "tier": "proxy", "run_name": "round0024_proxy_1774143500", "family_name": "lowrank_gated_residual", "family_stage": "stabilize", "status": null, "decision": null, "payload": {"tier": "proxy", "run_name": "round0024_proxy_1774143500", "family_name": "lowrank_gated_residual", "family_stage": "stabilize", "checkpoint_dir": "/root/sparsify-ascend/checkpoints/research_agent/round_0024_proxy/round0024_proxy_1774143500_dp2_bs1_ga8_ef32_k32_20260322_093829", "metrics_path": "/root/sparsify-ascend/checkpoints/research_agent/round_0024_proxy/round0024_proxy_1774143500_dp2_bs1_ga8_ef32_k32_20260322_093829/metrics.jsonl", "latest_step": 40, "latest_tokens_per_sec": 43689.19379965386, "baseline_ratio": 0.6564122723031688, "latest_total_tokens": 1310720.0, "proxy_mode": "fast", "evaluation_basis": "terminal_only"}}
{"event_id": "evt_1774143560638934617", "ts": 1774143560, "event": "training_heartbeat", "round": 24, "session_id": "019d130c-782e-75a2-aa6f-506b18d29edf", "tier": "proxy", "run_name": "round0024_proxy_1774143500", "family_name": "lowrank_gated_residual", "family_stage": "stabilize", "status": null, "decision": null, "payload": {"tier": "proxy", "run_name": "round0024_proxy_1774143500", "family_name": "lowrank_gated_residual", "family_stage": "stabilize", "checkpoint_dir": "/root/sparsify-ascend/checkpoints/research_agent/round_0024_proxy/round0024_proxy_1774143500_dp2_bs1_ga8_ef32_k32_20260322_093829", "metrics_path": "/root/sparsify-ascend/checkpoints/research_agent/round_0024_proxy/round0024_proxy_1774143500_dp2_bs1_ga8_ef32_k32_20260322_093829/metrics.jsonl", "latest_step": 140, "latest_tokens_per_sec": 76455.68722548238, "baseline_ratio": 1.1487154377881164, "latest_total_tokens": 4587520.0, "proxy_mode": "fast", "evaluation_basis": "terminal_only"}}
{"event_id": "evt_1774143590850053771", "ts": 1774143590, "event": "training_heartbeat", "round": 24, "session_id": "019d130c-782e-75a2-aa6f-506b18d29edf", "tier": "proxy", "run_name": "round0024_proxy_1774143500", "family_name": "lowrank_gated_residual", "family_stage": "stabilize", "status": null, "decision": null, "payload": {"tier": "proxy", "run_name": "round0024_proxy_1774143500", "family_name": "lowrank_gated_residual", "family_stage": "stabilize", "checkpoint_dir": "/root/sparsify-ascend/checkpoints/research_agent/round_0024_proxy/round0024_proxy_1774143500_dp2_bs1_ga8_ef32_k32_20260322_093829", "metrics_path": "/root/sparsify-ascend/checkpoints/research_agent/round_0024_proxy/round0024_proxy_1774143500_dp2_bs1_ga8_ef32_k32_20260322_093829/metrics.jsonl", "latest_step": 152, "latest_tokens_per_sec": 55339.20086033514, "baseline_ratio": 0.8314488646952753, "latest_total_tokens": 4980736.0, "proxy_mode": "fast", "evaluation_basis": "terminal_only"}}
{"event_id": "evt_1774143591379996785", "ts": 1774143591, "event": "training_finished", "round": 24, "session_id": "019d130c-782e-75a2-aa6f-506b18d29edf", "tier": "proxy", "run_name": "round0024_proxy_1774143500", "family_name": "lowrank_gated_residual", "family_stage": "stabilize", "status": "ok", "decision": "promote", "payload": {"tier": "proxy", "run_name": "round0024_proxy_1774143500", "family_name": "lowrank_gated_residual", "family_stage": "stabilize", "checkpoint_dir": "/root/sparsify-ascend/checkpoints/research_agent/round_0024_proxy/round0024_proxy_1774143500_dp2_bs1_ga8_ef32_k32_20260322_093829", "metrics_path": "/root/sparsify-ascend/checkpoints/research_agent/round_0024_proxy/round0024_proxy_1774143500_dp2_bs1_ga8_ef32_k32_20260322_093829/metrics.jsonl", "run_health": "normal", "termination_reason": "completed", "tokens_per_sec": 55339.20086033514, "baseline_ratio": 0.8314488646952753, "status": "ok", "decision": "promote", "proxy_mode": "fast", "evaluation_basis": "terminal_only", "curve_start_fvu": 0.3424038887023926, "curve_mid_fvu": 0.22121423482894897, "curve_end_fvu": 0.17489267885684967, "curve_late_slope": -6.86165343898709e-09, "curve_still_improving": true}}
