{"event_id": "evt_1774169385446809418", "ts": 1774169385, "event": "training_finished", "round": 79, "session_id": "019d14b3-7a66-7a10-a3d2-e744f4a315a4", "tier": "proxy", "run_name": "round0079_proxy_1774169325", "family_name": "jumprelu", "family_stage": "mainline_comparison", "status": "ok", "decision": "incubate", "payload": {"tier": "proxy", "run_name": "round0079_proxy_1774169325", "family_name": "jumprelu", "family_stage": "mainline_comparison", "checkpoint_dir": "/root/sparsify-ascend/checkpoints/research_agent/round_0079_proxy/round0079_proxy_1774169325_dp2_bs1_ga8_ef12_k32_20260322_164851", "metrics_path": "/root/sparsify-ascend/checkpoints/research_agent/round_0079_proxy/round0079_proxy_1774169325_dp2_bs1_ga8_ef12_k32_20260322_164851/metrics.jsonl", "run_health": "normal", "termination_reason": "completed", "tokens_per_sec": 83008.4021938002, "baseline_ratio": 0.999996948384256, "status": "ok", "decision": "incubate", "proxy_mode": "fast", "evaluation_basis": "terminal_only", "curve_start_fvu": 0.5405334234237671, "curve_mid_fvu": 0.4208275079727173, "curve_end_fvu": 0.3728748857975006, "curve_late_slope": -6.312362646924392e-09, "curve_still_improving": true}}
{"event_id": "evt_1774169385446861030", "ts": 1774169385, "event": "result_recorded", "round": 79, "session_id": "019d14b3-7a66-7a10-a3d2-e744f4a315a4", "tier": "proxy", "run_name": "round0079_proxy_1774169325", "family_name": "jumprelu", "family_stage": "mainline_comparison", "status": "ok", "decision": "incubate", "payload": {"tier": "proxy", "run_name": "round0079_proxy_1774169325", "family_name": "jumprelu", "family_stage": "mainline_comparison", "status": "ok", "decision": "incubate", "val_fvu": "0.37272263318300247", "observed_fvu": "0.372875", "k": "32", "log_path": "/root/sparsify-ascend/research/history/logs/proxy_1774169385.log", "checkpoint": null}}
{"event_id": "evt_1774169385447013081", "ts": 1774169385, "event": "round_finished", "round": 79, "session_id": "019d14b3-7a66-7a10-a3d2-e744f4a315a4", "tier": "proxy", "run_name": null, "family_name": "jumprelu", "family_stage": "mainline_comparison", "status": "ok", "decision": "incubate", "payload": {"tier": "proxy", "family_name": "jumprelu", "family_stage": "mainline_comparison", "status": "ok", "decision": "incubate", "val_fvu": "0.37272263318300247"}}
{"event_id": "evt_1774169385455645300", "ts": 1774169385, "event": "experiment_commit_prepared", "round": 79, "tier": "proxy", "run_name": null, "family_name": "jumprelu", "family_stage": "mainline_comparison", "status": "ok", "decision": "incubate", "payload": {"branch": "autoresearch-sae"}}
{"event_id": "evt_1774169393111556214", "ts": 1774169393, "event": "round_started", "round": 80, "session_id": "019d14b3-7a66-7a10-a3d2-e744f4a315a4", "tier": null, "run_name": null, "family_name": null, "family_stage": null, "status": "started", "decision": null, "payload": {"status": "started"}}
{"event_id": "evt_1774169393111721265", "ts": 1774169393, "event": "agent_deciding", "round": 80, "session_id": "019d14b3-7a66-7a10-a3d2-e744f4a315a4", "tier": null, "run_name": null, "family_name": null, "family_stage": null, "status": null, "decision": null, "payload": {}}
{"event_id": "evt_1774169522728562271", "ts": 1774169522, "event": "session_resumed", "round": 80, "tier": null, "run_name": null, "family_name": null, "family_stage": null, "status": "active", "decision": null, "payload": {"session_id": "019d14b3-7a66-7a10-a3d2-e744f4a315a4"}}
{"event_id": "evt_1774169522734618714", "ts": 1774169522, "event": "agent_action_received", "round": 80, "session_id": "019d14b3-7a66-7a10-a3d2-e744f4a315a4", "tier": "proxy", "run_name": null, "family_name": "residual_vq_topk", "family_stage": "prototype", "status": null, "decision": null, "payload": {"session_id": "019d14b3-7a66-7a10-a3d2-e744f4a315a4", "tier": "proxy", "family_name": "residual_vq_topk", "family_stage": "prototype", "change_type": "edit_sae_code", "expected_win": "smaller_k", "hypothesis": "After repeated weak low-K results from routing, gated-branch, preprocessing, and thresholded-sparsity pivots, the next informative move is to switch from continuous sparse support selection to a discrete coarse-plus-residual representation. Add a new `residual_vq_topk` prototype under `sparsify/` and run it at `K=32`, `EF=12` with the stable `signum`/`lr=1.6e-3`/`auxk_alpha=0` recipe to test whether a hard codebook backbone plus sparse residual correction yields a stronger low-K tradeoff than the current continuous families."}}
{"event_id": "evt_1774169652558998242", "ts": 1774169652, "event": "variable_isolation_warning", "round": 80, "session_id": "019d14b3-7a66-7a10-a3d2-e744f4a315a4", "tier": null, "run_name": null, "family_name": "residual_vq_topk", "family_stage": "prototype", "status": null, "decision": null, "payload": {"violation": "Multiple primary variables changed simultaneously: code_edit, architecture, k, lr"}}
{"event_id": "evt_1774169652559135252", "ts": 1774169652, "event": "proxy_mode_selected", "round": 80, "session_id": "019d14b3-7a66-7a10-a3d2-e744f4a315a4", "tier": "proxy", "run_name": null, "family_name": "residual_vq_topk", "family_stage": "prototype", "status": null, "decision": null, "payload": {"tier": "proxy", "proxy_mode": "fast", "evaluation_basis": "terminal_only", "parameter_behavior": "structural", "proxy_max_tokens": "40000000"}}
{"event_id": "evt_1774169652559184787", "ts": 1774169652, "event": "sanity_started", "round": 80, "session_id": "019d14b3-7a66-7a10-a3d2-e744f4a315a4", "tier": "proxy", "run_name": null, "family_name": "residual_vq_topk", "family_stage": "prototype", "status": null, "decision": null, "payload": {"tier": "proxy"}}
{"event_id": "evt_1774169657214958958", "ts": 1774169657, "event": "sanity_finished", "round": 80, "session_id": "019d14b3-7a66-7a10-a3d2-e744f4a315a4", "tier": "proxy", "run_name": null, "family_name": "residual_vq_topk", "family_stage": "prototype", "status": "ok", "decision": null, "payload": {"tier": "proxy", "status": "ok"}}
{"event_id": "evt_1774169657215352349", "ts": 1774169657, "event": "training_started", "round": 80, "session_id": "019d14b3-7a66-7a10-a3d2-e744f4a315a4", "tier": "proxy", "run_name": "round0080_proxy_1774169657", "family_name": "residual_vq_topk", "family_stage": "prototype", "status": null, "decision": null, "payload": {"tier": "proxy", "run_name": "round0080_proxy_1774169657", "family_name": "residual_vq_topk", "family_stage": "prototype", "checkpoint_dir": "/root/sparsify-ascend/checkpoints/research_agent/round_0080_proxy", "log_path": "/root/sparsify-ascend/research/history/logs/round0080_proxy_1774169657.log", "config": {"architecture": "residual_vq_topk", "expansion_factor": 12, "k": 32, "optimizer": "signum", "lr": "1.6e-3", "hookpoints": "layers.[3].self_attn.o_proj", "batch_size": 1, "grad_acc_steps": 8, "micro_acc_steps": 1, "auxk_alpha": 0.0, "dead_feature_threshold": 10000000, "use_hadamard": false, "tier": "proxy", "family_name": "residual_vq_topk", "family_stage": "prototype"}, "baseline_tokens_per_sec": null, "proxy_mode": "fast", "evaluation_basis": "terminal_only"}}
{"event_id": "evt_1774169687216148954", "ts": 1774169687, "event": "training_heartbeat", "round": 80, "session_id": "019d14b3-7a66-7a10-a3d2-e744f4a315a4", "tier": "proxy", "run_name": "round0080_proxy_1774169657", "family_name": "residual_vq_topk", "family_stage": "prototype", "status": null, "decision": null, "payload": {"tier": "proxy", "run_name": "round0080_proxy_1774169657", "family_name": "residual_vq_topk", "family_stage": "prototype", "checkpoint_dir": null, "metrics_path": null, "latest_step": null, "latest_tokens_per_sec": null, "baseline_ratio": null, "latest_total_tokens": null, "proxy_mode": "fast", "evaluation_basis": "terminal_only"}}
{"event_id": "evt_1774169687281331816", "ts": 1774169687, "event": "training_finished", "round": 80, "session_id": "019d14b3-7a66-7a10-a3d2-e744f4a315a4", "tier": "proxy", "run_name": "round0080_proxy_1774169657", "family_name": "residual_vq_topk", "family_stage": "prototype", "status": "crash", "decision": "crash", "payload": {"tier": "proxy", "run_name": "round0080_proxy_1774169657", "family_name": "residual_vq_topk", "family_stage": "prototype", "checkpoint_dir": null, "metrics_path": "", "run_health": "crash", "termination_reason": "completed", "tokens_per_sec": null, "baseline_ratio": null, "status": "crash", "decision": "crash", "proxy_mode": "fast", "evaluation_basis": "terminal_only", "curve_start_fvu": null, "curve_mid_fvu": null, "curve_end_fvu": null, "curve_late_slope": null, "curve_still_improving": null}}
{"event_id": "evt_1774169687281375846", "ts": 1774169687, "event": "result_recorded", "round": 80, "session_id": "019d14b3-7a66-7a10-a3d2-e744f4a315a4", "tier": "proxy", "run_name": "round0080_proxy_1774169657", "family_name": "residual_vq_topk", "family_stage": "prototype", "status": "crash", "decision": "crash", "payload": {"tier": "proxy", "run_name": "round0080_proxy_1774169657", "family_name": "residual_vq_topk", "family_stage": "prototype", "status": "crash", "decision": "crash", "val_fvu": "None", "observed_fvu": "", "k": "None", "log_path": "/root/sparsify-ascend/research/history/logs/proxy_1774169687.log", "checkpoint": null}}
{"event_id": "evt_1774169687281445377", "ts": 1774169687, "event": "repair_attempt_started", "round": 80, "session_id": "019d14b3-7a66-7a10-a3d2-e744f4a315a4", "tier": "proxy", "run_name": null, "family_name": "residual_vq_topk", "family_stage": "prototype", "status": null, "decision": null, "payload": {"tier": "proxy", "family_name": "residual_vq_topk", "family_stage": "prototype", "repair_attempt": 1, "failure_kind": "training_crash", "error_type": "ValueError", "error_summary": "ValueError: Unknown architecture: 'residual_vq_topk'. Must be one of ('topk', 'batch_topk', 'adaptive_budget_topk', 'bucketed_topk', 'codebook_topk', 'jumprelu', 'gated', 'routed', 'group_topk', 'factorized_topk', 'lowrank_residual', 'lowrank_gated_residual', 'lowrank_grouped_residual', 'whitened_topk', 'two_stage_residual', 'multi_branch_gated')"}}
{"event_id": "evt_1774169838192300596", "ts": 1774169838, "event": "repair_loop_blocked", "round": 80, "session_id": "019d14b3-7a66-7a10-a3d2-e744f4a315a4", "tier": null, "run_name": null, "family_name": "residual_vq_topk", "family_stage": "prototype", "status": null, "decision": null, "payload": {"repair_attempt": 1, "failure_kind": "post_repair_validation", "reason": "no_code_changes"}}
{"event_id": "evt_1774169838192367228", "ts": 1774169838, "event": "round_finished", "round": 80, "session_id": "019d14b3-7a66-7a10-a3d2-e744f4a315a4", "tier": "proxy", "run_name": null, "family_name": "residual_vq_topk", "family_stage": "prototype", "status": "crash", "decision": "crash", "payload": {"tier": "proxy", "family_name": "residual_vq_topk", "family_stage": "prototype", "status": "crash", "decision": "crash", "val_fvu": null}}
{"event_id": "evt_1774169845723034799", "ts": 1774169845, "event": "round_started", "round": 81, "session_id": "019d14b3-7a66-7a10-a3d2-e744f4a315a4", "tier": null, "run_name": null, "family_name": null, "family_stage": null, "status": "started", "decision": null, "payload": {"status": "started"}}
{"event_id": "evt_1774169845723195796", "ts": 1774169845, "event": "agent_deciding", "round": 81, "session_id": "019d14b3-7a66-7a10-a3d2-e744f4a315a4", "tier": null, "run_name": null, "family_name": null, "family_stage": null, "status": null, "decision": null, "payload": {}}
{"event_id": "evt_1774169971293193336", "ts": 1774169971, "event": "session_resumed", "round": 81, "tier": null, "run_name": null, "family_name": null, "family_stage": null, "status": "active", "decision": null, "payload": {"session_id": "019d14b3-7a66-7a10-a3d2-e744f4a315a4"}}
{"event_id": "evt_1774169971294472222", "ts": 1774169971, "event": "agent_action_received", "round": 81, "session_id": "019d14b3-7a66-7a10-a3d2-e744f4a315a4", "tier": "proxy", "run_name": null, "family_name": "residual_vq_topk", "family_stage": "prototype", "status": null, "decision": null, "payload": {"session_id": "019d14b3-7a66-7a10-a3d2-e744f4a315a4", "tier": "proxy", "family_name": "residual_vq_topk", "family_stage": "prototype", "change_type": "edit_sae_code", "expected_win": "smaller_k", "hypothesis": "`residual_vq_topk` still has not produced a real low-K signal because the prototype failed at the implementation layer before training, so the next move is one more narrow code-fix pass to make the existing `K=32`, `EF=12`, `signum`, `lr=1.6e-3`, `auxk_alpha=0` experiment runnable without changing its design."}}
{"event_id": "evt_1774170101415363294", "ts": 1774170101, "event": "variable_isolation_warning", "round": 81, "session_id": "019d14b3-7a66-7a10-a3d2-e744f4a315a4", "tier": null, "run_name": null, "family_name": "residual_vq_topk", "family_stage": "prototype", "status": null, "decision": null, "payload": {"violation": "Multiple primary variables changed simultaneously: code_edit, architecture, k, lr"}}
{"event_id": "evt_1774170101415499060", "ts": 1774170101, "event": "proxy_mode_selected", "round": 81, "session_id": "019d14b3-7a66-7a10-a3d2-e744f4a315a4", "tier": "proxy", "run_name": null, "family_name": "residual_vq_topk", "family_stage": "prototype", "status": null, "decision": null, "payload": {"tier": "proxy", "proxy_mode": "fast", "evaluation_basis": "terminal_only", "parameter_behavior": "structural", "proxy_max_tokens": "40000000"}}
{"event_id": "evt_1774170101415545002", "ts": 1774170101, "event": "sanity_started", "round": 81, "session_id": "019d14b3-7a66-7a10-a3d2-e744f4a315a4", "tier": "proxy", "run_name": null, "family_name": "residual_vq_topk", "family_stage": "prototype", "status": null, "decision": null, "payload": {"tier": "proxy"}}
{"event_id": "evt_1774170106066352331", "ts": 1774170106, "event": "sanity_finished", "round": 81, "session_id": "019d14b3-7a66-7a10-a3d2-e744f4a315a4", "tier": "proxy", "run_name": null, "family_name": "residual_vq_topk", "family_stage": "prototype", "status": "ok", "decision": null, "payload": {"tier": "proxy", "status": "ok"}}
{"event_id": "evt_1774170106066756917", "ts": 1774170106, "event": "training_started", "round": 81, "session_id": "019d14b3-7a66-7a10-a3d2-e744f4a315a4", "tier": "proxy", "run_name": "round0081_proxy_1774170106", "family_name": "residual_vq_topk", "family_stage": "prototype", "status": null, "decision": null, "payload": {"tier": "proxy", "run_name": "round0081_proxy_1774170106", "family_name": "residual_vq_topk", "family_stage": "prototype", "checkpoint_dir": "/root/sparsify-ascend/checkpoints/research_agent/round_0081_proxy", "log_path": "/root/sparsify-ascend/research/history/logs/round0081_proxy_1774170106.log", "config": {"architecture": "residual_vq_topk", "expansion_factor": 12, "k": 32, "optimizer": "signum", "lr": "1.6e-3", "hookpoints": "layers.[3].self_attn.o_proj", "batch_size": 1, "grad_acc_steps": 8, "micro_acc_steps": 1, "auxk_alpha": 0.0, "dead_feature_threshold": 10000000, "use_hadamard": false, "tier": "proxy", "family_name": "residual_vq_topk", "family_stage": "prototype"}, "baseline_tokens_per_sec": null, "proxy_mode": "fast", "evaluation_basis": "terminal_only"}}
{"event_id": "evt_1774170136068495467", "ts": 1774170136, "event": "training_heartbeat", "round": 81, "session_id": "019d14b3-7a66-7a10-a3d2-e744f4a315a4", "tier": "proxy", "run_name": "round0081_proxy_1774170106", "family_name": "residual_vq_topk", "family_stage": "prototype", "status": null, "decision": null, "payload": {"tier": "proxy", "run_name": "round0081_proxy_1774170106", "family_name": "residual_vq_topk", "family_stage": "prototype", "checkpoint_dir": null, "metrics_path": null, "latest_step": null, "latest_tokens_per_sec": null, "baseline_ratio": null, "latest_total_tokens": null, "proxy_mode": "fast", "evaluation_basis": "terminal_only"}}
{"event_id": "evt_1774170136133873346", "ts": 1774170136, "event": "training_finished", "round": 81, "session_id": "019d14b3-7a66-7a10-a3d2-e744f4a315a4", "tier": "proxy", "run_name": "round0081_proxy_1774170106", "family_name": "residual_vq_topk", "family_stage": "prototype", "status": "crash", "decision": "crash", "payload": {"tier": "proxy", "run_name": "round0081_proxy_1774170106", "family_name": "residual_vq_topk", "family_stage": "prototype", "checkpoint_dir": null, "metrics_path": "", "run_health": "crash", "termination_reason": "completed", "tokens_per_sec": null, "baseline_ratio": null, "status": "crash", "decision": "crash", "proxy_mode": "fast", "evaluation_basis": "terminal_only", "curve_start_fvu": null, "curve_mid_fvu": null, "curve_end_fvu": null, "curve_late_slope": null, "curve_still_improving": null}}
{"event_id": "evt_1774170136133917456", "ts": 1774170136, "event": "result_recorded", "round": 81, "session_id": "019d14b3-7a66-7a10-a3d2-e744f4a315a4", "tier": "proxy", "run_name": "round0081_proxy_1774170106", "family_name": "residual_vq_topk", "family_stage": "prototype", "status": "crash", "decision": "crash", "payload": {"tier": "proxy", "run_name": "round0081_proxy_1774170106", "family_name": "residual_vq_topk", "family_stage": "prototype", "status": "crash", "decision": "crash", "val_fvu": "None", "observed_fvu": "", "k": "None", "log_path": "/root/sparsify-ascend/research/history/logs/proxy_1774170136.log", "checkpoint": null}}
{"event_id": "evt_1774170136133986774", "ts": 1774170136, "event": "repair_attempt_started", "round": 81, "session_id": "019d14b3-7a66-7a10-a3d2-e744f4a315a4", "tier": "proxy", "run_name": null, "family_name": "residual_vq_topk", "family_stage": "prototype", "status": null, "decision": null, "payload": {"tier": "proxy", "family_name": "residual_vq_topk", "family_stage": "prototype", "repair_attempt": 1, "failure_kind": "training_crash", "error_type": "ValueError", "error_summary": "ValueError: Unknown architecture: 'residual_vq_topk'. Must be one of ('topk', 'batch_topk', 'adaptive_budget_topk', 'bucketed_topk', 'codebook_topk', 'jumprelu', 'gated', 'routed', 'group_topk', 'factorized_topk', 'lowrank_residual', 'lowrank_gated_residual', 'lowrank_grouped_residual', 'whitened_topk', 'two_stage_residual', 'multi_branch_gated')"}}
{"event_id": "evt_1774170287051944286", "ts": 1774170287, "event": "repair_loop_blocked", "round": 81, "session_id": "019d14b3-7a66-7a10-a3d2-e744f4a315a4", "tier": null, "run_name": null, "family_name": "residual_vq_topk", "family_stage": "prototype", "status": null, "decision": null, "payload": {"repair_attempt": 1, "failure_kind": "post_repair_validation", "reason": "no_code_changes"}}
{"event_id": "evt_1774170287052005491", "ts": 1774170287, "event": "round_finished", "round": 81, "session_id": "019d14b3-7a66-7a10-a3d2-e744f4a315a4", "tier": "proxy", "run_name": null, "family_name": "residual_vq_topk", "family_stage": "prototype", "status": "crash", "decision": "crash", "payload": {"tier": "proxy", "family_name": "residual_vq_topk", "family_stage": "prototype", "status": "crash", "decision": "crash", "val_fvu": null}}
{"event_id": "evt_1774170294621773735", "ts": 1774170294, "event": "round_started", "round": 82, "session_id": "019d14b3-7a66-7a10-a3d2-e744f4a315a4", "tier": null, "run_name": null, "family_name": null, "family_stage": null, "status": "started", "decision": null, "payload": {"status": "started"}}
{"event_id": "evt_1774170294621863666", "ts": 1774170294, "event": "agent_deciding", "round": 82, "session_id": "019d14b3-7a66-7a10-a3d2-e744f4a315a4", "tier": null, "run_name": null, "family_name": null, "family_stage": null, "status": null, "decision": null, "payload": {}}
{"event_id": "evt_1774170423643842319", "ts": 1774170423, "event": "session_resumed", "round": 82, "tier": null, "run_name": null, "family_name": null, "family_stage": null, "status": "active", "decision": null, "payload": {"session_id": "019d14b3-7a66-7a10-a3d2-e744f4a315a4"}}
{"event_id": "evt_1774170423645485872", "ts": 1774170423, "event": "agent_action_received", "round": 82, "session_id": "019d14b3-7a66-7a10-a3d2-e744f4a315a4", "tier": "proxy", "run_name": null, "family_name": "lowrank_gated_residual", "family_stage": "mainline_comparison", "status": null, "decision": null, "payload": {"session_id": "019d14b3-7a66-7a10-a3d2-e744f4a315a4", "tier": "proxy", "family_name": "lowrank_gated_residual", "family_stage": "mainline_comparison", "change_type": "param_only", "expected_win": "smaller_k", "hypothesis": "Crash recovery mode rules out further code changes, so the next stability-first move is to return to the strongest working family and make one conservative parameter-only adjustment that still respects the low-K priority: run `lowrank_gated_residual` at `K=32`, `EF=12` with the stable `signum`/`lr=1.6e-3`/`auxk_alpha=0` recipe to get a clean low-K signal in the preferred EF band."}}
{"event_id": "evt_1774170423645627545", "ts": 1774170423, "event": "proxy_mode_selected", "round": 82, "session_id": "019d14b3-7a66-7a10-a3d2-e744f4a315a4", "tier": "proxy", "run_name": null, "family_name": "lowrank_gated_residual", "family_stage": "mainline_comparison", "status": null, "decision": null, "payload": {"tier": "proxy", "proxy_mode": "fast", "evaluation_basis": "terminal_only", "parameter_behavior": "structural", "proxy_max_tokens": "5000000"}}
