{"event_id": "evt_1774163159056977166", "ts": 1774163159, "event": "result_recorded", "round": 54, "session_id": "019d1451-d554-79b2-8cc5-c99f2ae19f85", "tier": "proxy", "run_name": "round0054_proxy_1774163038", "family_name": "adaptive_budget_topk", "family_stage": "mainline_comparison", "status": "ok", "decision": "incubate", "payload": {"tier": "proxy", "run_name": "round0054_proxy_1774163038", "family_name": "adaptive_budget_topk", "family_stage": "mainline_comparison", "status": "ok", "decision": "incubate", "val_fvu": "0.42443543300032616", "observed_fvu": "0.423201", "k": "40", "log_path": "/root/sparsify-ascend/research/history/logs/proxy_1774163158.log", "checkpoint": null}}
{"event_id": "evt_1774163159057127821", "ts": 1774163159, "event": "round_finished", "round": 54, "session_id": "019d1451-d554-79b2-8cc5-c99f2ae19f85", "tier": "proxy", "run_name": null, "family_name": "adaptive_budget_topk", "family_stage": "mainline_comparison", "status": "ok", "decision": "incubate", "payload": {"tier": "proxy", "family_name": "adaptive_budget_topk", "family_stage": "mainline_comparison", "status": "ok", "decision": "incubate", "val_fvu": "0.42443543300032616"}}
{"event_id": "evt_1774163159221687122", "ts": 1774163159, "event": "experiment_commit_prepared", "round": 54, "tier": "proxy", "run_name": null, "family_name": "adaptive_budget_topk", "family_stage": "mainline_comparison", "status": "ok", "decision": "incubate", "payload": {"branch": "autoresearch-sae"}}
{"event_id": "evt_1774163166942432212", "ts": 1774163166, "event": "round_started", "round": 55, "session_id": "019d1451-d554-79b2-8cc5-c99f2ae19f85", "tier": null, "run_name": null, "family_name": null, "family_stage": null, "status": "started", "decision": null, "payload": {"status": "started"}}
{"event_id": "evt_1774163166942596290", "ts": 1774163166, "event": "agent_deciding", "round": 55, "session_id": "019d1451-d554-79b2-8cc5-c99f2ae19f85", "tier": null, "run_name": null, "family_name": null, "family_stage": null, "status": null, "decision": null, "payload": {}}
{"event_id": "evt_1774163289346611744", "ts": 1774163289, "event": "session_resumed", "round": 55, "tier": null, "run_name": null, "family_name": null, "family_stage": null, "status": "active", "decision": null, "payload": {"session_id": "019d1451-d554-79b2-8cc5-c99f2ae19f85"}}
{"event_id": "evt_1774163289347944427", "ts": 1774163289, "event": "agent_action_received", "round": 55, "session_id": "019d1451-d554-79b2-8cc5-c99f2ae19f85", "tier": "proxy", "run_name": null, "family_name": "bucketed_topk", "family_stage": "mainline_comparison", "status": null, "decision": null, "payload": {"session_id": "019d1451-d554-79b2-8cc5-c99f2ae19f85", "tier": "proxy", "family_name": "bucketed_topk", "family_stage": "mainline_comparison", "change_type": "param_only", "expected_win": "lower_fvu", "hypothesis": "The current lower-K small-EF regime appears to fail not only for residual and budget-allocation variants but also for batch-global selection, so the next informative move is to test conditional specialization rather than another global sparse mechanism. `bucketed_topk` may recover quality at `K=40`, `EF=8` by routing examples into simpler norm-conditioned subdictionaries before TopK selection."}}
{"event_id": "evt_1774163289348058507", "ts": 1774163289, "event": "variable_isolation_warning", "round": 55, "session_id": "019d1451-d554-79b2-8cc5-c99f2ae19f85", "tier": null, "run_name": null, "family_name": "bucketed_topk", "family_stage": "mainline_comparison", "status": null, "decision": null, "payload": {"violation": "Multiple primary variables changed simultaneously: architecture, k, lr"}}
{"event_id": "evt_1774163289348115376", "ts": 1774163289, "event": "proxy_mode_selected", "round": 55, "session_id": "019d1451-d554-79b2-8cc5-c99f2ae19f85", "tier": "proxy", "run_name": null, "family_name": "bucketed_topk", "family_stage": "mainline_comparison", "status": null, "decision": null, "payload": {"tier": "proxy", "proxy_mode": "fast", "evaluation_basis": "terminal_only", "parameter_behavior": "structural", "proxy_max_tokens": "5000000"}}
{"event_id": "evt_1774163289348381437", "ts": 1774163289, "event": "training_started", "round": 55, "session_id": "019d1451-d554-79b2-8cc5-c99f2ae19f85", "tier": "proxy", "run_name": "round0055_proxy_1774163289", "family_name": "bucketed_topk", "family_stage": "mainline_comparison", "status": null, "decision": null, "payload": {"tier": "proxy", "run_name": "round0055_proxy_1774163289", "family_name": "bucketed_topk", "family_stage": "mainline_comparison", "checkpoint_dir": "/root/sparsify-ascend/checkpoints/research_agent/round_0055_proxy", "log_path": "/root/sparsify-ascend/research/history/logs/round0055_proxy_1774163289.log", "config": {"architecture": "bucketed_topk", "expansion_factor": 8, "k": 40, "optimizer": "signum", "lr": "1.6e-3", "hookpoints": "layers.[3].self_attn.o_proj", "batch_size": 1, "grad_acc_steps": 8, "micro_acc_steps": 1, "auxk_alpha": 0.0, "dead_feature_threshold": 10000000, "use_hadamard": false, "tier": "proxy", "family_name": "bucketed_topk", "family_stage": "mainline_comparison"}, "baseline_tokens_per_sec": 60522.66487510176, "proxy_mode": "fast", "evaluation_basis": "terminal_only"}}
{"event_id": "evt_1774163319350530572", "ts": 1774163319, "event": "training_heartbeat", "round": 55, "session_id": "019d1451-d554-79b2-8cc5-c99f2ae19f85", "tier": "proxy", "run_name": "round0055_proxy_1774163289", "family_name": "bucketed_topk", "family_stage": "mainline_comparison", "status": null, "decision": null, "payload": {"tier": "proxy", "run_name": "round0055_proxy_1774163289", "family_name": "bucketed_topk", "family_stage": "mainline_comparison", "checkpoint_dir": "/root/sparsify-ascend/checkpoints/research_agent/round_0055_proxy/round0055_proxy_1774163289_dp2_bs1_ga8_ef8_k40_20260322_150815", "metrics_path": "/root/sparsify-ascend/checkpoints/research_agent/round_0055_proxy/round0055_proxy_1774163289_dp2_bs1_ga8_ef8_k40_20260322_150815/metrics.jsonl", "latest_step": 120, "latest_tokens_per_sec": 131063.96090976158, "baseline_ratio": 2.1655351954550106, "latest_total_tokens": 3932160.0, "proxy_mode": "fast", "evaluation_basis": "terminal_only"}}
{"event_id": "evt_1774163349434760173", "ts": 1774163349, "event": "training_heartbeat", "round": 55, "session_id": "019d1451-d554-79b2-8cc5-c99f2ae19f85", "tier": "proxy", "run_name": "round0055_proxy_1774163289", "family_name": "bucketed_topk", "family_stage": "mainline_comparison", "status": null, "decision": null, "payload": {"tier": "proxy", "run_name": "round0055_proxy_1774163289", "family_name": "bucketed_topk", "family_stage": "mainline_comparison", "checkpoint_dir": "/root/sparsify-ascend/checkpoints/research_agent/round_0055_proxy/round0055_proxy_1774163289_dp2_bs1_ga8_ef8_k40_20260322_150815", "metrics_path": "/root/sparsify-ascend/checkpoints/research_agent/round_0055_proxy/round0055_proxy_1774163289_dp2_bs1_ga8_ef8_k40_20260322_150815/metrics.jsonl", "latest_step": 152, "latest_tokens_per_sec": 83007.71318381428, "baseline_ratio": 1.371514512044604, "latest_total_tokens": 4980736.0, "proxy_mode": "fast", "evaluation_basis": "terminal_only"}}
{"event_id": "evt_1774163350575662746", "ts": 1774163350, "event": "training_finished", "round": 55, "session_id": "019d1451-d554-79b2-8cc5-c99f2ae19f85", "tier": "proxy", "run_name": "round0055_proxy_1774163289", "family_name": "bucketed_topk", "family_stage": "mainline_comparison", "status": "ok", "decision": "incubate", "payload": {"tier": "proxy", "run_name": "round0055_proxy_1774163289", "family_name": "bucketed_topk", "family_stage": "mainline_comparison", "checkpoint_dir": "/root/sparsify-ascend/checkpoints/research_agent/round_0055_proxy/round0055_proxy_1774163289_dp2_bs1_ga8_ef8_k40_20260322_150815", "metrics_path": "/root/sparsify-ascend/checkpoints/research_agent/round_0055_proxy/round0055_proxy_1774163289_dp2_bs1_ga8_ef8_k40_20260322_150815/metrics.jsonl", "run_health": "normal", "termination_reason": "completed", "tokens_per_sec": 83007.71318381428, "baseline_ratio": 1.371514512044604, "status": "ok", "decision": "incubate", "proxy_mode": "fast", "evaluation_basis": "terminal_only", "curve_start_fvu": 0.5366230010986328, "curve_mid_fvu": 0.4141395092010498, "curve_end_fvu": 0.363731324672699, "curve_late_slope": -6.8840240747968275e-09, "curve_still_improving": true}}
{"event_id": "evt_1774163350575778323", "ts": 1774163350, "event": "result_recorded", "round": 55, "session_id": "019d1451-d554-79b2-8cc5-c99f2ae19f85", "tier": "proxy", "run_name": "round0055_proxy_1774163289", "family_name": "bucketed_topk", "family_stage": "mainline_comparison", "status": "ok", "decision": "incubate", "payload": {"tier": "proxy", "run_name": "round0055_proxy_1774163289", "family_name": "bucketed_topk", "family_stage": "mainline_comparison", "status": "ok", "decision": "incubate", "val_fvu": "0.36289801076054573", "observed_fvu": "0.363731", "k": "40", "log_path": "/root/sparsify-ascend/research/history/logs/proxy_1774163350.log", "checkpoint": null}}
{"event_id": "evt_1774163350575935657", "ts": 1774163350, "event": "round_finished", "round": 55, "session_id": "019d1451-d554-79b2-8cc5-c99f2ae19f85", "tier": "proxy", "run_name": null, "family_name": "bucketed_topk", "family_stage": "mainline_comparison", "status": "ok", "decision": "incubate", "payload": {"tier": "proxy", "family_name": "bucketed_topk", "family_stage": "mainline_comparison", "status": "ok", "decision": "incubate", "val_fvu": "0.36289801076054573"}}
{"event_id": "evt_1774163351036115936", "ts": 1774163351, "event": "experiment_commit_prepared", "round": 55, "tier": "proxy", "run_name": null, "family_name": "bucketed_topk", "family_stage": "mainline_comparison", "status": "ok", "decision": "incubate", "payload": {"branch": "autoresearch-sae"}}
{"event_id": "evt_1774163359354848095", "ts": 1774163359, "event": "round_started", "round": 56, "session_id": "019d1451-d554-79b2-8cc5-c99f2ae19f85", "tier": null, "run_name": null, "family_name": null, "family_stage": null, "status": "started", "decision": null, "payload": {"status": "started"}}
{"event_id": "evt_1774163359354999249", "ts": 1774163359, "event": "agent_deciding", "round": 56, "session_id": "019d1451-d554-79b2-8cc5-c99f2ae19f85", "tier": null, "run_name": null, "family_name": null, "family_stage": null, "status": null, "decision": null, "payload": {}}
{"event_id": "evt_1774163482375262743", "ts": 1774163482, "event": "session_resumed", "round": 56, "tier": null, "run_name": null, "family_name": null, "family_stage": null, "status": "active", "decision": null, "payload": {"session_id": "019d1451-d554-79b2-8cc5-c99f2ae19f85"}}
{"event_id": "evt_1774163482377289354", "ts": 1774163482, "event": "agent_action_received", "round": 56, "session_id": "019d1451-d554-79b2-8cc5-c99f2ae19f85", "tier": "proxy", "run_name": null, "family_name": "jumprelu", "family_stage": "mainline_comparison", "status": null, "decision": null, "payload": {"session_id": "019d1451-d554-79b2-8cc5-c99f2ae19f85", "tier": "proxy", "family_name": "jumprelu", "family_stage": "mainline_comparison", "change_type": "param_only", "expected_win": "lower_fvu", "hypothesis": "The repeated failure of low-rank residual, batch-global, adaptive-budget, and bucketed routing at `K=40`, `EF=8` suggests the current small-EF lower-K bottleneck may be the hard TopK support mechanism itself rather than routing structure. `jumprelu` is the next fundamentally different same-EF comparison because it changes the sparse activation rule without requiring code edits this round."}}
{"event_id": "evt_1774163482377409246", "ts": 1774163482, "event": "variable_isolation_warning", "round": 56, "session_id": "019d1451-d554-79b2-8cc5-c99f2ae19f85", "tier": null, "run_name": null, "family_name": "jumprelu", "family_stage": "mainline_comparison", "status": null, "decision": null, "payload": {"violation": "Multiple primary variables changed simultaneously: architecture, k, lr"}}
{"event_id": "evt_1774163482377470552", "ts": 1774163482, "event": "proxy_mode_selected", "round": 56, "session_id": "019d1451-d554-79b2-8cc5-c99f2ae19f85", "tier": "proxy", "run_name": null, "family_name": "jumprelu", "family_stage": "mainline_comparison", "status": null, "decision": null, "payload": {"tier": "proxy", "proxy_mode": "fast", "evaluation_basis": "terminal_only", "parameter_behavior": "structural", "proxy_max_tokens": "5000000"}}
{"event_id": "evt_1774163482377740963", "ts": 1774163482, "event": "training_started", "round": 56, "session_id": "019d1451-d554-79b2-8cc5-c99f2ae19f85", "tier": "proxy", "run_name": "round0056_proxy_1774163482", "family_name": "jumprelu", "family_stage": "mainline_comparison", "status": null, "decision": null, "payload": {"tier": "proxy", "run_name": "round0056_proxy_1774163482", "family_name": "jumprelu", "family_stage": "mainline_comparison", "checkpoint_dir": "/root/sparsify-ascend/checkpoints/research_agent/round_0056_proxy", "log_path": "/root/sparsify-ascend/research/history/logs/round0056_proxy_1774163482.log", "config": {"architecture": "jumprelu", "expansion_factor": 8, "k": 40, "optimizer": "signum", "lr": "1.6e-3", "hookpoints": "layers.[3].self_attn.o_proj", "batch_size": 1, "grad_acc_steps": 8, "micro_acc_steps": 1, "auxk_alpha": 0.0, "dead_feature_threshold": 10000000, "use_hadamard": false, "tier": "proxy", "family_name": "jumprelu", "family_stage": "mainline_comparison"}, "baseline_tokens_per_sec": 83008.65550432022, "proxy_mode": "fast", "evaluation_basis": "terminal_only"}}
{"event_id": "evt_1774163512383284128", "ts": 1774163512, "event": "training_heartbeat", "round": 56, "session_id": "019d1451-d554-79b2-8cc5-c99f2ae19f85", "tier": "proxy", "run_name": "round0056_proxy_1774163482", "family_name": "jumprelu", "family_stage": "mainline_comparison", "status": null, "decision": null, "payload": {"tier": "proxy", "run_name": "round0056_proxy_1774163482", "family_name": "jumprelu", "family_stage": "mainline_comparison", "checkpoint_dir": "/root/sparsify-ascend/checkpoints/research_agent/round_0056_proxy/round0056_proxy_1774163482_dp2_bs1_ga8_ef8_k40_20260322_151128", "metrics_path": "/root/sparsify-ascend/checkpoints/research_agent/round_0056_proxy/round0056_proxy_1774163482_dp2_bs1_ga8_ef8_k40_20260322_151128/metrics.jsonl", "latest_step": 140, "latest_tokens_per_sec": 152891.95646897273, "baseline_ratio": 1.8418796876069796, "latest_total_tokens": 4587520.0, "proxy_mode": "fast", "evaluation_basis": "terminal_only"}}
{"event_id": "evt_1774163542385788305", "ts": 1774163542, "event": "training_heartbeat", "round": 56, "session_id": "019d1451-d554-79b2-8cc5-c99f2ae19f85", "tier": "proxy", "run_name": "round0056_proxy_1774163482", "family_name": "jumprelu", "family_stage": "mainline_comparison", "status": null, "decision": null, "payload": {"tier": "proxy", "run_name": "round0056_proxy_1774163482", "family_name": "jumprelu", "family_stage": "mainline_comparison", "checkpoint_dir": "/root/sparsify-ascend/checkpoints/research_agent/round_0056_proxy/round0056_proxy_1774163482_dp2_bs1_ga8_ef8_k40_20260322_151128", "metrics_path": "/root/sparsify-ascend/checkpoints/research_agent/round_0056_proxy/round0056_proxy_1774163482_dp2_bs1_ga8_ef8_k40_20260322_151128/metrics.jsonl", "latest_step": 152, "latest_tokens_per_sec": 83003.02465752789, "baseline_ratio": 0.9999321655463743, "latest_total_tokens": 4980736.0, "proxy_mode": "fast", "evaluation_basis": "terminal_only"}}
{"event_id": "evt_1774163542554539838", "ts": 1774163542, "event": "training_finished", "round": 56, "session_id": "019d1451-d554-79b2-8cc5-c99f2ae19f85", "tier": "proxy", "run_name": "round0056_proxy_1774163482", "family_name": "jumprelu", "family_stage": "mainline_comparison", "status": "ok", "decision": "incubate", "payload": {"tier": "proxy", "run_name": "round0056_proxy_1774163482", "family_name": "jumprelu", "family_stage": "mainline_comparison", "checkpoint_dir": "/root/sparsify-ascend/checkpoints/research_agent/round_0056_proxy/round0056_proxy_1774163482_dp2_bs1_ga8_ef8_k40_20260322_151128", "metrics_path": "/root/sparsify-ascend/checkpoints/research_agent/round_0056_proxy/round0056_proxy_1774163482_dp2_bs1_ga8_ef8_k40_20260322_151128/metrics.jsonl", "run_health": "normal", "termination_reason": "completed", "tokens_per_sec": 83003.02465752789, "baseline_ratio": 0.9999321655463743, "status": "ok", "decision": "incubate", "proxy_mode": "fast", "evaluation_basis": "terminal_only", "curve_start_fvu": 0.5215673446655273, "curve_mid_fvu": 0.4083801209926605, "curve_end_fvu": 0.363009512424469, "curve_late_slope": -5.869204018850841e-09, "curve_still_improving": true}}
{"event_id": "evt_1774163542554607044", "ts": 1774163542, "event": "result_recorded", "round": 56, "session_id": "019d1451-d554-79b2-8cc5-c99f2ae19f85", "tier": "proxy", "run_name": "round0056_proxy_1774163482", "family_name": "jumprelu", "family_stage": "mainline_comparison", "status": "ok", "decision": "incubate", "payload": {"tier": "proxy", "run_name": "round0056_proxy_1774163482", "family_name": "jumprelu", "family_stage": "mainline_comparison", "status": "ok", "decision": "incubate", "val_fvu": "0.36313553526997566", "observed_fvu": "0.363010", "k": "40", "log_path": "/root/sparsify-ascend/research/history/logs/proxy_1774163542.log", "checkpoint": null}}
{"event_id": "evt_1774163542554752343", "ts": 1774163542, "event": "round_finished", "round": 56, "session_id": "019d1451-d554-79b2-8cc5-c99f2ae19f85", "tier": "proxy", "run_name": null, "family_name": "jumprelu", "family_stage": "mainline_comparison", "status": "ok", "decision": "incubate", "payload": {"tier": "proxy", "family_name": "jumprelu", "family_stage": "mainline_comparison", "status": "ok", "decision": "incubate", "val_fvu": "0.36313553526997566"}}
{"event_id": "evt_1774163542605576904", "ts": 1774163542, "event": "experiment_commit_prepared", "round": 56, "tier": "proxy", "run_name": null, "family_name": "jumprelu", "family_stage": "mainline_comparison", "status": "ok", "decision": "incubate", "payload": {"branch": "autoresearch-sae"}}
{"event_id": "evt_1774163550385105278", "ts": 1774163550, "event": "round_started", "round": 57, "session_id": "019d1451-d554-79b2-8cc5-c99f2ae19f85", "tier": null, "run_name": null, "family_name": null, "family_stage": null, "status": "started", "decision": null, "payload": {"status": "started"}}
{"event_id": "evt_1774163550385268574", "ts": 1774163550, "event": "agent_deciding", "round": 57, "session_id": "019d1451-d554-79b2-8cc5-c99f2ae19f85", "tier": null, "run_name": null, "family_name": null, "family_stage": null, "status": null, "decision": null, "payload": {}}
{"event_id": "evt_1774163674728429493", "ts": 1774163674, "event": "session_resumed", "round": 57, "tier": null, "run_name": null, "family_name": null, "family_stage": null, "status": "active", "decision": null, "payload": {"session_id": "019d1451-d554-79b2-8cc5-c99f2ae19f85"}}
{"event_id": "evt_1774163674735277988", "ts": 1774163674, "event": "agent_action_received", "round": 57, "session_id": "019d1451-d554-79b2-8cc5-c99f2ae19f85", "tier": "proxy", "run_name": null, "family_name": "codebook_topk", "family_stage": "mainline_comparison", "status": null, "decision": null, "payload": {"session_id": "019d1451-d554-79b2-8cc5-c99f2ae19f85", "tier": "proxy", "family_name": "codebook_topk", "family_stage": "mainline_comparison", "change_type": "param_only", "expected_win": "lower_fvu", "hypothesis": "The `K=40`, `EF=8` search cluster now looks broadly exhausted across low-rank residual, batch/global allocation, adaptive-budget routing, bucketed routing, and JumpReLU, so the next informative move is to test a qualitatively different representation family rather than another sparse-support variant. `codebook_topk` is the strongest remaining same-EF architecture probe because it changes the problem from pure sparse combination to coarse prototype retrieval plus sparse residual correction."}}
{"event_id": "evt_1774163674735393111", "ts": 1774163674, "event": "variable_isolation_warning", "round": 57, "session_id": "019d1451-d554-79b2-8cc5-c99f2ae19f85", "tier": null, "run_name": null, "family_name": "codebook_topk", "family_stage": "mainline_comparison", "status": null, "decision": null, "payload": {"violation": "Multiple primary variables changed simultaneously: architecture, k, lr"}}
{"event_id": "evt_1774163674735455152", "ts": 1774163674, "event": "proxy_mode_selected", "round": 57, "session_id": "019d1451-d554-79b2-8cc5-c99f2ae19f85", "tier": "proxy", "run_name": null, "family_name": "codebook_topk", "family_stage": "mainline_comparison", "status": null, "decision": null, "payload": {"tier": "proxy", "proxy_mode": "fast", "evaluation_basis": "terminal_only", "parameter_behavior": "structural", "proxy_max_tokens": "5000000"}}
{"event_id": "evt_1774163674735709556", "ts": 1774163674, "event": "training_started", "round": 57, "session_id": "019d1451-d554-79b2-8cc5-c99f2ae19f85", "tier": "proxy", "run_name": "round0057_proxy_1774163674", "family_name": "codebook_topk", "family_stage": "mainline_comparison", "status": null, "decision": null, "payload": {"tier": "proxy", "run_name": "round0057_proxy_1774163674", "family_name": "codebook_topk", "family_stage": "mainline_comparison", "checkpoint_dir": "/root/sparsify-ascend/checkpoints/research_agent/round_0057_proxy", "log_path": "/root/sparsify-ascend/research/history/logs/round0057_proxy_1774163674.log", "config": {"architecture": "codebook_topk", "expansion_factor": 8, "k": 40, "optimizer": "signum", "lr": "1.6e-3", "hookpoints": "layers.[3].self_attn.o_proj", "batch_size": 1, "grad_acc_steps": 8, "micro_acc_steps": 1, "auxk_alpha": 0.0, "dead_feature_threshold": 10000000, "use_hadamard": false, "tier": "proxy", "family_name": "codebook_topk", "family_stage": "mainline_comparison"}, "baseline_tokens_per_sec": null, "proxy_mode": "fast", "evaluation_basis": "terminal_only"}}
